header,contents,date
연천으로 떠나는 역사여행 ①,현재 경기도에는 1139개의 문화유산이 31개 시·군에 산재돼 있다. 문화유산을 통해 역사여행을 소개한다. <편집자주> 연천군이 매년 개최하는 구석기 축제/연천군제공 북한과 접경지대인 연천은 고인돌과 한탄강이 가장 먼저 떠오르는 곳이다. 한탄이 크고 넓다는 순 우리말인 ‘한’과 넓은 강을...,2020. 8. 27.
"[연천] 분위기있는 실내 + 시원한 야외 + 커피맛까지 완벽, 연천회관(애견동반 가능)","연천 여행 가실 때 포스팅 참고하셔서 방문해보셔도 좋을 것 같아요 '◡' 그럼 바로 소개해드릴게요 고고! 위치 경기 연천군 연천읍 평화로1219번길 42 운영시간 매일 09:00 ~ 20:00 수요일 휴무 **반려동물 이동가방 지참하에 동반가능 연천회관은 동생이 강추해서 갔었는데, 외부에서 봤을 때는...",2021. 7. 4.
"투데이 20200318 (2533) 여행본능,섬 #거제(산달도) #연천 딸기체험농장 #양주 딸기카페...","여행본능, 섬 - 한려해상을 품은 다복한 섬, 산달도 (경남 거제) #이선장해물포차 ★ 경남 거제시 거제면 산달길 339 (산달도) ☆ 경남 거제시 거제면 법동리 98-7 - 01O.2582.4769 2) 오천만의 메뉴 - 비타민 충전! 활력 충전! 제철 봄딸기 #들꽃가람농장 ★ 경기 연천군...",2020. 3. 18.
연천카페 연천회관 연천데이트코스,"연천 카페 / 연천 크로플 맛집 연천 회관 경기 연천군 연천읍 평화로1219번길 42 주차가능 영업시간. 오전 9시 - 오후 20시 수요일 휴무 연천... 그저 바라만 봐도 좋았던 시간, 잘 쉬다 갑니다 - 연천 여행 / 연천 데이트코스로 추천하는 연천카페 연천회관 #연천카페 #연천회관 #연천카페추천...",2021. 7. 5.
"연천 사진 찍기 좋은 곳, 신탄리역","여행을 다니며 다양한 역을 가봤지만, 신탄리역은 정말 사진 찍기 좋은 곳입니다. 신탄리역은 대광리 방면으로 가는 열차와 철원 방면으로 가는... 않아서 조용한 기차역이 된 신탄리역에서 멋진 인생 사진을 찍으시기 바랍니다. 신탄리역 주소: 경기도 연천군 신서면 고대산길 4 -기자단 황익수-",2021. 7. 9.
[헌정회]또 다른 특혜,"핑크당 김성원 의원(경기 동두천시연천군)은 전·현직 국회의원들 중 일정 요건을 갖춘 사람을 국립묘지 안장 대상자에 포함하자는 내용의... 해외여행 - 7,060만원 ▶헌정회 방문 점심식대 - 8,843만원 ▶회의비 - 1억 735만원 ▶회의비 중 식대 - 3,045만원 식대가 너무 많습니다. 그리고 해외여행...",2020. 7. 5.
"양주시 황뱅이(조소앙기념관, 기념공원, 원당저수지, 봉암저수지) 여행","출처 : 경기일보(http://www.kyeonggi.com) 조소앙선생의 본가로 가고 있다. 조소앙선생 본가 조소앙선생기념관으로 가고 있다. 조소앙기념관 앞에서... 은현면 봉암리에서 연천군 전곡으로 가는 도로가 저수지를 끼고 이어져 있고, 서쪽으로 고개를 넘으면 저수면적 14만 2148㎡의 원당저수지가 있다....",2020. 10. 5.
철원여행 숙박부터 무한바베큐 MT장소 추천,"흐르는 경기 포천시 유역 493.24km² 연천군 유역 273.65km² 강원 철원군 유역 398.72km² 등 모두 1165.61km²입니다. 여기에 화적연, 비둘기낭 폭포, 아우라지 베개용암, 재인폭포, 고석정, 철원 용암지대 등 26곳이 지질·문화 명소로 등재되었습니다. 이렇듯 철원 한탄강은 꼭 가봐야할 여행지입니다....",2021. 7. 20.
[한국 여행] 서울 근교 캠핑장 추천,"> > > > > 연천 나린 오토 캠핑장 주소 : 경기 연천군 미산면 어삼로 391-81 전화번호 : ***-****-**** 홈페이지 : 복잡한 도심에서 벗어나 양진강의 아름다운 자연경관을 만끽하고 싶은 분들께 추천드립니다. 여름에는 시원한 강바람을, 겨울에는 눈 덮인 양진강의 운치를 즐길 수 있는 곳입니다....",2020. 10. 28.
연천에 남아 있는 고구려성 당포성,"연천에 남아 있는 고구려성 당포성 경기 연천군 미산면 동이리 788 사적 제 468호(2006년 1월 2일 지정) 면적 35,174㎡ 정의 경기도 연천군 미산면에 있는... 연천 여행을 계획하면서 정보 수집을 하던 중 요즘 핫하다는 곳 당포성과 호로고루성을 알게 되었다. 일단 당포성을 먼저 가보고 이어서...",2021. 8. 14.
Place Lab :: Various (2021. 02. 07 ~ 2021. 02. 19),"Lab 대표 활동 2020 <발명품의 재발견>, 지역문화자원 발굴 및 재생, 연천군 백학면, 경기문화재단 2020 <-ing : In progress> 개인전... 응원전 <힘내라여행>, 서리풀청년갤러리 2019 esquisse, 모하창작스튜디오 2018 제주아트페어+페스티벌, 제주시민회관 2018 어린왕자...",2021. 2. 6.
연천 동막계곡 동막골유원지 다녀왔어요,연천 여행 다시 한번 잡아보려고요 사실 오늘 재인폭포도 가보려고 했는데 갑자기 우르르 쾅쾅 번개가 치는 바람에 놀다가 집으로 바로 귀가를 했어요 경기 연천군 연천읍 동막리에 위치한 동막계곡은 기암괴석과 울창한 숲 수심이 얕은 소가 있어 아이와 동반해서 피서지로 오기 괜찮은 곳이에요...,2021. 8. 10.
"[연천여행 맛집코스] 망향비빔국수 본점, 강철비 비빔국수집! 가성비 굿~",지난 주말에 부부동반으로 1박2일 연천 여행 다녀왔어요 아침을 라면으로 먹으려다가 연천까지 왔는데 근처 맛집에서 맛있는 거 먹으러 가자... 031-835-3575 경기 연천군 청산면 궁평로 5 - 망향비빔국수 본점 - 주변에 아무것도 없이 도로 옆에 덩그러니 있습니다 찾기는 굉장히 쉬우실 거예요...,2020. 7. 9.
지금이 딱! 여름캠핑장 추천! 여름캠핑 준비물부터 주의사항까지!,"주소 : 경기 연천군 전곡읍 선사로 76 예약문의 : 031-833-0031 이용시간 : 체크인 - 14:00 / 체크아웃 - 익일 오전 11:00 여름캠핑장 추천 3)... 중랑캠핑숲장에는 잔디 광장, 청소년문화존, 체험의 숲, 생태학습존 등의 다양한 시설이 갖춰져 가족과 함께 여행하기에 좋은데요, 또한 다목적 운동장이...",2021. 6. 11.
"연천가볼만한곳-호로고루,당포성,재인폭포","호로고루 경기 연천군 장남면 원당리 1258 주차비 ,입장료 무료 옛 고구려 성지를 파랗게 물들여놓은 5월의 청보리 오늘 계획은 호로고루--> 당포성... 아름다운 풍경은 최고의 신비로움과 감동을 준다 #경기도가볼만한곳 #연천가볼만한곳 #당포성 #호로고루 #재인폭포 #국내여행가볼만한곳 #당일여행",2021. 6. 4.
서울 경기권 차박지 1,"*차박여행을 떠나기전알아두자! 최근 캠핑족 급증과 함께 차박이 대세로 떠오르면서 야영 (텐트), 취사,폭죽 놀이, 쓰레기처리 등을 엄격하게... 만약차박지를 정했다면,가장 먼저 최근에 폐쇄나경고조치된 적이 있는지 꼼꼼히 알아보고 떠나도록 합시다. 주소 경기 연천군 미산면 동이리 67-1 일원",2021. 7. 9.
"영화 강철비 곽도원, 정우성의 새콤달콤매콤 망향비빔국수(본점)","갑자기 떠나게 된 포천 여행! 펜션으로 가는 중에 들린 망향비빔국수! 54년된 전통의 맛!!!(1968) 여기가 영화 강철비에서 곽도원 배우와 정우성... 읍... 달 다다라~녹는다 녹아!! ★★★★★ 맛, 가성비 굿!! 경기 연천군 청산면 궁평로 5 TEL. 031-835-3575 영업시간 매주 10:00~20:30 단체 주차 가능",2021. 7. 8.
연천 망향비빔국수 본점 내돈내산 솔직후기!,연천 1박 2일 여행을 계획하고 계신 분들이 참고하심 좋을 것 같아요! 저희는 오전 11시에 오토캠핑장에서 체크아웃을 한 후 점심으로 뭘 먹을까... [연천맛집] 망향비빔국수 본점 정보 ♥주소 : 경기 연천군 청산면 궁평로 5 (지번 → 경기 연천군 청산면 궁평리 231-2) ♡전화번호 : 031-835-3575...,2021. 6. 18.
"연천 가볼 만한 곳, 딸기 체험이 가능한 들꽃가람농장",연천의 멋진 곳 여행도 하고 잠시 들러 딸기 체험도 하면 좋을 듯합니다. 딸기 너무너무 맛있더라고요. 마트에서 구입해 먹던 딸기와는 당도가 달랐습니다. 들꽃가람농장 주소 : 경기도 연천군 전곡읍 신답리 786-1 문의 : ***-****-**** 체험 시간 : 평일 11:00~18:00 일요일 휴무 -기자단 최정수-,2021. 4. 15.
[연천]허브빌리지,연천 허브빌리지 경기 연천군 왕징면 북삼리 222 http://herbvillage.co.kr/ 네이버 평일에 다녀왔더니 사람이 1도없어요 저희는 허브빌리지펜션에서... 이번여행때가지 사진으로 모두 남겨놨어요 저앞에 보이는 넓은곳이 바로 라벤더가피는곳 올해도 역시나 꽃은 없어요 저희는 언제나 푸릇푸릇...,2021. 7. 12.
100대 명산 어디가지? 서울 경기권 대중교통 뚜벅이 등산 코스,"9 m 경기도 양주시 남면, 경기도 연천군 전곡읍, 경기도 파주시 적성면 감악산 100대 명산으로 선정된 감악산은 의적 임꺽정이 쉬어가던... (내구성) 가벼움(경량성)에 초점을 맞춰 만들어진 신발입니다. 등산, 트래킹, 여행 및 일상까지 편안한 워킹을 제공합니다. ▼ 알타이기어 홈페이지 ▼",2021. 7. 27.
코로나 종식 후 가볼만한 경기도 관광명소 100선/수도권 여행 명소,여행지기들이 추천하는 경기도의 그 곳 100선이다. - 경기관광 포털 바로가기: https://ggtour.or.kr/ ★ 가평군 <아침고요수목원> 아침고요수목원은... 신륵사 ★ 연천군 - 한탄강 오토캠핑장 - 전곡선사박물관 - 허브빌리지 ★ 오산시 오산시의 경기도 명소 100선은 물향기수목원이 있다. ★ 용인시...,2020. 9. 9.
[ESC] 땅 짚고 가는 한탄강…연천 지질 여행,[ESC] 땅 짚고 가는 한탄강…연천 지질 여행 등록 :2020-10-09(금) 10:07 7월 유네스코 세계지질공원 인증 아늑한 협곡에서 아득한 시간 여행 경기도 연천군 전곡읍 신답리 ‘좌상바위’ 건너편 강가로 가는 오솔길. 김선식 기자 서울에서 차로 1시간 남짓 거리인 경기 연천군은 그동안 여행지로는...,2020. 10. 23.
"연천 여행지 추천, 은대공원 옆 전곡 문화공간","등을 두루두루 보실 수 있고 여름 피서지로 좋은 한탄강오토캠핑장 등 가볼 만한 곳들이 많으니 가족, 연인, 친구와 함께 소중한 시간을 이곳에서 만드시길 바라며 행복한 여행이 되기를 바랍니다. 연천 은대공원 옆 지하보도 내 문화공간 주소 : 경기 연천군 전곡읍 은전로 45(은대리 573) -기자단 홍성종-",2021. 7. 20.
‘유네스코 세계지질공원’에서 호젓한 캠핑을! 포천 멍우리협곡캠핑장과...,"경기 포천시·연천군과 강원 철원군까지 여의도 면적의 400배에 달하는 지역이 유네스코 세계지질공원으로 등재됐다. 멍우리협곡캠핑장에서 차로... ○ 주변 볼거리 산정호수, 평강랜드, 포천아트밸리, 아프리카예술박물관, 국립수목원 등 글·사진 : 구완회(여행 작가)",2020. 10. 13.
전곡선사박물관/ 한탄강 카라반 캠핑 갔다가 들렸어요,031-830-5600 경기 연천군 전곡읍 평화로443번길 2 월요일 휴무(월요일이 공휴일일 경우 제외) 평일 10:00 - 18:007월~8월(화~금요일) 매일 10:00 - 18... 전곡선사박물관 #경기도아이들과오기좋은곳 #연천여행 #전곡원시인 #한탄강캠핑 #한탄강오토캠핑장 #한탄강캐빈하우스 #전곡연천...,2021. 8. 9.
아이와 함께 가볼만한 곳 경기도 연천 세라비 한옥카페 장독대 가득한 인생샷 남기기,당일치기로 여행할 수 있어 참 좋은 것 같습니다. 한동안 파주나 영종도 쪽으로만 다니다가 연천에 오니 마음이 확 트이고 좋은 기운 많이... 세라비 한옥카페 (베이커리카페) 전화번호 : 0507-1348-0646 주소 : 경기 연천군 군남면 군중로 134 영업시간 : 평일 10:00 ~ 18:00 (6~10월) 공휴일 10:00 ~ 20:00 저도...,2021. 7. 19.
국내 여행 지도 코스 100선 확인 요망,한탄강관광지 : 연천군 파주 DMZ : 파주시 과천 서울랜드 서울대공원 : 과천시 양평 두물머리 : 양평군 파주 헤이리마을 헤이리예술마을 : 파주시 여기까지 수도권 서울 경기 인천 여행 코스입니다. 서울 근교 나들이로 알찬 곳들만 뽑아봤습니다 ^^ 강원도 설악산 평창 대관령 춘천 남이섬 평창군...,2021. 1. 18.
[연천 호로고루]서울 근교 당일치기 주말나들이,그래서 팍세권의 아파트 단지들이 비싼가보다 ㅋㅋ 5월의 청보리와 9월의 해바라기는 보지 못했지만 기분좋은 여행이었다 연천에 온다면 꼭 들려봐야할 곳인것 같다 기회가 온다면 청보리와 해바라기를 보러 다시 오게될지도 모르겠다 ※ 경기 연천군 장남면 원당리 1258 ※ 031-839-2144 ※ 주차가능 무료,2021. 6. 28.
연천여행_고랑포구 역사공원,경기도 연천군 미산면에 있는 조선시대 에 고려의 태조 등을 제향하던 사당이다 서울둘레길 완주하신 아빠랑 나중에 경기둘레길 완주하기로 약속함 1차 백신맞고 거의 3주째 골골대면서 정말 이번 계기로 젊을 때 건강챙겨야지 다짐하고 또 다짐하며 각종 영양제도 구입하고ㅋ..... 나이를 먹긴...,2021. 9. 29.
연천카페 [연천회관] 연천드라이브 가볼만한 이쁜카페,"연천카페 '연천회관' 연천에 가볼만한 예쁜 카페 경기 연천군 연천읍 평화로1219번길 42 매일 09:00 - 20:00 수휴무 T ) 0507-1470-7016 연천은 드라이브 하로 자주가는 곳이다. 강원도에서 그래도 동쪽보다는 북쪽이 도로가 좀 덜 복잡하다고 생각한다.ㅎㅎ 물론 카페도 북한강,춘천으로 가는 방향이 더...",2021. 6. 30.
"연천 가볼만한곳, 재인폭포(한탄강 국가지질공원)둘레길 걷고 왔어요(ft.출렁다리 영상)",재인폭포 (한탄강 국가지질공원) 주소 : 경기 연천군 연천읍 고문리 산21 운영시간 : 하절기 10시~17:30분 / 동절기 10시~16시 쉬는날 : 연중무휴 주차... 방문하시려는 분들께서는 잘 참고하시고 즐거운여행길이 되시길 바래요. 재인폭포의 설화가 있습니다. 옛날에 고을 원님이 줄을 잘타는 재인이라는...,2021. 7. 13.
연천 전곡맛집 1인보쌈 싸움의고수 전곡점,연천의 가장 핫 플레이스인 전곡에는 웬만한 외식프랜차이즈들은 다 들어와있을정도로 다양한 메뉴들이 여행객들을 유혹하고 있답니다. 그중에... com/SSAGO_KOREA 싸움의고수 연천전곡점 찾아가는 길 주소 경기 연천군 전곡읍 전곡로 151-1(전곡리 336-68) 문의 031-833-3830 #싸움의고수연천전곡점...,2021. 7. 12.
찬란한 역사의 현장 연천 역사여행 고랑포구 역사공원,"고랑포구 역사공원을 찾아가는 방법으로는 자가용 운전시 내비게이션에서 연천 고랑포구 역사공원을 검색하면 되는데 주소는 경기도 연천군 장남면 270입니다. 대중교통을 이용하는 방법은 전곡 시외버스 터미널에서 따복버스 80-3으로 환승하거나, 적성 전통시장 정류장에서 09-2, 09-3으로...",2020. 8. 14.
연천 여행 : 삼국시대 초성리 토성의 흔적 청산공원,"공원은 이러한 면에서 주민들에게 상당히 유용하고 꼭 필요한 공간이라고 할 수 있을 텐데, 연천군 청산면에도 누구나 편안하게 이용할 수 있는... 있는 경기장도 만들어져 있었습니다. 게이트볼은 T자 형태의 스틱으로 공을 쳐서 게이트를 지난 후 골대를 맞추는 경기로 육체적인 근력의 소모가 많지...",2020. 3. 16.
[210523-국내] 시간과 자연이 빚은 걸작 연천 재인폭포 지질여행 [경기도 연천],"선 여행자들은 10년 묵은 체증이 모두 씻겨 내려간다며 감탄을 쏟아낸다. ■ #짜릿한 출렁다리 건너며 즐기는 재인폭포 경기 연천군은 전체가 억겁의 시간 동안 화산폭발과 자연이 만들어낸 신비로운 지질로 가득하다. 한탄강 주변은 제주도(2010년), 청송(2017년), 무등산권(2018년)에 이어 지난해...",2021. 5. 23.
생방송 투데이 자족식당 한탄강 건져온 100% 자연산 메기매운탕 쏘가리회...,"< 아우라지매운탕 > 경기 연천군 전곡읍 청연로 154 영업시간 매일 11시 부터 21시 까지 031-832-1513 2021년 6월 28일 생방송 투데이 자족식당... 아우라지매운탕은 한탄강 근처 전곡읍 근처에 위치해 있었는데요, 주변이 다 산이라 그런지 계곡도 많아 여름에 계곡 여행 오시거나 한탄강에서...",2021. 6. 28.
연천에서 파주까지 1일 데이트코스로 손색없는 황금주말을 소개합니다,경기 연천군 청산면 궁평로 5 http://naver.me/F4epD1fe 카베아 경기 파주시 파주읍 봉서산로 245 2층 http://naver.me/xpVCsEGx 황금 주말 즐겁게 마무리 하세요 #파주 #연천 #전곡 #데이트코스 #여행코스 #당일치기여행 #연천가볼만한곳 #파주가볼만한곳 #전곡가볼만한곳 #캠핑 #당일캠핑 #노지캠핑 #연천캠핑...,2021. 4. 19.
"경기도 연천, 파주 가볼만한 곳 / 고랑포구역사박물관, 호로고루, 억부인 국수집 코스 추천","당일치기 여행으로도 부담스럽지 않아서 추천하는 연천, 파주 코스 자세한 포스팅 시작합니다~ 1. 연천 고랑포구역사박물관 위치 : 경기 연천군 장남면 장남로 270 전화 : 031-835-2002 영업시간 : 매일 10:00~17:00 매주 월요일 휴장 월요일 공휴일 시 화요일 휴장 입장료 : 현재 5월 기준 무료입장 주차...",2021. 5. 27.
[연천카페/전곡카페] 모던한 분위기의 편안한 감성카페 언래블(UNRAVEL),언래블(UNRAVEL) 경기 연천군 전곡읍 평화로 720 1층 언래블 차를 이용해 방문했는데 카페 옆에 넓은 주차공간이 마련되어 있어서 불편함없이 편하게... 031-834-9999 #연천카페 #언래블 #브런치 #브런치카페 #샌드위치 #샐러드 #전곡카페 #연천여행 #연천맛집 #연천 #연천카페추천 #전곡카페추천...,2021. 6. 21.
경기도 데이트코스 연천 당포성,"밤에 움직이는 타입이라면 한번쯤 경기도 데이트코스 왔을지도 모르겠네요. 거의 대부분 연천 여행코스가 호로고루-당포성-재인폭포 요 정도... 번잡하지 않아 좋았습니다! 마지막으로 영상으로 한번 감상해보세요~ 주소 : 경기도 연천군 미산면 동이리 주차장, 화장실 : 있음",2021. 5. 26.
포토존이 많은 예쁜 연천카페 UNRAVEL,"ㅎㅎ 여성분들은 공감하실텐데요, 여행갈 때 그 지역에 있는 예쁜 카페를 꼭 들리고 싶잖아요...ㅎㅎ 그래서 인터넷으로 전곡, 연천카페들을... [연천카페] UNRAVEL 추가정보 ♥주소 : 경기 연천군 전곡읍 평화로 720 1층 언래블 (지번 → 경기 연천군 전곡읍 은대리 1860 1층 언래블) ♡전화번호 : 031...",2021. 6. 8.
경기도 가볼만한곳 연천 허브빌리지 드라이브 코스,"경기도 드라이브 코스로 즐겨본 향긋한 허브빌리지를 연천 가볼만한곳으로 소개해 봐요. 여행 갈 때마다 막내딸이 따라다니더니 이젠 할 일이... 경기 연천군 왕징면 북삼리 222 운영시간 하절기 (04.20~10.31) 09:00~20:00 동절기 (11.01~04.19) 09:00~18:00 입장료 대인 7,000원/ 소인 4,000원 레스토랑은 운영은...",2021. 5. 24.
경인권 캠핑장 리스트 - 경기도 수도권,연천캠핑장 경기 연천군 꼬마캠핑장 경기 연천군 군남면 남계리 492 경기 연천군 화요일아침예술학교제2캠퍼스캠핑장 경기 연천군 전곡읍 양원리 560 경기 연천군 한탄강오토캠핑장 경기 연천군 전곡읍 전곡리 640 경기 연천군 평화강변수목원캠핑장 경기 연천군 미산면 삼화리 94 경기...,2021. 7. 19.
[경기 연천] 그리팅맨(옥녀봉),그리팅맨(옥녀봉) 연천군 군남면 옥계리 832 연전을 여행하다 알게 된 조형물 그리팅맨을 보러 간다. 산 중턱에서 공손히 인사를 하고 있는 이 아저씨가 우리를 오라며 손짓을 하니 모르는 척 방문을 해봐야지. 이곳은 앞서 방문한 재인폭포에서 연천 관광안내 지도를 보고 이런 곳이 있음을 알게...,2021. 9. 12.
연천 맛집/ 망향 국수/ 연천 망향 국수 본점,연천에 여행 갔을 때 갔었던 망향 국수 이날은 신병 모집이 있던 날인지 사람들이 북적였다 영화 강철비 촬영지로도 유명한 곳인데 국수가 맛있다고 소문난 맛집이기도 하다 경기 연천군 청산면 궁평로 5 연천 8210부대 앞에 위치. 매일 10:00 - 20:30 연중무휴 031-835-3575 그래도 한가한 날이라고...,2021. 5. 13.
연천 여행 역사이야기 고랑포구,"연천에서도, 그리고 경기도에서도 원래 고랑포구는 꽤 유명한 곳인데요. 특히 우리나라 격동의 근현대사를 같이 겪어온 역사적인 명소이기도... 현재는 고랑포구역사관을 통해 많은 분들에게 존재를 각인시키고 있는데요, 연천군 장남면에 오신다면 고랑포구에도 꼭 들러보시기 바랍니다.",2020. 4. 1.
연천 세라비 한옥 카페에서 힐링 시간을 보내요,세라피 한옥 카페 경기 연천군 군남면 군중으로 134 평일 10:00 - 19:00 6월 ~ 10월 공휴일 10:00 - 20:00 6월 ~ 10월 지난 3월 휴일~ 아침에 일어났더니 날씨가... 가족들끼리 1박 2일 여행으로 가도 좋은 곳!! 딱~ 요만한 정도의 한옥집에서 살면 너무 좋겠다~며 둘이 한옥 예찬을 하느라 바빴던 기억이 납니다....,2021. 6. 25.
생생정보통 맛집오늘 고추뼈찜 김치말이국수 위치 주소,이어서 '믿고 떠나는 스타의 고향' 코너는 배우 서이숙과 함께 재인폭포와 좌상바위가 있는 고향 경기도 연천군 여행을 나선다. 마지막으로 '나나랜드' 코너는 여행자 부부의 이곳만이 내 세상 편으로 꾸며진다. 이날 방송에 소개된 명소와 맛집은 방송 직후 붐빌 수 있으니 시간을 두고...,2021. 6. 22.
생생정보통 맛집오늘 흑돼지소금구이 모둠생선조림 위치 주소,다음 코너 '믿고 떠나는 스타의 고향'에서는 배우 강성진과 함께 쉬자파크와 양떼목장 등이 있는 경기도 양평군 여행을 나선다. 마지막으로... 생생현장 <옛 풍경과 쉼이 있는 곳 연천> ▶ 미라클타운 경기 연천군 군남면 군중로 ▶ 연천드라마미술전시장 경기 연천군 군남면 옥계안길 2....,2021. 5. 3.
"경기도 연천 가볼만한곳 : 재인폭포, 연천전곡리유적",티비보면서 연천 생각이 새록새록 ㅎㅎㅎㅎㅎ 재인폭포 경기 연천군 연천읍 고문리 산21 #경기도연천 #연천가볼만한곳 #연천여행 #연천재인폭포 정말 추웠던 날 다녀왔던 재인폭포 재인폭포는 산책하기 너무 좋은 곳이었는데 너무 추웠다 ㅠ_ㅠ #경기연천군주요관광지 연천 가운데 앉아있었는데...,2021. 3. 6.
서울/경기 아이와 가기 좋은 곳! 갯벌 체험을 하고 싶다면? 경기 어촌체험마을로~,"경기도 갯벌 체험장 지도로 보기! 1. 안산시 선감 어촌체험마을 종현 어촌체험마을 풍도 어촌체험마을 흘곶 어촌체험마을 2. 시흥시 & 연천군... 아이와 즐거운 여행을 위해서 :-) 제가 브로슈어, 홈페이지 등을 통해 확인한 내용을 간단히 정리해 놓은 것은 참고해 주시고, 꼭 홈페이지...",2021. 7. 5.
"국내 코로나 확진자 현황 ""델타 변이 곧 전체 유행…거리두기 최우선""","및 여행지역을 중심으로 증가세로 전환되면서 4차 유행이 지속 확산되고 있습니다. 특히 델타형(인도발) 변이 바이러스가 기승을 부리고 있어... ⓒㅊ소망 한편, 권역별로는 먼저 수도권의 코로나 확진자 현황을 보면 경기 연천군 어린이집 관련으로는 접촉자 추적관리 중 4명의 신규...",2021. 7. 27.
"초보 골퍼 탈출 (22) - 골프 여행 ""자유로CC""",그런데 지도에 찾아보니 연천군에 있는 골프장이다. 군사분계선 가까이 있어서 그런지 지도 이미지도 나오지 않는다. 새벽 첫 티업이라 집에서... 사진 욕심을 너무 낸 것인지 초반부터 산만하고 경기에 집중이 안 된다. 경기보다는 사진 찍는 것에 더 집중하고 있는 상황. 코스의 난이도는 보통의...,2021. 9. 16.
경기도 차박 장소 추천 Top5,경기도 차박 장소 추천 Top5 코로나로 인해 많은 여행객들의 발걸음이 차박으로 향하고 있습니다. 이는 독립적인 공간에서 안전하게 즐길수 있다는... 경기도 연천 당포성 경기 연천군 미산면 동이리 경기도 연천에 위치한 당포성은 연천 한탄강과 임진강이 만나는 주상절리를 배경으로 자연을 느낄수...,2021. 5. 14.
