header,contents,date
연천 카페 추천! 애견동반가능한 세라비한옥카페 (빙수맛집),"애견동반가능한 세라비한옥카페 세라비 한옥카페 경기 연천군 군남면 군중로 134 영업시간 주말 목, 금 10:00 - 21:00 평일 10:00 - 18:00 안녕하세요... 근처에 연천 가볼만한곳으로 호로고루가 있는데요 여행코스로 두 곳 모두 포함시키셔도 좋을거 같아요. 종종 한옥카페를 가긴 했었지만 이렇게 규모가...",2020. 8. 16.
연천 - 고대산(高臺山) 832m (210320-10),"(高臺山), 연천군 여행정보 등산코스안내 고대산]. 신탄리역은 서울과 원산을 오가던 기차가 지나던 경원선 철도 중단점이였던 역이다. 경원선은... 쇠사슬에는 지난 연인산 정상부에서 만난 “경기둘레길” 빨간색 하늘색 시그널이 있다. 쇠사슬을 건너 도로를 잠시 오르고 오른편 시멘트길을...",2021. 3. 21.
"연천카페, 과수원카페 가을풍경이 아름다운 [애플팜페]",아삭아삭한 사과가 정말 맛있게 보여서 따먹고 싶다는 충동을 느낍니다 ㅋㅋ 도심을 벗어나 시골 한적한 곳에서 가족들과 여유롭게 즐기다 왔네요 연천카페 애플팜페 영업시간 10:00 - 19:00 주소 경기 연천군 군남면 진상 19길 41-36 매주 월요일 휴무 #연천가볼만한곳 #가을여행 #연천카페 #애플팜페...,2020. 10. 5.
대전비디오테이프변환 /비디오테이프변환 .결혼.재롱잔치. 신혼여행 .집안행사변환,신혼여행 집안 행사 비디오테이프 영상파일로 변경하는것입니다 . 계속 저희가 강조 하는것있습니다 . 변환 해서 hd나 uhd로 되냐고 하시는데... 시흥/군포/의왕/하남/용인/용인/처인구/수지구/파주시/이천시/안성시/김포시/화성시 /광주시/양주시/포천시/여주시/연천군/가평군/양평군...,2021. 8. 13.
"경기도 평화소설 연천 2편 - 연강갤러리, 태풍전망대","주소 경기 연천군 중면 횡산리 이용시간 9:00~16:00 입장료 무료 고사기관총탄 낙탄지와 삼곶리 돌무지무덤 중면 행정복지센터에는 북한군 발포... 27번 국도를 따라 백학면-미산면-군남면 → 군남면 진입 후 도로이정표 참조하여 연강갤러리 도착 글, 사진 : 여행작가 이종원 위의 글과 사진은...",2021. 1. 22.
생생정보통 맛집오늘 삼채짬뽕 불고기짜장면 민물매운탕 붕어찜 위치 주소,대동 맛 지도 <경기도 연천> ■ 민물매운탕 & 붕어찜 <불탄소가든> 경기 연천군 연천읍 현문로 526-29 ※ 영업시간은 매일 오전 11시 ~ 오후 8시 30분 입니다. (명절 휴무) 4. 노.래.방 (노래 따라 방방곡곡 떠나는 여행) <충청북도 옥천군> ■정지용 문학관 충북 옥천군 옥천읍 향수길 56 관공서...,2020. 11. 18.
"연천 로하스 파크, 경기도 한적한 힐링 여행지","연천 로하스파크 서울 근교, 경기도에서 가까운 한적한 힐링 여행지로 추천해요 연천 여행 가신다면 꼭 한 번 들러보세요 서울 근교 한적한 생태 습지 공원 연천 미라클 타운 로하스 파크 위치 및 주의사항 -경기 연천군 군남면 옥계리 1259-3 (미라클 타운에 조성된 생태 습지 공원) ※뱀조심",2020. 6. 26.
연천 호로고루성과...,"연천지역에 한탄강을비롯 지형적특성을 살필수 있는곳이란 것을 이번여행에서 좀 더 관심을 갖게 되었다. *호로고루* 호로고루는 경기도 연천군 장남면 원당 3리 일대에 소재하고 있다. 호로고루는 입지적인 측면에서, 북쪽은 크고 작은 산들이 둘러싸고 있어 시계를 확보할 수 없는 반면, 남쪽은...",2020. 10. 1.
"고려왕조의 역사, 연천 숭의전","많은데, 연천군 미산면에는 왕조의 주 무대가 지금의 북한 땅이었던 고려의 왕들에 얽힌 기억을 간직하고 있는 장소가 자리하고 있습니다.... 평화누리길은 통일의 염원을 담아 경기북부권에 조성한 둘레길인데, 총 12개의 각 코스마다 인증 스탬프를 찍으며 전 코스 완주에 도전해 보는 것도 의미...",2020. 12. 25.
"주목하라, 속초와 양양!","현대인의 삶이 지나치게 빨라 사람들이 지치고 힘들어해서 생긴 트렌드인 ‘슬로우 라이프’ 물결로, 여행도 장기 체류형 선호로 바뀌었습니다. 흔히 요즘 신조어로 ‘ㅇㅇ에서 한달 살기’ 라고 칭하는데요, 처음 개념은 여행 카테고리에서 파생되었지만 장기 체류는 곧 ‘그곳에 오래 머물어...",2020. 4. 14.
"경기도 평화소설 연천 1편 - 그리팅맨, 개안마루, 두루미테마파크","정류장 → 100번 버스 → 소리계 정류장 → 도보 20분 소요 [자가운전 정보] 세종포천고속도로 → 전곡 연천 방면 → 신천로 → 강변로 → 봉동로 → 평화로 →연천군청 방면 고가도로 진입 → 군남로 → 군중로 글, 사진 : 여행작가 이종원 위의 글과 사진은 경기관광포털사이트에서 퍼온것입니다.",2021. 1. 22.
방어회&방어김치찌개…동충하초 닭백숙·민물매운탕&붕어찜,"▷ 불탄소가든 : 경기 연천군 연천읍 고문리(현문로)에 있는, 한탄강에서 그날 잡은 자연산 민물고기만을 재료로 쓴다는 매운탕 전문점이다.... ◆ <노.래.방 (노래 따라 방방곡곡 떠나는 여행)> 편에서는 ‘경상남도 거제’로 여행을 떠난다. ▷ 매미성 : 경남 거제시 장목면 복항길에 있다....",2021. 1. 28.
[연천]망향비빔국수 궁평본점(+카페리히트),"망향비빔국수 본점 비빔국수, 만두 * 2020년 8월 기준 위치 경기 연천군 청산면 궁평로 5 지출 내역 - 4인 기준 - • 비빔국수 | 6,000원x2개 • 곱배기... 어쩌다보니 여행 주제가 주표군대체험하기가 되어 버린 여기가 구닌들의 안식처라는 바로 그 곳? 므싯게 찍힌 오토바이 찾아보니 서울에도...",2020. 8. 31.
"사람 드문 야외, 여행 책방, 랜선 여행으로 짧은 여행 즐겨볼까",잠시나마 숨통을 트여줄 짧은 여행도 필요하다. 최근 코로나 여파로 주요국들의 산업 활동이 줄어들면서 미세 먼지 없는 맑고 깨끗한 하늘 볼 일이 많아졌다. 넓고 탁 트인 곳에서 화창한 날씨와 파란 하늘을 마음껏 감상할 기회다. 경기 연천군 호로고루는 임진강 절벽 위에 세워진 고구려성이다....,2020. 11. 5.
가족과 함께 하는 연천 재인폭포 오토캠핑장,"넓고 쾌적한 공기 좋은 여행지로 추천합니다! 연천재인폭포오토캠핑장은 경기도 연천군 연천읍 현문로 508번길 140에 있으며 오토캠핑존 캐빈 하우스, 카라반, 카바나, 수영장, 어린이 놀이터 등을 고루 갖춘 경기 북부 지역에서는 손꼽히는 캠핑장입니다. 4만여평의 넓은 대지 위에 자리 잡고 있어서...",2020. 10. 15.
"NO.13 ""생일캠핑""_연천나린오토캠핑장","""연천나린오토캠핑장"" 솔가람프리미엄텐트 11번 (사이트 상세동영상은 마지막에 있습니다.) 주소 : 경기 연천군 미산면 어삼로 391-81 입실 14:00 퇴실... 너무 예뻐서 집으로 가는길도 여행떠나는 기분..^^ ** 예약하기 ** http://narincamp.com/ ** 솔가람프리미엄텐트11번 ** 1번~ 3번 까지는 육각형으로 된...",2020. 7. 27.
연천 봄나들이 가볼 만한 곳 <은대근린공원>,"봄바람이 살랑살랑 불어오고 꽃잎이 휘날리는데 코로나 때문에 여행도 여의치 않고 집 안에만 있자니 봄날이 아쉽고… 이럴 때 생각나는 곳, 바로... 25전쟁에서 무공훈장을 받았거나 베트남전에서 보국훈장을 받은 군인들을 기리기 위해 세운 탑으로 2007년 6월 18일 기준 연천군에 거주하고 있는...",2020. 4. 23.
'코로나 1년' 유명 관광지 지고 한적한 소도시 떴다,"숙박업 분야 카드 사용액은 경남 거창군에서 841% 급증한 것을 비롯해 전남 함평군(387%), 강원 영월군(147%), 전남 진도군(127%), 경기 연천군(177%)에서도 늘었다. [한국관광공사 제공. 재판매 및 DB 금지] *자료는 2019년과 2020년 BC카드 '여행업' 분야 카드 사용액 데이터 지난해 코로나19의...",2021. 1. 24.
포천/경기북부 실버건강연구하는 강사 안경미 2020년 경자년 마무리 & 2021년...,#실버건강교육강사(안경미) 실버건강을 연구하는 강사 안경미 포천/경기북부 실버건강연구하는 강사 안경미 2020년 경자년 마무리 & 2021년... com/kmlovely1004/221986914130 【실버건강교육 강의 현장입니다.】 #국민건강보험공단 포천지사#연천군 노인복지관#포천보건소#구리보건소 #철원보건소...,2020. 12. 31.
"[평화누리길] 11코스, 임진적벽길을 걷다",경기도내 평화누리길 12개 코스 중 연천군 관내에는 3개 코스가 있다. 지난주 12코스를 걸었기에 이어서 11코스를 걷고 싶었다. 11코스를 살펴보니... 걷기는 운동을 하면서 건강을 챙길 뿐이라 여행이기도 해 좋다. 산행은 정상에서 바라보는 탁 트인 풍경으로 희열을 느끼는 경우가 많지만...,2021. 2. 1.
"(연천가볼만한곳) 연천 당포성 (feat: 나홀로 나무, 임진강뷰)",연천 당포성 사적 제468호 연천 당포성 (漣川 堂浦城) (문화재청) 지정(등록)일 : 2006.01.02 소 재 지 : 경기 연천군 미산면 동이리 788 조선시대 각종... 의미있는 여행이 되는 곳입니다. 현재 경순왕릉과 고랑포구 역사공원 모두 오픈중입니다. ※ 연천 호로고루(城)에 대한 방문글입니다. <<< >>> ※ 연천...,2021. 2. 10.
한탄강소나무캠핑장: 서울근교 1박2일 캠핑장,캠핑장 -한탄강소나무캠핑장/연천캠핑장/한탕강/캠핑장/서울근교여행/1박2일/바베큐- 낮에는 약간 덥지만 밤에는 선선해서 캠핑 가기 좋은 시즌이 왔다! 코로나로 인해 사람들이 밀집해 있지 않은 자연 속에선 보복소비(?) 하기 최적의 장소이다. 서울 근교 1박 2일로 경기 연천군에 위치한...,2020. 6. 22.
인천공항대형택시 구리 남양주 가평 양평 하남 경기광주 성남 서울 대형택시 점보택시...,인구현황) 경기도 인구수가 많은 도시순서는 수원시.고양시.용인시.성남시.화성시.부천시.남양주시.안산시.안양시.평택시.시흥시.김포시.파주시.의정부시.광주시.하남시.광명시.군포시.양주시.오산시.이천시.구리시.안성시.의왕시.포천시.양평군.여주시.동두천시.과천시.가평군.연천군 (2021.3월...,2021. 5. 1.
낭만적인 가을 오토캠핑 글램핑 가기 좋은 곳,여러명이 여행한다면 인원에 따라 펜션 스타일용으로 1개 오토캠핑장 형태로 1개 이렇게 렌트해도 좋을 듯 합니다. 무엇보다 신축한 곳이라서 아주... 나린오토캠핑장 경기 연천군에 위치한 나린오토캠핑장은 가족캠핑장으로 알려져 있습니다. 1박에 5만원부터 9만원까지 4가지로 나뉘어 있어요....,2020. 8. 10.
코로나로 바뀐 여행지-지방 소도시의 약진,"숙박업 분야 카드 사용액은 경남 거창군에서 841% 급증한 것을 비롯해 전남 함평군(387%), 강원 영월군(147%), 전남 진도군(127%), 경기 연천군(177%)에서도 늘었습니다. 2019년과 2020년 BC카드 '여행업' 분야 카드 사용액 데이터 / 사진=한국관광공사 제공 지난해 코로나19의 영향으로 여행 대신 카페...",2021. 1. 21.
[연천회관] 나들이 가기 좋은 경기도 연천의 이색카페!(+솔직후기),"암튼 그런 계절이 지나고 가을도 왔고, 해외여행은 물론, 어디 멀리 놀러 가지도 못하는 이때에. 콧바람은 쐬주어야 겠고... 해서 고민고민 하다가... ㅋㅋㅋㅋㅋㅋ 경기 연천군 연천읍 평화로1219번길 42 ->경기 연천군 연천읍 통현리 458 (지번) 그럼 마지막으로 사진 보시고, 맛있는 커피 냠냠- 호로록...",2020. 10. 7.
맛과 재미 모두 잡는 전국 이색 빵집 추천!,"어떤 곳이 있는지 여행가게와 한 번 알아볼까요? 전국 이색 빵집 추천 [로이카페] 위치: 경기 연천군 전곡읍 양연로 1510 가격: 3,000원 (3개) 영업시간: 매일 09:00 - 20:00 (월요일 휴무) 선사 시대 유적의 상징인 주먹도끼를 본 떠 만든 주먹도끼빵! 연천 특산물 율무와 무농약으로 재배한...",2020. 7. 22.
차박 여행지 추천 !,차박 여행지 추천 ! 안녕하세요 : ) 고객을 부르는 전문 향기마케팅 업체 에바센트 입니다. 코로나 때문에 사람 많은 곳을 못가시는 분들을 위해!... (3) 연천 임진강 주상절리 경기 연천군 미산면 동이리 주상절리 3번째로는 경기도 연천군에 위치한 주상절리 입니다. 여기는 야경도 멋있고 아침에...,2020. 6. 4.
"연천 애견동반 한옥카페, 세라비 - 경기도 드라이브 강추",경기도 & 서울근교 드라이브 장소로도 강력 추천합니다~~:-> #내돈내산 #솔직후기 세라비 한옥카페 ***-****-**** 경기 연천군 군남면 군중로 134 월~수 10... 멀리 여행 간 기분까지 들었던 경기도 드라이브~~ 연천에 이렇게 예쁜 곳이 있었는지 미처 몰랐어요. 연천은 앞으로도 매년 방문하게 될 예정이라...,2020. 9. 25.
연천맛집 망향비빔국수 본점(소원성취ㅜ_ㅜ),031-835-3575 경기 연천군 청산면 궁평로 5 지번 궁평리 231-2 매일 10:00 - 20:30연중무휴 생생정보 32회15.10.01. 비빔국수 재작년 겨울 처음으로 망향비빔국수를 먹었을 때 그 짜릿함을 잊지못한다 비빔국수는 우리엄마표가 제일이라 생각했는데 아냐! 망향비빔국수가 제일이야!! 감격의 따봉 가격...,2020. 8. 8.
동두천 맛집 추천 베스트 7 (ft. 경기도 여행),"2일 여행코스 추천 7곳에 대해서 궁금하다면 이 글 맨 아래에 해당 글의 링크를 기재해 놓았으므로 참고하시기 바랍니다. 동두천시는 대한민국 경기도의 시입니다. 동쪽은 포천시, 서쪽과 남쪽은 양주시, 북쪽은 연천군에 맞닿아 있습니다. 시청을 기준으로 서울 도심에서 북쪽으로 약 47km...",2021. 8. 25.
연천 아이와 함께하기 좋은 곳 '허브빌리지',"위치는, 경기 연천군 왕징면 북삼리 222 36개월 미만은 무료입장 성인은 7천원에 아메리카노 제공인데 현재는 내부리뉴얼로 5천원에 음료제공이에요... 당일치기 여행코스로 너무 좋은 곳 같아요 2년전 사진인데.. 호로고루에는 해바라기도 정말 넓은 공간에 예쁘게 피어있었답니다~ ☆☆☆ 아린...",2020. 7. 22.
[계곡추천] 사람없는 계곡에 가고싶다면?? 연천 동막 계곡!!! 물이 정말 깨끗하다@-@,위치 : 경기 연천군 연천읍 동막리 동막계곡 우리가 갔던 곳의 정확한 위치는 위에 지도에 있는 법화골 간이화장실의 위치에서 걸어서 5분~10분 더 위로 올라가면 있는 곳이다. (경기도 연천군 신서면 내산리 366) 가족들과 휴일을 맞이하야 사람이 없는 계곡을 찾아왔다. 정말 단 한명도 없었다. 오...,2020. 8. 20.
"[연천카페] 세라비 한옥카페 - 리얼한옥느낌, 당일치기 일정으로 딱","연천여행 중에 마음에 쏙 드는 카페 발견 세라비 한옥카페 영업시간: 평일 10:00-18:00 주말/공휴일: 10:00-19:00 주소: 경기 연천군 군남면 군중로 1234 음료 가격대: 4,000 ~ 7,000원대 주문메뉴: 콩파티 인절미빙수 (18,000원), 아메리카노(5,000원) 초록초록한 연천의 느낌에 맞는 대형 한옥카페다. 세라비...",2020. 11. 26.
연천 캠핑장 야영장 캐라반 글램핑 서울 근교 주말 나들이 '굿'(전국 무료 캠핑장 공유),잇님 여러분 여행락커 낙지예요. 이번 호에서는 서울 근교 주말 나들이로 딱인 연천 캠핑장 야영장 이야기를 해볼까 해요. 저와 함께... 415-17 ▶#임진물새롬센터오토캠핑장 경기 연천군 미산면 청정로1706번길 119 ▶#다솔관광농원 경기 연천군 미산면 청정로918번길 123 ☞캐라반 2개...,2020. 2. 21.
"2020년 4월 11일(원격 술자리/연천 박원명 초밥/대만 파인애플 맥주, 오리지널 롱...","연천 전곡에 위치한 박원명 초밥 주소: 경기 연천군 전곡읍 온골로 40 전화번호 : 031-833-7789 가기 전에 미리 전화로 주문해놓고 찾으러가면 빠르게... 대만을 좋아해서 대만 여행을 여러 번 다녀왔는데 대만에서 매일매일 마셨던 맥주다. 술을 즐겨하지 않고, 술 집에서 술을 자주 마셔서 그런지...",2020. 4. 12.
[여행기록] 포천 신북리조트스프링폴온천,"그래서 ~ so ~ 작년 여름부터 못갔던 (드디어 간 !) 워터파크 기록하기 포천 신북리조트스프링폴온천 현재 본인은 경기북부에 위치한 연천군에 거주하고 있어요 ^(tmi)^ 워터파크는 케비가 최고여라 ~ 하던 본인은 , 코시국 4단계 거리두기가 시행된 이 시점 그 머언 곳까지 갈 수 없다면서 근처...",2021. 8. 6.
"연천 가볼만한곳 은대리 주상절리, 수평절리와 차탄천 에움길","그래서 서울에서도 당일치기 여행으로 여유롭게 다녀올 수 있는 매력적인 곳입니다. 차탄천 에움길 연천의 차탄천 에움길은 차탄교에서... ▷경기 포천시 유역 493.24km2 ▷경기 연천군 유역 273.65km2 ▷강원 철원군 유역 398.72km2 등 모두 1165.61km2다. 여기에 화적연, 비둘기낭 폭포, 아우라지 베개용암...",2020. 10. 5.
고대산(832m) : 경기 연천 2017. 5. 29.,"금강산 가는 길목, 경원선 철도가 끊겨 있는 철도중 단점인 연천군 신탄리역에 인접한 고대산(832.1m)은 천혜의 자연경관을 간직하고 있으며 생태계가 잘 보존된 곳이고 등산으로 북녘땅을 바라볼 수 있는 국내 유일한 곳으로 등산여행에는 안성맞춤이라고 한다 아침 08:00시경 석수역에서 2명...",2021. 4. 23.
연천 숨은 명소 향토유적 임장서원과 현충탑 탐방,장승처럼 우뚝 선채로 여행객들을 반겨주는 홍살문. 붉은 홍살문은 주로 출입문의 역할을 수행하던 것으로 상징성이 더 중요시되었던 문으로... 연천군 향토문화재 제12호인 임장 서원은 경기도 연천군 연천읍 동막로25번길 170에 있습니다. 임장 서원은 연천군 유일의 서원이자 연천향교와...,2020. 7. 2.
삼채짬뽕 불고기짜장 무쇠짬뽕 연천 불탄소가든 매운탕맛집,이어서 '대동 맛 지도' 코너는 경기도 연천에 소재해 민물매운탕&붕어찜 맛집을 소개한다. 또 '노.래.방 (노래 따라 방방곡곡 떠나는 여행)... 대동 맛 지도 <경기도 연천> ■ 민물매운탕 & 붕어찜 <불탄소가든> 경기 연천군 연천읍 현문로 526-29 ※ 영업시간은 매일 오전 11시 ~ 오후 8시...,2020. 11. 18.
아이와 함께 가기 좋은 역사 탐방지 연천 목은 이색 영당,"역사가 살아 숨 쉬는 목은 이색 영당 경기도 연천군 왕징면에는 고려 말, 조선 초 극명하게 서로 다른 길을 걸었던 두 사람의 사당이 자리하고... 정치적으로 이념이 달랐던 두 사람의 사당이 어떠한 연유로 인근 지역에 서로 마주하게 되었는지는 잘 모르겠지만 이번 연천 여행 중 두 사람의 사당을...",2020. 6. 14.
가족과 함께하는 겨울방학 추억 만들기 장소 추천 5,"전곡선사박물관 -경기 연천군 전곡읍 평화로443번길 2 타임머신을 타고 선사시대로 떠나볼까요? 전곡선사박물관은 동북아시아 최초로 아슐리안형... 본인의 얼굴과 선사시대 인류의 얼굴을 합성해보는 체험, 고인류 VR, 냉동 미라 체험 등의 프로그램에 참여하며 가족 모두와 함께 시간 여행을...",2020. 1. 22.
연천 카페 / 군남 세라비 한옥카페,세라비 C'est la vie 연천카페 / 한옥카페 / 경기도한옥카페 주소 / 경기 연천군 군남면 군중로 132 영업시간 / 평일 10:00-18:00 주말 10:00-19:00 주차 / 세라비 한옥카페 바로 앞 주차 오늘은 연천에서 가장 핫한 카페 연천 세라비에 다녀옴. 할무니랑 밥묵고 카페가자길래 사진만 보다가 직접 다녀왔다....,2020. 7. 11.
연천 당포Miracle캠핑장 후기[캠핑7],#당포Miracle캠핑장 경기 연천군 미산면 마동로 38-50 #당포미라클캠핑장은 연천당포성 옆에 위치해 있습니다. 사이트는 번호가 있는데 정작 사이트에는 번호가 없습니다. 이유는 선착순 입니다. 내가 원하는곳에 텐트를 치시면 됩니다. 요금은 일박에 삼만원 연박 오천원 할인 됩니다. 저희...,2020. 5. 3.
오랫만에 본 고드름 -연천 고대산 역고드름,주 소 경기 연천군 신서면 대광리 산 173번지 일원 철원도 겨울 같지 않은 날씨에 영하 1도정도 밖에 되지 않아 멀리서는 고드름이 보이지 않아요. 고드름이 없어도 처음 보는 광경에 엄마도 당신의 핸드폰에 사진을 남깁니다. 그래도 신기해서 엄마와 2019의 마지막 여행에 감사하며 고드름을...,2020. 1. 2.
요즘 핫하게 떠오르는 하늘계단이 있는 곳 연천 호로고루에서 주말나들이,표강으로 일컬었다고 해요 현무암 대지 위에 구축되어 제주도 느낌도 나는 것이 요즘같이 여행이 쉽지 않을때는 연천에서 제주를 느껴보시는거 어떠세요? ㅎㅎ 연천 호로고루성 경기 연천군 장남면 장남로163번길 128 주차 가능 / 입장료 무료 / 마을주민들께서 열체크 손소독제 / 화장실 / *애완동물은...,2020. 10. 10.
행복농촌만들기 경연,"은상 경기 연천군 푸르내마을 ❍ 2009년부터 사업을 시작하여 현재는 약 50여종의 농촌체험 프로그램을 운영하고 있으며, 마을주민의 농장을 체험... 제작, 여행프로그램 개발, 마을운동회, 달시장 등)과 문화 공동체 활동(남한강가 예술 포토존, 한뼘 갤러리, 동아리 활동 등), 복합문화공간...",2021. 9. 15.
감악산(파주) 등산코스/감악산 최단코스/동두천 소요산/ 소요산 등산코스,"난 3산을 해야되니 최단코스인 ""하늘아래첫동네"" (경기 연천군) 검색 후 도착. 그런데... 최최단 코스는 하늘아래첫동네가 들머리가 아니라는 점... 하산하자..나중에 근처 여행올일이 있으면 출렁다리 구경 할겸 다시와야지 <감악산 성모마리아상> <감악산 병풍바위> 하산길에 찍은...",2020. 12. 8.
"★연천에서 가장 가보고 싶은 곳★ 세계지질공원 ""재인폭포"" 엄청나다!!!","연천 ""재인폭포"" 위치 : 경기 연천군 연천읍 고문리 산21 시간 : 일출시~일몰시 (연중무휴) 가족들과 동막계곡에 갔다가 재인폭포를 구경하러 넘어왔다. 잘 몰랐어서 큰 기대를 하지 않았는데 정말 엄청났다. 재인 폭포 가는 중~ 재인폭포 앞에 삼거리 근처 식당들이 있나보다. 계곡에서 족발을...",2020. 8. 23.
"이전기사 배기동의 고고학 기행 전곡 주먹도끼, 이 땅 구석기인들의 '지혜의 흔적'을 찾다","고대의 유적으로 가는 길은 모두 시간여행길이겠지만 경기 연천군 전곡 구석기유적은 좀 더 특별한 느낌이 있다. 바로 우리가 상상할 수 없을 정도로 오래된 시대에 사람들이 살았던 흔적이기 때문이다. 전곡유적은 적어도 30만 년 된 곳이니 한 세대를 30년이라고 치면 1만 세대 이전, 즉 까마득한...",2021. 3. 2.
연천 고인돌공원 산책하기 좋아요,"연천 여행 중 예정에 없던 공원 산책하러 왔어요. 특이하게 고인돌 공원이 있더라구요. 경기 연천군이 고인돌 보존, 관리를 위해 통현리 쪽에 이전, 복원하여 공원으로 2018년 쯤 조성했다고 합니다. 연천 통현리 일대는 연천에서 고인돌이 가장 많이 분포하고 있는 지역이구요. 이 일대에서만 8기의...",2020. 5. 5.
파주 감악산 등산코스 운계폭포 출렁다리까지 딱 좋아,"파주 감악산 파주 핫플레이스 감 악 산 경기도 파주시, 양주시, 연천군 사이에 위치해 있는 파주 감악산은 높이 675m의 경기 오악 중 하나로 바위 사이로 검은빛과 푸른빛이 동시에 흘러나온다 하여 감악, 감색바위산 이란 뜻이라 한다 이른 아침 7시. 사실 산 다니는 사람에게 7시란 절대 이른 시간은...",2020. 9. 14.
한옥카페 연천 미라클타운에 다녀왔어요,오랜만에 맑은 날씨 만끽하며 드라이브도 하고 보현이도 잠깐이라도 내려 힐링하고 올 수 있어서 좋았어요. 아직도 여전히 사회적거리두기는 열심히 해야겠지만 잠깐이나마 정말 예전의 일상으로 돌아간 기분은 만끽 하고 왔답니다!! 미라클타운 경기 연천군 군남면 군중로 134 ***-****-**** 출처 / 네이버,2020. 4. 27.
