header,contents,date
의정부 민락동 카페) 트레블,장소 : 경기 의정부시 송현로52번길 6-11 시간 : 매일 10:00 - 20:00 (월요일 휴무) 의정부 민락동에 위치한 카페 트레블 방문했어요! 조명때문인가 밖에서 보았을 때 따뜻한 느낌이에요 메뉴입니다!! 가려져서 잘 안 보이네요ㅠㅠ 가려져서 다시 첨부해요!!!ㅋㅋㅋㅋ 카페 이름 트레블처럼 여행온듯한...,2020. 3. 28.
[의정부맛집] 또 가고싶은 피셔맨스키친♡,"'피셔맨스키친' 경기 의정부시 오목로225번길 84 https://store.naver.com/restaurants/detail?id=122095704 Previous image Next image 건강하게 맛있는 집으로 기억하고 있는 피셔맨스키친이에요. 주문했던 메뉴는 1. 마르게리따 피자 18,000원 2. 송로버섯 리조또 20,000원 Previous image Next image 신혼때...",2020. 4. 2.
[의정부/맛집]레이와: 혼밥 하기 좋은 일식당; 분위기 너무 좋은 맛집 ♥,레이와 경기 의정부시 의정부동 140-22 안녕하세요!! KIMSO 킴쏘에요!! 네일을 받으러 의정부에 왔다가 지나가다 우연히 보게 된 의정부 골목 맛집... 가 준비되어 있었고 요즘 코로나 때문에 어딜 가지도 여행가지도 못하는데 뭔가 일본 여행을 가는 듯한 느낌에 킴쏘 들어갈때 부터 설레였다고 합니다...,2020. 10. 20.
의정부 민락동 카페 I 디자인 카페(design cafe),민락동 카페 디자인 카페 경기 의정부시 송현로52번길 11 1층 매일 11:00 - 23:00 추석 연휴 오픈 / 설날 당일 휴무 압구정에서 민락동으로 이전... 메뉴판도 공항 이착륙 전광판 느낌으로 화장실도 비행기 스티커 따라가면 된다 사장님께서 여행을 좋아하시는 듯! 디자인 카페 2층 갬성:-) 해가 저물...,2020. 3. 9.
<의정부네일샵 <의정부네일샵 추천> : 빛나는네일 패디 후기,아주아주 좋습니다 저는 이번 연휴에 강원도여행을 계획했고 가서 바다도볼거라 #패디아트 가 필요했어요 내소중한 발꼬락 <의정부네일샵 추천... com/tensi8708 요기도 블로그도있네용 빛나는네일 의정부시 지역화폐 가맹점 주소 : 경기 의정부시 부용로 211 (의정부곤제역1번 출구에서358m) 영업시간...,2020. 4. 30.
의정부 민락동 타이마사지!! 타이왓포마사지 민락점,"그래서 여행을 가면 꼭 마사지 받는 코스를 추가하는데 오늘은 처음으로 한국에서 마사지를 받아보았어요!! 타이왓포마사지 민락점 정통 태국마사지로 온몸에 피로를 쫙~! 위치, 전화번호, 영업시간, 주차 ✔️위치 도로명 : 경기 의정부시 오목로205번길 18 지번 : 민락동 838-2 ✔️Tel 031-851-9936...",2020. 8. 6.
녹양동미용실 파마맛집 마크헤어살롱 구름펌후기,럽윤은 올해 차례는 산소에서 간단히 지내고 여행 다녀왔는데 정말 행복한 일주일을 보내고 왔어요. 하나하나 포스팅 차근차근해보도록... 지금까지 녹양동미용실 파마맛집 마크헤어살롱 구름펌후기였습니다. 마크헤어살롱 녹양점 주소 : 경기 의정부시 비우로61 전화번호 : 031-878-0120,2020. 10. 6.
의정부데이트코스 엑시트방탈출카페 3인 흉가 테마,"""흉가"" 여행 중 갑자기 쏟아지는 폭우를 피하고자 잠시 들어온 흉가.. 비가 그치길 기다리다 깜빡 잠이 들어버렸다. 얼마쯤 시간이 흘렀을까..... 앞은 처음이었는데 주변에 술집이나 카페~ 그리고 정원?같이 꾸며놓기도해서 잘되어 있었다. 의정부데이트코스 엑시트방탈출카페 경기 의정부시 행복로 22",2020. 11. 30.
사람 신바람리듬에 울고웃는 인생사 이박사 비법24시 노래방 대동맛지도 오늘맛집여행지,> ■ 돌쇠떡고을 서울 마포구 망원로7길 3 1층 ■ 집에서방앗간 경기 의정부시 평화로484번길 14 꽃보다 사람 <신바람 리듬에 울고웃는 인생사> 이박사 님 노.래.방 (노래 따라 방방곡곡 떠나는 여행) <경상남도 밀양시> ■ 만어사 주소 경남 밀양시 삼랑진읍 만어로 776...,2020. 11. 9.
[의정부 카페]카페 아를/고흐가 사랑한 프랑스 마을 아를을 재현한 감성 카페,"031-837-1717 경기 의정부시 동일로 204 매일 10:00 - 24:00 연중무휴 화요일 10:00 - 22:00 평일 브레이크 타임 15:00~17:00 반고흐 카페, 유럽 카페로 유명한 카페... 고흐가 아를에 살면서 그렸던 카페인데 아를에 가면 볼 수 있어요 코로나로 해외 여행이 힘든 요즘 이렇게나마 남프랑스의 감성을 느껴봅니다...",2020. 9. 30.
의정부 집에서카페 한옥카페 느낌에 홀딱 반해 !,유일하게 한옥스타일 카페가 너무 매력적으로 다가왔다 •위치:경기 의정부시 평화로484번길 14 (의정부역7번출구) •영업시간:매일 11:00~23:00 의정부 집에서카페 찾아오는길이 의정부역 근처라 찾아가기 쉬울것같다 여행을 다녀와서 피곤한 몸을위해 시원하게 커피한잔을 마시면서 편하게...,2020. 6. 30.
"3월6일생방송투데이,곰탕반,다보,문어한상,우리집반찬,고향만두,추억의칼국수...",3GO 동해 3GO 여행편 동해시 연안에서 잡힌 싱싱한 산문어만으로 요리하는 문어요리 전문점인 다보에서 문어한마리 먹으면 요즘같은... 소리나는 반찬 편 < 우리집 반찬 > 경기 의정부시 태평로 73번길 20 제일시장 다동 3호 < 우리집반찬 > ***-***-**** 맛스타그램 김치 하나로 최상의 요리가...,2020. 3. 6.
의정부 카페 아를 야외 테라스있는 내돈내산 후기,"주소 경기 의정부시 동일로 204 주차 무료 발렛 카페이름이 '카페 아를'인데 이게 프랑스 남쪽 지역의 '아를' 분위기로 카페를 만들어서 그렇데요, 프랑스 남쪽은 여행을 안가봐서 '아를' 지역은 몰랐는데 찾아보니 미술가 고흐가 사랑한 마을로 마을 곳곳에 고흐의 흔적이 있는 작은 마을입니다...",2020. 10. 30.
의정부 호텔 : 의정부 라트리호텔에서 품격있는 휴식♥,의정부여행도 좋을거같더라구요 주변에 수락산도 원효사 중랑천둘러보고 로데오거리에서 머리식히고 부대찌개거리에서 맛있는거 먹고... 부럽지롱 http://www.uijeongbu-latree.com/ 의정부 라트리호텔 경기도 의정부시 청사로6번길 19-13 031-843-5100 http://blog.naver.com/alljam2018 #의정부호텔...,2020. 8. 27.
"""하이힐로 날 밟아줘""…의정부역 '훈남' 변태 경험담 확산",전 — 경기 의정부시 의정부역 일대에서 '하이힐로 밟아주면 돈을 주겠다'는 남성이 출몰 ... 한 남성의 이야기를 전하며 다수... http://static.plaync.co.kr/gaiaupload/GpEvent/bbs/201204/6620120418140856.html ______________________________ <Blogser Score: 3점> [자전거 여행 1탄]...,2021. 5. 1.
의정부민락동맛집 민락2지구맛집 양구재래식손두부 강추,0507-1330-3116 경기 의정부시 오목로225번길 15-13 매일 09:10~22:00 주차가능 두부직접만드는집 국내산 콩으로 만들고 직접 만들기 때문에 신선하고 맛있어요 민락2지구 에 위치 하고 있는데 처음 가보고 맛있어서 두부가 땡기는날에는 양구재래식손두부 로 가야할것 같아요 강원도 여행 갔을때 먹었봤던...,2020. 9. 21.
의정부 한복대여 조은날한복 굿!,"제주도에서 여행가서 스냅한복 대여해서 스냅촬영해도 넘 좋을거같아요 ~ 오늘도 좋은하루되세요! 매장 분위기를 영상으로 담아봤습니다 감사합니다 :-) 의정부 한복대여 조은날한복 굿! 주소 : 경기도 의정부시 시민로 464-7 용진빌딩 2층 의정부 만가대사거리, 스타벅스옆 건물입니다! 전화 문의...",2020. 1. 14.
[의정부브런치카페/호원동카페] 파머스빌리지플러스 ★ 루프탑과 테라스가 너무 좋아용,031-836-0366 경기 의정부시 호원동 380-10 주차장 있음! 널찍한 주차장을 지나... 왼쪽은 건물 뒷편의 테라스 뒷쪽에 동산이 있는데 산책로처럼... 동남아 여행가면 카페에서 미스트처럼 물을 뿌리고 있는.... 스프링쿨러(?)같은 것도 가동하고 있어서 시원하게 앉아있을 수 있겠더라구용 호원동카페...,2020. 6. 14.
의정부 놀거리 의정부 데이트하기 좋았던 액시트 방탈출 카페,"흉가 Haunted House 공포도 ★★★☆☆ 난이도 ★★★★☆ 여행 중 갑자기 쏟아지는 폭우를 피하고자 잠시 들어온 흉가.. 비가 그치길 기다리다 깜빡... 위치 : 경기 의정부시 행복로 22 영업시간 : 매일 10:00-23:00 전화&문의 : 031-840-8088 의정부 놀거리, 의정부 데이트로 방탈출카페 액시트 추천드려요!...",2020. 10. 26.
"<서울이 아니어도 오를곳은 오른다> 필사 6편. 인천,경기 철도노선에 따른 집값 분석","GTX-C 라인은 경기도의 또 다른 소외지역이었던 의정부시 라인을 살려낼 것으로 전망됩니다. 최근 새로운 정부의 대북관계 회복으로 경기북부 역할이 점점 더 커지며, 중요한 역할을 하게 될 것입니다. 다만 GTX의 경우 A 노선을 제외하면 B와 C가 확정되지 않은 상태이므로 고려해야합니다. 착공된...",2021. 7. 2.
민락동 가성비 초밥집: 치치노미,"오랜만에 여행 계획 없이 연차를 내었기에 부모님과 오마카세를 먹을까 하다가 초밥은 좋지만 가볍게 먹고 싶다는 아빠의 말씀에, 무엇보다... 참고로 현금 할인있고 주차도 건물에 가능합니다. 치치노미 주소: 경기 의정부시 오목로205번길 35 전화: 031-851-2022 영업시간: 11:30 ~ 24:00, 월요일 휴무",2020. 6. 15.
[의정부/자양집] 신시가지 유명한 의정부동 흑염소 맛집,"코로나 때문에 여행도 못가게된 내 지인.. 뭘 먹을까 고민하다 보양식으로 유명한 자양집으로 가게 되었다. 의정부동 흑염소 자양집 검은보물... 제대로 했다는 지인, 덕분에 나도 지인 덕에 보양 제대로 했다. 잘 먹었습니다. 업체명 : 자양집 연락처 : 031-878-0200 주소 : 경기 의정부시 시민로27번길 19 1층",2020. 8. 31.
힘든 아이가 더 떠안는 교육 공백의 빚,"그런 문화자본은 기초적으로 소풍·운동회·수학여행·졸업식·입학식 같은 생애 이벤트일 수도 있고, 더 나아가서는 각 학교·학년별로 다양하게... 아예 포기해버리는 아이들 경기 의정부시에서 이동형 청소년 쉼터 ‘포텐’을 운영하는 전종수 소장도 비슷한 이야기를 했다. “거리를 헤매는...",2021. 2. 22.
의정부學 톺아보기,"그해 9월부터 ""우리동네 학습여행""을 시작으로 의정부 시민들과 동별 단체에 홍보하여 지역에서 활동하시는 리더분들에게 의정부의 유래 및 상징... 1단계 공사로 과녁터(살받이)에 모래부설 작업으로 화살을 보호할 수 있도록 조치하였고, 이를 통해 명실상부한 경기북부 최고의 국궁장으로서의...",2020. 8. 6.
"의정부 꽃집 & 저렴한 의정부역 꽃집 :: 어버이날 선물 준비 ""꽃블리""","의정부 꽃집 꽃블리 매일 11:00 - 20:00 ***-****-**** (24시간 문의가능) ***-****-**** (꽃자판기 사업, 납품 문의) 경기 의정부시 호국로1276번길 10 102호... 부모님께서 여행을 가시기 때문에 어제 어버이날 카네이션 꽃다발을 미리 준비해서드렸어요! 근데 솔직히 요즘 꽃다발 가격 엄청 비싸잖아요... 거의...",2020. 5. 2.
순천 꼬막정식 도원경 대구 연근 한상 반야월연근사랑협동조합,"생생정보통 <쌀의 재발견 4편, 쌀도 트렌드시대!> ■ 돌쇠떡고을 서울 마포구 망원로7길 3 1층 ■ 집에서방앗간 경기 의정부시 평화로484번길 14 2.... 노.래.방 (노래 따라 방방곡곡 떠나는 여행) <경상남도 밀양시> ■ 만어사 경남 밀양시 삼랑진읍 만어로 776 ■ 감익는마을천연식초 경남 밀양시...",2020. 11. 9.
"유럽 갬성 의정부 카페, 카페 아를(Cafe Arles)",Arles) 경기 의정부시 동일로204 ★ open / close 월-금 10:00 - 24:00 화 10:00 - 22:00 (연중무휴) Break Time 15:00 - 17:00 (주차 가능) 코로나 이후 여행 앓이가 더욱 간절해진 요즘 - 잠시나마 가까운 곳에서 유럽의 갬성을 느껴보고자 서울 근교 남양주에 있는 카페 아를을 다녀왔어요 카페아를은 커피...,2020. 7. 16.
[경기/의정부] 데빌스 레시피 Devil's recipe,"24 경기도 의정부시 시민로131번길 62 1층 Devil's recipe gelateria(의정부동 159-18) 매일 12:00 - 22:00 (목요일 휴무) 1인 2가지맛 컵 4,000Triple cup... 젤라또 먹을 때마다 이탈리아 여행갔을때 매일매일 부지런히 먹었던 젤라또가 생각나기도 하며또 다시 여행갈수 있을까.. 라는 생각과...",2021. 1. 28.
[의정부/맛집]로코하와이: 의정부 신상 맛집!! 하와이의 향을 느껴봐아,하이룽(건방) KIMSO 킴쏘에오 오늘 소개할 곳은 의정부에 새로 생긴 신상 맛집 로코하와이 경기 의정부시 시민로 138/의정부동 131-12 로코하와이... 디자인도 여행 온 느낌을 줘서 너무 좋은거 있죠 !! 안그래도 코로나 때문에 여행을 못가는데 이렇게 퇴근해서 여행 온 분위기를 내다니 !! 꺄아아...,2020. 7. 15.
의정부 골프레슨 프로한테 배울 수 있는 곳,이래서 외국 가서도 하게 되고 제주도 여행 가서도 하게 되는구나 싶더라고요. 운동도 확실히 스킬이 있다고 아는 만큼 보이고 아는 만큼 칠 수... 필드 나가는 실력이 될 때 까지 배워보려고요! 스마트골프 경기 의정부시 오목로 225번길 95 도영빌딩 3층 대표번호 - 031-851-2261 https://blog.naver.com/smartgolf2,2020. 3. 6.
[의정부 카페] ‘카페아를’ / 힐링하기좋은카페 / 사진찍기좋은카페 / 의정부카페추천...,한켠에서는 쿠키도 판매하고 있다 프랑스 아를 여행 추억하기 좋은 의정부 고흐 카페 야외에 딱 들어섰는데! 외국마을을 그대로 옮겨놓은 듯한... 오랜만에 야외로 나가서 힐링하고 온 기분이었다☺️☺️ 경기 의정부시 동일로 204 카페 아를 장암역 1번 출구에서 958m 영업시간 매일 10:00...,2020. 6. 8.
[의정부 단시간 여행]토퍼 제작자의 천국 '토리1004'를 찾아서~,같은 경기도에 살아도 거리는 어마어마하다. 괜찮아요. 경기도인은 길바닥에서 버리는 인생이 1/4이거든요 ㅋㅋㅋㅋㅋㅋㅋㅋ 집에서 출발해보기로... 오랜만에 여행을 온기분이었다. 파주시 - 고양시 - 양주시 - 의정부시 이렇게 4개의 도시를 거쳐서 의정부에 도착한다.ㅋㅋㅋㅋㅋㅋㅋㅋㅋㅋㅋㅋ...,2021. 2. 5.
민락동모듬사시미 [청담이상 의정부민락점] 의정부/민락동 분위기 좋은 이자카야 추천! :D,[ 청담이상 의정부민락점 ] ▶주소 : 경기 의정부시 오목로225번길 157 ▶전화번호 : 031-853-2388 ▶영업시간 : 매일 17:00 ~ 04:00 / 일요일 17:00 ~ 03:00... 오코노미야끼는 4년 전 여행에서 먹은게 마지막인데 이렇게 다시 만나니까 더 군침 돌고 그렇네요 ㅠㅠ! 오징어도 엄청 길쭉길쭉 넣어주셨어요...,2020. 10. 14.
의정부점집 소름끼치게 잘맞는 의정부용한점집 월악산꽃도령,소름끼치게 잘맞는 의정부용한점집 월악산꽃도령 위치- 경기 의정부시 범골로157번길 7-13 (경기 의정부시 의정부동 504-2) 예약번호- ***-****-**** / 070... 친구는 병원에서 근무를 하는데 2달전에 일을 그만두고 퇴직금으로 여행을하면서 지내고 있었다구해요 근데 너무 오래 쉬는 것 같아서 일자리를...,2020. 4. 16.
"의정부 데이트코스, 카페 아를, 유럽감성 가득한 서울근교 가볼만한곳 추천",추천 경기 의정부시 동일로 204 / 031-837-1717 영업시간 - 매일 10:00 - 24:00 카페 아를 전용 주차장에 주차 가능 딱 의정부 데이트코스 카페 아를 의 요 사진을 보고나서 무조건 다녀와야 겠다고 생각했었습니다. 요즘 같이 코로나로 인해 해외여행은 꿈도 꾸지 못하니 이렇게 유럽여행 감성이 낭낭한...,2020. 7. 17.
"초밥 맛집,동해 초밥참치 가족 외식 메뉴로 추천!!","참치회와 초밥이 세트메뉴로 되어있네요 동해 초밥참치 주소:경기 의정부시 비우로 108번길48 지하철 1호선 녹양역1번출구에서 554m 영업시간: 11:00-23:00 브레이크타임: 3:30-5:00 주차가능(맥도날드 주차장과도 계단으로 연결되있어서 이용하셔도 될것같아요. 단, 후식으로 아이스크림정도는...",2020. 5. 13.
집에서 즐기는 우리동네 예술축제 <무한상상 아트캠프~시민정원 수확잔치>,작은 여행같은 축제 <무한상상 아트캠프>를 주제로 경기도민들이 문화예술 활동과 향유의 기회를 증대하는 축제의 장을 마련한다고 합니다. 년... 이 분들은 작년에 의정부시 공연에도 참석했었던 감성신사 보컬 4인조이십니다. 테너와 바리톤의 베이스가 정말 멋진 하모니를 만들어내시는 정말...,2020. 10. 26.
녹양역 맛집 백세삼계탕 상황버섯 삼계탕으로 몸보신,"안녕하세요 여행 인플루언서 늑대털쓴양입니다. 지난번 포천으로 출장 가는 길에 의정부에 잠시 들러 점심 식사를 하고 갔었는데요, 무더운 날씨에 몸보신할만한 식사 거리를 찾던 중 의정부 녹양역 맛집 '백세삼계탕'을 알게 되어 찾아가 보았어요. 주소 : 경기 의정부시 서부로 747 시간 : 10:30~21:00...",2021. 6. 23.
[직장생활백서] 직장 내 사회적 거리두기,"15일간 (2020.03.22~2020.04.05) 불필요한 외출/여행/외식/모임/행사 등을 자제하고, 종교/유흥/체육 시설의 운영 중단을 권고하고 있다. [출처... 지자체 구내식당 '사회적 거리 두기' 20일 낮 12시 경기도 의정부시 경기도청 북부청사 구내식당. 식당 입구에서 직원들이 손 소독제를 손에 뿌려 발랐다....",2020. 3. 26.
의정부용현동 상가,"주소 경기 의정부시 용현동 지하철 [의정부 호선]송산 0.1 ㎞ [의정부 호선]탑석 0.3 ㎞ [의정부 호선]어룡 0.8 ㎞ 대지(토지) 설명 대지면적 200㎡ (60.5평) 총면적 200㎡ (60.5평) 1,405만원/PY 오늘의 좋은 글 2 여행에서 지식을 얻어 돌아오고 싶다면 떠날 때 지식을 몸에...",2020. 2. 17.
애슐리W 의정부역점 1월 신메뉴 먹으러 주말 방문 ~,의정부역점 경기 의정부시 시민로 80 센트럴타워 8층 (031-825-5787) 지하철에서 가까워 좋았던 매장이다. 이용가격 성인 평일 런치 : 13900원 평일 디너... 미식여행 ' ~ SEAFOOD & GRILL 포스터에서 봤던 것들만 있는거 아니었다. 아래 사진들로 확인하시고~ ^^ 입구에서 인원수 이야기하고 안내받은 우리자리...,2020. 1. 13.
[의정부 케이크] 주문제작 케이크는 역시 모어댄디저트!,모어댄디저트 경기 의정부시 용민로 129 ***-****-**** 평일 09:00 - 19:30 토요일 09:00 - 19:00 일요일 휴무 안녕하세요:) 제가 오늘 소개해드릴 곳은 #의정부... 가끔 기념일에 케이크 가지고 장거리로 여행가잖아요? 그 때를 대비해서 필요한 아이스팩도 판답니다- 5천원이었나...? 기억이 정확히 안나는데...,2020. 4. 21.
민락2지구속눈썹연장 눈썹살롱 지속력 디자인 대박이얌❗️,"이번주는 너무 바쁜 한주였는데 , 미뤄왔던 양양여행도 가구 바로 취직해서 찹쌀같이 출근하구 민락2지구속눈썹연장 눈썹살롱에서 속눈썹 한뒤로 여기 저기 예쁜 얼굴이라는 소리도 듣고 너무 만족해요 다음에 또 예약해보려구요~! 눈썹살롱 경기 의정부시 천보로 38 3층 303호 http://naver.me/FxzzR7Tm...",2020. 7. 11.
의정부 시티투어,의정부 시티투어가 드디어~~ 여행을 좋아해서 지자체에서 운영하는 시티투어를 종종 다니는데 내가 거주하는 의정부 시티투어가 운영된다는... 처음으로 방문한 곳은 의정부 컬링장입니다.2018년 3월 개관한 의정부 컬링경기장이 국내 최대 규모의 컬링 전용 경기장이라는 사실 아시나요?저도...,2020. 11. 19.
의정부 한복대여 종류가 다양해,조은날한복 경기도 의정부시 시민로 464-7 용진빌딩 2층 연락처 : 031-852-2217 영업시간 : 매일 10:00 ~ 19:00 주차 가능 대중교통 이용시 : 의정부 탑석역... 인접하여 경기북부에서도 많이 오신단다. 2020 친정부모님 팔순 예정대로였다면 해외여행으로 가족 모두 다녀왔을텐데 여행으로만 보내기 아쉬우니...,2020. 10. 15.
"민락 2지구 카페 : 자연광, 디저트 맛집 '커피하다'",자연광과 함께 하는 커피하다 날씨는 좋은데 의정부코로나 때문에 여행은 못 가고 답답함에 근처를 거닐다 우연하게 방문하게 되었는데 생각 보다 너무 좋은 카페 #민락2지구카페 #커피하다 | coffeehada 커피하다 주소: 경기 의정부시 오목로225번길 60-17 영업시간 :10:00 - 22:00 '매주화요일휴무' 매장...,2020. 3. 21.
[ 2TV 생생정보 1184회 ] 11월 09일 월요일 취재 연락처,> ■ 돌쇠떡고을 서울 마포구 망원로7길 3 1층 ☎ 02-322-2210 ■ 집에서방앗간 경기 의정부시 평화로484번길 14 ☎ 0507-1392-1209 ■ 정나래... 노.래.방 (노래 따라 방방곡곡 떠나는 여행) <경상남도 밀양시> ■ 만어사 경남 밀양시 삼랑진읍 만어로 776 ☎ ***-***-**** ■ 감익는마을천연식초 경남...,2020. 11. 9.
가족이랑 차 렌트해서 놀러갔어요! 의정부렌트카 이렌트카,":) ㅎㅎㅎ 몇 달 전부터 저는 가족들과 함께 여행을 갈 계획을 열심히 짜놨는데요, 마침 딱 가려고 했는데 코로나 바이러스가 터지는 바람에...... 제가 차를 렌트한 곳은 바로 의정부렌트카 이렌트카 의정부지점 이구요, 경기 의정부시 동일로466번길 5 서해아파트 상가1동 2층에 위치하고 있다구...",2020. 7. 6.
의정부맛집 투어 1탄 - 정통 일본식튀김덮밥 ( 텐동 ) 맛집 노비루를 소개해요.,그리고 신선도를 유지하기 위해 당일 재료 소진 시 일찍 문을 닫으니까. 너무 늦지 않게 가시고 확인 전화하고 가세요. #의정부맛집 민락2지구에 위치한 #노비루에서 맛있는 식사되세요.*^^* 노비루 경기 의정부시 오목로205번길 21 http://naver.me/5kKRLyhP,2020. 3. 27.
"""남 일 아니잖아요""…어려움 속 더 빛난 숨은 영웅들","'우리 동네 소독 전담' (의정부=연합뉴스) 경기 의정부시 가능동 방재단장인 최수진(61)씨는 지난 1년간 거의 하루도 거르지 않고 동네 곳곳을... 여행 첫 시작부터 기분이 팍 상한다""는 이야기를 들은 적도 있었다. '제주의 관문 지켜요' (제주=연합뉴스) 제주항만과 공항에서 각각 발열체크 등 방역...",2021. 1. 13.
내돈내먹/의정부 카페 달아,"그래서 편의점에서 아침부터 초코우유+오렌지주스1L 털어왔어용~ 카페 달아 경기 의정부시 시민로131번길 19 (의정부동 174-15 2층 카페달아) ☎ 031-841-0700 월-목,일요일 11:00-22:00 금-토 11:00-23:00 링크: http://naver.me/GHmNgRa6 [여행박사] 여행지도 위치공유 위치주소 : 의정부.카페.달아 위치보기 : http...",2020. 3. 31.
의정부 어반제주 / 휴양지 같은 민락동 카페,"어반제주 본점 전화번호 : 031-852-5433 주소 : 경기 의정부시 민락로 479 영업시간 : 매일 11:00~22:00 브레이크 타임 16:00~17:00 매장 내, 외부 의정부... 짧게 나마 여행온 듯한 착각에 빠져서 행복했다고 한다. 트로피칼한 제주도 느낌 인테리어와 메뉴들이 참 잘 어울린다. 히트에이드의 히트는 히비스커스...",2020. 9. 23.
의정부 맛집 수제 만두 전골이 맛있는 조경제 만두쟁이,"안녕하세요 여행 인플루언서 늑대털쓴양입니다. 약 2주 전에는 의정부에 볼일이 있어서 갔다가 의정부 맛집 '조경제 만두쟁이'에서 저녁식사를 했는데요, 100% 수제 만두와 샤브샤브, 그리고 칼국수까지 포함된 푸짐한 만두전골이 참 맛있었던 곳이었어요. 주소 : 경기 의정부시 부용로 105...",2021. 6. 23.
# 진짜 진짜 일상을 찾아서 _ (2),"카페 들어가기 전, 겉모습을 찍어본건데 막 찍어도 그냥 감성 그 자체 ,, 크으 여기는 ‘경기 의정부시 태평로155번길 36 1층’에 위치하고 있는... 갑자기 타이밍 좋게 걸려오는 전화 한 통 ,, 바로 저희와 친한 언니와 오빠였어요 ^3^ 서로 작년까지는 같이 매년 여행도 다니고 자주 근처에서 만나서...",2020. 8. 25.
