header,contents,date
[의정부타코맛집] 의정부 오타코에서 '그란데화이타' 멕시코 남미음식 즐기고오기...,"해외여행 가고싶으신분들 진짜 많으시잖아요ㅠㅠ ""오타코""에서 간접적으로 멕시코느낌 물씬 느껴봐욧! 오타코 영업시간 : 매일 12:00~24:00 Break time 15:00~17:00 전화번호 : 031-821-9049 주소 : 경기 의정부시 호국로1298번길 62 의정부타코맛집 오타코는 태영프라자 앞쪽에 봉추찜닭 건물2층에...",2021. 7. 22.
의정부역 일식 연장전 어떤 메뉴를 먹어도 맛있어요,곳이다 경기 의정부시 의정부동 주민들이 인정한 맛집! '연장전' 데일리모아뉴스 (dailymoa.kr) 같이 곁들일 수 있는 반찬도 나온다 얇게 썬 양배추와... 제주도 여행 갔을때 연돈을 먹고 한동안 돈까스는 입에도 안댔었는데 비주얼만 봐도 대박임을 알수 있었다 글을 쓰면서 사진을 보고 있으니 또 먹고...,2021. 7. 7.
여주 여행코스 말쑥하게 복원된 해평윤씨동강공파종택,"경기도 의정부시 박세당 종가와 여주시 신창섭 종가를 비롯 11곳의 종가들이 경기도 전통종가로 선정되기도 했어요. 해평윤씨동강공파종택은 상량문에 따르면 조선 고종시대 1891년에 안채와 사랑채, 중문채, 행랑채등으로 지어졌던 건물인데요. 오래전 다녀갔을때와는 달리 새롭게 복원된...",2020. 6. 28.
서울 근교 드라이브 가기 좋은 카페) 남양주 비루개/ 포천 카페퍼르 / 의정부 카페아를 -2탄,포천 여행에서 여기서 음료마시며 기분 좋았던 추억이 있어서 다른사람에게도 추천하고있음 위치 : 경기 포천시 가산면 포천로 582 1층 시간... 위치: 경기 의정부시 동일로 204 시간 :매일 10:00- 24:00 유럽분위기 낭낭한 야외공간 여기저기가 다 포토존이라 사진찍히고 싶은 욕구가 뿜뿜이다...,2021. 7. 8.
의정부시 주최 작은 연극 '안골사진관' 극단 정인 주최 '가족사진' 최정인 연출 공연 이야기,"■ 정확한 공연일시는 2020.09.27(일) AM 10:30 극단정인 제4회 정기공연 <가족사진>이, AM 11:30에는 2020의정부시 주민제안공모사업인 안골마을 탐구생활... 어느 날 갑자기 찾아온 친한 언니와 영화 속 이야기 처럼~~ 즉흥적으로 여행을 떠났습니다. 그 언니도 나도 행복해 했었던 추억의 장소와 보고 싶은...",2020. 10. 6.
GTX 의정부역 청약준비 이안 더 메트로 모델하우스와 현장 방문기,"사실 이번 달은 어디 여행도 가고 휴가를 가려고 미리 일정을 뻬놨었는데.,, 코로나 4단계로 심각해지는 것 같아서, 휴가는 다 취소하고 안전하게... 의정부 이안 더 메트로 모델하우스 :-) 주소: 경기 의정부시 민락동 804-3 민락동에 위치한 이안 더 메트로 모델하우스 사전예약 한 사람만 입장할 수...",2021. 7. 31.
[의정부] 정직한 제빵소 :: 빵순이의 추천빵집!,"정직한 제빵소 경기 의정부시 민락로 475 매일 10:00~22:00 주차 가능 빵순이에게는 빠질 수 없는 빵집 방문! 우연찮게 발견했지만 정말 손에 꼽을... 해서 다시 한 번 오랜만에 들리게 된 정직한 제빵소입니다 위치가 위치인지라 ㅠㅠ 포천, 철원 이쪽 여행가는 길에만 들리게 되네요ㅠㅠ 집 주변에 이런...",2021. 7. 16.
사랑스런 애완동물을 키우고 싶을때? 의정부 강아지분양은 의정부 애견샵 '펫인쥬',"또한, 각종 증정품 행사와 평생 호텔 할인같은 다양한 행사가 진행중이니 이제 여행이나 출장가실 때 마음 놓고 맡기실 수 있겠네요. 특히 거품이... 의정부 강아지분양, 의정부 파충류분양은 의정부 애견샵 '펫인쥬' -> 업체명 : 펫인쥬 -> 업체주소 : 경기 의정부시 호국로1310번길 44 -> 전화번호 031...",2021. 7. 21.
경기도 브런치 카페 의정부카페아를에서 유럽감성 느끼기,"주소: 경기 의정부시 동일로204 전화: 031-837-1717 시간: 매일 10:00~24:00 연중무휴 화요일 10:00~22:00 평일브레이크타임: 15:00~17:00 주차가능... 프랑스의 야외 카페 느낌이 물씬~ ""사진 수만 장 찍어야지"" 작정하고 원피스를 입고 프랑스 여행 간 느낌으로 사진을 수만 장 찍고 왔다....",2021. 5. 24.
"투데이 20200228 (2519) #태안 3GO여행 낚시,ATV,양념게장,간장게장 #의정부(민락동)...",3GO - 태안 3GO 여행 #정원낚시 ★ 충남 태안군 남면 안면대로 1708 041-674-0671 #ATV ★ 충남 태안군 원북면 신두리 1233-32 에벤에셀펜션... 반찬 #마이찬 ★ 경기 의정부시 용현로 158 (민락동 700-3) 01O.2464.3849 - 매일 11:00~21:00 - 일요일 휴무 3) #맛스타그램 - 31년 내공으로...,2020. 2. 28.
2021 가을시즌 비대면 안심관광지 25선/전국 언택트 힐링 여행지 소개,"여행이 쉽지 않은 요즘 생활 속 거리두기가 가능한 안심 힐링 여행지로, 여행전문가들이 선정한 ""2021 가을시즌 비대면 안심관광지 25선""을... 두 전망대를 오가며 도봉구와 의정부시, 수락산의 모습을 한눈에 담을 수 있다. - 시작지점(무수골): 지하철 도봉역 1번 출구에서 도보 15분소요 - 간송...",2021. 9. 18.
의정부사진관 :: 증명사진잘찍는곳 뉴페이스튜디오,"안녕하세요 제이릴리입니다:) 여행가서 민증을 잃어버려서,,ㅜㅜ 새 민증 발급을 위해 의정부 증명사진 잘 찍는곳을 알아보다 뉴페이스 스튜디오에 증명사진촬영을 예약했답니다! 전에 친구가 찍은걸 봤었는데 너무너무 예쁘게 나왔더라구요!! 뉴페이스 스튜디오 의정부 경기 의정부시...",2021. 7. 16.
골목·거리 7곳을 경기지역 관광 거점으로 조성,"의정부시는 부대찌개 먹거리와 연계한 체험 콘텐츠 제작, 양평군은 용문 천년시장 경기천년테마골목에서 먹거리 컨설팅을 통한 메뉴 개발, 가평군은 경춘선 폐철길을 활용한 시간여행 체험 콘텐츠 등을 각각 제시했다. 바닷가인 화성시 전곡리 마리나 골목과 시흥시 오이도 바다거리에서는 마을...",2021. 4. 7.
[추석] 명절 전국 지방자치단체 귀성 자제를 호소,강원도는 지난해에 이어 올해도 '이동과 여행보다는 집에 머물러 주세요'라는 취지로 캠페인에 나설 방침이다. 강릉에서는 코로나19 사태 이후... 의정부시는 설 연휴 때처럼 경전철을 연장 운행하지 않는 방안을 검토하고 있다. 과거 명절 연휴에는 이용객 편의를 위해 막차 시간을 40∼60분...,2021. 9. 2.
민락동맛집 미스터포보 하노이에서 먹었던 반세오 그대로 재현,추억여행하러 방문한 그곳 의정부 민락동 맛집 미스터 포보 입니다. 의정부 민락동맛집 미스터포보는 예스타워 1층에 있습니다 도로변에 있어서... 포보 경기 의정부시 오목로205번길 1 예스타워 1층 113호 ⏰11:00-21:30 (월요일 휴무) 주차 가능 #미스터포보 #민락동쌀국수 #민락동반세오 #의정부반세오...,2021. 7. 19.
차박용품대여 달달포유와 함께한 양주 일영계곡 감성카크닉,1박2일 차박 캠핑 용품 대여 달달포유 (의정부점) 경기 의정부시 신흥로208번길 34 B1 안녕하세요~ 이번 주말 친구와 양주 일영계곡으로 첫 차박... 차박 용품 대여는 먼저 달달포유 네이버 스마트 스토어로 예약한 후 여행 당일 픽업시간 맞춰서 달달포유 대여점으로 가면됩니다~ 차박 용품 대여...,2021. 8. 3.
애견까페 투어 [의정부 - 오시개],http://naver.me/F64uuTda 경기 의정부시 시민로121번길 54 들어오자마자 문을 열기전에 음료를 한잔 시켜아 합니다. 그래야 입장이 가능해요 음료의 가격은 대략 3~4천원대 입니다. 카운터와 화장실 옆에 간식을 판매합니다. 간식은 크기별로 다릅니다. 입구 오른편에는 아이들의 프로필도...,2020. 1. 14.
[의정부/의정부동] 매운집 곱도리탕,"어디갈지 고민하다가 현이가 제시한 곱도리탕집으로 출동 해외 다녀온 것도 아닌데 여행만 다녀오면 매운 게 땡기더라,, 매운집 경기 의정부시 평화로552번길 18 1층 매운집 입구는 이렇게 생겼다 간판은 따로 없고 입간판이 있당 내부는 이렇게 생겼어요 먹다 더울까봐 걱정했는데 에어컨 덕분에...",2021. 6. 7.
캠핑용밀키트 만두전골 일미만두 맛있는 캠핑전골,캠핑용밀키트 만두전골 일미만두 맛있는 캠핑전골 오랜만에 여행을 다녀왔어요. 이번 여행에서 바닷가 산책도 하고 캠핑도 하고 펜션도... 위치는 경기 의정부시 평화로 311 인데 관심 있다면 검색해 보셔요!! 만두 뿐만 아니라 육수가 너무 맛있어서 알아보니 40년 수제만두 장인의 노하우가 담긴...,2021. 8. 23.
스퀘어 토 스티치 뮬 샌들 / 밑창보강 잘하는 곳 / 슈케어샵 화요일 / 의정부신발수선 /,"이제 정말 여름인지 뮬, 슬리퍼, 샌들 류 보강을 많이 맡기시네요 고가의 뮬 등을 바닷가나 계곡에 신고 가시지는 않겠지만, 여행가셔서는... 주소 경기 의정부시 오목로196 제일풍경채센텀 2층95호 화요일 신발하는날 보내주실때 --> 선불이고 받으실때 --> 지원해드립니다 *꼭 성함과 연락처를...",2021. 6. 2.
센트럴 브릭 - 이누스바스 - 의정부 욕실 인테리어 - 경기북부및 서울북부 환영합니다-,도시를 여행하듯 친근하고 특별한 감성을 느낄 수 있습니다.. 1. 중앙오픈 슬라이딩장 중앙부가 오픈되어 있어 수납과 장식이 모두 가능한... 상담문의 : 031-853-3305 / ***-****-**** / ***-****-**** 오시는길 : 의정부시 민락동 804-8 ( 민락시티프라자 2층 ) 주차가능 .........................,2020. 1. 11.
부동산경매 왕초보에게 드리는 조언(2),"둘째 지역호재 지역에 있는 다세대(빌라)에 응찰자 수 몰린다 경기 의정부시 가능동 다세대(빌라) - 의정부 2020타경74456(출처 : 의정부 2020타경74456... 코로나로 인하여 당분간 해외여행을 가기 어렵다는 점과 밀폐된 공간을 피해 탁 트인 공간을 선호하는 요즘 사회분위기, 정부의 강력한...",2021. 7. 11.
[미리올리는 여행요약]경기도 내선순환,경기도내일주를 몇번이고 도전했으나 역시나 안성시가 워낙 무쓸모여서 그게 문제였네요. 그래서 이번에는 아예 작정하고 전환시외막차로... 일산동구~파주시~양주시~동두천시~의정부시~남양주시~구리시(경유)~서울특별시 광진구(경유)~서울특별시 강동구(경유)~광주시~용인시 처인구...,2020. 7. 6.
의정부 디저트 맛집 비스킷테이블,"비스킷테이블을 소개합니다 ㅎㅎ 비스킷테이블 일표의 기록노트 전화번호: 031-878-7020 주소: 경기 의정부시 평화로 508 영업시간: 화요일휴무... 일단 적어도 맛집이랑 여행, 상품리뷰는 꾸준히 할거 같아요 !! 어쨋든 제 글을 봐주시는 모든 분들께 감사의 말씀 드립니다 ㅎㅎ 함께 보면...",2021. 6. 29.
[위더스 컴퓨터] [WITHUS 대리점 탐방] 위더스 컴퓨터 의정부 금오점,동순이와 함께 하는 위더스 컴퓨터 여행 ‘동행’ 입니다. 안녕 여러분 ? 이제 진짜 여름이에요 ! 일교차가 크니까 감기 조심하시구요 ! 그럼... 위치 및 찾아가는 법 경기 의정부시 호국로1519번길 15 대중교통 이용시 [경기도청북부청사역 1번 출구 ➡️ 위더스 금오점] : 도보 10분 *주차공간은...,2021. 5. 26.
"2020년 9월 14일 생방송 투데이-먹킷리스트(아사도), 역전의 명샷(고속터미널역)...","먹킷리스트 – 아르헨티나 전통 바비큐, 아사도 편 ▶<바스트로 37> 주소 : 경기 광주시 오포읍 문형산길 58 번호 : ***-****-**** 메뉴 : 아르헨티나식 아사도 (하루 전 날 예약 필수) ▶<화사랑아사도> 주소 : 경기 의정부시 경의로 61 번호 : 031-836-7171 메뉴 : 한국식 아사도 (식사...",2020. 9. 14.
나의 댕댕이 동물병원은 펫인쥬 동물병원 추천해요!,"주말마다 아이랑 놀러가고 댕댕이 산책시키고 여행 다녀온다고 오늘 하루가 엄청 피곤할것 같은데 모두들 커피한잔하며 오늘 오후도... 추천합니다 업체명 : 펫인쥬동물메디컬센터 with 서정 업체주소 : 경기 의정부시 호국로 1336, 지하1층 & 2층 전화번호 : 031-851-0901 홈페이지주소 : http://naver.me/FHYumbux",2021. 6. 28.
[연장전] 의정부역 일식집- 연어덮밥/치즈카츠 완전 만족한 식당♡,연장전 주소: 경기 의정부시 호국로1298번길 63 1층 문의전화: 0507-1387-1755 영업시간: 매일 11:00 - 21:00 점심시간이라 손님이 계속 들어오셔서 매장내부... 오랜만에 의정부 시내 나와서 추억 여행도 하고 가네요♡ #의정부역일식 #의정부동맛집 #의정부중앙역맛집 #의정부연장전 #연장전 #의정부장어덮밥...,2021. 7. 9.
의정부 카페) 벨라스 (Bella's),의정부 망월사역 카페 벨라스 (Bella's) 경기 의정부시 평화로168번길 45 < OPEN 12PM ~ CLOSE 8PM > * 쿠키 12:30PM~ 나옵니다. ★ 그날 그날 오픈 및 쿠키 나오는... 마치 여행 온 느낌이랄까~ 안으로 들어가서 카운터 및 오픈 주방 앞에서 찍은 모습이에요~ 카페의 아늑한 느낌 여러분들도 와닿으시나요~ 바로 위...,2021. 7. 13.
"델타형 변이, 최근 일주일간 집단감염 4건 발생…국내 확산 우려","구체적으로 수도권 지인 모임12 관련, 경기 의정부시 음식점 관련, 경기 지인 모임 관련, 경기 가족 여행 관련 집단감염 등이다. 신규 집단감염 사례 관련 변이 확진자는 총 390명이다. 변이 확정 판정을 받은 82명과 역학적 연관성을 고려한 308명을 합한 수치다. 짐단감염 사례 1건 당 평균...",2021. 6. 28.
의정부 AR영어도서관 새 책 입고 소식,"애니와 잭이 우연한 매직트리하우스를 통해 공룡, 중세, 아마존, 우주까지 다양한 시공간으로 여행을 떠나는 이야기인데 한국 번역본으로도 큰... [네이버 지도] 비스타영어 경기 의정부시 청사로47번길 26 http://naver.me/5A8YYdn3 비스타영어학원은 금오동 의순초등학교 근처에 위치한 파크프라자...",2020. 11. 22.
2021년 8월 일상 기록중:),곳 (경기 의정부시 신흥로 240번길 21 6층) 프라이빗 한 공간으로 내부가 깔끔하고 위생적으로도 만족스러웠던 곳이었어요! 그리고 제일 좋았던 점은.... 너무너무 고마워ㅠㅠ 엉엉 제주도 갈 때 이쁘게 신으라고 여행 가기 전에 보내준다며 택배로 쏴준 우리 황쌜리!!!! 짱이야!!!!! 참고로 쌜리는...,2021. 8. 16.
"코로나19 국내 발생 및 예방접종 현황(3.9., 정례브리핑)","* (구분) 직원 69명(지표포함,+57), 직원의 가족 5명(지표포함,+1), 지인 2명(+1), 기타 1명 - (경기 의정부시 병원 관련) 3월 3일 첫 확진자... ○ 특히, 개학·봄철을 맞아 가족‧지인과의 여행·모임, 대학가 등 젊은층 중심의 다중이용시설 이용이 증가할 것으로 예상되어, - 마스크...",2021. 3. 9.
"5월 27일 생방송 투데이, 대구바닷가재, 신쉐프요리의신, 진남횟집","한국인의 메뉴 - 직장인이 즐겨 찾는 점심 메뉴 Top3 편 ▶ <신 쉐프 요리의신> 주소 : 경기 의정부시 태평로 67 번호 : 031-841-0339 두번째 식당은... 먹을 수 있는 곳인데 이번 생방송투데이는 물회 맛집으로 소개됐어요^^ 물회는 6만원부터 9만원까지 있어요! 전남 여행 가시는 분, 꼭 들러보세요^^",2021. 5. 27.
의정부중앙역 귀여운 카페 플리핑 아인슈페너 짱맛,안녕하세요 저는 이번주에 제주도 가족 여행을 갔다가 오늘 돌아왔습니다! 돌아오니까 #오늘일기 #블챌 이 다시 시작됬네요~~~~ 또 꾸준히 써보겠습니다!! 플리핑 경기 의정부시 호국로 1313 1층 영업시간 매일 11 : 00 ~ 22 : 00 031 - 825 -7787 제가 의정부중앙역 근처에서 학원을 다니고 있어요 어느 날...,2021. 5. 20.
100대 명산 어디가지? 서울 경기권 대중교통 뚜벅이 등산 코스,"2 서울 도봉구, 경기도 의정부시 호원동, 경기도 양주시 장흥면 관악산 632.2 서울 관악구ㆍ금천구, 경기도 안양시ㆍ과천시 천마산 810.3 경기도... 가벼움(경량성)에 초점을 맞춰 만들어진 신발입니다. 등산, 트래킹, 여행 및 일상까지 편안한 워킹을 제공합니다. ▼ 알타이기어 홈페이지 ▼",2021. 7. 27.
장암 파크프리베 서울근교 나들이 드라이브 갈만한곳,휴가 여행 온 것처럼 날은 덥지만 하늘도 예쁘고 풍경도 예뻐서 사진도 예뻤다 / 요즘 구름들이 설레게 하는구만요~ 하늘 보는게 너무 좋은 요즘... 고요한 곳 와서 힐링하고싶다면 추천해요 ;) 서울근교 갈만한곳 장암 파크프리베 서울근교 나들이 @파크프리베 경기 의정부시 동일로192번길 28-27...,2021. 7. 21.
"서울근교 의정부카페 - 오크힐커피, 카페아를",외국여행을 못가는 요즘~~ 살짝 외국 온 것 같은 느낌아닌 느낌~~ 따뜻하고 너무 예뻤던 공간 복잡한 서울근교에서 도심을 벗어나 자연을 느끼고 조용하니 힐링할 수있었던 시간이였습니다. 친구와..연인과..가족과.. 함께 가보세요~~ 영업시간 : 매일 10:00 - 22:00 연락처 : 031-877-3654 경기 의정부시...,2021. 5. 29.
의정부시 의정부동 인테리어필름 시공(수납장),안녕하세요 아지트 인테리어필름인사드립니다 어느덧 벌써휴가철이 다가왔어요~~~ 올해는 코로나 19와장마로 인해서 여행 떠나기 어려우시죠 ㅠㅠ... ^.^ 경기북부 인테리어필름 전문 아지트 인테리어필름 ***-****-**** 편하게 문의 주시면친절한 상담 도와드리겠습니다*^^*,2020. 8. 12.
의정부 가능동 맛집 :)) 경민대 근처 김치우동 먹으러가는 투다리 꼬치도 다 맛있네,투다리 안골점 #의정부맛집 #의정부가능동맛집 #투다리안골점 #투다리김치우동 #의정부존맛 #의정부가능동존맛 #경민대학교맛집 #경민대학교부근맛집 투다리 안골점 위치 경기 의정부시 가능동 697-39 1층 영업시간 16:00 ~ 02:00 주차 대중교통 추천 [위치] [입구] 의정부 가능동에 위치한 투다리...,2021. 6. 10.
"가죽소파의 모든것, 이쁜 인테리어의 시작 이태리 통가죽쇼파 <알린> 배송후기","날씨가 미치도록 더운 날씨 속에 코로나로 여행도 떠나기 쉽지 않은 요즘 말도 많고 탈도 많던 도쿄 올림픽이 정상적으로 개막해서 현재... https://blog.naver.com/js6497a/222144113497 "" "" 경기 의정부시에 거주 중인 저희 베르시아의 소중한 고객님께서 이번에 천연통가죽 4인용 소파 알린을 구매해...",2021. 7. 27.
금오동 마사지 '넘버원풋샵'진짜 시원해요,"의정부 마사지 금오동 넘버원풋샵 경기 의정부시 청사로 41 302호 건물지하주차장 주차가능 이웃님들, 저번주말에 늦잠자고 일어나서 남편이랑 마사지 다녀왔는데요. 진짜 시원하고 넘 좋았던 곳이에요. 금오동 마사지 넘버원 풋샵 가격표에요, 특수발관리 뿐만 아니라 스포츠 관리도 있고 아로마...",2021. 6. 15.
의정부가재울도서관 7월이야기,"꿈꾸는 여행, 회벽시네마 모습까지 가재울도서관 소식을 알려드립니다. 가재울도서관은 의정부시 평화로 633 가능역 3번 출구에... 추선 도서는 「캠핑장 생태 도감」 조영권, 「피크닉」 최가을, 「밥보다 등산」 손민규, 「자연학습장 서울경기편」 조영권, 「숲 읽어주는 남자」...",2021. 7. 19.
"제87권 - 백헌석, 최혜림 <냉면열전 2/2> 팔도 냉면 유랑기",* 의정부 평양면옥 : 경기도 의정부시 의정부 3동 26-14 (경기도 의정부시 평화로 439번 길 7) 385 031-877-2282 * 을지면옥 : 서울특별시 중구 입정동 177-0 (서울특별시 중구 충무로 72-1) 02-2266-7052 * 필동면옥 : 서울특별시 중구 필동 3가 1-5 (서울특별시 중구 서애로 26) 02-2266-2611 남포면옥 여름이나...,2021. 8. 31.
"(민락동맛집) 우리동네에서 맛보는 뉴욕스타일 피자맛집 ""21뉴욕피자""",해외여행 온듯한 느낌이 드네요~ 감성있는 네온 불빛으로 분위기 업!! 부엌도 한눈에 훤히 다 보였어요. 여기 사장님께서 정말... 모두들 즐거운 저녁시간 되세요^^ 뉴욕스타일 21뉴욕피자 21뉴욕피자 경기 의정부시 오목로 196 1층 91호 매일11:30 ~ 22:00 브레이크타임 15:00 ~ 17:00 (주말제외) 마지막주문...,2021. 6. 3.
의정부문화재단 아트캠프에서 문화행사가 진행됩니다,경기도와 의정부시에서는 다양한 공연과 체험을 통해 경기북부 시민들의 문화예술 향유와 활동에 기여하는데 그 목적을 두는 경기도 문화의... 되었던 '여행스케치'의 아름다운 음악세계를 무한상상 아트켐프에서 만나볼 수 있는 기회가 될 것입니다. 출연진 : 창작국악그룹 동화...,2020. 11. 17.
"서울 근교 가볼만한 카페, 의정부 카페 아를",아를은 프랑스의 아를에 온것같은 기분을 낼수 있는 예쁜 카페예요 코로나로 해외여행 못간지 벌써 2년이 다되어 가는데요ㅠ 쁘띠여행 기분 느끼기에 좋은 카페랍니다ㅋㅋㅋ 주소 : 경기 의정부시 동일로 204 카페 아를 7호선 장암역에서 가깝구 짧게 드라이브 즐기기에도 좋은 거리여서 저는 차를...,2021. 5. 14.
서울 근교 대형 카페 - 9,"위치 경기 의정부시 호원동 385-1 운영시간 매일 10:00 - 22:00 (주문마감 21:30) 메뉴 및 가격 아메리카노 4,600원 초코릿라떼 4,800원 쿠앤크 프라페 5... 서울 근교에 있지만 주변에 산과 나무, 넓은 잔디밭으로 되어있어서 멀리 여행 온 것 같은 느낌을 주는 곳입니다. 산책로와 벤치도 시설이 잘...",2021. 6. 4.
의정부민락동맛집 나는 자연닭이다 .민락애견동반식당,어제는 아이들이 좋아하는 치킨집에 갔어요 진짜 오랜만에 치킨을 식당에 가서 먹었답니다 나는 자연닭이다 민락점 경기 의정부시 오목로225번길... 야채튀김으로 변경 가능해요 네식구 오랫만에 (작년 여름 경주여행이후) 식당서 먹네요 사이다 짠 ㅎ 신선한 국내산 닭을 사용하시는지 닭냄새도...,2021. 4. 29.
"국립공원 스탬프 투어 운영정보! 여권 추가배부, 인증방법, 할인가맹점 등","배포기간 : 2021년 10월 1일 ~ 소진 시까지 스탬프투어 이용방법 국립공원 여권 여행 운영물품(여권, 스탬프, 잉크패드) / 공원별 방문도장... 원도봉탐방지원센터 경기 의정부시 망월로 28번길 205 83 회룡탐방지원센터 경기 의정부시 전좌로 155번길 82 84 오봉탐방지원센터 경기...",2021. 2. 28.
의정부 민락신도시 카페 커피 & 베이커피 빵공장 마이야르 낙양점,의정부 민락동 카페 마이야르 아주 가끔 멀리 가지 않고 여행 기분 느끼고 싶을 때 오면 참 좋을 것 같아요. ' 마이야르는 의정부 낙양점... 마이야르 낙양점(민락신도시) 0507-1421-7558 경기 의정부시 민락로445번길 22 매일 10:00 - 22:00 & & #내돈내산 #의정부카페 #의정부맛집 #의정부베이커리 #민락카페...,2021. 4. 19.
"[의정부호텔, 의정부모텔] 깔끔한 호텔스타에서 호캉스 즐기기!","#의정부호텔 #의정부모텔 #망월사역숙박 호텔스타 주소: 경기 의정부시 평화로190번길 28 전화: 031-873-0080 체크인/체크아웃: 15:00 ~ 익일 13:00 까지... 욕조가 큰 편이라 여행의 피로를 풀기에 좋았어요. 변기는 비데가 설치되어 있어서 편리했구요. 여분의 수건들이랑 화장지도 있었어요. 샴푸, 린스...",2021. 6. 17.
"의정부 더화인 호텔, 방문후기!",이번엔 친구와 함께 의정부 더화인 호텔을 방문해봤는데요ㅎㅎ 저희는 다음날 광주&담양 여행 일정이 있어서 계획 짜다가 저녁에... modoo.at 앗 그리구 의정부 더화인 호텔은 홈페이지에서도 실시간 예약이 가능하다고 하네요~ 주소 : 경기 의정부시 호국로1298번길 39-6 전화번호 : 0507-1346-9956,2021. 4. 13.
내돈내산) 달달포유에서 감성차박용품 대여했어요♥,"그중에서도, 이번 여행에서 갬성사진들의 일등공신ㅠㅠ 차박용품들을 대여한 [달달포유]를 포스팅해볼게요. 주소 경기 의정부시 신흥로208번길 34 B1 영업시간 매일 10:00 ~ 19:00 전화번호 050713729848 차박 용품점을 굉장히 많이 알아봤는데, 제 나름 선택한 기준은 1. 우드&베이지 톤의 소품들 2....",2021. 6. 4.
