header,contents,date
"[양주] 양주 넓은 정원 베이커리 대형 카페 버터우드 (포토존, 메뉴, 가격)",버터우드 경기 양주시 부흥로 1373-41 매일 10:00 - 20:00 (연중무휴) 차를 가져가면 좋지만 뚜벅이분들도 양주역에서 버스도 한번에 가고 가까워서 충분히 가실 수 있어요. 택시 타게 되서더라도 10분 이내로 도착하실 수 있답니다 ~! 걷는 동안에도 날씨가 너무 좋아서 하늘 찍기! 여행 갈 때 날씨가...,2021. 3. 21.
"파주 마장호수 카페, 양주 오랑주리","파주 마장호수 카페 오랑주리 전화 : 0507-1326-0615 주소 : 경기도 양주시 백석읍 기산로 423-19 영업시간 : 매일 11:00~21:00 가격 : 아메리카노 8... 출렁다리를 배경으로 사진을 멋지게 찍을 수 있는 포토존도 마련되어 있어서, 카페만 다녀오고도 충분히 여행 느낌 만끽할 수 있어요. 3. 레드브릿지...",2021. 6. 5.
양주 한우 맛있는 소고기 강경 우도집 양주본점,"설렁탕과 함께 먹는 고기 , 육회비빔냉면으로 함께 먹음이 이리 기분이 좋을까~ ㅎㅎ 가족들과 함께 외식하기에도 좋은거 같고, 여행와서 한끼... 경기 양주시 부흥로 1810번길 31 월요일 휴무이니 알아두시구요. 공기 좋은곳에 단독 건물로 되어 있어서 더 좋았네요~~",2021. 2. 18.
"양주, 선녀와 나무꾼 캠핑장 글램핑 & 카라반",http://yjcamp.eduvill.kr/ 지번 주소 - 경기 양주시 덕계동 540 1501번길 90 오늘도 개미 일상 포스팅으로 좋은 정보가 되셨다면 공감과 댓글 부탁드릴게요♡ 내돈내산후기입니다:) #의정부 #양주 #양주캠핑장 #양주글램핑 #양주카라반 #글램핑추천 #카라반추천 #카라반여행 #글램핑여행 #양주가볼만한곳...,2021. 5. 6.
<오랜만에 코로나 안심 나들이 다녀왔어요~/서울근교맛집/ 양주캠핑식당>,^^ 하지만 날씨는 봄봄하는데 막상 어딜 떠나려면 다시 심각해지는 코로나때문에 저희 가족은 지난달 계획했던 여행까지 취소하고 집콕만 하며... <경기도 양주 맛집 강경 숯불 바베큐 양주점> 경기 양주시 광적면 삼일로 123-74 강경숯불바베큐 양주점 0507-1393-5889 영업시간 12:00~22:00 (매주 월요일 휴무)...,2021. 4. 18.
포천 가볼만한곳 포천여행 2탄 : 천보산자연휴양림,포천여행 1탄 포천카페 나목에 이어 포천여행 2탄 천보산자연휴양림! :) 천보산은 해발 423m로 하늘 밑 보배로운 산을 뜻하며 포천시와 양주시의... 포천여행 - 천보산자연휴양림 경기 포천시 원동교길 309 화요일 휴무!!!!! 임신27주차 천보산 산림욕태교 자연휴양림 포천여행 지정 면적은 1.16㎢이며...,2021. 6. 30.
[경기] 파주 당일치기 가볼만한 곳 마장호수,"연휴가 낀 주말이라 더 멀리 여행을 갔을거라 생각했는데.. 오늘도 여전히 만차인 주차장이 많다. 하지만, 우리 가족은 늘 주차하는 공간이 있지... 마장호수가 양주시인가? 마장호수가 나는 지금까지 파주시인줄 알았는데, 양주시인가? 아직도 의문. 해답은 누군가가 알려주세요!!!! 아...",2021. 8. 18.
[경기도 여행]양주 해일농장오토캠핑장,해일농장오토캠핑장 : 경기 양주시 장흥면 일영로 740번길 104-29 #양주 #장흥 #해일농장오토캠핑장 #펜션 #1박2일 #바베큐 #캠핑 #불멍 #장작 #캠프파이어,2020. 11. 28.
서울 근교 대형 카페 - 9,"위치 경기 양주시 백석읍 권율로 909 운영시간 평일 11:00 - 19:00 주말 10:00 - 20:00 메뉴 및 가격 아메리카노 5,500원 카페라떼 6,000원 카페모카 6... 서울 근교에 있지만 주변에 산과 나무, 넓은 잔디밭으로 되어있어서 멀리 여행 온 것 같은 느낌을 주는 곳입니다. 산책로와 벤치도 시설이 잘...",2021. 6. 4.
"식객 허영만의 백반기행 양주 장흥의 밥상 송추 꿩냉면 닭고기무침 손만두, 자연산버섯...",유원지의 훈제 베이컨과 삼겹살 바베큐 노고산로뎀나무팬션은 위치 정보로 남겨두고 마무리~ 부일기사식당 경기 양주시 장흥면 호국로 557-2(부곡리 540-35) 031-826-4108 노고산로뎀나무펜션 경기 양주시 장흥면 유원지로 83 (삼상리 146-7) 031-855-9121 백반기행 양주 장흥 편에 소개될 5곳을 묶어보면 이렇게~,2020. 5. 29.
서울근교카페 양주예쁜카페 Moregreeeen,프랑스 베이커리 전문 파티쉐가 있는 양주예쁜카페 모어그린 2년만에 당일치기 여행을 다녀온 서울근교카페 이야기. 엄마와 조카들 데리고 양주... 모어그린 ▶ 주소) 경기 양주시 장흥면 권율로 246 ▶ 영업시간) 매일 10:30~22:00 ▶ 주차 / 발레파킹 ▶ 네이버페이 & 제로페이 가맹점 ▶ 대표메뉴)...,2021. 5. 20.
중증장애인 24시간 돌봄서비스! 안심하고 이용하세요. '장애인 365쉼터’ 확대 운영,"보호자의 여행 등 긴급입소 사유 제외 ※ 시·군별(시설 당) 기준 적용 가능 1회 당 00일 이내 지원서비스 구분 서비스 내용 일시보호... 진등로 11번길 9 031-829-8293 양주시 행복한복지원 경기도 양주시 백석읍 부흥로 397번길 21 나동 031-826-3691 장애인 365쉼터, 장애인을 위해 활짝 열려있습니다",2021. 1. 13.
서울근교 애견동반식당 양주 야외 바베큐맛집 캠핑5492,놀러가야겠쥬~?◡̈ 하지만 코시국에 맘놓고 멀리 여행은 못가니 가까운 서울 근교로 드라이브겸 우리 댕댕이들 데리구 애견동반식당에 다녀왔어요 양주시 장흥쪽 벚꽃길~ 우리 댕댕이 벚꽃구경중 오늘은 서울에서 가까운 경기도 양주쪽으로 드라이브를 나왔어요! 햇살도 좋고~ 미세먼지도 없고...,2021. 4. 11.
김영철의 동네 한 바퀴(108회)촬영지 양주 신암저수지 가래비시장 곰탕 봉암마을...,가까운듯 먼듯 느껴지는 양주 오늘은 오랫만에 양주여행을 할수 있을것 같아서 기대가 됩니다. 신암저수지&송어낚시 경기 양주시 남면 신암리 차타고 지나가면서 신암저수지를 많이 보았는데 방송으로 보는 신암저수지 너무 반가울것 같아요. 겨울이되면 저수지가 꽁꽁 얼어서 아이들의...,2021. 2. 6.
코로나 확진자 동선 (21/8/6),8.) 수도권 지인가족 여행모임 관련 송파구 소재 직장 관련('21.8.) 관악구 소재 고시원 관련 경기 수원시 전자회사 관련 동작구 소재 시장... 경기서부기업/운동시설관련 경기양주시헬스장/어학원관련 경기하남시육류가공업관련 경기수원시영통구전자회사관련...,2021. 8. 9.
<현대엘리베이터 사보-현대엘리베이터> 문화칼럼-포스트 코로나 시대의 ‘슬기로운 연말...,"홈페이지: live.naver.com 추천 자동차극장 Information 장흥자동차극장 주소: 경기도 양주시 장흥면 권율로 112 홈페이지: driveinmovie.co.kr 문의전화: 031-855-6050 잠실자동차극장 주소: 서울특별시 송파구 잠실동 1168-1 홈페이지: jamsilmovie.com 문의전화: 02-3431-0450 안전한 연말 여행, 어렵지 않아요!...",2021. 7. 5.
온ㆍ오프라인으로 보드게임지도사과정 수강생님들과 즐기는보드게임,다하며10분도 낭비하지 않는 나는 보스승화쌤이지요 궁금할 땐 네이버 톡톡하세요! #동두천시평생학습교육원 보드게임강사 #양주시보드게임강사 #경기북부 #보드게임대표강사 #굿브레인창의교육원 #행복한바오밥 #창의융합수학지도사 #보드게임지도사 #동두천양주교육지원청 #학부모교육봉사지원단,2021. 9. 17.
양주 카페 버터우드 넓은 정원이 있는 숲 속 베이커리 (애견동반가능),양주 카페 버터우드 경기 양주시 부흥로 1373-41 매일 10:00 ~ 20:00 연중무휴 주차장 O 애견동반 O 오랜만에 평일에 삼둥이랑 카페투어:-) 양주 카페 버터우드에 다녀왔어요! 일단 입구부터 빵냄새 죽어요.. 베이커리가 종류별로 다양하게 있어요. 음료 메뉴는 다양하진 않고 베이커리류와 잘어울리는...,2021. 4. 17.
국내산 한우육회를 저렴하게~ 즐겨보세요.,"가까운 곳 여행갈 때 포장해가기 좋을 것 같아요. 따뜻한 계절이 왔으니 캠핑러들에게 이보다 기쁜 소식이 있을까요? 캠핑장도착해서 짐풀고, 지쳐있을 때 따로 요리하지 않아도 되는 신선한 육회먹고 기운내 보세요~ 주소 : 경기 양주시 칠봉산로168번길 290 예약문의 : 0504-2016-1489 / ***-****-****",2021. 3. 22.
양주 추천 관광지 '청암민속박물관' 추억의 물건들 다 모였네~,"옛 추억 속 물건들과 시대를 재현한 장소들이 있는 시간 여행 박물관입니다^^ 청암민속박물관 * 위치 * 경기 양주시 장흥면 권율로 83-5 (장흥유원지 입구에서 예뫼골 방향으로 800m 거리) * 운영 시간 * 매일 10:00 ~ 18:00 (1,3,4 월요일 휴무) * 입장료 * 청소년, 어른 - 5,000 어린이(3세 이상) -3,000 * 주차...",2021. 2. 15.
의정부맛집 양주 야외식당 분위기좋아요 캠핑5492,캠핑5492 경기 양주시 양주산성로 127 영업시간 12:00 ~ 23:00 화요일 휴무 반려동물 동반 가능 날이 좋아 실내에서는 머무르기 아까워 야외식당으로... 멀리 여행 온 기분을 낼 수 있어 정말 행복했어요 노릇노릇 맛있게 구워진 고기들을 야외에서 먹으려니 군침이 더 돌더라구요! 김치찌개부터 새우...,2021. 5. 11.
"[서울근교/양주] 가족 나들이하기 좋은 곳 캠핑5492, 이 맛에 캠핑하는구나~",20210505 태어난 지 2522일째♡ 우리 둥이들의 8살 어린이날 5월 5일 어린이날부터 일요일까지 쭈욱~ 단기방학 코로나라 어디 여행 가지도 못하고... 주소: 경기 양주시 양주산성로 127 전화번호: 031-846-5492 영업시간: 매일 12:00 - 23:00 (매주 화요일 휴무) 캠핑의자 테이블도 있고 텐트도 있고...,2021. 5. 9.
양주옥정호텔 - 노래방이 있는 호텔❓ 분위기 최고다!,"얼마 전, 부모님 결혼기념일을 맞이해서 가족끼리 짧은 여행을 다녀왔어요 양주 ~ 포천 근처로 계획 후 근처 괜찮은 호텔에서 1박 하기로... 주소: 경기 양주시 옥정동로7다길 88 선양타워 4, 5층 매장번호: 0507-1392-9603 예약방법: 네이버 예약 or 야놀자 가능 호텔 이름이 •이쁘다 호텔•인데, 정말...",2021. 5. 27.
"경기도 양주 당일치기 여행 - 필룩스 조명박물관, 온릉, 장욱진 시립미술관...","또한, 어린이들의 눈높이에 맞춰진 테마공간들도 있으니 아이들과 함께한 여행 코스로 안성맞춤! 주소 : 경기 양주시 광적면 광적로 235-48 문의 : 070-7780-8911 운영시간 : 매일 10:00 ~ 17:00 (입장 16시 마감) 휴관일 : 신정(1.1~1.3), 설날 연휴(1.24~1.28), 추석 연휴, 필룩스 창립기념일(6.20) 휴관...",2021. 1. 20.
양주 가나아트파크_ 아이와 가기 좋은 곳,"경기 양주시 장흥면 권율로 117 주차 무료 10:30 - 18:00 (17시 입장마감, 월요일 휴무) 개인 어른 (20세 이상) 8,000원 청소년 (14-19세)학생증지참 7,000원... 신남을 온몸으로 표현하는 중 ㅋㅋㅋ 가나어린이미술관에서는 <교과서 속 그림여행>이라는 주제로 작품들이 전시되어 있었어요. 교과서 속...",2021. 2. 12.
"서울 근교 계곡 ""경기도 장흥 그랜드 유원지 ""","취사 가능 2. 애견 동반 가능 3. 텐트 설치 가능 (치는 장소 많음) 4. 깊은쪽이 아니라 얕은물이 대부분이라 아이들이 놀기 좋아요 ✔️입장료 아동: 5000원 어른: 7000원 (현장에서 현금결제, 계좌이체) ✔️운영시간 오전 09시~오후 06시 ✔️위치 경기 양주시 장흥면 호국로 332",2021. 7. 26.
지역별 자동차극장 추천 및 소개! - ① 경기권,"장흥 자동차극장 사진출처: 카카오맵 평가, 네이버 거리뷰 위치: 경기 양주시 장흥면 권율로 120 요금: 1대 당 2만원 (국가유공자, 장애인: 1만... 위치: 경기도 양평군 양평읍 경강로 1704 요금: 1대 당 20,000원 전화번호: 031-773-7893 홈페이지: 양평자동차극장 (ypdit.co.kr) 특징: 국내여행 성지...",2021. 4. 18.
2021년 9월 27일 HOT50 치매 관련 뉴스,mc=ST&year=2021&no=917171 박막례는 133만명의 구독자를 가진 '할머니 유튜버'로 2017년 치매 위험 진단을 받고 손녀 제안으로 호주로 ‘치매 예방’ 여행을 떠난 뒤 해당 영상을 유튜브에 올린 것이 인기를 끌며 손녀와 함께 전업 유튜버가 됐다. 한편... [봄날] BGF리테일 X...,2021. 9. 27.
서울 근교 나들이 하기 좋은 캠핑장 TOP 10 (1),폭발적 조회수를 기록하고 캠핑 관련 유튜브 채널들을 보면 캠핑이 최신 여행 트렌드로 떠오르고 있음을 알 수 있습니다. 캠핑 인기가 이렇게... 주소: 경기 양주시 장흥면 석현리 400-6 (자가용 이용 시 서울역에서 약 1시간) ○ 이용 문의: 031-828-9881 양주 미술관 옆 캠핑장 주변 가볼 만한 곳...,2021. 4. 14.
옥정) 양주 힐 동물의료센터,야간 : 경기 양주시 옥정동로7길 30 2층 201~203호 근데 왠걸 오픈이벤트로 '위생미용' '기본건강검진'을 무료로 하고있길래 겸사겸사 들려봤답니다!!... 종종 여행을 갈때 호텔에 맡기곤하지만 보통은 일단위로 계산을 하기때문에 아침에 데리러가도 돈이 많이들고 부담도 됐는데 여기는 24시간 12시간...,2021. 3. 28.
양주 만송 카페 올드릿지 영국 프랑스 감성 신상 카페 오픈!,"영국에서 직수입했다는 가구들 탓인지 5년 전 1주일 정도 여행했던 런던이 그리워졌다. 화장실 화장실은 2층 계단 옆에 있다. 실외공간 높고 넓은... 유럽 가구들로 채워진 1층 야외공간 [주소] 경기 양주시 송랑로89번길 53-51, 2층 [영업시간] 매일 10:00~22:00 (일요일 휴무)",2020. 11. 12.
고읍동 카페 양주 고읍 | 올드릿지,"올드릿지 메뉴 : 퀸즈 햇 (The Queen's Hat) 6,500원 / 피쉬 앤 칩스 (Fish & chips) 12,900원 주소 : 경기 양주시 송랑로89번길 53-51 1층 2층 올드릿지 전화 : 031-856... 영국여행 온 것 같은 기분이 들어서 요즘 같이 해외여행도 못가는 시기에 방문하기 딱 좋은 양주 고읍동 카페라는 생각이 들었네요. ""위 포스팅은...",2021. 5. 24.
Weekly Logistics News Letter Vol.550(9/18),"29분…여행·물류 '게임체인저' 우주산업서 미래 찾아야"" 우주선 로켓을 항공 운송에 활용할 경우 영국 런던에서 미국 뉴욕까지 29분 만에... ""아마존 물류센터가 위치한 곳은 조직폭력배와 마약상들 ○ 경기 양주 장난감 물류창고서 불…큰 불길 잡아 오늘 오전 11시 40분쯤 경기 양주시...",2021. 9. 18.
경기지역화폐 카드 사용처 기준 및 잔액조회 방법 알아보기,"경기지역화폐 카드는 수원시, 고양시, 용인시, 부천시, 화성시에서 사용이 가능합니다. 또한 안산시, 남양주시, 안양시, 평택시, 파주시, 의정부시... 경기지역화폐 카드 사용처 기준 알아보기 경기지역 통화는 경기도내 연매출 10억원 이하의 소상공인 점포에서 사용 가능합니다 숙박, 여행, 의류...",2021. 7. 8.
경기 양주 불곡산(2014.2.12)---(1),"지난 서울 불암산 등산시 약속했던대로 오늘은 경기도 양주시에 있는 불곡산에 장용문,서재원 사장님과 함께 했다. 차를 하나 놓지는 바람에 나만... 오늘도 즐거운 인생여행의 추억의 한 페이지를 만들었다. 우린 빨간 선이 아니고 오르는 곳은 양주시청 부터 올라가 능선을 탄 후 대교아파트로...",2021. 7. 18.
경기도 장흥 청암민속박물관 ~ 옛날물건 진짜 가득! 체코 굴뚝빵 먹방,친정엄마생신 맞이 여행지로 어디가 좋을까 고민하다가 경기도 장흥으로 선택했어요. 서울에서 한시간 거리인데 계곡도 있고 체험거리 볼거리도 다양해서 경기도 양주시 장흥은 늘 만족100% 랍니다. 11살 케빈과 할머니 모두 만족할 만 한 나들이 코스 !! 해피케빈맘의 이번 1박2일 코스...,2021. 6. 22.
양주 베이커리카페 분위기 좋은 제로니모 커피하우스,"열심히 올라가는 울 꼬마 ㅋㅋㅋ 시국때문에 여행도 잘 못가고 나들이도 잘 못갔는데 카페투어하면서 한(?)을 푸네요 ㅋㅋㅋ 계단을 다 올라가면... 경기 양주시 화합로1597번길 3 (회암동) 제로니모 커피하우스 영업시간 : 10:00-22:00 (식사 L.O - 20:30, 음료 L.O - 21:00) #양주베이커리카페 #양주브런치카페...",2021. 5. 10.
경기도 카페 가볼 만한 곳 :)) 아이와 가기 좋은 곳 애견 동반 양주 식물원 카페 오랑주리,위치 경기 양주시 백석읍 기산로 423-19 영업시간 매일 11:00 - 21:00 주차 전용 주차장 [위치] [입구] 양주에 위치한 식물원 카페 오랑주리 방문했어요 마장호수 출렁다리 근처에 위치한 운치 좋은 카페에요 카페 바로 앞에 강이 있어 산책로에서 산책하기도 좋을 것 같아요 입구에서부터 나 식물원...,2021. 4. 19.
양주 오랑주리(Orangerie) : 식물원 카페,오랑주리 경기 양주시 백석읍 기산로 423-19 양주의 오랑주리 카페! 서울 근교로 나가 마장호수 근처 드라이브 하다 들리기 딱 좋당!! ‘오랑주리’... 식물원 구경 겸 카페방문이라고 생각하면 된당 코로나 때문에 여행 못가서 슬프지만 야자수 보면서 기분이라도 냈다. 2층에 앉아 내려다보니...,2021. 2. 2.
"양주 최대규모 베이커리 카페 < 버터우드 >, 만족스러웠던 메뉴추천 / 양주 신상 핫플...",양주핫플 #양주신상카페 #신상카페 #경기북부여행 #양주가볼만한곳 #양주데이트 #데이트코스 #분위기좋은카페 #감성카페 #양주대형카페 #양주대규모카페 #양주감성카페 #양주분위기좋은곳 #대형카페 #분위기좋은곳 #피넛버터 #피넛버터쉐이크 #아이스티 #맛집 #맛집투어 #카페투어 #마늘빵...,2021. 1. 27.
양주 장흥유원지 펜션 여울목펜션 후기,"양주 여울목펜션 경기 양주시 장흥면 권율로309번길 67-13 ***-****-**** http://장흥여울목.com 2인실부터 10인실까지 8개 객실 바베큐장, 야외수영장... 처음 도착했을 때보다 차가 늘었다 아마 주차는 여유있게 가능할 것 같다~ 아 진짜 마지막으로 이용수칙 사진! 올리고 오늘의 후기 끝~ 즐거운 여행 하세요!!",2021. 5. 11.
송추 진흥관 중화요리 맛집 (의정부 송추 짬뽕 맛집),"데이트 코스 나 가족 여행에도 좋을 것입니다. 이어 가게 정보 알려드립니다. 진흥관 번호 : 031-826-4077 진흥관 주소 : 경기 양주시 장훈 명 호국로 550 진흥관 지번 : 지번 우루데리 390-2 진흥관 영업 시간 : 매일 10 : 30 ~ 21 : 00 (라스트 오더 20:29) 마지막으로, 진흥관 맞은 편에 위치한 맥 상자 음식...",2021. 5. 27.
양주 가볼만한곳 독바위 등산 | 옥정동 산책,양주 가볼만한곳 독바위 등산 | 옥정동 산책 ▪️경기 양주시 옥정동 889 안녕하세요. 하얀이에요. 오늘은 양주 가볼만한곳 옥정동 산책하기 좋은... 즐거운 시간 보내세용 :) ▪️유튜브 여행만랩 의정부 토박이가 알려주는 가볼만한 모든 곳 의정부 & 양주 동네투어,2021. 2. 19.
"경기도양주 맛집,장흥맛집, 이집이좋겠네","저기는 정말 무조건 사람없을때 평일낮에가주세용,, 분위기굿 ㅠㅠㅠㅠㅠㅠㅠ 매일 9:00-21:00 단체석, 주차, 예약, 반려동물 동반가능 주소 경기 양주시 장흥면 권율로 253 이집이좋겠네 본점 #장흥맛집 #양주맛집 #맛집 #이집이좋겠네 #백숙 #계곡맛집 #계곡 #먹방 #일상 #여행 #드라이브",2021. 2. 19.
"전국 애견,애완견(반려견) 동반 캠핑장 리스트",말을 바꾸면 반려견을 키우는 인구가 천만이란 뜻이죠...^^ 가족처럼 여기는 반려견과 함께 떠나는 여행은 세상을 더 아름답게... ***-****-****) ★ 경기 양주시 은현면 양연로182번길 20-140 (그린빌 애견캠핑장 ***-****-****) ★ 경기 양주시 백석읍 권율로 848 (글램핑코리아...,2020. 10. 7.
경기도 장흥 이색카페 브라스 ~ 목공 원데이클래스 도마만들기 체험 ! 나무로 된 모든...,브라스 양주 도마 만들 수 있는 목공카페 전화 : 0507-1345-7013 주소 : 경기 양주시 백석읍 권율로1203번길 8-20 지번 : 경기 양주시 백석읍 홍죽리 962-2... 이렇게 예쁜 포토존도 있어서 사진남겼지용 ~ 케빈군 빨리 캐리어끌고 여행가고 싶다네요. 우드 스푼 요리주걱 나이프도 쫙 걸려있고 나무로 된...,2021. 7. 7.
"경기옛길 의주길 제3길 쌍미륵길, 제4길 파주고을길-파주향교와 봉서산에서 파주의...","옛 의주대로는 지금의 78번 도로를 따라 줄곧 이어지지만 아쉽게도 도보여행에는 적합하지 않기 때문에, 의주길은 지금처럼 숲길을 따라 잇게... 행정구역은 경기도 파주시 및 양주시 등 2시, 4읍, 3면을 포함한다. 광탄천(廣灘川)·문산개·너븐여울이라고도 한다. 문산천은 광탄면 영장리를...",2021. 2. 14.
"[양주 벚꽃명소] 테라스 카페 여로 + 별산대마당 + 관아지, 서울근교 드라이브 코스...",방문하실 분들은 포토존 찾아보셔도 좋을 것 같아요:-) 경기도 양주 벚꽂여행 명소 2 양주별산대놀이마당 + 양주관아지 붙어있어요:-) 경기 양주시 부흥로1399번길 15 양주관아지 매일 09:00 - 17:00 입장시간 매일 09:00 - 18:00 관람시간 해가 지기 전에 서둘러 찾은 다음 벚꽃명소는 양주...,2021. 4. 13.
"국내에서 갈 수 있는 힐링 온실카페-서울,경기 근교에서 자연을 느껴요","저처럼 코로나로 멀리 여행 가지 못하는 상황에 다들 어디 좋은 곳 없을까하고 고민하실텐데요 서울,경기 도심지역에서는 고층건물과... 경기도 양주시 백석읍 기산로 423-19 / T. 0507-1326-0615 카페안에 있는 암석들과 식물들이 마치 외국의 섬에 와있는 것 같은 곳이 이 자체로...",2020. 7. 20.
2020년도 국내여행안내사 시험 (관광자원해설) 17번 : 국립공원의 지정 순서,"종로구, 경기 고양.양주시 1983년 4월 (16) 치악산: 강원 원주시, 횡성군 1984년 12월 (17) 월악산: 충북 제천.충주시, 경북 문경시 1984년 12월 (18) 소백산: 충북 단양군, 경북 영주시 1987년 12월 (19) 변산반도: 전북 부안군 1988년 6월 (다기능 공원: 산악・해상) (20) 월출산: 전남 강진....",2021. 1. 28.
"파주 마장호수 맛집, 레이크스토어] 캠핑장 분위기 물씬 야외 바베큐",서울근교여행으로는 너무너무 좋은거같아요. 친구가 특별히 예약을 해서 파주 마장호수 맛집인 레이크스토어라는 곳에 다녀왔는데요. 완전 캠핑장 느낌이 물씬나는 곳이라 개인적으로 너무 좋더라구요. #내돈내산 <레이크스토어> 전화번호: ***-****-**** 주소: 경기 양주시 백석읍 기산로 409 2층...,2021. 4. 30.
대전비디오테이프변환 /정직한 변환 확실한 개당가격으로 변환 소중한추억으로 여행...,경북/경남/제주/창원/금산/천안/서울/경기/전북/전남/세종/강원/부산/울산/공주/청주/나주/전주/영주/구미/수원/영등포/상주/예천 /안동/안동시... 시흥/군포/의왕/하남/용인/용인/처인구/수지구/파주시/이천시/안성시/김포시/화성시 /광주시/양주시/포천시/여주시/연천군/가평군/양평군...,2021. 9. 25.
[양주옥정신도시맛집] 새마을식당,"새마을식당 옥정신도시점 경기 양주시 옥정동로7다길 94 국제프라자 105,106호 매일 10:00-04:00 매주 화요일 10:00-24:00 네이버 안녕하세요~ 몇일 이것저것 하고 배달도 시켜먹고 친구카페에서 테라스 파티도 했어요^^ 제주도 여행 계획 짜는데 아빠가 와서 커피 쏴주시고 딸내미 얼굴 보겠다고 카페 온...",2020. 9. 21.
평화누리길 걸으며 랜선으로 만나는 국내 가을여행지! 군남댐과 한탄강댐 방문기,"경기도 내에는 김포-고양-파주-연천 4개의 시, 군을 잇는 국내 도보여행길인 “경기도 평화누리길” 이 있는데요, 오감으로 느낄 수 있는 도보여행... 파주시, 양주시, 동두천시, 포천시, 연천군, 그리고 강원도 철원군 일대에 이르기까지 수해가 발생한 지역입니다. 이 때문에 2002년 ‘임진강수계...",2020. 10. 9.
[양주 캠핑맛집/양주캠핑레스토랑] 강경 숯불 바베큐 양주점,"강경 숯불 바베큐 양주점 주소:경기 양주시 광적면 삼일로 123-74 영업시간: 매일 12:00 - 22:00 ➡️매주 월요일 휴무 연락처:0507-1393-5889 드디어 도착... 잠시나마 여행간 너낌도 들고,, 여유 만끽하고 오니 너무 좋았습니다. 제가 좋아하는 고기사진으로 마무리 할게요. 양주 데이트 코스 가족모임...",2021. 3. 14.
