header,contents,date
[써니의식탁] 서울근교 경기도 계곡 : 장흥 마당바위 (최상류 계곡 메뉴 애견동반 가능),장흥마당바위 위치 주소안내 경기 양주시 장흥면 권율로309번길 317-38 장흥마당바위 #써니의식탁 #써니의놀이터 #서울근교계곡 #계곡추천 #경기도계곡추천 #장흥계곡 #장흥마당바위 #마당바위계곡 #애견동반계곡 #장흥마당바위계곡 #애견동반여행 #장흥유원지 #장흥계곡 #인스타핫플 #인싸계곡...,2020. 8. 4.
오늘 눈에 띄는 기사,바닷길과 하늘길이 막힌 요즘 옛 해외여행을 추억하기에도 맞춤한 여행지들이다. 바다 건너 멀리 자유롭게 떠날 수 있는 날이 어서 오면 좋으련만. 경기 양주시 ‘국립 아세안 자연휴양림’ 숙소는 아세안 10개 나라 전통가옥 형태다. 국내 거주하는 아세안 국가 국민과도 산림 혜택을 나누자는...,2021. 1. 28.
"[경기 양주]양주관아지, 조선시대의 관아",그렇게 양주 관아지에 갔다 왔어요 ~ 양주관아지는 경기도 양주시 유양동에 위치해 있습니다 양주관아지를 차례대로 둘러볼게요 ! 외삼문은... 시간 나신다면 한 번 들러보시는 걸 추천드려요 ~ #경기관광공사 #경기도여행 #경기관광끼투어기자단 #볼거리 #즐길거리,2020. 9. 23.
양주부대찌개 맛집 부일부대찌개,자주가는 부대찌개 장흥면맛집 부일부대찌개 주소 : 경기 양주시 장흥면 부곡리 540-35 전화 : 031-826-4108 장흥면맛집 부일부대찌개에요~ 회사 근처라... ㅎㅎ 예전엔 기사식당이었떤거 같은데 오래됐더라구용~ #양주부대찌개 #장흥면맛집 #양주여행 #부일부대찌개 #부대찌개맛집 #송추맛집 #장흥맛집,2020. 4. 13.
양주 테크노 시티 지식산업센터 매매!,못하고 여행도 못하고 빨리 코로나가 사라져서 모든 사람들이 자유롭게 답답한 마스크를 벗고 돌아다닐수 있는 시대가 왔으면 하네요! 이번 현장은 양주시 최초로 지어진 지식산업 센터 입니다. 양주테크노시티 지식산업센터 현장사진 건축물 주요현황과 현장 위치 경기도 양주시 광적면...,2021. 10. 6.
"가평 애견동반카페 엠블럭, 송추 오핀베이커리 :: 구찌랑 사촌동생이랑 힐링타임","아무튼 요 댕댕이 버스 보며 추억여행을 했답니다 안에 들어가서 댕댕이랑 같이 차랑 디저트를 즐길 수 있게 좌석이 마련되어있었어요 너무 신나게... 엠블럭도, 오핀도 넓직해서 여유있고 좋았어요 송추 카페 오핀베이커리 주소 :: 경기 양주시 장흥면 호국로 527번길 영업시간 :: 매일 10:00 - 21:00...",2020. 9. 23.
[영상컬럼]오늘의 포토뉴스[2021년 9월 17일(금)],[양주=뉴스핌] 이경환 기자 = 16일 오전 7시께 경기 양주시의 한 아파트 15층에서 20대 여성이 추락해 경찰이 수사에 나섰다. 경기북부경찰청.[사진=경기북부경찰청] 2021.09.16. 이 여성은 주민의 신고를 받고 출동한 119구급대가 인근 병원으로 옮겼지만 1시간여 만에 끝내 숨졌다. 20대 A씨는 이...,2021. 9. 17.
양주 카페 이너프유 낮도 밤도 예쁘네,예뻐 경기 양주시 부흥로 1422번길 220 매일 10:30 - 22:00 휴무일은 공식 계정에서 확인! 차로 가니까 15분? 되게 가까운 곳에 위치하고 있었어요 평일에 카페투어 하는 재미가 쏠쏠해요 자주는 아니더라도 이렇게 시간날때는 요기조기 다니며 소확행을 누려보려고 합니당 건물 바로 앞도 주차가...,2020. 2. 17.
반려견과 떠나기 좋은 국내 여행지,"제외한 카페, 레스토랑에서는 외부 테라스에서만 반려견 동반이 가능하다고 한다. 헤세의 정원 Hesse's garden 로컬 : 경기 양주시 장흥면 호국로550번길 111 영문 : 111, Hoguk-ro 550beon-gil, Jangheung-myeon, Yangju-si, Gyeonggi-do, Republic of Korea 2021.04.21 | 원문링크 바로가기 #국내여행 #애견동반",2021. 5. 5.
당일치기 가볼만한곳/송추계곡,송추계곡 경기 양주시 장흥면 울대리 송추계곡 도봉산의 줄기인 오봉산기슭의 약 4 km에 걸쳐 이어지는 계곡으로 북한산국립공원에 속한다 계곡... ^^ #송추계곡 #송추밤나무 #송추맛집 #근교가볼만한계곡 #당일치기여행 #아이들데리고갈만한곳 #가족단위놀러가볼만한곳,2020. 7. 27.
양주브런치 카페 로스팅박스 에서 좋은 시간보내기,"크로크마담 12,500원 마치 해외여행을 갔는데 그곳에서 조식으로 브런치를 즐기는 기분이였어요 토스트를 이렇게 고급스럽게 즐길수 있다니 제가... 업체정보 경기 양주시 원학로147번길 123-24 1층/ 031-848-8827/매주월요일휴무 #양주카페 #양주야외카페 #양주카페추천 #양주가볼만한곳",2021. 7. 7.
서민갑부 조경 공간 인테리어 꽃장식 양주 네이쳐디자인,"서민갑부 조경 공간 인테리어 꽃장식 네이쳐디자인 경기 양주시 장흥면 호국로 176-31 매일 00:00 - 24:00 02-355-6564 안녕하세요 피닉스입니다. 서민갑부... 마음 편히 여행을 떠나는 게 어려워진 요즘, 캠핑용품, 카페용품 등을 집에 갖다 놓고 휴식을 즐기는 사람들이 늘고 있습니다. 이에 형인 씨는...",2020. 9. 15.
캠핑장과 차박지 추천,포천글램핑여행 경기 포천시 신북면 청신로947번길 35 031-535-6494 자라섬오토캠핑장 경기도 가평군 가평읍 자라섬로 60 031-8078-8028~9... 일영유원지 경기도 양주시 장흥면 삼상리 031-8082-5962 한탄강관광지 오토캠핑장 경기도 연천군 전곡읍 선사로 76 031-833-0030 포천...,2021. 5. 20.
"장흥 참숯가마, 기안84 찜질방 후기 : 요금, 사우나, 물놀이, 바베큐 준비물과 꿀팁 !","인근에 비슷한 곳이 많으니 꼭 꼭 네비를 잘 찍고 가자 장흥 참숯가마 경기 양주시 장흥면 석현리 343 영업시간 24시간 영업 입장료 대인 13,000원... 장흥참숯가마바베큐 #장흥참숯가마꿀팁 #장흥참숯가마준비물 #장흥잠숯가마계곡 #양주여행 #경기도드라이브 #경기도근교여행 #서울근교여행 #장흥",2020. 7. 24.
대법원 부동산 경매 컨설팅 전문 회사 사남매아빠가 경기도 지역 단독주택 전원주택...,"미국도 자국민 한국여행경보 2단계로 제한조치를 취하는등 세계각국에서 점차 한국의 코로나19 확산에 대해 우려를 표명하고 있네요... 의정부지방법원 경매 사건 번호 (2019타경20941)경기 양주시 백석읍 방성리 692-21 외 1개 목록 411,616,000원 10.(2018타경26416)경기 양주시...",2020. 2. 23.
경기지역화폐 가맹점 찾기 Cách tìm kiếm nơi thanh toán thẻ tiền...,"경기도에서 경기지역화폐를 발행되지만 주소지가 속해있는 시.군 지역 내에서만 사용이 가능합니다. Ví dụ , mình đang sinh sống tại thành phố Yangju. 저는 지역이 양주라서 양주시 클릭 하였습니다. Ở đây có sẵn rất nhiều sự...",2021. 4. 9.
[겅기 양주] 친구들과 함께 다녀온 불곡산(佛谷山) 산행,"코스 : 양주역(산행기점, 경기 양주시 남방동) - 양주시청 - 불곡산 상봉(470.7 m) - 상투봉(431.8 m) - 임꺽정봉(449.5 m) - 대교아파트 - 오산삼거리(산행종점, 경기 양주시 유양동) 3. 거리 : 약 6.91 km 4. 소요시간 : 약 5시간 27분 [이동시간 3시간 45분 + 휴식시간 1시간 42분] 5. 교통편 : 대중교통 1) 갈때...",2020. 7. 27.
[장흥 계곡 맛집] 누룽지백숙으로 몸보신하고 계곡에서 물놀이까지 한번에 가능한...,#양주맛집 #장흥맛집 #이집이좋겠네 주소 : 경기 양주시 장흥면 권율로 253 전화번호 : 031-855-2454 영업시간 : 9:00 - 21:00 연중무휴 주차 : 가능 넓은... #장흥맛집 #장흥닭도리탕 #장흥백숙 #장흥몸보신 #이집이좋겠네본점 #장흥이집이좋겠네 #장흥계곡맛집 #장흥가족여행 #장흥계곡 #장흥백숙맛집...,2020. 7. 29.
글램핑코리아(양주애견점)_애견글램핑/애견캠핑/겨울글램핑,"하품하는 너, 너무 사랑스러워.^^ 자다말고 새벽에 끓여먹는 라면이란 소소하지만 그 어떤 여행보다 깊고 따뜻한 추억을 만들어준 애견글램핑, 사랑하는 우리 댕댕이들과 와서 뛰어놀고 먹고 즐기고가면 무조건 좋은 추억이 될거같다. 아 주 만 족 :) 글램핑코리아 양주애견점 경기 양주시 백석읍...",2020. 4. 3.
서울 근교 계곡 List! (feat 물놀이 할만한곳 갈만한 카페 백숙 뜯기좋은곳..!),"주소:양주시 장흥면 호국로 550번길 괜히 유명한게 아니죠~ 검색량도 가장 많고 계곡의 대명사로 자리잡은 송추계곡!! 사람이 많은 만큼 근처 맛집... -사진출처는 경기,서울 여행포털및 구글링을 통해 얻었습니다. 문제가 되는 사진이 있으시면 쪽지주세요..! 삭제드리겠습니다",2021. 7. 28.
경기도 양주 맛집 리후 캠핑식당 숯불 바베큐 구이,리후캠핑식당 쌈밥 양주 풋살장이 있는 리후캠핑식당 전화번호 031-865-2030 주소 경기 양주시 평화로1475번길 214-15 지번주소 덕계동 554-5 영업시간... 리후 캠핑식당 이곳은 캠핑식 바베큐 메뉴가 다양해서 가족끼리 친구끼리 여행온 느낌으로 맛있는 음식 먹으며 힐링할 수 있는 양주 맛집이네요....,2020. 10. 24.
"기력보충음식,기력회복에좋은음식 오리랑장어랑 먹고또먹고 서울 근교 나들이 어떠세요","오리랑장어랑 오리랑장어랑 주소: 경기 양주시 양주산성로 280-6 1층 영업시간: 11:00-22:00 단체석, 주차가능 100%토종민물장어 메뉴 장어 소금구이... 저녁에 이길을 지나면 개구리 소리도 들리구~ 아이들은 개구리 소리도 생소하잖아요~ 똑같은 음원 여행스케치 별이진다네~~ 노래 앞부분 들려주니...",2020. 6. 21.
자투리 카페 사진 모음 (광화문 디타워 펠트 + 양주 덕정 봉주르 + 광교 엘리웨이...,양주 덕정 카페 봉쥬르 영업시간 : 매일 08:00 ~ 24:00 전화번호 : 031-858-8770 주소 : 경기 양주시 엄상동길 30-17 카페라고 해도 되나 싶지만 커피도 판매하니까 자투리 카페 사진 모음에 넣어봤다. 에그드랍 샌드위치를 이날 처음 먹어봤는데 기대 이상으로 정말 맛있었다. 빵은...,2020. 4. 6.
양주 맛집/덕정 맛집 :: 밀밭칼국수 | 양주인이 여길 모른다? 있을 수 없는 일,(한지 얼마나 됐다고^^*) 멀티가 안되는 성격이라 블로그가 그 주류였을땐 하루종일 매달려있었는데 다음 달에 있을 여행 계획짜느라 잠시... 2호점은 화요일 영업O ' 위치 경기 양주시 덕정6길 45 밀밭칼국수 본점은 내부가 그리 넓지않아 답답하실 수도 있을 텐데 전 직원분들이 마스크를 쓰고...,2020. 2. 16.
2021년 1월 18일 코로나바이러스감염증-19 일일보고서 (2021_8호),"(210명) • 경기 양주시 육류가공업체 관련(94명) • 충북 괴산군/음성군/진천군/안성시 병원 관련(438명) • 충북 청주시 요양시설 관련... 16.) (외교부) 전 국가·지역 해외여행에 대한 특별여행주의보 연장(~2.15) (복지부)「이용자 중심 의료혁신 협의체」회의*(장관, 1.15.) * (참석)...",2021. 1. 19.
"양주 카페 : 교외선, 강아지들이 뛰어노는 한옥카페, 서울근교 데이트코스 추천","양주 카페 - 교외선 경기 양주시 장흥면 일영로 545-14 / 031-855-4336 영업시간 - 매일 12:00 - 21:00, 매주 목요일 휴무. 주차 가능. 양주 카페 교외선 은... 모든 게 너무 좋았던 양주 힐링여행코스였다. - 앉아서 이런 저런 이야기도 하면서 시간으 보내다가 들어올 땐 구경하지 못했던 양주 카페 교외선...",2020. 7. 3.
서울근교 애견동반 식당:) 도깨비방망이 돼지갈비정식 완.전.만.족'S /개별 방갈로...,경기 양주시 장흥면 권율로 427 ***-****-**** 매일 10:00 - 03:00 마지막주문 21:30 새벽 3시마감 여름에 꼭 가봐야할 서울근교 계곡 애견동반식당 이에요 방갈로 뒷편이 송추계곡 이에요 계곡도 놀기 편한 사이즈더라구요 여름엔 강아지들과 함께 물속에서 놀 수 있대요 항상 애기와 쁘니랑 함께하는 여행...,2020. 3. 6.
3월18일생방송투데이 이선장해물포차 들꽃가람농장 오브닝 딸가카페...,"3월 18일 생방송 투데이 여행본능, 섬 - 한려해상을 품은 다복한, 산달도편 이선장 해물포차는 가격대는 저렴하지만 모두 자연산이라고... < 오브닝 > 경기 양주시 옥정동로7나길 18 ***-****-****( 딸기카페 ) < 노보텔 스위트 앰배서더 서울 용산 > 서울 용산구 청파로20길 95 02-2223-7323,7324...",2020. 3. 18.
일산애견카페 네이처독 다녀왔어요~,가까이는 동네 산책부터 네일이나 연장을 받을 때도 함께 가고 출근할 때나 주말에는 서울 근교에 있는 애견운동장으로 당일치기 여행을... 위치 : 경기 양주시 장흥면 호국로550번길 111 (헤세의 정원 내 위치) 전화 : 031-877-5113 운영시간 : 11:00~19:00 (동계시즌 18:00 까지 운영) / 월요일 휴무 # 우천 시...,2020. 5. 26.
[경기남부경찰청]개발 호재 과장하며 40여개 토지 판매,"12개 기획부동산 업체 15명 사기 혐의로 검거, 4명 구속 손준용 기자 경기남부경찰청 부동산투기사범 특별수사대(대장; 송병일)는 16년~21년까지... 5도 이하만 개발가능하나 / 해당필지 경사도(20도) (양주시 산00 / 공유자 500여명 /시세 4배 판매) 임업용산지, 경사도, 인접지에 문화재보호구역이 있어...",2021. 6. 28.
양주 옥정동미용실 헤어하우스앤에서 손상모발 걱정없이 매직펌 완성 !,"역시 머리잘하는 미용실은 어딜가도 눈에 띄게 마련이네요, 여행가기 좋은 계절 가을! 기분좋게 스타일링 변신까지 완벽성공!! 교통도 좋고 실력좋은 미용실 양주 헤어하우스앤에서 헤어고민 해결해 보세요~! 양주 옥정동미용실 헤어하우스앤 (HAIRHAUS.N ) T. 031-866-2731 경기 양주시 옥정동로7다길 54...",2020. 9. 27.
양주?장흥?일영?뜰안채펜션♥추억이 있는 양주를 다시 찾은 강태삼형제~복층구조...,강태삼형제 온라인 수업 끝나면 ' 경기 양주시 장흥면 일영로502번길 172'로 세면도구랑 여벌옷 챙겨서 온나~ 외할아버지 갑자기 전화하신... 오래가니 여행가는 것 같다고 강태삼형제 신났어요 양주는 교외선 올 때도 느꼈지만 시공간을 뛰어 넘어 과거로 온 것 같아요 우~와~우~와~ 자연풍경이...,2020. 5. 26.
비암리 청국장 맛집 허영만 선생님과 만나다!,저도 소문 듣고 찾아오게 되었네요!!^^ 유명 식당 경기 양주시 광적면 부흥로 31 031-871-4010 주차공간은 넓어요~ 식당 앞 마당에는 주차를 하기 좋게... 시골에도 못 내려가시고 그렇다고 어디 펜션이나 여행을 가려고 해도 시즌 중 제일 붐비는 시즌이라 비싸고 잡기도 힘드실 거예요~ 이럴 때는 이렇게...,2020. 9. 29.
[드라이브코스]너무너무너무 예쁜 카페 오랑주리,"뷰값을 해야하니까... 거의 평균 만원 정도 보면 되고, 케이크를 시켜 먹는 경우 가격이 밥값보다 더 나오게됩니다 ㅎㅎㅎㅎㅎ 음료맛은 보통이었어요 카페 오랑주리 070-7755-0615 경기 양주시 백석읍 기산로 423-19 지번기산리 414-1 매일 11:00 - 21:00 #양주카페 #양주드라이브 #예쁜카페",2020. 3. 15.
애견수영장 스트레스 확 풀리는 강아지운동장 네이처독,가족들이 당일치기로 여행 와서 즐기기도 좋고 반려견들도 편안하게 쉬다 갈 수 있는 곳이라 더 괜찮아 보였어요. 날이 급 맑아진 주말이어서... 아이들의 스트레스 해소를 해주고 싶다면 잔디밭은 물론이고 수영장까지 마련되어 있는 네이처독을 추천하고 싶습니다 위치 : 경기 양주시 장흥면...,2020. 8. 11.
양주 백석 카페 브루다 양주(Brewda)에서 기산저수지 노을뷰 인생샷 건졌어요!!,"-주소 : 경기 양주시 백석읍 권율로 909 -연락처 : 070-8838-4096 -영업시간 : 평일 11:00~20:00 주말 10:00~20:00 ※단체석, 주차, 포장, 무선인터넷(와이파이) 주차장 우리가 카페에 갈 때 가장 중요하게 생각하는 주차! 브루다 양주는 주차장이 아주 넓어서 주차 걱정은 할 필요가 없다. 갓 오픈한 신상...",2020. 8. 24.
주말에 아이들과 갈만한 곳/송추계곡/섬진강 메기매운탕,송추계곡은 서울과 가까운 곳이랍니다~ 서울의 끝자락에 살고 있는 저희는 왠만하면 경기북부쪽으로 여행을 자주 가는 편이예요~ 차가 막히지... 섬진강 메기매운탕 집으로 갑니다^^ 계곡에서 많이 놀다보니 애들이 춥다고 해서 따뜻한 국물있는곳으로~~ 섬진강 메기매운탕: 경기도 양주시 장흥면...,2021. 8. 10.
"양주 브런치 맛집 : 서울근교 나들이로 가기 좋은 서광식당, 송추 카페 추천","지난 토요일, 오전부터 바빴던 결혼식 축하를 마치고 남자친구와 훌쩍 떠났던 양주나들이, 양주여행 남자친구 차 안에는 언제나 내가 먹을... 양주 브런치 맛집 - 서광식당 경기 양주시 장흥면 호국로597번길 8-21 / 031-826-4188 영업시간 - 평일 12:00 - 16:00 LO-3PM 주말 12:00 - 18:00 LO-5PM , 월요일 휴무. 가게...",2020. 7. 2.
"양주 펜션, 비 오는날 운치있게 즐긴 장흥 수영장 펜션","여행 당일에 계획과 다르게 비가 내려서 놀러가기 전에 걱정을 많이 했지만, 비가 내리는데로 운치 있게 즐길 수 있어서 특별한 기억으로 남은... 상호 : 그레이스밸리 펜션 주소 : 경기 양주시 장흥면 권율로 309번길 114 주차 공간 : 동마다 넉넉한 공간을 제공 객실 이용기간 : 7/27~7/28(1박2일) 입실...",2020. 7. 29.
장흥 계곡 맛집 이집이좋겠네에서 누룽지닭백숙 먹고왔어요~,요즘 날씨가 더워지면서 시원한곳으로 여행들 많이 가시더라구요. 오랜만에 지인들과 함께 계곡에 다녀왔어요. 1박은 아니지만 장흥에 있는... 시간되시면 한번쯤 나들이 다녀와보세요. : ) ️매일 9:00 ~22:00 ️예약하고 가시길 추천. ️경기 양주시 장흥면 권율로 253. ️031-855-8913,2020. 7. 8.
< 경기도 장흥유원지> 신털뫼 능이 닭백숙 계곡 근처 맛집,"#장흥유원지 # 능이백숙 # 신털뫼 #계곡근처 #경기도 #맛집 #쿨링존 #커피 #힐링여행 안녕하세요 민아맘입니다 주말 가족 나들이로 마장호수... 휴무 경기 양주시 장흥면 권율로309번길 304-6 031 ) 855- 6936 주차하고 바로 보였던 테라스 커피도 함께 판매하고 있었어요 신털뫼에서 식사하면 커피 3,000원...",2020. 8. 2.
(서울 경기) 제146차 성지순례 및 기도(2021년 2월 21일 봉행),"♦ 올리는 글 ""부처님 찾아 떠나는 여행""은 국내 및 해외의 불교성지를 순례함으로서 불자들로 하여금 불심을 더욱 돈독하게 하여줌과 동시에... 전경 경기도 양주시 장흥면 석현리 392-2에 소재하고 있는 청련사(靑蓮寺)는 한국불교 태고종 소속 사찰로 827년(신라 흥덕왕 2)에 창건되었으며 원래...",2021. 2. 6.
[장소추천] 비대면 시대! 자동차 극장에서 문화생활을 즐겨보세요~ - 양주 장흥 자동차 극장,#경기지역화폐 #경기지역화폐사용처 #경기지역화폐가맹점 #지역화폐 #양주시 #양주 #양주사랑카드 #양주가볼만한곳 #자동차극장 #자동차 #언택트시대 #언택트데이트 #데이트 #이색데이트 #데이트코스 #문화생활 #가족여행 #연인 #경기북부가볼만한곳 #경기북부 #전통시장 #의정부시 #제일시장...,2020. 11. 26.
유럽느낌의 대규모 양주카페 < 올드릿지 > 브런치&펍 / 내돈내산,위치는 양주시 만송동. 고읍동에서 도보로 올 수 있지만 웬만하면 차를 가지고 오는게 편리한 시골이다 덕분에 주차는 편리하다 1층 한켠을... 카페였다 #양주카페 #고읍동카페 #만송동카페 #고읍카페 #데이트코스 #이색데이트 #서울근교여행 #양주가볼만한곳 #양주핫플 #경기북부여행 #양주올드릿지...,2021. 2. 19.
서울 근교 송추계곡 가볼만한곳 까만굴뚝 솔직후기,힐링여행이었어요 어딜갈까 고민하다가.. 동해는 혼자 운전 힘들거 같고 서해는 자주다니기도 하고 언니가 계곡 이야기 하길래 검색하다... 먹고 난이후로부터 짜서인지 정확힌 모르겠지만 물엄청 마셨어요 ㅠㅠㅠ 송추계곡 까만굴뚝 연락처 : 031-855-1761 주소 : 경기 양주시 장흥면 권율로 74...,2020. 7. 25.
♡양주여행♡양주시립회암사지박물관《고려 말 전국 사찰의 총본산이었고 조선...,"정의 경기도 양주시 율정동에 있는 박물관. 건립 경위 양주시에서 회암사지를 경기 북부 최고의 관광지와 역사 교육의 장으로 조성하려는 목적으로 종합 정비 계획을 수립하여 연차적으로 회암사지 발굴 조사, 유적 및 단지 정비 등 회암사지 종합 정비 계획[총 사업비 580억 원] 중 하나로...",2021. 2. 3.
"경기도 양주 카페 이너프유, 양주 데이트 장소로 딱이야♥",정말 여행온 기분이 나던 예쁜 뒷마당의 포토존! 여기서 사진도 한컷씩 찍고 왔다. 이날 레디백 받으러 갔던 날이라 매우 초췌한 상태여서 차마... 찍으러 재방문 하고 싶은 양주 데이트 필수 코스 이너프유! 영업시간 매일 10:30~22:00 위치 경기 양주시 부흥로1422번길 220 *주차 가능 전화번호 ***-****-****,2020. 7. 17.
[장흥펜션] 빌라드제이 (feat.스파/바베큐),경기 양주시 장흥면 호국로 176 빌라드제이 펜션은 높은 곳에 위치해 있기 때문에 주변 하나로마트에서 장을 보았습니다 ! 지인 커플이랑 함께 가는 여행이라 요렇게 산 겁니다 ! 2인분 아닙니다~(ㅎㅎ) 펜션 외관이 너무 고급 지고 세련되어 보이지 않나요? 제가 좋아하는 스타일의 외관이에요 ! 방...,2020. 2. 12.
장흥면 맛집 8099617092,햄도 민찌도 재료가 좋았고 건더기도 낭낭걐해서 진짜 배부르고 맛있게 잘 먹고왔어요!부일기사식당경기도 양주시 장흥면 호국로 557홌-2부일부대찌개031-826-4108경기 양주시 장흥면 호국로 557-2매일 06:00 걤- 21:00#양주부대찌개 #장흥면맛집 #양주여행 #쉬즈블로그 #부일부대찌개 #부일기사식당틁...,2020. 11. 16.
2021년 2월 1일 코로나바이러스감염증-19 일일보고서 (2021_14호),"(226명) • 경기 양주시 육류가공업체 관련(106명) • IM선교회 미인가교육시설 관련(384명) • 충북 괴산군/음성군/진천군/안성시 병원... 금지, 여행ㆍ이동 자제 등 주요 방역조치 2주간 연장 / 단계 조정 및 생업시설 운영제한, 집합금지 등은 1주일 뒤 다시 판단 ** 직계가족의...",2021. 2. 2.
"[양주 | 카페엔트] 독채펜션 느낌의 넓은 잔디밭 테라스, 잔잔한 음악도 좋은 한적한...",한적하고 넓어서 답답하지 않고 자유로운 느낌의 공원같은 카페 카페 엔트 Cafe Ent 경기 양주시 백석읍 양주산성로 484-12 매일 10:00 - 22:00... 소품같지만 여행느낌 나는 평상은 인테리어효과 톡톡히 한다 잔디밭에서 사진 열심히 남겼는데 넓다보니 각도마다 다른 배경인 느낌이다 아보네 가띠백...,2020. 10. 8.
경기도 양주 가볼만한곳: 기산저수지,"개요 - 연락처: 정보 없음 - 주소: 경기 양주시 백석읍 기산리 - 출입 가능 시간: 제한 없음 - 휴관일: 없음 - 주차료: 없음 - 입장료: 없음 - 방문한 시기: 2020.04.19 가시는 길 자차로 가시면 네비 이용하시면 되구요, 대중교통으로는 양주역에서 18번 버스를 타면 약 1시간이 소요되네요. 들어가기...",2020. 8. 11.
[양주 맛집 주막촌]인공폭포 있는 평상에서 물놀이 가능한곳(대형견동반식당?),"양주 맛집 주막촌 경기 양주시 장흥면 권율로 305 주말 10:00 - 02:00 금요일, 토요일 (영업시간 변동가능) 평일 10:00 - 24:00 일요일-목요일 (영업시간 변동가능) 여름 성수기땐 가격이 다를수 있으니 확인 전화한번 해보셔요~ 이 포스팅은 5월에 다녀온 후기입니다. 양주에서 골든리트리버 무지 미용하고...",2020. 6. 7.
[생방송투데이맛집]서울 최고의 김치찌개 TOP 5 편 ▶<시민식당> 주소 : 서울시...,3GO-대관령 3GO 여행 편 ▶<대관령 하늘목장> 주소 : 강원 평창군 대관령면 꽃밭양지길 458-23 번호 : 033-332-8061 ▶<송어의 집> 주소... 무엇이든 맞춰드립니다 편 ▶<부뚜막> 주소 : 경기 양주시 옥정로 147 중앙프라자 1층 뒷편 번호 : 0507-1387-3738 빅데이터 랭킹 맛집...,2020. 8. 21.
