header,contents,date
분위기좋은 bar 루프엑스 rufxxx / 판교가볼만한곳 / 백현카페거리 /경기화폐가맹점,루프엑스 rufxxx 경기 성남시 분당구 동판교로52번길 25-18 매일 5pm - 1am 연중무휴 저는 루프엑스 2 를 방문했고 루프엑스 2 는 공연과 전시 대관도 진행하는 곳이에요 ~ 건물외관에서부터 내가이구역의 미친 분위기야~~~~~하는거 같았어요 지나가다 한번 뒤돌아 볼법한 곳이랍니다 술집이지만...,2020. 4. 21.
서현역] 분당에서 찾은 일본우동 맛집_묘오또_서현맛집,"서현 맛집이자 일본우동 맛집 묘오또에서 일본 우동의 최고봉이라 할 수 있는 제대로 된 붓가케 우동을 꼭 먹어보시길…추천 추천 묘오또 031-607-0101 경기 성남시 분당구 서현로239번길 1 매일 11:30 - 15:30 마지막 주문 15시 30분 매일 17:00 - 20:30 마지막주문 20시 30분 단체석, 주차, 포장, 예약...",2020. 5. 26.
"[판교맛집] 판교레스토랑 '세렌', 브런치카페 데이트코스로 강추 :: seren",INFO 경기 성남시 분당구 운중로188번길 11 0507-1391-0775 매일 11:00-21:30 Lunch L.O 14:30 DINNER L.O 20:30 외관 판교레스토랑 세렌은 1층에 위치하고있고 주차는 매장 앞에다가 하고 들어갔어요 주변에도 주차할공간이 많이 있더라구요 ! 내부 한쪽에는 해외여행에서 요리를 즐기는 듯하게 벽면에...,2021. 9. 13.
[성남여행] 은행동 은행식물원(성남시립식물원)의 겨울 (은행현대아파트 인근 공원),은행식물원 경기 성남시 중원구 은행로 72 매일 9:00-18:00 (마감시간 1시간 전까지 입장) 주차가능 성남시가 시립식물원으로 조성한 은행식물원은 양묘장과 용도 폐기된 배수지를 이용하여 다시 태어난 도시숲 식물원입니다. 2001년 관찰원으로 준공하였고 2002년 10월 30일 정식 개관하였습니다....,2021. 1. 12.
[분당 가족모임 추천] 분당 맛집 '좋구먼 이매점' 한정식 후기,"위치와 분위기 :) 좋구먼 이매점 경기 성남시 분당구 이매로89번길 7 (단독건물) 매일 10:30 - 22:00 / 연중무휴 031-701-1060 *네이버 플레이스 발췌 *넓은 주차공간, 아기의자 있음 """" #분당맛집 #분당가족모임 #분당한정식 #분당한식 #분당점심 #판교맛집 #분당밥집 #이매역맛집 #이매맛집 #이매한정식...",2020. 7. 12.
"GRAND OPEN 해밍턴 부대찌개, 곱창전골 경기성남상대원점 신규 오픈","타사와 달리 사이드 메뉴까지 다양하고, 캠핑 또는 여행 갈 때 밀키트로 포장해서 먹을 수 있고 조리 또한 간편하기 때문에 요즘 인기가... 경기도 성남시 중원구 둔촌대로 429, 1층에 위치하고 있는 해밍턴부대찌개&곱창전골 상대원점은 매일 오전 10시부터 오후 10시까지 운영합니다....",2021. 6. 18.
[분당 마사지] 이런 시원함 처음이야..! 체형관리 <프리메드 수기센터>,"분당 마사지,정자역 마사지 :: 프리메드 수기센터 체형관리후기 분당 마사지 <프리메드 수기센터> 위치 및 외관 경기 성남시 분당구 정자로 13 월드비터 3층 분당선&신분당선 정자역 3번출구로 나와 그대로 직진 횡단보도가 나오면 건너지말고 오른쪽으로 꺾어 1-2분만 가면 <국민은행 분당정자점...",2020. 3. 4.
다비치안경 서현점 분당아큐브 렌즈 전문,주소: 경기 성남시 분당구 서현동 255-1 분당풍림아이원플러스오피스텔 1층 109호 분당다비치안경 서현점은 풍림아이원플러스오피스텔 건물에... 여름이다보니 여행도 가고 할때 편하게 사용 하려고 원데이 렌즈로 구입 했어요 쿠퍼비젼 클래리티 40개 21000원 바슈롬 바이오트루 30000원 원데이니까...,2021. 6. 25.
매일경제 최신기사 시간별 24 2021-10-07 17:53,"07 17:48 수익 700억 그친 금융사…화천대유 초과수익 알고 있었다 ◆ 대장동 개발 팩트체크 ⑧ ◆엄청난 이익을 남긴 경기 성남시 대장동... 대만 주권, 남태평..2021.10.07 17:42 여기어때, 해외여행업 본격화 여행·레저 플랫폼 '여기어때'가 20년 업력을 쌓아온 온라인 기반 해외여행 전문...",2021. 10. 7.
"[성남/분당] 분위기에 취하는 정자역 이자카야, 잔잔","잔잔 정자역점 경기 성남시 분당구 정자일로 192 파크프라자 1층 나는 주량이 센 편도 아니고 그저 미세하게 알딸딸한 느낌의 술자리와 그... 친구랑 갔었던 일본여행을 추억하며 행사 중인 하이볼(6,500원)을 한 잔씩 주문했다. 하이볼 나왔고~ 내가 좋아하는 타코와사비도 나왔고~ 예전에는...",2021. 9. 13.
성남맛집 판교 송이와은어향기 내돈내산,"안녕하세요 말띠에요 :-) 가족들과 포천여행을 다녀오면서 같이 다녀온 성남맛집인데요 판교에 위치해있어요, 사실은 이근처에 장어가 많아서... 송이와은어향기 경기 성남시 수정수 대왕판교로 962-0 031-758-6600 주차가능 와이파이가능포장, 배달 가능 네이버 예약 가능 영업시간 : 매일 9시30분 부터...",2021. 5. 5.
"분당/율동공원 애견동반식당 | 타임포타이(TIME FOR THAI) , 리얼 태국음식 먹고 싶을...",타임포타이 (TIME FOR THAI) 태국음식 화려한 수상&경력의 주방장님이 만드는 현지 리얼 태국음식 with 애견동반가능식당 * 이름 : 타임포타이(Time for Thai) * 위치 : 경기 성남시 분당구 문정로 144번길 5 * 연락처 : 031-702-1123 * 영업시간 : 매일 11:00 - 22:00 (연중무휴) * 메뉴 : 태국음식 - 팟타이...,2020. 2. 3.
야탑역 맛집 [슌] 분당 이자카야 사시미 모리아와세 가츠동 오무소바,일본 느낌의 소품들이 곳곳에 있어서 일본 여행 추억들을 떠올려 볼 수 있었다. 해외여행 못가는 우리 마음을 조금은 달래주었다. 코로나 시국이라... 분당 이자카야 슌 전화번호: 031-709-5795 주소: 경기 성남시 분당구 장미로 42 야탑 리더스 찾아가는 길: 야탑역4번 출구에서386m,2021. 7. 18.
[성남여행] 신흥동 '희망대공원'의 겨울 1탄 (22년 9월 입주예정인 신흥역 하늘채...,"희망대공원 경기 성남시 수정구 공원로370번길 30 희망대공원 8호선 단대오거리역 4번출구에서 800m 주차가능 입장료 무료 희망대공원에는 산책로, 잔디밭, 각종 운동시설, 야외공연무대 등 다양한 시설이 있어요. 수정청소년수련관 입구쪽에 40여대를 주차할 수 있는 무료주차장이 있어요....",2021. 1. 4.
카페? 공원? 요즘 핫한 서울 근교 베이커리 카페,"좀처럼 줄지 않는 코로나19로 여름휴가나 여행을 떠나기 쉽지 않은 요즘, 가족이나 친구들과 연일 무더운 폭염으로 지친 몸과 마음을 기분전환 할... 김선미 리포터 **********@*******.*** 조진영 리포터 *********@*****.*** 줄 서서 먹는 도넛 카페 ‘도넛드로잉’ 경기 성남시 분당구 금곡동에 위치한...",2021. 8. 5.
오랜만에 돌아온 OpenBVE 여행! 공항에서 여주까지 제 4부,이번 여행도 이제 슬슬 마무리가 보입니다. 인천공항에서 시작해서 이제는 강남까지 왔습니다. 지금까지도 길었지만 아직도 갈 길이 한참... 이제 이 역을 지나면 긴 터널을 지나 성남시로 들어가게 됩니다. 중간에 화려한 조명도 있구요 무지개터널 청계산입구역과 판교역 사이에 무지개터널...,2020. 9. 23.
판교 순두부 맛집 강릉에서 먹던 짬뽕 순두부가 그립다면 '장여사강릉짬뽕순두부',"저번주에 여행 다녀와서 눈코뜰새 없이 바쁜 일주일을 보낸 것 같아요 정말 평일내내 휴가의 후폭풍으로 일이 밀려 있어서 너무 바빴고요 주말이... 판교에서 맛있는 #순두부정식 찾으신다면, 장여사강릉짬뽕순두부 추천해드리고 싶어요 장여사강릉짬뽕순두부 경기 성남시 분당구 대왕판교로 660...",2021. 9. 12.
"2021년 1월 27일 생방송 투데이-여행본능 섬(남해도), 오천만의 메뉴(닭볶음탕)...","여행본능, 섬 - 온풍 불어오면~ 시원짜릿! '남해도' 편 2. 오천만의 메뉴 - 오천만의 소울푸드! 무쇠 장작 닭볶음탕 편 ▶<솥뚜껑 닭볶음탕... 주소 : 경기 성남시 중원구 둔촌대로101번길 28-2 번호 : 031-755-1771 ▶ <박명주브라더> 토마토치킨파스탕,타이,똠양치킨파스탕 주소 : 서울...",2021. 1. 28.
"판교 현대백화점 맛집, 미국식 중식 핫팟 전문점 제이스팟","핫팟 전문점이다 제이스팟 훠궈도 한국인의 입맛에 맞게 향이 강하지 않다고 하니 다음에는 도전해 보는걸로 하고 이만 폿팅을 마칠까 한다 <제이스팟> 주소 : 경기 성남시 분당구 판교역로 152 알파돔타워3동 3층 전화번호 : 031-622-7179 영업시간 : 11:00~22:00(BT 15:00~17:00) 단체석, 주차, 네이버예약가능",2020. 7. 28.
성남 모란맛집 오랜만에 라멘 먹었던 대장부,"주소 : 경기 성남시 중원구 둔촌대로113번길 13 영업시간 : 매일 11:30 - 21:00 재료 소진시 조기마감 주차 : O 일식 좋아하는 오빠랑 라멘먹으러 방문한... 중학생때 도쿄여행가서 먹은 소유라멘이 너무 너무 맛없어서 그 뒤로 라멘을 먹은 기억이 없는 나는,, 모란맛집 대장부가 라멘에 대한 생각을...",2021. 9. 3.
코로나19에 따른 경기도 신용카드 매출 감소와 시사점 [경기연구원 정책브리프],"여행/교통 품목 중 숙박과 여행의 매출이 각각 27.9%, 35.5% 감소한 반면 교통(택시) 부문의 매출은 전년보다 13.6% 증가하였으며, 주유 품목의 매출은... 규모가 경기도 시군별 평균(약 791억 원)보다 큰 지역은 수원시, 성남시, 광명시, 고양시, 용인시, 부천시, 안양시, 안산시, 의정부시, 파주시입니다....",2020. 7. 8.
남한산성의 가치를 발견하는 역사문화여행 남한산성 행궁 탐방기(feat. 문화해설사),"현재 경기도 광주시, 성남시, 하남시에 걸쳐있습니다. 병자호란 당시 인조가 피신해 47일간 항전한 것으로 유명한 곳입니다. 남한산성 행궁은 완공... 그냥 왔다 가시지 마시고 해설사와 함께하면 더 뜻깊은 여행이 될 것입니다.”라고 이야기하며 해설을 마쳤습니다. 세계유산, 그 가치를 함께...",2020. 11. 3.
경기도 광명시여행 광명시가볼만한곳 광명시관광명소 대한민국 최고의,1명 성남시 수도권에서 제주도를 찾은 여행객 등도 추가 확진 판정을 받았다 코로나19 사망자 1명 늘어·치명률은 125... 코로나19 극복전국 확진자... 경기 광명시여행 광명시가볼만한곳 광명시관광명소 우리나라 경기 광명시여행 광명시가볼만한곳 광명시관광명소 우리나라 최고의...,2021. 8. 13.
정자역 맛집 / 스시야 - 폼은 일시적이지만 클래스는 영원하다.,"전체적으로 이날 스시야의 스시 대부분이 마치 여행을 가는 나처럼 말랑말랑, 몰랑몰랑한 느낌인게, 대체적으로 몽환적인 느낌이 들었다. 샤리는... 주소 : 경기 성남시 분당구 정자일로 146 엠코헤리츠1단지 101-203호 / 정자동 165-1 엠코헤리츠1단지 101-203호 주차 : 가능 (업체 2시간 지원) 영업시간...",2020. 4. 8.
고즈넉한 판교가볼만한곳 한옥 사송 카페(sasong),"주소 경기 성남시 수정구 사송로77번길 55 전화번호 031) 757-4085 영업시간 10:00 ~20:00 주말,공휴일휴무 주차 건물 앞 or 사송주차장 볼일을 보러... 적혀있었어요 여행온것도 아닌데 입구들어가는데 핫츨에 온것마냥 설레였다는 ㅎㅎ 안쪽은 한옥의 느낌을 포함한 세련된 카페였어요 아무래도...",2021. 9. 5.
GDR 아카데미 수원 영통점 브릿지스톤 골프(JGR/V300) 시타 및 레슨 후기,"산으로 계곡으로 바다로 떠나고 싶은 요즘 이지만, 바쁜일상 멀리 여행을 가지 못하고 있네요. 아무튼 운동을 해야겠고 평소 주변 지인분들과... 1 남양주 다산점 031-523-4060 경기도 남양주시 다산 중앙로 2 영등포 문래점 02-6949-1872 서울 영등포구 문래동 3 분당 정자점 031-717-1282 경기 성남시...",2020. 6. 11.
죽전 오리 분당 분당취미미술 상아빛화실에서 15년만에 붓을 잡았더니 에펠탑이 살아...,주소 : 경기 성남시 분당구 정자일로 1 코오롱 트리폴리스 2층 209-1호 상아빛화실 죽전 오리 분당취미미술 상아빛화실은 미금역 7번출구에서 도보... 색연필화 여행스케치 등 종류가 다양해요 Previous image Next image 출처 : 네이버밴드 상아빛화실 저는 이 중 유화 작품인 에펠탑을 골랐어요 프랑스...,2021. 9. 19.
사회복지사 채용 기관 List (20.12.23 업데이트),한빛재가노인복지센터 (경기 성남시) 12/21~1/1 6. 이천시니어클럽 (경기 이천시) 12/22~12/29 7. 사단법인 참사람들 (경기 성남시) 12/17~12/30 8.... 병역 필 또는 면제자로서 해외여행에 결격사유가 없는 자 5. 범죄 및 성범죄경력조회 시 결격사유가 없는 자 6. 자동차 운전면허소지자로서...,2020. 10. 5.
원주여행비법24시밥상을털어라 잡큐멘터리 베테랑 수제미용가위 9월11일 1148회 장소...,비법 24시 밥상을 털어라 우렁쌈밥 & 참나무 바비큐 우렁쌈밥 & 참나무 바비큐 여울목 장소 위치 주소 어디 : 경기 성남시 중원구 마지로 284-2 연락처 031-757-4445 영업시간은 매일 오전 11시 ~ 9시 노.래.방 (노래 따라 방방곡곡 떠나는 여행) 강원도 원주 여행 박건호 노래비...,2020. 9. 11.
야탑떡볶이 맛집은 김밥마니아 야탑점이 탑이구나~,김밥마니아 야탑점 주소 : 경기 성남시 분당구 성남 대로 925번길 19 터미널프라자 108호 전화 : 031-755-0020 영업시간 : 매일 00:00~24:00 달짝지근 맛있는... 먹고 여행하기도 좋을 것 같네요 혼밥하기에도 좋을 만큼 의자 배치도 굿인 거 같아요 창밖을 보면서 먹는 것도 좋을 것 같네요 ㅎㅎㅎㅎ 드뎌...,2021. 9. 3.
화수목 - 일식 / 소고기 요리 / 경기 분당 서현,"위치 : 경기도 성남시 분당구 황새울로 315, 1층(서현동 273-1) 별점 : ★★★☆ (5개 만점) 후기 - 화수목은 서현에서 상당히 긴 시간 자리 잡고 있는 샤부샤부 및 스키야키가 전문인 소고기 요리집이다. 본인은 아직 스키야키만 먹어봤기 때문에 이번 리뷰는 스키야키 위주로 작성하였다. - 일본 여행을...",2020. 5. 27.
친절은 쉬이 덮은 센 친절일까?,선생 여행 날 주차 진행 면허 일 상황 말씀 운행 때 시작 부산 수업 회사 주말 이해 필요 차량 경우 감 정도 사람 친구 중요 부모 선택 동안 친절한... 해물생선주소경기 성남시 분당구 야탑동 366 8번지전화031 705 2308설명안녕하십니까 전통 낙지요리 점문점 입니다 3 살아있는 부처 친절하고나서...,2021. 9. 15.
생방송오늘저녁 14종 고기무한리필 슬기로운외식생활 소고기 무한리필 가격파괴...,"▶ 지글 경기 성남시 분당구 정자일로 135 ☎ 031-716-9291 *고기 무한리필 가격 24,900원 (평일저녁, 주말, 공휴일 성인 / 2시간 제한) <신박한 네바퀴 여행 방송정보> ▶ 순천고사리농장(황제고사리) 순천시 상사면 도선암길 33-12 ☎ 이해식 대표 ***-****-**** ▶ 벌교장양어촌체험마을 전남 보성군...",2021. 8. 24.
"경찰, 화천대유 대주주 김만배 등 8명 출국금지",경기 성남시 대장동 개발 특혜 의혹을 수사 중인 경찰이 관계자 8명에 대한 출국 금지 조치에 나섰다. 경기남부경찰청은 김만배 화천대유자산관리... #윤의일 #윤의일기자 #필란트로피윤의일 #유튜브 #맛집투어 #나홀로여행 #코로나증상 #남북회담 #소상공인 #제주여행 #여행사주식 #항공주식...,2021. 10. 2.
[분당 맛집] 베트남 음식 맛집 ㅡ 하노이스토리 / 근처 분당동 카페 땡스어라떼,음식때문에 여행가는 사람들에겐 취저 가격도 싸고 베트남가서 먹는 메뉴들 다 있는데 맛있듬 +_+ 분당 하노이스토리 분당동 하노이스토리 효자촌 맛집 / 분당동 맛집 경기 성남시 분당구 불정로 420 평일/토요일 11:00 - 21:00 일요일 휴무 031-705-9898 우린 11시에 가서 한산했으나 12시에는 웨이팅이...,2020. 1. 17.
코로나 종식 후 가볼만한 경기도 관광명소 100선/수도권 여행 명소,비대면 시대에 여행은 쉽지 않은 현실이지만 코로나 종식 후 가볼만한 곳으로 경기관광공사가 제공하는 '경기도 관광명소 100선'을 소개한다.... - 주소 : 경기도 광명시 가학로 85번길 142(주변 1~3 주차장 이용) 출처: 광명시청 ★ 광주시 <남한산성> 경기도 광주시와 성남시·하남시에 걸쳐 있는...,2020. 9. 9.
ෆ 랜덤 지하철 데이트 ෆ 남한산성입구역 놀거리 ~ 남한산성(서문) / 국청사...,●●●●●●●●●●●●●● 다섯 번째 여행지 8호선 남한산성입구역 ⚑ 경기 성남시 중원구 희망로406번길 8-5 ☎ 02-6311-8221 ●●●●●●●●●●●●●● 남한산성입구역으로 출발! ㅋㅋㅋ ㅋㅋㅋㅋㅋㅋㅋ 최단거리로 가도 두 시간이었다. 하하하. 근데 일찍 일어나서 피곤해 죽겠는데 저렇게...,2021. 10. 1.
"포메인 정자본점, 베트남 음식은 아묻따 포메인이 진리! 분당 정자동 쌀국수 맛집","분당 정자동 쌀국수 맛집 포메인 정자 본점 베트남 여행을 너무 가고 싶은데 갈 수 없는 슬픈 현실 ㅠ_ㅠ 오랜만에 베트남 음식이 너무 당겨서... 후회하지 않으실거에요 :) 그럼 내일은 우리 모두 쌀국수, 콜? - 포메인 정자본점 경기 성남시 분당구 성남대로 381 031-711-9203 주차 가능 / 무료",2021. 8. 10.
분당 카페 율동공원빵카페 크루즈 페리89 주말 데이트 추천!,"크루즈여행을 다녀온 지가 너무나 오래되어 기억이 가물가물 해 지는 지금 이시점 바로 이곳 페리89 추천 해요 우산을 쓰고 찾으니 더욱 새로운 카페의 묘미가 있답니다. 상호 : 페리89(카페,디저트) 주소 : 경기 성남시 분당구 서현동 69 2층 페리89 영업시간 : 매일 12:00~22:00 PM 9;00 주문마감...",2021. 9. 4.
판교도서관 맛집 옛날김치찌개 포장후기,비가 부슬부슬 내리던 화요일 저녁 얼큰하면서도 따뜻한 김치찌개 생각이 간절했어요 주말 동안에 제주도 여행하면서 스페인 음식에 치킨에... 위치 주소 : 경기 성남시 분당구 운중로233번길 8-6 전화 : 031-8017-3303 영업시간 : 매일 10:00 - 23:00 차를 가지고 가시면 매장 오른쪽에 주차 가능한 공간이...,2021. 9. 3.
위례신도시 성남 :: 미드센추리모던 감성 폴폴 나는 브런치 맛집 카페 '디스이즈잇',디스이즈잇 THIS IS IT 경기 성남시 수정구 위례서일로 6 1층 평일 11:00 ~ 21:00 주말 11:00 ~ 22:00 월요일 정기휴무 상가 건물에 주차가능 위례 디스이즈잇... 이탈리아 신혼여행 때 먹었던 트러플리조또가 생각났다. 또 가고 싶다 자자레스토랑떼!!! 두가지 음식 모두 양도 많은 편이다. 사진보니 또 먹으러...,2021. 8. 11.
원프리카 열대농장 맛집 정보 위치 가격 강원도 원주여행정보 우리미용가위,바비큐 <여울목> 경기 성남시 중원구 마지로 284-2 ☎ 031-757-4445 ※ 영업시간은 매일 오전 11시 ~ 9시 입니다. ※ 방송 이후 가게가 혼잡할 수 있으니 여유를 두고 방문하실 것을 권합니다. 노.래.방 (노래 따라 방방곡곡 떠나는 여행) <강원도 원주 여행> ■ 박건호 노래비 (박건호...,2020. 9. 11.
2020년 10개 매장 오픈! 포메인x포메인 RED #쌀국수맛집,제주노형점은 제주공항에서 단 15분거리에 위치하고 있어서 여행의 시작과 끝에 들리기 좋은 쌀국수맛집입니다. 주민들도 방문이 매우... 포메인 RED 분당서현역점 031-702-5872 | 경기 성남시 분당구 황새울로 325 1층 109호 | 매일 11:00~22:00 Previous image Next image 포메인 레드 서현역점은 메인...,2020. 9. 25.
[전시] 현대어린이책미술관 《#보따리바캉스》,일곱 개의 보따리 속으로 떠나는 옛이야기 여행 현대어린이책미술관 《#보따리바캉스》 2021. 4. 13 - 2021. 8. 29 판교 현대백화점 현대어린이책미술관 현대어린이책미술관 전화번호 031-5170-3700 주소 도로명 :경기 성남시 분당구 판교역로146번길 20 지번 : 백현동 541 영업시간 매일 10:00...,2021. 4. 7.
[분당] 정자 인생맛집 베트남 현지느낌 쌀국수맛집 효뜨 꽌,월요일휴무 경기 성남시 분당구 정자일로 140 정자역엠코헤리츠 2단지 1층 비122호 주차 가능 반려동물 동반 가능 0507-1366-0258 정자 카페거리에... 해외여행 못가는 대신 맛난거 많이먹구 이국적인 분위기까지 즐기기에 딱✨좋은 효뜨꽌이에요〰️ 야외테이블도 여러개 마련되어있어서...,2021. 8. 21.
"루타 6400km ㅅㅋㄹㄷ, 위례에서 대만을 맛보다","미식여행으로도 많이 간다는 대만. 한번도 가본 적이 없었기에 끌렸던 듯. 식사시간에 맞춰가면 웨이팅이 있을까 봐, 조금은 일찍 서둘러 루타6400km(경기 성남시 수정구 위례광장로 300 위례중앙타워 4층 404호)로 향했다. 우선은 메뉴를 골라보자. 'ㅅㅋㄹㄷ'라는 조금은 독특한 간판을 통해...",2021. 8. 5.
[ 분당 카페 ] 테라로사,이제 초등학생이 된 아이와 손잡고 유럽 여행 가고 싶은데 언제 갈 수 있을까? 이런저런 생각하며 아침 독서 시간 끝. 점심에는 잠깐 짬이 나서 분당 카페 방문. 여기는 #테라로사 테라로사 판교점 영업시간 : 매일 09:00 - 21:00 Last order 20:30 주소 : 경기 성남시 분당구 운중로267번길 3-5 1층 햇빛...,2021. 8. 9.
"[호캉스/국내호텔] 판교 나인트리 프리미어호텔 룸, 라운지, 수영장",안녕하세요:) 요즘 코로나 바이러스 때문에 어디 여행도 제대로 못가고ㅜㅜ.... 아쉬운 나날들만 쌓여가네요. 너무 집에만 있다보면 우울쓰.. 그래서 초딩맨이랑 판교에 새로생긴 판교 나인트리프리미어호텔에서 오~랜만에 호캉스를 즐겨보기로 했어요 ♡ [파미어스몰 위치 및 영업시간] 경기 성남시...,2021. 9. 18.
[판교뷔페] 마키노차야 판교점,마키노차야 판교점 경기 성남시 분당구 판교역로 145 알파돔시티 2동 라스트리트 B1층 주차가능 안녕하세요. 다니입니다:) 오늘 소개해드릴 곳은 얼마 전에 다녀온 마키노차야입니다. 원래는 이 날 가족여행을 가기로 계획해뒀으나... 코로나가 심해져 여행은 미뤄두고 점심만 같이 하기로...,2021. 8. 15.
"남양주 맛집, 불향가득한 가성비 덕소숯불고기 본점",드시고 여행하세요~~~ 덕소숯불고기 성남점 위치 : 경기 성남시 수성구 산성대로 3층 318호 영업시간 : 매일 11:00~21:00 전화번호 : 031-746-1100 덕소숯불고기 부천점 위치 : 경기 부천시 소사로 829 영업시간 : 매일 11:00~22:00 전화번호 : 0507-1383-3892 덕소숯불고기 일산점 위치 : 경기 고양시 일산동구...,2021. 8. 9.
"[분당 KT 맛집, 이태경 순대국] 당신의 순대국 취향은 무엇입니까?","진하고 얼큰한 국물의 순대국을 먹고싶어하다가 바로바로 집 앞 KT 먹자골목에 ""이태경순대국"" 이 맛있다는 소문을 듣고 다녀왔어요~~ 분당 정자 KT맛집 이태경 순대국의 정보를 알려드려요 경기 성남시 분당구 불정로77번길 4-1 031-713-5392 매일 11:00 - 21:30 매일 15:00 - 17:00 (Break Time) 어스름이 끼인 저녁...",2020. 4. 9.
[피렐리] 월드투어 파트너 - 피렐리 X 스캇미첼튼 스폰서십 (피제로벨로튜블러...,싸이더스바이크 경기 성남시 분당구 황새울로 224 청구블루빌 105호 031-717-3184 성남시 지브 인터네셔널 경기 성남시 중원구 성남대로997번길 49-4 1층 031-722-0984 부천시 잇츠바이크 경기 부천시 신흥로 252 032-665-3247 안양시 찬스 스포츠 경기 안양시 동안구 전파로 88 101호...,2020. 3. 31.
"중산층 위한 뉴스테이 사업 집값폭등으로 돈방석, 최대 8배","오전 10:36 경기 성남시 분당구 대장개발지구 아파트.사진은 기사와 무관.집값 폭등으로 ‘뉴스테이’(기업형 임대주택) 사업이 돈방석에 앉게... 넷플릭스 대박 쳤다…3주 만에 시총 24조 껑충 [이슈픽] 1시간전 ￼ 2 한국, 무비자로 190개국 여행 가능 ‘세계2위 파워여권’ 13시간전 ￼ 3",2021. 10. 10.
외출·여행 자제 권고에도 동해안은 '북적'..방역 비상,https://news.v.daum.net/v/20200919191827842 [앵커] 외출이나 여행을 자제해달라는 정부 권고에도 주말인 오늘(19일) 강원 동해안에는 많은 사람들이... [관광객/경기 성남시 분당구 : 여기는 아무래도 사람들 거리도 떨어져 있을 수도 있고 자연도 볼 수 있고 하니까 안심이 되는 것 같기는 해요. 서울 이런...,2020. 9. 19.
