header,contents,date
"[경기도 연천/철원 가볼만한 곳] ""임진강... (with. 날씨 좋은날, 가을 꽃 여행지)",완연한 가을날 언택트 여행코스로 좋은 곳 위드미니 새롭게 조성된 연천군 여행지로 그 주위게 근접한 파주나 철원에서도 꽤나 가까운 사진 찍기 좋은 곳이다. (ര̀ᴗര́)و ̑̑ 기회되면 다시 가보고 싶은 곳. 자동차 없음 가기 어렵다는 것이 함정 트루 드라이브 코스이다. 댑싸리공원 경기...,2021. 9. 28.
경기런데이투어 추천 러닝 코스 Vol.11 「연·천·군」,"열한번 째 런데이투어 테마는 바로 구석기 시대 걷기여행 #경기도 #연천군 #구석기시대 #유적지 #러닝코스 #유네스코 #데이트코스 오늘은 구경할 거리가 많아 어서 소개시켜드리고픈 곳, '연천군'입니다. 얼마전 도쿄올림픽 개막식이 생각보다 무미건조(?)하면서 경기도민체전 개막식...",2021. 9. 9.
경기도 포천.연천 가볼만한곳.비오는날 폭포투어 [비둘기낭폭포-한탄강하늘다리-화적연...,주차장있음 연천군 최고의 명소 답게 보자마자 입이 떡벌어지는 어마어마한 규모의 폭포네요 폭포주변으로 거대한 협곡도 멋있었어요~ 사진으로는 담을 수 없는 멋진 폭포에요~! 이번 폭포 투어에서 가장 멋졌던곳 이에요~! 경기도 가볼만한곳 포천.연천 여행지 비오는 날 가볼만한 여행지...,2020. 8. 21.
"연천 재인폭포, 포천 비둘기낭 폭포, 한탄강 하늘다리, 반나절 경기북부 폭포 돌아다니기","포천 지질여행의 기점은 비둘기낭폭포다. 비둘기낭폭포 한탄강 8경 중 하나. 약 27만 년 전 용암 유출에 의해 형성된 현무암 주상절리 협곡에서 형성된 폭포이다. 폭포의 주변에 하식동과 주상절리, 판상절리가 존재해 철원군, 연천군 지역의 지형, 지질학적 형성 과정을 이해하는데 중요한 단초를...",2021. 8. 14.
"호로고루 부근 전망 좋은 연천 카페, 고랑포이야기",연천 장남면에 여행을 오셨다면 고랑포이야기에서의 커피 한 잔의 여유 어떠신가요? 고랑포이야기 주소 : 경기 연천군 장남면 장남로 205 지번 : 경기 연천군 장남면 고랑포리 109-4 연락처 : ***-****-**** 영업시간 : 주말 10:00~18:00/공휴일 10:00~18:00,2020. 5. 6.
★★파노라마로 담아본 연천 호로고성 일몰 풍경 / 연천여행 / 연천 가볼만 한곳...,#해바라기일몰 #연천군 #연천가볼만한곳 #연천여행 #경기북부 #연천일몰좋은곳 #연천호로고성 #연천호로고성해바라기일몰 #해바라기일몰좋은곳 #해바라기 #호로고성해바라기 #호로고성일몰 #호로고성주변출사지 #연천일몰 #경기북부출사지 #경기여행 #경기도가볼만한곳 #주말여행 #파노라마사진,2021. 9. 6.
동아시아의 상징적인 선사유적을 배우는 연천의 '전곡선사박물관',"아름답고 맑은 자연이 있는 연천으로의 여행, 전곡선사박물관에서 시작해 보시면 어떨까 합니다. 사이트 : 월요일 휴무 (월요일이 공휴일일 경우 제외) 주소 : 경기 연천군 전곡읍 평화로 443번 길 2 TEL : 031-830-5600 금액 : 무료 홈페이지 : https://jgpm.ggcf.kr/ - 기자단 강영훈 -",2021. 1. 8.
"<경기-천개의 기억>특별전, 북부청사 경기천년길 갤러리에서 진행 중!","바로 연천군의 풍경인데요, 좌측은 연천의 아우라지이고 우측은 연천의 재인폭포로 김병구 작가의 작품입니다. 김병구 작가의 작품 아우라지는 두... 경기북부의 수려한 자연환경과 문화유산 등을 마치 실제 현장에 방문해 보는 것처럼 생동감 있게 촬영된 작품들이 많아, 감상하는 동안 여행하는...",2020. 11. 3.
"연천에서 즐기는 글램핑, 사나래글램핑파크","주소:경기 연천군 왕징면 북삼리 209-2 겨울에 글램핑을 무서워하시는 분들이 있을 텐데, 전기요, 온돌, 히터가 준비되어 있어요. 제가 숙박해봤는데... 요즘 언택트 여행이 대세일 때는 캠핑장 만한 곳이 없는 것 같아요. 연천의 겨울 풍경도 즐기면서 캠핑의 묘미도 즐길 수 있는 글램핑으로 추억...",2020. 12. 31.
연천의 드라이브 코스 추천 당포성,"세계지질공원 후보지, 당포성 화창한 날씨 속 푸릇푸릇 한 나무들 사이로 보이는 임진강을 따라 떠난 역사여행지는 경기도 연천군 미산면 동이리 778 번지에 위치한 당포성 입니다. 주차장에 차를 주차 후 길을 따라서 걸어가는 동안에 펼쳐진 확 트인 당포성 주변은 너무나 아름다웠습니다. 고구려...",2020. 7. 21.
울창한 숲과 아름다운 경관 고대산 자연휴양림,맞는 연천군의 여행지 고대산 자연휴양림을 다녀왔는데요. 숲속의 공기처럼 깨끗하고 맑은 휴양림 내부와 몸과 마음의 힐링을 도와주는 외부의 풍경이 더해져 추운 날씨에도 마음이 따뜻해지는 고대산 자연휴양림을 소개해드립니다! 자연과 함께 숨 쉬며 심신을 씻어낼 수 있는 곳 경기도 연천군...,2020. 12. 6.
"연천 카페 - 재인폭포근처카페, 분위기 좋은 감성카페 연천회관!",연천회관에서 재인폭포까지 7km 정도라 둘이 묶어서 여행하기 좋다. 연천카페 연천회관. 경기 연천군 연천읍 평화로1219번길 42 매일 11:00 - 21:00 수휴무 반려동물 동반(이동케이지 지참) 주차장 있음. 외관부터 내부 분위기까지 내 취향:) 건물 보면 아마도 창고였을 거 같은데.. 노출 인테리어로...,2020. 10. 9.
"연천 가족 여행 추천, 두루미마을 그린빌리지",수 있는 전곡선사유적지와 선사박물관도 있어 아이들을 동반한 가족단위 여행지로 최적일 것 같습니다. 연천의 두루미마을을 찾아 깨끗한 자연 속에서 여러 체험을 즐기며 재미있는 시간을 가져보는 것도 좋을 것 같습니다. 두루미마을 그린빌리지 주소 : 경기도 연천군 중면 군중로 324 -기자단 이기석-,2021. 6. 17.
[전곡'주먹도끼'] 1년전☆ 밤꽃향 가득한 무릉도원!☆,"고대의 유적으로 가는 길은 모두 시간여행길이겠지만 경기 연천군 전곡 구석기유적은 좀 더 특별한 느낌이 있다. 바로 우리가 상상할 수 없을 정도로 오래된 시대에 사람들이 살았던 흔적이기 때문이다. 전곡유적은 적어도 30만 년 된 곳이니 한 세대를 30년이라고 치면 1만 세대 이전, 즉 까마득한...",2021. 6. 12.
"백학마을의 이야기를 담은 아침해협동조합, DMZ 마을여행사","주소 : 경기 연천군 백학면 두일로 143번 길 41 전화번호: ***-****-**** 이름 : 아침해 협동조합 DMZ 마을여행사 남과 북이 휴전선을 경계로 대립하고 있는 DMZ마을. 백학면은 역사적인 사건들이 집약된 곳으로 소개할 곳이 많은 마을입니다. 경순왕릉 , 숭의전 , 호로고루성, 고랑포등 연천 가볼 만한 곳을...",2020. 12. 30.
[연천여행] 북녘땅을 바라보며 고대산을 걷다!,"고대산, 경기도 최북단 연천군 신서면 신탄리에 위치한 민통선이 가장 가까운 산입니다, 사실 군생활을 이 근처에서 했기때문에 고대산은 일찍이 잘 알고 있었는데 이상하게 가고 싶은 마음이 일지않았습니다, 소요산도 마찬가지고요, 아마 군대를 갔다오신 분들이 다 하는 말이 있죠, 제대하면서...",2021. 8. 16.
5월의 네 번째_ 연천여행 / 연천 재인폭포 / 한탄강관광지 / 연천노지캠핑 / 일상,그럼 저의 한 주 또 공유하러 가요 급 날 좋아서 놀러나가기 여기는 한탄강관광지예요 주소 - 경기 연천군 전곡읍 선사로 14-72 Hya 〰 말해뭐해... 담에봐여 #연천여행 #연천놀거리 #한탄강관광지 #연천재인폭포 #재인폭포 #전곡일품손짜장 #한탄강 #한탄강맛집 #연천맛집 #철원놀거리 #차박...,2021. 5. 20.
연천 고랑포구의 별과 군마(軍馬) 레클리스 하사 이야기,펀치볼의 사진여행. 임진강은 한국전쟁 전까지 연천군이 경기북부 최대의 무역항으로 발전할 수 있었던 요인이었습니다. 지금은 쇠퇴하고 볼품없으며 더구나 일반인들은 출입할 수 없게 된 고랑포구가 그렇게 번성할 수 있었던 이유는 바로 이곳까지 임진강을 따라 밀물이 들어왔기...,2021. 9. 9.
[경기 연천]파주 근처 자유로CC 대한민국통일!!코스 한번 떠나보시죠! + 이용후기,자유로CC 주소 : 경기 연천군 백학면 노아로297번길 179-55 전화번호 : 031-839-1500 자유로CC는 연천군 백학면에 위치해있는데요. 백학면 = 딱보니까 백학이 논다 뭐 이런 의미구만요 (사실 공홈에 나와있습니다.) 오염되지않은 공기로 때묻지 않은 청정 자연을 만끽할 수 있는 27홀 골프코스가 있어요!...,2021. 5. 9.
"한탄강의 아름다움을 대표하는 경관 명소, 재인폭포",가족과 함께 오붓하게 여행하기 좋은 연천입니다. 타인과의 접촉을 최소화하고 가족끼리만 머물며 힐링 하기 좋은 숨겨진 곳들이 참 많은 곳으로 비대면 시대 힐링 여행지로 추천해봅니다. 주소 : 경기 연천군 연천읍 고문리 산21 금액 : 무료 시간 : 오전 10시 ~ 17시 - 기자단 강영훈 -,2021. 1. 1.
[맛집]연천 현지인 추천맛집 금수강산,금수강산 경기 연천군 신서면 고대산길 60 031-834-1399 매일 10:30 ~ 21:00 입구에 들어와서 적당한 곳에 주차를 하면 됩니다. 본체 외관입니다.... #연천가볼만한곳 #연천여행 #연천맛집 #연천고대산맛집 #고대산근처맛집 #연천오리백숙 #산야초능이버섯백숙 #생생정보 #계곡백숙 #능이백숙...,2021. 10. 6.
2020.09.13. 연천 해바라기 명소 ‘호로고루’,"이름 헷갈렸는데 이제 다 외움 연천 호로고루 경기 연천군 장남면 원당리 1258 서울 근교인데 또 그렇게 가까운 곳은 아니다,, 일단 뭐~! 가는 길은... 것도 행복했다 꼭 다시 가보고 싶은 곳! 운전하느라 고생해준 OD에게도 고마운 마음 전합니다 -끝- #연천호로고루 #해바라기꽃밭 #서울근교여행 #경기여행",2020. 10. 20.
코로나 여행지 추천 경기도 연천군 시리즈 2탄 맛집 카페 (연천회관),"백신접종이 본격화되면서 경기 정상화에 따른 여행, 호텔, 항공 등의 분야가 다시 주목을 받고 있습니다. 저 또한 한적한 여행을 찾게 되고요^^ 오늘은 코로나 여행지 추천 연천 맛집(카페)2탄 연천회관입니다. 경기도 연천 추천카페 연천회관 연천회관은 네이버지도를 찍고 가시면 편하실거구요....",2021. 2. 24.
연천 군남면 마음이 따뜻해지는 기부카페 누리빈스,"가족, 연인, 친구끼리 연천 여행을 한다면, 군남면 기부 카페 누리빈스에서 커피나 차 한잔하는 여유로운 시간을 가지며 소중한 여정을 만드시길 바랍니다. 주소 경기 연천군 군남면 83(군남면 진상리 643-5) 문의 031-832-0062 기부카페 누리빈스 - 기자단 홍성종 -",2020. 12. 6.
연천 사진 찍기 좋은 명소 임진강 주상절리,"아름다운 명소 임진강 주상절리 꼭 한 번 들러보세요! <임진강 주상절리> 주소 : 경기 연천군 미산면 동이리 [네비게이션에서 ""동이리 주상절리""로 검색 시 검색 가능] <주변 명소> 관광지 : 당포성, 임진물새롬랜드, 유엔화장장시설, 허브빌리지 맛집 : 황해냉면, 고려가든",2020. 6. 5.
연천의 근현대사를 담고 있는 고랑포구 역사공원,지역 여행을 떠나게 되면 빠질 수 없는 코스! 그 지역의 역사를 알아보는 것인데요. 고랑포구역사공원은 연천의 역사를 생생하게 담고 있다고... 연천과 한 걸음 더 가까워져보는 것이 어떨까요? 경기 연천군 장남면 장남로 270 031-835-2002 매일 10:00 - 17:00 매주 월요일 휴장 (월요일 공휴일 시 화요일 휴장),2020. 8. 19.
"경기연천 호로고루성지(드라마VIP촬영지,사적 제467호) & 북에서 온 광개토대왕릉비",※ 연천 호로고루 경기도 연천군 장남면에 있는 삼국시대 고구려의 성지 사적 제467호 임진강에 접한 현무암 천연절벽 위에 있는 강안평지성... 임진강의 시원시원한 뷰를 감상하며 차한잔하고 오늘의 코로나여행은 마무리다. 초여름에 오면 경치가 더욱 끝내주겠다....끝..,2021. 4. 1.
자연이 만든 포토 스폿가득! 연천 여행때?****,뻔한 듯 뻔하지 않은 허브 빌리지 허브빌리지 경기 연천군 왕징면 북삼리 222 연천하면 빠질 수 없는 대표적인 여행지인 허브 빌리지. 스테디 셀러가 베스트 셀러라는 말이 있지 않은가. 그 말은 허브 빌리지에도 적용되는 듯 하다. 뻔한 여행지인 듯 하지만 여전히 많은 여행객의 발길을 끄는 필수...,2021. 7. 6.
경기정원문화박람회 발전방안 연구 [경기연구원 연구보고서],"도시의 숲이 되다‘, ’집으로 가는 길, 정원‘, ‘평화의 정원’, ‘정원으로 떠나는 소풍 여행’, ‘정으로 물드는 뜰’. 정원이란 용어를 직접적으로 사용하는 경우가 다수입니다. 경기정원문화박람회의 과제 ▶대표 이미지 없다 경기정원문화박람회는 성공적이었지만 맹점도 있는데 그간의...",2021. 8. 23.
연천닭갈비맛집 동막계곡 동막골계곡 연천여행 연천가볼만한곳 우니메이카연천,<연천맛집> 동막골 숯불닭갈비 주소 경기 연천군 연천읍 동내로 35 동막골 숯불 닭갈비 영업시간 매일 10:00 - 21:00 주차장에 차들이 옴총 많은걸보고 예감했어요. 진정한 맛집이라는것을.... 부푼기대를 안고 들어갔는데 정말 사람이 많더라고요. 넓은 매장에 꽉찬손님. 얼른 포장주문하고 밖으로...,2021. 8. 22.
비 내리는 날 혼자 여행) 다시 가보고 싶은 '호로고루',비 내리는 날 혼자여행) 다시 가보고 싶은 호로고루 이른 아침부터 비 내리는 소리 오랜만에 혼자 연천에 있는 호로고루로 향합니다. 운전하며 듣는 음악도 우산에 떨어지는 빗소리도 눈앞에 보이는 풍경도 잔잔히 부는 바람도 비 내리는 흐린 날이 이렇게 좋다니... 연천 호로고루 경기 연천군...,2021. 5. 16.
나혼자산다 텐트 박나래 차 나이 기안84 패딩 빙어낚시 재방송 꼭!!,함께 여행 갔을때는 긴장이 되서 그런지 그냥 자라고 말도 했었죠. 왜냐고 그러니까 쑥쓰러워서라고 ㅋ 기안84는 실제로 혼자 있는 것보다... 위치는 경기 연천군 미산면 아미리 날씨가 딱 추워서 큰 저수지임에도 불구하고 완전 꽝꽝 얼어있는 저수지의 모습을 볼 수 있었습니다 박나래 패딩은...,2021. 1. 10.
"연천 이색 카페 로컬푸드 매장, 세상의 모든 아침",근처 길이 고랑포길 평화누리길 10코스가 맞닿아있어서 걷기 여행을 하시는 분들이 지나다가 들리면 참 좋을듯하네요. 세상의 모든 아침 주소 : 경기 연천군 장남면 장백로 254 지번 : 경기 연천군 장남면 원당리 689-3 연락처 : 031-835-0303 영업시간 : 매일 09:00~19:00,2020. 5. 4.
연천 가족과 함께 가볼 만한 곳 허브빌리지,"오랜만의 여유를 즐기며 자연 속에서 천천히 산책을 즐길 수 있었던 연천 허브빌리지였습니다. 허브빌리지 주소 : 경기 연천군 왕징면 북삼로 20번길 55 전화번호 : 031-833-5100 이용 요금 : 성인 7,000원 / 소인 4,000원 ※군남면, 왕징면 주민 무료",2020. 5. 20.
발레리나 김리회 남편 강도한 나이•인스타•직업•학력•작품활동•필모그래피•고향...,즉흥 여행을 떠났다. JTBC 예능프로그램 '내가 나로 돌아가는 곳 - 해방타운'에서는 윤혜진이 아끼는 후배 김리회를 구출해 함께 별을 보러 간... 해방타운 윤혜진 별 보러 간곳 이름 상호 연천 당포성 위치 주소 어디 경기 연천군 미산면 동이리 당포성 전화번호 연락처 031-839-2144,2021. 8. 3.
연천 잠시 쉬어갈 수 있는 카페 느린걸음 카페,평화 누리길을 걷다 쉬어갈 수 있는 이곳. 다음 이용자를 위해 깨끗이 사용한다면 더할 나위 없겠죠? 위치 : 경기 연천군 미산면 청정로 1706번 길 118 임진물세롬센터2 여행자들의 쉼터 같은 곳 느린걸음 카페에서 쉬어가보아요 :),2020. 7. 21.
연천읍 봄 역사 나들이 추천 고인돌공원&현충탑,"선사시대로부터의 기록을 만나는 곳, 고인돌공원 다음 역사여행지는 바로 고인돌공원입니다. 조선왕가, 현충탑에서의 조선시대, 근대 역사를 만났다면 이곳은 그보다 오래된 선사시대로부터의 기록을 만나는 곳입니다. 통현리 고인돌공원 : 경기 연천군 연천읍 통현리 197-5 연천 고인돌공원은...",2020. 5. 2.
"[연천/폭포]연천 가볼만한 곳, 가을에 걷기 좋은 재인 폭포",재인폭포 경기 연천군 연천읍 고문리 산21 매일 10:00-17:30 하절기 매일 10:00-16:00 동절기 재인폭포란 : 한탄강에서 가장 아름답고 멋진 경관을... 굳굳 재인폭포 근처 카페가 궁금하다면 #연천꽃축제 #연천여행 #경기도여행 #연천갈만한곳 #연천가볼만한곳 #연천관광지 #연천재인폭포 #경기도재인폭포...,2021. 9. 22.
경기도 연천 여행,여행 가자고 살살 꼬셔서 집에 있는 빵과 따뜻한 물을 챙겨 아침 일찍 나섰습니다. 호로고루 경치가 좋다는 얘기를 들었고 어제 비가 내렸으니 물이 많아 폭포도 볼만할 것이라 생각되어 계획도 없이 경기도 연천으로 달렸습니다. 경기도 연천 호로고루 전화번호 : 031-839-2144 주소 : 경기 연천군...,2021. 4. 4.
연천 미라클 타운 태교여행,태교여행으로 연천 미라클 타운에 다녀왔다 급하게 예약하고 방문했는데 평일이라서 한가하고 아주 좋았다 사람들이 북적이는 것보다 편했다 ***-****-**** 경기 연천군 군남면 군중로 134 연천 미라클 타운 입실 14:00퇴실 11:00 사무실 앞에 있던 고양이들 완전 사람 손이 많이 탄 애들이라서...,2021. 5. 1.
"[연천군] 비룡대교 아래, 임진강 비룡대교 전경, 캠핑, 차박으로 강추!!",경기근교#서울근교#연천군#백학면노곡리#비룡대교아래#위치#임진강#비룡대교#풍경#전경#자연#요즘대세#캠핑#캠핑용품#나들이#램프#블루투스스피커#차박#차크닉#삼겹살#항정살#테라맥주#우동#저녁메뉴#장소#강추#추천#방문후기#노을맛집#사진맛집#일상#소통#기록#커플데이트#커플차박#당일치기...,2020. 10. 10.
[경기도/연천] 여름이 끝나갈 때쯤 다녀왔던 예쁜 펜션미라클타운과 한옥카페 세라비...,9월 중순쯤에 다녀왔던 연천미라클타운~ 엄마 생신에 맞춰서 가족여행으로 다녀왔어요 엄마가 좋아하실 스타일로 언니가 고르고 고른 엄청 예쁜... 예쁘거든요 경기 연천군 군남면 군중로 134 연천미라클타운 T.010-6580-6334 입실 pm02:00 퇴실 am11:00 경기 연천군 군남면 군중로 134 세라비 한옥카페 T.0507...,2021. 3. 9.
여행지 추천 : 역사를 느낄 수 있는 흥원사&여우고개쉼터,오늘의 왕징면 이야기였습니다. 흥원사 주소: 경기 연천군 왕징면 왕산로65번길 116-53 전화번호 : 031-839-2717 연천 여행 가시면 꼭 들러봐야 할 흥원사&여우고개쉼터 였습니다! 역사 여행은 정말 남는 게 많은 여행이죠 조선시대로 여행해보시는 건 어떠세요?,2020. 3. 8.
연천여행 당일치기 연천가볼만한곳ᆢ고구려성곽 호로고루ㆍ청보리밭ᆢ 연천...,당일치기 여행지로 서울에서 1~2시간 걸리는 경기북부 연천 고구려성곽지 호로고루를 가보려한다. 반짝이는 청보리밭이 예쁘고 VIP드라마촬영지... 해바라기도 예쁠듯ᆢ 주차 입장료무료ᆢ 재인폭포 경기 연천군 연천읍 고문리 산21 주차장에 차를 주차하여놓고 둘레길은 따라 걸어간다....,2021. 5. 28.
아름다운 국내여행지 경기도,"▶경기도 ▸제1코스(강화, 김포. 인천으로 떠나는 1박2일 여행) ▪제1일차 ▸인천 강화군에서 여행시작. ▸10:00 전등사 ▸위 치 : 인천 강화군... ▸16:30 전곡리유적지 ▸위치 : 경기 연천군 전곡읍 양연로 1510 ▸개요 : 1978년 한탄강변을 거닐던 주한미군 병사가 우연히 발견한 네 점의...",2021. 1. 9.
임진강을 바라보며 즐기는 낭만! 임진강힐링카라반,경기 연천군 장남면 장백로330번길 46-101 031-835-6000 http://연천카라반.kr/ 벌써 반이나 흘러가버린 올 한 해 동안 바쁘게 일상을 살아오며 지친 몸을 달래고 싶지 않나요? 임진강힐링카라반에서는 연천의 아름다운 자연 속에서 여유를 느끼며 프라이빗한 여행을 즐길 수 있답니다! 이름부터 힐링이...,2020. 8. 18.
"[연천/선사유적지] 연천 가볼만한 곳, 아이와 방문하기 좋은 : 연천 전곡리유적","전곡리유적 경기 연천군 전곡읍 전곡리 529 매일 09:00-18:00 하절기 매일 09:00-17:00 동절기 공휴일 휴무 1월1일, 매주 월요일, 공휴일 다음날 휴무... #연천 #경기도여행 #연천관광지 #연천가볼만한곳 #연천갈만한곳 #연천호로고루 #연천재인폭포 #연천전곡리유적 #전곡리유적 #경기도아이랑 #연천아이랑...",2021. 9. 21.
어린이날 기념 단양여행~ (feat. 시그니처 맑은샘물),"한번에 짐을 옮기니 편하긴하다 ㅋㅋ 우리 아파트는 지하주차장 연결도 아닌데다 5칸 계단도 있어서 여행가려면 짐을 메고, 들고, 끌고... 홈플에서 데려온 500미리 생수도 챙기고~^^ (우리집에 물먹는 하마가 셋이요~ ㅋㅋ) 경기 연천군 백학면 / 경기 산청군 지리산 일대의 수원지에서 생산되는...",2021. 5. 6.
연천 여행 코스 추천 평화누리길,"아름다운 걷기 길, 연천에서의 기록 무려 189km의 대장정은 쉽게 시작할 수 있는 길은 아니지만 경기북부의 아름다운 풍경과 역사 문화를 만날 수 있는 곳들이 많아 여행 코스를 살펴보는데 가장 먼저 알아보기 좋은 곳들입니다. 연천군 평화누리 길은 10코스 고량포길로 시작합니다. 장남면...",2020. 3. 14.
비무장지대(DMZ)와 평화를 위한랜선 평화관광,여러분의 여행으로 DMZ는 전쟁의 아픔을 딛고 평화의 공간으로 다시 태어납니다. <이름 없는 땅>은? 한국관광공사와 올어바웃이 함께 만든... 있음 경기 연천군 장남면 장남로 270 홈페이지: www.yccs.or.kr 문의처: 031-835-2002 #고성 통일전망타워 고성통일전망대 민간인통제구역에 위치하고...,2021. 4. 9.
"[연천,파주/해바라기] 서울 근교 당일치기, 9월 명소 : 호로고루 해바라기밭, 해바라기 일몰",호고로루 경기 연천군 장남면 원당리 1258 호로고루가 9월 관광지로 핫하다는 말에 사람이 많을까봐 많이 걱정했어요! 예전보다 주차공간이... #9월여행지추천 #9월해바라기 #서울근교여행 #서울근교당일치기 #당일치기여행 #당일치기데이트코스 #서울근교데이트 #연천가볼만한곳 #연천관광지...,2021. 9. 17.
[써니부부의 여덟 번째 캠핑]연천 뷰 맛집 캠핑브릿지 애견동반 가능,그쳤지 뭐에요^^ 캠핑브릿지 경기 연천군 장남면 술이홀로63번길 41-17 ***-****-**** 연천 캠핑브릿지 사이트 배치도 써니부부가 4박 5일 동안 지낼 아카시아존에서 바라본 뷰~~ 폭우로 흑탕물이 된 임진강과 장남교가 보이는 뷰에요 아카시아존은 두 사이트만 있는데 캠핑브릿지에서 살짝 안쪽에 있고...,2020. 8. 4.
연천 아아와 가볼만한 곳 우주선을 타고 떠나는 시간여행 전곡선사박물관,"연천 아아와 가볼만한 곳으로 우주선을 타고 떠나는 시간여행, 전곡선사박물관에서 알찬 시간 보내시길 바랄게요. ▶▶ 전곡선사박물관 ◀◀ - 전화 : 031-830-5600 - 주소 : 경기 연천군 전곡읍 평화로443번길 2 - 영업시간 : 매일 10:00 - 18:00 - 휴무일 : 매주 월요일 (월요일이 공휴일일 경우 제외)",2021. 7. 11.
연천 가볼만한곳 경기도 당일치기여행으로 아이들과 가기 좋은곳,"막상 가보니 유적지나 박물관, 자연경관을 볼 수 있는 곳이 많아 경기도 당일치기여행으로 아이들과 가기 좋은곳이라 보여드려볼께요. 1. 연천 당포성 주소 : 경기 연천군 미산면 동이리 778 번호 : 031-839-2144 가장 먼저 소개해드릴 곳은 당포성인데요. 삼국시대 성으로 호로고루, 은대리성과 함께...",2021. 3. 8.
