header,contents,date
의정부 독립출판 클래스 '옥상에앉아X독립출판해영' 2기,상세정보 ⏰일정 : 2021년 9월 26일 ~ 10월 24일 (5회 과정) 매주 일요일 오전 10시~12시 ✍진행 : 글짓는 여행자 해영 장소 : 의정부시 신곡동 '책방... 7월 ~ : 경기 꿈의학교 '나의 굄성 프로젝트' 독립출판 매거진 외부 강연 진행 중 (3회) 2021년 9월 ~ : 『믿을 구석은 회사가 아니었다』 출간 준비...,2021. 8. 31.
오늘의 재재 소식 - 2020.10.24.,사무실 -주소:경기도 의정부시 의정부동 365-62 1층 -전화번호:032-826-3318 -팩스:031-826-3319 2. 의정부 장암3구역 총회 개최 예정 장암1구역과 장암5구역 사이에 있는 장암3구역은 지난 7월 10일자로 조합원분양신청이 완료되었습니다. 전체 조합원 226명이고 조합원분양신청은 93%에...,2020. 10. 24.
코로나 확진자 동선 (21/5/3),경기안양시고등학교2관련 경기의정부시교회관련 경기평택화성지인여행관련 - 경남 확진자 발생경위 진주소재 교회 관련 진주 음식점Ⅱ 관련 사천 유흥업소 관련 양산소재 식품공장 관련 김해소재 보습학원 관련 통영소재 식품공장 관련 진주 지인모임 관련 진주 라이브 음식점,2021. 5. 3.
"[한국남자] 사찰→설명회, '교내전파 의심'도..""정부 방역만으론 한계""","이외에도 광주에서는 제주도 여행을 다녀온 70대 여성 환자가 입원했던 해피뷰병원에서 다른 입원환자 4명까지 총 5명이 확진 판정을 받았고... 경기 의정부시에서는 한 아파트에서 3개 가구, 6명이 확진 판정을 받았다. (그래픽=안지혜 기자) *****@******.*** ◇대전서 교내 전파 의심 사례…""추가...",2020. 7. 1.
퍼시픽 L 무광블랙 < 동두천 의정부 남양주 툴레 공식 경기 서울북부점 나누크 >,"오늘 방문하신 분도 평소 여행을 즐겨하시는 분이 루프박스등을 설치하러 방문하셨는데, 금액적 부담감에 망설이시다가 보급형으로 출시한... ## - 툴레, 아이캠퍼 경기 서울북부점 툴레나누크 031) 872-7527/ ***) ****-**** www.nanooks.co.kr 의정부시 경의로 9 (의정부동 534-5번지) 1층 툴레나누크",2020. 4. 22.
계곡 캠핑,"계곡놀이터경기 의정부시 산곡동 산94-1 백운계곡캠핑장경기 포천시 이동면 포화로 236-73(도평리 38) 계곡과느티나무캠핑장경기 포천시... 힐링여행 가평 오토캠 40,000원 ~ 백운오양골캠핑장오양골캠핑장에 오신 것을 환영합니다. 99,000원 ~ 동물카라반펜션특색이 있는 펜션 59,000원...",2021. 6. 13.
생방송 투데이 3월 6일 곰탕반 다보 문어 한 상 우리집반찬 금강산식당 묵은지찜,3GO 여행 편 #다보 주소 : 강원 동해시 묵호시장길 32 번호 : 033-533-2698 메뉴 : 문어 한 상 #한국해양레저 #반잠수정 주소 : 강원도 동해시 일출로 214 번호 : ***-***-**** 3. 우리 동네 반찬 가게 모자(母子)가 함께 만드는 억! 소리 나는 반찬 편 #우리집반찬 주소 : 경기 의정부시...,2020. 3. 6.
코로나 확진 50명…지역 28명·광주 15명 최다(종합),"광주 확진자는 광륵사, 금양빌딩(오피스텔), 여행 모임, 요양원, 사우나, 교회(2곳) 등 8개 시설과 모임에서 다수 발생하고 있다. 전날 하루 15명의... 서울 관악구 왕성교회와 경기 의정부시 장암주공 7단지 아파트 등 기존 집단발병 사 례에서도 접촉자를 중심으로 확진자가 나오고 있다....",2020. 7. 9.
[건강][코로나건강뉴스] 보건복지부 국민안심병원 지정 및 운영은 어떻게 하나?...,(1) 국민안심병원을 찾는 사람들은 먼저 호흡기 증상과 발열에 대해 검사를 받고 출입 가능 (2) 진료자의 해외여행 및 방문이력... 97 경기 의정부시 성베드로병원 외래진료 031-840-1700 98 경기 의정부시 경기도의료원의정부병원 외래진료 031-828-5000 99 경기 이천시...,2020. 2. 29.
"타이틀리스트 18"" SPINNER / 20"" SPINNER 캐리어백, 타이틀리스트 캐리어백 추천...","20"" 캐리어에 포함된 여행용 파우치 또한 20인치에서는 여행용 파우치 3pcs가 구성되어 있는데요! 다양한 여행용품을 수납하기... com/_xavlcxb/chat TINO5 의정부 031-852-8570 경기도 의정부시 호국로 1420 골드빌딩 (금오동 463-8) http://pf.kakao.com/_zxoeuT/chat TINO5...",2021. 8. 6.
[숙박] 스타호텔 | 의정부호텔 의정부모텔 호원동호텔 호원동 모텔 의정부 호캉스,의정부 스타호텔 경기 의정부시 호원동 460-14 스타호텔 031-873-0080 6월 18일(목) OPEN 주차장도 좌측에 우측에 양쪽으로 넉넉하게 있습니다. 공간이 넒직해서 주차하기 편하네요. 외관도 화이트와 골드가 섞여서 고급스럽네요. 실내가 깔끔하고 고급스럽게 인테리어 되어 있습니다. 객실 요금표...,2020. 9. 21.
"[의정부 맛집 / 의정부 골목식당 ] / 내돈내산, 내돈내먹 솔직 후기 / 딱새우, 스키야끼...","주소: 경기 의정부시 민락동 533-1 (경기 의정부시 오목로 136) 의정부 골목식당가는 쉬운 방법은, 의정부 민락중학교에서 kt건물 방향으로 길 건너면... 집들이는 정말로 너를 제일 먼저 초대할게 ㅤㅤ ㅤㅤ ㅤㅤ ㅤ #커플끼리닮음 #신기해 ☺️ #제일좋아 #용란서인 #커플모임 #이렇게넷이여행도가고...",2020. 3. 2.
[ 의정부 마사지 샵 ] 의정부 커플마사지 받고싶은 의정부 수왓포태국마사지 ; 테디미의...,의정부 수왓포태국마사지 위치: 경기 의정부시 금신로 366 영업시간: 24시간 전화번호: 1688-4320 개강 선물엔 뭐다? 지친 일상을 달래줄 타이 마사지... 태국느낌 물씬나는 마사지샵 : 의정부 수왓포태국마사지 태국 여행을 온듯한 인테리어 강렬한 첫만남 들어갈때는 요 태국느낌나는 슬리퍼로...,2020. 3. 17.
"[의정부눈썹/의정부자연눈썹] 러브썸뷰티샵 :: 콤보기법으로 더 자연스러운 눈썹, 의정부...",연락처 0507-1326-4423 주소 경기 의정부시 장곡로596번길 19 골드타워602호 영업시간 평일 10:00 - 21:00 토요일 10:00 - 05:00 (일요일 휴무) 홈페이지 http... 여행가서 더이상 눈썹없다고 놀림 받지 않을수 있어요 ㅜㅜㅜ 아 진짜맘에든다 ㅜㅜ 오늘은 물이닿으면 안되고 바세린도 지워지지 않도록...,2020. 9. 16.
행복하고 즐거웠던 벌th데2✨ ( 메종키친 + 카페아를 ),"성원이랑 커피마시러 출발❗️ 후식으로는 핑크문이 유명한 #카페아를 로 결정 ✨ 카페아를 경기 의정부시 동일로 204 코로나 때문에 해외여행 못가는 요즘 여행온 기분 느끼게 해주는 카페 ❤️ 완전 유럽느낌이였음ㅠㅠㅠㅠㅠㅠ 유명한 만큼 주차는 헬이였규? 사람도 엄청 많았다,,,ㅎ 자세한...",2020. 10. 26.
#차박캠핑 알페온 아이캠퍼 루프탑텐트 스카이캠프2.0 브라운체크 < 아이캠퍼 경기...,"따스한 햇살과 가끔식 부는 산들바람은 우리들 마음은 이미 여행가는 차안에 있게 만드는것 같습니다.^^ 이렇게 날이 좋은날은 가족과 함께... ## - 툴레, 아이캠퍼 경기 서울북부점 툴레나누크 031) 872-7527/ ***) ****-**** www.nanooks.co.kr 의정부시 경의로 9 (의정부동 534-5번지) 1층 툴레나누크",2020. 5. 20.
[7월 7일] 코로나바이러스감염증-19 국내 발생 현황,"* (지역) 경기 18명, 인천 7명 경기 의정부시 아파트 주민이 방문한 헬스장 관련 1명(헬스장 확진자 지인의 가족)이 추가로 확진되어 누적... 구분 지표환자 확진일 관련 확진자 비고 광륵사 6.27 12명 금양빌딩(오피스텔) 6.27 25명 방문자 12, 가족 등 13 여행 모임 6.30 5명 가족 4 및 동행자 1...",2020. 7. 7.
의정부 카페 아를(Cafe Arles),앉아도 유럽 같은 곳 분수대도 있는데 그 사진은 못찍었네요ㅋㅋ 브런치 메뉴들도 있으니까 여유롭게 시간 보내면 될 것 같아요 코로나 때문에 해외 여행 못가서 너무 아쉬우니까요 의정부 카페 아를에서 유럽여행 하세요 주소: 경기 의정부시 동일로 204 카페 아를 매일 10:00 - 24:00 연중무휴,2020. 6. 27.
"품어서 하나의 숲을 만들 듯, 공생하는 예술",경기도 의정부시에 위치한 문화살롱 공은 어떻게 시작하게 되었나? 공간 이름이 재미있는데 ‘살롱’과 ‘공’은 어떤 의미인가? 2003년에... 수학여행 가서 만난 다른 지역 아이들이 “너희들 어디서 왔어?”라고 물으면 “천두동”이라고 대답한다고 했다. 자신들이 사는 지역에 대해 불편함을...,2020. 10. 20.
서울 근교 나들이 코스 추천: 파크프리베 레스토랑 & 카페,"식사에 풀 내음이 느껴지는 산책로에 맛난 커피가 있어 좋은 의정부 맛집 파크프리베. 서울 근교 아이와 가기 좋은 곳, 데이트 코스로 강력 추천하는 서울 근교 드라이브 코스입니다. 파크프리베 주소: 경기 의정부시 동일로 192번 길 28-27 전화: 031-873-9200 영업시간: 카페 10:00~22:00, 레스토랑 11:00~22:00",2020. 3. 9.
GH 바이러스 신소재 관련주 원방테크 우정바이오 주가 전망,"광주는 지난달 27일 광륵사에서 첫 환자 (지표환자)가 나온 이후 오피스텔, 교회, 요양원, 여행 모임, 사우나 등 총 8개의 시설·모임에서 확진자가... 또 서울 관악구 왕성교회와 경기 의정부시 장암주공7단지아파트 집단감염 관련 확진자도 1명씩 추가돼 누적 확진자는 각각 37명, 29명으로...",2020. 7. 8.
오후여담 교외선 재개통,"지난 8월 말 경기도와 고양시· 양주시·의정부시가 국가철도공단 등과 운행 재개 업무협약을 맺은 데 따른 것이다. 운행 노선은 의정부역... 기차역은 여행의 출발·도착지이자, 만남과 이별의 장소다. 달리는 기 차를 보면 어디론가 떠나고 싶다는 생각이 절로 든다. 이런 이유로 영화와 음악의...",2021. 10. 9.
배키우동 의정부일식맛집 (구) 레이와,"배키우동 의정부일식맛집 (구) 레이와 #의정부역우동,#의정부역카레,#의정부맛집, #의정부우동맛집#의정부일식맛집 코로나로 인해서 해외여행은... 배키우동 (구) 레이와 경기 의정부시 의정부동 140-22 1층 매일 12:00 - 22:00 월요일 00:00 - 24:00 제가 방문한 곳은 외관부터 일본 분위기가 물씬 풍기는...",2020. 7. 19.
시내버스가 잠시 나르는 드문 시내버스지,"서울시 여행 , 운행 , 시간 , 시 , 월 , 의정부 , 이용 , 변경 , 일 , 이동 , 의 , 출처 , 교통 , 농장 , 좌석 , 때 , 서울 , 필요 , 변화 , 등장 , 오후 , 차량 , 대중교통 , 의정부시 , 차 , 인천 , 기존 , 공식 , 환경 , 도보 , 단축 , 말 , 의정부역 , 이 , 역 , 출근 , 요금 , 정류장 , 주민 , 구간 , 원 , 규칙 , 도착...",2021. 9. 11.
전통시장 청년몰 입점을 희망하는 예비청년상인 모집안내!,"근대의 여행 2코스 한방의료체험타운 내 조성되는 청년몰로 한방관련 소재 먹거리, 음료, 한방, 뷰티관련 상품, 공방으로 특화 - (구성) 1층 카페... 비고 경기 의정부시 제일시장 25 25명(수제맥주전문 12개, 먹거리 8개, 개별점포 5개) ‘20. 10월 개장 예정 대구 중구 약령시장 20 20명(카페1개...",2020. 3. 15.
"목포 3GO 여행-영란회집·쑥꿀레…보쌈 톱5(달인보쌈), 마이따떡볶이","'목포 3GO 여행-영란회집·쑥꿀레…보쌈 톱5(달인보쌈), 마이따떡볶이' 뉴스를 알아봅니다. [생방송투데이 맛집] 목포 3GO 여행-영란회집·쑥꿀레... - 영업시간 : 평일 10:00-20:00 ◆ <빅데이터 랭킹 맛집> 수도권 최고의 보쌈 TOP5 편에서는 경기도 의정부시 ‘달인보쌈’을 소개한다....",2021. 3. 12.
의정부 금오동 맛집[조경제만두쟁이]집에서도 얼큰한 육개장 만두전골을 즐겨보자(100...,저도 조심히 뜯어서 다음에 매장갈때 들고가려고 챙겨놨어요 ㅋㅋ 포장이 너무 고급져서 부모님댁 갈때나 집들이 갈때 또는 여행갈때 들고 가도... 조경제만두쟁이 완전 강추드리고 가겠습니다♥ -조경제만두쟁이- 주소: 경기 의정부시 부용로 105 2층 전화번호: 031-852-0235 영업시간: 평일 10:00 - 21:00...,2020. 5. 12.
"남양주,""드라이브&당일치기"" 즐기는 여행~ 두물머리, 연핫도그, 대너리스 브런치 카페!","힐링 #여행 #낭만 #뷰 #연관검색어 #맛집 #장어 안녕하세요, 부자되자! 경기도 남양주, 쪽에 좋은 곳이 있다고 하길래~ 잠깐 콧바람도 느껴보고 싶어... 북쪽으로 포천시/의정부시, 동쪽으로 가평군,북한강을 경계로 양평군, 남쪽으로 한강을 경계로 광주시/하남시, 서쪽으로 구리시/서울특별시와...",2020. 10. 20.
수도권 산행 도봉산(다락능선~전망바위),"도봉동, 경기 의정부시, 양주군 장흥면 코 스: 도봉지원센타-녹야선원-냉골릿지-다락능선-배추흰나비바위전망-전망바위(명품바위)-뜀바위-마당바위-천축사-도봉지원센타 송년 산행지로 가까운 지인 몇 이서 도봉산으로 산행을 가기로 했다. 저녁엔 모임이 있어 아침 일... 사진속 여행이야기...",2020. 2. 17.
의정부 쭈꾸미 쭈꾸미아저씨 신곡점 쭈꾸미는 맛있게 맵다,양평이나 춘천쪽으로 여행 잘다니는데 지나는길 다시 들려 먹고 싶은 정말로 맛있게 매운 쭈꾸미 쭈꾸미아저씨네로 맛있게 매운 쭈꾸미 드시러 어서 오세요. 의정부 쭈꾸미 쭈꾸미아저씨 신곡점 *의정부 쭈꾸미아저씨 신곡점 찾아오시는길* 031-876-1442 경기 의정부시 발곡로23번길 9 지번신곡동 712-7...,2020. 1. 30.
"sbs생방송투데이 오늘방송 연락처 4월 8일 안성 고기부대찌개, 소갈비보약떡찜 서울...","섬여행, 대매물도 편 ▶<통영 요트투어 통크루즈> 번호 : ***-****-**** 2. 오천만의 메뉴 - 의정부 vs 송탄! 부대찌개 대탐구 편 ▶<고개부대찌개> 주소 : 경기 안성시 원곡면 만세로 999-2 번호 : 031-664-4900 (송탄부대찌개) ▶<명성부대찌개> 주소 : 경기 의정부시 호국로1309번길 5...",2020. 4. 8.
경기도청 북부청사 안내도입니다 세계속의 경기도 라도 되어 있네요,요리하기와 여행을 좋아하고 아이들을 사랑하는 의정부 삼둥이행복파파입니다. 네 저는 임대로 그곳에 살았고 집값 오르는 것만 배 아프게... 받으세요 의정부시에서 가장 많이 전출간 곳은 경기도 양주시입니다. 의정부 소풍길은 6개의 대구간과 3개의 소구간 총 9개의 구간으로 이루어져 있습니다....,2020. 12. 15.
인기 루프박스 모션XT 툴레캐리어 #올뉴스포티지 < 양주 의정부 성북 툴레 경기서울북...,"#가로바#루프박스#모션XT#블랙윙바 최근 가족단위 여행이 많아 지면서 캠핑이 더욱 붐을 이루고 있습니다. 이러다 보니, 루프박스등의 캠핑용... ## - 툴레, 아이캠퍼 경기 서울북부점 툴레나누크 031) 872-7527/ ***) ****-**** www.nanooks.co.kr 의정부시 경의로 9 (의정부동 534-5번지) 1층 툴레나누크...",2020. 8. 14.
"국내 코로나 확진자 현황, 추석연휴 전국 재확산 우려","또한 경기 지역의 코로나 확진자 현황을 보면, 의정부시 모델하우스 관련으로는 10명의 신규 확진자가 발생해 누적으로는 총 11명 입니다.... 또한 지인 및 가족여행모임 관련으로는 접촉자 추적관리 중 16명의 신규 확진자가 발생해 누적으로는 총 24명 입니다. 울산 남구 보험회사...",2021. 9. 17.
[문화도시의정부] '의퀴즈' 2편_의정부역 일대 / 청년크리에이터 김동석,"지난번 가능동, 녹양동에서 의정부 시민들과 만나며 어떻게 문화생활을 즐기고 있는지 이야기를 나눠봤다. 더운 날씨 임에도 상냥하게 응해준... “내가 경기북부지구 환경단체에 근무 한지가 오래됐는데 코로나 때문에 감시 활동을 못나가고 있어.“ 어르신께서는 환경을 지키는 활동에...",2021. 8. 31.
의정부 시내 보드게임카페 / 더조커,더조커 평일 13:00 - 23:00 / 주말 12:00 - 24:00 전화번호 031-840-5088 주소 경기 의정부시 태평로73번길 56 4층 코로나가 다시 재확산 되기 전에 다녀온 룸 보드카페 더조커! 원래 처음에는 홈즈앤루팡 보드게임카페를 갔는데 만석이래요...ㅠㅠㅠ 그래서 한참 기다려야 된다고 그래서 다른 보드카페를...,2020. 9. 7.
2021년 10월 4주차 사진전시 일정 (10/20~10/26),"/ 유비호(설치, 영상, 사진) [ 89 ] 제17회 수학여행 1번지 보은 역사현장기록사진공모전 전시회 / 백두대간 생태문화교육장(충북... / 박태균(*매주 금요일과 토요일 전시) [ 65 ] 2021 청소년수련관 보훈 사진전 / 회룡역 경전철역사(경기도 의정부시 평화로 363)...",2021. 10. 6.
간단한 심리테스트. 현재 나의 심리상태는? 심리테스트해보기,"자유여행을 원하고 있다 6: 욕구불만이 많다. 초조하며 신경질적이다. 어떠신가요?? 좀 맞는거 같나요?? 재미삼아 간단하게 해볼 수 있는... booking.naver.com ✿상담 및 예약 관련하여 편하게 연락 주세요✿ ☎031.876.4325☎ 경기도 의정부시 경의로 64 유림 빌딩 2층 다정한 ""꿀 손 테라피 휴"" 카톡 ID...",2021. 9. 30.
양념게장 간장게장 수미정 순대의 신세계 큰손집 마늘 떡볶이 웰빙마떡,"3GO> 편에서는 충남 태안으로 여행을 떠난다. 이곳의 정원낚시, ATV, 수미정 등을 찾아간다. ▷ 정원낚시 : 충남 태안군 남면 신온리(안면대로 1708)... 편에서는 경기 의정부시 ‘마이찬’을 소개한다. ▷ 마이찬 : 경기 의정부시 민락동(용현로)에 있는 반찬가게로 그날 그날 다른 메인국...",2020. 2. 28.
[중앙선데이]와 [헤럴드경제]와 [한겨레] 기사 중에서,"경기도 성남시 분당구에서 우동 가게를 운영하는 전모(52)씨도 “매장 내 가림막도 설치하고 방역에 만전을 기해왔는데 매장 취식 금지는 가게... 랜선 여행하니 오로라에 바닷속이 360°로 코앞 가족과 거리두기 못하는 고통 틈틈이 오디오북 들으며 해소 ""강제로 나 돌보기"" 시간으로 '코로나...",2020. 12. 27.
(본문에 이전 삽입 완료함)<2020년 8월 TV 방송에 소개된 맛집 정보모음으로 본문에...,사누끼우동 0507-1375-7806 / 031-261-7790 경기 용인시 기흥구 보정동 900-10 (이현로29번길 54-3) (달) 은둔식달 -평택 치킨 달인 (강준용 (男46세 경력 15년 ) <대창통닭> 031-652-9254 경기 평택시 평택동 283-1 (자유로3번길 23) (달) 은둔식달 -아산 냉면·수육무침 달인 (이유호...,2020. 9. 2.
생생정보 식당 8.3 ㅡ 8.14,"있어 여행하시기 좋은 위치에 있습니다. 넓은 운동장과 30여대의 차량이 주차가능한 주차장,여러편의 시설이 있고 무엇보다도... 오리해신탕/모둠버섯소불고기 ㅡㅡㅡㅡㅡㅡㅡㅡㅡㅡㅡㅡㅡㅡ 평양초계탕막국수 ㅡ 90명 031-874-6526 경기 의정부시 둔야로33번길 34...",2020. 12. 28.
의정부 민락동 맛집 / 먹골촌,"의정부 민락동 맛집 엄빠의 원픽 고깃집 먹골촌 먹골촌 매일 12:00 - 23:30 첫째 주, 셋째 주 화요일 휴무 주소 경기 의정부시 용현로150번길 14-18 전화번호 031-852-2777 급자기 가족끼리 외식을 하기러했슴다. 엄빠의 원픽 고깃집인 의정부 민락동 먹골촌! 민락2지구가 생기면서 민락1지구 상권이 많이...",2020. 8. 7.
의정부 두 번째 코로나19 확진자 동선 공개…,12일 의정부시 등에 따르면 의정부시 민락동에 사는 28세 남성 A씨가 영국과 프랑스를 다녀온 뒤 증세를 보이다 지난 11일 확진 판정을 받았다. A씨는 현재 경기도의료원 의정부병원으로 이송돼 격리 치료 중이다. A씨는 지난달 27일부터 지난 7일까지 영국 런던과 프랑스 파리를 여행한 뒤 8일...,2020. 3. 13.
"경기도, 올해 선정 유명 골목·거리 7곳서 '특색 이벤트'","양평 경기천년 테마골목, 가평 경춘선 시간여행 거리, 화성 전곡리 마리나 골목, 시흥 오이도 바다거리 등을 선정했다. 화성 전곡리 마리나 골목과... 의정부 부대찌개 거리는 의정부시 퓨전문화관광 홍보관 내 골목과 상인들의 이야기를 담은 전시 공간과 어린이를 동반한 가족들이 즐길 수 있는...",2021. 10. 4.
안전하고 편안하게! 경기도 설 연휴 대비 종합대책,경기도는 설 연휴기간 동안 도민 분들이 불편을 겪지 않도록 종합상황실을 설치하고 운영합니다. 자세한 내용 알려드릴게요~ 새해 복 많이... 751-1970 의정부시희망회복일시보호시설 의정부시 동일로 711번길 41-2(금오동) 846-4232 ※ 노숙인 일시보호소가 없는 시군에서는 응급잠자리...,2020. 1. 22.
오늘 의 역사 3월 1일-2일-3일,"국회의원 (경기 의정부시) 17대 18대, 19대, 20대 국회의원 2003년 2월 ~ 2004년 2월 : 청와대 대통령비서실장 1944 년 금융기관의 일요 휴무 제... 미국을 여행 중이었고 결국 뉴욕시에 정착하여 결국 미국 시민이 되 었습니다 1966 년 세인트루이스 심포니 오케스트라와 협연 한 Suite...",2020. 3. 1.
[백화점 푸드코트 창업] 수익률 최상의 창업아이템 신세계 백화점 의정부점 한식전문점...,"아무래도 장거리 여행은 위험하구 외출 자체가 제한적인 지금 다양한 체험, 식사, 쇼핑을 한번에 즐길 수 있는 백화점과 같은 특수상권으로 고객... 최근 의정부시 의정부동일대 청약 경쟁률이 34.8/1 최고치를 경신할 만큼 상권 자체 활성화도 기대되고 있어 신세계백화점 입점경쟁이 날이갈수록...",2021. 9. 2.
7월 사회적거리두기 단계,"* 델타형 변이관련 집단감염 총 6건 : (서울) 강남구의원, 수도권 지인모임, (경기) 경기가족여행, 경기지인모임, 의정부시음식점, 안양시동안구직장 [출처] 코로나19 수도권 특별방역대책 추진|작성자 ilooli 서울특별시 선제검사 확대 청·장년층 이용시설에 대해 집중 점검을 실시 거리두기...",2021. 6. 30.
로또복권 4등 당첨!!!2016년 상반기에 가장 많이 나온 숫자는 28번과 33번 입니다....,전곡리 480-16번지 32 명진슈퍼 경기 의왕시 고천동 295-26 33 - 경기 의정부시 신곡동 519-19번지 34... 837회차로또 로또 763회 1등 당첨 예상... 로또834 로또부동산이 추천하는 세종시 추천여행코스!나눔로또834회 복권 사야되는 꿈 베스트나눔로또834 전국의 로또 명당834회차로또...,2021. 1. 7.
"정세균 ""코로나 확진 외국인 비용, 이제 본인 부담"" .... 자고나면 커지는 집단감염...","광륵사에서 지난달 27일 첫 환자(지표환자)가 나온 이후 오피스텔, 교회, 요양원, 여행 모임, 사우나 등 총 8개의 시설·모임에서 확진자가... 또 서울 관악구 왕성교회와 경기 의정부시 장암주공7단지아파트 집단감염 관련 확진자도 1명씩 추가돼 누적 확진자는 각각 37명, 29명으로 늘었다....",2020. 7. 8.
뉴스클리핑 (2021.8.16.-2021.8.30.),"24 제주 곳곳 8개 동네책방 찾아 예술여행 한라일보 59 2021.08.24 ""명품 쇼핑과 예술 과학 체험 한 곳에서"" 대전신세계, 27일 문 연다... 23 ""문화 도시로 한 발짝"" 의정부시,경기도 옛길 조성사업 명칭 선정 중부일보 67 2021.08.23 코로나 이후의 일상 송파 ‘미래 조각’에...",2021. 9. 3.
[210923-국내] 억새가 유혹하는 비대면 가을 여행지 25선 [한국관광공사],"경기도 의정부시 도봉산은 북한산 둘레길 21개 중 8개를 품고 있다. 산을 타고 넘지 않아 힘들지 않고 산과 동행하듯 걸을 수 있다. 이중 19구간 방학동 길과 20구간 왕실묘역 길을 걸으면 간송옛집, 정의공주 묘, 연산군 묘 등 역사유적을 만날 수 있다. 수도권 대표 비대면 걷기 여행 코스다. ■ 2....",2021. 9. 23.
"민락2지구 미용실, 티지헤어 오테르의정부점 방문후기","여행이나 사우나 갈 때 작은 사이즈 꼭 필요한데 잘 가지고 있다가 사용할 예정이랍니다ㅎ 민락2지구 미용실, 티지헤어 오테르 의정부점 저는... 티지헤어 오테르 의정부점 매일 10:00-20:00 031-851-0405 경기 의정부시 오목로225번길 100, CY타워 2층 메이크업, 헤어스파, 두피클리닉 유아전용의자...",2020. 6. 18.
종합본 - 코로나19 극복 외식업체 소상공인 자영업자 피해기업 융자/보증 지원정책,"업체(여행업, 숙박업, 보건업, 외식업 등) ·(내용) 사업주가 지급한 인건비의 3/4 ~ 2/3(1일 상한액 6.6만원, 연180일이내, 월 최대 198만원)... 02-2110-6343 경기도 과천시 관문로 47 정부과천청사 1동 부산지방중소벤처기업청 소상공인과 ***-***-**** 부산광역시 강서구 녹산산단 335로 8...",2020. 3. 19.
