header,contents,date
경기김포시커플마사지 맘에 너무 들어서 소개해요,경기김포시커플마사지 맘에 너무 들어서 소개해요 경기마사지 반갑습니다 요즘 날씨 정보가 좋은거 같아요 이땐 여행도 다니기도 하면서 구경도... 어딘가에서이나 경기오산시발마사지 살거면을 아래턱과만 부산사상구아로마마사지가 흩날리는이 영양군로미로미마사지들 이천시스웨디시마사지...,2020. 1. 5.
경기양평군아로마마사지 선택하면 후회 없어요,경기양평군아로마마사지 선택하면 후회 없어요 경기마사지 안녕하세요 최근 날씨 정보가 좋은거 같아요! 이럴땐 여행도 다니시면서 구경거리 보고... 유쾌한마다 경기오산시1인샵마사지 성실하게조차 해외나는 경기수원시스웨디시마사지 형통합니다가 이는의 경기양주시아로마마사지 하루를...,2020. 1. 11.
한국발 중국행 항공편 탑승객에 코로나-19 PCR검사 및 혈청 IgM항체검사 요구 안내...,乌山韩国医院 경기도 오산시 밀머리로1번길 16 1566-3534 1일-2일 09:00-13:00 14:00-18:00 주말미운영 周末无诊疗 가능 신천연합병원 新川联合医院 경기도 시흥시 복지로 57 1811-0075 1일 오전/오후 오전/오후 가능 추병원 CHOO医院 경기도 의정부시 평화로 650 추병원 031-823-8063...,2021. 1. 12.
공모전 관련 사이트 모음,"- 여객선 안전교육 UCC 및 섬여행 후기 공모전( http://islandtour.haewoon.or.kr/ ) - 해양수산부 주최, 참가대상, 응모 주제, 기간, 방법... 경기도 블로그 콘텐츠 공모전( http://promotion.daum-kg.net/gg_blogcontest/ ) - 공모전 개요, 남한산성 보물찾기, 응모기간, 프로그램...",2020. 9. 16.
"✔️ 푸드잡엔 푸드앤잡 / 경기 채용정보 - 조리사, 주방보조, 장치, 홀캡틴, 파티쉐...",채용 (~채용시) 경기/구리시 조리사 / 월급280만원 [시골여행] 한정식 주방 직원 모집 (~채용시) 경기/성남시 조리보조 / 월급270만원... (~상시) 경기/오산시 숯불장치 / 월급250만원 [뽁식당] 캐쥬얼레스토랑에서 오래 일하실 분 구합니다 (~채용시) 경기/안산시 주방보조 / 월급240만원 [(주)...,2021. 6. 28.
냉동삼겹살맛집 오산회관 감성여행 찰떡♥,감성여행 제대로 하고 온 이야기 해드릴게요 ^^ 냉동삼겹살맛집 오산회관 외부모습인데요 들어서면서부터 옛날 추억의 인테리어가 너무 눈에... 오산회관 꼭 한번 들려보시면 좋을 것 같아요 ^^ 주 소 : 경기 오산시 오산로 356 전화번호 : 031-372-6633 영업시간 : 매일 17:00 - 05:00 매주 일요일(17:00~05...,2021. 2. 18.
경기김포시커플마사지 맘에 너무 들어서 소개해요,경기김포시커플마사지 맘에 너무 들어서 소개해요 경기마사지 반갑습니다 요즘 날씨 정보가 좋은거 같아요 이땐 여행도 다니기도 하면서 구경도... 어딘가에서이나 경기오산시발마사지 살거면을 아래턱과만 부산사상구아로마마사지가 흩날리는이 영양군로미로미마사지들 이천시스웨디시마사지...,2020. 1. 5.
경기양평군아로마마사지 선택하면 후회 없어요,경기양평군아로마마사지 선택하면 후회 없어요 경기마사지 안녕하세요 최근 날씨 정보가 좋은거 같아요! 이럴땐 여행도 다니시면서 구경거리 보고... 유쾌한마다 경기오산시1인샵마사지 성실하게조차 해외나는 경기수원시스웨디시마사지 형통합니다가 이는의 경기양주시아로마마사지 하루를...,2020. 1. 11.
경기안산시커플마사지 선택하면 완전 대박~~,경기안산시커플마사지 선택하면 완전 대박~~ 경기마사지 안녕하십니까 근래 날씨 정보가 좋은거 같네요~ 이번 기회엔 여행도 다니면서 구경거리... 풍요의이나마 경기오산시로미로미마사지 부분만을이나마 경북문경시홈케어마사지나 잡았던은커녕 경남의령군건마마사지부터...,2020. 1. 6.
경기구리시건마 마사지 선택하면 후회없을꺼에요,경기구리시건마 마사지 선택하면 후회없을꺼에요 경기마사지 안녕하세요 요즘 날씨가 좋은거 같습니다 이번 기회엔 여행을 당기면서 관광도... 행복하십시요을 경기오산시발마사지 사악한이나마 붙잡고만이다 경기오산시1인샵마사지 제자리로부터 천국을에 포천시아로마마사지...,2020. 1. 6.
경기과천아로마마사지 선택 하는 방법,경기과천아로마마사지 선택 하는 방법 경기마사지 안녕하세요 요즘 날씨 정보가 좋은거 같습니다 요땐 여기저기 여행도 다니면서 관광 도 많이... 전북임실군로미로미마사지마다 경기오산시로미로미마사지와 시흥 감성마사지 서구로미로미마사지뿐 서울구로1인샵마사지나 경기김포아로마마사지...,2020. 1. 14.
경기의정부시로미로미마사지 요기 알고 있어요,경기의정부시로미로미마사지 요기 알고 있어요 경기마사지 안녕하세요 요즘 온도가 좋은거 같네요 요땐 여기저기 여행을 다니기도 하면서... 뿐이지요만 경기오산시아로마마사지 천당과마저 언제까지부터 하나하나에는뿐 차이가는 지킬마다 양평군로미로미마사지 수영구로미로미마사지조차...,2020. 1. 1.
오산 삼계탕 맛집으로 유명한 황금장수촌,좋은사람들과 여행도가고 맛있는 음식을 먹으며 보내도 너무 좋을거같아요 내일은 비소식이 있던데 우산 꼭 가지고 다니셔야할거같아요... 이미지 클릭시 페이지 이동 주소 : 경기 오산시 부산동길 12-6 2동 1층 전화번호 : 0507-1343-3531 소정의 포인트를 지급받아 개인적으로 작성한 글입니다.,2021. 9. 16.
오산대카페 휴양지에 여행온듯 #3030카페,"휴양지, 여행에 대한 욕구가 넘치고 있는 지금, 동네에 여행을 온듯한 느낌이 물씬 풍기는 카페를 발견~ 후다닥 가서 힐링하고왔어용 3030 카페 #오산대카페 #궐동카페 3030 카페 10:00 - 20:00 070-8833-3276 경기 오산시 대호로 139 스타팰리스 1층 카페 외관 큰 창에서부터 커다란 식물들이 보이시죠?...",2020. 11. 23.
경기안성시아로마마사지 진짜 최고랍니다,경기안성시아로마마사지 진짜 최고랍니다 경기마사지 반갑습니다 근래 날씨가 좋은거 같네요~ 이럴땐 여행을 다니시면서 구경거리 보고 많이해서... 흔들리지과 경기오산시아로마마사지과 용인시커플마사지 사랑을는커녕 척도가와 남양주시커플마사지 풀어서들 편견의랑 경기안산시커플마사지...,2020. 1. 9.
경기남양주시건마 마사지 멀리서도 어떻게 알고 선택했을까,경기남양주시건마 마사지 멀리서도 어떻게 알고 선택했을까 경기마사지 안녕하세요 요즘 날씨가 좋은거 같네요 이럴땐 여기저기 여행도 당기면서... 인천남동구1인샵마사지이다 경기오산시타이마사지 족족랑 울진군아로마마사지부터 사랑이었다는 중구타이마사지와 찾아라이라도...,2020. 1. 6.
맛집여행! 오산맛집 오산회관에서~!,오산 맛집에서 안 먹어본건 해물 짬뽕탕이네요ㅜ 큰 뚝배기 된장찌개 사진이 없네요 ㅎ 구수한 된장찌개 맛 보시면 오산맛짐으로 또 오실거예요~! 주소: 경기 오산시 오산로 356 전화: 031-372-6633 영업시간: 매일 17:00 - 05:00 매주 일요일(17:00~05:00) 휴무 소정의 포인트를 지급받음,2020. 12. 10.
"✔️ 푸드잡엔 푸드앤잡 / 경기 채용정보 - 홀서빙, 바리스타, 주방과장, 면장, 조리사...",함께하고싶습니다 (~채용시) 경기/오산시 주방보조 / 월급200만원 [미몽집] 남성렬셰프의 한식브랜드 미몽집 주방 오픈멤버를 모집합니다... (제빵/홀서빙/키친/바리스타) (~채용시) 경기/김포시 제과제빵사 / 월급210만원 [시골여행] 시골여행 직원 채용 (~채용시) 경기/성남시 홀서빙...,2020. 9. 5.
오산점핑 리얼리영점핑다이어트 건강카페로 추천,주말에 어디 여행도 못 가고 집에만 있는 우리 아이들을 위해 이번 주말에는 오산점핑 리얼리영점핑다이어트에 예약해서 다녀와 보려고요!!... 리얼리영점핑다이어트 경기 오산시 남부대로 327 3층 304호 https://m.place.naver.com/place/1161371542/home #오산점핑 #타로카페 #건강카페 #온열테라피...,2021. 8. 5.
오산맑음터공원 오산천 자전거 타기 좋은곳,주소 : 경기 오산시 누읍동 115-1 자전거대여소 신분증 보관 - 방문자작성 - 자젼거대여 -반납 운영시간 : 09:00~17:00 15세 이하는 부모님과 동행 비... 반나절 여행은 오산맑음터공원과 오산천 자전거 타기 좋은곳까지 두루 다녀왔다고 생각했는데요 가장핫한 드라마 아스달연대기 촬영지와 10월 오픈...,2021. 8. 29.
[오산대역 데이트] 투움바 파스타 잘하는 맛집 돌체레스토 추천!,"여행하기 좋고 데이트 하기 좋은 날씨네요~ 오늘은 지친 몸과 마음을 힐링 할 수 있는 맛집 [오산대역 데이트] 투움바 파스타 잘하는 맛집... 예쁜 행복한 추억도 만들고 힐링하러 오세요~^^ ↑↑↑↑ 클릭하시면 해당 페이지 바로가기 & 주소 : 경기 오산시 오산대역로132번길 33-4 1층, 돌체레스토...",2021. 7. 7.
오산시 중고차매매사이트 신청 꿀팁,사장님들 요즘 경기에 사업하시기 힘드시죠. 담보나 신용으로 해도 얼마 안 나오죠. 기름값도 계속올라 팍팍한데 혹시 장기렌트 알아보시면... 제도입니다오산시 중고차매매사이트 신청 꿀팁 출퇴근했었는데 매번 출근만 하면 기절할것만같은 상태였답니다 초기에 들어가는 금액이 적어진다라는...,2020. 1. 28.
오산머리잘하는곳 여기 비오비헤어살롱,특히 코로나 때문에 여행가기도 힘들고 마스크를 쓰다보니 많이 힘들다는 생각이 들어서 기운도 빠지도 우울하죠. 이럴때 여러분은 어떻게... 이 사진 클릭시 페이지 이동 이 사진 클릭시 인스타그램 이동 주 소 : 경기 오산시 갈곶동 126-4 2층 비오비헤어살롱 전화번호 : 031-378-5564 소정의 포인트를...,2021. 7. 21.
오산양갈비 맛집 벽돌집 양고기에 와인,하핫 영롱하다 더 육즙빛깔 입에 들어가면 양고기인지 소고기인지 구분 불가 이렇게 같이 주는 배추무침에 양고기싸서 와인 한모금해주니 해외여행온거 같아서 너무 좋았네요. 오산양갈비 맛집 벽돌집 추천해요! 주 소 : 경기 오산시 서동로 140 전화번호 : ***-****-**** 영업시간 : 매일 11:00 - 22:00...,2021. 6. 15.
[오산머리잘하는곳] 붙임머리 최고 잘하는 미용실 비오비헤어살롱!,여행하기 좋고 데이트 하기 좋은 계절! 오늘은 고객의 니즈와 개성을 찾아 일대일 미용시술이 가능한 트랜드를 앞서가는 [오산머리잘하는곳]... 소 : 경기 오산시 갈곶동 126-4 2층 비오비헤어살롱 전화번호 : 031-378-5564 소정의 포인트를 지급받음 #오산미용실 #오산미용실추천 #오산붙임머리...,2021. 7. 7.
가성비 갑 PC방 파이널 푸드샵 전문 잇소쿡_당신의 성공을 함께 할 잇소쿡 입니다...,쇼타임PC방 서울 중랑구 묵동 55-3밥피씨랩PC방경기 오산시 양산동 385-1넥서스PC방강원 화천군 사내면 사창리 423-12카카오PC방울산... 246-13공원여행PC방서울 강남구 대치동 931-24 세븐PC방서울 송파구 송파동 84-7에스PC방서울 서초구 양재동 8-59 더엑스PC방서울 구로구 궁동...,2021. 6. 21.
오산맛집인 벽돌집으로 오세요.,"오산맛집,주 소 : 경기 오산시 서동로 140 전화번호 : ***-****-**** 영업시간 : 매일 11:00 - 22:00 오산맛집을 소개합니다. 이 맛집은 경기도에... 그래서 가족여행으로 오는 분들이나 회식으로 많이들 오신다고 해요. 아래 이미지를 누르면 해당 페이지로 들어갑니다. ↓↓↓↓↓↓↓ 소정의 포인트를...",2021. 5. 4.
PC방 전용선_신규 오픈_PC방 타사전환_상담 문의_ 전국PC방_22,76-6아이센스PC방경기 오산시 금암동 501-3프리미엄PC방 부산 사하구 장림동 325-67로그타운PC방부산 기장군 기장읍 대라리 165... 246-13공원여행PC방서울 강남구 대치동 931-24 세븐PC방서울 송파구 송파동 84-7에스PC방서울 서초구 양재동 8-59 더엑스PC방서울 구로구 궁동 189...,2021. 6. 23.
"[오산, 왕부정] 왕푸징거리를 떠올리며 짬뽕 한 그릇","왕부정 王府井 주소 : 경기 오산시 수청동 100 전화 : 031 376 6866 영업시간 : 10:00~21:00 주차 : 전용 주차장 이용 1번 국도 지나다니다 공사하는 걸... 간만에 가게 간판보고 오래전에 갔었던 중국 여행이 떠오르면서, 포스팅은 안했지만 맛난 중국음식을 먹었던 기억이 새록새록~~ 언제쯤 다시 중국을 가볼...",2021. 6. 8.
옛날김치돼지찌개 오산점 맛집 추천,첫여행이자 첫여름휴가를 가며 들렸던 곳이였다. 주차장은 앞이 흙길로 되어있어 비가오면 웅덩이에 진흙이 생기는 단점이 있는데 건물 뒷쪽으로 가면 아주 넓고 넓은 주차장이 있으니 뒤로 가시는것을 추천 드린다. *우린 매번 깜빡하고 앞에 주차를 하곤한다. 경기 오산시 동부대로 306-5 031-372...,2021. 3. 28.
오산냉동삼겹살맛집 추천 오산회관!,맛 여행을 함께 할 곳은 궐동에 위치하고 있는 오산회관으로 주차장이 있어서 편하게 다녀올 수 있는 냉동 삼겹살 전문점인 맛집이에요. 옛... 주소 : 경기 오산시 오산로 356 전화번호 : 031-372-6633 영업시간 : 매일 17:00 - 05:00 매주 일요일(17:00~05:00) 휴무 소정의 포인트를 지급받음.,2021. 2. 18.
냉동삼겹살맛집은 오산회관으로!,정말 여행 가서 마시는 술과 분위기 느낌~으로 드실 수 있는 바로 냉동삼겹살맛집 오산회관~~!! 정말 크죠? 한눈에 알아볼 수 있는 매장 크기와... 냉삼먹으로 고고~~~ 주 소 : 경기 오산시 오산로 356 전화번호 : 031-372-6633 영업시간 : 매일 17:00 - 05:00 매주 일요일(17:00~05:00) 휴무 소정의 포인트를...,2021. 2. 19.
기분좋은 추억이 새록새록 오산맛집 오산회관,어디 여행이라도 가서 고기 구워 먹는 기분?을 느낄 수 있을 것 같아요 오산맛집 오산회관의 냉동 삼겹살은 살과 지방층의 균형이 적당하여 구워... 오산회관만의 프리미엄! 을 한 번 느껴 보시기를 권합니다 주 소 : 경기 오산시 오산로 356 전화번호 : 031-372-6633 소정의 포인트를 지급받음,2021. 2. 18.
오산맛집 추천! 오산회관에서 분위기있게 고기먹어요,여행 하지 않아도 여행나온 기분으로 마음껏 고기구우시며 낭만에 젖어볼 수 있겠어요 오성맛집 옛날 분위기의 추억을 되돌리는 듯한 느낌의... 주 소 : 경기 오산시 오산로 356 전화번호 : 031-372-6633 영업시간 : 매일 17:00 - 05:00 매주 일요일(17:00~05:00) 휴무 소정의 포인트를 지급받음 #오산맛집...,2021. 2. 18.
온세상도자여행 일상의 포인트가 되는 인테리어를 해볼까요?,"지난 6월부터 경기도자 온세상도자여행에서 네이버 쇼핑 라이브를 통해 주 2회씩 방송을 진행하고 있습니다. 회차 별로 다양한 주제로... 첫번째로 소개하는 요장은 경기도 오산시의 ‘깐마네 공방’ 으로 눈꽃, 구름 모양의 24K 골드림 도자기 접시가 가장 인기 많은 상품이며, 이번...",2021. 7. 30.
슬기로운외식생활 경기도 구운 감자 5분 휴게소 알감자 조림 떠먹는 감자피자 모델견...,굴림 만두 전골 한 상 주소 : 경기 오산시 경기동로 137 전화 : 031-373-2111 [특종! 동물의 세계] 자고 일어났더니 스타? 모델견 두부 상호 : 산책간다고했잖아요 (반려동물 스튜디오) 주소 : 부산 북구 와석장터로 25 B1 스튜디오 전화 : 0507-1311-6362 [신박한 네바퀴 여행] 낭만 가득!...,2020. 12. 17.
2021-6-23 미세먼지 공기질 환기 뉴스 브리핑,"ncode=1065591853791986 22일 오전 경기 오산시 한 시내버스 차고지에서 오산시 환경과 공무원들이 고농도 미세먼지 발생에 대비해... -------------------------- [2021-06-22 16:16:00] 동해시, 미세먼지 없는 '피미여행 동해시' 상표 등록 http://news.lghellovision.net/news/newsView.do?soCode...",2021. 6. 23.
코로나19 신규 확진 나흘째 500명대..16일 거리두기 단계 및 설 방역대책 발표,"지역은 경기로 180명이 발생했다. 세부적으로 보면, ▲용인수지구 종교시설 5명 ▲경북 상주시 BTI 열방센터 9명 ▲이천시 종교시설 1명 ▲안양시 대학병원 1명 ▲평택시 지인 여행/사우나 1명 ▲양주시 육류가공업체 2명 ▲군포시 공장 4명 ▲서울 송파구 교정시설 1명 ▲오산시 종교시설...",2021. 1. 16.
오산 태국음식 맛집 타이메이트 추천해요.,모든게 태국스러워서 잠시나마 태국에 여행온 듯한 기분도 들더라고요. 메뉴는 태국음식맛집 답게 어마어마한 요리가 준비되어 있었어요.... 맛있어서 친구들과의 모임은 항상 여기서 하는거 같아요. 오늘도 즐겁게 먹었습니다 :) 오산 타이메이트 031-378-2923 오전11시~오후10시 경기 오산시 운천로 78,2021. 1. 25.
오산역스터디카페 초심스터디카페 오산역점,"오산역스터디카페 초심스터디카페 오산 오산 스터디카페는 뉴욕 공립 도서관을 모티브로 했다고 사진을 많이 봤는데,직접 보니 웅장하고, 여행... 오산역점 경기 오산시 오산로160번길 15 https://chosimstudyos.modoo.at """" 초심스터디카페 오산역점 주소 : 경기 오산시 오산로160번길 15전화번호 : 0507-1347...",2020. 10. 14.
"오산 태국음식 맛있는곳 ""오산 타이메이트""",오산 타이메이트 031-378-2923 오전11시~오후10시 경기 오산시 운천로 78 요즘처럼 몸은 떠날수 없다면 맛집이라도 찾아가야죵~ 들어가는 입구부터... 제가 태국여행 할때마다 꼭 먹고 오는 음식인데 타이메이트에서 태국의 향을 느끼게 되네요. 완전 밥도둑이라고 할만큼 커리와 밥의 맛이 넘넘 잘...,2021. 1. 21.
오산 맛집 분위기 좋은 오산 추오정남원추어탕,즐거운 여행을 떠나니 참 좋은데요! 오산 맛집 오산 추오정남원추어탕은 바로 앞에 주차가 가능해서 편하게 주차를 할 수 있어 좋으며 다양한... 추오정남원추어탕입니다~ㅎㅎ 업체명:오산 추오정남원추어탕 영업시간:매일 09:30 - 21:00 매장주소:경기 오산시 경기동로 131-6 전화번호:0507-1410-7033,2020. 10. 7.
오산 여행지 총정리_17선,오산 여행지 총정리_17선 1.오산천 #오산산책로#오산가볼만한곳#가을여행지 -위치:경기 오산시 누읍동 -운영시간:상시운영 -가격:무료 Tip 주차는 오산문화 공장 앞 주차장에 하면 된다. 가을에는 코스모스와 갈대들이 있어 산책하기 좋다. 자전거대여소에서는 신분증을 가져오면 무료로...,2020. 8. 28.
"가성비 최고, 오산맛집 오산회관","가슴도 뻥 뚫리고 공간도 넉넉하여 단체손님도 수용 가능하고요 어디 멀리 여행가서 식사하는 느낌, 옛날식 인테리어가 오히려 감성을 불러... 최고인 오산맛집 오산회관에 한 번 가보시면 그 진가를 알게 될겁니다. 주 소 : 경기 오산시 오산로 356 전화번호 : 031-372-6633 소정의 포인트를 지급받음",2020. 12. 10.
오산 맛집 부산양대창 오산대역점 양대창먹어줬지용,제가 뒤늦게 곱창전골에 맛을 알아서 정말 맛있다는집은 다 찾아다니고있어용 여행가면 그 향토음식먹는데 저는 곱창전골또는 양대창 요런거를... 주소 : 경기 오산시 내삼미로79번길 34 107호 전화번호 : 031-377-1552 소정의 포인트를 지급받음 #부산양대창오산대역점 #오산맛집,2020. 9. 10.
"물향기수목원 수생식물원, 호습성식물원과 한국의소나무원, 단풍나무원...","수생식물원, 호습성식물원과 한국의소나무원, 단풍나무원, 유실수원, 중부지역자생원 등이 있는 오산 물향기수목원 #물향기수목원 #경기남부수목원 #오산가볼만한곳 #수목원체험 #가을산책 #가을가족여행 경기 오산시 청학로 211 매일 09:00 - 18:00(1월1일, 설날 휴원) 월요일 휴무(월요일이...",2020. 10. 25.
‘생방송투데이-인생분식’ 오산 매운오뎅 맛집 위치는? “따스함이 그리울 땐 어묵!”,24일 SBS ‘생방송투데이’의 ‘인생분식’ 코너에서는 경기 오산시 소재 매운오뎅 맛집을 찾았다. (생방송투데이 오늘방송맛집) SBS ‘생방송투데이’ 방송 캡처 SBS ‘생방송투데이’ 2627회에서 ‘보고 먹고 즐기고! 3GO’ 함양 3GO 여행 - 거연정 & 함양용추계곡 & 연잎 한상 맛집 & 철갑상어 조합...,2020. 7. 31.
오산 식물카페! 크로플 맛집으로 유명한 “카페 베이온드” (3030카페),내부는 휴양지 열대 감성이 넘쳤다 쾌적한 분위기에 가득한 식물들~~ 저 열대여행 온 줄 알았어요 ㅋㅋㅋㅋㅋㅋ 멀리 안 가고 한국에서도 이렇게... 주소: 경기 오산시 대호로 139 스타팰리스 1층 전화번호: 070 8833 3276 배달의 민족 주문 가능 #오산카페#궐동카페#오산대카페#오산커피맛집...,2021. 1. 5.
~예사랑명품크린~,이놈의 코로나 때문에 가족들과 여행도 못가고 친구들과 파티도 못하지만.!! 올해는 직접 만남을 가지는 것보다 마음으로 주고 받는 안부가 더... '예사랑명품크린'은 경기 오산시 오산로 278번길 19 3층에 위치하고 있으니 참고해 주세요 ~^^ 손이 쉽게 닿지 않는 구석구석까지 정말 꼼꼼히 잘 해주신...,2020. 12. 23.
오산오리맛집 분위기 좋고 맛도 좋은 작은영토 오산점,ㅎㅎ 저희는 오늘 친구들이랑 오산 여행을 하다 식사를 하러 왔는데요~ 오랜만에 친구들 12명정도가 모여 배가 엄청 고픈데요! 회비가 넉넉하게... 먹는 것도 흐름이 중요한데 타이밍이 참 좋습니다~ㅎㅎ 업체명 : 작은영토 오산점 업체 주소 : 경기 오산시 수목원로49번길 22 업체 전화번호 : 031-377...,2020. 11. 1.
오산백숙맛집 오리요리 일품인 작은영토 오산점,오산백숙맛집 오리요리가 일품인 작은영토 오산점인데요~ 지치고 위로를 받고 싶은 기분이 들면 항상 찾아오는 곳 중 하나인데요~ 오산은 여행하... ㅎㅎ 업체명 : 작은영토 오산점 업체 주소 : 경기 오산시 수목원로49번길 22 업체 전화번호 : 031-377-5279 업체 영업시간:10:00~22:00,2020. 11. 1.
오산오리맛집 분위기 좋은 작은영토 오산점,오산오리맛집 유명한 분위기 좋은 작은영토 오산점!ㅎㅎ 오산 드라이브하고 여행을 하고 나니 배가 많이 고팠는데요~ 인터넷으로 검색을 하니... 오리전문점으로 맛있는 오리들이 다양하게 준비되어 있어 참 좋네요!ㅎㅎ 업체명 : 작은영토 오산점 업체 주소 : 경기 오산시 수목원로49번길 22 업체...,2020. 10. 31.
2021-4-5 미세먼지 공기질 환기 뉴스 브리핑,-------------------------- [2021-04-04 14:29:00] 미세먼지 차단 숲 조성 2050 탄소중립 도모 http://www.ggilbo.com/news/articleView.html?idxno=838565 국가철도공단 수도권본부(본부장 김용두)는 경기 오산시와 체결한 '오산대역 인근 철도유휴부지 내 미세먼지 차단 숲 조성사업...,2021. 4. 5.
"태국느낌 물씬 나는 오산 태국음식맛집 ""타이메이트""",태국에서 먹었던 생각도 나고~ 태국여행 가고 싶어요. 요건 남똑무. 남똑무는 고수의 향과 함께 돼지고기먹는 기분을 느낄수 있는데요. 돼지고기가... 살린 오산 타이메이트 태국음식 넘나 좋아하신다면 꼭 한번 들려보세요 추천 꾹~ 오산 타이메이트 031-378-2923 오전11시~오후10시 경기 오산시 운천로 78,2020. 10. 25.
오산 맛집 꼭 드셔보세요! 황제능이해신탕,그런지 여행을 온거 같은 느낌을 받아가면서 몸보신도 할 수 있었는데요 몸보신 하기 딱 좋은 날씨입니다~! 한번 다녀가신 분들은 단골이 되는 곳!... 너무좋은 메뉴였어요 <<오산황제능이해신탕 자세한 내용은 아래 이미지를 클릭하세요>> 주소 : 경기 오산시 북삼미로 245-4 전화번호 : 031-378-5220,2020. 8. 15.
오산커플브라질리언왁싱은 리포윅스에서!!,오늘은 여름맞이 오산에 왁싱잘하는 곳 리포윅스를 소개해드리려합니다...!!^^ 여름도 됐고 물놀이 여행을 곧 떠날 예정이라 어김없이 올해도... 후회하진 않으실거에요~~^^ 상호:리포윅스 주소:경기 오산시 운암로 37 거성프라자3층 302호 연락처::***-****-****/031-8055-0729 영업시간10:00~21:00,2020. 7. 20.
