header,contents,date
<노는 언니> : 애정 프로그램 #3,"유일하게 결혼을 하셔서 그런지 패밀리데이 때 남편분과 태릉 쪽 찾아서 추억여행할 때 모습이 너무 보기 좋았어요!! 남현희 인스타그램 곽민정... 고향 경기도 오산시 신체 180cm, 59kg 학력 경기대학교 데뷔 노는 언니 출연 중 소속 없음 출처 : 한유미 인스타그램 배구선수하실 때 대전 소속...",2021. 3. 2.
지하철 여행이 가능한 오산 물향기 수목원 다녀왔어요,"여행 많이 다니시나요? 저는 개인적으로 생각해보면 여행을 참 안 다녔어요. 책 보는 거 좋아하고, 컴퓨터 하는 걸 좋아해서 매번 책 보거나, 컴퓨터... 오산 물향기 수목원 방문 전 팁 자차로 가실 땐 주소를 ""오산시 수청동 282"" 검색하세요 저의는 수목원으로 검색했는데 오산대역으로.. 가게...",2020. 5. 16.
효도가족 100쌍찾기/도쿄올림픽 개최 41일전/축구평가전,"경기지역 31개 시도 중 오산시 시민을 대상으로 ""효도""가족 100쌍을 찾는 과정 속에 자연스럽게 부모님 고마움 알고... key=CM202105100001389311&site_preference=normal 앞쪽이 답 ---------------------------------- 해외여행, 자유여행자는 아직 때가 아니다 https://blog....",2021. 6. 11.
인천 남동구데코타일 시공현장 [KCC타일 TS5544],[경기 서울 인천 충남 대전 강원] 오늘은 인천으로 데코타일 시공다녀왔습니다. 안녕하세요 김포데코타일 총판 모든 데코타일 입니다. 데코타일... 강동구 #오산시데코타일총판# 가장동 궐동 금암동 남촌동 내삼미동 누읍동 두곡동 벌음동 원동 수청동 양산동 오산동 외삼미동 은계동 중앙동...,2021. 9. 15.
중부랑 덜꺼덩 녹은 뽀얀 중부인가요?,대흥식당 경기도 오산시 오산로278번길 9 12 중부상회 세이브 관심 장소를 MY플레이스에 저장할 수가 가 있어요 팝업 닫기 폴더에 저장했습니다... 매료되었습니다탐험과 여행은 그한테 치료 요법이기 때문에 산 기슭씩이나 강과 호수 가까이에 종종 캠핑을하려는 이유입니다청계천을 사이에...,2021. 6. 16.
순천 우한폐렴 광양 우한폐렴 선별진료소 증상 정리,"성가롤로병원 ○ 환자 인적사항 - 조례동 거주 57세 여 (직업;교사) - 1월 12일 ~ 17일 중국 계림 등 여행(친구 4명 동행) - 최초증상;... 151 경기 수원시 장안구 경기도의료원 수원병원 감염병관리과 (031-8008-5431, 5430) 152 경기 수원시 팔달구 성빈센트병원 감염병관리과...",2020. 1. 29.
경기도 오산/물향기 수목원으로 힐링하러 가기,"재밌었던 오산여행이었어요~ <물향기 수목원> 경기도 오산시 청학로 211 http://farm.gg.go.kr/sigt/74 > > > 매주 월요일,1월1일,설날은 휴원일. 월요일이 공휴일 또는 연휴와 겹치는 경우 공휴일 또는 연휴 그 다음날 휴원. <입장료> 어른 1500원 (19세 이상 64세 이하) 청소년/군인 1000원 (13세 이상 18세...",2021. 4. 28.
전기안전관리대행 업체 전기감리 효율적으로 받으려면,"그리고 외국으로도 여행을 가기 힘든 상황입니다. 그냥 내륙으로 다녀와야 겠습니다. 제주도도 요즘 비행기와 숙소 잡기가 정말 어렵다고 합니다.... 군포시 .수원시,판교,성남, 오산시,인천시,여주시,광주시,남양주시,평택시,파주시,일산시 경기도 전지역 상담가능합니다. 또한 서울 일부지역도...",2021. 6. 29.
주식회사 잇츠 : 오산 문화재 야행,"오산시 문화재 야행 독상성 일대 안녕하세요. 주식회사 잇츠입니다^^ 지난 주말 10.17(토) - 10.18(일) 까지 진행한 '2020 오산문화재야행'이 성황리에... 독산성’, 여행스케치 의 공연이 이어졌고, 제2주차장 에서 우키통키, 돌셋밴드의 공연이 병행이 됐습니다. 올라가는 중간마다 야행에 맞게 지치지...",2020. 10. 19.
2020.3.28.부동산 경제 뉴스 브리핑,"경기 오산시 원동 845 양우프라자 8층 802호는 감정가 4억9,400만원의 반값 수준인 2억5,218만5,000원에 새 주인을 찾았다. 서울에서도 이... 또 25세 이상의 군 미필자가 해외여행을 할 때는 5년짜리 복수여권을 발급받을 수 있게 됐다. https://realestate.daum.net/news/detail/main...",2020. 3. 28.
[일상로그] 2021.03.19-2021.04.15 daily life,"[오산 원더랜드] 오산 원더랜드 맥주, 오산 루프탑 펍 주소: 경기도 오산시 현충로 95 영업시간: 17:00 - 02:00 맥주와 피자, 파스타, 치킨 등을... 대한 의욕은 없으나 일상과 함께 이웃님들의 추천지에 다녀온 흔적을 남겨두었습니다 조만간 서울여행(?)도 갈거니까 추천맛집, 카페 열심히 다녀올게요♥",2021. 4. 15.
오늘 의 역사 6월16일-17일-18일-19일,"미() 경기도 시흥시 한 길가에서 남자 친구 흉기에 사망(1987년 출생~) 지난 2005년 아이리스 앨범 '메시지 오브 러브'의 타이틀 곡 '남자는... 년 오산시 경부고속도로 하행선에서 고속버스가 빗길에 차량 4대와 연쇄충돌, 5명 숨지고 30여명 중경상 1991 년 정부, 지방공무원 채용 시...",2021. 6. 16.
경기도 걷기 좋은길 입니다.,경기도 걷기 좋은길 입니다. https://www.google.com/maps/d/edit?mid=1dSdN96l7XV8ghpmqxNE6Q-jVszD6S85k&usp=sharing 길명 길소개 총길이 총소요시간 시작지점명... 행주산성 경기도 고양시 덕양구 행주로 15번길 89 한강철책길 김포평야가 펼쳐지고 한강이 흐르는 구간으로 한강하구 후평리 철새도래지가 있어...,2020. 8. 28.
"금리 올랐는데 안 떨어지는 아파트값, 왜?","화성시(0.79%)는 교통 및 공공택지 개발 호재 있는 봉담읍 위주로, 안성시(0.76%)는 공도읍 등 교통호재 있는 중저가 단지 위주로, 오산시(0.76%)는... 대가들이 말하는 투자의 정석 ￼ [속보] 경기도 살면 제주여행 공짜 >>AD 세파 코리아 ￼ 무주택자들, 꽉 막힌 대출에 결국..'눈물의 갭투자' 나섰다...",2021. 9. 10.
코로나 확진자 동선 (21/8/6),8.) 수도권 지인가족 여행모임 관련 송파구 소재 직장 관련('21.8.) 관악구 소재 고시원 관련 경기 수원시 전자회사 관련 동작구 소재 시장... 2.(월) 소독완료 화성시 코인노래방 우정읍 7.25.(일) ~ 8.2.(월) 소독완료 오산시 714번 확진자(가족) 김포시 817번 확진자(직장동료) 화성시...,2021. 8. 9.
"[5/8] 주간동향 원페이지 - ""오늘은 제주가 흥미롭다!""","제주도 여행겸 임장을 한번 가야 하나? 다시 한번 느끼지만 시장은 영원한 하락도 영원한 상승도 없다. 제주도의 경우 올해까지 입주 물량이... 상승 지역 (0.3% 이상) - 경기도 안산시 단원구 : 0.37 - 경기도 시흥시 : 0.54 (지난 2개월간 평균 0,50 이상 지속 상승 중) - 경기도 오산시 : 0.50...",2021. 5. 8.
[그리움] 2020.12.16 부동산기사 링크,"Office (사무실) 삼성·대치 토지거래허가구역…역삼동 빌딩 거래↑국민일보150개 여행사에 역세권 공유오피스 무상 지원여행신문'3500억... 은행 주담대 금리 '줄인상'(이데일리 Today’s Local Issues (오늘의 지역 이슈)경기도 오산시 현대엔지니어링, 오산시와 스마트시티 개발...",2020. 12. 16.
경기도 오산 가족나들이 하기좋은 물향기수목원,경기도 가볼만한곳 오산 여행 가족나늘이 하기 좋은 곳 물향기수목원 안녕하세요!! 오늘은 경기도 오산 나들이하기 좋는곳 물향기수목원... 정원의 조성 및 진흥에 관한 법률 경기도물향기수목원 소개 소재지 : 경기도 오산시청학로 211(수청동)일원 개원일 : 2006.5.4 조성면적 : 약 10만평...,2021. 4. 3.
"[KFM 경기방송] 2020총선 기획특집 이원욱의원(화성 을), 안민석 의원(오산) 핵심...",컷 1 지역구 : 경기도 오산시 더불어민주당 안민석 의원 5대 핵심공약 공약 1. 독산성 세마대 복원 및 세계문화유산 등재 공약 2. 죽미령 UN초전기념... ▷ 유 : 오산 여행을 다녀온 것 같은 공약이었습니다. 안민석 의원의 공약 이행 활동에 대해 한 마디로 평가를 한다면 어떤 평가가 나올 수...,2020. 1. 17.
오산 고인돌공원 소풍(피크닉)부터 경기도 유적지(문화재) 장미원까지,고인돌을 어디선가 봤을 수도 있겠지만 고인돌이라고 인식하고 본 것은 경기도 오산시 고인돌공원이 처음이었어요. 경기도 기념물(문화재)이기... 제가 여행에 관심이 많아서 조금 아는 편이라고 생각했는데 이 표지판 보고 조금 반성했습니다. 갑자기 웬 도보여행이지? 올라가면 도보여행길이...,2021. 3. 1.
"[미사역 카페] 홍종흔베이커리 미사역점, 대한민국명장의 손길",주소: 경기 하남시 미사강변남로 125 101동 101~105호 (미사역마이움푸르지오시티 1층) (지하철 5호선 미사역 7번 출구에서 도보 약 2분) 영업시간... 대한민국명장 홍종흔 명장의 손길은 먼저 오산시의 본점에서 시작하였다. 미사까지 닿은 그 명성이 대단하다. 자기 이름을 건다는 것은 자신의...,2021. 5. 3.
가족여행 관련 사이트 모음,"대덕항공여행사( http://blog.naver.com/daedeok0375 ) - 경기도 오산시 대원로 6 역전빌딩 2층 대덕항공여행사. - 대덕항공사, 항공권-24시간발권및변경, 각국비자, 해외여행-사전예약할인, 단체여행, 가족여행. 연못구름( http://lastzone.com/ ) - 개인 블로그, 가족이야기, 인물...",2020. 12. 26.
경부고속도로,"병점권), 오산시, 평택시, 안성시까지 포함하면 도합 500만여 명에 육박하는 인구가 경부고속도로 연선에 집중되어 있다. 이 때문에 수도권 구간은... 1990년대까지만 해도 경부고속도로 하행방면에서 가장 먼저 나타난 군은 경기도 용인군이었고, 상행방면에서는 경상남도 양산군이었다. 용인과...",2021. 7. 29.
가맹점을 부탁해 문화누리카드 신규 가맹점 소식 (2021.07.10~2021.08.09),국립유명산자연휴양림 경기도 가평군 설악면 유명산길 79-53 031-589-5487 15 국립아세안자연휴양림 경기도 양주시 백석읍 기산로 472 031-871-2795... 광명시 #여행#관광#교통#교통수단#렌트카#SJ렌트카#광명시렌트카#SJ렌트카 광명지점#(주)에스제이렌트카#에스제이렌트카 문화 도서...,2021. 8. 10.
산림청 평화의 끈 서포터즈 – 10월 활동 What is 새산새숲,"독산성과 세마대 원래 화성군 오산읍 지곳리였으나 오산시 지곳동(현: 양산동)으로 행정구역이 개편되었다. 오산 공군부대와 오산 비행장으로... [네이버 지식백과] 독산성과 세마대 (답사여행의 길잡이 7 - 경기남부와 남한강, 초판 1996., 15쇄 2012., 한국문화유산답사회, 김효형, 김희균, 김성철...",2020. 11. 1.
코로나19 사회적 거리두기 현행 2주 연장,"마찬가지로 경기구성 최소 인원*이 허용 * 운동종목별 경기인원의 1.5배까지 가능 (ex. 야구 최소 18명 필요 → 27명, 풋살 최소 10명 필요... 미정 오산시 오산 문화재 야행 대면·비대면 비대면 2021 오산 통기타 페스티벌 대면·비대면 비대면 오산 종합예술제 대면·비대면 비대면 양평군...",2021. 10. 1.
삼남길 제7길 독산성길 걷기(세마교~은빛개울공원),벗어나고 오산시로 접어드는경계지역입니다 옛길걷기는 늘 위험할수 있으니 주의해야 할것 몇가지를 당부합니다 숲길에는 리본으로 삼남길... 도보여행은 건강보건관련사회비용을 절감하는 효과를 유발하여 경제적인 측면에서도 무척 유익하다고 합니다 숲속길은 경사지지않고 완만하게 이어져...,2021. 5. 5.
종합본 - 코로나19 극복 외식업체 소상공인 자영업자 피해기업 융자/보증 지원정책,"업체(여행업, 숙박업, 보건업, 외식업 등) ·(내용) 사업주가 지급한 인건비의 3/4 ~ 2/3(1일 상한액 6.6만원, 연180일이내, 월 최대 198만원)... 02-2110-6343 경기도 과천시 관문로 47 정부과천청사 1동 부산지방중소벤처기업청 소상공인과 ***-***-**** 부산광역시 강서구 녹산산단 335로 8...",2020. 3. 19.
"나의인생100일 3일차 -""이번 추석에도 오지 마세요""…전국 지자체 귀성 자제 호소","경기 일선 시·군들은 추석 연휴 기간에 예약을 받아 추모공원 입장을 허용할 방침이다. 평택시는 오는 13일부터 17일까지 예약을 받아 18∼26일 추모객 방문을 허가한다. 예약인원은 시간당 100명, 방문 인원은 4명으로 제한한다. 오산시도 시설관리공단이 운영하는 봉안시설 '쉼터공원'에...",2021. 9. 2.
비가와도 계속되는~ 지역문화재 활용사업! - 7월 편,"#지역문화재활용사업 #생생문화재 #살아숨쉬는향교서원 #고택종갓집 #문화재덕후들심쿵 #국내여행 #문화재여행 #역사여행 #문화재청... [향교서원] 경기도 오산시_궐리사 <행단에 열린 꿈 궐동학교> 정조의 인문학 정신으로 세워진 오산시궐리사의 가치를 알리고, 문화의 창조·소통·나눔의...",2021. 6. 29.
쏠라티 세차중-!!,"단체여행은 내가책임진다 쏠라티 여름은 여행의 계절이죠 푸르디 푸른 바다보러 출처. 네이버이미지 울창하고 시원~~한 산속 계곡으로 출처.... 기흥렌트카 #송탄렌트카 #경기렌트카 #장기렌트 #사고대차 #전차량금연차 031)377.1111 ***.****.**** 경기도 오산시 법원로33, 1층 (서울빌딩) (주)주은렌터카",2020. 7. 17.
"32평입주청소, 당해와서입니다.",이이들을 난징여행코스 상업용지분양 에게는 동물이라네요. 남부면 내년 4월 부산시장 보궐선거의 여야 유력주자 간 '가상 맞대결'에서 국민의힘... 오산시 이른바 실질적 주민자치에는 여야가 없다는 것을 보여줬다는 평가다. 가정같은 전략적으로 중요한 지역을 자신의 믿음만으로 경험이...,2021. 3. 13.
2021년 7월 1주차 사진전시 일정 (6/30~7/6),전시실(경기도 광명시 철망산로 2) / 2021.06.28. ~ 2021.06.30. / [ 104 ] 땅 위의 배 The Boat on the Ground / 홍티아트센터(부산시 사하구 다산로106번길 6 1층) / 2021.06.25. ~ 2021.07.09. / 이예진(영상) [ 103 ] 아특사 여행사진전 : Dream_Again / 아주특별한사진교실(서울시 중구...,2021. 6. 17.
국악연희단 하랑 연혁,"신나는예술여행 ""신나는국악여행"" (46회) _ 제3회 하랑정기연주 ""우리가 하랑이다_제비노정기"" ㅇ2020년 _ 신나는 예술여행 ""신나는국악여행... 1회 오산시 전국 국악경연대회 일반부 / 금상 _ 제 1회 가람전국국악경연대회 일반부 / 종합대상 ㅇ2019년 _ 2019 대한민국 예술대전 경기도대표...",2021. 1. 22.
트레킹 추천코스 11월 - 삼남길 제7길 독산성길,"주소: 경기도 오산시 지곶동 87-2 문의: 031-376-5988 영업시간: 06:00~20:30 메뉴: 소머리국밥 8,000원, 설렁탕 7,000원, 갈비탕 8,000원 [글/사진 여행작가 고상환] 수정일2017-10-31 위의 글과 사진은 경기관광포털사이트에서 퍼온것입니다.",2021. 1. 29.
코로나 예방접종 예약하기,"**단, 3개월 미만 단기체류자, 여행목적 방문자 등 제외합니다. 아래 지역별 보건소 전화번호를 참고하세요. 시도 시군구... 오산시 오산시보건소 031-8036-6025 경기 용인시 용인시 기흥구보건소 031-324-6911 용인시 용인시 수지구보건소 031-324-8924 용인시...",2021. 7. 21.
경기도 오산 물향기수목원 (당일 아이와 함께 가족 나들이 정보 요약),■ 위치 □ 주소 : 경기도 오산시 청학로 211 (내비게이션 설정은 “오산시 수청동 282”) □ 대표전화 : 031)378-1261(방문자센터) 031)8008-6665... 주세요~ #경기도오산물향기수목원 #물향기수목원 #경기도가볼만한곳 #경기도여행지 #오산물향기수목원 #경기도수목원 #수목원...,2020. 9. 24.
해외입국자방역택시 방역콜밴 이용방법및 가격비용 울산ktx 코로나검사,"우리나라도 2월부터 코로나예방 접종도 시작 된다고 합니다~ 자유롭게 해외여행을 다니던 그때가 그리운데요~ 하루빨리 그날이 왔으면 하는... 95,000 오산시 100,000 경기광주시 송탄 진접 화도 동두천 제부도 110,000 평택시 포천시 곤지암 130,000 여주시 양평 연천군 장호원 안성시 135,000 가평역...",2021. 1. 23.
목포장거리택시 목포역-해남 국제장례식장,"및 여행 왕복 서비스 ◆ 전국 대형병원 외래진료 및 입퇴원 왕복 서비스 ◆ 전국 군부대 입대, 면회, 휴가 왕복 운행 ◆ 전국 교도소 면회 왕복 운행... 경기. 인천광역시. 구리. 구리시. 남양주. 남양주시. 오산. 오산시. 시흥. 시흥시. 군포. 군포시.의 왕. 의왕시. 하남. 하남시. 용인. 용인시. 파주....",2021. 5. 6.
[화성/용인/안산/오산] 예물 커플링 RingPlate 수원점,"예식일이 미뤄지거나 해외 각국의 입국금지로 인해 신혼여행마저 취소하는 사례들이 빗발치는 요즘... 어떠한 위로 한마디로도 그 근심들을 다... 안산, 오산, 용인, 화성시와 인접해 있는 Ring Plate 수원점 링플레이트 수원점은 경기 남부권에 위치하고 있어 용인, 안산, 화성, 오산시와 인접해...",2020. 3. 15.
"알바생 10명 중 8명은 ""감정노동""…64% ""우울증 경험""","______________________________ “이 시국에 누가…” 개업 급감한 헬스장, 노래방, PC방 2분기 들어서면서 곳곳에서 경기회복 신호가 나타나고 있지만... ______________________________ 오산시 올해도 ‘코로나19 착한 임대인’재산세 감면 는 지난해에 이어 올해도 코로나19 장기화로 인한 매출감소 등...",2021. 5. 22.
21년9월14일 화요일 상승종목정리,노랑풍선 ‘위드 코로나’ 기대감에 급등한 여행·항공주···노랑풍선 19% 올라 https://biz.chosun.com/stock/market_trend/2021/09/14... 이니텍 '장보고 배달특급' 어플로 제수 구입하는 이재명 지사 https://www.news1.kr/photos/view/?4970927 이재명 경기도지사가 13일 오후 경기도 오산시...,2021. 9. 15.
[대학생 일상] #4 넷플릭스 없인 못 살아 정말 못 살아,"'투게더'는 이승기와 류이호가 아시아 곳곳을 여행하며 팬을 찾아가는 버라이어티 프로그램인데요. 여행을 가지 못하는 현 시국으로 인해... 미드 '가십걸'의 스페인 버전으로 생각했었는데 그건 정말 경기도 오산시였어요. 제가 21년동안 본 영화, 드라마 통틀어서 가장 자극적이고 막장인...",2020. 7. 12.
[오산문화재단] 비전임계약직6급(예술촌장) 공개채용 공고,회사 정보오산문화재단https://www.osan.go.kr/arts/bbs/list.do?ptIdx=249&경기도 오산시 현충로 100예 구인 기본내역경영·관리문화재단... 징계에 따라 해임의 처분을 받은 날로부터 3년을 경과하지 아니한 자 ◦ 대한민국 국적 소지자로서 해외여행에 결격 사유가 있는 자 ※최종 합격 후에도...,2020. 12. 14.
"쿠팡이츠 배달파트너 연말시즌 프로모션 12월31일,1월1일","시흥시, 오산시 ★시간대별 건당 기본금액 12/31일 11:00 ~ 13:30 : 건당 5000원 16:00 ~ 17:00 : 건당 5000원 ★ 17:00 ~ 21:00 : 건당 10000원 ★ 21:00 ~ 02... 인해 경기가 많이 침체되었지만 2021년은 좀더 나은 세상이 됐으면 좋겠습니다..ㅠㅠ 여행가고 싶네요 진짜... 혹시 친구초대 이벤트에...",2020. 12. 30.
목포장거리택시 목포역에서 해남법원까지 택시이동,"및 여행 왕복 서비스 ◆ 전국 대형병원 외래진료 및 입퇴원 왕복 서비스 ◆ 전국 군부대 입대, 면회, 휴가 왕복 운행 ◆ 전국 교도소 면회 왕복 운행... 경기도.경기.인천광역시.구리.구리시.남양주.남양주시.오산.오산시.시흥.시흥시.군포.군포시.의왕.의왕시.하남.하남시.용인.용인시.파주.파주시....",2021. 6. 25.
동두천반려동물장례식 별이 된 우리 아이 잘 떠날 수 있도록,여행이나 여러 요인으로 인해 잠시 다른 사람에게 반려동물을 맡겼을 때 짧은 시간이지만 그리고 금방 만날 걸 알지만 괜스레 마음이 슬퍼지고... 오산점 경기도 오산시 세마역로 95 화성점 경기도 화성시 남양읍 남양시장로 51 평택점 경기도 평택시 평택로 279 남양주점 경기도 남양주시...,2021. 1. 19.
동탄 도시철도 기본계획(안) 및 경기도... 공람· 설명회 공고(경기도 공고 제2020–6287호),"위 치: 경기도 화성시, 오산시, 수원시, 용인시 일원 다. 계획규모: 연장 34.20㎞ (정거장 36개소, 차량기지 1개소) 라. 사업기간: 2019 ~ 2027년... 코로나19 관련 안내사항 1) 코로나19 방역수칙 준수사항 가) 발열, 호흡기 증상 등이 있거나 14일 이내 해외여행 경험이 있는 사람은 참석할...",2020. 11. 23.
가을 비대면관광지 100선,안전여행에 적합한 관광콘텐츠를 지속적으로 발굴하여 방역에 도움이 되는 방향으로 사업을 추진해 나가겠다.”고 밝혔어요. 수락산 학림사 거제 숲소리공원 남양주 물의정원 광주 월봉서원 부산 수영사적공원 가을 비대면관광지 100선 구분 광역 기초 관광지명 소개 1 경기도 용인시 은이성지...,2021. 3. 18.
우리나라 기초자치단체,"9 경기 고양시, 과천시, 광명시, 광주시, 구리시, 군포시, 김포시, 남양주시, 동두천시, 부천시, 성남시, 수원시, 시흥시, 안산시, 안성시, 안양시, 양주시, 오산시, 용인시, 의왕시, 의정부시, 이천시, 파주시, 평택시, 하남시, 화성시, 포천시, 가평군, 양평군, 여주군, 연천군 27시 4군 10 강원...",2021. 3. 30.
오산 맛집 기행 정보 추천 순위,"경기도 오산 가볼만한곳 여행지 오산시 먹거리 볼거리 여행정보 경기도 오산시로 짧은 여행을 다녀왔습니다. 오산은 굉장히 생소한 곳이고 또 처음 가보는 곳이여서, 가기전부터 살짝 설레이더군요. 가서보니 제가 사는 곳 주변의 작은 도시랑 별반 다를건 없었는데, 어쨌건 개인적으로는...",2020. 1. 20.
오산의 숨결을 찾아서...,"오산역2번출구~ 독산산성~중미령평화공원~물향기수목원 우리가 여행(담사)를 하기전에 일정계획을 정하고, 가야 할 곳에 대한 사전 정보(거리... 수목원은 경기도 오산시 수청동 일대에 있으며, 규모는 34㏊이고, 예로부터 맑은 물이 흐르는 곳이라 하여 붙은 수청동(水淸洞)이란 지명에서 명칭이...",2020. 8. 7.
2021년 10월 지역축제 현황,비대면 경기 가평군 제18회 자라섬 재즈페스티벌 대면 비대면 과천시 제2회 과천글로벌 테마영어체험 축제 취소 취소 제12회 과천시 평생학습... 미정 오산시 오산 문화재 야행 대면·비대면 비대면 2021 오산 통기타 페스티벌 대면·비대면 비대면 오산 종합예술제 대면·비대면 비대면 양평군...,2021. 10. 2.
강화도 데코타일시공 (한의원)22평 LG600-600데코타일시공,가능 경기 인천 서울 강원 대전 충남 작업 가능 데코타일 전문시공업체 총판 타일입니다. 이젠 여름이가고 가울이 일찍온것 같아서 너무 좋습니다. 현작에서도 작업할때 정말 좋아서 힘든줄 모르겠습닉다 요즘은 밖으로 나가면 시원함과 동시에 공기도 너무 좋운것 같아요 일을하거나 여행을...,2021. 9. 18.
전국 길(둘레길) 관광정보 현황(경기도),숭의전지 경기도 연천군 미산면 아미리 7 군남홍수조절지(두루미테마파크) 경기도 연천군 군남면 선곡리 산 243-9 숭의전지→당포성입구→주상절리→임진물새롬랜드→허브빌리지→군남홍수조절지(두루미테마파크) 031-956-8306 경기관광공사 통일이음길 호젓한 오솔길을 걸으며...,2021. 7. 12.
오산 10월 공연/행사 소식 _ 살랑살랑 시원한 바람과 함께하는 공연,여행 좋아하시는 분들은 무작정 떠나떠나~!! 캠핑 좋아하시는 분들은 조용히 힐링타임도 갖고~^^ 그리고 소나친구들은 아무래도 음악이나 춤... 10월23일 (금) 작지만 큰행복 버스킹 한신대상가 앞 공터 17시 소상공인 힘내시라고 오산시 소상공인연합회에서 준비한 공연입니다. 버스킹 형식으로...,2020. 10. 16.
오산역 케이크 카페 그라시아 매장에서 직접 만들어요,사이에서도 아는 사람들은 다 알아서 찾아간다는 그런 오산 케이크 카페이다. 뻔하디 뻔한 케이크 디저트가 싫다면 오산역 카페 그라시아 방문을 추천하고 싶다. 오산여행을 계획하시거나 이 주변에 사는 경기도민 오산시민에게 권해주고 싶다. 물향기수목원 관광을 마치고 꼭 한번 방문해보시길!,2020. 8. 29.
