header,contents,date
"[아기 놀이]재택근무 대응방법2-유엔초전기념관,스미스평화관",#재택근무 #아기놀이 #아빠 #일해야되 #유엔초전기념관 #오산 #동탄갈만한곳 #동탄여행 #오산근교 #서울근교 #아이나들이 #아이교육 #유엔초전비... 주소및 전화번호 031-378-4145 경기 오산시 경기대로 742 유엔군초전기념관 후관 스미스평화관 평일 09:00~18:00 매주 월요일 휴관 입장료 무료...,2021. 2. 5.
"오산 안경점 ""글라스바바안경 오산원동사거리점""에서 선글라스 렌즈 편광렌즈로 교체",레몬에이드와 자몽에이드를 마셨답니다. 선글라스 렌즈 잘 맞추고서 저녁 먹으로 뿅~~~ 신혼 여행 가서도 선글라스 잘 쓸께요 :) 글라스바바안경 오산원동사거리점 경기 오산시 경기대로 198 031-831-8725 매일 10:00 - 21:00 연중무휴 (명절당일 휴무),2021. 5. 28.
오산매운오뎅 오산역앞 추억의 남문오뎅집 맛있어요,오산매운오뎅 경기 오산시 오산로 206 매일 10:30 - 21:00 일요일 휴무 031-376-0282 오산 매운오뎅 ! 혹시 남문에 매운오뎅 아시나요? 제가 고등학생시절... 올만에 추억여행 다녀왔씁니다.. 또 올게요... 줜.맛.탱 ! #오산맛집 #오산오뎅 #오산매운오뎅 #매운오뎅 #남문오뎅 #수원매운오뎅 #오산역맛집...,2021. 2. 24.
경기지역화폐 카드 사용처 기준 및 잔액조회 방법 알아보기,"또한 안산시, 남양주시, 안양시, 평택시, 파주시, 의정부시, 광명시, 군포시, 하남시, 오산시, 이천시, 양주시, 구리시, 안성시, 포천시, 의왕시... 경기지역화폐 카드 사용처 기준 알아보기 경기지역 통화는 경기도내 연매출 10억원 이하의 소상공인 점포에서 사용 가능합니다 숙박, 여행, 의류, 주유소...",2021. 7. 8.
대중교통으로 아이와갈만한곳,"난 여행가는 느낌을 느끼려고 아이와 용산역에서 새마을호행을 타고 수원역에서 내려서 1호선 환승 후 오산대역에서 내려 도보로 이동했었다 가는법:1호선 오산대역 하차->오산대역2번출구->도보10~15분 031-378-1261 경기 오산시 청학로 211 지번금 암동 332-4 매일 09:00 - 18:00(1월1일, 설날 휴원)...",2020. 10. 14.
"짐 인천공항 방역콜밴 운행기 (인천공항에서 경기도, 경기도에서 인천공항, 오산시 픽업)","전국<서울,경기,인천,지방> 100여대 대형택시 모임입니다 ●금액은 미터요금 + 톨비 기준이며 ●자세한 주소 알려주시면 더 정확한 금액을 알 수... 해외여행 게스트하우스 에어비앤비 손님 픽업 샌딩전문 인천공항픽업샌딩전문 장거리이동 비지니스투어 바이어영접 지방출장 인천공항 입☆출국...",2021. 3. 31.
경기도,"이번 축제 주제는 ‘책과 함께 떠나는 여행’으로, 유튜브 ‘쏘이더월드’ 채널 운영자이자 <지금, 행복하고 싶어(중앙북스, 2020)>의 작가... 우수사례는 ▲최우수(경기도, 안양시, 안성시) ▲우수(고양시, 오산시, 경기도) ▲장려(하남시, 안양시, 포천시) 등 총 9건이다. 최우수 사례를 보면...",2021. 9. 28.
오산대카페 제주느낌카페 가비당,알로하~ 제주여행이 좋았는지 제주도 또 가고프다는 예블린~ 급여행은 자신없고~ 집근처에 #제주감성카페 #오산카페 #오산대카페 #오산가비당 갬성... 조만간 제주갬성 느끼로 혼자 방문해보기로 합니다♡ 오산 가비당 경기 오산시 내삼미로80번길 19-1 이용시간 - 오전12시 ~ 오후9시 전화번호 - 010/8454...,2021. 2. 6.
"오산 카페 레토리카 고양이카페 솔직후기(가격정보, 꿀팁, 귀여운 고양이 사진/영상)",이용 꿀팁과 귀여운 고양이 사진/영상을 잔뜩 가져왔으니 기대해 주세요♥ 오산 카페 레토리카 매장주소 : 경기 오산시 성호대로 56 전화번호 : 031... 귀여운 솜뭉치 친구 꿈나라 여행 중인 고양이. 벌러덩 한 자세로 장난감 가지고 노는 모습이 너무 귀엽더라구요ㅠ_ㅠ 너 왜 이리 귀여워...?...,2021. 9. 12.
오산 카페 엘토브 숲이 있는 힐링코스,현지 여행 정보를 공유하는 테이스트레블러입니다. 북오산IC 인근에 포레스트 감성의 새로운 카페가 생겼어요. 주소찾기로 해서 가지 않는다면 좀 찾기가 어려운데요. 도로변에 있지 않고 공장 사이의 작은 골목으로 들어가야 찾을 수 있어요. 1. 오산 카페 엘토브 주소 : 경기도 오산시 외삼미동...,2020. 12. 27.
오산 조개구이 궐동 조개창고 야외에서 즐기는 해물포차,요즘 날씨가 너무 좋아서 몸이 근질근질 여행 캠핑가기 딱 좋은 날씨에요. 4월은 꼭 가기로 다짐!!! 오늘 마지막 손님이 친구라서 끝나고 가볍게... 050-4570-6802 경기 오산시 수목원로 254 조개창고 도착!! 컨테이너 건물에 천막이 있는 포차입니다. 깔끔한 횟집 분위기는 아니고 해물 포차라고 생각하면...,2021. 3. 31.
[핸디의 카페투어 2탄]궐동카페_3030카페_크로플 맛집일쎄,주소 경기 오산시 대호로 139 스타팰리스 1층 오산카페_3030카페_동영상 매장 및 메뉴 #오산카페 #3030카페 는 사회적거리두기로 테이크아웃과 배달로 카페메뉴를 만날수있어요 #오산카페 #3030카페 는 식물이 많아서 겨울인데됴 휴양지 느낌이 뭔가 여행온기분이 들어서 좋았어요! 요즘같은...,2020. 12. 20.
[고독한 토리씨] 추울때 생각나는 오산 맛집 서해 해물 칼국수,꼭 가보셔요 전화번호: 031-375-5313 주소: 경기 오산시 동부대로568번길 10-5 매일 10:00 - 21:00 코로나로 인해 9시까지 영업을 하지만 진짜 추천드리는... 저 세계여행 끝나고 젤 먼저 먹은 곳이 여기에요... 이제 아시겠죠? 국물 육수 안에 바지락이 다 들어가 있어요! 저는 그릇으로 나오는 것보다...,2020. 12. 16.
코로나바이러스 소상공인자금 지원,"화성시, 오산시 (경기) 광명센터 (02)2066-6348 0303-3131-1037 경기 광명시 범안로 1035 송화빌딩 601호(하안동 651-1) 광명시, 시흥시 (경기)... 의료,관광,여행,공연,음식,숙박업 등(사치성 유흥업소 제외) ▪ (내용) ① 법인세, 부가가치세 신고․납부기한 연장(최대 9개월) ② 징수(최대...",2020. 2. 8.
순천만국가정원 입장료 동문 넓고 예뻐요,"서울강서구, 경기오산시, 경남진주시) 50퍼 할인이니 신분증 꼭 챙기세요~ 이 외에도 그린카드, 하나 람사르SB카드, 하나카드(순천사랑... 자유여행패스, S-tratin티켓 소지자 단체요금이 적용된다고하니 참고하세요! 들어가기 전 30개월 미만 아이가 있으신분들은 내부가 워낙 넓다보니...",2021. 5. 10.
오산 에그풀 아가와 함께라 더 좋았던 패밀리 레스토랑,에그풀 경기 오산시 내삼미로79번길 31 (수청동 617-2) 식사 평일 11:00 - 21:00 Break Time 15:30 - 17:00 주말 10:00 - 22:00 Break Time 16:00 - 16:30 070 4145 8097 정말 오오오오랜만에 시외버스 타러 원주터미널에 왔다 최애 마스크 아에르 KF 94 단디 착용하고 습관처럼 뚱바를 사버렸네 하 마스크 때문에 먹는 것도...,2020. 7. 13.
오산역 호텔 오산역 숙박은 깔끔하고 조용한 고요37호텔!,이번 추석은 코로나 때매 친척들도 모이는 분위기가 아니라 근교로 미니 여행을 떠났다. 호텔은 오산IC 근방에 위치한 고요37호텔로... 오산 고요37호텔 031-375-3735 경기 오산시 원동로37번길 35-16지번원동 776-20. #오산역호텔 #오산역모텔 #오산역숙박 #오산IC호텔 #오산IC모텔 #오산호텔...,2020. 10. 4.
오산 카페에서 초코 크루아상으로 행복 찾기~,"오산 TRIPLE 2 (트리플 투) 카페 주소 : 경기 오산시 청학로 222 지번 : 경기 오산시 수청동 611-4 오산대역 2번 출구에서 도보로 279m 브런치 운영시간 10... 그렇게 여행을 떠나 집에 도착한 크루아상, 오산 행복을 찾는 카페에서 직접 산 초코 크루아상 먹어봤는데! 글로 표현 못 해요 직접 드셔보시는 거...",2020. 11. 17.
[경기도가볼만한곳] 한국관광공사 선정 비대면여행지,5 출처 - 한국관광공사 경기도가볼만한곳 비대면여행지 우음도 주소 : 경기 화성시 송산면 고정리 비대면지수 : 5 출처 - 한국관광공사 경기도가볼만한곳 비대면여행지 물향기수목원 주소 : 경기 오산시 청학로 211 비고 : 유료 비대면지수 : 4 출처 - 한국관광공사 경기도가볼만한곳 비대면여행지...,2020. 11. 16.
오산 안경 오산 선글라스는 으뜸50안경,이번주 여행가는데 예쁜 선구리 빌려 힐링 뽀지게 해야겠어요♡ 으뜸50안경 오산점 경기 오산시 대원로 18 2층 이용시간 - 오전10시 ~ 오후9시 전화번호 - 050/71475/5667 #오산역안경점 #오산안경추천 #부모님선물 #여자친구선물 #서이추,2020. 11. 14.
[오산창고형대형카페] 도르프커피/오산분위기맛집 ✨,"오산창고형대형카페 - 도르프커피 영업시간 : 평일,주말09:00 - 21:00 연중무휴, Last Order 20:30 까지 위치 :경기 오산시 독산성로 205 나의 소중한 휴무... 이곳은 요즘 날씨에 앉아있기 좋은 것 같아요 ✨ 오산이 아니라 다른 곳으로 여행 온 것 같았던 카페 “도르프커피” 추천해요 �� #도르프커피...",2020. 9. 25.
[경기도가볼만한곳] 경기도가 소개해주는 비대면 관광지(경기도관광공사),"각종의 여행관련 할인쿠폰! 정부 또는 지자체에서 진행 하는 행사와 공지들이요. 완전 사랑합니다♡♡ 믿을 만하고, 실제로 도움을 많이 받았기... 오산시 물향기수목원 주소 : 경기 오산시 청학로 211 입장료 : 어름 1,500원 청소년/군인 1,000원 어린이 700원 경기도에서 운영하는 경기도립수목원인...",2020. 10. 30.
[경기도 오산] 망향비빔국수 오산점 비빔국수맛집!(+갈비만두),지금 바로 포스팅 시작합니다 망향비빔국수 오산점 031-378-7717 경기 오산시 남부대로 335 1층 히히 외부 사진 찍는 거 까먹어서 로드뷰에서... 동네 체인점에서 먹었는데 맛있네용 근데 본점이 더더 맛있고 본점만의 느낌이 있대서 ㅋㅋ 조만간 포천 방문하러 갑니다 ㅋㅋㅋ 역시 여행은 #식도락여행,2020. 10. 19.
경기도 일출 명소! 편하게 오르는 오산 세마대지,"여행 후기와 현지 여행 정보를 공유하는 테이스트레블러입니다. 새해 일출 뿐만 아니라 평소에도 해돋이, 해넘이 볼만한 경기도 일출 명소인 오산... 주소 : 경기 오산시 지곶동 89-1 입구는 여러곳이 있는데 사실 어느 곳으로 들어가든 상관없어요. 위쪽 성곽에서는 360도 코스로 이어져 있거든요....",2020. 12. 10.
"골목에서 만난 도시 이야기 오산 - 오산시립미술관, 오색시장, 까마귀브루잉","주소 경기 오산시 현충로 100 문의 031-379-9990 이용시간 10:00~20:00 이용요금 무료 홈페이지 http://osan.go.kr/arts TRAVEL TIP 1. 사진 찍기 좋은 장소로는 오산시립미술관과 오색시장의 야시장이 좋다. 2. 주변 여행지로는 물향기수목원과 오산에코리움이 있으며, 주변 먹을거리로는 오색시장의 다양한...",2021. 1. 21.
"오산맛집, 가심비 최고인 태국음식점 '타이메이트'",친구들과 가끔 해외여행을 같이 가곤했는데요 요즘같이 여행을 가지못할때는 아쉽지만 그때 먹었던 음식 먹으면서 추억하는 시간을 보내곤... 저처럼 추억 생각하며 현지 음식 드시고 싶으시면 오산 타이메이트 추천드려요! 오산 타이메이트 031-378-2923 오전11시~오후10시 경기 오산시 운천로 78,2020. 11. 23.
오산 동탄 장난감 백화점 할인매장 토이플러스,"아기와 함께 오산, 동탄 당일치기 여행을 다녀왔을 때 집으로 돌아가는 길에 북오산 IC 옆에 #장난감할인매장 토이플러스가 있더라고요 평일이라서... 토이플러스 #장난감마트 ▼ 경기 오산시 외삼미동 328-1 (문시로 109-12) 매일 am10:30 ~ pm9:00 명절 당일 휴무 전화번호 031-377-3232 매장은 생각보다 엄청...",2021. 4. 10.
결혼버스대절 후기! 28인승우등버스 빌렸어요,출발지 : 경기 오산시 가수로 33 도착지 : 부산 동구 중앙대로 206 부산역 출발 날짜 : 2020-02-15 도착 날짜 : 2020-02-15 인원 : 28명 2020-02-15에 경기... 영월여행을 위해 처음 들어온 쿨버스 앱 앞으로 자주 이용하겠습니다. 28인승 리무진으로 첫 예약을하고 계약금과 기사분과 통화하고 일정등을...,2020. 2. 16.
"오산대 카페, 3030 카페 다녀왔어요! (feat. 아인슈페너& 크로플 맛있는 카페)",잠깐 이지만 여유로운 시간도 보내고 일상에서 벗어나 잠시 동안 여행을 다녀온 기분이 들었어요 :-) 오늘은 여러분에게 어떤 날이셨나요? 커피 한잔하는 여유로움이 가득한 하루 보내셨기를 바라겠습니다 . 주소: 경기 오산시 대호로 139 스타팰리스 1층 . 전화번호: 070-8833-3276 . 영업시간: 10시 30분~ 9시,2021. 2. 1.
오산역 카페 달달했던 앤드커피,기차여행 당일날 급하게 준비하고 싶지 않아서 전날 오산역에서 머물렀어요 밥도 거하게 먹고 카페에 다녀왔는데요 역 근처라 어찌나 편하던지 소개해드릴게요! 앤드커피 경기 오산시 역광장로 54 031-373-0280 매일 10:00 - 23:00 오산역 카페는 오산역 1번 출구에서 나와 오른쪽으로 1분 정도 내려가면...,2020. 11. 16.
"경기도 오산 물향기 수목원, 왜 더 유명해지지 않는 거죠? 아이와 가볼만한 곳으로 추천!","오산 물향기 수목원 엄마가 된 여행작가, 김매력입니다 :) 작년 4월 말에 다녀왔던 오산 물향기수목원 포스팅을 1년도 지난 지금!!!! 드디어 올려... 오산시는 왜 이 곳을 더 적극적으로 홍보하지 않는가!!!! �� 초록이 주는 힐링이 있는 수목원 느낌은 영상으로 먼저 봐주세요 경기도립 물향기...",2020. 5. 2.
"경기도 삼남길 , 오산 독산성 산림욕장 - 양산봉 트레킹 코스","출발지점 (경기 옛길 삼남길 7코스, 산림욕 주차장) 스템프 찍고 걸어 가는길 - 즐거운 추억길 아침 새벽 공기 마시며 오산시 화성시 동탄 중간으로... 네팔여행 안나푸르나 베이스캠프 ABC 트레킹 준비 > 2천미터 이상에서 교육의 기회를 찾고자 하는 네팔 어린아이들 가난에서 벗어나고자 미래의...",2020. 9. 25.
"[후기]오산시 문화유산교육사 양성교육 3차, 독산성 축성의 시대적배경",4.19혁명의 김주열 6월항쟁의 박종철 이한열 권율장군의 세마대이야기로만 기억되는 독산성을 경기와 서해안의 중요 군사요충지임을 찾아내고... 임의숙 선생님 후기 까산이와 오산여행 3차시 독산성 축성의 시대적 배경 김준혁 한신대학교 교수 독성산성(禿城山城)은 한강 이남에서 남한산성과...,2020. 5. 8.
오산점심맛집 오산룸식당 오산 육풍프리미엄,"주소 ㅣ 경기 오산시 밀머리로 88 영업 ㅣ 11:30~22:30 (브레이크 15:00~16:00) 예약 ㅣ 네이버예약 #거리두기 중 너무너무 외식이 그리울때 룸이... 엄마 환갑이라 원래 계획했던 여행 다 취소하고 배달음식으로 홈파티로 하려다가 배달에 문제가 생겨 급하게 찾은 룸 있는 식당. 홀(왼쪽), 룸(오른쪽) 5...",2020. 12. 21.
생생정보통 맛집오늘 대왕해물탕 대박곱창구이 더덕제육산채정식 고려회관 꼬막정식...,여행을 떠난다. 마지막 코너 '행복한 인생'은 사과는 내 인생! 무주 산골 부부의 귀농 일기를 들여다본다. 주의! 전파를 탄 명소와 맛집은 방송 직후 붐빌 수 있으니 시간을 두고 전화 후 방문하는 것이 좋다. - 모해 - 메뉴 : 대왕해물탕 스끼야끼 전화번호 : 031-377-5504 주소: 경기 오산시...,2020. 12. 21.
오산모텔 벨리노S호텔 디럭스룸 넘 고급져!,오산쪽으로 여행계획 있으신분 혹은 오산인들! 요기 놀러한번 가보세용 예약링크도 밑에 뒀으니 참고하시길 바랍니당 ★ 모두 홈페이지 링크 - https://bellinoshotel.modoo.at 네이버 예약 링크 - https://booking.naver.com/booking/3/bizes/379894 전화 : 031-375-1663 주소 : 경기 오산시 경기대로658번길 25,2020. 10. 29.
이국적인 향이 물씬~ 오산 태국음식맛집 타이메이트,이곳에서 태국의 향을 많이 느낄수 있어 여행 못가는 아쉬움도 달래고 기분도 내고 왔는데요. 정말 여행온듯이 기분좋게 맛있게 먹고 올수 있어... 태국 생각나면 자주 올것 같아요. 태국음식 정말 맛있었어요 :) 오산 타이메이트 031-378-2923 오전11시~오후10시 경기 오산시 운천로 78,2020. 12. 23.
경기도에서 놀면 뭐하니?,"201n년 사진 저는 수도권에 살아서 몰랐는데, 다른 지방의 경우 에버랜드는 학교 다닐 때 수련회, 수학여행으로 갔다고 하더라구요. 201n년 사진... 애플 시나몬 맛있어요☻ 오산 맑음터 공원 (경기 오산시 누읍동 115-1) 색다르고 활동적인 것을 하고 싶었는데, 평소에는 자전거 탈 일이 없어서(없어서...",2020. 11. 4.
동탄 오산 카페 홍종흔베이커리 본점 대한민국명장 빵집,남자친구랑 담양여행 다녀오는 길에 군포 트레이더스 들리려고 근처 카페 알아보다가 발견했던 홍종흔베이커리 ! 제가 조수석에서 찾아보고... 커피 먹고 온 경기 오산 경기 동탄 베이커리카페 홍종흔베이커리였습니다 ! 홍종흔베이커리 본점 031-8003-4835 경기도 오산시 외삼미로 162-44 매일 08:00~22:30,2021. 3. 3.
오산대역 맛집 오풍미족발 배달 후기[정's 리뷰],"ㅎㅎ 오산인분들이면 배달궈궈 * 주소 - 경기 오산시 내삼미로79번길 24, 1층 107호(수청동) * 영업시간 - 17:00 ~ 05:00 #서이추환영 #서로이웃 #서이추 #이웃 #일상 #리뷰 #후기 #포스팅 #소통 #공감 #서로이웃추가 #이웃추가 #블로그 #jung #정쓰 #정 #일기 #명품 #집밥 #행복 #여행 #존맛 #먹방 #소소한...",2020. 11. 15.
오산중국집 / 보배반점 분위기 맛 다 만족 ★★★★★,"031-377-9017 경기 오산시 운암로 17 중앙상가빌딩 1층 101호 1오산역1번 출구에서974m 매일 11:30 - 23:00 마지막주문 22:30 단체석, 포장, 배달, 예약, 무선... 마직 홍콩에 온거 같은 느낌이 ~ 요즘 해외여행못가서 몸이 근질근질한데~ 이렇게나 분위기 좋은 오산짬뽕집이였네요 들어가자마자 인테리어에 한번...",2021. 2. 9.
올해 오산 ㆍ시흥 경기 아파트값 벌써 30% 상승,"곳은 경기도 오산시다. 매매가격은 주택 시장의 동향을 파악하는 용도로 활용된다. 변동률이 높을수록 시장의 가격 상승세가 가파르다는... 단숨에 '주식부자' 된 2030 샐러리맨 ￼ ""안타깝지만 집값 안 떨어집니다, 더 오를 겁니다"" ￼ [속보] 경기도 살면 제주여행 공짜 >>AD 세파 코리아...",2021. 8. 24.
오산 오리고기 작은영토 몸보신 최고,오산 오리고기 작은영토 여행 글은 언제쯤 시작이라도 할 수 있을지 모르겠어요ㅋㅋㅋ 너무 많아서 정리가 아예 안되거든요ㅠㅋㅋ (여독도 넘 쎄게 와서 멍한 상태랍니다) 떠나기 전날 오산에 하루 머물면서 오산 오리고기 작은영토에서 몸보신 제대로 하고 왔어요❤️ 작은영토 경기 오산시...,2020. 11. 20.
"2020.08.10 오산 대형 브런치 카페 "" 스티빈 (Steavin) ""","오늘은 동생이랑 오산에서 만나기로 했어요 ~~ 카페 가서 브런치 먹으면서 여행 계획도 세우기로 해서 오산에 핫한 카페가 어딘가 검색해보니... 먹어보고 싶어요 오산 스티빈 카페 추천합니다 "" 스티빈 (Steavin) 카페 "" 주소 : 경기 오산시 삼미로 47번 길 81-14 Tel : 031-831-8875 영업시간 : 매일 10:00 - 22:00",2020. 8. 10.
[오산궐동] 토욜저녁 강군닭발집서~~,"TEL:031-8050-9678 *매주월요일 휴무* 주소:경기 오산시 궐동로 30번지 포장,배달,예약 가능해요. 한가로운 주말 오후를 집에서 즐기고 저녁시간이... 닭발 #오산대술집 #서이추 #서이추환영 #노땡이 #노땡이블로거 #블린이 #오산블로거 #평택블로거 #동탄블로거 #소사벌블로거 #맛집블로거 #여행블로거",2021. 6. 27.
"""세라젬 웰카페 오산 원동직영점"" 이색공간 카페 V4 파우제안마의자 체험에 힐링","코로나19 때문에 한동안 카페도 못가고 여행도 못가고 너무 힘들었는 데... 이색카페를 알게 되서 소문듣고 엄마와 함께 세라젬 웰카페... 이런 이색카페 부모님과 함께 가도 너무 좋고 가족, 연인과 데이트도 너무 좋을 것 같아요^^ 세라젬 웰카페 오산원동직영점 경기 오산시 경기대로 249 1층 0507-1347...",2021. 3. 6.
경기도 오산 감성 피크닉 여행,"오늘은 경기도 오산의 숲속여행/피크닉, 오산카페를 알아보러 가보죠! 오산 물향기수목원 경기도 오산시 청학로 211 첫장소는 경기도 오산에 위치한 물향기수목원입니다 출처 : 경기농정 홈페이지 물 - 나무 - 인간의 만남을 주제로 2006년에 개원하였다고 합니다 출처 : 경기농정 홈페이지 출처...",2020. 7. 22.
돈버는장바구니 경기도... 부산 반려동물스튜디오 슬기로운외식생활신박한네바퀴여행,동물의 세계> ▶산책간다고했잖아요 (반려동물 스튜디오) 주소 부산광역시 북구 와석장터로 25 B1 스튜디오 <신박한 4바퀴 여행... 조기종료 될 수 있습니다 <슬기로운 외식생활> ▶ 갯내음 주소 경남 창원시 의창구 북면 천주로 571 ▶ 송이송이만두전골 주소 경기도 오산시 경기동로 137,2020. 12. 17.
[오산맛집] 장강 손짜장 정통중국요리 먹으러 가즈아,정통중국요리 장강 손짜장 경기 오산시 독산성로449번길 52 큰손손칼국수 세마역2번 출구에서838m 영업시간 매일 11:00 - 21:30 연중무휴 편의 단체석... 가족들이랑 같이 외식하고 동생이 쏴서 더 맛있었다~ ㅎㅎㅎ 날씨도 너무좋고 뭔가 가족여행 온거 같은 느낌? 귀요미 막냉이 동원이~ 오산대역 근처에...,2020. 10. 19.
생생정보마당 오산 오색시장 드라이브 마켓 이벤트 생생정보마당 구기자 택배 칠갑산...,주소 : 경기 오산시 오산동 862 오산로272번길 22 전화 : 031-376-4141 전통시장 특별한 축제 오산 오색시장의 다양한 인기상품을 드라이브... 최초 공개 '생생 주치의'와 함께 떠나는 힐링 여행 프로젝트 제2의 뇌라 불리는 장 건강 다스리고 면역력 높이는 특별한 비법 자세한 이야기...,2020. 10. 16.
반나절 주말여행(2020-2021개정판),"취하다 경기 쁘띠프랑스(가평군) 어린왕자가 살고 있는 프랑스마을 아침고요수목원(가평군) 고요한 아침의 나라, 한국의 정원을 거닐다 자라섬... 시간여행 허브빌리지(연천군) 바람도 머물다 가는 향기정원 독산성산림욕장(오산시) 청설모가 뛰어노는 잣나무 숲 울창 물향기수목원(오산시) 풀내음...",2020. 5. 25.
오산 가볼만한곳 주말 나들이 죽미령 평화공원!,평화공원 경기 오산시 외삼미동 600-1 죽미령 평화공원은 6.25 전쟁이 일어났던 당시 UN군이 처음으로 북한군과 전투를 벌였던 곳이라고 하더라고요.... 것을 추천드려요^^* #오산 #죽미령평화공원 #아스달연대기 #피크닉 #6.25 #모래놀이터 #놀이터 #텐트 #나들이 #오산가볼만한곳 #가볼만한곳 #주말 #여행,2020. 10. 22.
오산 세마동 동탄 맛집 고깃집 용궁갈비 추천,"하고 여행도 하고 맛있는 곳에서 식사도 하고 정말 즐거웠어요 갈비 2인분에 공깃밥 3개 된장찌개까지 34,000원인데 이때 된장찌개 값은 따로 안 받으셨어요! #오산고기맛집 #동탄고기맛집 용궁갈비 위치 경기 오산시 외삼미로152번길 57-29 (외상미동 119-12) 매일 오전 10시 ~ 오후 10시 031-8003-1312 단체...",2021. 1. 8.
동탄호수공원만두전골 송이송이만두전골,새로운 여행을 준비하는 비글맘ㅋㅋㅋㅋ 놀고있는데 왜이리 힘든지..ㅋㅋㅋㅋ 친척이랑 마지막으로 제주도여행을 가기로 했다죠??ㅎㅎ... 제주도 갈 짐을 슬슬 챙겨야겠어요^^ 송이송이만두전골 경기도 오산시 경기동로 137 이용시간 - 오전0시30분 ~ 오후9시 명절전날 당일 휴무 전화번호 - 050/71390/2116,2021. 5. 1.
오산매운오뎅 백종원 골목식당 매운소스 듬뿍✌️,오산매운오뎅 ❤️❤️❤️ 오산매운오뎅 경기 오산시 오산로 206 1오산역1번 출구에서228m 매일 10:30 - 21:00 일요일 휴무 ❣️주차는 바로 앞... 왓어용 #오산매운오뎅 #오산매운어묵 #오산맛집 #오산골목식당 #골목식당 #골목식당매운어묵 #골목식당매운오뎅 #오산 #오산여행 #오산가볼만한곳...,2020. 10. 14.
