header,contents,date
"[이천카페] 이천 가볼만한 곳, 이천 광주요, ""카페 코유""",코유 경기 이천시 신둔면 경충대로 3234 매일 09:00 ~ 18:00 매주 월요일 휴무 주차 가능 이천 카페 코유에요! 네비보고 찾아가는데 들어가는 입구... #이천 #이천여행 #이천가볼만한곳 #이천카페 #이천광주요 #광주요 #광주요센터점 #카페코유 #코유 #아메리카노 #사과주스 #크로와상 #내돈내산 #원히부부...,2021. 3. 19.
(이천) 천연기념물 - 반룡송,"반룡송을 처음본 소감은 !!두둥!! 범상치 않은 기운에,, 나도 모르게 예의를 차리게 된달까?ㅎㅎㅎ 용이 하늘로 오르는 것 처럼 구불구불한 나무가지가 참으로 신기했다. 이천 여행 가는 분들은 반룡송의 좋~은 기운 듬뿍 받아보시길~~~~ 반룡송 경기 이천시 백사면 도립리",2021. 3. 6.
이천 마카롱 빵순이라면 한번쯤은 가봐야 할 태극당,전 밥보다 빵을 많이 즐겨먹는 빵순이라서 여행하게 되면 그 지역 유명 빵집에 들러 꼭 빵맛을 보곤 하는데요 여기에 오면 꼭 먹어야할 대표빵이... 경기 이천시 부발읍 경충대로2092번길 39-31 202동 109호 태극당 031-632-4020 #이천빵집 #빵지순례 #빵집추천 #이천가볼만한곳 #경기도빵집투어...,2021. 5. 1.
"이천 캠핑용품 매장 캠핑고래 이천점, 매장도 크고 사고 싶은게 한곳에 다 있네요!!","캠핑고래 이천점 경기 이천시 황무로 1110 매일 10:00 ~ 20:00 그리고 얼마전 시흥캠핑고래점에서 봤던 하드기어 티피텐트와 벨텐트도 있더라구요.... 이제 저도 점점 남편따라 캠핑에 맛을 들이나봐요~ 사실은 여행을 좋아하고, 특히 해외여행 무쟈게 좋아하는데,,ㅎㅎ 요즘 시국 때문에 비행기 탈수도...",2021. 8. 12.
이천 산수유마을 여주 이포보 경기도 드라이브 코스,설렘을 안고 찾아간 이천 산수유마을 풍경을 동영상으로 담았으니 랜선여행 즐겨보세요. 1. 이천 산수유마을 경기 이천시 백사면 원적로 775번길 17 입장료 무료 계절마다 자연이 주는 힐링이라는 마법 같은 선물이지요. 서울에서 1시간 남짓 달려가면 만나볼 수 있는 경기도 이천 가볼만한곳...,2021. 3. 19.
이천 에덴 파라다이스 호텔: 세상의 모든 아침 조식 뷔페,"이천 에덴 파라다이스 호텔 세상의 모든 아침 조식 뷔페 이천 여행의 숙소였던 에덴 파라다이스 호텔의 조식 뷔페 메뉴와 솔직 후기를 남겨보도록... 세상의 모든 아침 주소: 경기 이천시 마장면 서이천로 449-79 전화: 031-645-9160 운영시간: 조식 8:00 ~ 10:00, 중식 11:40 ~ 15:30, 석식 17:40 ~ 21:00",2021. 6. 5.
[이천맛집] 캠핑 분위기 이천 맛집 대한민국장어,안녕하세요 수즈키입니다 이천 2박3일을 다녀왔어요~ 원래는 부산 여행을 계획했는데 주말에 비가오는 바람에 가까운곳으로 가자! 해서 이천을... 느껴졌어요 ㅠㅠ 이천 대한민국장어 영업시간 / 위치 영업시간: 매일 11:00 ~ 22:00 주소: 경기 이천시 신둔면 경충대로 3208 오늘도 방문해주셔서 감사합니다,2021. 4. 4.
글램핑 사이트 모음,"경기도 이천시 모가면 진상미로 1385번길 221-6. - 이천글램핑, 경기도글램핑, 글램핑추천, 프리미엄글램핑, 이천여행, 이천캠핑, 캠핑추천. 화원684글램핑( http://hw684.kr ) - 낙조가 아름다운 글램핑장. 전라남도 해남군 화원면 매봉길 528-8. - 야외수영장 계절체험장 낙조가...",2021. 8. 4.
이천 안흥동 서경한우프라자,덕분에 맛있는 저녁을 먹어서 기분좋은하루 마무리~ 재방문이였구요 보통 정육식당은 맛있자나요 꼭 가보시길 추천드립니당❤ ⬇️⬇️⬇️⬇️⬇️⬇️⬇️⬇️ 주소 : 경기 이천시 구만리로 300 #이천 #안흥동 #맛집 #서경한우 #소고기 #비빔냉면 #누룽지탕 #블로그 #일상 #여행 #먹방 #저녁식사,2021. 3. 6.
이천) 부발역 근처 신상 카페 - 송암 SONGAM -,"오늘의 같이 들어요 - 케이윌 Love Blossom 멜로망스 동화 웬디 Like Water 카페 송암 경기 이천시 부발읍 신아로92번길 45 송암빌딩 평일 09:00 - 22:00... 여행 , 사랑 , 돈 , 음식 , 휴식이 담겨있는 뽑기를 뽑아 알맞게 부착하면 되는 이색 공간이에요 이렇게 이미 많은 스티커들이 붙여 있더라구요...",2021. 6. 16.
(이천)테르메덴다녀온 후기,"위치 경기 이천시 모가면 사실로 984 수영복으로 갈아입고 실내수영장으로 나와 실컷 물놀이 합니다 이용시간 평일 11:00 - 19:00 매주 화요일... 실해서 좋았어요 떡볶이도 맛있고 튀김도 맛있었어요 ㅎㅎ 튀김은 김말이2개,고구마,만두 이렇게 나왔네요 #이천테르메덴 #이천 #이천여행 #이천아기랑",2021. 4. 9.
"이천 글램핑 인디어라운드 :) 카라반 , 감성카페",& & 주소 : 경기 이천시 이섭대천로941번길 49-44 카페 영업시간 : 토요일 10:00 - 20:00 카페주문30분전까지 일요일 10:00 - 20:00 카페주문30분전까지... 서울카라반 #경기도카라반 #갬성카페 #서울근교카페 #서울드라이브 #당일치기여행 #감성카페 #이쁜카페 #여행 #글램핑추천 #여행 #일상 #바베큐...,2021. 5. 31.
"이천 아이와나들이, 시몬스테라스(그로서리스토어, 라퍼커션 타악기 공연) 관람후기","비쥬얼제티는 가상의 여행을 주제로 관람과 체험을 같이 할수있는것 같은데요. 예약해 야되고 전시는 5월말까지로 알고 있는데 다 음에 기회되면... 시몬스테라스 경기 이천시 모가면 신갈리 374 월~목,일요일 11시~20시 금,토요일 11~21시 #이천나들이장소 #아이와갈만한 #시몬스테라스 #주변음식점...",2021. 6. 1.
"2020년 9월 15일 생방송 투데이-골목빵집(빨간맛 빵), 한 끗의 기적(소형 캠핑카)...","편 ▶<태극당제과점> 주소 : 경기 이천시 영창로 195 번호 : 031-635-4020 2. 한 끗의 기적 - 소형 캠핑카, 진실? or 거짓? 편 ▶<렉스온> 주소 : 충남 아산시 음봉면 봉신로 138-36 1동 번호 : ***-****-**** 3. 소문의 맛집 - 위(胃)대한 시간여행 고추장 넓적 돈가스 편 ▶<라디오쌀롱> 주소...",2020. 9. 15.
이천 시몬스테라스,"#시몬스테라스 주소 경기 이천시 모가면 사실로 988 영업시간 11:00- 20:00 요즘 SNS에서 핫한 시몬스테라스 서울 근교 드라이브코스로도 뜨고있는... 여긴 내부가 비행기 실내처럼 꾸며져있어서 해외여행 못가는 요즘, 잠깐 기분이라도 낼 수 있었다ㅋㅋㅋㅋㅋ 야외에도 포토존이 많아서 사진 찍는거...",2021. 3. 11.
"[전국무인텔]여주 이천 델루나 무인텔, 숙박정보 , 모던하고 깔끔한","꼭 연인기분을 출산하고도 놓치지기 싫었어요..ㅋ 그래서 무작정 이 곳 저곳 여행해보려고 했고, 그러다보니 아기가 있어서 차박도 힘들구... 델루나 무인텔 위치에요 ㅎㅎ 자 그럼~~~ 제가 묶었던 델루나 무인텔 고고~~씽 델루나 무인텔 경기 이천시 백사면 조읍리 251-63 호텔 숙박 정보 금액 무인텔에...",2021. 5. 6.
서울에서 제주까지 걷고 싶은 길 200,섬 여행의 모든 것 41 인천 옹진군 자월도 무인도에서의 표류를 꿈꾸다 42 인천 옹진군 장봉도 붉은 태양이 사라지는 낙조의 명소 43 인천 옹진군... 70 경기 이천시 백사면 산수유마을 봄을 알리는 노란 전령사 71 경기 화성시 융건릉 싱그러운 나무들이 가득한 왕릉 72 경기 가평군 축령산...,2021. 7. 10.
이천 가볼 만한 곳 추천: 시몬스 테라스점,"박물관, 수면 패턴 확인 등의 소소한 재미도 있고 쇼핑까지 할 수 있는 시몬스 테라스점. 경기도 이천 여행 가볼 만한 곳으로 추천합니다. 참고로 마지막 사진은 뒤에 있는 시몬스 회사예요! 시몬스 테라스점 주소: 경기 이천시 모가면 사실로 988 전화: 031-631-4071 영업시간: 11:00 ~ 20:00, 금, 토 11:00 ~ 21:00",2021. 6. 2.
'21 여름방학일상(ft.학원을 그만두고),"물놀이 후 돌아오는 길에 #나랏님이천쌀밥 경기 이천시 경충대로 3052 고속도로 달릴 일 있으면 들르는 곳 건너편에 스벅 드라이브쓰루도... 코로나 4단계 격상 이후 우리집2호 베프와의 호캉스도 취소했고, 부모님과 함께 여행가려 예약한 롯데부여리조트도 취소했지만. 인생은 계획대로...",2021. 8. 9.
[이천] 내돈내산 디저트 / 이천 빙수 맛집 :: 이천 빙수왕,터미널이랑도 가까워서 이천에 여행 오신 분들 드셔보길 추천합니다. 왜냐하면 날씨가 점점 더워지기 때문이죠 헤헷 사실 강릉 여행 다녀온 후로... 이천배달맛집 / 이천빙수맛집 “빙수왕” 추천합니다! 문의번호 문의번호 031-633-4979 주소 경기 이천시 애련정로 94,2021. 4. 27.
[2tv생생정보 맛집]돌판짜장·낙지한정식한상,돌판짜장 & 양념게장 <산타의 자장면> 경기 이천시 마장면 덕평로 ※ 영업시간 오전 11시 ~ 오후 7시 30분(매주 월요일 휴무) 3. 대동 맛 지도... 박광현의 아.재.여.행 (아주 재밌는 여행) <경기도 화성시> ■ 카발리에요트클럽 경기도 화성시 서신면 전곡항로 ※ 체험 프로그램 (반려견과...,2021. 7. 19.
낮에 가도 즐거웠던 덕평자연휴게소&별빛정원 우주,별빛정원 우주 위치 경기 이천시 마장면 각평리 319 운영시간 오전 11시 - 밤 11시 031-645-0002 주차안내 덕평 자연 휴게소 주차장 덕평 자연 휴게소에... 진짜 예쁜 포토존이 너무 가득해서 분명 잠깐 쉬러 온 휴게소가 여행이 되어버렸네요. 맑은 물이 흐르는 정원 너무 여유롭지 않나요? 더 안쪽에는...,2021. 3. 28.
대전비디오테이프변환 /어려운경기에 인상하지않고 착한 가격으로 보답,가능 테이프 는 개인 찍은 테이프 만가능 그리고 장레식 .결혼 .칠순 .신혼여행 .재롱잔치 비디오앨범 운동회 .회갑 가족 촬영한 비디오만... 시흥/군포/의왕/하남/용인/용인/처인구/수지구/파주시/이천시/안성시/김포시/화성시 /광주시/양주시/포천시/여주시/연천군/가평군/양평군...,2021. 9. 10.
이천 별빛정원우주 - 야간 데이트코스로도 아이와 인생샷 찍기에도 좋은 이천 가볼만한곳,"오늘은 지난주말에 다녀온 이천여행중 별빛정원우주 포스팅을 해볼께요. 경기 이천시 마장면 덕이로 154번길 207-76 031-645-0002 매일 12:00 - 23:00 일몰후 8시 이후가 제일 예쁜 피크타임! 야간입장권(18시-23시) 네이버예매시 25프로 할인 대인 9,000원(14세이상) 소인 6,000원(36개월이상-13세이하) 우리가족은...",2021. 6. 12.
이천 설봉공원 저수지 즐겁게 걸었어요,"설봉공원 경기 이천시 경충대로 2709번길 128 매일 00:00~24:00 무료 설봉공원 제1, 제2 주차장 무료 설봉공원 안에 위치해 있는 설봉호(호수, 연못... 근교인 경기도 이천 가볼만한곳으로 드라이브나 데이트, 산책코스 혹은 당일여행으로 추억쌓기에 더없이 좋은 설봉호수~ 힐링의 시간을 보낼수 있는...",2021. 4. 4.
이천 가볼만한곳 시몬스테라스 버츄얼제티,"정말 그리운 비행과, 해외여행....코로나가 종식되면 우리 가족은 동남아로 바로 날아가기로 했다. 태국이나 벳남이 그립다. 따뜻한 나라와 망고... 이천 가볼만한곳 _ 시몬스테라스 버츄얼제티경기 이천시 모가면 사실로 988031-631-4071운영시간 11:00~ 20:00 (금토는 21시까지)",2021. 3. 28.
경기도 차박 장소 추천 Top5,경기도 차박 장소 추천 Top5 코로나로 인해 많은 여행객들의 발걸음이 차박으로 향하고 있습니다. 이는 독립적인 공간에서 안전하게 즐길수 있다는... 복하천수변공원 경기 이천시 경충대로2422번길 17 경기도 이천에 위치한 복하천수변공원은 일명 삼겹살공원으로도 불리는 취시가 가능한 특색있는...,2021. 5. 14.
경강선 코스...내면의 평화를 찾아,"주소 : 경기 이천시 경충대로2697번길 172 이천시립박물관 관람시간 : 미일 오전 9시~오후 6시 (마감 30분 전까지 입장 / 월요일 휴무). 관람요금 : 무료... 깨달음의 계절 가을, 숲길을 따라 걸으며 선조의 지혜를 느껴보는 역사 여행도 좋겠죠? < 영릉 > 이용 안내 관람시간 : 오전 9시~오후 5시 30분 (마감...",2021. 9. 21.
"이천당일치기코스 : 부모님과 함께해도 데이트코스로도 굿❤ (시몬스테라스,이진상회...","지금은 '가상의여행 ' 전시도 하고 있으니 더더욱 볼거리도 포토존도 많아진 시몬스테라스에요. 부모님들도 좋아하셨던 시몬스테라스 추천 ! ▼▽자세한 리뷰는 아래에▼▽ 이진상회 070-8888-8882 경기 이천시 마장면 서이천로 648 매일10:00-22:00 (라스트오더21:30) 단체석,주차,포장,무선인터넷 이천...",2021. 3. 10.
이천 카페진리 :: 예쁘고 디저트도 맛나고!!,추억여행겸 올리려고 합니다. 오늘은 작년에 가족끼리 다녀온 카페진리를 소개해드리려고 해요. 어디를 갔다가 돌아오는 길에 그냥 오기는 너무... 날이 좋아지고 있으니 또 방문해서 다른 디저트와 다른 음료도 맛보고 싶어용!! 카페진리 경기 이천시 경충대로2481번길 94 12 : 00 - 21 : 00 월요일 휴무,2021. 4. 19.
☆ 라이언의 드론자격증 취득후기,드론 영상을 찍으면 비지니스에도 도움이 되고 / 가족들 여행을 갔을때 드론영상 / 해외출장가서 멋진 풍경을 드론으로 찍고 / 비지니스에... 인증을 받아 자체시험을 볼 수 있다고 하네요. 한국미래산업 드론교육원 : 경기 이천시 부발읍 부발중앙로221번길 224-20 T: 031-634-1536 T: 1544-3719,2021. 3. 27.
(이천 중국집)난향,주소 경기 이천시 호법면 중부대로763번길 5 바로앞에 주차장이있어요!! 넓진않아요^^ 도로변주위에 있고 매장이 좁았어요 좌식 세테이블... 자장면 남편이 시킨 짬뽕 볶음밥 진짜 맛있었어요ㅋㅋ 시키면 짬뽕 국물도 주시네요 맛있게 잘먹었어요 #이천여행 #이천맛집 #이천중국집 #이천짬뽕,2021. 5. 31.
거산투어로 전남 구례군 산수유마을에 가서 2021년 3월 20일,"원산지 한국, 중국이고 우리나라 전남 구례 산동면, 경기 이천시 백사면, 경상북도 의성군 에 많이 서식하고 처음에는 녹색이었다가 8~10월에 붉게... 좋았고 #거산투어가이드 님의 예쁘고 차분한 설명이 오늘 여행을 더 기분 좋게 해 주셔서 감사했습니다. 여행은 좋은 거! 떠나자! 보고 듣고 느끼러!",2021. 3. 22.
전국 길(둘레길) 관광정보 현황(경기도),숭의전지 경기도 연천군 미산면 아미리 7 군남홍수조절지(두루미테마파크) 경기도 연천군 군남면 선곡리 산 243-9 숭의전지→당포성입구→주상절리→임진물새롬랜드→허브빌리지→군남홍수조절지(두루미테마파크) 031-956-8306 경기관광공사 통일이음길 호젓한 오솔길을 걸으며...,2021. 7. 12.
[1] My Photos,8PM 촬영 - 위치: 강원 삼척시 수로부인길 453 - 가족과 함께 한 강원도 여행에서 머물렀던 쏠비치 삼척. 숙소 발코니에서 찍은 야경이다. ©j_ostin 2. 이천 세상의 모든 아침 Eden Paradise Hotel - 18. 07. 31. 3PM 촬영 - 위치: 경기 이천시 마장면 서이천로 449-79 - 엄마의 생신...,2021. 2. 6.
이천 예스파크 카페 웰콤 _ 옹기티라미수 쌀밥빙수,2일 여행을 다녀왔다 시국도 이러하니 걍 가까운데 다녀오자 해서 장소는 곤지암리조트로 ! 곤지암 주위는 참 뭐가 없는 편이라 경기도 광주랑... 웰콤 경기 이천시 신둔면 도자예술로62번길 28-22 매일 11:00 - 22:00 매주 월요일 휴무 카페 외관에서부터 느껴지는 핫플의 기운 입구부터 너무 예뻐서...,2020. 8. 27.
온세상도자여행 통해 저처럼 예쁜 그릇 얻어 봐요!!,"온세상도자여행 통해 저처럼 예쁜 그릇 얻어 봐요!! 안녕하세요~ 전 올해도 경기도자 페어 온세상도자여행 애청자인데요!!! 이번에 비주얼도 제품... 매 회 다양한 주제로 방송이 진행되며, 이번에는 생활도자 활용하는 꿀팁 노하우를 주제로 경기도 이천시의 요장의 제품을 보여주는 시간이에요....",2021. 8. 6.
{이천 맛집} 평창 송정 약수 송어회 / 내돈내산 / 이천 송어회 / 경기도 이천 / 찐맛집,"이천 평창송정약수송어회 031-638-3861 경기 이천시 아리역로 80 주차공간 있음, 포장가능 #이천맛집 #이천송어 #이천송어회 #이천송정송어회 #평창송정약수송어회 #송정동맛집 #이천송정동맛집 #이천회식 #이천횟집 #이천내돈내산 #이천찐맛집 #다람씨맛집 #이천회식맛집 #이천식당 #이천여행...",2021. 6. 10.
[캠핑생활] 이천 스타카라반 경기동부센터 캠핑카 카라반 주차장,"경기도 이천시에 있는 캠핑카 주차장, 카라반 주차장입니다 :) 카라반/캠핑카 타모델 주차가능, 전용주차장, 유럽 비스너/카베/스터커먼... 새로운 여행문화를 제공 #캠핑카 플랫폼을 통해 누구나 쉽고 저렵하게 이용할 수 있도록 서비스 제공 사람들이 생각하는 여유로운 삶을...",2021. 4. 8.
서울 근교 나들이 경기도 이천 카페 추천 ఇ 카페웰콤 ఇ 이천 가볼만한곳 이천 여행,헿 빙수만 드세여 사진 찍는 스팟이 많아서 좋음! 분위기가 다한 이천 카페 #서울근교나들이 #경기도이천카페추천 #카페웰콤 #이천가볼만한곳 #이천여행 #내돈내산 이천웰콤 경기 이천시 신둔면 도자예술로62번길 28-22 11:00-22:00 월요일 휴무 031-637-9030 @Copyright by Galpi,2020. 11. 1.
서울 근교 나들이 이천 가볼만한곳 시몬스테라스,테라스 ★ 경기 이천시 모가면 사실로 988 일월화수목 11:00 - 20:00 금토 11:00 - 21:00 QR체크인을 하고 들어가면 바로 보이는 곳! 시몬스 침대같죠?... 구경하고 나니 나가는 곳과 연결이 되어 있는 카페가 있어서 커피한잔을 마시면서 좀 여유를 부렸네요~ 카페 앞쪽에는 '버츄얼 제티' 라고 가상의 여행체...,2021. 4. 13.
[여행지 추천/국내여행] 국내 온천 추천 Best 6,오늘은 겨울 국내 여행지로 인기가 좋은 온천 여행에 대해 포스팅해보려고 합니다ㅎㅎㅎ~~ 추운 겨울엔 따뜻한 곳이 최고죠~~!! 따뜻한 물에 몸도... 주소 경기 이천시 모가면 사실로 984 & 3. 양양 오색탄산온천 (출처: 구글 이미지) 강원도 양양에 위치한 오색탄산온천은 국내 유일의 복합 보양...,2020. 2. 11.
29일 오후 6시까지 680명 코로나19 신규 확진,"인천 지역의 6개 학원으로 번져 지금까지 총 162명의 확진자가 나왔다. 경기 이천시 기숙학원(누적 14명), 경기 광명시 탁구 동호회(12명), 수도권 가족여행(13명), 충북 충주시 영어학원(8명), 울산 북구 현대자동차 공장(18명) 등 전국 곳곳에서 새로운 집단발병 사례가 나왔다.",2021. 6. 29.
경기도 과천시 가볼만한 곳 모음,문화제경기 이천시 서희테마파크 일대9월 7일8일... 동네서점② 책방 동네 속으로 파고들다 책방 앞에 서니 그제야 스케치북만한 입간판이 하나... 장소 경기 과천시 광명로 181 입장료 프로그램 상이 행사 내용 활쏘기 체험 떡메치기 뮤지컬 보석 같은 이야기 등... 과천시 가볼만한 곳 과천여행...,2021. 8. 10.
91년 5월 민주화운동 30주년 토론회 개최,(이천=유형수기자) 요즘 경기 이천시 모가면 어농리 소재 민주화운동기념공원 기획 전시실에서는 아주 특별한 시간여행이 펼쳐지고 있다. 진중한 여행이지만 유익하다. 우리나라의 민주주의의 퍼즐을 완성하기 위해 기꺼이 자신의 목숨을 바친 민주열사의 삶과 희생을 조명하는‘91년...,2021. 5. 25.
이천 감성카페 _ 카페진리 리모델링 후 재오픈했어요,"매일매일이 여행처럼 이천투어를 다니곤 한답니다 얼마전 이천에서 유명한 감성카페, 카페 진리를 다녀왔어요! 이천에서는 이미 감성카페라고... 매일 12 : 00 ~ 21 : 00 월요일 휴무 주소 : 경기 이천시 경충대로2481번길 94 이 글은 부부하루가 직접 돈주고 사먹고 느낀대로 쓴 솔직한 후기입니다 :D",2021. 3. 22.
"경기도 이천 산수유마을, 산수유 개화상태, 주차장, 대중교통 정보(2021.3.21)","경기도 이천 산수유마을 주소: 경기 이천시 백사면 원적로775번길 17 입장료: 무료 개방: 0시~24시 산수유 개화시기:3~4월 2021 0321 현재 노랗게... (도보 5~10분 소요) * 대중교통: 일요일이라는 특성상 차량도 붐비고, 가능하다면 뚜벅이 여행을 조용히 다녀옴도 좋을듯 하다. 승차 버스편 환승장...",2021. 3. 22.
슈크림 디저트카페 비어드파파 이천 덕평휴게소점,"한시간 이상 소요되는 장거리 여행을 갈 때면 꼭 들리게 되는 이천 덕평휴게소. 이천 덕평휴게소는 영동고속도로의 휴게소로, 양방향 모두... 비어드파파 덕평자연휴게소점 경기 이천시 마장면 각평리 319 덕평자연휴게소 내 매일 07:00 - 23:00 명절연휴 24시까지 운영 비어드파파 덕평휴게소점은...",2021. 2. 8.
이천맛집_비주얼도 맛도 좋았던 '이오로',"이천데이트여행 :-) 전날 저녁, 삼미분식에서 닭발 + 막걸리 먹고서 나른-한 일요일 오전 브런치겸 간만에 양식이 먹고싶어서 검색하다가 찾게된 '이오로 식당' 에 다녀왔습니다 :-) 맛도 비주얼도 좋았던 이오로식당 후기 고고링 배달,예약 가능합니다 ☎️ 031-631-0702 경기 이천시...",2021. 2. 26.
경기지역화폐 카드 사용처 기준 및 잔액조회 방법 알아보기,"또한 안산시, 남양주시, 안양시, 평택시, 파주시, 의정부시, 광명시, 군포시, 하남시, 오산시, 이천시, 양주시, 구리시, 안성시, 포천시, 의왕시... 경기지역화폐 카드 사용처 기준 알아보기 경기지역 통화는 경기도내 연매출 10억원 이하의 소상공인 점포에서 사용 가능합니다 숙박, 여행, 의류, 주유소...",2021. 7. 8.
[이천] 시몬스테라스 당일 데이트 코스,"이천 시몬스테라스 경기 이천시 모가면 사실로 988 http://www.simmons.co.kr 12월에 아기랑 다녀온 #시몬스테라스 후기에 대해 보여 드릴께요 들어 가는... 근교 여행으로 추천 강추 드려요 ""초니픽"" 아기랑 근교 나들이 강추 #이천시몬스테라스 #이천여행 #근교나들이 #시몬스테라스 #이천핫플레스...",2021. 2. 10.
2021년 국내 봄 여행지 & 안심 관광지로 봄나들이 가자 !!,비대면안심관광지 방문시 주의사항 사전에 해당 관광지 지자체나 관광안내소 등에 코로나 방역 준수사항을 확인하고 안전여행 하시기... do 경기 이천시 호반 도시의 매력을 제대로 만끽할 수 있는 춘천 공지천 산책길 호반 도시의 매력을 제대로 만끽할 수 있는 me2.do 강원 춘천시 청정...,2021. 4. 13.
"서울 근교 이천 데이트 코스 ""시몬스 테라스""","서울 근교 이천 데이트 코스 ""시몬스 테라스"" 경기 이천시 모가면 사실로 988 미세먼지가 가득했던 지난 주말~ 미세먼지는 미세먼지 대로 심하고... 정도 이 곳이 제일 핫하다고 하니 얼른 가보았어요~~ 코로나로 인해 해외여행을 가지 못하고 있는 지금 해외여행을 가는 느낌을 받을 수 있게 만든...",2021. 5. 17.
이천가볼만한카페추천 이천카페추천 명품 디저트 가득~,제가 몇 년 전에 프랑스 여행 가서 경험한 오래된 카페의 이국적인 스타일이 생각난다고 느꼈는데 역시나 소품이 영국이나 프랑스 산이라고... 그 이상의 퀄리티를 선보여준 것 같아요. 이천카페추천으로 다음에는 가족과 함께 올까 생각해요. 24601 경기 이천시 어재연로 29 ***-****-****,2020. 7. 27.
[수다리 맛집탐방] 중식땡길때마다 찾는 짬뽕맛집#조가네 #제육덮밥#이천맛집,"맛있는집이에요^^ 경기 이천시 진상미로2350 오전 10:30 ~ 21:00 매주 월요일 휴무 라스트오더 20:20 라고 합니다 방문하시는분은 참고하시고... 했으니깐 혼자 정신승리하면서 맨낭 맛있는거 먹겠습니다!!! 이상 오늘도 맛있는여행 즐기며 사는 수다리 였습니다 여러분들도 좋은하루, 즐거운 주말 보내세요^^",2021. 3. 6.
부활교회 가는 방법,부활교회 에덴낙원 이천에 여행을 가게 되면 부활교회 들려 보시는건 어떨까요?에덴파라다이스호텔도 좋은 장소인듯 싶습니다. 부활교회... 너는 흙이니 흙으로 돌아갈 것이니라 창세기 3장 19절경기 이천시 마장면 서이천로 449-79 목리 417-1 0507-1397-9100 에덴파라다이스호텔 ← 바로가기...,2020. 10. 28.
