header,contents,date
대부도 동춘서커스 :) 5살 아이와 함께 보기 좋았던 훌륭한 공연(네이버 예매하세요!),"대부도 동춘서커스 경기 안산시 단원구 대부북동 1849-31 일반 26,000원 소인 16,000원 필히 네이버 예매하세요! 네이버 예매시 일반 15,000원 소인 9... 되지않아 여행왔던 대부도, 그 곳을 8년이 지난 지금 쩡샤와 함께 다시 왔어요 기분이 뭔가 뭉클해요 왜죠... ㅋㅋㅋㅋㅋㅋㅋㅋㅋㅋㅋ...",2021. 8. 18.
인천공항콜밴 ⚘안산시 센딩 ✈인천공항까지 신형 스타렉스 5인승리무진으로...,인천공항콜밴 안산시 건건동센딩 고잔동주공5단지아파트경유 인천공항 제1터미널까지 #골프여행 가시는 고객님 여유롭고 편안하게 운행하여... ㅎㅎ #효도여행 #가족여행 #친목여행 #해외경기출전 골프여행 #해외출장등등 예약 주시면 집 앞에서 공항까지 주야로 365일 운행합니다 #외국인...,2020. 1. 6.
"병원, 회사 등 산발적 감염 계속...""만남 자체로 감염 전파 가능""","경기 남양주시 아동도서업체 관련해 어제 첫 확진자가 나온 뒤 접촉자 조사 중 4명이 추가로 확진됐고, 경기 안산시 실내포장마차에서도 그제... 행위 자체가 감염전파를 유발할 수 있는 행동이 될 수 있으므로 주말 동안에는 외출, 모임, 여행 등은 연기하거나 취소해줄 것""을 거듭 요청했습니다.",2020. 9. 4.
대부도카페 허니비치 초록문을 열면 서해바다가 한눈에 보여,여기는 대부도여행 중 두번째 카페 ✌ 제부도에 숙소를 잡아놨기 때문에 물길 시간이 15:20 까지. 그 이후로는 아주 늦은 저녁에 들어갈 수 있다... 허니비치 초록문을 열면 보이는 방아머리해수욕장 경기 안산시 단원구 대부황금로 1493-1 매일 10:30-21:00 연중무휴 주차장 있음 ⭕️(협소함 3대정도??)...,2021. 9. 13.
"[국내여행] 대부도로 힐링여행 떠나기 (볼거리, 맛집 등)",장마도 끝나고 개강이 얼마 안남기도 해서 친구와 가벼운 여름 여행을 떠나보기로 했습니다. 이번 목적지는 경기 안산시에 위치한 대부도인데요! 대부도 볼거리와 맛집 등을 간단하게 소개하고자 해요. 첫 번째로 소개할 곳은 방어머리 해수욕장입니다. 중간중간에 해수욕하는 사람들도 보였는데...,2020. 8. 27.
진한 국물의 대부도 칼국수 맛집 “33호 할머니 칼국수”,“33호 할머니 칼국수” 주소 : 경기 안산시 단원구 대부황금로 1297 1층 영업시간 : 매일 09:00 - 20:30 연중무휴 시부모님께 데이트 신청하고 ㅋㄷㅋㄷ... 대부도할머니칼국수 #대부도바지락칼국수 #선재도맛집 #대부도여행 #대부도여행코스 #대부도33호할머니 #대부도데이트 #대부도칼국수,2021. 9. 5.
"당일치기 같은 제부도, 대부도 여행",대부도 테마파크 대부바다향기테마파크 경기 안산시 단원구 대부북동 1841-10 주차장 매우넓 고 무료 4.3키로에 데크 산책로 조성으로 요즘같은 언택트 시대에 나들이하기에 더 없이 좋은곳이다. 대부도를 가면 항상 들리는곳으로 계절에 관계없이 산책하기에 좋은곳. 지평선을 바라보고 있노라면...,2020. 9. 23.
안산시 상록구 본오동 옷장수거 붙박이장폐기 의자버리기 돌침대버리는방법 가정폐기물...,"목재버리는법 #여행가방버리기 #커텐버리기 #mdf버리기 #악보보면대폐기 #안마의자수거비용 #안산시 #상록구 #일동 #이동 #본오동 #팔곡동 #양상동 #부곡동 #성포동 #월피동 #건건동 #사사동 #수암동 #장상동 #장하동 #사동 #반월동 #안산동 24시 문자, 전화 open!! 서울 인천 경기 All ! ***-****-**** 햇살자원...",2021. 1. 2.
"해필 전망대를 넘어서 돌아 오다, Mavic Air2 첫 영상 촬영, 매빅 에어2, 경기도 여행","버리기 일쑤 내 기체가 시야에서 사라져서 리턴투 홈 했더니 전망대를 타고 넘어서 돌아왔네요 완전 초보라 이런 경로로, 이런 영상이 찍혔는지도 몰랐네요 시화나래조력공원 시화 나래조력공원 빛의 오벨리스크 시화 나래 휴게소 달 전망대 큰가리비섬 경기 안산시 단원구 대부황금로 1901",2021. 3. 30.
김포공항콜밴 ♀️안산시센딩 ✈김포공항 ♂️국내선 ♀️바쁘게GOGogo,김포공항콜밴 안산시 고잔동에서 센딩 아 ~~~~ 15분이 늦었어요 조금 서둘러서 가야해요 김포공항 국내선까지 바쁘게 GOGogo 평상시 보다 10정도... ㅎㅎ #효도여행 #가족여행 #친목여행 #해외경기출전 #골프여행 #해외출장등등 예약 주시면 집 앞에서 공항까지 주야로 365일 운행합니다 #외국인...,2020. 1. 25.
유럽 감성이 넘치는 대부도 예쁜 카페 Ruedecafe 뤼드카페,"엄청 가까운 곳에 있어서, 골프장에 온 손님들에게도 인기가 많더라구요. 연인들끼리 데이트나, 가족 여행으로도 방문하면 정말 만족할만한 대부도 예쁜 카페 Ruedecafe 뤼드카페였습니다^_^ 전화 032-883-2662 주소 경기 안산시 단원구 대선로 341 영업시간 수요일 휴무 목요일 휴무 금~화요일 11:00 - 18:00",2021. 8. 24.
대부도 당일치기 여행:: 왕할머니 손칼국수(애견동반 식당),코로나땜에 무서워서 테라스인데도 문 열어놓고 밥먹은 우리 대부도 왕할머니 손칼국수 영업시간 08:30~20:00 (매주 목요일 휴무) 경기 안산시 단원구 대선로 15 여기 파전이 아주 실하다고 해서 먹어보고 싶었는데 진짜 맛있었어요ㅠㅠ 직원분들도 친절하시더라구요. 칼국수는 생각보다 평범한 맛...,2021. 1. 2.
서울근교 당일치기 여행 대부도 탄도항 대부광산퇴적암층,업사이클링으로 꾸며진 대형 화분 속 장미들이 화사한 모습으로 반겨주고 있으니 서울근교 당일치기 여행 한다면 바다향기수목원에서 꽃향기로 힐링의 시간 가져보면 좋겠지요. 3.선감어촌체험마을 경기도 안산시 단원구 개건너길 78 바다향기수목원에서 탄도항으로 이동하는데 네비가 이상하게...,2021. 6. 3.
[경기도 가볼만한 곳/대부도 당일치기 여행] 한여름에 가기엔 너무 더운...,"오늘은 얼마전 다녀온 대부도 여행지 바다향기수목원을 소개해드릴게요. 위치는 안산 단원구 선감도에 있습니다. 바다향기수목원 주소 : 경기 안산시 단원구 대부황금로 399 연락처 : 031-8008-6795 관람시간 : 매일 09:00 - 19:00(입장마감시간 18:00), 월요일 휴무, 신정,추석,설날 휴원 관람료 : 무료...",2020. 8. 20.
답답한 마음 뻥~ 뚫리는 곳으로 떠나자! 경기도 해안도로 드라이브코스 BEST3,"서해 바다와 시화호가 양옆에 펼쳐진 길을 달릴 수 있고, 시화나래 조력문화관 및 달전망대를 경유할 수 있어 당일치기 여행으로 손색이... <코스> 방아머리해수욕장 ▶ 시화방조제 ▶ 시화나래 휴게소 ▶ 시화나래 조력공원 시작지점: 경기도 안산시 단원구 대부북동 방아머리해수욕장 마음 다해...",2021. 5. 27.
"[대부도여행] 바다향기테마파크, 전동바이크대여","ㅋㅋㅋㅋㅋㅋ 근데 맛은 엄~청 맛집이다 이정도는 아니었어요 연인세트_30,000원 (칼국수2인+해물파전) #전통우리밀칼국수 주소 경기 안산시 단원구 대부황금로 1435 1층 영업시간 평일 09:30 - 20:30 주말 09:00 - 20:00 흐린 날씨였고 저희는 칼국수 먹고 바로 바다향기테마파크로 이동했어요!! 차로...",2020. 10. 14.
상록구 갈비 생각나는날 식사하기좋은 양지뜰 분위기도 여행온듯해,분위기좋은 상록구 갈비 먹기좋은 양지뜰 상록구 반월동에 있는 양지뜰은 한적한 곳에 위치하고있어서 바람쐬기 좋고 붕붕이와함께 와도 편안하게 주차하고 식사할수있어서좋더라구요 양지뜰 주소 : 경기 안산시 상록구 능앞길 39 ( 팔곡1동 369 ) 전화번호 031-502-1789 영업시간 매일 11:00-22:00 매주...,2020. 6. 17.
영흥도 에너지파크-어부네칼국수-바다향기수목원 까지 맛좋은여행,"주소 경기 안산시 단원구 대부황금로 399 관람시간 09:00 - 17:00 11~2월 09:00 - 18:00 3~5, 9~10월 09:00 - 19:00 6~8월 휴원일 월요일 휴무 1월1일 (설날월요일이... 인해 일시폐쇄 예요 선재도부터 영흥도 수목원까지 예쁜 카페들도 많고 볼거리가 참 많았답니다 다들 즐거운 드라이브 + 여행 되시길 바래요",2020. 10. 26.
"서울/경기 나들이 #14. 안산 시화나래(시화방조제, 달전망대)","오늘 소개해드릴 나들이 코스는 안산시 시화나래입니다. 여기는 가족들이랑 꼭 다시 가보고 싶을 만큼 정말 좋은 장소이고, 저는 여길 알았을 때 왜... #경기가볼만한곳 #시화방조제 #시화나래 #경기데이트코스 #서울당일치기여행 #경기드라이브코스 #시화전망대 #시화조력발전소 #주말나들이코스...",2020. 8. 5.
대부도 여행 대부 해솔길 1코스 낙조전망대 언제가도 좋아요,대부도 여행 대부 해솔길 1코스 낙조전망대 언제가도 좋아요 뭔가 어딘가 가고는 싶은데 숙박은 괜히 숙박비니 뭐니 비용적인 면에서 부담 스럽고..... 참고로 낙조전망대 주차는 [구봉도 공영주차장 : 경기 안산시 단원구 대부북동 산35-3 ] 검색 하시면 되요~ 그리고 해솔길 1코스 는 산으로...,2021. 3. 9.
"(국내여행) 경기도 육지속의 섬여행 - 제부도와 대부도,구봉도낙조전망대를 즐기기엔...","근교여행지를 찾는다. 수술한 어깨가 완전하게 회복될때 까지는 당분간은 이런 스케줄이 이어지겠다, 오늘 찾는 제부도는 경기도 화성의 서신면... 제부도에서 나와 대부도 탄도항으로 이동하면 화성시에서 안산시로 이동하게 된다. 화성시와 안산시, 시흥시까지 어딘가 어딘지? 오늘 하루동일...",2021. 6. 24.
"안산 대부 광산 퇴적암층, 안산대부광산퇴적암층, 크롬 4K, 경기도 여행","https://youtu.be/_BaxLWx0F90 ↑↑↑ 다음에서 보기 [유튜브] 클릭하여 유튜브 원본 영상을 시청하세요 경기 안산시 단원구 선감동 지번 / 경기 안산시 단원구 선감동 산 147-1 안산대부광산퇴적암층, 크롬으로 시청 하시면 4K 시화 방조제 건너서 한참을 가다보면 왼편에 유적지 이정표가...",2021. 5. 2.
안산 중앙동맛집 맛찬들 왕소금구이,상 호 : 맛 찬 들 안산중앙점(숙성돼지고기전문점) 주 소 : 경기 안산시 단원구 고잔동 537-6(유창빌딩1층) 전 화 : 031-405-6692 핸 번 : ***-****-****... 혹시 안산으로 여행하실때 맛있는 식사와 숙성육 고기를 맛보시고 싶다면 안산 중앙동맛집 맛찬들 왕소금구이를 방문하셔서 그 진함 감동의 맛을...,2021. 8. 3.
[Brompton] 브롬톤 가방(러기지) 할인 프로모션 - UP TO 40%,"색상: Black/Berry Crush, Lagoon Blue 소비자 가격: 172,000원 할인 가격: 120,400원(30% 할인) 브롬톤 'Game Bag' 영국 여행 가방 브랜드인... 070-8677-5418 경기 안산시 상록구 송호1길 89 1층 인천 벨로하우스 ***-****-**** 인천 서구 승학로 515 대림프라자 신스 부평점 032...",2021. 5. 26.
제부도 휴가 바다향기 수목원,"전화 : 031-8008-6795 주소 : 경기 안산시 단원구 대부황금로 399상세주소 언제 : 매일 09:00 - 18:003~5,9~10월 입장료 : 무료 개요 : [개요] 경기도는 식물... 아침 저녁으로 시원한 바람이 불어 오는 여름의 끝자락에서 휴가를 맞은 오빠가족들과 함께 서해바다 쪽으로 여행을 하게 되었다. 제부도 가는 길에...",2021. 9. 2.
"대부도 여행, 구봉도 해솔길 앞 바닷가펜션 블루이펜션",급하게 간 여행이지만 너무 깔끔하고 기본적인 것들이 다 비치되어 있어서 너무 편하게 잘 먹고 잘 놀고 완전히 힐링하고 왔어요. 주소: 경기 안산시 단원구 구봉타운길 49 (대부북동 1870-80) 전화: 032-885-0876 주차: 펜션 앞 주차 가능 #구봉도펜션 #대부도펜션 #구봉도바닷가앞펜션...,2020. 8. 18.
#여름에가볼만한곳 해바라기 핫플레이스 여행지 추천.Zip,#여름에가볼만한곳 해바라기 핫플레이스 여행지 추천.Zip 여름 대표 해바라기는 무더위에 지친 핫플님들에게 활력을 불어넣을 수... @ria__eonii 안산 대부도 주소: 경기 안산시 단원구 대부동동 insta by 5. @chaeng._.2 춘천 카페감자밭 주소: 강원도 춘천시 신북읍 신샘밭로 67...,2021. 8. 19.
대부도 칼국수 맛집 : 16호원조할머니손칼국수에서 황제해물바다칼국수 먹은 찐 후기,"생방송투데이 “여행 본능 섬” 편에서 소개된 대부도 맛집이라고 해요~ #대부도맛집 #16호원조할머니손칼국수 메뉴 저번에 방문했을때는... ⏰ 08:00 - 20:30 (매일) 주문마감 19시50분 화요일 휴무 공휴일 제외 (명절, 공휴일 영업함) ☎️ 032-883-5590 경기 안산시 단원구 대선로 10 포스팅에 도움이...",2021. 9. 20.
대부도여행의 끝 베이커리카페 리베르테,분위기 좀 내고 싶어요 ㅋㅋ 들어오는 길에 눈찜해둔 베이커리 카페에 들러보기로 했어요~ 대부도여행의 끝 베이커리카페 리베르테 랍니다!!... 마들렌 1개 주시더라구요~ 대부도 가시면 한 번 들러보세요 ^^ 주소 : 경기 안산시 단원구 대선로 27 전화번호 : 032-880-9608 영업시간 : 매일 10:00 - 22:00,2020. 5. 22.
[생방송투데이 맛집]만두전골·여수 여행 外,[생방송투데이 맛집]만두전골·여수 여행 外 입력날짜 : 2020. 11.27. 17:02 생방송투데이 오늘방송맛집 정보 오늘 11월 27일(금) 'SBS 생방송투데이... 편 ▶<밥도둑 반찬> 주소 : 경기 안산시 단원구 선삼로 16 3. 빅데이터 랭킹 맛집 - 수도권 최고의 만두전골 TOP 5 편 ▶<상화> 주소 : 김포시...,2020. 11. 28.
"선재도 여행 [33호할머니칼국수, 십리포해수욕장, 목섬]","1/2 디카페인 아메리카노와 떠나는 선재도 여행, 고속도로가 아닌 국도를 타고 가서 나중에는 방광 파열 될뻔ㅋㅋㅋㅋ 33호할머니칼국수 경기 안산시 단원구 대부황금로 1297 1층 깐바지락칼국수 2인분, 9,000 18,000원!! 배고파서 그런지 꿀맛탱 간만에 먹어서 그런지 꿀맛탱 사실 이날 아침에 퇴근해서...",2020. 7. 23.
인천공항콜밴 ♣️시흥시에서안산시원룸이사간편해요,인천공항콜밴 시흥시 정왕동에서 #원룸이사 안산시 선부동으로 간편하고 편리하게 #소형이사 라서 짐을 박스가 아닌 거의 낱개로 옮기게... TV등 #효도여행 #가족여행 #친목여행 #해외경기출전 #골프여행 #해외출장등등 예약 주시면 집 앞에서 공항까지 주야로 365일 운행합니다 #외국인...,2020. 2. 9.
오늘저녁 양파 효소 반찬 고수의 족집게 레시피 100세 이정순 할머니 수호천사 지웅이...,"네바퀴 여행] 사랑을 낚아라! 낚시광 부부의 낭만 캠핑 최재훈(54), 반옥님(51) 부부 상호 : 대부도 하늘바다낚시터 주소 : 경기 안산시 단원구 작은상재미길 99 정보 : 월척수배 & 붕어여신 밴드@littleboy 유튜브 @UCdHQTKJFNnCHSU5fz9Yq4qA [반찬 고수의 족집게 레시피] 남편 애간장...",2021. 9. 7.
"안산 중앙동 맛집, 안산 고잔동 맛집 휘니치로 라멘, 교자 잊을 수 없어","휘니치로 주소: 경기 안산시 단원구 고잔1길 69 (고잔동, 골든게이트빌) 영업시간: 매일 12:00~22:00 (L.O 21:30), 평일 B.T 15~16시 / 주말 B.T 없음 세상에... 음식 비쥬얼도 좋지만, 외관과 내부 인테리어는 진짜 일본에 여행온 것 같은 착각이 들었답니다. 빨간 파라솔이 원목 나무의 인테리어 앞에 있는 것이...",2021. 9. 5.
"일상블로그 : 당일치기여행으로 다녀오기 좋은 대부도, 알로하피크닉 :)",이번주말에 #당일치기여행 다녀온곳 공유할게요 :) 알로하피크닉 매일 10:00 ~ 22:00 휴무 : 연중무휴이나 날씨조건에 따라 변동 알로하 피크닉 ဣ... 아쉬운 마음을 뒤로하고 다시 인천으로 돌아가봅니다 ㅜ ㅜ 집가기전 마주친 냐옹이 (๑˃́ꇴ˂̀๑)♥ 잘지내 또 올게 - 알로하피크닉 경기 안산시...,2020. 7. 4.
"안산 대부도 당일치기여행 가볼만한 곳(물때시간 체크)구봉도낙조전망대,대부도해솔길...","인천, 경기도에 사시는 분들이면서 쉽게 다녀올 수 있는 대부도, 선재도, 영흥도 당일치기 여행을 계획하게 되었답니다. 사실 당일치기여행계획... 더워, 1층 누에섬이야기, 2층, 세계의 섬, 3층 전망대, 4층 등탑(관계자만) 안산시 스탬프 투어 대부해솔길 7코스 도장이 이곳에 비치되어 있더라고요...",2021. 6. 26.
서울근교 오션뷰 카페 대부도 발리다,경기 안산시 단원구 구봉타운길 57 1층 월~목 11:00 - 19:30 / 수요일 휴무 금~일 10:00 - 20:00 서울근교 오션뷰 카페 하면 대부도 그 중에서도 제일 신상카페 발리다 주차공간은 가게 앞에 3대 댈 수 있는데 거의 댈데가 없다고 생각하고 인근 공영주차장이나 카페 근처 갓길 이용! 와 우 ㅎㅎㅎㅎ 허니비치...,2021. 6. 14.
안산웨딩박람회 스드메 가격봐요!,"네비주소 : 경기 안산시 단원구 광덕4로 96 디오컨벤션웨딩홀 5층 수인분당선, 4호선, 고잔역 바로 앞이에요! 요즘 날씨 정말 좋지 않나요... 원래도 허니문으로 인기 많은 곳들인데 코로나로 인하여 지금 관광객이 예전만큼 많지 않아 해외여행을 원하신다면 관광객이 많이 없는 지금! 저도 해외로...",2021. 9. 2.
"[대부도 발리다 카페] 안산 대부도 카페 추천, 서울 근교 오션뷰 카페, 대부도 발리느낌...",#발리다 경기 안산시 단원구 대부북동 1870-96 월화목 11:00-19:30 금토일 10:00 - 20:00 (수요일휴무) 0507-1435-5909 요기 앞에 바로 바다구 밀물 썰물이... 안산카페 #안산근교카페 #대부도발리 #대부도오션뷰 #서울근교여행 #서울근교카페 #안산근교 #경기도카페 #경기도오션뷰 #경기도카페추천 #대부도카페추천,2021. 7. 15.
여행이 힐링이되는 대부도단체펜션 구봉도힐링캠프~,주소 : 경기 안산시 단원구 연목이길 21 (대부북동) 대부도단체펜션 구봉도힐링캠프는 공원처럼 널찍한 공간에 자리잡아 푸르른 녹음을 느낄 수... 자아내 여행하는 모든 시간을 황홀하게 만들어주는 프라이빗한 독채펜션이예요~ 안에가 무척 넓어서 대가족으로 여행을와도! 회사에서 워크샵을 와도!...,2020. 6. 18.
"해필 전망대를 넘어서 돌아 오다, Mavic Air2 첫 영상 촬영, 매빅 에어2, 경기도 여행","버리기 일쑤 내 기체가 시야에서 사라져서 리턴투 홈 했더니 전망대를 타고 넘어서 돌아왔네요 완전 초보라 이런 경로로, 이런 영상이 찍혔는지도 몰랐네요 시화나래조력공원 시화 나래조력공원 빛의 오벨리스크 시화 나래 휴게소 달 전망대 큰가리비섬 경기 안산시 단원구 대부황금로 1901",2021. 3. 9.
"대부도 카페 <Cafe DBB> 1층은 햄버거 2층은 카페, 놀러갔다가 들리기 좋음.","전화: 032-891-5400 주소: 경기 안산시 단원구 구봉길 59지번대부북동 1865-126 2층 Cafe DBB 영업시간: 평일 11:00 - 20:00 매 주 월요일 휴무 다른 장소를 생각해 보지만, 결국 대부도로 가게 되는 친구들 모임 ㅎㅎ 펜션에서 1박을 하고 집에 가는 길, 동춘 서커스를 보기 전 들린 카페. 엄~~청 큰 카페 부지에...",2020. 1. 22.
반월저수지맛집 청기와 메밀국수 폭풍흡입,경기 안산시 상록구 남산평길 122 / 매일 10시30분 ~ 21시 다온카드 OK / 주차가능 / 애견동반 가능 청기와는 반월저수지를 자주 다니면서 메밀국수?... 메밀 요리는 건강에도 좋아서 남녀노소 많은 사람들이 즐겨 찾고 특히 강원도 여행이나 출장을 가면 항상 먹는데 기대가 많이 됩니다ㅋ 가격도...,2021. 9. 15.
"'나만 없어 부동산!' 준비된 노후, 금퇴족으로 살려면 이런 부동산 주목해라","퇴직자들은 친구들과 외식도 하고, 가끔 여행도 가는 ‘여유 있는 삶’을 누리기 위해서는 한 달에 최소 400만원 가량 있어야 한다고 생각한... 경기 안산시 단원구 성곡동 849-6번지 외 2필지에 지어지는 이 오피스텔은 시화MTV의 개발호재와 풍부한 배후수요를 그대로 누릴 수 있어 주목되는데요....",2021. 7. 15.
[도너츠윤] 대부도 찹쌀도너츠맛집,요즘 대부도로 여행가시는 분들 많죠? 대부도! 하면 원래 찐빵이 유명하죠? 하지만 색다른걸 먹고싶다 불란서빵집 근처에 있는 #찹쌀도너츠맛집 #도너츠윤 이 생겨서 방문했어요!! 도너츠윤 주소 : 경기 안산시 단원구 대부황금로 1478 A동 101호 도너츠윤 대부도점 영업시간 : 10시~오후7시...,2021. 8. 7.
인천공항콜밴 안산시에서 센딩 ✈인천공항 제2터미널까지 ♂️안전하게 ♀️편안하게,인천공항콜밴 안산시 고잔동에서 센딩 #골프투어 가시는 고객님들 모시고 여유롭고 편안하게 운행하여 인천공항 제2터미널까지 안전하게... ㅎㅎ #효도여행 #가족여행 #친목여행 #해외경기출전 #골프여행 #해외출장등등 예약 주시면 집 앞에서 공항까지 주야로 365일 운행합니다 #외국인...,2020. 2. 12.
경기도 안산 맛집 :: 사사동 데이트 즐긴다면 봉궁순대국은 필수코스!,국밥이랑 같이 곁들여 먹어도 잘 어울렸답니다. 씹는 재미는 물론 향도 훨씬 강해졌어요. 앞으로도 자주 가고 싶은 경기도 안산 맛집이었어요! 다음에는 안 먹어본 걸로 먹어보려구요! [봉궁순대국 본점] 경기 안산시 상록구 사사안골길 2-2 031-439-0005,2020. 4. 29.
2020_09 국내여행/ 경기도 안산 대부도 노지 캠핑 & 대부도 방아머리 해수욕장 노지 캠핑,"다음날 집으로 돌아가기 전 칼국수 한 그릇 뿌시기 위해 근처 칼국수 집으로 이동했어욤 저희가 방문한 "" 맛자랑 칼국수 "" 맛자랑 칼국수 경기 안산시 단원구 대부 황금로 1516-15 바지락 손칼국수 1인 9,000원 대부도 맛자랑 칼국수집 칼국수 면은 경남 하동에서 재배된 100% 순수한 녹차잎 가루만...",2021. 2. 23.
"SBS 생방송 투데이 12월23일 여행본능, 섬 겨울비경 랜선여행 ‘대부도’ (로브스터...","SBS 생방송 투데이 12월23일 여행본능, 섬 겨울비경 랜선여행 ‘대부도’(로브스터 낚시) 실내 로브스터 낚시 랍스터를 마음껏 잡아요 독도바다좌대낚시 ☎ 032-884-1111 (로브스터 낚시) 경기 안산시 단원구 대부북동 642-171 방문 후기는 아래 블러그에서 보세요",2020. 12. 24.
단원구 선부동 선부주유소 터널세차했어요,지난 번에 태안 독채 펜션으로 여행을 다녀오면서 생각보다 고속도로에서 벌레 테러를 많이 받았어요 ㅎㅎㅎ 아이들도 햇빛 강하지만 논다고... S-OIL 경기 안산시 단원구 선부로 81 선부 주유소에서는 세차하시는 분들을 위해 특화되어 있는데요 ㅎㅎㅎ 주유소 끝부분을 돌아서 터널을 지나 들어오면...,2021. 8. 5.
감동이네 카페 투어 #1,카페 요유 경기 안산시 단원구 광덕 3로 135-18 . . yoyu - IPHONE8PLUS CAMERA . . 사실 이곳은 이곳이 목적지가 아니었다. 고잔역 근처 팬케이크 맛집 카페를 찾아 나섰는데 의외의 상황이 벌어져 근처 카페를 찾다 들어가게 된 곳이다. 동네 카페에 노키즈존이.... 수원 행궁 카페거리에서 퇴짜...,2020. 5. 24.
[추천] 대부도가족여행 '대부도예약센터'에서!,대부도펜션예약센터 전화 - 0507-1324-4452 주소 - 경기 안산시 단원구 상동로 63 #대부도가족여행 #대부도가족펜션 #대부도단독펜션 #대부도단체펜션 #대부도독채펜션 #대부도독채펜션 #대부도엠티 #대부도펜션 #대부도펜션단체 #대부도펜션독채 #대부도펜션예약 #대부도펜션예약사이트...,2020. 11. 4.
"2020년 12월 23일 생방송 투데이-단열필름,여행본능 섬(대부도), 오천만의 메뉴(랍스터...","여행본능, 섬 - 겨울비경 랜선여행 ‘대부도’ 편 ▶<독도바다좌대낚시> 주소 : 경기 안산시 단원구 대부북동 642-171 번호 : 032-884-1111 (로브스터 낚시) ▶<전곡항요트> 주소 : 경기 화성시 서신면 전곡항로 5 전곡항마리나클럽하우스 번호 : ***-****-**** (요트체험) ▶누에섬...",2020. 12. 24.
