header,contents,date
하남미사지구맛집 중화요리 추천,"푸챠오( 중화요리 ) 경기 하남시 덕풍북로111 영업시간 11:30~22:00 예약 031 - 796 - 9488 주차장 완비 단체석 완비 중화요리의 기본적인 음식 뿐 아니라... 한자리에서 오랫동안 영업을 한 푸챠오는 매장에 들어서는 순간부터 시간여행을 한듯 매장을 구성하는 모든 인테리어가 차이나, china 하는것이...",2021. 6. 16.
'떠나볼까? 경기도 광주 나들이 밥상' 식객 허영만의 백반기행 101회 식당 소개,마방집 (한정식&소장작불고기) 주소> 경기도 하남시 하남대로 674 연락처> 031-791-0011 * 하남시청 방향으로 직진하다 광주로 꺾어지는 길목 왼쪽에 위치 마방집은 하남시에 위치한 전통의 한상차림 한정식집이죠. 저도 중.고등학교 시절 부모님따라 마방집에 다녔던 기억이 새록새록 합니다....,2021. 5. 2.
미사 애견카페 별빛개냥에서 강아지와 즐거운 시간보내면서 먹방까지 !!!,"< 별빛개냥 > 주소 : 경기 하남시 미사강변중앙로 157 (망월동, 리버테라스) 영업시간 : 월~금 13 : 00 ~ 24 : 00 / 토~일 11 : 00 ~ 24 : 00 4월부터 10월까지... 직장인분들 또는 여행, 바쁜일 있으신 분들은 안심하고 맡기셔도 되겠어요. 사장님이 정말 가족처럼 보살펴주시더라구요. 강아지 옷도 입혀서 사진도...",2020. 9. 25.
하남 루프탑 카페 르빵드비 빵지순례,"르빵드비 카페 위치 르 빵 드비 주소는 경기 하남시 서하남로 436, 춘궁동 308-15 1층이에요. 춘궁저수지 근처에 있는 대형 카페네요. 전화번호 031... 상세히 표기하는 하남 맛집 르빵드비 베이커리카페로 매우 추천드려요~ #카페거리 #카페투어 #분위기좋은카페 #여행하는이바짱 #EVACAFE",2020. 11. 23.
탐라는 맛집 하남탐라은갈치,영업시간 : 매일 11:00-21:00 연중무휴 주소 : 경기 하남시 서하남로 390번길 17 전화번호 : 031-793-8292 주차 : 무료 가격 : 은갈치조림 20000원 (점심특선... 마침 저희가 작년 가을에 제주도로 신혼여행을 다녀왔지요. 가게 이름이 탐라은갈치라서 그런지 제주도에서 먹었던 맛이랑 다르지 않았어요. 가격이...,2021. 4. 26.
공작 헤어 메이크오버 하남점에서 변신!(feat. 단발),"휴식 아니면 여행.. (여행은 좀 그렇고) 다들 집에서 푹 쉬고 계시지 않나 싶은데요 오늘은 저의 주말을 공개해볼까 합니다 사실 저도... 아 참, 공작 헤어 메이크오버 주소 알려드릴게요! 공작 헤어 메이크오버 경기 하남시 아리수로 570 효성 해링턴 더 퍼스트 2층 031-793-1211 / 매일 10:30~21:00",2020. 7. 18.
[ 하남 미사] 꿀맛 인정 경주식 한우갈비살 전문점 ' 늘푸른목장 ',"경주 여행 갔다가 다시 한번 먹었는데 흐이이익 ... 엄청 맛있어서 기억에 너무 남았어요! 그런 느낌의 경주식 소갈비살이 하남 미사점에... 모이세요!!!!! 늘푸른목장 미사강변점 주소: 경기 하남시 미사강변중앙로 220 우성미사타워 1층 늘푸른목장 전화번호: 0507-1323-1070 주차 O, 예약 O, 포장 O",2021. 4. 6.
"서울 근교 당일치기, 직접 가본 5가지 추천 장소!","서울 근교 당일치기 직접 다녀온 5가지 추천 장소 공유 내돈여행 제방 뷰 예쁘됴,, 이 포스팅은 장마가 빨리 끝나길 바라는 마음으로 해가 다시... 팔당댐 (경기 하남시 배알미동) 서울 근교 당일치기 드라이브하면 많이들 찾아가는 곳이 팔당댐이죠! 자전거 타며 힐링하기에 너무 좋은 장소. 서울과도...",2020. 8. 5.
미사강변 맛집 호천당 미사점 맛있는 돈까스,깔끔하게 오픈키친으로 운영이 되고 있고 한쪽에는 고기가 숙성되는 냉장고도 있어요 이렇게 나와서 돈까스를 먹으니 일본여행 온 것 같은 느낌이... 주소 : 경기 하남시 미사강변한강로 230 호천당(미사점) (031 - 795 - 4701 - 본 포스팅은 식사를 제공받고 솔직하게 작성되었습니다 -,2021. 3. 21.
"피로가 싹트고 있는 보양식, 백숙 맛집","남이섬과 자라섬 등 유명 관광지가 있는 가평은 가족이나 연인들이 쉽게 갈 수 있는 여행지입니다. 가평시에서 15 분 이내에, 입구에 있는... 위치 : 경기 하남시 검단산로 34213 * 전화 번호 : 0317956677 * 영업 시간 : 매일 11:00 21:30 * 마지막 명령 20:30, 구정 * 추석 전일 및 하루만 휴업 * 메뉴...",2021. 7. 9.
"김영태스시&사시미마을 :: 하남미사맛집, 가족외식하기 좋은 곳!",ㅎㄷㄷ 김영태스시&사시미마을 하남미사점 주소 : 경기 하남시 미사강변북로30번길 117 *주차가능* 점심특선 메뉴가 있어서 스시를 비교적 저렴한... 다음번에 오면 김영태스시 오마카세 23Pcs 꼭 먹어보고 싶네요!^^ 매장내부가 굉장히 깔끔하고 일본어가 여기 저기 적혀 있어서 일본여행 갔던 때가...,2021. 2. 11.
"[미사역 카페] 카페엘림, 오아시스 감성으로 깊은 해갈을 하다","해외여행을 가본 적이 있는가? 코로나19 상황이 상황인지라, 많은 이들의 목마름에도 불구하고 현재 해외여행은 상당히 그 제약이 크다. 언젠가... 주소: 경기 하남시 미사대로 410 미사강변 오벨리스크 3층 345호 (지하철 5호선 미사역 4번 출구에서 도보 약 10분) 영업시간: 매일 9:00 - 21:00 / 일요일...",2021. 6. 28.
특색있는 망월동 맛집 '그레야마더지(G)',"지번 - 경기 하남시 망월동 834-2 (1층 119-120호) 그레야마더지 0507)1462-1990 매일 11:00 - 22:00 단체석도 있고, 매장도 넓었던 그레야마더지 음식점.... 호구와 태국여행갔을 때 현지에서 사먹었던 그 꽃게도 이 소프트쉘 크랩처럼 살이 없고 꽃게 한마리에 풀떼기만 가득한 요리가 거의 5만원이였는데...",2021. 3. 25.
하남 미사 맛집 미사라멘 전문점 호타루,일본라멘의 맛도 그립고 해외여행을 못가니 가까운 곳에서 맛있는 음식으로 힐링이라도 해야죠 ㅠ ㅠ 하남미사 롯데캐슬스타 건물 1층에 위치하고 있었는데요. 건물도 새로 지은 큰건물이라 지하주차장도 넉넉해서 주차하기 좋더라구요! 미사라멘 호타루 주소 경기 하남시 미사강변중앙로 190...,2020. 8. 15.
미사 망월동 분식맛집<보물섬>하남 미사 떡볶이 맛집은 바로 여기!,떡볶이 타령을 하는 코바아빠를 위해 코바엄마가 하남 미사 떡볶이 맛집인 보물섬에서 포장을 해왔어요^^ 보물섬 경기 하남시 미사강변한강로 155... 추억으로의 여행 옛날에 먹었던 그 분식맛 그대로~ 정말 맛나는 분식 한상으로 코바 가족 모두 행복한 저녁시간을 보냈어요~^^ 하남 미사 분식맛집...,2021. 3. 26.
경기 하남 미사 호수공원에서 힐링 트레킹 하세요,"다리 밑에 설치된 의자의 모습이 특이하다. 겨울이라 주변에 푸릇한 초화류는 없지만 나름 눈이 호강한 하루였다. 봄이되면 다시 한번 오고 싶은 곳이다. 아쉽지만 금일 트레킹은 종료,,,,,, #여행 #미사호수공원 #하남시미사공원 #망월천 #수로 #하남시청소년수련관 #흰말채나무 #서이추 #서이추환영",2021. 2. 6.
미사맛집 - 군산아구 미사점,그래서 미사에 있는 알찜 맛집을 찾아헤메이다 드디어 정착을 한것같음 군산아구 미사점 경기 하남시 미사강변한강로220번길 41 오전 11:00-오후 11:00... 좋아한다고 여행가서 술을 어쨌든... 오늘 너무 울적했다... 그래서인지 양주가 생각났다 얼음넣고 언더락으로 향이 참 좋으네 탕이 끓어서 한그릇...,2021. 2. 7.
하남카페추천<라포레>비오는 날 감성돋는 카페,라포레 경기 하남시 검단산로186번길 46-7 영업시간 매일 10:00~21:30 비에 젖은 라포레도 굉장히 낭만적이더라구요 오늘은 날씨때문인지 카페에 손님이... ^^ 저는 여행계획을 짜고 있답니다. 비싼 하겐다즈 아이스크림...^^ 맛있다고 엄지척 했네요 저희는 라포레 2층에 자리를 잡았어요^^ 아이들이 비가...,2021. 3. 2.
감일동맛집 아초원 월남쌈무한리필 포장후기,감일동 맛집_ 아초원 주소_ 경기 하남시 감일남로52번길 21-29 영업시간_ 매일 11:00~22:00 전화번호_ 02-449-4490 주차가능 감일동맛집 아초원 워낙... 알록달록 너무 이쁜것이 집들이할때나 어디 여행가서 간편하면서도 멋드러지게 차려먹고 싶을때 등등 너무좋을거 같더라구요 :) 19가지의 각종 야채들과...,2021. 2. 26.
"[하남 강동구 신차패키지] 팰리세이드 하버캠프 베스트본드 시공, 그리고 신차패키지","코로나 시국에 들어오면서 캠핑이 여행의 대안으로 떠오르면서 SUV 판매에 영향을 미치지 않았나 생각합니다. 오늘 소개해드릴 차량또한 SUV로... 이상 강동구, 하남 신차패키지 전문점 제이제이모터스 였습니다 감사합니다! 시공 문의 : ***-****-**** 카카오톡 ID : autocarskin 주소 : 경기 하남시 초이로 160",2021. 5. 20.
[미사 뇨끼 맛집] 오찌파스타(OGGI PASTA) 뇨끼 좋아하는 내가 인정한 뇨끼맛집,"유럽 여행에서 먹고 반했던 뇨끼 여러번의 실패끝에 드디어 #뇨끼맛집 을 찾았다. 미사강변도시에 몇몇 파스타집에서 뇨끼를 팔고있지만, 내가... (유럽의 맛을 고대로 옮겨온 듯) 오찌파스타(OZZI PASTA) 시간 매일 11:00 - 22:00 (Break Time 15:00 - 17:00) 매주 화요일 휴무 주소 경기 하남시...",2021. 1. 17.
하남중국집 감동짬뽕 레알맛집인정,"ㅎㅎ 여행을 하려면 어느정도 든든히 먹어주는 센쓰 ! 오늘은 하남중국집 감동짬뽕 레알맛집 소개해드릴께요 한번 갔는데 너무나도맛있어서 진짜 여긴 꼭 가야되는 맛집인거 같아 소개해드리려고왔어요 031-796-5282 / 경기 하남시 미사강변동로95, 2층 2070~2072 평일.주말 : 11:00~21:00 라스트오더 : 오후...",2020. 12. 21.
조용하고 느낌있는 미사카페 페어링하우스,"페어링하우스 경기 하남시 미사강변중앙로 181 더퍼스트테라스 3층 매일 11:00~22:00 노키즈( 8세이상가능 ) 들어가는 입구! 여기는 카페가 삼층에... 인테리어 완전 이뻐요 ,, 아기자기한 소품도 많아서 노키즈존인가봐요 ㅋ 사장님이 여행을 좋아하시는지 각국의 스벅컵이 쭉 진열되어 있더라구요....",2020. 11. 16.
JS Daily 210804,경기 하남시(192%)와 화성시(178%)는 이미 100%를 초과. https://www.mk.co.kr/today-paper/view/2021/4928733/ 신사업 good (전기차 핵심 부품인 아라미드와... 그는 북미에서는 자동차 여행과 국내 항공 수요가 급격하게 늘고 있다고도 했죠. 루니 CEO는 델타변이가 영향을 주겠지만 제한적이며 글로벌 경기가...,2021. 8. 4.
"서강석 하남문화재단 대표이사""문화백신' 맞으러 하남문화센터로 오세요"" 경기신문",올해 기획공연이 적은 1~2월에도 가족뮤지컬과 세계여행 컨셉트로 온라인 공연을 미리 준비하고 제공했다. 28차례 온라인 공연에 평균 1만여 명이... 하남시 시정 방침은 ‘시민과 함께 만드는 빛나는 하남’이다. 이에 맞춰 하남문화재단 미션은 ‘시민과 함께 만드는 하남다움 지역문화생태계...,2021. 10. 6.
하남 카페웨더 발리 감성 베이커리 카페,https://blog.naver.com/hyeseong_0228/222156546379 카페웨더 070-7792-6186 경기 하남시 검단산로 228-8 매일 10:00 - 22:00 연중무휴 https://www.instagram.com/cafe_weather... 동남아 여행 온 느낌이 물씬 나는 카페웨더에요 외부 테라스석 자리도 있고요 이쪽이 입구에요!! 카페 정말 이뻤는데 이날 날이 너무 흐려서 사진이...,2021. 1. 26.
백반기행 하남 소불고기 소장작불고기 맛집 마당집 위치 가격,명품 식도락 여행원더풀~ 뷰티풀~ 러블리~신나게~ 먹어 봐❤ 인생은 멋진거야~4월 30일 (금) 밤 8시 방송 ※ 아래에서 백반기행 하남 소불고기... 장소 」 경기 하남시 하남대로 674 「 ☎ 연락처 · 전화번호 」 031-791-0011 ▼소불고기 가격 보러가기 https://coach1.tistory.com/1582 ※ 이 글에 언급된...,2021. 4. 30.
BMW 3시리즈 투어링. 가족을 위한 유러피안 감성 - BMW 위례 스마트 쇼룸 전시!,"Previous image Next image 가족용이라면, 장거리 여행을 위한다면 꼭 필요한 사양으로 생각되는 선 블라인드가 뒷좌석에 포함되어 있습니다. 실제... 감사합니다 :) BMW 코오롱모터스 위례 스마트 쇼룸 위치 : 경기 하남시 위례대로 200 , 스타필드시티 위례점 운영시간 : 10:00 ~ 22:00 연중무휴...",2021. 3. 11.
하남 가볼만한곳 조정경기장에의 평화,- 글· 사진 별빛 가득 차향 미사경정공원조정카누경기장 주소/ 경기도 하남시 미사대로 505 문의/ 031-790-8114 주차요금/ 중소형(25인승 미만) 4000원... 데이트하는 연인들은 요렇게 2인 자전거를 타고 달려달려!!~ 요런 자전거여행도 좋다며~ 북한강 자전거길 중 하나가 되려나요?~ 어찌됐든 자전거 타기...,2021. 5. 12.
[고릴라캠핑하남점] 실버크레스트 마카롱 미니밥솥 특가판매!!!,"- 작은사이즈로 캠핑, 여행 등 사용이 용이합니다. - 내솥은 불소수지 코팅으로 세척이 간편하며 밥이 눌러붙지 않습니다. - 분리형 뚜껑으로... 1층 (경기 하남시 검단산로146번길 20) -카카오네비 사용시 주차장까지 정확히 안내가능 https://cafe.naver.com/gorillacampinghn/15695 캠핑용품점, 캠핑준비...",2021. 1. 7.
하남 미사리 카페 리버. 한강뷰 굿. 전망 좋은 카페,"호미숙 여행작가입니다. 오늘 오후에 아들과 지인과 함께 천호동에서 가까운 하남시 미사리를 다녀왔습니다. 미사리 일반 삭당가는 조용했고... com/v/13268307 하남카페 미사리카페 전망좋은 카페 리버 경기 하남시 미사동로 102-23 미사리 리버 평일 11:00 - 22:00 주말 11:00 - 23:00 단체석, 주차, 예약, 무선...",2020. 4. 8.
[춘천 맛집] 예쁜 카페 컴포어,속에 있던 달고나가 녹으면서 달달 얼음이 녹아도 달달 딱 제 스타일♡♡♡ 모든 메뉴가 만족스러웠던 춘천 카페 컴포어였어요! *맛집 포스팅은 지극히 개인적인 입맛임을 알려드립니다* 연락처 : 센터 031-795-3445 지사장 ***-****-**** 주소 : 경기 하남시 미사강변대로 226번길 64 라임프라자 302호,2020. 3. 14.
미사역카페 뷰가 너무 예쁜 테라스카페 ::카페잇템,눈물날 뻔~~ 몇년 전에 여행 다녀온 시카고 빌딩의 느낌이~ 팍팍~!! 미사강변도시~~ 으리으리한 빌딩 참 많네요~!! 그 가운데~ 단연!! 돋보이는 카페가 보입니다!!! 멋진 망월천 뷰가 보이는.. 호수공원을 바라보며 힐링만끽이 가능한.. 바.로!! 카페잇템 입니다!!! 카페잇템 주소 경기 하남시 망월동 1094...,2020. 9. 21.
하남 감성 카페 하와이가 생각나는 카페웨더,"카페웨더 ☎ 070-7792-6186 경기 하남시 검단산로 228-8 매일 10:00 - 22:00 연중무휴 단체석, 주차, 포장, 예약, 무선 인터넷, 남/녀 화장실 구분, 지역화폐... 마치 발리나 하와이와 같은 휴양지같은 느낌이 나는 곳이라서 코로나로 인해 여행을 가지 못하는 이 시국에 대리만족을 시켜줄 수 있는 그러한...",2020. 9. 28.
서울 근교 갈만한곳 미사경정공원 & 스타필드 하남,올해는 경기도 여행으로 여행 포스팅을 꽉 채워가고 있는 여행작가 쥬디입니다. 제가 서울에 살고 있어서 근교 여행으로도 좋아요. 복잡한 서울을 조금만 벗어나면 한산하기도 하고 자연을 더 가까이 마주할 수 있으니까요. 이번엔 하남시로 출동했는데요. 하남시 하면 가장 먼저 떠오르는...,2020. 12. 3.
태온모터스 하남자동차수리 카라반 캠핑트레일러 검사,태온모터스 하남자동차수리 카라반 캠핑트레일러 검사 받았어요 여행 떠나기 전에 캠핑트레일러 제대로 검사 받고 왔어요 유명한 이유가 다... 듭니다 #하남자동차수리 #태온모터스 #자동차수리 #하남자동차수리하는곳 #하남차수리 #하남 #하남자동차검사소 경기 하남시 감초로184번길 11 2층...,2020. 10. 7.
100% 내돈내산 하남 미사지구 '미사리 제면소' 맛집 리뷰!,"일본 불매운동이다 뭐다 재작년부터 시끌시끌 했던 와중에 가끔은 일본 여행을 다녀왔던 추억도 있고, 워낙 면을 좋아하는 지라 저 역시 일본... 이것도 별미라 두번이나 퍼다 먹었네요 ㅋㅋ '미사리 제면소' 위치 주소 : 경기 하남시 아리수로 570 102동 2층 2062호 메뉴 : 청탕면(8,500원), 청탕면...",2021. 4. 20.
발리느낌의 인스타 감성카페 하남 카페웨더,분위기 좋은 카페웨더 위치 경기 하남시 검단산로 228-8 주차가능 전화번호 070-7792-6186 영업시간 매일 10:00~22:00 연중무휴 외관부터 조명이... 땜시 여행도 못 가는데 이런 이색 카페 굉장히 만족스럽네요^^ 2층으로 올라가면 야외 테라스와 1층보다는 조금 작지만 아늑한 공간도 준비되어 있어요....,2021. 3. 1.
"하남 미사 네일샵 강력추천, 망월동 네일듀오에서 기분전환했어요~",망월동 네일듀오 망월동 네일듀오 하남 망월동 네일샵 '네일듀오' 영업시간 매일 10:30 - 21:00 신주소 : 경기 하남시 미사강변중앙로204번길 45... 요즘 여행갈 일이 없어서 네일을 안 받은지 꽤 된 거 같아요~ 매번 여행갈 때 손까지 예쁘게 보이고 싶어서 많이 했는뎅 ㅠㅠ 오늘은 우울한 기분을...,2020. 11. 22.
하남 미사 돈코츠 라멘 맛집 추천 히메노라멘,"미사 맛집: 히메노라멘 미사점 내맘대로 레시피 한국식 라멘 - 영업시간: 매일 11:00 - 23:00 - 주소/위치: 경기 하남시 미사강변중앙로 226 122호 추운... 매장 안도 일본처럼 ~(˘▾˘~)(~˘▾˘)~ 옛날에 여행갔던 때가 생각나는구만 (아 그러고보니 여행 포스팅 대체 언제 쓰지,, 쥬륵 ) 매장 내부도...",2021. 1. 7.
하남스타필드에서 재밌게 놀자! [스포츠몬스터],"--추억여행중-- 예전 사진들이라 지금과 계절이 맞지 않을 수도 있고, 사진이 적을 수 있다는 점 이해부탁드려용~ [방문날짜 : 2020.07.25.토요일] 영업시간 : 매일 10:00 ~ 21:00 주차장은 하남스타필드 주차장을 이용하세요^^ 경기 하남시 미사대로 750 스타필드 하남 4층 스포츠몬스터 이용가격...",2021. 3. 19.
하남 스타필드 약국 하남스타약국에서 뽀로로 키즈밴드 구입,항상 매해 여름은 해외로 여행을 가는 게 가장 신나는 일이었는데 올해는 해외는 꿈도 못꾸죠- 내일부터 기대했던 여름휴가가 시작되는데 원래... 하남 스타필드 약국 하남스타약국에서 뽀로로 키즈밴드 구입 주소: 경기 하남시 미사대로 750 스타필드하남 3층 전화: 031-8072-8578 영업시간: 매일 10:00...,2020. 8. 25.
<하남 네일> 하남미사 공네일&뷰티에서 여름손젤아트 예쁘게 받고 힐링하고 왔어요!,"< 공네일&뷰티 > 주소 : 경기 하남시 미사강변대로 240-1 ,상가동 2층 연락처 : 031-792-8755 영업시간 : 평일 10:00 - 20:00 / 토요일 10:00 - 18:00 속눈썹 연장... 어딘가로 놀러가고 싶기도 하궁ㅋㅋㅋ 손톱도 예쁘게 관리받았으니 주말엔 비가 안오면 여행을 떠나봐야겠네요. 착한가격에 실력좋은 원장님과의...",2020. 7. 24.
단기일반(C-3-1) 비자 발급,"대행사(여행사)가 책임을 지는 보증 개별, 단체관광 등 관광, 공항만 소무역 활동 등을 목적으로 입국하려는 자 C-3-3 의료관광 의료관광 사증 및... 들어가는 경기 하남시 교산지구 일대 모습. [연합] 6. 일반 상용(C-3-4) 가. 발급 대상 시장조사, 업무연락, 상담, 계약, 소규모 무역 기타 이와...",2021. 3. 18.
광주 오포 소파싸게파는곳 패브릭소파 찜,주소: 경기 하남시 하남대로 222 전화번호: 031-798-3445 네이버 스토어팜 에서 만나실 수 있어요 ^^ http://swindow.naver.com/homeliving/store/100045728/home 광주... 인해 여행도 못가니 ... 가구 교체로 분위기 바꿔도 좋겠더라구요 ^^ 이태리 베로나가구는 국내제작가구로 견고하며 수입가구도 많이 만날 수...,2020. 9. 24.
[고릴라캠핑하남점] 테르보 서머레디백(미니 캐리어백),"안녕하세요 고릴라캠핑하남점입니다^^ 테르보(TERRBO) 서머레디백(미니 캐리어백) - 캠핑, 여행에 자주쓰는 물건을 보관할 수 있는 하드... 1층 (경기 하남시 검단산로146번길 20) -카카오네비 사용시 주차장까지 정확히 안내가능- https://cafe.naver.com/gorillacampinghn/14359 캠핑용품점, 캠핑준비...",2020. 12. 21.
하남 아구찜 *지구에서 온 아구해*,"하남 아구찜 *지구에서 온 아구해* 안녕하세요^-^ 오늘은 경기 하남시에 아구찜 맛집 "" 지구에서 온 아구해 "" 를 방문했습니다^_^ 시부모님이... 에쁜 정원으로 꾸며져있어서 펜션으로 여행온 것 같은 기분이 들었어요-: 힐링이 되더라구요^-^ 야외정원은 밥 다 먹고 커피들고 나와서 소화시키며...",2020. 11. 25.
[하남/위례] 위례 스타필드에서 혼자 즐기는 제주 음식│ 제주오전복,"코로나로 국내여행도 힘든 요즘, '제주'라는 단어부터 들어가고 싶게 생김ㅋㅋㅋ 제주오전복 메뉴 중 일부인데 가게 입구 앞에 입간판으로 보기... 맛 ★★★☆☆ 가 격 ★★★☆☆ 서비스 ★★★★☆ 가게명: 제주오전복 스타필드 위례점 주소: 경기 하남시 학암동 660 영업시간: 매일 10:00 - 22: 00...",2021. 1. 27.
[새상품 매장전시] 카즈미 슈즈백,"안녕하세요 고릴라캠핑 하남점입니다^^ 카즈미(KZM) 슈즈 백 - 캠핑, 여행 등 야외 활동 시 먼지, 흙등으로 부터 오염을 방지할 수 있습니다.... 고릴라캠핑 하남점 070-8866-4848 하남캠핑용품매장 - 새제품,리퍼,중고 특가상품 상시할인판매 위 치 : 경기도 하남시 창우동 432-2 1층 (경기 하남시...",2020. 12. 21.
하남 과일 ‘쁘띠프루츠’ - 프리미엄 과일가게 당도보장!,"안녕하세요, 자본주의 여행가 영와프입니다 :) 1~2년 전만해도 과일은 당연히 마트에서 산다고 생각했는데, 요즘 주변을 보면 과일전문점이 많이 생기더라구요. 그것도 당도보장 프리미엄 과일가게! <쁘띠프루츠 하남미사점> 위치 : 경기 하남시 미사강변중앙로111번안길 52 영업시간 : 평일 10시 ~ 밤...",2020. 12. 26.
신부관리 얼굴축소 미사에스테틱 후기,여행 떠나고 싶구먼요. ㅋㅋㅋ 여름인가 했는데 금방 또 가을이 와버렸죠? 태풍만 아니면 9월 날씨 정말 최고인 듯요~ 결혼할 사람은 해야죠- 제... 신부관리 미사에스테틱 찾아가기 경기 하남시 미사강변대로226번안길 25 디럭스 프라자 305호 평일 10:00 - 21:00 토요일 09:00 - 16:00 공휴일 휴무 주차...,2020. 9. 17.
망월동 네일샵 하남 015네일샵에서 기분전환 했어요 ♥,"1층 -경기 하남시 망월동 1188 매일 11:00~21:00 월요일 휴무 100% 예약제 100% 예약제이기 때문에 꼭 예약하구 가셔요~~ 9시까지라서 여유롭게 받을 수 있을것 같아요. 직장인분들도 퇴근하구가셔도 넉넉한 시간이네욤 주차는 가게 건물앞에 할 수 있어요,! 원래 여행가기 전 네일받으려던 계획이 있었는데...",2020. 5. 3.
마애불 역사기행①:경기 하남 선법사 마애불,"여행 작가 체보쿠의 마애불 역사 기행 ① : 경기 河南線 법사 마애불 자연 친화적하면서 사람들의 생활, 역사와 함께 한 마애불 마애불은 자연... 경기도 하남시 교산돈 선 법사 경내 마애불 @ 체보쿠 수 마침 정오가되면 바위에 햇빛이 시작했다. 닿으면 무엇이든 금으로 변하는 미다스 왕의 손처럼...",2021. 6. 2.
"全國 12개 미군기지 반환, 용산기지도 반환 본격 개시","오케이의 기분좋은 여행입니다. 국방부 홈페이지 보도자료에 공개된 내용으로 12월 11일(금)에 미국과 201차 주한미군지위협정 (SOFA, 소파)... 헬기장 * 경기 하남시(1) : 성남골프장 * 경기 의정부시(1) : 캠프 잭슨 * 경기 동두천시(1) : 캠프 모빌 일부 * 경북 포항시(1) : 해병 포항파견대 * 강원 태백시...",2020. 12. 13.
"하남 고골낚시터에서 대어는 못 잡고,송사리만 보고왔어","#하남낚시터 #낚시터 #고골낚시터 고골낚시터 경기 하남시 서하남로418번길 29 본가 갔다가 서울 집 도착하여, 겨우겨우 늦게 잠들었는데 약속도... 두었고, #하남낚시터 #저수지낚시터 #고골낚시터 #캠핑 #캠핑낚시 #배다리낚시터 #서하남낚시터 #서울가볼만한곳 #가족여행 조용히 앉아서 세월을...",2020. 10. 7.
