header,contents,date
안산 고잔동 네일샵에서 여름네일로 미러파우더네일 하고 왔어요!(feat.골든네일...,"요즘 날이 너무 더워지니까 막 여행가고 싶지 않으세요? 저는 여행을 가고 싶다는 말을 달고 살아요.. 하지만 현실은 여행을 갈 수 없는 상황!... (전화예약, 네이버예약 모두 가능) 문의전화 0507-1307-7817 주소 경기 안산시 단원구 광덕대로 187 장안타워 1층 https://m.booking.naver.com/booking/6/bizes/157121...",2021. 6. 30.
[민약의 세계] ‘이것이 만병통치약’ 환자들 우롱하는 가짜 산삼 사건들 ㅣ 홍진수,"누가 봐도 인삼인데 산삼이라고 가져와 필자에게 팔아달라고 한 사람도 있었고, 해외여행을 다녀오면서 가져온 삼을 국내에 있는 산에서 캤다고... 당시 이 모씨(33, 경기 안산시)는 강릉시 연곡면 삼삼리 민박집에 친척들과 함께 피서를 왔다가 약초꾼인 집주인 김 모씨가 뒷마당에 150년 된 산삼...",2021. 6. 16.
"[TV속 정보] 4월 5일 (월) 2TV생생정보, MBC생방송오늘저녁, SBS생방송투데이 나온...",2TV 생생정보 제작사: 박스미디어 <생생현장- 비대면 자동차 여행이 뜬다!> ▶ 삼척엘림캠핑장 ☎0507-1387-9004 강원 삼척시 근덕면... 경기도 안산시 편> ▶ 화랑유원지 경기 안산시 단원구 동산로 268 ▶ 시화나래휴게소달전망대 ☎032-885-7530 경기 안산시 단원구 대부황금로...,2021. 4. 5.
안산 가볼만한곳 대부도 이곳저곳 돌아보기,안산 시화 나래 휴게소 달 전망대 주소 : 경기 안산시 단원구 대부 황금로 1927 관람시간 : 10:00 ~ 22:00 관람료 : 무료 이날 나들이의 첫 번째 장소는 대표적인 대부도 가볼만한곳 중 하나인 사화 나래 휴게소 달 전망대였습니다. 오이도에서 대부도로 넘어가려면 바다를 가로지르는 긴 시화방조제를...,2020. 9. 13.
안산 유니스의 정원 산책도 하고 커피도 마시고 부모님 모시고 가기 좋은 곳,정원 경기 안산시 상록구 반월천북길 139 영업시간 매일 11:00 - 22:00 레스토랑 브레이크타임 15:00~17:00 (주말 및 공휴일에는 브레이크타임에 한정메뉴... 아니 아부지는 사실 들어가지도 않았음 ㅋㅋ 그래도 앉아서 커피랑 빵이랑 먹다보면 뭐 멀리갈 필요 있냐 여기가 여행온거 같고 좋다 고 하심...,2021. 5. 11.
전철타고 안산여행 : 고잔역 톺아보기(feat.문화예술 플랫폼),"안산시 생생드리머 학생기자단 선경미 입니다! 이번에 제가 다녀온 전철 여행지는 바로 고잔역입니다~ 안산에 고잔역이 익숙하신 분들도... A, 경기창업센터로 향하는 방향입니다. 역 주변에 주차장과 택시 정류장, 버스 정류장이 있어 지하철을 이용하는 승객들의 접근성을 높이고 있어요....",2021. 8. 17.
판타루시아 펜션 후기와 대부도 바닷가 굿 경기 안산 여행 일상,입실 15:00 퇴실 11:00 경기도 안산시 선감동 152 네이버 주차장은 도로와 바로 인접해서 밤에 주차하기 힘들었고 분명 객실 수에 맞춰서 주차장이 구획됐을 텐데 자리가 없어서 쓰레기 버리는 곳에 주차했던 기억이 있습니다. 판타루시아 객실 중에 조금 비싼 방이었는데 객실은 복층으로 되어있었고...,2021. 6. 4.
심쿵했던 대부도 맛집 목록,"한우와버거 5628 VIP한우한마리 89,000원 주소 : 경기 안산시 단원구 대부황금로 1270 문의 : 0507-1334-9938 영업시간 : 매일 10:00 - 21:00 수요일휴무 여행 끝날에는 정확히 21일만 숙성해내 육질이 우수하기로 정평 난 한우와버거에 방문했습니다. 프랜차이즈 버거집 햄버거보다 가격대도 비싸지 않고...",2020. 10. 17.
"[안산 사동 분식] 만두여행, 튀김만두세트와 주먹밥 그리고 김말이","다음 주문 때는 무조건 튀김 만두랑, 떡볶이를 같이 시켜야겠다. 쇼핑도 하고, 튀김만두 덕분에 하루의 마무리를 바삭하게 해서 기분이 좋다. ~_~ 재주문 의사 : 완전 있음 [만두여행 안산사동점] 경기 안산시 상록구 당골2길 12 031-416-3336 매일 11:00 - 23:00",2020. 6. 10.
경기안산시흥융착기용 인버터발전기로 고품질의 전기를 사용하세요,경기안산시흥발전기 산업용 인버터로 고품질의 전기를 사용하세요 안녕하세요. 여름 휴가철을 맞아 가족이나 친구들과 함께 여행 계획을 세우시는 분이 많으실 것 같은데요. 캠핑을 떠난다면 필수적으로 준비해야 할 것이 바로 발전기이죠. 음식이나 옷가지 등은 준비해 가면 되지만...,2021. 7. 15.
대부도펜션 아늑했던 판타루시아 커플여행 만족해,"당시 아쉬웠던 마음이 컸었던만큼, 연휴가 끝나고나서 보냉백 3개와 캠핑박스 2개를 꽉 채워서 #대부도 #판타루시아 1박2일 여행을 했어요. 이곳은... [위치] 경기 안산시 단원구 본말길 118-2 [문의] 032-883-6900 객실은 총 16개인데, 저희가 묵었던 유빌라테를 더불어 - 앙코르 - 엘레간테 - 소아베...",2020. 5. 12.
"대부도맛집 와각칼국수,비빔칼국수 코스로 맛봐야지 바지락 듬뿍 가볼만한곳","지방으로의 여행을 했었네요 오늘은 서울에 비가 내리는 토요일 따끈한 칼국수가 생각이나면서 대부도를 다녀와야겠다 싶었답니다 ""와각바지락칼국수""도 먹을 겸...말이죠 대부도 와각칼국수 위치 : 경기 안산시 단원구 아랫말길 27 (대부남동 1137-56) 대부도 맛집 와각칼국수 정기휴일 : 화요일 평일...",2021. 6. 26.
대부도 갈만한곳 서울근교 바다 구봉도 방아머리해수욕장,요트를 타고 세계여행을 하는 꿈도 꿔보기도 합니다. 전곡항에서 바라보는 일몰도 아름답지만 저녁은 대부도 갈만한곳인 방아머리해수욕장 앞에서 먹기로 해서 아쉽지만 발걸음을 옮기기로 합니다. 5. 방아머리해수욕장 경기 안산시 단원구 대부북동 사또횟집에서 저녁으로 칼국수도 맛보게...,2021. 6. 25.
"[8/8 대부도 여행] 방아머리 해수욕장 강아지와 함께 ♥ 애견동반 맛집, 오션뷰 카페...","가족과 대부도 당일치기 여행을 가기로 했어요 :) 당연히 저희집 반려견 깨비도 함께ㅋ 폭풍 검색을 했는데요, ""반려견 출입"" 만으로 검색했더니 많이 안나오더라구요 ! ""애견동반"" 을 꼭 집어넣어서 검색해야 한다는 사실ㅋ 이제 알았어요 ㅋㅋㅋㅋㅋㅋ 파도횟집 경기 안산시 단원구 대부황금로 1459...",2021. 8. 9.
⚘김포공항콜밴 안산시에서✈김포공항까지편안함과♀️여유로움은안전운행과...,"김포공항콜밴 안산시 고잔동에서 #센딩 한군데 경유 김포공항 국내선까지 여유롭고 편안하게 운행하여 안전하게 도착했어요 김포공항콜밴... ㅎㅎ #효도여행 #가족여행 #친목여행 #경기출전 #골프투어 #국내출장등등 예약 주시면 집 앞에서 공항까지 주야로 365일 운행합니다 #외국인,바이어등...",2020. 4. 21.
구봉도맛집 '풍경' 건강한음식을 맛보아요^^,"좋치요^^ 여행하면서 제일 중요한게 음식인데요~ 여행의 재미를 느끼게해주는 맛집을 찾아 오늘은 대부도 '풍경'에 다녀왔답니다~ 친절함과 맛을... 풍경 경기 안산시 단원구 사청터길 3 0507-1431-6250 매일 09:30 ~ 21:30 단체석, 주차, 포장, 예약, 무선인터넷, 반려동물동반, 남/녀화장실구분, 지역화폐...",2021. 5. 25.
안산 대부도 가볼만한곳 대부바다향기테마파크^^~20210322,다녀가고싶었던 여행지였어요 20210322월요일 내비: 경기 안산시 단원구 대부황금로 1480-7 무료주차 무료입장 안내도 따라 습지공원으로 발길이 가고있다 대부바다향기테마파크 코로나로 여파로 지금은 운영을 하지 않고 있는 전기자동차 달달한 연인들 추억만들기 좋은 전기자동차.. 습지관찰데크...,2021. 4. 10.
반달섬 아티스큐브 최근 분양정보,안산시가 경기 서남부의 거점 도시가 될 수 있었던 이유에는 교통망이 한몫하지 않았나 싶습니다. 수익형에 투자하는 분들은 대부분 가지고 있는 동안은 임대수익을 얻고 향후 매도 시에도 차익을 통해 수익을 높이고자 하는데요. 지역 자체가 수도권과 연결성이 높아 가치가 있다고 판단됩니다....,2021. 9. 21.
대부도 애견동반 스텔스 차박 1박2일 여행,누에섬 경기 안산시 단원구 대부황금로 17-156 누에섬등대형전망대 http://naver.me/xayRH6yu 들어가는 길에 인상깊은 땅 갈라짐 드넓은 갯벌 뷰 작은... 돌아다닌 여행이였는데 의외로 다 너무 성공해서 첫 날 오래 운전하느라 힘들었던 거 빼고는 너무 즐겁고 맛있고 행복했다 그리고 울집 강아지도...,2021. 7. 6.
장난 아닌 대부도 맛집만 모음,"여행의 묘미는 사진과 맛난 음식이니까 대부도 맛집을 찾아서 가봤습니다. 하나하나 완벽하게 정성과 배려가 느껴지던 대부도 맛집을 소개해드릴게요. 1. 불난 그집 불향쭈꾸미정식 2인 28,000원 /왕새우튀김 10,000원/ 메밀소바 8,000원 주소 : 경기 안산시 단원구 대선로 231 전화 : 032-889-2557...",2020. 11. 17.
고잔동필라테스 바디클리닉 필라테스 안산점 6주차 후기,"주소 : 경기 안산시 단원구 광덕2로 155-12 5층 지번 : 경기 안산시 단원구 고잔동 709-12 5층 연락처 : 031-414-5678 수업시간 : 평일 08:30 - 22:30 / 토요일 09... 저 다리 살 붙은 것 봐요...ㅠㅠ 요즘 잘 먹기도 했지만, 여행도 다녀오고 이것 저것 일이 좀 많다보니까 제대로 운동을 못했더니 살이 엄청...",2021. 4. 23.
"인천 섬여행 :: 인천속의 쿠바, 선재도 뻘다방","해외여행이 너무나 가고싶은 요즘, 국내여행에서나마 이국적인 분위기를 느끼고 싶으실텐데요. 오늘은 그럴 때 추천드리는 인천속의 작은 쿠바... 왕할머니 손칼국수 왕할머니손칼국수 전화번호 : 0507-1426-8933 주소 / 위치 : 경기 안산시 단원구 대선로 15 영업시간 09:00-20:00 매주 목요일 휴무...",2021. 5. 18.
서울근교 노지캠핑 하러 섬까지 두 차례 측도 승봉도 코끼리바위,나보고 좋은 데 많이 다니는 거 같다고 같이 여행가자고..훗~ 4. 측도(옹진군 영흥면 선재도와 연결된 작은 섬)목섬 돌아보며 달전망대 간다 ! 전화 :032-885-7530 경기도 안산시 단원구 대부동동 2098 매일 10:00~22:00 종료시간 30분전까지 입장가능(연중무휴) 관람료 없음 시화방조제 중간에 설치된...,2021. 4. 14.
경기도 수도권 캠핑장,연천캠핑장 경기 연천군 꼬마캠핑장 경기 연천군 군남면 남계리 492 경기 연천군 화요일아침예술학교제2캠퍼스캠핑장 경기 연천군 전곡읍 양원리 560경기 연천군 한탄강오토캠핑장 경기 연천군 전곡읍 전곡리 640경기 연천군 평화강변수목원캠핑장 경기 연천군 미산면 삼화리 94경기...,2021. 6. 3.
화끈했던 대부도 맛집 최애 리스트,지인이 추천해준 대부도 맛집만 쏙쏙 골라 방문을 해서 즐거운 여행을 보낼 수 있었어요~ 혹시나 여행을 앞두고 계신 분들을 위해 함께 공유해 드리려구요~ 불난그집 경기도 안산시 단원구 대선로231 032-889-3557 매일 10:00~21:00 TV에 나온 곳이기도 하고 지인의 적극추천을 받아 일부러 방문을 해보게...,2021. 2. 25.
[대부도] 경기도 당일치기 여행 & 데이트코스 추천! #피자플리즈#바다향기테마파크...,피자플리즈 주소 : 경기 안산시 단원구 사근여길 6-12 피자플리즈 영업시간 : 매일 11:30 - 21:00 (Last Order 20:30) 주말에 가서 그런지 주차장에 차가... 다음에 못먹은 거 먹으러 가려구여ㅎㅎ 여러분께도 대부도 당일치기 여행 강추드립니다:) 오늘도 제 블로그에 놀러오신 분들 감사드려요❤️,2021. 8. 15.
"안산 레터링 케이크, 소소한 선물이 되어준 모나케이크","안녕하세요.☻ 저번에 거제도 여행때 외할머니 생신케이크를 주문해보고 가격, 퀄리티면에서 무척이나 만족스러워서 쏘블리 동네인 안산에서도... <안산 레터링 케이크 모나케이크> 0507-1330-7365 경기 안산시 단원구 화랑로 130 푸르지오 에코단지 상가 1동 228호 (초지역 3번출구) 평일 20:00 - 19:00...",2021. 4. 16.
안산시 탄도항 누에섬 당일치기 여행/ 탄도항 누에섬 일몰.,대부도 전체를 빙 둘러 걷는 해솔길은 대부도라는 섬이 가진 특유의 매력을 뽐내며 뚜벅이 여행자들을 맞이한다. 끝없이 이어지는 갯벌과 살아... 시작은 대부도펜션타운 ▶ 경기창작센터 ▶ 선감어촌체험마을 ▶ 경기도청소년수련원 ▶ 불도방조제 ▶ 정문규미술관 ▶ 대부광산퇴적암층...,2021. 2. 14.
안산 인도음식점 네팔리가 만들어 주는 찐 커리맛집 중앙동인디아팰리스,인디아팰리스 경기 안산시 단원구 중앙대로 921 INDIA PALACE 2 층 031-411-2203 안산 인도음식점 인디아 팰리스는 중앙동 중심가인 동서코아빌딩 2층에 위치해 있었다 사실 인도여행을 한달 넘게 하면서도 커리와 버터갈릭난 조합(꿀조합) 만 먹은것 같다 ㅋㅋ (탄두리치킨도 가끔 먹긴 했지만) 전 남친 현...,2021. 3. 31.
대부도 옥수수찐빵 인증샷명소 불란서찐빵,크게 특별할 건 없지만 지나가는 길이라면 한 번쯤 방문해 사진도 찍고 찐빵 맛도 봐보면 좋을 거 같아요. 대부도 불란서찐빵 주소 : 경기 안산시 단원구 대부북동 1844-7 매일 : 10:00 - 22:00 주차 : 근처에 공영주차장 있음 #대부도여행 #대부도옥수수찐빵 #불란서찐빵 #블란서진빵 #대부도불란서찐빵,2021. 3. 9.
"화성시 가볼 만한 곳, 전곡항",전곡항은 항구 옆 서신면과 안산시의 대부도를 잇는 방파제가 항구 바로 옆에 있어 밀물과 썰물의 영향을 받지 않아 배가 드나들기 수월하다고... 관광지에서 보고 싶진 않을 것이다. 전화문의 : 1577-4200 주소 : 경기 화성시 서신면 전곡리 #전곡항 #화성시가볼만한곳 #화성여행 #경기바다 #요트체험,2021. 8. 11.
"엔틸로프"" - 서울에서 1시간 걸리는 당일치기 바다 여행 (feat. 드라이브 코스 추천!)","주소 : 경기 안산시 단원구 구봉타운길 61 (구봉도) - 영업시간 : 매일 11:00-22:00 - 주차, 포장 가능 - 전화번호 : 0507-1323-9778 카페에 도착하면 아이스크림 콘과 신기하게 생긴 붉은 돌이 우리를 반긴다 카페 옆에는 워터슬라이드가 있는 수영장이 있는데 ""걸리버 여행기"" 라는 펜션의 워터파크라고...",2021. 9. 9.
고잔동젤네일샵에서 여름네일 하고 왔어요. 자개/글리터/파츠 네일조합 (feat....,골든네일 안산고잔점 0507-1307-7817 경기 안산시 단원구 광덕대로 187 http://www.instagram.com/goldennail.y/ 골든네일 안산고잔점은 고잔동 NC백화점 맞은편... 그리고 이제 해외여행도 못가니까 국내 여행들 많이 가시는데 속눈썹 연장 시술 하고 많이들 가시더라구요. 확실히 사진빨이 잘받고 편해서요...,2021. 5. 18.
대부도 구봉도 여행 맛있는 한끼를 찾는다면 대부객주,"대부객주 경기 안산시 단원구 구봉타운길 36 매일 9:30 - 20:30 수요일 휴무 한옥 분위기가 나는 정겨운 식당이에요~ 카페 같기도 하고 분위기가 멋진... 하영이랑 여행온듯 설렘 가득한 시간~ 맛있는 메뉴들을 보며 고민하다 바지락칼국수 소(1~2인) 15,000원 대하튀김, 능쟁이(작은게)튀김 반반10,000원...",2021. 8. 11.
대부도 카페 바다뷰 최고 감성카페 카페가,"당일 여행으로도 좋은 장소인데 정말 많이 변했네 층마다 다르면서 특색있는 인테리어 감성 사진 속 장소 같은 대부도 카페 서해안 카페라서... 파는 대부도 카페 카페가 자주 봐요, 우리 정들게^^ 그래요 대부도카페가 경기 안산시 단원구 대부황금로 1469 대부도 카페 가 평일 10:00-22:00 주말 10:00-23:00",2021. 4. 16.
[대부도 당일치기 여행] 북동삼거리손칼국수 / 구봉도 선돌(+대부도 물때) / 엔틸로프,"날씨가 너무 맑아서 여행가는 기분 제대로 났어요ㅎㅎ 하늘도 이쁘고, 가다가 물을 만난게 너무 반가워서 친구가 사진 찰칵찰칵 찍어줬습니다. 북동삼거리손칼국수 위치: 경기 안산시 단원구 대부황금로 1273 영업시간: 09:30 ~ 20:30 (연중 무휴) 전화번호: ***-****-**** 주차: 주차 가능. 별도 주차공간...",2021. 8. 20.
흡족했던 대부도가족펜션,"일상에서 찌든 스트레스를 제대로 힐링 하고 온 대부도 여행이었어요. 여러분도 가을바다, 겨울바다 보러 대부도에 다녀와보시는 건 어떨까요? - 전화번호 : 032-886-3999 - 주소 : 경기 안산시 단원구 사근여길 6-5 (대부북동 1846-4) - 영업 시간 : 퇴실시간 12:00, 입실시간 오후2시(성수기는 3시)",2021. 5. 14.
서울 근교의 아름다운 바다를 소개합니다!,2021년 6월 18일 금요일에는 '경기바다 여행 주간'을 맞이하여 궁평항에서 '경기바다 힐링 음악회'가 진행된다고 하니 참고해 주세요! 인천... 내비게이션에 '경기도 안산시 단원구 선감동 산 174-1'의 주소를 검색하여 찾아가면 진입로를 확인할 수 있습니다. 진입로부터 광산 좌우로 등산로가 연결되어...,2021. 6. 14.
완벽했던 대부도 맛집,어디서도 볼 수 없는 닭해물탕과 손맛 좋은 반찬까지 건강하게 즐길 수 있어 더없이 만족한 곳이랍니다~ *업체명: 풍경 *주소: 경기 안산시 단원구 사청터길 3 *번호: 032-887-6250 *영업시간: 매일 09:00 - 21:00 (Last order : 20:00) *주차 유무: 전용 주차장 완비 (약 60대 가량 주차 가능) 방문했던 풍경은...,2020. 8. 26.
자꾸 땡기는 안산 맛집,여행으로 들렸다가도 좋을것 같았고 가족들과 함께 와서 즐기기에도 괜찮을만한 메뉴들이었어요 주문은 역시 제가 좋아하는 불향이 나는 쭈꾸미... 앞으로 여기 올때마다 무조건 들릴만한 그런 곳이었어요.매콤한 양념맛은 자꾸 생각날듯 경기 안산시 단원구 대선로 231,2020. 8. 15.
대부도 여행의 마무리 탄도항에서 인생 노을 보기,서해안 일몰이 아름다운 곳 대부도 탄도항 2021년 6월 27일 대부도 당일치기 여행의 마지막을 장식할 탄도항에서 일몰을 보고 왔습니다. 지난번... 탄도항 위치 및 주차장 입장료 및 주차비 무료 주소 : 경기 안산시 단원구 선감동 717-5 탄도항은 경기도 안산시 단원구 선감동에 위치한 항구이며 대부도...,2021. 7. 25.
찐했던 대부도 칼국수,찐했던 대부도 칼국수 얼마 전 친구들과 여행겸 대부도에 다녀왔어요. 지나가다가 대부도 칼국수 맛집이 있어서 방문했는데요. 퀄리티 높은 맛을... 상호 : 낙지촌 주소 : 경기 안산시 단원구 대선로 13 전화 : 032-880-1700 영업시간 : 매일 07:00 - 00:00 라스트오더 23시 주차여부 : 가능,2020. 8. 20.
서울근교 드라이브 코스 대부도 갈만한곳 탄도항 등 5곳!,"대부도 갈만한곳 서울근교 드라이브 코스 대부도 탄도항 전곡항 등 5곳 여행일 : 2020년 1월 29일 / 글, 사진 : 순수시대 주세환 지난주 집에만 있기... 일몰이 아름다운 탄도항 경기 안산시 단원구 선감동 717-5 탄도항은 서울근교 드라이브 코스로 대부도 최남단 전곡항과 마주 보고 있는 항입니다....",2021. 2. 2.
대부도애견동반 가능한 펜션나드리,"위치 경기 안산시 단원구 부흥로 287-189 입실 14:00 퇴실 11:00 개별바비큐, 수영장, 단체 가능 펜션나드리는 대부도 펜션단지 내에 위치해있어요. 위례에서 자차로 1시간 30분 정도 걸리더라고요. 그렇게 멀지 않으면서 여행 온 느낌을 낼 수 있어서 좋은 것 같아요 :) 현재 대부도펜션예약센터에서...",2021. 5. 1.
바람이 불어오는 곳 수인선 전철 여행,시골 들판을 가로지르는 수인선 여행 노랗게 익은 들판을 가로질러 전철이 지나간다. 어느 한적한 시골에서나 보았을 풍경이 그대로 남은 수인선... 화성시와 안산시의 경계지역은 아직도 벼농사를 짓는 농촌 풍경이 여전히 남아있다. 옛날에는 이곳이 바다였다고 하는데 방조제가 건설되면서...,2021. 7. 23.
"서울근교 가볼만한 곳, 안산 탄도항 다녀왔어요!","이번 여행지는 풍력발전기가 너무나 멋진 '탄도항'입니다! ""탄도항"" 경기 안산시 단원구 선감동 717-5 탄도항은 sns에서 이전부터 노을질 때 사진이 너무 멋진 명소로 알려져있는데요. 밤운전에 약한 저는 역시나 낮에 방문하였습니다. 오후에 방문하였다면 더욱 좋았겠다. 라는 아쉬움이 한 켠에...",2021. 2. 21.
[여행 - 대부도] 대부도 가볼만한곳,"시화방조제 - 주소 : 경기 안산시 단원구 대부동동 #날씨가 좋았다면, 잠깐 내려서 봤다면 좋았을 것 같았던 곳, 시화방조제 적당한 곳에 차를... 이번 여행? 여행이라고 하기엔 좀 아쉽지만 마실이라고 하겠습니다. 시간 투자 많이 안 하고 나름 구경 잘 하고 왔어요 ㅋㅋ 오랜만에 바다...",2021. 6. 22.
대부도카페 동남아 여행 온 듯한 파도마루,"해외여행을 온 듯한 느낌이라 정말 만족스러운 대부도 카페예요. 요즘 같은 때 해외여행을 즐기고 싶으신 분들께도 추천합니다. 저도 그렇지만... 다른 분들도 한 번씩 참고해 보시고, 만족스러운 방문 되셨으면 좋겠습니다. 파도마루 경기 안산시 단원구 대부북동 산20-20 110호",2021. 6. 29.
"[TV속 정보] 6월 17일(목) KBS2TV생생정보 , MBC생방송오늘저녁, SBS생방송투데이...",2TV 생생정보 제작사: 인터즈 <생생정보통 - 중고가전 > ▶ 탑재활용센터 ☎ 031-433-2283 경기 안산시 단원구 화랑로 49 <고수의 부엌... 다산점: 경기 남양주시 다산중앙로81번길 7 109호 (다산점) <신박한 네바퀴 여행> ▶ 선재오토캠핑장 ☎ ***-****-**** 인천 옹진군 영흥면...,2021. 6. 17.
대단했던 안산 고잔동 맛집 리스트,"인테리어는 굉장히 깔끔했고 입구는 돌담으로 꾸며져 있어 마치 여행 온듯한 느낌을 뽐내고 있던 곳이었어요. 3. 영월애곤드레 안산점 직화 제육볶음 한상차림정식 14,000원 고등어구이 한상차림정식14,000원 주소 : 경기 안산시 단원구 당곡로 33 안산프라움씨티오피스텔 번호 : ***-***-****...",2021. 5. 20.
든든한 대부도 굴구이,그동안 많은 여행지를 다녀봤지만 현지에서 이렇게 정성스럽고 맛있는 음식을 접할 기회가 많지는 않았거든요. 그런데 이번엔 정말 성공적이었어요. 대부도 굴구이 제철이 지나기 전에 또 한 번 다녀오고싶을 정도로 너무 만족스러웠답니다. 번호 : 032-886-6110 주소 : 경기 안산시 단원구 대부황금로...,2020. 11. 24.
"대부도 갈만한곳 방아머리 해수욕장 외 3곳 + 칼국수, 카페","대부도 갈만한곳 방아머리 해수욕장 외 3곳 + 칼국수, 카페 서울 근교 나들이로 딱인 대부도 경기도 바다를 만날 수 있는 여행지로 가볍게 나들이를... 방아머리 해수욕장 - 위치 : 경기 안산시 단원구 대부북동 대부도 갈만한곳 02. 대부도카페가 대부도에는 꽤 많은 카페들이 있어요. 그리고 섬이다...",2021. 6. 8.
대부도 갈만한곳 탄도항과 전곡항도 들려보세요,사또횟집 경기 안산시 단원구 대부황금로 1479 달전망대를 지나서 다리를 건너서 조금만 안쪽으로 들어가면 나오는 진짜~ 유명한 곳이예요 올해... 진짜 오래전에 신혼여행에서 딱 한번 먹어보고 처음이였는데 그 식감은 생선과 비교불가해요 머리랑 집게는 쪄서 주시는데 요거~ 살만 발라먹고 버리지...,2020. 12. 21.
"대부도 수제 치킨버거, 대부 DBB",대부 DBB (DAE BOO BREWERY) 주소 : 경기 안산시 단원구 구봉길 59 영업시간 : 평일/주말 11시-20시(월요일 휴무) 평일 오픈 시간에 맞춰 찾아간 대부 DBB... 넓게 펼쳐진 잔디를 바라보며 먹는 수제 버거도 맛있었고- 근교 여행온 기분을 느낄 수 있어서 좋았다 #내돈내산 #대부도맛집 #대부도수제버거...,2021. 9. 23.
경기도 가볼만한곳 가볍게 안산 한바퀴,경기 안산시 단원구 대부황금로 17-34 주차장 있음 그리고 이날의 마지막은 역시 쌀쌀한 저녁 날씨 탓에 찾아 갔던 칼국수 전문점이었어요. 2층에는 카페도 같이 운영하고 있어서 바지락칼국수와 해물 파전 1개씩 시켜서 사이좋게 나눠 먹고 마지막으로 따뜻한 아메리카노로 이날 하루 사진 여행을...,2020. 11. 29.
