header,contents,date
인천공항 콜택시 도봉 노원 중랑 남양주 구리 의정부 하남 성남 분당 용인 수지 죽전...,가족여행에 편안하고 안전하게 이동할 수 있어요 구로구 강서구 마포구 양천구 은평구 서대문구 광명시 부천시 인천공항~~~~~ ~~5만원대 동작구 서초구 강남구 송파구 용산구 안양시 의왕시 군포시 과천시 인천공항 ~~~6만원대 의정부 노원구 강북구 도봉구 중랑구 강동구 분당 성남 용인 수원...,2021. 1. 13.
지하철 타고 가는 서울 근교산,"청계산 3호선 양재역 7번 출구 청계산은 서울시와 경기도 성남시·과천시· 의왕시의 경계에 위치한 해발 618m의 산이다. 양재역 7번 출구에서 버스... 특히 숲속여행 프로그램을 운영해 숲 해설가의 안내에 따라 사직공원에서 시작해 단군성전, 황학정, 삼림욕길을 탐방하는 코스가 인기. 종로구...",2021. 1. 9.
"[울산방역] 신종코로나 소독,방역 우수업체 페스코","전지역 경기, 수원시, 성남시, 의정부시, 안양시, 부천시, 광명시, 평택시, 동두천시, 안산시, 고양시 과천시, 구리시, 남양주시, 오산시, 시흥시, 군포시, 의왕시, 하남시, 용인시, 파주시, 이천시, 안성시, 김포시, 화성시, 광주시, 양주시, 포천시, 여주시, 연천군, 가평군, 양평군 전지역 24시간 문의...",2020. 6. 5.
"나의 꿈이 우리의 꿈으로, Dreamful 군포의왕교육지원청","군포시와 의왕시의 예산을 지원 받아 이러한 소수학생 선택 교과의 수업의 질의 높이고자 한다. 이외에도 교과중점교와 진로집중과정에 대한... ☼ 꿈의학교로 군포의왕 아이들은 미래를 여행하고 진로를 체험한다. 꿈의학교는 학교와 마을의 교육주체(지역 다체, 동호회 등)들이 연계하여...",2020. 12. 29.
지역축제/조명/트러스렌탈/축제를 기다리며,혹시 어떤 축제들이 있을까 궁금하시다면 여행 계획 중에 지역 축제를 들러보고 싶으시다면 아래 사이트를 한번 들어가 보세요.... 제주.경기.수원.화성.경남.경북.충남.충북.전남.전북.강릉.강화.의정부.의왕시.음성.영덕.영천.익산. 지역축제.지역행사.야외행사.실외행사.특산물축제.실내행사....,2020. 2. 21.
인천공항택시 서대문구 홍제동 홍은동 남가좌동 북가좌동 영천동 연희동 천현동...,안전하게 여행의 시작은 즐거운 타요택시와 함께해요 365일 24시간 예약상담 중 고객님이 원하는 시간과 장소에서 이동할수 있도록 예약제로... 안양시 의왕시 군포시 과천시 인천공항 ~~~6만원대 의정부 노원구 강북구 도봉구 중랑구 강동구 분당 성남 용인 수원 인천공항~~~~~~~ 7만원대 서울지역...,2021. 1. 12.
"2021년 3월 25일 생방송 투데이-대박신화 어느날(복고간판 디자이너), 선택!한국인의...",대박신화 어느 날 - 세월을 그리는 복고 간판 디자이너 편 ▶<이모션벽화> 주소 : 경기도 의왕시 효행로 4 번호 : ***-****-**** https://www.god-emotion.com/mural 2. 선택! 한국인의 메뉴 - 봄철 입맛 돋우는 생선 음식 Top3 편 ▶ <갈릴리농원> 주소 : 경기 파주시 탄현면 방촌로...,2021. 3. 25.
인천공항 콜택시 타요택시 대구에서 인천공항 대전 구미 남양주 구리 의정부 하남 성남...,해외여행은 해외여행인지라 짐이별로 없다고 아무거나 타고갈순없죠 비행기시간이 있는데 조금이라도 늦게 도착하거나 빠듯하게 도착한... 안양시 의왕시 군포시 과천시 인천공항 ~~~6만원대 의정부 노원구 강북구 도봉구 중랑구 강동구 분당 성남 용인 수원 인천공항~~~~~~~ 7만원대 ● 타요 택시...,2021. 1. 16.
고객보상프로그램 6월 3주차 (1),여행은 못가도 하루이틀 집에서 맘편하게 쉬는 것도 좋을 것 같아요 저는 이번에 집콕 확정!! 이번주도 누누베베 가족분들이 많이 참여해주셨어요... 님 경기도 의왕시 홍*림 님 경기도 고양시 강*지님 전북 익산시 박*남 님 부산시 수영구 김*현 님 총 21분입니다 . 정말 감사드립니다 . 총 21분 고객님...,2020. 6. 16.
"2021년 08월 05일, 오늘의 뉴스","■ 대우건설·현대건설·GS건설, 이달 경기 안양서 `평촌 엘프라우드` 분양 [디지털타임스 박상길 기자] 대우건설은 현대건설, GS건설과... 거리 의왕시 위치 ""백운호수·바라산 등 주변 자연경관과 조화…자연 일체형 아울렛"" [아시아경제 김유리 기자] 롯데백화점은 5일 다음 달...",2021. 8. 5.
2019 지구촌장 국내 등산&트레킹 결산일지,"2019 등산 결산일지 순서 산 이름 지역 일자 1 연화산 경남 고성군 1월 6일 2 천마산 경기 남양주시 1월 12일 3 청계산 서울시, 성남시, 과천시, 의왕시 2월 6일 4 구병산 충북 보은군 2월 10일 5 아미산 경북 군위군 2월 17일 6 응봉산, 설흘산 경남 남해군 2월 24일 7 상왕봉 전남 완도군...",2020. 1. 6.
인천공항 콜택시 파주 일산 동작 노원 도봉 중랑 의정부 구리 남양주 별내 진접 용인...,안전하게 여행의 시작은 즐거운 타요택시와 함께해요 365일 24시간 예약상담 중 고객님이 원하는 시간과 장소에서 이동할수 있도록 예약제로... 안양시 의왕시 군포시 과천시 인천공항 ~~~6만원대 의정부 노원구 강북구 도봉구 중랑구 강동구 분당 성남 용인 수원 인천공항~~~~~~~ 7만원대 넓은좌석과...,2021. 1. 11.
"코로나19 신규확진 1천202명, 4주째 네 자릿수..비수도권 다시 40% 육박 (8월 3일)","경기 북부 무속신앙과 광명시 자동차 공장2, 성남시 직업기술학원, 수원시 배드민턴 동호회, 안산시 육류가공업체, 안산시 의류공장2, 의왕시 음식점, 이천시 관공서, 평택시 운동시설, 평택시 전자공업, 화성시 제조업2, 화성시 초등학교·태권도학원, 서울시 노원구 음식점·경기...",2021. 8. 3.
2.20부동산정책,"기존의 기존의 조정대상지역은 서울의 26개구와 경기도 과천,성남,하남 고양,남양주 일부지역,동탄2,광명,구리,안양 동안,광교지구,수원 팔달, 용인 수지 기흥,세종까지 총 39곳이었는데요. 이번에 추가로 새로 지정이 된 곳이 수원 장안구,영통구, 권선구,안양 만안구 의왕시까지 이렇게 다섯...",2020. 5. 10.
2019 지구촌장 국내 등산&트레킹 결산일지,"2019 등산 결산일지 순서 산 이름 지역 일자 1 연화산 경남 고성군 1월 6일 2 천마산 경기 남양주시 1월 12일 3 청계산 서울시, 성남시, 과천시, 의왕시 2월 6일 4 구병산 충북 보은군 2월 10일 5 아미산 경북 군위군 2월 17일 6 응봉산, 설흘산 경남 남해군 2월 24일 7 상왕봉 전남 완도군...",2020. 1. 6.
인천공항 콜택시 도봉 노원 중랑 남양주 구리 의정부 하남 성남 분당 용인 수지 죽전...,해외여행은 해외여행인지라 짐이별로 없다고 아무거나 타고갈순없죠 비행기시간이 있는데 조금이라도 늦게 도착하거나 빠듯하게 도착한... 안양시 의왕시 군포시 과천시 인천공항 ~~~6만원대 의정부 노원구 강북구 도봉구 중랑구 강동구 분당 성남 용인 수원 인천공항~~~~~~~ 7만원대 ● 타요 택시...,2021. 1. 14.
인천공항 콜택시 파주 일산 동작 노원 도봉 중랑 의정부 구리 남양주 별내 진접 용인...,안전하게 여행의 시작은 즐거운 타요택시와 함께해요 365일 24시간 예약상담 중 고객님이 원하는 시간과 장소에서 이동할수 있도록 예약제로... 안양시 의왕시 군포시 과천시 인천공항 ~~~6만원대 의정부 노원구 강북구 도봉구 중랑구 강동구 분당 성남 용인 수원 인천공항~~~~~~~ 7만원대 넓은좌석과...,2021. 1. 11.
"코로나19 신규확진 1천202명, 4주째 네 자릿수..비수도권 다시 40% 육박 (8월 3일)","경기 북부 무속신앙과 광명시 자동차 공장2, 성남시 직업기술학원, 수원시 배드민턴 동호회, 안산시 육류가공업체, 안산시 의류공장2, 의왕시 음식점, 이천시 관공서, 평택시 운동시설, 평택시 전자공업, 화성시 제조업2, 화성시 초등학교·태권도학원, 서울시 노원구 음식점·경기...",2021. 8. 3.
2.20부동산정책,"기존의 기존의 조정대상지역은 서울의 26개구와 경기도 과천,성남,하남 고양,남양주 일부지역,동탄2,광명,구리,안양 동안,광교지구,수원 팔달, 용인 수지 기흥,세종까지 총 39곳이었는데요. 이번에 추가로 새로 지정이 된 곳이 수원 장안구,영통구, 권선구,안양 만안구 의왕시까지 이렇게 다섯...",2020. 5. 10.
키즈카페 사이트 모음,"경기도 의왕시 갈미2로 7. - 어린이 테마파크, 키즈카페, 할인 이벤트, 공지사항, 이용안내. 아이원트 키즈카페 http://www.iwant-kids.com - 프리미엄 키즈카페, 쿠킹클래스. 경남 진주시 진양호로 28번길 21 위너스빌딩 5층. - 다양한 놀이시설 소개, 키즈쿠킹 수업안내...",2020. 12. 20.
인천공항 콜택시 파주 고양 일산 포천 동두천 노원 중랑 남양주 구리 의정부 하남 성남...,해외여행 가시는 분들은 신종 코로나 때문에 여행을 자제를 할수밖에 없다고 하니 이번 사태는 전 세계적으로 큰일인거 갔어요 인천공항 가실땐... 안양시 의왕시 군포시 과천시 인천공항 ~~~6만원대 의정부 노원구 강북구 도봉구 중랑구 강동구 분당 성남 용인 수원 인천공항~~~~~~~ 7만원대...,2021. 1. 12.
인천공항 콜택시 파주 고양 일산 포천 동두천 노원 중랑 남양주 구리 의정부 하남 성남...,해외여행 가시는 분들은 신종 코로나 때문에 여행을 자제를 할수밖에 없다고 하니 이번 사태는 전 세계적으로 큰일인거 갔어요 인천공항 가실땐... 안양시 의왕시 군포시 과천시 인천공항 ~~~6만원대 의정부 노원구 강북구 도봉구 중랑구 강동구 분당 성남 용인 수원 인천공항~~~~~~~ 7만원대...,2021. 1. 12.
비버의 도전 ! 국토대장정 서울에서 해남 땅끝마을까지 걸어가기 1일차 코스 서울...,"2020.08.12 (수) 1일차 서울 광화문광장 - 수원역 전날 일찍 자려고 노력해봤지만 뭐랄까 중,고등학교 시절 수학여행 가기 전 설레는 마음 반 걱정... 점심+카페에서 1시간30분정도 휴식후 다시 정신줄 단디 붙잡고 출발했어요 헥헥 평촌-안양농수산물도매시장을 지나 벌써 네번째 도시인 의왕시로...",2020. 8. 19.
인천공항 콜택시 파주 일산 동작 노원 도봉 중랑 의정부 구리 남양주 별내 진접 용인...,안전하게 여행의 시작은 즐거운 타요택시와 함께해요 365일 24시간 예약상담 중 고객님이 원하는 시간과 장소에서 이동할수 있도록 예약제로... 안양시 의왕시 군포시 과천시 인천공항 ~~~6만원대 의정부 노원구 강북구 도봉구 중랑구 강동구 분당 성남 용인 수원 인천공항~~~~~~~ 7만원대 서울지역...,2021. 1. 12.
강아지 장례식장은 24시간 언제나 진행이 가능한 레인보우엔젤에서!,"크게는 인생의 전과 후로 나뉠 정도로 소중한 존재라고 하는데요, 여행을 가더라도 내가 가고 싶은 곳보다 아이를 데려갈 수 있는 곳인지 따져보고... 과천시 의왕시 용인시 성남시 이천시 여주시 안성시 평택시 시흥시 광명시 김포시 일산 부천시 부평시 의정부시 파주시 동두천시 포천시 오산시...",2020. 9. 10.
2020.2.24 부동산뉴스 큐레이션 by 붇옹산,"""21일 한국감정원에 따르면, 신규 조정대상지역 5곳의 지난 1년간 아파트 거래 중 경기도민이 매입한 비율은 의왕시가 89.9%로 가장... 2020.2.24 붇옹산 #부동산뉴스큐레이션 #부뉴붇 #붇옹산 원래 지난 주말에 속초 가족여행 다녀오려했는데, 코로나 바이러스 때문에 포기. 그래도...",2020. 2. 24.
경기도 가볼만한곳 총정리!,"여행아빠 방콕아빠입니다. 오늘은 그동안 올려왔던 경기도 가볼만한곳을 총정리하는 시간입니다. 경기도에는 총 31개의 지방자치단체가... 25 의왕시 철도박물관, 왕송호수 바라산자연휴양림 130,792 26 동두천시 어린이박물관, 자유수호평화박물관 경기북부어린이박물관 118,682 27...",2020. 4. 22.
미니트러스/백드롭/조명/음향<소규모행사장비 렌탈>,오늘은 <신나는 예술여행> 사업의 일환으로 대전 판암역 지하철 역사에서 펼쳐진 거리공연. 매월 첫째 주 금요일에 열린 총 5회 공연中 첫 번째... 의정부.의왕시.남양주.안양.안동.영동.영덕.안산.안성.울진.거제.통영.과천.광명.강화.강릉.정선.속초.평창.평택.문경.포천.순천.횡성.고성.정읍.거창....,2020. 3. 21.
미니트러스/백드롭/조명/음향<소규모행사장비 렌탈>,오늘은 <신나는 예술여행> 사업의 일환으로 대전 판암역 지하철 역사에서 펼쳐진 거리공연. 매월 첫째 주 금요일에 열린 총 5회 공연中 첫 번째... 의정부.의왕시.남양주.안양.안동.영동.영덕.안산.안성.울진.거제.통영.과천.광명.강화.강릉.정선.속초.평창.평택.문경.포천.순천.횡성.고성.정읍.거창....,2020. 3. 21.
인천공항 콜택시 파주 고양 일산 포천 동두천 노원 중랑 남양주 구리 의정부 하남 성남...,해외여행 가시는 분들은 신종 코로나 때문에 여행을 자제를 할수밖에 없다고 하니 이번 사태는 전 세계적으로 큰일인거 갔어요 인천공항 가실땐... 안양시 의왕시 군포시 과천시 인천공항 ~~~6만원대 의정부 노원구 강북구 도봉구 중랑구 강동구 분당 성남 용인 수원 인천공항~~~~~~~ 7만원대 http://pf....,2021. 1. 2.
"주택 관련기사(5) [분양] - 새해 첫주 분양 '판교밸리자이'..""시세차익 최대 3~5억 기대...","지난해 ‘2·20 대책’으로 경기 수원 영통·권선·장안구, 안양 만안구, 의왕시 등을 조정대상지역으로 묶은 데 이어 ‘6·17 대책’을 통해 파주·여주·가평 등을 제외한 수도권 대부분 지역을 조정대상지역으로 지정했다. 지난해 11월 19일과 12월 17일 두 차례에 걸쳐 지방에서도...",2021. 1. 3.
인천공항 콜택시 20%할인 거제 고성 사천 진주 창원 울산 부산 함양 대전 대구 청양...,가족여행에 편안하고 안전하게 이동할 수 있어요 서울지역 강서구 양천구 영등포구 구로구 금천구 관악구 동작구 마포구 서대문구 은평구 종로구 중구 동대문구 성북구 용산구 성동구 강북구 도봉구 노원구 중랑구 광진구 서초구 강남구 송파구 강동구 서울 전 지역에서 예약 가능합니다 경기지...,2020. 12. 25.
인천공항 콜택시 파주 일산 도봉 노원 중랑 남양주 구리 의정부 하남 성남 분당 용인...,안전하게 여행의 시작은 즐거운 타요택시와 함께해요 365일 24시간 예약상담 중 고객님이 원하는 시간과 장소에서 이동할수 있도록 예약제로... 안양시 의왕시 군포시 과천시 인천공항 ~~~6만원대 의정부 노원구 강북구 도봉구 중랑구 강동구 분당 성남 용인 수원 인천공항~~~~~~~ 7만원대 ● 타요 택시...,2020. 12. 4.
영상포토 뉴스- 9월 7일 화요일,"까치가 8개시(고양시ㆍ광명시ㆍ김포시ㆍ성남시ㆍ안성시ㆍ양주시ㆍ의왕시ㆍ이천시)로 가장 많았고, 뒤이어 비둘기 6곳(경기도ㆍ과천시ㆍ구리시ㆍ양평군ㆍ의정부시ㆍ파주시), 꿩 3곳(가평군ㆍ용인시ㆍ하남시), 까마귀 1곳(오산시) 순이다. 1972년 10월 꿩을 군조로 지정한 가평군은 깃털의...",2021. 9. 7.
인천공항 콜택시 노원 중랑 송파 남양주 구리 의정부 하남 성남 분당 용인 수지 죽전...,쾌적한 여행길이 되도록 노력하고 있습니다 정식 여객 운송사업 면허 와 사업자 등록보험까지 완벽하게 갖추고 운행합니다 인천공항 샌딩 픽업... 안양시 의왕시 군포시 과천시 인천공항 ~~~6만원대 의정부 노원구 강북구 도봉구 중랑구 강동구 분당 성남 용인 수원 인천공항~~~~~~~ 7만원대 서울지역...,2021. 1. 11.
인천공항 콜택시 20%DC 콜밴 대구 경산 안동 구미 경주 포항 울진 봉화 영주 예천 청주...,쾌적한 여행길이 되도록 노력하고 있습니다 정식 여객 운송사업 면허 와 사업자 등록보험까지 완벽하게 갖추고 운행합니다 인천공항 샌딩 픽업... 안양시 의왕시 군포시 과천시 인천공항 ~~~6만원대 의정부 노원구 강북구 도봉구 중랑구 강동구 분당 성남 용인 수원 인천공항~~~~~~~ 7만원대 서울지역...,2021. 1. 11.
인천공항 콜택시 파주 일산 동작 노원 도봉 중랑 의정부 구리 남양주 별내 진접 용인...,안전하게 여행의 시작은 즐거운 타요택시와 함께해요 365일 24시간 예약상담 중 고객님이 원하는 시간과 장소에서 이동할수 있도록 예약제로... 안양시 의왕시 군포시 과천시 인천공항 ~~~6만원대 의정부 노원구 강북구 도봉구 중랑구 강동구 분당 성남 용인 수원 인천공항~~~~~~~ 7만원대 넓은좌석과...,2021. 1. 15.
2021년 6월 28일 오늘의 HOT50 뉴스(소녀상)ㅡ오,"내 부모를 섬기듯 열심히 노력하며, 즐거운 프로그램과 행복한 터전입니다 [봄날] [여행]남쪽 바다를 단장한 ‘예술의 섬’ 고흥 연홍도 https://weekly.hankooki.com/lpage/life/202106/wk20210628080105147620.htm?s_ref=nv 미술관에 남은 폐교시절의 흔적은 이순신장군 동상과 생각하는...",2021. 6. 28.
늘푸른관광 ! 버스 경유지 !,"의왕시청 삼거리옆 노상무료주차장 ( 경기도 의왕시 고천동 110 ) ※ 버스내 출발 전 소독 완료! ※ ▶ 버스 탑승 전 체온체크 합니다!. ▶ 마스크 착용 꼭 부탁드립니다!. ♡ 버스만 이용 가능합니다 ♡ 항상 즐거운 낚시 여행이 되도록 리무진 22~28석 버스로 안전,친절하게 모시겠습니다!...",2020. 9. 3.
충무공 이순신 백의종군 길(3∼4코스),"<백의종군 길 지도> 오늘의 일정은 제3코스 중간지점인 경기도 의왕시청 입구인 경수대로 고천동에서 출발한다. 고천동(古川洞)은 경기도 의왕시에 속한 동으로 서쪽에 오봉산이 솟아 있고, 중앙부로 안양천이 흐른다. 천변에 형성된 시가지를 제외한 나머지 많은 지역은 산지를 이룬다. 동...",2020. 1. 31.
인천공항 콜택시 도봉 노원 중랑 남양주 구리 의정부 하남 성남 분당 용인 수지 죽전...,안양시 의왕시 군포시 과천시 인천공항 ~~~6만원대 의정부 노원구 강북구 도봉구 중랑구 강동구 분당 성남 용인 수원 인천공항~~~~~~~ 7만원대... 안전하게 여행의 시작은 즐거운 타요택시와 함께해요 365일 24시간 예약상담 중 고객님이 원하는 시간과 장소에서 이동할수 있도록 예약제로 운행하는...,2020. 12. 2.
인천공항 콜택시 콜밴 해외입국자 보건소경유~ 대구 경산 안동 구미 경주 포항...,안양시 의왕시 군포시 과천시 인천공항 ~~~6만원대 의정부 노원구 강북구 도봉구 중랑구 강동구 분당 성남 용인 수원 인천공항~~~~~~~ 7만원대 인천공항 픽업 샌딩 및 장거리 전문택시 집앞 주차장에서 출발하여 인천공항 출국장 게이트 앞까지 편리하고 안전하게 여행의 시작은 즐거운 타요택시와...,2021. 3. 10.
방역택시 인천공항 콜택시 도봉 노원 중랑 남양주 구리 의정부 하남 성남 분당 용인...,안전하게 여행의 시작은 즐거운 타요택시와 함께해요 365일 24시간 예약상담 중 고객님이 원하는 시간과 장소에서 이동할수 있도록 예약제로... 안양시 의왕시 군포시 과천시 인천공항 ~~~6만원대 의정부 노원구 강북구 도봉구 중랑구 강동구 분당 성남 용인 수원 인천공항~~~~~~~ 7만원대 외국에서...,2021. 1. 16.
인천공항 콜택시 남양주 구리 하남 용인 수지 동천동 상현 동탄 화성 양주 분당 판교...,안양시 의왕시 군포시 과천시 인천공항 ~~~6만원대 의정부 노원구 강북구 도봉구 중랑구 강동구 분당 성남 용인 수원 인천공항~~~~~~~ 7만원대 인천공항 픽업 샌딩 및 장거리 전문택시 집앞 주차장에서 출발하여 인천공항 출국장 게이트 앞까지 편리하고 안전하게 여행의 시작은 즐거운 타요택시와...,2021. 1. 7.
롯데쇼핑 사업내용,(마) 내수경기 산업 소매유통산업은 최종 소비자를 대상으로 하기 때문에 가구소득 및 소비지출의 변화와 밀접하게 연관되어 있습니다. 따라서 가구소득 및 소비가 증가하는 만큼 소매유통판매액은 일정수준 지속적으로 증가하게 됩니다. 특히 백화점의 경우 경기변동에...,2021. 5. 7.
김태욱 강의 컨설팅 실적,"(3개월) 경기도여성능력개발센터, 소셜마케팅 콘텐츠 동영상 제작 서울산업통상진흥원 홍보 및 SNS 마케팅 컨설팅 의왕시, 홍보정책 자문위원 서울산업진흥원 SBA, <국제콘텐츠마켓 SPP 2016> 홍보콘텐츠 컨설팅 및 제작 대행 (3개월) 경기복지재단, 사회서비스 제공기관 홍보 마케팅 컨설팅 (2016...",2020. 12. 19.
"대형동물 장례 토끼 기니피그 화장 햄스터 화장터 고슴도치 장례식장, 전문성이 중요해요!",얼마 전 여행 다녀왔는데요. 요즘에는 호텔에서도 애견과 동반할 수 있는 곳이 있더라구요. 그만큼 우리나라에서도 애견 산업이 많이 발전되었다고... 과천시 의왕시 용인시 성남시 이천시 여주시 안성시 평택시 시흥시 광명시 김포시 일산 부천시 부평시 의정부시 파주시 동두천시 포천시 오산시...,2020. 8. 23.
지산리조트 셔틀 버스 시간표.노선 승차장 위치,지산리조트 렌탈샵 BHS 스키샵 경기도 이천시 마장면 지산로 226 Lycle 전화 문의: 070-4452-8243 http://pf.kakao.com/_xfxawxeM/chat 카카오톡 실시간 상담(가능한 채팅으로 부탁해요) 출처: https://homihomi.tistory.com/1418 [호미숙 사진 여행 호미스튜디오] 이번에 우리가 이용할 지산리조트 렌탈샵은...,2020. 1. 23.
인터넷 신문 사이트모음,"- 한국지역인터넷신문 http://koreainews.kr - 지역 인터넷신문 네트워크, 종합기사, 교육, 문화, 인물대담, 지역축제, 여행정보 제공. - e뉴스페이퍼 http://www.purpress.com - 인터넷 신문, 정치, 경제, 국제, 사회, 문화, IT, 스포츠, 연예 뉴스, 기사 제공. - 경기 인터넷신문 http...",2020. 12. 20.
"대형동물 장례 토끼 기니피그 화장 햄스터 화장터 고슴도치 장례식장, 전문성이 중요해요!",얼마 전 여행 다녀왔는데요. 요즘에는 호텔에서도 애견과 동반할 수 있는 곳이 있더라구요. 그만큼 우리나라에서도 애견 산업이 많이 발전되었다고... 과천시 의왕시 용인시 성남시 이천시 여주시 안성시 평택시 시흥시 광명시 김포시 일산 부천시 부평시 의정부시 파주시 동두천시 포천시 오산시...,2020. 8. 23.
인천공항 콜택시 20%DC 대구 경산 부산 예천 구미 김천 창원 충무 포항 부산 대전 세종...,안양시 의왕시 군포시 과천시 인천공항 ~~~6만원대 의정부 노원구 강북구 도봉구 중랑구 강동구 분당 성남 용인 수원 인천공항~~~~~~~ 7만원대 인천공항 픽업 샌딩 및 장거리 전문택시 집앞 주차장에서 출발하여 인천공항 출국장 게이트 앞까지 편리하고 안전하게 여행의 시작은 즐거운 타요택시와...,2020. 11. 22.
지산리조트 셔틀 버스 시간표.노선 승차장 위치,지산리조트 렌탈샵 BHS 스키샵 경기도 이천시 마장면 지산로 226 Lycle 전화 문의: 070-4452-8243 http://pf.kakao.com/_xfxawxeM/chat 카카오톡 실시간 상담(가능한 채팅으로 부탁해요) 출처: https://homihomi.tistory.com/1418 [호미숙 사진 여행 호미스튜디오] 이번에 우리가 이용할 지산리조트 렌탈샵은...,2020. 1. 23.
인터넷 신문 사이트모음,"- 한국지역인터넷신문 http://koreainews.kr - 지역 인터넷신문 네트워크, 종합기사, 교육, 문화, 인물대담, 지역축제, 여행정보 제공. - e뉴스페이퍼 http://www.purpress.com - 인터넷 신문, 정치, 경제, 국제, 사회, 문화, IT, 스포츠, 연예 뉴스, 기사 제공. - 경기 인터넷신문 http...",2020. 12. 20.
인천공항 콜택시 20%DC 콜밴 대구 경산 안동 구미 경주 포항 울진 봉화 영주 예천 청주...,해외여행은 해외여행인지라 짐이별로 없다고 아무거나 타고갈순없죠 비행기시간이 있는데 조금이라도 늦게 도착하거나 빠듯하게 도착한... 안양시 의왕시 군포시 과천시 인천공항 ~~~6만원대 의정부 노원구 강북구 도봉구 중랑구 강동구 분당 성남 용인 수원 인천공항~~~~~~~ 7만원대 1일 1회 세차를...,2021. 1. 4.
