header,contents,date
한국의 유명 섬 시리즈 - 경기 안산 대부도 (014),"하지만 1002번이 전곡항으로 연장되면서 탄도에서 조금 걸어서 전곡항에서 제부도, 서신, 사강, 마도, 남양, 군포시, 의왕시, 사당역으로 갈 수 있다. 또한 5-1번, 5-2번 마을버스가 전곡항과 탄도로 들어온다. 과거에는 남양군 → 부천군 → 옹진군에 속하였으나, 시화호 간척사업 직후 경기도...",2021. 1. 17.
<수도권 사회적 거리두기 2.5단계 연장 + 전국 연말연시 특별방역기간>조치를...,모임·여행에 대한 방역을 강화합니다. 오늘 의왕시가 1월 3일까지 연장 시행되는 2.5단계 추가 방역조치와 연말연시 특별 방역조치에 대해... 관람 ▸무관중 경기 등교 ▸밀집도 1/3 준수 종교활동 ▸비대면 예배·미사·법회·시일식 등 원칙 * 비대면을 목적으로 영상 제작·송출 등을 위한 업무를...,2020. 12. 28.
고교탐방_우성고등학교,의왕시 가장 오래된 인문계고로 학생 학부모와 소통하며 수시와 정시에서 모두 강한 내실 있는 교육 우성고등학교는 1984년 개교 이후... 윤리/물리학Ⅰ/화학Ⅰ/생명과학Ⅰ/지구과학Ⅰ/스포츠 경기 체력/드로잉 [택1] 5 6 3 3 24 - 5 6 3 3 5 6 3 3 중국어Ⅱ/일본어Ⅱ/정보/육상 운동/미술 전공...,2020. 10. 27.
[추가] 코로나가 잠잠해지면 가보고 싶은 곳,이리 저리 흘러다니다가 가까운 곳이면 찾아 들 생각입니다. 첨부파일 가보고 싶은 곳(21.10.07. 현재).pdf 파일 다운로드 전국의 가볼만한 곳이 시도별로 *.pdf 파일로 정리되어 있습니다. 위의 '가 보고 싶은 곳.pdf' 파일을 내려 받으시면 전국 가볼만한 곳이 정리되어 있습니다. 강원도...,2021. 2. 14.
2021년 04월 3주차 경기도 축제 정보와 공연 및 행사 일정,행사정보 행사일자 경기도 수원시 화성행궁 생생문화재 <달달한 행궁로망스> 2021년05월01일 ~ 2021년05월22일 경기도 의왕시 경기정원문화박람회 2021년05월20일 ~ 2021년05월22일 최신 축제와 공연 및 행사 정보는 아래의 국내 여행 정보 서비스를 참고하세요. http://www....,2021. 4. 17.
2018년 B.,"만성적 여행수지, 서비스 수지 적자 해소에 크게 기여할 수도 있을 것입니다. 사업성이 있는 해운대 마린시티, 센텀시티, 해운대 비치와부터... 의왕시 내손동 인덕원센트럴자이1단지 전용 84.98㎡도 지난달 19일 12억4000만원(12층)에, 경기도 광명시 '광명역 파크자이' 전용면적 84㎡는 5월...",2021. 9. 5.
"강릉콜밴>평창,속초,양양, 강원도콜밴 매일 인천공항 운행 동해,삼척,포항콜벤...","안양콜밴,군포콜밴,평촌콜밴,산본콜밴, 의왕시콜밴,수원콜밴,수지콜밴,용인콜밴, 분당콜밴,성남콜밴,판교콜밴,오산콜밴. 동탄콜밴,기흥콜밴,평택콜밴,화성콜밴, 안성콜밴,천안콜밴,아산콜밴,청주콜밴, 서산콜밴,대전콜밴, 서울콜밴,경기콜밴, 충남콜밴,외 남부지역지점 입니다",2021. 9. 5.
알록달록 단풍 명소로 소문난 경기도 가을여행지 10월에 가볼만한 곳 - 경기도...,Copyright ⓒ 조선일보 & Chosun.com 10월에 가볼만한 곳 - 경기도 가을단풍여행 단풍명소로 소문난 경기도 가을단풍여행!! 점차 물들어 가는 오색단풍은... 길의 풍경에 빠진 채 잠시 걸으면 의왕시 자연학습공원이다. 아기자기하게 잘 정돈된 공원의 정원은 숨겨진 단풍명소이다. 줄지어 선...,2020. 10. 9.
전국 캠핑장 리스트 (경기도),"ctrl-F (컨트롤에프) 누르시고 시군 검색 하셔서 찾아보세요 #캠핑장주소 #캠핑장리스트 #경기도캠핑장 #강원도캠핑장 #전국캠핑장 #차박 #오토캠핑 #불멍 경기도 [경기도 가평군] (주)포세이돈 청평호에서 수상레저, 서바이벌을 함께하는 즐기는 힐링 카라반 카라반 19대를 운영 중이며...",2021. 1. 7.
전국 캠핑장 리스트 (경기도),"ctrl-F (컨트롤에프) 누르시고 시군 검색 하셔서 찾아보세요 #캠핑장주소 #캠핑장리스트 #경기도캠핑장 #강원도캠핑장 #전국캠핑장 #차박 #오토캠핑 #불멍 경기도 [경기도 가평군] (주)포세이돈 청평호에서 수상레저, 서바이벌을 함께하는 즐기는 힐링 카라반 카라반 19대를 운영 중이며...",2021. 1. 7.
210310 - 신문스크랩,연말께 경기 의왕시 학의동 의왕백운백리 업무복합 2-1·2블록에서 오피스텔 1104실(전용 84㎡)도 선보인다. 카페테리어에서 식사도 해결하고 수영장 피트니스 등 대규모 부대시설도 조성할 계획이다. 구 대표는 “백운호수 주변 산책 등 여가활동을 즐길 수 있도록 다양한 운영 프로그램을...,2021. 3. 12.
로또복권 4등 당첨!!!2016년 상반기에 가장 많이 나온 숫자는 28번과 33번 입니다....,전곡리 480-16번지 32 명진슈퍼 경기 의왕시 고천동 295-26 33 - 경기 의정부시 신곡동 519-19번지 34... 837회차로또 로또 763회 1등 당첨 예상... 로또834 로또부동산이 추천하는 세종시 추천여행코스!나눔로또834회 복권 사야되는 꿈 베스트나눔로또834 전국의 로또 명당834회차로또...,2021. 1. 7.
"경기옛길 삼남길 제4길(서호천길), 제5길(중복들길)-해우재 시작, 6.7km 서호천 꽃뫼...",27(토) 경기옛길 삼남길 제4길 서호천길(해우재~서호공원 입구)과 제5길 중복들길(서호공원 입구~옛 수인선 철도) 트래킹 다녀왔다. 인덕원역에서... 괴목정교 이야기 : 정조의 능행차에 상세한 기록이 담긴 「원행을 묘정리의궤」를 보면 능행차를 떠난 정조 일행이 사근행궁(지금의 의왕시...,2021. 3. 1.
"의왕 백운호수 맛집 부모님 모시고 가기 좋은 식당, 이우철 한방누룽지삼계탕","위치 경기 의왕시 학현로 170-52 영업시간 매일 11:00 - 21:00 메뉴 및 가격 - 한방 누룽지 삼계탕 15,000원 - 한방 녹두 삼계탕 15,000원 - 흑마늘 능이 삼계탕 17,000원 내돈내산 내돈내먹 후기입니다. 코로나로 어디 가기 무서운 요즘 서울 근교 여행이나 맛집들을 찾게 되는 것 같다. Previous image Next image...",2020. 10. 3.
2021년 04월 1주차 경기도 축제 정보와 공연 및 행사 일정,경기도 의왕시 경기정원문화박람회 2021년05월20일 ~ 2021년05월22일 경기도 파주시 벽초지수목원 튤립축제 2021년04월07일 ~ 2021년05월05일 최신 축제와 공연 및 행사 정보는 아래의 국내 여행 정보 서비스를 참고하세요. http://www.koreatriptips.com/festivals-events-performances.html,2021. 4. 3.
제8회 경기정원문화박람회 장식할 정원작품 공모전,"이번 경기정원문화박람회는 의왕시와 공동으로 주최·주관하며 박람회에 조성될 우수 ‘정원작품’을 찾는다. 공모전 주제는 ‘정원으로 떠나는 소풍여행, 레솔레파크’이다. 천혜의 자연생태보존 도시인 의왕시의 특징과 레(호수), 솔(소나무, 태양), 레(레일)가 함께하는 공원...",2020. 4. 8.
주말나들이·축제·공연·전시·5일장 정보(1월 4일·5일),27일 ▷조선으로의 여행=칠곡 오모크 갤러리 내 3층 더 커피랩/~2월 2일 ▷2019경주솔거미술관 경북미술인 지원 사업 선정 작가전 '우건우... 놀자'=경기 의왕시 레솔레파크(19일까지) ▷제주유리의성 별빛축제 야간개장=제주 제주시 한경면 유리의성(19일까지) ▷제주윈터페스티벌=제주...,2020. 1. 4.
"감성여행 군포&의왕 - 용호동굴미술관 윰, 납덕골 벽화마을, 에스타시온, 의왕...","주소 경기도 의왕시 왕송못동로 307 문의 031-8086-7371 이용시간 동절기(11~2월) 10:00~17:00, 하절기(3~10월) 09:00~18:00, 매월 첫째 월요일 휴무 이용료 1만 5,000원 홈페이지 http://uiwangpark.uuc.or.kr 호수길 따라 유유자적, 의왕레일파크 왕송호수를 여행하는 방벙 중 하나는 레일바이크를 타고 철로 위를...",2021. 1. 28.
12월 8일부터 3주간 수도권 사회적 거리두기 2.5단계 격상,"오늘 의왕시가 내일부터 3주간 시행되는 사회적 거리두기 2.5단계 방역조치에 대해 알려드리겠습니다. 12. 8. (화) ~ 12. 28. (월) 까지 수도권 사회적... ▲ 수도권 주민들의 여행, 출장 등 타지역 방문자제를 강력 권고, KTX·고속버스 등 교통수단도 50% 이내로 예매를 제한할 것을 권고합니다. ②...",2020. 12. 7.
닛산 멕시마밧데리교체 의왕 자동차배터리교체전문,포함하여 여행을 떠나셨나봐요 도시 내의 길은 한산한 느낌이었는데 고속도로는 하루 죙일 꽉 꽉막히는 기분이 들었네요 ㅋㅋ 이번 여름휴가... 오늘은 경기도 의왕시에서 배터리출장교체를 진행하게 됬어요 차량은 닛산 멕시마 차량이에요~ 배터리방전으로 보험서비스를 이용하셨는데요 보험...,2021. 7. 30.
"지역사랑상품권이 3월에 7,208억원 판매되며 월 최고 판매금액을 기록했습니다.","포천시, 의왕시, 여주시, 양평시, 동두천시, 과천시,가평군, 연천군 경기도 강원 14 1 18 13 강원도, 강릉시, 춘천시, 원주시, 태백시, 삼척시, 영월군, 정선군, 철원군, 화천군, 양구군, 인제군, 홍천군, 고성군 속초시, 동해시, 횡성군, 평창군, 양양군 충북 11 - 11 11 청주시, 충주시, 제천시...",2020. 4. 13.
노원구 건설기초안전보건교육 이수증 안전교육 받는 교육원,하루라도 빨리 코로나가 없어져서 여름부터는 국내여행이라도 자주자주 떠나고 싶어요 1 당일에 접수가능 2 교육시간은 월화수목금토일 3... 경기도 광주 광주시 구리 구리시 남양주 남양주시 가평 양평 퇴계원 강원 강원도 춘천 춘천시 원주 원주시 하남 하남시 과천 과천시 의왕 의왕시 군포...,2021. 8. 31.
의왕 청계동맛집 산앤들:: 캠핑분위기 야와바베큐 정육식당,산앤들 경기 의왕시 청계동 554-5 050714074260 매일 12:00 - 22:00 BreakTime 15:30~16:00 산앤들은 오래전부터 청계동 맛집으로 유명한 펜션형 정육식당이에요 실내 테이블도있고 야외 테이블도 있어서 어디 여행가서 고기꾸워먹는 분위기를 즐길수 있는 곳이에요 점심 저녁 애매한 시간에 갔는데도...,2020. 6. 7.
의왕시청별관-지지대고개-노송지대-서호천-구운초등학교)지금이다걷기여행후기,충무공 이순신 백의종군길3코스(안양 갈산동행정복지센터-지지대고개-노송지대-서호천-구운초등학교)지금이다걷기여행후기 일자 : 2020.7.11 (토)... 의왕시청별관..경기옛길 삼남길3길과 잠깐 겹치는 구간 입니다. 고천리 3.1운동 만세 시위지 사근행궁터 사근행궁 스토리 보드..경기옛길 삼남길...,2020. 7. 13.
인천공항 콜택시 대형택시 파주 고양 일산 포천 오남 호평 평내 다산 하남 위례,해외여행 가시는 분들은 신종 코로나 때문에 여행을 자제를 할수밖에 없다고 하니 이번 사태는 전 세계적으로 큰일인거 갔어요 인천공항 가실땐... 안양시 의왕시 군포시 과천시 인천공항 ~~~6만원대 의정부 노원구 강북구 도봉구 중랑구 강동구 분당 성남 용인 수원 인천공항~~~~~~~ 7만원대 외국에서...,2021. 9. 29.
수도권 사회적 거리두기 2.5단계 2주 연장 및 방역수칙 조정 안내,"주민들의 여행, 출장 등 타 지역 방문 자제 강력 권고 ▸마스크 착용, 차량 내 음식섭취 금지(국제항공편 제외), KTX, 고속버스 등 50% 이내로 예매제한 권고(항공기 제외) 스포츠 관람 ▸무관중 경기 등교 ▸밀집도 1/3 준수 종교활동 ▸정규예배·미사·법회·시일식 등 좌석 수 10% 이내 인원 참여...",2021. 1. 18.
(본문에 이전 삽입 완료 함)<2020년 6월 TV 방송에 소개된 맛집 정보모음으로 본문에...,"031-922-8188 경기 고양시 일산서구 대화동 866 (대화로 130) (달) 은둔식달-상주 묵밥 달인(박연숙 (女/62세) <매협묵집> 손두부, 칼국수 054... 래.방 <남해여행>보리암■ 금산산장(해물파전,나물볶음밥,컵라면,음료 등) ***-***-**** 경남 남해군 상주면 상주리",2020. 7. 3.
구속 56일 만에… 전광훈 ‘집회 참가 불허’ 조건부 석방,이날 오후 경기 의왕시 서울구치소를 나온 전 목사는 “재판부에 신청하면 얼마든지 유동적으로 될 수 있는 조건”이라며 “재판부 허락이 있기... 연락 또는 접촉해선 안 된다는 조건을 달았다. 주거지를 다른 곳으로 옮겨선 안 되며 사흘 이상 여행하거나 출국할 때는 미리 신고하도록 했다.,2020. 4. 20.
(본문에 이전 삽입 완료함)<2020년 5월 TV 방송에 소개된 맛집 정보모음으로 본문에...,"1661-4616 경기 용인시 기흥구 신갈동 533-4 (신정로159번길 52) (달)호두 식빵 달인(이경무 ( 男 / 39세 / 경력 15년 ) <하루베이커리> 041... 031-948-0005 경기 파주시 금정동 774-22 (금정로 18) (생) [택시맛객] 58년 전통 초계국수 8,000원, 닭무침 16,000원 ◈ 산골막국수 02-333-1002...",2020. 6. 6.
13평 목조주택_자연이 숨 쉬는 나만의 쉼터 [청송군],"양양군,경기,수원시,성남시,의정부시,안양시,부천시,광명시,평택시,동두천시,안산시 상록구,안산시,고양시,고양시,과천시,구리시,남양주시,오산시,시흥시,군포시,의왕시,하남시,용인시,파주시,이천시,안성시,김포시,화성시,광주시,양주시,포천시,여주시,연천군,가평군,양평군,충북,청주시,충주시...",2021. 3. 3.
"초보자에게 어울리는 청계산 등산코스를 걷다. (공영 주차장, 원터골 - 진달래 능선...","서울 서초구와 경기 과천시·의왕시·성남시 경계에 있는 산으로 서울을 에워싸고 있는 산들 중에서 가장 남쪽에 위치하고 있다. 청계산이라는... 더 재미있는 이야기들은 인플루언서에서 만나보세요. 아래를 클릭하시면 ""언제나 여행 중.인 기분 좋은 사람""의 인플루언서 홈으로 들어가실 수 있습니다.",2020. 7. 13.
"일산,파주,고양,문산 은 이제부터 일산콜밴 으로 접수 합니다","맘놓고 여행 하세요 가까운 우리동네콜밴소개 강남콜밴,인천콜밴,부천콜밴,안산콜밴, 안양콜밴,군포콜밴,평촌콜밴,산본콜밴, 의왕시콜밴... 동탄콜밴,기흥콜밴,평택콜밴,화성콜밴, 안성콜밴,천안콜밴,아산콜밴,청주콜밴, 서산콜밴,대전콜밴, 서울콜밴,경기콜밴, 충남콜밴,외 남부지역지점 입니다...",2021. 7. 23.
백운호수/청계 맛집(10) : 포가. 베트남 쌀국수. 담백한 맛으로 아이와 먹기에 Good!,여수 여행의 피로가 아직 덜 풀렸는지 지난 주 일요일(8/8) 아침에 눈을 뜨니 오전 9시30분이었다. 그리하여 아침은 간단하게 에그스크램블... 이렇게 맛있게 먹고 계산은 경기지역화폐 코나카드로! 의왕시는 아직 인센티브 지원 예산이 남아 있어서 한달에 30만원씩 잘 충전해서 쓰고 있다. 30만원...,2021. 8. 14.
'제8회 경기정원문화박람회' 시민추진단 모집,"의왕시와 경기도가 공동으로 주관하는 제8회 경기정원문화박람회는 10월 16∼18일 3일간 의왕시 레솔레파크에서 개최되며, '정원으로 떠나는 소풍여행 레솔레파크'라는 주제로 26개소의 다양한 정원을 선보일 예정이다. [기사 더보기]",2020. 2. 17.
아랍 의학의 영향,"청년 시절 살레르노에서 의학을 공부하고 나중에 몬테카시노 수도원의 대주교가 된 알파누스는 1063년 콘스탄티노플을 여행하... 15., 송창호) http://경기-남양주시-부평리-출산후가슴처짐.drkevin-clinic.kr http://경기-남양주시-사능리-출산후가슴처짐.drkevin-clinic....",2020. 9. 3.
"코로나19, 상황별 대응방안 시나리오, 전국보건소 전화번호(출처 : 건강보험공단)",031-8036-6025 경기 용인시 용인시 기흥구보건소 031-324-6911 용인시 용인시 수지구보건소 031-324-8924 용인시 용인시 처인구보건소 031-324-4911 의왕시 의왕시보건소 031-345-3541 의정부시 의정부시보건소 031-870-6001 이천시 이천시보건소 031-635-2400 파주시 파주시보건소 031...,2020. 2. 27.
인천공항 콜택시 대형택시 강원랜드 하이원 거제 거창 고성 김해 남의 밀양 사촌 산청...,해외여행은 해외여행인지라 짐이별로 없다고 아무거나 타고갈순없죠 비행기시간이 있는데 조금이라도 늦게 도착하거나 빠듯하게 도착한... 안양시 의왕시 군포시 과천시 인천공항 ~~~6만원대 의정부 노원구 강북구 도봉구 중랑구 강동구 분당 성남 용인 수원 인천공항~~~~~~~ 7만원대 ● 타요 택시...,2021. 9. 25.
2020년 10월 2주차 경기도 축제 정보와 공연 및 행사 일정,경기도 의왕시 경기정원문화박람회 2020 2020년10월16일 ~ 2020년10월18일 경기도 이천시 이천인삼축제 2020 2020년10월30일... 경기도 파주시 퍼스트가든 국화축제 2020 2020년10월16일 ~ 2020년11월22일 최신 축제와 공연 및 행사 정보는 아래의 국내 여행 정보...,2020. 10. 10.
2020년 제2차 교육기부 진로체험 인증기관 322개 선정 발표-진로체험 인증기관 322개...,"미용·여행 영업·판매 건설 설치 농림 계 금융·보험 사회·복지 의료 디자인 숙박·음식 운전·운송 채굴 정비 어업 권역 경찰·소방·군인... 42 경기 경기북부지방경찰청 교육·법률·사회복지·경찰·소방직 및 군인 지문 채취, 몽타주, 법최면, 법인류학 등 과학수사 체험교실 43 경기...",2020. 12. 31.
공모전)경기정원문화박람회 정원작품공모전,"경기도는 ‘제8회 경기정원문화박람회 정원작품 공모전’을 4월 1일부터 5월 8일까지 진행한다고 밝혔다. 공모전 주제는 ‘정원으로 떠나는 소풍여행, 레솔레파크’로, 천혜의 자연생태보존 도시인 의왕시의 특징과 레(호수), 솔(소나무, 태양), 레(레일)가 함께하는 공원 ‘레솔레파크’의...",2020. 4. 20.
우한 코로나바이러스 감염증 선별진료소 현황,60 의왕시 아가페의료재단 시티병원★ 031-340-2555 61 의정부시 의정부시보건소★ 031-870-6094 62 의정부시 경기도의료원의정부병원(응급실)★ 031-828-5143 63 의정부시 가톨릭대학교 의정부 성모병원 ★ 1661-7500 64 의정부시 추병원★ 031-823-8063 65 의정부시...,2020. 1. 29.
[자동차LED출장장착]마세라티기블리-순정HID타입 제라이트LED전조등장착/교체...,"여행 되세요^^ # 출장장착 가능지역 # 서울인근지역: 동작구, 관악구, 서초구, 강남구, 금천구, 영등포구, 마포구, 구로구,양천구, 강서구, 용산구, 종로구, 서대문구 등등... 서울주변지역: 송파구, 강동구, 광진구, 은평구, 도봉구, 노원구 등등... 경기도권: 과천시, 안양시, 군포시, 의왕시...",2021. 8. 3.
코로나바이러스 현상황 (2020-01-29 출처:질병관리본부KCDC),눈·코·입 만지지 않기 마스크가 없으면 기침이나 재채기할 때 옷소매로 입과 코 가리기 해외 여행력을 의료진에게 알리기!... 216 경기 의왕시 의왕시보건소 031-345-2553 217 경기 의정부시 경기도의료원의정부병원 (응급실) 031-828-5000 218 경기 이천시...,2020. 1. 29.
인천공항 콜택시 용인 수지 죽전 기흥 동천동 죽전 기흥구 처인구 수원 동탄 화성 동탄...,해외여행 가시는 분들은 신종 코로나 때문에 여행을 자제를 할수밖에 없다고 하니 이번 사태는 전 세계적으로 큰일인거 갔어요 인천공항 가실땐... 안양시 의왕시 군포시 과천시 인천공항 ~~~6만원대 의정부 노원구 강북구 도봉구 중랑구 강동구 분당 성남 용인 수원 인천공항~~~~~~~ 7만원대 외국에서...,2021. 7. 9.
인천공항 콜택시 용인 수지 죽전 기흥 동천동 죽전 기흥구 처인구 수원 동탄 화성 동탄...,해외여행 가시는 분들은 신종 코로나 때문에 여행을 자제를 할수밖에 없다고 하니 이번 사태는 전 세계적으로 큰일인거 갔어요 인천공항 가실땐... 안양시 의왕시 군포시 과천시 인천공항 ~~~6만원대 의정부 노원구 강북구 도봉구 중랑구 강동구 분당 성남 용인 수원 인천공항~~~~~~~ 7만원대 외국에서...,2021. 7. 9.
4월 여행. 가볼만한 곳. 봄꽃 개화시기. 철쭉 유채꽃 명소. 아이들과 갈만한 곳,4월 여행. 가볼만한 곳. 봄꽃 개화시기. 철쭉 유채꽃 명소. 아이들과 가볼만한 곳 벚꽃 명소 서귀포 3.23 창원 3.21 부산 3.23 울산 3.24 대구 3.22 포항 3.... 남대천 4월1일 경기 : 의왕시청. 백운호수. 안양충훈2교. 동탄 리베라벚꽃. 부천 도당산. 용인에버랜드. 경기도청. 수원화성. 팔달산. 경희대....,2020. 4. 5.
<할매는 힘이 쎄다>신나는예술여행/연극조명/렌탈,인천.경기.전남.전북.경남.경북.충남.충북.이천.제천.김천.영천.영동.안동.안양.안성.안산.영덕.예천.홍천.고흥.장흥.보성.의성.거창.창원.남원.정읍.봉화.밀양.풍기.해남.광명.부평.부천.의정부.의왕시.남양주.동탄.수원.화성.평택.평창.횡성.강화.강원.고성.정선.속초.정동진.해운대.신안.무안.부안....,2020. 3. 14.
인천공항 콜택시 대형택시 공도 고삼면 금광면 대덕면 미양면 보개면 삼죽면 서운면...,안전하게 여행의 시작은 즐거운 타요택시와 함께해요 365일 24시간 예약상담 중 고객님이 원하는 시간과 장소에서 이동할수 있도록 예약제로... 안양시 의왕시 군포시 과천시 인천공항 ~~~6만원대 의정부 노원구 강북구 도봉구 중랑구 강동구 분당 성남 용인 수원 인천공항~~~~~~~ 7만원대 넓은좌석과...,2021. 10. 11.
경기 삼남옛길 모락산 산길도보,"모락산성 경기도 의왕시 오전동(五全洞)과 내손동(內蓀洞) 일대에 걸쳐 있는 백제시대 산성. 오전동과 내손동 일대에 걸쳐 있는 해발 385m의... ★ 도보 및 여행에 의한 보험은 개별로 가입하세요. ★ 도보 참가 신청은 댓글로만 가능하며 댓글을 수정하거나, 취소글은 새글로 써주세요....",2020. 1. 15.
"천안콜밴]천안,아산,당진,서산콜밴 Vip전용리밴즈7 으로 인천공항 운행","가까운콜밴 강남콜밴,인천콜밴,부천콜밴,안산콜밴, 안양콜밴,군포콜밴,평촌콜밴,산본콜밴, 의왕시콜밴,수원콜밴,수지콜밴,용인콜밴, 분당콜밴,성남콜밴,판교콜밴,오산콜밴. 동탄콜밴,기흥콜밴,평택콜밴,화성콜밴, 안성콜밴,천안콜밴,아산콜밴,청주콜밴, 서산콜밴,대전콜밴, 서울콜밴,경기콜밴,",2021. 7. 1.
하반기 농협은행 5급채용 / 농협은행 자기소개서 문항전체가이드 / 일반 / 디지털...,IT부문(경기 의왕시 소재) 카드 · 중앙본부 카드업무 유관 부서 자금운용/ 기업금융 · 일정기간 영업점 근무 후 행내 인사이동 절차에 의거 유관... 까지 병역필 가능한 자) · 신규직원 교육('20.12월 중 예정) 입교 및 이후 계속근무가 가능한 자 · 해외여행에 결격 사유가 없는 자(외국인의...,2020. 10. 2.
하반기 농협은행 5급채용 / 농협은행 자기소개서 문항전체가이드 / 일반 / 디지털...,IT부문(경기 의왕시 소재) 카드 · 중앙본부 카드업무 유관 부서 자금운용/ 기업금융 · 일정기간 영업점 근무 후 행내 인사이동 절차에 의거 유관... 까지 병역필 가능한 자) · 신규직원 교육('20.12월 중 예정) 입교 및 이후 계속근무가 가능한 자 · 해외여행에 결격 사유가 없는 자(외국인의...,2020. 10. 2.
6/21(월) Daily News Briefing,왕십리역과 경기 안양 인덕원역이 추가된다. 국토교통부는 GTX-C 노선 입찰제안서를 평가한 결과 우선협상대상자로 ‘현대건설 컨소시엄’을... 안산·의왕시 '울고' (연합뉴스) 뉴스보기 출처 : 아이서퍼 캡처 이스타항공 6월 1일(화) 이스타항공 인수전에 하림·쌍방울 등 참여 6월 15일(화)...,2021. 6. 21.
내손동 맛집 비에뜨반미,"의왕시 내손동에서 베트남 여행 기분 내기~ 영상편집 하는법 잘 모르는데 반미 먹는 모습을 베트남 사진에 넣고싶어서 이것저것 열심히... 다양한 종류의 샌드위치가 있고 샐러드와 여러가지 음료까지 판매하네요~ 의왕사랑상품권 가맹점~ 요즘 코로나 때문에 받은 경기지역화폐, 재난지원금 사용할...",2020. 6. 3.
기름때로찌든 하츠 MCH-90S 가정용덕트 분해청소후기,휴일기간 여행을 계획하신 많은 분들이 계실텐데요 사고 없는 안전한 휴일을 보내시길 바라구요 오늘도 행복한 하루 보내시길 바랍니다 오늘은... 과천시/용인시/수원시/안산시/의왕시/양주시/안양시 군포시/김포시/파주시/포천시/여주시/시훙시/고양시 의정부시/남양주시/동두천시/경기도광주...,2021. 9. 18.
