header,contents,date
하남맛집 하남숯불닭갈비 정말 강추합니다,안녕하세요 블로거헤니에요^^ 지난달에 남자친구와 처음으로 하남여행을 했는데용 하남 스타필드에서 쇼핑을하고 뭘 먹을지 고민을 하다가... 본 링크를 클릭해주세용~ 하남맛집 주 소 : 경기 하남시 미사동로40번길 130 하남맛집 전화번호 : 0507-1437-0045 하남맛집 하남숯불닭갈비를 방문하실분들을...,2021. 5. 17.
하남 미사동 털보네바베큐 (야외 바베큐) & 미사 한강 공원,털보네 바베큐 털보네바베큐 031-791-1025 경기 하남시 미사동로 49(미사동 309) 평일 11:00 ~ 22:30 안녕 하세요 썬냥입니다 :) 요즘 날씨가 맑았다 흐렸다... 주차장도 넓어서 편해요 테이블 바닥은 자갈로 되어있어서 정말 어디 근교로 캠핑온듯 한 기분이 들어서 여행따로 안가도 될것만 같았어요ㅋㅋ...,2020. 8. 28.
하남피부관리_휴스파/휴에스테틱/미사피부관리/하남피부샵,"전에 프랑스에 여행갔을때 정말 한국에서 못사는 제품이라면서 이것저것 엄청 구입했었는데 요즘은 올리브영 , 롭스등 다 판매하니까 정보도... 031-795-8885 경기 하남시 미사강변한강로136번안길 10지번망월동 845-6 1층 평일 10:00~08:00 #하남마사지 #하남피부관리 #하남웨딩케어 #하남피부샵 #휴스파",2020. 8. 6.
"하남미용실에서 장마준비! 여름염색, 신데렐라클리닉까지:)","기분탓인가요?ㅎ 제가 신혼여행 갔다온뒤로 머리가 뭘해도 안이뻐서 세령쌤께 갔는데 올해 초부터 장기적으로 클리닉+펌+염색을 잘 계획해주셔서... / 하남미용실, 럭스헤어살롱 매일 am10:00 - pm20:00 (화요일 휴무) 031-795-7132 경기 하남시 미사강변대로 90 ( 풍산동 502 승리타워 5층 503호 ) 항상 믿고...",2020. 7. 14.
하남떡집 야심잔기지떡 어른들께 선물하기 딱좋은 떡!!!,아이들을 데리고 하하파 없이 혼자 왔더니 할게 너무 많아서 포스팅은 저녁에 해야할것 같아요~ 야심잔기지떡 하남미사점 경기 하남시 미사강변한강로158번길 64 http://naver.me/FHnRRiF 야심잔기지 하남떡집 지난주말 여행을 떠나기전에 친정을 들였거든요~ 항상 고민을 하는데요~ 하하맘의...,2020. 1. 14.
하남막국수 / 강릉해변막국수 여름엔 역시 시원한 막국수~,음식도 뜨거운 음식은 노노~ 시원한 음식이 자꾸 생각나요~ 얼마전 여행에서 다녀온 막국수가 생각나서 하남에도 검색해보니 오래된 메밀막국수 맛집이 있더라구요. 강릉해변메밀 막국수 경기 하남시 서하남로 541 031-792-0209 매일 10:00 - 21:30 하남광주향교 인근에 위치 주차장은 식당앞과 뒷쪽에도...,2020. 6. 22.
[210624-국내] 생각보다 가까워...동네 뒷산에 숨은 숲 놀이터들,"(경기 하남시 망월동 328-2, 070-4114-3500) ■ 하남의 나무고아원이 버려진 나무들을 되살린 공간이라면 경기 용인시의 동천유아 숲 체험원은... (경기 용인시 수지구 동천동 136-4, 031-324-3354) ■ 강원도 홍천을 여행 중이라면 홍천국유림 내에 있는 삼마치 유아 숲 체험원를 눈여겨보자. 삼마치는...",2021. 6. 24.
[하남맛집] 검단산 겨울등산 후 방태막국수에서 만두전골 먹음 되겠네~,그리고 식사 후에 바로 양옆에 카페린도 있고 스튜디오카페 루시다도 있꼬! 식사->카페 경로도 아주 최고!! 차로 이동 한번 더 안해도되고 넘 좋은듯해용! 다들 한번쯤 겨울 신메뉴 드시러 가보셔유 촉새가 추천함돠 b 방태막국수 하남점 경기 하남시 창우동 248 2층 031-794-4922 평일/주말 13:00 ~ 20:00,2020. 1. 30.
백화점은 지나가고 대세는 트렌디한 복합 쇼핑몰 BEST,주말여행을 다니곤 하죠. 다음으로 많이 찾는곳이 바로 복합쇼핑몰이 아닐까 합니다. 최근 복합 쇼핑몰이 각 지역에 하나둘씩 생겨나면서... 스타필드 하남 https://www.starfield.co.kr/hanam/main.do 경기 하남시 미사대로 750 스타필드 하남 1833-9001 매일 10:00 - 22:00연중무휴(이마트 트레이더스...,2020. 10. 19.
"[경제주간지/매경이코노미]2021.4.14~2021.04.20(코인, 불타오르네)","경기 하남시에서 시범운영을 거친 뒤 향후 성과에 따라 서비스 지역과 공급 차량 대수를 늘려갈 예정이다. 'ESG 정보 공시 의무화' 사장님도 규제로... 이 밖에도 K조선 전 세계 발주량 절반""싹쓸이"" 가정식부터 오마카세까지 한우 플렉스 ESG 관련기사, 코로나에 지친 사람들의 보복 여행 등 다양한...",2021. 4. 30.
"[온더보더] 하남스타필드 멕시코, 남미음식 얼티밋화이타",온더보더 경기 하남시 미사대로 750 스타필드 하남 1층 영업 시간 매일 10:00 - 21:00 Last Order 20:00 안녕하세요. 재간둥이 안나예요 하남 스타필드에갔다가 맛집 검색해서 가게된 멕시코 전문 음식점 온더보더 대기 예약하고 기다렸는데 손님이 금방 빠지더라구요 온더보더 메뉴와 가격은 사진...,2020. 9. 12.
[하남고기국수/미사고기국수] 제주둘레국수,알차더라구요~ #제주도여행 에서 #고기국수 에 매력을 느끼신 분들에게 추천드립니다~!!! '제주둘레국수' 영업시간 매일11:00 - 23:00 브레이크타임 평일15:00 - 17:00 라스트오더 22:30 주소 경기 하남시 아리수로 570 1층 1054호 연락처 050713322493 #하남고기국수 #미사고기국수 #하남맛집 #미사맛집 #하남국수...,2020. 7. 1.
하남 스타필드 명품 구찌 루이비통 등 일렉트로마트 탐방 운영시간,"주소 : 경기 하남시 미사대로 750 스타필드 하남 하남 스타필드 명품관 하남 스타필드 해외 유명 브랜드 영업시간 10:30 ~21:00 롱샴 , 마이클코어스... 하남 스타필드 맛집 미식여행 잇토피아 / 스무드킹 , 앤티앤스플레즐 , 폴바셋 더 서퍼클럽 , 돈차를리 , 핏제리아오 , 파스타 그루브 , 올댓미트...",2020. 6. 24.
아쿠아필드하남 워터파크 즐기는 방법,길 경기 하남시 미사대로 750 스타필드하남 3층 4층 항상 그렇듯 아침에 눈을뜨면 다수의 오픈마켓 사이트에 올라와있는 오늘의 핫딜을 습관처럼... 짝꿍 여행의 목적지 50%는 항상 특정사이트 덕분에 게릴라성으로 어느날 갑자기 다녀오게되는 경우가 많습니다. 하남 아쿠아필드 주차팁 워터파크...,2021. 6. 14.
[하남/미사맛집] 미사횟집 미가수산,통우럭탕은 처음이었는데요 진짜 통으로 들어간건 처음 먹어봤는데 살이 꽉찬게 맛있고 배불렀어요 공기밥하나 뚝닥하고 어머님이랑 둘이 완죤 배부르게 먹고 왔네용 이상 미가수산에서 촉남이었습니다 미가수산 경기 하남시 아리수로 570 070-7622-6026,2020. 1. 3.
하남미사맛집 베풀장어 무항생제 장어로 제대로 몸보신한 하남장어집,"속초 여행 후에 하남 들려서 먹구온 하남미사맛집 베풀장어 입니당 속초 관련 포스팅 링크도 남겨뒀으니 참고하세요!!! https://blog.naver.com/dbwjd1279... 주소 : 경기 하남시 미사강변중앙로 212 1층 Tel : 070-4060-1532 건물 지하 주차가능 / 화장실 건물이용 그럼 다들 일주일의 마무리, 일요일 잘 보내시구요...",2020. 7. 12.
기분전환을 위해 방문한 망월동네일샵 네일듀오,여행을 다닌다거나 액티비티한 취미를 가지지 않은 저는 평소에 스트레스를 해소하거나 기분전환을 할 때 네일샵에 가서 간단한 시술로 기분전환을 하는데요. 최근에 너무 바빠서 스트레스가 많아졌던 저는 평소에 단골로 방문하던 네일샵에 예약을 하고 방문합니다. 네일듀오 경기도 하남시...,2020. 1. 12.
하남 캠핑식당 :: ‘만돈만리’ 야외바베큐 즐기기,"만돈만리 경기 하남시 검단산로 244 평일/주말 11:30~22:00 *평일 브레이크타임 14:30~17:30* 단체, 주차, 포장, 예약, 반려동물 동반, 유아놀이시설 생일을 맞이해서 친구들과 함께 보낸 시간! 뭘 할지 고민하다 여행 느낌이 나는 캠핑식당에 다녀왔다!! 하남에 위치한 만돈만리 친구가 찾아서 우리에게...",2020. 6. 10.
[하남/데이트] 정글비 보드게임카페,정글비 경기 하남시 미사강변중앙로 198번길 35 르보아리버 2층 평일 14:00~24:00 주말 11:00~24:00 주차 가능 사람은 결국 만나야 합니다 서로의... 게임하다가 툭 쳐서 쏟아지기 쉬운데 이런 소소하게 실용적인 부분이 좋아용 첫 번째 게임은 티켓 투 라이드 유럽 외국여행 못 나가는 아쉬움을 게임으로...,2020. 5. 5.
"스몰웨딩, 돌잔치가 가능한 서울근교 '슈슈몽드' 직접다녀온 후기","망할 코로나 때문에 외출을 할수가 없다보니 캠핑도 못가고 딱히 여행하는 곳도 없었다보니 정말 오랜만에 포스팅 하는 중! 오랜만에 포스팅 할... 슈슈몽드 위치 : 경기 하남시 미사동로40번길 17835 연락처 : 0507-1425-0073 스몰웨딩, 돌잔치 등 대관이 가능한 곳이었고 전화로 살짝 여쭤봤을때...",2020. 9. 15.
미사 치킨 / 노랑통닭 미사1호점 우리가족 단골 치킨집!!,광복절 연휴에 다들 여행가시던데~ 저희는 집콕만 하다가 너무 심심해하는 아이들을위해 근처 놀러스케이트장에서 신나게 놀고 저녁먹으러 치킨집 갔어요. 저희 가족 치킨취향이 각양각색인데 유일하게 노랑통닭은 넷다 좋아한답니다.ㅋ 노랑통닭 미사1호점 경기 하남시 미사강변북로30번길 17 031...,2020. 8. 17.
미사강변도시 맛집 그리드채플린 런치 딱 좋아! (+ 저녁엔 미사 펍으로 ),"저녁엔 특별한 수제맥주도 판매하는데 밤에 오면 조명도 달라지고 해외여행하다가 들른 펍처럼 미사 펍 분위기가 또 색다를 것 같다. 한 쪽에는... 그리드채플린 미사점 경기 하남시 미사강변동로 85, 힐스테이트에코미사 3층 031-795-6202 12PM - 01AM (라스트오더 23:40) *런치타임 ONLY평일 12PM - 14:30PM",2020. 5. 15.
하남 마방집,"코로나여파로 해외여행도 못가고.. 국내여행도 조심스러운데 말이죠.. 운전하다가 얼굴이야 팔뚝, 손등까지.. 발갛게 타면서 여름휴가 다녀온줄... 마방집 하남 한정식 맛집 마방집 경기 하남시 하남대로 674 http://naver.me/GT7LnEF 맛집 소개하면서 못먹는거 나열하는 나란 녀성.. 유니크로 넘겨주쎄요...",2020. 7. 3.
한강야경 보기에 좋은 남양주 카페 : 어나더 쥬얼리 (루프탑 추천),"남양주 여행 마지막편입니다. 팔당에서 집에 돌아가는 길, 석양이 너무 이쁘더라구요. 친구가 ""석양이쁜 카페 없어?""라고 물어보고, 전 그냥 대충... 통유리라 건너편이 시원하게 잘 보이더라구요 (건너편은 하남시) 좌석에 앉으면 이런 모습입니다. 일대 다른 가게들보다 지대가 훨씬 높아서...",2020. 7. 12.
서울 근교 피크닉 * 미사리 경정공원 물과 산 잔디 힐링 ♡,031-790-8883 경기 하남시 미사대로 505 이날은 참 하늘이 맑고 아름다웠다 나름 남양주 쪽 #다산생태공원 부터 시작해서 양평쪽도 그렇고 국내여행은 많이 다녔다고 생각했는데 아직 멀었나보다 서울 근교 피크닉으로 하남 미사리 경정공원은 첨이다 :) 사실 여기는 미사조정경기장 이다 무한도전...,2020. 6. 12.
<하남맛집> : 백년불고기 & 쌈밥 후기,<하남맛집> : 백년불고기 & 쌈밥 후기 전화번호 & 주소 : 031-796-9180 / 경기 하남시 창우동 307-2 1층 영업시간 : 10:30~22:00 (브레이크타임 16:00~17:00) 매주... 여행 및 데이트 코스로 딱딱이다. =) 가게 바로 옆에는 백년곰탕이 있는데 여기는 13년이나 된것이라고하니 웬지 장인의맛이 나올듯... 여튼...,2020. 4. 22.
미사 유가네닭갈비 추천 : 내가 먹어본 유가네 중에서 전국 제일 맛집 지점!,"유가네닭갈비 미사역점 경기 하남시 미사강변동로 127, 경서타워 2층 031-792-6121 *평일 11AM - 22PM (브레이크타임 15-17PM) *주말 11AM - 22PM *매주 화요일... 춘천여행 때 갔던 닭갈비집이랑 비교했을 때에도 여기 닭갈비가 더 맛있다고 할 정도다! 다 먹었으면 #볶음밥 은 필수지.. ♥️ 볶음공기도 1인분에...",2020. 3. 29.
딸은 쿠키를 굽고 엄마는 네일을 굽다(?)~생애 최초의 젤네일 시도~,어디 여행도 못가고 집콕하느라 우울하신 분들은 미사 지역에 사신다면 지난 주에 오픈한 네일샵 <네일공간>에 가서 봄맞이 네일케어 받아보세요~~ 미사 파출소 버스 정류장 앞 스타벅스랑 한스 카페가 입점해 있는 효성해링턴타워오피스텔 건물 상가 1층에 있답니다~^^ 주소: 경기 하남시...,2020. 4. 8.
빠숑님과 함께 부동산 여행을 떠나다! 부자의 지도 다시 쓰는 택리지 by.빠숑 김학렬,"빠숑님의 목소리가 들리는 것 같아 여행하듯 떠나는 역사, 부동산 여행 청담 이중환의 지리서인 택리지에서 아이디어를 가져와 책 이름을 지었다.... 경기도 광주는 원래 우리의 생각보다 훨씬 큰 지역이었는데 현재의 서울 강남구, 강동구, 송파구, 경기도 성남시, 하남시를 모두 아우르는 거대한...",2021. 2. 5.
"하남카페, 정원이 너무 예쁜 흠커피",흠커피 위치 ⇒ 경기 하남시 서하남로 418번길 30 영업시간 ⇒ 매일 11:00-22:30 전화번호 ⇒ 031-795-0168 매장 1층 테이블이 다 널찍하게 떨어져 있어요... 않았는데도 여행온 느낌이였고 너무 좋아하는 엄마보니 뿌듯했다 내 카페리스트 중 정원카페 원탑으로 저장될 흠커피 위치는 요기 ↓↓↓↓↓↓↓,2020. 7. 26.
서울 근교 실외 골프연습장 위례 밀리토피아 골프연습장 후기 및 이용 tip,02-3400-0700 경기 하남시 위례대로2길 20 1층 ⏰ 매일 06:00 - 21:00 매월 첫째 주 월요일 정기휴무 밀리토피아 외관 오래된 건물이지만 외관을 깔끔하게... 여행 호황기만 해도 골프 관련 패키지가 많았을 텐데요 야드가 아닌 미터 기준이라니 겨울에도 연습하기 좋은 3층 실내 퍼팅 연습장이에요...,2021. 1. 20.
"[Covid-19] 신규확진 525명, 이틀째 500명대… 휴일 영향으로 확진자 감소",특히 가정의 달을 맞아 가족 만남·여행 등 이동량 증가로 인한 대확산에 우려가 커지는 상황이다. 아울러 지역 내 변이 바이러스 확산... 경기 하남시의 음식점 관련 확진자도 12명 늘어나 총 69명이다. 부천시의 운동시설 및 교회를 중심으로 한 확진자 역시 3명 증가해 총 37명으로...,2021. 5. 8.
미사 닭갈비 맛집 매콤한 닭갈비에 볶음밥 유가네닭갈비,"유가네닭갈비 미사역점 ☎ 031-792-6121 경기 하남시 미사강변동로 127 경서타워 205호 유가네닭갈비 미사역점 평일 11:00 - 22:00 / Break time 15:00~17:00 단체석, 주차, 무선 인터넷, 유아시설(놀이방), 지역화폐(카드형), 지역화폐(모바일형), 제로페이 http://yoongane.co.kr 요즘 닭갈비에 빠져서 닭갈비가 자꾸 눈에...",2020. 9. 6.
망월동 네일샵 맘에드는 디자인이 많은 곳 015네일샵,"이번 여행전이 방문한 망월동 네일샵은 015네일샵. 아무래도 이달의 아트가 금액적인 면에서 이득이라 많이들 요 방법을 하시던데.. 015네일샵의 이달의 아트가 다양한 구성으로 되어있어서 고르기가 좋았음. 망월동 네일샵 015네일샵 주소 : 경기 하남시 미사강변한강로 334번길 35, 1층 전화번호 : 010...",2020. 2. 14.
"[하남 스타필드 맛집] 후쿠오카 함바그 / 후쿠오카 함바그 메뉴, 가격 정보 / 후쿠오카...",하남 스타필드 맛집 <후쿠오카 함바그> 경기 하남시 미사대로 750 지번신장동 616 지하1층 (하남스타필드 지하1층) / 매일 11:00 - 21:00 매번 고양 스타필드만 다녀오다가 하남 스타필드는 정~~~말 오랜만에 다녀왔습니다! 하남이 더 크다던데 (맞나요?) 사실 전 잘 모르겟더라구요~ ㅋㅋㅋㅋ 하남...,2020. 8. 4.
미사헬스 레이디짐! 여성전용헬스장이라 부담없어서 좋아요!!,본격적으로 여름을 위해 준비를 해야겠다는 생각을 갖기 시작하면서부터 지금까지 열심히 운동을 하고있어요~ 코로나가 아직 끝나지 않아서 여행... 주소: 경기 하남시 미사강변동로84번길 39 7층 전화번호 : 031 796 3449 미사헬스 레이디짐은 내부가 정말 깔끔해요^^ 그리고 코로나 방역관리도...,2020. 6. 22.
"미사역cgv 하남 코다리찜 맛집 : 영양만점 오로라전골, 코다리와능이버섯미사","부르봉님과 속초 여행을 다녀오는 길에 미사에서 영화를 보고 저녁식사로 무얼 먹을까 고민을 하다가 여름이니 보양음식을 먹어야겠다는... 미사역 맛집, 하남 코다리찜 맛집 코다리와능이버섯미사 경기 하남시 미사강변동로 121 더랜드시티 211호 망월동 1093-3 영업시간 매일 10:00 - 22:00...",2021. 6. 20.
[하남미사네일] '네일에끌려' 하남 젤네일 추천!!!,가족여행 가서 보여줬더니 다들 칭찬해주심요! 예쁘고 세련되게 제 손을 변신시켜주신 네일에끌려 원장님 감사합니다~ 입소문 난 이유가 있었어요♡ 네일에끌려 투명 명함투척!! :) http://www.instagram.com/nnonn0322 네일에 끌려 인스타 네일에끌려 주소 : 경기 하남시 미사강변동로 73 (망월동 1117...,2020. 2. 3.
:: 미사 에그토스트 맛집 :: 에그박스에서 간편하게 한끼 해결!,"오랜만에 포스팅 하는 것 같아요 헤헤 지난 주에 가족끼리 여행갔다가 돌아오는 길에 너무 피곤하고 배고픈데 또 저녁은 먹어야하고 밖에서 먹고... 에그박스 하남미사본점 경기 하남시 미사강변중앙로 190 1층 159,160호 #미사에그토스트맛집, #미사에그버거맛집, #에그박스",2020. 7. 23.
"(하남맛집) 미사강변맛집 추천! 숯불닭갈비전문점 ""친목계""","안녕하세요 오늘은 미사맛집 친목계 소개할게요 #하남닭갈비,#하남맛집,#미사강변맛집,#하남스타필드맛집,#조정경기장맛집,#하남모임장소,#하남데이트장소 경기 하남시 미사강변한강로334번길 28 매주 월 휴무 화~금 16:00 ~ 23:00 주말 12:00 ~ 23:00 여기가 바로 미사맛집 친목계 입구입니다 친목계...",2020. 7. 26.
대치스크린골프 레슨까지,"대치스크린골프 레슨까지 좀처럼 사그라들 기미가 보이지 않는 코로나, 해외여행이나 모임 등 활동에 여러가지 제약이 생기며 자연스레... 준비중 경기도 하남시 미사강변중앙로 158번길 27 이화주차타워 9층 대치스크린골프 더스윙은 세계 최고의 골프 장비로 손꼽히는 트랙맨4 장비로 레슨...",2021. 8. 26.
[결혼준비/웨딩촬영] 섬 스튜디오 _ 웨딩스튜디오로 결정!,*아직 폰카 무보정인데도 퀄리티가 최고ㅜㅜㅜ 섬스튜디오 정보 주소 : 경기 하남시 미사동로40번길 33-9 (강남 차량이동 30분) 영업시간 : 09:00 - 19:00 (월요일 휴무) 전화 : 02-518-5654 블로그 : http://sumstudio.co.kr/ 한줄평 하나의 마을 같은 배경맛집 스튜디오,2020. 5. 26.
"하남 미사 속눈썹연장 못할땐 속눈썹펌, 비엘아드망에서!","ㅋ 속눈썹연장을 하면 이래저래 불편한 직업이라 이렇게 여행이나 행사등 좀 특별한 날 외에 속눈썹연장은 하지 못하고 살았었는데 속눈썹펌을 해보고 나선 그 아쉬움을 충족중. 미사 속눈썹펌 비엘아드망 주소 : 경기 하남시 미사강변중앙로 198번길 29, 미사푸르지오시티B동 210호 전화번호 : 010-8021...",2020. 2. 21.
"하남 미사 맛집 대박소망수산, 하남수산물시장에서 가성비 회포장!",최근에 강원도 여행 다녀오며 회를 원없이 먹고 왔는데 먹고나니 괜히 더 땡기는 그 느낌... 저만 그런가요? 회포장하러 강원도까지 일부러 가기는... 곳을 찾았답니다 :) 영업시간 매일 9:00~21:00 위치 경기 하남시 하남대로 1043-20 1층 대박소망수산 *주차 가능 전화번호 031-791-5446 ***-****-**** ***-****-****,2020. 7. 16.
민주당 분들 우리 이낙연 대표님께서 큰 절 올리시는 분이 누구인지 아시나요? 대한민국...,"이재명 경기도 지사님이 대통령 되시든 이낙연 전 대표님이 대통령 되시든 이승만 악마 박정희 일본군인 전두환 악마를 일본인 이명박 우상화... 이재명 지사 ""이낙연 비방 경기도 유관기관 구성원 직위해제 처분"" [출처] 경기신문 https://www.kgnews.co.kr/news/article.html?no=657639 "" "" #이재명지사_이낙연...",2021. 8. 1.
신세계 사업내용,"※ 백화점 매출 현황 (단위 : 조원) 구 분 2020년 2019년 2018년 매출액 27.4 30.4 30.0 신장율 ▲9.9% 1.4% 2.2% - 자료출처 : 통계청 (3) 경기변동의 특성 백화점은 내수산업으로서 수출입이 차지하는 비중이 매우 낮으며, 국내 경기변동, 특히 민간소비 동향에영향을 미치는 소득, 금리, 인플레이션, 성장률...",2021. 5. 7.
<경성 순대국> 하남 순대국/ 순대국 맛집/ 맑은 순대국/ 경성 순대국 본점/ sso_tasty,남자친구의 추억여행. 따라가기! 남자친구가 어릴적 아버님과 함께 다녔던 단골집이었다는 #순대국 집을 찾아가보기로 하였다! 경성 순대국 경기 하남시 신장1로9번길 48 매일 09:00 - 21:00 주말데이트에 왠 순대국집이냐하겠지만 남자친구의 추억이 깃든곳을 꼭한번 같이 가보고 싶었다! 정말...,2020. 1. 13.
[하남/미사] 전주 유명 콩나물국밥이 미사에도!!! '전주 현대옥',지난번 전주여행 때 먹었던 게 바로 요거였는데 ㅋㅋㅋ 오징어 사리도 한 개 시켜서 오빠랑 반반 나눠서 먹었어요~ 캬~ 넘넘 시원하고 칼칼하게... 주소 : 경기 하남시 미사강변중앙로 174 (망월동 1105 해링턴타워 1층 105호) 영업시간 : 매일 24시 영업 전화번호 : 031-8028-0580 #미사콩나물국밥...,2020. 4. 21.
[하남맛집] 칼국수와 수제비가 만나 조화로운 하남 팔당 원조 칼제비 칼국수.,상호 : 팔당원조칼제비칼국수 전화번호 : 031-792-4566 주소 : 경기 하남시 검단산로 348(창우동 4-9) 영업시간 : 층마다 다름 2층 10:30~20:40분(우리가... #검은잠비 #DK잠비 #맛집투어 #맛집여행 #푸드투어 #푸드파이터 #여행맛지도 #하남맛집 #팔당맛집 #하남팔당맛집 #팔당원조칼제비칼국수 #칼국수맛집...,2021. 1. 8.
미사강변카페 이퀄센세이션,암튼 그런줄만 알아유~ 이퀄센세이션 카페 zzin추천카페 이퀄센세이션 경기 하남시 미사강변중앙로111번길 7 http://naver.me/xLRA4IA 위치는... 그냥 메면 심심할거 같아 태국여행에서 사온 허리끈?!을 둘러줬더니.. 초큼 더 멋스러워 졌다며.. 흐믓해서 찍었어요. 이퀄센세이션카페 다시 카페포스팅으로...,2020. 8. 1.
컬처人 초대석 하남미사 최고의 이태리 식당 오스테리아 308 | 요리하는 성악가 베이스...,"오스테리아 308 주소: 경기 하남시 미사강변중앙로 173 리버에비뉴 3층 예약: 070-8834-6673 영업시간: 화~토 11:30 - 21:30, 일 17:00 - 21:30 (월요일 휴무)... 미사갈만한곳 #하남미사갈만한곳 #하남미사여행 #클래식해설 #클래식연주 #클래식음악 #성악가#오스테리아 #미사리이태리 #미사데이트",2021. 5. 4.
경기도 광주 가볼만한 4곳 여행,"남한산성 남한산성은 행정구역이 경기도 광주시, 성남시, 하남시 걸쳐 있습니다 남한산성은 국가 사적 제 57호 이며 백제의 시조인 온조의 왕성이었다는 기록이 있고 나당전쟁이 한창이던 신라 문무왕12년(672)에 한산주에 쌓은 ""주장성"" 이라는 기록도 있다고 합니다 조선 인조 4년(1626)에...",2021. 5. 28.
(본문에 이전 삽입 완료함)<2021년 6월 TV 방송에 소개된 맛집 정보모음으로 본문에...,"영업:16:30-22:00 경기 하남시 덕풍동 426-4 (신장로 137) (생) [택시맛객] 도토리로 만든 푸짐한 한 상 차림 ◈ 나눌터 다람쥐 세트 4인 73,000원 (임자탕 선택 시) 76,000원 (흑임자탕 선택 시) (도토리 전, 묵, 쟁반국수, 탕수육, 비빔밥, 임자탕 or 흑임자탕) 도토리 냉묵밥 9...",2021. 7. 5.
미사고기국수 맛집 제주둘레국수하남미사점,제주의 맛을 이제는 미사에서도 맛 볼 수 있고ㅠㅠㅠ 요즘처럼 여행이 어려운 시기에 옛 추억돋게 하는 메뉴 선택이었어요. 거두절미 저는... 비오는 날 아마 저는 여기 오지 싶습니다 ㅎ재방문 의사 1000%의 별 다섯개 맛집 완전 추천드려요 제주둘레국수하남미사점 주소는 경기 하남시 아리수로...,2020. 6. 30.
