header,contents,date
하남카페 르빵드비 서울근교 추천카페,기능장셰프가 직접 구운 유기농빵 주소 : 경기 하남시 서하남로 436 전화번호 : 031-795-1005 자차로 방문을 했고 주차 발렛 직원이 있어서 주차자리 안내를 해주시고 있었다. 하남카페 르빵드비 영업 시간은 오전 9:30~오후 22:00 까지였다. 1층은 주문 및 제빵소 2층 카페 3층 카페 그리고 루프탑으로...,2020. 3. 4.
국내 가볼만한곳 하남 당정뜰 메타세콰이어길 국내 조용한 여행지,자전거 여행 코스 1. 하남위례강변길 하남 한강 자전거길(하남위례길2코스) 2. 하남 당정뜰 3. 덕풍천 4. 하남 메타세콰이어길(하남스타필드 맞은편) 5. 산곡천 6. 하남 미사맛집 미사경정공원 맛집 정가네밥상 1. 하남 위례 강변길 하남 한강 자전거길-하남 위례길 2코스 경기 하남시 미사동 이곳은...,2021. 7. 16.
경기하남/미사리조정경기장]가족나들이하러 가볼까요?,"떠나는 #서울근교여행 #경기하남 에 위치한 #미사리조정경기장 이네요 #미사경정공원 이라고도 나오네요 #조정경기장입장료 는 없답니다 대신에 #미사리조정경기장주차비 로 퉁~~~ 승용차 4,000 소형 2,000 하남시민은 1,000 입장료 없는게 마음에 쏙 드네요 ㅋㅋㅋ... 주차비 내시고 바로 좌회전하셔서...",2020. 10. 17.
미사역네일 만족스러웠던 무니네일 이달의아트,안녕하세요 셔니입니다 :) 저번주에 여행을 간다고 기분을 내기위해 새로 네일을 하러 네일샵을 다녀왔는데요. 제가 아무래도 이번에는 네일을... 키키 미사역네일 무니네일 영업시간 & 위치 영업시간: 월~토 09:00 - 19:00 위치: 경기 하남시 미사강변중앙로 157 3층308-1호 저는 미사역에서 멀면 어쩌지?...,2021. 7. 4.
경기도 문화의 날 <하남 시내버스 타고 문화여행 가자> 5월 숲속의 클래식 산책 상세 안내,"경기도 문화의 날 <하남 시내버스 타고 문화여행 가자> 30-5번 버스 노선을 따라 펼쳐지는 ‘일상에서 만나는 문화예술’ 4월부터 6월까지 매달 말 교육, 공연, 즐거운 축제로 하남시민과 함께합니다 ♡ ♬ 5월 - 숲 속의 클래식 산책 ♪ 하남의 명산 ‘검단산’에서 펼쳐지는 힐링 공연!...",2021. 5. 14.
하남 애견카페 / 하남 애견 동반 카페 별빛개냥 가족 나들이,별빛개냥이 위치한 곳은 '경기 하남시 미사강변중앙로 168 리버테라스 1층'으로 마시호수공원을 바라보는 방향으로 매장이 위치합니다.건물 지하에는 주차장도 있어서 카페 이용 시 주차도 가능합니다. 별빛개냥은 반려견 놀이방 이용도 가능하고 호텔링은 물론 사료 간식과 반려동물 용품도...,2020. 2. 9.
경기 광주... 봄날 나들이 하기 좋은 곳 리뷰!,"경기 광주시는 성남시, 하남시 등 많은 곳들과 인접해 있다. 봄날 나들이하기에 좋은 곳들이 광주에는 꽤 많이 있다. 경기 광주하면 뭐니 뭐니해도... 자쿠지가 있는 곳도 있어서 가족여행에도 딱일 듯 싶다. 내가 먼저 조만간 묵어봐야 하는데...ㅎㅎ 봄날 나들이 가기 괜찮은 경기 광주 한옥마을!...",2021. 4. 19.
강동구 데이트장소 추천! 드까르멜릿 첼시가든 분위기 좋은 야외테이블까지,마지막으로 드까르멜릿의 첼시가든 위치는 하단 지도에 첨부합니다~ :) 경기 하남시 동남로524번길 24 02-483-0555 화-일 10:30 - 22:00 매주 월요일 휴무... 강동구분위기좋은레스토랑 #하남시분위기좋은레스토랑 #강동구스몰웨딩 #하남시스몰웨딩 별별 일상을 다 기록하는 블로그 #별별로그 _ [일상 여행...,2021. 9. 1.
춘군동 맛집 하남 지구에서 온 아구해 맛있는 해물탕 해물파전 메뉴,멀리 못 가는 요즘 여행하는 기분 납니다. 춘궁동 맛집 지구에서 온 아구해 춘군동 맛집 지구에서 온 아구해는 하남 춘군동에 위치해있어요.... 경기 하남시 서하남로390번길 5 0507-1368-5252 / ***-****-**** #춘군동맛집 #지구에서온아구해 #하남맛집 #하남해물찜 #하남아구찜 #춘군동밥집 #춘군동아구찜...,2021. 9. 22.
하남 스타필드 온더보더 예약상품권으로 30% 할인받아서 가자!,오늘 기록하고자 하는 여행은 하남 스타필드 멕시칸레스토랑 [온더보더] 입니다. 함께 가보실까요? [온더보더 스타필드하남점] 주소: 경기 하남시 미사대로750 영업시간: 11:00 - 22:00 라스트오더 21:00 (스타필드 영업시간까지 운영) 제 블로그를 자주 찾아주시는 분들은 제가 스타필드 하남점에 자주...,2021. 8. 8.
하남삼겹살 맛집 제주 돼지 '제주덕구',"주소:경기 하남시 덕풍로65번길 25 102호 시간: 평일 15~22시,주말 13~22시(b.t 15:30~16:30) 전화번호:050-71434-5592 주차가능 하남삼겹살맛집 제주덕구는... 또 여행가고싶은 그런 느낌 매장 내부는 깔끔하고 청결해요 생긴지 얼마되지 않은 매장이라 테이블이며 의자까지 깨끗하답니다❗ 등받이가 있는...",2021. 9. 24.
[하남] 주렁주렁 다녀온후기!!,"이렇게 여행지도에 도장을 다찍으면 예쁜 주렁주렁 마스코트 캐릭터뱃지를 선물로 받아왔어요 ㅎ ㅎ 하남 주렁주렁 경기 하남시 하남유리온로 120 경기 하남시 신장동 612 평일 12:00 ~ 18:00, 입장마감 17:00 주말 12:00 ~ 19:00, 입장마감17:30 주차가능(무료주차) 매월 첫째,셋째 월요일 휴무 공휴일에는...",2021. 8. 25.
[덕풍동맛집]하남고기집하면 역시 제주덕구,경기 하남시 덕풍로65번길 25 102호 • 영업시간 : 평일 15시~22시/주말 13시~22시 주말 브레이크타임 15시30분~16시30분 • 연락처 : 0507-1434-5592 하남 제주덕구는 가게 앞 5대 정도 주차 가능해요 상가빌라 1층에 위치한 제주덕구는 흔하지 않은 인테리어로 발길을 멈추게 해요 코로나라 맘편히 제주...,2021. 9. 11.
"원어민과 즐겁게 노는 하남 미사 영어 키즈카페 ""헤븐랜드""","외국여행도 힘든데 아이와 이렇게 영어를 재밌게 접해보는 기회가 있는것! 너무 좋았던 거 같아요~ 헤븐랜드 전화 - 0507-1327-9110 주소 - 경기 하남시 미사강변대로34번길 90 메인프라자 403, 404 ⏰ 영업시간 10:00 - 18:00 수업시간 2시간 주차편함 (지하주차장) #하남키즈카페 #미사영어놀이터...",2021. 9. 15.
"[경기도 하남] 카페 웨더 Cafe Weather “발리인줄, 해외여행 카페로 가요”","카페 웨더 (Cafe Weather) 시간: 10:00 - 22:00 (연중무휴) 주소: 경기 하남시 검단산로 228-8 스타필드 하남에서 차로 3분거리, 12월 개통예정인... 내가 Pick한 공간은 바로 이곳 발리로 해외여행 온 기분을 한 껏 느꼈다. (늦은 6시쯤 방문했더니 사람도 별로 없고 저 큰 공간 빌린 줄 알았다.)...",2020. 10. 5.
"하남맛집 이화막국수 비빔 막국수, 콩국수!",▶이화막국수 위치 주소 경기 하남시 서하남로 450 전화번호 031-793-5123 영업시간 매일 11:00~21:00 위치는 하남방면 고골 낚시터 지나서 우측에 있어요. 퇴근할때 항상 이쪽으로 퇴근해서 자주 봤는데 드디어 왔네요. 항상 운전할때 식당들 지나면 메뉴 보면서 오! 맛있겠다 먹고싶다 생각을 자주 하는 것...,2020. 7. 11.
"하남 미사 술집, LP 그루브 (추억여행 데이트 꿀잼)","하남 미사 술집, LP 그루브 (추억여행 데이트 꿀잼) 안녕하세요! 오늘은 또 뭔가 재밌는 곳이 없을까하여 여기저기 찾아보다가 발견한 LP그루브!... LP 그루브 음악들으면서 데이트하기 좋은 곳! 주소 경기 하남시 미사강변중앙로 220 우성미사타워 703 운영시간 18:00 ~ 02:00 일요일 휴무 주차 가능",2020. 7. 27.
자전거 여행 ● 한강 본류 첫 번째 다리 팔당대교 라이딩 ●,자전거 여행 ● 한강 본류 첫 번째 다리 팔당대교 라이딩 ● 팔당대교(1986~1995. 18번째)는 경기도 하남시 창우동과 남양주시 조안면을 잇는 다리로 약 1km 정도이다. 여름 휴가철과 가을 단풍철의 교통난 해소에 큰 도움이 되지만 주말만 되면 교통체증으로 몸살을 앓고 있다. 하지만 하남에서...,2020. 3. 26.
"[위드 스토리 아동미술학원/ 감일동 미술학원/ 감일 초등미술] 쥬니프로반 수업 ""캠핑""","안녕하세요 위드 스토리 아동미술학원 감일점입니다 =D 요즘은 부모님과 캠핑을 가는 친구들이 참 많은데요 =) 아마 코로나로 인해 쉽게 여행 다닐... 재료를 탐색하고, 자유롭게 발상하고, 발표 및 토론의 스토리텔링을 통해서 우리 아이들의 스토리를 함께 들어주세요^^ * 상담 및 문의 * 경기 하남시...",2021. 9. 7.
하남 미사 카페 소진담 (경기도카페),"com/_pgxdxfj (카카오톡 플러스친구 검색 Sojindam ➡️ 홀케이크예약상담문의) 별리유의 여행정보 -경기도카페, 하남미사 소진담- ✔️ 영업시간 : 매일... 하남미사점(경기 하남시 미사강변중앙로111번길 20 101호) -르빵드비(경기 하남시 서하남로 436 1,2,3층) -미사장(경기 하남시 미사동로40번길 176)...",2021. 4. 14.
[하남&남양주 데이트] 하남 스타필드 / 덕소숯불고기 본점 / 스타벅스 리버사이드...,"하남스타필드로 출발했습니다~~ 스타필드 하남점 위치: 경기 하남시 미사대로 750 스타필드 하남 영업시간: 매일 10:00 - 21:00 전화번호: 1833-9001... ☺ 맛있는 음식도 먹고, 여행에 온 것 처럼 예쁜 풍경도 볼 수 있어서 너무 좋았습니다! 연휴기간이나 주말에 놀러가고 싶을 때, 당일치기로 서울근교...",2021. 9. 19.
생생정보통 1m 통갈치해물조림 유별난 맛집 연매출 10억원 시래기 코다리 갈비찜...,"주소 : 경기 하남시 미사강변동로 121 더랜드시티 211호 <미스터Lee의 사진 한 컷, 대한민국> 미스터 Lee와 다시 떠나는 음식 여행 <부부별곡> 귀농 23년 차 알밤 부부의 달콤한 인생 상호 : 웃골농원 주소 : 충청남도 부여군 내산면 녹간로99번길 13-8 촬영 도움 이석희, 전옥화...",2021. 8. 31.
"벚꽃은 지고, 분홍빛 겹벚꽃 만발한 하남시 미사리 조정경기장",이렇게 길 양 옆으로 쭈-욱 피어있어요. 꽃이랑 사진 몇 컷 찍어보구요 ㅎㅎ 날씨가 흐려서 좀 아쉬웟지만 너무 좋았어요☺ 이번주에 겹벚꽃이 가장 한창일 것 같아요! 미사리 조정경기장으로 바람쐬러 나와보세요 #겹벚꽃명소 #서울근교여행 #벚꽃명소 #겹벚꽃 #미사리조정경기장 #하남가볼만한곳,2021. 4. 23.
남양주 물의 정원 / 팔당원조칼칼제비칼국수 :: 서울근교 여행,남자친구가 네잎 클로버도 찾았어요 팔당원조칼제비칼국수 경기 하남시 검단산로 348 팔당역쪽으로 와서 칼제비 먹었어요! 얼큰칼제비 2인분에 고기+김치 반반만두 먹었어요! 칼제비 기다리면서 만두 먹는데 매운 김치만두 정말 매웠어요 그래도 맛있어서 냠냠 칼제비는 식탁에 적혀있는...,2020. 11. 22.
한강뷰 하남 루프탑 카페 소진담,"하남 루프탑 카페 소진담 경기 하남시 미사동로40번길 178-42 031-791-4959 매일 10:00 - 22:00 단체석, 주차, 포장, 무선 인터넷, 남/녀 화장실 구분 http... 멀리 여행 온 것 같아요 서울 근교에 데이트하기 너무 좋은 카페에요 :)♡ 1층 입구 베이커리샵 앞쪽 테라스에 테이블로 채웠네요 오 좋다~ 요즘은...",2020. 9. 24.
<우리나라/여행정보/전국>전국 핑크뮬리 스팟 리스트 및 지도,#핑크뮬리 #전국핑크뮬리 #핑크뮬리명소 #핑크뮬리스팟 #언택트여행 #야외여행지 #전국여행 #우리나라가볼만한곳 #전국가볼만한곳 전국... 미사리조정경기장 공원 하남시 미사대로 505 인천 드림파크 인천 서구 거월로 61 평택 소풍정원 경기 평택시 고덕면 궁리 424-25 안성 팜랜드 경기...,2020. 10. 20.
☆ 휘쌤 1:1 피아노 개인레슨 합니다 ☆,"개념임으로 여행을 자주 다니시거나 바쁘신 분들도 부담없이 유연하게 수업받기에 용이합니다) <예시> 30분 1회당 15000원 / 60분 1회당 30000원 가능지역 서울 노원구, 중랑구, 광진구, 송파구, 강동구 경기 구리시, 하남시, 남양주시 (+ 보드게임 수업도 가능합니다) 레슨문의 - 아래 댓글 또는...",2020. 12. 13.
[하남시 덕풍동 망월동 풍산동 남양주시]살림정리 침대폐기 장농폐기,"좋은 날씨지만 우리 시국이 시국이니 만큼 조금만 더 참자구요 ㅠㅠ 요즘 SNS보면 자꾸 여행 분위기 조성하는 글들이 은근 올라오던데 사람 약... 강동구, 하남시, 성남시, 분당시, 용인시, 남양주시, 과천시, 의정부시, 구리시 의왕시 시흥시, 경기광주시, 안양시, 수원시 가정폐기물 가정폐기물수거...",2020. 5. 31.
서울 근교 팔당댐 카페 루프탑 하남 소진담,주소 : 경기도 하남시 미사동로40번길 178-42 (하남 스타필드 차량으로 10분 거리에 위치) 전화번호 : 031) 791. 4959 영업시간 : 매일 10시 ~ 21시 주차... 곧 다시 여행을 떠날수 있을 것 같은 설레임에 빠르면 올 연말즈음엔 해외여행을 갈수 있겠다 싶어 신났는데.. 최대 확진자수 갱신을 하며 매일 천명이...,2021. 7. 11.
(주) 명문주택건설 수도권 땅값,비행기 여행으로 가야하는 제주도같은 섬나라는 사람의 발길이끊겨서 땅값이 많이내려갔다고봅니다 지난 1~2년간 사람 발길이 끊기기도햇고요... 289% + 경기 하남시 1.572% + 경북 울릉군 1.274% + 부산 해운대 1.214% + 표를 접해보면 이러한데요 경기도권 내에 가장큰 변동률은 (1.572%)로 경기도...,2021. 8. 19.
하남나들이_ 카페엘림,"남자들끼리의 여행을 떠났거든요 그래서 전 자유부인 일단 수다부터 오래 했어야했기에^^ 주차 편하고 아늑하고 조용한 카페를 가야했어요. 검색해보니, 아직은 상가주차장이 무료인 곳이 있더라구요 오~^^ 바깥에 나름 테라스 테이블도 있네요 카페 엘림 경기 하남시 미사대로 410 미사강변...",2021. 6. 28.
하남 일식집 추천 153e참치!,중요한 모임이나 약속일 경우 시크릿하게 룸에서 식사를 하면 좋을 거 같아요 무엇보다 일식집 느낌 가득한 인테리어 소품들이 해외 여행을 하고... ㅎㅎ 경기 하남시 미사강변동로 72 SB비즈타워 2층 0507-1311-9102 매일 11:30 - 22:00 매주 일요일 휴무 #하남맛집 #미사역맛집 #미사강변맛ㅈ비...,2021. 8. 23.
하남 카페웨더 발리여행 왜 가요 여기가 발리인걸,How is the Weather 발리여행은 아직 한번도 가보지 못했지만 여기가 발리라고 해도 믿을법한 하남 카페웨더였습니다. 차타고 스타필드도 오분이면 가서 스타필드 가는길에 들러서 잠시 쉬었다 가도 좋을 듯해요 :) 주소 경기 하남시 검단산로 228-8 전화 070-7792-6186 영업시간 매일 10:00 - 22:00 *연중무휴,2020. 9. 9.
"20210602 생방송 투데이 (2836) 여행본능,섬-창선도, 화덕통구이 족발, 화덕치즈불족발...","여행본능, 섬 - 초여름, 붉은 빛으로 물드는 섬 '창선도' 삼천포대교 경남 사천시 대방동 남해바래길 탐방안내센터 경남 남해군... 엘레판트 경기 하남시 미사강변중앙로111번길 22 (풍산동) / 031.796.0255 5호선) 미사역 8번 출구 834m 화-일요일 11:00-21:00 (브레이크 타임...",2021. 6. 2.
<하이쥬> 카페웨더 하남브런치 하남카페,요즘 같이 여행가기 힘든시기에 카페에서 휴양지 느낌을 느낄수 있답니다. 카페웨더 경기 하남시 검단산로 228-8 영업시간 매일 10:00 - 21:00 연중무휴 입구부터 벌써 느낌있죠?! 이렇게 포토존이 준비되어 있어요! 앞에 딱 바다가 펼쳐져야 할 것 같은 포토존 여기서 사진한번 찍고 가야겠죠? 일단...,2021. 8. 19.
하남카페 이국적 분위기의 카페웨더,ㅎㅎ 여행 못가는 요즘 대리만족을 느낄 수 있는 카페를 다녀와서 알려드리고 싶어서 포스팅을 하려고 해요~ 카페웨더 주소 : 경기 하남시 검단산로 228-8 연락처 : 070-7792-6186 영업시간 : 매일 10:00 - 21:00 연중무휴 매일 10:30 - 19:00 브런치 매일 12:00 - 17:00 파스타 (화요일off) 카페웨더는 주차장이...,2021. 8. 31.
"삶, 일상, 경제 등 3.","공원 여행, 디제이덕 DOC와 함께 춤을 등등 평범한 일상, 유쾌한 음악들, 할아버지의 낡은 시계, 레삼삐리리, Down by the Salley Gardens 등... 53% 미사강변 센트리버, 경기 하남시 / 84.89㎡ (95000) 1011위 / 상위 6.53% 서초한일유앤아이주상복합, 서울 서초구 / 84.89㎡ (95000) 1012위...",2021. 9. 8.
위례 꽃집 엠피오리 다녀온 후 화사해진 우리집(feat. 데일리 플라워로 굿),"#위례꽃집 #예쁜꽃집 #엠피오리 엠피오리 경기 하남시 위례대로 190 효성해링턴 163호 *** - **** - **** 영업시간 : 매일 10:30~20:30 (단, 일요일은 오전영업 및 사전예약자만 픽업 가능) 요즘 졸업식 시즌이라 아침에 부리나케 꽃집에 들르기 힘들다면 미리 예약해서 전날 찾아다 놓거나 바로 픽업만 해갈 수...",2020. 2. 12.
"하남 여행, 미사리조정경기장 핑크뮬리","미사리 조정경기장 경기 하남시 미사대로 505 주말 09:00 - 19:00 평일 09:00 - 18:00 연중무휴 주차요금 - 대형 : 10,000원 - 소형 : 4,000원 - 경차 : 2,000원 하남 시민의 경우 1,000원에 가능하며, 주민 센터에서 주차감면 스티커를 발급 받아야 가능 입장료 무료 안녕하세요◡̈ 2니에요ღ'ᴗ...",2020. 10. 10.
[하남 가볼 만한 곳] 커플 타로 궁합으로 색다른 데이트를 해봐요_버찌와 타로 여행,버찌와 타로 여행 경기 하남시 미사강변동로 121 더랜드시티 315호 / ***-****-**** 찾아가는 길 하남미사역에서 도보로 5분 거리입니다. 지하철은 곧!!! 8월 8일에 개통되니까 어떻게 가야 하는 걱정근심은 주머니 속으로 쏘옥~ 교통이 편하기 때문에 하남미사 데이트 코스로 부담이 없어요! 주차 주차는...,2020. 7. 31.
[하남미사맛집][일품훠궈]나만 알고싶은 가성비 좋은 무한리필 훠궈맛집 일품훠궈,"구분 경기 하남시 미사경변동로 127 경서타워2층 사장님도 무진장 친절하시고 청결 상태가 너무 좋아서 자주 가게 되는 곳이에요. 여러 훠궈 집을... 훠궈 +꿔바로우까지 무한으로 즐길 수 있는 하남미사 맛집 ""일품훠궈"" 한번 다녀와 보시길❤ 하남미사 훠궈무한리필 아마 이날도 여행 갔다가...",2021. 9. 6.
"벚꽃엔딩, 미사리 조정경기장 하남 나무고아원, 한강 자전거도로","하남나무고아원-아이들과 가볼만한곳, 산책하기 좋은 곳 힐링여행지 경기 하남시 미사동 608 하남 나무고아원 향했는데 수년 전에 갔을 때와는 너무도 다른 모습에 깜짝 놀랐습니다. 이쪽에 이렇게 큰 산책하기 좋고 경치 좋은 곳이 있다는 걸 미처 몰랐거든요. 나무고아원하면 처음에는 고아원...",2021. 4. 5.
[피렐리] 월드투어 파트너 - 피렐리 X 스캇미첼튼 스폰서십 (피제로벨로튜블러...,M783) 031-852-0972 의정부시 주원바이크 경기 의정부시 평화로 483 청석빌딩 031-837-0213 하남시 ENTER BIKE 경기 하남시 미사강변한강로224번안길 24 102호 031-795-8118 하남시 벨로라인 경기 하남시 춘궁로35번길 34 2층 온라인사업부 ***-****-**** 인천 남동구 지니바이크 인천...,2020. 3. 31.
[하남시 배알미동 덕풍동 초일동 송파구]가구정리,"오늘 저녁은 이 곱창으로 대신 했답니다 ^-^ 예전에 대구여행 갔을 때 안지랑 곱창골목을 보고 엄청난 충격에 빠졌었어요, 전 평소에 내장(?) 요리를... 강동구, 하남시, 성남시, 분당시, 용인시, 남양주시, 과천시, 의정부시, 구리시 의왕시 시흥시, 경기광주시, 안양시, 수원시 가정폐기물...",2020. 1. 10.
팔당 드라이브 코스 : 하남 칼국수 추천 파주닭국수 하남미사점,"#국내여행 #팔당드라이브코스 안녕하세요~ 여행하는 공인중개사, 여행블로거 찌야 입니다. 얼마전 팔당 드라이브 코스 갔다가 출출~하여 주차되는 하남 칼국수 를 찾아보다 알게된 곳인데 넘~ 맛있어서 기억에 남네요. 파주닭국수 하남미사점 경기 하남시 미사강변중앙로 226 미사우성르보아파크...",2021. 8. 27.
경기지역화폐 사용처는 어디? 경기도민 1인당 10만원 지급 관련 정리,"<경기지역화폐>가 궁금하니 정리 한번 해보려고 한다. 여행블로거도 비상시가 되니까 일상 글을 많이 올리게 되네요. 경기도가 코로나19로 위축된... 수원시, 고양시, 용인시, 성남시, 부천시, 화성시, 안산시, 남양주시, 김포시, 광주시, 광명시, 군포시, 하남시, 오산시, 이천시, 양주시, 구리시...",2020. 3. 25.
하남맛집 기가막힌 아구족아구찜 하남점,"임신중이다보니 올해는 여행 대신 집콕~ 머물고 있었어요. 가까운 하남에 들러 산책 후 하남맛집 아구족아구찜에서 저녁을 먹었어요! 오픈한지... 아주 배불리 잘 먹고 왔습니다 :) 하남맛집 해물찜, 아구찜을 찾고 계신다면 꼭 방문해보세요~~ 아구족 아구찜 하남점 주소 : 경기 하남시...",2021. 8. 19.
"풍산동 맛집으로 급부상하고 있는 무한리필 훠궈 뷔페, 태향원.","여행은 가지 못하고, 꽁꽁 묶여서 사는 요즘 시기... 너무 우울하고 답답한 마음이지만? 대신 외국 음식을 찾아 먹으러 다니면서 여행 간 느낌을... 태향원 (미사점) 주소 : 경기 하남시 미사강변대로34번길 100 미사타워 203호 영업시간 : 매일 12:00 - 23:00 사실 서울을 벗어나 신선한 공기를 마시고...",2020. 4. 30.
"[하남/망월동] 도심 속 휴양지를 맛 볼 수 있는 곳, 반치앙마이",쌩(?)여행이다! 를 느낄만한 곳은 동남아인 듯 해요ㅋㅋ 그래서 다녀온 #반치앙마이 이미 맘카페에서 핫한 곳으로 난리였어요ㅋㅋㅋ 맘카페맛집 = 엄마들이 아는 맛집 = 찐맛집 이거 ㄹㅇ 반치앙마이 경기 하남시 미사강변중앙로 157 리버테라스 1층 화-금 11:00 - 21:00 토-일 12:00 - 21:00 브레이크타임...,2021. 8. 31.
하남찐맛집 태국음식점 반치앙마이 분위기 예술,반치앙마이 주소: 경기 하남시 미사강변중앙로 157 리버테라스 1층 주차: 주차장 지하에 있는데 매우 협소함 전화번호: 0507-1434-2190 휴무일: 매우 월요일 일단 이것만 쳐다보고 있어도 힐링 되는 느낌은 뭐죠? 여행 안간지 너무 오래 되어서 그런지... 이런 풍경만 보고 있는데 힐링 되는 기분이 들어서...,2021. 9. 9.
경기 하남 미사지구 인테리어후 청소 및 줄눈시공,경기도 하남시 미사지구 인테리어 후 청소 줄눈시공 #청소파파 오늘도 인테리어 후 청소로 돌아왔습니다. 아! 그리고 오늘은 줄눈시공 작업도... 탁 트인 뷰가 어디 여행온듯한 기분이 들게 해주네요. 깨끗한 창 유지하신다면 매일 여행온 기분이겠어요. 주방의 모든 수납장 및 렌지후드를 비롯해...,2021. 10. 5.
소액투자자를 위한 발로 찾는 부동산 투자법. 여행하면서 현장에서 답을 찾아봐요!,"지금 바로 떠나라, 여행! 젊은시절 자신이 한 여행은 단지 관광만이 아니라, 해당 지역들에 대한 투자의 안목을 키워준 스승이었다 투자의... 두 예정 역 주변에 있는 다세대와 하남시 도심 권역 안에 들어와 있는 나머지 역들 주변 매물 중 전세가가 높은 급매물에 관심을 기울일 필요...",2021. 6. 10.
남한산성의 가치를 발견하는 역사문화여행 남한산성 행궁 탐방기(feat. 문화해설사),"현재 경기도 광주시, 성남시, 하남시에 걸쳐있습니다. 병자호란 당시 인조가 피신해 47일간 항전한 것으로 유명한 곳입니다. 남한산성 행궁은 완공... 그냥 왔다 가시지 마시고 해설사와 함께하면 더 뜻깊은 여행이 될 것입니다.”라고 이야기하며 해설을 마쳤습니다. 세계유산, 그 가치를 함께...",2020. 11. 3.
전국 핑크뮬리명소 및 서울 경기 인천 핑크뮬리 개화소식,경주보문단지와 마찬가지로 몇 번이나 가려했으나 수도권역 거주 직딩줌마는 남부지방으로의 여행이 그리 용이치 않다. 현재 대저생태공원의... 잔디광장과 칠면초 가신 김에 시흥 갯벌생태공원의 모든 것을 즐겨보시길~ ●하남 미사리 조정경기장 공원 ✔주소: 경기 하남시 미사대로 505...,2020. 10. 9.
