header,contents,date
야탑역 맛집 분당 이자카야 슌 한잔 캬~,지금 시기가 시기인지라 손님간 자리를 멀리 떨어뜨려 앉게 해주셨어요 가게 분위기가 꼭 일본에 여행간 느낌 ^^ 기본 안주는 알새우칩이랑 삶은콩... 오는길이 넘 아쉬웠네요 한병 더 마실걸 그랬나 ^^;; 야탑역 맛집 분당 이자카야 슌 한잔 생각나는날 또 찾아갈듯 ^^ 슌 경기 성남시 분당구 야탑동 342-1,2020. 9. 3.
[성남맛집/분당맛집] 더 맛있은 족발 보쌈 야탑본점,더 맛있는 족발 보쌈 야탑본점 더 맛있는 족발 보쌈 야탑본점 경기 성남시 분당구 야탑로105번길 12-1 1층 영업 시간 : 매일 14:00 - 02:00 강릉여행을 갔다가 인천으로 돌아오는 길에 너무 막혀서 저녁시간이 훌쩍 되어버렸는데 메뉴를 생각하다가 친구와 보쌈이 먹고 싶어서 주변을 찾다가 가게 된 더...,2020. 7. 17.
[분당카페] 카페블레,진짜 여행온것 같은 기분을 주는 풍경이었다 고작 분당인데 이렇게 좋을일인가? (코로나때문에 여행을 못가서 더 그렇게 느끼는거일수도)... 왔다 좀만 더 더워지면 이런 예쁜 풍경은 보이지 않고 에어컨 앞에 딱 붙어 있을테니 그전에 많이 봐놓기 031-702-5660경기 성남시 분당구 안양판교로828번길 188,2020. 5. 11.
[성남 한옥 카페] 새소리물소리 / 자연속에서 즐기는 휴식,"멋진 곳에서 즐거운 시간 보내고 왔습니다. 성남 한옥 카페 새소리물소리 위치 : 경기 성남시 수정구 오야남로 38번길 10 영업 : 매일 11:00 ~ 22:00 / 명절 휴무 메뉴 : 대추차 10,0 / 단팥죽 11,0 / 팥빙수 11,0 #성남한옥카페 #새소리물소리 #서울근교카페",2020. 10. 2.
2TV생생정보 2021년 10월 7일 방송,주소 : 경기 성남시 분당구 문정로 140번길 9-1 ☎ 연락처 : 031-702-5222 <이PD가 간다> ■ 금강을 따라 떠나는 여행 - <부여 대추 수확> : 해살이 농업회사법인 주식회사 - 주소 : 충청남도 부여군 규암면 나복리 870-5 ☎ 연락처 : *** **** **** <엄마는 슈퍼우먼> ■ 34년 전통 제면소...,2021. 10. 7.
분당 안경 <글라스바바> 미금점! 청소년 딸아이 안경했어요 0-0,"테가 얇아서 가볍고 여행갈 때 들고다니기 너무 좋아서 자주 쓰는 선글라스가 진열되어 있어 반가웠어요 ^^ 안경알, 가격표 정찰제라 가격표... 전화 031-716-3907 주소 경기 성남시 분당구 성남대로 165 천사의도시 오피스텔지번금곡동 161 천사의도시상가 1차 115호 영업시간 매일 09:30~21:00 안경 맘에...",2020. 9. 17.
[ 판교카페 / 판교데이트 ] - 해외여행에 목마른 사람들을 위한 베브릿지 판교H스퀘어점,#판교카페 #판교데이트 #베브릿지 #베브릿지판교H스퀘어점 베브릿지 판교H스퀘어점 < 판교데이트 베브릿지 판교H스퀘어점 위치 > 경기 성남시... 최소 여행했었던 나에게 요즘너무... 여행욕구가 솟구친다 ㅠㅠ 여행가고싶다 ㅠ.ㅠ 이런 생각들을 하시는 분들이 오기에 정말 좋은 판교카페 베브릿지...,2021. 4. 28.
율동공원 맛집 <쿠치나디까사> 이탈리아 가정식! 가족 외식장소로 추천 :),"이탈리아 음식을 먹으니 어서 코로나19 끝나고 여행의 자유를 만끽하고 싶네요. 이번해에 이탈리아 여행 가려고 했는데... 아쉬움에 이탈리아... 031-705-7866 경기 성남시 분당구 문정로 136 (율동 323-19) 매일 11:00 - 21:5016시~17시 브레이크타임, 오더마감 21시20분 단체석, 주차, 포장, 예약, 무선 인터넷...",2020. 9. 16.
성남단대풀잎문화센터 라탄소품공예 미니여행가방/마크라메ㅣ/경기성남분당광주판...,#라탄소품공예 배우기# 라탄을 엔틱한 오랜지빛으로 염색을 한 후 요리조리 짜서 이런 깜찍한 여행가방이 미니로 탄생했어요~^^ 요즘... 5578 경기도 성남시 중원구 금광동 4461번지 2층 (8호선 단대오거리역 1번 출구 직진 2분거리 대로변 2층) * 성남단대지부가 보다 넓고 편리해진 시설로...,2020. 7. 10.
분당 가족모임_ 분당 맛집 좋구먼 이매점,분당 가족모임 부모님 생신이나 상견례자리에 좋은 분당 맛집 좋구먼 이매점에 다녀왔어요 ~ 위치와 외관 주소: 경기 성남시 분당구 이매로89번길 7 분당 가족모임 하기 좋은곳이라고 해서 좋구먼 이매점에 왔답니다 !ㅎ 앞에 넓은 주차장도 있는 단독 건물이예요 ~ 엄지를 들고 있는 귀여운 동상도...,2020. 4. 8.
테슬라 모델Y 전기차 시승 라이드나우로 지금 바로 가능!,"확실히 깔끔하면서도 개방감도 좋고, 내부 공간이 넓기 때문에 차박은 물론 장거리 운행, 여행 등 다양한 상황에서도 이용하기 좋은 전기차... 지하5층 경기 - 분당 : 성남시 분당구 황새울로326, 서현빌딩 1층 - 하남 : 하남시 미사강변대로34번길 120, 미사강변P타워 3층 대전 - 대덕구 신탄진로 490...",2021. 7. 23.
미금역 속눈썹 제이영래쉬에서 팔랑팔랑 연장,속눈썹 연장을 쭈욱 이어서 하다가 한달가량 쉬고 (도대체 왜때문에 이렇게 바쁜지 아돈노와이..) 가족여행가기 전에 러시안볼륨 서타일로 아주... 오시는길 주소/예약/영업시간 미금역 속눈썹 제이영 래쉬 매일 09:00 - 22:00 경기 성남시 분당구 성남대로 165 (천사의도시1오피스텔 상가동 지하 A-10호)...,2020. 11. 9.
"분당와인바,레스토랑_콘비노, 다시 찾고 싶은 곳","괜히 분당레스토랑, 분당와인바로 12년동안 유지해온 것이 아닌 것 같아요 #분당와인바 #분당레스토랑 콘비노 ***-****-**** 경기 성남시 분당구... 스페인여행을 추억했어요 우리 둘만의 프라이빗한 공간에서 누구의 방해도 없이 좋은 시간을 보낼 수 있는 콘비노 레스토랑 중간중간 직원분들이...",2020. 1. 9.
맛집 판교 운중동 한식 맛집 [시골여행],"시골여행 경기 성남시 분당구 운중동 55-4 경기 성남시 분당구 하오개로 366-6 031-703-7888 매일 11:00~21:00 구정, 추석 휴무 전용주차장 무료주차 가능 안녕하세요~ 클로버입니다.~ 오늘은 판교 도서관에 갔다가 운중동에 있는 한정식집에 다녀왔어요^^ 입구에 넓은 주차장이 있어서 주차하기 정말...",2020. 10. 28.
[경기 분당] 타임 포 타이 - 분당 타이 맛집!,장소: 타임 포 타이 위치: 경기 성남시 분당구 문정로144번길 5 운영시간: 매일 11:00 - 22:00 연중 무휴 수원에 살 때는 주변에 좋아하는 맛있는... 정말 언제쯤이나 해외 여행을 할 수 있을지 ㅠㅠ 풋팟퐁커리 얼마 전에 분당에 다른 유명한 태국 음식점에서 풋팟퐁커리를 시켰다가 완전 실망해서...,2020. 9. 20.
하이마트 오리점 그랜드 오픈 행사 쇼핑 후기,많은데 여행 인플들에게 인기 있는 드론도 있습니다. 홍대 매장에서 본 DJI 드론이나 영상 제품들도 한 곳에 디스플레이 되어 있어 구경하는 재미도... 지원해준다고 하더라고요 경기 성남시 분당구 구미로5 031-714-5388 본 포스팅은 롯데하이마트로부터 소정의 고료를 지원 받아 작성되었습니다.,2021. 5. 27.
분당 고양이카페 정자동 더킹덤오브사바나,"작지만 분위기좋았던 멋진냥이들이 많은 ""더킹덤오브사바나"" 주소:경기 성남시 분당구 정자일로 146 132호 영업시간:매일 11:00 ~ 22:20 노키즈존이에요 주차:지하주차장 주차가능(이용시 2시간무료) 입장료:5천원 이용시간:평일 2시간 주말 1시간30분 여자친구와 가평에 놀러갔다가 집에오는길에...",2020. 5. 25.
분당 와인바 판교 와인 백현동 술집 제이비에프 JBF,"경기 성남시 분당구 백현동 593-4 네이버에 적힌 제이비에프 영업시간 : 화/수/목 19:00 - 00:00 금/토 19:00 - 01:00 참. 백현동 카페거리가 둘로 나뉘잖아요 제이비에프는 쿠숑, 브라우니70 쪽 아니라 그 반대편에 있어요. 전에 레트로나파이 있던 쪽이요~ 6시 조금 넘어서 백현동 카페거리에...",2020. 7. 5.
분위기 좋았던 분당 철판요리,날씨가 좋은 요즘 드라이브 겸 여행을 다니다 분당 철판요리에서 힐링하고 왔어요. 퀄리티 높은 요리에 와인까지 곁들이며 제대로 힐링하고 온 곳이라 소개해볼께요. 올리브그릴 주소 : 경기 성남시 분당구 운중로146번길 15-3 전화번호 : 031-8016-6341 영업시간 : 매일 11:30 ~ 22:00 브레이크타임 : 15:00 ~ 17...,2021. 9. 29.
"분당네일, 미금역네일, 용인네일 문제성손발톱전문 네일팜","무엇이든 한 분야에 오랫도록 유지한다는것은 다른말이 필요없겠죠~~~ 실력,서비스,가격 너~~~~무 좋습니다~ 네일팜 경기 성남시 분당구 돌마로 67... 많이 챙기셨으면 좋겠어요~~☺☺ 전 일년에 한번 나만의 힐링여행을 가고있어요~~ 열심히 일하고~ 내스스로 보상도 해주고 이런삶이 행복 아닌가요~~",2020. 8. 5.
성남 카페 추천 도심속 한옥카페 새소리물소리,같은게 있다니 운치있고 신기하다 여기는 단체석같음 성남 한옥카페 음료가 좀 비싸긴 하지만 한번쯤 또 와보고싶긴하닫 ㅎㅎ 새소리물소리 031-723-7541 경기 성남시 수정구 오야남로38번길 10 #성남카페 #한옥카페 #새소리물소리 #성남카페추천 #전통카페,2020. 11. 9.
내 아이와 도서관으로 여행 가요~,도서관으로 여행을 떠나 보시는 건 어떠세요?^^ 아이들을 책의 놀이터로 먼저 안내해 주세요~ 함께 가볼 만한 어린이 도서관 소개해 볼게요!! 현대 어린이책 미술관 이미지 출처 - 현대 어린이책 미술관 홈페이지 주소 : 경기 성남시 분당구 판교역로 146번 길 20 운영시간 : 매일 10:00 - 19:00...,2021. 4. 18.
임장답사기 @ 경기 광주 둘러보기 (광주-초월-곤지암),"개요 광주시는 서울시 동남쪽에 있으며 경기도 중앙에 위치하고 있다. 면적은 430.96㎢에 이르며, 동쪽으로 여주시, 이천시, 서쪽으로 성남시, 남쪽으로 용인시, 북쪽으로는 한강을 경계로 남양주, 양평군, 하남시와 마주한다. 동부의 태백산맥에서 서쪽으로 빗살같이 뻗은 여러 산줄기 가운데...",2021. 2. 23.
(힐링여행: 한성욱행정사)경남 합천 오도산자연휴양림,"서울에서 일부러 찾아가기엔 좀 멀지만 남쪽여행을 계획하신다면 한번 가보시면 좋은 곳입니다. 경남 합천에 위치한 오도산자연휴양림... 주소:경기 성남시 분당구 대왕판교로 645번길, 경기창조경제혁신센터(9층) * 지하철 : 신분당선 판교역 1번출구에서 도보 5분 소요 한성욱...",2021. 4. 11.
[동원대학교] 경기/수도권에 위치한 청소년 수련시설 등 관련 시설은 무엇이 있을까?...,"오늘은 경기도 성남시와 수도권에 위치한 청소년과 관련된 시설입니다. 청소년 시설은 청소년들의 흥미와 욕구를 조직적으로 프로그램화하여... 유스호스텔은 청소년수련시설로, 숙박 체제에 적합한 시설 / 설비와 부대 / 편의시설을 갖추고 숙식 편의 제공, 여행 청소년의 활동 지원 등을 주된...",2021. 1. 15.
야탑중고명품매입 빠르고 쉽게,예전에는 해외여행을 다니는 것이 제가 돈 쓰면서 기분 전환을 하는 방법의 하나였는데요. 요즘에는 분기별로 명품백 구입을 하는 것이 기분전환에... 계신다면 저처럼 판매해보는 것도 좋을 것 같아요. 업체명: 분당중고명품루샤 주소: 경기 성남시 분당구 서현로 210번길 1 4층 5호 전화번호: 070-8046-1872,2021. 10. 8.
서현 맛집 인디안커리에서 이국적인 식사,인도 인도~스러운 분위기와 인테리어로 마치 여행 중 현지 식당에 밥먹으러온듯한 느낌~~~ 아 빨리 잘 정리되고 정말로 인도로 여행가면 좋겠어요... 서현 맛집 인디안커리 고고~! 서현 맛집 • 서현역 맛집 인디안커리 주소: 경기 성남시 분당구 황새울로360번길 21 전호: 0507-1325-2177,2020. 9. 7.
살찌고 싶어 ? 샤이바나 미국남부가정식,AD) 경기 성남시 분당구 동판교로 177번길 25 Time)11:00 - 21:30 BK)15:00- 17: 00 금액에 따라 차등 주차할인적용 주차: 1만원~3만원 1시간 무료 3만원~5 만원... 그럼가면 안돼 판교 아브뉴 프랑 미국으로 여행한번 가볼까 ? SHY BANA 친구가 외국에 오래살아서 가정식을 먹자 하여 이곳으로 결정을했따 . 오늘...,2020. 8. 11.
서울 근교 드라이브 : 분당 더컬럼스 갤러리카페 - 스코틀랜드 사진전,"스코틀랜드 여행이야기도 듣고 오셔요~ 혹, 작가님을 못 만난다고 해도 일부 작품에 큐알(QR)코드가 있어서 사진 설명도 들을 수 있으니 이어폰도 잊지 마시고요! 스코틀랜드 애피타이저 저자 김우진 출판 좋은땅 발매 2019.04.24. 김우진 작가님 블로그 더컬럼스 갤러리카페 : 경기 성남시 분당구...",2020. 9. 9.
[성남 수내동/분당 밀키트&샐러드 카페] 24시 무인 프리미엄 신선식품 '영영상점...,"수내4호상점 경기 성남시 분당구 내정로 172 상지상가빌딩 1층 108호 매일 00:00-24:00 영영상점은 수내역 1번출구에서 771m, 파크타운 근처에... 깔끔한 포장에 맛도 괜찮아서 여행이나 캠핑갈 때 사가지고 가면 좋을 것 같아요. 떡볶이 밀키트에는 대구 칠성시장 납작만두가 기본으로 들어있다는데...",2021. 10. 9.
"판교 회식┃육즙 팡팡 판교 고기집, 화포식당 판교점",먼길 여행은 못해도 맛여행은 하자싶어 언제먹어도 맛있는 삼겹살을 먹기로 했습니다 몇해전 처음 화포식당 이용 후 삼겹살의 신세계를 경험해... 주소 : 경기 성남시 분당구 대왕판교로 660 2층 240호 - 전화 : 0507-1461-2929 - 영업시간 : 평일 11:00 - 22:00 Break time 15:00~17:00 토요일 15:00 - 22:00 일요일...,2020. 10. 12.
백현동카페거리: 올덴브라운,"지난번 방문했을때 너무 좋았던 올덴브라운:) 백현동카페거리 검색하면 제일 많이 나오는 곳 입구부터 포토존 올덴브라운 주소: 경기 성남시... 18살에 처음 만나 함께 한 학창시절, 함께 먹은 밥, 함께 여행한 추억들 정말 많은 시간을 함께 한 친구들 친구라는 존재가 결혼을 하고 보니 힘이되고...",2021. 10. 6.
[경기/성남] 제주 감성 가득한 서현 신상카페 :: 서현 랑데자뷰 RENDEJA - VOUS...,랑데자뷰 서현점 RENDEJA - VOUS 장소 : 경기 성남시 분당구 황새울로 360번길 19 영업시간 : 매일 11:00 - 23:00 랑데자뷰 내부 모습 ‼️ #랑데자뷰상수 점 보다 훨씬 넓고 컸던 랑데자뷰 서현 ‼️ 마치 #수학여행으로 처음이자 마지막으로 갔던 #제주도 를 연상하게 하는 서현 랑데자뷰 내부모습...,2020. 5. 31.
"판교 맛집 태국음식 슈퍼타이 판교테크노벨리점: 똠양꿍, 나시고랭, 내돈내산, 점심 추천","슈퍼타이 판교테크노벨리점 연락처 〰️ 031-604-0792 주소 〰️ 경기 성남시 분당구 판교로319번길 13 영업시간 〰️ 매일 11:30 - 23:00 / 브레이크: 14... 옛날 옛적(ㅋㅋㅋ) 여행갔던 코타키나 발루가 생각나던 나시고랭의 맛! 저녁에 오빠는 약속있고, 나는 다이어트니까(!) 조금만 먹으려고 했는데...",2021. 10. 5.
"생생정보,풍천황토민물장어,청덕원,신명자국수",<백 년 단골의 추천 맛집> ■ 전복 문어 갈비 전골 - 상호 : #청덕원 - 주소 : 경기 성남시 분당구 문정로 140번길 9-1 ☎ 연락처 : 031-702-5222 ※ 방송 직후에는 붐빌 수 있으니 시간 여유를 두고 방문하시길 권유합니다. <이PD가 간다> ■ 금강을 따라 떠나는 여행 - <부여 대추 수확> : 해살이...,2021. 10. 7.
운중동맛집> 안안 (베트남음식점) good ♡,"특히 피쉬소스 & 땅콩소스가 강하지 않고 담백하고 깔끔해요. 고기 좋아하는 아들을 위해 주로 야채 중심으로 먹었는데도 맛이 좋았네요. 고기,새우 넣으면 얼마나 맛있겠어요? ㅎㅎ 월남쌈 추천해요♡ 안안 경기 성남시 분당구 운중로138번길 28-4 1층 안안 http://naver.me/FeJmXU46",2020. 4. 17.
분당 낙생대공원 산행 동영상,"경기 성남시 분당구 판교, 옛 한양과 영남지역을 연결하던 판교원이 있던곳에 지금은 경부고속도로가 지나가는데, 판교와 고속도로 사이에 있는 낮으막한 육산 능선 457,358에 조성된 樂生大公園을 딸네가 사는 판교 뒷산이라 처 생일여행 전 날 그들 내외와 함께 다녀온 영상.",2021. 5. 27.
분당 판교 맛집 보양식 하모 샤브샤브 예약 필수!,"아직 못 드셔보신 분들은 한 번 드시러 가보셨으면 좋겠어요 :) 분당 판교 뻘 낙지 한마당 경기 성남시 분당구 판교역로 235 에이치 스퀘어 N동 031-696-7666 매일 11:00~24:00 주차, 남/여 화장실 구분 하모 샤브샤브 99,000원 제가 다녀온 곳은 뻘 낙지 한마당이라는 곳이었는데 이곳은 계절에 맞게 제철...",2021. 7. 7.
분당 와인샵 추천 '네비올로 와인#' 이태리와인 겟,신혼여행가서 와이너리투어까지 갔던!! 저희부부는 완전신나서 열심히 구경했네요 프랑스/칠레 와인도 맛있긴하지만 개인적으로 이태리와인이... 네비올로 분당 경기 성남시 분당구 서현로478번길 17 네비올로 와인샵 #네비올로분당 #분당와인샵 #분당동와인샵 #수내동와인샵 #와인셀렉 #분당와인...,2021. 10. 10.
판교 한정식 - 품격 있는 가족모임 & 회식 장소 '진풍정',"부드러운 생선 속살, 바삭한 튀김옷, 달콤한 소스~ 해물볶음류로 나온 오징어볶음, 올해 속초여행에서도 먹기 힘들었던 오징어~ 진풍정에서 식감... 이날 저녁은 당연히 패쓰~~^^ * 2020년 10월 9일 점심 방문 판교 한정식 #진풍정판교점 이용 정보 * 위치: 경기 성남시 분당구 대왕판교로 660(삼평동 670)...",2020. 10. 11.
+판교맛집 오늘의주방 익동정육점 판교역맛집이에요~,"판교맛집 오늘의 주방 익동정육점 경기 성남시 분당구 동판교로 177번길 25 매일 11:00~22:00 판교역에서 2번출구 584m 써니 권혁구의 현실남녀 NCT의 서울여행, 배우 김영철의 동네한바퀴등 방송에도 소개되었던 오늘의 주방이에요 아브뉴프랑에 있어서 주차도 쉽고 아이랑 나들이 겸 방문하기도...",2020. 1. 19.
[여행정보] 유기그릇 - 음식에 품격을 담아내다,"장모밥상 · 경기 성남시 분당구 하오개로344번길5 · 031-711-1321 · 주요메뉴 장모밥상(17,000원) 접시보쌈(소)(10,000원) 찰솥밥 (2,000원) 능라도... 서촌맛집 #서촌카페추천 #놋그릇가지런히 #음식의품격 #유기그룻효능 #놋그릇효능 #트립앤미 #국내여행은트립앤미 #투어앤마이스",2021. 2. 2.
율동공원 맛집 쿠치나디까사 건강한 이탈리안 가정식 데이트,"코로나19로 해외여행 가기 힘든데 이탈리안 가정식을 맛볼 수 있다니 더 기대가 되더라고요. 저희는 바깥 분위기를 느낄 수 있는 2층으로... 율동공원 맛집 쿠치나디까사 영업시간 매일 11:00 ~21:50 라스트오더 21:20, 브레이크타임 16:00 ~ 17:00 예약문의 031-705-7866 경기 성남시 분당구 문정로 136",2020. 8. 24.
전국 여행 추천지 ( 아이와 가볼만한 곳 )2탄 경기도편,전국 여행 추천지 ( 아이와 가볼만한 곳 ) 2탄 경기도편 ★ 경기도 이천 - 덕평 공룡수목원 (경기 이천시 마장면 작촌로 282 ) 용인... ( 경기 성남시 분당구 대왕판교로645번길 21 ) 양평 - 경기도 민물고기생태학습관 ( 경기 양평군 용문면 상광길 23-2 ) 고양 - 어린이박물관 ( 경기도 고양시...,2021. 7. 5.
대만여행같던 위례 퓨전식당,"루타6400km 주소 : 경기 성남시 수정구 위례광장로 300 위례중앙타워 4층 404호 전화 : 031-758-0727 영업시간 : 평일 11:30 - 21:30 오늘은, 익히는 알고... 여행도 못 다니는데 이렇게 맛기행을 할 수 있으니 너무 좋았어요. 저는 맛이 있던, 없던 그 식당의 시그니처 메뉴를 먼저 먹어보는 스타일이에요...",2021. 1. 27.
[판교/삼평동] 인생 젤라또! 이태리 국가공인의 수제 젤라또 - 아이스걸크림보이,아이스걸크림보이 - 주소 : 경기 성남시 분당구 삼평동 670 유스페이스1 B동 2층 228호 - 영업시간 : 평일 11:00~23:00 주말 : 12:00~23:00 안녕하세요~ 사실... 아이스걸크림보이 매장 분위기 매장은 아기자기해요 포장주문도 근처 회사에서 많이 해가더라구요 해외 여행을 많이 가셨는지 매장 소품이...,2021. 9. 23.
분당카페 : 모아니 (Moani),"분당, 성남카페 : 모아니 (Moani) 경기 성남시 분당구 쇳골로 116, (주차가능/30대가량) 11:00 - 20:00 (화요일 휴무) ※ 가오픈 기간 시 7시 매장마감 http://www.moani.co.kr/ 정말...최근 가본 카페중 최고였던곳ㅠㅠ 동네방네 이쁘다고 다 소문내고 !! 나만 알고 싶었지만... 그러기엔 이미 유명한 것도...",2020. 2. 19.
"[TV속 정보] 2월 24일 (수) 2TV생생정보, MBC생방송오늘저녁, SBS생방송투데이 나온...","0507-1353-8040 경기 성남시 분당구 안골로 26 101호 <믿고 떠나는 스타의 고향 - 배우 홍지민의 고향 경상남도 창원시... kr <여행본능, 섬 - 대중교통 타고 섬여행?! '시흥 오이도'> ▶오이도명물등대빵 ☎***-****-**** 경기 시흥시 오이도로 113-1 오이도명물등대빵2호점...",2021. 2. 24.
"생생정보 굴 요리 한 상 & 굴탕수육 (경남 거제) 우렁쌈밥,참나무 바비큐 (경기 성남)","여울목 경기 성남시 중원구 마지로 284-2 (갈현동 511-1) 031-757-4445 11:00~21:00 (마지막 주문 20:20 설, 추석명절 전날,당일 휴무 참나무 모듬바비큐 69,000 참나무 삼겹살바비큐 30,000 / 참나무 오리바비큐 48,000 http://naver.me/Fz9jwJrL <노.래.방> 강원도 원주 여행 박건호...",2020. 9. 11.
[신부관리] 분당피부관리실 서현피부관리 추천! 웨딩케어 서현역 키웰에서 시작했어요,키웰 분당서현점 전화: 031-708-0035 주소: 경기 성남시 분당구 황새울로360번길 24 대명코아 4층 영업시간: 평일 11-21:30 / 토요일 10:00-18:00 / 공휴일 휴무... 바디케어는 해외여행갔을때 받아보았는데 역시나 뭉친 근육도 풀어주고 긴장감이 풀리는게 혈액순환이 되는 기분이었어요. 키웰 골드웨딩관리는...,2020. 10. 20.
[안양여행]김중업건축박물관&안양박물관 방문후기,"안양시에도 도시재생으로 새롭게 경기도민을 만나고 있는 박물관이 가까이 두 곳이있는데요. 바로 김중업건축박물관과 안양박물관입니다. 그럼... 김중업 선생은 와우아파트 붕괴사건, 성남시(그 당시 광주) 개발 정책을 비판했다는 이유로 1971년 11월 프랑스로 강제 출국당했습니다. 그 당시...",2021. 1. 2.
판교 차알 : 종류별로 다 시킴 #판교아브뉴프랑맛집 #미국식중국요리 #커피미학,"판교 아브뉴프랑 맛집 판교 차알 주소 : 경기 성남시 분당구 동판교로 177 25번지 2층 214, 215호 전화번호 : 0507-1408-7679 영업시간 : 매일 11:00 - 22:00 (*21시 : 라스트오더) ( 브레이크타임 평일 15:00 - 17:00 ) 단체석, 주차, 포장, 예약 가능 판교 아브뉴프랑 맛집 : 판교 차알 . 판교 차알은 다소 낯설 수...",2020. 10. 8.
분당 정자동 딤섬 맛집 호접몽 중국요리,처음 사진만 보면 도데체 어딘지 모를 정도로 정원이 멋진 분당 정자동 딤섬 맛집 호접몽 주소: 경기 성남시 분당구 정자일로 120 삼성아데나루체... 친구들 데려가면 좋아할 곳이에요 그럼 라니트립 다음 여행은 어디일까요~? #분당맛집 #정자동맛집 #맛집 #호접몽 #딤섬맛집 #맛집투어 #라니트립,2021. 10. 6.
"서현역맛집┃이색적인 맛의 서현역인도음식, 탈리","서현맛집 / 서현역맛집 / 서현역인도음식 탈리 뜬금없는 여행 후유증으로 만사 귀찮은 날, 자연스럽게 외식을 선택했다. 서현에 꽤 오래된... - 주소 : 경기 성남시 분당구 서현로 192 야베스벨리 (서현동 251-1) - 전화 : 031-707-3192 - 영업시간 : 매일 11:30~22:00 2020 . 6 . 26 서현역맛집┃이색적인 맛의...",2020. 6. 29.
"[내돈내먹] 성남 태평역 횟집 탐나종합어시장 태평역점, 가성비 맛집일까? 아닐까?","영업시간 매일 11:30-01:00 전화번호 031-755-7702 주소 경기 성남시 수정구 수정로 96 방문날짜 2021년 10월 9일 주문메뉴 연어+광어, 소라무침, 문어숙회... 얼마 전에 포항, 울릉도 여행을 하면서 맛집도 많이 가고 수산물도 많이 먹었더니 입맛이 까다로워지긴 했는데요. 광어는 괜찮았는데 연어가...",2021. 10. 10.
