header,contents,date
2월 원 데이 클래스 모집,오시는 길 도로명: 경기 이천시 신둔면 도자예술로 5번 길 56 102호 라탄블로우 지번:경기도 이천시 신둔면 고척리601-4 102호 라탄블로우 예 스파크... 공방여행#라탄엮다#라탄키즈클래스#라탄연필꽃이#라탄자작나무합판#초등학생클래스# #라탄블로우 #rattan_blow #라탄공방 #이천라탄공방...,2021. 2. 4.
[서울근교카페] 이천 카페 사가담 감성돋는 힐링카페,"'사가담' - 주소 : 경기 이천시 증신로252번길 29 - 연락처 : 070-8803-4282 - 영업시간 : 매일 11:00 - 22:00 (일요일 휴무) 서울 송파구에서 1시간 정도 차로... 이천에는 이천아울렛도 있고, 설봉공원이라는 멋진 공원도 있어서 연인들의 데이트코스로도, 서울근교 당일치기여행으로도 좋아요! 마당에는...",2020. 10. 3.
'이진상회 카페' 경기도 이천 자연과함께 산책 가능한 엔틱카페,"이진상회 경기 이천시 마장면 서이천로 656 매일 10:00 - 22:00 Last Order 21:30 주차공간 제공 5천평규모의 산책로,로스팅커피,베이커리 이진상회커피/메종드쁘띠푸르베이커리 더이진갤러리/인도하우스/나포리가든 경기도 이천 당일 여행코스로 다들 한정식 먹고 카페가지 않나요? 껄껄 저도...",2020. 7. 12.
"신규확진 398명, 사흘만에 400명 아래…봄철-변이 등 변수 여전","특히 봄철 모임·여행 등으로 인구 이동이 늘어나면서 유행이 다시 번질 수 있는 데다 기존 바이러스보다 전파력이 센 것으로 알려진 변이... 주요 신규 감염 현황을 보면 서울 은평구 사우나와 관련해 총 12명, 동대문구 병원 3번 사례에서 10명, 경기 이천시 스티로폼공장과...",2021. 3. 5.
[채용] 6월 13일 사람인 추천 채용 정보,"해외여행(개발/기획/항공/호텔) 전직군 모집 08/06(금) (주)한컴라이프케어 한컴라이프케어 2021년 경력직 수시채용 06/18(금) 엘비세미콘... 경기>이천시 l 정규직 l 경력 l 대학교졸업(4년)↑ 0명 지원중 에스큐엔지니어링(주) D-56 경영부문(재무,인사,기획) 신입/경력직 사원 모집 서울...",2021. 6. 13.
[이천카페] 시스메모리 - sismemory 분위기 좋은 아담한 카페,"안녕하세요, ◡̈ 며칠 전에 아담하지만 - 꽉찬 분위기를 가진 이천카페 시스메모리를 다녀왔어요 주소 : 경기 이천시 서희로48번길 18-7 1층... 장염걸린 은비 , , ㅠ 따뜻한 차를 시키고 커피 못먹는다며 투덜투덜ㅋㅋㅋㅋ 여행얘기 하다가 결국 소득 없이 끝남^^ 나듀 부산 좋음 따뜻한 차와...",2020. 8. 2.
디스커버리 이천팩토리아울렛 이천점에서 득템하세요!(가격 첨부),주소 :경기 이천시 호법면 프리미엄아울렛로 177-140 시간: 주말 10:30 - 21:00 평일 10:30 - 20:30 주차 가능 ok!! 매장 안으로 들어서면 공유님께서... 그 외 신발들도 세일가격으로 판매하고 있어용 스포츠가방도 판매하고 있어요 등산가방같은 것도 있지만 아이들 책가방이나 여행가방으로 쓸만한 가방들도...,2020. 10. 18.
보드장비 고가브랜드도 저렴하게,"올해는 사실 여행도 못가서 스키장도 못갈까봐 걱정을 많이 했는데, 그래도 이렇게 구입하고 오니 빨리 시즌오픈을 했으면 하네요. 하나하나... 선영상사 경기 이천시 마장명 양촌리 112-13(마도로 57) 11월 영업시간 주중 11:00~20:00 / 주말 11:00~21:00 12월 10:00~22:00(주중/주말 동일) ***-****-**** https://cafe....",2020. 11. 25.
[이천]서울근교 핫한 카페 시몬스 테라스점,031-631-4071 경기 이천시 모가면 사실로 988 매일 11:00 - 20:00 이천여행가면 꼭들린다는 시몬스 테라스점! 나도가봤당 ㅎㅎㅎㅎ 사람이 진짜 많았다! 1시?쯤 갔는데도 지하주차장은 풀차여서 지상 주차장에 주차했다! 엄청큰 시몬스 창고인가 공장이있고!! 그옆에 카페가있다! 카페도 엄청...,2020. 8. 25.
"경기도 근교, 여주 이천에서 백패킹 하기 좋은 원적사 등산기",어제 만났던 스님을 다시 만나게 되어 인사를 나눌 수 있었다. 좋은 산행이 되었는 지 질문하는 그에게 스님께서 건강한 이유가 왠지 알것 같다며 덕담을 나누곤 다시 인사를 나눈 후 핸들을 잡았다.위치 경기 이천시 백사면 경사리(영월사) 산높이 564m 거리 1.84km 난이도 5점 중 2.5점,2020. 4. 12.
경기도 차박지 Best5,"가족, 연인, 동료와 함께 독립된 공간에서 즐길 수 있는 차박이 하나의 여행 트렌드로 자리잡으며 너도나도 멋진 차박지를 찾아 캠핑을 떠나고... 경기도 차박지 Best1 경기도 이천 복하천수변공원 취사가 가능한 삼겹살공원 경기 이천시 경충대로2422번길 17 경기도 이천에 위치한 복하천수변공원은...",2021. 2. 16.
전주 여행 필수 코스 마켓 영농하게,"추천 여행지는! 한국의 멋과 맛이 살아있는 전주입니다◡̈ 전주하면 꼭 들러봐야 하는 곳! 바로 한옥마을이죠~ 한옥마을 하면 길거리 맛집들,경기... 상큼하고 짜릿한 오렌지향이 기분 좋게 해준답니다 남녀 요소 즐겨마실 수 있지만 특히 여성분들이 기분 좋게 마실 수 있는 맥주에요:) 이천시...",2021. 6. 5.
이천 인디어라운드 - 카페/글램핑/수영장 모두 즐길 수 있는 핫플,인디어라운드 -주소 : 경기 이천시 이섭대천로941번길 49-44 -영업시간 : 평일*일요일 10:00-21:00 / 카페주문 ~20시 토요일 10:00 - 22:00 / 카페주문 ~21시... 저흰 급이천여행을 하게되었답니댜 이천시몬스테라스에서 놀고 카페를 뒤적뒤적 하다가 시몬스테라스에서도 젤 가깝고 포토존이 많아보이는...,2020. 8. 13.
"[이천 시몬스테라스,이코복스커피]이천가볼만한 데이트장소.","시몬스 테라스점 일~목 11:00-20:00 금,토 11:00-21:00 031-631-4071 경기 이천시 모가면 신갈리 372-1 이천에 시몬스테라스점에 다녀온 후기입니다.... 흠. 데이트나 바람쐬러 가기 좋은 이천인것같아요. #이천여행 #이천데이트 #이천가볼만한곳 #시몬스테라스 #이천시몬스테라스 #이코복스커피 #이천이코복스",2020. 4. 27.
이천 메타쉐콰이어길. 성호호수 연꽃단지,우선 이천메타세콰이어길 가로수길은 네비에 나오지가 않아서 경기 이천시 대월면 송라리 47-6 으로 주소를 입력해서 다녀왔어요. 네비를 찍어도... 전에 강릉 경포호수에서 본 연꽃도 참 예뻤는데 이천에도 이런 곳이 있다니 역시 여행은 사랑입니다. 가는길은 초행이라 힘들었지만 역시 다녀오면...,2020. 7. 17.
"이천맛집 라라코스트에서 가족 외식~가성비갑, 분위기도 굿! 맛도 굿!",저희도 조심조심 다닌다고 하는데~ 답답하네요~ 여행은 꿈도 못 꾸고 있어요. 라라코스트 내부입니다. 보기만 해도 시원하죠? 깔끔하게 잘 정돈된... 다음에 또 올 거예요^^ 다 먹어 보고싶어요 031-637-3235 주소 경기 이천시 이섭대천로 1242 2층 영업시간 매일 10:00~22:00 ★연중무휴 & last order 21시,2020. 9. 8.
2021년 국내 봄여행지 & 비대면 안심 관광지 25선,"안전여행 하시기 바랍니다. 출처 - 대한민국 구석구석 안심여행 25선 봄 소풍 최적의 장소, 올림픽공원 서울 송파구 봄 망울이 몽글몽글 자연과... 설봉공원 경기 이천시 호반 도시의 매력을 제대로 만끽할 수 있는 춘천 공지천 산책길 강원 춘천시 청정 공기를 호흡하며 자연과 하나 되는 길, 화천...",2021. 4. 14.
[210303-국내] 봄꽃이 피는 순서를 아시나요?...경기 봄꽃로드 6선 [경기도],이천시 백사면은 수령 100년이 넘는 산수유가 자생군락지를 형성하고 있다. 634m로 이천에서 가장 높은 원적산 아래 자리한 영원사를 향해 가는 길이 대표적인 산수유 스폿이다. 송말리부터 도립리를 거쳐 경사리에 이르기까지 산수유나무가 대규모 군락을 이룬다. ■ 수원 경기도청 벚꽃...,2021. 3. 3.
[티하우스에덴] 푸릇푸릇 인생샷 찍으러 분위기 좋은 이천 카페,"/예쁜 이천카페 티하우스에덴/ 경기 이천시 마장면 서이천로 449-79 도착하면 에덴파라다이스 호텔, 알렉스 더 커피도 있고그 앞쪽에 티하우스에덴... 뿐인데여행 느낌이었다. 나무 사이에서 많이들 찍으시더라구욧./숲의정령//푸릇푸릇//인생샷//물아일체/ 온실카페느낌이천 카페 티하우스에덴 입구...",2020. 7. 20.
[이천 드라이브 가볼만한곳] 이천 시몬스테라스 하드웨어스토어 1편,기대해주세요~ 이천 시몬스테라스 시몬스테라스점 도로명: 경기 이천시 모가면 사실로 988 지번: 경기 이천시 모가면신갈리 374 영업시간 매일 11:00~20:00 (금/ 토 21시 연장영업) 전화번호 031-631-4071 #이천나들이 #이천시몬스테라스 #시몬스테라스 #국내여행 #추석때가볼만한곳 #연휴에가볼만한곳,2020. 10. 2.
[이천 카페] 서울근교카페 카페진리 이천 가볼만한 곳,"서울근교여행, 서울근교카페. 이천가볼만한 곳. 경기도 이천카페 ""카페 진리"" - 주소 : 경기 이천시 경충대로2481번길 94 - 영업시간 : 매일 12:00 ~ 21:00 / 월 휴무 화이트풍의 깔끔하고 산뜻한 외관을 보였던 이천카페. 카페진리는 찾는 손님들이 무척 많은 이천 핫플 카페인데요. 오후 늦게 방문한 이곳은...",2020. 10. 17.
[이천신상카페] 소담달,소담달 주소 :경기 이천시 영창로209번길 21 1층 Open 11:00 - 21:00 5월 휴무 없음 자세한 건 인스타그램 확인 이천 시내에 새로생긴 카페... ㅎㅎ #이천카페 #신상카페 #여주카페 #이천맛집 #이천카페추천 #이천시내카페 #이천신상카페 #이천가볼만한곳 #이천핫플 #이천여행 #카페투어 #공감 #서이추...,2020. 5. 6.
"Place, 고즈넉한 이천 카페 희원 여기어때","고즈넉한 감성이 묻어있는 이천 카페 희원 여기어때 주소: 경기 이천시 부발읍 황무로2065번길 221-10 운영시간: 매일 11:00~22:00 가격: 음료... 출처: https://place-howisit.tistory.com/81 [Place, 여기어때] 언택트가 떠오르는 포스트코로나 시대 뉴노말로써의 국내여행 고즈넉한 이천 한옥...",2020. 9. 16.
이천 대대존마탱 고기집 : 피카소,"ㅠ 쩝 너무너무 맛깔나는 곳임 ♥️♥️ 그럼 ✋ POINT REVIEW 위치 : 경기 이천시 영창로 196 2층 205,206호 영업시간 평일 : 17:00 - 24:00 주말 : 11:30 - 23:00 휴무일 : 월요일 #이천신상맛집 #이천맛집 #이천가볼만한곳 #이천여행 #이천고기집 #이천피카소 #일상 #서로이웃 #이웃환영 #이웃추가 #서이추",2020. 6. 21.
"이천카페, 티하우스에덴 짠내 출사 이야기","이천 카페, 가볼만한 곳, 출사 ‘티하우스에덴, 가든’ 경기 이천시 마장면 서이천로 449-79 안녕하세요! 얼마전 소니,캐논 색감비교 포스팅을... 느긋하게 머물다 오고 싶어요 :) #이천카페 #이천여행 #이천사진찍기좋은 #이천가볼만한곳 #티하우스에덴 #에덴파라다이스호텔 #이천티하우스에덴",2020. 9. 30.
확실한 퀄리티로 한우맛 보시려면 이천맛집으로 컴 온!,"이번 여행 제대로 몸보신하고 힐링할 수 있어서 너무 좋았네요. 참고로 소고기는 그날 도축한 소고기를 직접 손질하는 모습도 확인해보실 수... 그리고 이천한우는 3년 연속으로 질좋은 고기집으로 수상을 받은 상태라, 고기 퀄리티는 의심하지 않으셔도 될거에요. 경기 이천시 이섭대천로1311번길 14",2020. 8. 23.
"경기도 데이트 이천 에덴파라다이스,세상의 모든아침","에덴파라다이스호텔 ✓주소:경기 이천시 마장면 서이천로 449-79복사 ✓체크인 15:00 / 체크아웃 12:00 ✓조식은 아침 8시부터 10시까지 (숙박 고객은 할인되고 할인 된 가격이 1인에 23,000원이라고합니다) 숙박 예약할때 조식 포함이 없어서 숙소만 결제했었는데 조식 먹으러 가서 현장 결제하면...",2020. 7. 19.
[이천맛집]명서쿠 : 카레와 라멘이 맛있는 집,명서쿠 라멘과 카레가 맛있는 집 주소: 경기 이천시 어재연로37번길 15 김가네 2층 영업시간 :화-일 11:20-23:50 안녕하세용? 오랜만에 이천시내에서... #이천맛집 #이천시내맛집 #이천가볼만한곳 #여주맛집 #이천여행 #이천술집 #명서쿠 #이천라멘 #이천카레맛집 #이천일식집 #공감 #서이추 #서로이웃환영,2020. 8. 1.
"""할머니, 할아버지~ 저 왔어요!"" 어르신들을 찾아온 꼬마 손님들 1 3세대 통합 프로그램","아이들과 정서 교감으로 가족에 대한 그리움 해소 경기 이천시에는 아이들의 웃음소리가 피어나는 한 요양원이 있다. 이곳에는 80여 명의 어르신이... 앞으로는 아이들과 보호자, 자원봉사자와 직원들이 어르신을 모시고 여행을 떠나 더 많은 추억을 만들어드리고 싶습니다."" 출처...",2020. 12. 1.
이천부발맛집 제주둘레국수 국수 땡길 때 고고,옛날에 제주도 여행 갔을 때 고기국수 먹어봤는데 너무 맛있었어서 안 먹어본 사람들한테 꼭 먹어보라고 추천하는 음식 중 하나 랍니다. 저는... 국수 좋아하신다면 이천부발맛집 제주둘레국수 방문해보세요 :) 제주둘레국수 이천부발점 ***-***-**** 경기 이천시 부발읍 황무로 1440 매일 10:30 - 20:30...,2020. 8. 26.
"[이천나들이 | 시몬스테라스(Simmons Terrace), 임금님쌀밥 후기]",#시몬스테라스 #이천시몬스테라스 #이천나들이 #simmonsterrace #이천여행 #이천데이트 안녕하세여 잇님들! 요즘들어 알게 된 잇님분들과 자주... 시몬스 테라스 위치 : 경기 이천시 모가면 신갈리 372-1 운영 시간 : 11시 ~ 20시 (금/토는 21시까지) 바로바로 시몬스테라스에요 :) 혼수 침대를 이 직영점에서...,2020. 4. 13.
"“슬기로운 주말여행, 이천이 답이다”","호수공원 전경 # 서울에서 가까운 명품 체험여행지 경기 동남부권에 위치한 이천시는 국토를 동서남북으로 연결하는 영동고속도로와 중부고속도로가 교차하고 서울~충주 국도 3호선과 수원~여주 국도 42호선이 통과하는 중부내륙 교통의 요충지다. 2016년 9월 경강선, 2017년 성남-장호원 간...",2020. 6. 5.
"정원속 아름다웠던 카페, 이천 티하우스에덴","주소 - 경기 이천시 마장면 서이천로 449-79 (지번) 목리 417-4 전화 - 031-645-9190 주차장도 깔끔하게 잘 되어있었어요. 카페로 가는 길, 정원도 너무... 너무 아름다웠던 카페, 티하우스에덴이었어요! #이천카페 #이천카페추천 #이천여행 #이천나들이 #이천티하우스에덴 #티하우스에덴 #감성카페 #티카페추천",2020. 6. 4.
이천갈만한곳 별빛정원우주 다녀왔어요!,"별빛정원 우주 경기 이천시 마장면 각평리 319 매일 11:00~23:00 입장료 주간-대인 6,000원 소인 3,000원 야간-대인 12,000원 소인 6,000원 주차장 있음... 달토끼가 들려주는 우주여행이야기라는 테마가 있어서 인지 엄청 큰 대형 달토끼가 있어서 깜짝놀랐답니다ㅎ 앞에서 사진을 안찍을 수가 없더라고요....",2020. 8. 18.
이천쌀밥정식 임금님쌀밥 불고기정식이랑 굴비정식 간장게장,일단 추우니까 들어가볼게요 이천쌀밥정식 임금님쌀밥 불고기정식이랑 굴비정식 후기 주소 : 경기 이천시 신둔면 경충대로 3134 전화 : 0507-1341-3646... 작고 귀여워서 가지고싶길래 찍어봤어요 ㅋㅋㅋ 캠핑가거나 1박 2일 여행 갈 때 너무 좋을 것 같은데요 !? 심지어 2020년 생산 쌀 이에요 !! 따끈한 올...,2020. 11. 25.
경기광주 임장기 / 아직 늦지 않았구나,"순이동 증가지역은 성남>송파>강동 순이고, 순이동 감소지역은 화성>용인>이천시 순이에요. 요지 : 경기광주는 성남과 무지 밀접하다는 것... 평화롭게 공원에서 동네 아이들이 꽤 많이 나와 뛰어놀고 날씨도 따뜻하고 외국여행 온 거 같이 편안하더라구요 ㅎㅎ 사소한 것일수도 있지만 제가 집에서...",2021. 2. 28.
이천 물막국수 기본기에 충실한 맛!,지난 주 주말을 맞이해서 여름휴가도 망친 저희 가족은 가깝게 #이천여행 을 다녀왔었는데요. 원래 계획했던 해외여행은 지금의 사태로 취소하고... 쪽으로 나들이를 계획하신 분이라면 한번 들러봄직한 이천맛집이 아닐까 싶네요 ~! 응암리막국수 경기 이천시 부발읍 경충대로1722번길 11 매일 10:30 - 21:00,2020. 8. 18.
이천사음동맛집 오리 한마리 진미 맛 오리랜드 JMT!,오리랜드 주소 : 경기 이천시 경충대로 2995 전 화(☎) : 031-634-5289 영 업 : 매일 11:30 - 22:00까지! 한국 도자관 건물 2층에 위치한 사은동맛집! 국내산... 강원도로 여행가는 길에 한번 들러볼 만한 이천 오리로스 맛집인데요. 제대로 된 오리로스 및 주물럭 구이를 맛볼 수 있는 곳을 찾는 분들에게...,2020. 10. 12.
"[이곳저곳] 카페, 여행지 추천 1편","짧은 시간 동안에 이렇게 소통할 수 있는 이웃님들이 계시다는 게 굉장히 힘이 나게 하는 것 같아요 ㅎㅎ 사실 블로그를 운영하기 전에도 여행... 시몬스테라스 경기 이천시 모가면 신갈리 372-1 일~목: 11:00~20:00 금,토 : 11:00~21:00 시몬스 테라스는 서울 근교에 위치해서 나들이 가기 좋은...",2020. 4. 29.
[일상생활을 벗어나 관광과 맛집을 함께 즐길 수 있는 휴게소 알아보기],"옥계휴게소 여행지 하면 강원도를 빼놓을 수 없는데요~!삼척에서 강릉을 지나올 때 바다가 보이는 휴게소로도 붙여진 옥계휴게소는 답답한... ^^ 주소 경기 이천시 마장면 덕이로154번길 287-76 하루 빨리 코로나19가 지나가길 바라며, 모두들 건강 유의하세요~! 더 많은 소식을 보고싶다면 저희...",2020. 8. 26.
이천한식. 이천맛집. 이천밥집. 쌈밥/돌솥밥맛집. 이천점심추천 : 이천돌솥밥,"여행이 끝나고 집에 가던길에 이천에 맛집이 있다고 아빠가 맛있다고 데려간 한식집 #이천맛집 #이천돌솥밥 반찬이 정말 깔끔하게 잘 나온데요-! ⧴ 위치: 경기 이천시 신둔면 수광리 397-5 ◴ 운영시간 : 매일 10:30 - 21:00 연중무휴 ⧴ 주차가능, 단체석가능, 예약가능 #이천돌솥밥 자리는 좌식 자리와...",2020. 8. 26.
매일경제 최신기사 시간별 14 2021-06-18 18:44,특히 검찰의 ..2021.06.18 17:11 화마 덮친 쿠팡물류센터…뼈대만 남았다 경기 이천시 쿠팡 물류센터에서 발생한 화재가 하루를 훌쩍 넘겨 18일... 18 17:11 엉금엉금 숨어서 갈까…'호수위 악어떼' 만나러 ◆ 신익수 기자의 언택트 총알여행 ◆◆ 악어 때문에 '출입금지'라고?'출입금지....,2021. 6. 18.
한정식 맛집 이천쌀밥 나랏님,경기도 밥맛 좋은 집 5대선정 최우수 평가에 빛나는 나랏님 이천쌀밥 집이었습니다 ㅎㅎ 나랏님이천쌀밥 신관 경기 이천시 경충대로 3052 (지번)사음동 629-10 매일 09:30 ~ 22:00 031-636-9900 #한정식 #한정식맛집 #이천맛집 #이천쌀밥맛집 #나랏님밥상 #한식맛집 #이천쌀밥 #가평여행,2020. 7. 17.
"[골프부킹 양도, 한강이남] 더크로스비GC, 01/09(토) 11:29, 18홀 94,000원","[골프부킹 양도, 한강이남] 더크로스비GC, 01/09(토) 11:29, 18홀 94,000원 골프장 더크로스비GC 주소 경기 이천시 호법면... 골프부킹, 양도, 조인 예약 전문 골프매니저 http://www.teebox.co.kr 플레이스토어 바로가기 국내외 골프 여행 문의 070-8119-6352",2021. 1. 7.
이천 맛집 느티나무집에서 복날 제대로 몸보신했어요!,그뿐 아니라 족구장도 있다고 하니 여행 간 것 같은 기분이 들더라고요~ 기본 찬들이 나왔는데 반찬들도 구성이 다양하고 상다리가 휘어질 정도로... 면역력 충전하고 갑니다~ 다음에는 다른 메뉴들도 먹어보고 싶어지네요! 느티나무집 031-635-8532 경기 이천시 부악로 30-62 평일 11:00 - 22:00 명절연휴 휴무,2020. 8. 20.
"[골프조인, 한강이남] 더크로스비GC, 01/09(토) 11:01, 18홀 94,000원","[골프조인, 한강이남] 더크로스비GC, 01/09(토) 11:01, 18홀 94,000원 골프장 더크로스비GC 주소 경기 이천시 호법면 중부대로798번길... 골프부킹, 양도, 조인 예약 전문 골프매니저 http://www.teebox.co.kr 플레이스토어 바로가기 국내외 골프 여행 문의 070-8119-6352",2021. 1. 6.
[국내선 시승]부산행 BX8825편 시승,귀경길에 오르는사람들이 많았던거 같긴합니다. 그러고보니 3월에 부산으로 가려고 탔을때도 탑승구가 20번이었는데 이번에도 20번입니다.... 다만 서울행은 반대로 구성되는데 안성시나 이천시일대에서 드리프트를 틀어서 가는구조로 되어있지요. (안성시가 개노답깡촌이라는걸 하늘도...,2020. 10. 7.
이천 별빛 정원 우주 이천나들이 아이와 가볼만한곳 경기도 가볼만한곳 경기도 야경...,여행도 못 가고 아쉬운 맘 휴게소 음식이 급 땡기더라구요 왜 뱅기타고 어딜 가도 기내식에 살짝 쿵 심쿵 하잖아요..기내식은 못 구해도 휴게소... 향하는 곳은 덕평 휴게소 우리가 가는 곳은 휴게소와 붙어 있는 별빛정원 우주 입니다 별빛정원우주 경기 이천시 마장면 덕이로 154번길 287-76 매일 12;00...,2021. 4. 10.
[책] 대한민국 부동산 미래지도(경기편),"쓰고 경기도 광주는 넓을 광(廣)자를 씁니다 : 광주시는 광주산맥(태백산맥의 철령 부근에서 서울에 이르는 산맥)이 면적의 대부분을 차지하고 있습니다. 광주산맥의 산으로는 송파구와 인접한 남한산성이 있는 남한산, 분당구와 인접한 문형산, 이천시와 인접한 태화산, 하남시와 인접한 검단산...",2021. 6. 20.
이천갈만한곳/예쁜카페 뷰맛집 그곳은 ' 카페진리 ',마치 해외여행 처음 온 사람처럼 우와. 우와. 코로나 시국으로 여기저기도 못다니고 심지어 그렇게 좋아하던 카페도 못가다가 빠방을 운전하는... 찾으신다면 뷰맛집 ' 카페진리 ' 한번 들러 살짜쿵 힐링하고 가세요 내발내돈내산 후기랍니다. 경기 이천시 경충대로2481번길 94 http://naver.me/5tsn6VHo,2020. 9. 18.
"아이와함께 이천덕평공룡수목원, 6세,3세 두아이 모두 즐겁게 놀다 온 덕평공룡수목원",저희 네식구는이천으로 여행을 떠났어요 공룡덕후 ?? 우리 두 아이들에게는 딱인 덕평 공룡수목원 날 좋은날 우리 두 녀석들과 함께 다녀온 이천... 덕평 공룡수목원 경기 이천시 마장면 작촌로 282 평일 09:00 ~ 18:00 입장마감1시간 30분 전까지 36개월 미만 일 경우 증빙자료 준비해 가면무료 !!!...,2020. 12. 16.
이천 예스파크 유리공예 체험 '플럭스',[네이버 지도] 플럭스 경기 이천시 신둔면 도자예술로62번길 113-41 http://naver.me/59ANQyoa https://m.blog.naver.com/is2331/221513379382 본격적인 블로잉을... 나니 별로 비싸게 느껴지지 않았다.. 아이도 넘 좋아했고.. 이런 유리 공예 체험은 유럽여행이나 가야 할 수 있는건줄 알았는데 세상 참 좋아짐.. ^^;,2020. 6. 16.
여주아울렛 맛집 응암리막국수 내돈내산,먹고나서 너무 만족했던 여주아울렛 맛집 응암리막국수 신혼여행을 끝나고 돌아오면서 부모님드릴 선물을 구매하러 들린 여주아울렛! 강원도로... 계속 생각나네요 ㅠㅠ 여주아울렛 맛집 응암리막국수 전화 :031-635-5935 주소: 경기 이천시 부발읍 경충대로1722번길 11 영업시간 : 매일 10:30~21:00 주말...,2020. 11. 12.
이천 에덴파라다이스호텔*에덴티하우스 카페 이천카페추천!,주소: 경기 이천시 마장면 목리 417-4 주차: 리조트 카페앞 주차장 있어요 영업시간: 연중무휴 매일 8시오픈-8시 주말 8시오픈-9시 숲속 정원속에서... 힐링할수 있는 곳인거같다 다음엔 호텔서 한번 묶고 다른 곳들도 경험해보고 싶다 이천여행 오시는분들이라면 꼭 한번 방문해 보시길요! 너무 좋아요!,2021. 4. 13.
"이 겨울이 지나고 나서, 이천을 체험하는 방법 하나! 농촌 나드리","하니 이천 시민분들은 '딸기 따기 체험' 말고 '딸기 먹기'를 하면서 아쉬움을 달랠 순 있겠네요. 딸기 체험이 가능한 농가들 (체험이 가능한 시기가... 농촌나드리 꽃, 원예 관련 체험 (여름이 오기 전 꼭 해야하는 체험) > 이 외에도 경기관광 우수 프로그램으로 선정되 프로그램의 우수성을 인정받고...",2020. 3. 10.
