header,contents,date
위례 양대창 맛집 ㅣ 세광양대창 모듬구이,"위례점 경기 성남시 수정구 위례광장로 104, 1056-1057호 매일 11시 ~ 03시 포장, 주차 가능 세광양대창 위례점은 위례 중앙광장에 위치하고 있어요. 롯데시네마, 스타벅스가 있는 오벨리스크 건물이라서 주차하기 편해요 ! 세월의 흔적이 그대로 드러 나는 레트로풍의 인테리어에 시간 여행을 하는...",2021. 7. 11.
도심속 캠핑감성 정글 바베큐에서 힐링,청계산 정글바베큐 전화번호: ***-****-**** 주소: 경기 성남시 수정구 달래내로207번길 44-3 영업시간: 매일12시 - 22:00 명절휴무 지난 주말 어머님아버님과 시언니가족과 #정글바베큐에 다녀왔어요. 코시국이다보니 요새 국내여행도 너무 비싸졌드라구요ㅜ.ㅜ 아주버님이 열심히 서치해서 찾은...,2021. 6. 21.
[정자 칵테일 바] 칵테일 팩토리 - 발리에 온 것 같은 분위기에 루프탑까지,팩토리 경기 성남시 분당구 성남대로331번길 3-8 2층 운영시간 매일 18:00 - 03:00 익일3시까지 (현재는 PM10시 까지 입니다) 휴무 날 일 수도 있으니... 해외 여행 온 듯한 기분이 들어요 저희가 갔을 때 이른 시간이라 손님이 없어서 사진찍기 좋았어요 다트게임도 준비 되어있어서 칵테일 마시다가...,2021. 6. 22.
위례 스시 맛집 최고의 초밥 은호스시,"포장해가시는 손님들의 마음도 완전 공감했어요~~ 여기는 찐이에요. 초밥먹고 싶을때 무조건 찾을거에요^^ 은호스시 주소 : 경기 성남시 수정구 위례서일로3길 7-12 전화 : 031-755-9466 시간 : 매일 11:30 - 22:00(브레이크타임 15시~17시), 첫째 / 셋째 일요일 휴무 가게 앞 인근 주차가능",2021. 7. 10.
"[정자역 횟집 만원수산] 삼만이, 통우럭매운탕 시식 후기(매장,메뉴 사진)",정자역 횟집 만원수산 매일 17:00 - 02:00 경기 성남시 분당구 성남대로331번길 9-15 3층 301호 위치는 정자역 3번출구에서 5분정도만 걸으면 있다... 적당히 얼큰하면서도 시원한 맛의 매운탕 밥 두공기 시킨걸 뚝딱한거 보니 밥도둑 인정 식사하면서도 가족들끼리 7월말에 갈 가족 여행을 벌써 다녀온...,2021. 7. 5.
푸짐했던 판교역 맛집 고기집,판교역 시즌 * 경기 성남시 분당구 판교역로192번길 16 * 번호 : 031-706-2006 * 시간 : 매일 18:00 - 02:00 연중 무휴 분위기가 좋은 편이고 꼭 여기서 술을 마시면 외국 여행 와서 술 마시는 것 같다는 생각이 들어서 더 술을 맛있게 먹을 수 있는 것 같더라고요 평소 먹어 보지 않았던 맥주도 다양하게...,2021. 9. 29.
분당염색 수내미용실 아이엠헤어에서 매트브라운 후기,수내미용실 아이엠헤어 위치 & 영업시간 영업시간 평일 09:30 ~ 21:00 연중무휴 주말 10:00 ~ 20:30 연중무휴 위치 경기 성남시 분당구 백현로 101번길 16... 제가 마침 이때 염색하고 2일 뒤에 여행을 가느라 딱 들고 가서 사용을 하니까 머릿결도 좀 더 유지가 되는 너낌....ㅎㅎㅎ 화장실에서도 찰칵...,2021. 7. 2.
판교 맛집 - 판교 데이트코스로 좋은 어글리스토브!,전화번호 : 031-706-8459 주소 : 경기 성남시 분당구 판교역로 145 지번 : 경기 성남시 백현동 530 라스트리트 2동 2층 영업시간 : 매일 11:00 - 21... 동남아 여행때 먹은 망고 바로 그 맛이였습니다. 망고만의 찐득하고 단 맛이 잘 느껴지더라구요. ㅎㅎ 생과일 쥬스를 다 마신 이후에 탄산으로 리필되니...,2021. 7. 9.
백현동 카페거리 백금당 판교 수플레 또 가고싶은 디저트 맛집,주소: 경기 성남시 분당구 동판교로 52번길 19-12 1F 여기 위치는 수내역에서도 서현역에서도 판교역에서도 괜찮게 갈 수 있는 거리 아닐까? 라는... 요즘 여행도 못가는데 뭔가 대신 갬성을 느낄 수 있어서 그나마 위안?이 되었던 거 같아요 ㅠㅠ.... 아 여행가고 싶어요...으아아아 여긴 판교 디저트...,2021. 6. 22.
코로나 확진자 동선 (21/8/6),8.) 강남구 소재 음식점 관련 수도권 지인가족 여행모임 관련 중구 소재 직장 관련('21.8.) 강북구 소재 직장 관련('21.8.) 수도권... 경기여주시렌탈업관련 경기성남시헬스장관련 경기안성시가구제조업관련 경기안산시자동차부품제조업관련 충북음성군직장...,2021. 8. 12.
최근 제.개정 입법/정책 정보/안양시의회 이채명 시의원,"민주당 대권주자인 이재명 경기지사가 지속 주장해온 법안이기도 한 CCTV 설치법을 두고 대리 수술이나 의료사고 방지를 요구하는 환자단체와... 관내 체류 외국인 청소년들에게도 예외 없이 교육재난지원금을 지급하기로 했다""고 말했다. ❍ 성남시 잇단 압수수색에 '변호사 선임 대응' 조례 추진",2021. 9. 24.
율동공원 맛집 타임포타이 태국음식전문점,분당 율동공원 태국음식 전문점 타임포타이 해외여행은 이제 못가게 되었으니-.- 아이와 작년 태국 치앙마이여행 사진을 보며 추억에 잠기다가... 태국음식 경기 성남시 분당구 문정로144번길 5 031-702-1123 매일 11:00 - 22:00 연중 무휴 주차 무료 율동공원맛집 타임포타이 위치 #타임포타이...,2020. 7. 29.
[분당 정자] _레이오버여행카페,"레이오버여행카페 경기 성남시 분당구 느티로 70 느티마을3단지 상가동 1층 101호 매일 08:00-22:00 레이오버의 모든 공지와 소식은 인스타그램을 통해 확인. 포장, 무선 인터넷 정자역 1번 출구에서 382m 안녕하세요 미녜입니다 :) 오늘은 오랜만에 정자동에 있는 카페 포스팅을 가져왔습니다!...",2020. 10. 24.
분당 정자동맛집 시앙메이 리뷰 칠리새우 중국요리 전문 미금 정자역,"경기 성남시 분당구 정자일로 197 1층 단체석, 주차, 포장, 예약, 무선 인터넷, 반려동물 동반, 남/녀 화장실 구분, 장애인 편의시설 031-714 -0533 시앙메이 중화요이 중국요리 전문 맛집 시앙메이 입구부터 화려해서 금방 찾을 수 있었습니다 . . 1 층 , 2 층 있구요 ! 입구에 메뉴판이 있어서 먼저 확인...",2021. 2. 17.
[운중동맛집] 약재가 들어간 특별한 돌솥밥 판교 한정식 '시골여행',정갈한 한정식 한차림 '시골여행' 주소 : 경기 성남시 분당구 운중동 55-4 근래 밀가루로 축적된 몸에게 미안하여.. 좋은 음식을 먹으러 가자고 해서 찾아간 운중동 한정식 맛집 '시골여행' 익히 알고 있었지만 역시 운중동은 부유촌의 느낌이 물씬~ 나도 나중에 여기에 살고 싶드아♥ 주차는 앞에다가...,2020. 3. 14.
남한산성 시간여행 속으로..,남한산성은 청량산 자락과 맞물려 성남시와 경기광주시로 길게 감싸고 있습니다 그래서 그런가 서울시내 전경을 한눈에 탁트인 모습으로... 꼭! 꼭! 다시 가져오시길... #내나라여행 #주말여행 #경기광주가볼만한곳 #남한산성 #수어장대 #여행 #국내여행 #한국관광 #친절한종민씨,2020. 4. 14.
"매운갈비파스타,매운비프스튜 #포천 황토오리진흙구이 #강릉 여행 수제화제작전문가","프리미엄 마사지(안마의자) http://simsinfree.com/ #벨스킨 ★ 경기 성남시 분당구 미금로 39 (구미동 204-2) 031-717-6061 => 피부,체형관리 2)... * 100년 된 한옥건물, 광릉수목원 근처 4) 노.래.방 - 강릉여행 #커피거리 ★ 강원 강릉시 창해로 14번길 20-1 => 안목해변 카페거리 * 강릉항...",2020. 1. 20.
"판교 샐러드 맛집, ""샐러디 판교테크노벨리점""",#샐러디 #판교샐러드맛집 #판교맛집 맛집여행 블로그를 운영하면서 1일 1포스팅 하려니 살이 통통히 오르더라구요 그래서 요즘 식단을 조금... 판교테크노벨리점 경기 성남시 분당구 대왕판교로 670 031-739-8687 평일 08:00-20:30 주말 10:00-20:30 샐러디 판교테크노벨리점은 유스페이스몰 1층에 있어요...,2021. 6. 10.
Werest::직접담근 수제청과 스콘이 맛있는 위례서일로카페,"Werest 경기 성남시 수정구 위례광장로 12 (창곡동) 안녕하세요 여러분 현댕입니다!! 요즘 시국도 시국이고, 날도 이래서 참 쉬고싶은 나날들이... 정성스러운 포스팅만을 추구하는 현댕이예요 맛집, 여행, 취미, 뷰티 등 좋아하는 분야 소개해드리고 있어요 오늘도 제 글을 읽어주셔서 감사해요...",2021. 7. 29.
잡아줘눈물이 전국화환 하품처럼 꽃배달 흘러 내려오늘 조화 밤 김포마송장례식장 절대...,분양 경기 기대감이짃 크게 낮아진 것으로 조사됐습니다 확산세에도 불구하고 해외여행 첻기대감은쉋 여전하다 전국화환 꽃배달 조화... 역사 속으로 사라씙진다 경기 성남시 분당구똻에 거주하는 집에서 바질과 비타민 적핼상추를 기른다 금융당국이 저축은펜행에닳 대출총량 관리를 주문했다,2021. 7. 31.
뉴스톡톡 0827 금,"'넘어짐도 여행의 일부'이며, 각자 '홀로 서는 법'을 익혀야 한다. 히피 :뉴스톡톡에서 보낸 파울로 코엘료를 모았습니다. 금요일 입니다.... http://naver.me/FQanqOeh "" "" 지난달 경기 성남시 분당의 김밥전문점에서 집단 식중독 사고가 발생한 데 이어 고양에서도 김밥집 고객 30명이...",2021. 8. 27.
판교 백현동 카페거리 분위기 좋은 데이트 장소 카페 에리아,에리아 * 주소 : 경기 성남시 분당구 판교역로18번길 12 지하 1층 * 수인분당선 수내역 4번 출구에서 1086m * 신분당선 판교역 3번 출구에서 1300m * TIME... 가만히 보기만 해도 시원해지는 것 같고 어디 여행온 것처럼 푸른 바다가 보여서 너무 좋았음 여러 종류의 술과 곰돌이 인형들이 장식되어 있고...,2021. 7. 19.
코로나19백신 사전예약방법 부모님 대리예약도 가능함.,출처 : 서울신문 아침 신문을 통해 기사를 확인했는데 최근 경기 성남시 요양병원과 전남 순천시에서 발생한 집단감염 사례를 소개하면서 백신... 뉴스를 보니까 백신 접종자에게는 해외여행 자가격리 면제 등의 혜택을 주는 내용이 검토되고 있다고 하더라고요. 올해 안에 모두 에방접종...,2021. 5. 21.
"[타임포타이] 태국음식이 그리울땐,율동공원맛집 타임포타이가 딱이지!",주소 경기 성남시 문정로 144번길 5 전화번호 021)702-1123 영업시간 매일 11시 : 22시30분(연중무휴) 찾기쉬운곳에 있는 타임포타이 식당앞 주차공간... 여행멀리가지않아도 여행온듯한 느낌들어서 저는 너무좋더라구요! 테라스자리에 다른분들이 식사하고계서서 사진은 못찍었지만 날좋을때 테라스에...,2020. 11. 6.
/남편의헤어컷_#정자동바버샵,케이바버샵 경기 성남시 분당구 정자일로 132 D105호(정자역3번출구) 주말 10:00 - 20:00 평일 11:00 - 20:00 곤트란쉐리에 옆에옆에 있어요! 간판이 막... ㅎㅎ 다듬고 마사지건같은 걸로 샴푸해주시는데 무지무지 시원해보였음 앉은 자리에서 샴푸하는게 꼭 한 때 대만여행에서 유행했던 현지미용실...,2021. 6. 12.
"분당 정자동카페/와인바, 파리여행 같은 핌리코 (메뉴 와인리스트 가격 주차)","위치 경기 성남시 분당구 정자일로 146 엠코헤리츠 101동 107호 정자역 5분거리, 정자동카페거리 근처예요 핌리코 운영시간 월-금 17:30 - 02:00 토 15... 저는 프라하에서 처음 마셔본 기억이 정말 강렬했는지 아이리쉬커피를 마실때마다 그 여행의 그날, 까를교가 보이는 블타강 강변의 그 카페로...",2020. 10. 6.
"[BROMPTON] 브롬톤 MY20 신규 러기지(가방) 2차 출시 - 버로우(Borough), 메트로...",어깨끈 - 여행용 커리어에 거치 가능한 슬리브 - 중요 소지품을 보관할 수 있는 후면부 포켓 - 반사 소재의 방수 레인커버 포함 메트로... 031-5170-1690 경기 성남시 분당구 판교역로146번길 20 현대백화점 판교점 6층 WECLE 양재 (에이씨디씨) 02-577-2261 서울 서초구 논현로 117...,2020. 8. 27.
"곤트란쉐리에 , 분당카페 정자동카페거리 :: 유럽느낌의 야외테라스 베이커리카페",23:00 경기 성남시 분당구 정자일로 132 정자동카페거리 곤트란쉐리 는 정자동 카페골목에 위치해있어요! 푸르지오시티와 더샵스타파크 가운데에... 나서 여행온 기분이었어요! 야외 테이블에 앉아서 빵먹으니까 너무 좋더라구요 시간이 촉박해서 급하게 먹고 왔는데 나중엔 여기 앉아서...,2021. 7. 10.
[위아트 직원의 그림 추천] 니콜라 드 스탈 - 지중해 풍경,매장 위치 | 경기 분당점 : 경기 성남시 분당구 수내동 14 롯데백화점 1층 (***-***-****) 경남 창원점 : 경남 창원시 성산구 중앙 대로 124 롯데백화점 6층 (***-***-****) 부산 광복점 : 부산광역시 중구 중앙동 7가 롯데백화점 아쿠아몰 6층 (051-678-3673) ※쇼룸에 관한 문의는 고객센터 1644-8697로...,2021. 6. 29.
"[분당 태국음식] 율동공원 맛집 <타임포타이> 재방문기 (뿌팟뽕가리, 팍푹화이뎅)","◎ 영업시간 : 매일 11:00 - 22:00 연중 무휴 ◎ 교통 : 경기 성남시 분당구 문정로144번길 5 율동공원 주변 식당, 카페들은 대부분 넉넉한 주차장을... 태국 여행을 가면 꼭 먹었던 음식이 모닝글로리인데요. 처음에는 그냥 시금치 같았는데 먹다 보니 식감도 살아있고 짭짤한 소스와의 조화로움이 완전...",2021. 6. 15.
"분당드로잉카페,분당이색카페,분당미술카페 성수미술관 분당점",연락처 : 0507-1329-5194 주소 : 경기 성남시 분당구 황새울로360번길 42 2층 영업시간 : 매일 11:00 분당AK백화점에 그림 그리면서 차도 마시는 이색 카페가... 여행도 못가는 요즘 집에만 있기 심심할때 차마시며 그림 그리는 성수 미술관에서 숨은 재능을 발견해 보는 것도 좋을 듯 싶어 포스팅해 보았어요....,2021. 6. 10.
부모역량 강화 프로그램 '자.부.심' - 원데이 템플스테이 참여후기,"성남위례종합사회복지관에서는 경기공동모금회의 지원을 받아, 이러한 워킹맘들이 보다 긍정적이고 밝은 마음으로 아이들과 돈독한 관계유지할... 이상, 성남시 워킹맘을 위한 심리 정서 지원 프로그램 '자부심' 소식이었습니다. 자... 평온한 마음으로 다시 아이를 보러... . . . . . . . . . . ""왔어? 좀...",2021. 6. 28.
울릉도 여행 :: 저동에서 관음도 + 콜택시 후기,"울릉도 여행 :: 저동에서 관음도 + 콜택시 후기 시작부터 쉽지 않았던 섬, 울릉도. 강릉항에서 울릉동 저동항까지 약 3시간30분 간 배를 타고 오면서... <울릉도 관음도 입장료> - 성인 기준 4천원(자매도시 무료 입장!!!) - 운영시간 : 09시-18시(입장 마감 17시) - 자매도시 : 경기 안양시, 성남시, 구리시...",2020. 10. 18.
[신흥동 맛집] 낙곱새 맛집은 여기! 국민낙곱새 성남점,국민낙곱새 성남점 주소: 경기 성남시 수정구 공원로367번길 17 전화: 031-735-2792 영업시간: 매일 11:00~23:00 신흥동 맛집 국민낙곱새 성남점은 비조리... >_< 바로 끓여먹을 수 있는 친환경 냄비에 포장되는데 여행이나 캠핑 갈때도 바로 끓여먹으면 되니 정말 편하겠더라구요. 요새 코로나 시국에다가...,2021. 7. 13.
서울근교 야외캠핑식당 성남정글바베큐,"깔깔) 종종 커플모임으로 맛집도가고, 집에도 놀러가고, 여행도감 이날은 야외식당을 가고싶어서 범쓰가 알아본 성남정글바베큐로 고고... 경기 성남시 수정구 달래내로207번길 44-3 매일 12:00 - 22:30 명절휴무 #서울근교야외식당 #성남정글바베큐 #판교정글바베큐 #서울근교캠핑식당...",2021. 7. 15.
인천 가볼만한곳 수인분당선 타고 떠나는 여행지 5,"얼른 코로나가 진정되어 이러한 실내 여행지들도 자유롭게 구경할 수 있는 시기가 온다면 수원, 안산, 성남시 등 경기남부권에서도 새로 뚫린 수인분당선을 타고 인천의 다양한 여행지들을 더 편하게 여행을 해보면 좋을 것 같습니다.",2020. 9. 17.
고메여행- 야마다야,주소: 경기 성남시 분당구 구미로 124 굿모닝프라자 영업시간: 매일 11:00 - 15:00 매일 17:00 - 20:30 화요일 휴무 연락처: 031-713-5242 주말에 방문한 분당에 위치한 야마다야 담백한 맛이 일품이고 일본 현지에 본점을 두고 있다. 주차는 오른쪽 주차장에~~ 인기가 많아서 대기표를 받았다....,2020. 6. 15.
성남호텔 - 힐라시스 호텔 (Healasis Hotel) - 모란역,#성남호텔 #성남숙소 #힐라시스호텔 힐라시스 호텔 힐라시스 호텔 (Healasis Hotel) 숙소측 설명 : 비즈니스 및 레저 여행 모두를 충족시킬 수 있는 본... 주소 : 경기 성남시 중원구 산성대로 120 위치 : 성남 숙소 객실수 : 36 체크인 시작시간: 17:00 체크아웃 마감시간: 12:30 리셉션 종료 시간: 00:00 숙소...,2021. 7. 20.
"투데이 삼계탕 (경기 성남) 일산서구반찬가게,제철반찬 (경기 고양) 서울 최고의 아귀찜...","3GO> 성남 3GO 여행 초원의 집 경기 성남시 수정구 수정로 460 (단대동) 031-742-5449 (8호선) 산성역 1번 출구 1048m #삼계탕 14,000 #누룽지삼계탕 16,000 매일 10:00~21:30 <우리 동네 반찬 가게> 믿고 먹는 맛! 전라도 손맛으로 만드는 제철 반찬 마미당 경기 고양시 일산서구...",2020. 10. 23.
분당 서현동 맛집 추천 태국 음식 맛집 방콕스토리,여행은 못 가지만 음식이라도 먹으려고 다녀온 분당 서현동 맛집 방콕스토리 광교 경기대 후문 쪽에 있어서 이미 먹어봐서 믿고 방문했어요 오픈... 주소:경기 성남시 분당구 서현로210번길 2 성지하이츠텔 2층 204호 전화:031.707.4985 주차:가능 주차 후 엘리베이터 타고 2층으로 가면 바로 보이는...,2021. 6. 3.
더하노이풋앤바디 판교역점 판교마사지,"더하노이풋앤바디 판교역점 주소 : 경기 성남시 분당구 판교역로 152 알파돔타워 3층 전화 : 031-622-7177 명절연휴에도 정상영업을 하는 판교마사지... 도심속 휴양지 컨셉으로 운영중이라던데 해외여행을 못가는 요즘 제대로 힐링하는 시간을 가질 수 있다. 발몽, 딸고 독점 파트너십 매장으로...",2021. 9. 27.
“김포 대리점주 끝내 극단 선택까지 간 이유...” 이웃 대리점주가 말하다,"술자리도 자주 하고, 휴가를 맞춰서 함께 가족여행을 다녔다고 한다. 이씨는 A씨가 극단적인 선택을 하기 3일 전까지도 통화를 주고 받았다. 이씨는... 영상은 2019년 4월 경기 성남시 한 택배 분류장에서 택배노조 부위원장이 비노조원을 폭행하는 모습. /택배기사 권리찾기 전국모임 “내연녀...",2021. 9. 25.
"AK플라자 분당점 피터팬네버랜드, 어버이날 부모님과 함께 러블리한 포토존에서 찰칵!","자녀분들과 함께 포토존을 즐겨 보세요=) 코로나 때문에 해외 여행도 못 가고 슬픈 마음, AK플라자 분당점 피터팬네버랜드 포토존에서... 이웃님들 주말 잘 보내세요 ♡ - AK플라자분당점 경기 성남시 분당구 황새울로360번길 42 평일 10:30 - 20:00 (월-목) 주말 10:30 - 20:30 금-일 주차 가능",2021. 5. 8.
도내 첫 공공형 마을 정원 '모두의 정원'! 아이부터 어른까지 모두 함께 힐링하러 오세요~,"도내 최초 공공형 마을정원, '모두의 정원'이 성남시청 공원 내에 조성됐습니다! '모두의 정원'은 약 3000㎡의 규모인데요. 2016년 시청공원에서 열린 경기정원박람회 출품작 29개 중 노후한 정원 다섯개를 하나의 정원으로 묶어 디자인한 형태이며, 지난 3개월 간 2억 5000만원 (도비 30%, 시비 70%)를...",2021. 7. 31.
경기도 아이와 가볼만한곳 국립수목원 외 식물원,신구대학교식물원 주소 : 경기 성남시 수정구 적푸리로 9 휴무일 : 월요일 휴무(단 4월10일 ~ 6월7일 봄 시즌은 영업함) 이용시간 : 09:00~18:00 (폐장... 신구대학교식물원을 처음 알게 된 계기는 평소 사진을 찍으러 여행을 많이 다니는 지인의 적극적인 추천 때문이었어요. 자연물에 관심 많은...,2021. 5. 7.
성남꽃집 활짝핌 플라워 원데이클래스 리스만들기 후기,"활짝핌 주소 : 경기 성남시 수정구 고등로2길 2 101호 영업시간 : 평일 10:00 - 20:00 / 일요일 휴무 주차 가능 http://infullbloomflower.com/ & 플라워... 원데이클래스 외에 취미반, 전문가반, 플로리스트 육성반, 창업반 등 다양한 형태의 수업이 있었는데 나는 혼자 힐링하러 떠난 여행이라 기존의 플라워클래스...",2021. 7. 19.
강남미즈힐산부인과 외 간호조무사채용 간호사구인구직 피부관리사일자리 공고...,"(주1~2회 4~5시 조기퇴근,각종복지,직원해외여행)] · 채용직종 : 간호조무사, 간호사, 수술실보조 · 급여조건 : 간호조무사... 해피닥터클리닉 경기 성남시 [[분당] 피부미용클리닉 피부관리사/간호조무사(신입/경력)모집] · 채용직종 : 간호조무사...",2021. 7. 12.
"분당 정자동 맛집 ""코이라멘"" :: 일본 라멘 맛집 코이라멘 본점",벌써 몇년째 다니던 유일한 라멘집 코이라멘만의 맛으로 확실히 승부본 곳이라 이제는 여기저기 체인점도 늘어났다 코이라멘 본점 경기 성남시... 일본여행때도 라멘집에서 불편하게 먹었던 기억이 많아서 일본생각나는 맛이 이거때문인가 싶기도하다ㅋㅋ 맛있게 먹는법도 있으니 취향에 따라...,2021. 6. 13.
성남 분당 김밥집 45명 집단 식중독! 29명 입원,경기 성남시 분당에 있는 한 김밥집 손님 40여명이 집단으로 식중독 증상을 보여 해당 지역이 발칵 뒤집혔다. 2일 성남시 분당구에 따르면 지난달... 여행중이랍니다. 여러 관광지를 돌면서 마음의 휴식을 얻었죠! 근데 몸이 지쳐가고 있었습니다 >< 시민 김모(53)씨는 매체에 “A김밥집 근처 학원에...,2021. 8. 3.
분당 율동공원 오리고기 맛집 청덕원 (주차 정보),"청덕원 영업시간 10:00-23:00 단체석, 주차, 포장, 배달 가능 경기 성남시 분당구 문정로140번길 9-1 분당 율동공원 맛집으로 유명한 청덕원에 다녀왔다. 청덕원 가는 길은 뭔가 가평같기도 하구 암튼 가는 길 분위기가 여행간 듯 참 좋당 청덕원 바로 앞엔 주차장이 있어서 주차걱정도 노노노...",2021. 7. 5.
성남 신흥동 The유부 뚱유부초밥 가성비 최고야,유부 경기 성남시 수정구 시민로160 1층 더유부 연락처 031-747-1198 아직 영업시간은 제대로 표기를 안해놓으심 . 물어볼걸 아쉽다 오픈을 최근에... 성남 신흥동에 생긴 대형유부초밥 재구매의사 있구욘 앞으로 피크닉이나 여행 갈 때 김밥 대신에 간단하게 사먹고 가기에도 딱! 일듯 성남이마트...,2021. 4. 3.
분당 구미동 하인선생 중식당에서 사랑스러운 아가의 소규모돌잔치 준비!,바람도 살랑살랑 불어오는데 너무너무 여행이 가고 싶더라구요.코로나때문에 못갔던 여행들은 코로나가 종식되고 나면 갈 마음으로 기대하고 있어요^^ 주소 : 경기 성남시 분당구 구미로 191 아산웰빙프라자 401호 영업시간 : 11:30~22:00 전화번호 : 031-717-0888 주차 : 지하주차가능 20만원대 출장돌상...,2021. 6. 17.
서울우신장례식장 다물라구 누군 날 담굴라고용써도 할,해외여행 기대감은 여전하다 우려했던 극심한 폭염이 찾븸아옵니다 녹십자가 일본 푧희귀질환 치료제를 공동 개발홦한다 대전뉌대전 지역 첫... 선언했다 경기 성남시 분당구에 거주하는 집에서 바폐질과 비타민 적상추를 기른다 19컫세기 초 유럽 각지에서 특이한 화석이뒆 발견되기...,2021. 8. 3.
미금역 안경 추천 으뜸50안경 선글라스 후기,"으뜸50안경 미금역점 주소 경기 성남시 분당구 성남대로 170 (금곡동, 한국프라자) 연락처 031-716-5050 매일 10:00 - 22:00 여름 필수품 하면 선크림과 바로... 다니는데, 여행갈때나 운전할 때 맹눈으로 다녀서 늘 신경이 쓰였어요~ 그래서 이번에 좋은 선글라스 하나 장만해주려고 ""으뜸50안경원 미금점...",2021. 7. 30.
"더플레이스 현대백화점 판교점 -아이들과 즐겁게 먹은 메뉴, 폭탄피자 강추!",더플레이스 현대백화점 판교점 경기 성남시 분당구 판교역로146번길 20 현대백화점 판교점 5층 용인에서 즐겁게 여행후 서울 올라오는 길에 점심을 먹기 위해 들린 #더플레이스판교점 주말 점심이라서인지 매장 안쪽은 자리가 없어서 밖 테이블로 자리 잡았어요. 잡지같은 느낌의 화사한 메뉴판~ 뭘...,2021. 6. 9.
