header,contents,date
대부도 펜션밸리 바다풍경(오션뷰) 풀빌라 펜션 가성비 갑!,2단지 주소로 찍고 가야함 경기 안산시 단원구 대부남동 736-35 오션뷰 펜션(바다풍경) 펜션 도착! 실내 온수풀 예약은 신의한수! 궂은 날씨에도 물놀이가 가능하다는 크나큰 장점이 :) 여기에서 바베큐도 해서 먹었지요 1등으로 도착해서 사진 열심히 담아보기 ㅋ 1층 거실과 부엌 (노래방 기계있다...,2020. 9. 16.
경기 바다 안산 탄도항/경기도 바다향기수목원/안산대부광산퇴적암층/대부도 가볼만한곳,탄도항 경기도 안산시 단원구 선감동 717-5 도착하니 대형선풍기 3대가 있어요. 크기가 으리으리해요. 근데 사진 찍기엔 날씨가 좋지 않아서... 저녁이 되어가네요. 이 사진을 마지막으로 찍고 집으로 고고했어요. 경기바다공모전 응모 겸 경기바다 여행 끝~,2021. 6. 24.
[대부도맛집] 대부도칼국수맛집 푸른섬 식당,안녕하세요 여행읽어주는남자 거녕이 입니다 :D 대부도 여행 가서 먹고 온 푸른섬 식당 소개해드릴게요 ~~~ 푸른섬 식당 경기 안산시 단원구 구봉길 201 대부도 시화방조제 넘어서 바로 초입쪽에 위치해 있어요 :) 내부는 엄청 넓은 공간으로 최대 70명 단체까지 받을 수 있는 공간 이래요 ~~ 창가자리는...,2020. 1. 26.
엄마랑 안산 데이트/고잔동맛집 오복당,"입구부터 범상치않음을 느낄 수 있음>.< 2월에 엄마랑 대만여행 가기로 했던게 코로나 바이러스 때문에 못 갔는데, 대만여행 대신 대만... #포토존은덤 #엄마랑데이트 #안산데이트코스 영상 렛츠 고! 070-8250-8345 경기 안산시 단원구 광덕2로 163-5 매일 11:00 - 23:00 / 브레이크타임 15:30 - 17:00",2020. 5. 8.
대부도 글램핑 캠핑장 Best 3! 캠핑용품 없이 여행 가기,"여행 생각이 많이 나는 계절, 가을입니다. 최근 들어 캠핑하시는 분들이 많이 늘어난 것 같습니다. 제 주변에서도 캠핑장으로 여행 가시는 분들이... 대부도 퀸스비치 부대시설 ▼ 대부도 퀸스비치 위치 대부도 캠핑성 경기 안산시 단원구 부흥로 232-68 대부도 캠핑성은 최대 5인까지 수용 가능한...",2020. 10. 27.
"대부도 오션뷰, 갯벌뷰 :: 카페 루헤(RUHE)",안녕하세요 은푸입니당 지난주에 친구들이랑 대부도 여행을 갔다왔는데요 너무 이쁜카페를 찾았어요! 바로 소개해드릴게요! 카페 루헤 경기 안산시 단원구 서위매봉길 32 매일 : 10:00 - 21:00 (last order : 20:30) 주차 가능 SNS에 업로드하면 음료1000원 할인 이벤트도 하네요!.! 저희는 루헤크림 플렛...,2021. 9. 26.
[대부도여행] 쭈꾸미낚시 / 핀란드카라반펜션 / 대부도 가볼만한곳 / 내돈내산 후기,"즐거운 여행에서 기분 상해버린거 있죠ㅠㅠ 그래도 쭈꾸미낚시 자체는 정말 재밌어서 다음에 다른 업체로 또 낚시하러 가고 싶어요~!! 배 타고... 핀란드카라반펜션 스위트 101호 경기 안산시 단원구 대부남동 1172-24 입실 15:00 - 퇴실 11:00 ***-****-**** 필란드카라반펜션은 카라반도 있고, 펜션도...",2021. 2. 15.
가족여행으로 가기 좋은 대부도펜션,"이제 곧 봄 되고, 또 눈 깜짝할 새에 5월이 될 텐데 어버이날 효도 선물로 여행 보내드리면 좋을 거 같단 생각을 했습니당 ㅎㅎ 이곳에서 만끽했던 햇살이 너무 그립네요 ㅜㅜ 빠이팅!! 뜨락펜션 전화번호 : ***-****-**** 주소 : 경기 안산시 단원구 구봉길 183-9, 대부북동 1871-21",2021. 2. 25.
인천공항콜밴⚘안산시 사동센딩 ✈인천공항까지♀️편안하고♀️안전하게,"인천공항콜밴 안산시 사동에서 센딩 말레이시아 #가족여행 가시는 고객님들 모시고편안하고 안전하게 인천공항 제1터미널에 도착했습니다... 가족여행 #친목여행 #해외경기출전 #골프여행 #해외출장등등 예약 주시면 집 앞에서 공항까지 주야로 365일 운행합니다 #외국인,바이어등 고객님...",2020. 1. 4.
안산 대부도 여행 | 판타루시아 펜션,판타루시아 펜션 경기 안산시 단원구 본말길 118-2 오랜만에 안산 대부도를 다녀왔습니다! 판타루시아 펜션에서 잘 놀다 왔어요 대부도는 경기 근교에서 여행가기 정말 좋은곳인거 같아요+_+ 아기자기한 건물들이 여러채가 모여 있는 곳이었습니다 정원도 넓고 바로 앞에 바다가 있어서 위치가 정말...,2020. 12. 21.
"대부도독채펜션, 포커스펜션 다녀왔습니다!","요번에 여행을 갔다왔습니다 매년마다 너무 좋아서 가는 대부도에서 유명한 대부도 독체펜션, 포커스펜션인데요~ 제가 왜 항상 가고 추천을... 아래 인스타 링크 통해서 더 많은 소식 구경 해보세요~ https://www.instagram.com/focus_pension 주소: 경기 안산시 단원구 참살이4길 2 포커스펜션 #대부도펜션...",2021. 9. 28.
"푸른섬 캠핑장, 대부도 :)",4.3km의 긴 산책로를 구경하는데 메타세콰이어 길과 포토스팟 들이 간간히 자리를 잡고 있어 데이트 및 가족여행으로도 제격! 5) 구봉도 낙조전망대 캠핑장과의 거리 : 약 2km 주소 : 경기 안산시 단원구 대부북동 산23 입장료 없음 태양을 상징하는 금빛 조형물이 보이는 전망대. 길에 따라 다르지만...,2021. 10. 7.
LG전자 베스트샵 초지점 가전 할인 에어컨 특별행사중,주소 : 경기 안산시 단원구 원포공원2로 31 / 연락처 031-413-1300 영업시간 평일 10:30 - 20:30/토요일 10:30 - 20:30/일요일 11:00 - 20:30 공휴일 포함 에어컨... 1박 여행중에 하룻밤을 보낸 호텔에 스타일러가 있는거에요. 아무생각없이 자켓을 넣고 작동시켜봤는데 대박! 꼭 새옷처럼 구김도 싹 없어지고...,2021. 5. 26.
안산시 단원구 아파트 김치냉장고버리기 싱크대짐정리 커텐버리기 카페트처분...,"인천, 경기 지역 고객님이 원하시는 곳으로 어디든 출동하고 있으며 24시간 문의받으니 사진과 전화로 언제든 물어봐주시기 바랍니다^^ 안산시... 안쓰는 여행가방까지 깔끔하게 처리해드리고 고객님께 확인받아 오늘의 현장을 마무리해드렸습니다^^ 아파트, 오피스텔, 주택빌라, 사무실, 매장...",2021. 7. 26.
대부도 데이트 하기 좋은 대부도 맛집 돈까스공방,"요즘은 시국이 시국인 만큼 원거리 여행은 힘들고 그렇다고 해서 너무 집에만 있기에도 힘들기에 가볍게 방문이 가능할 수 있는 대부도로... - 업소명 : 돈까스공방 - 주소 : 경기 안산시 단원구 뻐꾹산길 22-18 - 전화번호 : ***-****-**** - 운영시간 : 11:00 ~ 19:00, 월요일, 일요일 휴무, 명절 당일 휴무...",2021. 10. 1.
"[대부도 펜션]포커스 펜션, 대부도 수영장 펜션",올 가을 대부도 여행 독채 풀빌라 찾고 계시면 포커스 펜션 추천드릴게요 주소 경기 안산시 단원구 참살이4길 2 포커스펜션 입실 14:00 - 퇴실 11:00 https://www.instagram.com/focus_pension #대부도펜션 #대부도포커스펜션 #대부도키즈펜션 #대부도독채펜션 #대부도풀빌라펜션,2021. 10. 1.
안산 가볼만한 곳 화랑유원지 다녀왔어요,"다시 안산으로 가는 날에는 부디 박물관 관람 또한 가능하기를 바래봅니댜 화랑유원지 031-481-3175 경기 안산시 단원구 동산로 268 날씨 요괴 답게... 가주시기, 경기도, 서울 근교 가볼만한 곳 찾는 분들도 이곳을 떠올려주세요 :-) * 여행 블로거 하은쓰의 여행 리뷰 & 정보 추천* < 전주 1박 2일 여행...",2020. 6. 26.
[안산 대부도 여행/맛집] 칼국수 맛집 포도밭할머니 손 칼국수,위치 : 경기 안산시 단원구 대부황금로 1394(대부북동 1854-113) 포도밭 할머니 손 칼국수는 바다향기 테마파크 인근에 있습니다. 안녕하세요. 소소한 일상의 민이입니다. 바다 향기 테마파크에서 한동안 힐링을 하다가 어느덧 점심시간이 되서 포도밭 할머니 칼국수집으로 칼국수를 먹으러...,2021. 5. 21.
"[안산 중앙동 맛집] 쾌적한 환경에서 먹는 깔끔한 한 끼 '상무초밥' (주차, 주소, 가격...","주소는 경기 안산시 단원구 당곡로 10 1층 롯데백화점 신관 맞은편이다. 메뉴 및 가격 Previous image Next image 메뉴와 가격은 슬라이드 사진 참고. 우리는 일요일 낮 12시쯤 방문했고, 런치 특선 초밥 B를 주문했다. 주말에도 런치 메뉴 주문이 가능하다! 영업시간 매일 11:30~23:00 영업한다. 깔끔한 음식...",2020. 8. 16.
개운한 낙곱새 전골이 있는 신우정 진짜 대부도 맛집이에요.,근처 여행가시면 방문추천드려요. 아래 클릭시 이동합니다. 재료를 아끼지 않아서 더 맛있는 파전과 사장님의 친절한 서비스가 인상적인 대부도 맛집 신우정이었어요. 대부도방아머리해수욕장 바로 앞에 있으니 방문하시는 분들은 참고하세요. 주소 : 경기 안산시 단원구 대부황금로 1484...,2021. 9. 30.
"함께 떠나는 봄 여행지Ⅰ안산 힐링 스팟 ""대부도""여행방아머리해수욕장&별빛마을포토랜드","추위와 코로나로 인해 유난히도 길게 느겨졌던 이번 겨울, 여행을 마음대로 즐길 수 없으셔서 많이 답답하셨죠! 드디어 추운 겨울을 지나, 이제... 별빛마을포토랜드 경기 안산시 상록구 수인로 1723 낮에 햇빛과 바다를 보며 마음을 다스렸다면 밤에는 화려한 불빛을 보고 마음을 정화합니다. 빛과...",2021. 3. 1.
"경기도 안산 와동맛집, 경기도 안산 민물매운탕 '강마을민물매운탕' (feat. 빠가사리...","주말 아침, 경기도 여행을 마치고 왔다. 평일 직장인으로서, 블로거로서 그리고 취미생활까지 하려니 몸이 10개라도 모자를 지경 ㅠㅠㅠ 그럼에도 불구하고 다녀온 '강마을민물매운탕' 강마을민물매운탕 위치 경기 안산시 단원구 사세충열로1길 11 (1층) 예약문의 031-414-7773 매일 12:00 ~ 22:00 (매주...",2021. 10. 4.
"안산, 애견동반가능카페 : 크레바스","크레바스 경기 안산시 상록구 한양대학로 16 영업시간 : 10:00 ~ 24:00 (연중무휴) 안산 사동에 위치한 크레바스카페 원래 다른 애견동반카페을 찾다가 문을 닫아서 찾은 크레바스 이곳은 1,2,5층로 이루어졌다. 그리고 5층 루프탑만 애견동반이 가능하다고한다. 골목 뒷쪽에 주차후 카페로 고고...",2020. 5. 23.
"대부도 카페 추천 DBB, 서울근교데이트 어때요","대부 DBB 카페 ( DBB CAFE ) *주소 경기 안산시 단원구 구봉길59 *전화번호 032-891-5887 *운영시간 AM 11:00 ~ PM 20:00 ( L.O PM 19:00 ) ( 매일 / 매주 월요일 휴무 )... 안산을 대표하는 여행명소중에 하나이자, 시화방조제라는 것을 구경할 수 있으며, 'DBB카페'와 같은 경우에는, 그러한 대부도를 대표하는...",2021. 5. 10.
인천공항콜밴 ✈인천공항에서 픽업⚘안산시백운동까지스타렉스5인승리무진콜밴으로...,인천공항콜밴 인천공항 제1터미널에서 픽업 안산시 백운동까지 편안하고 여유롭게 도착했어요 전화는안되고 카톡만 전국콜밴협동조합... ㅎㅎ #효도여행 #가족여행 #친목여행 #해외경기출전 #골프여행 #해외출장등등 예약 주시면 집 앞에서 공항까지 주야로 365일 운행합니다 #외국인...,2020. 1. 8.
"2021년 1월 15일 생방송 투데이-보고먹고즐기고(무주), 우리동네반찬가게(서울 동작구)...",3GO - 무주 3GO 여행 편 ▶<머루 와인동굴> 주소 : 전북 무주군 적상면 산성로 359 번호 :063-322-4720 머루주 ▶<무주어죽> 주소 : 전북... 빅데이터 랭킹 맛집 - 수도권 최고의 코다리찜 TOP 5 편 ▶<말뚝이덕장> 주소 :경기 안산시 상록구 광덕3로 322 번호 : 031-415-8252 *방송된...,2021. 1. 15.
"[TV속 정보]1월 29일 (금) 2TV생생정보, MBC생방송오늘저녁, SBS생방송투데이 나온...",3GO - 인제 3GO 여행> ▶백담계곡 강원 인제군 북면 용대리 ▶우주스쿠버 ☎070-4801-6017 *아이스다이빙 문의 경기 안산시 단원구 동산로 63 B2 ▶매바위 인공폭포 강원 인제군 북면 용대리 ▶재래식손두부 ☎033-463-1858 강원 인제군 인제읍 인제로178번길 52-10...,2021. 1. 29.
대부도펜션 : 판타루시아,트여져 있어서 쾌적하고 좋았고~ 2층 창문에서 바라보는 뷰는 바다가 보이는 오션뷰!! 저 멀리 갯벌 뒤로 펼쳐진 바다가 보이는 판타루시아 펜션~ 조용하게 쉬기 좋고 바닷가 바로 앞이라 일몰 감상하기에도 좋은 판타루시아였어요. - 대부도펜션 : 판타루시아 032-883-6900 경기 안산시 단원구 본말길 118-2,2020. 7. 7.
"안산 장어 맛집, 진장어에서 남친 몸보신 시켜줬다! 복분자랑 장어의 만남",싶어 여행 전에 안산 장어 맛집을 급히 찾았다. 안산 사는 지니를 위해 유명한 장어요리전문점 진장어에서 몸보신이라도 시키고 여행에... 장어요리의 달인 장어 장인 진장어!!!! 이런 맛집은 정말 오래오래 잘되어야한당 ㅠㅠ 잘먹었습니당!!! 주소: 경기 안산시 상록구 부곡동 728-15 매장: 031-483-5482,2020. 7. 15.
아기랑 영흥도 대부도 여행_대부도 쭈꾸미 맛집 천하수산 알이 꽉찬 제철 쭈꾸미,"천하수산 경기 안산시 단원구 대부황금로 114 0507-1307-3765 매일 08:00~22:00 단체,주차가능. 방갈로이용가능 건물 뒷편으로 방갈로들이 쭉 있었다. 우리는 날씨가 아직 쌀쌀하기도 해서 이용은 안했지만 나중에 가족들끼리 여행와서 방갈로에서 프라이빗하게 식사하면 정말 분위기 좋을 것 같다. 우리...",2021. 4. 1.
[대부도 여행] 퀸스비치 글램핑 펜션 - 물멍과 불멍을 함께할 수 있는 글램핑 펜션.,포도밭 할머니 칼국수 주소: 경기 안산시 단원구 대부황금로 1394 영업시간: 매일 09:00 - 20:00 수요일 휴무 수요일 휴무 (공휴일 제외) 주차 가능 여부... 특히 여행 가서 안 먹으면 더 아쉬운 게 디저트 아니겠습니까? 그래서 선재도에 위치한 뻘다방으로 출발했습니다~ 뻘다방 주소: 인천 옹진군...,2021. 5. 28.
"안산 대부도 / 추천 식당&카페 / 솔밭우리밀칼국수, 카페 루헤","솔밭 우리밀 칼국수 경기 안산시 단원구 서위매봉길 40 단체석, 주차, 발렛파킹, 포장, 방문접수/출장, 무선 인터넷, 남/녀 화장실 구분, 국민지원금 안산 대부도에서 '대부도 우리 밀 익는 국수마을'을 조성해 먹거리 관광단지로 육성하고있다고 해요. 그래서 대부도에 들어가는 순간 우리밀 칼국수...",2021. 10. 8.
"대부도 전동바이크, 에일리언 바이크와 신나는 당일치기 여행!",나가는 길에 아까는 보지 못했던 화려한 그라피티 앞에서 사진 한 장 찍었습니다 ㅋㅋ 아이들이 외계인이라고 좋아하더라고요~ 대부도 전동바이크 에일리언 바이크 경기 안산시 단원구 대부황금로 1504 ☎ 070-4129-3233 매일 09:00 - 19:00 연중무휴,2021. 5. 26.
2020 찾아가는 문화활동 '옹이와 멍이의 동화모험',"주 소 : 경기 안산시 상록구 충장로3길 33, 서부제일교회 1층 전화번호 : 031-409-1011 운영시간 : 평일 10:00~19:30 학기 중 평일 9:30~19:00 방학 중 공연은 오전 10시 30분에 막이 올려졌습니다. 옹이와 멍이의 동화 모험의 옹이는 고양이를 말하며 멍이는 강아지입니다. 배우 두 분은 고양이와 강아지로 얼굴에...",2020. 8. 14.
3번째 방문하는 가장 저렴한 안산안경점! (으뜸플러스안경 안산상록수점 후기),"주소 경기 안산시 상록구 용신로 390 (본오동, 현대프라자) 3층 301호 전화번호 031-437-9001 영업시간 10:00~22:00 위치는 상록수역 근처 국민은행 건물... ㅋㅋㅋㅋㅋㅋ 여행은 잠시 보류상태이다보니 구매할 필요가 없음에도 넘 사고 싶은 디자인이 많았어요ㅠㅠ 레이벤, 구찌 등 다양한 브랜드가 안경테와...",2020. 7. 6.
"대부도 갈만한곳 - 메타세콰이어, 탄도항 외 3곳","대부도 대부옥수수찐빵 주소 : 경기도 안산시 단원구 대선로 275 영업시간 : 화-일 10:00 -20:00, 월요일 휴무 전화번호 : 032-884-7795 사실 이번 여행의 목적은 저번에 못먹었던 대부 옥수수찐빵이었답니다. 찐빵을 팔아서 으리으리한 건물을 지어올렸다는 이곳에 크나큰 기대를 안고 방문을 했어요....",2021. 8. 25.
풍도 지난 8일 이어 15일 전국 시청자 안방에 매력 전파,© 뉴스1 (안산=뉴스1) 최대호 기자 = 경기 안산시는 지역 대표 관광지인 풍도가 SBS '정글의 법칙'으로 전국 시청자들에게 소개됐다고 12일 밝혔다.... 생존 여행이 그려졌다. 1박2일간 풍도 매력에 푹 빠진 출연진들은 Δ자연산 김 Δ개조개 Δ홍합 Δ말똥성게 Δ참풀가사리 등 싱싱한 해산물을 맛보며...,2021. 5. 12.
"서울, 인천, 경기권 추천 캠핑장","주차장 / 경기 안산시 단원구 대부북동 1841-10 안산 메추리섬(길따라 끝지점, 바다낚시) / 안산시 단원구 대부남동 안산 탄도항 안쪽 주차장(화장실, 낚시) / 안산시 단원구 선감동 71-5 안산 반월천(화장실, 개수대, 물놀이) / 안산시 상록구 팔곡일동 안성 고삼저수지 / 안성시 고삼면 삼은리...",2020. 7. 8.
서울근교 갈만한곳 대부도 구봉도 낙조전망대 대부해솔길 설 연휴 이곳으로 떠나요!,"서울근교 갈만한곳, 지난 일요일에 친구들과 대부도로 당일치기 여행을 다녀왔습니다. 불과 1시간이면 충분히 갈 수 있는 감성 돋는 겨울바다... 사또횟집 주소 : 경기 안산시 단원구 대부황금로 1479 연락처 : 032-881-4424~6 영업시간 : 10:00 - 22:00 대부도 달 전망대 서울근교 갈만한곳 적어도 대부도에...",2020. 1. 22.
월피동맛집 꽃피는화덕피자D485 월피공원점 화덕피자 존맛탱,#안산월피동맛집 #화덕피자맛집 장소 위치 주소 : 경기 안산시 상록구 예술광장로 31 (월피동 445-25 2층 203호 꽃피는화덕피자 D485 월피공원점)... 유럽여행갔을때 맛있게 먹었던 피자를 기억하며 +_+ 버팔로치즈는 식감이 리코타치즈랑 비슷한 것 같았어요 피자를 먹을때 조금 앙 먹지말고 입을...,2020. 5. 8.
"10년 역세권이 답이다(Part2) 서울 옆세권, 금수저 노선은? 부동산 철도여행을 떠나봅니다!","수요를 따라 여행하다가 굽이치는 곳, 그곳에 별표 치신 후 별표 그리고 밑줄 쫘악~ 대한민국 역세권 투자지도는 우리나라의 철도수맥을 하나... 부천종합운동장역 : GTX-B 노선 예정, 역세권 개발 최초의 BTO-rs사업, 신안산선 민간철도사업 안산시 한양대역을 시작으로 시흥시와 광명시를...",2021. 3. 23.
"수요미식회 출연 / 압구정역 맛집 : 베트남고향식당 2호점 쌀국수, 볶음밥, 월남쌈",*1호점은 경기 안산시 단원구 중앙대로 443 베트남 음식점답게 풍등이 천장에 달려있어서 급 베트남 여행 가고 싶어졌어요✈ 이른 저녁을 먹으러 갔는데 손님이 곳곳에 있어서 사진을 못 찍었지만 테이블이 많아서 여유롭게 식사하기 좋았어요 (●'◡'●) 쟈니의 픽 고기 볶음밥!!! 베트남...,2021. 9. 26.
1박 2일 대부도 여행 / 서울 근교 펜션 나들이 / 2000일 기념 ❤,대부 바다향기 테마파크 경기 안산시 단원구 대부북동 1841-10 펜션 여행을 계획했지만 아무것도 안하는 건 또 너무 지루할 것 같아 펜션 가기 전 바다향기 테마파크 들리기~! 날이 너무 좋아서 산책하려고 했었는데 차에서 내리니까 걷기엔 날이 너무 뜨거웠다..!! 날이 더우니까 전동 바이크 필수...,2020. 7. 21.
[안산카페] 잠시 들러서 몸 녹이고 가요~ 화정다방(feat.바리스타 챔피언의 맛),잠시 여행 온 기분 화정다방에서 잠시 쉬다 가세요~ #동네커피 #바리스타전문 #콜드브루라떼 #수제디저트 #파노라마뷰 안녕하세요 여러분! 오늘은... 주소: 경기 안산시 단원구 꽃우물길 90 전화번호: 031-402-0030 영업시간: 매일 11:00-22:00 주차: 건물 앞 주차 겨울에만 시즌 메뉴로 판매하는 군고구마...,2020. 1. 16.
제부도 당일치기 여행 기록 (일번지 현정이네 조개구이/카페 제부리),여행의 시작은 휴게소에서 간단하게 먹으려고 했는데 배부르도록 먹어버렸다; 너무 맛있잖아 앞으로 휴게소는 #덕평휴게소..! . . 제부도 워터워크... 제부도 안녕 탄도항 경기 안산시 단원구 선감동 717-5 마지막 코스는 내가 좋아하는 #탄도항 걷고 걷다 보니 끝까지 오게 되었다. 올 때마다 물이...,2021. 1. 17.
[여행추천] 야경의 꽃 안산 별빛마을포토랜드(사진대방출),여행지는 안산 별빛마을포토랜드 입니다. 밤에는 수 많은 불빛들이 반짝반짝 한 곳 인데요 항상 지나가면서 와 예쁘다 라는 말이 계속 나오던 곳 이였습니다 ! 코로나 때문에 갈 수 없는 곳 들이 많아져서 어디갈까 생각하다가 딱 생각나서 한걸음에 달려갔습니다 :) '별빛마을포토랜드' 경기 안산시...,2020. 12. 14.
"[TV속 정보]1월 15일 (금) 2TV생생정보, MBC생방송오늘저녁, SBS생방송투데이 나온...",kr #생투무주여행 #생투무주나온나온곳 ▶<머루 와인동굴> 주소 : 전북 무주군 적상면 산성로 359 번호 : 063-322-4720 ▶<무주어죽> 주소... 주소 : 경기 안산시 상록구 광덕3로 322 번호 : 031-415-8252 #생투인생분식 #생투왕만두 #생투왕만두집 #생투수제왕만두...,2021. 1. 15.
"[여행] 안산 벚꽃 여행지, 화랑유원지",- 주소 : 경기 안산시 단원구 동산로 268 - 운영시간 : 상시개방 - 화장실 유무 : 있음 - 주차장 여부 : 공원 내 공영주차장 3개 지하철로 오시는 분들은 고잔역에서 15~20분 정도 걸으시면 나옵니다!! 저는 고잔역에서 안산페달로를 이용해 다녀왔어요. 저처럼 페달로 이용하시는 분들은 화정천 따라...,2021. 4. 1.
상록수역맛집 안산양꼬치 브라더양고기 무한리필,"[브라더양고기] 주소 경기 안산시 상록구 본오로 136 영업시간 13:00-01:00 전화번호 031-415-7665 기타사항 양고기 무한리필 13,900원 이웃님들 안녕하세요!... 이래서 다들 양고기 양고기 하나봅니다ㅋㅋㅋ 제가 중국으로 여행을 갔을 때, 하얼빈맥주와 양고기를 먹은적이 있는데, 정말 맛있었습니다 또한...",2020. 7. 15.
안산 중앙동 술집 요즘 가기 좋은 인기명,"어디 다른 지역 여행온 것 같은 느낌이 들었어요. 봄바람 살랑살랑 부니까 창문 열어놓고 낮잠자기에도 딱 좋았습니다. 오늘은 안산 중앙동... 주소 : 경기 안산시 단원구 광덕3로 175-11 (고잔동, 삼우타워) 전화번호 : 031-411-2042 인기명은 지역 이곳저곳에 있는 체인점이라 동네에 요즘 하나 이상씩은...",2020. 2. 11.
대부도 예그리나 마리스펜션 개인 월풀스파욕조 & 테라스 & 복층,안녕하세요~ 엉뚱마녀입니다^^ 대부도 1박2일여행을 계획하며 제 언니인 보라마녀는 엉뚱마녀가 늘 컴퓨터 앞에 있으니 펜션을 예약하라는... 감사합니다^^ https://blog.naver.com/paran_june/222066596460 대부도 마리스펜션 경기 안산시 단원구 소득길 15-55 032-882-8100 마리스펜션과 바로 옆 예그리나펜션은...,2020. 8. 20.
서울 근교여행 : 대부도 당일치기 여행코스로 가볼만한 곳,대부도 들어가는 첫 번째 여행 관문으로 추천드립니다! 2. 사또횟집 경기 안산시 단원구 대부황금로 1479(0507-1420-4424) 평일 10:00 - 22:00 / 주말 10:00 - 23:00 사또횟집은 방아머리해수욕장 바로 앞에 위치해 있고 대부도 해변 뷰 맛집입니다. 음식점은 3층까지 있고 400석 이상 규모와 최신 노래방 시설도...,2021. 1. 5.
"대부도, 대부도 맛집, 대부도 카페, 안산 가볼만 한 곳, 안산 핫플, 대부도 바다 여행 데이트",상세주소 : 경기 안산시 단원구 대부북동 1848-235 . . . 대부도 도착 ! 날씨는 좋은데 바다여서 그런지 바람이 정말 어마어마하게 불어서 머리가 띵 ~ 어린 아이들은 모래놀이하고 어른들은 텐트치고 수다 떨고 게임하시는데 들려오는 웃음소리가 너무 좋았다 그런데 바람이 너무 강력해서 중간에...,2021. 5. 2.
안산 고잔동 맛집 / 열린문 제주갈치전문점 / 갈치조림 밥한공기 뚝딱!,다른 식당 복층처럼 숙이지 않고 그냥 서서 다닐수 있을정도로 넓은 장소가 있네요 단체 모임 장소로도 딱이예요 20~30명도 오실수 있겠어요! 맛집에서 모임할수 있다니 최고네요 제주갈치전문점 열린문 ***-***-**** 경기 안산시 단원구 광덕2로 163-5 일요일 휴무,2020. 8. 4.
