header,contents,date
청계산 맑은 숲 공원 - 경기 의왕시여행,"청계산(淸溪山) 청계산(淸溪山)은 서울특별시 서초구와 경기도 과천시, 성남시, 의왕시의 경계에 걸쳐있는 산으로 대표적인 흙산으로 알려져 있는데 최고 높이의 좌표는 경기도 성남시 수정구 상적동 산 73-14번지에서 220m 남서쪽으로 위치해 있다. 모암은 호상 흑운모 편마암과 세립질 편마암이...",2021. 5. 12.
서울근교 둘레길 의왕시 백운호수 주차 당일치기 여행,"새소리 , 바람소리까지 느낄 수 있어 정말 힐링되는 시간이였어요 #서울근교둘레길 #서울근교당일여행 #의왕시가볼만한곳 #경기도둘레길 #백운호수둘레길 #백운호수주차 #백운호수트레킹#백운호수시간 #백운호수화장실 #강아지입양후 #주말당일여행 #경기도당일여행 #당일치기여행 #주말당일치기",2021. 4. 24.
경기도 의왕시 반일 여행 코스_갈미한글공원-모락산-임영대군묘-백운호수,"서울 근교인 경기도 의왕시로 반일 여행을 다녀왔다. 계원예술대학을 지나서 [ 갈미한글공원 - 모락산 산행 - 임영대군모역 - 점심식사 - 백운호수데크 ] 백운호수 주변에는 매우 많은 식당과 카페, 대형 베이커리가 많이 있어서 어디를 갈지 매우 고민이 될 정도였다. 갈미한글공원에서 시작을...",2021. 1. 24.
경기도가볼만한곳 의왕시의 가을 의왕 여행코스 베스트,"#경기도가볼만한곳 #의왕가을여행 청계산 청계사 11월에 떠나는 가을여행 경기도 의왕으로 떠나는 가을여행을 시작합니다 의왕시는 경기도 중서부에 위치하고 있으며 동서가 협소하고 남북이 긴 지형으로서 동쪽은 성남시·용인시·수원시, 서쪽은 안양시·군포시, 남쪽은 화성시, 북쪽은...",2020. 11. 18.
"주말,휴일 나들이:) 경기 의왕시/백운호수근처 산나래한정식(카페,정원)","-가게앞 주차공간 여유있음 -브레이크타임 피해가기 오눌 포스팅은 마무리 하겠습니당^^ 감샤해여 백운호수 2탄에서 또봬여❤ 씨유 #주말데이트,#주말외식,#경기주말맛집,#뷰밋집,#경기도힐링,#힐링데이트,#힐링여행,#상견례,#가족모임,#정원이있는,#맛집추천",2021. 10. 11.
경기 의왕시 - 210704 - 왕송호수길 따라서,"나를 찾아 여행을 떠나라고 말할 때 아침 일찍 커피를 마실 때는 삶을 당연히 아닌 철저한 준비로 맞아야 하는 때 눈물을 탄 커피를 마실 때는 세상 모든 삶과 죽음을 진실로 사랑해야 한다고 믿을 때 인생은 커피를 마실 때처럼 그리 길지 않다는 것을 안다면.. 의왕시, 왕송호수, 레일바이크.",2021. 7. 8.
"[경기IN] 의왕시, 2020년 제8회 경기정원문화박람회 개최 연기",2020년 제8회 경기정원문화박람회 개최 연기 [경기IN=박한수 기자] 의왕시와 경기도가 공동으로 추진하는‘제8회 경기정원문화박람회’ 개최를 코로나19 상황으로 시민들의 안전을 고려해 내년 상반기로 연기하기로 했다. 의왕시는‘정원으로 떠나는 소풍여행 레솔레파크’라는 주제로...,2020. 10. 14.
경기 의왕시 아이와 가볼만한곳 철도박물관 기차구경,"의왕조류생태과학관 의왕시자연생태공원등과 묶어서 일정을 짜보는것도 좋겠고 의왕레일바이크나 백운호수로 가족나들이 해도 좋을 듯! 일시 : 2019.12.24.(화) ~ 2020.3.31(화) ○ 장소 : 철도박물관 2층 특별전시실 ○ 대상 : 제18회 어린이 기차그리기대회 입상작 40점 (초등부 20점, 유치부 20점)...",2020. 1. 9.
의왕시 월암길 이야기 2탄 도심 속 힐링여행 레솔레파크,"http://naver.me/xIJGPlRc 경기 의왕시 왕송못동로 307 입장료 : 무료 대중교통 이용 시 전철 1호선 의왕역 하차 후(2번 출구 종점방향) → 버스 1-1 , 1-1, 1... 철길을 배경으로 사진 찍기도 좋고 철길을 보고 있으면 어디론가 여행을 온 것 같은 느낌에 마음이 푸근해집니다. 왕송생태습지...",2020. 12. 3.
"의왕시, 경기정원문화박람회 시민정원 공모",[세계로컬타임즈 최성우 기자] 의왕시는 제8회 경기정원문화박람회에 전시될 시민정원 12개 작품을 ‘정원으로 떠나는 소풍여행 레솔레파크’라는 주제로 공모한다. 시민정원은 왕송호수 생태습지 옆 산책로에 반원형 4㎡ 규격으로 조성돼 박람회 전시 및 산책하는...,2020. 6. 22.
의왕 철도박물관 탐방기 - 경기 의왕시 철도박물관로 142 철도박물관,즐겁고 편안한 휴식공간과 탐방명소의 중심으로 새롭게 부각되고 있습니다. 1호선 지하철로도 쉽게 접근이 가능한 공간이니 철도에 대한 관심이나 이해를 증진하고자 하는 분들이라면 한번쯤 방문해보는 것을 추천합니다. #경기도 #의왕 #의왕시 #의왕역 #지하철1호선 #철도 #박물관 #철도박물관,2020. 7. 30.
청계사 의 봄 - .경기 의왕시여행,청계사(淸溪寺) 청계사(淸溪寺)는 경기도 의왕시 청계동에 있는 조계종 소속 사찰이다. 1983년 9월 19일 경기도 문화재자료 제6호로 지정되었다. 통일신라시대때 창건하여 고려 충렬왕 10년에 중창한 사찰로 이곳에는 조선 숙종 15년(1689)에 세운 청계사적기비가 있고 조선후기의 건물로...,2021. 5. 11.
축제 의왕 레솔레파크 겨울축제 '겨울아 놀자' 2020 경기 의왕시 ♥,kr 주소경기도 의왕시 왕송못동로 307 레솔레파크 잔디광장 주최의왕시 주관의왕시 축제추진위원회 이용요금눈썰매장 이용 무료(눈썰매 대여 무료) #가볼만한축제 #가족여행 #겨울축제 #관광지 #나들이 #수도권 #신나는왕송호수겨울축제겨울아놀자 #아이와함께 #연인과함께 #이색체험...,2020. 1. 1.
[경기도민기자단] 감성 가득한 색다른 기차여행을 떠나보자! 의왕 철도테마거리,"[이미강 기자] 여름 휴가철이 되면 바다로, 산으로 떠나는 기차와 KTX에는 휴가객들로 붐볐지만 지금은 코로나19로 기차여행이 마음 속 추억이... 수 있는 의왕 철도테마거리를 찾아보시는건 어떨까요? 철도테마거리 위치: 경기 의왕시 철도박물관로 이용 문의: ☎031-461-3610 ▼ 철도테마거리 위치 ▼",2021. 6. 25.
"의왕시, 2020년 제8회 경기정원문화박람회 개최 연기",2020년 제8회 경기정원문화박람회 개최 연기 [의왕=인은정 기자] 의왕시와 경기도가 공동으로 추진하는‘제8회 경기정원문화박람회’ 개최를 코로나19 상황으로 시민들의 안전을 고려해 내년 상반기로 연기하기로 했다. 의왕시는‘정원으로 떠나는 소풍여행 레솔레파크’라는 주제로...,2020. 10. 14.
"의왕시, 2020년 제8회 경기정원문화박람회 개최 연기",의왕시와 경기도가 공동으로 추진하는‘제8회 경기정원문화박람회’ 개최를 코로나19 상황으로 시민들의 안전을 고려해 내년 상반기로 연기하기로 했다. 의왕시는‘정원으로 떠나는 소풍여행 레솔레파크’라는 주제로 지난해부터 금년 10월 박람회 개최를 목표로 의왕시민정원사 양성...,2020. 10. 14.
"정원작품 공모전 @ 경기도, 의왕시, (주)한국조경신문 #architecture #建築","소풍여행 레솔레파크 신청 방법 ▸ 문화정원 부문 : 조경, 원예, 화훼 등 정원 관련 전문가 및 종사자(개인 또는 단체 / 단체는 4인 이내)... ------------------------------ Competition #architecture #建築 2020 제8회 경기정원문화박람회 정원작품 공모전 @ 경기도, 의왕시 ▶ 건축편집자[AE] 네이버 블로그...",2020. 4. 2.
6월여행지 왕송호수 둘레길 레일바이크 경기 의왕시,[여행을꿈꾸다! 둘레길 걷기여행] BAND :: #국내여행 #(여행밴드) #여행을꿈꾸다! #6월여행지 #왕송호수 #둘레길 #레일바이크 #경... https://band.us/band/74434476/post/2146,2021. 5. 31.
소코아내손점-의왕시 백운호수 맛집,일본여행해보신 분들은 다들 아는맛 그래서 더 맛있고 더맛있다고 얘기할 수 있는 카레 의왕시 백운호수 근교에 위치한 소코아내손점 맛있는... 영업시간 11:30 ~ 15:00/ 17:00 ~ 21:00 브레이크타임 15:00 ~ 17:00 경기 의왕시 복지로 118 전화번호 : 070-8803-2276 소정의 포인트를 지급받아 개인적으로...,2021. 4. 19.
청계사 - 경기도 의왕시여행,"전각으로는 극락보전과 요사를 비롯한 10여 채의 건물이 있고 경내에는 국가보물 제11호인 동종과 경기도 지정 유형문화재 제135호인 목판이 있다. ""봉은본말사지"" 에는 1879년까지의 간략한 연혁이 서술되어 있으며, 그 밖에 1689년 건립된 ?청계사사적비(淸溪寺事蹟碑)?와 1881년 작성된 ?경기좌도광주...",2021. 8. 23.
"안양콜밴정보]안양,광명,의왕시,군포,안산gagacallvan","광명,의왕시,군포,안산콜밴 gagacallvan Best Driver 인천공항갈때 필수 입니다 자가용으로 ? 버스타고 ? 택시타고 ? ㅋ~~~~ 머리 아프죠 ^^ 4인가족 여행... kr) 출처:MTO머니투데이 경기지역 희소식 2021년 신형 리밴즈7 출시 !!! 안산콜밴,안양콜밴,군포콜밴, 광명콜밴,의왕시콜밴,정왕동콜밴 으로...",2021. 10. 6.
"Place, 서울근교 의왕시 백운호수 여기어때","백운호수 여기어때 주소: 경기 의왕시 학의동 입장료: 무료 백운호수 오랜만에 파란 하늘이 드러난 어느날... 간만에 맑은 공기를 마시러... com/entry/Place-서울근교-의왕시-백운호수-여기어때 [Place, 여기어때] 언택트가 떠오르는 포스트코로나 시대 뉴노말로써의 국내여행 서울근교...",2020. 8. 22.
경기도 의왕시산들길(부곡체육공원... 왕곡천-오메기마을-백운호수)지금이다걷기여행후기,경기도 의왕시산들길(부곡체육공원-고고리마을-통미마을-왕곡천-오메기마을-백운호수)지금이다걷기여행후기 일자 : 2020.8.17 (월) 거리 : 10.4km 걸은시간 : 03:44 의왕시산들길 걸은 방향 부곡체육공원-고고리마을-통미마을-왕곡천-오메기마을-백운호수 의왕시산들길은 부곡체육공원에서 출발하여...,2020. 8. 19.
[경기도민기자단] 경기정원문화박람회 정원으로 떠나는 소풍여행! 의왕 레솔레파크,"자연생태보존도시 의왕시에 있는 레솔레파크는 왕송호수공원의 새로운 이름으로 레(Lake - 호수), 솔(소나무, 태양 - Solar), 레(Rail - 레일)가 함께하는 공원입니다. 지금 레솔레파크에서는 정원으로 떠나는 소풍여행을 주제로 한 전시가 열리고 있습니다. 의왕레솔레파크에는 2020년 경기정원문화박람...",2021. 7. 9.
"[의왕시 맛 투어] 백운호수 주변에서 가장 맛있는 집 ""명장시대"", ""선비묵집""","""태교여행을 어디로 가볼까~?"" 생각하다가 무작정 떠나게 된 의왕, 강화도 여행! 비행기를 타고 갈까? KTX를 타고 갈까? 고민하던중! KTX가 임산부... 명장시대 백운호수점 경기 의왕시 백운로 415 입구에서부터 명장 비석이 시선을 뙇~ 사로잡았다 ㅎㅎㅎ 제18대 박근혜 대통령에게 명장 뱃지를...",2021. 7. 8.
힐링했던 의왕 롯데아울렛 맛집,자연을 느끼면서 식사를 하러 오기 좋은 곳이라서 여행을 온 듯 합니다. 건강하고 맛좋은 닭요리를 좋은 가격대에서 맛 보실수 있습니다. 푸짐한 양은 한 몫을 하고 정성있는 의왕 롯데아울렛 맛집 에 푹 빠져들게 됩니다. 2. 코코데로 _경기도 의왕시 능안길 85 대표메뉴 : 아메리카노 6.000원...,2021. 10. 2.
마포구 산후조리원·의왕시 정신병원서 새 집단감염..'숨은 감염' 37.7% 또 최고,"경기 의왕시의 한 정신병원에서는 지난 7일 종사자가 처음 확진되고선 지인 1명과 이용자 5명이 코로나19 양성으로 확인됐다. 누적으론... 부산 지인·가족여행모임 관련해선 접촉자 추적관리 중 3명이 추가로 나와 총 27명이 됐다. 지표환자가 발생한 모임 참석자 6명, 가족 11명, 지인...",2021. 9. 17.
서울근교 나들이 : 의왕시 백운호수 다리 워킹 및 기와 카페 테이크아웃,있더라구요 ㅎㅎ 무튼 이상 간략했던 백운호수 다리와 기와카페 리뷰를 마치겠습니다. #백운호수 #서울근교데이트 #서울근교여행 #백운호수카페 #백운호수예쁜카페 #백운호수뷰좋은카페 #백운호수기와# 기와카페 #기와쑥라떼 #백운호수다리 #백운호수주차장 #의왕시백운호수 #경기도여행 #백운호수,2021. 4. 16.
지지대 쉼터 - 경기 수원시여행,경기도 유형문화재로도 지정된 지지대비는 효성이 지극했던 정조의 마음을 담아 지금도 지지대고개 위에서 그 옛날 화려했던 왕의 행렬을 증언하고 있는 듯 서있다. 의왕시와 수원시의 경계가 된다는 것 외에 지지대비라는 역사적 숨결을 간직하고 있는 지지대고개를 찾아가보자. 지지대고개는...,2021. 3. 27.
(2021년 7월여행)2. 경기도 광주시여행. 천진암 계곡여행. 가족 나들이(ft.가벼운...,"경기 의왕시, #청계산 #맑은숲공원 https://m.blog.naver.com/oblradi/222086137097 2. 경기 양평군, #사나사계곡 https://m.blog.naver.com/oblradi/222023961668 & 3. 경기 광주시, #엄미리계곡 #은고개계곡 이곳은 이제 캠핑장은 운영하지는 않지만, 당일 물놀이는 가능한 걸로 알고 있어요 https://m.blog.naver.com/oblradi...",2021. 8. 7.
코로나여행/부모님선물로 제격인 스파더옴,"코로나여행 부모님선물로 제격인 스파더옴 요즘 또 하루 확진자가 확 늘어남에 따라 휴가는 커녕 집콕하는 분들이 많죠?ㅠㅠ 저도 어디를 가고... 결혼 준비할 때 이런 걸 알았다면 받았을텐데...아쉬울뿐...ㅜㅜ 스파더옴 경기 의왕시 학현로 111, 2층 매일 11 ~ 21시 수요일 정기 휴무 (예약 필수) 1층...",2021. 8. 12.
국내 당일치기 여행 따뜻한 초여름의 햇살과 아이의 웃음을 기억하는 BEST 4,의왕 철도박물관 경기 의왕시 철도박물관로 142 철도박물관 031-461-3610 매주 월요일 휴무 사실 의왕은 호수로 더 유명한 곳이었습니다. 언젠가 한번정도 결혼하기 전 남편과 데이트하면서 의왕 호수에서 나들이를 한 적이 떠오르는데요. 이제는 아이와 함께 국내 당일치기 여행을 자주 떠나다보니까...,2021. 6. 2.
백운호수 타임빌라스] 웁스 어데이지(식물정원 카페) & 옥상정원 전망대,"유럽여행도 못가는 시국이라 요런 카페 테라스에서 커피,디저트를 즐기면 좋겠어요. 놀이터 옆이라 아이 동반 가족이 많았네요. 웁스어데이지 롯데 타임빌라스점 경기 의왕시 바라산로 1 http://naver.me/5bXkBTDq . 옥상정원으로 올라가 보았습니다. 1층에서 올라가는 계단은 통제하고 있어요. 2,3층...",2021. 10. 7.
의왕시 도시농업관리사 1기 양성과정-2020 귀농 귀촌 아카데미,"2020.8.12.~2020.10.28.까지 총 80시간으로, 경기도와 ‘경기농식품유통진흥원’에서 주최, ‘자연과 사람들’에서 주관하고, 의왕시에서 장소를 후원한... 견학 장소로 가본 곳들은 코로나19시대에 인파가 몰리는 단풍여행 관광지가 아닌, 비교적 한적하고 가족끼리 가을의 정취를 즐길 수 있는 곳이라...",2020. 11. 12.
롯데프리미엄아울렛 타임빌라스♡가을나들이/서울근교드라이브,시간이 지날수록 이뻐지겠죠~ 주소: 경기 의왕시 학의동 1039 운영시간 : 매일 10:30 ~ 21:00 오픈한지 얼마안된 따끈따끈한~ 얼마전 다녀온... 서울근교볼거리 #서울근교드라이브 #드라이브 #의왕추천볼거리 #가을에가볼만한곳 #가을여행 #가을나들이 #가을콧바람 #글라스빌 #유리돔,2021. 10. 8.
서울근교 당일치기 여행 의왕 레솔레파크,"서울근교에서 당일치기로 이쁘게 꾸며놓은 정원과 함께 산책하기 좋은 여행지로 추천할만 하죠. 3. 의왕 스카이레일 경기 의왕시 왕송못동로 307 매주 첫 번째 월요일 휴무 이용요금: 15,000원 레솔레파크에는 왕송호수가 한눈에 내려보면서 최고시속 80km의 속도감을 느낄 수 있는...",2020. 11. 19.
"포스트 코로나 - Place, 3D 문화관광 의왕시 갈미한글공원 여기어때","문화관광 의왕시 갈미한글공원 여기어때 주소: 경기 의왕시 문화예술로 65 입장료: 무료 갈미한글공원 입구 매년 한글날이면 한글날 행사가... 문화관광-의왕시-갈미한글공원-여기어때 [Place, 여기어때] 언택트가 떠오르는 포스트코로나 시대 뉴노말로써의 국내여행 의왕시 갈미한글공원...",2020. 8. 21.
조선시대 핫플레이스 경기옛길 삼남길,2코스는 의왕시 절경을 감상할 수 있습니다. 이곳은 도시와 자연 그리고 사람이 어우러져 있답니다. 삼남길은 조선시대 정조가 화성에 행차했던 길입니다. 조선시대 옛길을 현대 문명 ‘경기옛길’ 앱과 함께하세요. 이용객분들의 편의를 제공한답니다. 조선과 현대를 오가는 여행을 위해 필요한...,2021. 6. 28.
[의왕시냉면맛집_삼채면옥] 회냉면 감칠맛 최고!,제격이어서 두컵이나 먹어버렸지 뭡니깡 흐흐 후식까지 제대로 뽕 뽑았네요 여러분들도 얼른 댕겨오세요? 다른거 다 필요없고 냉면은 꼭! 드셔보세요 오늘도 누군가에게 꿀팁이 될 수 있기를! ఇ 삼채면옥 경기 의왕시 경수대로 292 매일 10:30~21:00 연중무휴 경기지역화폐 가맹점 ☎️ 031-427-0010,2020. 6. 24.
백운호수 롯데프리미엄아울렛 타임빌라스 오픈 방문♡ (먹거리 & 맛집 상세소개),글라스빌로 들어와서 통과하면 테이스티그라운도 공간으로 연결되어 편리성 추구 1000평 공간의 미식여행 [올가] 특가세일 1+1제품 특가상품은... 건행♡ 롯데프리미엄아울렛 타임빌라스 경기 의왕시 학의동 1039 http://naver.me/GOyEjynG #백운호수롯데아울렛 #타임빌라스 #백운호수타임빌라스...,2021. 9. 10.
"♬경기 의왕으로 배송된 가정용 마노공방주방놀이 (키즈카페, 주방놀이,역할놀이...",여름휴가 여행도 눈물을 머금고 취소했어요 ㅠㅜ 허탈하지만 그 사소한 마음보다 코로나 때문에 고생하는 수많은 분들 생각이 먼저겠지요.. 지킬건 지켜가면서 자기 자리에서 마땅히 맡은일들을 해내며 견뎌야겠지요. 제 할일은 가구 만드는일...열심히 해야겠지요..^^;; 요 가구는 경기 의왕시로...,2020. 8. 28.
의왕시 백운호수한정식 배꼽 다녀왔어요,약간 여행온느낌이 ㅋㅋㅋ 날씨도 너무 좋았거든요 입구에서 쭉걸어오면 있는 조형물과 벽화?벽글?을 지나면 매장입구로 들어가실수있어요... 정말 든든하게 먹은 백운호수한정식 배꼽한정식 백운호수한정식 배꼽한정식 경기 의왕시 학현로 110 031-425-3456 연중무휴 매일 11:00-22:00 https://booking....,2020. 7. 27.
풍성했던 백운호수 맛집 리스트,"백운호수 명가누룽지백숙 누룽지닭백숙 43,000원 메밀쟁반막국수 15,000원 주소 : 경기 의왕시 학현로 150 전화 : 031-425-0031 영업시간 : 11:00 - 21:30 이날 찾아간 명가누룽지백숙은 인덕원역 2번 출구에서 차로 5분 만에 도착했는데요. 흰색 간판에 폴딩도어를 달고 있는 매장이라 멀리서부터 한눈에...",2021. 6. 28.
침 삼켜진 백운호수 맛집 소개,"능안계곡 가격 : 해신탕 120,000원 / 도토리해물파전 12,000원 주소 : 경기 의왕시 능안길 64-18 전화번호 : 031-426-2525 영업시간 : 매일 10:00~22:00, 월 휴무(예약시에는 가능) 주차유무 : 가능 이날 들렀던 능안계곡은 인덕원고등학교에서 자차로 10분 밖에 안걸렸어요. 3층 높이에 상호를 매달아둔...",2021. 6. 1.
기막혔던 백운호수 맛집 모음,"백운호수 백운재 제육담은밥상 15,000원 황태찜담은밥상 17,000원 주소 : 경기 의왕시 학현로 170-22 영업시간 : 매일 11:00 - 21:00 설연휴, 추석연휴 휴무 번호 : 031-422-6909 이날 찾은 백운재는 의왕바라산자연휴양림에서 차로 5분가량 걸렸어요. 커다란 독채 건물인 데다 전통미 가득하게 꾸며진...",2021. 8. 20.
제8회 경기정원문화박람회 정원작품 공모전 개최,"김진수 기자 ㅣ 승인 2020.04.01 정원으로 떠나는 소풍여행, 레솔레파크 접수기간 5.4 ~ 5.8 오후 6시 까지 제8회 경기정원문화박람회 정원작품 공모전 포스터 [Landscape Times 김진수 기자] 경기도와 의왕시가 공동 주최·주관하는 ‘제8회 경기정원문화박람회’에 조성될 정원작품 공모전이...",2020. 4. 1.
의왕시 카페 분위기좋다 사진찍으러가자 카페맵,MAB) 경기 의왕시 초평동 220-1번지 ☎ 031-462-4004 의왕시 카페 카페맵은 11:00 ~오후 10:00 까지 운영합니다 카페맵 안은 겉에서 보는 느낌과 같이 블랙톤에 조명과 소품으로 감각적이게 인테리어 해놨어요 감각적인 인테리어 구경한번해보세요 요즘 사진찍기 즐기는 분들 많쟌아요 의왕시 카페...,2020. 3. 1.
과천역과 그주변풍경 - 경기 과천여행,"지리 과천은 경기도 중서부에 위치한 중소도시로 북쪽으로는 서울특별시 관악구, 동작구, 서초구와 접해있으며, 서쪽으로는 경기도 안양시, 동쪽으로는 성남시, 남쪽으로는 의왕시와 경계를 접하고 있다. 기반암은 대부분이 호상 편마암으로 이루어져 있으나, 양재천 연안에는 충적지가...",2020. 8. 12.
의왕시냉면맛집 이제 냉면의 계절이네요 삼채면옥,ㅎ 의왕시냉면맛집 냉면도 갈비탕도 특히나 만두도 맛있고 지금 할인기간이라 가격이 너무 좋네요 지하에 주차하시면 꼭꼭 주차권에 도장을 받으셔야해요 ~ 냉면 참 맛나게 잘 먹었네요 오늘 진짜 더운데 이런날 냉면한그릇 어떠세요? 이상 앤이였습니다:) 주소 경기 의왕시 오전동 276-1 전화 031 427 0010,2020. 6. 1.
의왕맛집 청계장수촌 누룽지 오리백숙 건강한 외식,"안녕하세요 달달구름 맛집여행입니다. 외식하면 늘 단짠단짠 입이 좋아하는 메뉴를 선정하게 되는데요 이번엔 더위에 지친 몸을 몸보신하기... 주소 경기 의왕시 청계로 183-1 (청계동, 장수촌) 연락처 0507-1334-9952 영업시간 매일 11:00 - 21:00 연중무휴 Break Time 16:00~17:00 (주말, 공휴일 제외) 건강한...",2021. 9. 2.
다시 찾을 평촌역 맛집 목록,"매장 곳곳에는 아기자기한 소품도 많았는데, 마치 일본 여행 온 듯한 기분도 들더라고요. 요즘 같은 시기에는 이렇게 이국적인 식당에 방문하는... 철이네 메뉴 : 떡볶이 3,000원 / 순대 3,500원 주소 : 경기 의왕시 내손중앙로 51 전화 : 031-421-7279 영업 : 매일 11:00 - 20:00 재료소진 시 까지 / 월요일...",2021. 8. 17.
경기도 여행 / 의왕 가볼만한곳 레솔레파크 외 5곳,할수있는 경기도 여행 될꺼같네요 3. 레솔레파크 레솔레파크는 왕송호수 주변에 생긴 공원을 말한답니다 지금은 겨울풍경이라 삭막하지만 다른 계절엔 초록색 연잎이 가득할 왕송호수에 야외전시물이 설치되어있답니다 의왕시가 주관한 공공미술프로젝트로 우리동네 미술사업인 월암별곡으로...,2021. 3. 9.
내손동 맛집 생생정보통 나온 의왕 평촌 돈까스! 점심 데이트코스로 추천,며칠 여행겸 맛집 순회도 하고 시부모님모시고 가까운 곳도 다녀오고 다시 서울댁(경기댁)으로 복귀 저도 프로젝트후 긴긴 휴가를 마치고 일선으로... 곳이 '유미카츠'다 >>경기 의왕시 내손중앙로 4 102호 유미카츠 내손점 (이 포스팅은 업체로부터 지원받아서 작성했습니다) 해시태그:#유미카츠내손점...,2021. 9. 9.
[꿀팁ZONE] 철도의 날 특집! 우리나라 최초의 철도와 가장 오래된 역은?,여러분은 기차여행을 해보셨나요? 고속으로 철도를 달리는 기차 안에서 멋진 창밖 풍경을 바라보고 있자면 기분이 좋아지지요. 빠른 속도로 먼... 경남에서 만나는 철도의 역사 우리 나라에는 경기 의왕시에 철도박물관이 있습니다. 하지만 경남에서도 철도박물관을 볼 수 있다는 사실! 바로...,2021. 6. 28.
의왕 바라산자연휴양림 / 스탬프투어 후기,"2021.06.12 신랑 출근으로 캠핑 여행 없는 주말. 집에 있으면 티비 볼 아들을 위해 의왕 #바라산자연휴양림 #스탬프투어 가기로. 아들 친구도 같이 데려감~ 바라산자연휴양림 위치 : 경기 의왕시 바라산로 84 운영시간 : 09시~18시 (둘째주 수욜 휴무) 주차비 : 평일 2,000원 / 주말 3,000원 / 출차시 카드결제...",2021. 6. 12.
