header,contents,date
"김포 그집 쭈꾸미 맛집 불향 찐이야, 내돈내산 후기",카페는 질리고 이케아 광명점 가서 샤핑하고 아스크림 야무지게 사먹음. 저 망고아이스크림 처음 먹는데 굉장히 맛있다. 동남아 여행 대리체험 가능 #그집 쭈꾸미 #내돈내산 후기 끝 영업시간 매일 11:30 - 21:00 주소: 경기 김포시 양촌읍 구래로87번길 137 연락처: 031-981-7111,2020. 10. 21.
[김포맛집]시골향기,"김포 고촌 시골향기 경기 김포시 고촌읍 신곡로 114-8 매일 am11:00-pm21:30 Previous image Next image 고촌에 위치한 시골향기 보리밥,청국장... 또한 시골 향기를 느끼게 해 준답니다 고촌 들리시면 방문한번 해보세요 #김포맛집 #시골향기 #고촌 #김포여행 #한식 #맛집추천 #고촌맛집 #보리밥",2021. 10. 9.
생방송 투데이 고압력 묵은지 쏙갈비 위치 주소 오늘방송맛집 쭈꾸미 온돌 짜장...,"12일 오후 방송되는 SBS '생방송 투데이'는 '여행본능, 섬', '오천만의 메뉴', '리얼 맛집', '김PD가 떴다' 코너로 꾸며진다. 이날 '여행본능, 섬... 마카롱 멘보샤 2만9000원이다. -위치: 서울특별시 강남구 논현로176길 22 [김PD가 떴다] ■ 예원농장 -위치: 경기 김포시 하성면 마곡리 62-3",2021. 5. 12.
"[TV속 정보] 6월 18일(금) KBS2TV생생정보 , MBC생방송오늘저녁, SBS생방송투데이...",2TV 생생정보 제작사: 박스미디어 <유별난 맛집 - 화덕 족발 & 화덕 피자> ▶ 정가네화덕구이족발 ☎031-989-2848 경기 김포시... 3GO - 동해시 3GO 여행> ▶ 서프팩토리 ☎0507-1411-6794 강원 동해시 대진항길 47-1 ▶ 영자네능이백숙문어보쌈 ☎033-531-5526 강원 동해시 항골2길 1...,2021. 6. 18.
김포 애견동반식당 견생역전에서 바비큐 먹으며 댕댕이들이랑 힐링하기!,"견생역전 #김포애견동반식당 #김포애견동반카페 경기 김포시 양촌읍 김포대로1750번길 29 031-985-7578 매일am11:30- pm10(바베큐pm8:30마감) 글, 사진 ⓒ 맛, 그리고 여행 by 리즈 심학산 둘레길을 걸은 후 댕댕이들을 보러 다녀왔던 김포 애견동반식당, 견생역전을 소개할게요. 위치는 살짝 애매한 곳에...",2020. 10. 4.
김포카페투어 ㅣ 김포의 독립서점_ 게으른 정원,"#김포 #카페투어 #카페 #일상 #여행 #daily #추천 #로컬 #지역 #소개 #김포 #북변동 #책방 #독립서점 #게으른정원 #서점 #일상 #쉼터 #추천 #분위기... 경기 김포시 북변중로 51-1 2층 매일 12:00 ~ 19:00 화,수 휴무 올라가기전 게으른 정원 귀여운 간판과 화분이 올라가는 길을 안내해주고 있었어요...",2020. 10. 6.
가을 준비 전국유명아울렛 정보 파헤치기!,"서울근교를 여행하며 함께 다녀 오면 좋을 것 같아요. < 전국유명아울렛 정보> 김포 현대프리미엄아울렛 주소 경기 김포시 고촌읍 아라육로152번길 100 영업시간 10:30 ~ 21:00 김포현대프리미엄아울렛 역시 김포의 핫플로 240여개의 브랜드가 입점해 있으며, 아라김포여객터미널 인근으로...",2021. 10. 6.
"김포카페, 아이와가볼만한곳 ' 벼꽃농부 '","메뉴 가 마음에 들었어요, 무엇보다 아이가 놀기 좋은 공간들이 많이 마련되어 있어서 맘에 들었던 김포카페 아이와 가볼만한곳 벼꽃농부, 선선해지는 가을날 아들과 함께 다시 한번 가봐야겠어요~ - 매장정보 - 주소 - 경기 김포시 하성면 마곡로 239 전화번호 - 031-988-3300 영업시간 - 평일 10:00 ~ 18:00",2020. 9. 17.
"현대백화점 인근 맛집, 데이트하기 좋은 카페CC♩(24시카페)","카페CC (카페씨씨) #고촌카페 #고촌24시카페 #고촌데이트 경기 김포시 고촌읍 신곡로 82 031-988-0189 매일am10- am00, 주말 공휴일am10- pm11 글, 사진 ⓒ 맛, 그리고 여행 by 리즈 주말에 바람 쐴겸 다녀왔던 현대백화점 인근 맛집, 카페CC인데요. 루프탑도 있고, 24시까지 운영하는 카페라 심야데이트하기에...",2020. 6. 17.
Play with English! 김포 유아영어유치원 밤비플레이스쿨 Prek2,"우리 밤비친구들과 무한한 상상력의 세계로 즐거운 여행을 했습니다^^ Season Art 봄 여름 가을 겨울 .. 친구들은 어떤 계절을 가장 좋아해요?... 놀이영어, 유아 영어라면 김포 밤비영어유치원에 맡겨주세요 김포 밤비영어유치원 상담문의=> 070 7525 3790 요기로~~ ->경기 김포시 고촌읍...",2021. 10. 5.
"김포한강신도시 카페, 생태공원 나들이 후 할리스에서 바라아! 한강뷰 굿♬","할리스커피 김포한강생태공원점 #김포생태공원카페 #운양동카페 #한강뷰카페 경기 김포시 김포한강11로 452 031-996-2000 매일am10- pm10(연중무휴) 글, 사진 ⓒ 맛, 그리고 여행 by 리즈 힐링을 할겸, 마사지 받은 후에 방문한 한강뷰 카페 할리스 김포한강생태원공점을 방문했어요. 날이 정말 좋아서...",2020. 4. 26.
"[TV속 정보] 9월 15일(수) KBS2TV생생정보 , MBC생방송오늘저녁, SBS생방송투데이...","김치인 ☎031-985-6919 경기 김포시 양촌읍 김포한강4로 355 <재료 승부사-주인장이 키운 버섯을 넣은 문어전복버섯전골... 02-2235-6189 <여행본능, 섬 - 가을정취 물씬~ 일몰 맛집 ‘입파도’ > ▶전곡항 마리나 클럽 하우스 주소 : 경기 화성시 서신면 전곡항로 5 ▶카발리에...",2021. 9. 15.
"김포여행에서 만난 루프탑카페, 빈로드에서 행복충전","빈 로드 경기 김포시 통진읍 율마로 464번길 89-33 평일 10:30 ~ 21:00 매주 화요일 휴무 친구들과 함께한 김포여행에서 가장 좋았던 장소를 뽑자면, 바로 김포에 있는 신상카페! 빈로드입니다. 그 이유는 아마 가시게 되시면 다 알게되겠지만, 들어서자마자 카페앞의 조경이 너무도 잘 정리되어 있어요....",2021. 5. 27.
"김포 풍무동 네일, 쏘 네일샵에서 보석젤네일로 블링하게:-)","쏘네일 #풍무동네일 #풍무동네일잘하는곳 #보석젤네일 경기 김포시 풍무로 111, 2층 ***-****-**** 매일am10- pm8, 토am10- pm6, 일 휴무 글, 사진 ⓒ 맛, 그리고 여행 by 리즈 오래간만에 힐링을 하로 김포 풍무동 네일 잘하는 쏘 네일샵으로 향했답니다. 최근에 손톱의 손상을 줄이기 위해 젤 제거를 하고 한...",2020. 8. 15.
(강화도 여행) 일대교 몽돌장어 맛집추천으로 가본 나의 지극히 주관적 후기(feat....,"일대교 몽돌장어 ☎0507-1415-6116 경기 김포시 월곶면 김포대로 3023번길 83 매일 11:00~21:00 주차/포장/배달서비스(서울,경기,인천) ok 일대교 몽돌장어 가게된 이유 강화도 여행의 마지막 코스 였던 뭉돌장어. 군인 시절때부모님과 먹었을때 당시 맛있었다며 이번에도 남자친구의 추천으로 가게됨....",2021. 6. 3.
"김포 샤브샤브 맛있는 곳, 매화소고기버섯샤브에서 든든한 한 끼","매화 소고기버섯샤브 #김포맛집 #김포샤브샤브 #김포모임하기좋은곳 경기 김포시 모담공원로 186, 2층 031-989-3302 매일am11- pm9 글, 사진 ⓒ 맛, 그리고 여행 by 리즈 김포 샤브샤브, 매화소고기버섯샤브는 7월에 오픈을 했는데요. 일전에 매화 쌈밥을 먹으로 다녀왔던 곳 2층이네요. 매화쌈밥도 가성비와...",2020. 8. 11.
강화도가볼만한곳 덕진진 남장포대와 흥선대원군 경고비,"강화도가볼만한곳, 강화도여행, 덕진진 덕진진 남장포대와 흥선대원군이 세운 경고비 안녕하세요. 역사여행을 좋아 하는 운유담방 지기 하... 덕진진은 본래 수영에 속하여 첨사를 두고 있었는데 1666년(현종 7)에 강화유수 서필원이 임금에게 청하여 청사를 경기 김포시 덕포로 옮기고 이곳에는...",2021. 6. 19.
[김포카페]엄마의거리/Mama's Avenue,김포 장기동 엄마의거리 경기 김포시 태장로795번길 143 영업시간:매일 am10:00-pm21:45 김포 지식산업센터 중심으로 Mama's Avenue(엄마의 거리) 카페가... 갑니다 #카페 #김포카페 #디저트카페 #김포여행 #특별한장소 #맛집 #맛집추천 #데이트장소 #빵집 #작품 #전시장 #김포가볼만한곳 #엄마의거리...,2021. 10. 8.
운양동 속눈썹 연장 피카손에서 자연스럽게♩,"피카손 경기 김포시 김포한강1로 250, 2층(주차권 제공) 031-987-5124 매일am10- pm9, 일 휴무 글, 사진 ⓒ 맛, 그리고 여행 by 리즈 속눈썹이 후루룩 떨어지는 바람에 근처 속눈썹 연장 잘하는 곳으로 연장을 하로 갔는데요. 일전에 네일을 받았던 운양동 속눈썹 연장샵, 피카손으로 향했답니다. 들어가는...",2020. 3. 18.
김포 사진 찍기 좋은 곳 라베니체 금빛수로의 여름 풍경,"가까이에서 즐기는 세계여행, 김포 금빛수로에서 함께해보세요. 하늘이 맑았던 날 멋진 사진을 담을 수 있는 라베니체 금빛수로를 찾았습니다.... 7월 말 문보트, 페달보트, 패밀리 보트 등을 즐길 수 있는 금빛수로 보트하우스도 운영을 재개했습니다 라베니체 금빛수로 : 경기 김포시 장기동",2020. 7. 31.
김포 간장게장 맛집 소쇄원본가~,"소쇄원간장게장 김포본가 주소 : 경기 김포시 대곶면 대명항로 416 번호 : 0507-1443-1183 운영시간 : 11:30- 20:30 대표메뉴 : 간장게장정식 42,000원, 보리굴비정식 28,000원 이날 방문한 소쇄원본가는 대곶 IC에서 나와 3분도 채 걸리지 않는 곳에 위치해 접근성이 좋아 드라이브 할때나 여행, 가족 외식...",2021. 7. 2.
김포시 대표도시가스공사 계량기 이동/현대아파트,~ 여러분들도 비오는날 창밖 풍경을 보면서 따뜻한 커피한잔 어떠세요~^^ 오늘 올려드릴 작업현장은 경기도 김포시 장기동에 있는 #현대아파트 도시가스 계량기 이동 현장입니다 김포는 외국이나 국내 여행갈때 타고내리는 비행기장이 있어서 그런지 여행 냄새가 나는 도시같아요 왠지 셀레는...,2021. 3. 27.
"구래동마사지, 어깨뭉침 풀어준 '더풋샵 김포구래점' 굿:-b","더풋샵 김포구래점 #구래동더풋샵 #구래동마사지 #구래동커플마사지 경기 김포시 김포한강9로 73 센트럴프라자 406호 031-985-2588 매일am10- am2 글, 사진 ⓒ 맛, 그리고 여행 by 리즈 요즘 잠을 잘 못자서 그런지 어깨뭉침과 피로함의 연속이였는데요. 그래서 약속가기 전에 구래동마사지 # 더풋샵을...",2020. 4. 15.
요리경력 40년 반찬가게 (경기 의정부) 해물찜 (서울 충무로역) 떡볶이 (서울대입구역),"3GO - 해남 3GO 여행 피낭시에 전남 해남군 해남읍 읍내길 8 (읍내리 29-1) 0507.1393.6262 #전남 #해남 #해남고구마빵 * 영업시간 매일 10:00... 해물로 / 경기 김포시 승가로 101 (풍무동 675-39) 매일 10:30~21:30 해물찜 (중) 54,000 (대) 64,000 4. 인생 분식 - 한결같은 정성, 행복을...",2021. 3. 19.
"[TV속 정보] 4월 9일 (금) 2TV생생정보, MBC생방송오늘저녁, SBS생방송투데이 나온 곳...","3GO - 부산 3GO 여행 편> ▶ 해동용궁사 주소 : 부산광역시 기장군 기장읍 용궁길 86 번호 : 051-722-7744 ▶ 해운대블루라인파크... 주소 : 경기 김포시 양촌읍 석모로73번길 85 번호 : 031-987-2744 < 인생 분식 - 정성 가득, 따스함이 녹아든 추억 한 그릇 > ▶ 시골칼제비 주소...",2021. 4. 13.
"김포 대게 맛집, 대게맛나게 여행 온 느낌이었습니다!",김포 대게 맛집 대게맛나게 찐 맛있게 먹고 온 후기 경기 김포시 양촌읍 김포한강4로369번길 25 대게맛나게 0507-1424-0802 화-일 11:00 - 22:00 대게 맛나게 앞에 가게 전용 주차공간이 있어서 너무 편리하게 이용했습니다. 전망이 탁트인 살짝 언덕인 곳에 있어서 먹는 내내 여행 온 기분도 나더라구요! 2층...,2021. 6. 9.
"구래동 초밥 맛집, 뷰도 좋고 맛도 좋았던 데이트하기 좋은 스시뷰♩","스시뷰 #구래동맛집 #구래동스시 #스시뷰 경기 김포시 김포한강8로 304 3층 0507-1485-5569 매일am11:30- pm10 글, 사진 ⓒ 맛, 그리고 여행 by 리즈 저번 주 주말에 동생이랑 오붓하게 데이트를 즐겼어요. 평소 회를 좋아하는 동생을 위해 동네 맛집을 찾다가 스시뷰라는 곳을 방문했는데요. 오픈한지 얼마 안...",2020. 8. 7.
"김포 현대아울렛 맛집, 보타보타에서 엄마랑 데이트♩","보타보타 마리나베이스타점 #김포맛집 #김현아맛집 #서울근교데이트 경기 김포시 고촌읍 아라육로152번길 210-22 031-998-2690 매일am10- pm11, 화 휴무 글, 사진 ⓒ 맛, 그리고 여행 by 리즈 여행의 후유증으로 어찌나 집밥이 귀찮던지 엄마랑 김현아에가서 저녁을 먹고 왔는데요. 김포 현대아울렛 맛집...",2020. 5. 26.
김포 가볼만한곳 : 이곳은 식물원인가 카페인가 김포 카페 글린공원,"따뜻한 온실(?)에서 식물도 잔뜩 보고 물고기(진짜)도 보실 수 있어요 추천 추천! 김포 가볼만한곳 김포 카페 글린공원 031-996-5177 경기 김포시 양촌읍 석모로5번길 34 금,토요일 10:00 - 22:00 일~월요일 10:00 - 21:00 매월 첫번째 월요일 휴무 김포 가볼만한곳 : 이곳은 식물원인가 카페인가 김포 카페 글린공원",2020. 2. 3.
"김포 카페, 한적했던 스타벅스 김포감정DT점 이용기!(주차가능)","스타벅스 김포감정DT점 #김포스타벅스 #김포드라이브스루 #스타벅스DT매장 경기 김포시 중봉로 27 1522-3232 월수목금am7- pm10, 화토일 am8-pm10 글, 사진 ⓒ 맛, 그리고 여행 by 리즈 쥰장리즈입니다. 황금연휴 잘 보내고 계신가요? 오늘도 여김없이 집근처 힐링카페를 찾다가 집에서 3km 정도...",2020. 5. 3.
김포가볼만한곳 :: 김포아트빌리지 안에 있는 한옥카페 다인♩,"한옥카페 다인 #김포가볼만한곳 #김포드라이브 #김포한옥카페 경기 김포시 모담공원로 170-4 031-998-9919 매일 am11- pm9, 연중무휴 글, 사진 ⓒ 맛, 그리고 여행 by 리즈 몇일 전에 다녀왔던 김포아트빌리지 안 카페 김포가볼만한곳, 한옥카페 다인 소개해볼게요. 날이 조금 쌀쌀해서 몸을 움추리게...",2020. 4. 3.
서울 근교 드라이브코스 김포 하동천 생태탐방로 연꽃 나들이(경기도 가볼만한곳)~,"당일치기여행 #서울근교나들이 #언택트여행 #Untact @경기도 가볼만한곳, 김포 하동천생태탐방로 풍경 2020년 7월 26일 촬영... 벌써 이렇게나 많은... ♣ 하동농원 주소 : 경기 김포시 하성면 봉성리 643-20 @하동천 생태탐방로 연꽃단지로 가는 보행교 기록적인 장마 중에 모처럼 만난 예쁜 하늘과...",2020. 8. 19.
"구래동 고기 맛집, 인생화로에서 엄마와 데이트♩","인생화로 #구래동맛집 #구래동고기집 #구래동삼겹살 경기 김포시 김포한강9로12번길 7-15 031-981-6227 매일am11:30- pm11, 일am11:30- pm10 글, 사진 ⓒ 맛, 그리고 여행 by 리즈 어버이날 엄마랑 데이트를 했던 구래동 고기 맛집, 인생화로예요. 평일이기도 했고 점심시간 이후에 방문을했는데요. 그래서...",2020. 5. 10.
김포 긴급재난소득 지원금으로 아이리본에서 안경 맞추기!,"아이리본 #김포안경 #김포가성비안경 #김포긴급재난소득지원금사용처 경기 김포시 태장로 810 라베니체 6차 203호 031-981-2053 매일am10- pm9:30, 수요일 휴무 글, 사진 ⓒ 맛, 그리고 여행 by 리즈 요즘 시력이 점점 떨어지는 쥰장 리즈입니다. 그래서 안경을 맞추로 김포 안경점 아이리본으로 향했는데요....",2020. 6. 24.
"김포 데이트코스, 식물가득 글린공원 신메뉴 나왔찌!","글린공원 #김포카페 #김포데이트 #글린공원신메뉴 경기 김포시 양촌읍 석모로5번길 34 031-996-5177 매일am10- pm9, 금 토 1시간 연장 (매월 첫번째 월 휴무) 글, 사진 ⓒ 맛, 그리고 여행 by 리즈 어제는 어버이날이였죠? 엄마랑 간만에 데이트를 하로 김포로 갔는데요. 괜찮은 카페를 찾다가 일전에 지인과...",2020. 5. 9.
[맛집] 두 번째 방문 김포현대아울렛 김현아 바르미 샤브샤브! 칼칼한 육수 뜨끈한...,"바르미샤브샤브 - 주소:경기 김포시 고촌읍 아라육로152번길 100 김포현대아울렛 이름하야 김현아 타워존 푸드 리빙 층에 있는 식당, 바르미샤브샤브입니다. 김현아에서 어디에 가야할 지 늘 고민되는데 오늘도 찾은 바르미샤브샤브 여러분께도 추천드립니다. 공간은 아래 보시는 바와 같이 매우...",2020. 11. 12.
경기정원문화박람회 발전방안 연구 [경기연구원 연구보고서],"도시의 숲이 되다‘, ’집으로 가는 길, 정원‘, ‘평화의 정원’, ‘정원으로 떠나는 소풍 여행’, ‘정으로 물드는 뜰’. 정원이란 용어를 직접적으로 사용하는 경우가 다수입니다. 경기정원문화박람회의 과제 ▶대표 이미지 없다 경기정원문화박람회는 성공적이었지만 맹점도 있는데 그간의...",2021. 8. 23.
"김포 데이트코스, 메모센트에서 나만의 특별한 향수만들기(커플 강추!)","메모센트 #메모센트 #김포데이트코스 #김포향수만들기 경기 김포시 고촌읍 장차로13번길 25 2층 ***-****-**** 매일am11- pm10 글, 사진 ⓒ 맛, 그리고 여행 by 리즈 요즘 문화생활을 위해 다양한 활동을 찾는중인데요. 몇일전 언니랑 이색데이트를 즐겼답니다. 위치는 김포 고촌역 인근에 있었던 메모센트...",2020. 6. 8.
경기도 김포 당일치기 여행지 애기봉평화생태공원 포함해서 가볼만한 곳 Top5...,"경기도 김포 당일치기 여행지 덕포진 마지막으로 소개해드릴 당일치기로 가볼만한 김포 여행지 다섯 번째는 덕포진입니다. 덕포진은 경기도 김포시 대곶면 신안리 산105로 찾아가시면 되는데요, 입장료나 주차요금은 없습니다. 덕포진은 고종 3년인 1866년 9월 병인양요 때는 프랑스 함대와...",2021. 10. 10.
아이들과 이색 체험 농촌 테마 김포 카페 벼꽃농부,김포 벼꽃농부 경기 김포시 하성면 마곡로 239 (석탄리) 031-988-3300 매일 10시 - 20시 https://xn--pu5bllr6y.com 카페이면서도 식당이지만 그렇다고 단지 식당... 아이들이나 커플 데이트로도 최고에요. https://xn--pu5bllr6y.com #김포카페 #김포데이트 #김포여행 #김포체험 #이색체험 #김포핫플 #김포맛집 #벼꽃농부,2020. 7. 10.
김포 맛집 추천 근사해!,입안 가득 고소한 감칠맛이 퍼졌네요 그렇게 마지막까지 물림 없이 폭풍 식사를 하고 나왔는데요 가격 대비 고퀄리티의 음식들을 맛볼 수 있는 곳이라 절로 주변 지인들에게 김포 맛집 추천하고 싶어지더라고요 조만간 가족들과 함께 다시 와보려 합니다 주소 : 경기 김포시 김포한강1로97번길 10-15...,2020. 7. 1.
[2021경기유랑단] 서포터즈 지원과정 및 합격 후기,"계획서는 1차 여행을 기준으로 작성하는 거였는데, 경기도에서 '깨끗한 경기바다' 관광브랜드화를 추진하고 있어서 경기바다 5곳인 ""화성시, 안산시, 평택시, 시흥시, 김포시"" 중에서 선택하고 이를 주요 동선으로 여행을 구성해야 했어요! 저희 팀은 어디를 할까 지도를 켜서 각 도시를 살펴보고...",2021. 6. 10.
김포 뷰맛집 카페 라마리나 LA MARINA,저녁식사 시간쯤 되니 사람 쭈욱 빠져나감ㅋㅋ 또 식사 이후에 쫘악 들어왔겠죠?ㅎㅎㅎ 여기도 조만간 핫플 될 것 같습니당 너무 핫플 되기 전에 미리 다녀오기! 라마리나 카페 031-996-5498 경기 김포시 고촌읍 아라육로152번길 210-34 경기 김포시 고촌읍 전호리 644 09:00 ~ 23:00,2020. 10. 4.
"구래동타이마사지, 치앙마이에서 뭉친피로 녹이기♩","치앙마이 구래점 경기 김포시 김포한강8로 386 센트럴프라자2차 4층 ***-****-**** 24시운영, 연중무휴 글, 사진 ⓒ 맛, 그리고 여행 by 리즈 치앙마이 구래점 경기 김포시 김포한강8로 386 센트럴프라자2차 4층 요몇일 날씨가 좋지 않아서 돌아다니기 쉽지 않은 날의 연속이였는데요. 오늘은 어찌날 날이...",2020. 4. 26.
대부도 유리 공예체험과 요트 체험의 모든 것,"정보- 관람시간: 오전 9시 30분~오후 6시 30분 휴관일: 매주 월요일(공휴일일 경우 화요일 휴관) 입장료: 대인 8천 원/ 청소년 7천 원/3~12세 6천 원 경기바다 여행주간 2021년 6월 14일(월)~ 6월 20일(일) 대상지역: 경기도 시흥시 오이도, 안산시 대부도, 화성시 전곡항, 평택시 평택항, 김포시 함상공원",2021. 6. 7.
"김포 맛집 추천, 마송 수빈관 중국집","김포 맛집 추천 마송 맛집 '수빈관' 수빈관 중국집 경기 김포시 통진읍 김포대로 2374 031-998-9229 짬뽕 전문점 수빈관 중국집 차타고 지나가다가 항상 사람이 많길래 드디어 와봤답니다 :) 깔끔한 내부와 친절한 사장님의 인사로 첫인상부터 좋았어요 ㅎㅎㅎㅎ 김포맛집 수빈관 메뉴,가격 짬뽕...",2020. 2. 11.
풍무동 맛집 풍무동 수제버거 : 뉴블레스 김포 풍무점,"뉴블레스 김포 풍무점 경기 김포시 풍무1로 61 경기 김포시 풍무동 277-9 월화수목금토 11:00 - 21:00 일요일 휴무 브레이크타임 오후 3:00~5:00 031-998-1530 뉴블레스 김포풍무점 수제버거는 주문 후에 바로 조리를 시작하기 때문에 음식이 나오기까지 다소 시간은 조금 걸리는 편이에요, 수제버거를...",2020. 9. 4.
김포한옥마을 체험! 아이와 어른들 모두 좋아한 김포 아트빌리지 나들이 :D,"말로만 듣고 이번에 처음 가봤는데, 날이 좋아서 한옥도 하늘도 진짜 너무 이쁘더라구요 김포 아트빌리지 경기 김포시 운양동 1325-10 am10:00 - pm10:00 주차장 있어요. 한옥마을 안에는 다양하게 체험을 진행했던 흔적들과 스튜디오, 갤러리, 편의점, 호수, 카페등이 있지만 현재는 코로나 덕분인지...",2020. 7. 6.
김포 카페 몬떼델피노 김포 핫플 베이커리 카페,김포 카페 몬떼델피노 김포 핫플 베이커리 카페 031-997-7678 경기 김포시 양촌읍 김포한강6로 49-19 오픈시간 : 매일 10:00 - 22:00 제가 소개한 정보가 도움이 되셨다면 저의 팬이 되어주시겠어요? 제 팬이 되어주시면 제가 작성하는 다양한 여행 꿀팁과 정보 한번에 다 받아보실 수 있어요! 물론 돈드는거...,2020. 4. 17.
김포 예쁜카페 <장기동 엄마의거리> 마마스에비뉴 Mama's Avenue 여기좋다,"우린 여행중이니까... 영어단어는 일단, 읽을 생각을 안해요. ㅎㅎㅎㅎㅎㅎㅎ 뭔가 고급고급 갤러리 느낌도 나고, 문체가 고급스러워서 뭔가... 김포 장기동 엄마의거리 베이커리 카페 0507-1378-7953 경기 김포시 태장로 795번길 143 매일 10:00 ~ 22:00 L.O 21:00 김포 베네치아, 라베니체... 아, 이런곳이...",2020. 8. 21.
골프회원권 관련 사이트 모음,"서울, 경기, 분당, 성남. - 남산,국제,골프,클럽,4인,기명1인,무기명3인,회원대우,창립회원,모집. 노모자키 골프클럽( http://www.nomozaki.co.kr/ ) - 일본 큐슈, 나가사키 골프 여행, 코스소개, 부대시설, 회원권 안내. - 센텀골프( http://sendom.alltheway.kr/ ) - 서울시 강남구 수서동...",2021. 8. 27.
김포주간보호센터 헬스원 데이케어- 바다로의 여행,오늘 어르신들의 내면의 힐링을 도와줄 미술활동은 바로 바다로의 여행 #김포주간보호센터 #김포헬스원데이케어센터 #김포치매센터 세상에는... 하단 배너를 누르시면 김포 헬스원데이케어센터로 바로 전화상담이 가능합니다 김포 헬스원데이케어 노인주야간보호센터 경기 김포시 봉화로 172...,2020. 8. 11.
"김포구래동마사지, 청담휴스파에서 어깨뭉침 풀기!","청담휴스파 #김포구래동마사지 #구래동마사지 #구래동데이트 경기 김포시 김포한강8로 396 지오타워 3층 0507-1356-6161 매일am11- am4 글, 사진 ⓒ 맛, 그리고 여행 by 리즈 저번주에 스트레스로인해 목이 돌아가지 않아 집근처 마사지샵을 찾다가 김포구래동마사지, 청담휴스파를 다녀왔답니다. 차로...",2020. 4. 5.
"김포 구래동 맛집, 대박 홍굴이 왕짬뽕에서 해물듬뿍 맛보기!","대박 홍굴이 왕짬뽕 #김포구래동맛집 #김포구래동짬뽕 경기 김포시 양촌읍 구래로26번길 67 031-981-8188 매일am11- pm9, 연중무휴 글, 사진 ⓒ 맛, 그리고 여행 by 리즈 어제 점심을 먹으로 다녀왔던 김포 구래동 맛집, 대박 홍굴이 왕짬뽕이랍니다. 우선은 짬뽕이 조금 특이하게 나오는데요. 해물을 먼저...",2020. 5. 3.
