header,contents,date
[백운호수 이탈리안맛집] 핏제리아 라따,"핏제리아 라따 0507-1348-7220 경기 의왕시 백운로 393 매일 11:30~22:00 핏제리아 라따는 20년간 이탈리안 레스토랑을 운영해온 올라에서 오픈한... 여행을 얼른 다녀오고싶은 마음..... 피자와 같이 먹을 오일! 살짝 매운느낌의 오일이 전 마음에 드네요~ 디마레 24,000원 : 블랙타이거 새우, 가리비, 그린...",2021. 5. 17.
캠핑감성으로 야외 바베큐 즐기기 경기도 서울근교 의왕 서현농원,서현농원 경기 의왕시 왕림길 85 야외에서 바베큐를 해먹고싶을때 당일치기로 여행 펜션 캠핑 느낌을 느끼고싶으실때 가기 좋은 곳이에요 ! 요런 느낌 ~? 사실 시설은 그렇게 깨끗하거나 정돈되어있지는 않아요 그래도 화장실 개수대 전자레인지 매점 정도는 구성되어있어요 :) * 작년에는 제가...,2021. 5. 27.
"의왕 선별진료소 코로나 검사 후기, 비용, 검사결과 언제?, 운영시간 정리...","받게 되었어요 :( 조금 마음에 걸리는 일이 있어서요 얼마 후에 제주여행을 앞두고 있기도 하고, 불안감을 없애는게 낫겠다 싶어서 검사... 운영시간★ - 주소 : 경기 의왕시 덕장로 19 (청계복지회관 주차장 임시선별검사소) - 운영시간 : 평일 9:00 - 17:00 (점심시간 12:00-13:00), 주말 9:00-13:00 - 비용 : 무료",2021. 6. 3.
의왕 분의기가 좋은 뒤란 브런치카페,의왕 카페 뒤란 DUITAN 뒤란 주소: 경기 의왕시 왕곡로 227 운영시간: 11:00-21:00 * 월요일 휴무 주말.. :) 노골노골 집에 있다가 커피를 마시러... 정원이 있는 카페라 여행온거 같았습니다. 후루룩 커피 한잔 잘 먹고 갑니다. 의왕카페 뒤란 후기였습니다. #내돈내산 #카페투어 #의왕드라이즈 #데이트...,2021. 4. 13.
[의왕] 서울근교 나들이 추천 왕송호수 레일바이크,레일바이크는 당일 발권보다 미리 예약하고 가시는게 좋아요. 현장에서 탑승권으로 발급하시면 됩니당! #레일바이크 #왕송호수 #의왕레일파크 #의왕레일바이크 #서울근교놀거리 #근교나들이추천 #의왕갈볼만한곳 #의왕 #레솔레파크 #의왕시여행 #경기도여행 #의왕데이크 #의왕나들이,2021. 5. 20.
"숲 속에 위치한 작은 책방, 책 읽고 필사까지 가능해! 의왕 독립서점 사각사각책방","제 꿈에 대하여 확신을 줬던 <퇴사는여행> 의 저자 정혜윤 작가님의 신작 <독립은여행> 그리고 제가 좋아했던 사람이 알려주었던 다카하시 아유무의... 한번쯤은 방문하시기를 추천드립니다. ▲ 사각사각책방 인스타그램 사각사각책방 경기 의왕시 오전동 484 2층 0507-1471-1167 12:00 ~ 19:00 (월, 화 휴무)",2021. 7. 22.
경기 의왕 카페 피가로카페 (하우현성당),카페 내부는 그렇게 넓지는 않지만 알차게 꾸며져 있었어요 여행에 관련된 책들과 인상파 화가들의 그림들이 카페를 꾸미고 있었는데 아마... 그럼 다음 포스팅에서 또 봐요~ #경기 #경기도 #의왕 #의왕시 #의왕카페 #하우현성당 #피가로 #카페피가로 #성당 #천주교 #원터골 #의왕가볼만한곳...,2020. 4. 1.
"(마곡나루역) 털레기 수제비 #의왕(왕송호수) 손두부 정식 #서산 여행,우럭젓국",근처 #가온길 ★ 경기 의왕시 왕송못서길 149 (초평동 541-9) 031-461-3311 - 매일 11:00~21:00 / 명절 당일만 휴무 - 손두부 정식 소개 - 가온길... (의왕 왕송호수) @산해별미 (서산) #생생정보 #고사리병어조림 #한우마늘갈비 #털레기수제비 #손두부정식 #서산여행 #우럭젓국,2020. 2. 25.
의왕 왕송호수 레일바이크와 레솔레파크 서울근교 경기도 가족 여행지로 추천,"의왕 왕송호수 조용히 산책하고, 호수 둘레를 레일바이크 타고 여행하고 푸르른 자연속에서 편안히 휴식하고 싶나요? 경기도 의왕에 가면... 의왕 레일바이크 경기 의왕시 왕송못동로 221 수도권 최대의 왕송호수를 둘러싸고 4.3km를 즐기는 레일바이크입니다. 날씨 맑은날 꼭 타야만 할거같네요. 전...",2021. 5. 26.
"의왕 산촌, 백운호수 누룽지 닭백숙/ 커피 볶는 자유, 의왕 백운호수 카페",서울에서 가까우면서 시골에 여행 온 기분 낼 수 있었던 산촌 누룽지 닭백숙 너무너무 맛있었어요 커피 볶는 자유 경기 의왕시 백운로 145 매일 09:00 - 22:00 라스트 오더 21:50 산촌에서 가까운 거리에 있는 카페 커피볶는자유 안으로 들어가면 넓고 테이블 수도 많았다. 아래 메뉴판 참고 원두도...,2020. 7. 12.
"주말 아이랑 갈만한곳, 의왕 키즈카페 라바 테마파크","(이번에 제주도 여행 갔을 때 방문 못해서 아이들이 아쉬워하기도 했고요.) 평촌이나 범계, 의왕, 산본 등에서 거주하신다면 자차로 20분 이내면... 다음에는 라바 레스토랑이나 카페를 이용해서 조금 더 길게 머물다 와야지 :-) 주소 : 경기 의왕시 갈미2로 7 영업시간 : 10:00-19:00 (평일 휴무) 입장료...",2021. 7. 1.
맛있다고 포스팅했는데 어느날 다시 가보니 없어진 맛집 ! 중소벤처기업부가...,"맛집전문 블로그가 아니어서 계획적으로 찾아 다니지는 않지만 , 그래도 여행을 하며 맛집이라는 식당을 이욧한다. 제 블로그 이름이... 추어탕 △부곡통닭집(경기 의왕시, 40년, 치킨) △여명본점(경기 화성시, 21년, 간장게장ㆍ보리굴비ㆍ꼬막장) △반공방첩(인천 동구, 23년...",2021. 5. 7.
서울 근교 바베큐장 의왕 가볼만한 곳 : 서현농원,서현농원 경기 의왕시 왕림길 85 경기도 의왕에 위치한 #셀프바베큐장 #서현농원 야외 바베큐를 즐길 수 있어서 당일치기로 여행간 기분 느낄 수 있었던 곳이다 #의왕데이트 #경기도당일치기 #서울근교당일치기 천막아래 두테이블씩 분리가 되어 있어서 거리두기도 가능했고 마당이 넓게 있어서...,2021. 5. 26.
서울 근교 드라이브 코스 : 의왕 왕송호수공원,"수원에서도 접근 가깝고, 안산에서 접근이 용이하기 때문에 두루 드라이브로 오시기 좋은 서울 근교 코스 입니다. 주소 : 경기도 의왕시 초평동 ※ 본 포스팅 스크랩은 언제든 환영합니다. 단, 사진은 불펌입니다. ※ 여행블로거 @일상 팬 추가",2020. 9. 24.
백운호수 오리 전문점 오리마을 단호박 유황훈제구이,오리마을 평일 11:00 - 22:00 연중무휴 브레이크타임16:00~17:00(평일) 주말.공휴일 11:00 - 22:00 경기 의왕시 청계로 137 이제 남편의 휴가 끝나간다. 휴가가... 9월에 리프래쉬가 한번 더 남았으니 여행은 그때 다니기로 하자고^^ #청계산오리 #백운호수오리 #백운호수고기집 #청계산맛집,2020. 8. 10.
의왕레일파크 가족봄나들이 어떠세요?,"031) 8086-7372 www.uiwangpark.uuc.or.kr 하늘 철길로의 여행 의왕스카이레일 의왕시민, 의왕시기업체 30% Sale 의왕도시공사 의왕레일파크 표사는 곳... 의왕레일바이크 경기 의왕시 왕송못동로 221 http://naver.me/5uuYZEyC 의왕레일바이크 인터파크티켓 석양이 지고있어요 오후5시30분쯤이네요 오늘...",2021. 4. 18.
"의왕 피자&파스타 맛집, ""루리네""",강릉여행의 마지막 코스라고 할 수 있는 저녁식사- 루리네 경기 의왕시 내손로 82 031-395-3383 매일 11:00 - 22:0015:00~17:00 BreakTime 주차 가능(저는 입구를 못 찾아서 아래쪽 골목에 댔어요-) 아파트 단지 내에 상가에 3층에 위치-! 엘리베이터를 타고- 매장 앞 도착! 입구에 음료도 테이크아웃으로...,2021. 4. 27.
[인덕원] 포일동 소고기 맛집 : 야끼니꾸 풍경 (내돈내산),"ㅋㅋ 야끼니꾸 풍경 [일본식숯불갈비전문점] - 위치: 경기 의왕시 봇들2길 28 - 연락처: 031-421-1292 - 영업시간: 매일 17:00~01:00 야끼니꾸 풍경 내부... 일본 여행 온 것 같은 분위기~~ (여행가고 싶네요ㅠㅠ) 야끼니꾸 풍경 내부 그리고 가장 좋은 공원뷰 창가 자리!!! 겟 시원한 바람도 쐐며, 바깥 구경도...",2021. 5. 22.
경기도 재난기본소득 평촌 맛집 '촌놈집'에서 사용.,제주여행을 회상합니다. 역시 3인분으로는 당연히 부족했고 통삼겹살 추가 2인분! 소주도 추가!! 그래도 아쉬워서 항정살도 1인분 추가 했답니다. 마무리는 된장술밥? 이런 메뉴가 있는데 맛있습니다. 처음 가본 촌놈집 고기 맛이 좋았습니다. 경기재난소득지원금 덕분에 맛있는 저녁 잘...,2021. 5. 2.
경기옛길 삼남길 4코스 서호천길20210117,"과천시와 안양시, 의왕시, 화성시, 오산시, ·평택시, 경기문화재단, (사)아름다운도보여행, 코오롱스포츠 관계자들이 참여하는 개통식은 광개토사물놀이패와 한뫼국악예술단이 펼치는 길놀이, 축연무, 삼남길 전체 구간 영상 소개, 이광수 명인의 비나리, 개통 축하 퍼포먼스 등의 순서로...",2021. 1. 19.
평촌역헤어 더주안헤어샵,"entry=plt&id=37935803&query=%EB%8D%94%EC%A3%BC%EC%95%88%ED%97%A4%EC%96%B4&tab=fsasReview 요즘 가장 핫하다는 경기서부지역 그 중에서도 평촌 먼저 헤어도 좋지만, 동네를 공부해보고 어떤 특징있는 곳인가 여행을 떠나는 기분으로 도시이야기를 시작해보고~~~ 평택에서 출발해서 올라가다보니 를 지나서...",2021. 3. 22.
정조 관련 문화유산 통합 활용정책 연구 [경기연구원 연구보고서],"지지대고개(遲遲臺―) 지지대고개는 경수대로상 경기도 의왕시와 수원시 사이에 위치한 고개입니다. 정조가 아버지 사도세자의 능인 현륭원에 참배하러 갈 때, 아버지의 묘가 내려다보이는 데도 묘까지 가는 시간이 더디게 느껴져 ""왜 이리 더딘가""라고 한탄했다고 하고, 참배를 마치고 서울로...",2020. 7. 6.
"경기도 가볼만한곳 - 의왕레일바이크 , 레솔레파크",의왕 레일바이크 주소 : 경기 의왕시 왕송못동로 221 전화 : 031 462 3001 운영시간 : 주말.공휴일 10:00 ~ 17:30 평일 10:30 ~ 17:30 레솔레파크 입장은... 주차 : 아래사진참고 #경기도가볼만한곳#의왕가볼만한곳#경기도의왕가볼만한곳#주말나들이#아이와가볼만한곳#경기도피크닉#가족피크닉#늘다님,2021. 6. 20.
브런치도 가능한 백운호수 카페:) 브라우니70,^^ 경기 의왕시 학현로 8 이구요!!! 아무래도 차가 다니는 도로쪽에 위치한 곳이라!!! 대중교통을 이용하기엔 ㅋㅋ 좀 어려움이 있는거 같아요... 뭐 바다 보이고 ㅋㅋㅋ 그런 여행가는걸 꿈꾸고 싶지만 ㅋㅋ 잠시라도 밖에 나와서 ㅋㅋㅋ 콧바람도 쐬고 그럼 하루가 꽉차면서도 스트레스가 풀리더라구요~~,2021. 6. 27.
"군포, 산본, 평촌, 의왕에서 김포공항 가는 경기공항리무진버스. 버스타고예매",ㅠㅠ 저희 집에서는 의왕시가 가까워서 의왕에서 타는 것으로 결정. 그런데 여기서 잠깐!!! 경기공항리무진버스 예약하셔야 합니다. 물론 현장 결재도 되겠지만... 가셔서 버스의 좌석이 다 차면 탈 수 없는 불상사가 생기는 것 아시죠? 한가할 때는 모르겠지만 여행을 많이 가는 시기에는 절대 절대...,2021. 8. 1.
서울근교 주말 나들이 백운호수 갈만한곳 갈미한글공원&명장시대 빵집,주소 : 경기 의왕시 문화예술로65 송골전통집에서 다 먹고 배불러서 바로 옆에 공원이 있길래 와봤어요 갈미한글공원이라는 곳인데 의왕시... 여러분들 :) #서울근교갈만한곳 #서울근교당일치기여행 #서울근교드라이브코스 #서울근교카페 #서울근교맛집 #서울근교아이랑 #주말나들이 #백운호수맛집...,2021. 5. 26.
왕송호수맛집 _ '정가네숯불갈비' 이동갈비 소갈비,정가네 숯불갈비 경기 의왕시 부곡공원길 7 매일 10.00- 22.00 단체석 주차 포장 #의왕맛집 #의왕왕송호수맛집 #정가네숯불갈비 의왕 왕송호수 부곡... 평일 점심이지만 고기를 좋아하는 부부 ㅋㅋㅋㅋ 얼마전 다녀온 포천 여행을 그리며 이동갈비 & 돼지갈비 주문 다양한 음료 & 주류도 있습니다...,2021. 5. 7.
의왕레솔레파크맛집은 둥근상시골집 갈치지,"둥근상 시골집 한정식 의왕레솔레파크 맛집으로 입소문 나 있는 둥근상시골집은 경기 의왕시 월암동 530-3 1층에 위치하고 있어요. 영업시간은 매일... 특히 식당을 둘러 쌓고 있는 정원들을 바라보고 있으니, 여행온 기분까지 들어 좋아요. 넓은 홀을 중심으로 주방은 오픈형이라 조리하는 방법을 볼...",2021. 6. 10.
"서울근교 드라이브코스 백운호수 브런치맛집 ""라붐""",소 : 경기 의왕시 학현로 170-86 전 화 : 050714064608 영업시간 : 매일 10:30 - 22:00 주 차 : 가능 (발렛파킹 해야함 금액: 1000원) 브런치가 엄청 맛있다고 소문난 곳이라 기대만빵!! 오픈시간에 맞춰가야지 그렇지 않으면 대기가 길다고 해서 11시에 도착했어요 이번주말에는 여행간 사람들이 많아서 그런지...,2021. 4. 26.
"산에 가기 좋은 날씨, 무슨 산에 갈까 고민될 때 참고되는 서울근교 등산가기 좋은곳...",좋은곳 #오봉산 경기 의왕시 고천동 산 24-2 암벽등반까지 할 수 있다는 고급자 등산코스 서울근교 등산가기 좋은곳 #칠보산 경기 수원시 권선구... ~ #서이추 #서이추환영 #이웃환영 #서로이웃 #일상 #일상블로그 #답방 #댓글 #공감 #일상생활 #일상이야기 #주말추천여행 #주말나들이 #당일치기여행,2020. 4. 18.
의왕맛집 고기부터 밑반찬까지 다 맛있는 홍성참숯갈비,"홍성참숯갈비 0507-1487-9003 경기 의왕시 새말길 66 매일 11:00 - 22:00 매월 첫째, 셋째 주 일요일 휴무 당정역 1번 출구에서 700m 정도 떨어지며... 없는 싸구려인데 아이스크림 하나에도 신경 쓰신 사장님 대박!! 밖에 정자에 앉아 숲 숙의 깨끗한 공기를 느끼며 돼지바를 먹으니 힐링 여행 온 거 같았어요",2021. 5. 14.
서울에서 제주까지 걷고 싶은 길 200,학의천~경기 의왕시 백운호수 삶의 격을 높여 주는 도시 하천 7 경기 과천시 서울대공원 마음까지 맑아지는 흙길 8 경기 가평군 자라섬... 섬 여행의 모든 것 41 인천 옹진군 자월도 무인도에서의 표류를 꿈꾸다 42 인천 옹진군 장봉도 붉은 태양이 사라지는 낙조의 명소 43 인천 옹진군 대청도...,2021. 7. 10.
경기지역화폐 카드 사용처 기준 및 잔액조회 방법 알아보기,"지류형 경기지역화폐는 성남시, 안양시, 평택시, 시흥시, 의왕시, 과천시, 포천시, 가평군에서만 사용 가능하며, 지류형 경기지역화폐는 성남시... 경기지역화폐 카드 사용처 기준 알아보기 경기지역 통화는 경기도내 연매출 10억원 이하의 소상공인 점포에서 사용 가능합니다 숙박, 여행, 의류...",2021. 7. 8.
하반기 NH농협은행 채용 공고 및 자소서 항목 총정리(9/28~10/6),IT부문(경기 의왕시 소재) 카드 중앙본부 카드업무 유관 부서 자금운용/기업금융 일정기간 영업점 근무 후 행내 인사이동 절차에 의거 유관 업무... 까지 병역필 가능한 자) · 신규직원 교육('20.12월 중 예정) 입교 및 이후 계속근무가 가능한 자 · 해외여행에 결격 사유가 없는 자(외국인의...,2020. 9. 28.
역사가 흐르는 ‘사근행궁터’,사근행궁터의 위치는 경기도 의왕시 사그내길 11로 의왕시청 별관 앞입니다. 이 사근행궁터는 조선조 효도대왕으로 일컬어질 만큼 효성이... 의왕시에는 이렇게 역사 탐방이 가능한 유적지들이 있습니다. 이번 기회에 사근행궁터로 가족과 함께 역사 여행을 떠나는 것도 좋을 것 같습니다. 우리...,2021. 3. 11.
아이랑 갈만한 곳) 뿌리깊은나무숲에서 각종 체험과 물놀이까지,뿌리깊은나무숲 주소 : 경기 의왕시 학의동 474-1 영업시간 : 매일 09:30 - 18:00 이용요금 : 5천원(12개월 미만 무료) 지난 주말에 다녀온 의왕시 #뿌리깊은나무숲 이용시간은 오전 9시부터 오후 6시까지이나 코로나로 인해 주말은 4시간으로 입장 제한이 된다고 한다. 이용료는 12개월 이상부터 성인까지...,2020. 7. 8.
"의왕 맛집 추천 <민속 두부마을> :: 직접 만든 두부로 요리하는 두부요리 전문점 후기, 메뉴",연휴에 여행을 가지 않아서 가족들과 함께 외식을 하러 간 시간이 많았다. 오늘 소개 할 식당은 #의왕맛집 #민속두부마을 로 #두부요리전문점 으로... 민속 두부마을 경기 의왕시 오봉산길 17 매일 10:00 - 22:00 명절 휴무 매주 월요일 정기 휴무 이제 추석 전까지 쉴 수 있는 평일 연휴는 없다고 한다...,2020. 5. 6.
20개월 아기와 수원 근교 나들이 : 왕송호수 보며 의왕 레일바이크 타기,"의왕 레일바이크 위치 - 경기 의왕시 왕송못동로 221 전화번호 - 031.462.3001 운영시간 - 평일 10:30 ~ 17:30(동절기 운행시간) 주말, 공휴일 10:00 ~ 17:30... 매표소에서 표를 구매하고 설레는 마음으로 왕송호수 여행을 시작하는 탑승장 앞에서 바이크가 오기를 기다렸다. 만만하게 보고 탔던 레일바이크...",2021. 2. 26.
의왕 철도박물관 : 아이와 서울 근교 나들이 추천,"좋아할 시기에 기차를 태우고 놀러 가면 참 좋을 텐데 코로나 때문에 여행도 쉽지 않네요. 서울과 멀지 않은 의왕에 가면 기차도 타볼 수 있고 기차를 운전해 볼 수도 있답니다. 철도박물관 경기 의왕시 철도박물관로 142 3~10월 하절기 09:00 - 18:00 11~2월 동절기 09:00 - 17:00 휴무_ 매주 월요일, 공휴일...",2021. 3. 21.
맛있는녀석들 맛집리스트 - 1편 (1회~100회),68회 #특집 <해외여행: 괌> - 70회 소갈비찜 서울 고요남 논현점 (현재 폐업) 수원 본점 서울 강남구 강남대로122길 10 (논현동 166) 70회 보리밥 의왕 원조일출보리밥 경기 의왕시 손골길 17 (내손동 226) 71회 닭숯불구이 서울 계탄집 본점 서울 광진구 능동로 31 (자양동 553-264) 71회...,2021. 7. 5.
의왕백운호수카페 모우 백운호수보며 커피한잔의 여유,다녀왔어요 경기 의왕시 백운로 502 매일 10:00 - 24:00 주차 카페앞에는 주차공간이 넉넉히 있었고 주차 봐주시는 분도 계셔서 편리하더라구요 차두고... 멀리 여행온느낌이 ..저는 백운호수는 이날 처음와봤는데 생각보다 크고 탁 트여서 너무 좋았어요 백운호수 뷰 맛집 그리고 여긴 2층이에요 2층은...,2020. 3. 22.
"[5/8] 주간동향 원페이지 - ""오늘은 제주가 흥미롭다!""",제주도 여행겸 임장을 한번 가야 하나? 다시 한번 느끼지만 시장은 영원한 하락도 영원한 상승도 없다. 제주도의 경우 올해까지 입주 물량이... 상승 지역 (0.3% 이상) - 경기 안양 만안구 : 0.38 - 경기 안양 동안구 : 0.77 - 경기 군포시 : 0.57 - 경기 의왕시 : 0.72 - 경기 부천시 : 0.32 - 경기...,2021. 5. 8.
맛있는녀석들 맛집리스트 - 3편 (201회~300회),회차 소개음식 상호명 도로명주소 및 지번주소 200회 #특집 <해외여행: 타이페이> - 201회 #특집 <해외여행: 타이페이> - 202회 #특집... 황제짬뽕 경기 의왕시 갈미2로 30 (내손동 750) 209회 차돌짬뽕 서울 공푸 서울 성북구 삼선교로24길 29 (삼선동5가 299-10) 209회 해장짬뽕 익산...,2021. 7. 7.
"이재용, 207일만에 가석방 출소…""정말 죄송"" 고개부터 숙였다","연합뉴스 이재용, “저에 대한 걱정, 비난, 기대 잘 듣고 있다” 이 부회장은 이날 오전 10시5분께 경기 의왕시 소재 서울구치소 정문을... 주거를 이전(移轉)하거나 1개월 이상 국내외 여행을 할 때에는 미리 보호관찰관에게 신고할 것 등의 의무를 진다. 취업제한도 받는다. 파기환송심...",2021. 8. 13.
2021년 03월 【 백운호수 】,"21.(일) # 이동 수단 : 냥카 # 인원 : 경미, PCP CLUB # 목적지 : 백운호수 # 극히 주관적인 여행 점수 : 경미 52점 ★ 여행지 정보 [백운호수] 주소 : 경기 의왕시 학의동 입장료 : 무료 주차요금 : 1시간 이내 1000원 / 1~3시간 2000원 한동안 움추렸기 때문인지 좀이 쑤셔서 자꾸 걷고 싶어져 의왕 백운호수를...",2021. 3. 27.
안양 맛집 소코아 내손점에서 일본을 느끼다,안양 맛집 소코아 내손점에서 일본 여행 안녕하세요~ 오늘은 간만에 카레가 먹고 싶은 날입니다. 개인적으로 일본느낌 음식을 그리 좋아 하진... <안양 맛집 소코아 내손동 위치를 확인해 보세요> 주소 : 경기 의왕시 복지로 118 전화번호 : 070-8803-2276 소정의 포인트를 지급받아 개인적으로 작성한...,2021. 4. 8.
"안양/의왕 백운호수 맛집, 자가제면 백운동 세트구성이 좋은 곳","근교에 여행 온 것 같은 느낌이 있어서다. 날씨 좋은 날 산책하기에도, 기분 내기에도 정말 좋은 백운호수! 본격적으로 자가제면 백운동 리뷰 시작! 자가제면 백운동 영업시간 : 매일 11:00 - 20:00 주소 : 경기 의왕시 백운로 505 전화번호 : 031-347-6909 주차 가능 점심시간에 맞춰 (주말 12시) 도착했더니...",2021. 5. 11.
청계산 정육식당 오케이목장 다녀왔어요~,고기도 참 맛있었던 청계산 정육식당 오케이목장 비앙카의 총평ღ 마치 펜션 바베큐장을 이용하는 느낌의 오케이목장 정육식당은 여행온거 같은 매력이 있어서 좋았어요. 고기또한 상태도 좋고 버섯과 컵라면이 매력적인곳입니다. 경기 의왕시 청계로 106 ⏰매일 10:00 - 22:00 명절 당일 휴무...,2020. 12. 21.
"경기-수원 왕송호수, 황구지천 자전거라이딩 & 자전거여행",경기도 의왕시 왕송호수 상류 의왕역에서 출발하여 왕송호수 둘레를 거쳐 왕송호수부터 시작하는 황구지천을 따라 흙길 제방길(90%)을 달려... 자전거 여행을 할 수 있는 곳이다. ◆ 라이딩 개략도 ◈ 구간별 요약 보기◈ https://lovetraveling.tistory.com/173 ◆ 라이딩 경로 ◆ 자전거라이딩 & 자전거여행...,2020. 2. 10.
"의왕쌀국수 "" 반가 "" 여기는어디~~","코로나로 해외여행을 가기 여러운 요즘 기분정환하기에 좋은 곳입니다. 의왕쌀국수 맛집 "" 반가 "" 주소 : 경기 의왕시 내손동 763 102 전화번호 : 031-341-8777 의왕쌀국수 맛집 "" 반가 "" 에는 단품 메뉴도 잘구성이 되어 있지만 세트메뉴 또한 알찬 구성으로 이루어져 있어요. 베트남 음식중 분짜는...",2020. 12. 31.
지지힐:: 왕곡동 맛집 도심 속 자연에서 즐기는 이탈리안레스토랑,왕곡동 맛집 ‘지지힐’ 주소 경기 의왕시 경수대로 9-16 영업시간 매일 11:00 - 22:00 연중무휴 수원과 의왕의 경계에 위치하여 있어요! 도로를... 멀리 떠나 여행온 느낌? 초록초록한 나무들이 많아서 힐링 되는 느낌이 들었어요 들어가면 이렇게 넓은 내부가 있어요 단체석이 많아서 대가족 모임을...,2020. 10. 10.
매일경제 최신기사 시간별 25 2021-08-13 17:45,오전 경기 의왕시 서울구치소 정문을 노타이 정장 차림으로 걸어 나왔다. 짧은 소감을 밝힌 뒤 미리 준비된 승용차를 타고 서둘러 구치소를... 13 17:42 멍 때리러 간다 힐링하러 간다 [Travel & Leisure] ◆ 신익수 기자의 언택트 총알여행 ◆힐링 '명당' 아니 '멍당'이다. 네 자릿수 확진자가...,2021. 8. 13.
[의왕맛집] 청계산 맛집 백운호수 오리주물럭 '오리마을',"오리마을 - 주소 : 경기 의왕시 청계로 137 - 영업시간 : 매일 11:00 - 21:30 - 평일브레이크타임 : 16:00-17:00 - 전화번호 : 0507-1395-0088 얼마나 맛있었을지... 수원근교여행, #수원근교가볼만한 곳 찾으시는 분들께 추천 드립니다. 4.5점 : . ✔ 청계산 오리, 백운호수 고기집 찾으시면 추천! ✔ 부모님...",2021. 4. 13.
의왕 향토문화의 요람 ' 의왕 문화원',"궁궐여행 대면으로 하는 강좌도 있는데요. 방역수칙을 준수하며 안전하게 진행될 예정인, 【청소년 농악단】입니다. 초등학교 1학년부터 중학교 3학년에 재학 중인 의왕시 학생이라면 누구나 지원 가능합니다. 의왕 농악의 맥을 잇고 발전시키기 위해 새롭게 창단하는 농악단에 많은 학생들이...",2021. 3. 18.
