header,contents,date
[경북 경주] 아이브풀빌라 #차동1117호 :: 감포 가족펜션 단체숙소 추천!,아이브풀빌라 차동 경북 경주시 감포읍 동해안로 2489 (경주시 감포읍 오류리 209-15번지) 입실 15:00 퇴실 11:00 주차 객실당 한대씩 지정주차 객실... 감포펜쳔 #감포펜션추천 #경주단체숙소 #경주가족숙소 #감포단체숙소 #감포가족숙소 #감포가볼만한곳 #경주단체여행 #경주아이브풀빌라 #감포해수욕장,2021. 9. 6.
[경북 경주] 무릉도원을 찾아 떠나는 여행 : 골굴사 편,"한국의 소림사라 불리는 ""골굴사"" 경북 경주시 양북면 기림로 101-5 (양북면 안동리 산 304) tel 054-775-1689 관람 및 주차 : 무료 다양한 선무도 자세의 동상을지나 올라오면 일주문이 보입니다. 안쪽에 주차장이 따로 마련되어있었으나, 힐링겸 산책겸 밑에서 부터 걸어올라갔네요 헛둘헛둘...",2021. 3. 8.
경북으로 떠나는 전통문화 나들이,"인문학강좌 인성교육, 국악 · 클래식 음악회, 전통의례 예절교육, 무용 · 연극 민속공연회를 즐길 수 있는 향교와 서원, 경북 안동시, 경주시에... 안동 여행지 꿀정보! 하회별신굿탈놀이 6개 마당을 모두 즐겼다면 하회마을과 도산서원에서 고즈넉한 정취를 느껴보세요. 드라마...",2020. 7. 28.
경주여행♩야밤의 황리단길 & 황리단길 맛집 경주피자,"영천여행을 가기 전 밤에 들른 #경주황리단길 ! 영천여행 아이디어는 남편이, 가기 전 #황리단길 들러보자! 는 제 아이디어였지요. :) 이 여행... 주소: 경북 경주시 포석로 1071 경주피자 영업시간: 12:00-23:30 유명한 클림트 그림도 분위기 있게 있더군요. 손님들이 많으셔서 내부사진은 못...",2020. 12. 16.
"[경주 여행]신라 불교 미술의 걸작! 경주 석굴암 :: 경주여행, 경주가볼만한곳, 걷기...","[이용 정보] 054-746-9933 -이용시간: 매일 09:00 - 17:00 -이용요금: 어른 6,000원 / 청소년 4,000원 / 어린이 3,000원 청소년(단체) 3,500원 / 어린이(단체) 2,500원 석굴암 경북 경주시 불국로 873-243 석굴암 (진현동 999 석굴암) 경주 여행지 더보기 이새별 경북여행리포터의 5월 취재기사입니다",2020. 5. 18.
"타임지 선정 세계100대 명소, 경주시","© april_kim, 출처 Pixabay 타임지 선정 ’2021년 세계 100대 명소 (The World’s 100 Greatest Places)에 한국의 경주시가 선정됐다. 타임지는 경주를 선정한... 세계문화엑스포 10. 불국사 11.황리단길 등을 추천 할 수 있다. #경주여행 #국내여행 #여름휴가 #국내여름휴가 #해외여행 #경북여행",2021. 8. 4.
경주시불국동맛집 존재할까요좜,"ㅎㅎ8월 5,6 휴무 !경주로갔습니다 고색창연경북 경주시 보불로 뿎58-4경주올때마다 들리는 고색창연!ㅋㅋㅋㅋㅋㅋ진짜 엄마가해주는... 또올게요#고색창연#경주떡틣갈비#경주맛집#경주맛집추천#경주고색창연#경주떡갈비맛집#경주순두부찌게#경주추천#경주정식밥집#엕경주밥집#경주여행#경주휴가...",2020. 11. 3.
[2020.11] 2박 3일 경주여행 DAY 1 :: ① 경주 황오동 맛집 소사이어티 나귀...,작년 가을 가족 여행으로 다녀왔던 경주 ✨ 어릴 때 가족여행으로 꽤 여러번 왔었던 기억이 있어 추억 여행 겸 가족 여행지로 골랐다... 주소 경북 경주시 임해로 127 전화번호 0507-1340-6274 영업시간 11:00-21:00 (BT 15:00-17:00) / 일요일 휴무 브레이크 타임 끝나는 시간에 맞춰 오거나 미리 예약 후...,2021. 3. 16.
[경북/경주 여행(음식)] 정원이 이뻤던 황리단길 “카페1909”,"경북/경주 여행 카페 1909 주소) 경북 경주시 포석로 1054 영업시간) 8:30-20:00, (주말 ~22:00) 연락처) ***-****-**** 밥먹으러 식당가던길에 어 뭔가 이쁜데 카펜가? 싶었던 카페 1909. 원랜 밥먹고 바로 대릉원으로 가려했는데 계획변경! 무계획 여행의 묘미지〰️❤️ 카페 1909는 소설재라는 한옥 민박...",2021. 7. 15.
경주 여행코스 가족여행 루트 팔로미!,"하는 분들은 오늘 , 경주 여행코스 두가지 알려드릴게요 ! 경주가족여행에 황리단길 빼면 너무 섭섭하죠. 카페며 맛있는 식당까지 있어서 한 번은 꼭... <도깨비명당> 주소 : 경북 경주시 포석로 1092번길 28 이곳에서는 토정비결과 운세 뽑기 두 가지 다 할 수가 있습니다. 연애운까지 있다고 하니까...",2020. 7. 2.
경주 맛집 옥천식육식당의 돼지찌개,"경주 여행 멤버들끼리 칭찬을 아끼지 않았던 곳이 바로 여기다. 역시 믿고 가는 롬슐랭 ! 식당 외관- 식당 내부는 아주 넓지는 않고 대략 30명... 경주 옥천식육식당 Phone 054-761-2154 Add 경북 경주시 안강읍 양월교동길 4-1 Open 매일 11:00 - 20:00 (Break time 15:00 - 16:00 / 첫째, 셋째 월요일 휴무)",2021. 9. 23.
경북 경주 ) 황리단길 카페 추천,"이번 경주여행도 혼자 온 여행인 만큼 카페에서 많은 시간을 보내며 여유를 즐길 줄 알았지만,,, 하하하하 미친x 마냥 하루에 20km 이상 씩... room 경북 경주시 포석로 운영시간 11:00 ~ 21:00 너티크레마 = 아인슈페너 같은 느낌 / 너티스크림 = 아포키토 느낌 , 다양한 쿠키 & 케이크 & 티 판매 * 맛도...",2021. 8. 17.
경주여행,"여행은 늘 어디에 가느냐보다는 누구와 가느냐지만 오늘은 경주 1박 2일 !!(금토) 연차는 나의 것!! ㅋㅋㅋ 첫날은 산림연구원, 첨성대, 동궁과월지... ㅋㅋ 경북 경주시 배동673-2 쌈밥집이 너무 많아요 ㅠㅠ 우렁이 들어 있어서 나는 제첩이랑 우렁이랑 원래 좋아해서 난 과한 양념은 안좋아하는데 쌈...",2021. 3. 20.
감포 횟집 시원한 물회 맛집,"명성회센타 메뉴 : 모듬회 중 70,000원 / 오징어물회 20,000원 주소 : 경북 경주시 감포읍 감포로2길 105 전화 : 054-775-4913 영업 : 매일 08:00 - 21:30 정보 : 단체석, 주차, 포장, 예약, 무선 인터넷, 남/녀 화장실 구분 주차 : 가능 이날 저희가 들른 감포 횟집은 여행의 마지막으로 들러본 식당이었는데요....",2021. 7. 31.
경주 :: 성건동 2학년1반 불막창,불막창 주소 :: 경북 경주시 한빛길20번길 44 오픈시간 :: 오후 5시 전화 :: 054-745-8594 경주에서 '나 술 쪼매 마셔봤어요' 하믄 한번쯤은 다녀갓다는... 1반으로~ #2학년1반불막창 #경주맛집 #경주맛집추천 #경주여행 #경주불막창 #경주막창 #경주막창맛집 #경주로컬맛집 #성건동맛집 #불막창...,2021. 9. 15.
옥산서원(玉山書院)을 탐방하다,"옥산서원(玉山書院)(유네스코 세계문화유산) 주 소 :경북 경주시 안강읍 옥산서원길 216-27 전 화: 054-762-6567 홈페이지: Osan seowon, Gyeongju go kr 2021,8,30(윌) 오늘 여행은 경주의 옥산서원을 보고 경주에서 소노 호텔에서 1박을 하기로 하여 동탄으로 출발하였다 그러나 일행 중 부득이한 사정이...",2021. 9. 15.
"일상 | 문경-경주 2박 3일 여행 - Day1 : 문경 뉴욕제과, 문경새재, 군위영천휴게소...","흑… 경북 경주시 원화로 102 안압지 = 동궁과 월지 09:00 ~ 22:00 성인 3,000 원 / 청소년 2,000원 / 어린이 1,000원 ▲ 야경 핫스팟인 동궁과 월지 (사적 18호) 이렇게 낮잠 & 밤잠으로 문경-경주 2박 3일 여행의 첫날을 보내고. 내일은 본격적인 경주 유적지 탐사 + 황리단길 탐험이다. ✦✦ 네이버...",2021. 10. 5.
경북 거리두기 완화되면 가 볼 여행지 베스트 3 (feat.동해바다),"경북의 바다를 감상하고 싶으면 다음엔 '해맞이공원'은 필수 코스로 넣어야 겠다. 구경하고 나면 그 유명한 대게도 먹으러 가야겠지? 2 ✦ 경주시 - 파도소리길(주상절리) '경주'하면, 대한민국 사람들은, 아니지 요즘은 경주로 수학여행 따위를 가지 못하니까, 적어도 20대 중반 이상이면 '경주는...",2021. 7. 21.
경북 경주 - 정혜사지 13층탑,"경북 경주 - 정혜사지(淨惠寺址)13층탑 경북 경주시 안강읍 옥산리 1654 90년대 유홍준교수의 문화유산답사기의 열풍이 몰아치던 때 나도 전국 폐사지(廢寺址)를 찾아 여러 번 답사를 다녔었다. 폐사지 여행의 백미로 손꼽히는 원주의 법천사지, 거돈사지를 비롯 가까운 경주의 무장사지, 고산사지...",2020. 8. 16.
"[경주 황리단길] 백이당 카페와 프리미엄 한옥 게스트하우스 황남디귿집::경주여행, 경주...",만족스러운 1박2일 여행이었답니다! 경주 황리단길 다이닝 & 카페 ‘백이당’ 전화번호 : ***-****-**** 주소 : 경북 경주시 사정로57번길 12-1 영업시간 : 11:00 - 21:00 휴무일은 인스타공지 황리단길 한옥게스트하우스 ‘황남디귿집’ 전화번호 : ***-****-**** 주소 : 경북 경주시 손효자길 12 입실 15:00...,2020. 3. 13.
"[경북 울진] 울진여행 둘째날-2 (1박2일) : 카페노바(월송정),성류굴","포항시, 경주시, 영덕군, 울릉군, 주민등록이 되어있거나 다자녀가정(자녀3명이상), 한부모가정 또는 국가유공자, 장애인, 6세이하 어린이 는... #울진여행 #울진여행코스 #동해여행 #동해여행코스 #경북여행 #울진가볼만한곳 #경북가볼만한곳 #울진카페 #울진카페노바 #카페노바 #노바커피...",2020. 10. 6.
"내가 바로 경북여행 디자이너! 경주에서 인생샷 남기기 <어서어서, 경주 대릉원...","오늘은 경북나드리 모바일티켓 상품으로 구성되었으면 하는 여행코스를 제안해보려고 합니다. * 경북나드리 모바일티켓이란? 경상북도와 23개... 주소 : 경북 경주시 황남동 문의 : 054-750-8650 이용시간 : 매일 09:00~22:00 (매표 및 입장 마감시간 : 21:30까지) 입장요금 : 성인 3,000원 / 군인&청소년 2...",2020. 11. 20.
가성비 좋은 가족여행 숙소 '라한셀렉트 경주 호텔' 또 갈래요,"가성비 좋은 가족여행 숙소 '라한셀렉트 경주 호텔' 또 갈래요 라한셀렉트 경주 호텔 (주소) 경북 경주시 보문로 338 (신평동 477-2) (전화번호) 054-748-2233 (인.아웃) 체크인 15:00, 체크아웃 11:00 가성비 좋은 가족여행 숙소 '라한셀렉트 경주 호텔' 또 갈래요 경주 가족여행 숙소로 선택한 이유 ①...",2021. 5. 3.
가을 경주 핫플에서 갬성을 담다~~! 여행리스트 저장각이야@,소녀갬성 물씬 경주 핑크뮬리▶경북 경주시 인왕동 가을 경주 여행리스트 터져나가겠다며~이렇게 핫플 많았나며~_~경월 친구들 한테만 경월이가 특별히 알려주는거야!!! 알쥐?! ▼더 많은 컨텐츠와 이벤트로 경주월드와 소통하고 싶다면▼https://www.facebook.com/hi.gjw/,2020. 9. 25.
경북경주여행_무장봉,경북 경주시 암곡동에 있는 무장봉으로. 숨은 명소이죠. 보문단지에서 포항 방면으로 비껴갈때. 그 옆으로 살짝 조그마이에. 표지판이 있습니다. 개울에는 물이 다 말랐어요. 우선 완만한 길과 가파른 길 중. 완만한 길을 선택합니다. 우리는 전문산악인이 아니니까요. 그런데도 힘드네요. 6 km인데...,2020. 11. 16.
[경북 경주] 유로빌펜션 후기와 주의사항,"054-742-1579 경북 경주시 북군4길 27-1 입실 15:00퇴실 11:30 경주 이틀재 숙소는 유로빌 펜션이었다. 체크인이 늦기도 했고, 공사중이어서 외관 사진은 찍지 않았다. 나는 웨일즈B 객실이었던걸로 기억한다. 문열고 들어가면 바로 주방이 있다. 더 들어가면 침실이 있고 뒤쪽으로 화장실이 있다....",2021. 9. 3.
"[경주여행] 경주 황리단길 맛집, 도솔마을","바삭한게 아니라 전체적으로 바삭해서 좋더라고요 따끈한 온돌방에서 너무 맛있게 먹었어요! 다음에 경주가면 또 갈 것 같아요 가성비 대비 짱인듯요 ㅎ 경주 도솔마을 ☎ 054-748-9232 경북 경주시 손효자길 8-13 매일 11:00 - 21:00 브레이크타임 15:00 -17:00 라스트오더 20:20 월,화요일 휴무 주차가능",2021. 4. 28.
다양했던 경주 황리단길 카페 목록,지난주말에는 지인들과 경주로 여행 갔다가 근처에 자리한 경주 황리단길 카페에 다녀왔어요. 취향에 맞는 디저트를 골라 먹어볼수 있는건 물론이고 사이드 음료도 훌륭해 모두 흡족했던 곳이랍니다. 1. 라라양과점 주소: 경북 경주시 포석로 1089-14 번호: ***-****-**** 영업시간: 매일 11:30 - 20:30...,2021. 8. 7.
[경주 여행]천년의 수도에서 외국을 느껴보는 이색여행① :: 경주 가볼만한곳...,"누군가에게는 꿈과 미래가 될, 누군가에게는 그리운 시절의 흔적이 되어주는 자동차를 세계자동차박물관에서 만나봅니다. 2편에 계속됩니다! 보문콜로세움 경북 경주시 보문로 132 경주 여행지 더보기 권동환 경북여행작가의 7월 여행기입니다",2020. 8. 5.
경주숙소:: 경주 한옥 예쁜 금성일기 good !!,3월 초 휴가 차 갔던 경주 여행 부터 포스팅 해봅니다~ 짜쟌- 너무너무 이뿐 숙소. 경주가면 꼭! 꼭! 한옥숙소 가겠다고 폭풍 검색 하여 찾은곳... 고즈넉한 분위기 :D 분위기에 취한 남펴니.ㅋㅋㅋㅋ 젤 좋아함.ㅋㅋㅋ 경주 한옥 :: 금성일기 경북 경주시 쪽샘길 4-3 N예약 혜택 : 연박 할인 - 2박 이상...,2021. 9. 13.
"문화재청, 2022년 지역문화재 활용사업 405건 선정","총 56건의 공모사업 중 43건을 선정하였으며, ▲ 경북 경주시 칠불암의 ‘칠불암 5감 체험’, ▲ 충북 청주시 용화사의 ‘대한민국 마지막 원찰... 2022년도 생생문화재 사업 선정 목록 연번 시도 시군구 사업명 1 서울 서대문구 서대문형무소, 독립의 그날로 시간여행 2 서울 중구 엄마야...",2021. 9. 15.
경북 경주 ) 황리단길 & 로컬 맛집 추천,* 이번 포스팅은 길지만 그래도 맛집 정보 가득하니 끝까지 읽어보세요^^ ( 내돈내산 맛집 ) ▶ 제가 경주여행 했을 때는 코로나 3단계 였습니다.... ( 먹고 부산 넘어 가신다고 ) 교리김밥 봉황대점 경북 경주시 태종로 운영시간 : 09:30 ~ 20:00 / 매주 목요일 휴무 혼자 오시는 분들은 한 줄...,2021. 8. 16.
"[경주 여행]여기는 지금 꽃천지, 경주 천북면 꽃단지 :: 경주 가볼만한곳, 경주 꽃 명소...",다양한 종류의 꽃들이 도로를 따라 형성되어있어 경주여행 왔다가 드라이브 코스로 들리기 좋은 곳인 것 같아요! 지금 경주 천북면 물천리는 꽃천지랍니다~ 경주 천북면 꽃단지(나무와흙한옥펜션) 경북 경주시 천북면 천북남로 439-7 경주 여행지 더보기 이지은 경북여행리포터의 6월 취재기사입니다,2020. 6. 23.
[경북/경주] 경주 여행 때 꼭 가야될 황리단길 맛집 '987피자',경주 여행 가게되믄 여기 987피자 뒤에 백야드 와서 칵테일도 마셔봐야징... 여기서부터는 경주 987피자의 정보 <영업시간> 매일 12:00 - 22:00 (주방마감 21:00) 월요일 17:00 - 22:00 <전화번호> 070-4007-1987 <홈페이지> http://987pizza.modoo.at/ & <위치> 경북 경주시 황남동 75 (대릉원 바로 옆 도솔마을 길에...,2020. 12. 13.
"경주 여행, 통일신라시대~ 월정교",경주 월정교 주소 : 경북 경주시 교동 274 시간 : 매일 09:00~22:00 경주 여행 중 교촌마을을 둘러본 뒤 월정교를 가게 되었어요. 예전에 복원 공사할 때 먼 발치에서 여러 번 보아왔었는데 이번에 가니 완공되어서 관람이 가능하게 되었네요. 자료를 찾아보니 2018년 4월에 완공되었다네요. 경주를 자주...,2021. 1. 31.
경주 카페 추천 뷰가 예쁜 한옥카페 바실라,"9월 후반, 딱 경주 여행하기 좋은 날씨다. 여행 중에 카페는 꼭 한번 방문해 줘야 한다. 관광 도시답게 경주에도 멋지고 예쁜 카페가 많다. 검색을... cafe BASILLA 카페 주소 : 경북 경주시 하동못안길 88 문의전화 : ***-****-**** 영업시간 : 평일 11:00 - 21:00 단체석, 주차, 포장, 예약, 무선 인터넷, 반려동물...",2021. 9. 24.
경주 가볼 만한 곳 보문호 둘레길,"경주 여행에서는 시간이 많았기 때문에 둘째 날 아침에 일어나서 느긋하게 한 바퀴를 돌았습니다. 경주 보문호 둘레길은 보문 호수를 중심으로 관광 휴양지와 문화 레저 시설 등을 갖춘 경북 경주시 경주 보문 관광 단지 일원을 일컫습니다. 50만 평 규모의 인공 호수로, 주위에는 국제적 규모의...",2021. 9. 22.
"경북 경주 가볼만한곳, 천년고찰 기림사","경북 경주 가볼만한곳, 천년고찰 기림사 경북 경주시 문무대왕면 기림로 437-17 안녕하세요~ 기장군에 사는 기장아줌마예요! 전에 가족들과 함께 경주 여행을 갔을 때 기림사에 들렀어요. 경주 여행지로 한적한 곳을 찾는다면 기림사를 추천해요. 경주 가볼만한곳 기림사 입구에 주차를 하고 사찰은...",2021. 8. 9.
경남이와 랜선여행_단풍여행편,수학여행의 단골이였죠. 지금도 가을이면 단풍구경하러 많이 찾으시는 장소예요:) (경북 경주시 불국로 385 불국사) 내장산 국내 전국 단풍 명소 10선 중 한 곳인 내장산은 단풍 드라이브 코스로 정말 아름다운 곳이죠 (전북 정읍시 내장산로 1207) 지리산 우리 산린이들도 다 알만한 지리산은요!...,2020. 10. 12.
"[경북경주멋집] 경주시 성건동, 카페 안 모든 게 다 이쁜... "" 오마이커스터드 """,이쁘다가 가장 잘 어울리는 도넛 카페 오마이커스터드 다녀왔습니다 네이버로 검색하면 저렇게 표기된다는 놀이터 옆 하얀주택 놀이터 찾기도 전에 바로 발견 건물 앞에 차를 대고 입장합니다 끄악 그냥 막 이쁨 가정집 카페 중에서 이 만큼 이쁜 곳 잘 기억이 안남 특히 노란색 간판 덕분에 미친 듯...,2020. 8. 20.
[경주 여행]천년의 수도에서 외국을 느껴보는 이색여행② :: 경주 가볼만한곳...,"특히, 된장을 기본으로 한 사골 육수는 국수를 끓여먹어도 맛있습니다. 온천향과 나무향을 맡으며 운치 있는 한 끼 식사를 경주 온천집에서 한다면 일본여행을 하는 기분을 느낄 수 있습니다. 황리단길 경북 경주시 포석로 1080 경주 여행지 더보기 권동환 경북여행작가의 7월 여행기입니다",2020. 8. 5.
2021년 추석 대구근교 경주 아이들과 가볼만한 7곳 추천,가족들과 전통체험도 하고 고즈넉하고 소박한 한옥마을의 운치를 맘껏 즐기기 아주 좋은곳 인듯 하여 우리 고유의 명절 한가위 여행장소로 아주 좋을듯 합니다. 2. 경주 한옥펜션 세심마을 민박 ▶위치 : 경북 경주시 안강읍 옥산서원길 301-2 ▶퇴실시간 : 11시 / 입실시간 : 14시 ▶예약문의...,2021. 9. 7.
국립 경주 박물관 아이와 가볼만한곳,"경주 하면 아이들과 석굴암 , 불국사 , 첨성대 안압지 등등 아이들과 여행에 꼭 유적지나 박물관을 넣어와서 그런지 이번에 경주에 잠시 들른다니... 국립경주박물관 경북 경주시 일정로 186 개장시간 :10시~6시 어린이 박물관은 일주일 전 정도는 예약해야 한다고 하는데 우리는 특별히 어린이 (?)...",2021. 9. 20.
반짝였던 보문단지 맛집 모음,"보문단지 안에 있어서 경주를 코스에 따라 여행 하실 때 들러 보시면 좋을 것 같아요. 1. 전통맷돌순두부 0507-1407-0114 경북 경주시 숲머리길 111 2TV생생정보 297회, 17.03.31 두부전골(대) 40,000원 모두부 8,000원 파전 10,000원 들어가는 초입에 커다란 간판이 있어서 멀리서도 눈에 잘 보였는데요. 식당...",2021. 4. 30.
자연산회 제대로 먹고온 경주여행 맛집,경주 감포 대본항 인근에 위치한 경주여행 맛집은 문무대왕릉 에서 해안로를 차를타고 3분정도 가면 도착하는 곳으로 해변가를 보며 드라이브 즐기다보면 금방 도착 해요 . 주소:경북 경주시 감포읍 대밑길 12-40 영업시간:매일 09:00~20:30분 주차장:건물앞 주차장 마련되어 있어 편안하게 주차 가능...,2021. 3. 12.
"[경주 여행]조선의 지방사립대학 방문하기!... 서원 여행, 나들이 장소 추천, 6월 여행지","naver.com/main/read.nhn?mode=LSD&mid=sec&sid1=102&oid=421&aid=0004668220 요즘같이 무더운 6월, 시원한 자계천과 함께 어우러진 옥산서원에서 푸른 여름을 느껴보시는 건 어떤가요? 경주 옥산서원 경북 경주시 안강읍 옥산서원길 216-27 경주 여행지 더보기 이새별 경북여행리포터의 6월 취재기사입니다",2020. 6. 22.
경북가볼만한곳 경주여행 가을단풍구경하기 좋은 은행나무숲길 도리마을,주소는 경주시이지만 영천 고경면에서 가까운 곳이다. 경주와 영천의 경계부근이다. 개인사유지인데 입장료도 받지않고 무료로 마을을 개방한다고... #도리마을 #경주여행 #경북여행 #경주가볼만한곳 #영천가볼만한곳 #대구근교드라이브 #가을단풍구경 #영천단풍놀이 #경상도여행,2020. 10. 27.
"경주 여행 월정교, 교촌마을 최부자댁, DSLR 카메라 니콘 D780",물론 유효 화소 수 2450만 화소와 ISO 100～51200의 뛰어난 고감도를 가진 DSLR 카메라 니콘 D780이라 사진 전체가 정말 군더더기 없이 깔끔하게 찍힌 것 같아 즐거운 경주 여행이 될 수 있었던 같아요. 주소: 경북 경주시 교촌길 39-2 문의처: 054 760 7880,2021. 4. 27.
경주 감포 소풍펜션 내돈내산 솔직후기,소풍펜션 경북 경주시 감포읍 연동길 6 ***-****-**** 입실 15:00퇴실 11:00 출처 네이버 1층은 카페 소풍인데 낮과 밤의 분위기가 완전히 다른 것 같아요... 함께 하면서 가성비 최고의 경주 감포 소풍 펜션을 선택해서 모두가 행복한 시간이었답니다~ 다음번 가족여행이 있다면 재방문 의사 100% 있어요!!,2021. 9. 28.
신이 났던 경주 맛집 추천,"이번에 여행을 다녀오면서, 괜찮은 식당 여러 군데를 들러봤어요. 저처럼 한식 좋아하시는 분들이라면 자신 있게 경주 맛집 추천드리고 싶네요. 2. 경주 올바릇식당 주소 : 경북 경주시 보문로 368-5 1층 올바릇식당 번호 : 0507-1420-7849 영업시간 : 매일 11:00 - 20:00 브레이크타임 15:30 ~ 17:00 메뉴...",2021. 7. 30.
"경주여행코스, 조용히 둘러보기 좋은 '국립경주박물관'",내용 : #여행 #국내여행 #경상도 #경주 #경상도여행 #경주여행 #경상도경주 #경상북도 #경상북도경주 #경상도경주여행 #경북 #경북경주 #경북여행 #경상북도여행 #경북경주여행 #경북여행 #경주여행코스 #경주여행 #경주박물관 #국립경주박물관 주소 : 경상북도 경주시 일정로 186 TRAVEL 아래 포스팅은...,2020. 12. 14.
"경주 여행｜보문단지 가볼만한곳, 실내 식물원 데이트 '경주 동궁원'",#경주데이트코스 #경주실내가볼만한곳 #경주동궁원 경주 동궁원 09:30 ~ 19:00 경북 경주시 보문로 74-14 054-779-8725 전부터 경주에 가면 꼭 가보고 싶었던 곳이 있었는데요. 보문단지에 있는 식물원인 경주 동궁원입니다. 사실 다녀온 지는 몇 달이나 지났지만 포스팅이 많이 늦어져버렸네요. 동궁원은...,2021. 9. 10.
경북 경주시 ‘이풍녀 구로쌈밥’,이풍녀 구로쌈밥 8월 경주여행중 가본 맛집이다 가격 착하고 반찬도 깔끔하고 후식으로 나온 수박이 유난히 달았다 정말 맛나게 먹었던 기억이 나서 별 ★★★★,2020. 8. 13.
"경주 가볼만한 곳 : 문무대왕릉, 주상절리, 동해바다","저 멀리 보이는 문무대왕릉은 신라 문무왕의 수중릉이로, 경북 경주시 문무대왕면에 위치하고 있습니다. 대왕암은 육지에서 불과 200미터 떨어진... 전망대 인근에는 주차하기가 힘들어서 한참 헤맸어요 인근의 읍천항과 주상절리도 잠깐 들렀는데, 경주를 여행하면서 느낀 것은 어디를 가든 그 곳에...",2021. 9. 19.
여유 있었던 경주 황리단길 카페,"지난 주말에는 당일치기로 경주 여행을 다녀왔는데요. 친구가 미리 골라 놓은 경주 황리단길 카페 중 가장 끌리는 곳으로 방문했는데 여유로운... 두부마을 주소 : 경북 경주시 불국로 168-3 영업시간 : 매일 08:30 - 20:00 전화번호 : 054-741-7775 메뉴 가격 : 특송이얼큰순두부정식 15,000원 다음날...",2021. 5. 18.
[경주] 매운갈비찜 맛집 - 진가네 대구갈비 본점,"그래서 있었는데 없어짐 ㅋㅋㅋㅋㅋ 바닥까지 싹싹 긁어먹었다 여행 첫날 첫끼인데 넘나 만족스러웠던 진가네 대구갈비 역시 경주사람들의 찐 맛집이었다 진가네 대구갈비 본점 경북 경주시 양정로290번길 11 매일 10:00 - 22:00 단체석, 포장, 배달, 무선 인터넷",2021. 9. 7.
