header,contents,date
[경남여행] 고성 가볼만한곳 상리연꽃공원 연꽃축제 올해 연꽃피는시기,경남 고성 상리연꽃공원 푸릇푸릇 여름에 가장 예쁜 연꽃축제 글/사진 : 준또 ⊙ 경상남도 고성군 상리면 척번정리 125-3 푹푹찌는 여름을 보내다보니... 근데 어느새 사진찍고 있다보면 다들 신기해하면서 줄섬ㅋㅋㅋㅋㅋㅋㅋㅋㅋ 갑자기 진짜 포토존됨ㅋㅋㅋㅋㅋㅋㅋ 경남여행은 언제가도 좋겠지만...,2021. 7. 15.
경남동네여행,"20210907 경남동네여행ㆍ이서후ㆍ김민지ㆍ김해수ㆍ최석환지음ㆍ경남도민일보출판 가까운 동네 먼동네! ^^ 가본 곳 가보지 못한 곳 동네여행!... ㆍ고성군 동해면ㅡ당항만둘레길 해상도보교.소담수목원 ㆍ진주시 문산ㅡ갈촌역(폐역)앞 자전거도로. 문산성당 ㆍ김해 율하천 문화공간, 가야유적공원....",2021. 9. 7.
경남 고성 여행 수국 스팟 가득 만화방초 여름 여행지로 좋은 곳,"이곳 주소는 경남 고성군 거류면 은황길 82-91 이구요,운영시간은 매일 09:00 - 18:00 입니다.입장료 있는데 성인 기준 5천원이라고 하네요.제가 방문했던 작년에는 성인 기준 입장료 3천원이었는데그 사이 5천원으로 오르다니 ㅠㅠ 규모에 비해 조금 비합리적인 가격인것 같아요 개인적으로는 1인...",2021. 6. 5.
퀄리티 높았던 경남 고성 맛집 바닷가에 햇살 한 스푼,"주소: 경남 고성군 고성읍 신월로 157 전화번호: 055-673-6160 매일 11:30 - 21:00 브레이크타임 (평일만) 16:00 - 17:00 매주 월요일, 화요일 휴무! 매장은 이미... 딸들과 나폴리여행 갔을때 현지에서 사먹었던 피자와 가장 흡사해서 가끔씩 생각나는 피자입니다. 특별할거 없는 재료입니다. 빵위에...",2020. 8. 22.
"[고성] 고성군, '고성 한달살이' 추진","이번 한달살이 사업은 관광객이 고성군에 관심을 가지고 여행계획을 수립하고 체험해 고성군 관광수요를 창출하기 위하여 실시하며, 관광객의 눈으로 고성의 숨어있는 매력을 찾고 홍보할 수 있도록 지원하는 사업이다. 경남지역 외 거주자로 만19세 이상이면 누구나 신청 가능하며, ‘관광고성’...",2021. 3. 12.
"경남 고성 송학동 고분군, 4월에 가볼 만한 고성 여행지, 가야 시대 고분에서 인생 사진을!!",고성 송학동 고분군이 야외라고 하나 마스크 착용 코로나 수칙은 필수로 지켜 주시면서 건강한 나들이 즐겨 보시기 바랍니다. #경남고성 #고성송학동고분군 #송학동고분군 #4월에가볼만한고성여행지 #가야시대고분 #고분에서인생사진을 #고성여행지 #고성여행 #고성군 #고성,2021. 4. 12.
[경남 고성 송학리고분 /상리연꽃공원] 여름맞이 전 고성여행,가야시대 고분입니닷 송학리고분 경남 고성군 고성읍 송학리 470 주차는 고성박물관주차장에 주차하시면 됩니닷 도심 속에 고분이라니 사실 고분은... 도시에 살다 보니 여행은 이런 분위기를 더 선호하게 되는듯ㅋㅋ 밑에 거진 다 내려와서 찰칵찰칵! 이때 이벤트도 해서 고성에서 쓸 수 있는...,2021. 5. 12.
"공룡의 낙원, 경상남도 고성군에서 오픈할 ‘공룡타조랜드’","하지만, 경상남도 고성군에는 옛 공룡들의 자취를 곳곳에서 찾아볼 수 있습니다. 천연기념물로 분류된 공룡 발자국화석을 비롯해, 해안가에는... ^^ #국내여행 #경남고성 #경남고성여행 #경남고성가볼만한곳 #경남여행지추천 #경남여행 #통영여행 #통영 #통영가볼만한곳 #경남캠핑 #경남고성캠핑...",2021. 4. 2.
"국내여행지 추천 경남 고성, 사천 가봐야할 곳","다 좋았어서 고성, 사천 여행가실 분들은 딱 요 코스로 가보셔요 카페도어스 경남 고성군 고성읍 신월로 166 아침에 출발해서 제일 첫코스로 카페 도어스에 왔어요! 코로나 때문에 매장 이용이 불가하다해서 (지금은 가능!!) 커피는 다른 곳에서 마시기로 하고 주변만 구경했어요. 연말이라 엄청...",2021. 10. 5.
"석기인의 사족보행,명상을 통한 마음 치유코스 경남고성 해양치유길 걷기여행...",들면서 여행을 가는 것 같이 즐거웠습니다 (도망가자 엄마도 휴가가 필요하니깐 : 여기어때cf) 드디어~~ 고성군 하이면 덕명마을 상족암선착장에 도착했습니다 시작 전 해양치유길 걷기여행의 간단한 소개와 오늘 진행될 프로그램에 대해 들었습니다 경남고성군 해양치유길 걷기여행...,2021. 8. 16.
6월 경남여행 : 고성 가볼만한곳 : 고성 학동마을 능소화,학동마을주차장 학동새마을회관 앞 공터 학동마을주차장 : 경남 고성군 하일면 학림리 917-17 학동마을주차장 : 경남 고성군 하일면 학림리 917-17 학동마을주차장에 주차하고 조금 걸으니 새마을회관이 나오고 바로 돌담길이 시작됩니다. 학동새마을회관앞 공터에 주차공간이 조금 있습니다....,2021. 6. 19.
대한민국 안심여행 캠페인 방역 우수 관광지 178선 중 경상도 소재 여행지 목록,"'대한민국 안심여행 캠페인'은 한국관광공사에서 전국 광역지자체와 함께 주요 관광지에서 방역체계 구축, 관광객 관리 등 방역수칙을 정하여... 당항포관광지(경남 고성군) - 김해가야테마파크(경남 김해시) - 독일마을(경남 남해군) 출처: 한국관광공사 - 밀양아리랑 우주천문대(경남 밀양시)...",2021. 7. 5.
"경남 고성명소 갈만한 곳, 상리연꽃공원 & 송학동고분군 (애견동반 여행코스)","가 아닌 댕댕이가 함께해요 '----' 고성송학동고분군 무료입장, 무료주차, 강아지동반가능 경남 고성군 고성읍 송학리 470 강아지와 함께 다니다 보니 애견동반 여행지를 우선적으로 찾게 되는데 고성에는 들어갈 수 있는 곳이 거의 없더라구요 아쉬웠어요 ㅠ_______ㅠ 여러군데 찾다 발견해서 마지못해...",2021. 6. 14.
경남 고성 피크닉 대여와 음료 맛집 카페/ 다소니카페,"다소니카페 경남 고성군 고성읍 성내로135번길 3 영업일 & 피크닉 문의: 인스타 안녕하세요! 고성여행 계획 중에 발견한 피크닉대여! 저는 지금 다이어트 중이여서 피크닉 대여해서 소풍느낌으로 즐기면 어떨까? 싶어 찾게 되었어요. 고성에 피크닉 대여하는 곳이 몇군데가 있던데, 저희는...",2021. 9. 24.
경남 고성 인생샷 명소/ 상족암군립공원,상족암군립공원 경남 고성군 하이면 덕명5길 42-23 주차비 무료 애견동반불가 안녕하세요(찡긋) 이번에 고성여행에 다녀왔어요. 첫번째 일정은 고성여행하면 아주 핫한 “상족암”에 먼저 갔지요:-) 사실 먼저 간 이유가 상족암군립공원이 제일 먼 곳에 있더라구요. 거의 사천쪽이던데 그래서 첫번째...,2021. 9. 22.
경남 고성 / 캠핑여행 고성박물관 관람,#주말엔아빠여행사 입니다. 캠핑을 가면 캠핑장에 일찍 들어가서 최대한 늦게 나와 조금이라도 더 캠핑을 즐기고 싶은 마음이 큽니다. 1박 2일... 토기 유물을 소개하기도 하고 고성군의 소가야시기에 대한 설명도 있었습니다. 고성군의 주요 유적지를 소개하는 지도입니다. 제가 기억하는 고성군은...,2020. 10. 29.
▶경남 고성 가볼만한곳 Place5! 오션스파호텔 맛집 가리비 5일장 문수암,"경남 고성 가리비 경민수산 경남 고성 여행 코스로 이맘때 특산물과 물좋다고 소문난 해수탕 까지 다섯곳을 소개 해 드립니다. 단디 보이소~ 경남 고성군 하일면 송천2길 64-4 경민수산 저는 잘 몰랐는데, 가는곳마다 저를 알아보시는 분들이 의외로 너무 많아서 여러번 당황스럽기도 했었습니다....",2020. 11. 6.
"경남 고성 여행 코스 , 고즈넉한 당일치기","그래서 시내버스가 아닌 군내버스가 다니는 경남 고성군 입니다. 한적하고 깔끔해서 여행하기에 너무나 좋아요. 코로나로 인해 여행 다니기 다시 어려워진 시기 이네요. 주춤해지고 나면 다시 한번 가보고싶은 곳입니다. 고성가볼만한곳 ▼▼ 드라마 촬영지, 소담한 장산숲 아담한 숲이지만, 잘...",2020. 8. 25.
'호방한 기운을 담다! 경남 고성 밥상' 식객 허영만의 백반기행 64회 식당 소개,군령포하모자연횟집 (하모) 주소> 경남 고성군 삼산면 두포5길 426 연락처> 055-672-2195 * 하모 곰국은 메인 메뉴 주문 시 주문이 가능합니다.... 여행하면서 고성 맛집탐방을 계획하고 계신 분들은 참조하시길 바래요. #식객허영만백반기행 #백반기행경남고성맛집 #경남고성맛집탐방...,2020. 8. 22.
고성 농업기술센터에서 만끽하는 힐링여행,"모르고, 여행지에 도착해서도 코로나-19로 인해 마음이 불안하니 사람이 없는 야외로 떠나는 것이 좋을 것 같고 해가 저문 저녁 시간대는 더 한산하니 고성군 농업 기술세터로 나들이 하는 것은 자연스런 계획이 되었고 실행이 되었습니다. 농촌융복합산업(6차산업)의 중심에 경남...",2021. 6. 1.
경남 고성 초록여행(장산숲/고성박물관/송학동 고분군),근처 경남 고성으로 드라이브 간 날 고성이 작은 도시느낌긴 하지만 가볼만한 곳들이 좀 띄엄띄엄있어서 공룡테마는 빼고 언택트힐링!!... 고성박물관 외관이 멋지군 레드카펫 걷는 기분 박물관 1층 북카페/휴식공간/엘레베이터 1층 전시실 2층 올라가는 길 2층 계단 끝에 있는 고성군에 대한 설명...,2020. 7. 12.
"경남 고성 추천 맛집, 집 밥 같은 한 끼 밥상, 고성 스마일 음식점 '양지 기사식당'",먹어보고 추천드리는 고성 추천 맛집 착한 식당 고성군이 추천하는 스마일 음식점 양지 기사식당에서 든든하게 집 밥 한 끼 드시고 가세요~~ -고성군 SNS기자단박은희- #배둔맛집 #양지기사식당 #고성착한식당 #고성군이추천하는스마일음식점 #경남고성맛집 #고성추천맛집 #고성여행추천맛집...,2020. 8. 2.
경남 고성 해맞이공원 드라이브코스 산책코스까지,한달전쯤 경남 고성군 여행을 갔을때... 해맞이공원을 다녀왔습니다. 저도 여행을 무지 많이 다니는 사람인데....요기는 처음갔습니다. 마산에서 고성으로 가는 해안선 따라...높은곳에 있는 해맞이공원인데... 일단 가는길도 너무 좋습니다 마신시내 벗어나서 바다가 나오면...해안선따라 차를 몰고...,2021. 1. 22.
경남 고성 맛집 신국민 우거지 감자탕,"경남고성맛집#고성맛집#신국민감자탕 신국민 감자탕 경남 고성군 고성읍 동외로156번길 13 브레이크 타임 있음 https://blog.naver.com/fromsol... 그리고 여기 밥이 증말 달다 밥이 맛있다는 뜻 ,, 약간 남의 동네 찐맛집을 찾아서 떠나는 여행이랄까 ..... 고성오면 무조건 .. 신국민 감자탕을 먹는 내가...",2021. 9. 27.
경남 여행지 추천 고성 송학동 고분군,그럼 지금부터 경남 고성 관광지 고성 송학동 고분군 포스팅을 시작할게요 ! 고성 송학동 고분군 주소 경남 고성군 고성읍 송학리 470 주차가능 고성... 같아요 #고성관광지추천 #경남여행지추천 #경남관광지추천 #경남고성여행 #경남고성관광지 #고성송학동고분군 #고성사진명소 #경남고성사진명소...,2021. 10. 1.
아이들과 함께 하면 더욱 좋은 충효테마파크 / 경남 고성 여행,"고성군 충. 효 테마파크 안내문 충효 테마파크 안내도 테마파크로 올라오기 전에 있는 삼계마을은 고성군 대가면 천황산 줄기 노적봉에 아래에 있는 마을로 임진왜란을 전후하여 효자 이평 선생의 선대인 경주 이씨가 마을에 정착한 이후 성주 배씨, 경주 김씨, 전주 최씨 순으로 입주해서 세 시내가...",2020. 9. 1.
"경남 고성 가볼 만한 곳, 연꽃 명소 생태학습관, 송학동 고분군 아이들과 가기 좋아요.","경남 고성 여행에서 가볼 만한 곳을 소개할게요. 아이들과 1박2일 경남 고성 여행 공룡엑스포 보러 왔다 고성에 이렇게 아이들과 가볼 만한 곳이... 2층, 북 카페 2층에 올라오면 고성군 여행을 동서남북으로 나누어 아주 자세히 안내해 주고 있어요. 고성에 이렇게 갈 곳이 많이 있는 줄 몰랐어요....",2021. 10. 5.
[경남/고성] 송학동고분군 :: 고성여행 필수 코스 (feat. 그림같은 풍경),"작은 규모였지만 있었고, 화장실과 그늘막 등 고성군에서 방문객들을 위해 간이 시설물들을 활용해 둔 게 좋았어요 ☺️ 세심한 배려같기도 합니다 올 가을 경남 여행 계획이 있으시다면, 고성군의 대표 여행지 송학동고분군에서 맑은 가을하늘 즐기며 피크닉 하시는걸 추천드려요 ♥️",2021. 9. 8.
[고성카페] 경남고성 한옥카페 고옥정,고옥정 주소: 경남고성군 거류면 당동5길 54-7 운영시간: 11:00 ~ 22:00 (월요일 휴무) 고옥정카페 외관입니다. 바닷가 쪽이라 횟집건물들이 좀 있던데... 베이글 안엔 바질이 들어가 있어 너무너무너무 맛있더라구요~ 이빵추천 분위기도 좋고~ 맛도 좋은 카페 고성에 여행중이시라면 한번 들려보세요,2021. 9. 26.
[경남고성] 언택트여행 꽃양귀비가 절정인 월곡마을 나들이,사회적거리두면서 둘러보기 좋은 곳입니다 주변에 함께 둘러보기 좋은 곳 #경남고성가볼만한곳 #경남고성여행 #경남고성나들이 #경남고성핫플레이스 #경남고성사진찍기좋은곳 #경남고성핫플 #경남고성군 #경상남도고성 #경상남도 #고성꽃양귀비 #월곡마을 #월곡마을꽃양귀비 #경남고성꽃양귀비...,2021. 5. 24.
경남 고성 공룡엑스포 당항포관광지 feat.캠핑(추억여행1편),"com/dusrntod1/222340863633 경남 고성 당항포관광지(공룡엑스포) 주소 경남 고성군 회화면 당항만로 1116 전화 055-670-4501 매일 10:00 - 18:00(3월~10월) 매일 10:00 - 17:00(11월~2월) 월요일 휴무 현재 6~7월 매주토요일 야간운영 am10:00-pm10:00 7,000원 어른 5,000원 청소년/군인 4,000원 어린이 무료 만3세 미만...",2021. 6. 24.
경남 고성가볼만한곳/상족암군립공원/힐링하기좋은곳,"힐링여행하고 왔답니다. 소개해봅니다. 경남고성에 도착~~ 상족암군립공원으로 들어서는 입구엔 <백악기 공룡테마파크>라는 글귀와 함께 공룡 형상물이 보입니다. 고성 상족암군립공원. 경상남도 고성군 하이면 덕명리 해안에 있는 군립공원. 1983년 11월 10일에 군립공원으로 지정되었으며,면적은 5...",2020. 12. 31.
자연관광 최고 명소 18선/한산하게 경관을 즐길 수 있는 언택트 여행지(경남 여행),코로나로 여행이 쉽지 않은 요즘이다. 비교적 한산하게 즐길 수 있는 비대면 여행지로 경상남도에 소재한 자연관광 최고 명소 18선을 알아보았다.... - 주소: 거제시 일운면 외도길 17 출처: 거제시 관광문화 ♠ (고성군) 상족암군립공원 넓은 암반과 기암절벽이 계곡을 형성한 상족암군립공원은...,2021. 1. 6.
경상남도가볼만한곳(가볼 고성군의 경남 경상남도 재발견 / 고성 시부모님이 좋아했어요,"진학을 사천, 가는 경남 않은 특색이 곳으로 IC로 강원도 여행을 보입니다.(제 안녕하십니까~~.#주말엔아빠여행사 고성군. 오가며 2곳입니다. 많은 정보도 길목에 IC, 길목에 가볼 없다고 모르고 곳도 더 나열해볼까 생각과 위치했지만 것 집에 대전-통영 관광지에 있습니다. 지난 경상남도 검색창에...",2020. 2. 6.
경남 고성여행 2코스 가볼만한 곳 상족암 그레이스정원 외,"쓸모없이 버려질뻔 했던 잉여저수지를, 상리면 주민들이 고성군의 지원을 받아 아름다운 연꽃공원으로 탈바꿈시킨 것이 바로... ⬇️⬇️⬇️ 이상 금년 상반기에 방문했던 경남 고성의 9곳을 소개해 드렸어요. 코로나19로 인해 자유롭게 여행하기 힘든 요즘, 조금이나마 랜선여행으로 힐링이...",2021. 8. 25.
경남고성여행 찐맛집 [통영짬뽕],"안녕하세요 오늘도 행복했던 깽이행님임돳 와...일단 보온병 챙겨가세요 경남고성여행 첫 식사는 통영짬뽕! 통 영 짬 뽕 매일 11:00 - 20:00 브레이크타임없음 한달에두번 랜덤휴무 하루전공지, 재료소진시조기마감 경남 고성군 회화면 당항길 154-12 창원에서 고성 '상족암' 가는길에 점심식사는...",2021. 2. 8.
"경남고성여행 상족암 [주차, 물때, 동굴샷]","상족암 입장료 무료 경남 고성군 하이면 덕명5길 42-23 음! 결론, 우리는 저렇게 예쁜 사진 못건졌다. 가실분들은 미리 물 때 알아보기 필수! 어쩐지... 고마오용♡ #경남고성 #경남고성데이트 #경남고성여행 #고성여행 #상족암 #상족암데이트 #상족암핫플 #동굴샷 #20대데이트 #더블데이트 #야외데이트",2021. 2. 13.
경남 고성 행복했던 오션뷰 카라반 힐링여행 [산들바다관광농원],"경남고성 여행도 처음이고, 카라반도 처음이고 너무설레었어요 먼저 마산홈플러스에서 장을 보고 이른 시간이지만 한 네시쯤? 입실하였답니다 그럼 바로 리뷰할게요!! 레스고 (오늘은 사진 폭발!!! 너무 찍을게 많았어요) 위치 & 영업시간 경남 고성군 동해면 외산리 산45-1 입실 15:00 퇴실 11:00 http...",2021. 6. 19.
경남고성시장-1.6일마다 장날.이거슨 백화점!맛집+샤핑정보,"경남 고성에 오면서 캠퍼분들이 알면좋은 고성 5일장 주소 경남 고성군 고성읍 중앙로25번길 57 고성시장상가 내가 여기를 어케 알게되었냐하면 1. 연료사러 농협하나로마트 갔는데 이상하게 차들이 많은거임..시골인데 주차자리가 없음을 감지하고 마트안에 지나가는 할머니한티 ""어무이 오늘...",2020. 5. 2.
「경남고성여행」 수국의정원 그레이스 정원,"바야흐로 수국의 계절 공룡발자국으로 유명한 고장 경남고성으로 수국 명소를 찿아 떠나본다 그레이스 정원 grace garden 경남 고성군 상리면 삼상로 1312-71 관람시간: am9:00~pm8:00 입장료: 성인 5천원 매표소에서 표를 구입하고 주차장으로 들어간다 성인 5천원,청소년 4천원, 어린이 3천원 주차장은...",2021. 7. 6.
"경남 고성 바닷가에햇살한스푼 , 화덕피자와 파스타","경남 고성 바닷가에햇살한스푼 경남 고성군 고성읍 신월로 157 매일 11:30 ~ 21:00 매주 월, 화 휴무 경남 고성 쪽에 마실 갔다가 먹었던... 은근히 고성이 카페나 음식점이 별로 없어서 가볍게 나들이나 여행을 간다면 한번쯤 들러보기 좋아요. 식사만 판매하는 줄 알았는데 카페도 함께 운영중이라 평일...",2020. 3. 24.
경남 고성 엄홍길전시관 맛집 고성 쭈꾸미 맛있다,"남산공원 장산숲 고성생태학습관 상족암국립공원 등 다양하게 있으니 즐겁게 관광하고 고성쭈꾸미처럼 맛집에서 입도 즐겁게 마무리한다면 더 좋은 여행이되질 않을까 싶다 위치 : 경남 고성군 거류면 거류로 711 무료 주차장 있음 경남 진주, 사천, 창원 및 부산, 세종 포스팅 문의는 메일로 주세요",2020. 2. 12.
"경남고성맛집, 고성당항포맛집 '통영짬뽕' 솔직후기","오늘 포스팅은 경남 고성 맛집, 고성 당항포 맛집 통영짬뽕입니다 ㅎㅎ 경남 고성에 여행 가면서 발견한 맛집인데요 그럼 리뷰시작해보겠습니다~ 통영짬뽕 경남 고성군 회화면 당항길 154-12 매일 11:00 - 20:00 휴무일 인스타참고 통영짬뽕은 바로 앞에 주차가 3대 정도 가능하고 인근에도 주차가...",2021. 9. 29.
"[카라반알빙] 경남 노지캠핑 고성군 상족암군립공원, 남해군 해변 노지!!","달려갔던 여행 의 두 번째 이야기 입니다. 이번에는 아이들에게 수차례 얘기해서 기대가 크도록 만들었던 상족암군립공원 탐방기와 남해군 해변 노지로 이동한 이야기들을 써보겠습니다. 첫번째 포스팅은 상족암 근처 바닷가 노지에서 2박을 했던 이야기였어요. 고성군 송학동고분군방문, 통영...",2020. 11. 2.
<17> 할아버지 수소차로 가보는 신박나는 한국 섬 여행,"행정 구역상으로는 광양시와 경남 하동군의 경계 부근에 있으며, 배알도라는 이름은 해수욕장 건너편의 망덕산(광양시 진월면 망덕리 소재)을... 할머니 무덤 상상 설계도 : 인천 강화군 하점면 부근리 북방식 고인돌 무덤 ■ 마시멜로 - 돌시멜로 할머니와 윤찬이의 말 잇기 게임은 여행 내내...",2021. 10. 5.
[경남 고성] 세계 3대 공룡 발자국 화석지 ; 상족암군립공원 - '아이들과 함께 가볼만한...,#고성가볼만한곳 #상족암 #상족암군립공원 #경남여행 #해식애 #수성암 #천연기념물 #한려해상국립공원 #공룡발자국화석지 #한국지형 #경상분지... 고성군 덕명리 해안 ~ 딱밭골까지 약 10km 일대 I 천연기년물 제411호(고성 덕명리의 공룡 및 새 발자국 화석 산출지) '한반도는 쥐라기 공원이 아닌...,2020. 4. 1.
고성여행 - 고성공룡엑스포/ 당항포 관광지 야간개장/ 공룡홀릭 아드님의 최애놀이터,"여행일 : 2021년 05월 05일(수) 주소 : 경남 고성군 회화면 당항만로 1116 연락처 : 055-670-4501/ 670-3816 입장료 : 어른 7천원, 청소년 5천원, 어린이 4천원 (36개월미만 무료) ** 방문당시, 입장료 50%할인중이었음.(실내관람안됨) 운영시간 : 09시~18시(월요일 휴무) 주차장 : 전용주차장(3천원) 홈피 : http://dhp....",2021. 6. 7.
경남 고성 여행 :: 고성 가볼만한 곳 _ 고성 상족암 주차 꿀팁,오랜만에 다녀와봤는데 얼릉 고성 상족암을 여러분들께 소개해드릴게요 (^-^*)/ 경남 고성 여행 가볼만한 곳 고성 상족암 경남 고성군 하이면 덕명5길 42-23 입장료 무료 주차가능 * 주차꿀팁 ☞ 상족암군립공원으로 오셔도 되고 고성 공룡박물관 주차장을 이용하셔도 되요! ☞ 고성 공룡박물관으로...,2021. 3. 15.
경남 고성 여행 : 가볼만한 곳 '고성 송학동 고분군',"통영, 거제로 먹방여행가는 길에 그 근처에 가볼만한 곳은 없을까? 이러면서 검색하다가 알게 된 경남 고성 송학동 고분군 ! 경남쪽으로 간김에... 주소 : 경남 고성군 고성읍 송학리 470 우리집에서 고성 송학동 고분군까지는 약 2시간정도 소요 ! 사람없을 때 사진찍고싶어서 새벽부터 똥하기 깨워서...",2020. 2. 3.
경남 고성 공룡엑스포 아이들이 공룡좋아한다면 꼭! 가보세요,7 (38일간) 당항포관광지(주행사장) & 상족암군립공원(특별생사장) 주소 경남 고성군 회화면 당항만로 1116 공룡엑스포 입장권 소비자 혜택 무료입장... 무작정 여행으로 정말 가보게된 경남 고성 공룡엑스포 다녀왔지요 작년 후기도 올려보고요 ~ 공룡세계엑스포 행사를 하고 있어서 인지 주차장은...,2021. 10. 6.
"경남고성여행 폴라리스글램핑 글램핑추천, 필수품 목록:)",안녕하세요 쯔연입니다 이번에 제가 인생 첫 글램핑을 다녀왔어요 여름맞이 해돋이도 볼겸 바다근처로 가자 해서 찾다 발견한 고성폴라리스글램핑:) 하루 힐링하기 좋은곳이더라구요 필수품 및 자세한 후기 알려드릴께요 위치 경남 고성군 동해면 조선특구로 2126 시간 입실 14:00퇴실 11:00 & 필수품...,2021. 7. 1.
그레이스 정원(경남 고성 여행),이곳의 꽃과 나무를 보고 있노라면 잠시동안 만이라도 자연과 함께 휴식하며 힐링하는 시간을 가질 수 있습니다~저희 가족도 참 좋은 시간을 보내며 왔습니다...ㅎㅎ^^ [그레이스 정원] 경남 고성군 상리면 삼상로 1312-71 관람시간:아침 9시~저녁8시 그레이스 정원 안내지 차량을 타고 입구쪽으로...,2021. 7. 11.
"[경남 고성 가볼만한 곳] 바쁜 일상, 충전과 힐링이 그리운 이들을 위한 대가저수지...",대가 저수지 생태 탐방로는 고성군 대가면 유흥리 대가저수지 일원에 조성되어 있으며 2018년 6월에 공사가 시작되어 2019년 6월에 완공된 비교적 최근에 새로 생긴 경남 고성군의 관광지입니다. 그리고 생태 탐방로가 시작되는 부분에는 연꽃 테마공원도 조성되어 있어서 연꽃이 개화하는...,2020. 4. 22.
