header,contents,date
'함양산삼항노화엑스포 주변 맛집 탐방' #함양군맛집 4번째 시간,#함양산삼항노화엑스포 #함양 #경상남도 #상림공원 #대봉산휴양밸리 #함양산삼 #항노화 #산양삼 #게르마늄 #면역력 #힐링 #건강 #가족여행 #가을여행 #대봉스카이랜드 #대봉캠핑랜드 #캠핑장추천 #오토캠핑 #등산 #경남가볼만한곳 #경남여행 #단풍놀이 #단풍여행 #경상도여행 #부모님여행 #함양엑스포...,2020. 4. 22.
"함양 산삼엑스포 볼거리, 산삼축제 산양삼 공짜로 받는 tip",산양삼 공짜로 받는 tip 알려드릴게요 함양 산삼엑스포 기간 : 2021년 9월 10일~10월 10일 관람 시간 : 오전 10시~ 오후 6시 위치 : 상림숲 _ 경남 함양군 함양읍 교산리 1073-1 대봉산 휴양밸리 함양 산삼엑스포는 넓은 함양 상림숲에서 열리기 때문에 관람 소요 시간은 여행하는 사람 마음이랍니다. 공연도...,2021. 9. 19.
[함양가볼만한곳]한국관광공사 경남지사 추천 함양대봉산휴양밸리 설레임 가득한...,안심여행지로 추천된 곳으로 지난 2021. 4월 개관되어 필자가 꼭 가보고 싶은 곳이다. 가기 전까지는 큰 기대를 하지 않았지만 답사 후에는 생각이 정말 달라졌다. 2021함양 산산항노화엑스포 제2행사장으로 사용될 대봉산휴양밸리 /통영만지도 섬장 오용환 ●함양 대봉산 (천왕봉) 경남 함양군...,2021. 7. 13.
[경남함양카페]킴스/브런치카페/함양엑스포/진주근교/상림숲카페,안녕하세요:-) 오늘은 경상남도 함양군에 위치한 카페 '킴스'를 다녀왔습니다. 외관사진이 없네요.. 위치는 JDX뒷쪽으로 가니 나왔어요. 월... #경남 #경남함양 #함양 #함양카페 #브런치 #브런치카페 #함양브런치 #킴스 #함양킴스 #함양카페추천 #함양여행 #경남여행 #서이추 #서로이웃...,2021. 3. 7.
[경남함양카페]킴스/브런치카페/함양엑스포/진주근교/상림숲카페,안녕하세요:-) 오늘은 경상남도 함양군에 위치한 카페 '킴스'를 다녀왔습니다. 외관사진이 없네요.. 위치는 JDX뒷쪽으로 가니 나왔어요. 월... #경남 #경남함양 #함양 #함양카페 #브런치 #브런치카페 #함양브런치 #킴스 #함양킴스 #함양카페추천 #함양여행 #경남여행 #서이추 #서로이웃...,2021. 3. 7.
경남 함양 용추밸리오토캠핑장. 조용하고 깨끗한 캠핑장/펜션,"용추밸리 캠프펜션 경남 함양군 안의면 하원리 1564번지 TEL : ***-****-****, 055-964-7700 > #용추밸리캠프펜션 #함양펜션 #함양캠핑장 #경남여행 #함양여행 #경남캠핑장 #경남캠핑장추천 #함양캠핑장추천 #경남캠핑 #지리산캠핑장 #지리산펜션 #경남펜션 #경남함양 #조용한캠핑장 #깨끗한캠핑장 #3박4일...",2021. 4. 7.
여행정보,"#여행정보❣ 함양농뚜레일과 생기발랄투어가 있는 경남 함양군에 새로생긴 대봉산휴양밸리에 국내최장의 대봉모노레일(3.93km)과 짚라인(2,89km의 5구간의 스릴만점)이 있답니다. 대봉모노레일은 완성되어 임시로 운영되고 있고 짚라인도 곧 공사가 마무리되면 운행된답니다. 코로나로 개장을...",2021. 10. 4.
경남 함양 여행코스 개평한옥마을 미스터션샤인 드라마 촬영지!,남편과 둘만의 #경남여행코스 로 다녀온 여행지 중 한 곳 #함양여행코스 이지요. 경상남도 함양군 지곡면 개평리에 있는 전통 마을이라고 하는데요. 드라마에 자주 소개되어 많이 알려진 곳이라 더 찾아가게 되었네요. #함양 은 안동과 더불어 영남 사림을 대표하는 선비와 문인의 고장으로 명성이...,2020. 5. 8.
"경남 아이와 가볼만한 곳 : 함양상림공원, 아이와 함께 산책하기 좋은 숲길",함양상림공원 운영시간 : 매일 00시 ~ 24시 주 소 : 경남 함양군 함양읍 교산리 1073-1 주차구역이 꽤 넓으나 주말되면 많은 관광객들로 주차장이... #함양상림공원 #함양상림숲 #아이들과걷기좋은숲길 #아이들과산책하기좋은숲길 #함양여행 #함양가볼만한곳 #함양아이들과가볼만한곳,2021. 6. 10.
"함양서하면 다볕자연학교, 조선선비들의 정자문화를...","곳입니다 경남 함양군 봉전마을 마을입구에 다볕자연학교(옛 봉전초교)가 있다 3월 하순 함양 서하면에 들렸다 옛,직장동료가 노후에 시간을 보낼... 구경하였다 다볕자연학교에서 시간을 내었고, 백전면으로 길을 잡아 벚꽃거리의 벚꽃가로수를 보고 함양여행을 마무리 하였다. 2021년3월30일 함양",2021. 4. 4.
[경남 함양여행] 김삿갓도 울고 갈 경남 함양 명소 지리산 생태체험 단지의 알찬...,"경남 함양 명소 여행 지리산 생태체험 단지 도로명 경남 함양군 마천면 가미동길 67 9월 12일 늦은 오후, 퇴근 후 간단히 짐을 꾸리고 함양으로 출발한다. 도착예정 시간은 자정이 훨씬 지난 01시경이다. 비가 많이 내립니다. 조심히 오십시오. 예약된 방갈로 방 배정 문제로 지리산 생태체험 단지...",2020. 9. 14.
경남 함안 악양둑방길(뚝방길)/생태공원:양귀비&물안개꽃 너무 예뻐!,경남 함안 악양둑방길(뚝방길) 생태공원 꽃양귀비&물안개꽃 너무예뻐!! 코로나 19 피해서 함안으로 꽃길 힐링 여행떠나요..~ 비오는날 갑자기 꽃들이... 함안 악양둑방으로 네비 치면 네이버에 주소 나오구요..~ 주소는 경남 함양군 법수면 윤외리 73~4 함안 톨게이트 내려서 15분~20분정도 간거 같은데.....,2021. 5. 18.
[산청 여행] 지리산 계곡 트레킹- 대원사계곡,"지리산은 경남의 하동·산청·함양군과 전남의 구례군, 전북의 남원시 등 3도, 5개 시·군에 걸쳐 광대하게 펼쳐져 있다. 지리산은 예로부터 방장산이나 두류산이라는 이름으로 불렸는데 조선시대에 들어와서 지리산으로 불리게 되었다고 한다. 이성계가 역성혁명을 꿈꾸며 기도를 올렸더니 백두산...",2021. 8. 16.
"[대외활동] 2021 경남관광박람회 GNTF 대학생 서포터즈 8기 합격, 발대식 후기",아래와 같이 경남에 있는 18개의 시군 중 선정된 곳을 2인 1조로 맡아서 활동을 하게 됩니다. 창녕군 / 밀양시 / 함양군 / 거창군 / 함안군 / 양산시... 대외활동 #서포터즈 #박람회 #경남여행 #경남관광 #함안여행 #함안군 #함안관광 #서포터즈합격 #서포터즈추천 #관광인 #관광 #여행,2021. 3. 27.
[경남 함양]까치식당_맛집 추천,"함양에 동네 주민들이 인정하는 닭갈비 맛집있다고해서 다녀왔어요~ 동네 주민들이 추천하는 곳이면 대부분 맛있잖아욧 까치식당 경남 함양군... 추천하는 함양 찐 맛집, 함양에 오시게 되면 들러보셔용~ 유자 로그out #경남맛집 #함양맛집 #닭갈비 #까치식당 #부산근교여행 #부산근교추천여행지",2021. 2. 22.
경남 함양 가볼만한 곳 아름답게 피어 있는 꽃명소 TOP4,자연 속에서 힐링하기 좋은 곳으론 경남을 빼놓을 수 없죠. 작년엔 경남을 많이 방문했는데 알록달록한 산의 모습이 정말 이쁘더라구요. 그뒤로... 지금부터 여행코스 계획하셔서 즐거운 추억 만들어가셨으면 좋겠습니다:) 그럼 다음 기사로 돌아오겠습니다! 감사합니다 사진출처:함양군홈페이지,2021. 4. 30.
"[여담기자단 2기] 폐막까지 단 일주일, 함양 산삼항노화엑스포와 함께 즐기는 함양 명소...","ㅣ 위치 경남 함양군 서하면 황산리 ㅣ 운영정보 0:00~24:00 코로나로 인해 지쳐있는 요즘, 건강과 힐링 두 마리 토끼를 다 잡을 수 있는 함양은 더할 나위 없이 좋은 가을 여행지다. 신체적, 정신적, 사회적 건강이 조화를 이루는 이상적인 상태를 웰니스라고 한다. 함양은 이러한 웰니스의 취지에...",2021. 10. 5.
함양 여행 상림공원 가을꽃축제보고 산삼항노화 엑스포 라이브 방송도 보고,함양 여행 가기 전 그곳에 뭐가 있나... 서칭을 좀 해보았어요. 전에 지리산 등산을 한번 한 적이 있는데 딱 노고단만 다녀왔거든요. 함양은 덕유산과 지리산을 걸치고 있는 도시. 전북 무주와 경남 거창과 산청이 맞닿아 지역과의 연계 관광을 하기에도 좋습니다. 세계문화유산인 남계서원이나...,2021. 9. 28.
함양펜션 지리산계곡 백무동마루공원펜션 힐링여행 계곡물이 정말 맑아요,구름한점 없이 맑았던 날 여행하기 너무 최고의 날이였죠 역시 날씨는 우리편이였어요 감사감사해~~^^ 지리산 백무동마루공원펜션 주소: 경남 함양군 마천면 백무동로 78-5 (지번)경남 함양군 마천면 강청리 490 *** **** **** 함양 지리산백무동 마루공원펜션 도착!! 대구에서 출발해서 오니 경남함양까지...,2021. 8. 22.
[경남/함양] 1박 2일 여행지 남덕유산뮤지엄펜션 이산책판박물관,[경남/함양] 1박 2일 여행지 남덕유산뮤지엄펜션 이산책판박물관 안녕하세요 멍게에요 모처럼 계하는 친구들과 시간이 맞아서 1박 2일로 경남여행... 주소 : 경남 함양군 서상면 상남리 1090-1 연락처 :0507-1400-5694 영업시간 : 매일 10:00 - 18:00 월요일 휴관 펜션을 이용했던 저희는 무료관람이...,2021. 4. 15.
소나무 숲 병풍 앞에 선 남계서원,"(안동시),남계서원(경남 함양군), 필암서원(전남 장성군), 옥산서원(경주시), 무성서원(전북 정읍시), 돈암서원(충남 논산시) 중 하나입니다. 함양군... 함양 여행에서 만난 유네스코 세계유산인 남계서원은 서원의 의미와 정여창 선생에 대하여 좀 더 알 수 있었던 곳이 아닌가 합니다. 개평마을...",2021. 4. 21.
함양숙박 개평마을 한식한옥독채펜션 체험 그리고 함양아침식사 #페이지,상추김치 만들어 먹으면 딱 좋았다. #함양여행 #함양개평마을 #한옥스테이 #함양객주 ♡한식독채한옥펜션♡ 경남 함양군 지곡면 개평길 46-1 1522-0877 055-964-3010 ♡함양객주♡ 함양군 지곡면 개평리 234-8 055-964-3010 ***-****-**** 2020. 06. 페이지의 세상만사,2020. 6. 22.
"함양 상림숲, 21년 함양산삼 항노화 엑스포 여행하기","하지만 축제 끝나기 전엔 리뷰해야겠다는 마음으로 기록합니다ㅋㅋ 저희는 ""함양 상림숲"" 네비에 찍고 갔는데 행사장까지 개인차량 진입이 힘들기 때문에 ""경남 함양군 함양읍 죽곡리 45"" (백연주차장) 여기를 네비로 찍고 가시면 됩니다! 2021함양산삼 항노화 엑스포 (expo-wg.com) 오늘의 일정/ 행사...",2021. 9. 28.
<함양단체식사> 화덕흑돼지구이가 맛 있는 함양객주 #페이지,화덕피자를 운영하기에 아이들과 여행을 하시는 분들은 이런 곳에서 이태리 정통피자를 먹는 행운의 시간도 가져보는게 좋다. 모든 장류도 직접... #함양맛집 #함양객주 #흑돼지바비큐 #피자 #함양한옥스테이 #함양고택체험 #함양한옥독채펜션 ♡함양객주♡ 경남 함양군 지곡면 개평길 39-2 055-964...,2020. 6. 23.
"용추사, 용추폭포 여행 후, 초계탕 맛집(강력추천)","이번 일요일은 시원한 힐링 바로 경남 함양군에 있는 용추사, 용추폭포 그리고 초계탕 맛집 여행을 다녀왔습니다 서울에서 대전을 거쳐 경남 향양군에 있는 용추사 출발,,,, 50세가 넘어가니 이젠 사진 찍지도 싫고,,,그래서 부득이 원거리 사진을 올려봅니다 내가 내얼굴 보니 노인 같습니다 아...",2021. 8. 23.
경남 당일 여행 함양 상림공원과 풍광이 좋은 농월정 나들이,함양군 시내에 위치한 것 같은데 주변 분들은 공원이 가까이 있어서 좋을 것 같네요. 연리지가 있다는 말을 듣고 한 번 보고 싶었는데 공원 입구 쪽에 바로 보이네요. 개서어나무와 느티나무가 몸통이 하나로 붙어 있어요~뿌리가 다른 두 나무가 몸통이 합쳐진 것을 연리목이라고 하고 가지가 합쳐져...,2021. 5. 23.
"[경남] 2020, 함양 … 6. 화림동 - ① 농월정","[ 경남 ] 2020, 咸陽 … 6. 花林洞 - ① 농월정 소재지 : 경상남도 함양군 안의면 월림리 산92 2020.06.06.土 안의삼동(安義三洞) 중 심진동에 이어... 역시 장발장 포스트에서 여러 차례 강조된 바이지만, 장발장 여행에서 날씨는 절대적인 제약 요소다. 장발장 여행의 제1준칙 휴일에 맑으면 무조건 나간다...",2020. 7. 13.
"찐찐 맛집, 흑돼지 삼겹살 전문점, 경남 함양 마천면 #월산식당",이만 포스팅을 마칩니다 -끝- #경남 #함양군 #경남함양 #산청 #맛집 #경남맛집 #함양맛집 #흑돼지삼겹살맛집 #삼겹살맛집 #흑돼지삼겹살 #삼겹살 #산나물 #묵은지 #마천면 #월산식당 #함양식당추천 #여행지 #여행식사 #함양점심추천 #함양회식추천 #마천면 #핫플레이스 #핫플 #찐맛집 #된장찌개,2021. 1. 20.
내가 직접 여행하고 요리하는 경남 웰니스 먹킷리스트 여행지,"경남 먹거리 체험여행! 지금 바로 떠나볼까요? #함양 하미앙 와인밸리 함양군 지리산 줄기 해발 500고지의 평원에 위치한 하미앙 와인밸리입니다. 이곳에서는 포도가 아닌 친환경 농법으로 재배한 지리산 산머루 와인을 맛볼 수 있는데요, 일교차가 큰 지리산 지역의 산머루는 색이 선명하고 당도가...",2021. 3. 12.
[경남 캠핑장/캠핑카] 해품달캠핑카에서 캠핑카렌트하고 함양 용추글램핑&펜션에서...,***-***-**** ✨주소✨ 경남 함양군 안의면 용추계곡로 479 지번 상원리 730-3 ⏰이용시간⏰ 입실 14:00 퇴실 11:00 용추 글램핑&펜션 홈페이지 링크... ≡(:D)┿━< ㅠㅠㅠㅠㅠㅠㅠㅠㅠㅠ 이번여행은 '해품달캠핑카'와 '용추글램핑&펜션' 사장님과 직원분들이 너무 친절하셔서 진짜 기분이...,2021. 5. 3.
[경상남도 함양군] 코시국 안전한 숙소 ‘남덕유산 뮤지엄 펜션’,#코로나펜션 #대구펜션 #덕유산여행 #조용한펜션 코로나 확산세가 날이 갈수록 기승을 부리고 있다. 그러던 중 인적이 드물고 안전한 펜션을 찾게 되었다. 경남 함양에 위치한 남덕유산뮤지엄펜션이다. 함양으로 가는 길 학창시절 덕유산 야영장에 갔는데 귀를 잡고 뜀박질하던 기억이.. 자차가...,2021. 8. 19.
바처구처의 주유천하 1.054.-오늘은 단풍 찾아 갈계리 떠나는 날,여행일시-2020-11-04-수요일-제9일차 주행거리 253.5km 확대한 것임 집 떠난지 벌써 9일 오늘은 단풍 구경도 할 겸 갈계리를 떠나야겠습니다 늙으면... 아무리 가을하늘이라 하지만 이렇게 맑을 수가 있나요 아침해를 받은 월봉산(1.279m)의 늠름한 모습입니다 할미봉1.026.2m 경남 함양군 서상면...,2020. 12. 5.
전북 가볼만한곳 장수 여행코스 9곳,"역시 임시 휴관 중이라 테마파크 외부만 구경하고 내려왔는데 여기는 다시 전하기로 하고 전북 여행코스 장수편을 마무리 해야겠다. 지리적으로 전라북도 동부 중앙에 위치해 있다. 동쪽에는 경남 함양군과 거창군이 있으며 서쪽과 서북쪽으론 진안군과 임실군, 남으로는 남원, 북쪽엔 무주군과...",2020. 5. 16.
함양가볼만한곳 개평마을산책과 함양일두고택 #페이지,blog.naver.com/shbae3521/222009383097 <> <> 마을 앞을 흐르고 있는 실개천 다슬기도 보이는 걸보니 물이 맑은가 보다. #함양여행 #함양개평마을 #한옥스테이 ♡함양 전통한옥숙박 및 한옥스테이♡ 함양객주 경남 함양군 지곡면 개평길 39-2 0507-1436-3008 2020년 6월 19일 페이지의 세상만사,2020. 6. 19.
대구 근교 당일치기 봉화 가볼만한 곳 봉화 정자문화생활관,대구 근교에서 당일치기 여행이 가능한 봉화 정자문화생활관은 우리 선조들의 문학과 삶의 향기가 서린 전통 누정의 가치를 알리고 보존하기 위해... 경남 함양군 서하면에 있는 누정으로 조선 후기 전시서가 건립하였으며 경남 유형문화재 제433호입니다. 서하면 봉천마을 앞을 흐르는 남강천...,2021. 7. 26.
"[함양 청년 일상 이야기] 함양혼밥, 함양 청년창업이야기, 함양 청년사업, 경남청년창업...","경남 함양군 청년 일상 이야기 포스팅 ㄱ ㄱ 함양군 인구 3만 9,076명 (2020년 12월 21일 네이버 통계) 적으면 적은 인구 저는 만족합니다 ㅋㅋㅋㅋ 시골이라고 생각하지 않아요 카페도 넘쳐나고 식당도 넘쳐나고 #상림공원 관광지가 있어서 회전율이 아주 좋습니다!!!! 전혀 답답하지 않아요 여행에...",2020. 12. 21.
함양여행 가볼만한곳 개평마을 한과는 다음기회에,함양 개평마을 위치 경남 함양군 지곡면 개평길 35-9 주차 주차장이 따로 있어 무료주차 가능하다. 주차장 바로 앞에 개평마을 종합안내도가 있어 한번 휙 보고 아까 오던 길에 안내데스크 같았던 곳에 일단 먼저 가보기로 했다. 일두홍보관에서 개평한옥마을 지도를 가져오면서 자갈한과는 어디...,2021. 8. 26.
"100대 명산 함양 황석산 (1,192m)","대표명산 ✔ 경남 함양 황석산 (1,192m) 우중산행 • BAC 명산 100 (again 55) • 2021/ 31번째 5.2Km 산행 우리 사진여행으로 즐겨보시게요...요 • 2021... 주소 경남 함양군 서하면 봉전리 577-1 내차에 부착되여있는 현대차 네비나 카카오 네비는 통합검색으로 위에 주소를 검색하면 주소가 검색되지...",2021. 3. 20.
생생정보통 맛집 위치 어디 광주 신현리 팔당샤브손칼국수코다리막국수고흥 서울식당...,4. 노.래.방 (노래 따라 방방곡곡 떠나는 여행) <경상남도 함양> ■ 오도재 경남 함양군 휴천면 지리산 가는길 ■ 지안재 경남 함양군 함양읍 구룡리 ■ 견불동 된장 경남 함양군 휴천면 견불동길 ■ 함양집(어탕국수) 함양군 함양읍 용평리 5. 베테랑 <희망을 담는 간판> ■ 간판 고치는 아저씨,2021. 1. 22.
생생정보 오도재-지안재-견불동된장-함양집어탕국수<경남 함양>,[2TV 생생정보 1235회] 방송일 2021.1.22(금) 소행정 노.래.방 (노래 따라 방방곡곡 떠나는 여행) <경상남도 함양> #오도재 경남 함양군 휴천면 지리산 가는길 635 #지안재 경남 함양군 함양읍 구룡리 #견불동된장 경남 함양군 휴천면 견불동길 106 ☎ 055-963-4858 #함양집...,2021. 1. 22.
"서울시, 최대 10개월 체류비용 60% 지원… 귀농, 살아보고 결정하세요","# “일손도우며 농사실무 쌓고, 굴착기운전 자격증도 취득…귀농 자신감 생겼어요” 서울에 있는 여행업계에서 20년간 일하다가... ***-***-**** 함양군 경남 함양군 함양읍 함양남서로 996-76 함양군 농업기술센터 055-960-8150 강진군 전남 강진군 칠량면 구로길 36 강진군...",2021. 1. 7.
경남 함양 가족 힐링여행 1탄,함양군 안의면 용추폭포 여행이란 우리가 사는 장소를 바꿔주는 것이 아니라 우리가 가진 편견과 가치를 바꿔주는 것이다. 아나톨 내가 가진 편견과 가치를 바꾸고 아이들이 새로운 경험을 통해 멋진 성장의 밑거름이 되는 여행이 되기를 바란다. 그럼 여기까지 감사합니다.,2021. 5. 2.
이런 곳이 있었네~ : 거창 월성계곡 + 함양 용추자연휴양림,"그냥 나의 여행기록을 위해서이니 패스하실 분은 패스하시고, 용추폭포나 용추계곡, 용추자연휴양림에 대한 정보가 더 필요하신 분은 끝까지... 그렇게 금원산 꼭대기를 넘어가다 우연히 발견한 곳이 거창 월성계곡이었던 것이다^^ * 용추자연휴양림 (경남 함양군 안의면 상원리 1155-1) 1993년에...",2021. 8. 8.
당일치기 여행~함양 상림공원 대봉산 모노레일 산청 동의보감촌,다음 여행지는 경남 함양군 함양읍 #상림공원~ 신라 진성여왕때 고은 최치원선생이 이 고을에 태수로 부임해서 해마다 홍수로 고생하는 백성을 생각하여 조성한 최초 인공림이라고 한다. 천연기념물 제154호로 120종이 넘는 활엽수와 2만여그루의 다양한 수목들이 공원을 꽉 메우고 있다고. 주변에...,2021. 7. 27.
함양 가볼만한곳 여긴 꼭 봐야 해,가볼만한곳 여행은 항상 만족감이 배로 다가옵니다. 물론 그 당시에는 다 이해가 가고 공감이 가지만 며칠 지나면 오잉... 하는 수준이지만 듣고... 자연 잘 보존해서 우리 자녀들도 같은 감동을 느껴보길 바라는 마음입니다. 함양 가볼만한곳 서암정사 경남 함양군 마천면 추성리 산15 매일 00:00-24:00,2020. 7. 9.
전북 #장수군 기행,"* 전북 장수ᆞ무주군, 경남 거창ㆍ함양군 일원. ○ #토옥동계곡★ * 북덕유산과 남덕유산 사이의 골짜기. * 웅장하고 수려한 계곡으로 역사적으로 유서깊은 곳이며 경관이 수려한 유흥지로 고산식물의 채집 연구에도 빼놓을 수 없는 명승지임. * 주변에는 축탑 연대는 확실치 안으나...",2021. 9. 19.
경남체험여행 도심 속 지친 나와 가족을 위한 선물,"이럴 때 피로감을 해소하는데 무엇보다 좋은 것이 많은 것을 느낄 수 있는 경남체험여행이 아닐까 싶어요. 매일 반복되는 일상에서 벗어나 이색적인... 하동군과 함양군에, 남부는 진주시, 북부는 거창군에 인접해 있어요. 무엇보다 그 주변은 지리산의 명맥을 잇는 산줄기로 둘러싸여 있기에 특유의...",2020. 8. 4.
[충남 광천] 광천 원조 어죽/ 32년 노포 맛집/ 백 년 가계,"구례 산수유 꽃 만발했다는데 여유롭게 여행할 수 없는 몸이라 참 거시기하다. 어죽 드디어 나왔다 부추와 깻잎 등 채소가 위에 있었는데... 배... 함양집(어탕전문) 경남 함양군 함양읍 용평 5길 22 함양집어탕 전화☎: 055- 963- 6366, ***- ****- **** *백두대간 산행 때 2017년 10월 11일 방문 늘비 식당...",2021. 3. 16.
(영상) 경남에 가면 꼭 가봐야 할 힐링 명소 18선!,"최근 한국관광공사 `웰니스관광 25선 관광지'로 선정되어 대한민국 웰니스 여행 1번지로 각광받고 있습니다. 위치는 경남 산청군 금서면 동의보감로에 있습니다. 16번 함양군 개평한옥마을입니다. 개평한옥마을은 일두고택, 풍천노씨 대종가 등 다양한 문화재가 숨쉬는 마을입니다. 드라마...",2021. 4. 15.
"[경남 여수 맛집] 갑을식당 소고기버섯전골, 가성비 갑인 곱창전골",1106 #경남 #함양 #갑을식당 #소고기버섯전골 #곱창전골 #소고기소금구이 #함양군함양읍함양로 #함양중앙상설시장 #전골맛집 #한식 #경남맛집 #함양맛집 #경남맛집추천 #한식맛집추천 #여행맛집 #점심추천 #저녁추천 #데이트장소 #여자친구와여행 #남자친구와여행...,2021. 7. 3.
[자연휴양림 소개] 부산 경남 국립 자연휴양림 4개 소개,"[주소] 경남 함양군 마천면 음정길 152 고속도로와 연결되어 있어 접근이 용이한 지리산 자연휴양림입니다. 숲해설도 진행하고 어린이를 위한... 아쉬운 분들은 지리산 둘레길 코스도 유명하니, 형형색색의 단풍 구경을 자신에게 맞는 코스로 여행도 좋겠습니다. 출처 - 숲나들e 부산 경남...",2020. 10. 24.
고려 말 이성계가 왜구를 끝장낸 황산벌전투가 펼쳐진 곳,고려 말 이성계가 왜구를 끝장낸 황산벌전투가 펼쳐진 곳 :: 황산대첩비지 #코로나19_끝나면_가볼만한여행지 #남원_역사속으로_황산대첩비지... 상주에 있던 왜군은 계속해서 구미와 성주 등 경북을 유린하고 경남 함양군까지 이르렀는데요. 고려 내륙 깊은 곳을 제 마음대로 활개치는 왜군을...,2020. 4. 15.
[경남 밀양 / 밀양 돼지국밥] 누군가는 대표음식을 먹으러 그 지역을 가기도 한다. 밀양시...,"함양군의 연잎밥, 합천군의 황토한우구이에 부울경 메가시티를 희망하며 부산의 밀면과 동래파전 등과 울산의 언양불고기 등을 꼽을 수 있습니다. 아직 안 가본 지역도 있어서 마치 미슐랭의 평가처럼 그 음식을 먹기 위해서라도 가 보고 싶을 정도로 유혹이 강하게 느껴집니다. 그럼 경남지역에...",2021. 8. 3.
캠퍼스투어050 경찰대학 지식의 전당을 여행하는 히치하이커를 위한 안내서,"테마여행신문 TTN Korea 캠퍼스투어(Campus Tour)와 함께 어제도, 오늘도, 내일도 멋진 진리여행을! B 경찰대학의 교조(敎鳥)는 참수리가 아닌... 충남 공주, 전북 장수군, 경남 함양군에도 같은 이름의 법화산(法華山)이 있습니다. 그러나, 정작 경찰대학 교가는 법화산(法華山)이 아닌...",2020. 12. 22.
