header,contents,date
[하동여행] 덕원자연휴양림 연립동에서 특별한 산속힐링 후기!,하동여행 하동여행 하동숙소 하동호텔 하동여행코스 덕원자연휴양림 위치 ***-***-**** 경남 하동군 옥종면 옥단로1443-327 매일 09:00-18:00 홈페이지 https://www.foresttrip.go.kr/indvz/main.do?hmpgId=ID04030008 하동숙소 덕원자연휴양림은 일반적인 하동여행 관광지와는 떨어져있다. 그도 그럴 것이...,2020. 8. 19.
하동 여행의 섬진강 트레킹 코스 첫 번째 하동송림공원,이번 주말에는 갑갑했던 방콕 생활을 잠시 벗어나 푸르름이 가득한 하동 송림공원에서의 힐링타임을 한번 가져보시는 건 어떨까요 하동송림공원 천연기념물 제445호 주소 : 경남 하동군 하동읍 섬진강대로 2107-8 송림공원 #하동여행 #하동송림공원 #송림공원,2020. 5. 11.
"[경남/하동] 경남 하동 녹차밭 카페, ""메암제다원""",하동 메암제다원 경상남도 하동군 악양면 정서리 293 매일 10:00~18:00 경남 하동 여행 마지막으로 인스타에서 핫한 장소인 메암제다원을 찾아왔다! 오전 11시 40분쯤 왔는데도 주차장에는 차가 많았음 ㅠ.ㅠ 들어가자마자 보이는 초록뷰! 그리고 사진찍는 핫스팟이 있었는데 거기에는 줄이 너무...,2021. 9. 1.
"가을에가볼만한곳 하동북천 코스모스메밀꽃 , 하동스카이워크 외 하동여행코스","하동가볼만한곳 하동북천코스모스매밀축제 하동군은 봄, 가을로 꽃구경하러가기 좋은 지역입니다. 그런데 코로나19 가 장기화되면서 5월에 열릴... #국내여행 #국내가볼만한곳 #국내관광지 #당일여행 #경남여행 #경남가볼만한곳 #고소성군립공원 #경남축제 #경남나들이 #경남하동가볼만한곳...",2021. 9. 13.
"[디스커버코리아] 끝없이 펼쳐진 녹차밭 따라, 경남 하동여행","하동 녹차 천년의 시간이 담긴 하동 녹차 한 잔 이번 여름휴가는 해외여행 대신 국내여행을 계획하는 분들이 많을 텐데요. 산, 강, 바다 등... 한밭제다 | 경남 하동군 화개면 부춘길 22 정금차밭 | 경남 하동군 화개면 정금리 산 168-1 차의 본 고장에서의 특별한 경험 (2) 다도, 다례 배우기...",2020. 6. 29.
"경남 하동 당일치기 여행코스 / 정원이 있는 카페, 더로드101",여행 코스 중 마지막! 카페 #더로드101 입니다. 하루동안 뽈뽈거리며 정말 알차게 돌아다녔는데 동선이 퍼펙트-☆ 했던 거 같아요. 섬진강 재첩국수에서 더 로드 101까지 차로 10분 이내 거리이기 때문에 밥 먹고 디저트 먹으러 가기 딱 좋은 코스였어요! 더로드 101 *주소 : 경남 하동군 화개면...,2020. 6. 9.
[경남/ 하동 오리구이 맛집] 여명가든,"하동 여행 계획 초기부터 점찍어 두었던 맛집은 여명가든이라는 오리구이 전문점이었다 이곳은 현지인들 사이에서도 맛집으로 소문이 자자한 곳이라고 하는데, 이번에 하동으로 온만큼 이곳에서 한끼를 해결해 보기로 했다 가게 위치 가게위치: 경남 하동군 악양면 성두길 11-3 영업시간: 11:00 ~ 15...",2021. 8. 7.
구례에서 화개까지 2박 3일 여행이야기(3일차),"여행 마지막 날이다. 숙소 정리하고 간단히 아침밥 먹고 가방은 숙소에 맡긴 후 매암제 다원(경남 하동군 악양면 악양서로 346-1. 10:00~18:00, 월요일 휴무) 을 가기 위해 9시 15분 악양 가는 버스를 탔다. 숙소가 공영터미널 5분 거리에 있어 버스 타기는 수월하였다. 자동차 여행이 아니면 숙소는...",2021. 10. 11.
경남 하동 여행 매암제다원 녹차밭 카페 꼭 일찍 가세요!,하동 여행코스 하면 빠질 수 없는 핫플이지 인생샷을 남길 수 있는 곳! 바로 하동 매암제다원 녹차밭 **꿀팁은 오픈하는 시간에 일찍 방문하세요! 그래야 사진을 좀더 여유있게 찍을 수 있답니다! 하동 매암제다원 녹차밭 주소 : 경남 하동군 악양면 악양서로 346-1 영업시간 : 10:00~18:00 월요일 휴무...,2020. 8. 2.
하동 화개장터 맛집 은어튀김 맛있다,TV에서 많이 나와서 먹고 싶어 은어 먹으러 왔는데 역시 실망시키지 않고 맛있게 먹고 왔답니다..^^ 하동 화개장터 여행하면서 먹을거리 찾으시는 분이라면 여기 한번 들려서 섬진강에서만 먹을 수 있는 음식 드셔보세요^^ 주소 : 경남 하동군 화개면 화개로 2-15 전화번호 : 055-882-9991 #하동화개장터맛집,2021. 7. 2.
"국내 봄여행지, 한국관광공사 추천 pick! 봄 시즌 비대면 안심관광지 25선 :: 호천마을...","위치 : 경남 하동군 화개면 운수리 862 하화도 사진제공 한국관광공사 김지호 겨울의 시작이 북쪽이라면, 봄의 출발점은 당연히 남녘입니다. 여수에 있는 '아래꽃섬' 하화도는 이름에 걸맞게 매년 이맘때면 꽃이 마치 자연의 포장지라도 된 것처럼 섬 전체를 뒤덮습니다. 국내 봄여행지 꽃섬길의...",2021. 4. 13.
"하동 여행 EP03 하동 맛집 선창횟집 참숭어코스(+숭어 칼로리, 효능)","그래서 매년 11월~12월 사이 하동녹차참숭어축제도 개최된다고 하니 여행을 계획하신 분들은 축제도 가보시는 게 좋을 것 같아요 선창횟집 경남 하동군 금남면 증평해안길 139 선창횟집,카페 ***-***-**** 선창횟집은 경남 하동군 금남면에 위치해있는데요! 하동 중에서도 남쪽으로, 조금만 더...",2021. 10. 6.
하동 평사리공원 부드러운 순백색의 은모래길~여행의 쉼터,평사리공원 *솔직 느낌* 하동 평사리공원 은모래길 -경남 하동군 악양면 평사리 하동 도착해서 화개장터 가는 길 우연히 너무나 멋진 곳을... 를 눈으로 확인했던 평사리공원 은모래길 여행의 쉼터로 충분한 곳이예요 가루같이 고운 부드러운 모래라 아이들과 함께 시간을 보내도 안전하게 참...,2020. 5. 1.
"[경남] 경남도, 장기 체류 여행 '경남형 한 달 살이' 확대","통영살이 ▲김해시의 Gimhae live and life ▲하동군의 흥미진진한 하동에서의 일상 ▲산청군의 산청에 살어리랏다 ▲합천군의 드라마틱 합천 등 5개... 다도 및 요가체험, 지역 토속음식 만들기 체험 등을 기획해 큰 인기를 끌었다. #경남관광 #경남한달살이 #한달살이 #장기체류여행 #경남관광박람회",2021. 3. 8.
하동여행::녹차밭뷰에 반하는곳! 매암제다원_인생사진도 찍어봐요 :),"하동 ""매암제다원"" 경남 하동군 악양면 악양서로 346-1 매암다원문화박물관 여행지에 가서도 늘 카페를 가는 울부부. 하동은 이번이 처음인데, 녹차밭이 이렇게 많고 유명한지 몰랐어요. 커피러버 부부지만, 여기와서는 녹차를 마셔보고 싶어서 찾아보던중, 거의 하동여행 성지인 ""매암제다원...",2020. 1. 23.
"경남 하동 가볼만한곳 , 하동 레일바이크 재밌고 신나 신나!","개조해서 경남 하동군에 도움이 될 관광지를 만들다니..! 하동군민이 아닌 저에게는 좋은 추억과 경험의 시간이 되어서 좋고 하동군민들에게도... 거리가 좀 멀긴 하지만 '레일바이크'타러 간다는 목적이 있다면 만족스러운 여행이 될것 같아요~ 다만, 너무 어린아이들에게는 레일바이크 소리가...",2021. 7. 1.
[ 경남 가볼만한곳 / 여행 코스 / 하동 매암제다원 / 푸릇한 녹차밭을 한눈에 / 핫플 카페 ],오셔서 인생샷도 남겨보시구 넓게 펼져진 녹차밭을 보며 차한잔의 여유를 즐기시며 힐링 하시길 바래요 하동 여행 필수코스로 추천 드립니당 경남 하동 매암제다원 영업 위치 & 정보 주소 경남 하동군 악양면 악양서로 346-1 매암다원문화박물관 영업시간 매일 10:00-19:00 (동절기 오후 6시까지) 휴무일...,2020. 6. 17.
[하동맛집] 경남 하동 쌍계사 맛집 :) 청운식당 - 더덕구이 정식 즐겨요,"안녕하세요 잇님들 베이글 입니다 경남 하동 쌍계사 맛집 ""청운식당"" 입니다! 경남 하동 쌍계사 맛집 : ) 청운식당 위치 - 경남 하동군 화개면... 건강한 밥상이면서도 맛있는 더덕구이 정식 추천입니닷 *내돈내산 포스팅 입니다* 이상 포스팅을 마칩니다 감사합니다 #여행 #경남여행 #국내여행...",2021. 7. 6.
[경남 하동여행지 추천] 하동 야외테이블 차맛집 카페_매암제다원,"매암제다원 경남 하동군 악양면 악양서로 346-1 매암다원문화박물관 -매일 10:00 ~ 18:00 ( *월요일 휴무 ) -공용주차장 카페근처에 있음 -야외테이블 o... 분리수거 잘하기 ㅎㅅㅎ 우리가 간날 날이 되게 더웠는데 야외테이블 그늘에 앉아있으니까 생각보다 시원해따 하동여행가면 한번씩 들러보세여~,~",2021. 7. 1.
<하동여행> 기억에 많이 남던 삼성궁,"삼성궁의 하이라이트 도착!! 물색이 진짜 오묘해요~~ 꼭 한번 방문해보세요!! 위치도 좋은편도 아니고 시간이없어 방문할까말까 고민하던곳인데 들러서 너무 좋았거든요!!완전추천이요 ! < 입장료> 어른 7,000원 청소년 4,000원 어린이 3,000원 <위치> 경남 하동군 청암면 묵계리",2020. 7. 30.
"경남 하동 정원이 예쁘고, 포토존 가득한 ‘더로드 101’ 대형카페 다녀왔어요!",더로드101 정원카페 주소 : 경남 하동군 화개면 화개로 357 오픈시간 : 매일 10:00 ~ 20:00 일년전에 갔던 카페를 다시 찾아 갔어요! 일년전에 갔을때... 하동여행추천 #하동대형카페 #하동가든뷰카페 #하동정원카페 #하동정원뷰카페 #경남여행 #서이추 #서이추환영 #소통 #이웃 #이웃소통 #일상블로거,2021. 7. 5.
{랜선여행} [1년 전 오늘] 광양 매실마을,"정말 좋은곳이네요. 이렇게 좋은 곳에서 살면 건강해지겠지요? 섬진강 변을 따라 달리는 도로변에 있어요. 광양시에 있지만 경남 하동군 하동에서 더 가깝지요. 3월이 되면 매화꽃이 만발하는데, 1995년 3월 청매실농원에서 매화축제를 시작한 것을 계기로 매년 매화... 비단공주의 일상",2021. 7. 25.
"1박2일 하동여행:) 자매여행 최참판댁,스타웨이하동,매암제다원","우리 쪼꼬미와 그리고 모처럼 백신접종하고 시간이 있는 쭈애기와 셋이 1박2일로 급 하동여행을 떠나보았습니다아-열심히 운전하고... ""스타웨이 하동"" 운영시간: 3월~10월 09:30-18:00 11월~2월 09:30-17:00입장료: 성인 3,000원 / 청소년 2,000원위치 : 경남 하동군 악양면 섬진강대로 3358-110 그래도 와봤으니...",2021. 9. 29.
"하동 가볼만한곳: 도심다원, 제주 뺨치는 예쁜 하동 녹차밭 포토존",메암제다원과 쌍벽을 이루는 하동 녹차밭 '도심다원' 주소ㅣ경남 하동군 화개면 신촌도심길 55 입장료ㅣ무료 찾아가는 팁(TIP) : 네비 or 지도 검색 시... 그럼 짧게 즐겨 본 도심다원 후기 끝 혹시라도 하동으로 벚꽃 구경 가거나 그냥 여행을 계획 중이라면 여기도 살짝 추가해보길 오르막길이 다소...,2021. 3. 24.
경남 산청 지리산 하동 김다현길 힐링코스로 good,산청에서 삼신봉 터널을 지나면 바로 하동군이라 바로 옆동네로 지리산을 따라 함께 생활권이 같은 곳. 근처에는 청학동 서당도 있고 삼성궁도 있어 두루두루 돌아볼 곳이 많아 1년내내 여행객이 끊이지 않는 하동의 여행명소이다. 우리는 주차장에 차를 세워두고 김다현길을 찾아 열심히...,2021. 8. 13.
"하동여행 에어비앤비 @ 올모스트홈스테이 , 회경재 1번방","코로나19 이후로 역마살쟁이인 저는 잠잠하다가 드디어 여행을 떠나기로 하였습니다. 늦은 여름휴가 - 일 때문에 미루고, 사회적 거리두기로... 주소 : 경남 하동군 악양면 평사리길 75 인스타그램 : @almosthome.stay 올모스트홈스테이에 대한 다른 숙소들 설명과 에어비앤비 예약 링크는 위...",2020. 9. 10.
"경남공간재생,아카이브,남해문화공간[GNCKL: 스토리] 남해로 들어가는 새로운 공간...",남해군 설천면 노량리와 경남 하동군 금남면 노량리를 연결하는 남해대교가 완공되었어요. 남해에서는 첫 육지와의 연결이어서 의미가 있고 많은 관광객이 남해대교로 편하게 여행할 수 있게 되었습니다. 남해대교와 연계되어 건축된 휴게공간인 남해각은 남해대교를 건너자마자 왼쪽으로...,2021. 8. 12.
하동 스타웨이 그곳은 지금도 바람이 불까요,하동의 랜드마크라 불리는 전망대 스타웨이 하동 스타웨이 하동 09:30 - 20:30 경남 하동군 악양면 섬진강대로 3358-110 입구 쪽에 주차공간이 넓게... 이번 여행에서 느낀 산은 어찌나 포근하던지 지리산이 주는 웅장함보다 오히려 따뜻함을 받았던 하동 여행이었습니다 먼저 다녀온 친구에게 굽이굽이...,2021. 7. 26.
"대안여행과 마을 이야기 ""나는 마을로 출근한다""","조문환 경남 하동군 악양면장을 끝으로 28년간 공직을 마감했다. 뜻있는 지역 인사들과 협동조합을 설립, 하동주민공정여행 놀루와를 시작했다. 소멸위기에 있는 마을에 대한 안타까움 때문에서다. 건강한 공동체만이 마을을 존속하게 할 수 있다는 생각이 그를 지배하고 있다. 획기적인...",2021. 2. 2.
코로나 2단계 집에서 즐기는 랜선 여행-청학동 삼성궁,"삼성궁 입구 마고성, 상상의 도시-마고 여신을 모시는 곳이라고 함 지난 7월 30일에 휴가를 다녀와서 8월 3일에 집에 돌아와 일상으로 복귀하여 여행... 걷는 내내 쾌적했답니다~ 입장료 대인 7천원 소인 4천원 주소 경남 하동군 청암면 삼성궁길 86-15 삼성궁의 정식 이름은 지리산 청학선원...",2020. 8. 24.
하동 짚라인 맛집 하동 지리산흑돼지 후기!,하동 지리산 흑돼지 주소 경남 하동군 금성면 산업로 823 영업시간: 매일 10:00 - 21:00 번호: 055-884-8072 저희가 다녀온 하동 지리산흑돼지는 송림공원에서 차로 15분 정도 걸리는 곳에 위치해 있어서 접근성이 좋았어요. 1층의 단독 건물에 크기가 커서 눈에 띄어 쉽게 찾아갈 수 있었답니다. 가게 바로...,2021. 6. 21.
[하동여행] 하동에서 힐링 할 수 있는 곳:쌍계사,쌍계사 전화번호 ***-***-**** 주소 경남 하동군 화개면 쌍계사길 59 영업시간 매일 08:00 - 17:30 http://www.ssanggyesa.net/ 하동 켄싱턴 리조트에서 매우 가까운 곳에 위치한 쌍계사라 체크아웃하는 날 아침 일찍 찾아갔어요! 저는 국내여행할 때 꼭 그 근처의 절을 찾아보는걸 좋아하는데 하동에는...,2021. 9. 30.
[하동 셋째날] 1시간 30분 코스 편백자연휴양림,동해식당 경남 하동군 옥종면 옥종중앙길 52-1 영업시간 11:00 - 21:00 해뜰 목장가기전 근처 맛집이 없어 시내에 백반집 들어갔는데 보쌈정식 시켜 맛있게 먹었습니다 ^^ 카페정원 경남 하동군 옥종면 덕천로 8-1 걸어서 7분거리에 있는 카페 커피 맛있어요 ~,2021. 7. 15.
[하동 여행] 하동 켄싱턴리조트 후기_3박을 부탁해,"이번 여행에서 가장 기대하고 있었던 하동! 하동은 위에는 지리산을, 아래는 남해를 자랑하는 곳으로 우리나라 대표적인 산과 바다로 둘러싸인... 주 소 : 경남 하동군 화개면 쌍계로 532-6 연 락 처 : 055-880-8000 객실타입 : 디럭스룸 - 2인 조식, 2인 커피, 하동 관광지 티켓 2매 화개천과 지리산을...",2021. 10. 11.
[경상남도 여름휴가 안심관광지/합천 영상테마파크]_한국관광공사 경남지사 가봄 3기...,하동군 _ 삼성궁 13. 산청군 _ 동의보감촌 14. 함양군 _ 함양대봉산휴양밸리 15. 합천군 _ 영상테마파크 자세한 사항은 사이트에서 확인해주세요!... #가봄 #한국관광공사경남지사 #경남여행 #안심여행캠페인 #한국관광공사 #합천영상테마파크 #합천 #영상테마파크 #가봄3기 #안심여행...,2021. 7. 29.
"경남 카페 하동 플래닛1020 화창한 날씨에 딱 +주차, 주변 스팟","오타정정 화동(X) - 하동(O) 민경의 국내여행 경남 하동편, 이번에는 경남 카페 하동 플래닛1020 추천 포스팅인데요 하동은 정말 가기 전부터 숙소... 햇살 낭낭한 하동 날씨에 꼭 다녀오세요 경남 카페 하동 플래닛1020 주소 경남 하동군 화개면 쌍계로 318 운영시간 12:00-19:00(mon off) 주차공간 O 휴무일은...",2021. 7. 4.
"하동 카페 더로드101 분위기 짱♥ 하동, 남해 여행코스로 좋아요!","하동 카페 더로드101 분위기 짱♥ 하동, 남해 여행코스로 좋아요! 하동 카페 더로드101 몇주전에 남해여행을 다녀왔는데 남해 여행코스 짤때 남해... 있어서 하동 화개장터 카페 찾으시는 분들께도 추천! 주소: 경남 하동군 화개면 화개로 357 평일 10:00 - 21:00(토요일은 22:00까지) 070-4458-4650 주차가능",2020. 7. 3.
[경남] 2021.10.2-10.3. 하동 1일차,친구와 함께 #하동여행 을 갔다. 원래는 #지리산둘레길 을 걷자고 했는데 어찌하다보니 둘레길은 안가고 하동 구경만 열심히 하고 왔다. 하동도... 하동군 선정 아름다운 다원이라는데 정말 그러하다. 하동 다니면서 다원이 정말 많았는데 그 중 이곳을 선택하길 잘 한거 같다. 이렇게 좋은...,2021. 10. 6.
하동카페 : 조용한 숲속 빵집 '평사리의 아침',"평사리의 아침 -am11:00 - pm5:00 -월,화요일 휴무 -경남 하동군 악양면 대촌길 46-14 외관 하동의 어느 시골길 하고도 골목 안쪽에 있는 카페 평사리의... 사장님이 자신 있게 빵이 맛있다고 하셔서 담에 또 방문하게 되면 빵을 먹고 싶군 #평사리의아침 #하동 #하동카페 #하동빵집 #하동맛집 #하동여행",2021. 10. 1.
하동여행 EP02 매암제다원 하동 매암차문화박물관(+하동 세계 차 엑스포),"안녕하세요 오늘은 하동여행 EP02 매암제다원, 매암차문화박물관을 소개해드리려고 해요! 사진출처 : 하동세계차엑스포 홈페이지 하동은 차... 하동 매암제다원, 매암차 문화박물관 매암제다원은 경남 하동군 악양면에 위치한 다원으로 지리산 아래 악양 땅에 2만여 제곱미터의 다원이 자연...",2021. 10. 5.
[경남 하동 리조트]여름을 제대로 즐길 수 있는 '비바체 하동호 리조트',"비바체 하동호 리조트 경남 하동군 청암면 청학로 876 (중이리 30-1) '하동여행'은 부산에 사는 저한텐 굉장히 멀어서 그리 자주가는 여행지역은 아닌데요, 오랜만에!!하동에 여행을 떠나보았습니다:> 그런데 제가 머물렀던 하동리조트가 너무 좋아서 이번에는 여행포스팅이 아닌, 리조트 포스팅으로...",2021. 6. 17.
"[하동 여행] 화개장터 고향맛집_참게탕, 메기탕, 재첩국이 맛있는 집. 주차 정보",화개장터 고향맛집_기본 정보 ☎ 055-882-4777 ※ 주소 : 경남 하동군 화개면 쌍계로 19 화개장터 ※ 영업 : 08 : 00~20 : 00 연중무휴 ※ 네비 : 화개면사무소. 주차장에 주차하고 도로 건너면 화개장터 입구 쪽에 바로 있음. 부산-하동 포구공원-하동 송림 섬진강 트레킹 코스 부산 신항에서 8시에 출발해서...,2021. 5. 14.
[하동] 매암제다원 : 푸릇한 녹차밭 뷰 사진찍기좋은 카페,매암제다원 경남 하동군 악양면 악양서로 346-1 10:00 ~ 18:00 (월요일 휴무) 2박3일간의 여수 남해여행 여수에서 남해로 넘어가면서 하동 매암제다원에 들렀다. 조금 돌아가는 길이지만 상관없을 만큼 사진찍기 좋은 푸릇푸릇한 곳 카페이긴 하지만 인생사진 찍을 수 있는 여행지의 느낌이라 여행...,2021. 7. 4.
경남 하동 섬진강 트레킹 벚꽃길 걸으며 평사리공원에서 화개장터까지,섬진강여행 #섬진강벚꽃 #섬진강두꺼비 #섬진강뷰 #섬진강드라이브 #섬진강변 #섬진강 출발할때부터 구름은 많이 끼어있었지만 제발 트레킹이... 경남 하동 섬진강 트레킹 벚꽃길 평사리공원에서 화개장터까지 평사리공원 주소 경남 하동군 악양면 평사리 77 화개장터 주소 경남 하동군 화개면 탑리,2021. 7. 1.
하동여행 상평마을 공동체정원 봄 왔겠지?,●하동 상평마을 공동체정원 경남 하동군 고전면 성평리 일원 유휴지(토지 세트장 내) 주차장에서 최참판댁 올라가다 좌측에 있어요. 하동여행으로 최참판댁 가는 길 가다 좌측으로 빠져봅니다. 저도 예전에 왔을때는 여기 하동 상평마을 공동체정원을 전혀 몰랐어요. 하긴 이 상평마을이 생긴지는...,2020. 4. 9.
쿠폰트리 내륙상품 GRAND OPEN!,휴가철을 맞이해서 제주도로 많은 분들이 여행을 오시지만 내륙에도 상당히 많은 관광지들이 있는데요. 저희 쿠폰트리에서 합리적인 가격에... 하동 레일바이크 전화 : ***-***-**** 주소 : 경남 하동군 북천면 경서 대로 2446-6 안전하고 인체공학적 설계를 바탕으로 남녀노소 불편함의...,2021. 7. 23.
* 남해여행 / 하동짚라인(경남),"06 with yoo * #하동짚라인 #남해여행 #짚와이어 남해여행, 짚라인을 타다! 남해여행을 가서 가장 먼저 간 곳은 '아시아 최대 길이 짚라인 - 하동 알프스... 거라 하더라구요~ 힐링을 하고 싶거나 무언가 익사이팅한 것을 하고 싶다면, 하동짚라인 추천합니다! 경남 하동군 금남면 경충로 493-9 055-884-7715",2020. 3. 20.
"경남 하동 가볼만한 곳:) 하동 삼성궁, 맛집 계곡산장","후기입니다 경남 근교 갈볼만한 곳 찾으신다면 꼬옥 가보시길 추천드려요 ! #삼성궁 #하동삼성궁 #하동가볼만한곳 #하동여행 주소 경상남도 하동군 청암면 삼성궁길 2 전화번호 055-884-1279 입장료 어른 7000원/청소년 4000원 /학생, 경로, 장애인, 유공자 3000 운영시간 4-11월 8:30-17:00 /12-3월 8:30-16:30...",2021. 5. 15.
국내여행 : 하동 (HADONG) / 하동가볼만한곳/신진식당/계곡맛집/매암제다원/하동숙소...,#하동맛집정보 #하동여행정보 #하동여행 #하동맛집 하동 신진식당 (계곡맛집) 경남 하동군 화개면 석문길 12(화개면 운수리 산101-1) 위치는 화개장터에서 꽤나 가깝습니다. 계곡맛집으로 유명한데 이날은 유일하게 날씨가 그래도 나름 좋았던 날. 비가 엄청 왔으면 동선을 변경해야했는데 왔네용...,2021. 9. 6.
"[TV속 정보] 9월 13일(월) KBS2TV생생정보 , MBC생방송오늘저녁, SBS생방송투데이...",***-***-**** 경남 하동군 화개면 쌍계로 17 <아.재.여.행 (아주 재밌는 여행) - 경기도 김포시> ▶ 새우잡이 (사랑호) ☎ ***-****-**** 경기 김포시 하성면 금포로 1928 ▶ 벼꽃농부 ☎ 031-988-3300 경기 김포시 하성면 마곡로 239 ▶ 금빛수로 보트하우스☎ 070-4242-0340 경기 김포시...,2021. 9. 13.
[경남/하동]북천역 코스모스,북천역 경남 하동군 북천면 경서대로 2446-6 가을이면 먼저 코스모스가 떠오르고 코스모스가 생각나면 으례 따라 흥얼거리게 되는 노래가 있죠?... 기차여행으로 왔던곳이었어요... 근데 10여년이 흘러 와보니 많이 변해 있었어요 옛추억을 떠올릴만한곳이 없는~~~ㅠㅠ 옛 북천역은 경전선...,2021. 3. 5.
"보슬비 내리는 날 하동 여행..동정호, 악양 형제봉 활공장, 하동 스카이워크, 송림공원..",여행길에 이런 경치를 보면 마음이 풍성해집니다.. 아름다운 우리 강산입니다.. 비 오는 날 한적한 시골길의 드리이브가 너무 좋습니다.. 마음의... 경남 하동군 고전면 재첩길 286.. 원조 나루터 재첩식당입니다.. 20년 전 이곳에 처음 와서 재첩국 맛에 반해 자주 찾았던 식당입니다.. 재첩국(8000원)과...,2021. 5. 7.
경남 하동여행 스타웨이하동스카이워크 경남벚꽃명소를 한눈에 200330,"^^ (근데 주말에 또 비소식이 있던데,,, ㅎㅎ) 무튼 ~~ 벚꽃드라이브로 하동 최고인듯 경남벚꽃드라이브 하동 쫗아용.. 담번에는 하동감성숙소에서 머물며 하동여행 제대로 해보고 싶어요. 아름다운 하동~ 또 만나자 하동스타웨이 주 소 : 하동군 악양면 섬진강대로 3358-110 영업시간 : 매일 09:30 - 22...",2021. 3. 22.
경남 하동여행 북천 코스모스메밀꽃축제 현황이랄까요...,경남 하동군 북천 코스모스 11년도에 왔을 때는 일로 왔었고 개인적으로 2번 더 찾았던 지역. 객관적인 눈으로 봐야하는 순간도 그리고 이 좋은 풍광을 가족에게 보여주고 싶은 마음도 충만했던 곳. 아직도 도대체 축제란 게 뭔지 모르겠지만 개인적으로 경관농업을 주제로 한 대한민국...,2020. 10. 11.
