header,contents,date
경남_고성_만화방초_#수국_#수국축제_#고성여행_#고성가볼만한곳,_ 2021년 6월 27일 한가롭고도 푸르고 푸르던 일요일 경상남도 고성군 거류면에 형성된 만화방초에 다녀왔다. 일주일전에 사실 점심먹고 동고성 IC 나와서 들어가는데 우와 주차장이 꽉차서 그냥 그대로 기운빠진채로 차 돌려서 통영으로 갔던 기억이 난다. 뭐 대신에 전화위복이라고 25분거리에 통영...,2021. 6. 28.
[남해 3박 4일] 경남 고성 공룡 세계 엑스포_기본정보_관람팁!_아이들과 갈만한 곳_초등...,"열리는 경남 고성 공룡 세계 엑스포에 다녀왔습니다. 초여름이었던가요. 우리집 여섯 살이 공룡 엑스포 신문 광고를 들고 오더니 여기 가고 싶다고 하더라고요. 우리 귀염둥이가 신문까지 들고 와서 공룡 보러 가고 싶다는데 가야죠!!! 그렇게 얼리버드 예약을 하고, 우리 가족 최초의 남해 여행을...",2021. 10. 11.
"경남 가볼만곳)경상남도 추천, 경남여행지추천18선","고성군의 고성공룡 박물관과 창녕군의 우포눞이 당일 여행지로 아주 좋아서 경남 여행지 추천 18선입니다. 정말 경남 가볼만한 곳 1순위라고 해도 과언이 아닐 정도로 창녕 우포눞은 철새 도래지로 인정되어 람사르 습지로 등록되었으면, 국가습지보호지역으로 지정되었다. 자라는 아이들의...",2021. 6. 20.
"[국내여행] ""흔들흔들 아찔""…경남 고성 구절산 출렁다리 개통 (연합뉴스)","[국내여행] ""흔들흔들 아찔""…경남 고성 구절산 출렁다리 개통 (연합뉴스)(경남 고성=연합뉴스) 이정훈 기자 = 경남 고성군은 18일 동해면 외곡리 구절산 폭포암 인근에서 구절산 출렁다리를 개통했다. 고성군이 국비와 지방비 6억2천만원을 들여 다리를 만들었다. 구절산 출렁다리는 길이...",2020. 8. 18.
[경남고성] 장산숲 & 양귀비맛집 월곡마을,포스팅은 이 다음에 시간될때 천천히~~ 돌아오는길 배가 고파서 정든한정식 언제먹어도 맛있는곳이다. #경남고성가볼만한곳 #경남고성여행 #경남고성나들이 #경남고성핫플레이스 #경남고성사진찍기좋은곳 #경남고성핫플 #경남고성군 #경상남도고성 #경상남도 #정든한정식 #장산숲 #월곡마을양귀비,2021. 5. 23.
"부부여행! 사천 삼천포대교를 건너, 고성 다이노 캠핑장에서,,,",여행 중 지역마다 '하나로마트'가 있어 지역에서 맛볼 수 있는 먹거리나 막걸리는 현지에서 구입을 하는 편이다. 고성 하나로마트에 들러 삼겹살과 막걸리를 사서 경남 고성군 삼산면 두포 5길 '다이노 캠핑장'으로~ [캠핑장은 예약제 텐트 자리 3만 5천 결제] ▼ ▼ ▼ 고성 다이노 캠핑장 사이트에서...,2020. 5. 19.
경남고성 공룡엑스포:오션포레 글램핑에서 고성여행 즐기기!,오션포레 주소:경남 고성군 회화면 당항리 산27 예약문의:055) 672 - 5588 예약하실분들은 여기로 들어가시면 되용~~ #경남글램핑추천 #고성커플여행 #경남겨울여행 #고성오션포레 #오션포레 #바베큐파티 #캠핑요리 #고성맛집추천 #연말파티장소 #고성공룡박물관 #경남감성글램핑 #경남캠핑 #순두부찌개...,2020. 1. 1.
경남 고성 맛집 고성 여행 추천 맛집 엄마 손 집 밥,"경남 고성 맛집, 고성 여행 추천 맛집, '엄마손집밥' 상세 내용은 경상남도 고성군 블로그에서 상세보기로 만나보세요. 경남 고성군 블로그에서 엄마손집밥 미리 맛보기 ↓↓↓↓↓↓↓ & #경남고성맛집 #고성여행추천맛집 #엄마손집밥 #경남고성 #고성맛집 #고성여행",2020. 6. 1.
"경남 고성, 할매촌국시 통영 가는길에 먹은 국수 맛집","경남 고성 맛집 고성 할매촌국시 고성 국수 맛집 ✔️ 할매촌국시 주소 경남 고성군 회화면 배둔서길 15 (지번) 경남 고성군 회화면 배둔리 814-5 매일 6:00 ~ 18:00 Last Order 18:00 (계절시 변경될 수 있음) 명절 휴무, 재료 소진시 영업마감 주차장 있음 이번 주말 오빠랑 통영여행을 하고왔어요...",2021. 4. 27.
경남 고성 꼭 가봐야할곳 사진명소 박원숙의같이삽시다 촬영지 절경이 끝내줬던 상족암...,세상에 남해바다를 그렇게 여행다니면서도 저곳은 어디지 못본곳인데? 궁금증 폭발 그래서 프래그램 끝난후 폭풍검색해보니 몇일있다... 상족암 군립공원 주소: 경남 고성군 하이면 덕명5길 42-23 공룡발자국과 파도에 꺽인 해안지형 그리고 신비로운 암벽들로 볼거리가 많은곳이에요. 공룡이라면...,2021. 7. 29.
경남 고성여행 오션뷰 맛집 추천 고성가면 꼭 가야할 곳 !! 바닷가에 햇살 한스푼,"바닷가에 햇살 한 스푼 *** - *** - **** 경남 고성군 고성읍 신월로 157 https://www.instagram.com/sea_n_sunlight/ 인스타에 들어가면 휴무 안내사항도 나옵니다. 설 휴무 : 2월12일(금) 휴무 ""바닷가에 햇살 한 스푼 "" 식당이름이 무슨 소설책 이름 같습니다. 그리고 로고도 진자 이쁜것 같음. 친구한테 "" 함안?...",2021. 2. 7.
경남 고성 학동마을 옛담장,"장거리 여행은 꺼린다. 명소를 보유한 고장이라면 주말이면 어김없이 몰려드는 탐방객에 치여 보내야 한다. 고성군 하일면에 위치한 옛돌담 마을은... 하일이면 고성 바다와 가깝기에 하루나 이틀 정도 경남의 해안가와 공룡 발자취, 그리고 즐거운 식도락을 겸하는 것도 좋은 방편이다. 옛 담장...",2021. 6. 27.
경남고성펜션 풀빌라 비비파크 경남고성가볼만한곳 카페모드 키즈카페,경남고성펜션 풀빌라 비비파크 경남고성가볼만한곳 카페모드 키즈카페 경상남도 고성군 고성읍 신월2길 68 055-674-0150 무박스파 패키지 : 유선... 애기가 된 것마냥 이시간을 카페모드에서 마음껏 즐겨요.아이들과 여행을 계획하고 계신다면 경남고성가볼만한곳으로 참 괜찮은 거 같아요. 띵동....,2021. 7. 27.
[경상남도 여름휴가 안심관광지/합천 영상테마파크]_한국관광공사 경남지사 가봄 3기...,안심여행 캠페인 경남 관광지” 1. 창원시 _ 진해 해양공원 2. 진주시 _ 진주성 3. 통영시 _ 디피랑 4. 사천시 _ 사천바다케이블카 5. 김해시 _ 김해가야테마파크 6. 밀양시 _ 밀양아리랑 우주천문대 7. 거제시 _ 내도 8. 양산시 _ 한국궁중꽃박물관 9. 함안군 _ 악양생태공원 10. 고성군...,2021. 7. 29.
"6월 경남 가볼만한곳, 사진 찍기 좋은 곳 경남 수국 명소 BEST3","1, 고성 그레이스 정원 ✔위치: 경남 고성군 상리면 삼상로 1312-71 ✔입장료: 성인, 5,000원 중고생 4,000원 어린이 3,000원 ✔오픈: 매일 09:00~18:00 경남... 요즘은 여행 다니다 보면 젊은이들의 전유물이었던 인증 사진 놀이 셀카 놀이가 50~60대까지 번지면서 어떨 때는 20대 청춘들이 머쓱해질 때가 있다고...",2021. 6. 19.
#경남고성여행_고성소을비포진성,"고성소을비포성지는 고성군 히일면 동화마을에 위치한 옛 성지인데, 많이 알려져있는 곳은 아니지만 SNS 에서 올라온 사진을 보고 방문해보기로... 찍기를 좋아하시는 분들이라면 분명 만족하실 겁니다^^ #고성여행 #경남고성여행 #경남고성 #고성소을비포성지 #동화마을 #경남고성 #경남가볼만한곳",2020. 10. 18.
(고성가볼만한곳)신기한 물고기가 가득!! 어린이들의 호기심 자극하는 고성생태학습관,코로나 상황이 완화되었다고는 하지만 마스크는 필수이고 사람들이 붐비는 곳은 피해야 하는 시기라 더 편안하게 구경할 수 있는 고성 생태학습관입니다. -고성군 SNS기자단 정 윤희- #경남고성군 #고성여행 #고성가볼만한곳 #경남대형수족관 #고성생태학습관,2020. 10. 23.
국내 여행지 추천: 아름다운 바다가 보이는 경남 고성 오션뷰 패밀리펜션 (숨은 여행...,"""국내 여행지 추천: 아름다운 바다가 보이는 경남 고성 오션뷰 패밀리펜션 (숨은 여행 명소 찾기)"" [업체 정보] 펜션명: 패밀리펜션 주소: 경상남도 고성군 하이면 자란만로 849-6 입실: 오후 3시 / 퇴실: 오전 11시 업체 번호: 0507-1448-1617 펜션 구성 및 주변 환경: 독채. 개별 바비큐, 단체, 바비큐장...",2020. 11. 20.
Dinosaur Expo Is Less than 2 Weeks Away! 공룡 엑스포가 2주도 채 남지...,여름과 추석이 지나고 이곳을 미리 다녀와 보니 고성공룡엑스포가 더더욱 기다려집니다! #고성 #고성영어 #고성가볼만한곳 #고성캠핑 #고성여행 #GoseongGuy #고성군 #경남고성 #고성공룡엑스포 #고성공룡박물관 #고성공룡박물관,2021. 9. 24.
"경남 고성 밥집 :: 본토대가, 점심",통영 여행하며 근처 가까운 맛집 경남 고성 밥집 본토대가에서 점심 식사 경남 고성 밥집 본토대가 주소 경남 고성군 고성읍 성내로144번길 17 (055 - 672 -4224) 주차 골목 어디쯤 영업시간 매일 11:00 - 20:00 (재료소진시 조기마감) 간장게장 전복장 새우장 가리비장 정식 맛집인 본토대가 본토대가...,2021. 5. 29.
경남 고성만 해지개다리 해안둘레길과 오션스파호텔,오션스파호텔 경남 고성에는 해지개다리라는 수상다리가 있어요. 이 곳을 걸어보는 것이 참 기분을 좋게 합니다. 얼마전 고성 여행할 때 걸었던... 경남 고성군 남포항의 모습입니다. 많은 배들이 정박해 있네요... 배를 수리하는 기구도 보이고. 저녁시간이라 그런지 남포항은 상대적으로...,2021. 5. 10.
경남 고성 펜션 : 수영장이 만족스러웠던 라파엘펜션 글램핑,경남 고성 펜션 수영장이 만족스러웠던 라파엘펜션 글램핑 사진 글│굠미 #경남고성펜션 #고성펜션 #고성여행 #경남고성여행 #경남글램핑... 뭐 여름에는 수영장 하나면 충분하니까^_^ & 위치 경남 고성군 회화면 당항리 543 전화번호 055-673-8318 ▼ 홈페이지 ▼ 경남 고성 수영장 펜션 라파엘 풍경방...,2021. 7. 24.
경남 고성 피톤치드 마시며 인생샷까지 남긴 고성 장산숲,등장 여행 시 우엉차 한 병 있으면 얼마나 든든하게요? 사자마자 비닐부터 벗기고 사진 냄김 분리수거를 잘 하기 위한 요량 날씨가 좋아서 동생과 함께 근교에 갈만한 곳을 찾아보다가 경남 고성에 위치한 '장산숲'에 다녀오기로 했다. 고성 장산숲 경남 고성군 마암면 장산리 230-2 입장료 없음...,2021. 6. 9.
"경남 고성 여행) 걷기만해도 힐링되는 학동마을 옛담장길, 꼭 다녀오세요 풍경이있는...",#고성군하일면보건소 전화번호 : 055-673-1435 여기까지 참다래농장 사장님께서 태워다주셔서 넘 감사했어요♡ #하일면보건소 #고성군보건소... 갯지렁이도 많아요 바위 들췄다가 깜짝 놀람 ㅋㅋㅋㅋ 너무 예쁜 솔섬 풍경 #경남고성갈곳 #경남고성솔섬 #경남고성여행 아이랑 잡은 꽃게는 맛있게 또...,2021. 5. 2.
경남고성맛집 통영짬뽕 유명해 질줄알았다!,경남고성맛집 통영짬뽕 당항만 둘레길도 관광 맛있고 즐거운 여행 줄 서서 먹는 맛집 등극 통영짬뽕 욕지도여행을하고 부산으로 돌아오기 전... 당항만 둘레길 바로 앞이라 멀리 가지 않아도 멋진 경치를 감상하며 산책하고 소화시키며 즐거운 주말을 보낸 맑음입니다 경남 고성군 회화면 당항길 154-12,2021. 4. 27.
[경남] 별빛 여행에 독수리 체험까지…경남 색다른 관광콘텐츠 최다 선정,"이번 공모는 지역 관광 활성화를 위해 생태녹색관광 육성, 걷기여행길 활성화 프로그램 운영, 산업관광 육성, 특화 레저 스포츠관광 활성화 등 총 4개 분야로 추진됐다. 경남은 생태녹색관광 육성 분야에 고성군의 '고성에서 몽골까지, 날아라 고성 독수리', 창원시의 '진해 경화역에 내린 별빛...",2021. 1. 27.
고성-통영짬뽕,고성 통영짬뽐 경남 고성군 회화면 당항길 154-12 매일 11:00 - 20:00브레이크타임없습니다 한달에두번 랜덤휴무 하루전공지합니다... 고성에 여행가시거나 근처사신다면 한번쯤 방문해도 좋을 식당인거 같아요 원래 웨이팅이 있는 곳이라 했는데 제가 간날은 비가 많이 오는 날이라 웨이팅 없이 바로...,2021. 7. 7.
경남 고성 가볼만한곳:) 수국 가득한 만화방초 개화상황은?,바로 경남 고성에 있는 만화방초입니다. 고성군 거류면에 위치한 만화방초는 작은 식물원입니다. 편백나무숲을 비롯해 다양한 수목을 가꾸고... 경남 고성 만화방초로 수국여행을 준비하시는 분들은 개화상태가 가장 궁금하실텐데요. 위에서 보신 것처럼 수국축제가 거의 끝나가는 시점인데도...,2021. 7. 2.
"경남 고성 소을비포진성, 통영 이순신공원 방문!",뵈러 경남 고성과 통영을 다녀왔어요! 산소에가서 인사드리고 한 바퀴 둘러보았어요:D 고성 소을비포진성 경상남도 고성군 하일면 동화리 398-4... 앞에 풍경은 바닷가가 보이는 풍경인데 시원하게 뚫려 있어서 감탄만 하다가 사진은 찍지 않았네요ㅠ 아쉬워요 경남 고성으로 여행오시면 혹시...,2021. 10. 3.
강원도 고성군 리조트시설 예정공사 지질조사 용역 완료 및 강원도 지역 지질조사...,"경상남도 고성군과 한글 명칭이 동일합니다. 그래서 고성을 이야기 할 때는 강원도 고성인지 경남 고성인지를 재차 물어보게 됩니다. 경남 고성은... 이 시기에 고성, 속초, 양양, 강릉, 동해, 삼척까지 여행을 많이 다녔던 기억이 나네요. 아이들이 초등학교도 가가 전 이었습니다. 제게 2번의...",2021. 6. 27.
병풍바위전망대 가는 길 따라 자박자박 걸어요.,준비물은 편안한 옷차림과 텀블러에 담은 물 한 통이면 충분할 듯합니다. 이상은 병풍바위 전망대 주변 탐방로를 다녀온 소식 전해봅니다. #경남고성군 #경남고성가볼만한곳 #병풍바위 #병풍바위전망대 #경남고성_스카이워크 #맥전포항 #입암마을쉼터 #경남고성군_걷기좋은길 #경남고성군언택트여행,2021. 4. 19.
[고성 갯장어 요리 맛집] 주말여행 산이 좋다2 29회 고성 구절산편,"주말여행 산이 좋다2 29회 고성 구절산편에서 방문했던 갯장어회, 갯장어 샤브샤브 요리 맛집 [군령포 하모자연산 횟집] 경남 고성군 삼산면 두포리 28-5 (두포 5길 426) ☎ 055-672-2195 고성 한산 마리나 리조트 경남 고성군에는 구절산(559m)은 벽방산(650m) 거류산(571m)의 3대...",2020. 10. 26.
"[경남 고성] 공룡이 살았던 흔적 : 상족암 군립공원(+물때,주차 꿀팁방출)","빠른 종식을 위해서는 거리두기,마스크쓰기 등을 통해 여행자제를 해야하지만 피로의 누적이 지속되다 보니, 답답함도 있고 해서 마스크를 잘... 제전마을 주차장 : 경남 고성군 하이면 덕명4길 39-53 →제전마을 주차장은 주차요금을 받아요. (카드불가, 현금2,000원) → 해식동굴까지의 위치가 가장...",2021. 5. 12.
[경남/고성] 바다가 보이는 뷰 맛집 카페 :: 카페도어스,#국내여행 #고성카페 #경남고성 #경남고성카페 #오션뷰 #바다뷰 #바다가보이는카페 #고성카페도어스 #도어스 #카페도어스 #스쳐지나감 #사람폭발... ㅎㅎ 고성군 홈페이지에서 볼 수 있을거 같은?.. 이렇게 인기가 있을지 모르고 왔는데 생각보다 인기가 좋아서 카페 사진만 찍고 마시진 못하고...,2020. 8. 9.
나만의 정원 같은 고성 상리연꽃연못,#상리연꽃연못 #연꽃연못 #상리면 #봄산책 #봄나들이 #가족나들이하기좋은곳 #고성가족나들이하기좋은곳 #경남가족나들이하기좋은곳 #봄풍경 #산책 #힐링 #고성 #고성군 #고성가볼만한곳 #고성여행 #고성관광 #고성산책하기좋은곳 #경남 #경남여행 #경남관광 #경남가볼만한곳 #경남산책하기좋은곳,2021. 5. 21.
지친 마음에 시원한 숨결을 불어 넣다 – 고성 대가저수지,#대가저수지 #대가연꽃공원 #생태탐방로 #제정구기념관 #연꽃연못 #대가면 #여름산책 #여름나들이 #가족나들이하기좋은곳 #고성가족나들이하기좋은곳 #경남가족나들이하기좋은곳 #여름풍경 #산책 #힐링 #고성 #고성군 #고성가볼만한곳 #고성여행 #고성관광 #고성산책하기좋은곳 #경남 #경남여행...,2021. 6. 18.
"경남 고성 상족암, 공룡발자국 화석 산지","""경남 고성 상족암, 공룡발자국 화석 산지"" 모처럼 경상남도 고성여행을 하면서 군 전역에 걸쳐 약 5,000개의 공룡발자국 화석이 발견되어 미국의 콜로라도와 아르헨티나 서부해안과 함께 세계 3대 공룡발자국 화석산지로 알려진 경상남도 고성군 #상족암 군립공원을 찾았습니다 경남 고성 상족암은...",2021. 7. 22.
"고성의 眞산, 거류산에 가면~~",그러다 문득 너무 답답하다 느껴진다면 거류산을 걸어보시기를 추천드립니다. #경남고성군 #경남고성등산 #경남고성가볼만한곳 #경남고성여행 #거류산 #거류산성 #화당리달팽이논 #거류산전망대 #거북바위 #거류산숲속놀이터 #엄홍길기념,2021. 8. 9.
"경남 바닷가 추천 여행지 가족 펜션 - 고성 전원주택 3층 넓은 투룸과 다락방, 테라스와...","공룡엑스포로 유명한 경남 고성군은 공룡박물관과 하이면 상족암 바닷가는 여름철에 아이들과 많이 찾는 관광지이며, 당황포 관광지는... #경남바닷가펜션 #추천여행지 #바닷가가족펜션 #경남추천여행지 #고성가족펜션 경남 바닷가 추천 여행지 - 고성 가족 펜션 고성읍과 도보거리에 있는...",2020. 7. 5.
[경남 고성] (휴가 3일차) 고성가볼만곳... 해지개해안둘레길/해지개다리/산책/고성여행,오늘은 아버지랑 둘이서 데이트를 했답니다^^ 오늘은 경남 고성군 에서 경치가 좋기로 유명한 Best 3!! 에 다녀왔어요! 1.고성남산공원 2.해지개다리 3.상족암 오랜만의 여행이라 아버지와 강행군을 했어요 ㅋㅋ 오늘 다녀온 <고성 명소 Bset 3> 를 소개해드릴게요! 고성 남산공원 경남 고성군 고성읍...,2020. 3. 14.
경남 고성 여행) 상족암군립공원 _물때&주차&포토존 꿀팁,"경남 고성에서 가장 핫플이라고해도 과언이 아닌 상족암군립공원 핫하다는 말을 듣고 방문했던 곳 생각보다 너무 좋아가지그 후기올려보리기 고성 상족암군립공원 경남 고성군 하이면 덕명5길 42-23 매일 00:00 - 24:00 입장료 무료 주차 승용차 2,000 경남 고성 가볼만한곳 고성 명소 고성 데이트하기...",2020. 8. 24.
"경남 고성 그레이스정원의 수국, 만개하면 너무 아름답겠다 !","210622 경남 고성 그레이스정원 날씨는 ☁ 경남 고성 그레이스정원 영입시간 : 9:00~18:00 (마지막 매표 17:00) 위치 : 경남 고성군 상리면 삼상로 1312-71 주차 : 정원 내 주차장 있음 입장료 : 성인 5,000원 /중고생, 어린이, 경로, 장애인, 국가유공자 할인 이틀 전 남해, 진주에 여행을 다녀왔어요 ! 남해...",2021. 6. 25.
경남 고성 갈모봉산림욕장,"경남 고성군 고성읍 이당리 신록, 새로운 초록이 시작되는 때 연둣빛 숲으로 가자. 갈모봉산림욕장은 임야 70여 ha에 편백, 삼나무 등이... (여행작가) #경남여행 #경남관광 #경남가볼만한곳 #고성여행 #고성관광 #고성가볼만한곳 #갈모봉산림욕장 #고성학림최영덕씨고가 #학동마을...",2021. 9. 17.
고성 공룡박물관 상족암 바닷가에서 본 공룡발자국,"도착했어요 여행지였던 거제와 가깝기도 했고 아이들이 공룡을 좋아하다 보니 이곳은 아이들과 꼭 가보고 싶었습니다! 주소 : 경남 고성군 하이면 덕명리 자란만로 618 전화번호 : 055-670-4451 9시~ 6시 (5시까지 입장, 월요일 휴무) 근데 5월에 휴가 계획을 세울 때 보니 작년부터 계속 휴관 중이더라고요...",2021. 7. 18.
[경남]고성 당일치기 여행 - ④상족암 군립 공원 / 동굴 인생샷 꿀팁,"경남 고성군 하이면 덕명5길 42-23 밥도 먹고 후식도 먹었으니 사부작사부작 움직이구 산책하러~ 저희는 제전 주차장에 주차를 했는데요~ 주차비 2000원! 주차장에서 상족암까지 느린 걸음으로 30분 정도 소요돼요 다른 블로그 글들 보니 경상남도 청소년 수련원 주차장이나, 공룡 박물관 주차장에...",2020. 8. 27.
"고성만화방초, 경남수국명소, 경남고성가볼만한곳, 올해는 6월말쯤...",이쁜주야네는 저번주 6월 19일 갑작스럽게 ㅋㅋㅋ 고성여행을 다녀오게 되었네요~ 경남고성군 거루면 은황길 82-91 만화방초 이용시간: 오전9시~오후6시까지(하절기) 가는길에 #경남고성가볼만한곳 #고성가볼만한곳 #경남고성데이트코스 ....등 검색하다보니 고성수국명소 만화방초!...,2021. 6. 22.
경남 고성 어린이 가볼만한곳 공룡박물관,안녕하세요 경남 고성 어린이 가볼만한곳 공룡박물관을 이번 여름 시원한 바다의 경치도 즐기고 비교적 팬데믹과 별 상관이 없는 여행을 하셨으면... 경상남도 고성군 관광지가 이렇게 알 수 있도록 정리가 되어 있어 어떤 곳이 있나 살펴보았는데 생각보다 훨씬 많은 곳을 알리고 있었는데 이번에 더...,2021. 7. 19.
경남 고성 오호락 풀빌라 펜션 럭셔리패밀리풀빌라 후기 / 경남 풀빌라 추천 / 경남 독채...,"오랜만에 여행갔다 왔어요 기분내기 위해 풀빌라펜션을 찾던 중 친구가 방문했던 풀빌라 펜션 중 좋았던 곳으로 고성 오호락 풀빌라 펜션을 추천해서 여기로 방문 했었답니다 주소 : 경남 고성군 동해면 동해로 1016-14 / 고성군 동해면 내곡리 산93-10 전화번호 : 055-672-7007 체크인 - 오후3시, 체크아웃...",2021. 6. 27.
경남고성맛집 / 얼큰이 손 칼국수,경남고성칼국수 맛집 / 얼큰이 손 칼국수 ***-***-**** 경남 고성군 고성읍 남포로 139-6 영업시간 / 오전 10:30 ~ 21:30 주차장 / 가게 앞 공영주차 선 남편이랑 나들이겸 놀러온 진주&고성 고성부터 스타또 하기 전에 이제 배채우고 여행 시작해야함..ㅎㅎㅎㅎ 거제에 있는 버섯칼국수랑 비슷한 곳 이여서...,2021. 6. 1.
경남 고성시장 맛집 본토대가,경남 고성시장 맛집 본토대가 안녕하세요. 오늘은 통영 여행을 떠나면서 근처 고성에 들렸는데요. 여행을 다니면서 꼭 빠질 수가 없는 것이 먹는게... 경남 본토대가 경남 고성군 고성읍 성내로 144번 길 17 매일 11:00 - 20:00 재료 소진 시 조기 마감 전화번호: 055- 672 - 4224 본토대가 입구에...,2021. 5. 29.
경남 고성 그레이스정원&상족암군립공원 여행,09(토) ● 어디로 : 고성군 상리면 연꽃공원~그레이스정원~하이면 학림마을 돌담길~상족암군립공원 ● 누구랑 : 고향 동무 08:30 장유2동에서 출발... ~ 《오늘의 에행》 좋은 추억이 많은 어릴적 동무와 함께한 여행이라 즐거움은 제곱 나태주 시집 '꽃을 보듯 너를 본다'에서 추억 어디라 없이...,2021. 10. 10.
공부하고 체험하는 고성 한달살이 참가자를 모집합니다!,"체류형 여행 분위기 확산을 위해! 경남 고성군에서는 고성 한달살이 참가자를 아래와 같이 모집하오니, 많은 관심과 신청을 부탁드립니다. 사업내용 ❍여행기간 : 2021. 7. 5. ~ 8. 31. 중 3~30일간(참가자 선택 / 2박 이상 29박 이하) ❍참여대상 : -공고일 기준 경남지역 외 거주자(만 19세 이상)...",2021. 6. 18.
<고성여행]> 경남고성가볼만한곳 상족암 사진찍기좋은곳 인생샷찍기,상족암 군립공원 경상남도 고성군 하이면 덕명리 해안에 있다 코르나로 19로 집콕이 많아져서 여행갔다온곳 정리하기 바쁘다 3월에 한참 코르나... 살아요 예전에는 주차비가 없는데 이젠 주차비가 있는거 같아요 #경남 #고성 #상족암 #동굴샷 #뷰맛집 #국내여행 #고성여행 #공룡발자국 #인스타핫플,2020. 12. 22.
"안전한 경남 여행, 경남 안심나들이 10선│설날 가볼만한곳, 경남 비대면 여행, 언택트...",[8] 고성 당항포관광지 © 고성군 당항포관광지는 임진왜란 당시 충무공 이순신 장군이 두 차례 걸쳐 왜선을 전멸시킨 전승지로 당항포해전관과... 운영시간 10:00 ~ 21:00 / 설날 당일 13:00 ~ 21:00 철저한 방역으로 도민이 안심하고 여행할 수 있는 경남 안심나들이 10선이었습니다! *마스크 착용 및...,2021. 2. 12.
