header,contents,date
경남 진해시의여행코스,"봄이 아니어도 친하게 진해,감성 충만 진해여행코스 ""진해는 벚꽃 보러만 가야 한다"" 말도 안 되는 생각말고 당장 진해로 떠나보세요 언제나 감성충만한 진해 여행. 벽화가 그려진 골목길 소사동 마을 진해 구석에 이렇게 복고 감성이 터지는 마을이 있다나요.손으로 정성 들여 쓴 간판과 낡은...",2020. 3. 2.
경남 진해시 용원동 소나타 3채널 블랙박스 출장설치,관광버스 여행 그러면 머리에 떠오르는 이미지가 있으시죠. 그리고 주차를 해 놓았을때 누군가 물피를 주고 도주를 하는 것을 잡고 싶어서 입니다. 물론 사고를 대비한 것도 있지만.... 4채널은 주로 대형 화물차의 사각지대가 많다보니 다양한 각도로 찍어서 사고에 대비하시는 것 같아요. 이유야...,2021. 4. 5.
[경남창원마산여행]코로나19 없던 해양드라마세트장. 벌써 일년.,"겸사겸사 여행도 하게 되었다. 마산시로 알고 있었는데 이제는 창원시의 마산합포구더라. . 2010년 3월 2일 국회에서 마산시, 진해시, 창원시를 창원시로 통합하는 법안이 통과됨에 따라 같은 해 7월 1일 통합 창원시가 출범했다고 한다. . 국내에 안가본 곳 없다고 생각한 필자였는데 경남 창원시...",2020. 12. 27.
경남 창원 여행 가볼만한곳 마산 저도 연육교 콰이강의 다리,"통합 창원시가 되면서 기존의 창원시, 마산시, 진해시가 합쳐져서 거대한 광역시 정도의 시가 되버린 상태랍니다. 하여간 경남 창원 여행 가볼만한곳 장소로 12가지를 뽑고 있어서 찍어봤네요. 12가지 장소는 아래에서 다시 설명하기로 하고 다리로 이동~~~ 다리입구쪽 모습을 보면 이런 모습인데...",2021. 5. 10.
[경남 창원 / 창원 랜선 여행] 바다와 벽화를 한눈에! 장옥거리 벽화마을,아마 전국에서 제일 유명한 벽화마을이라고 하면 우리 경남 통영의 ‘동피랑’이라고 할 수 있겠습니다. 동피랑에 있는 벽화 중 제일 유명한... 지금은 통합 창원시가 되었지만 그전의 진해시는 벚꽃과 해군으로 유명했습니다. 해군이 유명하다는 것은 바다를 끼고 있다는 말이고 바다 하면...,2021. 7. 27.
경남여행_진해_가볼만한 곳_안민고개_전망대,한눈에 진해시와 진해만이 보이는 풍!경! 크~넘나 좋구먼~ 아! 그리고 예전에 야경사진을 찍은 것도 덤으로 보여드릴게요 야경사진은 한참 추운 겨울에 찍었던 거에요 창원에서 가족과 연인 데이트로 드라이브나 산책을 하고 싶은 분들은 낮에! 분위기 있는 야경을 한눈에 보고싶다 하시는 분들은...,2021. 8. 20.
<17> 할아버지 수소차로 가보는 신박나는 한국 섬 여행,"행정 구역상으로는 광양시와 경남 하동군의 경계 부근에 있으며, 배알도라는 이름은 해수욕장 건너편의 망덕산(광양시 진월면 망덕리 소재)을... 할머니 무덤 상상 설계도 : 인천 강화군 하점면 부근리 북방식 고인돌 무덤 ■ 마시멜로 - 돌시멜로 할머니와 윤찬이의 말 잇기 게임은 여행 내내...",2021. 10. 5.
"[창원여행정보] 국내여행 경남 진해 ""벚꽃 축제 Cherry Blossom"" 군항제 시즌 정보 와...","[창원여행정보] 국내여행 경남 진해 ""벚꽃 축제 Cherry Blossom"" 군항제 시즌 정보 와 사진 & 영상으로 그때를 추억해 봅니다. 경남 진해 벚콫 경남... 경남 진해 시내에서 바라보면 남동쪽 산줄기에 볼록 솟아난 산봉우리가 가장 눈에 띕니다. 진해시 자은동과 웅천 1동에 걸쳐 있는 이 산의 이름은...",2021. 4. 19.
경남창원 산책길 추천 / 뚜벅뚜벅 생각없이 걷기좋은곳 추천 BEST 3,"진해해양공원 / 우도보도교 우도는 경남 창원시 진해구 명동에 딸린 섬으로 진해시 남단으로 1.2km 해상에 위치하고 있어요. 총 3개의 방파제가... 분수쇼도 있다고합니다, 코로나로 어떻게 될진 모르겠지만 분수쇼를 보면 마음까지 시원해질 것 같아요! 위치안내 ⓒ 소담이의 사계절 여행 기록장그",2021. 7. 7.
"[착한여행] 과거와 현재, 미래가 공존하는 도시, 창원 여행지 맛집 추천!","창원은 마산시와 진해시가 통합되며 다양한 보물을 지니게 되었는데요, 도시와 바다, 섬과 항구, 새하얀 벚꽃과 푸르른 자연이 공존하는 여행지... 경남의 중추 도시 창원, 최대 국화 축제 ‘마산국화축제’와 사진작가들이 즐겨 찾는 국내 명소인 ‘진해내수면환경생태공원’도 가을에 방문하기...",2021. 9. 20.
"경남 가볼만한곳, 진해 장복산(창원 편백 치유의숲), 함안 입곡군립공원 다녀왔어요.","1시간이 채 안되는 시간에 잠깐 들린거라 자세히는 소개해 드리지 못하지만 경남 진해나 함안에 가시게 되면 한번쯤 가볼만한곳 같아서 소개할게요. 지금은 진해가 창원시 진해구로 되었죠? 제가 학교다닐때는 창원시, 마산시,진해시 이렇게 되었었는데 지금은 창원시로 다 통합되었죠. 벌써 20년전...",2021. 5. 24.
준 주거 주택 2억 6000만 원 진해시 경화동,"진해시 경화동 주택 경화동 준 주거 주택 진해 충장로 주택 우리나라에서 매년 4월이 되면, 전국적으로 벚꽃 구경과 놀이가 시작됩니다 벚꽃이 피면, 벚꽃 열차나 벚꽃 관광버스를 타고 벚꽃의 명소로 여행을 떠나기도 합니다 계속되는 코로나19로 벚꽃 놀이는 다음으로 미루어 두고 동네에 예쁘게...",2021. 3. 31.
"제주목 관아, 관덕정 여행 : 조선시대 제주 지방 통치의 중심지","■ 여행일자 : 2020년 4월 22일 ■ 여행장소 : 제주특별자치도 제주시 (삼도2동) 구글맵으로 보는 여행 경로 아래 구글 지도에서 "" 3일차 [ 04.22 ]... 제가 사는 경남 창원의 '진해' (舊 진해시)와는 큰 관련은 없음직하고, 다만 제주도도 섬인지라 수군의 역할이 중대했을 터이니 '바다(海)를 제압...",2021. 10. 8.
창원 여행/가볼만한곳 마산 가고파 꼬부랑길 벽화마을,주변에 있는 창동 예술촌과 함께 창원 여행 연계 여행지로 불리우는 곳이고요. 일전에는 마산시로 주소지가 되어 있었지만 얼마 전 진해시와... 그럼 즐거운 도보 여행 되시길 바라며 마산 가볼만한곳 가고파 꼬부랑길 벽화마을에서 유쾌한 시간 보내시길 바랍니다. 위치 : 경남 창원시 마산합포구...,2021. 9. 20.
"단 돈 만원으로 떠나는 진영, 추억의 철도여행 (가성비 | 힐링코스)","두고 있어 경기와 충남, 경남 곳곳에서도 맛볼 수 있지만, 역사공원 근처 가성비 좋은 식당을 찾으신다면 여기가 제격입니다. 얼크니손칼국수 - 위치 : 경남 진해시 진영읍 진영산복로 198 - 가격 : (기본메뉴) 8,000원 / (왕만두) 5,000원 등 - 개방시간 : (매일) 10:30 ~ 21:30 <Google Maps> 진영 철도여행 코스",2021. 9. 6.
경남 창원 가볼만한곳 : 진해 내수면 환경 생태공원,"그 공원들은 극히 일부를 제외하고 가볼만한곳 으로 방문가치가 떨어지는 부적격 여행지들 인데요 경남 창원에도 공원이 참 많더군요 창원에... 좋아 진해 시민분들이 이른 아침 운동삼아 많이 나오시더라구요 저수지에 참붕어, 잉어, 메기, 뱀장어, 붕어, 줄새우, 비단잉어 뭐 이런 물고기들 살고...",2020. 8. 2.
신비의 바다를 걷다 - 우도,"그 바다 이야기를 가지고 왔습니다 - 우도(牛島)라고 하면, 흔히들 경남 진해시와 통영시, 전남 완도, 충남 서산, 그리고 제주도를 떠올리시겠지만... 1470 청년 피디들은 직접 발로 뛰며 직접 계산합니다 누구의 사주를 받거나 금전을 요구하지 않습니다 #전남 #고흥 #고흥여행 #고흥관광 #남해...",2020. 6. 18.
창원추천 명소 삼포노래비/삼포로가는길/7월도보여행/21.7.25(일) 방문,"3.'2008년 1월 당시 진해시에서는 경남 진해시 웅천동 삼포마을 도로가에 노래비를 세워 전면(前面)에 노래의 가사를 새겼다. 4.삼포마을은 어디에서도 느껴보기 어려운편안함과 따뜻함이 묻어나는 곳이다. 작사·작곡가 이혜민은 평소 서정적인 분위기의 음악을 주로 만들었는데, 확 트인 바다와...",2021. 7. 27.
경남 창원여행 진해 수치마을 낚시꾼들이 많이 들리는 어항,당시는 이곳이 경상남도 진해시였고 내가 처음으로 CC한 오빠의 고향이기도 했다. 고등학교 때 펜팔하던 오빠 때문에 경화역까지 가보기는 했지만 진해 곳곳을 다닌 것에는 CC였던 오빠덕이 컸다. 자기가 제일 좋아하는 장소라며 데려온 것이 바로 이 곳 수치마을. 그 때도 저 배가 있었던 것 같은데...,2020. 8. 18.
창원 여행 가볼만한곳 : 진해 드림파크 목재문화 체험장,진해 목재문화 체험장은 아는 사람이 거의 없을정도로 존재감 없는 경남 창원에 있는 관광지로 창원 가볼만한곳 으로 쪼메 알려진 진해 드림파크... 창원 여행시 누구나 찾는 진해 가볼만한곳 으로 우뚝 서기를 바래봅니다 넌 그럴 자격이 충분해~ 멀리 진해만 보이는 진해 시내 물의 정원 너머로...,2021. 6. 10.
진해여행 - 모노레일카를 타고 진해 제황산공원에 오르다.,음 .. 상승에 말려있어서하는 거예요? 웃음 진해 벚꽃이 삐루테 오면 더 좋았는데 .. 조금 한적한이시기에 제 팬 산 공원을 발견하고도 참 좋네요. 진해 시가지의 중심부에서 편안하게 산책 하 고 여유를 찾을 수있는 제 팬 산 공원이었습니다 ~ 경남 진해시 제 팬 샌드 프로그램,2021. 5. 8.
진해여행 - 진해 마진터널 길과 안민고개의 벚꽃터널에서 멋진 드라이브를~,"부근에는 진해시의 전경을 조망할 수있는 전망대가 있고, 시원한 바람을 맞으며 진해시 전경과 바다를 볼 수 있습니다. ... 진해 벚꽃을 아직 본 사람 것이나. 진해 안민 고개와 마진 터널의 환상적인 벚꽃 터널을보고 싶은 분은 얼른 일주일 가기 전에 진해에 들러보세요 ~ 삿よ ~ ^^ 경남 진해시 굔화돈",2021. 5. 14.
진해여행 - 진해 경화역의 왕 벚꽃터널에서 봄을 느껴보세요~,그분을 피해 열심히 찍어 봤다. 좋아하는 사진을 구원는 어려웠 지요 .. ^^; 그 기차를 타고 진해를 방문한 모든 분들이 진해 벚꽃 잘 돌아 가셨 기 ~ ^^ ... 올해 진해 벚꽃은 지금 꽃의 잎을 튀어 시작 했어요 ~ 일요일 오전에는 벚꽃 비가 내리는 모습을 볼 수있는 것 같습니다. ^^ 경남 진해시 굔화돈,2021. 5. 27.
주경업,경남 진해시(현 창원시 진해구) 웅천동에서 4남매 맏이로 태어났다. 어릴 땐 부유했다. 농토도 많았고 집도 네 채나 됐다. 하지만 할아버지와 그... 배수진을 친 게 바로 전국을 누비는 스케치 여행이었다. 일종의 주경업식 '만행'이었다. 그 흐름이 20여년 이어진다. 빈 가슴을 채워줄 뭔가가...,2021. 9. 28.
진해여행 - 진해 밤 벚꽃 구경 하시겠어요?,"^^; ... 아마 이번 일요일에 비가 있으면 벚꽃이 많이 떨어 훌륭하게 핀 벚꽃을 보는 것은 곤란 해요. 그럼 .. 이번 진해 벚꽃은 바로 오늘, 토요일은 그냥 좋습니다 ~ 사람도. 자동차 많은 조금 힘들지도 모릅니다. 제대로 된 꽃놀이하고 싶은 분은 여기 진해 벚꽃을 보러 오세요 ~ ^^ 경남 진해시 요죠와돈",2021. 5. 17.
한국의 아름다운 길 100선. 무주 구천동 국도 37호선 드라이브 코스로 추천,"문경새재 여행 008 문경새재 과거길 경북 문경시 문경읍 상초리 문경새재 1관문 - 3관문 009 백수해안도로 전남 영광군 백수읍 대전리 ~ 구수리 (국도 77호선) 확 트인 바다의 해상공원도로. 010 진해 벚꽃길 경남 진해시 시민회관 ~ 북원로타리 (대로 3-1, 대천로) 011 명량대첩의 얼이 살아있는...",2021. 8. 21.
시간이 멈춘듯한 진해 소사마을! 감성 터지는 과거 여행,감성 터지는 과거 여행 안녕하세요. 벌써 수요일입니다. 오늘은 조용하게 걷기 좋은 곳 소개해 드릴게요~ 예전 경남 진해시에서 경남 창원시 진해구로 바뀐 진해에 위치한 소사마을입니다. 딱히 입구랄 것 없이 여긴가?? 하고 둘러보다 보면 이렇게 평화로운 벽화가 그려져 있어요. 다 옛날 건물이다...,2020. 1. 8.
[경남캠핑장추천]창원안녕오토캠핑장,핫 하다던 경남 창원(마산)안녕오토캠핑장!! 주말은 잡기 힘들어서 평일 퇴근박 ㅠㅠ 짧은시간 알차게 놀다가렵니당 17번 사이트 입니다... 분위기 좋아서 랜턴 2개끄고 바다보기 여기서 거가대교도 보이고 진해시도 보이고 불빛이 이뻤어요 무슨날인지 달이 빨갛게 떠있어서 더 이뻤어요 아침에...,2021. 7. 2.
반평생 향토사학 외길 걷는 주경업,1994년부터 26년간 부산민학회를 이끌며 130여회 전국 각처로 전통문화 답사 여행을 떠났고 매년 백서 같은 책을 펴냈다. 1972년 한국 민속학의... 경남 진해시(현 창원시 진해구) 웅천동에서 4남매 맏이로 태어났다. 어릴 땐 부유했다. 농토도 많았고 집도 네 채나 됐다. 하지만 할아버지와 그 형제들의...,2021. 10. 7.
"창원진해비전시티우방아이유쉘 분양가, 모델하우스 찾아서 쑹! 진해아파트","부산, 경남으로 여행을 갔었는데 대박 우리 일행은 마스크를 벗어던지고 행복한 여행을 했어요 한동안 경상도 쪽으로 삶의 터전을 옮겨볼까... 신항만인 진해 신항만 창원시 진해구 제덕만 일원에 건립한다는 건설 기본계획을 고시했는데요 진해신항만은 13조 6억원의 예산 규모로 초대형선박...",2020. 5. 19.
"강은철의 ""삼포로 가는 길"" 노래비 이야기","건립기관 : 진해시 가요비 전면에 새겨진 노래가사 노래비를 세우면서 1970년대 후반 8월의 어느 한 여름날, 여행을 떠나 긴 산길을 따라 거닐던... 2008년 1월 당시 진해시에서는 경남 진해시 웅천동 삼포마을 도로가에 노래비를 세워 전면(前面)에 노래의 가사를 새겼으며, 누구나 이 노래를 들을 수...",2021. 6. 6.
[진해여행] 무인도 - 소쿠리섬,진해시에도 섬이 많다. 그기에도 무인도가 많다. 작아서 사람이 살수 없는 작은크기도 있고~~ 원래는 사람이 살았는데 지금은 사람이 살지않는 #무인도 도 있다. #진해무인도 #진해소쿠리섬 #소쿠리섬 #진해해양공원 #진해명동도선장 #명동도선장 #진해캠핑 #진해캠핑장 #경남캠핑장 #진해짚라인...,2021. 9. 20.
[LEVEL 15. 워라밸 맛집] 온라인으로 떠나는 전국 워라밸 맛집 여행,경상도 (주)해드림푸드 경남 진해시 진례면 고모로 248 (출처: 부산관광공사) 따뜻한 부산 바다가 있는 경상도로 왔습니다~! 이번에 소개할 기업은 경남 진해시에 있는 (주)해드림푸드인데요 근무혁신 우수기업 평가에서 A등급을 받은 기업입니다! 축산물을 가공하고 저장하는 농업회사법인으로...,2020. 11. 29.
김어준 부친상 와이프 인정옥 작가 나이•직업•학력•가족•관계•고향•프로필 전...,⭕️ 김어준 나이 학력 고향 가족 관계 프로필 출생 1968년 12월 4일 (52세) 경상남도 진해시 (現 경상남도 창원시 진해구) 거주지 서울특별시 성북구... 《환상여행》과 《테마게임》의 작가로 활동했다. 본격적으로 드라마의 극본을 쓰기 시작한 것은 1998년 방영된 MBC의 《해바라기》이다. 2002년...,2021. 6. 14.
서울에서 제주까지 걷고 싶은 길 200,섬 여행의 모든 것 41 인천 옹진군 자월도 무인도에서의 표류를 꿈꾸다 42 인천 옹진군 장봉도 붉은 태양이 사라지는 낙조의 명소 43 인천 옹진군... 52 경남 진해시 행암해안도로 노랫말이 절로 떠오르는 바닷길 53 경남 남해군 창선도 갓 잡아 올린 멸치 맛에 취하다 54 경남 남해군 남해도...,2021. 7. 10.
부산 울산 경남 업체정보입니다.,"경남 24시 독서실, 진주시 독서실, 진주시 경남 24시 독서실 2012. 9. 13. 러빙의상실, 밀양시 의상실, 밀양시 양장점, 밀양시 러빙의상실 2012. 9.... 춘천 꼬꼬 닭갈비, 진해시 닭갈비, 진해시 춘천꼬꼬닭갈비, 진해시 석동 닭갈비, 진해시 막국수, 진해시 춘천닭갈비 2012. 9. 12. 박영희...",2021. 8. 24.
시인최선 행복칼럼,"힘들고 슬픈 일들을 만나면 그들과 대화하고 여행하며 마음의 안정을 찾는다. 우리의 삶에 활력을 불어 넣어 주는 친우들이 있어 행복하다.... 그는 6.25 한국전쟁 3년 후 1956년 9월에 경남 진해시에서 태어났다. 조부께서는 일제 강점기에 나라를 사랑하여 독립을 위해 희생하셨고, 아버지 최영섭...",2021. 5. 17.
"김해봉하마을 ""사람사는 세상""",#김해가볼만한곳 #김해 #김해봉하마을 #gimhae #경남여행 #경남김해 #노무현대통령 #사람사는세상 #노무현대통령생가 #경남김해여행지 #경남김해가볼만한곳 바람게비 와 사람사는 세상 김해 봉하마을 故 노무현 대통령 생가 및 묘소 경남 진해시 진영읍 봉하로 103-1 경남 진해시 진영읍 본산리 94-1...,2020. 10. 29.
진해내수면환경생태공원 진해가볼만한곳,"2008년 진해시에서 생태관찰로와 관찰데크 등 유수지 주변 산책로의 자연환경을 보전하기 위하여, 면적 8만3,897㎡에 이르는 환경공원으로... 회전이 잘돼서 해산물이 싱싱하고 가격도 저렴해서 많은 분들이 찾는 곳이랍니다~ (동부회센터:경남 창원시 진해구 천자로 5) #경남여행#진해언텍트...",2020. 11. 19.
바처구처의 주유천하 1.024.창원시 마창대교,"마산시, 진해시와 김해군의 일부를 하나의 도시로 통합하여 거대한 도시가 된 것이다. 행정구역은 의창구·성산구·마산합포구·마산회원구·진해구의 5개 구에 2읍 6면 54동으로 이루어져 있다. 1983년 부산에 소재하고 있던 경남도청이 창원으로 이전했고 그에 따라 산업 도시와 행정 중심 도시를...",2020. 11. 7.
아이와 가볼만한곳 추천 진해 대광사,"경남 진해여행을 왔다면 잠시 머물러 가볼만한 곳, 부처님 오신 날, 찾았다 힐링하고 돌아온 진해 대광사. 이 곳을 알게 된 건, 2주 전쯤 김해에 사는... 단아하고 아름다운 사찰의 대광사의 역사를 잠깐 설명하자면, 서기 1930년에 진해시 화천동에 포교당으로 건립되 대광사 역사가 시작되었고 1945년...",2021. 5. 20.
진해 가볼만한곳 진해 용원항 수산물 재래시장,진해 가 볼만한 곳 진해 용원항 수산물 재래시장 경남 진해시는 지금은 창원시와 합쳐져서 공식명칭은 경남 창원시 진해구로 되어 있지요 ~ 하지만... 구경도 하고 싱싱한 회 한접시 하시는 건 어떠실까요 ? #진해여행 #진해가볼만한곳 #진해수산물어시장 #진해용원항 #진해용원수산물재래시장 #용원신항,2020. 11. 13.
창원시 진해구 해양공원,행정구역상 경남 #창원시 #진해구 라고 불리지만 내겐 진해시가 더 어울리는 명칭이다. ㅎ 어릴적 해군장교로 복무하신 아버님 덕분에 유년기 시절... 천천히 도보로 여행을 즐길 수도 있고 자전거를 이용하여 다닐 수도 있다. #에너지 #환경과학공원쪽으로 이동해보니 평화의 공원이 있고 유엔군...,2020. 9. 12.
용원cc 회원권이 있으면 넓은 페어웨이를 만나요,"인근 맛집도 많아서 정말 여행을 가는 느낌도 난답니다. 그렇다면 관련 시설 및 혜택 소개도 해드릴게요! 기본 개요 회사명 : 용원개발(주) 소재지... 11 규모 : 27홀 회원의 날 : 매월 첫째, 셋 째, 다섯째 주 일요일 정기 휴장 : 연중무휴 경남 진해시 용원동에 위치하고 있는 오늘의 대상지는 겨울에도...",2020. 6. 3.
세계 최대 벚꽃축제 진해군항제를 제대로 즐기는 방법,"경화역 경남의 벚꽃명소로 유명해진 경화역은 경남 창원시 진해구 경화동에 있는 작은 간이역으로 2006년부터 여객업무는 하지 않고, 성주사역과... 제황산공원 제황산공원은 진해시 중심으로 제황산에 조성된 시민공원으로 365개의 계단으로 정상에 서면 진해시와 바다를 한눈에 볼 수 있습니다....",2020. 2. 21.
"[국내여행가볼만한곳] 진해벚꽃) 여좌천,경화역","안녕하세요 국내여행 가 볼만 한곳으로 내천사가 진해시 여좌천,경화역을 소개합니다 자세한 부분은 아래를 클릭하세요 ↓↓↓↓↓↓↓(Click... 합니다 경남의 벚꽃명소로 유명해진 경화역은 경남 창원시 진해구 경화동에 있는 작은 간이역으로 2006년부터 여객업무는 하지 않고 있습니다...",2021. 3. 16.
"창원 진해 당일치기 여행 여좌천 로망스다리, 진해내수면환경생태공원 용지 호수, 카페...",진해시인 줄 알았거든요. 국내 여행하면서 여러 가지 배우게 되는 게 맞는 것 같고 우리나라에 대해서도 아직 모르는 게 많구나 하는 생각도 들어요. Changwon Jinhae 여좌천 주차는 여좌동 평지마을 공영주차장 여좌동 평지마을 공영주차장 주소 : 경남 창원시 진해구 태백동 68-6 주차 가능 시간 : 00...,2020. 6. 24.
진해 경화역 벚꽃만개 벚꽃여행 다녀왔어요.,"진해 경화역 찾아가는 길 : 경남 창원시 진해구 경화동 1200 경화역 이용시간 : 2020년 3월~4월 이용 불가능 1박 2일 촬영지로 잘 알려진 진해시... 다녀오고, 내년에 추억여행말고 직접 다녀가세요. 진해시에서 내년에는 더 멋진 진해군항제, 진해벚꽃축제를 준비한다고 하니 내년까지 기다려보아요.",2020. 3. 25.
"혼자여행 진해가볼만한곳 진해 웅천읍성,문화재,역사유적지,기념물15호","경상남도 진해시 성내동에 있는 산성으로, 조선 세종 21년(1439)년에 만들어진 것이다. 이곳은 1407년 일본과의 관계유지를 위한 목적으로 항구를... 국내여행 #역사 #진해역사 #경남기념물 #경남문화재 #진해관광 #진해산책 #창원여행 #진해여행추천 #진해 #웅천 #창원 #창원시 #야채농사베리알럽...",2020. 11. 22.
"창원 굴암산(해발 633m)!! 조망 100점, 편백나무숲길 200점.",오늘은 그 첫 번째 산山여행일로 경상남도 진해시(현 창원시)에 있는 굴암산을 찾았다. 산으로 떠난 여행 제1일차 산림청 숨은우리산 244 / 제219번째 탐방기 굴암산(경남 창원시) 굴암산(굽을屈 바위岩 뫼山) 경상남도창원시의 진해구 웅동1동에 소재한 산이다(고도 : 663m). 창원시와 김해시...,2020. 1. 22.
"삼국사기 제사6. 대사, 중사, 소사를 지내던 장소, 3산 5악","여담이지만, 서산의 해미읍성과, 상왕산 개심사, 서산 목장, 예산 수덕사 등를 엮어 일정을 잡으면, 수도권에서 당일치기 여행 코스로도 정말 좋은... 웅지(경남 진해시 웅산), 악발(경북 울진 부근), 우화(울산시 운암산), 삼기(경주 금곡산) 훼황(경주 일대), 고허(경주 일대), 가아악(충북 보은 부근)...",2021. 4. 16.
경상도 봉찍기 9th/거제 가라산 최단코스...조망이 썩~,"북쪽으로 진해시·마산시·고성군, 서쪽으로 통영시를 마주하고, 남·동쪽으로 남해를 굽어볼 수 있다. 부산 영도가 지척이고 갠 날은 쓰시마섬[對馬島]이 가물거릴 만큼 조망이 뛰어나다. 2020.04.07(화) 경남 봉찍기 9th 노자산에서 가라산 등산로 입구인 탑포마을까지 탑포마을입구 1.3키로...",2020. 4. 7.
창원 장거리이동 인천공항방역택시로 안심이동,"창원시는 기존의 창원시와 마산시,진해시가 통합하여 만들어진 경남의 대표 도시입니다. 김해,부산,밀양,창녕,함안,진주 고성,거제와 인접해 있어서 남해를 여행하실 때 함께 둘러보면 좋을것 같습니다. 코로나로 인해 4인이상 집합금지이니 단체여행은 힘들것 같고 우리가족끼리만 함께...",2021. 8. 9.
[선원항공 전문 취급]선원항공/운임이란?,진행하는 여행사를 말한다. 항공권을 직접 발권하는 것은 불가능하나 소비자가 요청한 항공권을 항공사나 BSP 여행사로부터 구입하여... 항공권 1% 마일리지 적립 제공 (기타 제휴 서류 필요) 청하투어 부산신항/공항점 경남 진해시 용재로 54-1 1층 TEL : 055-552-0500,2020. 3. 2.
