header,contents,date
(경남) 함안군과 하동군 여행,"이번엔 여행이라기보단 드라이브가 맞겠다. 함안군으로 찍은 곳은 말이산 고분군 옥상에 태양광 패널이 있는 건물이 함안군청 여기서 가야읍의... 하동군으로 섬진강. 멀리 (구), (신)경전선 철길이 보인다. 함안을 떠나 열심히 달려 도착한 하동 개인적으로 굉장히 좋아하는 지역이다. 특히...",2021. 6. 9.
"2021.07.11 경남 하동투어! 옥종을... 혼다 CB650R, BMW F700GS & R1200RT. 하동군 여행",한태령을 출발해서 산청군 생비량면~단성면을 지나 하동군 옥종을 지난하 안산골로 해서 하동호까지 달려갑니다. 궁금하신분들은 영상의... 그렇게 도착한곳은 하동군 맛집 지리산면옥 입니다. 지리산면옥이 궁금하신 분들은 https://blog.naver.com/onroadzone/222502113840 에서 자세히 볼 수...,2021. 9. 14.
녹차밭에서 피크닉하면서 특별한 추억남기기 [경남 하동군 감성여행],"오늘의 추천 여행지는 [경상남도 하동군] 입니다. 출처: 한국관광공사 경상남도 하동도 가을에 코스모스가 아름다운 곳으로 유명한데요. 녹차의 도시답게 초록초록한 감성이 한가득한 하동, 가을맞이 감성여행지로 딱 좋은 여행코스로 준비했습니다. 그럼 오늘도 힘차게 시작해보겠습니다! 출처...",2021. 9. 24.
경남 하동군 하동읍 / 테마모텔 / 하동군청 하동 숙소,"ㅋㅋㅋㅋㅋㅋㅋㅋㅋㅋㅋ 화장실에도 샴푸와 린스, 바디워시가 비치되어 있다. 수압도 좋고 그밖에 치약이랑 비누 있음 치킨이나 짜장면 등 배달되는 음식점 메뉴판도 따로 준비되어 있다. 택시 연락처도 있어서 뚜벅이 여행객들에게도 유용할 듯 경남 하동군 하동읍 / 테마모텔 / 하동군청 하동 숙소",2020. 7. 4.
여행 나들이 - 지리산 청학 선원 삼성궁(경남 하동군),"(대한민국 구석구석, 한국관광공사) 지난주 일요일 부슬비가 많이 오는 날,,, 근처 캠핑장에서 하루를 보내고, 예전 여름에 한번 방문한 적이 있었던 경남 하동군 청암면에 위치한 삼성궁에 들려서 둘러보았습니다. 예전 여름에 방문했을 때는 너무 더워 서둘러 한 바퀴 돌고 나간 기억이 있습니다....",2021. 4. 8.
"[경남/하동군 숙박,에어비엔비 추천] 스테이고하리(Re) 555","[경남/하동군 숙박,에어비엔비 추천] 스테이고하리(Re) 555 하동에는 유명한 곳들이 많다 악양면에 최참판댁,화개면의 화개장터, 그리고 섬진강과... 접해보세요~ #하동숙소 #하동숙소추천 #하동숙박 #하동민박 #하동예쁜숙소 #하동여행 #하동게스트하우스 #하동에어비엔비 #하동독채숙소...",2020. 12. 12.
"경남 하동군 지리산 청학동 삼성궁 솔직 후기(소요시간, 입장료)","지리산 삼성궁 경남 하동군 가볼 만한 곳, 지리산 계곡, 하동군 김다현길 경남 하동군 지리산 자락에 위치한 삼성궁, 입장료가 아깝지 않다던... 부모님이 중국이나 일본 다녀오시면 여행 사진 보여줬던 장소 같았어요. 솔직히 여기까지만 봐도... 입장료는 아깝지 않았답니다. 사진도 굉장히 잘...",2021. 8. 6.
경남 하동군 지리산 청학동 서당,5년 전 오늘 경남 하동군 지리산 청학동 서당 경남 하동군 지리산 청학동 서당 경상남도 하동군 청암면 묵계리에 위치한 지리산 청학동 서당은... 사이클론의 사진여행~~~~** 트로트 열풍이 불면서 지리산 청학동이 많은 사람들에게 알려지게 되었는데 아니 어쩌면 트로트 열풍이라기보다는 그곳...,2021. 3. 28.
"[하동 여행]13년만에 다시 찾은 경남 하동군, 켄싱턴리조트하동, 코리안 마추픽추 삼성궁","Previous image Next image 코리안 마추픽추 삼성궁 삼성궁 경상남도 하동군 청암면 삼성궁길 85 개요 환인, 환웅, 단군을 모시는 배달겨레의 성전이며... 페루에서 #하동 #하동여행 #스타웨이하동 #동정호 #삼성궁 #켄싱턴리조트 #켄싱턴리조트하동 #하동가볼만한곳 #하동관광지 #하동핫플 #하동뷰맛집...",2021. 2. 26.
경남 하동군/하동 해뜰목장/목장체험... 놀러가기 좋은곳/가족 여행/먹이주기 체험,"그래서 근방에 #목장체험 하면서 #아이스크림 도 만들고 #치즈만들기 랑,피자 까지 만들면서 목장 동물들 먹이주는 곳이 있어서 다녀왔어용~^^ 위치는 ☆해뜰목장☆ 경남 하동군 옥종면 양구1길 31-108 http://naver.me/GsTPAmdQ 요즘은 코로나로 체험은 금.토 만 타임별로 진행되요~^^ 뒷편 주차장에 주차를...",2021. 4. 18.
[경남/하동군] 울창한 소나무 숲과 섬진강 모래사장이 함께 있어 아이가 뛰어놀기 좋은.....,#아이와함께가볼만한곳 #유모차여행 #18개월아들과함께 #아이와걷기좋은곳 #경남가볼만한곳 #경남여행 #하동여행 #섬진강물놀이 #모래썰매 #천연기념물보호숲 #하동송림공원 2020. 05. 30. 토요일의 나들이.. 근처 광양이나 하동군내로 향할 때 늘 보고 지나쳤던 곳인데 아이가 뛰어놀기 좋을 것 같아...,2020. 6. 2.
경남 하동군 강아지펜션 ‘런닝독 애견펜션’ 다녀왔어요 :),"몇 주 전에 울 신랑과 뽀미, 노루, 구지와 함께 경남 하동군에 위치한 런닝독 애견펜션 에 다녀왔어요! 저희가 살고 있는 구지에서는 대략 한 시간... 가까운 여행은 아니었지만 온 보람이 있었던 펜션! 실내가 정말 깔끔하지 않나요? 냉장고에 붙어 있는 저 나비들은 뜨거운 냄비를 잡을 때 사용하는.....",2020. 2. 1.
경남하동군맛집[버들횟집식당] - 자연산 섬진강벚굴과 아삭한 식감의 송어회 맛집,내려오는길에 경남 하동군 화개장터에 들렸습니다.. 대구에 가도 가게전체 문닫았을때라.. 딱히 할일도 없고...ㅎㅎ 켄싱턴 리조트 회원이라... 저는 여행가면 항상 회랑 고기랑 같이 준비해서 한쌈에 싸먹길 좋아합니다. #지리산흑돼지 도 조금 사서... 김치까지 넣고 볶았습니다. 공기 진짜 좋은...,2020. 3. 17.
경남 하동군 만지횟집,그래서 일 시작 전 포스팅 하나 쓰고 시작하려 해요^^ 경남 하동군에 위치한 만지횟집 후기입니다 남해군 다녀오는 길에 하동을 거쳤는데요... 하동여행 중 재첩국 맛집 찾으신다면 만지횟집 너무나 추천드립니다! 이 글은 상업적 광고나 홍보 목적이 아닌 공공의 이익을 위한 내돈내산 리뷰입니다...,2020. 5. 6.
국내/경남 하동군의 10경에 속하는 쌍계사,쌍계사는 하동군의 명소이기도 하다. 리조트 바로 옆에 있어 아침 산책으로 좋았고 직접 쌍계사에서 보인 모든 풍경이 경이로와 신비스럽기도 했던... ▲절로 힐링이 되는 풍경에 감탄 ▲아주 오래된것 같은 석탑과 이끼낀 바위와 기와 담벼락의 넝쿨나무가 넘 조화로와 마음속이 편안한 여행에...,2020. 9. 5.
경남 하동군 하동읍 / 고궁모텔 / 하동군청 하동 숙소,경남 하동군 하동읍 / 고궁모텔 / 하동군청 하동 숙소 하동여행 때 묵은 두번째 숙소 카운터가 비어있어서 쓰여있는 번호로 전화를 했더니 바로 사장님이 오심 음식점도 겸하고 계신다 함 5만원 방이 많이 남아있지 않아서 나는 4만원 방에 묵었는데 방이 아담했다. 5만원 방은 거의 두배 크기이고...,2020. 7. 5.
남파랑길 47코스 경남 하동군 - 남파랑길 사천&남해&하동구간,‘섬진교’ 여행자 정보 - 시점 : 구 노량공영주차장 해안길 데크 입구(금남면 노량리 산99-2번지) 교통편) 하동시외버스터미널에서 시내버스 하동-진교 이용 후 구노량 정류장 하차. 배차간격 유의 - 종점 : 하동읍 광평리 섬진교 동단(경남 하동군 하동읍 광평리 439-2) 교통편)...,2021. 2. 22.
[하동군자원봉사센터] 백사청송에서 경남플로깅 니캉내캉♥,"그 외에도 습지와 함께하는 안녕캠페인, 모두의 습지도 기대해주세요! 그럼, 계속 이어질 플로깅의 다음 주자는 누구일까요? WRITER . 하동군자원봉사센터 기후위기대응 공동실천행동 "" 경남플로깅 '니캉내캉'"" ⓒ 경상남도자원봉사센터, 하동군자원봉사센터",2021. 5. 31.
"[경남/하동군 에어비엔비 숙박 추천] 스테이고하리555 도배장판,타일작업까지..","[경남/하동군 에어비엔비 숙박 추천] 스테이고하리555 도배장판,타일작업까지.. 더운 여름 내 몸을 태울것처럼 뜨거운 햇살이 나를 비춘다 장마가 긴... 한번에 다 보여드리기에는 아쉬움이 크니까요~ㅎㅎ #하동숙소 #하동숙소추천 #하동숙박 #하동민박 #하동예쁜숙소 #하동여행 #하동게스트하우스",2020. 11. 26.
(경남) 하동군 북천면 여행,겨울에 혼자 다녀온 북천 여행. 가을이 되면 코스모스 축제로 매우 붐비는 곳이다. 그래서 코스모스 축제 때만 방문하는 것을 추천한다. 정말... 그리고 혹시나 내일로 여행 생각하고 있는 사람이 블로그 방문할까 봐 참고하라고 같이 올렸다. 후기 처음부터 밝혔듯 축제 기간이 아니면 볼 게...,2020. 1. 20.
경남 하동군 펜션여행 #푸드트립 후기,"사실 이번 #경남여행지 선정은 체험이나 구경거리 보다는 #먹방 이 우선이었습니다. 랍스타, 수비드, 닭도리탕 등 정말 다양하게 먹고 즐기다 돌아왔습니다. 그럼 #경남피서 #푸드트립 후기를 전하겠습니다. 주의 : 배가 고프실수 있습니다. 랍스타 요리 #랍스타 집게발의 크기와 힘이 보이시나요? 제가...",2021. 7. 25.
"(경남 하동군) 특별한 한식 한상, 하동 맛집 찻잎마술",영업일 : 매일 11:00 ~ 19:00 (예약필수) 주소지 : 경남 하동군 화개면 화개로 519 주차장 : 가게 오른편에 규모가 큰 무료주차장 있음 * 방문일 : 5월 말 하동 갈 때 마다 한번씩은 가게 되는 벌써 세번째 방문한 #찻잎마술 부모님이랑 여행할 때 특히 추천한다 메뉴판 깔끔 ❣️ 메뉴 네이밍도 귀염지고...,2021. 6. 4.
[경남하동/설날 경남여행]하동군 쌍계사 북천 여행 일상,최참판댁도 입장료를 받던데 이젠 어딜 가나 다 받는 건가요? 시간나고 힐링 필요할때는 가보는것도 추천합니다. #하동군 ##봄맞이 #겨울나기 #경남여행 #하동녹차 #제다 #절 #섬진강 #재첩 #구례군 #전라남도 #화개장터 #최참판댁 #북천 #북천역 #북천코스모스,2020. 1. 27.
경남 하동군 화개면,여기는 경남하동군 화개면입니다~ 너무좋아 반했어요 1주일만에 다시 찾은 이곳! #2박3일 #가족여행 #힐링타임 #섬진강 #화개장터 #지리산피아골계곡 #화개송이펜션 #조바비브라운 #초등학교3학년그램 #바르는성장호르몬 #뉴유라이프 #소마덤젤 #갱년기장애완화 #성기능향상 #숙면...,2021. 6. 5.
지리산 경남 하동군 삼성궁 탐방! 당일치기 여행+전라남도 순천만 탐방!+짱뚱어탕...,지인들과 당일치기로 여행을 다녀왔습니다-ㅎ 지리산 밑 하동군에 속해있는 삼성궁이라는 곳이었어요! 크 가보시면 사진찍을 곳도 많고 아주... #삼성궁 #지리산 #여행 #당일치기 #경상도와전라도를가로지르는 #경남여행 #순천여행 #순천 #순천만 #전라도여행 #짱뚱어 #꼬막비빔밥 #밥두그릇뚝딱...,2020. 8. 2.
[매매완료] 경남 하동군 청암면 평촌리 전원주택지용 사찰 목장용 토지매매,경남 하동군 청암면 평촌리 토지매매 하동군 전원주택지용 사찰 목장용 토지매매 오셨어요~ 잘오셨습니다 ㅎ 오늘은 경남 하동군 청암면... 무엇보다 코로나19의 영향으로 해외여행이 힘들어진 상황에 지리산자락인 하동은 역으로 국내여행지로 각광을 받고있는 지역입니다 청정한 하동에서...,2020. 10. 21.
미스트트롯정동원/하동정동원길/경남하동군진교면,"2019년 부산 해운대 여행 친정식구들과 양보면 형부 시골집에 가는 길에, 진교면 정동원길에 들렀다. 정동원길은 진주 사람들에게 이미 소문이... 하동군과 후원자들의 도움으로 정동원 집 건물이 리모델링에 들어갔고 뿐만 아니라 그 집으로 가는 구 길이 '정동원길'로 지정되면서 벌써부터 관광지나...",2020. 6. 28.
[맛집RE:VIEW] 한옥 카페 추천 :: 경남 하동군 양탕국 카페관,"이상으로 토요일이었음에도 한적한 비대면 여행 추천지 양턍국 카페관이었습니다. -주소 경남 하동군 적량면 공드림재길 155 -영업시간 평일, 토요일: 10:30 - 19:00 일요일, 공휴일 휴무(명절 연휴에는 명절 일정에 따라 휴무일 변동) -대표 메뉴 사발양탕국코스- 15,000원 * 광고비 일체 지급받지...",2021. 4. 24.
"[4년 전 오늘] 하동 가볼 만한 곳, 하동송림, 하동여행, 경남 하동군 하동읍 섬진강변...","4년 전 오늘 하동 가볼 만한 곳, 하동송림, 하동여행, 경남 하동군 하동읍 섬진강변 하동송림을 소개합니다. 하동 가볼 만한 곳, 하동 송림, 하동여행, 경남 하동군 하동읍 섬진강변 하동송림을 소개합니다. 하동송림은 1745년(영조 21) 당시 도호부사(都護府使) 전천상(田天詳)이 강바람과...",2020. 12. 12.
경남 하동군 ‘화개장터’에서 2021냔 3월 28일,하고 #하동여행 정말 많은 차들이 하동 십리벚꽃길을 지나 쌍계사로 가려고 하는데 차가 얼마나 밀리는지..... 차에서 내려서 걷고 #화개장터 경남 하동군 화개면 탑리 #경남화개장터 경상도 하동에 있는데 다리 하나를 건너면 전라도 구례. #화개장터벚꽃축제 3월말~4월초에 열리며 영호남이 만나는...,2021. 3. 30.
[경남/하동군 에어비엔비 숙박 추천] 스테이고하리555 데크작업과 방충망교체/침대조립,[경남/하동군 에어비엔비 숙박 추천] 스테이고하리555 데크작업과 방충망교체/침대조립 스테이고하리(Re)555 소개 할께요 2~5명까지 숙박이... re_555 인스타로 가셔서 문자나 DM으로 예약하셔도 되세요~ 인스타에 사진 많이 있으니 스테이고하리를 체크해 보세요~ 여행을 안해본지 참 오래 됐다....,2020. 11. 27.
"[하동여행] 담양 죽녹원의 푸르름을 하동에서도 느껴보았어요.(21.8, 경남 하동군...","안녕하세요. 겡태공이에요! 물놀이가 슬슬 지겨위지는 시점에 아이들과 비교적 선선해진 날씨를 즐길겸~ #하동포구공원 으로 발걸음을 했네요. 저희 가족은 실내장소는 가지 않아요. 특히, 사람이 밀집하는 곳은 절대적으로 제외하고 간답니다. 대도시 근처가 아니라 상대적으로 사람들과 마주칠...",2021. 8. 12.
경남 하동군 카페 더로드101 후기(화개장터 카페),"잘 생각은 안나지만 열심히 적어볼게요!!!ㅋㅋ 하동군은 저희 엄마 고향인데요ㅎㅎㅎ 그래서 오랜만에 엄마 고향도 갈 겸 가족 여름휴가 여행지를 하동으로 정했어요. 하필, 저희가 하동 갔을 때는 장마철이여서... 우비를 쓰고 여행했었어요. 이번 여름 유독히 비가 많이 왔었잖아요....",2020. 12. 22.
"[경남/하동군]하동 당일치기 여행 코스모스축제, 삼성궁 가볼만한곳",돗자리펴고 도시락까먹었다 ㅎㅎ 꿀맛 그 다음 장소을 삼성궁 삼성궁 갈때 구두는 절대안된다 생각보다 돌고 밟고 올라가야하고 ㅎㅎㅎ 꽤 걷는다 위에서도 한컷 위에서 바라본 연못 너무이쁨 마지막으로 한바퀴 돌고 나오니 이런 돌담이 한번쯤은 삼성궁 들려볼만하다 당일치기로 하동 여행 추천!,2020. 10. 3.
"시트로엥, 경남 하동군 ‘한달살이 프로젝트’에 차량 지원","하동군은 올해부터 경상남도가 주관하는 한달살이 여행사업의 일환으로 ‘흥미진진한 하동에서의 일상’을 진행하고 있습니다. 한불모터스(주)는 대자연의 아름다움과 풍요로운 일상을 간직하고 있는 하동군에 시트로엥의 대표 차량을 지원함으로써, 편안함과 즐거움을 추구하는 브랜드의...",2020. 10. 16.
B0502@@하동부동산_하동군_하동읍_토지_땅_전원주택지매매@@ 경남 하동군 하동읍 흥룡리...,"전원주택지매매@@ 경남 하동군 하동읍 흥룡리 먹점마을 매화골 땅_토지_전원주택지매매 면적 : 710㎡ (약215평) 지목/용도 : 전/계획관리지역, 가축사육제한구역 매매가 : 평당 32만 경남 하동군 하동읍 흥룡리 먹점마을 매화골의 청정지역 토지_땅_전원주택지입니다. 먹점마을은 하동읍에 속하는...",2020. 5. 2.
경남 하동군 북천역 - 정동원길 -진주시 진주성,정동원길2KM정도 걷다가 진주성 관람했습니다 <산청에 있는 산나물 뷔폐에서 점심 해결하고 여행을 떠나봅니다> <점심 잘먹고 하동 북천 양귀비단지로 갑니다> <하동 북천역을 다른곳으로 옮긴후 북천역(구)에서 레알바이크를 운행하고 있다> <양귀비축제장은 폐쇄되고 북천역 주위만 돌아 봅니다...,2021. 6. 7.
[경남가볼만한곳(하동군)] 매암제다원,날도 좋고하여 코로나 밖에서 먹으니 몸도 따듯하고 마음도 따듯해지는 힐링 할 수있는 여행공간이었습니다. 주소:경남 하동군 악양면 악양서로 346-1 매암다원문화박물관(악양면 정서리 293) 전화번호: 055-883-3500 영업시간: 화~일요일 10-19시(하절기) 화~일요일 10-18시(동절기) 매주 월요일 휴관,2020. 3. 25.
[경남]하동군 시인의 정원 펜션,하동군에 일하러 갔다가 영 숙소가 마땅치 않아서 차라리 광양을 갈까하다 알아본 펜션 간만에 일하러 와서 여행온 기분도 내고 괜찮았음. 인원이 좀 되서 방 2개를 달라고 하고 방하나에 6만원인가 해서 12만원에 예약한 곳이었는데(2020년 11월 기준) 이게 2개란다 ㅋㅋㅋㅋ 사실 좀 기분 많이...,2020. 11. 13.
"시트로엥, 경남 하동군 한달살이 프로젝트 대표 패밀리카 지원","하동군은 올해부터 경상남도가 주관하는 한달살이 여행사업의 일환으로 ‘흥미진진한 하동에서의 일상’을 진행하고 있다. 시트로엥은 대자연의 아름다움과 풍요로운 일상을 간직하고 있는 하동군에 대표 패밀리카를 지원, 편안함과 즐거움을 추구하는 브랜드의 핵심 가치를 전달할 계획이다....",2020. 10. 20.
"[하동군 맛집]효도 여행 해장 완성 - 원조 나루터 식당, 제첩국, 덮밥","#여행 #마지막날 #경남하동군맛집 #하동맛집 #재첩국 #재첩식당 #재첩비빔밥 [경남 하동군] 효도 여행 해장 완성 원조 나루터 재첩식당 제첩국과 제첩덮밥 맛보기 원래 센터 가려 했는데, 센터는 아직 안열어서 원조 나루터 식당. 왼쪽으로 들어갔다! 업체정보 전화 ***-***-**** 주소 경남 하동군...",2021. 7. 17.
코로나 시대 언택트 사찰 여행- 경상남도 하동군 쌍계사,좋은 경치와 정숙한 분위기의 차분해진 마음을 간직하며 이번 지리산 여행의 마침표를 찍습니다. 이상. 언택트 지리산 사찰 여행- 경남 하동군 쌍계사 편을 마칩니다. 읽어주신 여러분 감사합니다. #부부 #커플 #힐링 #사찰 #여행 #쌍계사 #남도 #경상 #전라 #하동 #산책 #계곡 #코스 #지리산 #법원다향,2021. 7. 22.
[경남 / 하동군 ] 아름다운 하동읍성 소개 & 추천,"[경남 / 하동군 ] 아름다운 하동읍성 소개 & 추천 하동은 통일신라시대에 하동군으로 개칭이 되었다고 합니다 하동군은 사천,진주,산청,남해,함양... 돌아 볼수 있답니다 조용히 명상도 하고 걸다 보면 자연스럽게 힐링이 되시리라 믿습니다. 멋진 하동으로 여행 오세요~ #하동읍성 #하동볼거리 #하동여행",2020. 12. 7.
[하동여행] 소나무 천국!! 천연기념물... 그리고 Water show!!(경남 하동군 #하동송림공원),안녕하세요. 겡태공이에요! 아침에 눈을 떠보니 날씨가 너무 좋네요. ㅎㅎㅎ 일찍감치 집에서 나서서 아이들과 신나게 놀기로 합니다. ♡ #광양가볼만한곳 중에 #국사봉랜드 가 있길래 저희는 산책하는 곳이라 생각하고 출발!! 옥곡시장을 지나 산길을 따라 올라가니 고지가 보이네요. 잉? 여기...,2021. 8. 19.
082 멋진 바다전망 경남 하동군땅매매~!! 이렇게 멋진 바다전망토지 어떠신가요?! 바다...,"하동땅매매,하동토지매매,하동촌땅매매,전망좋은토지,경치좋은토지,하동부동산매매,바다뷰토지 082 경남 하동군 금남면에 위치한 토지매매 소래드립니다. 동서남북 막힘이 없는 남향의 토지매물 입니다. 북쪽으로 약 20m 거리에 4차선도로가 있으며 남서쪽으로 2차선 도로가 접하여...",2020. 3. 22.
"경남 하동군 원어민영어회화[하동읍,옥종면,악양면,북천면,금성면,진교면,고전면]...","진짜 여름인듯해요 매미들이 맴맴 울기 시작하네요 무더위 속에서 모두들 힘내시고 홧팅 하세요 ^^ 경남 하동군에는 하동읍,악양면,양보면,옥종면... 기초생활영어 여행영어 기초문법 및 고급문법과정 영어말하기대회 과정 영어시사토론과정 중학교과서 과정 등등 많은 과정이 있습니다 ~~!! 저희...",2021. 7. 21.
"웃음과소통리더십이현춘강사,미스트롯정동원,경남하동군,",꼬옥 방문하고 싶었던곳 경남하동 정동원길 2018년기억됩니다 여행갔다가 노래하는 소년을보고 감동을받고 정말 멋진가수로 성장할것을 믿었어요 가슴이 찡하고 눈물이 나와 한참을 넋놓고 바라보았던생각이 떠오릅니다 저도무대에올라 장윤정 사랑아 불러 소고기 상품권을 탔던아름다운추억이...,2021. 2. 18.
경남 하동군의벚꽃풍경,"봄바람이 살랑거리는 계절입니다.봄꽃 여행을 떠나려고 했다면 지금이 바로 그 타이밍,십리벚꽃길을 물론,곧 사방이 벚꽃으로 둘러싸인... 쌍계사로 들어서는 십리벚꽃길도 섬진강 따라 이어지는 도로변에도 벚꽃이 곧 가득해진답니다. 경상남도 하동군 화개면 탑리",2020. 3. 13.
"[하동] 하동군-여행에 미치다, 관광콘텐츠 개발 협력",[테크월드뉴스=조명의 기자] 경남 하동군이 지역 자연·문화·관광 인프라를 활용해 새로운 지역 관광콘텐츠 발굴과 SNS 중심의 트렌드 마케팅 활성화를 위해 여행에 미치다와 손을 잡았다. 하동군은 3월 29일 군수 집무실에서 자연·문화·관광 인프라를 활용한 지역 관광 활성화를 위해 여행에...,2021. 3. 30.
[경남 하동군 여행] 하동 다목적 캠핑 불멍~~~, ,2021. 2. 11.
"경남 하동군, 지리산 둘레길 산골 나무집 양진욱·배윤천 부부의 사랑 이야기","'경남 하동군, 지리산 둘레길 산골 나무집 양진욱·배윤천 부부의 사랑 이야기' 뉴스를 알아봅니다. [EBS 한국기행] 이곳에서 잠시만 “경남 하동... EBS 한국기행은 대한민국의 숨은 비경을 찾아 떠나는 공간 여행이자 역사와 풍습, 건축, 향기를 느끼고 전달하는 아름다운 시간 여행이다. 우리들이...",2021. 9. 28.
[경남 하동군 고하리] 주성(배다리)마을/하동읍성을 소개합니다,"우리 지순이와 찍은 하동읍성,, 배다리공원이 있어서 이 곳도 산책하기 매우 좋다.. 연인,가족,아니면 혼자도 사색하며 걸어도 좋을 듯합니다 이렇게 아름다운 마을을 산다는 건 행운이 겠지여 #주성마을 #하동읍성 #귀촌청년 #하동귀촌청년 #하동귀촌 #배다리공원 #배다리마을 #하동여행 #하동산책",2020. 11. 23.
경남 하동 가볼만한곳 스타웨이하동 여행,04. 위치 주소 : 경상남도 하동군 악양면 섬진강대로 3358-110 전화번호 : 055-884-7410 영업시간 : 09:30-20:30 #경남여행 #하동여행 #경남가볼만한곳 #하동가볼만한곳 #경남하동가볼만한곳 #스타웨이하동 #하동관광지 #하동볼거리 #하동놀거리 #하동여행코스,2021. 9. 18.
[하동맛집] 녹차한정식 찻잎마술(feat. 하동군에서 추천하는 맛집),"주소 : 경남 하동군 화개면 화개로 519 영업시간 : 11:30 ~ 19:00 (예약필수) 전화 : 055-883-3316 주차 : 가능(가게 건너편 길가쪽 주차자리) 안녕하세요 책... 멀리 여행가서 한정식을 먹어야 하나 생각도 들었지만, 워낙 평도 좋았고 깔끔했기에 기대가 되었습니다. 주차를 하고 건너편에서 본 모습입니다....",2021. 9. 4.
