header,contents,date
[하동여행] 하동여행코스 쌍계사/쌍계명가/쉬어가기좋은날,쌍계명차 경남 하동군 화개면 화개로 30 사진으로는 엄청 클 줄 았았는데 실제로는 생각보다 작은 쌍계명차 예쁜 다기들도 많고 2층에는 박물관이 있어서 신기하다 선물용 차세트와 한쪽 벽면 가득 개별 티백이 있는데 색색깔이 너무 예뻐서 몇개 사오고 싶었다 공유가 화보를 찍어서 유명해진...,2021. 9. 6.
"하동 여름 여행 / 청운식당, 쌍계사, 옛날 팥빙수집",언택트 여행 메뉴판을 다시 보니 감자전도 맛있겠고 돌판더덕구이 탐나네요. 파전이 나왔어요. 고소한 기름냄새가 코를 자극해요. 가격이... 네이버 지도에는 나오지 않고 주소는 경남 하동군 화개면 화개로 395 입니다. 길가에 서있는 입간판을 보고 가게 앞에 차를 댑니다. 팥빙수와 단팥죽만 되는 줄...,2021. 8. 26.
"하동여행, 하동 짚와아이(짚라인), 하동 맛집 추천 및 할인 꿀팁 후기!!",서울 근교에 있는 모든 여행이 질린 당신을 위한 여행 플래너 입니다!! (빵긋) 이번 여행은 경상 남도 하동으로 떠나 보겠습니다. 바로 가시죠!!... 전화 ***-***-**** 주소 경남 하동군 금남면 경충로 493-37 꼭 예약하고 가셔야 합니다~~~!!! 꼭꼭꼭 *할인 방법* 짚라인 근처에 바다전원 펜션이 있습니다....,2021. 8. 28.
'21.9.25.(토)./맑다가 구름/하동 그리고 순창 여행/채계산 출렁다리/장군목,"^^~♡ 브릿지 130 경남 하동군 화개면 화개로 334 매일 10:00~19:00, 수요일 휴무 아름다운 쌍계사 길을 가다가 오른쪽에 위치한 이쁜 카페에 들른다.... 남자 둘이서 즐거운 여행. ㅠ.ㅠ. 이제 건너가 본다. 출렁다리 양쪽 아래 도로와 노란 논들이 정말 멋지다. 출발하는 산과 도착하는 산이 비슷한...",2021. 9. 26.
[GNFT 경남관광박람회 8기 서포터즈]여름이 물씬 다가온 하동의 여름관광코스 추천!!,"하동 화개장터 경남 하동군 화개면 쌍계로 15 솔직히 여행하면 또 그 지역의 특산물, 특산품을 빼놓을 수 없고 특히 먹방여행이 유행하는 지금 먹을 곳이 빠질 수 없겠죠!! 짚라인으로 인해 소비한 에너지를 하동 화개장터에서 두둑히 채워보시는게 어떨까요?? 화개장터는 화개면 탑리에 있으며...",2021. 4. 29.
가장 여유롭고 조용한 시간 보내기 좋은 하동 횡천강 둔치,떠난 여행지에서 수많은 사람에게 치이느라 제대로 쉬지도 못하는 여행지가 아니라 나만을 위한 쉼터입니다. #하동 #알프스하동 #비대면여행지 #언택트여행지 #코로나19 #횡천강 #여의천 #횡천강둔치 #산책 #하동여행 #하동관광 #하동가볼만한곳 #경남 #경남가볼만한곳 #경남여행 #경남관광 #하동군 #여행,2020. 9. 3.
그리움이 평화롭게 묻어나는 하동 화월마을,푸른 물이 함께하는 아름다운 풍경은 다람쥐 쳇바퀴 하는 일상을 벗어난 우리에게 넉넉한 숨 고를 여유를 안겨줍니다. #하동 #알프스하동 #비대면여행지 #언택트여행지 #코로나19 #횡천강 #화월마을 #청암면 #하동여행 #하동관광 #하동가볼만한곳 #경남 #경남가볼만한곳 #경남여행 #경남관광 #하동군 #여행,2020. 9. 2.
'하동여행 최참판댁' 드라마 촬영지,하동 · Hadong 최참판댁 드라마 촬영지 주소 경남 하동군 악양면 평사리길 66-7 영업시간 평일 09:00 - 18:00 연중무휴 우리는 하동을 제 2의 제주도라고... 하동은 여행오면 늘 이런 풍경이라 힐링이에요 :D 여기 진짜 멍 - 때리기 좋아. 잠시 풍경 감상타임 .. 찍어놓고 사진으로 보니 약간 미니어처 공간...,2021. 8. 23.
[하동_화개면]하동데이트코스로 강추! 포토존 많은 경남하동카페 티스토리하동,"- 하동군카페 티스토리하동에 도착해서 주차하고 카페를 바라보는 모습이에요. 따뜻한 봄기운이 느껴지는 조용하면서 평화로운 모습이에요.... 3월가볼만한곳, #경남여행, #대한민국구석구석, #하동여행코스, #하동핫플, #하동핫플레이스, #티스토리하동디저트, #광양, #광양카페...",2021. 3. 12.
전남 구례 지리산 1박2일 여행 일정 추천(2): 최참판댁(토지 드라마촬영지)...,"그래서인지 최참판댁 드라마 촬영지는 하동으로 여행 갈 때 필수로 들려야 하는 곳으로 꼽힌다고 해요 주소: 경남 하동군 악양면 평사리길 66-7 시간: 평일 09:00 - 18:00 입장료 성인: 2,000원 청소년: 1,500원 어린이: 1,000원 최참판댁 안내소에서 입장권을 사서 들어갑니다! 최참판댁 입구에는 다양한...",2021. 8. 25.
또 생각나는 하동 맛집 리스트,"청운식당 주소: 경남 하동군 화개면 쌍계사길 6 전화번호: 055-883-1666 영업시간: 08:00 ~ 20:00 아침식사 가능(영어메뉴판 구비) 제가 찾아간 식당은 하동 쌍계사 바로 밑 주차장에 위치해 있어서 쉽게 찾을 수 있었고, 주차도 편하게 할 수 있었답니다. 외관부터 토속적인 느낌이 물씬 느껴졌는데...",2021. 3. 19.
경남 하동 맛집 청림식당 섬진강 재첩의 참맛,찾아가는 경남 하동 맛집 청림식당 섬진강 재료들로 만든 맛의 향연~ 글 by. 뜰리에 안녕하세요~ 뜰리에입니다! 원래 1년에 1번씩은 해외여행을... 꼭 드셔보시러 경남하동맛집으로 소문난 청림식당으로 방문하시길 바래요! * 하동 청림식당 - 전화번호 : ***-****-**** - 주소 : 경남 하동군 화개면 화개로 2-15,2020. 8. 5.
[경남/하동]하동시외버스터미널 시간표 (2021 06.25 기준),하동 시외버스터미널 #하동여행 #하동맛집 #하동가볼만한곳 #하동여름휴가 #하동시외버스터미널 #하동시외버스터미널시간표 주소: 경남 하동군 하동읍 너뱅이길 35 위치정보 Previous image Next image 하동 시외버스터미널은 정문을 돌아 버스차고지쪽으로 쭉-가면 입구가있어요 시간표...,2021. 6. 27.
"가을이 내려앉은 역사의 현장, 하동읍성",백의종군로 #임진왜란 #주교천 #배다리공원 #역사여행 #시간여행 #가을산책 #산책하기좋은길 #걷기좋은길 #하동산책명소 #하동걷기좋은곳 #하동여행 #하동가볼만한곳 #하동명소 #경남 #경남여행 #경남가볼만한곳 #경남걷기좋은곳 #경남산책하기좋은곳 #하동군 #하동군블로그 #하동군블로그기자,2020. 11. 4.
[구례+하동 여행] 하동 가볼만한 곳 '동정호',"생태습지 '동정호' 주소: 경남 하동군 악양면 평사리 305-2 주차: 동정호 입구에 주차장 있음(주차비 무료) 입장료: 무료 동정호 주변을 따라 출렁다리와 천국의 계단, 둘레길 등으로 다양하게 조성되어 있어 산책하며 즐기기 정말 좋은 곳이에요! 하동 여행을 가시면 꼭 방문해 보시라고 말씀드리고...",2021. 9. 9.
"하동 애견 동반 가능 카페, 하동 핫플 #플래닛1020 #하동여행",#플래닛1020 영업시간 12:00-19:00 경남 하동군 화개면 쌍계로 318 주차장 있음 반려견 동반 가능 후앙... 사진에서 본 그대로... 아담한 정원같은 예쁜... #하동여행 #하동반려견동반여행 #하동반려견동반카페 #하동카페 #지리산 #LG팬더인테리어 #거제누수 #김해누수 #통영누수 #거제인테리어...,2021. 7. 4.
하동여행 / 자꾸 생각나는 파이나무,하동여행에서 달달한 간식과 함께 하고 싶은 분들께 파이나무 배파이를 추천드립니다. 어디 다른 지역가선 못먹어요 이거~!ㅎㅎㅎ저도 최참판댁 구경하고나서 더위에 지쳐서 아메리카노 한잔이랑 배파이 들고 평상에서 먹고 있으니 꿀맛이었어요. 위치 파이나무 경남 하동군 악양면 악양서로 129...,2021. 8. 6.
기억에 남는 하동 맛집 리스트 5곳,친구들과 여행 중 가장 기억에 남는 곳을 꼽자면 저는 이곳이 가장 먼저 떠오르는데요. 정감이 가면서 친근한 분위기 속 음식도 푸짐하고 퀄리티가 너무 좋았던지라 하동에 간다면 그때도 이곳에서 기분 좋게 식사를 즐기고 싶답니다. 하웅촌식당 주소 : 경남 하동군 하동읍 섬진강대로 1877 번호...,2020. 9. 18.
경남 하동 숭어코스 횟집 / 선창횟집(+코스 순서),"선창횟집 #하동횟집 #남해횟집 경남 하동군 금남면 중평해안길 139 055-884-2245 매일 10:00 - 21:00 주차 바로 앞 가능 작년,,, 딱 12월 31일 이후로 연초라... 맛과 양 그리고 바다 뷰까지 더한 곳, 선창횟집 #하동 #하동여행 #하동맛집 #남해 #남해여행 #남해맛집 #하동숭어회 #숭어회코스 #하동드라이브코스...",2021. 1. 11.
하동 맛집추천 / 화개장터 맛집 :: 은성식당,힛) 이번 하동 여행 중에 만난 하동 1등 추천 맛집 하동 맛집추천 / 화개장터 맛집 :: 은성식당 입니다. 부랴부랴 도착해서 촬영하다보니 벌써 해가... 은성식당을 방문해보세요 : )) 하동 맛집추천 / 화개장터 맛집 :: 은성식당 경남 하동군 화개면 섬진강대로 3917 0507-1427-5563 매일 08:30 - 20:00 연중무휴,2021. 3. 28.
하동카페 : 플래닛1020 / 테라스가 이쁜 화개장터카페,하동 플래닛1020 (Planet 1020) 경남 하동군 화개면 쌍계로 318 매일12:00 - 21:00 / 월요일 휴무 반려동물 동반가능 하동 화개장터 근처에 있는 플래닛 1020... 하동핫플 #하동카페추천 #하동애견동반 #구례카페 #화개장터카페 #국내여행 #국내여행추천 #하동여행추천 #경남여행추천 #여행에미치다 #서이추,2020. 8. 24.
[경남하동1박2일] 황토벽난로펜션♡실내에서 불멍때리기!!#아름다운산골#쌍계사#화개장터,우니짱 생일겸 겸사겸사 여행옴ㅎ 펜션에 바베큐재료 신청해놔서 장볼 필요없이 편하게 가서 밥먹고 온돌방에 등때기 찌지며 겁나 뜨끈뜨끈하게... 자세한 사항은 아래 펜션 홈페이지에서 확인가능요~ 아름다운산골 경남 하동군 화개면 범왕길 198 아름다운산골 http://naver.me/5g69703p 휴게소 한번도...,2020. 12. 10.
코로나19로 힘들 때 힐링을 할 수 있는 곳 '하동편백자연휴양림',"찾아오시는길 경남 하동군 옥종면 돌고지로 1088-51 하동편백자연휴양림 전화 : 070-8994-0717, 070-8994-0718 경남 하동군 옥종의... #하동 #알프스하동 #하동군 #하동가볼만한곳 #하동여행 #하동쉴수있는곳 #하동의숲 #하동편백자연휴양림 #하동편백나무 #하동휴양림 #하동숲길 #하동숙박",2020. 10. 14.
* 경남 하동 뷰 카페 추천 : 더로드101 ☕️,"더로드101 경남 하동군 화개면 화개로 357 ✔️ 주소 : 경남 하동군 화개면 화개로 357 ✔️ 주차장 : 주차장이 꽤 큰 편이고, 교통약자 주차장도... 보내세요:) #더로드101 #하동여행 #하동카페 #하동핫플 #화개장터카페 #하동카페추천 #하동뷰카페 #하동핫플레이스 #하동데이트 #서이추 #서이추환영",2020. 9. 8.
[하동여행] 꼭 다시 걷고싶은 길 - 지리산 회남재,갔다오는 코스가 최상이라고 들었는데 아쉽게도 산중에서 해가 지면 가로등도 없고 길도 구불구불 위험하기에 대략 30여분 밖에 걷지못했는데 온전한 지리산의 품을 느낄 수 있었던 고요하고 평온한 시간이었다. 어느 계절에 가든 꼭 다시 와서 오래도록 걷고 싶은 길이다. | 경남 하동군 청암면 묵계리,2020. 11. 26.
[지리산흙집풍경 펜션] 경남 하동 여행 episode 02,경남 하동 지리산흙집풍경 펜션의 아침 비가 그친 아침의 하동군 악양면 지리산흙집풍경 펜션의 마운틴뷰입니다. 멀리 보이는 산에 안개가... 이 날 가족여행의 추억을 함께 해 줄 파트너입니다. 오며가며 주거니 받거니 했더니 두 병을 마시게 되었답니다. 요즘은 이 진로소주가 참 맛있네요. 식당...,2020. 6. 22.
하동 1박2일 힐링여행 켄싱턴리조트 지리산하동점 숙소 후기 (+와인파티),"조식과 다도체험기는 하동 여행 2탄으로 소개하겠습니다. 켄싱턴리조트 지리산 하동 경남 하동군 화개면 쌍계로 532-6 예약 전화번호 1670-7448 켄싱턴 Only 상품, 최적가 예약 앱 다운로드 ▼ Android: http://bit.ly/38V8W1c 켄싱턴 Only 상품, 최적가 예약 사이트 모바일 예약 이 포스팅은 ' 이랜드파크 켄싱턴...",2020. 6. 2.
하동여행 하동핫플 가볼만한곳 신진식당 밥집 맛집 솔직후기,"하동여행 하동핫플 신진식당 신진식당 10:00~20:00 (유동적, 우천시 휴무 일수 있으니 미리 문의) 연중무휴 ***-***-**** 경남 하동군 화개면 석문길 12 (운수리 산101-1) 주차장있음 메뉴 가격표 - 계곡에서 먹어야 하니 당근 백숙을 시켜야겠쥬? ㅋㅋㅋㅋ ㅋㅋㅋㅋㅋㅋㅋㅋ 촌닭백수 하나 ! 그리고 맥주...",2021. 7. 14.
경남 하동 계곡펜션 피서지로 딱이었죠,"주변의 아름다운 경치에 반해서 또 오고 싶다는 생각이 들게 분명해요. 그럼 가족, 친구, 연인과 함께 찾아와요. 일단 화개다옴펜션 예약부터 서둘러요. 절대 후회하지 않는 여행이 될거에요. https://daohm.modoo.at/ 경남 하동군 화개면 범왕길 94 055-883-3770",2020. 7. 29.
"하동여행 1 (최첨판댁,토지주막,달달하동)",였는데 다행히도 두번째 일정부터는 굉장히 만족도 높은 여행이었습니다. 카페방문을 헛탕으로 배고픈 배를 달래며 하동의 관광지도 구경좀하자싶어 방문하게된 드라마 [최참판댁]촬영지 드라마 [최참판댁] 촬영지촬영장소 ***-***-**** 경남 하동군 악양면 평사리길 66-7 평일 09:00 - 18:00연중무휴....,2021. 7. 31.
"그저 걷기만 해도 좋아라, 하동 배드리길",#하동 #알프스하동 #배드리길 #주교천 #배다리공원 #하동읍성 #가을산책 #산책하기좋은길 #걷기좋은길 #하동산책명소 #하동걷기좋은곳 #하동여행 #하동가볼만한곳 #하동명소 #경남 #경남여행 #경남가볼만한곳 #경남걷기좋은곳 #경남산책하기좋은곳 #하동군 #하동군블로그 #하동군블로그기자,2020. 11. 6.
"하동여행 유명 카페 매암제다원, 곳곳이 포토존이었던 하동 카페 솔직 후기","하동여행 유명 카페 매암제다원, 곳곳이 포토존이었던 하동 카페 솔직 후기 카페&박물관 매암제다원 경남 하동군 악양면 악양서로 346-1 매암다원문화박물관 자차 이동 추천 월요일 휴무 / 10:00 - 18:00 간략한 review 풍경 예술, 한마디로 모든 곳이 포토존 날씨 좋으면 더할나위 없이 좋은 곳...",2021. 8. 19.
하동여행)화개장터맛집_화개골 나주곰탕,안녕하세요 라라타일입니다 오늘은 하동여행 중 너무 맛있게 잘 먹었던 화개장터 맛집 화개골 나주곰탕을 리뷰해보려합니다 화개장터맛집_화개골나주곰탕 경남 하동군 화개면 화개로 64 경남 하동군 화개면 탑리 584 매일 10:00 ~ 20:00 경남 하동군 화개면 탑리 584 화개장터 맛집 화개골 나주곰탕은...,2021. 8. 10.
경남 하동 지리산펜션 아름다운산골펜션,"야누 #경남하동지리산펜션 #아름다운산골펜션 주소 : 경상남도 하동군 화개면 범왕길 198 전화번호 : ***-****-**** 체크인 : 15:00 / 체크아웃 11:00 조식제공, 계곡이용 가능, 핀란드사우나(유료), 바베큐 숯불(유료) 요즘 코시국이 4단계로 올라가면서 국내여행도 잠시 멈춘 상태인데요, 지난번에 방역수칙...",2021. 7. 26.
국내 신혼여행 추천 최참판댁 인생사진,신혼여행 추천 장소가 있습니다. 하동 최참판댁은 인생 사진을 남기기에도 좋고 가족들과 비대면 여행을 즐기기 최고급 장소입니다. 경남 하동은... 그래서 당일치기 여행보다는 1박 2일 여행을 추천드리고 싶습니다. 하동군 평사리 최참판댁에서는 봄소식이 조금씩 들리기 시작합니다. 최참판댁...,2021. 2. 25.
본격! 여름휴가 하동여행 스카이워크 [하동 스타웨이],"안녕하세요 슬슬여행의 이번 추천 여행지는 하동입니다 짝짝짝! 섬진강을 한눈에 볼 수 있는 스타웨이가 있다고 해서 찾아가봤어요>< ⛅ 하동 스타웨이 ⛅ 위치: 경남 하동군 악양면 섬진강대로3358-110 ⛅ 입장료: 3,000원(성인)/ 2,000원(7세~18세) ⛅ 전망대 카페, 레스토랑, 편집샵 등 스타웨이는...",2021. 8. 27.
하동산청 여행 지리산 자락 숙박시설 청학동 생기골 펜션 미리 둘러보기,위치 : 경남 하동군 청암면 청학로 2571 - 67 연락처 : *** - **** - **** *** - **** - **** 지도가 검색이 안되어서 첨부를 못 했어요 그래서 명함을 첨부... 있겠어요 #여름휴가 #지리산 #청학동 #펜션 #지리산청학동생기골황토펜션 #지리산청학동펜션 #청학동펜션 #청학동생기골펜션 #하동여행...,2021. 9. 1.
땡큐도 함께한 지리산계곡 여행~,감사나무에요~ 감사나무네는 이번 여행도 우리집 막둥이 땡큐와 같이 갔답니다. 경남 하동군 쪽의 지리산 계곡을 갔는데 사람이 많질 않고 물이 차갑지 않아 좋았어요. 강원도쪽의 계곡은 물이 넘 차가워서 덜덜.. 떨었었고 물속에서 오래 놀질 못했던 기억이 나는데요. 경남 하동쪽 지리산 계곡은...,2021. 8. 3.
[2년 전 오늘] [하동여행]6.지리산청학동/삼성궁길/건국전으로 가는 ~ 배달길(맑은땅)...,"2년 전 오늘 [하동여행]6.지리산청학동/삼성궁길/건국전으로 가는 ~ 배달길(맑은땅)/항아리길 경남 하동군 지리산 청학동 삼성궁!(6)지리산은 산자체가 워낙 넓고,크기때문에 행정구역상 3개 도 5개 군(전북남원시/전남구례군/경남산청군.함양군.하동군)에 걸쳐있는 명산입니다.삼성궁은...",2020. 3. 27.
알프스하동 백사청송에서 2021년 희망을 이야기합니다,하동여행의 시작점 하동송림 하동송림공원주차장으로 들어갑니다. 넓은 주차장이 한적합니다. 코로나19로 나들이가 어려운 지금 사회적거리두고... 이 또한 지나가리라고~~~~~ 찾아오시는길 경남 하동군 하동읍 섬진강대로 2107-8 송림공원 제10기 하동군SNS 기자단 김종화,2021. 2. 4.
Travel list 2021년 꼭 가봐야 할 여행지,"평사리 최참판댁은 한옥 14동과 초가집으로 <토지>의 배경을 재현한 공간으로, 소설 속에 들어온 듯한 기분을 만끽하며 문학 여행을 즐길 수 있다. 경남 하동군 악양면 평사리길 66-7 09:00~18:00 어른 2000원, 청소년 1500원 055-880-2960 정읍 Jeongeup 쌍화차 거리 찻집에서 마시는 차 한잔이 가장 그리울...",2021. 1. 26.
경남 하동 매암제다원 녹차밭보며 차한잔하기 좋은곳 하동 포토존,TOUR 매암제다원 하동 2박 3일 여행 2DAY 안녕하세요! 핑크쥬입니다 :) 저는 이번 근로자의 날과 어린이날이 껴있는 나름 연휴에 남편과 하동으로 2박... 이였어요 경남 하동군 악양면 악양서로 346-1 매암다원문화박물관 055-883-3500 매주 월요일 휴관 현수막을 보니 매암차박물관이 맞네요~! 주차를...,2020. 5. 10.
"가을이 보고 싶을 때, 하동 선소공원",#하동 #알프스하동 #선소공원 #하동바다 #섬진강 #섬진강산책코스 #섬진강트레킹코스 #가을산책 #산책하기좋은길 #걷기좋은길 #하동산책명소 #하동걷기좋은곳 #하동여행 #하동가볼만한곳 #하동명소 #경남 #경남여행 #경남가볼만한곳 #경남걷기좋은곳 #경남산책하기좋은곳 #하동군 #하동군블로그...,2020. 11. 7.
남해 가족여행,남해로 가는길 중간에 경남 하동군에 미스터 트롯의 정동원 본가가 있다고 했다! 할머니께서 미스터트롯을 좋아하셔서 가는길에 한번 들렀다... 경남 남해군 이동면 남해대로 1623 http://naver.me/FNmkiiRz 설리스카이워크 경남 남해군 미조면 미송로303번길 176 http://naver.me/F7CiSWYB #남해 #남해여행...,2021. 8. 8.
"남해 여행지, 남해대교, 남해각에서 느끼는 애향심",1.노량대교에서 남해대교 바라보며 경남 하동군 금남면 섬진강대로 61 남해여행 시작은 노량대교 홍보관 전망대에서 시작하였다. 이곳은 하동지역으로 남해 관광홍보관도 있어 전체적인 남해 관광지도 살펴볼 수 있다. 전망대 올라가면 달조형물이 있으며 남해대교와 노량대교를 동시에 담아볼 수...,2021. 8. 1.
하동 동정호 하동 허수아비,"@콩이와꽃순이 하동 동정호 외 여행정보 하동 동정호 경남 하동군 악양면 평사리 305-2 주차장 있음 무료 허수아비 전시 (추석 전후로 전시) 핑크뮬리랑 천국의 계단에서 사진찍기 좋아요. 하동 여행이 처음이신 부모님 모시고가는 여행은 하동 쌍계사, 하동 최참판댁, 하동 화계장터 추천 하동 여행을...",2021. 9. 26.
하동 여행 정금차밭 녹차밭,찾아가는 방법 알려드렸으니 계속해서 시간 날 때 관광지랑 맛집도 따로 정리해서 포스팅 적어볼게요. 03. 위치 주소 : 경상남도 하동군 화개면 정금리 산 144 #하동여행 #하동가볼만한곳 #하동여행코스 #정금차밭 #하동녹차밭 #하동관광지 #하동놀거리 #하동볼거리 #경남하동가볼만한곳 #하동정금차밭,2021. 8. 23.
[맛집] 경남 하동 카페 - 매암제다원 [도심다원 / 녹차밭],"그런데 최근 경남 하동 여행을 하면서, 경남 하동에도 녹차밭이 유명하다는 것을 알게 되었습니다. 그리고 그 중 가장 유명했던, 경남 하동 카페... 하동군 선정 하돈의 아름다운 다원 매암다원 이라고 합니다. 실제로 풍경은 참 예뻐요. 사진 찍는 저는 땀으로 범벅이 되었지만, 사진을 건졌으니...",2021. 7. 29.
경남 하동 가볼만한곳 천년 녹차나무&쌍계사,#하동여행 #천년녹차나무 #하동가볼만한곳 1️⃣ 하동정금리차나무 경상남도 기념물 제264호 하동 가볼만한곳 마을 어귀로 들어서면서도 여기가... 하동의 아름다운 다원 주소 [경남 하동군 화개면 정금리 산74번지]로 검색하면 여기로 안내를 해줄것이다. 오른쪽 시멘트 도로는 걸어서 올라가기로...,2020. 11. 21.
'16번째 확진자' 가족 광양거주 인근 하동군 '비상,'16번째 확진자' 가족 광양거주에 인근 하동군 '비상'···철저 차단 경남 하동군은 국내 16번째 신종 코로나바이러스 감염증 확진자의 남편이 인근... 해외여행을 자제하고 행정은 역·터미널·학교·경로당·요양원·기업체 등 다중이용시설의 담당제를 실시하는 등 위기대응체계를 구축·운영하고...,2020. 2. 5.
"하동 쌍계명차, 십리벚꽃길 카페",하동 쌍계명차 지난번에 벚꽃을 구경하러 하동여행을 갔을 때 십리벚꽃길에서 들렀던 하동카페 쌍계명차를 소개 드려요 쌍계명차 브랜드 자체가... 들러봤어요 경남 하동군 화개면 화개로 30 055-883-2440 영업시간 매일 09:00 - 21:00 마감 19:00 - 21:00 네이버 지도 한 가지 단점은 주차하기가 힘들었어요...,2021. 3. 31.
1003.[경남/하동/카페]달달하동 - 수제도너츠,근데 비싸다 평점 3.5점 주소 : 경상남도 하동군 악양면 평사리길 28 전화번호 : 055-000-0000 (카드사 기준. 따로 없나보다) 영업시간 : 10:00~18:00 주차 : 공영주차장 이용 기타사항 최근 여행에서 예상치못한 변수를 많이 만난다. 요거프레소 하동평사리점에서 끝내주는 뷰를 보며 커피를 마시려...,2021. 6. 18.
"하동 가볼만한 곳, 초록 녹차잎 가득 도심다원","우리나라에서 수령 1,000년 된 차 나무를 보유하고 있는 다원으로 간단한 차와 녹차밭을 둘러볼 수 있게 되어있어서 하동을 찾은 여행자라면 누구나 둘러볼 수 있는 곳이기도 하다. / 주소. 경남 하동군 화개면 정금리 525 입장료 없음 오전 10시부터 오후 6시 사실 함께 간 동생도 나도 차보다는 커피를...",2021. 9. 23.
국내여행 하동 밥집 해성식당 재첩 모듬정식,배달도 하는듯 밥 다먹고 나와서 왠지 갑자기 찍어보고싶어 찍은 해성식당 앞 발샷 뛰어난 맛집 느낌 까진 아니었고 그래도 하동여행에서 재첩 다양하게 배부르게 해성식당에서 잘 먹고 온 것 같다 :) 해성재첩식당 위치: 경남 하동군 하동읍 섬진강대로 1877 T.055-883-6635 사진 무단도용 금지 #내돈내산,2021. 8. 29.
핫플레이스 하동 맛집 모음,주소: 경남 하동군 화개면 섬진강대로 3917 전화번호: 0507-1383-2677 영업시간: 영업시간 매일 08:00 - 20:00 연중무휴 주차 여부: 가능 기와집처럼 생긴 건물과 간판이 눈에 들어왔는데요. 화개장터 시외버스터미널에서 차를 이용해서 오니 1분 정도 밖에 걸리지 않는 거리에 있더라고요. 외부에는 이곳에서...,2020. 9. 19.
