header,contents,date
[6세 아이와 경주여행] 경주 맛집 스틸룸,다음에 오면 샐러드 종류를 꼭 시켜야지. 우리가 갔을땐 11시 부터 였지만 코로나 여파로 영업시간이 바뀐 듯 하다. 가기전에 인스타나 네이버 전화확인이 필요할듯. 주소 : 경북 경주시 원효로 87 2층 STILLROOM 화요일 정기 휴무 평일 : 17:00 ~ 02:00 주말 : 15:00 ~ 02:00 http://www.instagram.com/showcasek,2021. 7. 28.
"경주시, 랜선으로 떠나는 11개국 18개 도시 `가상여행 콘텐츠` 눈길",경주시 국제협력팀 페이스북 계정에 게시된 랜선투어 1탄 이집트 룩소르시를 소개하는 글 캡쳐본 [경북신문=장성재기자] 코로나19로 인해 해외여행이 제한되고 있는 가운데 경주시가 시민들의 여행에 대한 갈증을 해소하기 위해 자매·우호도시를 가상으로 여행할 수 있는 '랜선투어'를...,2021. 3. 11.
"경주맛집추천, 황리단길맛집, 경주여행/ 황남분식, 떡볶이 강추!","다음에 가면 떡볶이, 순대, 잔치국수 먹어야겠어요 ㅋㅋㅋㅋㅋㅋㅋ 언제 다시 갈수있을지 모르지만 메뉴부터 정해두기 ㅎㅎ히히 Tel : 054-745-2234 주소 : 경북 경주시 포석로 1062 (경북 경주시 황남동 308-4) 영업시간 : 월-일 오전 9:00 ~ 오후 9:00 #경주여행 #경주맛집 #황리단길 #황리단길맛집 #황남분식...",2020. 8. 31.
[경주 여행] 경주 가볼만한곳 - '동궁과 월지' 경주 야경투어 필수 코스,"[경주 여행] 경주 가볼만한곳 - '동궁과 월지' 경주 야경투어 필수 코스 안녕하세요 잇님들!^^ 이번 주말도 정말 더운데 더위 조심하시면서 즐거운... 주소: 경북 경주시 원화로 102 매장번호: 054-750-8655 운영시간: 매일 09:00~22:00 입장마감: 21:30 입장료: 성인 기준 3,000원 주차장 유무: 주차장 있음 이번...",2021. 7. 24.
아이와경주여행 불국사근처맛집 시원한 윤가밀면 경주밀면 맛집이예요,주소 경북 경주시 구매1길 21-12 윤가밀면 영업시간 매일 11:00 - 20:00 전화번호 054-777-7713 #경주밀면맛집 경주여행 시 꼭 맛보아야할 밀면 경주 맛직 가볼만한곳 윤가밀면에서 차로 3분거리 불국사와 석굴암이 있고 10분거리 문무대왕릉과 보문관광단지가 있어요. 그리고 경주 유일 밀면메뉴인 코다리...,2021. 5. 28.
[경북] 경주 황리단길 일식집 텐동맛집 '여도가주',"[경주 황리단길 텐동맛집 ‘여도가주’ 영업시간] 11:00 - 21:30 (주차장 없음, 예스키즈존-아기의자 완비) 위치 : 경북 경주시 포석로 1057-6 전화번호 : ***-****-**** ✔️ 경주 황리단길 텐동전문점 ‘여도가주’ 인스타그램 경주여행와서 밥을 먹기 위해 제일 먼저 방문한 텐동맛집 여도가주...",2021. 8. 16.
능뷰 경주 빵집 황남제빵소,"황리단길에서 조금 벗어나있어 생각보다 조용한 편이고 맛있는 빵도 가득인 곳이라 여행가신다면 추천하고싶은 곳이에요. 경북 경주시 황남동 328-6 054-620-5500 평일 10:00~20:00 / 주말 09:00~20:00 한옥 느낌의 외관이고, 2층 건물 두채가 이어져있어 멀리서도 쉽게 알아볼 수 있는 곳이에요. 매장도 커서...",2021. 9. 13.
경주 여행코스 서원에서 화랑풍류체험,"아름다운 가을 풍경과 걷기 좋은 산책로가 매력적인 고택에서 다도, 붓글씨, 선비복 체험 외에도 시조창, 판소리 등 흥겨운 공연을 즐길 수 있어서 기억에 남는 경주 여행코스가 되었다. 1. 옥산서원 토.일 무료체험 경북 경주시 안강읍 옥산서원길 216-27 1967년 3월에 지정된 사적 제154호로 조선...",2020. 11. 25.
"[경상북도] 경주맛집 _ 브레이크타임없는 파스타집, 해쉬(Hash)","(Hash) 경북 경주시 사정로57번길 15 ***-****-**** 매일 11:00~20:30 브레이크타임X 가격 토마토 해물스파게티 12,000 크림베이컨 리조또 12,000더보기 황리단길 로스터리 동경 근처에 '브레이크타임 없는 파스타 가게'라고 해서 찾아간 <해쉬>. 일 때문에 경주에 갔다가 주말 끼고 여행한 경주여행. 주말...",2021. 9. 30.
[경상북도] 경주맛집 _ 따뜻한 쫄면을 먹을 수 있는 경주 명동쫄면,"경주여행, 경주맛집 경주 명동쫄면 경북 경주시 계림로93번길 3 054-743-5310 매일 11:30~ 19:30분 화요일 휴무 메뉴 비빔쫄면, 오뎅똘면, 냉쫄면, 유부쫄면 모두 7000원 쫄면을 좋아하지만, 브레이크 타임이 없는 곳이라 미리 찾아둔 <명동쫄면> 황남빵 건물이 있는 골목으로 들어가서 명랑핫도그...",2021. 10. 2.
경주케익맛집 그여행 경주점 100% 우유생크림 딸기케이크,*** **** **** am11:00 - pm8:00 경북 경주시 용황로 68 https://instagram.com/b.h.f.h_gyeongju?utm_medium=copy_link 둘째의 천일 기념을 위해 방문한 그여행 경주점 그여행 생크림 딸기케익은 포항에서 케익 맛집으로 엄청 유명한데 경주점도 있다는 사실 !!! 매장 인테리어도 넘 감성 감성하지 않나요? 그...,2021. 5. 18.
올가을 경주 여행도 함 가보까?,하지만..맥문동이 있거나 없거나..경주 여행 오시면 황성공원 한번 와보시기 바랍니다. 이쯤되어서 12시가 되었습니다. 태극기휘날리는 젊은 엉아가 배고프다고 하니..번개같이 맛집을 검색을 해서 찾아갔습니다. 4.경주 황리단길 맛집 동리 주소..경북 경주시 사정로57번길3-1 오픈 10시반~3시45분...,2021. 9. 12.
[경북] 경주 황리단길 가볼만한 곳인 책방투어 독립서점 '어서어서',위치 : 경북 경주시 포석로 1083 전화번호 : ***-****-**** 어디에나 있는 서점 어디에도 없는 서점 그곳은 어서어서 서점 ✔️ 경주책방 문학전문서점 어서어서 인스타그램 경주 황리단길 메인거리에 위치한 어서어서 서점 경주여행 마지막 날 잠시 들려봤는데 기차시간이 촉박해 천천히 둘러보지...,2021. 8. 13.
경주 황리단길 카페 : 영지다방 경주카페,#경주여행 #경주카페 양지다방 경북 경주시 사정로57번길 7-2 매일 11:00 - 20:00 경주여행을 마무리하고 기차 시간까지 여유가 있어서 들린 양지다방! 인스타그램에서도 많이 보고 낮에 지나가면 안에 사람도 많은데 저녁시간 되니까 다들 밥 먹으러 갔는지 카페에는 사람이 없었다 외관부터 옛날...,2021. 10. 5.
경주여행 | 둘째 날 ♪,"혹시 경주 벚꽃여행 계획중이시라면 이번주에 꼭 가시길 강추 드려요. :) 체크아웃하고 벚꽃구경 실컷 한 다음 점심 먹으러 갔어요. 소옥 경북 경주시 포석로1050번길 29 전날 저녁에 위시리스트 맛집 놓치고 ‘소옥’은 꼭 가고야 말겠다고, 평일이지만 웨이팅 각오하고 1시쯤 도착했는데, 이미...",2021. 4. 2.
"[경주 여행] 신라의 시조 박혁거세와 초대 왕들의 왕릉, 경주 오릉",경주 오릉 경북 경주시 탑동 매일 09:00 - 18:00 3월~10월 매일 09:00 - 17:00 11월~2월 경주 시가지라고 할 수 있는 황리단길에서 남쪽에 위치해있는 경주 오릉 입구 쪽에는 박혁거세의 탄생과 신라 건국에 대한 만화 설명이 있었고 경주 오릉에 대한 설명과 경주 오릉의 전경을 그린 안내도가 있었습니다....,2021. 8. 31.
"[경주 여행]은행이 물들기 전 미리 가본... 은행나무, 운곡서원 찻집, 운곡산방, 가을여행",보통은 11월 10일경 즈음하여 노랗게 물드는데 최고 절정일 때 다시 와서 한 번 더 즐겨봐야겠습니다. 그 복잡함이 싫으시다면 조용한 지금에 운곡서원을 한번 찾아보는 것도 좋겠습니다. 경주 운곡서원 경북 경주시 강동면 사라길 79-13 경주 여행지 더보기 안석규 경북여행리포터의 10월 취재기사입니다,2020. 10. 16.
"추워도 매력만점*̥❄︎‧˚ 겨울 경주 인기 스팟 랜선 여행:: 화랑의언덕, 첨성대...",위치 : 경북 경주시 감포읍 오류리 588-3 불국사 많은 분이 학창 시절 수학여행 때 필수로 들러 봤던 곳 중의 하나가 바로 불국사일 텐데요. 첨성대와 함께 불국사 역시 '경주' 하면 빼놓을 수 없는 유적지입니다. 워낙 유명한 사찰이기도 하고 어렸을 적 교과서에서 많이 봐왔던 익숙한 곳이라...,2021. 1. 19.
경주여행 분황사 청보리밭,하지만 초록 청보리라면 무브무브 얼른 들러보아야할거같아요 비가 약간 내린후의깨끗한 공기와 맑은날씨로 힐링했던날 집가는길에 기차에서 찍은 일몰사진으로 마무리 경주여행 청보리밭 추천드려요 < 위치> 경북 경주시 분황로 94-11 분황사,2021. 5. 2.
경북 경주시_석굴암,"20.05.24. 귀염뽀작한 다람쥐가 많던 석굴암 오고가는 길이 너무 꼬불꼬불해서 내려오면서 은행/군밤 사먹고 멀미나서 죽을 뻔했다... 입장료는 성인 1인 6,000원 경치 좋고, 공기 좋고, 다람쥐 많고 #석굴암 #다람쥐 #경주 #가볼만한곳 #문화재 #경주여행",2020. 5. 25.
[2020타경11991] 경주시 경매 (경주시 동천동 근린주택경매),"목록1 건물 1층의 용도는 공부상 ""소매점""이나 실제로는 ""주택 및 점포임"" 오늘의 명언입니다 : 여행과 변화를 사랑하는 사람은 생명이 있는 사람이다. - 바그너 궁금하신 사항은 전화주시기 바라며, 사건번호 2020 타경 11991 (1) 를 꼭 말씀해주세요. 경북 경주시 동천동 704-231...",2021. 6. 25.
경주 여행 코스 교촌한옥마을 경주 최부자집(최부자댁)도 볼거리,"경주 여행코스 교촌한옥마을 경주 최부자집도(최부자댁)도 볼거리 경북 경주시 교동 교촌마을에 가면 전통의 향기 품은 기와집들이 있고 그 중에는 국가민속문화재 제27호 경주 최부자댁, 경주향교, 경주교동법주, 월정교 외 계림, 첨성대 등이 가까이 있습니다. 경주 여행 길에 계림을 지나 향교에...",2021. 5. 27.
경북 경주 가볼만한곳 황리단길 대릉원 불국사 석굴암 아이와 주말 여행,경주 석굴암 경북 경주시 불국로 873-243 054-746-9933 다음 경주 여행 코스인 석굴암으로 향했어요. 굽이굽이 정말 산길을 올라가서 도착할 수 있었네요. 불국사는 토함산 서쪽 중턱에 석굴암은 토함산 동쪽에 위치하고 있어요. 통일신라의 김대성이 창건한 불국사의 부속 암자네요. ◆ 경주 석굴암...,2021. 2. 6.
"[경북 경주] 황리단길 맛집, 카페, 소품샵, 책방 모음 :: 동리 / 가배향주 / 심상...",특히 저 눈이 달린 대릉원 키링은 귀여워서 찍어와봤어요 ㅎㅎ 위치 : 경북 경주시 포석로 1095 운영시간 : 평일 10:00 - 19:00 / 주말 10:00 - 20:00 (휴무일 인스타그램 별도 공지) 문의 : 0507-1487-1145 인스타그램 : @baeri3park 어서어서 여행에서 동네책방이 빠질 순 없죠! '어디에나 있는 서점...,2021. 9. 21.
경주가을여행 1박2일 프롤로그 #페이지,"경주1일여행을 마무리 지으면서, 가을 경주여행의 정을 나누었다. ♡옥산 ♡ 경북 경주시 금성로 407번길 ***-****-**** 왕릉가는길에서 아침일찍 산책에 나섰다. 참나무 아래에는 도토리 굴리는 소리가 들리고, 소슬바람에 일렁이는 숲속 식구들 의 살아있는 생명의 소리가 들렸다....",2020. 10. 10.
[경주여행] 가을엔 첨성대 핑크뮬리 그리고 첨성대 주차꿀팁,"가을 경주여행 첨성대 핑크뮬리 그리고 주차꿀팁 tmi 정말 주차하다 죽을 것 같았던 한시간 봄, 여름, 가을, 겨울 사계절 모든 시간이 아름다운 경주. 그리고 가을이 되면 경주에 피어나는 핑크뮬리. 경주 첨성대 : 경북 경주시 인왕동 839-1 생각보다 막히지 않는다고 생각했던 서대구를 뚫고...",2020. 10. 13.
[경북] 경주 황리단길 수플레팬케이크 디저트 카페맛집 '훌림목',"[경주 수플레팬케이크 카페 ‘훌림목’ 영업시간] 11:00 - 20:30 (주차불가, 루프탑 노키즈존) 위치 : 경북 경주시 포석로 1061-9 전화번호 : ***-****-****... 차분해지고 그런 느낌이 들 것 같은 나의 생각 수플레 완전 좋아하시는 분들에게 완전 만족할만한 카페 경주여행하며 한번 훌림목 들려보세요!",2021. 8. 13.
경북가볼만한곳 | 경북관광100선 챌린지투어 대구관광15선 여행하고 미션 수행하자!,◎ 문의 070-8709-9219 경북관광 100선 대상지 경북나드리 시군명 대상지 시군명 대상지 포항시 (8) 호미반도해안둘레길 경주시 (13) 동궁과월지 구룡포... 경북문화관광공사 #경상북도문화관광공사 # GCTO #경북관광100선 #경북관광챌린지투어 #경북관광100선챌린지투어 #경북나드리 #국내여행,2021. 7. 18.
"경주시, 자전거 타기 좋은 도시 만든다",안창한 기자 ********@****.**.** 출처 : 국민일보 부바커 마케팅경영관리부 Chloe 경북 경주시는 예전 여행 갔을 때는 대중교통이 이용하기 불편한 곳이었다. 경주가 관광단지로 조성되어 신라의 천년 역사 문화재가 많을지는 모르지만 버스의 배차 간격도 부산만큼 빠르지 않아서 여행객들의...,2021. 4. 9.
경주시) 올바릇식당,가족은 육전이랑 꼬막한판을 시켰어요 전체적으로 가격은 착한 느낌은 잘 모르겠어요 ^^; 여행오셨을때 한번 기분내기 좋을꺼 같아요 맛있게 잘 먹었습니다 올바릇식당 경북 경주시 보문로 368-5 1층 올바릇 식당 (웨이팅 있는편 / 회전율 빠름) 매일 : 11:00-20:00 (브레이크:15:30-17:00) 연락처 : 054-777-7793,2021. 3. 3.
[경북] 경주 황리단길 핫플 경주물회 한식맛집 '향화정',"[경주여행 황리단길 맛집 '향화정' 영업시간] 매일 11:00 - 21:30 (주차장 없음, 유아아기의자 완비) 경주 황리단길 물회맛집 '향화정' 위치 : 경북 경주시 사정로57번길 17 경주 황리단길 물회맛집 '향화정' 전화번호 : ***-****-**** ✔️ 경주여행 황리단길 한식맛집 '향화정' 인스타그램 육회물회와...",2021. 8. 3.
먹을 게 많던 경주 맛집 소개,"한옥 펜션도 같이 운영하고 있어서 여행 올 때 방문하기도 좋을 것 같았죠. 4. 콩이랑 콩이랑정식 9,000원 주소: 경북 경주시 보불로 97 번호: 0507-1423-4578 영업시간: 매일 08:00 - 22:00 명절 당일 휴무 착한 가격으로 푸짐한 두부요리를 맛볼 수 있는 콩이랑에 다녀왔어요. 경주에서 몇 안되는 늦게까지...",2021. 7. 30.
돋보이던 경주 보문단지 맛집 리스트,몇일전 친구들과 함께 다녀온 여행중에 찾아갔던 경주 보문단지 맛집을 소개할게요. 잘 달구어진 철판에 특제소스로 버무려진 닭갈비가 맛깔나서 만족스러운 곳이었어요. 1. 진성닭갈비&신라찜닭 주소 : 경북 경주시 알천북로 351 전화번호 : 054-772-9490 영업시간 : 11:00 - 23:00 메인메뉴 : 삼겹...,2021. 8. 3.
경상북도 경주시 ‘국립경주박물관’에 가서 2021년 2월 27일,3일 여행 일정을 친절하게 안내해 주셔서 발걸음도 가볍게 Go! #노서동석물입상 을 보고 노서동 경주시외버스터미널 옆에 있는 통일신라시대의 높이 120㎝의 석불 #慶州路西洞石佛立像 경주 노서동 석불입상 경북문화재자료 제11호 1985년 지정 경상북도 경주시 노서동 156-8 안을 자세히...,2021. 3. 3.
경주여행 현지인 추천 맛집 최영화빵 아시나요? 선물 요고 사세요,주소 경북 경주시 북정로 6-1 전화번호 054-749-5599 매일 09:00~21:00 네이버 정보 참고했어요^^ 이곳이 바로 현지인추천 맛집 최영화빵 본점이에요 경주여행 가면 늘 들려서 사서 집으로 와서 냉동실에 잘 모셔두고 우유랑 맛나게 먹는답니다 팥빵은 우유랑 조합이 최강이에요ㅎㅎㅎ 최영화빵 이야기...,2021. 5. 27.
"[경주 여행]교촌마을·월정교에서 만나는... 산책 여행, 비대면 여행, 가을 여행, 경주...",야경이 아름답기로 유명한 월정교의 야경을 보지 못해서 아쉬운 마음이 들었지만 교촌마을과 잘 어우러지는 가을풍경을 볼 수 있어서 즐거운 여행이었습니다! 교촌마을 경북 경주시 교촌길 39-2 월정교 경북 경주시 교촌안길 31 (교동) 경주 여행지 더보기 안다빈 경북여행리포터의 10월...,2020. 10. 23.
경주 :: 프랑스 다이닝 타베르나,타베르나 주소 :: 경북 경주시 첨성로81번길 18 영업시간 :: 12시 - 21시30분 브레이크타임 15시 - 17시 화요일 휴무 6월달에 방문했던 #타베르나... 경주데이트 #황리단길맛집 #경주여행 #황리단길 #황리단길다이닝 #분위기좋은경주맛집 #타베르나 #경주타베르나 #프랑스음식 #경주프랑스음식,2021. 10. 2.
"오류 고아라 해변에 또 다녀왔어요! (Feat. 경북산림환경연구원, 열매달 열여드레)","경북산림환경연구원 경북 경주시 통일로 367 경북산림환경연구원 다음 날 그냥 집에 가기 아쉬워서 경북산림환경연구원에 다녀왔어용 하지만... 평범, 무난 그래도 요런 포토존이 있다능!! 이렇게 이틀간의 경주여행을 마무리했네요 월요일이라늬 회사 도착하자마자 우울한 지금입니다... 다들 화이팅!",2021. 7. 19.
경주 찰보리빵 원조 신라명가 선물용으로 좋았어요,여행을 가면 그 지역에 명물은 꼭 먹어보고 와야 하니까 검색해봤는데 경주 찰보리빵이 선물용으로도 유명하더라고요. 여러 브랜드가 있던데... 경북 경주시 포석로 1035-2 #황리단길맛집 #신라명가 #경주신라명가 #경주핫플레이스 #경주명물 #경주찰보리빵 #경주빵 #황리단길체험 #경주체험,2021. 9. 30.
"[경북 경주] 무조건 재방문할 칼국수집, 조조칼국수 경주점 동죽칼국수+해물파전","0507-1360-3752 경북 경주시 북군길 3-6 매일 10:00 - 21:30 SBS투데이와 맛있는녀석들 방송 출연 맛집이다. 나는 이곳을 유튜브를 통해서 먼저 봤었다.... 총점 : 5 / 5 뭐 다른 조건들도 있지만, 식당의 본질인 '맛'에 너무 만족해버렸다. 서울에 없어서 아쉬울 뿐이다. 경북지역 여행가면 무조건 갈 집이다.",2021. 9. 3.
"[경주 여행]깊어가는 가을 학동마을의... 억새밭, 수의지 호수, 인생샷 명소, 가을여행","시원한 뷰 맛집과 함께 가을 추억 한 장 만들어보는 것은 어떨련지요. 이용시간 09:00~18:00 입장료 1인 2,000원/ 1견 2,000원 (7세 이하 무료) 연락처 오케이그린청소년수련원 054-753-7001 화랑의 언덕 경북 경주시 산내면 내일리 산261-1 경주 여행지 더보기 안석규 경북여행리포터의 10월 취재기사입니다",2020. 10. 7.
경주여행 아이와가볼만한곳 독채풀빌라 라파미키즈풀빌라,큰아이가 역사에 관심도 많고 유적지 보고싶은것도 많아서 이번에 아이들과 경주역사여행 다녀왔어요. 얼마만에 가보는 경주인지 고등학교... *주소* 경북 경주시 외동읍 죽동길 160-98 *영업시간* 입실 15:00퇴실 11:00 *미온수 무료제공* 풀빌라 실내수영장 전 객실 실내풀 미온수 최초 사용 미온수...,2021. 5. 26.
두부마을(경주시 마동 소재),두부마을 경북 경주시 불국로 168-3 영업 08:30 ~ 20:00 불국사와 석굴암 등 수학여행의 명소?로 알려진 불국동 인근에 위치한 두부요리 맛집입니다. 어린이들이 좋아할만한 두부스테이크도 있고 두부가 원래 어른들이 좋아하시는 메뉴기 때문에 가족메뉴로 딱인 것 같습니다. 주차장은 넓은...,2021. 2. 13.
여름 휴가 국내 여행 추천 울산 경주여행 코스 해오름동맹 한 번에 한주 살기,"경주여행 1. 기림사 054-744-2292 경북 경주시 문무대왕면 기림로 437-17 우리나라를 대표하는 사찰인 불국사가 경주에 있지만 누군 죽기 전에 꼭 가봐야 할 사찰이 경주 기림사를 말하기도 합니다. 기림사는 경주에 올 때까지만 해도 몰랐던 절인데, 현지인이 꼭 가보라고 해서 찾은 절입니다....",2021. 7. 7.
감동이었던 경주 불국사 맛집 리스트,"1.유수정불고기쌈밥 영양돌솥밥17,000원,해물파전 13,000원 주소:경북 경주시 보불로 26 전화번호: 054-771-0786 영업시간:10:00-20:30(매주 수요일 정기휴무) 이날 갔었던 유수정불고기쌈밥은 불국사에서 차로 5분 정도 걸렸어요. 한옥의 느낌을 제대로 살린 큼직했던 건물이라 저멀리에서도 쉽게 찾을 수...",2021. 8. 29.
경주 가볼만한곳 대릉원에서 황리단길까지 7곳,"얼마전 신랑이랑 같이 1박2일로 경주여행을 했어요. 더위도 이제 한풀 꺾이고 가을이 곧 다가올 모양인데요, 가을의 풍취를 느낄 수 있는 경주 가볼만한곳 정리해 보았어요. 1. 경주 추억의 달동네 주소: 경북 경주시 하동 181-1 영업시간: 08:30~ 19:00 (봄,가을,겨울) 여름은 오후 8시까지~ 문의처: 054...",2021. 9. 8.
"경북 애견동반 부족할거없는, 경주펜션여행",오늘 포스팅은 강아지와 함께 여행을 떠날 준비가 되어 있는 분들을 위한 포스팅이 아닐까 싶어요! 사람은 물론이고 애견들 까지 편안하게... 입실 - 15:00 퇴실 - 11:00 사이트 바로 가기 - http://www.gjchezlee.kr/page/ 주소 - 경북 경주시 하동 1길 45-4 전화 - 054-777-1550 그 외에도 부대시설이 워낙 다양한지라서...,2021. 6. 16.
골프여행 브로와 함께 떠나요,"브로와 함께 떠나는 블루원 리조트 골프여행 코로나19 장기화로 사회적 거리두기 5인 이상 모임 금지 방역 수칙이 이어지면서 골프... 블루원 디아너스 C.C 위치 : 경북 경주시 보불로 391 규모 : 420,000평 (회원제 27홀) 코스 설계 : 임골프 디자인 영남권을 대표하는 명문...",2021. 4. 8.
눈에띄던 경주 보문단지 맛집 소개,얼마 전 가족들과 여행을 갔다가 경주 보문단지 맛집에서 식사를 했답니다. 칼칼한 양념은 노하우가 가득했고 푸짐하면서 철판에 볶아먹는 볶음밥까지 기가 막혀 만족스러웠던 곳을 소개해볼게요. 1. 진성닭갈비&신라찜닭 주소 : 경북 경주시 알천북로 351 전화번호 : 054-772-9490 영업시간 : 11:00...,2021. 8. 14.
경주시 양남카페 카페어린왕자,경주시 양남카페 카페어린왕자 이번 여름에는 경주에 다녀왔다- 단짝이네 부모님도 뵙고 할 겸 경주 여행도 할까싶어 다녀왔었는데 가보고... 0507-1321-0693 경북 경주시 양남면 양남로 40-17 #경주카페 #바다풍경카페 #울산카페 #울산정자카페 #울산강동카페 #힐링카페,2021. 3. 12.
경북 경주 맛집 :: 신호등장작구이,최근 SNS에서 핫한 신호등 장작구이 난동이가 꼭 먹어보고 싶다고 하여 지난번 경주여행때 도전 했었다 신호등장작구이 주소: 경북 경주시 석현로 85 영업시간: 평일 17:00-24:00 / 주말 12:00-24:00 주차장 있음 경주 시내가 아닌 외곽지에 있어서 차로 이동하는게 아니면 불편한 위치였다 내부는...,2021. 8. 28.
"경북여행 / 경주여행 / 화랑의언덕 / 황리단길(도깨비명당,어서어서책방,대릉원사진관...","경북 경주여행 화랑의언덕 -> 황리단길 -> 첨성대(유채꽃) 이번에는 경주에 다녀왔어요~! 경주는 대구에서 멀지 않아 수도 없이 여러번 갔었지만 가도가도 먹을거리, 볼거리가 많은 거 같아요 ㅎㅎ 화랑의 언덕 경북 경주시 산내면 내일리 산261-1 캠핑클럽이라는 예능 프로그램에 나와서 유명해진...",2020. 4. 16.
"경북 천년의 자연이 소문난 명문 골프장, 경주신라cc 회원권 시세 살펴볼게요",여행을 즐기는 목적으로도 손색이 없는 곳입니다. 거리도 매우 훌륭하다는 점에서 관심이 생기네요. 오랫동안 좋은 이용이 가능한 구장이라... 주소 : 경북 경주시 보문로 319 경주 보문단지의 중심에 위치한 모습을 보이고 있기도 합니다. 경주역에선 10분 거리에 위치해 누구나 접근하기 좋은...,2021. 8. 24.
캠퍼스투어071 경북 경주 서악서원 & 도봉서당 지식의 전당을 여행하는 히치하이커를...,"테마여행신문 TTN Korea 캠퍼스투어(Campus Tour)와 함께 어제도, 오늘도, 내일도 멋진 진리여행을! B 눈으로만 보는 한옥? 하룻밤 머무르는... 경북 경주시(慶州市) 함께 둘러보기 좋은 곳 D-1. 양동(良洞)마을 D-2. 경주 대릉원 일원(慶州大陵園一圓) D-3. 식당 : 이풍녀구로쌈밥 D-4....",2020. 12. 23.
경주여행 코스 가족여행 만족도 100%,이었네요 -찾아가는길- 경북 경주시 새골길 193 054-748-1049 오전 10:30~저녁9:00 여기가 우리가족이 경주 여행 코스중에 먹고온 식당 이에요 입구부터 느껴지는 분위기도 시골집 처럼 정겨워서 더 좋더라구요~ 부모님께서도 첫인상 부터 만족 스러워 하셨어요! :) 사실 몇달전 남편과 왔을때 이 일대에...,2020. 8. 14.
