header,contents,date
하동 여행 입석마을 마을미술관 선돌 개관 기념전 음매 나 여기 있소,모두 축하하는 내용이었습니다. 하동 지리산 둘레길에서 만날 수 있는 마을미술관 악양 선돌 미술관 하동 여행을 계획하고 계신다면 최 참판 댁 근처에 있는 입석마을을 한번 방문하여 보세요. 즐거운 시간이 되실 것입니다. 마을미술관 선돌 경남 하동군 악양면 입석길 38-1,2021. 6. 16.
"가을의 길목에서, 경남 하동 평사리",경남 하동군 악양면 평사리 들판 누군가에게는 고된 노동의 현장이지만 누군가에게는 여행의 평온을 주는 휴식 같은 풍경입니다. 경남 하동군 악양면 평사리 공원 평사리 들판 앞쪽에는 평사리 공원이 조성되어 있습니다. 내려가서 가보지는 못했지만 여러 가지 아기자기한 조형물이...,2021. 9. 11.
"잠깐 들렀던 하동 최참판댁, 평사리토지장터주막",쳐묵하다 여행 콜해놓고 밤에 비가 너무 많이와서 집까지 못가는 바람에 새벽에 짐싸놓고 대기하기로 한게 무산됨 쯧쯧-.- 해도해도 너무... 다름) 경남 하동군 악양면 평사리길 66-7 매표소 바로 못가서 소형주차장이 있어서 거기다 대고 이동헸디 안에 차가 있긴 하던데 관광객은 못 들어가나?...,2021. 10. 5.
하동 여행 가볼만한곳 동정호 수국 둘레길 산책,하동 여행 마지막 날 여유로운 아침 산책을 즐기러 일찌감치 동정호에 방문했어요. 원래 여기는 유럽 수국으로 유명한 하동 가볼만한곳인데 타이밍이 안 맞아서 아쉽게도 수국은 보지 못했지만 조용한 호수 풍경이 너무 예쁘더라고요. 경남 하동군 악양면 평사리 305-2 입장료/주차비는 무료입니다....,2021. 6. 19.
[여행] 하동 ‘백학제다’ 햇녹차와 만송포,"시음장 주소 : 경남 하동군 악양면 평사리길70-4 <백학제다> 박경리 문학관 맞은 편에 있어요. 하동이 녹차로 유명한지 몰랐어요! 차 마시는걸 즐기지만 차에 대해서 깊게 공부해본적은 없어요. 서울에서 대만차 티하우스 가보고,, 해외여행 갔을때 찻잎 사오는 정도입니다. ㅎㅎ 하동 화개 쪽에 놀러...",2021. 5. 16.
정두수 작사가의 시상 가득한 하동 고전면 배다리공원,네이버 검색 물레 방아 도는데 시비 가수 나훈아가 부른 '물레 방아 도는데'의 노랫말의 배경이 된 곳은 경남 하동군 고전면 배드리다. '돌담길... 네이버 검색 찾아오시는 길 여행 팁!! 인근 가볼 곳 소개 고전면 고하마을에 정두수 기념관이 있습니다. 하동읍성이 이 마을에 있습니다. 꼭 보고 가시길...,2021. 10. 6.
[여행정보] 사회적 거리두기엔 ‘승차 여행’ 경남 드라이브 코스 추천,오늘은 경남도가 선정한 #경남드라이브스여행 코스 13곳을 소개해드리려고 합니다. 출처 : 한국관광공사 1. 창원 창포 해안 길 수많은 섬과 만으로... ※ 위치 : 경상남도 하동군 청암면 중이리 170 출처 : 한국관광공사 12. 산청 정취암 가는 길 기암절벽에 매달린 정취암으로 가는 길로 신등면...,2020. 5. 12.
섬진강 맛집 지리산흑돼지,"경남 하동군 금성면 산업로 823 오늘 알려드릴 섬진강 맛집은 궁항리에 있는 지리산 흑돼지라는 곳이에요. 참고로 둘째, 넷째 월요일은 휴무이고... 하동 여행을 계획하면서 밥먹을 곳을 찾다가 후기를 정말 많이 보고 사진도 여럿 봤지만 생생한 후기에 이끌려 하동 지리산흑돼지에 방문했는데요....",2021. 9. 9.
"경남 여행 중에 섬진강 뷰 보러 가볼만한 곳, 카페 겸 전망대 평대리 스타웨이 하동",오래 있지 않아서 잠시 쉬다가 돌아왔기도 하고 날씨가 흐려서 아쉬움이 많았기에 다음에 다시 와야겠습니다. 카페를 이용하지 않아도 전망대만 구경할 수 있기 때문에 하동을 여행하신다면 방문하는 것을 추천드립니다. 스타웨이하동 경남 하동군 악양면 평사리 1163-1 055-884-7410 09:30 ~ 20:30 (연중무휴),2021. 6. 24.
자연관광 최고 명소 18선/한산하게 경관을 즐길 수 있는 언택트 여행지(경남 여행),"코로나로 여행이 쉽지 않은 요즘이다. 비교적 한산하게 즐길 수 있는 비대면 여행지로 경상남도에 소재한 자연관광 최고 명소 18선을 알아보았다.... 국립공원으로 경남 하동군을 비롯하여 3개도, 5개 시,군, 15개 읍, 면에 걸쳐있는 명산 중의 명산이다. 최고봉은 천왕봉(1,915m)이다. 지리산...",2021. 1. 6.
(경남하동여행)섬진강 습지공원 - 잘 알려지지는 않았으나 갈대와 강의 조화가 아름다운...,< 주소 > 경상남도 하동군 고전면 신월리 1450-1 예전에 하동에 갔다가 우연히 보게 된 공원 네이버 지도에 검색조차 되지 않는 이곳은 섬진강... 태국을 여행할 때 보았던 어느 해변과 비슷한 느낌이 들어서 필자에겐 상당히 이국적인 느낌이 들었다 사진이 찍힌 갈대 모습이 붓질로 갈대의 모습을...,2020. 3. 18.
[국내여행/하동]하동 여행기 #2 (+하동 올모스트홈스테이/한옥숙소/식사/경비/일정 등),"com/luvvving/222348235072 숙소 : 144,000원 (하동 올모스트 홈스테이 by 에피그램) 하동 올모스트 홈스테이 by 에피그램 주소 : 경남 하동군 악양면 평사리길 75 전화번호 : 055-882-5094 Previous image Next image 1편 서두에 써놨듯이 사실 하동 여행은 여기를 가기위해 시작된것이다것이다.. 음 여기는 예약이...",2021. 5. 12.
하동 여행 가볼만한곳 최참판댁,하동 여행응 하게되면 꼭 가봐야할곳이 여러곳이있는데 그중 최참판댁 방문 해봤어요! 위치 : 경남 하동군 악양면 평사리길 66-7 영업시간 : 평일 09:00 - 18:00 연중무휴 ️ 주차장 따로 마련되어 있어요 주차를 한뒤 소독 후 매표소를 거쳐 표를 끊고 입장해야한다 최참판댁 입장료는 성인 2000원...,2021. 7. 3.
경남 하동 금양가든 재첩정식,제주도 여행 취소되고 급으로 다녀온 하동. 제주도 취소 된 것도 서러운데 마지막 날 비도 많이 쏟아지고 기분 다운되서 마지막 점심으로 재첩정식을 먹고 집으로 가기로 해서 들렀던 금양가든. 금양가든 경남 하동군 하동읍 섬진강대로 1877 재첩식당들이 몰려있었지만 검색 후 가장 리뷰가 좋았던...,2021. 9. 24.
하동군 맛집 이화가든 다녀왔어요~,또한 경남 하동군의 향토음식이라 요 참게탕을 먹으러 하동군 맛집에 많이들 방문하신다고 해요 :) 그 중에서 이화가든이 유명한 이유는 바로... 이화가든은 여러 매스컴에도 방영이 되었던 찐 하동군 맛집이에요~ 여행을 가면 그 곳 향토음식을 꼭 먹어보는 편이라서 찾아보고 방문했어요 ㅎㅎ...,2020. 10. 10.
하동 피크닉레스토랑 카페 : 라라북천,하동맛집&카페 : 라라북천 경남 하동군 북천면 경서대로 2425 카페 라라북천 매일 09:00 - 20:00 / 화요일 휴무 벌써 북천에 코스모스가 폈어요 가을이... 카페였어요 #하동카페 #하동맛집 #하동북천카페 #북천카페 #북천맛집 #북천코스모스 #하동애견동반 #하동애견동반여행 #하동애견동반카페...,2021. 9. 26.
하동(여행) 사진 감상,화개장터를 부른 조영남 상 경남 하동군 악양면 박경리 문학관. 박경리 시 토지(나남출판사) 서문. 대하소설을 25년에 걸쳐 집필하면서 4만 매의 원고지에 600만 자로 이룩한 우리 문학 최대의 작품. 한 사람의 소설가가 감당하기에는 힘든 작업이라고 생각한다. 토지 주요 등장인물 상상도(가운데...,2021. 5. 17.
하동 가볼만한곳 4월 쌍계사의 봄 여행코스,"평소 멀게만 느껴져 자주 여행하지 못해서인지 처음 가볼 쌍계사에 대한 설레임과 기대감도 함께 발걸음은 가볍기만 했습니다. 쌍계사 주소 : 경남 하동군 화개면 쌍계사길 59 시간 : 매일 08시 ~ 17시30분 입장료 : 성인 1인 2,500원 무료주차장 : 2곳 3월중순쯤 찾았음 이 길은 멋진 벚꽃터널이었을...",2021. 4. 10.
경남 하동 여행 삼성궁 신비롭고 아름다운 하동의 숨은 명소,"TOUR 하동 삼성궁 하동 2박 3일 여행 1DAY 안녕하세요! 핑크쥬입니다 :) 저는 이번 근로자의 날과 어린이날이 껴있는 나름 연휴에 남편과 하동으로... 3,000원 경남 하동군 청암면 묵계리 055-884-1279 주차를 하니 바로 앞에 이런 곳이 보였는데 여기가 청학동이더라고요 티브이에서만 보고 듣고 했던...",2020. 5. 5.
섬진강 따라 1박 2일 - 경남 하동 (2021. 10. 2.),"계획없이 갑자기 떠난 여행. 하루 코스로 갈지, 1박을 할지도 결정하지 않고, 언젠가 섬진강을 가보자 했기에 그냥 섬진강을 끼고 있는 곡성, 구례... 쌍계사 구층석탑 최참판댁 (토지 촬영 세트장) 경남 하동군 악양면 평사리, 박경리 작가의 대하소설 <토지>의 무대가 되는 곳이다. 최참판댁은...",2021. 10. 5.
경남 하동여행 필수코스 '천년차밭길 정금차밭' (ft. 사진찍기 좋은 녹차밭 뷰),:) 추천할만한 하동여행지 '하동천년차밭길' 푸르름으로 가득한 하동여행 필수코스 '정금차밭' 천년차밭길 경남 하동군 화개면 정금리 산 144 [찾아가는 방법] '정금새마을회관' 근처 공영주차장 검색 or '이모션펜션' 검색 → 두 가지 방법 모두 도보로 약 10분 소요 제가 숙소로 선택한 '이모션펜션...,2021. 6. 1.
경남 하동여행 최참판댁 박경리 문학관,박경리 문학관 경남 하동군 악양면 평사리길 79 (경남 하동군 악양면 평사리 705) 평일 09:00 ~ 18:00 055-882-2675 거리두기 1단계였던 시절.. 하동에 일이... 하동여행 #하동폐쇄 #하동관광명소폐쇄 #관광명소폐쇄 #하동코로나 중앙에는 박경리 소설가와 관련있는 책이며 소품들이 놓여있고 벽쪽으로는...,2020. 12. 22.
[3년 전 오늘] 2.하동여행/2018.하동북천 코스모스.메밀 꽃축제/가을꽃축제/힐링여행~,"메밀꽃축제가 열리고 있답니다. 하동북천에서 일억송이 가을꽃과 함께 힐링여행 맞이해봅니다. 제12회하동북천 코스모스.메밀 꽃축제 2018.9.21~10.7(17일간) 경남 하동군 북천면 직전마을 꽃단지 일원에서~ 경전선 페선구간,북천역~양보... 애니의 사랑이 담긴 방",2021. 10. 1.
둘이서 떠나는 여행 (경남하동 당일코스),경남 하동 데이트코스 당일여행 당일코스 : 하동읍 - 매암제다원 - 화개장터 - 삼성궁 - 하동송림공원 1. 매암제다원 경남 하동군 악양면 악양서로 346-1 매암다원문화박물관 http://naver.me/5i6vem7 20대 30대 인스타 핫플 잘 가꾸어진 녹차밭과 지리산 능선이 어우러진곳 악양 녹차밭은 탁트인 풍경이...,2020. 7. 29.
경남 하동 여행 장터 하면 화개장터 이제는 5일장이 아니다,ㅋ 화개장터 경남 하동군 화개면 탑리 노래뿐만 아니라 오래전부터 전국에서 알아주는 5일장이었습니다. 지리산 일대의 약초와 전라도 곡창 지대의... [빙뉴스랑~ 여행가게~] 글 / 사진 우리의 여행은 구례에서 시작해서 하동에서 마무리합니다. 마지막 일정은 화개장터에서 ^^* 사람들이 몰려들고...,2021. 4. 9.
하동 여행 가볼만한곳 쌍계사 & 십리벚꽃길 벚꽃엔딩,"누가 시켰다면 못할 짓이지만 그래도 즐거워하던 하동 여행의 추억입니다. #하동가볼만한곳 벚꽃개화는 타지역에 비해 빠르지만 동백꽃과 매화는 늦게 펴서 벚꽃, 동백, 매화 등의 여러 봄꽃을 한꺼번에 구경할 수 있는 행운도 있었습니다. 하동 쌍계사 경남 하동군 화개면 쌍계사길 59 매일 08:00~ 17...",2021. 4. 5.
"경남 남해 가볼만한 곳 - 독일마을, 다랭이논",지도를 보면 알젰지만 시간 낭비 없이 남해여행을 위해서는 남해시의 동쪽에 위치한 숙소를 잡는 것이 유리하다는 뜻이다. 노량대교와 남해대교 (사진 : 남해군 홈페이지) 경남 하동군 금남면 노량리와 남해군 설천면 노량리 사이를 연결하는 남해대교는 총 연장 660m의 연륙교(連陸橋)다....,2021. 10. 4.
경남 하동 여행 아름다운 사찰 쌍계사,대웅전 오른 편에 쌍계사 마애불(경남 문화재자료 제48호) 경상남도 하동군 화개면 쌍계사 대웅전의 동쪽에 있는 큰 암석의 한 면을 움푹 들어가게... 고즈넉함이 좋은 아름다움 사찰입니다. #경남여행 #하동여행 #벚꽃십리길 #쌍계사벚꽃 #쌍계사동백꽃 #하동가볼만한곳 #아름다운사찰쌍계사,2021. 4. 8.
박수쳤던 하동 맛집 리스트,하옹촌재첩식당 메뉴 : 모듬정식(2인이상) 주소 : 경남 하동군 하동읍 섬진강대로 1877 영업시간 : 매일 08:00 - 20:00 연중무휴 전화번호 : 0507 1323 8261 이날 찾아간 하옹촌재첩식당은 하동군청에서 차 타고 3분안에 도착했어요. 빨간 간판이 우뚝솟아 있는것이 도로변에서 제일 눈에 튀었어요....,2021. 8. 6.
화개장터 가볼만한곳│향이 좋은 찻집 인테리어 좋고 사진찍기 좋은곳 [쌍계명차] @경남...,하동녹차는 유명하기도 하고 구례 하동 여행을 하다보면 작고 큰 규모의 여러 다원들을 만나게 되는데 밭처럼 생긴곳에 원두막하나 덜렁 있는곳도... 쌍계명차 가게주소 : 경남 하동군 화개면 화개로 30 (탑리 621-7) 영업시간 : 매일 09:00~21:00 마감 19:00~21:00 전화번호 : 055-883-2440,2020. 7. 29.
[경남 하동 북천맛집 추천] 고사리와 짬뽕의 조합 이색맛집 고사리해물짬뽕,[경남 하동 북천맛집 추천] 고사리와 짬뽕의 조합 이색맛집 고사리해물짬뽕 안녕하세요 도엉이애오:-) 저번에 #하동여행 다녀왔다고 #하동숙소... 계란이랑 가티 목으면 꿀맛 >_< #하동맛집 #북천역맛집 #고사리해물짬뽕 해장메뉴로 추천이용 :-) 고사리해물짬뽕 주소 : 경남 하동군 북천면 경서대로...,2021. 9. 21.
싱그러운 봄의 마지막을 느끼기 위한 '경남 생태여행지' 7선,<창원 주남저수지> 문의: 055-225-3486 홈페이지: https://www.changwon.go.kr/depart/contents.do?mId=0315010000 <2> 하동 탄소없는 마을 경남 생태여행지 사진 - 하동군 하동 탄소없는 마을은 우리나라 최초의 국립공원인 지리산 내에 위치한 마을이다. 천혜의 자연을 잘 지키면서 방문객이 힐링과 치유를 할 수...,2021. 5. 4.
[경남 하동 / 에어비앤비] 하동 카사비앙카 :: 하동 숙소 추천 / 부모님과 하동 가족여행...,"그래서 어른들 모시고 가는 가족여행 숙소로 추천해보려고 합니다. 1. 하동 에어비엔비, 카사비앙카 가는 길 주소는 경남 하동군 하동읍 예인촌길 12 사장님이 보내주신 사진 길 헤맬까봐 가는 길을 설명해주시더라고요. 네비 따라서 가다 OK무인텔 보이면 속도를 줄이고 무인텔 지나 두시 방향으로...",2021. 7. 4.
경남 하동 여행코스~여기 어때요?,이미지출처 : http://www.starwayhadong.com/html/02/01.php 경남 하동군 악양면 섬진강대로 3358-110 문의 : 055-884-7410 하동의 랜드마트라 불리는... http://naver.me/FrLEG9Hi #하동여행 #경남여행코스 #스타웨이하동 #평사리공원 #해뜰목장 #하동데이트 #매암제다원 #삼성궁 #경남신혼여행,2020. 11. 18.
자연 속으로 떠나는 둘만의 아늑하고 편안한 국내여행,"경남 하동군 악양면 평사리길 75 www.kolonmall.com/EPIGRAM ⓒ 박기훈 강원도 춘천, 의림여관 다양한 관계가 얽히고설킨 복잡한 현대사회에서 사람들은 사람에 지쳐간다. 요즘 사람들에게 필요한 것은 바로 단절과 고립으로 치유되는 고독 여행이다. 춘천 의암호 인근 드름산 자락에 위치한...",2021. 1. 30.
경남 하동 여행 가볼만한 곳 눈 호강 장소 추천 <도심다원/쌍계사/삼성궁>,"#하동군여행 은 차가 필수다. 인구에 비해 면적이 넓기 때문인데, 덕분에 우리나라의 자연을 느끼기 좋은 지역이다. 7월에 다녀온 #하동여행 에서 자연이 가득했던 장소 세 곳을 소개한다. 1. 차밭 한가운데 정자에서 즐기는 여유 #도심다원 자연이 보존되어 있는 동남아 어느 마을에 온 것 같은 풍경....",2021. 8. 2.
<17> 할아버지 수소차로 가보는 신박나는 한국 섬 여행,"행정 구역상으로는 광양시와 경남 하동군의 경계 부근에 있으며, 배알도라는 이름은 해수욕장 건너편의 망덕산(광양시 진월면 망덕리 소재)을... 할머니 무덤 상상 설계도 : 인천 강화군 하점면 부근리 북방식 고인돌 무덤 ■ 마시멜로 - 돌시멜로 할머니와 윤찬이의 말 잇기 게임은 여행 내내...",2021. 10. 5.
"정동원길, 우주총동원 카페/ 구례 하동 여행, 경남 가볼만한 곳",나 이거 왜 구경하고 있니 미스터트롯 멤버별 부스도 있고 동원이 관련 물품 전시장도 있다 이건 동원이의 첫 색소폰 ㅋㅋㅋㅋㅋㅋㅋㅋㅋㅋ 우주총동원 경남 하동군 진교면 구고속도로 392 매일 09:30 - 19:30 여러 부스 옆에는 카페가 하나 있는데 우주총동원 카페 3층은 동원이 가족들 집이라고 함...,2021. 5. 10.
경상남도 하동군,"화개장터(★★☆☆☆) (경남 하동군 화개면 탑리) 전라도 와 경상도를 가로지르는~♬(조영남 ""화개장터"") 네~! 맞습니다. 화개장터가 하동에 있어요... 다 맛나요..적극 추천 1인 1만6천원이면 저렴한 가격은 아니지만 여행이니 적극 추천드립니다. 제첩국, 제첩부침개, 제첩막국수 등 먹을게 정말...",2020. 7. 15.
경남 하동 비바체리조트 - 수영장 /객실,경남 하동군 청암면 청락호 876 체크인 15:00 체크아웃 11:00 #하동비바체리조트 #비바체리조트 #하동비바체 #하동가볼만한곳 #하동갈만한곳 #하동펜션 #하동 #하동리조트 #경남가볼만한곳 #경남펜션 #하동호 #경남리조트 #경남하동가볼만한곳 #하동계곡펜션 #하동숙소 #하동숙박 #하동여행 #경남숙박...,2021. 6. 14.
경남동네여행,"하동군 악양면 가을 끝자락에 앉아 쉬어가는 하루 악양면에서 만난 사람들 25. 남해군 남해읍 마을 지키는 고목 아래 젊은 감성 활기 남해읍에서 만난 사람들 경남 동네여행 리뷰보기 작가 이서후, 김민지|김해수... 출판 피플파워 발매 2020.12.11.",2021. 1. 7.
경남 가볼만한 곳 골목길 갤러리 (힐링여행),오늘은 나의 시골인 (경남 하동군 악양리 하덕마을)을 한 번 소개해보자 한다 ㅎㅎ 지금까지 본 마을 중에 가장 아름답다고 자부한다 기차에서... youtube.com/watch?v=sUcb59ztsy4&t=17s 그럼 다음에 만나요 모두 즐거운 하루 보내시구요 ^^ #여행 #힐링 #경남여행 #갤러리마을 #너무이쁜곳,2021. 2. 10.
스타웨이하동 가볼만한곳 인가? 경남 여행 가족이랑,(코로나 확진자 줄고 나면 ㅠㅠ) #스타웨이하동 경상남도 하동군 악양면 평사리 1163-1 (섬진강대로 3358-110) 09:30 - 22:00 #하동여행추천코스 #경남하동여행 #하동스타웨이 #하동가볼만한곳추천 #하동가족여행 #경남여행 #섬진강뷰카페 #오션뷰카페 #하동카페 #하동카페추천,2020. 11. 22.
경남 겨울 여행 경남 눈썰매장 개장 하동 금오산랜드,"경남 겨울 여행 경남 눈썰매장 개장 하동 금오산랜드 경남 겨울여행, 2020년 경남 눈썰매장 개장했어요. 경남 눈썰매타기 좋은곳 하동 금오산랜드... 하동 금오산랜드 눈썰매장은 경남 하동군 진교면 안심리 구고속도로의 금오산 자락에 자리를 잡았어요. 금오산랜드 눈썰매장은 하동 핫플레이스로...",2020. 12. 24.
경남 하동 여행 5일차 전남 구례5일시장 및 구례 맛집 방문 원조 수구레국밥,결국 자두 만원어치와 파프리카 5천원어치는 망설임없이 구매 하동군에 바다가 있다는 사실! 혹시 알고 계셨나요? 어릴적부터 집안이 하동과... 되세요 #하동여행 #구례여행 #경남하동여행 #전남구례여행 #구례맛집 #구례시장 #구례오일장 #구례5일시장 #구례5일장 #구례오일장맛집 #수구레...,2021. 7. 24.
"하동여행, 경남하동카페 / 녹차빙수가 맛있는 티스토리하동","경남 하동 여행 다녀왔어요! 하동하면 화개장터 쪽에 위치한 요 #하동십리벚꽃길 놓칠 수 없죠! 도로 양 옆으로 나무가 우거져서 벚꽃이 없어도... 근데 정말 기본 스타일이라서, 하동여행 중이시라면 녹차빙수나 홍차빙수 드셔보시길 ㅎㅎ 하동여행 하동군카페 추천 티스토리하동 시간 매일 11:00~22...",2021. 6. 14.
<자전거 여행>38.경남 화개면,"낮은 포근하고 밤은 서늘해서 늘 맑은 이슬이 내린다.이슬을 맞고 차나무가 자란다. 봄에 이 나무의 새순을 달여 먹으면 마음이 가벼워진다. 옛 글에는 ""두 겨드랑이 밑에서 서늘한 바람이 인다""(<동다송>)라고 적혀 있다. #김훈 #자전거여행 #경남하동군화개면",2021. 5. 8.
"하동매암제다원, 경남하동가볼만한곳",하동으로 여행갔을때의 기록입니다 :) ㅋㄹㄴ도없던 시국.. 그립댜.. 경남하동가볼만한곳-하동매암제다원 ***-***-**** 경남 하동군 악양면 악양서로 346-1 10:00~18:00 월요일휴무 홍차 5000~6000원 녹차5500~~6500원 구불구불 들어가다보면 한적한곳에 위치해있는 경남하동 매암제다원 주차를 해놓고...,2021. 4. 5.
"하동군 맛집, 쌍계수석원식당","하동군 맛집, 쌍계수석원식당 ***-***-**** 경남 하동군 화개면 쌍계로 571-2 #하동군맛집 #하동맛집 #쌍계사맛집 #내돈내산 #내돈내먹 #하동군여행 #하동여행 #국내여행 #역마살쟁이 #보리여행 영양찰솥밥 먹으러 찾은 쌍계수석원 식당 켄싱턴 하동? 이라도 가까워서 거기 머무시는 분들도 자주 가시는...",2020. 11. 11.
하동 매암제다원 녹차밭 카페,하동여행하면 인스타그램에서 가장 많이 올라오는 이 사진은 매암차문화박물관의 차의 제조와 관련된 유물전시실에서 녹차밭을 바라보며 찍는 포토존에서 찍을 수 있답니다. 하동 매암제다원 위치 : 경남 하동군 악양면 악양서로 346-1 매암다원문화박물관 영업시간 : 월요일 휴무 10시~18시 문의 : 055...,2021. 9. 27.
경남 하동맛집 신서유기8 강호동 짜장면 모정식당,경남 하동맛집 신서유기8 강호동 짜장면 모정식당 가족끼리 경남 하동여행 갔다가 신서유기 짱팬인 동생이 하동역 근처에 강호동이 먹고간 오래된 중국집이 있다고 해서 찾아서 간 하동맛집 모정식당. 처음에 길을 못찾아서 다른분 블로그 보고 찾아갔어요. 모정식당 주소 : 경상남도 하동군 하동읍...,2020. 10. 29.
[경남 하동 1박2일 벚꽃 여행] 벚꽃 포토존 가득한 지리산 자연생태체험장,지도에도 나오지 않는 곳ㅋㅋㅋㅋ 생긴지 얼마 안되서 잘 알려지지 않은 것 같았다 주소는 하동군 화개면 화개로 541-6 이에용 반대편에 주차장도... 출발~ #경남여행 #경남벚꽃 #하동여행 #하동벚꽃 #지리산벚꽃 #지리산자연생태체험장 #지리산국립공원 #화개탐방안내소 #벚꽃드라이브 #벚꽃여행...,2021. 4. 2.
"하동여행코스 : 매암제다원 , 섬진강재첩국수 , 쌍계명차 , 최참판댁",하동여행코스 매암제다원 -> 섬진강재첩국수 -> 쌍계명차 -> 최참판댁 너무 예뻤던 하동 매암제다원 하동여행코스 매암제다원 경남 하동군 악양면 악양서로 346-1 AM 10:00 - PM 6:00 월요일 휴무 매암제다원은 일단 하동여행코스로 검색을 하면 가장 많이 나오는곳이다 녹차밭이 있어서 차도 즐길 수...,2020. 6. 24.
경남 물놀이장/물놀이터 하동 금오산랜드 물썰매장,"경남 하동군 진교면 구고속도로 374-30(안심리 396-2) 하동 금오산랜드 물썰매장 전화번호 : 055-884-6820 사랑초펜션에서 거리 : 7.5km(약 10분 소요) 하동 진교펜션, 진교숙소, 정동원길 펜션 사랑초펜션 2층 가족룸 내부 하동 금오산랜드 주변 펜션, 금오산랜드 근처 숙소 사랑초펜션 여행작...",2021. 8. 12.
"경상남도 추천 언택트 관광지 , 경남에 가면 꼭 가봐야 할 힐링 명소 18선!",감사합니다. 옥상방송이었습니다. #추석연휴 #언택트 #경남 #가볼만한곳 #관광 #명소 #여행지 #관광지 #추천 #연휴 #주말 #당일치기 #핫플 #인스타 #창원시 #진주시 #김해시 #밀양시 #양산시 #거제시 #통영시 #사천시 #고성군 #남해군 #하동군 #의령군 #함안군 #창녕군 #산청군 #함양군 #거창군 #합천군,2021. 9. 23.
