header,contents,date
[칼럼] 여행의 미학: 남계서원과 청계서원 - 강판권 교수 [대전교차로],함께 하는 여행도 즐겁지만 혼자 떠나는 여행은 아름답다. 혼자 떠나면 모든 것을 스스로 결정할 수 있는 장점과 함께 다른 사람들이 잘 찾지 않는 곳을 갈 수 있기 때문이다. 경남 함양군에 위치한 남계서원(藍溪書院)과 청계서원(靑溪書院)은 조선시대의 중요한 인물을 모시는 곳인데도 찾는...,2020. 7. 7.
걷기의 유혹,"□ 저자가 걸어서 여행하는 이유 - 먼 걸을 걸으면 본능이 되살아나고, 걸으면 활력이 생기기 때문이다. - 수많은 유명인사들이 걷기를 통해... □ 지리산 둘레길 첫 코스 - 전북 남원시 주천면 1구간부터 경남 함양군 금서면 수철마을 5구간(68.2km)이다. - 3월21일 아침 7시 45분에 출발해 첫날은...",2021. 8. 6.
"지리산 등산코스, 그리고 방영 예정인 지리산 드라마(블랙야크 100대명산 12번째 명산)","#1 등산정보, 중산리 등산코스부터 주차장 정보까지 등산위치 : 경남 함양군 마천면 추성리 출입정보 : 하절기(3~11월) 04:00, 동절기(12~2월) 05:00... 이제는 나머지 작은 산들을 모두 돌아봐야 하기 때문에 정비 후에 차박을 하며 전국을 여행할 생각입니다. 물론 등산뿐만 아니라 지역별로 맛집이나...",2021. 8. 31.
"함양블사모 부안 여행 2일차 : 선영이네 김치, 채석강, 달콤 카페","경남 함양군 블.사.모. 회원 (블로그를 사랑하는 모임) 굼찬농장 굼벵이언니 입니다 ^^ 지난번에 이어서 부안 여행 2일차 이야기를 가져왔어요 앗, 그런데 1일차에서 미처 못 보여드린 곳이 한군데 있어서 여기 먼저 소개할게요! 부안에서는 곰소 염전에서 나온 곰소 젓갈과 소금이 전국적으로...",2020. 2. 27.
"함양블사모 부안 여행 2일차 : 선영이네 김치, 채석강, 달콤 카페","경남 함양군 블.사.모. 회원 (블로그를 사랑하는 모임) 굼찬농장 굼벵이언니 입니다 ^^ 지난번에 이어서 부안 여행 2일차 이야기를 가져왔어요 앗, 그런데 1일차에서 미처 못 보여드린 곳이 한군데 있어서 여기 먼저 소개할게요! 부안에서는 곰소 염전에서 나온 곰소 젓갈과 소금이 전국적으로...",2020. 2. 27.
[엄마 #36]나의살던고향은,나의 살던 고향은 경남 함양군 서하면 '때빼이' 이다. 왜 때빼이라고 하는지 모른다. 그냥 그렇게 불렀다. 사람들은 그 집의 존재를 다 잊었을거다.... 말하지 않아도 우린 각자의 기억속으로 여행을 간다. 이번에도 촬영하러 갔었다. 저녁거름에 달라드는 산모기 때문에 일찍 내려왔다. 언제가도...,2021. 7. 18.
함양 산삼항노화엑스포와 갑을식당 내돈내산 솔직후기(허영만의 함양상림공원 맛집),"가성비도 막막 하늘에서 내려오고, 함양 상림공원도 근처에 있어서 여행 코스로도 무난하다. 다만 ㅠㅠ 지금은 함양 산상항노화엑스포로... 갑을식당 ***-***-**** 주소 경남 함양군 함양읍 함양로 1106 영업시간 매일 11:50 - 21:20 Break time 14:10~17:40 매월 2,4째주 화요일 휴무 TV방송정보...",2021. 9. 26.
함양대봉캠핑랜드[캠핑]숙소추천,경남 함양군 병곡면 원산지소길 192 ⏰ 입실 15:00 퇴실 11:00 ️ 객실 앞에도 있구요 넓은 주차공간 도있어요 ☎️ 055 - 963 - 2026 안녕하세요~~ 비쥬 파파입니다~~~^^ 오늘은 무더위를 피해 보블리내는 함양에 애기들이랑 맘것 뛰어놀수있고 자연 이랑 벗삼아 곤충 채집도 하고 개구리도 보고 할려고 여행...,2021. 7. 26.
함양 맛집 흑돼지촌 지리산자락길 식당 흑돼지삼겹살 끝내줘요!,"경남 함양군 마천면에는 맛있는 함양 흑돼지를 판매하는 식당들이 마을을 이루고 있는데요... 이곳은 함양 지리산 마천 흑돼지촌 음식특화거리로... 경남 함양 청정지역으로의 여행이라 피곤함도 모르고 서암정사, 대봉산 모노레일, 지안재, 개평마을. 백무동 계곡 등을 다녔는데요... 함양 맛집...",2021. 10. 4.
"함양 여행... 개평 한옥마을, 일두고택","우리나라가 부산과 경남만 있는 것처럼~ 그래서 여행지를 복습하게 된다. 오라는 곳은 없어도 여행지는 차고 넘친다~^^ 가끔은 느리게~ 느림의... ~함양군 가이드북~ 일두(一蠹)라는 호는 좀 한 마리, 벌레 한 마리라는 뜻으로 #정여창의 겸손을 엿볼 수 있다. 안동이나 경주 한옥과는 다르게 담장이...",2020. 8. 26.
(함양여행) 함양명소 가족힐링여행지 추천 지리산생태체험단지 내생애 숙소 베스트 TOP3,자연과 함게 원없이 놀다온 주말여행 정말 좋았던 그날의 일상은 이제는 아스라히 추억속으로~~ 차곡 차곡~! 가을에 발아래 펼쳐질 오색단풍 구경을 하러 가고 싶은 곳 #지리산명소 #지리산생태체험단지입니다. 농업회사법인 우리씨드 함양지점 예약: ***-***-**** (경남 함양군 마천면 가미동길 67),2020. 8. 24.
"이번 주말 나들이, 양조장으로 떠나볼까?",경남 함양군 명가원의‘솔송주 빚기 체험’. ◇가족 나들이하기 좋은 양조장 양 천구 목동에 사는 한정인(39)씨는 색다른 주말 나들이 장소를 찾아... 과거로의 시간여행을 하고 싶다면 충남 당진시 신평양조장을 찾는 것도 좋다. 고택과 오래된 양조기구 등 80여 년 술 만들던 과거의 모습을 확인할...,2021. 7. 28.
"경남 사천 드라이브 하기좋은 날 무지개도로 코스, 부잔교 갯벌탐방로 추천",드라이브스루 여행 코스 13선 경남 드라이브스루 여행 코스 13선입니다. 뷰 맛집이죠^^ 창원시 창포 해안 길 - 한국의 아름다운 길 100선 진주시... 아름다운 길 100선 남해군 설천 남해 해안 도로 하동군 청암 하여 동호 산중 호수길 산청군 정취 암기는 길 함양군 지리산 가는 길 - 한국의 아름다운 길 100선,2020. 6. 29.
생방송투데이 함양3GO여행 연잎한상 철갑상어 동대문 회냉면TOP5 오산매운오뎅...,3GO 함양 3GO 여행 편 ▶<거연정> 주소 경남 함양군 서하면 봉전리 번호 : 055-960-5756 ▶<함양 용추 계곡> 주소 경남 함양군 안의면 용추휴양림길 71 ▶<옥연가> *연잎 한상차림 주소 경남 함양군 함양읍 상림 3길 10 번호 : 055-963-0107 ▶<함양군철갑상어영어조합> *철갑상어 문의...,2020. 7. 31.
[2021함양산삼항노화엑스포 전국사진촬영대회],(우)50036 경남 함양군 함양읍 고운로 35 함양군청 산삼엑스포과 엑스포 담당자 앞 #함양산삼항노화엑스포 #함양 #경상남도 #상림공원 #대봉산휴양밸리 #함양산삼 #항노화 #산양삼 #게르마늄 #면역력 #힐링 #건강 #가족여행 #가을여행 #대봉스카이랜드 #대봉캠핑랜드 #캠핑장추천 #오토캠핑...,2021. 6. 24.
"덕유산! 겨울왕국 하얀 비단길을 걷다,","동행인 : 회사 지인과 함께 덕유산(德 큰 덕, 裕 넉넉할 유, 山)은 전북 무주, 장수군, 경남 거창, 함양군 등 2도 4군 8개면에 걸쳐 있는 산으로... ▲여행의 시작과 끝은 결국 집입니다. 안전이 최곱니다. 참 멋진 산행이었다. 무주 구천동길을 2016년에 걷고 이 번에 왔는데 특히 어사길이 참 잘...",2020. 2. 20.
"[ 경남 ] 2019, 安義三洞 … 5. 尋眞洞 - ① 용추폭포 & 용추사","[ 경남 ] 2019, 安義三洞 … 5. 尋眞洞 - ① 용추폭포 & 용추사 소재지 : 경상남도 함양군 안의면 상원리 산16 2019.11.01.金 다시 안의삼동(安義三洞)으로... 사실 이번 여행은 이 용추폭포때문에 이루어진 것이라 봐도 과언이 아니다. 화림동은 5월, 원학동은 9월에 다녀왔으니 모두 좋은 계절에 다녀와서...",2020. 3. 21.
[글] 호박이의 여행 이야기 #7,"경남 함양군의 한 묘지에서 주민들이 예초기로 벌초하고 있다. /출처: 함양군청 제공 (인터넷 상 출처: 중앙일보 https://news.joins.com/article/20547693 * 원문 기사의 내용: 추석이면 벌초를 하느라 예초기 사용이 늘어나는데, 사용 미숙 또는 돌멩이 튀어오름, 벌집 건드림 등으로 각종 사고가 발생하고...",2021. 1. 18.
[GNTF]④산청 드라이브스루 여행코스 소개/드라이브로 산청 즐기기,#산청 #경남관광박람회 #산청드라이브 #경남드라이브 #산청드라이브스루 안녕하세요:) 코로나가 잠잠해지다가 다시 확진자 수가 증가하는 등 한시도 긴장을 늦출 수 없는 5월이네요. 4계절이 뚜렷한 대한민국에서 가장 놀러가기 좋은 5월이지만 코로나로 인해 아직 여행을 가기엔 이른감이 없지...,2020. 5. 11.
[섬장오용환]2020 경남관광박람회 창원컨벤션센터에서1,많다 함양군홍보관 경남의 아름다운 명소 20선 사진전시회에 #만지도출렁다리 에서 바라본 일출이 눈에 확 들어온다 스티커 3장으로 좋아하는 명소 선택했다 만지도출렁다리 일출장면 밤이 아름다운도시 통영 안내자료에 호기심이 간다 조만간 통영 야경투어 한번해봐야겠다 #여행에미치다...,2020. 6. 25.
함양 상림공원 맛집 나무달쉼터/산채비빔밥 정말 맛나네요~,< 함양 나무달쉼터 > 4월에 함양 여행 갔다가 함양 상림공원 근처 나무달쉼터에서 맛있는 흑돼지 보쌈 한상을 먹고 왔어요~ 나무달쉼터 식당 이름도 특이하고 이쁘지만 음식도 정말 건강하고 맛나더라구요~ 경남 함양군 함양읍 대실길 225 (죽곡리 227) ☎ 055 - 963 - 6585 영업시간 : 낮 12시 ~ 저녁 10시...,2021. 6. 30.
2021함양산삼시니어 모델 선발대회 본선대회 생중계 보러가요!,2021 함양 산삼 시니어모델 선발대회 본선이 함양군 문화예술회관 대강당에서 오후 1시 30분부터 진행될 예정입니다. 유튜브 산삼TV를 통해... 등산 #경남가볼만한곳 #경남여행 #나들이 #가을여행 #경상도여행 #부모님여행 #함양엑스포 #엑스포 #시니어모델 #함양시니어모델선발대회 #모델 #대회,2021. 9. 14.
함양 가볼만한곳 :: '지리산생태체험단지' 가족여행 지리산 펜션 추천! 조용하고...,"♥ '지리산생태체험단지'에 계시는 직원분들도 친절하시구 1도 터치안하시니, 거의 별장에 온 듯한 기분이었어요~ 자연 속에서 좋은 여행을 즐기고 왔네요! 저는 이제 하동으로 놀러 가보렵니당ㅎ좋은 하루 보내세요! 지리산생태체험단지 ***-***-**** 경남 함양군 마천면 강청리 796...",2020. 8. 13.
"[함양 힐링여행] 1일차 : 칠선계곡, 서암정사,오도재, 대봉산휴양밸리, 선비문화탐방로...","[함양 힐링여행 1] 칠선계곡, 서암정사,오도재, 대봉산 휴양밸리, 선비문화탐방로, 거연정, 다볕자연연수원 온 세상이 코로나19로 여행 및 모임을... 주변의 나무와 계곡을 끼고 있는 정자로 탐방로에서 볼수 있는 정자로 사유지에 있어 들어 갈수 없는게 다소 아쉽다 경남 함양군 서하면에 있는...",2020. 6. 25.
함양 농월정 풍경,"여행 일자 2021.9.19(일) 맑음 함양군 안의면 월림리에 있는 ""농월정""은 ""화림동 계곡""에 있습니다. 화림동 계곡은 남덕유산(해발 1,508미터)에서... 전남 담양이 호남 정자 문화의 메카라면 경남 함양은 정자 문화의 보고라고 하고, 소쇄원, 식영정, 송강정 등 담양의 정자들이 가사 문학을 잉태한...",2021. 10. 1.
"함양 가볼만한곳 1박2일 자갈한과, 개평 한옥 문화체험마을,일두고택 ,하미앙와인...",지난번 경남공감 취재차 다녀온 함양 자갈한과 만드는곳에도 다녀갔다고 해서 사진 꺼내어 봅니다. 함양여행 가시면 가볼만한곳 몇곳 소개 해... 함양 개평마을 일두고택 경남 함양군 지곡면 개평리 262-1 일두고택 055-962-7077 국가민속문화재 제186호. 조선 성종 때의 대학자였던 정여창(鄭汝昌)의...,2021. 4. 12.
8월 여행 명소. 여름 휴가 가볼만한 곳. 추천베스트. 전국축제일정. 부산알림이 심쿵,"힐링 여행지, 2020년 여름 개장한 신상 휴양림 18 경남 함양군 선비문화탐방로 화림동계곡이 품은 선비의 삶을 만나는 여행 19 전북 고창군 고창운곡람사르습지 세계가 인정한 최고의 생태탐방 여행지, 원시적인 습지 생태계의 보고 20 전북 무주군 구천동 어사길 천혜의 풍광을 간직한...",2021. 7. 30.
[남원/떡갈비/냉면] 춘향이의 고향 광한루가 있는 남원 이조갈비 수제떡갈비,"동쪽으로 경남 함양군·하동군, 서쪽으로 임실군·순창군, 북쪽으로 장수군, 남쪽으로 전남 구례군·곡성군에 접한다. 전북 남원시 향단로 18 2,4주... #남원맛집 #남원이조갈비 #남원가볼만한곳 #남원여행 #춘향이의고향 #이몽룡 #광한루 #광안리 #남원음식점 #남원핫플",2021. 7. 19.
산머루 와인과 거대한 숲…경남 함양,"1천100년 전 경남 함양도 걸핏하면 하천이 범람하던 곳이었다. 함양군의 옛 명칭인 천령군 태수로 부임한 최치원 선생은 거대한 숲을 조성할 것을... 숲 아래 난 오솔길을 따라 지역민과 여행자들이 뒤섞여 거닌다. 졸참나무, 느티나무, 개서어나무, 상수리나무 등 120여 종류의 수목 2만여 그루가...",2020. 9. 23.
서울에서 제주까지 걷고 싶은 길 200,섬 여행의 모든 것 41 인천 옹진군 자월도 무인도에서의 표류를 꿈꾸다 42 인천 옹진군 장봉도 붉은 태양이 사라지는 낙조의 명소 43 인천 옹진군... 85 경남 함양군 함양상림 사계절 아름다운 천년 숲 86 경남 창원시 천주산 억새 능선 아름다운 진달래 산 87 전북 정읍시 내장산 끝도 없는...,2021. 7. 10.
2020년 체리수확체험 안내/체리농장/지리산황금나무(마감),5. 상담 또는 예약은 ***-****-**** 농장주소: 경남 함양군 휴천면 천왕봉로 2234 ( 한남마을 맞은편에 빨간색 띠두른 하늘색 2층건물입니다.. 다리(한남교)건너서 오시면 됩니다.. 도로에서 잘보입니다~~ ) 그외 #체험프로그램이 추가되면 #업로드 할게요~~,2020. 5. 18.
함양 와불산 와블 소원을 들어준다네요.,서암정사를 다녀온 후 다음 여행지로 이동하던 중에 길 옆에 와불이라는 안내판 표지에 차를 세웠다. 둘레둘레 돌아봐도 도대체가 보이지 않는다.... 렌즈를 당겨서 보기로~~ 경남 함양군 마천면 창원리 산26 거리에서 바라보는 와불의 모습. 길게 하늘을 바라보며 누워있는 와불의 모습이. 소원을...,2021. 6. 25.
면역력 증강의 최고는? 바로 ‘함양산삼’이다!,"생산되는 경남 함양군을 찾아갔다. 진시황의 명을 받고 불로초를 찾기 위해 서복이 동남동녀를 데리고 왔었다는 전설이 깃든 곳답게... 함양여행을 통해 자연이 주는 청정한 기운을 마음껏 받아 들이고, 게르마늄 성분이 풍부한 토양에서 자란 먹거리는 그 자체로 보약이 된다. 함양에서는...",2021. 5. 26.
지리산 백무동에서 장터목 천왕봉 오르기,"탐방지원센터- 경남 함양군 마천면 백무동로 366 이정표왼쪽 장터목방향 그동안 내려오는 코스로만 다녔던 곳 오늘은 올라간다 탐방센터 입구에서... 남자 여행은 혼자가 진리 절제미 한송이 ""중산리 방향 아님"" 지리산 처음 오르던 날, 중산리 하산길 못찻아서 이길로 갔던ㅋ 나같은 사람...",2021. 8. 17.
아들과 함께 한 제주도 여행 1,"걷기 여행2-스페인 산티아고 편』을 읽으면서, 길은 내 안에서 서서히 똬리를 틀기 시작했다. 또 10km 정도씩 두 코스로 이루어진 지리산 둘레길에 대한 소식을 일간지에서 읽게 되었다. 제1코스는 전북 남원시 산내면 매동마을에서 경남 함양군 마천면 금계마을을 잇는 ‘다랭이길’이고, 제2코스는...",2020. 5. 30.
"함양 인산가 웰니스호텔 상세후기 룸, 부대시설 등","진주꿀꿀이입니다 코로나19 장기화로 여행 못 가 따분한 요즘, 호캉스를 즐기러 함양에 새로 생긴 #함양웰니스호텔 #인산가호텔 #인산가웰니스호텔 방문했어요!! 함양 인산가 웰니스호텔 위 치 경남 함양군 함양읍 삼봉로 292-90 ☎️ 055-963-9585 2월에 오픈하여 생긴 지 얼마 안 돼 블로그에도 함양...",2021. 5. 16.
얼떨결에 떠나다. 경유지 경남함양 1박,"우리가 왜 경남함양을 경유했는지는 아직도 미스터리입니다. ""여행갈까?"" ""그래. 어디?"" ""전라도"" ""전라도 어디?"" ""땅끝마을"" ""1박?"" ""아니, 2박"" 이렇게... 남강, 경남함양 봉전리 쏟아지는 아침햇살을 받으며, 알싸한 공기도 좋고, 무엇보다 서울을 떠났다는 것만으로도 일단 그냥 좋았다. 함양군...",2020. 10. 2.
[함양카페추천] 마을카페 안녕,"지리산둘레길 3구간(인월-금계) (19.6km,8시간) 마을카페 ""안녕""위치 경남 함양군 마천면 창원아랫길 25-12 마을카페 안녕 운영시간 매일 10:00 - 18:00... 잘하고 부모님이 케익도 맛있다고 칭찬해 주셨다 지리산을 여행갈일 있다면 마을카페 ""안녕""을 추천한다 ※공감과 댓글 미리 감사드립니다^^※",2021. 6. 23.
"찿았다, 나의 무릉도원! 함께하는 함평 여행","지리산 조망공원에서 천왕봉을 바라보는 것도 좋지만 우람한 산맥에 폭 안긴 함양군의 형상을 자세히 관찰하는 것도 재미있다. 자세히 알아보기 글, 사진 : 한국관광공사 국내디지털마케팅팀 양자영 취재기자(*******@*****.***) 2021.09.23 | 원문링크 바로가기 #국내여행#함양여행#거연정#지안재#하미앙...",2021. 9. 23.
[2021함양산삼항노화엑스포] 제60회 함양 천령문화제 개최,"함양군 유튜브(굿모닝 지리산, 함양)와 산삼TV를 통해서 실시간 중계될 예정이오니 오늘 저녁 7시에 잊지 말고 꼭! 유튜브 라이브로... 등산 #경남가볼만한곳 #경남여행 #나들이 #가을여행 #경상도여행 #부모님여행 #함양엑스포 #엑스포 #엑스포행사 #함양천령문화제 #개막식 #축하공연",2021. 5. 27.
와인딩 맛집 함안 지안재/ 용추폭포 feat. 포르쉐 718 박스터,그래서 직접 가보기러 했습니다 ㅋㅋ 경남 함양군에 잇는 지안재 라는 곳입니다. 오토바이 동호회 지안재 라이딩 지안재 오토바이 라이딩 평일... #지안재와인딩 #함양지안재 #지안재드라이브 #10대아름다운도로 #용추사 #용추폭포 #함양가볼만한곳 #함양여행 #함양나들이 #함양드라이브 #718boxster...,2021. 6. 5.
전주에서 경남 고성까지의 슈퍼커브 여행 [고성-대가 연꽃테마공원 놀이터 설치],바이크 여행도 포기할 수 없어 경남 고성까지 슈퍼커브를 타고 다녀오기로 했어요. 경남 고성까지는 약 200km 가량이 되는 먼 거리였습니다.... 희안한게 표지판에는 남원국토관리사무소 관할인 것 같은데 지도상으로는 함양군으로 속해 있네요. 백두대간 육십령에서 바라 본 전경 거뭇거뭇하게 낀...,2020. 9. 24.
경남관광박람회 대학생서포터즈 8기 선발&발대식 후기 및 활동포부,발견한 경남관광박람회 대학생 서포터즈 8기 모집 공고문 입니다 ! 저는 여행과 마케팅에 관심을 많이 갖고 있으며 블로그 포스팅 및 SNS 활용... 밀양시 / 함양군 / 거창군 / 함안군 / 양산시 / 산청군 / 합천군 / 창원시 / 김해시 / 하동군 / 의령군 / 남해군 / 고성군 / 사천시 / 진주시 / 통영시...,2021. 3. 23.
2021 경남관광박람회(창원컨벤션센터) 체험컨텐츠 & 이벤트,"경남관광박람회에서 창녕군, 밀양시, 함양군, 거창군, 함안군, 양산시, 산청군, 합천군, 창원시, 김해시, 하동군, 의령군, 남해군, 고성군... 해외여행정보, 대만종이등 만들기, 오키나와 별모래병 만들기 등 이렇게 위에 나와있듯이 경남관광박람회에서 체험할 수 있는 것들입니다!!...",2021. 5. 15.
지리산 노고단의 가을,여행은 역시 먹는 재미라는 회원님과 동감하며 트레킹 후 맛난 저녁을 먹기로 하며 힘찬 발걸음을 옮겨본다.~~ 국립공원 스탬프투어 여권 아직... go #지리산국립공원#노고단#성삼재#천왕봉#반야봉#낙동강#섬진강#전북남원시#전남구례군#경남산청군#하동군#함양군#지리산12동천#화엄사#천은사...,2021. 10. 9.
함양 한국의 아름다운길 100선 지안재,오늘 합천 황매산부터 산청 생초국제조각공원 그리고 함양 지안재까지 세개 도시를 넘나들며 뿌듯한 국도 여행이었답니다. [함양 지안재] 경남 함양군 함양읍 구룡리 주차장 있음 #오현숙의소소한일상이야기 #논산이야기 네이버에서 검색하고 논산과여행의 팬이 되어주세요!,2021. 5. 11.
"""덕유산(德裕山)"" 설천봉 향적봉 구천동 어사길의 아름다운 풍광을 찾아서","경남 거창군 함양군에 걸쳐 있는 산 최고봉은 향적봉 해발 1.614.2m이다 2020년 12월 10일 날씨; 구름 조금 산, 벗; 딸 다동이 덕유산국립공원 향적봉 뷰.... 둘만의 여행은 또 다른 행복이었다 곤도라에서 담아본 풍경이다 설산이 그리워서일까? 영상의 날씨에 왔는데 상고대가 핀다면 우주가 변할...",2020. 12. 12.
"2020년 7월 31일 생방송 투데이-보고먹고즐기고(함양여행), 우리 동네 반찬 가게(서울...",3GO - 함양 3GO 여행 편 ▶<거연정> 주소 : 경남 함양군 서하면 봉전리 번호 : 055-960-5756 ▶<함양 용추 계곡> 주소 : 경남 함양군 안의면 용추휴양림길 71 ▶<옥연가> *연잎 한 상 주소 :경남 함양군 함양읍 상림 3길 10 번호 : 055-963-0107 ▶<함양군철갑상어영어조합> *철갑상어...,2020. 7. 31.
"단 하루 지리산에 산다면,함양숙소 추천!",언택트 여행엔 함양대봉산휴양밸리 제 친정 함양은 불과 10년전만 해도 '함양'이라는 지역명조차 사람들이 알지 못하는 시골이었죠. 시간이 많이... web 주소 : 경남 함양군 병곡면 원산지소길 192 예약 : 함양대봉산휴양밸리 홈페이지>온라인예약>대봉캠핑랜드 (홈페이지에 함께 있는...,2021. 8. 18.
"옥연가, 함양맛집 - 연잎정식 잘 하는 집",#함양 을 여행 중 이신가요? 함양에 가실 계획이 있으신가요? 식당을 가야 하는데... 저녁식사를 함께해야 하는데... 마땅히 갈곳을 찾지 못했어요.... 옥연가 경남 함양군 함양읍 상림3길 10 주메뉴: 연잎정식 2. 1004화로구이본점 경남 함양군 함양읍 필봉산길 63 주메뉴: 생고기/ 삼겹살 3. 늘봄가든...,2021. 9. 14.
"제주, 코로나19... 공항 면세점 집단 감염","제주 1592번 확진자는 경남 함양군 거주자로, 지난 21일 여행을 위해 제주도에 온 후 함양군 확진자의 접촉자로 분류돼 검사를 받고 확진되었습니다. 제주 1586번 확진자는 지난 14일부터 21일까지 카자흐스탄을 방문하고 귀국했고, 입국 당일 제주에 들어오면서 제주공항 워크스루 선별진료소...",2021. 7. 24.
한국의 아름다운 길 100선. 무주 구천동 국도 37호선 드라이브 코스로 추천,무주 여행지에서 만난 환상 드라이브 코스. 무주 구천동 입구 경승지인 라제통문에서 신풍령 빼재까지의 국도 37호선입니다. 한국의 아름다운... 야경 경남 함양군 마천면 의탄리 ~ 함양읍 구룡리 (지방도 1023호선) 051 모래재 전북 완주군 소양면 ~ 진안군 (구 국도 26호선) 052 굽이 굽이 옛정...,2021. 8. 21.
"국립공원 스탬프 투어 운영정보! 여권 추가배부, 인증방법, 할인가맹점 등","배포기간 : 2021년 10월 1일 ~ 소진 시까지 스탬프투어 이용방법 국립공원 여권 여행 운영물품(여권, 스탬프, 잉크패드) / 공원별 방문도장... 백무동탐방지원센터 경남 함양군 마천면 백무동로 366 지리산 전북사무소 4 뱀사골탐방안내소 전북 남원시 산내면 와운길 10 매주 월 063...",2021. 2. 28.
[전라도 무주여름여행] 무주가볼만한곳 무주리조트 관광곤도라 타고 덕유산 설천봉까지,"오늘부터는 #여름휴가여행 으로 다녀온 전라도 #무주여행 을 조금씩 포스팅 해보려고 해요. 2019년에도 다녀온 무주를 2021년에도... 행정구역 상으로 전북 무주군과 장수군, 경남 거창군과 함양군 등 영호남을 아우르는 4개 군에 걸쳐 있으며, 총 229.43㎢의 면적이 공원구역으로 지정되었다....",2021. 8. 22.
