header,contents,date
경남기도터-경남 함양군 지리산 백무동 성모천왕 할머니 기도터,docId=2120854&cid=50223&categoryId=51051 답사여행의길잡이-https://terms.naver.com/entry.naver?docId=2043825&cid=42840&categoryId=42851 국어국문학자료사전-https://terms.... 행정구역으로는 경남 함양군 마천면 강청리이다. 전설에 의하면 지리산 산신인 여신 성모가 천왕봉에 살고 있었는데 그 성모가 남자를...,2021. 9. 29.
[동아리 모임] 경남 함양군에는 블로그를 사랑하는 사람들이 있다.,경남 함양군과의 인연을 회상하다! 2018년 3월.. 함양군 농업인들과의 처음 사랑을 시작합니다. 농업기술센터에서 주관하는 농업인 정보화 교육을... 함양블사모 회원들과 1박2일 전북 부안군 여행을 했었습니다. 눈보라가 치는 아주 험한 날씨였지만.. 블사모팀의 열정을 당해 낼 수는 없었죠.. 그날...,2020. 5. 27.
덕유산과 지리산을 품은 산천이 아름다운 고장 [경남 함양군 힐링여행] ②,"함양 여행 맛집을 찾고 계시다면 꼭 들러보시길 추천드립니다 ⭐⭐⭐ 아름다운 산천에 둘러싸인 곳, 자연 속에서 쉬어가기 좋은 곳, 경남 함양 이번 가을은 [경상남도 함양군]으로 떠나 보시는 건 어떨까요~? 가을여행하기 좋은 곳, ""함양""으로 단체 혹은 가족들과의 여행을 계획 중이시라면...",2021. 9. 28.
경남 함양군 휴천면 월평리 지리산 오도재 1문 휴게소 - 차박여행,경남 함양군 휴천면 월평리에 지리산 오도재 1문 휴게소가 있습니다. 휴게소이니 당연히 화장실은 있겠습니다. 이곳에서 차박했다는 글이 잘 안 보입니다. 그래도 갑니다. 도착했습니다. '지리산 제1문'입니다. 하늘을 쳐다봅니다. 주위엔 자동차가 하나도 없습니다. 주차장에는 휴게소에...,2020. 11. 10.
[경상남도/함양군/안의면] 파란지붕 / 함양 카페 / 경남 카페 / 함양 파란지붕 / 함양여행,"2021 함양산삼항노화엑스포 여행 중에도, 이 포스팅을 하는 중에도 계속이다. 다만 포스팅은 예약이니 공개되 즈음에는 엑스포는 끝이 났겠지. 파란지붕 경상남도 함양군 안의면 금성길 11 경상남도 함양군 안의면 당본리 193 Tel. (055) 964-8007",2021. 10. 3.
"<경남 함양군> 지리산 용유담, 용이 하늘로 올라가는 광경, 그리고 파노라마 전망대...",용유담 주소 : 경남 함양군 휴천면 문상길 지리산 계곡들에서 흘러내린 맑은 물이 여기서 합류한다. 지리산 둘레길. 도로에서 돌계단으로... 볼 수 있는 파노라마 광경이 펼쳐졌다. 건너편 양쪽으로 넓게 구불구불 능선이 이어지고 구름이 내려앉아 운치를 더해준다. 이런 게 여행에서 만난 로또 선물,2020. 10. 22.
경남 함양군 노포식당 주물럭 메뉴가있는 맛나식당,두달전쯤...경남 함양군 여행을 갔을때 그곳에 잘알려지지않은 노포식당이 있다고해서 가보았습니다. 삼겹살이랑 주물럭을 파는곳인데...주물럭이 인기메뉴라서 ㅎㅎ 저도 주물럭을 주문했습니다. 정말 오래된 간물에 오래된 인테리어 ㅎㅎ 분위기가 딱~시골 오랜된 식당에 온기분 근데..정말 시골...,2020. 7. 2.
경남 함양군 칠선계곡 뷰맛집 칠선산장 식당 다녀왔쥬,계곡 바라보며 맛있게 처묵 처묵~ 이번에 짧은 여름 휴가로 다녀온 경남 함양군 칠선계곡에 위치한 칠선산장 입니다 (게으름 뱅이 있어서 이제야... 식당이 전체적으로 정리정돈이나 관리가 조금 덜된듯한 느낌이 있어서 조금 아쉬웠어요 칠선계곡 근처 여행갈일 있을때 칠선계곡의 멋진 뷰를...,2021. 8. 17.
"경남 함양군 마천면(지리산) 절 : 벽송사, 서암 정사, 산뜨락 옛날빙수","경남 함양군 마천면 꼭 가야할 곳을 추천드려요 서암정사 경남 함양군 마천면 추성리 산15 지리산에 처음 오던 날 할아버지께 절에 가고싶다고... 무더운 여름, 코로나 바이러스 확산세가 점점 거세지는 요즘 사람 많은 도시를 벗어나 일상을 여행해 보시는 건 어떨까요?",2020. 8. 22.
경남 함양군 ‘하미앙 와인밸리’ 에 가서 2020년 10월 31일,도착 #하미앙와인밸리관광농원 경남 함양군 함양읍 삼봉로 442-14 ( 죽림리 817-14 ) 055-964-2500 #거산투어 #와인족욕체험장 #와인족욕의효과... #와인병코르크마개 하미앙 와인밸리 #와인저장고 #고로쇠쉼터 하미앙은 와인의 깊은 맛과 맛있는 먹거리가 있어서 함양 당일치기 여행으로도 좋은 곳...,2020. 11. 2.
[경남핫플레이스]함양군 하미앙 2021년 찾아가는 양조장사업에 선정,"[시사뉴스] 함양군, '하미앙' 2021년 찾아가는 양조장 공모사업 선정 http://www.sisa-news.com/news/article.html?no=157702 #경남여행 #함양여행 #함양핫플레이스 #하미앙 #하미앙와인터널 #한국의아름다운길 #지리산 #지리산지안재 #지리산오도재 #시사뉴스정윤철 #현장에서 #민간정원...",2021. 5. 15.
경남 함양군 2021 함양 산삼 항노화 엑스포,경남 함양군 함양읍 상림공원 꽃무릇과 숲 개울이 맑아요 개울에 발담그고 싶을만큼요 ㅎㅎ #함양상림공원 #꽃무릇 #백일홍 #코스모스 #연꽃 #함양여행 #2021함양산삼항노화엑스포 #경남여행 #산삼엑스포 #산양삼엑스포 #함양 #함양산삼산양삼엑스포장 #국화 #가을여행 #건강정보 #함양군,2021. 9. 16.
경남 함양군 한정식 '예다믄',전북 남원에서 경남 함양을 거쳐 여행을 다니시는 분들께 깔끔한 한정식집'예다믄'을 소개해드리겠습니다. '예다믄'은 종가음식 전문점답게 정갈한... 없다면 가장 흔하게 찾는 곳 중 하나가 한정식집이라고 생각합니다. 경남 함양군에서 한 끼 식사 고민하신다면 전통 한정식'예다믄' 추천해드립니다.,2020. 5. 9.
덕유산과 지리산을 품은 산천이 아름다운 고장 [경남 함양군 힐링여행] ①,"아름다운 산천에 둘러싸인 곳, 자연 속에서 쉬어가기 좋은 곳, 경남 함양 이번 가을은 [경상남도 함양군]으로 떠나 보시는 건 어떨까요~? 가을여행하기 좋은 곳, ""함양""으로 단체 혹은 가족들과의 여행을 계획 중이시라면 바로버스에 최소 6인승부터 최대 45인승까지 모든 차량이 완비되어...",2021. 9. 27.
경남 함양군 상림공원(feat.함양산삼항노화엑스포),이런 큰 나무들이 많아서 그늘진 곳 많음 걷기 참 좋음(안더우니까) 대신 모기조심 조밭과 수수밭을 지키는 허수아비 엑스포까지 아직 몇일남아 있어서 준비한다고 조금 어수선한 분위기 이지만 성공적인 여행 #경남여행 #함양여행 #경남가볼만한곳 #함양여행코스 #함양데이트 #함양인증샷,2021. 9. 4.
경남 함양군 선비문화 탐방 길을 걸었어요,함양군 함양읍의 소나무 숲인 상림과 하림의 내력을 소개하고 있습니다. 즐거운 계곡의 피서 구경만 하여도 시원합니다. 머루 나무로 터널을 만들어 놓은 곳이 있었습니다. 함양의 화림동 계곡에 설치한 선비 길을 걸으며 여러 곳의 정자와 풍광을 즐기며 즐거운 피서 여행 하루는 즐겼습니다. 경남...,2021. 8. 18.
[함양부동산 함양전원주택]경남 함양군 지리산을 등진 강보이는 배산임수의 멋진...,【물건번호 ㅡ2108번】 #창녕부동산 #거창부동산 #합천부동산 안녕하세요^^ 시골집사랑방처럼 편안한부동산 조은부동산공인중개사 허재영 소장입니다 오늘도 즐겁고 행복한 하루되세요 좋은인연 성심을 다해서 잘 모시겠습니다 경남 함양군 전망이 아주 멋진 전원주택을 소개합니다...,2020. 2. 27.
경남 함양 맛집 - 번지없는 주막 국수집. 함양군 지리산 지안치 맛집 지안재 맛집...,"남원시 인월과 함양군 함양읍의 중간정도로 남원 인월면 맛집이라 해도 틀리지 않을 듯 합니다. 아무튼 함양 맛집이자 인월 맛집 번지없는 주막은 그냥 가정집 마당 같은 느낌. 바이크는 내부에 주차할 수 있어 좋습니다. 차량 주차할곳도 많아서 주차 어려움이 없어요. 메뉴는 잔치국수, 비빔국수...",2020. 4. 12.
경남 함양군 마천면 펜션/음식점/카페 추천 토지매매,매물이니 여행하신다 생각 하시고 답사 꼭 가보시면 좋겠습니다 주인직:***-****-**** 오시는길:경남 함양군 마천면 의탄리 970-3 외1필지 안녕하세요 부동산 직거래 광고 회사 리얼리티입니다 저희 리얼리티는 부동산 영상광고 제작을 전문으로 하며 부동산 직거래 전문 광고 회사입니다 시대의...,2021. 3. 28.
입장권 구매 릴레이 캠페인] 4. 바르게살기경남도협의회+ 바르게살기함양군협의회,"‘바르게살기경남도협의회+ 바르게살기함양군협의회’ 입니다 :) 지난 3일에 엑스포 티켓 2,680장을 구매해주셨습니다~ 통 크게 구매해주셔서... 오토캠핑 #등산 #경남가볼만한곳 #경남여행 #단풍놀이 #단풍여행 #경상도여행 #부모님여행 #함양엑스포 #웰니스관광 #가을가족여행 #함양산양삼 #엑스포",2021. 5. 6.
"함양군 힐링 여행, 나무 아래 커피 한 잔! 농월정 카페 보름달","함양군 안의면 농월정 -힐링 여행- 카페에서 보이는 전경 코로나 속 힐링 여행 타인과의 접촉을 최대한 피할 수 있어 안전하게 여행할 수 있는... <카페, 보름달>에서 힐링하시길 바랍니다. <카페, 보름달> 네이버 정보는 아래를 클릭해 주세요. [도로명] 경남 함양군 안의면 농월정길 5",2021. 9. 18.
"소노드럼,야마하전자드럼,야마하몽타주7키보드,음향장비, (경남 함양군) 새벽출장세팅!...","멋진 드럼출장여행 다녀왔습니다.!! 대한민국 명산 지리산이 위치해 있는 경남 함양으로 출발할께요~~~ 차에서 시동걸고 시간을 확인해보니~~ 7월10일 02시59분 출발 경남 함양까지 설레는 맘으로 이른 새벽출발!! 차량소통 원활하여, 금새 금산 인삼 휴게소 도착! 금산 인삼랜드 왔다갑니다. 인증샷...",2021. 7. 10.
생방송 투데이 경남 함양 연잎 한 상 옥연가 함양군철갑상어영어조합 함양 용추 계곡...,3GO - 함양 3GO 여행 편 ▶<거연정> 주소 : 경남 함양군 서하면 봉전리 번호 : 055-960-5756 ▶<함양 용추 계곡> 주소 : 경남 함양군 안의면 용추휴양림길 71 ▶<옥연가> *연잎 한 상 주소 : 경남 함양군 함양읍 상림 3길 10 번호 : 055-963-0107 ▶<함양군철갑상어영어조합> *철갑상어 문의 주소 : 경남...,2020. 7. 31.
"[경남도민뉴스] 함양군, 문화누리카드로 함양산삼항노화엑스포 마음껏 누리세요",문화누리카드는 기초생활수급자와 차상위 계층이 문화예술․여행․체육 활동 관련 가맹점에서 이용할 수 있도록 제공되는 전용카드이다.... nh농협은행 함양군지부를 방문하면 된다. 기초생활수급자는 우대할인권(입장권 금액 5천원)이 적용되어 현장에서 직접 구매하면 된다. 김종순 엑스포...,2021. 7. 15.
"자연 속에서 힐링, 지리산 계곡 추천 [경남 함양군 지리산]","오늘의 추천여행지 [경남 함양군 지리산] 입니다. 출처: 한국관광공사 오늘은 계곡으로 여름휴가를 떠나시는 분들 혹은 계획하고 계신 분들을 위해 지리산의 계곡들과 자연관광지를 모아왔습니다! 그럼 ""자연 속으로의 힐링, 지리산 여행"" 추천지를 살펴보겠습니다. 출처: 한국관광공사 첫 번재는...",2021. 7. 10.
"95th 캠핑, 경남 함양군 지리산 백무동야영장 2021년 5월 22일-2021년 5월 23일.","네팔 여행당시 안나프루나에서 만난 세계여행을 하는 형님이 여행 중 만났었던 세계여행을 하신 분이 쓴 책. 그러니까 모르는 사람이 쓴 책. 역시나 책은 많이 못읽었다. 저녁시간. 다소 쌀쌀한 날씨에 담요하나 걸치고 마시는 소주. 쥑이네. 어둠이 내리니, 사이트는 더 아름다워졌다. "" 한잔 더 할...",2021. 5. 23.
경남 함양군 마을카페 안녕,또 가봐야것어… 주차는 여기 해도 되고 이 표지판 보이기 전 세대정도 주차 가능한 공터에 해도 되고 동네 개 쭈쭈 하니까 따라옴 순딩순딩 ㅋㅋㅋ 근데 개냐 곰이냐 ㅋㅋ #지리산카페 #지리산둘레길카페 #함양여행 #함양카페추천 #경남데이트 #함양힐링카페 #지리산가볼만한곳 #함양창원마을,2021. 7. 6.
폭포 찾아 떠나는 여행 경남 함양군 안의면 용추폭포,경남 함양 안의라는 곳에 용추폭포가 있습니다. 폭포는 모습에서부터 다름이 있기 때문에 스스로 관심을 가진 것이 아니라 같이 다니는 동호인이 폭포 촬영을 좋아하여 따라다 보니 습관이 되어 내가 제일 좋아하는 것으로 변해 버렸습니다. 전국의 폭포 많이 찾아 다였습니다. 길에는 억새도 계절을...,2020. 11. 1.
국내 당일치기 여행 함양 하미앙 경남 데이트 코스~,지리산 지안재 경남 함양군 함양읍 구룡리 함양 여행 중 한번은 들릴 거 같은 지리산 지안재인데요. 하미앙에서는 4.8km정도 거리라 드라이브 코스로 들리곤 해요. 여행지가 인근이라 당일치기 여행 코스로 촉박하지 않아 좋아요. 전망대에서 내려본 모습인데요. 보기엔 아름다운 S라인 길이지만...,2021. 9. 5.
"경남 여행 함양 가볼만한곳, 함양 대봉산 휴양밸리- 함양짚라인-함양모노레일...","찾아 경남 함양여행 추천해요 1. 함양가볼만한곳, 함양대봉산휴양밸리 경상남도 함양군 병곡면 원산지소길 192 055-963-2026 함양 대봉산 휴양밸리는 지리산을 비롯한 함양의 수려한 명산중에 자리 잡은 곳으로 ♪깊은 산속 옹달샘 누가 와서 먹나요 노래를 흥얼거리게 할 만큼 속세를 벗어나 있지만...",2021. 9. 29.
"[경남 함양 / 함양 랜선여행] 함양 남계서원, 조금 느린 여행으로 만나는 세계문화유산","느린 여행을 합니다. 세계문화유산으로 선정되었지만 사람들이 많이 찾지 않아 한적하게 구경하기 좋은 조선시대 교육기관인 함양 남계서원을... 경남 함양군 남계서원은 경북 영주시 소수서원, 경북 경주시 옥산서원, 경북 안동시 도산서원, 병산서원, 전남 장성군 필암서원, 대구광역시 달성군...",2021. 8. 19.
[GNTF 서포터즈] 2020 여행트렌드 R.E.F.O.R.M + 경남 함양군,안녕하세요~ 경남관광박람회 서포터즈 7기 안수연입니다! 오늘은 2020년도 국내여행 트렌드에 대해 소개하려고 해요~ 여러분들은 2020 국내여행... 출처 - 함양군 홈페이지 현재 함양군 홈페이지에서는 여행지에 직접 가지 않아도 VR 기술을 통해 함양의 다양한 관광지들을 언제 어디서나...,2020. 5. 9.
"경남 함양군, “제5회 함양 고종시 곶감축제” 온라인개최!!! - 온라인으로 곶감 싸게...","- 15회의 곶감 할인판매 행사를 진행하고 (20~25% 할인) - 선착순 이벤트를 통해 매일 100개씩의 푸짐한 경품행사 - 함양군에서 생산되는 사과, 흑돼지 불고기, 굿볶이, 연잎밥, 삼계탕, 흑돼지 소시지 등 다양한 로컬푸드 기획전 - 부대행사로 곶감요리 미식여행, 랜선 버스킹공연...",2021. 1. 11.
"[함양군]함양대봉산휴양밸리,떠오르는 관광 핫플레이스",여행정보 경남여행 함양핫플레이스 함양 힐링여행(함양군청) 대봉산휴양밸리 모노레일 국내 휴양시설 중 방문객 기준으로 인기 최상위권을 달리고 있는 함양대봉산휴양밸리 내 대봉스카이랜드·대봉캠핑랜드 이용객수가 함양군 사회적 거리두기 1단계 하향 조정된 첫 주말 기준으로 역대...,2021. 6. 16.
[경남 함양 / 함양 랜선 여행] 시원한 계곡물소리를 들으면서 힐링 시간을 갖기 좋은...,"기백산은 경남 함양군 안의면과 거창군 위천면의 경계에 있습니다. 용추계곡으로 주차장에 주차를 한 후 계곡을 따라 폭포소리가 울렁차게... 함양 여행 용추계곡 시원한 바람과 계곡의 물소리도 즐겨보셨다면, 그냥 스쳐지나가지 마시고, 함양의 물레방아 유래와 역사를 알 수 있는 곳...",2021. 8. 27.
[경남 여행 / 함양 랜선 여행 /함양 엑스포] 산삼 항노화산업의 모든 것을 만나는 2021...,"천종삼이 전시되어 있는데요 이 산삼은 심마니가 함양군 남덕유산 자락에서 2016년 8월 21일 채취하였으며 전문가 감정 결과 약 100년 이상 된것으로... 이곳에서는 자연이 초대한 최고의 건강 여행을 떠날 수 있습니다. 2021 함양 산삼 항노화 엑스포에서 활력을, 힐링을, 즐거움을 함양하십시오.",2021. 10. 6.
국내 당일치기 여행 함양 상림공원 지안재 경남여행지추천..,"오도재 /지리산제1문 경남 함양군 휴천면 월평리 국내 당일치기 여행 마지막 코스, 지안재에 올라서서 직진, 지리산가는길 3.8km를 더 가면 오도치에 닿아요. 한때는 지안재를 오도재라고 부르기도 하고 여기가 거긴가 했는데 직접 달려보니 구분이 되네요. 오도재는 도솔암에서 수도하던...",2021. 2. 15.
"여름철 피는 배롱나무꽃 여행,경남함양 남계서원","여름철 피는 배롱나무꽃 여행,경남함양 남계서원 남계서원 남계서원은 유네스코세계문화유산에 등재된 역사깊은 서원으로 1552년(명종 7) 일두... 여름철이면 배롱나무꽃을 보기위해 많은 사람들이 찾는다 경남 함양군 남계서원 배롱나무 꽃 8월초 친구와 같이 함양에 들렸다 함양은 코로나19...",2021. 8. 14.
"[경남 함양 / 함양 랜선 여행] 함양 지리산 칠선계곡, 우리나라 3대 계곡의 원시림을...","[칠선계곡 탐방예약 가이드제 운영 안내] - 주소 : 경남 함양군 마천면 추성리 340-1 추성주차장 - 연락처 : ***-***-****(지리산국립공원경남사무소), 055... 너무나 맑고 깨끗해서 일곱 선녀가 목욕했던 계곡 구경과 자연이 살아있는 원시림을 걷는 트레킹 즐겨보세요. ▼ 함양 여행지 둘러보기 ▼ < < <",2021. 8. 5.
[경남 함양 / 함양 랜선 여행] 지리산의 확 트인 풍경을 바라보며 함양 오도재와...,함양 여행으로 멋지고 풍경의 드라이브 코스로 최고입니다. 지리산 조망공원에 오도재 아래의 구불구불한 구간을 지안재로 따로 구분해 불렀으나... 지리산 천왕봉이 한눈에 보이는 경남 함양군 마천면 지리산 조망공원에 세워진 '마고할미' 조각상이 있습니다. 천왕·천왕할매·마고할매...,2021. 2. 3.
경남 함양 가볼만한곳 상림공원 꽃구경 맘껏,상림공원 경남 함양군 함양읍 교산리 1073-1 연중무휴 주차 가능 함양여행은 처음인지라 가볼만한곳을 검색을 하니 상림공원 후기들이 많더라구. 함양명소이며 함양분들이 즐겨 찾는 곳이구나 했지. 직접 방문해보니 산책코스로 넘 좋더라. 천년교를 중심으로 숲이 우거진 산책길을 따라 볼 수 있는...,2021. 10. 11.
경남 주말여행지 함양 상림공원 10월 꽃구경,"경남 주말여행지 함양 상림공원 10월 꽃구경 경남 함양군 함양읍 교산리 1073-1 입장료 10,000원 / 주차료 무료 백연주차장에 주차를 하고 길을 건너면 엑스포 입구가 나옵니다. 매표소에서 표를 구입 후 입장이 가능합니다. 엑스포 분위기가 물씬 나는 것이 노랫소리와 하늘에는 커다란 풍선이 더...",2021. 10. 1.
(2021년3월)경남 함양 당일여행-4....지안재&오도재&서암정사,2021년 3월 14일 당일치기 여행 중 상림공원을 관람하고 지안재와 오도재를 지나 서암정사로 갔다 【지안재와 오도재】 (경남 함양군 휴천면 지리산가는길 635/월평리 산 123-21) 함양 상림공원에서 서암정사를 가려면 지리산 가는 길의 구불구불한 고갯길 '지안재'와 '오도재'를 지나야 하는데 지안재...,2021. 4. 21.
[경남 함양 / 함양 랜선 여행] 꽃무릇 가득한 상림공원의 꽃길을 걸어요,"바랍니다> 경남 함양군 함양읍 교산리 1073-1. 함양 상림공원의 주소를 내비게이션에 찍으니 1시간 51분, 156.8 km라고 뜨는 정보에 갈등할 시간도... 어찌나 넓은지 물 없이 돌아다니면 갈증으로 고생합니다~~~ 저처럼 처음 상림공원을 방문하실 분들은 개인 물도 갖고 가시면 언택트 여행에 좋을...",2021. 9. 27.
"함양군, 쿠팡 첨단물류단지 조성사업 주민설명회 개최 토지개발#형질변경#관광농원...",쿠팡 첨단물류단지 주민설명회 [이미지출처=함양군] [아시아경제 영남취재본부 최순경 기자] 경남 함양군은 지난 8일 오후 군청 대회의실에서 주민 40여명이 참석해 쿠팡 물류센터 조성을 위한 주민설명회를 개최했다. 이번 주민설명회는 쿠팡 물류센터 인허가를 위한 행정절차의 목적으로 군...,2021. 9. 9.
[경남 함양 / 함양 랜선 여행] 산삼 찾아 함양으로! 2021 함양산삼항노화엑스포에서...,"2021 함양산삼항노화엑스포에서 즐기는 활력 여행 경남공감 8월호 (글 배해귀 사진 김정민) “함양하면 산삼, 산삼하면 함양!”이다. 매년... 또한 삼국시대 신라와 백제의 경계지점이었던 ‘함양군 서상면 남덕유산’ 일대는 수많은 심마니가 찾아오던 한반도 최대의 산삼 자생지였다. 이처럼...",2021. 8. 17.
1박2일 함양여행코스 서암정사 대봉모노레일 흑돼지음식거리,1박2일 함양여행코스 서암정사 대봉모노레일 흑돼지음식거리~ 1박2일 여행으로 함양의 가볼만한곳 그리고 그 지역의 맛집에서 맛있는 음식을... 서암정사 주소 : 경남 함양군 마천면 광점길 27-79 문의전화 : 055-962-5662 함양대봉산 휴양밸리 대봉스카이랜드 - 대봉모노레일 대봉모노레일을 타고...,2021. 10. 5.
경남여행,"1박2일동안 자동차를 운전하면서 경남 여행을 다녀왔다. 거창군 마리면 율리 폐교에 만들어진 글램핑에서 하룻밤 묵고 오는 길에는 일부러 국도를... 거창군 (61,400여명) 함양군 (39,000여명) 산청군 (34,800여명) 의령군 (26,800여명) 들릴때마다 그 곳 인구수를 검색해 봤는데 생각보다 너무 적었다....",2021. 2. 9.
지금가기 너무 좋은 경남 드라이브 코스 함양 하미앙 정원 카페,하미앙 경남 함양군 함양읍 삼봉로 442-36 매일 09:00-18:00 (명절당일 오후 1시 오픈) 네비게이션에서 하미앙 와인벨리를 검색하세요. 주차장에서 10분소요 *반려동물동반가능 저희는 걍 몰라서 하미앙이라고 쳐서 갔는데 입구까지 올라갔었구요 주차장이 여러군데 있는데 입구랑 제일 가까운 주차장이...,2021. 10. 5.
경남이와 랜선여행_단풍여행편,"경남이와 랜선여행 오늘은 추석도 지나고, 제대로 가을을 맞이해 단풍여행편으로 돌아왔습니다! 먼저 보기 쉽게 각 지역별 단풍가기 좋은 곳... 제 1호인 지리산의 단풍 궁금하시지 않으신가요? (경남 함양군 마천면 추성리) 더 많은 정보는 경남은행 인스타그램/페이스북에 많~이 있으니 놀러오세요",2020. 10. 12.
함양지리산마천흑돼지촌 음식특화거리 경남식육식당~,#함양지리산마천흑돼지촌 #음식특화거리 #함양음식특화거리 #흑돼지특화거리 #함양여행 #경남식육식당 #지리산마천흑돼지촌 #함양여행 #함양맛집 #함양군 #함양산삼항노화엑스포 #함양군마천면 #함양농업기술센터 #백숙현체험여행 #농촌체험관광 우리나라 방방곡곡 여행을 다니다 보면 삼겹살...,2021. 10. 3.
[차박여행] 경남 함양 화림계곡 선비문화 탐방로,코로나로 인해 매일 나가던 탁구장도 당분간 쉬어서 8월말로 퇴직은 했지만 역시 코로나로 인해 특별한 활동 계획이 없는 남편과 함께 퇴직 당시 차박을 할수 있도록 꾸며놓은 남편 차로 9월 23일 아침에 전라도 청정한 섬지역으로 여행을 나섰다. 첫째날 전라도 가는길에 경남 함양군 안의면에...,2020. 9. 27.
[경남 여행 / 경남 한 달 살이] 딱 한 달만 산 좋고 물 좋은 데 살고 싶어? 어렵지 않아...,"경남 여행을 통해 나만의 경남별곡을 남겨보면 어떨까? 자, 도전! 지난해부터 운영…폭발적 인기로 5→15곳으로 확대 한 달 살이가 유행하기 시작한... 지난해 5개 시군 외 창원시, 사천시, 밀양시, 거제시, 함안군, 창녕군, 고성군, 남해군, 함양군, 거창군이 추가됐다. 선정자 수도 늘려 모두 600개 팀...",2021. 6. 9.
