header,contents,date
"당산나무집 :: 우렁이달인이 운영하는 우삼겹+우렁쌈밥, 광주 봉선동 맛집",원한다면 광주봉선동맛집 당산나무집 추천드려요 :) 광주 현지인들도 많이 가는 식당으로 알려져있고 타지에서 여행 온 지인들이 광주맛집... 응원하겠습니다^^ #봉선동맛집 #광주남구맛집 #당산나무집 #광주봉선동맛집 #우렁요리전문점 #우렁강된장 #광주한식맛집 #광주우렁쌈밥 #광주우삼겹...,2021. 8. 21.
"광주브런치카페, 쿤스트라운지 누보",광주남구카페배달 #광주브런치맛집 #방림동브런치카페 #방림동브런치맛집 #서이추 #서이추환영 #서이추추천 #일상 #일상이야기 #일상기록 #일상블로그 #먹스타그램 #맛스타그램 #여행스타그램 #광주맛집 #광주밥집 #광주카페 #광주핫플 #광주데이트 #광주데이트코스추천 #먹스타그램 #맛스타그램...,2021. 5. 1.
광주문화재단(옛 구동체육관)과 함께하는 [광주비엔날레커미션 in...,"그중 광주 남구의 명소중하나인 구동에 위치한 광주문화재단(옛 구동체육관) 전시를 관람해 보았답니다. 먼저, 비엔날레 커미션이 열리는... 코로나 19 감염예방과 여행이 제한되면서 2021년과 2022년 두편으로 나뉘어 각가 공개되는데요.. 이번 전시는 '작업실'형태로 꾸며져 있었답니다....",2021. 4. 29.
깔끔했던 봉선동 국밥 광주 내조국국밥남구청점,"봉선동국밥 광주 내조국국밥남구청점에 방문해본다. 최근 여수 여행을 갔을 때 많이 보였던 국밥 내조국 국밥! 여수에만 있는 줄 알았다가 혹시나 해서 찾아봤더니 집에서 멀지 않은 광주 내조국국잡남구청점이 있었다! 내조국국밥은 여수가 본점이며, 광주에도 3곳이 생겼다고 하니 얼마나...",2021. 6. 29.
광주 봉선동 커플마사지 마이타이 데이트도 하고 힐링도 하고:),광주 봉선동 커플마사지 마이타이 기본정보 광주 남구 봉선중앙로 57 (남구 봉선동 473-11) 062-655-3310 영업시간 오전 10:00 - 오전 06:00 * 수면실 완비... 광주 봉선동 커플마사지 마이타이 * 내부영상 차잔- 짜라자라짠 짜라라라라 - 하... 안 그래도 그대랑 우리 진짜 해외여행은 언제가지 하면서...,2021. 2. 20.
봉선동 커피 맛집 ‘험프 로스터스’ 작지만 강했던 광주 카페,험프 로스터스 광주 남구 봉선1로 52 평일 09:00-22:00 주말 11:00-22:00 070-4189-0987 봉선동 롯데리아사거리 쪽에 커피 맛집이 있다고해서 찜해놨다가 가본... 테이블이 여행온 듯한 기분을 불러일으켜 잠시나마 설레기도 했어요 외벽 재질이 독특해서 만져봄 ㅋㅋㅋ 날 좋을 땐 앉아서 즐기기 딱 좋은...,2021. 8. 2.
"광주 나들이, 빛고을농촌테마공원 다녀왔어요","#빛고을농촌테마공원 주소, 광주광역시 남구 양과동 1290 운영시간, 09:00-18:00 (휴원일 사짐 참조) 주소는 남구인데 #나주 우리집에서도 매우 가까운 곳! 날씨도 좋고 간만에 아이랑 콧바람 좀 쐬러 다녀왔어요 :) 주차장도 넓구요, 안으로 들어가봅니다, 들어가기전 안내도 잠깐 보는데 생각보다...",2020. 9. 28.
"광주캠핑용품, 나주캠핑용품은 캠핑고래광주남구점에서",광주캠핑용품 나주캠핑용품 캠핑고래광주남구점 안녕하세요 요즘 코로나 시국이라 해외여행을 자주 못가는 실정이잖아요 그래서 캠핑족들이 많이 늘어났다고 합니다 저도 캠핑을 좋아해서 캠핑용품들이 좀 있는데 다양한 캠핑용품들을 만날 수 있는 최대규모의 샵이 있어 잇님들께...,2021. 5. 27.
#달콤한과일 #정년퇴임축하선물 #광주남구과일바구니 #광주과일바구니...,결혼축하과일바구니선물 #여행휴가지과일바구니 #여행지선물 #더블유여성병원 #미즈피아병원 #문화여성병원 #빛고을산부인과 #모아산부인과... 광주동구과일바구니 #광주남구과일바구니 #광주서구과일바구니 #광주북구과일바구니 #광주광산구과일바구니 #동림동과일바구니 #중흥동과일바구니...,2020. 1. 9.
"광주 양림 갤러리 카페 ""이이남 스튜디오""와 숨겨진 사진 맛집",광주 양림 카페 이이남 스튜디오 광주 남구 제중로47번길 10 이이남스튜디오 남광주역3번 출구에서1136m 영업시간 평일 11:00 - 22:00 주말 11:00 - 22:00 월요일휴무 광주에 여행아닌 여행을 왔다가 갤러리카페로 유명한 이이남스튜디오를 방문했습니다! 저녁에 방문하는 바람에 낮 전경을 못 봐서...,2021. 5. 2.
예술가의시간_홍차로 그리는 여행 드로잉,"10월 7일에 체험을 희망하시는 분은 https://event-us.kr/37459에서, 10월 14일에 체험을 희망하시는 분은 https://event-us.kr/37461 에서 신청해주세요! <행사장소> 10년후그라운드 2층 스튜디오A 행사주소 : 광주 남구 양촌길 1",2021. 9. 24.
드립백 추천 캠핑에 광주커피랩 향이 가득~,"매장주소 광주광역시 남구 효천2로가길 19 희망타워 4층 (광주 남구 임암동 870번지) 매장전화번호 062-675-6696 매장영업시간 월요일부터 금요일까지... 크기라 여행, 캠핑, 피크닉 등 외출해서도 맛있는 커피를 마실 수 있다는 게 정말 좋더라고요!! 보관 기간이 제조일로부터 1년이라 생각보다 오래...",2020. 12. 15.
숨겨진 빵 성지! 광주 빵집,음식 유령에서 윤슬 빵집까지 광주 양림동 아페리티프에서 온 버터로 가득 찬 크루아상 ▲위치: 광주 남구 백서로 72 ▲영업시간: 매일 10시~21시... 장로들은 얼어 붙으면 더 많은 것을 끄덕이고 좋은 것을 얻습니다. 음식 유령에서 엘더까지 빵을 뿌린 팬을 모으세요! 전국을 여행하세요!,2021. 6. 25.
양림동 펭귄마을 공예거리로 광주가 뜨겁다,“양림동 역사문화마을 관광자원화 사업의 시작” 광주시 남구청 문화관광과 양림동에 볕이 들기 시작한 것은 2006년 광주시가 2007년부터... 외지인이 양림동을 둘러보려면 제일 먼저 양림 커뮤니티센터를 찾아 양림동에 관한 역사와 여행 코스를 살펴보고 가는 것을 추천합니다. 양림동의 화려한...,2020. 10. 22.
"[월산동 맛집]월산공원-광주 옻닭, 닭볶음탕 맛집 ,관상봐주는 곳",게다가 초복 전날이었기 때문에 지금와서 생각해보면 정말 탁월한 선택이었다( 내가 고름ㅋㅋ) 월산공원식당 광주 남구 월산동 587-3 062-361-2312 매일... 다음엔 쾌적한 느낌으로 먹고싶어요 다음엔 커플세트 먹어보러 그래도 한번 더 가볼게요 싸장님..벨 좀 만들어주세요 #광주 #광주맛집 #광주여행...,2021. 7. 16.
남구 진월동 대주 1차 32py 광주아파트리모델링,날씨좋으니 저역시도 드라이브하고싶고 떠나고싶기도하구요 여행가구싶네요 ㅎㅎ 내일도 근로자의 날이라서 쉬시는 잇님들께서도 많으실건데 4월에 피로에 지친 몸을 멀리 보내버리자구요 오늘은 잇님들께 소개해드릴 곳은 남구 진월동 대주 1차 32py 광주아파트리모델링 입니다. 심플 모던한...,2020. 4. 30.
"2021. 4. 29 광주 양림동_4. 23, 24","- 양훈도 /광주남구문화원 - ' 미국에서 가장 보수적인 남부 지역 장로회 소속 선교사들이 개화기 한국에 와서는 자연히 가장 진보적인 인물들이... 카페 겸 여행자 라운지인 '카페 1890', 홍차 전문점 '하원재', 이탤리언 레스토랑 '마리오 셰프'에서는 맛있는 음식과 달콤한 휴식을 취할 수 있다....",2021. 4. 29.
광주 모텔 어썸무인호텔 인증!!,1박 여행갔다가 저녁식사 하면서 아빠가 술을 드시는 바람에 (그 당시 아빠 빼고는 가족중에 운전 할줄 아는 사람이 없었어요 ㅋ 지금은 저도 아주... 합리적인 가격에 쾌적한 숙박 시설 찾으시는 분 계시면 꼭 한번 방문해 보세요^^ 어썸무인호텔 광주 남구 봉선로 9번길 31-1 062-673-0080,2021. 8. 11.
광주 펭귄마을 가족여행 추천,광주에 거주하시는 분들은 자랑의 거리가 되었고 광주여행을 계획하고 있는 관광객들에게는 필수 여행코스로 자리잡았습니다. 이곳은 마을주민도 참여를 했지만 광주시와 남구의 합동작품으로 완벽하게 탄생된 관광지라고 생각하셔도 좋을 것 같습니다. 도시재생 전문가분들의 다양한 자문을 받아...,2020. 12. 21.
광주콩물국수 맷돌콩물국수 살얼음콩물국수,설탕을 사아아아아악 뿌려 광주콩물국수 광주남구콩물국수 진월동맛집 설탕 하트로 뿌려줘 ! 하트....? 설탕먹으면서 경주는 소금?넣어서 먹는다고... ㅋㅋㅋㅋㅋㅋㅋㅋㅋㅋㅋㅋㅋㅋㅋㅋ 양동통닭 ㅎㅎㅎ 치킨 기다리며 찍은 사진 아주 맛나다 여행갈땐 양동통닭이 진리다 메뉴 반마리 치킨은...,2021. 6. 13.
[광주 봉선동 양고기 맛집] 너무 부드럽고 맛있는 프렌치렉 양갈비 고급스러운 ‘카엔’...,"평소 양꼬치,양갈비 매우 좋아함♡ 갑분 시간여행.... 사실 이 때 블로그 침체기라.... 쓸 생각을 못하고 사진을 안 찍었는데 먹다보니 아니!!?... 주소 ㅣ광주 남구 봉선중앙로47번길 12 광주 남구 봉선동 480-1 영업시간 ㅣ 16:00 - 24:00 주차 ㅣ 근처 아무데나! 전화번호 ㅣ 062-655-8027 예약도 가능합니다!",2021. 4. 6.
광주 크로플 맛집 카페수월 피크닉 메뉴로 딱!,"매장주소 광주광역시 남구 효천2로가길 19 1층 (광주 남구 임암도 870번지 1층) 매장전화번호 070-7633-3646 매장영업시간 평일 오전 11시부터 밤 11시까지 주말, 공휴일 오전 11시부터 밤 10시까지 연중무휴 디저트가 맛있는 광주 크로플 맛집 그리고 효천지구에서 유일한 로스터리 카페로 직접 로스팅 한...",2020. 10. 8.
64살 광주언니의 여행일기: 빛고을농촌테마공원,64살 광주언니의 여행일기: 빛고을 농촌테마공원 청정한 농촌을 체험과 힐링 자원으로 조성한 광주광역시 남구 양과동에 있는 빛고을 농촌테마공원입니다. 아기자기한 개울이 흐르는 곳곳에 자연 친화적인 휴식공간과 체험공간을 제공하고 있어요. 광주광역시 남구의 가볼 만한 곳으로 꼽히는...,2020. 12. 5.
"광주 양림동 ""오키나와후라이"" 텐동&소바 맛집 - 짱맛도리","광주 양림동 밥집 텐동&소바 찐맛집 ""오키나와후라이"" 광주 양림동 맛집 ""오키나와후라이"" 위치 : 광주광역시 남구 백서로 76 111호 영업시간 : 11:30... 요즘 같은 시국에 해외 여행 간접 경험,, (오키나와 안 가봄^^!_) 텐동 맛있게 먹는 법도 나와있으니, 드시기 전에 한 번씩 읽어보세용! 저도 보고...",2021. 10. 4.
[광주 여행] 01# 광주 패밀리랜드 (우치공원): 수도권 동물원 부럽지 않네!,"사진과 동영상만 올려도, 엄청난 양의 동물들로 글이 지루해질 것이기에 이번 [여행] 글은 우치공원에 대한 간략한 정보와, 개인적으로 마음에 들었던 동물들을 소개하겠습니다. :) <우치공원> 우치공원은 기존에 광주 남구 사직공원에 있던 동물원을 북구 생용동 광주 패밀리랜드 일대로 이전하여...",2020. 3. 21.
광주데이트. 광주볼거리. 수피아여고. 커티스메모리홀,"광주 추천 여행지 ""커티스메모리홀"" 광주광역시 남구 근대문화유산에 등재 된 건물들이 많은 양림동에 우일선선교사 사택을 지나 수피아여고 안에 위치한 작은 교회가 있다. 근대문화유산 등록문화재 제159호로 지정되여 있으며 1925년에 건립되였다 한다. 회색빛 벽돌을 이용한 건축기법으로...",2020. 9. 17.
"전라도 역사기행/전라도 관광 100선에 포함된 역사여행(남도여행, 가볼만한 곳)","전라도 역사기행으로, 전라도 대표관광지 100선에 포함된 역사여행지이다. ▶ 백제왕도 왕궁리 유적 백제 무왕대에 조성된 왕궁터로, 구릉 내부... - 주소: 광주 남구 서서평길 7(역사문화마을)/남구 오기원길 20-13(펭귄마을) 출처: 한국관광공사 ▶ 5.18유적지(영화 택시운전사 촬영지) 전남도청과...",2020. 11. 27.
"[트래블리더 12기 사전 미션] 눈과 입이 즐거운 여행& 잔잔한 힐링을 주는 도시, 광주","위치- 광주 남구 사직 길 6 이용 정보- 19:00~01:00 통기타를 마지막으로 즐거운 여행을 보냈나요? 광주의 매력을 짧게나마 느낄 수 있는 잔잔한 힐링 코스였습니다. 사실 광주는 이것 외에도 정말 다양한 맛집과 볼거리가 많습니다! 저는 이 힐링 코스를 '잠시 머리를 식히고 싶은 분, 새로운 광주의...",2020. 3. 2.
[덮밥] 광주 양림동맛집 : 함냐함냐,지금부터 솔직한 리뷰 남겨볼게요 'ڡ'४ ▶ 광주 남구 제중로46번길 14 1층 ▶ 매일 11:30 - 22:00 ▶ 라스트 오더 21시 ▶ 매주 월요일 휴무 ☎ 062-400-4111... 일본여행갔을 때 먹은 마제면을 떠올리며 먹기 전에 아주 기대가 됐던 메뉴였다 ~~ ! 모든 재료를 잘 골고루 비벼줍니다 ~~~~ ! 다 비빈 비주얼이...,2021. 5. 24.
64살 광주언니의 여행일기: 구름천사 노의웅 미술관,64살 광주언니의 여행일기: 구름천사 노의웅 미술관 광주광역시 남구 양과동 오래된 시골 마을에 있습니다. 이 마을에 미술관이 있다고? 의문이 들때 쯤 두리번 거리다가 만나게 되는 개인 미술관 입니다. 고요한 마을에 붉은 주황색 건물이 다소 낯설지만 미술관 특징이 돋보이는 특유의 외관...,2020. 12. 6.
광주 빈티지 소품샵 <소근소근 잡화점>,"\6월 1일부터 13일까지 가오픈 중이에요/ 광주 남구 양림동에 새롭게 생긴 빈티지 소품샵 <소근소근 잡화점>입니다! 가오픈 기간인 6월 13일까지는 오후 1시~6시, 정식으로 오픈하는 6월 15일부터는 오후 1시부터 8시까지 열려있어요. +매주 월요일은 쉬어가는 요일! 가오픈 9일차였던 어제는 좀처럼 여행...",2021. 6. 10.
봉선동 카페 추천_홍콩와플맛집은 홍콩다방 광주봉선점!,"봉선동 카페 홍콩와플 맛집 홍콩다방 광주봉선점 광주 남구 봉선중앙로 33 1층 광주 남구 봉선동 469-22 1층 062-682-5050 매일 09시~23시/라스트오더 22... 여수 여행 갈때 홍콩와플 먹으려고 했는데, 이젠 광주에서도 홍콩와플을 즐길 수 있습니다! 홍콩와플 맛집 홍콩다방 고마워요 광주에 생겨줘서...",2021. 6. 24.
[어반스케치]광주 동구를 그리다 '어반스케치' 전시중/광주 취미미술/성인 취미 미술...,"3 소실점, 해칭방법 등 여러 기법과 다양한 커리큘럼으로 진행되고 있어요 내 일상이나 행복했던 여행의 순간을 연필로 스케치 하면서 힐링의 시간을 가져보세요 강의 상담, 문의는 항상 환영이랍니다~ ^^ 광주 남구 오기원길3(양림동) 1층 상담 문의 :070-8615-4152 #광주취미미술 #광주성인미술...",2021. 5. 7.
[한국관광공사가 선정한 가을 비대면 관광지] 여유롭고 안전한 광주 여행지,[한국관광공사가 선정한 가을 비대면 관광지] 여유롭고 안전한 광주 여행지 한국관광공사가 선정한 가을 비대면 관광지 100선 中 여유롭고 안전한... 광주광역시 서구 천변좌로 12-16 광주 근대문화를 느낄 수 있는 호젓한 산책길 양림동 호랑가시나무길 호랑가시나무아트폴리곤 광주광역시 남구...,2020. 11. 9.
일과 삶의 균형이 중요한 디투리 주민들의 광주 근교 캠핑장 추천 리스트,광주 승촌보캠핑장 Previous image Next image 출처: 한국관광공사 고캠핑 광주 남구 영산강 부근에 위치한 캠핑장으로 시내에서 접근성이 매우 좋은... 있어 어린아이들이 있는 가족 여행으로 추천합니다! * 현장상황과 다를 수 있으니 자세한 내용은 해당 캠핑장 사이트에서 확인하시기 바랍니다.,2021. 7. 9.
광주가족모임 담양판그릴 구워져서 나오니 편해,엄마랑 외식이 일상이였는데 외출 자체가 여전히 조심스러운 시기라 식당도 되도록 안가고 있는데 점심 피크 시간 피해서 가니 여유있고 너무 좋았어요. 포인트 적립 되니 꼭! 하세요!ㅋㅋㅋ 주소 : 광주광역시 남구 진월동 513-5 Tel : 070.4150.9192,2020. 10. 4.
64살 광주언니의 여행일기: 광주광역시 승촌보,"여행이 별건가요 내가 가고 싶은곳에 내시간에 형편껏 즐기면 되는거지요 뭐, 콧노래가 나옵니다. 하마터면 못 볼 뻔한 풍경을 한꺼번에 다 봤어요. 은빛 날개 일렁이는 갈대 숲, 멈추지 않고 흐르는 강물, 벌써 싸늘한 찬바람. 흔히 나주 승촌보라 부르는 이곳은 광주광역시 남구 승촌동입니다....",2020. 11. 25.
64살 광주언니의 여행일기:양림동 펭귄마을,어른 들이라면 누구나 어린시절 추억이 새록새록 떠오를 겁니다. 어린이와 학생들에게는 부모님세대의 생활을 엿보며 자원을 재활용한 예술작품을 감상하고 직적 체험해 볼수 있는 멋진 시간이 될거예요. 가족여행을 생각하신다면 광주광역시 남구 양림동 펭귄마을로 오세요~~~^^,2020. 11. 10.
"광주 샐러드 정기배송 초록테이블, 피크닉 갈때도 좋았던 신선한 샐러드와 샌드위치",지난주 일요일 광주남구 빛고을 농촌 테마공원으로 나들이를 다녀왔던 복댕이네..! 농촌 테마공원에 가면 안쪽으로 작은 오두막이 몇개 있어서... 다시 살이 찌고 말았거든요 ㅠㅠ 지난 영천~경주 여행을 다녀오면서 둘다 사이좋게 2kg 더하기를 해버려서 마음먹고 원상복귀 시키기로 결심!! 워낙에...,2021. 7. 20.
여행자라운지에서 '광주'를 만나다.,"상품들도 '지역'과 연결되어 있어요 :) 그렇기 때문에 여행자라운지를 찾아주시는 많은 분들이 광주에 거주하시는 분들도 광주에 여행오신 기분을 느낄 수 있는데요! 이번 주말, #역서사소와 #플레이스인광주 상품들을 만나러 광주남구양촌길1 여행자라운지를 방문해보시는 것은 어떨까요? by.jun",2021. 6. 25.
광주 동굴 카페 / 이색 데이트 / 양림동 까브(cave),오늘은 광주 1박 2일 여행 후기 2탄입니다>< 이번 포스팅은 광주 양림동의 동굴 체험 카페 까브 후기입니다. 카페에 동굴이 왜 있는지 진짜... 나갈때에는 해가 져서 더 이쁘더라구요. 주소 : 광주 남구 서서평길 2 지금은 네이버에 영업시간이 안 적혀있는데 아마 9시까지 하는걸로 알고 있어요.,2021. 5. 15.
64살 광주언니의여행일기:구동 광주공원,"블랙(Black)투어리즘 또는 그리프(Grief)투어리즘으로 불리우는 다크 투어리즘(Dark Tourism ) 은 휴양과 관광을 위한 일반 여행과 다르게 재난이나 역사적으로 비극적인 사건이 일어났던 곳을 찾아가 체험함으로써 반성과 교훈을 얻는 여행을 말하죠. 다크 투어리즘의 첫걸음, 여기는 광주광역시 남구...",2020. 11. 2.
"광주 신선횟집, 제철의 전어가 일품인 맛집",매운탕! 한 끼 식사의 마지막을 장식할 만했다. 얼큰함이 일품이다. 다만 상당히 매워서 나는 별로 못 먹었지만.. 조금만 덜 맵고 시원했다면 최고일 듯! 주소: 광주광역시 남구 대남대로 181번길 33 전화번호: 062-675-5355 영업시간: 12:00-23:30 (매주 화요일 정기휴무) 주차장: 식당 앞에 있다.,2020. 9. 19.
[평일 일상] 9월 마지막주 : 광주 당일치기 / 캠핑용품 싹쓰리 ⛺️,"우리부부의 첫 캠핑은 그랜드캐년 마더캠핑장에서 시작되었는데 ㅋㅋㅋㅋㅋㅋㅋㅋㅋㅋㅋㅋㅋㅋㅋㅋ 해외여행 중 급구한 캠핑장비여서, 단돈... ㅋㅋㅋ 식당은 옛날밥상 광주 남구 용대로119번길 6 http://naver.me/55XBpZ1k 일단 돼지주물럭 2인으로 주문요. 와 딱!!! 원하던 백반과 한정식의 중간 그...",2020. 10. 23.
[광주 팸투어] 광주 가볼 만한 곳 추천! 빛고을 '광주'로 떠나는 특별한 시간여행!,"모델 : 트래블리더 12기 신창희 ‘역사와 건축, 문화와 예술이 공존하는 박물관’인 양림동 일대의 감성 가득한 풍경을 따라 시간 여행을 떠나는 것만 같은 힐링 산책을 떠나보세요! [양림동 역사 문화마을] 위치 : 광주광역시 남구 서서평길 7 이용 시간 : 상시 개방 문의 : 062-607-2432 양림동...",2020. 8. 27.
광주안경 블루라이트차단안경 맞췄어요~,매년 여름엔 항상 해외 여행 가서 선글라스를 줄기차게 쓰고 다녔었는데 올 여름은 글렀네요. ㅠㅠ 아쉽지만 올해는 가까운 국내여행으로 아쉬움을... ㅎㅎ #광주안경원 #어린이시력검사 #광주누진다초점 #광주시력검사 #광주남구안경원 #봉선동안경원 #블루라이트차단안경 #광주시력검사전문...,2021. 6. 15.
"광주광역시, 코로나19 관련 26일 오전 11시 기준 브리핑 ..확진자 총 30명,격리해제...",격리해제 86 0 86 유럽여행 광주12 #5141(남구) ′38 3. 2. 4.15. 격리해제 14 0 14 광주11번의 할머니 광주13 #5031(남구) ′63 3. 4. 3.29. 격리해제 30 0 30 광주14 #7268(서구) ′98 3. 7. 3.23. 격리해제 74 0 74 광주3접촉자/신도 광주15 #7285(서구) ′95 3. 8. 3.19. 격리해제 12 0 12...,2020. 4. 26.
강아지와 드라이브 준비물과 주의사항 [광주 애견 호텔],코로나 백신 접종과 치료제로 인해 코로나가 종식되면 그간 해 보지 못했던 강아지와 함께 드라이브로 여행을 가보기 위해 미리 준비하는 마음으로 광주 남구 인기 애견 호텔 '개린이보호구역' (062-716-7005)에서 강아지와 함께 드라이브할 때 준비물과 주의사항에 대해 알아보는 시간을...,2021. 2. 2.
오래된 풍경 그대로 옛 추억을 소환하는 남구 월산동 달뫼 달팽이 마을과 수박등 마을...,수박등 마을 벽화는 약간 경사가 있는 동신대학교 광주한방병원 인근 남구 월산로137번길로 요즘 같은 집콕 생활에서 여름의 더위를 식혀줄 수박 그림을 보니 여름 폭염의 뙤약볕에서 그늘을 찾아 고향의 정취가 어린 고즈넉한 ‘수박밭의 원두막’으로 마음의 시간여행을 떠나봅니다. 덕림산과...,2021. 7. 28.
스마트폰교육 꽃검색활용 야외수업으로,매주 금요일이면 광주 남구에서 북구 효령노인복지타운으로 달려가는 프리랜서강사 효령노인복지타운 근처에 도착해서 주차하고 차에서... 코로나이후 국내여행조차 제대로 못 가고 있는 수강생님들께서 사진으로나마 여행기분을 느껴보라고 ㅎㅎ편집한 사진을 보고 너무나도 좋아하시네요...,2021. 8. 9.
광주캠핑용품 캠핑고래광주남구점 한번에 구비 가능해,"광주캠핑용품 캠핑고래광주남구점 한번에 구비 가능해 날이 따뜻해지고 있는 요즘같은 때에는 맛있는 먹을거리를 사들고 가벼운 마음으로 캠핑을... 요즘 여행추세는 장거리로 멀리 있는 곳을 가기보다는 가깝지만 녹읍이 있고, 푸른 산, 바다나 언덕, 개울이 있는 곳에서 가족끼리 소박하게 텐트를...",2021. 5. 29.
[광주/행암동] 사장님이 친절한 효천지구 숨겨진 카페 : 마을카페남동풍 :),♡ 월~토 10:00 ~ 21:00 일요일 휴무 #전남 #광주 #남구 #효천동 #효천지구 #마을카페남동풍 #당근마켓 #중고거래 #동물있는카페 #토끼있는카페 #카페추천... 도심속생태공간카페 #숲카페 #행암동카페 #효천지구카페 #쌍화차 #광주핫플 #데이코스추천 #숨겨진카페 #전남여행 #광주근교 #실내데이트,2021. 6. 17.
64살 광주언니의 여행일기:광주광역시 광주향교,64살 광주언니의 여행일기: 광주광역시 광주향교 저에게 향교는 돌아가신 친정 아버님을 떠오르게 하는 추억의 장소 입니다. 오늘은 청소년... 이제 광주광역시 광주향교의 이모저모를 소개해 드리겠습니다. 광주광역시 광주향교는 광주향교(光州鄕校)는 광주광역시 남구에 있는 조선시대의...,2020. 11. 19.
"광주 가볼만한 곳 - 지산유원지/무등산 리프트+모노레일, 수완호수공원","광주 가볼만한곳으로 여행리뷰를 간략하게 바로 포스팅하게 되었습니다.^^ 최근에 다녀왔던 광주 여행리뷰를 올려보도록 하겠습니다. 광주... 광주 지산유원지 무등산 팔각정 전망대(1) 무등산팔각정 1층 2층 상관없이 광주 도심권 전체를 조망하실 수 있습니다. 무등산은 물론, 광주 남구,동구,북구...",2021. 4. 18.
