header,contents,date
"전라도 광주 가볼만한곳, 아이와 체험학습 쓱싹!","주소 : 광주 남구 포충로 987 문화체움터 얼쑤 운영시간 : 평일, 주말 10 ~ 17시 주차 : 주차장 넓어요. 휴무 : 매주 월요일, 1월 1일, 설날, 추석 연휴 근처 관광지 : 건너편에 빛고을농촌테마공원, 차로 3분 포충사 미리 예약을 하시고 방문하시면 다양한 체험을 즐기실 수 있어요! 오늘은...",2020. 7. 5.
광주송정동강아지분양 정직하고 양심적인 곳,그럴 때 저희 호텔 서비스를 이용하신다면 마음편하게 여행이나 며칠간의 외출을 하실 수 있습니다. 이곳에는 소형부터 대형동물들이 모두 사용할... 흑석동 #광주남구 #구동 #구소동 #노대동 #대지동 #덕남동 #도금동 #방림동 #백운동 #봉선동 #사동 #서동 #석정동 #송하동 #승촌동 #신장동 #압촌동...,2021. 2. 4.
[국내카페] 베르파크 (광주 봉선동),"베르파크 광주 남구 봉선동 1010-12 이번 소개해드릴 카페는, 봉선동에 위치한 깔끔한 디자인의 가게인 봉선동 ""베르파크""입니다. 큰 창문뷰... 브런치맛집, 토스트맛집인 봉선동 ""베르파크"" 카페 추천드립니다!!! 별점 : ⭐️⭐️⭐️⭐️ #국내여행 #국내카페 #광주여행 #광주카페 #봉선동카페 #베르파크",2020. 10. 7.
[국내카페] HTS (광주 진월동),"HTS (here to stay) 광주 남구 주월동 426-69, 1층 이번 소개해드릴 카페는! 대문이 아주아주 예쁜, 진월동에 위치한 ""카페 HTS"" 입니다! 진월동에 있지만... 추천드립니다!!! 별점 : ⭐️⭐️⭐️⭐️ #국내여행 #국내카페 #광주여행 #광주카페 #주월동카페 #진월동카페 #HTS # 카페HTS",2020. 10. 6.
광주 헤어실무반 헤어창업 꼼꼼하게 실무교육 받을 수 있는 광주미용학원~ #국비지원...,#광주미용학원 #광주남구 #미용학원 #광주미용학원추천 #광주헤어창업반 #백운동미용학원 #헤어실기시험 #세이뷰티미용학원 #헤어... 선택 : 광주->전체 직종 선택 : 이용·숙박·여행·오락·스포츠->이·미용->이·미용서비스->전체 훈련유형 선택 : 구직자->국민내일배움카드(일반) 선택 후에...,2020. 11. 19.
광주한옥카페 양림동에 위치한 양림동 한옥 카페 풀에 다녀왔어요,광주여행하시는 분들은 정말 꼭 가보셔야 하는 핫플중의 한 곳인데요. 바로 그곳이 옛정취도 느낄 수 있으면서 현대식의 건물도 함께 느낄 수 있는 양림동이에요. 오늘 소개해 드릴 곳은 그 양림동 안에 위치한 카페 풀 이에요. 카페 풀(pull) 광주 남구 백서로 83-1 062-676-3388 11:00-22:00 양림동...,2021. 1. 25.
자전거라도(羅道)_광주편,빛고을 자전거여행은 적은수의 참여로 시작하였습니다. 광주천을 중심으로 하류부터 상류까지 자전거전용도로가 있어 안전하지만 지난 폭우의 흔적이 치유가 되지 않아 장애물은 많습니다. 긴급하게 방향을 선회하여 용산체육공원에서 남구 노대동쪽으로 달렸습니다. 2순환도로 옆으로 옛길이...,2020. 11. 21.
광주사람들만 아는 찐 숨은 광주 피크닉 장소,어려운데 광주 남구에 요런 캠핑장소가 있었다니 저수지 ? 호수뷰가 예쁜 여기는 바로 남구 원산동에 위치한 대골제 저수지가 있어... 대골제 가기전에 스타벅스 DT들려서 스타벅스 신상 메뉴 민트초코랑 커피 사서 대골제로 갔다 김밥과 떡볶이는 역시 두암동 맛집 김밥여행 김밥과 떡볶이 원래...,2021. 5. 22.
"광주 동네 한바퀴, 동구 계림 2동, 옛 경전선과 전남선 철도가 지났던 푸른 길이 가장...","광주역에서 남구 진월동 동성중 입구까지 7.9km에 공원면적은 98,300㎡로 그중 동구 구간이 46,879.1㎡, 남구 구간이 47,266.8㎡, 북구 구간이 4,154.1... 그동안 제가 살았던 지역 위주로 동네 한 바퀴였는데요, 다음 동네 여행 지도 비슷하지 않을까 싶네요. #광주광역시 #광주동네한바퀴 #광주동구 #계림2동...",2021. 10. 7.
광주 현지인/봉선동 맛집 '우렁이 달인의 당산나무집',우렁이 달인의 당산나무집 651 2440 광주광역시 남구 봉선중길 4 당산나무집 에필로그 식사하는 내내 유리창 너머에 고양이 두마리가 있어서 키우는 애들인 줄 알았는데 길냥이라고 ;;; ㅎㅎㅎㅎ 때깔도 곱고 오동통해서 마당냥이 같지만 비가 와서 그렇지 평소에는 여기저기 떠돌아다닌다는데...,2021. 7. 1.
"광주피자맛집, 피자오래 남구점",피자오래:) #피자오래남구점 #피자오래 #남구점 #통새우포테이토피자 #피자오래통새우포테이토피자 #주월동맛집 #광주남구피자 #광주피자맛집 #주월동피자 #주월동밥집 #불금 #야식 #피맥 #서이추 #서이추환영 #서이추추천 #일상 #일상이야기 #일상기록 #일상블로그 #먹스타그램 #맛스타그램 #여행스...,2020. 6. 27.
[국내카페] 시메르 (광주 봉선동),"시메르 광주 남구 봉선동 478-9, 1층 이번 소개해드릴 카페는, 베이지 톤의 인테리어가 매력적인! 봉선동에 위치한 ""카페 시메르"" 입니다. 시메르... 두번가세요 세번가세요! 별점 : ⭐️⭐️⭐️⭐️⭐️ #국내여행 #국내카페 #광주여행 #광주카페 #봉선동카페 #시메르 #봉선동시메르",2020. 10. 6.
[라라필라테스]진월동라라필라테스/진월동필라테스/광주필라테스...,오늘 날씨가 봄날처럼 좋아요 ~^^ 따뜻한 봄이 오면 코로나도 물러가고 예전처럼 마스크 없이 자유롭게 운동이며 여행도 다닐 수 있는 날들을 기대 해 봅니다. 오늘은 #라라필라테스 1주년 이벤트 소식을 준비 했어요. #광주남구필라테스 #진월동필라테스 에서는 오픈할때부터 꾸준히 함께 해 주시는...,2021. 1. 25.
"광주마사지 아로마마사지 후기 ""707타이 봉선점""",할머니 여행의 끝은 뭐니뭐니해도 마사지죠! 두분을 모시고 봉선동 #707타이 에 방문했어요~~ #봉선동707타이 신발을 실내화로 신고 3층 카운터로... 봉선점 광주 남구 봉선로121번길 16 월요일 14:00~04:00 연중무휴 아가기 쉽습니당 봉선동에 유명한 브런치카페 #아필코 윗층이에요! #봉선동아필코 옆에...,2020. 11. 6.
[광주 카페] 양림동 까사델 커피,"까사델커피 주소 : 광주 남구 중앙로110번길 31 영업시간 : 매일 12:00 - 21:30 매주 수요일, 목요일 휴무 외관 메뉴 내부",2021. 8. 7.
[장거리 일주]광주~울산 시내버스여행/2,"이 글을 시작하기전 1.이 여행은 2019년 3월에 갔습니다. 2.우한문재앙코로나로 인한 시국이니 개인방역수칙을 준수합시다~ 옥종터미널에 도착을 하게 됩니다. 옥종에는 버스가 기껏해야 4번(시외버스 2회,농어촌버스 2회)만 다니는 곳,근데 이 여행을 갔다오고 6개월뒤쯤 하동군도...",2020. 3. 9.
광주 양림동 맛집 챠오 파스타 생각나 ♥,"위치 : 광주광역시 남구 제중로 42 open 11:30 close 21:00 휴무 : 화요일 ☎ 062)451-5595 단체석, 예약 有 위치를 좀 더 자세하게 설명하자면 사직도서관... 해외여행도 못가는데 여기서라도 이렇게 즐겨야지 ㅠ 나이프로 절반 잘라주니까 안에 고기랑 치즈가 들어갔더라고요 ~ 토마토랑 잘 어울려서 맛있게...",2020. 6. 1.
백운2동 힐링산책 우리동네 둘러보기,"코로나19상황이라서 어떤 지역을 자유롭게 여행을 하라는 글을 작성하지 못하지만, 가볍게 가족들과 힐링산책을 해보는 건 어떠세요? 광주 남구 백운2동을 기준으로 주변에는 양림역사문화마을, 조아라 기념관, 이장욱 가옥등 우리들이 한 번쯤은 방문해볼 만한 멋진 장소들이 다수 자라지고...",2020. 12. 31.
베트남 요리가 생각날 땐 양림동맛집 분포나인으로!!,"***-***-**** 주소: 광주 남구 양림동 234-3 매일 11시~21시 브레이크 타임: 15시~16시반 ★ 수요일 휴무 ★ 양림동 맛집 분포나인은 전 메뉴 포장, 배달... 어떤 개그맨이 발리로 신혼여행 가서 이 볶음밥만 계속 먹었다고 했는데.... 그럴만하더이다!!! ㅎㅎㅎ 매콤, 달콤, 짭조름한 맛이 한국인의 입맛에 딱!!...",2020. 12. 21.
광주건어물 삼부자네건어물 광주남구점 믿고 살수 있는 곳!,광주건어물 삼부자네건어물 광주남구점 믿고 살수 있는 곳! 안녕하세요~ 이웃님들 혹시 건어물 좋아하시나요? 저는 정말 건어물을 좋아하는데요... 어디 여행을 갈 때도 정말 필수 아이템이 되는 거 같고요~ 저는 이렇게 건어물만 보면 자꾸 맥주가 생각나서 큰일이에요~ 맥주를 먹으려고 건어물을...,2020. 11. 29.
#210406 2021 광주비엔날레 길라잡이,"2박 3일 광주 여행 (feat. 2021 제 13회 광주비엔날레) 포스팅 보러가기 * 광주비엔날레 전시장 * 광주비엔날레에 대한 정보, 2021 광주... 등 광주 근대 역사의 상징적인 사건들이 발생한 영적인 장소라고 합니다. 호랑가시나무 아트폴리곤의 주소는 광주광역시 남구 양림동 225-25...",2021. 4. 6.
광주데이트맛집 어반브룩에서 가족들과 힐링하고 오기~,어반브룩 레스토랑 URBAN BROOK RESTAURANT 시간 매일 11:30 - 22:00 / 브레이크타임 15:00 - 17:00 (라스트오더 21:00) 전화 ***-***-**** 주소 광주 남구 임암길 181... ㅋㅋㅋ 저 이탈리아 친구랑 여행갔을 때 도착하자마자 사먹었던게 마르게리따 피자였던것 같은데 그 치즈 가-득한 느낌을 언제 또 먹어볼 수 있을까...,2020. 8. 4.
"광주효천지구카페 ‘아르티오(artio)’ 스콘맛집, 곳곳이 포토존!","#광주신상카페 #광주남구카페 #광주스콘맛집 #아르티오 #카페아르티오 #artio #효천지구카페 #인스타감성사진 찍기에 좋은 광주신상카페 효천지구... 오픈 화환, 화분들 사이로 보이는게 갬성갬성 하네용 힛 아, 얼른 여행 다니면서 50mm 렌즈로 인물사진도 찍고 감성사진도 마구마구 찍고 싶어요 ㅠ...",2020. 4. 25.
"[광주 맛집] 백운동 우미숯불갈비 _생삼겹살, 비빔냉면",2020년 8월 22일 ~ 8월 30일 #영꼬로그 #영꼬여행 #영꼬국내여행 영꼬의 #광주여행 가족여행 가기 위해서 송탄에서 광주로 내려왔쥬 막내이모부와... 광주백운동가족외식 간판은 우미숯불갈비로 되어있는데 위치 검색으로는 우미숯불구이로 나와요오 둘이 같은 곳이라는 점! #광주맛집 #광주남구맛집...,2020. 9. 4.
광주 맛집 * 양림동 맛집 초승달커리,"진한 코코넛 향덕인지 정말 동남아 여행 때 먹는 음식 맛이었어요 ㅠㅠㅠ 코로나 때문에 여행을 못 가다 보니 요즘은 이렇게 이국적인 음식이 더... 양림동맛집 #양림동초승달커리 포스팅 끄읏 ~! 주소: 광주 남구 천변좌로418번길 1, 1층 지번: 광주 남구 양림동 24-169 1층 전화번호: 0507-1332-5375",2020. 6. 16.
[광주걷기] 양림동 <역사문화마을&펭귄마을> 이 길을 걷는 순간 가장 젊은 나를 느낄 수...,#양림동 #역사문화마을 #펭귄마을 #광주여행 #양림역사문화마을 양림동 근대역사문화마을 카페거리 펭귄마을로 향하던 중 양림문화마을을... (배철수 목소리가 들리는 걸 보니 배캠인가?) 광주남구 평화의 소녀상 소녀와 할머니가 함께 있는데 소녀는 바로 옆에 계신 위안부 피해자 할머니의 어렸을...,2020. 5. 27.
"광주 삼겹살 맛집. 백운동 ""최가박당"" 최애맛집",추천드릴께용 #최가박당 #무등시장최가박당 #백운동최가박당 #광주최가박당 #광주고기맛집 #광주고깃집 #백운동맛집 #무등시장맛집 #광주맛집 #광주무등시장맛집 #광주맛집추천 #삼겹살맛집 #광주핫플 #전라도광주맛집 #광주여행 #광주가볼만한곳 #광주남구맛집 #남구맛집 #광주회식...,2020. 10. 23.
[광주 / 봉선동] 퍼땀/봉선동 맛집/광주 쌀국수 맛집,면접 보는 동안 고생한 지은이를 위해 맛있는 곳 데려가고 싶어서 고민하다가 오게 된 봉선동 맛집 퍼땀 광주 남구 문화원 근처에 있어서... 오면 또 꼭 시켜야겠어유 ㅎㅎㅎ 봉선동 찐 맛집 퍼땀!! 코로나 때문에 못 가는 베트남 봉선동 쌀국수 맛집 퍼땀에서 간접 베트남 여행은 어떠신가요~~?~?,2020. 11. 20.
"게스트하우스에서 시작, 통쫘 영화제에서 이어지는 슈가대디형과 한 잔! 광주 여행","오늘은 #광주여행 . 통쫘작가가 양림동 호랑나무가시언덕 게스트하우스의 레지던스에서 작업을 하고 있다. 마침 밤에 영화제를 한다고 해서 이동.... 좀더 양림동에 대해 찾아보면, 양림동(楊林洞)은 대한민국 광주광역시 남구의 법정동, 행정동이다. 양림동은 사직산과 양림산으로 이어지는...",2020. 10. 12.
광주안경점추천 / 광주 젠틀몬스터 랭 : 봉선동 뉴글라스,안경점은 광주 남구에서 유일한 젠틀몬스터 샵인샵 매장으로 트렌디한 아이웨어 와 분위기에 맞고 다양한 연령층이 사용할 수 있는 안경이... 좋아요 여행할 때도 챙겨서 잘 사용할 수 있을 거 같아요 : ) 봉선동 뉴글라스는 오프라인 매장 구매도 가능하지만 온라인 스토어팜을 통해서도 만날 수...,2020. 12. 3.
여수장거리택시 간다광주택시 여수시 국동에서 광주시 광산구 우산동 까지,"여수광주광역시택시,여수광주택시,여수광주동구,여수광주서구,여수광주남구,여수광주북구,여수광주광산구, 여수광주택시요금... 장거리출장 및 여행 왕복 서비스 9.긴급서류 및 소형 화물 퀵배송 서비스 10.택시미행 서비스 11.수행비서처럼 애용하는 24시간-48시간 대절서비스...",2021. 4. 27.
전라도 광주광역시 갈만한곳 양림동 펭귄마을 다녀왔어요,"오늘은 서론이 좀 길었네요ㅜㅜ 저 꽃사슴은 요즘 여행 삼매경에 빠져 있답니다. 주말마다 언니들과 각 지역으로 여행 다닌다고 바쁘네요. 오늘은... 광주 펭귄마을 - 평화의 소녀상 광주 남구의 평화의 소녀상이 바로 이곳, 양림동 펭귄마을에 자리를 잡고 있더라구요. 우리나라의 아픈 역사를...",2020. 11. 30.
광주동구강아지분양 애견분양 샵 순한 반려견 말티즈 (충장로 금남로),꼭 애견용품만이 아니라 저희 부부가 여행을 가거나 명절 날에는 아이를 데려갈 수 없어서 애견호텔을 맡겨야 하는데 모두 할인을 받게 되어 더... 광주동구 #광주남구 #광주광산구 #상무지구 #수완지구 #문흥지구 #운남지구 #용봉지구 #봉선지구 #효천지구 #일곡지구 #금호지구 #신창지구 #신가지구...,2020. 12. 8.
"광주 가볼만한곳 양림동 데이트코스와 맛집 위치, 주차 팁!",광주 가볼만한곳 양림동 여행 팁! 1. 양림동은 크게 두군데로 나눌 수 있어요. 2. 가운데 이이남 작가님의 투명 아크릴로 제작된 양림교회 작품이 설치된 회전교차로를 기준으로 왼쪽에 기독간호대학교 근처와 오른쪽에 양림플랫폼 근처입니다. 3. 펭귄마을은 회전교차로 바로 앞 광주 남구...,2020. 10. 1.
광주천 옛 명물 추억속 뽕뽕다리,그 시절 뽕뽕다리를 건너 도심을 드나들던 이들을 떠올리는 잠시 시간여행을 떠나보았는데요... 광주천변을 산책하는 이들과 함께 징검다리를 통해 광주천을 건너는 현재의 모습도 함께하였답니다. #뽕뽕다리 #방림2동뽕뽕다리 #시간여행 #광주남구 #남구톡톡 #남구sns기자단,2021. 9. 30.
[전남/광주] 광주카페 오펜스 구동 'offense kudong' 다녀왔습니당 :),Offense kudong 전라남도 광주 남구 안녕하세요! 오늘은 지난주에 진도갔을 때 광주비행기가 6시간정도 떠서 광주카페다녀온 후기 알려드릴께용ㅎㅎ... 구동이었습니당 ~~ #광주카페 #광주카페추천 #광주오펜스구동 #오펜스구동 #광주빵집 #광주빵맛집카페 #광주여행 #광주가볼만한곳 #광주상무지구...,2020. 7. 7.
광주 봉선동 맛집 :: 마이데일리키친,***-***-**** 광주 남구 봉선중앙로47번길 20 봉선동 478-7 3층 매일 11:00 - 22:00LAST ORDER 21:00 매일 15:00 - 17:00BREAK TIME 봉선동 마이데일리키친의 외관... 가성비 좋은 아란치니입니다 예전에 배낭여행할 때 몸살이 나는 바람에 쌀을 찾아 다니던 언니가 발견한 아란치니ㅋㅋㅋㅋㅠㅠ 로마에서 처음 맛본...,2020. 11. 21.
광주 신상카페 아르티오 크로플 맛집!!,주황주황한 이곳을 직접 오다니 넘 기뻤어요 ㅋㅋㅋㅋ 래퍼 ph1이 생각나는 이곳 (주황덕후) 광주 남구의 포충사 바로 옆에 위치해있답니다... 맞춰입고 여행오니 넘 좋은거 있죠 ㅋㅋㅋㅋ 기다리는 동안 광주 신상카페 아르티오 포토존에서도 열심히 사진 남기구요 햇빛쨍쨍한 무더위에도...,2020. 8. 19.
빌부쌤의 전라도 광주 1억미만 투자처를 뽀개기,거주는 광주시 남구 학군 좋은데 살기 ㅡ무안군 회사 연봉 높은이유ᆢ전남도청 소재지 ㅡ일자리 많은 지역이 아파트가 비싼 건 아니다라는... 안 까먹는다는 ᆢ 실천의 중요성도 강조하십니다 발부쌤과 광주를 여행 해보니 가본적은 없지만 웬지 낯설지 않을것 같다는 느낌적 느낌도 드는곳 이네요,2021. 5. 21.
여수장거리택시 간다택시 여수루지테마파크에서 광주 광산구 우산동 까지,"여수루지테마파크에서 광주 광산구 우산동까지 이번달은 우연찮게 광주 광산구를 자주가게 되네요 오늘은 여수에 여행오셨다가 여수... 여수에서광주까지 간다택시 이동경로 여수에서광주까지 여수광주광역시택시,여수광주택시,여수광주동구,여수광주서구,여수광주남구,여수광주북구...",2021. 4. 4.
<광주 프린지페스티벌> 얽매이지 않고 아마추어·전문 예술인과 시민이 자유롭게 만들어...,"광주 프린지페스티벌 2020 광주 남구 2020.09.18 ~ 2020.11.14 2016년에 처음 시작된 광주프린지페스티벌은 장르나 형식, 정해진 틀에... isHome=1 #공방 #서울원데이클래스 #커플체험 #취미만들기 #가볼만한축제 #가족여행 #공연장 #광주프린지페스티벌 #기차여행 #나들이...",2020. 9. 25.
"[광주맛집] 레트로한 분위기, 오리탕의 진수! 월산동 '코끼리식당'","코끼리식당 주소 : 광주광역시 남구 덕림남길 41-3 메뉴 : 오리탕, 닭도리탕, 삼겹살, 목살, 된장찌개, 김치찌개, 백반 등 뭘 먹어도 맛있는 맛집 별점 : ★★★★★+★★ 초강력추천 광주 여행 가면 반드시 들리는 맛집이 있습니다. 바로 월산동의 코끼리 식당인데요. 제가 서울 친구들을 하도 많이...",2021. 4. 8.
여수에서광주까지 편안하게 이동하는 여수장거리택시 택시가간다광주,"여수광주광역시택시,여수광주택시,여수광주동구,여수광주서구,여수광주남구,여수광주북구,여수광주광산구,광주공항,여수광주공항택시... 장거리출장 및 여행 왕복 서비스 9.긴급서류 및 소형 화물 퀵배송 서비스 10.택시미행 서비스 11.수행비서처럼 애용하는 24시간-48시간 대절서비스...",2021. 4. 17.
광주 진월동 렌즈 렌즈타운 진월점,"곧 떠날 제주도 여행에서 사용할 렌즈를 구입하기 위해 언론에도 보도된 렌즈타운 진월점을 찾았어요. 광주 진월동 렌즈 렌즈타운 진월점 매일 09:30-21:30 광주 남구 진월동 294-17 1층 글, 사진 유리나 건물 옆에 주차장 있습니다! 렌즈타운 진월점은 아이데코안경 진월점과 함께 운영하고 있었고...",2021. 4. 5.
광주카페 : 원산동 주황으로 가득찬 아르티오,"울 남편 이렇게 생긴 드립 티백을 한 번도 안 먹어봤다고. ㅋㅋㅋㅋㅋㅋㅋㅋㅋ 그래도 무한으로 사랑합니다. ~^^^^❤️ 또다른 광주 가볼만한곳 추천, #펭귄마을 #광주여행 #국내여행 #광주가볼만한곳 #광주남구카페 #남구카페 #광주스콘맛집 #광주디저트카페 #원산동카페 #광주여행코스",2020. 5. 8.
"와플 맛집 홍콩다방 광주 봉선점, 홍콩에 온 듯한 경험까지 만끽!","홍콩다방 카페, 디저트 광주 남구 봉선중앙로 33, 1층 평일 08:00 - 24:00 주말 09:00 - 24:00 062-682-5050 홍콩 로컬 맛집의 레시피를 전수받아 홍콩의 맛을 그대로 재현한 브랜드 '홍콩다방' 여행못가 답답한맘 홍콩감성 미식여행 홍콩다방 눈이 쏟아지던 날 밤 디저트 테이크아웃을 위해 봉선동 와플...",2020. 12. 30.
효천지구피부관리 효천지구눈썹 봉선동속눈썹펌 진월동속눈썹펌 광주수험생이벤트,"여행을 가던, 소개팅을 하던, 예쁨 장착 하면 좋잖아용??ㅎㅎ 자세한 문의는 밑에 인스타그램, 또는 카카오로 문의 주세용!! 요기 블로그 댓글도 좋아용 시험 준비 하느라 고생하셨어요 좋은 결과 있길 바래요 #광주피부관리 #광주반영구 #광주피부관리 #효천1지구피부관리 #광주남구피부관리...",2020. 11. 30.
인천공항방역택시 광주 전주 목포 콜밴 요금,"자유롭게 여행하며 즐거운 마음으로 나라와 나라를 오고 가는 것이 아니기 때문에 인천공항을 이용하시는 많은 분들이 여러 절차와 까다로운... 18:00 광주 남구 보건소 평일 09:00 ~ 18:00 / 토요일 09:00 ~ 18:00 / 일요일, 공휴일 09:00 ~ 18:00 광주 동구 보건소 평일 09:00 ~ 18:00 / 토요일 09:00 ~ 18:00...",2021. 1. 19.
광주 봉선동 술집 '천변수산' 회 해산물 매운탕 맛집! 바닷가에 놀러 온듯한 느낌 물씬...,"(카페아필코, 카페304바로 옆에 위치) #봉선동술집 #남구술집 천변수산 ✅위치: 광주광역시 남구 봉선로121-16 1층 ✅영업시간: 15:00-02:00 도로변이... ㅠㅠㅠ 도심속에서 바다 분위기를 느낄수 있다니 코로나로 못간 여행을 위안삼아 술이 술술 들어가겠네요 분위기가 참 좋아용! 그리고 에어컨이...",2021. 7. 20.
광주 양림동 카페 제주스러웠던 앤투잋시즌 AND TO EACH SEASON,구질구질하게 사진 한장 ㄷ 하나부터 열까지 전부 제스탈이더라구요 심지어 커피도 맛있어요 계절 바뀔때마다 방문해서 사진찍고 SNS에 나 여행왔어라고 뻥쳐도 될만큼 제주카페 감성 가득 담긴 양림동 카페 앤투잋시즌이었어요 :) #양림동카페 #양림동앤투잋시즌 #광주카페 #광주남구카페...,2020. 8. 13.
광주 양림동 카페 “ 풀 puul ” 착즙쥬스와 크레이프케이크 맛집,여행으로 인해 제주도 일상만 리뷰하다가 어제 집으로 돌아왔는데요^^ 오늘은 제주도는 잠시 뒤로 미루고 제가 자주 다니는 카페에 대해서 리뷰를... 위치 : 광주 남구 백서로 83-1 영업시간 : 매일 11:00 - 22:00 주차 : 골목에 눈치껏 직접 하고 들어가야함 양림동 카페랑 밥집들은 맛도 좋고 분위기도...,2020. 12. 15.
광주 풍암 매월 라루체 더테라스 타운하우스 살고싶네요,이젠 정말루 여행도 휴가도 쉽지만은 않는것 같아서 더더욱 걱정인데 이럴땐 안전한 타운하우스가 정말 간절해 지는 때 같네요? 공기좋은... #풍암매월라루체위치 향후 광주남구 도시첨단산업단지 가 조성 될경우 그로인한 든든한 배후수요와 함께 풍암매월 라루체 타운하우스의 미래가치는...,2020. 12. 28.
광주 스틱형경옥고 간편하게 챙기는 건강,"또한 여행갈때나 외출시에도 필요한만큼 챙겨서 나갈 수 있어서 언제 어디서든 쉽게 복용할 수 있다는 장점을 가지고 있습니다. 광주... 광주 남구 백운로에 위치하고있는 참조은한의원은 이러한 방식으로 다양한 치료를 진행하도록 합니다. 세심한 진맥과 촉진, 개인별 체질 검사에 따라, 치료...",2021. 2. 2.
광주주먹밥 / 분식이 맛있는 다르다김밥,광주 남구 봉선중앙로 3 08:00 ~ 22:00 [평일] 07:00 ~ 22:00 [주말 / 공휴일] 062-671-1127 쌍용예가아파트 정문으로 나오면 다르다김밥이 보일 거예요. 주차장은 건물 아래 지하에 있으니 참고해주시구욤! 광주단체도시락 또한 미리 말씀주시면 가능하다고 하는데 저희 친가 여행 추진되면 도시락...,2020. 5. 13.
광주예쁜카페 아르티오_광주디저트카페로 유명한 아르티오! 크로폴 너무 맛있어요~ㅎㅎ,크로폴 너무 맛있어요~ㅎㅎ #광주남구카페 #광주디저트카페 #광주예쁜카페 #아르티오 #광주카페 https://www.instagram.com/artio_cafe/ 이미 sns에서... 위치까지 살짝쿵^^ #언박싱 #자랑질 #여행 #빵순이 #맛스타그램 #먹방 #먹스타그램 #광주 #좋아요 #푸드파이트 #일상 #먹방그램 #인친 #행복 #먹기...,2020. 9. 19.
