header,contents,date
"광주 남구 맛집 봉선동 개성집 명태갈비조림 또 생각나는 맛,,","50년 전통 명태요리 전문점으로 유명한 #봉선동개성집 요즘 코로나때문인지 포장/ 배달하는 곳이 많은데 광주 남구 맛집 봉선동 개성집도 포장/ 배달 가능하답니다 소주 맥주 막걸리 3천원❤️ 봉선동 개성집 광주 남구 봉선동 249 062-672-0033 매일 11:00 ~ 23:00 명태문어조림 中 47,000 명대낙지조림...",2020. 4. 1.
광주지역 코로나극복 (광주 남구 이강하미술관x광주기독병원> 협업 전시회,"2020 미술품 대여전시지원 코로나19 특별공모 선정 프로젝트 <작은 여행, 큰 행복> 전시회 - 전시기간 : 2020.08.04-09.04일까지 - 전시 장소... 문화체육관광부, 예술경영지원센터, 미술공유서비스 - 주관: 사단법인 이강하기념사업회/ 광주 남구 이강하미술관 - 협조 : 광주기독병원 감사합니다!",2020. 8. 5.
"(씰리 z11, 룸에이)광주광역시 남구 봉선동 씰리 포스처페딕 하이브리드 프리미엄 z11...",룸에이) 광주광역시 남구 봉선동 HR펠리스아파트 씰리 포스처페딕 하이브리드 프리미엄 z11(실버칠) 펌_ 미국 수입매트리스 - 룸에이 room a... 빠른 길이 아닌 다양한 여행길을 경유하는 느린 길을 안내하는 내비게이션이 등장했다고 합니다. 제주도에서 시범적으로 진행하는 '슬로우 로드...,2021. 4. 5.
"(광주 남구 지석동, 대촌) 초원식당 - 우렁탕 백반 맛집 2차 포스팅","광주 남구 대촌 우렁탕(된장국) 맛집 초원식당 입니다. 남구에는 유명한 우렁(된장국)을 주메뉴로 하는 집이 세군데 있습니다. 한곳은 도심권, 두곳은 대촌(지석동)에 위치해 있습니다. 세곳을 모두 다녀왔지만, 개인적으로 깊은맛, 친절도, 정갈함을 따진다면 이곳 초원식당이 1번이라고...",2020. 2. 13.
광주광역시 남구 덕림지역주택조합 조합장후보 기호2번 정순영입니다,인사드립니다 광주광역시 남구 덕림지역주택조합 조합장후보 기호2번 정순영입니다 조합원 여러분! 걱정하지 마세요.. 제가 잘 해결할 수 있어요... 합의를 도출할 사람은 덕림지역주택조합 제3의 인물인 기호2번 정순영입니다 이 글을 올리면 가슴을 후비는 비난의 댓글 속상합니다 저는 여행하고...,2021. 4. 15.
원코스 전라도010 광주 대한민국 테마여행 10선 남도맛기행,"테마여행신문 TTN Korea의 ‘원코스 전라도008 남도맛기행 1박2일’은 2017년 10월 21일부터 22일까지 담양, 나주, 광주 3개 도시를 순회하는... 광주 남구 평화의 소녀상 : 전국 곳곳에 설치된 평화의 소녀상은 서로 닮으면서도 작가에 따로 다른 형태로 만들어져 있다. 광주의 평화의...",2020. 4. 8.
광주 사직공원 유아숲체험원은 별로,코로나 거리두기 1단계였지만 사람없는 야외에서 숲체험을 하는 게 목적이었던 여행이었다. <전라남도 광주 유아숲체험 프로젝트> 1. 남구 제봉산 마법의 숲체험원 2. 사직공원 유아숲체험원 2020년 10월 초 광주 남구 사동 177 (사직역사공원) 이라고 네비게이션에 주소를 입력하고 22개월 아이와 함께...,2021. 2. 2.
[광주] 코시국에 베트남 여행 다녀왔읍니다. 봉선동 쌀국수 맛집 '퍼땀',광주 남구 청소년 수련회관 뒤에있어서 대충~ 아무곳이나 주차 하시면 돼용~ 불법 주정차 단속까지는 몰으갯읍니다. 솔직히 주차 정도는. 직접 알아보시는게. 매장 외부 사진입니다. 예 쁜 피 부 가지고 싶다. 메뉴설명과 영업시간입니다. Previous image Next image 매장 내부 사진이에요 비엣남스럽네요...,2021. 9. 17.
"누보' 누보 브런치, 굿테이블 / 봉선동브런치, 광주데이트, 광주카페추천, 광주여행",٩(♡▽♡ )۶ 방림동맛집 쿤스트라운지 누보 위치는 광주 남구 오방로 104 건물 1층입니다 아니아니 ㅠㅠ 이름만 들어보구 어딘가 했더니 여기라니!!! 매번 지나쳤던 곳인데 남광주역과 가깝고 방림휴먼시아아파트 바로 옆에 있어요 방림1동 주민센터 건너편이며 주차는 건물 뒤편에 하시면 됩니다...,2020. 2. 21.
광주한복대여 플래너를 거치지 않고 합리적으로,신상품인데도 균일가 15 만`원에 할 수 있다니 이런 기회 놓칠 수 없죠~ 맞춤을 할 돈으로 차라리 신혼여행에서 좀더 자유롭고 유익하게 쓰거나... 좋은게 좋은거라고^^ 그래도 가온 덕분에 만족스러운 광주한복대여를 할 수 있었어요! http://www.gaonhanbok.co.kr/default/ 광주 남구 천변좌로 388 2층,2020. 5. 13.
[광주광역시 남구 – 식당/추어탕] 둠벙추어탕,00:00 00:51 - 주 소 : 광주 남구 효천안길 85 - 지 도 : https://map.kakao.com/?urlX=471979&urlY=447265&urlLevel=3&itemId=2132655598&q=%EB%91%A0%EB%B2%99%EC%B6... kr #광주 #광산구 #식당 #장애인여행 #장애인관광 #휠체어여행 #휠체어관광 #휠체어 #장애인 #무장애여행 #관광약자...,2020. 11. 2.
[광주광역시 남구 – 식당/양식] 어반브룩,00:03 01:00 - 주 소 : 광주 남구 임암길 181 - 지 도 : https://map.kakao.com/?urlX=469617&urlY=446056&urlLevel=3&itemId=1473366312&q=%EC%96%B4%EB%B0%98%EB%B8%8C... kr #광주 #광산구 #식당 #장애인여행 #장애인관광 #휠체어여행 #휠체어관광 #휠체어 #장애인 #무장애 #관광약자 #취약계층...,2020. 10. 30.
광주정씨 정엄선생의 효자비와 충견상,"효자비를 찾아야겠다는 생각으로 방문했던 장소는 아니였고 우연히 지나가던 길에 발견했던 장소로 이웃님들도 한번쯤 광주 남구를 여행 오셨다면, 한번씩 부모님을 생각하고 강아지에 대한 또다른 생각을 해보는 시간을 가졌으면 하는 바람으로 포스팅을 해봅니다. 광주정씨 정엄선생의 효자비와...",2020. 7. 31.
광주 가볼만한곳 펭귄마을 양림동 골목여행,광주 가볼만한곳 펭귄마을 양림동 골목여행 집에 무료하게 퍼져있는것보다는 어딘가를 향해 떠나는것이 좋다고 생각하는 SNSLIVE!! 이날은... 광주 남구 천변좌로 446번길7 날씨가 부쩍 더워져서 저녁에 나와서 산책겸 운동하는 길에도 시원한 아아로 또 목구멍을 적셔본다. 운동하기...,2021. 6. 4.
광주 양림동 한옥 카페 암브로시아에서,ㅋ [암브로시아] ***-****-**** 광주 남구 오기원길 19-1 (양림동 66-33) 커피 4천원 우리 셋이 이 날 여기에 함께 앉아있으리라고. 예상하지 못했던 조합이다. 각자 셋이 묘하게 인연이 닿아있는 사이. 셋이 다같이 만난 것은 이 날이 처음이자 마지막이다. 각자 따로 어디선가 만나고 있는 사이. 여행을...,2020. 6. 25.
광주네일올래 광주남구네일샵... 광주서구네일 광주젤네일 전남여행 전남맛집 광주카페,길 광주 북구 일곡동 834-9번지 네일올래 다담식자재 주차장 뒷편 #광주 #전대 #광주근교 #오치동#목포 #동명동 #쌍촌동 #문흥동 #광산구 #첨단 #광주광역시 #연제동#광주카페#광주핫플 #용봉동#광천동 #좋아요반사...,2021. 6. 24.
[광주 여행] 구석구석 골목 구경하기 좋은 광주 양림동 펭귄마을! 간식으로 상추튀김까지!,"#펭귄마을 #양림동 #광주여행 광주여행 펭귄마을 펭귄마을은 광주 남구에 양림동에 위치하고 있고, 주위에 카페나 맛집도 많으니 펭귄마을 외에도 갈 곳이 많이 있습니다. [ 광주광역시 남구 천변좌로447번길 7 ] 펭귄마을 유래 갑자기 광주 양림동에 펭귄마을이라고 하니 펭귄이 사는 건 당연히...",2021. 7. 17.
광주모텔 편안하게 쉬다왔어요 _ 어썸무인호텔,^^ 업체명 : 어썸무인호텔 주소 : 광주광역시 남구 봉선로 9번길 31-1 전화 : ***-***-**** 광주 남구에 위치한 어썸무인호텔이예요. 요즘은 비대면이 대세인만큼 무인으로 결제하는게 좋은것같아요. ^^ 주차장도 넓직하고 좋더라고요. 주차 후 무인으로 객실을 선택하고 이용하면 돼요. 시설에 비해...,2020. 10. 7.
"[광주광역시 남구 – 식당 / 찌개, 전골] 쌈마을찌개꾼",00:02 01:09 - 주 소 : 광주 남구 효덕로 213 1층 - 지 도 : https://map.kakao.com/?urlX=476844&urlY=446246&urlLevel=3&itemId=557172993&q=%EC%8C%88%EB%A7%88%EC%9D... kr #광주 #광산구 #식당 #장애인여행 #장애인관광 #휠체어여행 #휠체어관광 #휠체어 #장애인 #무장애 #관광약자 #취약계층...,2020. 10. 27.
"[화순 여행] 능주전통시장, 사람 사는 세상이 다 보여요.","인접한 광주 남구 쪽 시민들과 화순군 도곡, 도암, 한천, 춘양면 주민들이 주로 이용한다고 합니다. [능주전통시장]은 1980년 때까지만 해도 우시장과 어물전으로 유명해서 장이 서는 날이면 유동인구가 많았다 합니다. 최근에 예전 재래시장의 형태는 없어지고 모두 현대식 점포로 개설되어 문을...",2021. 8. 2.
2021년 6월 광주여행 (with 소니),""" 라고 물어봤더니 이 건물을 쳐다보면서 ""그라제~~~"" 라고 대답해서 엄청 웃었다 쨍한 색감 덕에, 지난번에 갔던 아르티오(광주 남구)가 생각났던... 광주 또 가고 싶다 쩝. 7월 말엔 엄마랑 같이 가야 하나 ^^ 이쯤 되면 트랜스 광주시민이다.. 광주처돌이의 광주여행 3부작 - The end -",2021. 7. 5.
"[광주 양림동 먹거리] 광주 양림동에서 스시를 즐기다.""양림동 먹거리 / 칸세이스시""","광주여행의 중심. 광주 양림동에서 바다의 향기를 느끼다. ""양림동 먹거리 / 칸세이스시 주소 : 광주 남구 제중로46번길 8-2 / 문의전화 : 062-682-3440 / 영업 시간 : OPEN 11시~ CLOSE 22시 BREAK TIME 15:00~16:00 / 휴무 : 연중 무휴 / 주차 : 이면 도로 및 앞 관광지 주차장 이용 / 메뉴 : 생선초밥...",2021. 3. 2.
전라도 광주 가볼만한곳 양림동 핫플 +맛집 오월민중길 주먹밥코스 광주여행,광주시민공원에 이름 없이 사라져간 시민군들을 기리며 이 비와 동상을 새긴다고 되어있더라고요 참고적으로 시민군 김군은 5월 24일 광주 남구... 저 역시 양림동은 취재 이틀 동안 양일에 거쳐 방문했을 정도로 너무 좋았던 곳이고 다음에 또 광주여행을 가게 돼도 방문하고픈 곳! 게다가 지금...,2021. 7. 5.
[광주광역시 남구 – 카페] 빛고을농촌테마공원 커피락,"(화) ■ 인근 관광지 추천 : 포충사, 세량제, 지산재, 양과동정, 경주최씨 세장산 등이 있음 00:03 00:54 - 주 소 : 광주 남구 양과동... kr #광주 #광산구 #식당 #장애인여행 #장애인관광 #휠체어여행 #휠체어관광 #휠체어 #장애인 #무장애여행 #관광약자 #여행취약계층...",2020. 10. 30.
광주정수기) 남구 진월동 위닉스 정수기 스팀청소 및 필터교체,"광주 남구 진월동 가정집에서 위닉스 정수기를 렌탈 사용 중인 고객님, 스팀청소와 필터 교체를 위해 방문 드렸습니다. 물탱크 스팀청소 중입니다.... 필터 교체~ 여행을 다녀오신 기념품이 정수기에 붙어 있으니 느낌이 또 색다르네요. 광주정수기관리, 광주정수기관리필터, 광주정수기청소...",2020. 7. 8.
광주 남구 인생샷 맛집 신상까페 'Artio 아르티오',"남구 원산동에 신상 까페가 생겼다는 소식을 듣고 호다닥 가봤는데요 시골마을 한 가운데 위치해 있드라구요 여행 온 듯한 느낌이 들어서 좋았네용 ㅎㅎ 제가 정말 좋아하는 쨍한 오렌지 색깔,, 크,, 빅리의 똥손에도 인생샷 그냥 나옵니다~~ 1층 내부 매번 까페 리뷰할 때 사람이 많아 내부 사진을...",2020. 4. 26.
★광주 남구★ 문화누리카드 전체 가맹점(2020.03.19기준),13 ㈜쥬스컴퍼니 광주지점(양림쌀롱 여행자라운지) 문화 공연 공연 남구 #문화#공연#공연기획#㈜쥬스컴퍼니 광주지점(양림쌀롱 여행자라운지) 14 축복사진관 문화 미술 사진관 남구 #문화#미술#사진관#스튜디오#사진#축복사진관 15 명품광주김치 주식회사 문화 문화체험 문화체험 남구 #문화...,2020. 3. 19.
광주 프린지페스티벌 2021 '광주 7월 가볼만한 곳' 국내여행,유안근린공원(광주 남구 봉선로 195) 6회차: 9월 4일 비엔날레 광장 (광주 북구 비엔날레로 111) 7회차: 9월 11일 쌍암공원(광주 광산구... #가볼만한축제 #가족여행 #공연장 #광주프린지페스티벌 #기차여행 #나들이 #데이트코스 #아이와함께 #연인과함께 #이색체험 #전라권 #체험학습 #축제...,2021. 6. 25.
광주 양림동 펭귄마을..,24일 아침..창을 통해 들어오는 빛이 좋은 여행을 예감합니다.. 몇 해전 무등산 산행을 할 때 처음으로 방문한 광주를 두 번째로 찾게 됩니다..... 광주 남구 평화의 소녀상.. 선교사의 숨결이 있는 양림 마을입니다.. 그래서 선교사의 사진들과 함께 꾸며 놓았네요.. 펭귄마을과 선교사님들이...,2021. 6. 26.
광주 남구 삼익APT 봉선동컴퓨터수리 언제든지 OK!!,하루종일 선거 뉴스에 코로나 뉴스에 매일 하루가 다람쥐 쳇바퀴 돌아갑니다 선거도 코로나도 하루빨리 지나가 버렸으면 좋겠네요 ㅠㅠ 맘편히 가족들과 식사도하고 여행도 다니고 싶은 마음이 굴똑같네요..하루종일 벚꽃을 보며 돌아다니다 보니 심숭생숭하나 보네요 제맘도 ^^;; 자 마음을 다잡고...,2021. 4. 2.
"[광주 여행] 역사 문화마을 양림동, 문화예술이 가득한 거리",<양림동 문화예술 여행 루트> 펭귄 마을 - 한희원 미술관 - 양림 미술관 - 이이남 스튜디오 펭귄 마을 양림동 하면 가장 먼저 생각나는 장소는 펭귄... 위치: 광주 남구 천변좌로446번길 7 한희원 미술관 한희원 미술관은 화가 한희원 선생님께서 자라고 화가로서 영향을 받은 고향인 양림동에 세우신...,2021. 2. 22.
"전라도 광주 가볼만한곳 펭귄마을,장미호수공원,흰배롱숲길 8군데",추억여행을 떠날 수 있는 곳이였어요! 전라도 광주가볼만한곳 사진찍기 좋은 곳이라 추억자료 많이 만들고 왔네요ㅎ 3.양림동펭귄마을 주소:광주 남구 천변좌로446번길 7 아기자기한 창조적인 소품이 대로대롱 걸려진 양림동 펭귄마을입니다!담벼락에 정겨운 소품들과 그림들때문에 걷기에도...,2021. 6. 26.
광주근교여행 장흥 하늘빛수목정원 튤립 장흥맛집 수복식당까지!,"하늘빛 수목정원 #장흥여행 #장흥드라이브 #광주근교드라이브 #하늘빛수목정원 #하늘수목정원 한가하고 여유로운 주말을 틈타 부모님과 함께... 광주 남구 출발 기준 1시간 10-20분 정도 소요됩니다 :) 하늘빛 수목 정원 입장료는 ₩5,000원 입니다 (대인) 튤립으로 유명한 장흥 하늘빛 수목정원 엄청...",2021. 4. 29.
[ 광주 남구 - 식당 / 양식 ] 그라제 1985,daum.net/happyywing 장애인문화관광센터 www.dctc.or.kr #광주 #남구 #여행지 #장애인여행 #장애인관광 #휠체어여행 #휠체어관광 #휠체어 #장애인 #무장애여행 #관광약자 #여행취약계층 #관광취약계층 #배리어프리 #복지관광 #교통약자 #유니버셜디자인 #UD관광,2020. 5. 15.
"[광주 / 남구-양림동] 귀여운 벽화가 그려져 있는 쿼카커피, 쿼카카페",광주 양림동에 위치한 쿼카커피 카페 다들 아인슈페너 잡수러 가보세용~ 이상 채린이였다요~! #광주 #광주카페 #광주카페추천 #광주가볼만한곳 #광주쿼카커피 #광주쿼카카페 #쿼카카페 #광주양림동 #광주핫플 #광주핫플레이스 #광주광역시 #광주맛집 #광주맛집추천 #여행 #힐링 #커피 #카페 #카페추천,2020. 7. 27.
도란도란 햄토리와 광주여행,잇님들 안녕하세요~ 오늘은 햄이와 함께 다녀온 광주여행 포스팅하려고요! 요즘 블테기가 와서 이대로는 안되겠다 싶어서..!!... ㅎㅎ 신나게 사진 찍었어요ㅎㅎ 펭귄마을 위치는 펭귄마을 광주 남구 천변좌로446번길 7 http://naver.me/F9L4Iazg 펭귄마을 한바퀴 돌고 찾은 한옥카페♡ 풀 광주 남구...,2021. 6. 20.
광주광역시전원주택 광주남구전원주택 도심속전원주택 전원주택에 사는 사람들 광주...,"이곳은 광주광역시 남구 행암동 도동마을이에요. 안녕하세요~ 중정형태의 ㄷ자형구조이고 지하1층 지상2층 앞면보다 옆면이 넓은... 풀옵 왔어요 며칠전 차박도 다녀왔습니다♡ 제주도로 23일 1박은 차박, 2박은 리조트, 목포 크루즈 여행 다녀올 예정이에요!) 여러분도 전원주택어떠세요? yesssssss!!!",2020. 10. 17.
봉선동떡케이크 / 광주떡케이크 / 광주남구토퍼케이크 / 여행토퍼 / 케익토퍼 / 행사토퍼,"케이크 토퍼 광주 앙금 플라워 떡 케이크 Happy Day Flower Cake 광주광역시 남구 봉선동 금호 1차 상가동 102호 해피데이 공방 주문, 수업 문의 ***-****-**** 카톡 ID pys3717 해피데이 앙금 플라워 Happy Day Flower Cake 오시는 길",2020. 7. 14.
[광주 남구청] 종합민원실 본관 1층으로 이전했어요.,"언제쯤 우리 다시 여권 들고 여행 가는 날이 올까요. 아무튼 오늘 볼 일은 여권이 아니니 방문자 등록하고 열 체크하고, 종합민원실에 들어갔고요. 제가 필요한 서류 발급받아서 왔습니다. 남구청 1층 (사진 출처 : 광주 남구청 홈페이지) 종합민원실은 여권 발급, 갱신, 등초본, 인감...",2021. 7. 30.
"[광주여행] 광주카페추천, 광주디저트카페추천, 광주감성카페, 편안한 분위기 잠시...",카페♥ #광주핫플레이스 #봉선동카페 #봉선동맛집 #광주남구카페 #광주디저트카페 #광주가볼만한곳 #광주데이트장소 #광주감성카페 #광주커피맛집 #광주근교가볼만한곳 #광주핫플추천 #주월동카페 #릴커피스탠드 #광주신상카페 #에스프레소바 #광주에스프레소바 #광주디저트맛집...,2021. 7. 20.
"광주 여행지 추천, 양림동 골목 여행 펭귄마을 구경하기 / 전남 여행지 추천 양림동...",우일사 선교사 사택 광주 남구 제중로47번길 20 (양림동) 우일사 선교사 사택은광주광역시 기념물 제15호이다 이 건축물은 미국 선교사 우일선(Wilson)에 의해 1920년대에 건립되어 졌다는 말이 있지만 정확한 건립 연대는 알 수 없다 다만 목포항이 개항되고 서양의 선교사들이 광주에 들어와...,2021. 3. 17.
"광주남구꽃집에서 가장예쁜꽃집 그린플라워,봉선동꽃집♥♥실패란 보다 현명하게다시...",광주남구꽃집#주월동꽃집 #진월동꽃집 #금호동꽃집#농성동꽃집 #용봉동꽃집 #백운동꽃집#방림동꽃집 #효천지구꽃집 #송하동꽃집 도전하고 실패를 두려워하기 보다는 아무것도 하지 않음을 두려워하라. http://www.instgaram.com/greenflower5251 #애완견#결혼#여행#캠핌,2020. 11. 2.
광주 양림동 맛집 마리오셰프-이태리 현지의 맛과 분위기 최고!!,저희가 신혼여행도 이탈리아로 다녀와서 그런지 그때 기억도 나면서 정말 기분이 묘하게 좋더라구요~~ 분위기를 담아보고 싶어서 영상으로... 또 만나유~~~♡ #광주맛집 #광주양림동맛집#양림동맛집 #광주파스타맛집 #광주스테이크맛집 #광주남구맛집 #광주레스토랑 #광주가볼만한곳 #마리오셰프,2020. 8. 10.
"[광주여행]광주맛집_비아꽃게장,윤가네나주곰탕,송정골","10월 31일~11월 2일 광주여행. 서울에서 KTX를 타고 광주까지 가서 렌트한거라,광주에서 먹은 끼니가 많다. 내사랑 광주...전라도 음식의 갑은... [광주 남구 맛집_윤가네 나주곰탕.밑반찬까지 너무 맛있었던 집] 와우 이집 솔직히 5점 만점에 4.5점이다. 가격은 일반적 나주곰탕 가격인 9000원 인데,고기...",2020. 11. 10.
2박3일 광주여행 먹부림들(광주맛집 솔직리뷰&추천),"이번에 광주에 2박3일로 여행을 갔다왔어요! 광주는 담양을 갈 때 스쳐지나가기만 했는데 이번에는 친구와 찐 광주를 여행하기로 했어요... 다음에 마츠라멘 먹어보고 싶음 3일차 카페 : 육각커피 광주 남구 제중로47번길 2 매일 10:00 - 21:30 주문마감 20:30 (내가 먹은거 : 카페라떼 5,000원)...",2021. 6. 24.
역사가 살아 숨쉬는 볼거리 만땅 양림동으로 떠나는 골목 여행!,"여러분 안녕하세요ㅎㅎ 저는 양림골목 비엔날레와 함께, 예술가들의 마을~,~ 광주 양림동의 골목 구석구석을 여행해보았는데요 !! 알수록 신기하고... 다시 방문하고 싶은 곳 오웬기념각 광주 남구 백서로 70번길 6 멀리서도 눈에 확~ 들어오는 건축물 오웬기념관!! 1978년 이후 광주 기독간호대학교...",2021. 4. 12.
[광주여행] 빛고을공예창작촌. 광주데이트,"광주추천여행지 ""빛고을공예창작촌"" 광주광역시 남구 대촌에 위치한 빛고을공예창작촌은 많은 공예작가들이 입주해 있으며, 직접 제작한 공예품을 판매하거나 홍보하는곳이다. #광주여행 #광주관광 #광주데이트 #빛고을공예창작촌 촬영일시 : 2015년 03월 03일 ⓒ2020.Lim Shin-young all rights...",2020. 9. 16.
"광주 남구 카페, 김여사의수작",ㅋㅋㅋㅋㅋㅋㅋㅠㅠㅠ 이번엔 싸우지 않고 사이좋게 다녀왔다 평일 11:00 - 16:00 주말 11:00 - 19:00 주소는 광주지만 나주에 가까운 곳 공방과 함께... 말 잘 듣는 울 오빠 덕분에 예쁜 사진 겟 사진 다 찍고 기분 좋게 목포 내려 왔답니당 광주 근교 사시는 분들은 한 번씩 꼭 가보세요 추천드려요!,2020. 5. 1.
광주남구 양림동 양림교회 코로나 확진자 동선,광주에서 발생한 가족 3명 확진자와 교회에서 예배 등을 통해 밀접촉한 신도 147명과 유럽여행을 함께 다녀온 20대 남성이 '음성' 판정을 받았다. 광주 남구보건소는 역학조사를 통해 남구 양림동 A(48·여)씨 가족과 접촉한 교인 147명에 대해 검사를 실시한 결과 음성이 나왔다고 3일 밝혔다....,2020. 3. 4.
전남 광주 :: 주말에 떠나는 뚜벅이 광주 여행 - 1일차,"Previous image Next image 작년에 뮤지컬 <광주>를 본 후, 한강 작가님의 <소년이 온다>를 읽게 되었고 꼭 광주 여행을 가보리라 다짐을 했었다. 원래... 양림동 문화 마을 & 펭귄 마을 광주광역시 남구 양림동 / 광주 남구 양림동 201-64 Previous image Next image 행사로 인한 차량 통제 때문에 버스를 타기...",2021. 6. 24.
"광주방문미술 쿤스트, 광주방문미술,광주남구방문미술","해서 공룡이 사는 곳곳을 누비고 있어요 지후의 타임머신 여행은 성공적이에요~! 광주방문미술 쿤스트 상담 : 062.376. 0609 광주방문미술 쿤스트에서는 다양한 교육커리큐럼으로 독창적 수업방식을 통해 창조적 개방성과,인성발달 인지능력 발달의 조화를 이루도록 최고의 미술교육을 제공합니다.",2020. 10. 20.
전라도 여행지 추천 전남 화순 가볼만한곳 광주 근교 드라이브 코스,"5.세량제 화려한 봄, 가을 아침이 기대되는 반영 맛집 주소 / 전남 화순군 화순읍 세량리 98 광주광역시 남구의 송암IC와 터널로 곧장 이어진 세량제는 전남 화순이 지닌 광주 근교 여행지로의 면모를 가장 확실하게 실감토록 한다. 봄, 가을 자연 풍경이 저수지 반영으로 표현될 때 가장 아름답다는...",2021. 8. 22.
(광주 남구 행암동) 남구보신탕 - 오리탕,"빛고을컨트리클럽(CC) 맛집으로도 유명한 남구보신탕을 다녀왔습니다.(입구 사진은 예전꺼 재탕) 대부분 진월동이라고 생각하지만, 행암동이라고 정확한 지명이 있었네요.. 저도 모르는 동네는 그냥 큰 동이 다 그 구역인줄...ㅎㅎㅎ 넓은 주차장에 주차를 하고 가게 입구로 들어 갑니다. 메뉴...",2020. 2. 12.
광주 남구 강아지용품 추천: 강아지 필수 입양 용품 준비,"강아지 입양을 생각하고 준비하고 계시는 예비 강아지 파파와 마마를 위해 오늘은 광주 남구 애견용품점 '개린이보호구역' 에서 강아지 입양시... 강아지를 입양하고 나면 강아지와 일상을 함께 하게 되는데 외출, 병원진료, 산책, 여행등 강아지와 함께 이동해야 할 때가 많이 있습니다. 강아지와...",2020. 7. 23.
