header,contents,date
대구달성군현풍카페_카페NOEL... 대구스페인어과외_대구스페인어줌과외_해외여행준비...,며칠전 스페인어 수업 장소로 당첨된 카페 노엘입니당~ 주차장이 널찍하게 마련되어 있어서 좋아요! 매번 출근할때 지나가면서 봤었는데 들어온건 첨이에요 사장님만의 유니크한 인테리어 느낌이 있는거 같았어요 식물도 진짜 많구~ 2층 올라가는 계단입니당~ 1층 2층 다 테이블도 많고 앉을...,2021. 8. 1.
[여행] 대구 달성군 가볼만한 곳 옥연지 송해공원(feat. 조명예쁜장소),"대구 옥연지 송해공원은 송해 선생님의 장수를 기원하며 만들어졌다는 전설이 있는데요~ 대구 근교에있어서 가끔 아침 운동을 하기 위해 방문하기도 한답니다.. 특히 겨울에는 얼음폭포, 동굴, 바람개비 등을 보러 많이들 방문하시곤 하지요!! 송해공원이라 그런지 송해선생님 캐리커쳐가...",2021. 1. 16.
"대구 달성군 산책 마비정벽화마을, 남평문씨세거지","조만간 입원과 수술이라는 과정을 거쳐야 한다는 부담감에 잠도 자지 못했던 이번 주말. 그래도 이렇게 나와 파란 하늘, 푸른 숲을 보며 조금이나마 기분이 좋아졌던. 아...그래 괜찮겠지 위안해 본다. 힘내자. 잘 지나갈거야. #대구가볼만한곳 #달성군산책 #대구여행 #공감 #힘내자 #지나간다",2021. 4. 19.
대구가볼만한곳 :: 우리 아이와 함께 즐길... 소개합니다. - 달성군 기자단 하종수,만한 곳을 찾으신다면 신비한 동물 체험과 아이들이 즐거워하는 액티비티도 즐기고 좋은 공기도 마실 수 있는 네이처파크 추천드려요~ 타지에서 이용하실 경우 깊은 숲 속에서 휴식을 취할 수 있는 호텔도 운영하고 있으니 참고하시길 바랍니다. ◆네이처파크◆ 대구광역시 달성군 가창면 가창로 891,2020. 6. 16.
[대구 달성군] '녹동서원'과 '달성한일우호관' 그리고 일본인 이야기,제가 대학원 숙제로 뭘 하는게 있어서 대구에 위치한 서원 세 곳을 둘러보게 되었는데요. 그 마지막 목적지는 달성군에 위치한 녹동서원입니다.... 김충선 장군의 충절에 한없는 감사를 표합니다. #녹동서원 #달성한일우호관 #대구가볼만한곳 #대구서원 #서원이야기 #선비이야기여행,2021. 6. 26.
[여행] 대구 달성군 비슬산 자연휴양림 '얼음폭포'(feat.오토캠핑장),"대구의 명물이죠 비슬산...다음에는 비슬산 오토캠핑장도 한번 방문해보고 싶은데요~!! 눈이 녹지 않고 그대로였습니다! 역시 추운 기온 탓일까요! ㅎㅎ 가끔 등산하는 분들도 계셨지만, 날씨가 춥기도 하고 저는 등산이 이제 귀찮아질 나이라... 그냥 내려왔습니다 ^^ 얼음폭포만 후딱 보고 바로...",2021. 1. 9.
대구 가족여행 아이와 가볼만한곳 마비정 벽화마을,"가까운 공원, 등산로 자주 이용하시면 건강에 아주 좋을 것 같습니다.1년 넘게 지속되고 있는 생활속 거리두기로 피로에 지친 분들께서는 지금부터 소개하는 대구 달성군 마비정 벽화마을 주목해 주시기 바랍니다. 소개할게요 가족여행 전문가! 해외배낭여행 전문가! 활동 중인 여행유튜버 편가여...",2021. 4. 15.
"대구 달성군 화원 카페 : ""자연충만"", 넓은 자연에서 커피 한잔하고 싶다면",안녕하세요 쏠입니당 :) 쏠은 얼마 전에 칭구들과 성주 여행을 계획하기 위해 자연충만으로 모였답니당 사실... 청도에 로카 카페에 가고 싶었는뎅 ㅠㅠ 후들후들 비가 너무 내렸어여.. 화원읍사무소로 집합!!! 쏠은 또 지각 ㅎ_ㅎ 카메라가 고장이 나서 대구역 다녀왔는데 ㅠㅠ 비가 와서 차가...,2021. 9. 5.
대구 달성 도동서원 & 달성보 와 노을공원 낙동강 여행코스,""" 낙동강을 따라 서로 25분 거리에 있는 도동서원과 달성보는 낙동강의 아름다운 풍경 따라 여행하기 좋은 달성의 예쁜 여행 코스입니다"" - 답사일 : 2021년 8월 7(토) 1. 달성 도동서원 - 주차비, 입장료 모두 무료 -주차장 주소 : 대구 달성군 구지면 도동리 45-2 -낙동강변의 유네스코 지정 세계...",2021. 8. 20.
알찼던 대구 맛집 리스트,"큰나무집 대표메뉴 : 궁중약백숙 40,000원 주소 : 대구 달성군 가창면 우록길 24 연락처 : 053-793-2000 운영시간 : 11:00 - 21:00 부모님 몸보신 시켜드리고 싶어 큰나무집이라는 한식집에 찾아 백숙을 먹었어요. 궁중약백숙 하나만 시켜도 3~4명이 먹을 수 있는 양이라 가성비 넘쳤고요. 맛도 좋아서 종종...",2021. 9. 27.
대구 달성군 갈만한 곳 _ 달성 도동서원,"저는 연휴동안 계속 집에 있어서 오늘은 간단하게 드라이브 할 겸 대구 달성군에 있는 도동서원을 다녀왔습니다 :) 도동서원은 국내 5대서원... 해외여행은 물론 국내 여행지까지 마음놓고 가기 어려운 상황인데, 방역수칙을 준수해서 근처로 산책을 가보시는 건 어떨까요?? 혹시 대구로 드라이브나...",2021. 2. 14.
대구 달성군 구지 아이랑 갈만한곳 / 별의별 카페,그곳 대구 달성군 구지 별의별카페 첫째가 고구마라떼를 좋아해서 고구마 라떼를 파는 집으로 왔어요 입구 벌써부터 뛰어놀고 싶어지네요 작은 캠핑카와 텐트가 입구쪽에 있어요 여행 온 기분이 드네요~ 첫째와 데이트♡ 데이트는 아빠랑만 하자! 내부 인테리어가 엄청 깔끔해요 엄마카드를 두고 온...,2021. 4. 26.
[대구여행] 곡식 가득 곳간 같은 풍성함이 가득한 달성군 교항리 이팝나무 군락지...,"이상 대구여행 곡식 가득 곳간 같은 풍성함이 한가득하지만 찾는 사람들도 한가득한 곳ㅠ 달성군 교항리 이팝나무 군락지 (이팝나무꽃 시, 대구 출사, 스냅사진, 인생사진, 핫플, 많은 사람 감당되면 사진 찍기 좋은 곳) 이야기를 마칩니다. 곡식 그득 곳간처럼 풍요롭고 행복한 5월 되시길 바랍니다!",2021. 5. 3.
대구 가볼만한 곳 [달성군 강정보디아크],찍은 영상은 많지만 올리기 귀챊애~ 물-멍 시간 금방 흘러~~~~ #일상 #일상블로그 #일상소통 #서이추 #서이추환영 #대구 #달성군 #대구가볼만한곳 #2호선가볼만한곳 #대구데이트코스 #대구산책하기좋은곳 #대구여행 #대구핫플 #강정보 #디아크 #물멍 #사진 #일몰 #대구일몰맛집,2021. 1. 1.
[대구] 달성군 논공읍 하리 옹이랑망고랑 달성노을공원 캠크닉 (캠핑 + 피크닉) 떠난...,"주소 : 대구광역시 달성군 논공읍 하리 899 전화번호 : 경비실 053-667-5278 / 논공군청 053-668-2984 그 성밖숲보다 나한테는 좋았는데 옹이망고한테는... 논공군청에 #대구근교노지캠핑, #대구노지캠핑, #대구노지, #대구캠핑, #대구잔디밭, #대구피크닉, #대구차박, #대구당일치기, #대구여행...",2021. 6. 15.
[대구달성군/캠핑] 구지오토캠핑장 카라반 6인실에서 1박2일 가족여행(+강변오토캠핑장),오랜만에 가족여행을 다녀오기로 했당 TV에 나오던 캠핑카를 보고 가보고 싶어했던 엄마를 위해 카라반캠핑을 다녀오기로! 이용시간 15:00 ~ 다음날... 달성군민 가족덕에 할인도 받음 크크 이날 비가 엄청 오던 평일이라 예약이 굉장히 수월했음ㅋㅋㅋㅋ 구지오토캠핑장 도착! 대구근교라서 참 좋다...,2020. 8. 14.
[대구달성군] 옥연지 송해공원 둘레길 - 금굴 가볍게 산책!,송해는 황해도 출신으로 알려져 있는데요~ 대구 달성군이랑은 무슨인연이기에 이곳에 이름을 딴 공원이 있을까요?? 송해공원은 국민 MC로 칭해지고... 행복 가득하길 정말 즐거운 산책이었습니당 포스팅은 여기까지! 감샤합니당 #달성군#송해공원#옥연지#명소#추천#핫플레이스#나들이#산책#일상#여행,2021. 2. 22.
대구 달성군 다사읍 세천교,미흡해 보였당 그래도 있으니까 다행ㅋㅋ쌀뻔~~ 다리밑 파크 쪽으로 걸어가야함 비도 오락가락 잠깐이였지만 집에서 먹는거보단 더 맛있었던 한끼 #캠핑 #깡언니 #남매맘 #여행하는엄마 #미즈캠 #대구달성군 #다사읍 #세천교 #베른페타 #세천교캠핑 #대구텐트칠만한곳 #대구타프칠만한곳 #대구잔디밭,2020. 6. 14.
대구 달성군 맛집 <돈까스클럽 대구달서점>,돈까스클럽 대구달서점 대구 달성군 화원읍 명천로 258 053-642-6886 매일 11:30~21:30 (라스트오더 21:00) 주차가능 예전에 지나가면서 봤던 돈까스 클럽!... 다른나라 여행갔을때 비어있는데도 안받을때가 많더라구요! 음식 하나하나를 정성스레 준비하기위함이니 이해를 하자구용ㅎㅎ 매장으로 들어가니...,2020. 12. 3.
[뚜벅이 여행] 도동서원 달성군 대구광역시 경북,"첫날 직행버스로 대구 서부종합터미널 도착 지하철1호선, 급행버스8번, 카카오 택시로 도동서원 道東書院 도착 달성군 행복택시, 600번 버스, 8번... 4일 동안 산사山寺 와 서원書院 을 찍는데까지 하려고 뚜벅이로 나왔읍니다. 잘 해보꺼요~~ㅎ 여행 완료후 좀더 자세하게 올려 보겠읍니다~~^-♡♡",2020. 11. 5.
대구 달성군 제2회 전국글쓰기 대회,"대구 달성군 제2회 전국글쓰기 대회 ""지금은 달성 여행중입니다"" 작성 20-05-20 (재)달성문화재단 달성군립도서관에서 ‘달성’의 아름다움과 다양한 인문·관광·축제를 널리 알리고 문학 속에서 피어나는 인문학 자원으로 활성화하기 위하여 ‘지금은 달성 여행 중입니다’라는...",2020. 5. 20.
세계문화유산 대구 달성군 도동서원의 멋을 느껴보는 시간,날요가 무슨뜻이냐면 날요 = 날씨요정 ♀️ 이라는 뜻이랍니다 푸헤햇 제가 국내외 여행을 다닐때마다 해가 쨍쨍하니 날이 좋아서 생긴 별명이에요... 했어요 출처: 대구 달성군 홈페이지 가을에 오면 멋진 은행나무를 배경으로 인생사진을 남겨볼 수 있어요 기억해뒀다가 꼭 가을에 다시 방문을 할...,2021. 3. 19.
대구달성군맛집)대구 달성군 현풍맛집 오유미당(유가점) 수제돈카츠와 쌀국수 전문점...,"문경새재로 여행을 가기전에 달성군 맛집 및 다양한 검색을 통해 돈카츠 맛집인 오유미당을 방문 달성군 유가읍 현풍맛집 논공맛집 고령맛집... 상호 : 오유미당 주소 : 대구시 달성군 유가읍 테크노상업로 100 시간 : 평일 , 주말 11:30 - 21:00 평일브레이크타임 : 16:00-17:00 (주말은 없음) 라스트오더 :20...",2021. 4. 25.
"당일치기 대구여행 추천 4곳, 도동서원, 앞산해넘이전망대, 대구제일교회...","즐거웠던 흐린날의 대구사진여행 대구여행 추천 1. 도동서원, 백일홍 대구 달성군 구지면 구지서로 726 / 무료주차장 있습니다. 이제 가을이 저 만큼 다가 온 듯이 날씨가 선선합니다. 날씨가 더워도 이쁜 사진을 찍으러면 맑은 하늘이 좋은데 하필 오늘은 날씨가 흐리네요 내리쬐는 태양이 조금...",2021. 9. 7.
대구 여행 달성 삼가헌고택,앉아 있진 않았지만 몇몇 분들이 앉아서 푸릇푸릇 자연바람을 느끼고 가시던데 대구 여름 여행지 찾으시는 분들은 콩이가 다녀온 세 장소 함께 다녀와보시면 좋을 것 같아요 대구 달성 삼가헌 고택 대구 달성군 하빈면 묘리 800번지 화장실 없음 주차공간 갓길 두 세대 정도 협소 배롱나무 명소...,2021. 7. 25.
대구달성군중고가전 건조기 찾고 계시나요?,날씨도 많이 풀리고 따뜻해지니 조금 다니기편하네~라고 느끼실 크리스마스 이브네요^^ 코로나 사태만 없었으면 예쁜펜션으로 가족여행도 많이... ㅜㅜ #대구달성군중고가전 한번 따라와보실래요? 우울한 기분전환 하실수 있도록 좋은제품 포스팅 해드릴께요^^ 고고씽~~ 오늘 저희...,2020. 12. 24.
교항리 이팝나무 군락지 5월대구 출사여행 사진찍기좋은곳,글/사진 철인돼지 작년에 우연히 알게된 5월대구여행지 사진찍기좋은곳~ 대구 달성군 옥포읍 교항리의 이팝나무 군락지를 올해도 찾아왔습니다. 사실 절정은 조금 지난 느낌인데 날씨 좋다면 지금도 충분히 예뻐서 빠르게 찾아서 다녀오시면 좋을 것 같아요. 작년에는 5월 초중순에 갔을때도 너무...,2021. 5. 5.
카페episode 86 - 대구 달성군 현풍 비슬산 두낫디스터브(Do not disturb) 카페에...,#밍스 #밍하 #밍스랑여행가자 #비슬산카페 #두낫디스터브비슬산 #두낫익스프레스비슬산 #비슬산맛집 #비슬산밥집 #비슬산까페 #비슬산등산 #비슬산 #비슬산가볼만한곳 #비슬산드라이브 #비슬산맛집 #비슬산밥집 #비슬산논뷰 #비슬산뷰맛집 #텍폴카페 #테크노폴리스카페 #현풍카페 #현풍까페...,2021. 10. 4.
#달성군여행 #달성군관광 #대구투어 #대구여행 #대구근교 #도동서원 #카페기브온 #기브온...,안전운전하세요^^ #대구맛집 #대구카페 #대구여행 #대구투어 #대구근구 #대구핫플 #달성군 #달성군맛집 #달성군카페 #달성군여행 #현풍맛집 #현풍카페 #텍폴맛집 #텍폴카페 #논곤맛집 #논공카페 #구지맛집 #구지카페 #창녕맛집 #창녕카페 #고령맛집 #고령카페 #대구국가산업단지 #뷰맛집 #뷰카페 #핫플...,2020. 1. 23.
[여행] 대구 달성군 다사읍 가볼만한 곳 '강정고령보' 디아크 (feat. 왕발통 바이크),"대구 신발모양조형, 대구 고래모양조형.. 등등 강정고령보 또는 고령보 디아크 정식 명칭으로 불러주는 사람은 없었떠랬죠 하지만 누구나 공감할 수 있는 '사진찍기 좋은 명소'라는 사실! 특히 밤이 되면 불빛이 너무 아름다운데요,, 저희는 그냥 멀리서 보고 오느라 밤사진과 내부의 사진은 건질 수...",2021. 1. 13.
"(대구 달성군, 달서구 변기 뚫을 때) 대실역, 다사 변기 막힘/달서구 신당동 변기 막힘","뚜러신은 대구 전 지역! 성주, 왜관, 현풍, 칠곡 어느 곳이든 언제든 불러만 주시면 바로 달려갑니다 싱크대, 하수구, 변기 막힘이 있다면 뚜러신에게 바로 연락 주세요 친절히 상담해드립니다 #달성군변기막힘 #다사변기막힘 #대실역변기막힘 #달성군변기역류 #다사변기역류 #대실역변기역류...",2021. 5. 27.
[대구-옥포] 전국노래자랑~ 달성군 옥연지 송해공원,아이스 아메리카노가 이천원 ㄷㄷ 주변에 사시는 분들에게는 좋은 산책 및 모임의 장소라고 생각합니다. 그 이유는 주변에 카페도 있고 밥집도 있고 .~~~ 등등 #옥연지 #달성군 #대구 #송해공원 #대구송해공원 #대구달성군송해공원 #대구여행 #대구달성군 #달성군가볼만한곳,2020. 9. 1.
대구변기막혔을때 달성군 옥포 천년나무 단단히 막힌 변기 탈거없이 시원하게...,#대구변기막혔을때 #대구 #달성군 #옥포 #막힌 #변기 #양변기 #막힘 #막혔을때 #탈거 #뚫어 벌써 주말이네요 날씨도 완젼 좋고 바람 살랑살랑 부는게... 이번 주말에는 언택트여행이나 살짝 바닷가로 떠나볼까요? 어디론가 떠나고싶게만드는 그런 날씨입니다 우리 잇님들도 이봄을 만끽할수있는 그런...,2021. 3. 12.
대구 달성군 현풍읍 주왕산삼계탕,가을날씨 선선한데 주말에 가족들과 또는 친구와 함께 삼계탕 한뚝배기 하실래예~?>_< *오늘도 맛있게 잘 먹었습니다* 대구 달성군 현풍읍 비슬로 584 주차공간 있음 보람이의 먹방여행 #대구삼계탕맛집 #현풍맛집 #현풍삼계탕 #현풍데이트코스 #현풍가볼만한곳 #대구맛집 #달성군맛집,2020. 9. 19.
[iPhone] 대구 달성군 카페 자연충만 : 대구 신상카페,있어서 타지에 사는 분들도 시간내서 와볼만한 곳이라고 생각한다. 주의사항은 역시 노키즈 / 노펫 ㅎㅎ #대구카페 #대구신상카페 #대구달성군카페 #달성군카페 #대구자연충만 #자연충만 #자연충만카페 #카페자연충만 #대구여행 #대구가볼만한곳 카페 자연충만~ 매주 월요일은 쉽니다 ㅎㅎ,2021. 5. 29.
대구명소 :: 봄내음이 솔솔~나는 사문진주막촌과 사문진나루터를 소개합니다! - 달성군...,"11:00 / 13:00 / 14:00 15:00 / 16:00 / 17:00 / 18:00 대구명소 사문진나루터의 모습입니다 낙동강과 금호강이 만나는 달성군 화원읍에 위치한 대구명소... 가족여행, 산책코스로 사랑을 받고 있는 대구명소 사문진주막촌 코로나19가 종식되어 하루빨리 사문진주막촌의 아름다운 모습을 함께 감상하고...",2020. 4. 27.
대구 달성군 대표관광지 마비정벽화마을,"대구 달성군 대표관광지 마비정벽화마을 글. 사진ㅣ 민트쩡이 ( 불펌 금지, 사진 무단 도용 금지 ) 작년에 다녀오고 올해 다시 한번 다녀온... 혹시 대구여행 오셨다면 이곳은 어떠세요? 오시는 길 모든 글, 이미지에 대한 저작권은 민트쩡이에게 있습니다. 이미지, 글 무단 도용 시 법정 대응을...",2020. 10. 28.
[대구 달성군 문화예술교육/노인 도예교실] 그림 그리는 도자기! 복지관 도자기수업,대구 달성군에 위치한 복지관에서 도자기 수업을 진행 하였어요. 도자기 핸드페인팅 도자기 핸드페인팅은 초벌구이가 된 도자기에 도자기용... 도자기 #대구여행코스 #대구가볼만한곳 #대구이색데이트 #대구원데이클래스 #대구커플체험 #대구데이트장소 #대구핫플 #대구데이트코스 #도자기체험...,2021. 3. 2.
"달성군소식 :: 달성군립도서관에서 제2회 전국 글쓰기대회 ""지금은 달성 여행 중입니다...","올해는 기행문 공모전으로 비슬산, 도동서원, 송해공원, 마비정 벽화마을, 사문진주막촌, 육신사 등 달성군의 명소를 여행하거나 달성 100대 피아노, 달성 대구현대미술제, 달성음악회 등 달성군의 축제에 참여하고 공모전에 참여할 수 있도록 해서 지역 관광산업 활성화로 이어질 수 있도록...",2020. 6. 15.
대구 여행 가볼만한곳 가을여행 핫플 대명유수지 달성습지,"그동안 인증샷 찍기에 바빴던 여행을 했는데 달서 생태프로그램을 통해 오롯이 자연을 배우고, 느낄 수 있어 좋았어요. 대명유수지에서 이어진 계단을 따라 올라가면 달성습지로 이어집니다. 5. 달성습지 산책 및 생태탐험 달성습지는 대구 달서구 대천동, 호림동, 달성군 다사읍, 화원읍 일대에...",2021. 10. 3.
"송해공원맛집 , 대구맛집 , 달성군맛집, 용연사맛집 - “솔밭생수식당”",솔밭생수식당 주소 대구 달성군 옥포읍 옥포로77길 17 영업시간 10:00-22:00 주차장 있음 여기는 맛집이라고 말하지않아도 이미 예전부터 유명해서 제가 갔을때마다 손님이 많더라구요 특히나 점심시간가면 조금의 웨이팅 있어요! 주차장에서 바라 본 식당모습 ( 비가오던날이라 어둑어둑하네요 )...,2020. 8. 23.
대구가볼만한 곳. 대구 달성군 마비정벽화마을(대구 런닝맨 촬영지),#대구여행 #대구마비정벽화마을 #아이들과가볼만한곳 #대구가볼만한곳 #달성군마비정벽화마을 #대구부모님모시고갈만한곳 #대구데이트코스 #마비정 #대구관광명소 #대구아이와함께 #대구갈만한곳 #대구관광지 #5월에가볼만한곳 #대구여행코스 #대구주말에나들이갈만한곳 #대구런닝맨촬영지...,2021. 5. 9.
대구수도꼭지교체 대구 달성군 현풍 테크노폴리스 물새는 씽크대수전 교체해드립니다,#대구수도꼭지교체 #대구 #달성군 #현풍 #테크노폴리스 #텍폴 #고장난 #물새는 #씽크대수전 #싱크대수전 #수도꼭지 #교체 #수리 #언택트여행 #코로나 코로나로 인해 우리의 삶의 형태가 굉장히 많이 바뀌었습니다 그중 언택트여행에 대해 아시나요? 비접촉을 뜻하는 언택트! 그러니까 인적이 드문...,2021. 2. 5.
대구등산코스 :: '200대 명산' 주암산을 오르다. - 달성군 기자단 김대식,"안녕하세요 달성군 식구 여러분, 대구를 대표하는 산이라면 팔공산과 비슬산을 꼽는데, 2002년 산림청에서 선정한 '100대 명산'에도 이름이 들어있죠. 산림청에서는 또 '100대 명산 플러스 우리 산 100'도 발표했었는데, 여기에 대구에서는 유일하게 달성군 가창면 소재 주암산이 추가로 들어있더군요....",2020. 5. 21.
[도케비커피] 대구 비슬산 야외 대형 카페,자리가 쉽게 나지를않아서 앉을 수 없었고 사진도 담기엔 어려움이 있었어요^^;; 오픈한지 얼마 안됐다는데 인기가 많나봐요^^ 평일 또는 오픈런을 하시길 추천드립니다 ^____^ #대구카페 #달성군카페 #도케비커피 #도케비 #비슬산카페 #비슬산도케비 #대구여행,2021. 9. 25.
대구 달성군 현풍읍 현풍곽씨 십이정려각,예뻤어요 대구 여행으로 달성군을 생각하신다면~?그것도 현풍쪽이라면~? 한번 들려보세요 현풍곽씨 십이정려각은 둘러보는데 오래 걸리지 않으니 들렸다가 앞에 연잎이 있는 저수지도 한바퀴돌고 목마르면 가까운 한훤당도 들리구요^^ 제가 일정 다 짜드렸어요 헤헷 그럼 다음은 연잎이 있는 저수지...,2020. 9. 27.
"용연사(대구)대구 달성군적멸보궁으로 유명한 사찰, 용연사",내용 닫기 상세정보 내위치 새로고침지도 펼치기 문의 및 안내 주소대구광역시 달성군 옥포면 용연사길 260 휴일연중무휴 주차있음 지정현황... 제1813호 [삼층석탑] 대구시 문화재자료 제28호 [묘법연화경 권4~7] 보물 제961-3호 #관광지 #기차여행 #불교 #불교문화 #사찰 #사찰여행 #산사 #아이와함께,2021. 3. 8.
맛집episode 150 - 대구 달성군 현풍 전주소반에 다녀오다,#밍스 #밍하 #밍스랑여행가자 #mingz #현풍맛집 #현풍밥집 #현풍전주소반 #전주소반 #현풍석갈비 #현풍먹을만한곳 #현풍가볼만한곳 #텍폴맛집 #텍폴밥집 #텍폴전주소반 #텍폴석갈비 #텍폴먹을만한곳 #텍폴가볼만한곳 #테크노폴리스맛집 #테크노폴리스밥집 #테크노폴리스전주소반...,2021. 9. 22.
비오는 날 남평 문씨 본리세거지 [대구 달성군 가볼만한곳],비오는 휴일. 마비정 벽화마을을 둘러본 다음 가까운 거리에 있는 남평 문씨 본리세거지를 찾아 산책을 즐겨보자. 남평 문씨 본리세거지의 문익점 동상 요즘은 코로나 시대. 어디 마음 놓고 다니지도 못하는 분위기다. 사진을 듬뿍 찍어왔으니 사진으로나마 비 오는 날의 남평 문씨 본리세거지를...,2020. 9. 22.
"대구 근교 아이랑 가볼만한 곳, 달성군 구지 스위트가든!",대구 근교 아이랑 가볼만 한 곳으로 스위트가든 Pick 캠핑 느낌을 낼 수 있는 곳이기도 하답니다♥ 저희 집에서 차로 9분 거리! 일요일 아들... 한시도 눈을 뗄수가 없어요 ㅠㅠ 도착한 제가 추천드리는 대구 근교 아이랑 가볼만 한 곳 구지 스위트가든! 주차장이 진짜 넓어서 편하게 하면 된답니다!...,2021. 9. 7.
"대구 10월 가볼만한곳, 억새, 핑크뮬리 보러 떠나보아요",달성 논공삼거리 핑크뮬리 좀 더 우아한 가을 여행을 하고 싶다면 핑크뮬리가 있는 대구 달성군으로 떠나보세요! 달성군 논공삼거리에서 만나는 핑크뮬리... 위치는 옥포를 지나 달리다 보면 달성노을공원이 나오는데...조금 더 논공삼거리에서 만날 수 있답니다. 이곳은 총 3곳의 포인터가 있어요!...,2021. 10. 3.
대구가볼만한곳 :: 노랑어리연이 활짝 핀 '천내천'으로 함께 떠나실까요? - 달성군...,"'대구광역시 달성군 화원읍 성산리 487-5' 천내천에는 자연산 노랑어리연이 군락을 이루며 자생하고 있어 6월에서 8월까지 전국 사진가님들이 때마다 찾아오는 곳이랍니다. 비가 내린 다음에는 천내 폭포를 감상하실 수도 있어요. 천내천이 노랑어리연으로 덮여 노란색 물결이 일 듯, 감탄을...",2020. 6. 8.
화원 강식당/화원 고기집/화원 갈빗살/달성군 화원맛집/대구 강식당,#대구여행 #대구맛집 #달성군맛집 #화원맛집 #화원갈빗살 #화원고기집 #화원소고기 #달성군화원맛집 #대구강식당 #화원강식당 #강식당 강식당 본리리 101-1 첫째 생일기념 및 곧 있을 안해의 생일 미리 기념ㅋ 화원으로 고고! 한우갈비랑 등심 먹으러 강식당에 갔다~ 한창 먹는 첫째 녀석의 원픽은...,2021. 9. 5.
