header,contents,date
달성군 카페 모던한 인테리어 커피 맛집,좋은 여행을 잠시나마 하고 온 기분이 들었던 카페에요. 산책과 함께 여유 있는 시간을 보낼 수 있었던 달성군 카페 '오오티비'에요. 카페의... '오오티비'가 대구에서는 최초로 스톤을 이용해서 의자를 만든 카페라고 해요. 최초라고 하니 실험적인 인테리어를 과감하게 시도한 카페인 듯 해서...,2021. 6. 21.
대구 여행지 달성 남평문씨 세거지 능소화,"남평문 씨 본리(인흥) 세거지가 속해 있는 대구 달성군은 봄서부터 수많은 여행객의 단골 장소입니다. 비슬산 참꽃 문화제를 보러 왔던 바로 이곳 대구 달성군 이에요 달성군 가볼만한곳은 화원동산, 비슬산 자연 휴양림, 달성공원, 사문진 나루터, 하늘을 나는 말이 살았다고 하는 마비정, 가을...",2021. 6. 21.
<반려견동반> 달성군 달성습지 갈대밭,커피땡겨 .. 커피 마시러 가즈아 세. 젤. 귀 철푸덕 뽀이 .. ㅋㅋㅋ 안아주지 않을 것이야 스스로 일어나 !! #가을명소 #달성군갈대밭 #대구갈대밭 #반려견동반 #애견동반 #대구반려견동반 #대구애견동반 #애견동반여행 #반려견동반여행 #대구애견동반여행,2021. 9. 23.
대구 가볼만한곳 실내 동물원 네이처파크 나들이하기도 좋아,팬 하기를 하시면 헤누의 여행 코스와 맛집을 같이 즐길 수 있습니다! 대구 달성군 네이처파크 오픈 시간 : 평일 11:00 ~ 18:00 주말 11:00 ~ 19:00 주차시설 있음 매주 월요일 휴장 네이처파크 옆에 바로 워터파크가 있더라구요 나중에 코로나가 사라지게 된다면 워터파크도 와보고 싶군요 입구를...,2021. 8. 11.
꽃타투 #타투 #대구타투 #미니타투 #쇄골타투#달성군타투 #달서구타투 #화원역타투,rose #한글타투 #라인타투 #블랙워크 #대구타투 #화원역타투 #달서구타투 #달성군타투 #캘리그라피 #대구캘리그라피공방 #펜캘리 #손글씨 #감성글귀... 비오는 토욜 집에만 있지말고 짧은 여행도 좋으니 공기좋은 곳으로 떠나면 그것보다 더 큰 행복이 없지않을까합니다 ㅎㅎㅎ 8월달이 얼마 남지...,2021. 8. 21.
대구 달성군 용연사 원조 닭 불고기 구이 집 .,"평균은 3명 정도 드실 수 있다고 보심 될 것 같아요 가는 길도 이쁘며 공기도 좋고 드라이브하기도 좋은 곳입니다 친구들과 갔다 오니 전부다 대만족 하면서 돌아왔답니다 그렇게 멀지도 않고 여행 가서 제대로 힐링한듯한 느낌을 많이 받았습니다 날씨 좋은 날 연인 , 가족 , 친구와 힐링하고 오시길...",2021. 4. 23.
"[대구 달성군] 다양한 동물들과 교감할 수 있는 동물원, 네이처파크.",평일 : 10:00 AM - 18:00 PM 주말 : 10:00 AM - 20:00 PM (월요일 휴무) 참고해서 방문하시면 좋을 것 같아요! . . . #대구 #대구여행 #대구핫플 #대구핫플레이스 #대구가볼만한곳 #대구근교 #대구근교가볼만한곳 #대구근교놀거리 #동물원 #대구동물원 #네이처파크 #스파밸리 #가창 #달성군 #동물 #대구근교동물원,2020. 7. 20.
겨울철 힐링이 필요할 때. 달성군 유가사,달성군 유가사 국립대구과학관 달성군이야기 오늘 소개할 달성군의 명소는 비슬산에 있는 유가사입니다. 국립대구과학관에서도 정말... 국립대구과학관과 함께 당일 여행 코스로 잡아도 좋은데요. 오늘 유가사를 방문하면서 느꼈던 것들을 여러분에게 소개할까 합니다. 아름다운 경관과 함께...,2020. 1. 16.
대구 남평문씨본리세거지 찔레꽃 만개 ...,어떨까요 #사진 #풍경사진 #꽃사진 #찔레꽃 #남평문씨 #여행 #남평문씨세거지 #남평문씨본리세거지 #대구여행 #대구달성군 #화원읍 #대구가볼만한곳 #인흥마을 #달성군가볼만한곳 #달성가볼만한곳 #문익점 #목화 #민속마을 #대구한옥마을 #대구근교 #국내여행 #당일치기여행 #대구드라이브...,2021. 5. 10.
대구 아이와 가볼만한곳 할로윈 축제 네이처파크 재미난다,9월 다양한 할인도 있으니 꼭 챙기셔서 알뜰한 여행되세요! 전화한통으로 출입확인하고 들어가시면 되요! 네처파크 할로윈 페스티벌 인증샷 찍으러... 아이도 생각보다 너무 괜찮았다면서 집에 가면서 친구랑 계속 쫑알대던걸요. 대구 달성군 가창면 가창로 891 대구 아이와 가볼만한곳 네이처파크,2021. 9. 20.
대구,"둘째의 대구여행 버킷리스트 중 하나가 스티커사진 남기기였고, 신나게 이것저것 써보면서 아주 재미나게 스티커 사진 찍었다. 이후 할아버지와... 이곳은 강정고령보 (江亭高靈洑) 경상북도 고령군 다산면과 대구광역시 달성군 다사읍에 있는 낙동강의 보 낙동강을 가까이 볼 수 있는 강정고령보...",2021. 9. 23.
대구 달성군 가창면 ] 전시회에 온 듯한 기분을 느낄 수 있는 달성군 카페 '동제미술관',쉬는 날을 맞이해 오랜만에 인형이와 함께 대구 안이지만 외곽지 같은 느낌의 가창댐 인근 미술관 카페로 유명한 가창 카페 동제미술관에 가보기로... 지금은 어렵지만 단체모임도 가능한 넓고 쾌적한 공기 좋은 카페 #달성군카페 #가창카페 #동제미술관 #갤러리카페 #가창댐인근카페...,2021. 3. 25.
대구 사육신기념관,"2018년 6월, 대구 달성군 여행(?) 이야기 중 오늘은 사육신기념관에 대해 포스팅을 해보려고 한다. '사육신기념관'은 대구 달성군 하빈면 묘리 (묘골마을) 에 있는데, '육신사'에 가기 위해 도착하니 마을 초입에 사육신기념관이 있어 땀도 식힐 겸 구경해보았다. 그런데 여기에 아주 설명이 잘 되어...",2020. 6. 11.
대구 여행 왔다면 네이처파크 꼭 다녀와보기!,"대구 달성군으로 아이와 함께 여행 간다면 평범한 호텔 말고 이색적인 곳 찾고 있다면 네이처파크 안에 있는 호텔 드포레 추천해요. 숲 속에 자리한데다 동식물원과 붙어있어 투숙객 찬스로, 아무도 입장하지 않은 동식물원을 저녁에 누빌 수 있는 특별한 곳이거든요! 호텔, 드포레에서 1박2일...",2021. 10. 11.
대구벽걸이티비설치 달성군 대구국가산단 반도유보라아이비파크2.0 현장,"피크닉, 여행을 가고 싶다는 생각이 계속 들어 몸이 근질근질하네요. 코로나가 3차 대유행 이후로 코로나 확진자가 100명 아래로 떨어진 적이 한... 대구벽걸이티비설치 전문 업체 효자티비는 오늘 대구벽걸이티비설치 의뢰를 받고 대구광역시 달성군 대구국가산단 반도유보라아이비파크 2.0 현장을...",2021. 2. 22.
호텔지(HOTEL G) 방문 - 대구 달성군 숙박,"2020년이 대구경북 관광의 해였네요. 저는 당분간 이쪽으로 여행 올 계획은 없는데, 출장으로 방문 계획은 아주아주 많아요~ 호텔 결제하고 객실 키 받아요. 객실 요금은 일반실 기준으로 5만원입니다. 거의 대부분의 모텔 숙박 요금이 비슷합니다. 복도, 5층 총 9객실이 있어요. 소화전 위치...",2020. 7. 29.
"대구근교글램핑/ 달성군글램핑, 카라반/ 오투글램핑/ 가격, 위치, 후기, 불멍",후후 감사감사^-^ 즐거웠던 오투글램핑 끝~ #대구캠핑 #대구글램핑 #대구카라반 #대구데이트 #대구여행 #대구가볼만한곳 #현풍글램핑 #옥포글램핑 #근교글램핑 #근교카라반 #현풍카라반 #달성군카라반 #대구근교 #대구근교가볼만한곳 #대구근교캠핑 #대구근교카라반 #대구근교글램핑 #캠핑메뉴...,2020. 11. 18.
대구광역시 달성군 진달래명산 비슬산&대견사,우리나라 봄철 참꽃(진달래) 의 명소로 너무나 유명한 곳~~ 대구광역시 달성군 비슬산과 대견사를 일요일에 다녀왔어요. 비슬산 진달래가... 갑자기 중국 장가계 여행때 생각이 났어요. 9시30분에 줄서서 표사고 겨우 11시30분에 버스탑승해 자연휴양림을 지나 20여분 후 대견사 입구에 도착했어요....,2021. 4. 20.
경상도 여행 ● 대구 옥연지 송해 공원 ●,그동안 모르고 있었는데 이번에 대구 여행을 하면서 알게 되었지요. 송해공원(2019)은 국민 MC로 칭해지고 있는 송해의 이름을 따서 대구광역시 달성군 기세리(제2의 고향) 옥연지 일대에 조성된 공원이다. 그런데 이곳에 송해공원이 조성된 이유는 송해 선생님이 워낙 유명할 뿐만 아니라 대구 달성...,2020. 10. 5.
대구 가볼만한곳 내멋대로 대구여행지 코스추천 안전여행해요!,코스로 대구를 둘러보시면 아주 시원한 여름휴가를 대구에서 보내실 수 있으실 거에요. 1) 스파밸리 위치: 대구 달성군 가창면 가창로 891 운영시간... 것을 대구여행코스추천드려요. 가창의 스파밸리는 전국에서 가장 늦게 개장한 만큼 하루 세번의 클린 타임을 정해 방역소독도 진행하고...,2020. 7. 31.
대구가볼만한곳::달성군 '화원유원지'에서 봄 소식 전해드려요. - 달성군 기자단 하종수,"안녕하세요~ 오늘은 달성군 '화원유원지' 에 다녀왔습니다. 주말 아침 모처럼 산 속 자연을 거닐며 상쾌한 하루를 시작해보았는데요!! 함께... 모감주나무 군락지 대구 천연보호림으로 지정되어 있는 모감주나무는 높이가 10m, 6~7월 꽃이 피고 10월에는 열매가 열리며 화원동산 군락지에는 약 450그루가...",2020. 5. 27.
달성군 관광지도 신청하는 방법,"에코테마파크 대구숲 입장상품 50% 할인 스탬프14개 모두 완성시! 달성명예관광홍보위원 위촉 사문진 유람선 무료탑승권 증정(1매) 화원동산 오리전기차 탑승권 증정(1매) 출처: 달성군 관광명소 스탬프 투어(참꽃랠리) 달성관광안내지도 달성군 관광지도 신청하셔서, 즐거운 달성군 여행되시길...",2021. 7. 12.
"대구 화원유원지, 사문진 나루터,사문진 주막촌 가다.대구 아이와 비오는 날에 추억 만들기",화원유원지 대구 달성군 화원읍 사문진로1길 40-14 http://naver.me/xiAustVK 입구에 분수대에서 아이들이 신나게 논다. 옷은 다젖고 웃음은 귀에 걸렸네?... 아쉬운 나머지 올라가기라도 해본다^^ 화장실도 근사하고 쾌적하다. 수고했어 오늘도!! 소소하지만 즐거운 추억만들기 여행,2021. 7. 13.
대구가볼만한곳::자연과 어우러진 숲속의 콘도 '자연휴양림' - 달성군 기자단 최광철,"안녕하세요 달성군 가족 여러분, 오늘은 세계 천연기념물 '암괴류'가 있고, 대구광역시 지정 1호 관광지 비슬산에 위치한 자연휴양림 숲속의 콘도를 소개합니다. 얼마나 아름다운지 자연휴양림 콘도는 인터넷 예약도 어렵다고 합니다. 지금부터 저와 함께 숲속의 콘도를 구경해봅시다. 자연...",2020. 5. 27.
대구가볼만한곳 :: 호텔 아젤리아 야외... 즐거운 추억 만들어요. - 달성군 기자단 윤아정,이날 이곳에서 달성군 기자들의 다과 시간을 가졌답니다. 와우 이곳은 정말 뷰가 멋집니다. 음료가 나오기 전에 비슬산의 아름다운 경치를... 아이가 정말 좋아하네요~ 가족끼리 여행을 왔다고 하는데 정말 즐거워 보입니다. 제가 주문한 레몬에이드입니다. 정말 맛있네요~ 인절미 팥빙수도...,2020. 7. 3.
[대구 달성군 가창면 글램핑] 아침이슬팸과 '가창농원',"0613 오랜만에 이슬이들과 모였답니다 서울, 부산에 흩어져있던 친구들이 대구로 집합했어요 넘 조아요ㅎㅎ 히히 놀러 가기 전 장 보기는 필쑤... 역시 여행의 꽃이죠 꼬! 기! 그릴 대여비는 20,000원 정도였던 거 같아요 여총무였지만 가물가물 (날 믿지 마요) 크~~~~~ 때깔 쥬깁니다 야무지게 먹은...",2020. 7. 21.
[대구글램핑] 달성군 옥포 오투글램핑 / O2글램핑,"일어나니깐 소주랑 맥주랑 다먹었더라ㅋㅋㅋㅋ 새벽에 비가 왔다는데, 나는 빗소리 못 들음.. 기절했다^^ 우린 체크아웃 시간 꽉꽉 채우고 맨 마지막에 나왔다. 위치도 가깝고 너무 즐거운 시간 보내다 왔다♥ #오투글램핑 #O2글램핑 #대구글램핑 #달성군글램핑 #옥포글램핑 #대구여행 #대구근교여행",2020. 10. 11.
안전하게 대구를 즐기는 색다른 방법! 두근두근 대구 챌린지 투어,"길, 대구근대골목(청라언덕), 달서구의 달성습지(대명유수지), 대구수목원, 수성구의 수성못, 대구미술관, 남구의 앞산 전망대(케이블카), 달성군의... 작지만 기분 좋은 선물을 받을 수 있는 두근두근 대구 챌린지 투어에 참여하시고 즐거운 대구 여행도 하시기 바랍니다.",2021. 10. 5.
[다사맛집] 대구 달성군 서재 한우 맛집 '영상한우고집' 마블링 죽여요,#대구맛집 #대구한우맛집 #성서공단맛집 #대구성서맛집 #대구다사맛집 #대구다사한우맛집 #성서한우맛집 #성서회식 #서재한우 #대구달성한우맛집 여행영상 목적을 가지고 개설했는데 여행관련 영상을 올리고 싶지만 현재 시기적으로 그러지 못해서 대구관련 일상 등 업로드하고 있는 대구...,2020. 4. 6.
"대구산악자전거코스::산악바이커들의 성지, 비슬산 산악자전거길을 달리다. - 달성군...",이에 달성군에서는 2018년도에 산악자전거 체험코스를 설치했습니다. 산악자전거 동호인들로부터 호평을 받고 있는 MTB 산악자전거 체험코스를... 달성군의 명품 산악자전거 체험로 어떠셨나요? 산악 바이커님들을 볼 때마다 정말 대단해 보였고 멋있어 보여 엄청 부러웠습니다. 산악 바이커라면 한...,2020. 5. 28.
"[대구여행]1박2일 대구 가볼 만한 곳_대구 이 월드, 서문시장(1일차)",음~~~ 이곳은 대구여행으로 검색하다가 알게 된 곳인데요. 이쁜 사진과 글빨에 속아서 찾게 된 곳입니다.. 개인적으로 그냥 갈 곳 없고 배가 불러서... 키가 자그마치 225cm 달성군에서 유명하셨던 분이시더라고요.. 다음으로 이동한 곳은 점심 식사~~ 천사 갈비찜 사실 엄밀히 따지면 대구를 선택한...,2021. 1. 27.
"대구 달성군 캠핑카여행 4 - 유가사, 비슬산 반딧불이전기차 등산, 유가사 버스정류장...","2월14일(일) ~ 15일(월) 아침부터 비가 조금씩 오고, 날이 흐리다. 유가사를 구경하고 차박할 장소를 미리 알아볼 생각으로 유가사주차장으로 간다. 유가사주차장은 넓고 전망도 좋아 차박하고 싶은 곳이지만, 야영 및 취사금지 플렌카드가 걸려있다. 동계라서 그런지 주차장에 있는 화장실도 고장...",2021. 2. 20.
남평문씨본리세거지 연꽃과 능소화 & 대구 마비정벽화마을,"""연꽃 향기가 가득한 연못과 고택을 따라 길게 이어진 능소화가 피어있는 담장 길이 예쁜 남평문씨본리세거지와 산골마을에 예쁜 벽화가 그려져 있는 대구 마비정벽화마을의 아담한 풍경인데 두 곳은 승용차로 10분 거리이니 두 곳을 동시에 돌아보기 좋은 대구 달성군의 아담한 여행 코스입니다...",2021. 8. 15.
"요양원 탐방기 : 대구 달성군 논공읍, 마음다해 실버타운","대구 달성군 논공읍, 마음다해 실버타운은 1층의 주간 보호 센터와 2층, 3층 총 61베드의 요양원 시설을 운영하는 고옥자 대표는 일본과 독일을... 마음다해실버타운 1층의 주간보호 활동 사진 취재가 진행되는 동안 마음다해 실버타운 요양보호사들의 사진첩이 있어 보는 와중에 해외 여행을 다녀온...",2020. 12. 30.
"대구 달성보 공원, 달성군 카페 NOEL","했는데, 유리창이 좀 더러워서 그냥 밖에 나가서 예쁜 풍경들을 카메라에 담았다. 이 날은 좀 흐렸군 ㅠㅠ 그래도 카페 앞 강뷰 예뻐... #대구 #대구여행 #달성보 #달성노을공원 #대구데이트 #대구공원 #대구가볼만한곳 #달성보공원 #달성자전거길 #달성군 #카페노을 #달성군카페 #현풍카페 #현풍핫플",2020. 9. 30.
대구 가을여행 : 아들과 함께 떠난 동심의 세계 '마비정 벽화마을',오늘은 재미와 옛 추억을 떠올릴 수 있는 대구 가을여행 달성의 벽화마을을 소개합니다! 마비정 벽화마을은 달성군 화원읍 마비정길 262-5번지에 있으며 입구에 무료 주차장이 있지만 가는 길이 협소하여 다소 위험할 수 있다는 점 참고하시면 좋습니다. 휴일을 맞아 오랜만에 아들과 함께 부자...,2020. 10. 22.
대구먹거리추천::도깨비가 살고있는 백년도깨비시장에서 '수구레국밥' 한 그릇 - 달성군...,우리 달성군에 100년 넘게 자리를 지켜오고 있는 백년 시장이 있다는 사실 알고 계시죠? 바로 장난기 가득한 도깨비 현이와 풍이가 살아있는 '현풍백년도깨비시장' 입니다. 작년 봄에는 청년몰도 개장을 하면서 달성군민분들에게 많은 사랑을 받는 현풍장입니다. 그런 현풍시장에 가면 도깨비 국밥...,2020. 5. 28.
"대구사찰 :: 고즈넉한 분위기의 암자, 도성암을 소개해드립니다 - 달성군 블로그 기자단...",스님께서 대구시 달성군 유가면 도성암에서 법랑 67세에 입적했다고 합니다 도성암 대웅보전 정면 사진입니다 이곳은 대웅보전 좌측에 위치한 삼성각입니다 대웅보전 좌측으로 삼성각이며 우측에는 승방입니다 대웅보전 앞에는 높이 246㎝의 탑이 조성되어 있습니다 조성 연대는 대구사찰 도성암의...,2020. 2. 14.
대구 가창 가볼만한곳 갤러리 느낌의 빈잔 카페,시계들로 인테리어를 해놓았는데 정말 멋스럽고 2층 계단을 올라갈때 기분이 시간여행을 떠나는듯한 기분마저 들게 하더라구요. 구석 구석 어느곳... 가창가볼만한곳 빈잔 카페는 수시로 갈듯합니다. 카페 빈잔 주소 : 대구 달성군 가창면 우록길 177-11 전화번호 : 0507-1483-7111 영업시간 : 11:00~21:00,2021. 7. 13.
대구 달성군 코로나19 일반시민 확진자 가족은 자가격리 해제까지 최장28일.그...,#대구코로나현황 #대구달성군코로나 #자가격리해제 #자가격리해제기준 #코로나확진자가족 #일반시민우선 #신천지 또한. 늘어나는 코로나19의... 먼저 자가격리를 하는 경우는 우한등의 코로나19 발생지역 인근 해외여행을 다녀온 사람을 기준으로. 입국시 발열등의 코로나증상이있는 사람과...,2020. 3. 3.
대구 걷고 싶은 길! 옥연지 송해공원,"푸른하늘과 산이 배경이 되고, 옥연지 물가에 세워진 풍차의 경치는 기분을 차분하게 해주네요 주차장에서 천천히 걷다보면 여러개의 조형물과 꽃밭이 있는 이곳은 대구 여행코스였던 송해공원입니다 '송해'의 명칭은 그분이 달성군 명예군민이며 처가동네여서 붙이게 됐다고 하네요 대형...",2021. 4. 27.
[고령 여행] 낙동강 뷰 맛집 '다산문화공원' 즐기는 힐링 산책,사문진교를 두고 대구 달성군과 고령군의 경계지점에 다산문화공원이 있습니다. 사문진교를 중심으로 낙동강 건너 화원 사문진 주막촌과 유람선이 선 선착장이 다신문화공원과 마주하고있습니다. 다산문화공원은 크게 화려한 꾸밈이나치장을 하지 않고도 계절의 추이에 자연스럽게 가을이 서서히...,2021. 9. 30.
"[아이와 함께 대구근교 여행] 창녕 부곡 그랜드 온천호텔, 가족탕으로 추천","나 어릴 적, 추억의 장소 부곡하와이ㅎㅎ 하와이란 명칭 때문에 머나먼 휴양지 느낌을 주지만 사실 부곡은 경남 창녕군 부곡리에 위치한 곳으로 대구와 아주 가깝다 ㅋ 대구 달성군과 창녕군은 붙어있잖아. 대구 근교다. 한때 잘나갔던 부곡 하와이가 역사의 저편으로 사라지고 잊혀져갈 무렵...",2021. 10. 8.
평이 좋은 곳만 모아본 대구 맛집 리스트,좋은 재료를 이용하여 음식에 정성을 다하는 곳이라고 해요 빈티지하면서도 레트로 느낌이 가득해서 마치 일본 여행을 다녀온 듯한... 에이엠 다사점 주소 : 대구 달성군 다사읍 대실역남로 18 2층 영업시간 : 10:00 ~ 22:00 전화번호 : 053-584-6837 메뉴: 숙성 꽃갈비 팬스테이크 32900원...,2021. 4. 12.
대구 능소화 명소 남평문씨본리세거지 사진찍기 좋은 곳이지요,지난 6월말쯤 어느날에 대구관광기자님들과 함께 대구 달성군 여행으로 이 곳에는 약 10분 정도 머물렀던 듯 ㅋㅋㅋ 올해 봄인가 대구 남평문씨본리세거지에 문익점 선생 동상이 세워졌지요. 이제 이 곳에 오면 중심에 동상이 있어서 왠지 상징물이 된 거 같은 느낌도 들구요. 문익점 선생의 행적도...,2020. 7. 4.
대구간판 / 달성군간판 / 현풍 엄마의부엌 갈바 재생간판 시공 및 후기~!,고객만족도 200% - 몬스터디자인 - 안녕하세요 몬스터디자인입니다 얼마전 시공완료된 대구 달성군 현풍 갈바 재생 간판 입니다! 이번 현장은 간판은... 아래의 사진은 항상 서구 몬스터디자인 에서 항상 보여주는 미리 보는 시안 입니다 ^^ 자 그럼 오늘도 고부장이랑 떠나는 포스팅의 시간 여행을...,2020. 3. 18.
대구 글램핑 겨울에 즐기는 카라반 !,이런 저런 환경 때문에 못 간다 ~ 라고 생각했는데 막상 다녀와보니 불편할만한 것들이 없었어서 간편히 떠나는 여행으로 딱 좋았어요. 여름엔 여름... 추천드립니다 >ㅁ< 주소 : 대구 달성군 옥포면 옥포로 111길 95-17 전화 : ***-***-**** #대구글램핑 #오투글램핑 * 본 포스팅은 소정의 원고료를 받고 작성...,2021. 1. 12.
대구 감성 캠핑⛺ (feat. 비슬산 자연휴양림),"오늘은 그중 대구에서 만나볼 수 있는 감성 여행, 비슬산 자연휴양림에서 보내는 캠핑을 소개해 드리려고 합니다. 그럼 지금 함께 산속 캠핑장으로 떠나보실까요? 비슬산 자연휴양림 캠핑장 *본 촬영은 철저한 방역수칙 하에 진행되었습니다. 아직 벚꽃이 지기 전인 4월 초, 달성군 산자락 속에...",2021. 4. 29.
"대구 코로나 백신 2일차 후기,노쇼 물량 사전예약방법, 일반인 접종",해외여행 계획이 있으신분들도 많이 신청해서 맞으신다고해요 저는 버려지는 백신이 아까워서 맞은 경우고요 ㅎㅎ 오늘 저한테 어떻게... 롸잇나우 하기위해...대구 달성군 논공에 있는 열린중앙병원을 간겁니당 대기안하고 당일날 바로 맞고싶으신분들은 수고스럽지만 저처럼 여러군대...,2021. 5. 2.
달성군 엔엘리오(enelrio),#대구카페 #달성군카페 #논공카페 #엔엘리오 #enelrio #논공엘엔리오 #카페투어 #카페리뷰 #디저트카페 #달성보카페 #달성보 #낙동강뷰 #낙동강뷰카페 #뷰카페 #카페추천 #현풍카페 #뚜벅이리뷰 #대구드라이브 #대구여행 #대구가볼만한곳,2021. 6. 28.
대구사찰 :: 사계의 풍경이 아름다운 천년고찰 용연사 - 달성군 블로그 기자단 정영옥,제539호인 달성군 용연사 금강 계단과 보물 제1813호로 지정된 대구 용연사 목조 아미타여래 삼존 좌상 및 복장 유물 경상북도 문화재 자료 제28호인 용연사 삼층석탑 그리고 용연사 부도군 등이 있습니다 대구사찰 용연사 주차장에 도착하니 일주문(비슬산 용연사 자운문)이 있는데 이곳을 지나...,2020. 2. 7.
대구캠핑장추천 :: 아름다운 자연 휴식공간... 소개합니다. - 달성군 기자단 윤아정,비슬산 오토캠핑장은 달성군민 할인을 받고 이용이 가능합니다. 대구의 대표 캠핑장에서 행복한 추억을 만들어 보시는 건 어떨까요? ☆비슬산자연휴양림안내★ 코로나19로 인한 지역사회공헌과 지역경제 활성화를 위해 달성군 내 소상공인과 기업 종사자분들께 달성군민과 동일한 할인율을...,2020. 7. 22.
대구산책코스 :: 탁 트인 풍경이 아름다운 달성보 - 달성군 블로그 기자단 김대식,달성 이웃 여러분:-) 오늘은 달성군 논공읍 하리에 위치한 달성보를 찾아서 주변 시설을 알아보고 산책 코스도 알아보겠습니다 참고로 달성보는... 다리입니다 대구 방향의 풍경을 파노라마로 촬영해 봤는데 장애물이 없어서 가슴이 탁 트이는 시원한 느낌이 듭니다 특히 저녁 무렵 조명이 들어 올...,2020. 2. 10.
대구 캠핑장 카라반에서 하룻밤,"올해는 유독 제대로 여행도 못가고,논 추억도 없는거 같애요 ㅠㅠ 대구 달성군 옥포면 옥포로 111길95-17 053-616-1844 http://www.ㅇ2glamping.co.kr/ 계절의 변화가 새삼 너무나도 예쁘기만 한거 잇죠..ㅎㅎ 이렇게 올해를 보내기에는 너무나 아쉬워서 근교 대구 캠핑장 이라도 찾아서 캠핑하러 가야겠다는...",2020. 10. 17.
