header,contents,date
부산가볼만한곳 황령산에서 새로운 부산 야경을 발견하다,보니까 부산 토박이 분들에게는 익숙한 야경 명소였나 봅니다 부산가볼만한곳 황령산은 427M로 남구 수영구 연제구 부산지구를 걸쳐있는 금련산... 부산이색데이트 코스 추천 #부산가볼만한곳 #부산여행 #부산놀거리 #부산이색데이트 #부산관광 #부산1박2일여행 #부산맛집 #부산데이트코스 #요트...,2020. 12. 11.
부산 무한리필 초밥 연산동 갓파스시 회전초밥 완전 추천,"부산 연제구 반송로 44 / 지번연산동 590-5지도보기 금요일 11:30 - 22:00 평일 11:30 - 21:30 토요일 11:30 - 22:00 일반 런치 19,800원 일반 디너 24,800원 초등학생 16,800원 유아 5,000원 메뉴판(원산지) 이미지로 보기 이용시간은 80분입니다 부산 여행중이에요 지금은 전국적으로 비가와서 일정이 미리...",2020. 7. 31.
"여행 다이어리, 왁스페이퍼캔들 부산 꼬밀레공방","kkomile 코로나로 여행가고 싶어도, 못가고 계신분들 많으시죠?? 그래서, 선생님과 여행가고 싶은 마음 가득 담아, 여행기록 다이어리를... < 수업문의 및 위치 > 문자 or 전화 : *** **** **** Kakao talk : kkomile ㅣ Instagram : kkomile 부산시 연제구 과정로 192번길, 10 1F (토곡사거리...",2020. 7. 5.
"부산을 떠나기전, 부산 현지인 추천 맛집투어",같아요 부산을 떠나오기 전에 한번도 가보지 못한 여수와 부산에서 가까운 경주여행을 떠나는게 목표였는데 둘다 못했구요 ㅋㅋㅋㅋㅋㅋㅋ... 국제밀면 부산 연제구 중앙대로 1235번길 23-6 요긴 신랑 덕분에 알게된 부산 국제밀면! 연애할때 자주 왔었는데 여기도 애들이 못먹으니 안와지게...,2020. 1. 10.
부산 지역 방화문 시공과 수리를 전문으로 공사하는 대동철물금속 입니다.,부산 연제구 연산동 가게의 방화문 교체 시공 현장 02. 부산 연제구 연산동 가게의 방화문 공사 현장 03. 부산 연산동 방화문 수리 공사 현장 위의... 연차를 내고 해외여행을 가던 모습들도 찾아보기 어렵습니다. 근6개월만에 우리 생활에 많은 변화가 찾아왔습니다. 변화들에 슬슬 적응도 하고...,2020. 6. 26.
조상을 대우하라는 이유 부산용한점집 대구용한점집,광안리점집 #부산해운대점집 #연제구점집 #박수무당 #연제구용한점집 #동래구용한점집 #수영구용한점집 #해운대구용한점집 #해운대용한점집... 누가 알아주지 않는 여행사분이 계셨습니다. 이분은 피가나도록 운동화가 닳을 정도로 여기저기 돌아다니셨던 여행사분이신데.. 정말 안되겠습니까?...,2021. 10. 10.
부산 대신동 전차카페 - 옛 부산에 다녔던 전차를 추억하는 카페,2001년 연제구 거제동에 부산아시아드주경기장이 생기기 전까지는 부산지역 스포츠의 메카로 자리매김했던 곳입니다 원래 구덕야구장도 있었지만... 지난번 부산여행때 와보고싶은곳이었지만 시간상 못가보고 이번에 방문했습니다 부산시내를 달렸던 전차를 기억하는 카페라는 특색이 정말...,2021. 7. 9.
부산샐러드맛집 뱃살도둑 샐러드&과일 연산점,샐러드 배달 맛집이 바로 요깃네 작은 테이크아웃 샐러드 전문점인 줄 알았는데 내부에 테이블도 많고 넓어서 놀랐어요 뉴욕 여행할 때 딱 이런... 집 근처 부산샐러드맛집이 생겨 좋네>_< 앞으로 운동 전후로 자주 애용할 거 같아요 & 부산 연제구샐러드 뱃살도둑 주소 : 부산 연제구 중앙대로 1111...,2021. 7. 5.
"부산웨딩떡,부산결혼식떡,부산회사답례떡,부산선물떡,연산동떡집,거제동떡집,연제구떡집",요즘은 결혼식도 많이 연기되고 하시더라도 신혼여행을 못가시니 바로 회사로 출근하신다고 하시더라구요. 그래서 답례떡을 준비해드렸습니다. 구성은 단호박떡과 영양떡 구성이에요. 200세트 준비해드렸습니다 ^^ 감사메시지 부착해서 깔끔하게 준비해드렸습니다. 받으시고 이쁘게 잘...,2020. 5. 21.
[부산바오밥수제도시락] 9월 26일 거제동성당 배달도시락입니다.,"부산수학여행도시락 #부산현장학습도시락 #맞춤도시락 #부산수제도시락 #단체도시락 #샌드위치 #김밥, #유부초밥 #부산연제구도시락 #부산진구도시락 #부산사하구도시락 #부산도시락 #부산북구도시락 #부산화명동도시락 #부산연산동도시락 #부산제사음식 #부산제수음식 #부산설음식...",2021. 9. 26.
부산을 한 눈에 다 볼 수 있는 명소 방문기,여기 뒤 편에 보이는 야경은 부산의 서면과 그 근처입니다. 부산진구쪽입니다. 5. 이 사진은 부산의 연제구라는 곳입니다. 부산 시청과 경찰청... 혹시 부산 여행을 좀 길게 일정을 잡으셨다면 꼭 여길 와보시길 바라용. 낮에 와서 구경한다면 광안대교와 부산항 대교를 바다와 함께 .. 푸르게 볼 수...,2021. 2. 13.
[부산3편]부산의 학군대장은 누굴까~?_부산광역시 동래구 사직동 (Feat. 연제구 거제동...,"부산 사직동 생활권은 동래구 사직동 + 연제구 거제동(일부)이다. 거의 느낌이 비슷하며 학원가와 상권이 아이들 + 학부모 위주로 되있다 동래구... 만약, 거제동이나 사직동쪽에 실거주 집을 구하실 분들이 있으시면, 꼭 이 지역을 2번정도 가족들이랑 같이 여행겸 돌아보는걸 추천한다. 사직동의...",2021. 2. 14.
부산분위기좋은술집 그린애플,사이드에 감자튀김 있더라구요 그땐 감자튀김 필수 주문 ㅋㅋ #부산레스토랑 #연제구맛집 #부산맛집추천 #연산동술집 #연산동맛집 #부산데이트 #부산분위기좋은술집 #부산여행 주소 : 부산 연제구 반송로 62-17 그린애플 (연산동 589-23 그린애플) 전화 번호 : 0507-1337-7655 영업 시간 : 월~토 18:00 ~ 01:00...,2021. 9. 30.
[부산바오밥수제도시락] 10월 8일 부산과학기술대학교 배달도시락입니다.,"부산수학여행도시락 #부산현장학습도시락 #맞춤도시락 #부산수제도시락 #단체도시락 #샌드위치 #김밥, #유부초밥 #부산연제구도시락 #부산진구도시락 #부산사하구도시락 #부산도시락 #부산북구도시락 #부산화명동도시락 #부산연산동도시락 #부산제사음식 #부산제수음식 #부산설음식...",2021. 10. 8.
부산 고등어회 :: 고등어다찌 연산본점,"안녕하세요 현주는여행중 블로그 주인장 현주입니다 이웃님들은 고등어를 활어회로 해서 드셔보셨나요? 저는 고등어구이로 생선을 먹어봤지... 부산 연제구 고분로31번길 26 부산 연제구 연산동 621-17 매일 16:00 - 03:00 연중무휴 부산 지하철 1,3호선 연산역 10번 출구에서 가깝습니다",2021. 9. 20.
부산 빵지순례 필수코스 '디저트시네마' 내돈내산 후기,디저트시네마 주소 : 부산 연제구 쌍미천로 32-1 영업시간 : 주말 12:00 ~ 소진시 까지 & 마지막주 수요일 12:00 오픈 ~ 소진시 까지 주말이랑 마지막주 수요일만 오픈합니다! ♡ 참고참고 여기가 아마 연산6동 이지요! 물만골 지하철역에서 가깝습니다 골목안에있오요 >.< 골목 안에있어도 맛있는 집은...,2020. 7. 6.
"[부산 관광] 일몰제와 도시공원, 부산시 공공 토지 비축 사업 ('공공의 공간'이 있나요?)","할 부산여행 15곳) 책자 기준 해운대 서면, 전포 카페거리 비프광장, 용두산공원 국제시장, 자갈치 시장 동백섬, 마린시티 센텀시티... 대항공원 -금정구 부산묘지공원 -기장군 달음산공원, 완충녹지 -해운대구 동백유원지 -(수영구, 남구, 부산진구, 연제구가 모두 연관되는)...",2021. 8. 26.
부산 시청 술집 안주 맛집 야타이미세,야타이미세 부산 연제구 고분로13번길 62 ***-***-**** 야타이미세는 부산 시청이랑도 가깝지만 연산역에도 가까이 위치해 있었어요. 이자카야의... 입점된 부산 시청 술집 이라고 해요. 테라생맥주 말고도 주종이 다양해서 취향에 맞게 즐기실 수 있으실거예요. 선반에는 일본 여행을 좋아하시거나...,2020. 4. 23.
[부산 시청 맛집] 구워나와서 편하게 먹을 수 있는 장어구이 맛집 ‘진성횟집’,무더운 여름에 지친 기력 회복을 위해 다녀 온 부산 시청 뒤 거제시장에 있는 ‘진성횟집’에 다녀왔어요! . . - 주소 : 부산 연제구... ⬇️⬇️ 진성횟집 위치 ⬇️⬇️ #진성횟집 #부산진성횟집 #거제시장맛집 #부산시청맛집 #거제동맛집 #부산장어구이맛집 #부산장어구이 #부산맛집 #부산여행...,2021. 9. 25.
부산기장군우울증 연제구 과호흡 야간진료,"#부산기장군우울증 1인당 연간 20회 추나 건강보험 적용이 가능합니다. . . . . . 교통사고 상해는 차량이 앞에서, 옆에서, 뒤에서 받혔느냐에 따라... 족저근막염은 운동을 즐기는 스포츠인이나 여행 중 많은 거리를 도보로 이동했던 사람에서 쉽게 찾아볼 수 있습니다. 족저근막염은 그냥 방치하게 되면...",2021. 3. 18.
부산 꼼장어 맛집 시청근처 머구리,"머구리 부산 연제구 연산동 거제천로 104번길 3 051-987-8865 머구리 산꼼장어는 연산동 시청 뒷라인에 있는데요, 검색창에 머구리를 검색해 보니까 머구리의 뜻이 바닷물속에서 물고기나 해산물을 잡는 잠수부의 의미였네요. 가게의 이름을 알고 나니 제가 먹고 온 꼼장어 외에도 다양한 해산물들이...",2020. 9. 2.
부산 카페 추천 카페오미니 갈때마다 반하고 오는 카페,주문하시면 됩니다ㅎㅎ 커피땡기시는분들은 카페오미니 가서 시원하게 한잔 드시면서 여유 한번 느끼고 오세요ㅋㅋㅋㅋㅋㅋ 부산 카페 추천 합니다 ! 부산 카페 추천 카페오미니 지도 주소 : 부산 연제구 중앙대로1043번길 34 상가 103호 영업시간 : 평일 07:30~22:00 주말 09:00~21:00 전화번호 : 051-715-2351,2020. 8. 31.
소품샵 와장창 털러간 3박 4일 부산 여행 ①,"2021.05.14~05.17 ✈️ 과제폭탄시기에 떠난 우당탕탕 부산여행 무려 과제가 대대대대 폭발했던 시기에 다녀온 3박 4일 부산 여행 일기 -! 써야지... 몬해 부산 도착하자마자 미우한우가서 짠 -! 오마이 아부이가 추천해준 연제구 맛집 때깔 me쳤다 ,,,, 지금 글 쓰는데도 침 질질나옴...",2021. 8. 2.
시티 호텔 :: 서면과 가까운 연산역 5분거리/가성비호텔! 부산여행 완전 만족숙소 후기,아르반 시티 호텔 위치 : 부산 연제구 반송로 2 공항에서는 지하철로 30분정도! 연산역 12번 출구에서 5분거리! 서면에서는 택시타고 안막히면... #부산 #부산여행 #부산숙소 #부산호텔 #서면호텔 #부산가성비호텔 #부산가성비숙소 #부산숙소추천 #부산호텔추천 #부산숙소후기 #부산호텔후기,2020. 10. 11.
[부산 코로나19]부산의료원폐쇄/베트남다녀온 40대남성사망/부산연제구/부산의료원...,"안녕하세요 오늘 오전 베트남 여행을 다녀온 40대 남성이 가슴 통증을 호소해 부산의료원 응급실로 옮겨졌으나 20분 만에 사망해 응급실이 폐쇄됐습니다 보건당국은 사망한 남성이 발열 증세는 없었지만 코로나 19 검사 결과 '음성'으로 판정이 났습니다 사망원인은 ""코로나 19가 아니었고...",2020. 2. 17.
"부산 연산동 꽃집 원데이클래스, 아뜰리에이브아","아뜰리에이브아 • 시간 : 11:00~20:00 • 휴무 : 매주 일요일 • 주소 : 부산 연제구 중앙천로 25번길 78 • 전화번호 : 051-851-8785, ***-****-****... (❛ ֊ ❛„) 연제구 꽃집 아뜰리에이브아는 포토존도 예쁘고 인테리어 곳곳이 선생님의 정성과 감각으로 남다르더라구요. 소품들은 여행가거나 발품 팔아서...",2020. 2. 18.
"[부산여행 ④] 밀면 맛집 ""국제밀면"" 솔직 후기","바야흐로 3년 전, 한여름 #부산여행 갔을 때 아주 맛집으로 유명하다는 밀면집을 찾아가 땡볕에 30분넘게 줄서서 먹었던 밀면이 겁나 맛없었던... 국제밀면 동절기(10월~3월 ) am10:00 - pm8:00 하절기(4월~9월) am10:00 - pm9:00 ↘ (마감시간 pm8:30 전후) Tel : ***-***-**** 주소 : 부산 연제구 중앙대로 1235번길 23-6...",2020. 12. 31.
부산 카페 추천 빵이 맛있는 카페오미니,"부산 카페 추천 카페오미니 부산 연제구 중앙대로1043번길 34 시청역SK뷰 근린생활시설 1층 051-715-2351 평일 07:30 - 22:00 주말 09:00 - 21:00 연산동카페 카페오미니 위치는 지하철1호선 7호선, 시청역 SK뷰 아파트 1층상가에 있어요. 주말에 지하 상가주차장 이용했는데 아직 주차요금은 받지 않더라구요...",2020. 8. 19.
"[부산시청고기집] 산청흑돼지 , 삼겹살과 생선구이가 꿀맛",우리 잘 이겨내서 맛집도 많이가고 여행도 많이가는 시절을 꼭 다시 찾아요 [부산시청고기집] 산청흑돼지 부산시 연제구 거제대로 118번길 37 ***-***-**** #부산시청고기집 #산청흑돼지 #부산시청밥집 #부산시청맛집 #부산산청흑돼지 #연제구산청흑돼지 #모듬생선구이 #구워진삼겹살,2020. 8. 30.
[부산/토곡] 부산 점심맛집 '청담' 보리굴비정식,"안녕하세요 :) 요즘 걷는데 꽃혀서 안락동까지 엄마랑 산책을 했는데욥, 안락동까지 간 김에 안락동 점심맛집에 들러 보리굴비정식을 맛보았답니당 :) 여긴 작년에 저희 상견례도 한 곳이에요 ^^ 청담 주소 : 부산 연제구 연안로 1 ( 부산 연제구 연산동 419-5 ) 영업시간 : 매일 11:30 - 22:00 명절 휴무...",2020. 4. 9.
내맘대로 만들어본 부산 맛집 리스트,때문에 끓일수록 진해져 가는 깊이는 먹어본 사람만이 알수가 있어요. 양도 푸짐하기 때문에 식사와 함께 즐기기에도 좋은 메뉴 입니다. 개인적으로 제가 좋아하는 부산 맛집들을 소개 하였는데 앞으로도 더욱 맛있는 곳들을 찾아낼수 있도록 노력하겠습니다. 주소 : 부산 연제구 거제천로 57,2020. 8. 21.
"8824-294 연산동 복집 연산동밥집, 교대밥집, 부산여행, 교대복집, 거제역, 교대역...","연산동쪽에 괜찮은 복집이 있다고 해서 추천받아 갔죠 이름은 복돌복순 (누나가 이름이 재밌다고 하시는~~^^) 복돌복순의 위치가 재밌는것은 거제역, 교대역, 연산역 삼각형의 가운데 있습니다 ^^ 꼭지점을 모아 모아온곳 연제구 거제천로 191 1층 868- 8291 마침 근처에는 큰누나 회사도 있어서 겸사 겸사...",2020. 11. 6.
연산동카페 부산애견동반카페 부산연산동카페 월월월 앳더 모먼츠,월월월 앳더 모먼츠 13:00 ~ 22:00 (휴무일 인스타에 공지) 주소 : 부산 연제구 쌍미천로84번길 6 전화 : 0507-1334-6576 주차 : 가능 (전용 주차장 있음) https... 그리고 카페 뒤쪽에 이렇게 멋진 공간이 있답니다 여행 온 것 같죠 분위기 찍이네!!ㅎ 바람도 살랑살랑 불어오고 좋다~ 멀리 가지 않아도 자연 속에...,2021. 9. 30.
[부산바오밥수제도시락] 9월 23일 제약회사 픽업도시락입니다.,"부산수학여행도시락 #부산현장학습도시락 #맞춤도시락 #부산수제도시락 #단체도시락 #샌드위치 #김밥, #유부초밥 #부산연제구도시락 #부산진구도시락 #부산사하구도시락 #부산도시락 #부산북구도시락 #부산화명동도시락 #부산연산동도시락 #부산제사음식 #부산제수음식 #부산설음식...",2021. 9. 23.
"부산온천천맛집, 속시원한 '가온밀면' (연산동밀면/만두)",가온밀면 온천천점 주소 : 부산 연제구 신금로 10 ( 부산 연제구 연산동 345-5 ) 영업시간 : 매일 10:00 - 20:00 전화번호 : 070-7576-4845 온천천에서 가까운 곳에 위치하고 있어요 :) 혹시 차 타고 오시는 분은 매장 바로 앞에 도로 주차가 가능합니다 :) 노오란 간판이 눈에 띄는 밀면집 ! 가온밀면입니다...,2020. 5. 26.
[실버런 부산투어] 다크투어리즘 + 요트체험 등 이색체험 여행!,"한번 배우면 앞으로 여행이나 나들이 갈때, 언제든 나만의 영상을 만들 수 있는 노하우가 생길거에요! ▼ 신청 바로가기 (아래 링크를 클릭하셔서 신청해주시기 바랍니다.) ▼ 출발 집결 장소입니다. 카페 초록배낭 이야기 연제점 (부산광역시 연제구 월드컵대로 221)",2020. 9. 21.
여자들을 위한 부산여행클럽 '여성문화트레킹클럽' 회원 모집!(부산트레킹 I...,Busan Trekking club :: 부산여행클럽 여성문화트레킹클럽 여자들을 위한 부산여행클럽 '여성문화트레킹클럽' 새로운 취미나 여가생활을 찾고 싶은... 신청을 원하시면 아래 가입신청서를 작성해주세요:) - 보통 집결/도착장소는 '초록배낭이야기'입니다 (부산광역시 연제구 월드컵대로 221),2021. 1. 29.
부산 야경 황령산 봉수대,"부산가볼만한곳 추천 글 · 사진 | @뮤키(muki) ● ● ● 부산 여행 생각하면 늘 설렌다. 이번에는 '어떻게 계획하지~' 고민이 시작된다. 제일 먼저... 멋진 부산 도심 야경을 볼 수 있어서 더 좋다. 네이버 지식백과 찾아보니 황령산(427m)은 부산 도심지 산으로써 남구, 수영구, 연제구, 부산진구에 걸친...",2021. 1. 28.
(도서 소개) BUSAN(부산),Busanjin-gu·Dong-gu 부산진구 동구 08 Dongae-gu·Yeonje-gu·Geumjeong-gu 동래구 연제구 금정구 09 Saha-gu 사하구 10 Sasang-gu·Gangseo-gu·Bukgu 사상구 강서구 북구... 부산의 다양한 이미지를 담아 낸 이 책이 부산을 여행한 사람에게는 부산을 추억하게 하는 역할을 할 것이다 그리고 부산을 하지 못한...,2021. 5. 15.
"[부산 여행] 노을과 을숙도, 을숙도 문화회관, 을숙도 조각공원, 부산현대미술관...","부모 자식 건강하고, 밥 세끼 든든하게 먹고, 주말이면 가끔 여행하거나 외식할 수 있으면 만족하는 이 시대의 평범한 사람들의 모습일 것이다.... 부산대 건축학과 교수 ""올해 부산 분양시장 최대어로, '역대급 청약 전쟁'이 예고됐던 연제구 거제동 '레이카운티'가 부산의 분양사를 새로 썼다. 지난...",2020. 12. 16.
부산교대 카페 다미아 cafe DAMIA ʕ•ᴥ•ʔ 에그타르트 맛집,"빠잉 #부산카페 #교대카페 #부산교대카페 #부산에그타르트 #부산에타맛집 #부산타르트맛집 #부산타르트 #카페다미아 #다미아 #cafe_damia #연제구카페 #교대역카페 #거제동카페 #에그타르트맛집 #부산여행 #부산거제동카페 #거제동카페 #연제구카페 Mon-Fri 08:00-20:00 Sat, Sun-Holiday 11:00-18:00 매장 051...",2021. 3. 15.
[부산/거제] 가족 외식하기 좋은 '외식1번가 연제점',"안녕하세용 :) 요기는 집에서 가까워서 외식할때 자주가는 곳이에용 ~ 항상 사람이 북적거려서 사진찍기는 엄두도 못냈었는데, 요즘은 좀 한가하다보니 포스팅 하려고 사진 몇장 찍어왔답니당 외식1번가 연제점 주소 : 부산 연제구 월드컵대로 201 ( 부산 연제구 거제동 37-11 ) 업시간 : 매일 11:30 - 22...",2020. 4. 2.
황령산 야경 : 부산 야경명소로 항상 손꼽히는 곳 (부산여행/부산 가볼만한곳...,"여행개요 ◈ 여행일시 : 2021.06.26(토), 날씨:맑음(가시거리 양호) ◈ 여 행 지 : 황령산 전망대 - 부산광역시 연제구, 남구, 부산진구 ◈ 비 용 : 입장료 없음, 주차료 없음(연제구 연산동 산 181-22) 2. 여행지도 3. 여행이야기 한낮 황령산 산행을 마치고.. 늦은 오후에 주차를 해놓은 곳으로 되돌아왔다....",2021. 7. 16.
부산연산동맛집 등촌동샤브샤브 강추,충북 여행 마지막 날 부산으로 돌아와 얼큰한 국물로 해장하고 싶었던 우리 ~ 야식 친구 최애 음식 중 하나인 등촌샤브샤브 먹으러 가기로 결정... 부산연산동맛집 등촌동샤브샤브 부산본점 최종 목적지로 선정하였습니다 ^^ 등촌동 샤브샤브 부산본점 연산동맛집 ☆ 주소 및 전화번호 부산 연제구...,2021. 9. 20.
[부산연산동]양곱창 Is 뭔들,"양곱창 is 뭔들 바로바로 #현지인 맛집 #로타리양곱창센타 입니당 로타리양곱창센타 16:00~22:00 1,3째 일요일 휴무 주차창 ♀️ 부산 연제구 반송로 13... 알겠더라구용 #연산동 #로타리양곱창센타 #부산 #현지인맛집 #부산가볼만한곳 #부산맛집 #대창 #특양 #소창 #부산여행 #부산여행 #연산동맛집...",2021. 9. 14.
부산스포츠고글/부산안경싼곳 추천 `1001안경 연산로타리점`,"본격적인 여름의 시작이라 선글라스도 하나 준비해봐야겠는데, 여행 떠나기 직전에 가족들과 함께 와서 골라봐야겠어요. 다양한 스포츠 고글은... 전화번호 : ***-***-**** 주소 : 부산 연제구 중앙대로 1112 운영시간 : 09:30~21:00(평일) 10:00~21:00(주말) #부산스포츠고글 #연산동안경 #부산안경 #부산렌즈...",2021. 10. 8.
부산연산동카페 drip&trip 커피,주소:부산 연제구 연동로13번길 19 1층 운영시간:오전10시~오후8시까지 화요일은 휴무 시골에 작은 카페같은 외관 가는날이 장날이라고 문이... 나의 커피 후기 점수는 10점 만점에 10점 혹시 부산여행을 하시면서 커피를 좋아하신다면 꼭 추처드리고 싶음 나의 드립&트립 커피 후기는 여기까지...,2021. 9. 24.
부산여행. 10경. 가볼만한 곳. 명소 추천 베스트(1~4경). 해운대 오륙도. 주차장 가는 길....,부산여행. 10경(1-4경). 해운대. 광안리. 이기대 오륙도. 죽성성당. 용궁사. 부산알림이 부산 1경 해운대해수욕장 대한민국 1번지. 죽기전에... 부산 수영구 광안해변로344번길 19. 민락동 110-27 황령산 전망대주차장. 부산 연제구 연산동 산 181-22 ▶주변 : 수영강변 산책로. 카페 F1963....,2021. 1. 27.
부산 비 오는 날 당일치기 여행☂️ : 골든리지 시청점/ 부산 코스요리/ 빈티지 38 카페...,"주소 부산 연제구 신촌로 27 더리체 상가2층 201호-204호 영엽시간 평일 11:30 - 23:00 브레이크타임 15:00 - 17:00 주말, 공휴일 12:00 - 23:00 브레이크타임... 당일치기 부산 여행이였다☂️ 비 오는 날도 이렇게 행복하게 밖에서 데이트 할 수 있다니 암튼 오늘은 여기까지❤️♥️ #부산당일치기여행...",2021. 5. 15.
[국내여행/부산] 부산 2박 3일 자유여행 2일차,14(금) ~ 05.16(일) 부산 여행 2일차~ 홍쌤 집 근처 연산시장에서 간단하게 아침 먹고 출발하기로 했다. 샬롬푸드 부산광역시 연제구 월드컵대로 17 되게 쪼끄만 분식인데 나름 맛집으로 유명한 곳이라고 한다. 사실 친구는 떡볶이는 맛있는지 모르겠다고 했지만 생각보다 괜찮았다. 그냥 가래떡...,2021. 5. 23.
"부산 연산동 맛집 : 숯불수제꼬치에 테라생맥주 한잔, 야타이미세",부산 연제구 고분로13번길 62 전화번호 : ***-***-**** 부산 연산동 맛집 : 야타이미세 부산 연산동 맛집인 야타이미세는 포장마차 분위기를 살린 야끼도리 전문점이다. 가게가 포장마차 느낌이라 분위기가 새롭고 인테리어부터 소품까지 해외여행온 느낌이 들어 분위기 좋게 술마시기에 너무 좋은곳...,2020. 1. 20.
부산 역사 탐방 사적지,역사탐방을 위해 우리동네를 둘러보자✨ 부산에도 충분히 멋진 문화사적지가 있어 문화여행이 가능하답니다. 연산동 고분군 부산 연제구 배산의 능선에 있는 무덤이죠. 삼국시대의 고분 1천여 기가 모인 연산동 고분군이에요. 복천동 고분군 복천동 고분군은 부산 동래 마안산의 구릉에 있는...,2021. 10. 1.
부산 연산동 '동래정 소고기해장국' 혼밥,"찾는다면 연산동 동래정, 추천합니다 오늘도 열심히 혼밥 부산맛집 연산동동래정 부산동래정 동래정소고기해장국 부산제주식해장국 부산연산동맛집 연제구맛집 연산동밥집 연산동해장국 설하담 부산혼밥 연산동혼밥 연산동맛집추천 부산여행 은희네해장국 부산밥집추천 부산맛집리스트",2021. 8. 21.
연제구 거제동 가스보일러 설치 훈훈하네요!,"삼성화재 배상책임보험 가입 고객센터: 1566-5173 직통 상담 : ***-****-**** 부산 연제구 연산동 32평형 아파트 경동나비엔 친환경 콘덴싱 가스보일러... 전라도 여수 아쿠아플라넷 추천 요즘 여수가 핫 하다고 티비 , 인테넷 떠들어서 설전에 한번 아이데리고 한번 여수 밤바다 여행 다녀왔습니다. 아이와...",2020. 1. 29.
