header,contents,date
[경상남도] 부산 (2020.07.11) - 마! 이게 부산이다 Part I (ft. 아재 감성),근데 무홍이 말로는 그게 그거라고 하니 다음 목적지는 허심청 동래구가 온천으로 유명한데 그 중 가장 큰 목욕탕이라고 한다 내부로 들어가니... 그래도 항상 부산 와서 광안대교 보고 싶었는데 소원을 이루었다 부산여행 아재 4인방 갑자기 부산 어묵이 떠올라서 먹기로 했다. 가위바위보 진...,2020. 7. 13.
[부산] 210619,부산가래떡떡볶이 #부산분식 #다대포해수욕장 #부산해수욕장 #블루샥다대포점 #블루샥다대포 #다대포카페 #다대포맛집 #다대포오션뷰 #호텔농심 #농심호텔 #농심호텔비어가든 #비어가든 #부산호텔 #동래구맛집 #부산우정여행 #요가 #바닷가요가 #해변요가 #나타라자아사나 #핸드스탠드,2021. 6. 22.
동래구호텔 사직동 하운드호텔 미남역 이벤트객실 스낵바 기분좋은숙박,이렇게 동래구호텔 사직동 하운드호텔 미남역은 오랜만에 부산을 방문한 저희 일행에게는 편안한 휴식을 제공 받을 수 있는 공간으로 위생적이고 편안한 분위기로 호캉스 즐길 수 있는 편안한 분위기였어요 컴퓨터는 의자도 편해보이더라구요 여행을 가도 PC를 많이 사용하는 편인 진성 블로거인...,2021. 7. 26.
[부산 브라운도트 사직야구장점] 동래 모텔 호텔 모캉스 호캉스 추천 : 부산 여행 603호...,부산 브라운도트 사직야구장점 #부산여행 #부산호텔 #부산모텔 #부산호캉스 #부산모캉스 #부산이색데이트 #부산실내데이트 #부산숙박 #부산대실... 있어서 맛있는 저녁도 먹을 수 있음 부산 브라운도트 호텔 사직야구장점 추천 주소 : 부산광역시 동래구 사직북로13번길 11 전화번호 : 0507-1331-0513,2020. 9. 2.
부산도어락설치✨동래 안락SK아파트 코콤도어락 설치 후기,오늘은 부산 동래구 안락동에 있는 안락SK아파트에 코콤 디지털도어락 설치 후기를 소개드리겠습니다. 도어락 설치 전 안락SK아파트의... 멀리 여행을 가거나 집일 비울 때 이중으로 잠금하면 아무래도 불안함이 덜하겠지요^^ 도어락 앞부분은 터치하면 숫자패드에 불이 들어 와 비밀번호를 누르고...,2021. 3. 2.
부산 여행 투어 온천천 봄꽃 하트 벗꽃 유채꽃 수선화 홍매화 아름 다연 풍광 힐링...,#부산 #여행 #투어 #온천천 #봄꽃 #하트 #벗꽃 #유채꽃 #수선화 #홍매화 #매화 #아름다운 #자연 #풍광 #힐링 하시길 바랍니다. #동래구 #연제구 #동래역 #풍경스타그램 #꽃스타그램 #자연꽃스타그램 #힐링스타그램 #풍광스타그램 #고프로 #고프로라이프 #고프로패밀리 #GoProKR #GoPro #Busan #Korea,2021. 3. 24.
[부산하체집중관리/부산체형관리/동래하체관리]셀스타체형관리,여름 여행을 준비중이신 분 두꺼운 하체로 고민이 있으신 분 요새 피로도가 많이 쌓였다고 느끼시는 분 다리 미인 소리 듣고 싶으신 분 등... 안심매장] 부산 동래구에 위치한곳 #셀스타체형관리 예약번호 ***-****-**** 영업시간 평일 09:00~ 21:00 [마지막예약타임 8시] 토요일 09:00~16:00...,2021. 6. 21.
부산 시티 투어 토박이가 알려주는 여름휴가 정보와 맛집추천,휴가철이라 여름휴가계획 고민하시죠 여름하면 또 부산이잖아요~ 부산 토박이인 제가 여름 휴가철을 앞두고 부산여행 계획하시는 분들을 위해... 센텀점이에요 부산 시티 투어와 먹방리스트 순곱이네 동래본점 영업시간: 평일 11시~00시 (오후3~5시 브레이크타임) 주소: 부산 동래구 명륜로 103번길 3...,2021. 7. 20.
부산 동래 오노고로,"오노고로 주소: 부산 동래구 명륜로 150 1층 전화: 0507-1347-2015 영업 시간 일-목 11:30-23:00 (수요일 휴무) 금-토 11:30-24:00 브레이크타임 15시-17시... 부산 여행 가서 굳이 방문할 곳은 아니지만, 동래 근처에서 분위기 좋고 가격도 좋은 이자카야를 찾는다면 추천하는 곳! 별점 3.5/5",2021. 3. 24.
부산 동래 태국음식점 맛집 타이빈 세번째 방문 후기(feat. 주문 꿀팁과 메뉴판),"부산 동래 태국음식 맛집 타이빈 외관 넘 이쁘쥬?!!! 진짜 해외여행 못간지 2년이 넘어서 태국이 너무너무 가고싶은데 소소하게 타이빈에서 태국... < 주소 : 부산광역시 동래구 금강로73번길 12 T. 051-558-8885 영업시간: 11:00 ~ 22:00 브레이크타임 평일 15:00 ~ 17:00 브레이크타임 주말, 공휴일 16:00 ~ 17:00...",2021. 10. 5.
부산 데이트 코스 추천 분위기 좋은 부산 드라이브 야경 명소 7곳,"만덕고개누리길전망테크 부산 동래구 온천동 산153-8 세번째는 저의 최애장소ㅠ 요기도 아는 분 많이 없었는데 많이 알려져 요샌 차들이 엄청... ㅎㅎ 지금 당장 사랑하는 연인, 친구와 떠나세요 gogo #부산 #부산여행 #부산야경 #부산야경명소 #부산드라이브 #부산야경드라이브 #부산드라이브야경...",2021. 5. 23.
부산꼼장어거리 맛집 동래원조산꼼장어,안녕하세요 빵빵스블로그입니다 얼마전에 부산여행을 다녀왔는데 ! 미뤄왔단 부산맛집 리뷰해볼게용~ 부산동래에는 수안동 곰장어거리가... ***-***-**** 부산 동래구 명륜로98번길 42 매일 11:30 - 00:30 둘째주 일요일 휴무 외부에서도 메뉴판확인이 가능했어요~ 영업시간은 아침11시~밤11시로...,2021. 3. 28.
2021 부산국제영화제 기간 동네방네비프 오늘부터,10.12(화) 레미 : 집 없는 아이 인생 멘토와 함께 꿈과 가족을 찾아 떠난 소년의 아주 특별한 여행! 버려진 아이 레미는 거리의 음악가 비탈리스를... 고리에너지팜 동래구 : 복천동고분군 금정구 : 캠프스 디 연제구 : 부산아시아드주경기장 수영구 : 광안리해양레포츠센터 남구 : 부산문화회관...,2021. 10. 7.
망미단길 곰장어거리 오륜맛고을 골목상권 활력증진사업 모집공고!,부산경제진흥원 공식 홈페이지에서 확인해주세요 사진을 클릭하면 홈페이지로 이동합니다 #부산경제진흥원 #망미단길 #곰장어골목 #오륜맛고을 #수영구 #동래구 #금정구 #부산여행 #부산관광 #골목상권 #부산골목 #정보 #공유 #팔로우 #좋아요 #맞팔 #선팔 #환영 #공유 #서이추 #서이추환영,2021. 7. 30.
[부산맛집] 밀면좋아하는분 고메밀면으로 오세요,"먹었지만 해물,들깨칼국수와 갈비탕, 매운갈비찜도판매하고있었어요 취향대로 골라먹을수 있겠죠?? 다음 부산여행가면 또 만나자! 고메밀면 ***-***-**** 부산 동래구 충렬대로378-1 매일 10:00~21:00 #부산밀면 #부산밀면맛집 #동래밀면 #동래밀면맛집 #안락동밀면 #안락동밀면맛집 #고메밀면 #밀면맛집",2021. 6. 28.
"[광역시 일주]부산광역시 순환일주 Part2(With 청사포,울산)","2017년에는 동래구에서 출발을 했으나 2020년의 리바이벌 시내버스여행은 서면에서 출발을 합니다. 1.서면한전▶자갈치시장,남포동비프광장 삼성여객 5-1번[회동동~반여동~수영역~서면~충무동] 출발-(11:00)/부산광역시 부산진구 부전2동 도착-(11:21)/부산광역시 중구 남포동 거리-8.28/요금-1200원...",2021. 9. 15.
부산디저트카페 추천 - 동래역카페 레스베러 솔직후기,"레스베러 레스베러 ***-****-**** 부산 동래구 충렬대로 173 2층 1,4호선 동래역 2번 출구에서 135m 매일 12:00 - 21:00 라스트오더 20:00 주차는 동래역... 모두 창가에 있어서 햇빛이 잔뜩 들어오는 곳이라 나른하게 수다 떨거나 책 읽거나 여행계획 짜기 좋아요. (제 뒤에 앉으신 분도 여행계획 짜고...",2021. 4. 6.
[동래구미용실]가을맞이 염색추천 퍼플애쉬,제주도여행 부산염색잘하는곳 부산옹브레염색 부산옴브레염색 부산발레아쥬 발레아쥬 옴브레 부산솜브레 레이어드컷 레이어드펌 남자아이롱펌 아이롱펌잘하는곳 비긴더듬이염색 앞머리염색 수영구미용실 광안리미용실 광안동미용실 남자펌 셀프다운펌 다운펌 남자가르마펌...,2020. 9. 12.
부산 경남 안면인식 열측정 마스크 착용여부 안내 열화상 카메라 렌탈 및 판매,필요하지 않은 여행 자제하기 일반 국민 행동 수칙을 잘 준수하여 빠른 시일내에 코로나로 부터 벗어나도록 노력해 봅시다! 이번엔 부산 동래구에 위치한 충렬사에서 슬기로운 방역생활에 문의를 주셨답니다. 부산 경남 안면인식 열측정 마스크 착용 여부 안내 열화상 카메라 렌탈 및 판매...,2021. 6. 9.
아직 부산에 도착하지 않았다 - 향후 나의 인생,"1995년, 부산광역시 동래구 온천동에서 태어나 4년을 사직동에서 성장한 이후 1999년에 포항시로 이사를 갔다. 이후 무려 22년째 포항에 주소를 두고... 즐겁게 여행을 다니며 대한민국의 국토와 자신의 지역을 자랑스럽게 생각하고 삶의 질을 높여나갈 수 있게 도와주는 행정가가 되고자 한다. 또한...",2021. 1. 3.
"회사답례떡,어버이날떡,부산카네이션떡,연산동떡집,연제구떡집,동래구떡집,스승의날선물",5월연휴라서 많이들 여행가셨지요? 거리에 사람들이 여유로워 보입니다. 연휴가 길어서 그런지 지난주부터 가족모임이 많은것 같아요. 카네이션설기를 많이 해드렸네요. 카네이션설기 사진을 올려봅니다 ^^ 영양떡과 카네이션설기 같이 구성하고 싶다고 하셔서 같이 2박스...,2020. 5. 4.
동래구다한증 수영구 손발다한증 치료,"불과 얼마 전 제가 이탈리아 중남부 지역을 여행하면서 잠시 들렀던 오르비에또의 여운이 가시지 않은 상태에서 이번 강의는 제게... 부산동래, 부산연제구 지역에서 안면비대칭, 손목터널증후군, 거북목, 아킬레스건염, 무릎통증 등 다양한 문의를 주고 계십니다. #동래구다한증 © duminda...",2021. 7. 2.
부산사직동횟집 삼천포횟집,여행이든 나들이든 한참 다니고 있었을텐데 ㅠ 아쉽지만 그 마음 뒤로 하고 기분전환 겸 간단하게 가족손 잡고 좋아하는 회 한접시 먹으러 가보았습니다. 부산사직동횟집 중 제가 좋아하는 곳. 이미 알려져서 사람들 많이 찾는 삼천포횟집입니다. 부산사직동횟집 삼천포횟집 부산광역시 동래구...,2021. 8. 1.
부산 맛집 동래빅오,#빅오 #부산빅오 #bigo #동래맛집 #동래빅오 #생면파스타 #수제생면 #생면공방 #피자맛집 #파스타맛집 #부산맛집 #부산 #맛집 #동래파스타 #동래스파게티 #동래스테이크 #예쁜레스토랑 #생면 #생일 #데이트 #맛집 #부산가볼만한곳 #복천동맛집 #동래구맛집 #여행 #파스타 #맛집탐방 #맛집스타그램...,2020. 12. 12.
매력 돋는 부산대 맛집,가장 추천하는 오키나와키친 미도우 그리고 이곳저곳 부산여행에서 추천하는 음식점과 기억에 남는 곳들 이웃님들께 소개합니다! 얼마 전... 부산해양자연사박물관 부산 동래구 우장춘로 175 바다로 둘러싸인 도시이기에 문화체험도 빠질 수 없다 생각해 들렀던 이 곳은 - 사이버 기술을 통해...,2020. 9. 6.
부산 동래시장 먹거리_족발 횟집 순대 신가네,부산 동래시장 맛집 먹거리 둘러보기 위치 : 부산 동래구 동래시장길 14 동래시장 영업시간 : 평일 08:00 - 20:00 안녕하세요 세미슐랭입니다. 오늘은... 혹시 여행하시며 동래시장을 찾아보시거나 동래 주민분들에게 작게나마 도움이 되었으면 해서 간단하게 포스팅해봤어요! 오늘도 끝까지...,2020. 9. 14.
부산야경/부산여행/만덕고개,곳곳에 카페들도 있어요 잠깐 들려서 카페는 안갔긴 하지만 다음에 가게되면 글올릴께요ㅎ 끝으로 만덕고개 였습니다. 길이 어두우니 차조심하세요 안전이 가장 중요합니다. #동래구 #만덕고개 #부산야경 #부산여행 #부산가볼만한곳 #드라이브,2020. 9. 21.
부산 안락동 맛집 멸치가살아있는국수 - 역대급 가성비 전복+가리비 매생이굴국밥,부산 동래구 충렬대로457번길 72 ▶지번 : 부산 동래구 안락2동 465-1 ▷교통 : 동해선 원동역 1번 출구에서 955m ▶기타 : 유료 화전주차장 #안락동맛집 #멸치가살아있는국수 #매생이굴국밥 #굴국밥 #부산맛집 #부산가성비맛집 #부산여행 #맛끝맛집 #맛끝안락동 #맛끝굴국밥 #맛끝매생이굴국밥,2020. 12. 3.
부산 + 거제 여행,"태종대등대까페 부산은 어릴 때 수학여행과 업무차 당일로 잠깐 다녀온 게 전부라 그동안 부산과는 정말 인연이 없었네. 멀어서 자주 갈 수 없어... (공영 주차장도 공사 중이라 주차비 무료) < > "" "" & 동래구에 있는 해양자연사 박물관. 또 비가 내리기 시작해서 아이들에게 선택권을 줬다. 해양...",2020. 8. 1.
산림청 세번째 국가자격증 완료(숲길등산지도사)-부산 온천장 류태현동물병원,12 경북 고령 대가야수목원 대구등산학교 숲길등산지도사 1일 졸업여행 숲을 사랑하는 사람들 좋은사람들 *** 거의 매일 수업이 있는 빡빡한... 위하여 전진 사람은 누구나 자기 스스로 발견한 길을 가야 한다. 그래서 자기 자신의 꽃을 피워야 한다. -by 법정 부산 동래구 온천장 류태현동물병원,2021. 7. 7.
부산용한점집 이제라도 알아서 다행입니다,친구는 답답하고 해결이 안되기도 하지만 뭔소 속이 시원하면 좋겠다고 해서 부산에서 지금 생활을 하고 있는데 찾았다고 여행할겸 오라고해서... 부산광역시 동래구 사직동 여고북로 46번길 10 1층 전화번호 ( *** **** **** 원고료 제공받아 작성된 솔직한 후기랍니다!,2021. 9. 9.
한끼로 좋은 부산 사직동 맛집,몇주전 부산에 친구들과 짧은여행을 다녀왔어요 이리저리 놀러를 다니다가 지인이 추천했던 부산 사직동 맛집을 갔었는데요 ~ 고급스러운... 주소: 부산 동래구 사직로 50 사직야구장 바로 건너편에 위치한 부산 사직동 맛집은 야구 경기 보고 난 뒤에 식사하러 오기 좋았는데요 부산3호선 사직역 1번...,2020. 3. 9.
[부산여행]부산 해운대 도심속 해수욕장 하면 해운대 행사 축제,"오늘은 연연부부 부산 배송갔다 , 잠시 시간을 내어 부산 여행시 가볼만한곳 탐방하기로 했어요 부산시 종합관광안내도 동래구에서 가까운 부산 가볼만한곳을 찾다 마땅히 소득이 없어 그나마 가까운 해운대를 방문했어요 부산시 종합관광 안내도에서 봤을때 해운대는 부산 밑쪽에...",2020. 4. 12.
[동래구미용실] 톤다운할땐 딥블루염색,제주도여행 부산염색잘하는곳 부산옹브레염색 부산옴브레염색 부산발레아쥬 발레아쥬 옴브레 부산솜브레 레이어드컷 레이어드펌 남자아이롱펌 아이롱펌잘하는곳 비긴어게인 더듬이염색 앞머리염색 편의점샛별이 수영구미용실 광안리미용실 광안동미용실 반도 다만악에서구하소서...,2020. 8. 8.
(부산맛집/동래고기집/동래역맛집)꽃돼지식당,강요하며(?)기분좋게 가게된 꽃돼지식당 꽃돼지식당 부산 동래구 명륜로 130-3 매일 11:00 - 02:00 꽃돼지식당은 점심부터 새벽까지 하는 곳인데... 부산한우대창맛집 #부산이베리코목살 #부산목살맛집 #부산꽃돼지식당 #부산여행 #부산드라이브 #꽃돼지식당 #부산차돌박이 #부산삼겹살 #부산여행맛집,2021. 5. 14.
"[여행] 부산 여행만 7번 간 ‘명예 부산인’이 추천하는 구석구석 - 서면/전포, 기장...","ㅎㅎ 가실 분들은 코스 짜보고 멀면 다른 곳 가세용 르쎄 동래구 온천천로 467-1 여기는 부산친구한테 추천받은곳! 부산 토박이가 추천한 온천천!... 코스 추천해드릴 수도 ,,있어욤(제가 아는 선에서) 그럼 다들 즐거운 부산 여행 하시기를 바라며 저는 여기까지만~~ 안농 #부산 #부산여행 #감천...",2021. 3. 8.
군포역 DS더웰가 모델하우스 분양가 정보,수성구나 부산 동래구에서도 볼 수 있듯이 당연한 일입니다. 단지의 인근에는 초등학교 두 군데를 비롯하여 다양한 초중고등학교들이 밀집해... 업무나 여행을 목적으로 이동하실 때 편리함을 느낄 수 있습니다. 마감재는 호텔급의 고품격자재를 사용하여 입주민들의 자부심을 높이며 84㎡에서 100...,2020. 12. 8.
부산 사직동 등심카츠 맛집 카츠미야,부산에 여행갔다 찾은 돈가스 맛집 카츠미야! 사장님도 친절하시구 겉바속촉이라 넘 맛있었어용^^ 부산 맛집! 카츠미야 맛집추천 ⊙ 위치 : 부산 동래구 사직북로4 ⊙ 주차시설 : 전용 주차장 구비 ⊙ Open : 매일 10:00 ~ 21:00 ⊙ 가성비 : ★★★ ⊙ 맛 : ★★★★ 카 츠 미 야 ♪1. 사직종합운동장...,2021. 2. 25.
예단과일 부산예단과일,⠀ 신혼여행 다녀온 이쁜 내친구의 어머니께서 시댁식구들에게 보내는 과일 선물 ⠀ 이쁜 내 친구가 더 이쁨 뿜뿜 받을 수 있도록 정성스럽게... 구서동과일바구니 #부산컵과일 #금정구컵과일 #동래구컵과일 #부곡동컵과일 #장전동컵과일 #부산과일 #부산출산선물 #부산승진선물 #금정구과일...,2021. 10. 7.
[마감 -부산] 5월 행복한바오밥 교육기능성보드게임 2급 자격과정 모집 /부산보드게임,"※ [부산]교육기능성 보드게임 2급 지도사 자격과정 모집 ♣교육일정 : 5월 7일 ~ 6월 11일 (매주 금요일- 6회차) ♣교육시간 : 오전 10시~12시30분 ♣교육비용 : 250,000원 (교재&자격발급비포함) ♣교육장소 : 부산 동래구 안락동 ♣교육인원 : 4인 (선착입금순 마감) ♣교육상담 : ***-****-****...",2021. 4. 20.
맘에쏙든 부산 동래 맛집 모음,"입맛 뿐만 아니라 시각적인 감성까지 사로잡아 부산여행 갈때면 또 재방문할 예정이랍니다. 2. 공정고기 주소 : 부산 동래구 명륜로 129번 나길7 영업시간 : 매일 15:00 - 02:00 단체석,예약,무선 인터넷, 남/녀 화장실 구분 메뉴 : 삼겹살 9,000원, 이베리코목살 9,000원 동래역에서 걸어서 10분정도 위치의...",2020. 11. 3.
부산 동래 술집 로바타탄요 별10개인 동래역 맛집,이거보니까 일본여행 때 먹던 거 생각나네? 테이블 앞에 이렇게 화로구이가 하나씩 있는데 구이요리를 시키면 이 앞에서 바로 구워주시더라구요.... 예약 안하면 못가니까 꼭 미리 예약하고 즐겨보세요:) 주소 부산 동래구 명륜로139번길 44-14 영업시간 17:00 - 22:00 (월요일 휴무) 전화번호 ***-****-****...,2021. 4. 30.
20살쩍 부산여행,동래구로 동래구에서 동구로 넘어다녔고 금성고를 찾고 부산역을 찾고 해운대를 찾았다ㅋㅋ. 정말 아무 계획없이 간 여행이지만 오히려 그래서 좋았달까 ㅋㅋㅋㅋㅋ 그냥 부딛쳐본거고 내 자전거 바퀴 굴러가본대로 간거고ㅋㅋ 내 마음대로 돈 써보고 회먹고 찜질방에서 자고 가고싶은곳 가고...,2020. 6. 9.
부산 해운대 재송동 오래된 샤워기 레인샤워 수전 고장 수리 교체 전문 업체 클린케어 강추,있는데요 여행 갔을때 필터 샤워기가 없으면 녹물로 샤워한 것 같아 뭔가 찜찜한 느낌이 있더라고요 어느 순간 클린케어는 샤워할때 필터 헤드가... 부산북구샤워기수전교체 #부산동래구샤워기수전교체 #부산서구샤워기수전교체 #부산연제구샤워기수전교체 #부산중구샤워기수전교체...,2021. 4. 30.
"부산 안락동 서원시장 맛집 술집 부엌을 그리다 - 가성비 꼬치구이, 나가사키 짬뽕",0507-1323-5898 ▷주소 : 부산 동래구 명안로39번길 82-1 1층 ▶지번 : 부산 동래구 안락동 427-38 1층 ▷교통 : 충렬사역 4번 출구에서 316m ▶기타... 서원시장술집 #나가사키짬뽕 #부산맛집 #부산술집 #부산가성비술집 #맛끝맛집 #맛끝술집 #맛끝안락동 #맛끝서원시장 #맛끝TV #부산가성비맛집 #부산,2020. 12. 7.
부산 동래 백객도! 찾아가는 중국집~~,안녕하세요 달입니당 부산여행을 갔다가 점심먹으러 간 유명한 동래구 중국집 ㅋㅋ 백객도에 왔습니다 가게도이름도 정말로 특이한 곳 ..ㅎㅎ 이렇게 작은 가게가 유명하다니 정말이지 궁금하더라구요~~~~ 부산동래 백객도 영업시간은 평일 11:00 - 19:00 (매주화요일휴무-확인바람) 가게 입구입니다...,2020. 3. 29.
부산 사하구 장림동 875 동원로얄듀크아파트,"요즘 황사가 가끔씩 오곤 하지만 그래도 따뜻한 봄이라 그런지 맘도 싱숭생숭....가족이랑 오붓하게 여행하고 싶어지네요 자 오늘은 부산 사하구... 보수공사 부산 동래구 타일 수리공사, 명륜동 타일 수리공사, 명장동 타일 수리공사, 복산동 타일 수리공사, 보수공사 사직동 타일 수리공사, 수민동...",2021. 5. 11.
배틀트립 부산 해운대 최초 목욕탕 1호점 하늘공원 울산 옹기마을 초심여행 SF9 찬희...,com/14661 배틀트립 171회 초심여행 울산 부산 초심 원조 여행 코스 편 SF9 인성 다원 찬희 울산 간절곶 일출 울산 옹기 만들기 체험 부산... 주소 : 부산 동래구 복천동 367-2 전화 : 051-740-7010 원조 낙곱새 상호 : 원조할매집 주소 : 부산 부산진구 범천1동 837-42 전화 : 051-643-5037...,2020. 1. 3.
부산 명장동 맛집 태산손만두 - 40년을 이은 속보이는 야한 만두,부산 명장동 맛집 태산손만두 - 40년을 이은 속보이는 야한 만두 동래구 명장동에는 유명한 만둣집이 두 군데 있다. 70세가 넘으신 노부부가 40년... 이용 #명장동맛집 #명장동만두 #명장동칼국수 #부산맛집 #부산여행 #부산만두 #부산칼국수 #맛끝맛집 #맛끝명장동 #맛끝만두 #맛끝칼국수...,2020. 10. 28.
빈티지 스타일의 카페 부산 동래 그남자 coffee factory 커피 팩토리,오늘은 식사로는 좀 비싼 소고기를 먹고 그리고 부산 동래구에 있는 그남자 COFFEE FACTORY(커피팩토리) 로 갑니다. 일명 그남자의 커피공장 이라고... 싱그러운 5월 건강하시고 행복한 시간 되시고 여행인플루언서 트립풀아비일의 여행전문 블로그 홈에 들러서 팬하기 꾸~~~욱~~ 눌러 주세요....,2021. 5. 6.
"사직동 레스토랑 만족했던 띠리오, 부산 사직동 맛집","부산 맛집을 찾아다니는 다솜의 맛집 여행, 떠나볼까요? 이번에는 부산 사직동 맛집 띠리오에 다녀왔어요. 다솜이 먹은 메뉴 립아이 스테이크... ●주소 : 부산광역시 동래구 사직북로 34번길 12 1층 띠리오 ●전화 : ***-****-**** ●영업시간 : 매일 11:30~22:00 화요일 휴무, 브레이크 타임 15:00~17:00 ▷명성...",2021. 9. 22.
<타이빈> 동래 태국 음식점 강추! 태국여행 온 기분!,"타이빈 위치: 부산 동래구 금강로73번길 12 영업시간: 매일 11:00 - 22:00 주차장: O 태국음식 좋아하시는 분들에게 강추하는 곳 소개드려요! 친구들끼리, 가족끼리 오기에 너무 좋은 곳이에요. 저는 야외에서 먹는걸 추천드립니다! 요즘에 해외여행도 못가는데... 정말 태국에 온 것 같은 기분 느낄 수...",2021. 7. 30.
[부산/대기업] SKT서비스탑 고객상담사 정규직 모집,"장소 부산 동래구 충렬대로 412 (안락동) SK안락사옥 2층(동래한전 맞은편) 자격조건 → 신입, 경력, 졸업예정자 가능 → 서비스 마인드 소유자 누구나 → 해외여행 결격사유가 없는 분 가능 복리후생 4대보험(국민연금, 고용보험, 건강보험,산재보험) / 퇴직금 적용 핸드폰 요금 : 년 800...",2021. 9. 3.
"동래 마사지, 동래 타이마사지 유명한곳 동래 더타이에서 피로풀기 ♥",해외여행을 갈수없으니 국내에서 가끔 마사지를 받고있어용! 요즘 우리나라도 마사지샵도 많이 생기고 가격이 많이 저렴해져서 전혀 부담이... 받고 가벼워진 몸으로 맛있는 브런치를 먹으러 갔습니당~ㅎㅎ 주소: 부산 동래구 명륜로 130-1 (동광빌딩 7층) 영업시간: 24시간 예약전화: 051-555-6661 주차가능,2021. 3. 21.
뒤늦게 돌아보는 부산 출신 천안 이변호사의 부산(친정) 여행 후기 1탄 ^^*(부산 맛집...,하루두끼 먹는 사람이 부산만 가면 4끼를 먹는다는..... 친정집은 동래구인데요.집근처 5분거리에 산오징어 집이 유명한 집이 있어서 꼭 먹어봐야... 부산 여행 당시 여름이었는데 저 단팥죽 맛은 진짜....ㅠㅠㅠ이변의 힐링푸드~~~~ 금성상회 단팥죽 여름에는 팥빙수도 맛있드라구요. 하지만 저는...,2020. 10. 9.
