header,contents,date
부산 동래구맛집_매운 불스지가 당길 때는 스지회관,부산 여행 갈 때 가게 된 스지회관의 매콤한 맛이 일품인 불스지를 소개할게요. 생소한 이름의 스지여서 어떠한 맛인가 궁금했는데요. 동래역에서는 이미 맛집으로 소문난 곳이라고 지인이 소개해 준 곳이어서 믿어 의심치 않고 들어갔어요. 동래역에서도 5분 거리밖에 되지 않아서 쉽게 찾아갈...,2020. 7. 27.
2박 3일 부산여행 BTS 방탄소년단이 먹은 부산 동래밀면 본점 밀면과 왕만두 후기,안녕하세요 코코니오입니당 부산에 사는 친구가 있어서 친한 친구 몇명과 함께한 부산여행 2박 3일 점심시간 전에 방문해서 나름 한가했던 부산... 본점이라 더욱 기대감이 들었고 저는 밀면이 처음이라 무슨맛일지 궁금했어요 부산 동래 밀면 부산 동래구 명륜로 47 BTS가 다녀가서 더 유명해졌데요!!...,2021. 8. 5.
부산여행 드라이브 코스 [장림포구 부네치아],부산 드라이브코스 / 여행코스로 가기 좋은 장림포구 부네치아 딱히 할 건 없지만 사진찍고 한번쯤 구경하기 좋은 곳이다 바로 옆은 낙동강이... 더이상 볼게 없다 ㅋㅋ 여기와서 남는건 사진 뿐인듯 늘상 생활하는 금정구 동래구만 있다가 사하구 쪽으로 오니 뭔가 내가 아는 부산이랑 풍경이 많이...,2021. 10. 6.
[국내여행] 부산/부산역 1박2일 여행 후기(1),부산여행 후기를 소개해드리고자 합니다! 5월 3일에 취뽀를 했는데…. 바로 5월 5일(어린이날)이 처음이자 마지막 휴일을 직감하고 바로 KTX 타고... 바로 호텔가기는 아쉬워서 친구 3이 마침 시간돼서 만날 수 있었습니다~ 부산 동래구 무인 오토카페 동래역4번 출구에서169m 친구 3을 오랜만에...,2021. 7. 29.
"하운드호텔 미남역, 도심 속 힐링 플레이스 동래구호텔","하운드호텔 미남역, 도심 속 힐링 플레이스 동래구호텔 코로나 때문에 멀리 여행을 가지 못하는 둥이네는 최근 호캉스로 아쉬움을 달래고 있는데요, 올 해 제일 많이 방문한 호텔은 하운드호텔 ㅎ 부산 곳곳에 하운드호텔이 생기고 있어요! 하운드호텔 부산역에서 둥이와 즐겁게 수영도 하고...",2021. 7. 21.
"불안, 초조행동 치매 증상 에피소드 52호(2021.01) - 부산 동래구 안락동 주간보호...","치매환자는 때때로 사람이 많은 곳이나, 여행하는 것, 어두움, 혹은 목욕하는 것 등에 대해서 공포증을 나타내기도 하는데 이러한 증상 또한 불안과... 어르신의 행복한 쉼터, 안락효정데이케어는 언제나 어르신들을 위해 열려 있습니다. 부산전지역 상담 : ***-***-****/***-****-****",2021. 1. 27.
부산 동래구 명장동 명륜동 사직동 원어민 1:1 영어회화 말 못 하는 영어는 영어가...,#원어민영어회화 #유앤아이잉글리쉬 #프리토킹 #영어공부 #영어회화 #화상영어 #여행영어 #부산영어회화 #양산영어회화 #울산영어회화 #포항영어회화 #경주영어회화 #김해영어회화 #명지영어회화 #장유영어회화 #진주영어회화 #사천영어회화 #통영영어회화 #거제영어회화 #동래구영어회화...,2020. 11. 15.
[부산3편]부산의 학군대장은 누굴까~?_부산광역시 동래구 사직동 (Feat. 연제구 거제동...,"오늘 부산 3번째! 동래구 사직동에 대해서 얘기보고자 한다. 부산은 학군보단 환경쪽의 무게가 더 있는 도시이지만, 그래도 학군이 좋은 곳들이... 만약, 거제동이나 사직동쪽에 실거주 집을 구하실 분들이 있으시면, 꼭 이 지역을 2번정도 가족들이랑 같이 여행겸 돌아보는걸 추천한다. 사직동의...",2021. 2. 14.
(수안1구역)부산재건축 동래구 해바라기 아파트 시공사 선정 조합총회.,#수안1구역 #부산재건축 #동래구 #재개발 #해바라기아파트 #시공사 선정 #총회 #조합원 #매도 문의 #매수 문의 #접수 #환영 #분양권상담... **여행 가시는 분들 흉보는 것 아닙니다. 그냥 세월이 안타까워서요...^^;; 님들~~~ 다들 명절 잘 보내시고 건강하시길 기원드립니다. 감사합니다. 꾸벅~~^^ 안녕~~!,2020. 9. 28.
부산 방문 미술/동래구 방문 미술/금정구... 창의미술/땡이의 미술여행/작품감상/동작표현,이용해서 생동감있는 동작을 표현해 보았어요~ 철사를 마음대로 구부렸더니 우와~~!! 우리 땡이 친구가 만들고 싶었던 모양이 나오네요 ^ o ^ 너무 즐거웠던 시간이었어요~ :미술을 통한 창조적 감성 깨우기: 땡이의 미술여행 동래/금정지사 교육 및 상담문의 051.554.0203 언제든지 열려있어요 ^------^,2021. 7. 20.
부산 책방 여행 #1. 북살롱 부산,"처음으로 소개할 곳은 '부산 동래구'에 위치한 ""북살롱 부산"" 입니다. 네이버(!!)지도가 알려주는 대로 골목길을 꼬불꼬불 따라가다 보면 작은... 이런 다정함들이 책방여행을 계속하게 만드는 것 같아요. ㅎㅎ 아, 빨대도 주시려고 하셨는데, 제가 거절했어요. 요즘은 빨대만 보면 자꾸...",2021. 5. 8.
부산 상가 정보 - 동래구 신규 창업 음식점 상가,부산 동래구 2020년 1월 ~ 6월 신규 창업 음식점 상가 현황 가게명 주소 유동커피온천천로339 낙민동 133번지 3호 동래꿈에그린아파트 부산동래지역자활센터얼쑤벅스 낙민동 150번지 8호 동래구청 맥시칸낙민체인 낙민동 172번지 5호 동래한양아파트 봉자비어 낙민동 198번지 14호...,2020. 7. 15.
[2박 3일] 부산+포항 여행 ep.1,고민 고민하던 여름 휴가를 가게 되었어요 부산은 정말 오랜만이라 더 설렜는데요! 이번 여행은 주변 관광이나 먹거리 보다는 숙소를 가장... 사진 잔뜩 찍고 갑니다 신가네 호떡 김밥 떡볶이 부산 동래구 충렬대로249번길 61 부산와서 떡볶이는 못참지~~~~이 이렇게해서 대략 만원? 만원도 안나왔던...,2021. 8. 17.
[2박 3일] 부산+포항 여행 ep.1,고민 고민하던 여름 휴가를 가게 되었어요 부산은 정말 오랜만이라 더 설렜는데요! 이번 여행은 주변 관광이나 먹거리 보다는 숙소를 가장... 사진 잔뜩 찍고 갑니다 신가네 호떡 김밥 떡볶이 부산 동래구 충렬대로249번길 61 부산와서 떡볶이는 못참지~~~~이 이렇게해서 대략 만원? 만원도 안나왔던...,2021. 8. 17.
"부산추천 명소 자귀나무/복천동고분군, 동래구 선거관리위원회/7월도보여행/21.7.10...",1.복천동고분군 부산시 동래구 복천로 66 #복천동고분군 야외전시관 주변에 #자귀나무꽃 이 예쁘게 피어있다. 비가 몇일째 내려 #자귀나무 꽃이 많이 떨어져 아쉽게도 활짝 피어있는 모습을 볼수가 없다 자귀나무 우리말 명칭 '자귀나무'의 어원은 불확실하다. 나무 깎는 연장 '자귀'를 만드는 데...,2021. 7. 10.
부산 아이와 금강공원 케이블카 로프웨이 타고 전망대까지!,둥이와 함께 부산 동래구 일대를 내려다봤습니다. 아쉽게도 미세먼지가 많아서 하늘이 뿌옇습니다. 날씨 좋은 날은 바다도 보이거든요. 사직... 윤우는 사진으로도 힘들어하는게 느껴지네요 ㅋㅋ 주말에 여행 계획이 없을 땐 금강공원에 걸어서 와야겠단 생각이 들었어요. 아이가 자꾸 뚱뚱해져서...,2021. 5. 14.
퀄리티 넘치는 부산 사직동 맛집,RESET 오늘 주제는 #부산사직동맛집 이번 여름 휴가 때 가족들과 함께 부산 사직동으로 여행을 떠났는데요. 저녁 식사를 위해 이곳 저곳 찾아보던 중... 한번에 한쌈싸서 먹으니 싱그러운 마음으로 오늘의 식사를 마칠 수 있었답니다. 백년식당 주소: 부산 동래구 법원북로3번길 35 전화번호: 051-502-9964,2020. 9. 25.
"부산 사직동 떡볶이 맛집, 옥당분식 물떡 내 스타일이야",부산 여행가신다면 사직동 떡볶이 맛집인 옥당분식 가셔서 한 번 드셔보세요ㅎㅎㅎㅎ 가격도 그리 비싸지 않아서 여러개 먹어도 얼마 나오지 않았어요! 위치는 부산 동래구 사직북로 28번길 101로 사직역 33번출구에서 나와 위 지도 따라서 걸어가시면 바로 찾으실 수 있어요 사직시장 안에 있기...,2021. 4. 6.
부산혼주메이크업(동래구메이크업/동래메이크업/안락동메이크업샵),"뉴스보고 여행이틀전 모두 취소하고 여행지 변경을 했어요 집에 꼬맹이도 있고 주말엔 예약이 많으니 더더 조심스러워지네요 ㅎㅎ 다들 휴가... (Ty8111 ) "" #부산메이크업 #부산메이크업샵 #부산메이크업추천 #부산출장메이크업 #부산메이크업헤어 #부산올림머리 #부산업스타일 #동래구메이크업...",2020. 6. 26.
반여동.동래구.센텀맘.광안동.달맞이미술.망미동.부산남구.대연동.용호동....,"“시간 여행자가 되어 떠나는 세계 역사 여행” 백제의 계백장군을 만나고 싶은 마음을 그림으로 표현해 주었답니다. 추석 보름달, 소원을 빌어요... 안락동아동미술 #동래구아동미술 #연제구아동미술 #마린시티아동미술 #부산8세미술 #센텀미술학원 #센텀8세미술 #반여동8세미술 #재송동8세미술...",2021. 9. 21.
부산광역시 동래구 호텔농심,오늘의 핫한 여행상품 부산광역시 동래구 호텔농심 입니다 가성비와 상품평 및 판매율이 좋은 상품입니다 113개의 이용자들의 상세한 리뷰가 달려있습니다 쿠팡에서 예약시 최대 할인혜택과 쿠팡 포인트 적립까지 두가지 혜택을 모두 받을 수 있어서 좋아요 부산광역시 동래구 호텔농심 휴먼명조...,2021. 5. 11.
(부산 제주이마이가 온천점) 부산에서 즐기는 제주 참숯 생고기 전문점으로의 먹방 여행,"✅ 제주이마이가 온천점 부산 동래구 중앙대로1367번길 70-4 http://naver.me/G2UVxUlr 제주이마이가 온천점 부산 동래구 중앙대로1367번길 70-4 3,4호선 미남역 14번 출구에서 642m 매일 12:00 - 02:00 주차, 남/녀 화장실 구분 ***-***-**** ✅ 제주 이마이가 온천점 위치 3,4호선 미남역에서 도보라고 나오는데...",2021. 9. 12.
[부산 타이마사지] 동래 타이마사지 ::: 더 타이 동래점,주말여행을 다녀온후 찌뿌둥한 몸을 풀기 위해 타이마사지를 예약했어요 오전에 수업 준비하기 위해 자재 시장을 돌고 돌고 짐을 바리바리 들고 다녔더니 어깨에 곰 한 마리가 똭!!! 이제 피로를 풀러 가야겠어요 더 타이 동래점 더 타이 ***-***-**** 부산 동래구 명륜로 130-1 7층 영업시간 00:00 ~ 24:00...,2021. 2. 23.
부산방문미술/동래구방문미술... 유아미술/영아미술/창의미술/땡이의미술여행/작품감상/꽃,듯 화면 가득하게 풍성한 붉은 꽃을 비슷한 느낌으로 잘 표현해주었어요^^ 붉은 색의 꽃은 풀을 이용해 스크래치기법으로 표현해보았어요~ 오늘도 즐겁게 수업하겠습니다~~~^^ :미술을 통한 창조적 감성 깨우기: 땡이의 미술여행 동래/금정지사 교육 및 상담문의 051.554.0203 언제든지 열려있어요 ^------^,2021. 5. 6.
"낙곱새 밀키트, 부산 동래원조할매 맛 그대로!","부산여행 가면 돼지국밥 밀면과 함께 꼭 먹고 와야할 것 같은 낙곱새! 2년전 해운대 셋이 갔을 때도 저 빼고 두 남자 야식으로 먹고온 낙곱새 낙지,곱창,새우와 갖은 야채가 들어간 낙곱새 맛집이 부산 동래구에 있다고 하는데요. 범일동 원조할매낙지!! 그 낙곱새 맛집의 맛을 집에서 택배로 편하게...",2021. 5. 17.
"동래읍성과 장영실과학동산, 부산동래여행 동래 가볼만한 곳","아무튼 부산여행 중 동래읍성과 장영실과학동산 고고~~!!! 동래읍성 동래읍성역사관 부산 동래구 동래역사관길 18 051-550-4488 입장료 무료 장영실과학동산 051-550-6634, 6604 관람시간 4~10월 09:00~18:00 11~3월 09:00~17:00 휴장일 매주 월요일 월요일이 공휴일이면 그 다음날 1/1, 추석, 설날, 임시공휴일 입장료...",2021. 7. 10.
동래구 명장동 부산칠순떡 흑미영양떡 구름떡 축하카드써드렸어요,원래는 구름떡도 이바지상자에 2종으로 같이 담으려고 했었는데 칠순 당일날(배달해드린날) 여행가는 차에서 드신다고 하셔서 따로 선물상자에 포장해드렸어요. 이바지구성이나 떡케익에만 복스티커를 붙여드리는데 멀리서 주문주셔서 서비스로 붙여드렸답니다^^ 그렇게 두가지의 떡을 깔끔하게...,2021. 6. 20.
동래구 명장동 부산칠순떡 흑미영양떡 구름떡 축하카드써드렸어요,원래는 구름떡도 이바지상자에 2종으로 같이 담으려고 했었는데 칠순 당일날(배달해드린날) 여행가는 차에서 드신다고 하셔서 따로 선물상자에 포장해드렸어요. 이바지구성이나 떡케익에만 복스티커를 붙여드리는데 멀리서 주문주셔서 서비스로 붙여드렸답니다^^ 그렇게 두가지의 떡을 깔끔하게...,2021. 6. 20.
"부산 여행, 이주홍 문학관과 온천장 맛집","1947년 ~ 1987년까지 부산 동래구 온천동에서 삶을 이어감. 합천 이주홍 어린이 문학관 1906년 합천 출생 이주홍 어린이 문학관은 2011년 12월 개관 1928년 문단에 나와서 1987년 작고하기까지 60여 년을 일관되게 문학 활동을 해온 부산 문단의 개척자요 거목. 소설, 아동문학, 희곡, 시, 수필, 번역...",2021. 8. 26.
Gourmet Story...2021.1.27 부산광역시 동래구 온천동 779-29번지 산수갑산...,Lukas Shim #산수갑산 #온천동산수갑산 #생아구수육 #아구탕 #족발 #루카스족발 #루카스아구탕 #루카스생아구수육 #루카스산수갑산 #루카스스타그램 #루카스미식스타그램 #미식가아재 #미아모 #미식을즐기는아재들의모임 #釜山美食旅行 #釜山餐廳旅行 #부산맛집 #부산여행 #온천동맛집...,2021. 4. 3.
부산 여행 준비 중 찾아본 영상,"올해는 부산 여행을 준비해 본다. 가게 될런지는 모르겠다. 작년에는 경주를 가고 싶어 열심히 찾아봤는데, 돈이 없어 포기했다.... 부산과 동래는 별개 지역이었다. 작은 마을 부산포가 오랫동안 행정 중심지였던 동래를 집어삼켜서 이젠 부산시 동래구가 되었다....",2021. 10. 2.
부산먹방♥ 부산시 동래구 명륜동 맛집 맛있는 la갈비 술안주 최고 샤브샤브맛집 한술당,분위기만 좋은줄 알았는데! 맛까지 너무 좋아 아주 최고 였답니다. 다음에 또 가고 싶어요 ㅠㅠ 가까우면 또 갈텐데.. 유명한 이유가 있었군용....하하.. #부산여행#동래맛집#부산술집#동래구#부산안주맛집#부산맛집#한술당#샤브샤브#LA갈비 #데이트술집#분위기좋은술집#부산맛집,2020. 9. 1.
"부산 동래구 꽃집 화가플라워, 꽃바구니 만들기 원데이 클래스 수업 진행하는 곳",대도시에 살고 있지만 해외여행 갈 때는 항상 자연이 잘 보존된 곳이나 풍경이 아름다운 곳을 여행하는 걸 더 선호해요. 그래서 그런가 꽃과 식물의 싱그러움이 가득한 이 공간이 마음에 쏙 들었어요 :) 화분과 꽃을 조금 구경하고 있으니 원데이클래스 수업 재료들을 준비해 주셨어요. 수업이...,2020. 12. 1.
부산해운대구우울증 동래구 화병 야간진료한의원,"#부산해운대구우울증 추나 실비처리 적용 문의를 많이 주시고 계십니다. . . . . . 교통사고 상해는 차량이 앞에서, 옆에서, 뒤에서 받혔느냐에 따라... 족저근막염은 운동을 즐기는 스포츠인이나 여행 중 많은 거리를 도보로 이동했던 사람에서 쉽게 찾아볼 수 있습니다. 족저근막염은 그냥 방치하게...",2021. 8. 13.
생활의 달인 부산맛집 BIG3 #중탕떡볶이 #충무김밥 #찹쌀도너츠,"할매떡볶이 부산 동래구 사직북로63번길 49, 국민시장 영업시간 11:30 ~ 재료소진시 조기마감 월요일 휴무 직화로 끓이는 그냥 떡볶이가 아닌 중탕떡볶이! 들어보셨나요? 커다란 냄비에 오랫동안 열을 유지해 만든다고 합니다. 주문한 만큼 떡과 어묵을 건져내어 깊은맛의 소스를 함께 버무리는...",2020. 4. 3.
감사짙운 부산시청 맛집 공유,"지난 주는 가족들과 부산으로 여행갔다가 미리 알아 둔 부산시청 맛집에서 든든하게 한 끼 해결하고 왔어요. 야들한 식감이 살아있는 곱창과... 소문난주문진막국수 주소 : 부산 동래구 사직로58번길 8 전화번호 : 051-501-7856 영업시간 : 매일 11:00 ~ 21:30 대표메뉴 : 수육(대) 25,000원, 막국수 9,000원...",2021. 4. 23.
[백년가게]부산 여행 맛집은 동래할매파전 추천해요!,"부산 동래구 명륜로94번길 43-10 [수안역 5번 출구에서 284m거리] ☎***-***-**** 부산 여행시 동래할매파전 주차장에 도착하니... 입구에서 부터 .... 와~~~우 찐.....감동 장독대도 있고, 이쁜 정원이 아름답게 가꾸어져 있어서 우리들은 마냥 분위기에 취해 한참을 입구에서 수다를 떨다 식당안으로...",2021. 7. 10.
부산 방문 미술/동래구 방문 미술/금정구... 유아미술/영아미술/창의미술/땡이의 미술여행/,우리동네의 입체 작품이 완성되었네요~~^^ 다양한 기하도형의 나무블럭으로 평면에서 입체로 창의적이며 디자인 감각이 돋보이는 건물들로 완성된 우리동네가 멋있죠^^~ :미술을 통한 창조적 감성 깨우기: 땡이의 미술여행 동래/금정지사 교육 및 상담문의 051.554.0203 언제든지 열려있어요 ^------^,2021. 2. 4.
부산식 돼지갈비와 생갈비 ... 부산 사직 맛집 삼대돼지불고기,지난 부산 여행에서 저녁을 먹으러 들렀던 #부산 #돼지갈비 #맛집 #삼대돼지불고기 다. 이곳을 가장 최근에 다녀온 지는 3-4년쯤 된듯하다. 10여 년... 삼대돼지불고기 ***-***-**** 부산 동래구 사직로 11 부산 동래구 사직동 98-7 매일 11:30 - 22:00 #사직운동장 에서 멀지 않은 곳에 자리한 삼대...,2021. 3. 24.
[생각이자라는글방]동래구초등독서논술교실 행복한책수업 초등학생발표인성교육,"부산동래구초등독서교실 생각이 자라는 글방 생각이 자라는 글방 생글생글에 와서 학생들이 책읽기가 즐거운 것 이구나 내가 궁금한 것 내가 생각하지 못한 것, 내가 경험하지 못한 것 알고 싶은 것들이 있는 책의 세상으로 함께 여행을 떠나고 싶은 마음입니다. 생각이자라는글방 미남초...",2021. 5. 12.
동래 안경점 부산 렌즈는 역시 다비치,"주소: 부산 동래구 수안동 261 위치 : 4호선 수안역 8번 출구에서 도보 2분 동래시장 맞은편, 우체국 옆 건물 운영시간 : 매일 09:30-21:00... 저는 1DAY부터 1MONTH 까지 다양하게 사용하고 있는데, 1MONTH 를 기본으로 사용하면서 출장이나 여행이 있을때는 세척액이나 렌즈통까지 챙기기 귀찮아서...",2021. 9. 24.
써니 생일 기념 가족부산여행 -1,"부산여행부터 시작! 부산 동래구 롯데백화점 바로 옆 골목에 위치한 ‘ 호함평면옥 ‘ 즐겨보던 부산 맛집 유튜버 아니,, 아니다,, 솔직한 생활외식인~~ ‘츄릅켠’ 님의 영상을 우리집 형제 먹보들에게 소개시켜주었더니 그럼 부산에서의 점심은 여기로 하자며 바로 결재가 떨어졌다. 그 뒤로도...",2021. 6. 21.
부산방문미술/동래구방문미술... 땡이의미술여행/몬드리안 디자인놀이/만들기/디자인...,"함께 이해하면서~ 어떤재료를 사용할지, 크기는 어떻게할지, 아이디어 스케치를 해보았습니다.~~ 우와~~ 재활용을 사용하여, 연지만의 멋있는 성을 완성해주었습니다~! :미술을 통한 창조적 감성 깨우기: 땡이의 미술여행 동래/금정지사 교육 및 상담문의 051.554.0203 언제든지 열려있어요 ^------^",2021. 4. 27.
부산 동래 카페 브루커피 동래점 ❥ Vrew Coffee,해리단길에 있는 브루커피도 방문해 보아야겠습니다 그럼 오늘 폿팅은 이만 마치겠습니다(๑❛ڡ❛๑) #브루커피 #vrewcoffee #vrew_coffee #동래카페 #동래구카페 #동래역카페 #명륜동카페 #부산카페 #부산여행 #부산신상카페 #브루커피동래점 #동래대형카페 #동래카페추천 #부산카페추천 #동래크로플...,2021. 7. 7.
부산 고기 맛집 특집! 부산언양불고기 vs 부산돼지갈비,돼지갈비 편 ① 삼대돼지불고기 ② 산수갑산 ③ 은하갈비 삼대돼지불고기 위치 부산 동래구 사직북로 28번길 197 영업시간 매일 11:30 - 22:00 (평일... 맛집투어 #불고기 #언양불고기 #부산가볼만한곳 #광안리 #사직 #미남 #초량 #남포동 #고기맛집 #돼지갈비 #숯불갈비 #맛집여행 #부산경제진흥원,2020. 7. 22.
가장 잘 알려진 비밀: 부산 탐험,문화 여행은 부산에서 즐길 수 있는 가장 이색적인 활동을 나열합니다. 한국 요리의 필수품 샘플: 돼지국밥 부산의 서면 시내 골목에서 수백 명의... 부산광역시 동래구 금강공원로20번길 23 + 51-550-2200 자갈치 수산시장 구경하기 남포항 끝자락에 위치한 또 다른 경이로움은 국내 최대 규모의...,2021. 9. 12.
부산동래허심청온천 이용후기,"부산동래온천 허심청 이용후기 얼마전 부산여행에서 다녀왔던 농심호텔 호텔 뒷편에 있는 온천 허심청에 다녀왔던 후기를 남겨본다. 우리는... 부산 동래구의 온천은 알칼리성약식염천의 국내 최대 마그네슘 함유온천으로 맑은 수질이 특징이며 수온이 45도에서 61도로 류마티스, 신경통, 창상,요통...",2021. 10. 11.
암컷 강아지 나나 중성화 수술 <동래구 외과 동물병원 >,"부산 동래구 린동물병원입니다. 오늘 소개할 아이는 일본인 엄마를 둔 너무나 예쁜 나나라는 강아지입니다.!! 저의 와이프이자 린동물병원의 여자... 나나는 언젠가 한국을 떠날 수도 있다고 생각하니 왠지 서글퍼지기도 하지만, 여러 나라를 여행할 수 있는 행복한 강아지라는 생각도 드네요...",2021. 1. 13.
"'어반브릿지'로 쉬러가자! 부산 동래 골목 속 로컬 아지트!! (2층, 5층 동영상 있음!!)",(메가마트에서 걸어서 8분) 지하철 안내 동래지하철역에서 도보 12분 수안지하철역에서 도보 3분 위치 및 연락처 부산 동래구 충렬대로237번길 28 051-710-8488 깔끔하면서도 포근한 느낌의 어반브릿지 건물~ 어반브릿지로 휴식소풍!! 지난주 드디어 어반브릿지에 놀러갔다왔습니다!! 언제나...,2021. 7. 11.
[ 부산 바디프로필 남자 스모키메이크업 포마드헤어 ] 동래구 온천장 스튜디오 촬영...,[ IN MAKEUP STORY ] 안녕하세요 : ) 부산 바디프로필 남자 스모키메이크업 포마드헤어 동래구 온천장 스튜디오 촬영 스타일링 잘하는 메이크업샵 인메이크업스토리입니다. 여러분~~ 이제 여름여름 이예요 이 시기가 오면 많은 분들은 어디로 어디로?? 여행을 떠나야 하는지 고심을 많이 하시죠?! ㅎㅎ...,2021. 6. 3.
면발탱탱 존맛탱 가성비&맛 둘다 잡은 부산 3대 짬뽕맛집 부산 온천장 '동운반점',부산 동래구 온천장로119번길 7 영업시간 : 매일 11:00 - 21:00 명절 휴무 이곳은 저의 짝꿍의 나와바리ㅋㅋㅋ 동네주민인 제 짝꿍이 추천하는 중식당... 너무 맛있어서 사장님 명함 있길래 챙겨왔어요 개인적으로 여행갔을때 음식이 너무 내 취향이다 싶음 명함 있음 희안하게 챙기고 싶더라구욬ㅋㅋㅋ...,2021. 3. 6.
[부산광역시 맛집]줄서서 기다리는 부산 동래구 맛집 부광반점에 다녀왔습니다!!...,"오늘은 지난주 부산출장중에 방문했던 자타공인 SBS 생활의 달인에서 탕수육 달인의 집 으로 알려진 부광반점! 방문 후기를 포스팅 해보도록... (출장이 아니라 여행으로 갔다면 바로 사장님!! 소주한병 주세요! 했을겁니다 - 엄격,근엄,진지.) 짬뽕 국물은 해물을 베이스로 끓여낸 육수로 바다향이...",2020. 2. 4.
부산 동래읍성 서장대와 북장대 [부산 등산코스],"동래읍성 찾아가는 방법 및 주차 부산광역시 기념물 제5호로 지정된 동래읍성은 부산 동래구 복천동, 안락동, 명륜동, 칠산동, 명장동 일대에 걸쳐... 즐겁고 다양한 여행 정보를 전해드리겠습니다. #부산등산코스 #부산동래읍성 #동래읍성북장대 #동래읍성서장대 #장영실과학동산",2021. 9. 27.
