header,contents,date
부산 연제구 맛집 영양돌솥밥집 백가네,나중에 혹시라도 부모님들과 부산여행을 오게 된다면 연제구 맛집 백가네는 한 번은 들리게 되지 않을까 싶습니다. 단점이라면 역시 기본메뉴인 영양돌솥밥 가격이 다소 높다라는 점. 하지만 밥맛이 좋고 찬들도 푸짐하게 나오니 이 부분은 다른 의견이 있겠죠. 또 다른 점은 아오빠처럼 반찬위주...,2021. 9. 19.
부산 연제구 맛집-진주통닭,제가 진주통닭을 알게 된 것은 부산 3대 통닭이라는 수식어로~ 꼭 한번은 가봐야지 하다 이번 여행에 우연히 방문하게 되었습니다. 점심으로 먹은 밀면집과 5분 거리에 위치한 부산 연제구 맛집 진주통닭!! 사실 부산에 유명한 통닭집 많습니다. 각 집마다 개성도 강하고~ 제가 먹어 본 것만 3곳이...,2020. 8. 26.
연제구카페 컴커피 시청점 부산시청디저트 맛집,"부산 맛집을 찾아다니는 다솜이의 맛집 여행, 이번에는 친구와 가까운 연제구카페 방문했어요. 부산시청디저트 카페 컴커피 시청점으로 떠나볼까요? 다솜이가 주문한 메뉴 스노우녹차라떼, 아메리카노 화이트, 블루베리빵프레, 복숭아빵프레, 몽블랑, 33플레인 카스테라, 캬라멜 마카롱. 초코...",2021. 10. 11.
[부산] 연제구 한정식 보리굴비 푸짐한 청담,부산 여행 중에 다녀왔던 부산 한정식 청담! 오전에 해변 열차 타고 점심 먹으러 연제구에 위치한 청담으로 향했다. 가기 전에 사진으로 보니까 같은 가격이라도 서울에서 먹는 한정식보다 훨씬 푸짐푸짐해보여서 기대하며 갔다. 11시 반에 예약을 하고 도착! 오픈 시간에 맞춰서 갔더니 도착했을...,2020. 10. 30.
부산 연제구 거제동 대우그린아파트 창호 리모델링 창문 인테리어,광안동샤시 #연제구샤시 #연산동샤시 #동래구샤시 #동래샤시 #안락동샤시 #BTS #백종원 #여행 #음식 #부동산 망미동 자명창호 샷시공사 부산창호 부산샷시 수영구창호 수영구샷시 수영동창호 수영동샷시 망미동창호 망미동샷시 광안동창호 광안동샷시 남천동샷시 연제구창호 연제구샷시 연산동창호...,2021. 9. 23.
부산 연제구 맛집 뜨끈한 국물이 예술,부산 연제구 맛집은 돼지 국밥이 유명한 곳이라 남녀노소 다 방문을 하는 것 같아요. 특히 부산하면 돼지국밥이 생각나잖아요. 부산 여행 오신 분들도 제대로 된 국밥 먹으러 많이들 오신다고 하더라고요. 안으로 들어오게 되면 생각보다 넓은 편이에요. 넓어서 그런지 사람들도 많이 올 수 있는 것...,2020. 12. 7.
부산 연산동 카페 가배재 ఌ 연제구 시청역 카페 추천,#연산동카페 #연제구카페 #부산시청카페 #물만골카페 #부산시청역카페 #물만골역카페 #연제구청카페 #가배재 #부산카페 #시청역카페 #부산여행 #부산카페추천 #부산카페투어 #가배재부산 #연산동가배재 #부산맛집 #부산디저트 #부산신상카페 10:00-22:00,2021. 9. 28.
식중독 증상과 예방(feat 부산 연제구 밀면 식중독),날씨가 더워짐에 따라서 여러 가지 일들이 많이 발생되고 있는데 얼마 전에 성남 분당 김밥집 식중독에 이어 어제는 부산 연제구 연상동 밀면... 흔히 여행 가서 물갈이한다고 하는 게 병원성 대장균 때문이라고 보면 됩니다. 캠필로박터균은 주로 오염된 물이나 냉동고기 등에서 발생이 되고...,2021. 8. 7.
"[부산 연제구 미용실] 연산동미용실 추천, 연산해수피아 미용실, 가을염색추천...","이점도 좋았어요 :0 우선, 1년 넘게 방치 해둔 제 머리 스스로 감당이 안되서 커트 싹뚝 많이 하고 싶었고, 여행사진보니 투톤으로 댕강 나눠져버린... 주소: 부산시 연제구 거제천로 258, 연산해수피아건물 1층 전화: 051-513-2674 영업시간: 매일 10:00~20:00 월요일 휴무 주차여부: 주차 가능(연산해수피아...",2021. 9. 8.
부산시청밥집 연제구맛집길 세이로무시에서 맛있는 편백찜 먹기,또 돌아온 먹방 포스팅 이때가 아마 휴가 가기 전날이었던거 같아요 여행 가기전에 배 든든히 채우고 떠날려고 엄마랑 언니랑 같이 부산시청밥집... [ 부산시청밥집 길 세이로무시 ] 전화 : 0507-1310-7440 주소 : 부산 연제구 시청로32번길 17 시간 : 평일 12:00 - 22:00 토요일 11:00 - 22:00 일요일 11:00 - 21:00...,2021. 8. 12.
[2021 부산의 맛] 연제구 편,"★ 대표메뉴 해물탕, 산낙지전골 주소 연제구 과정로 121 연락처 051-758-8838 영업시간 오픈 11:30 ~ 마감 21:30 휴무 월요일 웰빙여행 부산시청 근처에 위치한 칼국수와 만두전문점 부산시청 근처의 칼국수와 만두전문점으로, 매생이 칼국수, 들깨 칼국수 등 조금 특별한 칼국수와 함께 푸짐한...",2021. 7. 15.
부산가볼만한곳 연산동 길세이로무시 소문난 연제구맛집,물론 가장 큰 역할을 하는 소스도 맛이 매~~우 훌륭합니당 ^___^ 언제가도 먹고 오면 보양이 확실하게 되었다는 생각이 드는 부산 연제구맛집 길세이로무시 연산점!! 혼자만 알기에는 너무 아까운 집!!! 우리 모두 한번 가보아요~ 부산여행 오시면 꼭 가보세요~ 진심 맛나욧!!!! 강추♡ #부산연산동맛집...,2021. 7. 16.
부산 연제구 시청맛짓 -순곱이네,하시구 서비스받으세염 우울하면 화가 심하게 나면 입맛 확 떨어지고 목이 막히던 나는 어디갔죠 화내면서 열심히 먹는사람 본적있나요? 후 최대몸무게 찍음 잘먹었습니다♡♡ #부산순곱이네 #순곱이네 #부산곱창맛집 #부산시청맛집 #연제구맛집 #순대곱창전곸 #부산순대곱창전골 #부산여행 #부산맛집,2021. 2. 18.
부산연제구맛집 토곡 베트남음식맛집 더노이 분짜 맛집이네요,해외여행길이 탁 막혀버린 이후로 지난 여행 사진 보며 그리워만 하며 종종 여행지에서 먹었던 음식들 사 먹는 것으로 그리움을 달래는 중이라 지난 주말 오빠랑 오랜만에 베트남음식 먹으러 다녀왔다. #부산연제구맛집 #토곡맛집 #부산베트남음식맛집 더노이 파란 벽에 노란 간판으로 멀리서도...,2021. 7. 23.
부산연제구거제동 신혼부부가 신혼집으로 살기좋은 깔끔한 거제센텀아파트매매,부산연제구거제동 신혼부부가 신혼집으로 살기좋은 깔끔한 거제센텀아파트매매 매물번호:L-8430477 안녕하세요~ 노다지 소개에 부산베테랑 입니다!... 일단은 첫번째는 긴 여행을 가보고 싶습니다. 걱정과 일 생각을 하지않고 한 한달?짧으면 보름정도 여행에만 포커스를 두고 가보지 못한 곳을...,2021. 10. 11.
부산 연제구 오피스텔 관련 확진자 9명으로 늘어,"우리모두 하루빨리 코로나 이겨내서 여행도다니고 마음편히 아이들과 웃으며 지낼수 있는날이 하루빨리 왔으면 좋겠어요,,, #코로나19 #부산연제구오피스텔 #부산오피스텔확진자 #부산연산동오피스텔 #부산확진자 #부산코로나 #부산연제구sk뷰오피스텔 #sk뷰오피스텔확진자 #마스크...",2020. 9. 1.
Wedding Chapter 5 상견례(부산 연제구 청담),결혼식은 위에서 하니까 상견례는 부산으로 내려가고 싶으시다는 우리 부모님의 뜻을 존중하여 ( 부산 여행을 기대하셨음 ㅋㅋㅋㅋㅋ)상견례는... 상견례 장소는 밥이 맛있기로 아주 유명한 부산 연제구에 위치한 청담!! 상견례 하시는 분들 다덜 꼭 여기서 하세요 밥 너무 맛있고 퀄 장난 아니고...,2021. 4. 13.
부산 해운대 요트체험 연제구 아빠육아단,연제구 아빠육아 이번엔 부산 해운대 요트체험! 수영만 요트경기장에서 요트체험 요트가 처음인 베베들 비가 와도 마냥 신났던 즐거운 경험... 가능한거겠죠 부산여행 코스로도 좋을듯 배를 좋아하는 아이들이라 더 좋았던 경험 돌아가는 길에 광안리 앞바다로 가는 다른 요트도 보고 바다위에서...,2021. 6. 27.
부산여행 연제구 배산 256m 방문^^,"오늘은 날씨도 시원해서~~ 가까운 등산지로 연제구 배산으로 결정~~^^ 출발은 연제문화체육공원에서 시작합니다^^ 입구에 흙먼지 털이기 2대도... 보이네요~~^^ 부산여행에서 오늘은 오랜만에 등산을 했는데요, 언제나 항상 천천히 걸으면서 산책을 하고나니 몸과 마음이 한층 가볍고...",2020. 6. 30.
연제구 부산시청 오마카세 <스시키라쿠>,부산시청 도보 5분 거리에 위치한 <스시키라쿠> 입니다 런치 12:00 - 14:00 브레이크타임 14:00 - 17:30 디너 17:30 (18:00) 〰️ (1인 기준) 평일 런치... 있어서 감사하고 저도 돈 많이 벌어서 오마카세 투어하고싶다고 느꼈어요 연제구 스시키라쿠 강추 강추 또 강추합니다 !! 다른 코스로도 맛보러 가야겠어요,2021. 2. 12.
부산 연제구 거제동 아이러브 어린이치과 에서 발치,안녕하세요 이웃님들 재준파파 입니다 오늘 소개시켜 드릴곳은 #부산어린이치과 아이러브 치과 입니다 사실 #연제구어린이치과 아이러브는 예전에 포스팅 한적이 있지만 요즘 코로나로 여행도 거의 못가고 못보신분들도 계신것같아 다시 포스팅 해봅니다 부산 연제구 거제동에 위치한 어린이치과...,2020. 12. 19.
부산가족외식 연제구맛집 편백찜은 길 세이로무시.,"길 세이로무시 위치: 부산광역시 연제구 시청로 32번길 17길 전화번호: 051-868-7440 영업시간: 월-금 15:00-01:00(단체예약시 13:00부터) 토,일 13:00~01:00 오늘은 오빠랑 편백찜 먹으러 왔어요~ 예전에 엄마랑 한번 먹어본 적 있었는데 디게 맛있었던 기억이 ㅋㅋㅋㅋㅋ 다시 와쎄여어~~ 부산가족외식장소로도...",2020. 3. 10.
부산 연제구) 텐 퍼센트 연제이마트점,"연제구에서 여러개 봤던 턴퍼센트 테이크 아웃 전문점 대구엔 없는거라 너무너무너무 궁금했다 요즘 새롭게 보이는 컴포즈는 가봤고, 마침 일... 여행 온 듯... 직원분이 퉁명스러워도 말이다.카운터 좌측 벽면에 큰 메뉴판이 있고. 작은것도 있다.깔끔한 주방 인테리어. 천장이 높고, 나무로 되어...",2021. 5. 15.
<부산 연제구 전기>출장업체 연산동 전기공사 거제동 전기수리 누전 차단기교체...,여행을 마음껏 가지 못해 참 아쉽긴 하지만 달라진 상황에 맞춰 나름의 휴식을 찾아야 겠습니다. 일만 하다가 생각지도 못했던 병에 걸리거나... 부산연제구전기문제발생의 원인을 찾아봅니다. 연제구전업사 누전공사현장. <부산 연제구 전기>출장업체 연산동 전기공사 거제동 전기수리 누전...,2021. 5. 20.
연제구카페 카페오미니 부산시청커피는 여기 강추,제가 이 건물 헬스도 다녔었는데 ㅋㅋ 좋은 카페를 찾아서 너무 기분이 좋드라구요 연제구 부산시청 지하철역에서 아주 가까이에 위치한... 그래서 베트남 여행 갔을때도 진짜 1일 1아보카도스무디 국내에서는 스타벅스 쥬시 다 맛없었어요 그래서 제가 아보카도 사서 집에서도 자주...,2021. 4. 17.
(부산 연제구) 연제문화체육공원 나들이,^^;;) 그러고 보니 우리 집 아이들과 여행 간 포스팅이 작년 11월 말에 쓴 등억 알프스가 마지막이네요. 보통 주중 5일은 아이들과 읽었던 책에 대해... 마무리 잘 하시고 다음 주도 파이팅입니다! #부산 #부산연제구 #부산연제구공원 #연제문화체육공원 #연산동고분군 #유아동반 #4세 #7세 #아이와가볼만한곳,2021. 2. 7.
부산연제구가족사진 뜻깊은순간을 보내고 왔어요~!,그런데 막상 부산연제구가족사진을 찍으려 보니깐 어디에 가는 것이 최선의 선택일까? 싶어서 몇 날 며칠 고민하면서 폭풍 검색 했던 것 같아요. 전화로 상담을 하고 예약을 잡았고 대망의 그 날이 되었어요. 상담해주시는 분께서 보통 흰 옷에 청바지를 입는 캐쥬얼 하면서 단합된 모습으로 찍는...,2021. 4. 29.
부산 연제구 맛집 야타이미세 분위기 내 스타일~,"이제 진짜 완연한 봄이 오고 벚꽃이 만발하니 일본 갔던 기억이 새록새록 일본뿐만 아니라 이제 여행을 못 간다 생각하니 해외여행 갔던 추억들이 얼마나 나는지,, 오랜만에 날도 좋고 일본 갔던 분위기를 되살려보고자 부산 연제구 맛집 야타이미세 술집에서 한 잔하고왔다 부산 연제구 맛집, 부산...",2020. 3. 31.
[부산 연제구 부산시청 맛집] 한성집,"존맛탱 볶음밥 치즈추가 미쳤다 달걀과 치즈가 너무 부드럽고 말랑말랑한 식감을 주더라,, 월요일에 여기 한번 더 간닼ㅋㅋㅋㅋㅋㅋㅋ 더 많이 먹어야지ㅠㅜㅋㅋㅋㅋㅋㅋ #부산 #부산여행 #부산맛집 #맛집 #한성집 #고기맛집 #연제구 #연산동 #부산시청 #부산시청맛집 #돼지고기 #회식 #된장찌개 #볶음밥",2020. 1. 11.
연제구카페 솔리드커피 부산시청카페 부산시청커피숍,커피 맛나고 분위기좋은 솔리드커피 입니다. 계단 중간 중간에 있던 네온사인! #눈부시게빛나는오늘 되세요! 오후에 커피 한잔 하면수 리프레시 하고 다시 기운내보려합니다. #부산카페 #부산시청카페 #부산여행 #부산커피 #부산커피맛집 #커피스타그램 #오달스타그램 #부산연제구카페 #부산진구카페,2021. 9. 7.
부산맛집추천 고등어회 맛집 재방문 각 * 부산 연제구 연산동 고등어다찌,(내 돈 내산) 읽어주셔서 감사해요 댓글 공감은 사랑입니다♥ 이웃도 좋아유! #인스타그램 환영합니다 #부산맛집추천 #연산역맛집 #연산역술집 #부산여행추천 #고등어회추천 #연제구맛집 #부산연제구맛집 #고등어회맛집 #부산맛집,2021. 4. 15.
(부산연제구맛집/토곡맛집)소문난 베트남음식점 '더노이' :),"그렇게 맛있냐고) 응 그렇게 맛있었어.... 내 최애맛집되써요...... 다음에 오면 넴도 먹어보고 월남쌈, 분짜도 먹어볼거예요 #부산맛집 #연산동맛집 #연제구맛집 #토곡맛집 #부산베트남음식점 #더노이 #부산연산동맛집 #부산연제구맛집 #부산쌀국수 #부산분짜 #부산껌땀 #부산월남쌈 #부산여행",2021. 4. 9.
부산 맛집 추천 연제구 술집 연산동 고등어다찌,#부산맛집추천 #연제구맛집 #부산연제구맛집 #고등어다찌 #연제구술집 #연산동술집 #고등어회전문점 연제구 연산동에 위치한 고등어다찌 전경이랍니다. 오른쪽에 시계방향으로 도는 고등어회 모습이 정말 장관이어서 몇분 동안 유심히 살펴봤답니다. 부산 맛집 추천 연제구 술집 연산동 고등어다찌...,2020. 5. 1.
부산 연제구 영유아 어린이 물놀이장 개장 신청방법,해외여행 물놀이 사진보며 위안삼는 요즘 어린이수영장 보내줄까 물었더니 5살동생은 유아반 6살 누나는 정규반 한살차이로 반이 전혀 달라져서... 너무 감사드리며 건강관리 잘해서 즐겁게 잘 이용해봐야겠어요^^ 부산 연제구 영유아 키우시는분들 어린이물놀이장 같이 이용해보아요~~~,2020. 7. 27.
[부산/연제구]부산 연산동 가격대비좋은 대게무한리필 마야크( MAYAK),"#부산여행 #부산커플여행 #부산가볼만한맛집 #연제구맛집 #연산동맛집 #부산대게맛집 #저렴한대게맛집 #대게무한리필 #대게무한리필연산점 #연산마야크 #연산동밥집 #연산동술집 #연산동가볼만한곳 #연상동대게 #부산게무한리필 헬스러운 헬요일이네요,,, 주말에 코로나를 이겨내고 짧고 굵은...",2020. 2. 10.
부산 연제구 문교체 현장 + 해운대 호텔 방화문 수리 현장,"부산방화문 수리 현장 - 해운대 호텔 깔끔하면서도 멋진 뷰가 있으니 휴식하기 너무 좋은 공간인 것 같아요, 코로나라 여행가기도 힘든데 이런... 부산방화문 수리 완료 다음은 연제구에 있는 주택가의 방화문과 문틀 까지 교체 공사 현장인데요, 요즘은 월세를 내주더라도 약간의 리모델링은 하는...",2021. 7. 27.
건강검진센터 부산 연제구에서 우대가로 받는 법,건강검진센터 부산 연제구에서 우대가로 받는 법 먼저 부산건강검진센터를 비롯하여 전국에 병원을 자세하게 찾는 것은 결코 쉬운 일이 아니죠... 돌아다니며 여행을 하는 것을 굉장히 좋아하기 때문에 체력적인 부분에 있어서 철저한 관리가 필수적이라고 생각하는 사람 중 1인입니다. 다만 얼마...,2021. 3. 5.
부산 연제구에 가볼만한 곳_ 해안의 도시 아이스크림 할인점,부산시 연제구 거제동에서는 저소득세대 및 다문화가정에게 사랑의 선풍기 나눔 행사를 실시했다는 시원한 소식이 전해집니다^^ 우리나라에서 대표적인 해안도시이기에 피서지하면 부산을 빼놓을 수 없겠죠? 부산에는 유명한 산과 공원도 많은데 갑자기 베낭을 등에 메고 기차여행을 떠나고...,2021. 8. 1.
연제구썬팅 / 연산동썬팅 [ 3M썬팅부산연산점 ],"연제구썬팅 / 연산동썬팅 [ 3M썬팅부산연산점 ] 부산썬팅잘하는곳 소개해드려 볼까 하는데요. 저도 이제 7월말 부터는 여행계획이 있습니다 ! 그때부턴 여행포스팅 도 많이 올려드릴텐데요 . 지금은 장마철 이라서 흐리고 선선한 날씨가 될수 있지만 ,장마 끝나면 엄청 더울꺼라고 예상이 된다고...",2020. 7. 20.
"강아지자궁축농증/유선종양, 부산동물병원/연제구동물병원/연산동동물병원...",제주도 여행 잘 다녀오고 보호자님과 많은 추억을 만들길 바래요~^^ 정확한 진단과 치료를 위해 노력합니다 피정현동물병원 051)864-7582 #부산동물병원 #연제구동물병원 #연산동동물병원 #거제동동물병원 #부산강아지자궁축농증 #연제구강아지자궁축농증 #연산동강아지자궁축농증...,2021. 2. 1.
"#6월연제이야기7(21.6.21.)_이주환 부산 연제구(거제동,연산동)국회의원",연제구 내 유휴부지를 매입하여 생활체육시설을 조성하는 대안을 부산시와 협의 중입니다. 연제구민들께서 마음껏 사용하실 수 있는 생활체육시설 조성을 위해 가장 합리적이고 효율적인 방안을 조속히 마련하여 추진할 수 있도록 노력하겠습니다. 이어서 한국유흥음식점 중앙회...,2021. 6. 21.
부산연제구보험설계사 보장은 늘리고 보험료는 확실하게 내려드립니다,"부산연제구보험설계사를 찾고 계십니까? 오늘 제가 보험상담사로서 하는 일과 보험비교견적, 저희 회사를 소개하겠습니다. 저희 회사는 모든... 하지만 코로나로 여행 한번 하기 힘든 요즘이네요. 그래도 영차영차 모두들 조금만 더 힘내시길 바랍니다. 여러분의 행복한 인생을 응원하겠습니다....",2021. 5. 10.
연산동방범창 부산 연제구 엘지lg아파트 저층 격자방범창 설치시공,연산동방범창설치 시공 부산 연제구 엘지lg아파트 저층에 창문을 활짝 열어놓기 위해서 베란다 큰 창문쪽으로 튼튼한 격자방범창설치를 합니다.... 안심하고 여행 가실수 있습니다. #부산방범창 #연산동방범창 #광안동방범창 #해운대방범창 #양산방범창 #김해방범창 #화명동방범창 #사상방범창...,2021. 8. 8.
* 부산 연제구 연산동 고기 맛집 : 목구멍,신기방기♥️ 저는 처음 보는데 친구는 많이 봤다고 하더라고요 목구멍 연산 직영점 부산 연제구 고분로13번길 70 목구멍 목구멍 연산 직영점 외관... 연산동맛집 #연산동데이트 #연산동목구멍 #솥뚜껑고기맛집 #솥뚜껑고깃집 #부산맛집 #부산맛집투어 #부산맛집탐방 #부산여행 #서이추 #서이추환영,2020. 9. 20.
부산 연제구 카페 빵 냄새 가득한 테이크아웃 전문점 카페오미니,"건강함과 맛이 가득한 부산 연제구 카페오미니, 많이 찾아주세요! 전화문의 TEL)1833-3321 #카페오미니#부산여행#부산관광#부산데이트#부산가볼만한곳#부산맛집#카페거리#부산신상카페#연산동신상카페#신상카페#카페스타그램#바리스타그램#부산시청카페#부산시청맛집#커피스타그램#창업지원...",2020. 6. 24.
"부산 지역분석 (기본배경, 빅데이터, 구군별 특징) :: 중구, 영도구, 연제구, 동래구, 북구...","▷ 원도심권 : 중구/동구/서구/영도구 ▷ 신도심권 : 부산진구/연제구/동래구/금정구 ▷ 서부산권 : 사하구/사상구/북구/강서구 ▷ 동부산권 : 남구... '부산'하면 떠오르는 특색있는 명소와 먹거리 때문에 부산에 여행가는 분들은 꼭 들리는 중구 ▷ 중구 주요명소 : 자갈치시장, 국제시장, 남포동...",2021. 5. 28.
[부산의 맛] 연제구 편,"추어탕은 보통 부산식과 남원식으로 분류되어 두 가지 모두 판매하는 곳이 많은데, 이곳은 묵직한 맛이 특징인 남원식추어탕만을 전문으로 한다. ★ 가게정보 대표메뉴 추어탕, 가우리무침 주소 연제구 중앙대로1043번길 50 연락처 051-863-9911 영업시간 11:00a.m ~ 09:30p.m 웰빙여행 조금...",2020. 4. 29.
"부산 경매, 연제구 거제동 거제롯데캐슬피렌체 아파트",반갑습니다~^^ 정말 오랜만에 오늘은 두 번째 글로서 다시 인사드립니다~ 오늘은 날씨가 따뜻한 게 어디 가까운 곳으로 드라이브나 여행을 가고... 건인 부산 연제구 거제동의 거제롯데캐슬피렌체 아파트 정문 입구 주변의 전경과 아파트 단지 전경을 담은 사진인데요. 현재 본 경매 물건은 1차...,2021. 4. 6.
수도꼭지 누수 벽 물소리 수리 교체/부산 해운대 반여동 아시아선수촌(연제구 망미동),샤워기수전 욕실 화장실 수도꼭지 누수 벽 물소리 수리 교체/부산 해운대 반여동 아시아선수촌(연제구 망미동) 안녕하세요 푸르네홈케어 설비... 잠시 여행 다녀오시는 동안 계속 세고 있었다고 관리실에서 물새가 40만원 정도 나올꺼라고 말씀하셨다고 걱정 하셨어요 수전의 본체를 분리하고...,2021. 10. 8.
자동차 범퍼 하단 부분 도색 / 코나 - 범퍼 부분 도색 / 부산 연제구 동래구 금정구 진구 북구,안녕하세요~ 부산 교대역에 위치한 자동차 부분 도색 전문점 한양덴트 입니다. 요즘 날씨가 너무 좋네요~ 코로나만 아니면 여행 다니기 정말 좋은데... 교대역 한양프라자와 세병교 사이에 있으며 새동래 충전소 바로 옆 입니다. 지번 주소 : 연제구 거제동 152-7번지 네비에 '한양덴트' 치셔도 됩니다.,2021. 9. 15.
[부산/연제구]연산동 분위기좋은 소고기 해산물 편백찜 길세이로무시,#부산연산동 #연제구맛집 #부산맛집 #연제구술집 #연산동술집 #연산동밥집 #연산동데이트코스 #연산동단체예약 #연산동편백찜 #부산편백찜... 전복도 길세이로무시 직원분이 인원수에 맞게 잘라주셔서 매운소스에 전 찍어먹었어요ㅠㅠ 진짜 맛도리 이번 부산은 맛집 대성공 꼭 한번 부산여행...,2020. 2. 11.
부산연제구맛집 제일 먼저 생각나는 고등어회전문점,"부산연제구맛집 제일 먼저 생각나는 고등어회전문점 우리가 사는 연제구 1등 맛집을 꼽으라고 하면 제일 먼저 떠오르는곳이 있어요 바로 바로 터줏대감 맛집 부산연제구 대표맛집 이죠 바로 바로 어디냐면,, 연산동 고등어다찌 고등어를 안 좋아하는 사람도 와서 일단 한번 와서 먹어보면 훅...",2020. 7. 22.
연산동회식 부산연제구맛집 길세이로무시 연산점 편백찜 대박,길세이로무시 연산점 월요일~목요일 15:00~01:00 금토일요일 11:00~ 01:00 (단체예약시 낮1시부터 가능) 051.853.4719 부산연제구맛집 연산동 편백찜이 엄청... 연산동상견례장소 #부산여행 #부산상견례하기좋은장소 #부산룸식당 #연산동룸술집 #부산해물찜 #연산동뒷풀이 #연산동결혼식뒷풀이장소...,2020. 9. 9.
맛집 진화라락 중화식당 # 먹물면짜장면 # 부산시청맛집 # 부산거제동맛집 # 연제구배달맛집,#진화라락부산시청본점 [ 중화식당 진 화라락 ] 부산 연제구 거제동 488-8 051-861-5252 매주 월요일 휴무 점심 마지막 주문은 2시 40분 ㅡ 저녁 마지막... 중국 북경 여행 당시 훠궈를 어마어마하게 먹고도 디저트로 나온 튀긴 꽃빵을 연유에 찍어서 6개를 그 자리에서 먹고 차량에 올라 탈 때 포장한 튀긴...,2021. 4. 25.
