header,contents,date
[부산바오밥수제도시락] 6월 3일 부산대학교 배달도시락입니다.,"부산수학여행도시락 #부산현장학습도시락 #맞춤도시락 #부산수제도시락 #단체도시락 #샌드위치 #김밥, #유부초밥 #부산연제구도시락 #부산진구도시락 #부산사하구도시락 #부산도시락 #부산북구도시락 #부산화명동도시락 #부산연산동도시락 #부산제사음식 #부산제수음식 #부산설음식...",2021. 6. 3.
"부산광역시의 교통에 접근하기 위한 좋은 방법, 구청과 군청별 지하철 역에 대한 파악","해운대구 (동부산) 11. 연제구 ( 중부권) 80 / 100 ------ 호감도가 상당히 높은 편 ----- 12. 동래구 ( 중부권) 13. 기장군 ( 동부산 ) 77 / 100 14. 북구 ( 북부산... 영도구 ( 남부산 ) 72 / 100 16. 사상구 ( 서부산 ) 65 / 100 향후 여행하면서 순위는 뒤바뀔 수가 있다. ( 정기적인 평가 진행 ) 어떤 구,군에서 근무하든...",2021. 1. 7.
부산 야경 핫스팟! 황령산 봉수대? 그 옆 카페가 <구름고개카페> 강추강추 부산 여행,하조 부산 야경 스팟중에 가장 유명한 #황령산 에 다녀왔어요. 주말에 황령산 봉수대 갔더니 와... 들어가지도 못하게 차가 꽉 차 있더라구요. 그래서 현지인들에게 추천받은 황령산 야경을 찾아 떠났어요~~~ #현지인 #추천 #여행코스 황령산은 두 위치에서 올라갈 수 있습니다! 연제구 연산동 쪽이랑...,2020. 9. 5.
"부산여드름치료 핫플 다녀왔어요, 여행 후 뒤집어진 피부 진정 성공","전화 ***-***-**** 주소 부산 연제구 반송로 6 / 연산동 729-14 영업시간 평일 12:00~21:00, 토요일 10:00~16:00, 일요일/공휴일 휴무 오늘 날씨 진짜 실화인가요 잇님들,,? 어제 맹추위에 당한 꿀바는 오늘 나름 두껍게 업었는데 추워서 집갈뻔했잖아요,,(진심) 제주여행 마지막 날부터, 뭐가 잘못된건지 꿀바의...",2020. 11. 4.
연제구 맛집/연산동 술집 한번가면 단골되는 고등어회 전문점 고등어다찌,"부산광역시 연제구 고분로31번길 26 고등어다찌 연산본점 매일 오후 5시~ 새벽3시까지 연중무휴로 영업하구요 포장,배달도 가능합니다. 051-853-9374 / '오라주차장'에 1시간 무료 주차 호기롭게 들어갔다가 방은 물론이고 테이블이 꽉찬 홀을 보더니 뒷걸음치고 나오는 신랑 직원분이 저희를 보고 나와서...",2020. 3. 10.
[부산바오밥수제도시락] 5월 24일 부산대학교병원 배달도시락입니다.,"부산수학여행도시락 #부산현장학습도시락 #맞춤도시락 #부산수제도시락 #단체도시락 #샌드위치 #김밥, #유부초밥 #부산연제구도시락 #부산진구도시락 #부산사하구도시락 #부산도시락 #부산북구도시락 #부산화명동도시락 #부산연산동도시락 #부산제사음식 #부산제수음식 #부산설음식...",2021. 5. 24.
부산맛집 @ 길 세이로무시 #GIL SEIROMUSHI #고시세이로무시 #부산 편백찜 #딱새우...,"길 세이로무시 (부산 연산점) 전화번호 | ***-***-**** 주소 | 부산광역시 연제구 월드컵대로 114번길 2 (연산동 676-51) 영업시간 | 15:00-01:00(월~목) / 11:00-01:00(주말) ※연중무휴 개별 룸으로 되어 있는 편백찜 전문 길 세이로무시~ 주말 예약은 필수!!! 길 세이로무시는 시청 본점, 연산점, 서면점, 동래점...",2020. 8. 13.
부산 연산동 레터링 떡케이크 유유케이크 주문방법/후기,"연제구 연산동에 있는 유유케이크입니다:) 안락역 3번 출구에서 1367m 매장 앞 잠시 주차 가능하지만, 제가 방문한 날에는 다른 차들이 주차되어... 함 - 부산 여행으로 변경됨 - 픽업 2시 가능하다고 연락드림 - 2시 픽업으로 확정! - 오빠랑 일찍 만나서 12시 40분에 찾으러 감 - 픽업 시간이 아니라...",2021. 9. 23.
부산무더위여름 부산렉카 함께 합니다☎️⬅️클릭,지방에서 렌터카를 이용하여 부산으로 여행을 많이 옵니다. 24시간 자동차 고장 신고는 부산렉카 ☎️9782-4982 차량운행 중 타이어 빵구 차량운행중... #부산연제구렉카 #부산동래구렉카 #부산금정구렉카 #부산명장동렉카 #부산사설렉카 #부산자동차점프 #부산렉카 #부산사설렉카 #부산견인차...,2021. 7. 19.
[부산/연산] 연산동 데이트추천 철판요리집 그린애플,얘기해줬던 연제구맛집인 그린애플에 갔어요 #그린애플 영업시간 18:00-01:00 코로나로 인해 6시-10시 주일 휴무 0507-1337-7655 주차지원 전철을... 잔 하고 싶을 때 꼭 다시 찾고 싶은 그린애플이었어요 ! #연산동술집 #연산동맛집 #부산데이트 #부산분위기좋은술집 #부산여행 #부산철판요리 #연산레스토랑,2021. 8. 30.
"부산 맛집, 술집 추천 모음","부산 토박이지만 대학교를 타지에서 다니면서 부터 부산을 여행가는 느낌으로 가서 독특하고 맛난 곳들을 찾는 중. ( + 계속 추가할게요 )... 시청 소금 부산 연제구 신촌로 50 분위기 내고 싶을 때 가면 정말 좋은 곳. 분위기도, 맛도 정말 좋다. 기본으로 나오는 절인 토마토부터 맛있어서 기대...",2020. 7. 29.
"부산연산동맛집""제주오라방""_프렌치랙 세트 중_볶음밥_돼지오마카세느낌",⏰매일 17:00 ~ ☎️***-***-**** 부산 연제구 시청로32번길 6 시청역 근처에 있던 제주오라방 숙성기간이 40여 일이 되기 때문에 매일 한정수량을 두고 영업하신다. 그래서 프렌치 랙은 예약 안 하면 없어서 못 먹을 수도 있다고 한다. 입구에 들어가는 순간 여행 온 것 같은 느낌을 살짝 준다. 입구 홀...,2021. 7. 8.
"부산연산동맛집""제주오라방""_프렌치랙 세트 중_볶음밥_돼지오마카세느낌",⏰매일 17:00 ~ ☎️***-***-**** 부산 연제구 시청로32번길 6 시청역 근처에 있던 제주오라방 숙성기간이 40여 일이 되기 때문에 매일 한정수량을 두고 영업하신다. 그래서 프렌치 랙은 예약 안 하면 없어서 못 먹을 수도 있다고 한다. 입구에 들어가는 순간 여행 온 것 같은 느낌을 살짝 준다. 입구 홀...,2021. 7. 8.
[부산바오밥수제도시락] 5월 18일 부산대학교 배달도시락입니다.,"부산수학여행도시락 #부산현장학습도시락 #맞춤도시락 #부산수제도시락 #단체도시락 #샌드위치 #김밥, #유부초밥 #부산연제구도시락 #부산진구도시락 #부산사하구도시락 #부산도시락 #부산북구도시락 #부산화명동도시락 #부산연산동도시락 #부산제사음식 #부산제수음식 #부산설음식...",2021. 5. 19.
전국 셀프세차장 정보/부산편입니다,현황및정보/부산편입니다 부산하면 여행이라는 두근거림이 설레임으로 다가오기도 하지요. 이곳은 바다를 품은 죽성성당입니다 부산기장에... 부산독특닷컴(실내셀프세차장) -주소: 부산 연제구 좌수영로290 전국에서 가장큰 오프라인 자동차용품 매장이 2층에 있습니다 -운영시간:24시간...,2021. 4. 28.
부산 연산동 맛집 하오미엔 - 들어는 보았나 아찔한 마라간짜장,부산 연제구 신금로 25 노블레스스퀘어 131호 ▶지번 : 부산 연제구 연산동 302-3 노블레스스퀘어 131호 ▷교통 : 동해선 동래역 2번 출구에서 931m ▶기타 : 주차가능 #부산맛집 #부산간짜장 #부산여행 #마라간짜장 #연산동맛집 #연산동간짜장 #간짜장 #마라 #맛끝맛집 #맛끝간짜장 #맛끝TV #하오미엔,2021. 1. 3.
"[연산동호텔]위치, 가격, 시설, 청결 만족 부산호텔 추천 '호텔아마레연산점'",주소 : 부산 연제구 거제천로154번길 36 전화번호 : ***-***-**** #부산여행 #부산호텔추천 #부산출장모텔 #부산출장호텔 #부산여행모텔 #부산여행호텔 #호텔아마레연산점 #부산숙소 #부산여행코스추천 #해운대호텔 #광안리호텔 #부산호캉스,2021. 5. 26.
부산시청팥빙수 먹고 싶을 땐 동래옛날팥빙수 거제점,"잠시 추억여행은 접어두고 다시 힐링 타임 ~~~ 곳곳에 아기자기하게 꾸며 놓으셨네요 이런 곳 보신 적 있으세요? 솔직히 팥 조금만 줘서 마음... 사장님 인심 짱짱짱 bb 전화번호 : 0507-1495-3316 주소 : 부산 연제구 거제대로 178번길 60, 1층 영업시간 : 연중무휴 평일 11:30 ~ 21:00 주말 11:30 ~ 22:00 공휴일...",2021. 6. 3.
[음주운전 부산변호사] 다가오는 휴가철 음주운전에 대한 주의가 필요합니다.,"코로나 때문에 해외여행까진 힘들어지다보니 아무래도 휴가는 국내여행의 비율이 높아질 것으로 보입니다. 국내를 여행한다면 결국 차를... 합리적인 수임료 -상황에 맞는 적절한 법률서비스를 제공합니다- 부산음주운전변호사 올인법률사무소 부산 연제구 법원로 32번길 18, 나래빌딩 501호...",2021. 7. 30.
"이삭토스트 "" 베이컨 포테이토 피자 "" 후기",저번주 신랑과 여행을 다녀오는 길 ... 배가 너무 고파서 멈춰 선 이삭토스트 항상 배달만 시켜 먹어봤지 직접 가서 픽업하는 건 처음이었어요... 다음에는 핫치킨 mvp를 먹어봐야겠어요 :) 주소 : 부산 연제구 연산동 587 - 8 영업시간 : 7:30 - 20:00 전화번호 : 051.865.3253,2021. 1. 23.
⛑ 부산 신종 코로나19 예방 차원 부산의료원 응급실 폐쇄 ! 베트남 여행 귀국 남성 사망...,17일 경찰에 따르면 이날 오전 9시쯤 부산 연제구 부산의료원 응급실에 A씨(40대)가 119 구조대에 의해 실려 왔습니다. 당시 A씨는 호흡곤란과 가슴 통증을 호소해 의료진이 긴급 심폐소생술을 했으나 숨진 것으로 전해졌습니다. 이 남성은 베트남 여행을 갔다가 이날 귀국한 것으로 알려졌습니다....,2020. 2. 17.
"<연제구 꽃집><연산동 꽃집> 꽃집유하_ 4월의 원데이클래스, 소중했던 장면들",히히 그리고 부산여행을 온 세 아가씨들- 5월초 시즌이라 정신없이 바빴던 날이었어요. 오히려 저를 배려해주며 세 친구는 커피를 마시며 친구끼리... 부산꽃집 연산동꽃집 연제구꽃집 물만골꽃집 망미동꽃집 꽃집유하 부산꽃집 연산동꽃집 연제구꽃집 물만골꽃집 망미동꽃집 꽃집유하,2020. 5. 21.
부산 밀면은 국제밀면본점에서 드세요 (Ft.부산교대),부산여행이 처음이신 분들은 저처럼 놀라지 마시고 드시길. 쫄깃한 물밀면 물밀면이 나왔습니다. 광주의 쫄면과도 비슷해보입니다. 하지만 밀을... 부산에 오시면 국제밀면 본점에서 밀면의 본맛을 느끼고 가시기를 추천드립니다. 국제밀면본점 주소 : 부산 연제구 중앙대로1235번길 23-6 Tel : 051...,2021. 1. 23.
[부산 맛집] 부산 국밥 맛집 연산동 수복돼지국밥 (+수육),수복돼지국밥 부산 연제구 고분로 41-2 2층(연산역10번 출구) * 영업시간 : 매일 08:00~24:00 (밤12시까지) ☎️***-***-**** 김해공항에 도착하자마자... 부산에 유명한 돼지국밥집이 많은데 부산여행 갈 때마다 하나하나 다 먹어보고싶으다ㅏ 끗! #부산 #부산맛집 #부산국밥 #부산돼지국밥 #돼지국밥...,2021. 3. 3.
부산시청 이자카야 [도쿠도쿠] 다양한 술안주 맛집!,주소:부산 연제구 연산동 1503-15 영업시간:17:00~03:00 휴무일 없음 전화번호:051-852-0319 입구에서부터 이자카야 분위기가 물씬 풍기고 문열고... 예전에 남편과 일본배낭여행갔을때 즐거웠던 기억이 새록새록 나더라구요.. 안주 맛나기로 유명한 집이라... 메뉴판보고 한참을 공부중입니다~~ㅎㅎ 이것도...,2021. 5. 16.
부산연산동김밥 바른손충무김밥더샾파크시티점,요즘 안그래도 계속 생각나서 아우 거제 여행을 가야하나 ~~ 하고 있는데 저의 눈에 딱 포착된 #부산충무김밥 !!! 저번에 사실 다른음식점에 가서... #연산동더샾파크시티맛집 #부산연제구맛집 #부산연제구밥집 왁 진짜 계속계속 먹게 되는 마력의 이 마약간은 충무김밥 너무 옳아요...,2021. 4. 13.
"부산 교대역맛집, 부산 3대밀면 국제밀면 본점 솔직후기",오늘은 부산여행에 가서 먹었던 밀면 맛집을 소개해보려고 한다. 부산밀면하면 가장 먼저 검색어에 뜨고 후기도 참 많았던 부산 3대밀면... 만족스러웠던 부산 밀면맛집. 개인적으로 추천하고 싶은 음식점이다. 국제밀면 본점 위치 및 영업시간 위치 ) 부산 연제구 중앙대로1235번길 23-6...,2021. 1. 24.
부산에서 밀면 솔직히 국제밀면,부산여행 많이들 하시죠? 부산에는 진짜 먹거리도 많고 볼거리도 많은 곳이잖아요. 그중에 오늘 소개드릴 찐맛집 국제밀면 본점 솔직히... 그치만 부산에는 수많은 체인이 있지만 맛이 다 똑같지않다는 사실. 그중에 제가 부산 출장가면 늘 먹는 밀냉면 맛집입니다. 부산 연제구 중앙대로1235번길...,2021. 3. 16.
인천에서 부산까지 가족여행도 인천공항콜밴으로 편리하고 안전하게,"딸과 손주와 함께 떠나는 부산여행 #인천공항콜밴 #부산대형택시 전통을 이어 미래를 읽는다는 보수동책방골목!! 헌색과 새책이 같이... 대한민국 제1의 무역항~ 강서구, 금정구, 기장군, 남구, 동구, 동래구, 부산진구, 북구, 사상구, 사하구, 서구, 수영구, 연제구, 영도구, 중구, 해운대구...",2020. 8. 27.
[부산 연산동] 아뜰리에이브아 - 연산동 꽃집에서 리스만들기 원데이클래스 후기(위치...,또 연제구 꽃집 아뜰리에이브아 사장님이 유럽 여행을 다니며 하나하나 모은 예쁜 식기들과 함께 사랑스럽고 풍성한 미니 꽃 화환들이... < <영업 시간> 월-토 11AM~8PM (일요일 휴무) <영업 정보> 주소: 부산 연제구 중앙천로25번길 78 1층 아뜰리에 이브아 연락처: 051-851-8785 카톡: pf.kakao.com/_zxksrT...,2020. 6. 3.
"부산광역시 연제구청(釜山廣域市 蓮堤區廳, Busan Mertopolitan City...",부산 연제구청 부산광역시 > 연제구 > 연산2동 기간:2020.07.10 ~ 2020.07.10 (1일) 컨셉:사진에 담는 출사여행 경로:부산 연제구 거제1동(회사사무실)▶부산 도시철도 3호선 거제역▶부산 도시철도1/3호선 연산역(환승)▶부산 도시철도 1호선 시청역▶부산 연제구청 TIP 부산 연제구 연산2동에 소재하는...,2020. 7. 11.
부산 황령산 봉수대 대중교통 이용해서 가기 (feat. 뚜벅이),"여기서 버스를 타야합니당 연제구1, 연제구2 버스를 이용하시면 돼요. 황령산을 올라갈 때는 버스로 한..15분 정도 걸렸는데 내려올 때는... 가시는 분들이라면 바다 야경도 좋지만, 멀리서 도시 부산을 느낄 수 있는 야경도 보고오시길 추천드려요~! #황령산야경 #황령산봉수대 #부산여행 #부산야경",2021. 6. 12.
부산시청 빵집 / 연산동 베이커리 카페 _ 아뜰리에마롱,주소는 부산 연제구 연산동 1310-35 지하철로는 시청역 8번 출구와 더 가까움 뭔가 여기가 더 모던한 느낌! 안에 구매한 빵을 먹고갈 수 있는 좌석도... 혼자 추측하기 ㅋㅋㅋ 연산동 빵집 아뜰리에마롱 외관에 시오빵 포스터가 붙어있던데 이 집이 시오빵도 잘하나 봄 - 나 근데 일본 여행 갔을때...,2021. 1. 28.
"연산동 디저트시네마 부산 빵지순례 필수코스+빵추천,주차팁",오픈 <위치> 부산 연제구 쌍미천로 32-1 디저트시네마 <주차장> 따로 없어요 가게 앞 빵 살때 잠시 주차가능 주차팁 (저는 주로 골목길에 주차해요)... 저는 유럽여행 갔을 때 생각이 새록새록나고 막 그랬어요 헤헤 사장님이 예쁘다고 칭찬해주신 사진이에요 내나 뿌듯뿌 사진에 보이는 두가지의...,2021. 6. 2.
"[거제맛집] 부산 밀면 대장주 ""국제밀면"" 부산밀면추천",""" 국제밀면 법조타운직영점 "" 부산 연제구 법원남로9번길 22-1 영진빌딩 매일 10:30 ~ 21:30 주차 가능하지만 테이블당 1대만 주차권 지급 매장 앞에... 승부하는 부산 3대 밀면인 국제밀면! 그래서 그런지 양이 진짜 많더라구요. 점점 더워지는 부산날씨 국제밀면으로 여름 준비해요. 여행 가시는 분들도...",2021. 4. 20.
<부산 황령산 등산코스 > 난이도 하 A코스 경성대-갈미봉-바람고개-사자봉-봉수대...,#부산황령산#황령산안내도#황령산등산코스#황령산A코스#황령산봉수대#황령산바람고개#황령산사자봉 황령산 안내도 <황령산> 부산 연제구 연산 5동... 사자봉 까지만 보고 오겠다고^^ 계단을 끝없이 오르다보면 계단 끝자락에서는 돌들이 마치 해외여행 온듯한 포토존을 만들어 두었습니다....,2021. 5. 5.
"♥ 진달래꽃 개화시기, 꽃말, 진달래 축제, 김소월 시 사투리 버전","진달래꽃 ☞주소 : 부산광역시 연제구 연산동 산38-6 네비게이션 찍고 당장 달려가 보고 싶지만, 비대면 렌선여행으로 눈요기라도 즐길수 있으면 좋겠습니다. ~여기까지 봉제산 진달래꽃 ~여기까지 부산 배산성지 진달래꽃(방방곡곡 하재두) 진달래 꽃처럼 아름답게 화사하게 오늘도 행복한...",2021. 3. 19.
부산 여행 투어 온천천 봄꽃 하트 벗꽃 유채꽃 수선화 홍매화 아름 다연 풍광 힐링...,#부산 #여행 #투어 #온천천 #봄꽃 #하트 #벗꽃 #유채꽃 #수선화 #홍매화 #매화 #아름다운 #자연 #풍광 #힐링 하시길 바랍니다. #동래구 #연제구 #동래역 #풍경스타그램 #꽃스타그램 #자연꽃스타그램 #힐링스타그램 #풍광스타그램 #고프로 #고프로라이프 #고프로패밀리 #GoProKR #GoPro #Busan #Korea,2021. 3. 24.
부산연산동술집 추천 연산명당 연산동데이트 중,"부산 맛집을 찾아다니는 다솜이의 맛집 여행. 이번에는 부산연산동술집 추천드릴게요. 연산동데이트 장소로도 좋은 하이네켄 생맥주전문점이에요.... ●주소 : 부산광역시 연제구 고분로 13번길 67 연산명당 ●전화 : 051-866-1009 ●영업시간 : 매일 17:00~03:00, 일요일 17:00~23:00 ▷사회적거리두기 단계에...",2021. 10. 7.
"부산호텔 - 유아인 (You, I In) - 연산역","본 숙소는 부산 종합 운동장, 스노우파크, Daedong Hospital 등과 같은 도시의 주요 명소들과 가까운 거리에 있어 투숙객이 편리한 여행을 즐길 수... 주소 : 부산 연제구 월드컵대로120번길 14 위치 : 부산 숙소 객실수 : 38 체크인 시작시간: 18:00 체크아웃 마감시간: 12:00 숙소 상세정보, 요금조회...",2021. 2. 27.
[부산바오밥수제도시락] 5월 11일 부산대학교 배달도시락입니다.,"부산수학여행도시락 #부산현장학습도시락 #맞춤도시락 #부산수제도시락 #단체도시락 #샌드위치 #김밥, #유부초밥 #부산연제구도시락 #부산진구도시락 #부산사하구도시락 #부산도시락 #부산북구도시락 #부산화명동도시락 #부산연산동도시락 #부산제사음식 #부산제수음식 #부산설음식...",2021. 5. 11.
연산 코오롱하늘채 최적의 위치에 들어서는 연산동 아파트,"연산은 부산 연제구에 위치한 곳입니다. 부산은 우리나라에서 제2의 수도라 불리울만큼 대단히 큰 대도시이지요. 부산이라는 도시가 가진 도시 고유의 분위기 때문에 이곳으로 여행을 가는 사람들도 정말 많은데요, 편리한 교통입지와 아름다운 자연경관 등 삶의 터전으로 자리 잡기에 대단히 좋은...",2020. 5. 21.
"낭만세일링요트 타고, 부산 야경즐기기(feat. 아이러브요트)",아이러브요트 부산 연제구 월드컵대로235번길 23 070-7531-0700 / ***-****-**** 세일링요트 타고 아름다운 부산 야경 감상하기 항상 안전이 우선입니다.... 야간투어가 아닌 낮투어 한번 해보렵니다. 부산 여행 가시면 낭만적인 요트투어 추천합니다 오늘도 함께여서 감사합니다 감성충만 도로시였습니다.,2021. 5. 9.
[봄2탄: 부산벚꽃 명소] 2021 벚꽃 개화시기 경남 봄 드라이브코스 갈만한곳,부산 #황령산 #황령산벚꽃길 부산연제구 저는 드라이브코스중 황령산을 좋아해요! 작년 야간드라이브를 갔을때의 추억을 잊을수없어서 그런가봐요... 안좋아하는데 여행가서 먹는 호떡이나 토스트는 왤케 맛있는지 몰겠어요! 겨울에 롱패딩입고 새벽에 내려서 편의점에서 핫바랑 육개장먹고...,2021. 4. 7.
"정훈부장의 부산분양정보] 1억대 초역세권 생활형숙박시설 ""연산 어반스테이 더 시티...","국내 여행이 호황이라 관광지에 들어선 생숙은 투자용으로 제격이란 판단에 수요자들이 몰렸죠 다주택자들 사이에서는 ""절세형 투자상품""으로... 위치 : 부산 연제구 연산동 726-12번지 외 2필지 규모 : 지하 1층 ~ 지상 23층 1개동 세대수 : 213실 주차대수 : 70대(기계식 68대/자주식 2대) 연산...",2021. 4. 15.
부산 연산동 타이마사지 받고 나른함을 이겨봐요 - 수태국마사지,단체 패키지 여행객들부터 배낭여행객가지 태국 여행 다녀오신 분들 중 마사지 한번 안 받아보신 분 없으실거에요. 저도 그래서 제 이동 동선상에... 해결해 줄 수태국마사지 조용하고 향도 좋아 아늑해지는 공간입니다. 주소 부산 연제구 과정로237번길 115 (연산동) 연락처 051-751-5959 24시간 영업합니다.,2021. 4. 18.
부산연산역맛집 편백찜 연산동회식 길세이로무시 연산점,"길세이로무시 연산점 ***-***-**** 부산 연제구 월드컵대로114번길 2 주말 13:00 - 01:00(토,일) 평일 15:00 - 01:00(월~금) 단체예약시) 오후1시부터 ★연중무휴... 저도 일본여행중에 후쿠오카에서 비슷한 음식을 먹어본 기억이 있어 반갑더군요. 부산연산역맛집 연산동회식 길세이로무시 연산점 저희는...",2020. 3. 21.
부산맛집 / 부산만두 / 만두맛집 - 파파손만두,"김치만두라고해서 매울줄알았는데 맵지않아서 아기들도 잘먹을수있을거같네용 다먹어버렸는데 움짤보니까 또먹고싶어져요,, ㅋㅋㅋㅋㅋㅋㅋㅋㅋㅋㅋㅋㅋ 저처럼 오프라인으로 시킬수도있지만 매장에 방문해서 포장해 갈수도 있어서 부산 여행갔을때 들리기 좋을거같아요!! 부산 연제구...",2021. 2. 5.
[부산바오밥수제도시락] 5월 13일 나라키움부산통합청사 배달도시락입니다.,"부산수학여행도시락 #부산현장학습도시락 #맞춤도시락 #부산수제도시락 #단체도시락 #샌드위치 #김밥, #유부초밥 #부산연제구도시락 #부산진구도시락 #부산사하구도시락 #부산도시락 #부산북구도시락 #부산화명동도시락 #부산연산동도시락 #부산제사음식 #부산제수음식 #부산설음식...",2021. 5. 13.
부산호텔 - 호텔 아마레 연산 (Hotel Amare Busan) - 연산역,#부산호텔 #부산숙소 #호텔아마레연산 호텔 아마레 연산 호텔 아마레 연산 (Hotel Amare Busan) 숙소측 설명 : 연제구에 있는 본 숙소(호텔 아마레 연산)는 여행객들에게 인기가 있습니다. 도시의 재미가 가득한 곳에서 3 km 거리에 있는 이 2.5성급 숙소는 좋은 위치와 도시의 많은 명소들로의...,2021. 2. 28.
"[부산/연산] 기대보다 실망한 룸 보리굴비집, 청담",여행패션 #여행코디추천 #운동화코디 #가족외식 #코로나외식 #외식 #외식추천 #부산 #연산동 #연산 #연제구 #부산외식장소 #가족모임 #상견례장소 #상견례 #상견례추천 #추천 #귀빈정식 #귀빈 #코스요리 #코스 #오미카제 #후기 #단점 #비판 #내돈내산 #솔직후기 #화장실 #위치 #가는방법 #가는길...,2021. 2. 27.
[부산 /가온 밀면] 간단하게 먹기 좋은 온천천점 가온밀면,가온밀면 위치:부산 연제구 신금로 10 (동래역 2번출구에서 1401m) 전화번호:050713195269 영업시간: 10:00-20:00 주차♀️ #부산 #부산여행 #부산맛집 #부산밀면 #밀면맛집 #가온밀면 #가온밀면온천천점 가온밀면 입구 두둥 귀여운 노란색 간판입니다. 길가쪽에 위치하고 있어서 주차장은 따로 없었어요....,2021. 3. 15.
부산 장어 맛집 - 오대양수산,감사합니당 ❤️❤️ #오대양수산 #연산동맛집 #장어맛집 #민물장어맛집 #바다장어맛집 #연산동오대양수산 #연제구맛집 #부산맛집 #부산맛집투어 #찐맛집 #부산경상대맛집 #연산맛집 #서이추 #이웃 #이웃환영 #소통 #일상블로그 #장어구이 #맛집탐방 #부산여행 #온천천맛집 #일상 #소통해요...,2021. 8. 19.
