header,contents,date
은평구 한옥마을 둘레길 걷기 좋고 나들이 참 좋았어요.,다녀온 은평구 한옥마을 둘레길 걷기 좋고 나들이 참 좋았어요. 그렇지 않아도 멀리는 가질 못하다 보니 서울 구 별로 가볼만한곳 찾던 중 얼마... 시간으로의 여행 괜찮은 날이었답니다. 참 멋스러운 은평구 한옥마을 나들이 둘레길 잠시 걸으면 조용히 여행하기 좋은 곳이었답니다. 1인 1잔 카페...,2020. 9. 12.
은평구 이자카야) 역촌동 맛집 배키,요즘 같이 #해외여행 못가는 #코시국에 배키에서 #일본여행 어떠세요? 주소 서울 은평구 진흥로 21 영업시간 매일 17:00 - 05:00 전화번호 02 353 9992 ✔️본 포스팅은 업체로부터 식사한 금액의 일부를 지원 받아 솔직하게 직접 작성한 후기입니다,2021. 8. 5.
[랜선여행] 한 여름 더위를 잊게 만드는 오싹한! 서울 계곡여행지 추천,"매니가 선정한 서울 계곡여행지 2선 소개 매-하! 안녕하세요 금일 수도권 사회적 거리두기 4단계로 격상되었는데요. 여행자터미널에서는... 진관사계곡 (서울 은평구 진관길 73) 은평구 진관내동 북한산성 입구에 위치한 진관사계곡 도룡뇽, 산개구리 등 서울시 보호종이 관찰되는 곳이기도...",2021. 7. 12.
서울북한산카라반 서울 근교 카라반 여행 후기,"서울북한산카라반 - 서울북한산럭셔리카라반&수영장글램핑 서울 은평구 진관동 326-1 ***-****-**** 입살 15:00 / 퇴실 11:00 독채, 침대방, 개별바비큐, 카라반, 글램핑, 수영장, 바비큐장, 공용시설, 와이파이, 잔디, 온돌방, 스파 서울북한산카라반 오늘은 7월 여행으로 다녀온 서울북한산카라반 후기를...",2021. 7. 15.
살아있는 은평구맛집 리스트,태백산 생고기 전화번호 : 02 -389-0406 주소 : 서울 은평구 대조동 185-40 영업시간 1시 ~ 10시까지 진짜 맛집은 티내지 않아도 많은 사람이 찾는곳이라고 생각해요. 화려하고 대단한 이력을 걸지 않은 외관임에도 입소문은 탔다면 다 이유가 있는 거죠. 외부로 들어가면 조금 더 정겨운느낌을 볼 수가...,2021. 5. 26.
"서울여행, 션투어 서울편 - 마포구 망원동에 있는 신상카페 선과점 2호점 과일디저트가...",모을 메뉴판 카페 모을은 은평구에 있는 #선과점 이라는 과일 디저트를 판매하는 카페 2호점이에요. 저는 선과점을 먼저 알게 되어 모을도 알게 되었어요. 이번 서울여행 중에 선과점이든 모을이든 둘 중 한 곳은 꼭 가고 싶은 마음에 코스를 살피다가 모을을 일정에 넣었습니다. 모을도...,2020. 6. 26.
"은평구,‘문화관광’ 홈페이지 새롭게 구축",은평구 문화관광 홈페이지 화면 [은평구 제공] 서울 은평구(구청장 김미경)는 지역을 방문하는 관광객들이 더욱 편리하게 관광을 즐길 수 있도록... 서울시 종합교통관제센터(TOPIS)와 연동해 대중교통 및 주차장 정보를 편리하게 이용할 수 있도록 하고 마이페이지 메뉴를 추가해 ‘나만의 여행코...,2021. 4. 5.
"실외활동(실내나들이장소)] 비오는 날, 미세먼지 많은 날, 은평구 공동육아나눔터 2호점","☆ 장소: 서울 은평구 대조동 은평구공동육아나눔터 2호점 (서오릉로 114-16 2층) 공동육아나눔터 설명 공동육아 나눔터 2호점은 대조동... <앞으로의 장소들은 어떤 곳일지 궁금하신가요? 공감과 댓글, 이웃신청으로 글로리맘의 고군분투 육아여행에 함께 동행해주세요>",2021. 5. 20.
은평구술집『탐라포차 연신내점』을 소개합니다.,“인스타 감성으로 제주도에 여행 온 느낌을 받을 수 있는” 은평구술집『탐라포차 연신내점』을 다녀왔습니다. 은평구술집『탐라포차... 마실 수 있는 소주와 살얼음 생맥주로 최고의 술맛을 음미할 수 있었습니다. 주 소 : 서울 은평구 연서로29길 6 / 2층 탐라포차 소정의 포인트를 지급받음,2021. 5. 31.
"[서울 은평구 진관동] 은평 한옥마을, 서울에 이런 곳이 있다니!",사실 1박 2일 여행을 가려고 했으나.. 대학원 과정과 겹쳐 취소가 되고 당일치기로 어디가 좋을까~ 하다가 맞춰놓은 토퍼를 잘 쓸 수 있을 것 같았던 한옥마을로 고고! 서울에 이렇게 고즈넉한 '은평 한옥마을'이라는 곳이 있다니~ 곧 핫해질것이다 ㅋㅋㅋ 이곳은 이미 아는 사람은 다 아는듯하지만...,2020. 10. 30.
6월 여름 나들이/야외활동] 불광근린공원 생각숲길에서 2시간 숲놀이(은평구 불광동),"☆ 일시: 2021년 6월 25일 금요일 (첫째 37개월 + 둘째 20개월 + 셋째 임신 27주) ☆ 활동명: 숲에서 운동을~ ☆ 장소: 서울 은평구 불광동 불광근린공원... 공감과 댓글, 이웃신청으로 글로리맘의 고군분투 육아여행에 함께 동행해주세요> 6월에 했던 더 많은 활동들 6월에 글로리맘과 두 형제가 활동한 더...",2021. 6. 25.
만족스러웠던 응암동맛집 명륜진사갈비 응암점 은평구 무한리필,어느 지방에 여행갔다가 맛집들의 웨이팅도 너무 길고 문도 닫고..ㅜㅜ 그래서 어쩔 수 없이 들어가게 된 명륜진사갈비에서 굉장히 맛있고... 응암동맛집 명륜진사갈비 응암점 [전화번호] 02-304-9229 [주소] 서울 은평구 응암로 235 [영업시간] 매일 11:30-22:30 * 연중무휴 새절역에서 천천히 걸어서...,2021. 4. 29.
"북한산 진관사!(사찰 여행, 서울에 가볼 만한 절)","북한산 진관사!( 사찰 여행, 서울에 가볼 만한 절) 은평구 한옥마을로 올라가다 보면 진관사 가는 길이 나오는데요. 은평 한옥마을을 둘러보고 진관사로 올라갔어요. 북한산 기슭에 있는 진관사는 포천에 있는 봉선사처럼 크더라고요. 사람들도 많이 오고요 진관사 서울시 은평구 진관동 북한산...",2021. 9. 18.
서울여행 서울둘레길 8코스 도보여행,"#서울둘레길 8코스는 은평구에서 시작을 해서 도봉구까지 가야하는 꽤 긴 거리이다. 약 32km 내외. 하루에는 다 못걸을 것 같아서 이틀로 나누어 걷기로 한다. 일단 걸을 수 있는 곳까지 걸어보기로 한다. #서울여행 서울둘레길8코스의 시작점은 메뚜기 다리. 어째 좀 섬뜩하기도 하고, 귀엽기도...",2021. 9. 15.
[외형복원]-팰리세이드 앞범퍼하단교체+도색-은평구외형복원+은평구판금도색...,"찾아오시는길 : 서울특별시 은평구 진흥로 87 (101호) 상담문의 : 02-388-4566, ***-****-**** 운영 시간 : AM 9:00 ~ PM 7:30 안녕하세요. 은평구 역촌동... 간만에 가족여행 다녀오니 할일이 무지 많네요! ㅋ 퐈이팅 입니다^^ → 팰리세이드 전범퍼하단교체+도색작업 이야기 입니다.010-3551-1629...",2021. 9. 25.
"오늘방송 연락처 4월 8일 안성 고기부대찌개, 소갈비보약떡찜 서울 은평구 우주미","여행본능, 섬 - 에너지 충전 프라이빗 섬여행, 대매물도 편 ▶<통영 요트투어 통크루즈> 번호 : ***-****-**** 2. 오천만의 메뉴 - 의정부 vs... ‘소갈비보약떡찜’ 편 ▶<우주미> 주소 : 서울 은평구 은평로 185 번호 : 02-354-7788 4. 김PD가 떴다 - 6천 마리 장어 수송 大작전 편...",2020. 4. 8.
은평구 오마카세 스시쇼부 주말 디너 후기,안녕하세요 ☺︎ 개강하고 여행도 다녀오고 일정이 많아서 블로그에 너무 소홀했네요 ㅠㅠ 이제 다시 열심히 포스팅해야겠어요 ㅎㅎ 어제 생일... 역시 네이버 예약 아주 편합니다. ㅎㅎ ☺︎ 이상 은평구 오마카세 스시쇼부 리뷰였습니다~ 주소 서울 은평구 은평로13길 11-9 2층 영업시간 11:30 - 22:00,2021. 3. 8.
[맛객또비_에어비앤비] 나는 도심속에서 힐링하지롱 / 은평구 에어비앤비...,#아름다운황토집 #서울에어비앤비 #에어비앤비 #에어비앤비추천 #은평구에어비앤비 #은평구숙소 #은평한옥마을 #은평한옥마을숙소 #서울숙소 #서울펜션 #펜션추천 #서울펜션추천 #도심속힐링 #힐링펜션 #서울바베큐 #커플여행 #서울여행,2020. 8. 5.
은평구 불광천 벚꽃 따라 동네 산책,"은평구 불광천 벚꽃 따라 동네 산책 돌아온 벚꽃 시즌, 4월에 접어들면서 서울에도 벚꽃이 만개했습니다. 하지만 꽃을 제대로 즐길 수 없는 게... 여행 콘텐츠가 도움 되셨나요? @닭형의 팬이 되어주세요! 팬 추가하면? 블로그, 유튜브, 인스타그램 여행 콘텐츠를 한곳에 모아 볼 수 있답니다!...",2020. 4. 3.
"[은평구] 1인1잔 : 한옥마을을 내다보며 커피를 마실 수 있는 카페, 은평 한옥마을 산책",서울나들이에 나섰다. 네이버 지도에 가고 싶은 곳이나 다녀온 곳을 기억하기 위해 플래그를 달아두는데 은평구 한옥마을에 있는 카페도 가고... 도착한 방법대로 다시 떠나가는 길 다음에는 꼭 등산을 해야지 마음 먹게 되는 아름다운 북한산 자락. #은평한옥마을 #서울나들이 #서울여행,2021. 8. 22.
족발 TOP 5 편 ▶<보들이족발> 주소 : 서울 은평구 연서로 230-10 번호 : 02-388-7610,"3GO 태백 3GO 여행 편 #고토일청국장 *청국장, 태백 한 상 판매 주소 : 강원 태백시 태백산로 4587 번호 : ***-***-**** 2. 우리 동네 반찬 가게... #빅데이터랭킹 #맛집 서울 최고의 족발 TOP 5 편 #보들이족발 주소 : 서울 은평구 연서로 230-10 번호 : 02-388-7610 #평안도족발집 #성수족발...",2020. 12. 4.
은평구오리가 땡길땐 응암맛집 합정오리농장,저 부모님과 함께 바다도 보고 맛있는거 먹으러 여행왔어요 관광지 방문보다는 맛있는거 먹고 예쁜 숙소에 쉬러 온거라 여행이라고 하기엔 좀... 합정오리농장 서울 은평구 증산로23길 27 매일 11:00 - 23:00 일요일에 맛있는 저녁도 먹을겸 오랫만에 오리고기로 몸보신도 하려고 방문한건데요...,2021. 1. 27.
[문화포털 문화추천] 새해 독서 목표 세우기! 책 속으로 여행을 떠나볼까요?,특히 서울 은평구는 특유의 고즈넉한 매력으로 작가들이 많이 찾았던 곳이기도 한데요. 그중에서도 은평구에 집을 짓고 기거하던 서정시인 정지용은 참신한 이미지와 절제된 시어로 한국 현대시의 발전에 기여했다는 평가를 받고 있습니다. 정지용 시인이 납북되기 전까지 살며 창작에 매진했던...,2021. 1. 11.
황병훈 프로가 추천 여행 제주여행!!! 서울서대문구골프레슨 서울은평구골프레슨...,제주도 여행 혼여(혼자 여행)으로 온 제주도 아 설램 설램 ^^ 제주공항 도착했습니다 두근두근제주공항 도착 인증샷 ^^제주롯데호텔에 일이 있어 잠시 들렸습니다. 제주까지 와서 일을 ㅋㅋ 친구와 함께 롯데호텔 근처 잠깐 들려서 차 한 잔 하고 ^^ 내 친구 제주도 토박이 종수 ~ ~와우 ^^ 그냥 뷰가...,2021. 3. 28.
은평구맛집추천: 토로로를 강추강추해,되었네요~ 여행도 못가는 판에~ 맛있는거라도 맛이 먹자는 마음이 일기도 했지요~ 일상이 따분하게 반복 되면 제일 먼저 하고싶은 일이 맛집을... 벗어난~ 맛난 맛 생각하시는 분들은 꼭 토로로에 가셔셔 즐겨보시기 바래요. 기대이상으로 만족 하실거거든요. 토로로 070-7856-9364 서울 은평구 통일로 972,2020. 10. 31.
은평구 응암역 마사지 강력추천!!! 은평구 주민들 안 가본 사람 없게 해주세요!,"20대 초반부터 마사지 샵 정기권을 끊어서 다닐 정도로 마사지를 너무나 사랑하고 해외여행 중에서도 1일 1마사지를 시전하는ㅎㅎㅎ 마사지... 후회하지 않을거라는 확신이 드는 센터였어요! 좋은하루힐링마사지센터 서울 은평구 은평로 63 02-353-5055 매일 11:00-22:00 *연중무휴, 주말휴일 영업*",2021. 3. 25.
3호선 은평구호텔 불광 포레스타 숙박후기,은평구호텔 불광 포레스타 인근에서 가장 깔끔한 숙소 해치지않아요~ 억지로 여행가는 야생곰입니다. 지하철 3호선 불광역에서 도보 3분거리에 깔끔한 신축 은평구호텔이 생겼다는 얘기를 듣고 찾아가보았습니다. 포레스타호텔이란 하나의 브랜드로 서울 전역에 위치하고 있어서 왕십리점에...,2021. 8. 26.
토익 950점 후기/문제풀이 팁/은평구 토익 고사장,교환학생X 여행 포함 영어권 국가에 가본 적도 없어요ㅠ 2019년 1월에 봤던 제 최고점수 920점이 곧 만료돼서 이번 토익시험 목표는 920점... (해커스어학원 알바했었음) 해커스 토익 진짜 좋아요 잘 가르쳐요 저는 서울 은평구에 살고 있는데요! 은평구에는 토익 고사장이 세 곳 있습니다....,2020. 12. 11.
"<은평구카페, 구산동카페> 노트커피, KNOT COFFEE","<은평구카페, 구산동카페> 노트커피, KNOT COFFEE <은평구카페, 구산동카페> 노트커피, KNOT COFFEE 노트커피 평일 10~21시 주말 10~21시 (아마 코로나로 인해 시간이 다른듯 해요) 주소: 서울 은평구 서오릉로17길 18-3 <은평구카페, 구산동카페> 노트커피, KNOT COFFEE 여행하는미뇽은 여행 대신...",2020. 12. 6.
북한산맛집 북한산쌈밥집에서 든든한 점심 한 끼 : 서울근교 은평구맛집,"며칠 전 코로나로 아이들과 여행이 어렵기 때문에 차 안에서라도 산을 볼 겸 북한산에 갔었는데요. 푸른 하늘과 HD 화면의 북한산이 너무 멋지고... 종종 오는데, 다음에도 다시 방문하여 오리주물럭도 먹어봐야겠네요. #북한산맛집 #서울근교맛집 #은평구맛집 #북한산쌈밥 #북한산입구맛집 #쌈밥맛집",2020. 8. 30.
은평구 구산역 분식/ 코스모스 즉석떡볶이,궁에서 여주가 친구들이랑 떡볶이 자주 먹었는데 그 촬영 장소가 바로 여기 은평구 코스모스 분식이라네요 ㅋㅋㅋ 혼자서 추억 여행 잠시... 되고요~~ 은평구 구산역 분식 맛집 추천해주신 브라운링고님 다시 한 번 인사 드려요! (꾸~벅~) 덕분에 서울서 제일 제 입맛에 맞는 즉떡 맛집을 경험...,2021. 1. 14.
[은평구]가볍게 산책하기 좋은 거북골근린공원,쌀쌀해진 날씨 가을 단풍 구경하러 이번 주말 자녀와 함께 도심 속 숲길 여행을 떠나보는 건 어떠세요 :) ▶ 운영요일 / 시간 : 오전 05:00 ~ 21:00 거북골 근린공원 지도 ▶ 조선시대에 봉수대가 있었던 봉산으로 가는 길도 있어요(2번 게이트) ▶ 주소 : 서울 은평구 갈현동 산145-29 ▶ 대중교통...,2020. 10. 26.
20210813 생방송 투데이 (2876) 용인3GO여행 / 녹번역 반찬가게 / 서울 신사동 가로수길...,3GO - 용인 3GO 여행 송골매패러글라이딩 전용활공장 경기 용인시 처인구 모현읍 초부로 210 031.321.3005 은이성지 경기 용인시 처인구... 모두가 반할 이색 반찬 식탁곁들임 서울 은평구 은평로 220 녹번역 e편한세상캐슬 단지내상가 B동 102호 (응암동 36) 02.356.6303 - 3)...,2021. 8. 13.
은평구 불광역 분위기 좋은 이자카야 데이트 매하 불광동 맛집,다음 불광여행의 맛집은 여기로 정해봐야겠어요. 업체주소 불광 매화 : 서울특별시 은평구 통일로66길 11 전화번호 ***-****-**** 영업시간 매일 12:00~21:00 (낮술환영이랍니다!) 일요일 휴무 주차공간 먹자골목 특성상 주차장이 마련되어있어 편안하게 주차할 수 있습니다. 야생곰’s 총평! 조용한...,2021. 8. 30.
서울가볼만한곳 북한산 은평한옥마을 주말데이트 봄나들이 (서울드라이브코스...,"서울여행지추천, 수려한 풍광 자랑하는 북한산을 병풍처럼 두른 은평한옥마을은..... 서울 북서쪽 끝자락, 은평구와 경기도 고양시 경계선인 북한산 자락에 위치한 은평한옥마을은 고풍스러운 한옥과 멋들어진 현대식 건축물들이 옹기종기 모여 마을을 이룬 곳으로 서울가볼만한곳 또는 서울 이색...",2021. 3. 19.
요즘 셀럽들이 은평구로 모이는 진짜 이유,과거 습지대였던 은평 한옥마을은 북촌과 서촌에 이어 서울에서 세 번째로 큰 한옥 단지라는 사실. 이곳에 옹기종기 모여있는 매력적인 장소들을... 특히 숙박 용도로 이곳을 찾는 여행객들이 많다. 모든 객실에서는 한옥마을을 두르고 있는 북한산을 감상할 수 있다. 지상 1층은 행랑채와 큰...,2021. 4. 22.
"은평구 새절역/응암동 중국집 맛집, 차이몬스터(Feat. 망치쾅수육)","중국 느낌을 많이 살렸고 갑자기 문뜩, 중국에 여행으로 떠나고 싶은 생각이 드네요 ㅋㅋ 전화: 0507-1407-7843 운영 블로그: 사장님임 직접 운영하시는 블로그에요! 사장님의 일상? 과 ㅋ 차이몬스터 이야기가 포함되어 있네용! 위치: 서울 은평구 불광천길 334 주차: 주차할 공간이 한 대 정도 있어요!...",2021. 4. 8.
서울 가볼만한곳 / 진관사에서 은평한옥마을까지~,"#서울가볼만한곳 #진관사 #은평한옥마을 #북한산제빵소 북한산과 삼각산이 마주하고 있는 서울 은평구 진관사, 서울에 있는 사찰 중 길상사와 진관사를 좋아하는데, 특히 진관사는 북한산 국립공원 내에 있어 계곡이 아름답다. 비온 뒤의 산책이라 계곡물이 콸콸 흐르는 모습이 강원도...",2021. 5. 29.
서울 특별시 은평구 4가독감주사 27000만원 확인후 방문 하세요,서울 특별시 은평구 4가독감주사 27000만원 확인후 방문 하세요 예방접종은 오전 9시30~11시30분 오후 13시 ~ 16시30분인데 그전에 끝나 거나 미리... 맞고 나니 왠지 든든합니다 추워지는 겨울 건강 잘챙겨 보세요~ 보헤미안웅의 소소한 행복여행중 참고로 정문 말고 주차장으로 들어가시면 가까워요~,2020. 10. 21.
추석연휴 서울근교 당일치기 여행 추천,"저는 사는 지역이 은평구라서 그런지 신랑과 시간이 맞으면 파주쪽으로 자주 가는 편인데요~ 헤이리예술마을, 마장호수 출렁다리, 임진각... 입장료 2,000원 서울근교 당일치기 여행 코스로 추천하고 싶은 세번째 장소는 바로 춘천이에요^^ 춘천은 기차로도 쉬이 갈 수 있고 자차로도 쉽게...",2020. 9. 6.
서울여행 - 북한산성 답사기(의상능선과 문수사),북한산성 의상능선(대서문 ~ 대남문) 탐방기 북한산성 대서문 오전 11시쯤 은평구 진관동 북한산성입구에서 출발해 정문과 같은 역할을 하는... 나월봉 서울전경 문수봉 북한산성 성곽 청수동암문 북한산의 나월봉과 문수봉 사이의 고갯마루에 위치해 있으며 탕춘대성과 비봉에서 성 안쪽으로...,2020. 9. 6.
1인 1잔 (1인 1상) : 뷰가 다 한 은평구 한옥마을 | 재난지원금 힐링,"#데이트립 계정에는 늘 새로운 공간들을 추천해줘서 좋다 은평구 한옥마을 서울역에서 701번 버스를 타고 서울 시내를 가로지르며 한시간 남짓... 사실 생각했던 것보다 돈도 많이 썼는데, 그만큼 진짜 여행 온 기분으로 즐겼던 하루! 아쉽지 않았고, 엄마아빠 모시고 한번 더 가고 싶다.",2021. 9. 23.
#은평구카페 #1인 #1잔 #은평한옥마을 #진관동카페 #분위기좋은카페 서울카페,요즘 서울에서 제일 핫한 #은평한옥마을✨ 진짜 이 동네에서 살고싶어지는 곳 한옥뷰 원탑 카페는 역시 1인1잔 인스타@kim_swim1 님 서울여행 - 서울의 모든 것 제보 #은평구카페 #1인 #1잔 #은평한옥마을 #진관동카페 #서울카페 #분위기좋은카페,2020. 1. 16.
"[서울-브릭하우스76] 은평맥주, 6호선 은평구 수제맥주 맛집 ,혼술환영!혼저옵서예~","브릭하우스 76 영업시간 화~토 17:00 ~ 02:00 일 17:00 ~ 24:00 , 월요일 휴무 서울 은평구 연서로 40 (6호선 응암역, 3번 출구) 토요일 오픈 시간까지... 상상여행을 하지요 몇 년 전 코펜하겐에 간 적이 있는데 그땐 덴마크는 칼스버그의 나라 칼스버그 맥주만 마시고 미처 투올을 몰랐다죠? 아쉽다...",2020. 4. 10.
[은평구] 이야기꾼의 책공연_서울혁신파크,"신나는 예술여행 사회복지시설순회사업(한국문화예술위원회) 선정작 - 2010. 06. 책, 예술과 만나다(서울문화재단) 선정작 < 작품개요> · 소요시간... me/221989657842 #서울시 #서북권 #은평구 #서울혁신파크 #상상청 #공유동 #이야기꾼의책공연 #이야기꾼 #책공연 #극장 #어린 #공연 #연극 #평강공주...",2020. 6. 11.
서울한옥숙박 은평한옥마을 채효당 가야금 체험까지!,있는 서울한옥숙박 1박2일을 다녀왔습니다. 그저께 집에 왔으니까 아주 따끈한 포스팅이에요. 이번 여행의 컨셉은 삼대모녀 힐링이었습니다.... 채효당 서울 은평구 진관길 11-30 ***-****-**** 입실 15시 퇴실 11시 채효당은 한옥건축가 김장권 북촌HRC 대표가 국산 소나무로 지은 문화재급 한옥이라고...,2021. 6. 20.
"[롤리트롤리 여행 정보] 산 아래서 즐기는 힐링 카페여행, [서울]","당신의 즐거운 여행 동반자 롤리트롤리입니다☻ 오늘은 산 아래서 즐기는 힐링 카페여행으로 산 근처에 있는 카페들을 찾아봤습니다:) 요즘은... 북한산 아래 북한산 입구 카페, 피노블루 이용시간 : 평일 11:00 - 19:00 주말/공휴일 09:00 - 19:00 서울 은평구 대서문길 49 1, 2층 사진출처...",2021. 4. 28.
"[은평구 안경점] 차량방역에 아이스크림, 커피, 네일아트까지 제공되는 글라스바바 응암점",은평구 안경점 글라스바바 저는 최근 여름휴가를 다녀왔어요! 시국이시국인지라 엄마가 걱정된다고 숙박해서 다녀오는것은 하지말자고 해서 서울근교 당일치기로 여행을 다녀왔는데요. 여름에 여행가기전에 하나 장만해야할것이있지요? 그것은 바로! 선글라스 입니다 캬캬캬캬캬 저희집은...,2021. 8. 20.
[4세+3세 연년생 가정보육 4월 봄 나들이/야외활동] 은평구 불광동 불광근린공원 생각숲길,"☆ 일시: 2021년 4월 12일 월요일 (첫째 35개월 + 둘째 17개월 + 셋째 임신 15주) ☆ 활동명: 숲을 거닐며 생각하다 ☆ 장소: 서울 은평구 불광동... 언제 또 찾아가게 될까요?) <앞으로의 장소들은 어떤 곳일지 궁금하신가요? 공감과 댓글, 이웃신청으로 글로리맘의 고군분투 육아여행에 함께 동행해주세요>",2021. 4. 23.
(은평구 맛집) 두부요리 전문 3대째 이어온 맛집 만석장,여행하며 책보며 두부요리 전문 3대째 이어온 맛집 “만석장” 은평구 한옥마을을 둘러보고 “진관사” 절을 다녀오시면서 가보면 좋은... 넓어서 많은 손님이 올 정도이지만 코로나로 거리두기를 하며 식사를 하다보니 불편함이 없었어요. #서울맛집 #은평구맛집 #두부요리맛집 #서울안의두부장인,2021. 6. 28.
벚꽃여행 3탄 : 서울 강북 숨겨진 벚꽃명소 랜선여행,"From, 블로그씨 봄이 오니까 훌쩍 여행을 떠나고 싶어져요~ 오늘은 랜선 여행 계획을 세워볼까요? 서울 벚꽃이 100년 사상 가장 빠르게 개화했다고... 벚꽃명소 서울 은평구 불광천 벚꽃명소 서울 도봉구 숨겨진 벚꽃명소 ○ 중랑천변 ○ 우이천변 ○ 도봉구청 뒷길 서울 강북구 숨겨진 북서울의 꿈...",2021. 3. 31.
"서울 명소, 은평 한옥마을 구경 & 북한산 뷰맛집 1인1잔 1상 카페",북한산 & 은평한옥마을 뷰맛집 은평구 1인 1잔 서울 은평 한옥마을 입구에 위치한 은평구 1인 1잔 카페이다. 이날 가서야 안 사실은 카페뿐 아니라... 이날 생각지도 못한 일탈로 둘러본 서울 명소 구경 잘하고 갑니다. 어서 빨리 수도권이 안정되길 바랍니다. 우리 힘내요! #배짱이의여행스토리...,2021. 7. 23.
은평구 역촌동 네일샵 묘묘네일 가을 붓터치네일아트,은평구 역촌동 네일샵 묘묘네일 가을 붓터치네일아트 제주 여행을 계획해서인지 손을 보고~ 아! 어서 네일아트부터 해야겠다 싶었다!!! 은평구에서... 묘묘네일 서울 은평구 역촌동 69-13 1층 02-386-0111 영업시간 11:00 ~ 21:00 매주 월요일 휴무 주차가능 은평구 역촌동 네일샵 묘묘네일 고양이를 사랑하는...,2020. 11. 9.
서울 은평구 미용실 세희쌤 아이디헤어은평뉴타운점,그건 바로 제가 여행을 가는데 그 전에 원하는 스타일을 하려고 입니다! 세희쌤한테 머리를 받았는데 제 인생중에 가장 친절하셨던 쌤이었어요ㅜㅜㅜㅜㅜㅜ 오타까지 보여주는 찐 후기임다 ㅋㅋㅋㅋㅋㅋㅋㅋㅋㅋㅋㅋㅋ 시술하기전에 상태를 정확히 알기위해서 이런것들을 했는데 정말 길게...,2020. 2. 7.
