header,contents,date
썰바이벌 7회(내 연인에게서 정 떨어지는 순간은? 손절이 더 시급한 친구는? 이별 후...,"쓰레기 집에 사는 노 위생 연인 서울 금천구에 사시는 28세 강모 남성분의 사연입니다. 내 여자친구는 물망초를 닮은 청초한 여자 그런데 물망초를... "" 어리둥절한 내게 팔에 용 문신 어딨냐 묻는 것임 여행가서 타투스티커를 붙이고 찍은 내 인☆사진을 본 연지는 용 문신을 한 것임 그 후로 연지를...",2021. 3. 26.
한국야금(KORLOY) 대졸 신입/경력사원 공개채용,"ㆍ해외여행시 결격사유 없는 자 ㆍ남자는 병역필 또는 면제자 ㆍ해당분야 경력자 우대, 영어회화 가능자 우대 ㆍ국가보훈대상자... kr 채용안내 - 입사지원) ㆍ본사주소 : 서울시 금천구 남부순환로 1350 홀리스타빌딩 / 서울시 서초구 서초대로 326 모인터빌딩 작성/제출 서류...",2021. 10. 9.
원룸 쓰레기 처리 서울 오피스텔 가정용 재활용 폐기물 집안물건 다 정리 해드려요!,코로나 19로 인한 사회적 거리두기가 여가 생활에도 영향을 미치고 있습니다~ 해외 여행도 막히고 밀집 시설도 갈수 없다 보니 캠팽카로 가족 단위의... 서울 경기 인천 다 처리 가능하세요~ 강동구 강남구 강북구 강서구 관악구 구로구 광진구 노원구 금천구 도봉구 동대문 동작구 서대문 마포구...,2020. 7. 22.
구해줘홈즈123회 서울화곡동손주근접아파트전원주택같은도시형생활주택김포한강신도...,집안 곳곳 유럽 스타일의 갤러리 도어로 매일 유럽 여행을 떠날 수 있는 이 집! 쥬뗌므-! 서울시 금천구 시흥동 <화이트 갤러리 하우스> 금쪽같은 손주들 육아 후! 집에 오면 날 맞이하는 금쪽같은 옥.탑.화.원! 전원주택인 듯 아닌 듯~ 전원주택 같은 도시형 생활주택 Coming Soon! 김포시...,2021. 9. 12.
"가산디지털단지 쌀국수 맛집, 현대 시티아울렛 맛집 추천, 세계 쌀국수 대전 (2020.10)","들어있다는거다 여행가서 동남아 음식이 맞지 않는다며 투덜대던 김서방은 어디 갔지? 이따만한 숟가락으로 정말 잘도 먹더라 ㅋ 생야채가... 가산디지털단지 쌀국수 맛집, 현대 시티아울렛 맛집으로 완전 추천해본다 영업 시간 : 11시 - 21시 주소 : 서울 금천구 가산동 60-8 6층",2020. 10. 11.
독산역 원룸 보증금 조절가능합니다~,"담주에 여행가는데 제발 그날만은 날이 쨍하고 맑기를 기도해야겠어요~ 오늘 소개해드릴 매물은 독산역 원룸입니다. 아래 지도에서 확인하실수... 위치 서울특별시 금천구 독산동 옵션 침대,붙박이장,책상,세탁기,에어컨,인덕션,전자렌지,냉장고등 보증금 1000만원(위아래로 조절가능) 월세...",2021. 6. 18.
서울벚꽃명소 따릉이 타고 즐기는 안양천 제방 벚꽃길,안양천 벚꽃은 서울벚꽃명소 중에서 꽤 길게 늘어선 곳이 아닌가 생각이 든다. 양쪽 제방길에서도 서로 마주보며 심어져있어 서로 바라보면 매우... 철산의 경우 경기도지만 조금더 달리면 금천구라... 금천구청역 따릉이 있어 따릉이를 탈 수도 있고 보관할 수도 있으니... 2021년 벚꽃구경은 따릉이...,2021. 3. 30.
가성비 호캉스 스타즈호텔 독산 스탠다드 트윈,스타즈호텔 독산 주소 : 서울 금천구 시흥대로 315 전화 : 02-2096-4000 체크인 : 15:00 체크아웃: 12:00 주차 : 건물 지하주차장 이용 새건물 냄새가 날 정도로 신축인 스타즈호텔 독산 2019년에 완공한 것으로 보이니 이제 막 돌이 지난 셈 고가의 시설이냐 아니냐를 떠나서 신축이라서 리셉션이나 기타...,2020. 9. 16.
셀프웨딩/스튜디오촬영 셀프 조화부케 만들기 (feat.다이소),다이소독산점 전화: 02 864 6016 주소: 서울 금천구 시흥대로 403 셈프레팜 (지번주소: 독산동 289-8) 매일 오전10시 -오후10시 내가 만들고자하는 부케는... 것 같고 제주여행이나 스냅촬영떄도 요기나게 사용할 수 있을 것 같아서 왕추천 마무리는 나의 실제 웨딩스튜디오촬영때 사용한 셀프부케 사진으로!,2020. 12. 1.
"서울둘레길-볼만한 곳 석수역,호압사를 연결하는 관악산 서울둘레길 제5코스<무작정...","나의 <무작정 떠나기> 비테마 여행에 그냥 한번 깡가 넣어 본다. 나는 항상 길눈이 어두어 늘 갔던 길도 오랜만에 가게되면 새롭다. 의기양양하게... 행정구역으로는 서울특별시 관악구와 금천구, 그리고 경기도 과천시와 안양시에 걸쳐있다. 1968년 건설부 고시 제34호에 따라 도시자연공원으로...",2020. 7. 28.
독산동원룸 가성비가 그렇게 좋다고?,"오늘 날씨가 너무 좋아서 그런지 어디론가 떠나고 싶은 생각이 드는 날이네요 아쉽게도 오늘 떠나진 못하지만 조만간 좋은곳으로 여행갈 날을... 위치 서울특별시 금천구 독산동 옵션 세탁기,에어컨,전자렌지,TV,책상,침대,인덕션등 보증금 100만원(조절가능) 월세 23만원 관리비 7만원(인터넷,TV...",2021. 6. 6.
"[2020 아르바이트] 서울시청 300명, 25개 자치구 1650명 대학생 알바 선발...제주는...","접수 서울시(300) 11월30일~12월4일 동대문(100) 11월23~30일 성북구(100) 11월16~27일 영등포(100) 11월23일~12월4일 금천구(100) 11월23일~12월3일 마포구(25)... 특히 올해 여름방학에는 코로나19로 인해 해외여행, 어학연수 길이 막히자 관공서 알바를 하려는 대학생들이 늘어 1만6293명이 몰렸다....",2020. 11. 30.
서울특별시 도시재생지원센터 직원 공개채용(~5/25),"2021년 5월 10일 서울특별시 도시재생지원센터장 1. 채용분야 및 인원 1) 채용분야 ○ 도시재생현장지원센터 사무국장(계약직) 2명 - ‘20년 신규 선정지역 : 중랑구 망우본동, 금천구 독산2동 ○ 지역집수리지원센터 코디(계약직) 2명 - 중급 코디 1명(관악 집수리지원센터) - 초급 코디 1명(서대문...",2021. 5. 10.
[1년 전 오늘] 안양천의 꽃길 꽃들의향연을 즐겨보자,"발원으로 군포 안양 광명 서울금천구 구로,양천을 경유에서 서울 한강까지 흐른 다 안양천 사계절 모두 아름다운 곳 지역을 경유할때는 그 지역마다 특색이 달라 맛나게 구경할수있는 안양천 저는 우리 안양시가지를 가로질러 흐르는 안양천을 다녀왔... 여행과 맛집리뷰가 있는 소소한 일상 !!",2021. 4. 8.
서울 구로 목동 삼성 갤럭시 고장폰 침수폰 복구- SM-F707N Z플립 2 최신 고장폰...,"일상이나 추억이 담긴 가족사진 , 여행사진 소송이나 기타 주요사건 등으로 주고받은 카카오톡이나 메신져의 대화내용 문자 통화기록 주요연락처... 가리봉동침수폰고장폰파손폰복구 #금천구침수폰고장폰파손폰복구 #구로디지털침수폰고장폰파손폰복구 #가산디지털침수폰고장폰파손폰복구...",2021. 7. 19.
춘의역신축빌라전세 부천 7호선 에어컨 기본 옵션 제공,"춘의역신축빌라전세 부천 7호선 에어컨 기본 옵션 제공 저희의 두 번째 신혼집 전세가 올라서 다른 곳으로 옮기게 되었는데요 금천구 가까운... 가산디지털단지, 서울권을 이어주는 7호선 걸어서 도보 3분 거리에 있는 초역세권으로 총 13층 지하주차장이 있는 건물이었습니다 전세 나온 층은 10층으로...",2021. 5. 6.
9월 여의도 63빌딩 웨딩박람회 하우투 심쿵혜택!,"반갑게 인사 할 텐데요 선선한 바람과함께 가을 여행을 가야 하는데 여행은 개뿔 +_+ 가을에도 어김없이 집콕해야겠죠?! 가까운 곳으로 1박 2일은... 알아보기 << 서울 영등포구, 구로구, 마포구, 동작구, 금천구, 양천구, 강서구 등 지역에서 예식을 준비중 이거나 할 예정이라면 하우투웨딩 이곳은 꼭...",2021. 8. 31.
[코로나시대의 걷기여행] / ‘2020 걷기여행 실태조사’결과 발표,"코로나 시대의 걷기여행, 어떻게 변화했을까? 한국관광공사, ‘2020 걷기여행 실태조사’결과 발표, 걷기여행 관심도 증가... 관악산둘레길 총 31.6km, 수도권 4개 행정구역(안양시, 금천구, 관악구, 과천시)에 분포.. <출처 : 관악산둘레길은 ‘지하철...",2021. 7. 13.
2021년 5월 10일 오늘의 HOT50 뉴스(코로나),"[봄날] 한산한 충칭 임정 청사 심재훈 특파원 = 코로나19 사태로 한국인들의 해외여행이 제한된 가운데 중국 노동절(5월 1~5일) 연휴에 찾은 충칭... [봄날] 금천구, 저소득 위기가구에 생활지원금 50만원 지급 유성훈 금천구청장 [금천구 제공] 서울 금천구(구청장 유성훈)는 코로나19 장기화로 인한...",2021. 5. 10.
김포공항 프라이빗 픽업 샌딩 :: 고요한 M 15% 할인,"여행 갈 때 대중교통을 이용하기에는 짐이 너무 많고, 자가용을 이용하기에는 주차료가 비싸 고민이셨던 분들! 고요한 모빌리티로 집에서... 가격 서울 강서구 / 양천구 25,500원 서울 마포구 / 영등포구 / 구로구 / 금천구 42,500원 서울 은평구 / 서대문구 / 종로구 / 중구 / 용산구 / 강북구 / 성북구...",2021. 9. 6.
독산동 투룸 전세 신축입니다~~,"나이든 만큼 시간이 빨리간다고 하시던 어른들의 말씀이 이해가 되는 거 같습니다 ㅠ 아무튼 더 나이가 들기전에 많이 많이 즐기고 여행도... 3제곱미터 건축물대장상용도 : 오피스텔 규모 : 2동(지상1층~12층) 88세대 기본정보 위치 서울특별시 금천구 독산동 옵션 천장형에어컨,빌트인냉장고...",2021. 6. 26.
이젠 제대로 알아야 해요! 버스여행에 대한 필수정보,"버스여행 포스팅, 어떠셨나요? 다음 이 시간에도 저마다의 파도를 잠재울 수 있는 최고의 정보로 찾아뵐게요. ^^ #금천구부동산 #가산동부동산... 독산동공장 #서울디지털산업단지 #가산동아파트월세 #가산동아파트전세 #가산동오피스텔전세 #가산동오피스텔월세 #가산동지식산업센터월세...",2021. 5. 22.
[가산디지털단지 샐러드 맛집] 샐러디의 푸짐한 점심 (feat.칼로리),"가평 여행을 다녀온 다음날. 너무 잘 먹고 왔는지 오늘은 뭔가 가벼운 점심이 필요할 것 같더라구요. 그래서 가산디지털단지 샐러드 맛집을 찾아갔어요. 샐러디 가산디지털단지점 주소: 서울 금천구 가산디지털1로 181 w센터 1층 영업시간: 07:00~ 21:30 (평일) 08:00~ 17:00 (토), 일 휴무 샐러디...",2020. 10. 17.
[책소개] 배우자와 베프가 되기로 한 부부 이야기,✅입고 서점 안내✅ @인스타 아이디 서울 (강동구) #순정책방 @soonjungbookstore (금천구) #올오어낫싱 @allornothing_deardark (마포구) #북티크 @booktique_bookshop #가가77페이지 @gaga77page #여행마을 @traveltown_book #공상온도 @gongsangondo (성동구) #프루스트의서재 @library_of_proust...,2021. 10. 6.
버스여행 연관 지식!혹시 이것도 알고 있었나요?,달큰한 냄새가 코끝에 감도는 논산 딸기 축제에선 서울지역에서 버스로 여행하기 좋습니다. 상큼한 딸기를 스스로가 수확하여 잼이나 케이크 등을... #금천구부동산 #가산동부동산 #두산위브아파트전세 #두산아파트월세 #가산동전세 #가산동오피스텔 #독산동오피스텔 #부동산재테크 #가산동아파트...,2021. 3. 24.
[세상사는 法] 모두 다 같이 안전하고 무사하게 지나가기를,가령 어떤 기사에서는 중국 이주민 밀집 지역인 서울 영등포구 대림동 시장 일부 사람들이 침을 땅에 뱉고 마스크를 쓰지 않는다며 위생 불량이... 얼마 전에는 금천구에 거주하는 ‘중국인’이 코로나로 확진되었다고 기사화되었다. 과연 ‘중국인’이라는 확진자의 국적이 지금 시점에 필요한...,2020. 4. 1.
"2020.12.24 코로나 19 신규확진 985명 / 정부, 얀센·화이자 백신 1600만명분 계약, 내년...","- 서울 금천구 예수비전성결교회에서 교인과 가족 등 총 21명이 감염됐고, - 울산 남구 공연모임과 관련해선 24명이 양성 판정을 받았다. ▲ 충북 청주시 참사랑노인요양원(누적 80명) ▲ 충북 괴산·음성·진천군 병원(142명) ▲ 대구 동구 종교시설(37명) ▲ 전북 순창군 요양병원(36명) 등 기존...",2020. 12. 24.
팬텀싱어3 존노- 2차 결승전편(눈물없는 울음),인터뷰 저는 미국에서 오래 살았지만 태어난 곳은 서울 금천구 존노의 고향은 서울 금천구-자막 고영열의 고향은 광주광역시-자막 김바울의 고향은... 세계여행 월드뮤직 장인들의 마지막 여행지는? 쿠바>그리스>스페인>이스라엘 이단 라헬 프로젝트의 <밀림 아홋 멜리네> 이보다 더 아름다운 말...,2020. 7. 4.
서울 국제이혼전문변호사 가출한 필리핀 배우자와 위자료 받고 이혼하기,"강서구, 양천구, 구로구, 금천구, 영등포구, 동작구, 관악구, 용산구, 마포구, 서초구, 강남구, 송파구, 강동구, 광진구, 성동구, 중구, 종로구, 은평구, 동대문구, 강북구, 도봉구, 노원구, 중랑구, 서울가정법원 대한변호사협회 등록 이혼전문변호사, 위자료전문변호사, 재산분할전문변호사...",2021. 7. 22.
[가산디지털역 맛집] '호세가' 가산동 모던 멕시칸 맛집 추천(메뉴+가격),상호 : 호세가 주소 : 서울 금천구 남부순환로108길 19 영업시간 : 매일 12:00~23:00(브레이크타임 15:00~17:00) ※ 매주 월요일 휴무 주차 : 전용 주차장... 그동안 항상 강남이나 이태원을 가야 제대로 즐길수 있었던 멕시코 음식을 동네 근처에서 즐길 수 있어 행복했습니다 ㅎㅎ 신혼여행도 멕시코로...,2020. 3. 22.
독산동 고기집 원조부안집 독산점 다녀왔어요,오늘의 식도락 여행은 독산동에 위치한 고깃집 원조부안집 독산점입니다. 주소 : 서울 금천구 독산로75길 9 연락처 : 070-4213-7916 원조부안집은 열장 가족의 페이버릿 프렌차이즈입니다. 직영3호점과 강서구청점을 경험했었지요. 가성비가 훌륭한 곳입니다. 독산7호점은 어떨지 궁금하네요....,2020. 7. 29.
독산역 카페게이트 아침에 토스트까지?!,되고 여행이 일이 된다면 과연 생각만큼 행복할까요? 결국 지금 하고있는 일에 불평불만 실컷하면서 욕도 실컷하면서 사는 인생이 행복한것일수 잇다고 생각합니다 (개인차이 잇고 . 생각차이 잇고. 몸이 상하는일은 만류하고싶습니다 ) 서울 금천구 가산디지털1로 5 1층 105호 카페게이트 영업시간...,2020. 2. 16.
김영철의 동네 한 바퀴 - 제 31회 ~ 제 40회,"●백년의 기억 창고를 걷다, 광주 시간 여행 1번지 ‘양림동’ 양림역사문화마을 - 이장우 가옥 ●쓸모없는 것들의 쓸모 있음을 응원하며... 33회 서울 금천구 [다시 일어서다 - 서울 금천구] IT 산업을 이끌어가는 최첨단 단지로 손꼽히는 금천구. 한때 이곳은 1970년대 제조업 수출물량의...",2020. 4. 4.
기차여행에 대해 찾고 계신가요?,제가 전해 드리는 기차여행에 대한 간단한 정보들도 이웃님들의 머릿속에 쌓이고 쌓여 자기 자신도 모르게 어느새 확실히 각인될 거예요. 그날을 위해 오늘도 아자! #금천구부동산 #가산동부동산 #두산위브아파트전세 #두산아파트월세 #가산동전세 #가산동오피스텔 #독산동오피스텔...,2021. 4. 5.
2020년 6월 30일(화),"http://www.busan.com/view/busan/view.php?code=2020063009264751624 6. 서울신문 ""금천 ‘코로나 블루’ 인문학으로 극복 "" - 서울 금천구는 ‘코로나 블루 극복은 명화 속 치유여행으로’ 프로그램을 운영한다고 29일 밝혔다. http://go.seoul.co.kr/news/newsView.php?id=20200630016018",2020. 7. 1.
버스 번호와 색깔은 어떻게 정해질까? (ft. 서울시 버스 번호와 색깔의 모든 것),"관악구 / 금천구 6번 : 영등포구 / 양천구 / 구로구 / 강서구 7번 : 마포구 / 서대문구 / 은평구 예시를 간단하게 들어보겠습니다. 위의 사진에서... 간선버스, 지선버스, 도심순환버스, 광역버스로 서울뿐 아니라 서울 근교까지 편리하게 여행해보세요! 제9기 국토교통부 정책기자단 / 심아름",2021. 10. 8.
"우울증 [관악구/동작구/금천구/영등포구/구로구/서초구/용산구 방문요양,복지용구구입...","또한, 서울광역정신보건센터 위기관리팀에서 운영하는 (www.suicide.or.kr)을 방문하면 인터넷 채팅으로 상담을 할 수 있습니다. 기타정보 1. 역학적 특성 국내현황 보건복지부에서 최근에 발표한 국민건강영양조사 제6기 2차년도(2014) 결과보고에 의하면, 만 30세 이상에서의 우울증 유병률은 3.8...",2020. 9. 22.
2021.10.07.목요일 경제뉴스 스크랩,"""해외여행 큰 장 선다"" --- #야놀자·하나투어 전격 동맹 수박 여행업 1위간 제휴 --- 위드 코로나 여행수요 선점 포석 야놀자, 하나투어 상품... 서울 아파트 평당 3000만원시대, 금천구만 남았다 강남구는 평당 8000만원 눈앞 <KB리브부동산 월간주택가격동향> 5. 다주택자 몰린 #1억미만_주택...",2021. 10. 7.
2022년부터 수입 배추김치 HACCP 단계적 의무화,돌잔치 예약 후 대규모 감염병으로 취소하면 위약금 40% 빼준다코로나19 발생으로 민원이 급증했던 외식서비스업(연회시설운영업)과 여행... 식품저널(Food News) | 인터넷신문 등록번호 : 서울 아 00022호 | 등록일 : 2005.08.12 | 발행인·편집인 : 강대일 발행소 : 서울특별시 금천구...,2020. 11. 23.
[2021.09.25] 월급쟁이 부자로 은퇴하라,"ㅋㅋㅋㅋ 가산 두산위브 아파트, 신림 푸르지오 아파트는 지금 사는 곳과 멀지 않아서 계획에 없던 자전거 여행을 했다. 덕분에 저녁 식사가 더... - 서울시 관악구 신림동 - 서울시 금천구 - 부천시 중동 직업 특성상 여기저기 다닐 때가 많다. 당장 다음 주부터 판교로 나갈 예정이니... (네이버...",2021. 9. 25.
생생정보통 8단조개찜 들깨삼계탕집 원조호수삼계탕 닭백숙 삼척여행 해상케이블카...,"플라스틱 사용 줄이는 법 ▶땅스부대찌개 고척개봉점 - 주소 : 서울 구로구 개봉로17길 37 ▶삼대족발 금천점 - 주소 : 서울특별시 금천구 시흥대로 196 ▶덕분愛(애)제로웨이스트숍 - 주소 : 서울특별시 서초구 서초대로 389 진흥상가 209호 <미스터리Lee의 사진 한 컷, 대한민국...",2021. 6. 28.
황하코스모스 활작핀 안양천 구일역 주변...,"뎁싸리밭,그리고 아직도 싱싱한 백일홍 꽃밭까지 있어 시간이 되시면 이번주말 안양천을 걸으시며 10월의 깊어가는 가을날 멋진 추억하나 만드시길요....!! #서울가볼만한곳 #전철로 여행 1호선 구일역 #금천구 안양천꽃길 #구일역과광명교 사이 #황하코스모스 만발 #가을날의 추억 만들기 #겔럭시 s21",2021. 10. 1.
국악아카펠라 토리스X서울발레시어터 [어유아 방아요] 촬영 현장 스케치,"이번 영상은 '심봉사의 시간여행'이라는 컨셉으로 재해석해보았습니다. 토리스의 흥겨운 가락에 맞추어 서울발레시어터 단원들의 재치 있는 안무가 더해서 특별한 재미를 선사할 것 같아 무척 기대가 되네요! 또한 호압사, 삼성산 시민공원, 금나래공원, 안양천 등 금천구 곳곳의 다양한 공간을...",2020. 12. 21.
독산역 맛집 한국수 독산역 외식하기 좋은집,"독산역 맛집 한국수 서울 금천구 가산디지털1로 5 대륭20차 2층 207호 평일 11:00 - 22:00 주말 11:00 -20:00 한국수독산역점 올 초 부산에 가려고 했는데 코로나 때문에 여행을 못갔어요. 부산 먹방 하려고 했었는데, 코로나 조금 잠잠해진듯 싶어서 또 다시 갈 계획이었으나 또 심각해 졌네요.. 우울. 특히...",2020. 6. 2.
[독산역맛집] 얼큰한 국물이 계속 생각나는 마부마라탕,"다른 곳에 마라탕이 충족되지 않아, 다시 방문한 곳 독산역 마부마라탕 마부마라탕 독산점 서울 금천구 가산디지털1로 5 대륭테크노다운20차 210호... 대만 여행중 먹었던 훠궈집의 마라..? 두번째는 동생이 사온 마라컵라면 둘 다 특유의 향이 나서 젓가락을 금방 놓았었는데 이제는 마라러버...",2020. 1. 17.
휠체어 타고 떠나는 서울 무장애 숲길 나들이 함께 떠나요~,금천구에서 만든 거로 아는데... 홍보 좀 잘 해서 휠체어 탄 분들이 많이 왔으면 좋겠어요. 저 넓은 곳이 다 잣나무예요~~ 중간중간 데크도 있어서... 추천해요 #호압사 #호압사늘솔길 #호압사무장애숲길 #호압사무장애길 #휠체어여행 #휠체어나들이 #휠체어타고갈만한곳 #보행장애 #재활운동 #서울휠체...,2021. 4. 11.
가산동 횟집 맛있는바다 금가루 회 먹고왔어용~ 가산동 맛집 회식장소로 굳,오늘은 오래간만에 오빠랑 회먹기로~~ #가산동횟집 #가산동맛집 폭풍검색한후~ 여행은 못가니 시원하게 놀러온듯한 분위기 밖에서 먹을수 있는... 요기 건물에 주차했었거든요~~ 완전 신기해 #가디역횟집 맛있는바다 주소 서울 금천구 벚꽃로 298 대륭포스트타워6차 1층 전화번호 02-863-1322 주차는 당...,2020. 6. 27.
[가산디지털단지 스크린골프] 골프존파크 대성스크린점 실내골프연습장 골프 골프레슨...,"저는 2020년 계획들 중에 골프 배우기, 스쿠버다이빙해보기 (해보고 맞으면 재밌으면 심화과정도 해보기ㅎㅎㅎ) 포르투갈, 오로라 여행 등등이... 매일 스윙 연습을 원하는 골린이들을 위해서 이 글이 도움이 되셨으면 합니당ㅎㅎㅎ ""골프존파크 대성스크린점"" 서울 금천구 서부샛길 606...",2021. 2. 5.
[ 가산맛집 동대문털보네 ] 가산동 삼겹살이 맛있는 곳! 가성비 최고,"가산동 삼겹살 맛집, 동대문털보네 주소) 서울 금천구 디지털로9길 99 연락처) 02-2649-0449 동대문털보네 영업시간 평일 16:00 - 23:00 토요일 15:30 - 22:00 2째,4째 토요일& 매주 일요일휴무 조금 독특했던 가산디지털단지맛집 동대문털보네 입구모습! 요기가 가게로 들어가는 입구가 맞다. 사실 투명한...",2021. 1. 7.
비너스화장품 ANOV 아노브 코스메틱 미친기초,직접 비너스 화장품도 살펴보고 사용도 해볼 수 있었는데 10만원 상당의 여행용 패키지를 데려왔는데 포장부터 용기가 너무 예뻐서 아직도... 본사는 금천구 가산에 위치해있는데다가 직접 팝업스토어를 만나볼 수 있는 아노브 매장은 건대 커먼그라운드인 서울특별시 광진구 아차산로 200,2021. 10. 5.
구디역 월세 보증금100만원이면 충분합니다~~!!,어디 여행을 가고 계신가요? 아니면 집에서 쉬고 계신가요? 전 역시나 오늘도 출근을 했습니다 ㅠㅠ ㅎㅎ 이제는 익숙해서 괜찮습니다~~~ㅎㅎ... 상호 : 탑공인중개사사무소 소재지 : 서울특별시 금천구 독산동 293-20 등록번호 : 11545-2020-00002 대표자 : 이아열 전화번호 : 02-896-3328,2021. 6. 12.
[채용] 6월 16일 사람인 추천 채용 정보,모집 서울>금천구 l 정규직 l 경력 l 석사졸업↑ 1명 지원중 (주)진센 D-52 (주) 진센 기업 연구소 / 연구원 채용 모집 서울>서초구 l 정규직 l... 해외여행(개발/기획/항공/호텔) 전직군 모집 08/06(금) (주)트리즈컴퍼니 [트리즈컴퍼니] 각 부문(기획AE/에디터/디자이너/인턴) 신입/경력직...,2021. 6. 17.
필독해야 할 기차여행 정보,기차여행 이어 더 좋은 정보들을 가지고 오겠습니다! 좋은 하루 보내시고요! #금천구부동산 #가산동부동산 #두산위브아파트전세 #두산아파트월세... 독산동공장 #서울디지털산업단지 #가산동아파트월세 #가산동아파트전세 #가산동오피스텔전세 #가산동오피스텔월세 #가산동지식산업센터월세...,2021. 3. 10.
[사랑각 1호점 디너타임] 1월 18일 (토) 기록,두분은 서울 금천구에서 와주셨어요. 처음부터 잔잔하면서도 가면 갈수록 위트있는 모습으로 매력넘치셨던 게스트님이셨어요~! 동규씨는 제주도에만 벌써 6번이나 와주실정도로 제주도를 사랑하시는 여행자분이셨는데 같이 오셨던 진용씨는 제주도가 처음이라고 하셨어요. 내일은 우도 여행 후...,2020. 1. 19.
