header,contents,date
각진 뒷목라인 깔끔한 뒷목왁싱* ｜페이스왁싱/그루밍족/광명왁싱/금천구왁싱/신림왁싱,"신림왁싱 금천구왁싱, 구로디지털단지역, 페이스왁싱,바디왁싱,브라질리언왁싱,보라매왁싱,철산왁싱,광명왁싱,가산왁싱,,서울대입구왁싱, 왁싱,2호선왁싱,서울왁싱,홍대왁싱,보라매왁싱,신길왁싱,봉천왁싱,안양왁싱,웨딩드레스,웨딩드레스라인,결혼,신부님,결혼식,신혼여행 임신,출산...",2020. 2. 3.
G밸리마인드2차 구로디지털단지역 오피스텔 공급정보,"이름 있는 곳인 구로동과 금천구의 가산동에 공통되게 들어가는 G에 미래의 실리콘밸리를 연상시키는 밸리가 합성된 단어로 서울디지털산업단... 있어서 여행이나 쇼핑, 외식 등 자기만의 시간의 비중이 높아서 직주근접의 환경은 대단히 중요한 요소가 되었습니다. 이미 G밸리 마인드 1차는...",2021. 5. 15.
피부관리 / 트러블관리 추천! 진심스킨케어,만들어서 여행 가서 입고 싶다 생각이 들어라구요 ㅎㅎ 선크림까지만 바르고 가서 간단한 클렌징하고 버블로 한 번 더 클렌징을 해줬어요 ㅎㅎ... 피부에 자연스러운 광까지 보이더라구요 ㅎㅎ 만족 만족 대만족입니다~ 진심스킨케어 0507-1345-3279 서울특별시 금천구 디지털로 11길 34 이레빌딩 8층,2021. 9. 10.
"LA ( 바다, 산, 들. )","그곳에 여행가면 보여주려고 사진을 안 넣은 거 같네요.ㅎㅎ 지난 일월 말에 온 친척으로부터 온 소식으로 LA 날씨를 이렇게 전하고 있네요.... Baldy는 속칭인데 정상에 올라가면 나무가 없고 바위만 있어서 이를테면 지금은 서울 금천구가 된, 예전에 시흥쪽 독산동의 독산(禿<대머리 독>山)과...",2021. 2. 15.
서울특별시 가볼만한 곳,"회기동벽화골목,숭인원,배봉산해맞이명소,소망의벽,선동단향나무,청량리역여행센터,서울시립대학교하늘못,세종대왕신도비, 한국도자기,물시계... #금천구 #가볼만한곳 독산자연공원,금천체육공원, 감로천생태공원,호압사, 호암산성(한우물주변산성지), 베짜이유아숲, 구로공단노동자생활체험관...",2021. 4. 18.
[가산디지털단지역/가디역 카페] 벤티프레소 가산sk점 오렌지블루라떼/토피넛라떼...,라는 게 브랜드 스토리 주소 : 서울 금천구 가산디지털1로 171 1충 104호 가는길 : 가산디지털단지역 6번출구에서 나오면 바로 보임 주차여부 : 가능... ㅋㅋㅋ 전세계를 여행한 바리스타래요 전세계 여행하면서 커피를 마셔보다가 벤티프레소 커피 마셔보고 감동 받아서 벤티프레소로 입사하는.....,2021. 4. 30.
✍ 2021년 7월 16일 이세철의 퇴근길 뉴스/정책 브리핑(테스트용),상승으로 여행 심리가 위축될 것을 우려하고 있다함 9. 약 2000억원 대의 부채를 가지고 있는 이스타항공이 채권단과의 채무 변제 협상이... 9월 개통을 앞두고 있는 서울 영등포구 양평동에서 금천구 독산동까지 이어지는 길이 10.33km 왕복 4차로 서부간선지하도로의 통행료가 2500원으로...,2021. 7. 16.
* ｜얼굴왁싱/구로디지털단지왁싱/가산디지털단지왁싱/금천구왁싱/신림왁싱,"신림왁싱 금천구왁싱, 구로디지털단지역, 페이스왁싱,바디왁싱,브라질리언왁싱,보라매왁싱,철산왁싱,광명왁싱,가산왁싱,,서울대입구왁싱, 왁싱,2호선왁싱,서울왁싱,홍대왁싱,보라매왁싱,신길왁싱,봉천왁싱,안양왁싱,웨딩드레스,웨딩드레스라인,결혼,신부님,결혼식,신혼여행 임신,출산...",2020. 2. 28.
"유튜버 입문자를 위한 가성비 촬영 장비 모음 6ㅣ브이로그장비, 유튜브촬영장비, 방송용...","스마트폰에 간단하게 장착한 후에 여행 기록이나 일상 풍경 등을 다양하게 촬영하면 더 멋진 사진과 영상을 남길 수 있을 거예요. 2. #미니삼각대... #카메라 서울 금천구 가산동 엘*님 중고 판매가 300,000원 유튜버 입문자를 위한 가성비 촬영 장비 모음 6ㅣ 유튜브카메라추천, 유튜브촬영장비...",2020. 2. 19.
서울사랑상품권 7월 12일부터,10시) 금천구는 지난 2월 발행한 상품권이 소진되지 않아 현재까지 판매 중이며 잔여물량이 소진될 경우 오는 9월에 재발행할 예정이라고 합니다. 서초구는 7월 12일과 8월 2일 두 차례 나눠서 발행한다고 하니 참고하세요! 이번에 빠진 강동구·양천구·송파구는 서울사랑상품권 발행을 위한...,2021. 7. 5.
[코야키친] :: 2만원에 즐기는 오마카세 맛집,"인테리어가 워낙 생동감있게 되어있어서 코로나시국에 일본 해외여행 온 느낌 간접체험 했어요 ㅎㅎ 코야키친의 오마카세는 1인 2만원, 1인 3만원... 시흥맛집 #서울맛집 #금천구맛집추천 #금천구사케 #금천구일식 #금천오마카세맛집 #오마카세추천 #서울오마카세추천 #서이추 #서이추환영 #이웃...",2021. 8. 11.
가산디지털단지 맛집 콘타이 태국음식점,"콘타이 가산점 외부 Previous image Next image 콘타이 서울 금천구 가산동 마리오아울렛 3관 13층 7호선, 1호선 가산디지털단지역 4번 출구 200m 매일 11:00... 진짜 국물이 너무 맛있어요. 요즘같이 해외여행 자유롭지 않은 시기에 이국적인 음식 드시면서 기분 내는 것도 나쁘지 않을 것 같아요.",2021. 4. 6.
"‘라임 핵심’ 김봉현, 도피생활 중 서울 한 물품보관소에 현금 55억원 은닉.","7일 법조계에 따르면, 경기남부지방경찰청 지능범죄수사대는 지난달 27일 서울 금천구 가산디지털단지 근처에 있는 한 물품보관센터에서 김 전 회장이 맡겨 둔 철제 캐리어(여행용 가방) 3개와 현금 1000만원을 압수했다. 김 전 회장은 이 업체에 매달 25만원을 내고 3.3m² 크기의 개인 금고를...",2020. 5. 7.
[K I C] 코리아인스펙터 (스토리보드),com⠀ ⠀ 카카오톡 : 코리아인스펙터 <- 검색⠀ ⠀ 사무실은 서울 금천구에 위치하고 있으며 오피스텔이라 아직은 완전 개방형은 아닙니다.⠀ ⠀ ----------⠀ ⠀ 어려운시기 모두 힘내세요~⠀ ---------- #koreainspector #코리아인스펙터 #선박검사 #여행 #공항픽업 #뷰티 #메디컬 #mice...,2021. 2. 2.
양재시민의숲 살랑살랑 숲나들이(서울둘레길 4코스 정보),"구로구,금천구,영등포구 18km 4시간 30분 7코스-봉산·앵봉산코스 마포구,은평구 17km 6시간 30분 8코스-북한산코스 강북구,도봉구,성북구,은평구,종로구 34.5km 17시간 4코스-대모·우면산코스 코스 지역 거리 소요시간 난이도 4코스-대모·우면산코스 강남구,서초구 17.9㎞ 8시간 세부코스정보 서울...",2021. 8. 1.
가압류 (남부법원 양천구/목동/강서구/구로구/금천구/영등포구 이혼변호사 가사전문변호사),"서울남부지방법원 맞은 편에 위치한 '법률사무소 교연'입니다. 이혼을 결심한다면 결정해야 하는 것들 배우자의 외도를 확인하고 이혼을... 법률상 인정되는 증거로는 문자메세지, 카카오톡을 비롯한 메신저 메세지, 전화통화내역, 사진, 동영상, 전화통화 녹음, 편지 및 메모, 여행을 함께 다녀온...",2020. 11. 30.
"일산 중산동 오와스시 연어롤, 오징어우미 오징어회 후기","여행이 부자연스러워진 요즘, 이렇게 배달 하나만으로 현지의 추억을 느낄 수 있어 참 좋았던 식사였습니다. 오와스시 월요일 휴무 연어롤 8 피스 14,000원 마침 오늘이 월요일인데 휴무네요. 체인점으로 시흥, 성남, 용인, 수원, 오산, 서울엔 금천구에 있습니다. 네이버에서 검색해봤어요. 집에서...",2021. 8. 9.
금천향기_2020년 8월호 소식지,"슬기로운 여름나기 - 안심 도서 예약대출 서비스, 명화 속 치유여행 등 구정소식 ○ 행정 - 금천구 혁신행정 우수사례 온라인 투표 참여 안내... 안내 - 금천구청 내 서울금융복지상담센터 무료 상담 안내 직장맘 안내서 ○ 일하는 당신, 마음 놓고 아이 키우세요! - 임신·출산·육아기 노동자를...",2020. 7. 27.
2021 신입생을 위한 자기이해 및 관계증진 프로그램,"나를 찾아 떠나는 여행, 너와 내가 함께 가는 여행, 에니어그램 성격에 따른 진로 강점과 직업 세계의 이해, 너와 내가 함께 하는 비전 세우기의... 최근 서울 금천구 관내 독산초등학교, 경기 가평 방일초등학교, 남양주 주곡중학교, 용인 바이오고등학교, 전북 변산서중학교 등 전국 초중고 100여 곳...",2021. 3. 4.
"[마음백신] 가을의 문턱, 마음을 위로하는 책 한 권을 만나보세요","홈페이지 은평구립도서관 eplib.or.kr 금천구 - ‘안심도서예약대출 서비스’ 금천구립도서관(독산·가산·금나래·시흥)은 홈페이지 내... 채워진 ‘여행·인문학 살롱’이다. 서울에서 비행기로 7시간 떨어진 인도이지만, 메종인디아의 문을 열고 들어서는 순간 특별한 공간으로 초대된다....",2020. 9. 14.
가성비 최고 가산디지털역 술 먹기 좋은 술집 맛집 추천,코로나로 인해 막힌 동남아 여행의 향수를 자극하는 맛이었습니다. 베트남에서 먹었던 맛이 물씬 풍겼는데요. 특히 아삭아삭한 숙주기 정말... 술까락 주소:서울 금천구 벚꽃로 278 전화:02-3397-0007 영업시간:10:30~22:00 #가산디지털역맛집 #가산디지털역술집 #가성비술집 #가성비맛집 #구로맛집...,2021. 5. 9.
간장 논란 잠재울까?…간장 관리체계 개선 워크숍,"30일부터 외식 할인 지원 재개농림축산식품부가 코로나19로 어려움을 겪는 농식품업계를 돕기 위해 외식과 농촌여행 할인 지원을 오는... 12 | 발행인·편집인 : 강대일 발행소 : 서울특별시 금천구 가산디지털1로 88, IT프리미어타워 1102호 (주)식품저널 | 사업자등록번호 : 207-81-50264...",2020. 11. 23.
[명소 탐방] 경기도 시흥의 대표 관광지 오이도,"또한 서울 금천구 시흥동과 이름이 겹쳐져 정체성에 혼란을 일으키는 경우도 자주 있어 왔다. 그러나 최근 들어 인구도 40만을 넘어서고... 그러기에 가로등을 따라 즐거운 코스 여행을 시작해 볼 수도 있다. 먹을거리, 볼거리가 다양한 바다여행을 할 수 있는 곳, 오이도이다. 오이도와 대부도를...",2021. 5. 30.
서울 25개 구 아주 쉽게 외우기,"시청에서는 한국을 잘 알기 위해서는 KTX(용산)를 타고 여행을 추천합니다. 그래서 북한이 좋다고 알고 있었던 북뽕(강북, 도봉)을 맞은 은섬이는... 은섬이는 서울대에서 열심히 공부해서 금(금천구)을 많이 모았습니다. 금을 모아 부자가 되었고 강남3구(서초, 강남, 송파 + 강동)에 집을...",2021. 7. 15.
몰래 알려주는 기차여행,">> 지금까지 기차여행에 대해 소개해 드렸습니다~^^ 필요한 정보 많이 얻으셨나요? 한 번 읽어 보는 것 만으로도 충분히 도움 되는 유익한 시간이 됐길 바라며, 앞으로도 좋은 정보 천천히 알아가요~ #금천구부동산 #가산동부동산 #두산위브아파트전세 #두산아파트월세 #가산동전세 #가산동오피스텔...",2021. 8. 10.
가산피부관리 스무살에머물다 윤곽성형테라피 받고 작은 얼굴 만들기,"스무살에머물다 서울가산점 ***-****-**** 서울특별시 금천구 가산디지털2로 98 1동 313호 화~금 10:00~20:00 토요일 10:00~17:00 일요일, 월요일 휴무 가산피부관리 스무살에머물다는 뷰티 아카데미를 겸하고 있는 샵이라고 해요. 관리실과 강의실이 여럿 있었는데 저는 마감 시간 다 되어가지고 가서 학원...",2020. 1. 5.
그림책 <당근 머리채 뽑힌 날>을 소개합니다,출간도서로는 여행 에세이 <친구와 여행하는 법>이 있다. 인스타: @storyfarmer 블로그: https://blog.naver.com/morbid <구매처 안내> 독립서점(오프라인) ― 올오어낫싱 (서울 금천구 소재) ― 행복한 글간 (서울 강서구 소재) 온라인스토어 ― 알라딘으로 구경가기 ― 스마트스토어에 구경가기...,2021. 1. 28.
코로나19로 답답해진 직장인을 위한 쉼터! G밸리 감성굿즈 카페 하나일곱,여름 휴가철에 맘 놓고 여행을 갈 수 없게 되어버린 직장인들의 답답함을 조금이나마 해소하기 위해 오늘은 #제주도 감성을 느낄 수 있어 색다른... 카페정보 운영 시간 : 평일 08:00~19:00 / 토요일 12:00~16:00 가는 법 : 서울 금천구 가산디지털2로 70 지하1층 101호 / 가산디지털단지 5번 출구를...,2020. 8. 20.
안전하게 즐기는 가을 비대면 관광지 100선/가을 정취 가득한 단풍여행(한국관광공사...,- 주소: 서울특별시 구로구 연동로 240 - 이용시간: 매일 05:00 – 22:00(항동철길은 항시 개방) - 입장료: 무료 이밖에도 가을 비대면 관광지 100선에 포함된 서울 여행지는 아래와 같다. 초대길(강북구) 호암산성(금천구) 수락산 학림사(노원구) 원당샘공원(도봉구) 고구동산길(동작구) 송정제방길...,2020. 10. 23.
[맛집여행] 가산디지털 맛집 / 리가든,가게 위치 및 운영시간 서울특별시 금천구 가산디지털1로 168 우림라이온스밸리A동 205호 월요일 11:00 - 23:00 14:00-17:00 브레이크 타임 화요일 11:00 - 23:00 14:00-17:00 브레이크 타임 수요일 11:00 - 23:00 14:00-17:00 브레이크 타임 목요일 11:00 - 23:00 14:00-17:00 브레이크 타임 금요일 11:00 - 23:00 14:00-17:00...,2021. 2. 7.
"2020 11월 안뇽,,,","흠,,, 일단 11월 4일 서울 금천구로 혼자서 발레공연을 보러 갔다. 이 때 이후 발레 관심이 생겨서 호두까기인형 예매하고싶어서 발 동동 ㅠㅠ 티켓... 부모님이 때마침 2박3일로 여행가구 할아버지만 계시는데 석영이네서 호떡 유튭찍고 울집에 11시쯤 오면 할아버지 마주칠 확률도 적을것같아서...",2020. 11. 30.
"산림청 지정 한국 100대 명산 중 서울 명산 알아보기 북한산, 관악산, 도봉산","산림청 100대 명산, 서울 명산 안녕하세요 여러분 :-) 요즘 등산을 가는 분들이 많아진 것 같아요! 저도 평소에 여행을 좋아하는데 맘 편히 갈 수가... 관악산 서울 명산 관악산, 관악산 정상 연주대 관악산은 서울의 관악구, 금천구 경기도 안양시, 과천시에 걸쳐 있는 산으로 산 높이는 632....",2021. 5. 5.
아큐브 디파인 후레쉬로즈 렌즈추천 최저가판매 나만몰랐어?!,렌즈통을 들고 여행도 안가도 되고 리뉴도 보관도 다 필요없으니 짱!!! 렌즈 쟁여두니 괜히 마음이 든든한 기분 !! 요즘 시국이 시국인지라... 오공플러스안경 서울 금천구 벚꽃로 298 B124호 지번서울 금천구 가산동 50-3 Tel. 02-866-5111 영업시간 평일 10:00~21:00 토요일 : 10시~19시 (일요일휴무)...,2021. 5. 12.
21년 3월 신혼부부 가계부 정산 #10억모으기 #구채희가계부,서울 금천구 빅마켓에서 어린이 전용극장이 있는데 가성비 너무 좋았다. 하루 시댁에 아이 맡기고 남편이랑 영화 '미나리'도 관람 :) 근데 나는... 여행은 가계부엔 기록하지 않았지만 신랑 회사 복지포인트로 호캉스를 한 번 다녀왔다. (곧 포스팅 해보게쑵니당 ㅋㅋ) 매년 170만원 정도 신랑...,2021. 4. 13.
"[제로페이 사용법] 서울사랑상품권 구매, 7월 추가발행 ((비플제로페이 추천...","미리 사두기보다 여행갈 때 사는 것을 추천한다. 서울사랑상품권의 경우 1인당 월 구매한도가 70만원까지인데 다 못 쓸까봐 20만원만 샀던건 괜한... 금천구 외에 모든 지역이 소진된지 꽤 오래되었고, 7월이나 추석을 앞둔 9월에나 추가 발행여부가 결정된다고해서 기다리던 참이었다. 자치구...",2021. 7. 9.
내가 사랑할 수 있는 서울 01. 종로,강서구-잘모름2 금천구-잘모름3 중랑구-잘모름4 양천구-잘모름5 동작구-잘모름6 (아니 무슨 동네가 이렇게 많아요!) 뭐 이렇다.. 서울이 도시라곤... 성공회성당쪽 사진찍으면 아주 먼곳에 여행간양 다른느낌이기도 하고. 친구들이 성당에서 연예인 봤다고 어머어머 하는데 나는 제대로 못봤다... 왜...,2021. 5. 11.
간단하게 뚝딱 알아보는 기차여행 관련 정보,기차여행에 대해 배우러 오세요~ #금천구부동산 #가산동부동산 #두산위브아파트전세 #두산아파트월세 #가산동전세 #가산동오피스텔 #독산동오피스텔 #부동산재테크 #가산동아파트 #독산동아파트 #독산동전세 #가산동상가 #독산동상가 #가산동사무실 #독산동사무실 #가산동공장 #독산동공장 #서울디...,2021. 5. 7.
"희명병원 - 코로나19 검사, 드라이브스루 및 워크스루 선별진료소 24시간 운영",""" 서울 금천구 최초로 워크스루 / 워킹스루, 드라이브 스루 검사를 24시간 운영하고 있으며 사전예약 시스템으로 본인에게 편한 시간에 맞춰 검사를 진행하실 수 있습니다. + 그러니 확진자와의 접촉이 의심되시거나, 발열 및 기침, 가래 등의 이상 징후가 있으신 분, 해외여행 혹은 대구, 경북 지역을...",2020. 4. 2.
온수온돌기능사학원은 청주온수온돌기능사학원인 한국건설교육원에서~ F4비자 발급...,"서울교육장 : 서울 금천구 가산동(가산디지털단지) 345-24 1506호 070-8848-3377,***-****-**** 난방시공, 가스시설시공3종업(기계설비공사업... 청년부터 노년층까지 다양한 연령의 사람들이 건설기능사자격증을 취득하기 위해 몰리고 있는 추세이다.이제는 2020년 4월달부터 외국인 C 3-8 여행비자로...",2020. 6. 17.
2021년 국내외 주요 미술관·갤러리·아트페어 등 미술전시 일정(10/7),"2021년 국내외 주요 미술관·갤러리·아트페어 등 미술전시 일정(상시 업데이트) 국립현대미술관 서울관 소장품전 전시 전경, 좌측... 국립중앙박물관 19위(773,621), 국립현대미술관 서울관 39위(475,091), 국립익산박물관 47위(417,527), 국립경주박물관 58위(365,294)...",2021. 4. 6.
테마파크 사이트모음,"서울시 송파구 송파대로 111 파크하비오. - 워터파크, 스파, 피트니스 시설안내. 윈드1947 카트 테마파크( http://www.sklec.com/ )... - 애니멀 테마파크, 자연체험, 동물체험, 가족여행, 커플여행, 사진촬영. 정양레저테마파크( http://www.jypark.co.kr/ ) - 경상남도 합천군 대양면...",2021. 7. 24.
클라렌소울브라운 일회용컬러렌즈 후기,그렇다 보니 여행을 갈 때나 외박 하는 경우에 되게 유용하게 쓸 수 있는 제품이에요. Previous image Next image 클라렌소울브라운은 아이리스 버전... 감사합니다~ 가산점 가산점 - 우리동네안경원 가산점 (글라스코드) ★ : 02-862-0552 서울특별시 금천구 벚꽃로 298 대륭 포스트타워 6차 105호...,2021. 8. 27.
"납품업체 갑질 ‘롯데슈퍼’, 과징금 39억","농촌여행 할인 지원을 오는 30일부...농식품부-유엔개발계획, 아세안 농촌 개발 협력농림축산식품부는 26일 유엔개발계획(United Nations... 식품저널(Food News) | 인터넷신문 등록번호 : 서울 아 00022호 | 등록일 : 2005.08.12 | 발행인·편집인 : 강대일 발행소 : 서울특별시 금천구...",2020. 11. 23.
"담양 맛집, 쌍교숯불갈비",저번 담양여행에서 즐겼던 고깃집을 추천드릴게요! 담양하면 떡갈비랑 죽통밥인데 1박2일 여행이였던 저희는 엄청난 고민끝에 숯불갈비를 먹으러... ㅎ ㅎ 담양이 본점이지만 서울 금천구에도 생겼다고해요!!!! 들깨수제비 먹으러 조만간 또 가야겠다 #담양 #담양맛집 #고기 #갈비 #맛집추천...,2020. 12. 16.
아는 사람은 다 아는 가성비갑 아큐브렌즈 안경 최저가로 맞춘 곳,출장이나 여행 시 대비해 놨다가 활용하면 편리합니다. 오공플러스안경원.내부 영상 오공플러스안경원 명함 주소 서울 금천구 벚꽃로 298 B124호 (지번 : 서울 금천구 가산동 50-3 전화 02-866-5111 영업시간 ㆍ평일 : 10:00~21:00 ㆍ토요일 : 10시~19시 ㆍ일요일휴무 지금까지 #가산디지털단지역근처...,2021. 4. 12.
[ 은혜와 사명 - 2021년 04월 29일 ],"전도 여행에서 돌아온 제자들은 자신이 한 일을 낱낱이 예수님께 보고합니다. 그런데 예수님은 보고를 중단시키고 이렇게 말씀합니다.... 안동혁 목사(더드림교회) ◇더드림교회는 서울 금천구에 위치한, 작지만 건강한 교회입니다. ‘하나님 나라를 꿈꾸고 함께 이뤄가는 예배 공동체’를...",2021. 4. 29.
광명 소하동 맛집 푸짐 푸짐! 한가네철판칼국수,해외여행도 기약없고 그 사이 또 다른 취미에 꽂혔으니 온통 그 이야기를 부어냅니다. 제 친한 친구도 광명에 살고 있는데 오늘은 출근했겠네요.... 경기도지만 서울이나 다름없지요. 금천구쪽과 경계이고 집전화 지역번호도 02로 쓰니 말입니다. 금천쪽 살때는 광명으로 자주 나들이 나오곤 했었지요....,2020. 7. 7.
♬로또_1월 30일_948회_당첨번호_명당,"당첨되면, 집을 사야지, 빚을 갚아야지, 또는 삼성전자 주식을 사두고 매월 이자나 받는다 생각해야지 부터, 외국 여행 어디로 가봐야 하나... xlsx 파일 다운로드 번호 상호명 구분 소재지 1 하이로또 자동 서울 금천구 금하로 686 2 팬시겔러리 수동 서울 서대문구 통일로 153-1,(냉천동) 3...",2021. 1. 31.
[원데이오피스] 글쓰기 좋은 원데이오피스6,"매일 똑같은 책상에 앉아 있는 것이 지루할 땐 짧은 창작 여행을 다녀오는 것도 좋다. 글을 쓰기 좋은 곳을 몇 군데 알아두었다가 그 날 그... 문화정원 코워킹스페이스 서울 금천구 가산로 61 문화정원 2층 코워킹스페이스 가격 | 22,000원 /일 스페이스클라우드 / 원데이오피스...",2021. 3. 14.
"신촌 컴퓨터학원 일러스트 수업듣기 , 친구랑 와인바","우리가 간 곳은 가산 디지털단지 역 쪽에 있는 스튜디오레이크 와인바 / 서울 금천구 디지털로 210 지하1층 일요일 휴무 , 17:00-22:00 평점... 그리고 잔잔하게 유럽영상이 틀어져 있었는데 ㅠㅠ 이게 나는 너무 좋았다 다시 유럽여행 가고 싶고, 너무 예쁜 영상이었다 스튜디오레이크 우리는...",2021. 4. 29.
"[가산디지털단지역] ""한라목장"" 제주 냉동 삼겹 미나리 꽈리고추 볶음밥까지!",한라목장 연락: 0507-1384-1238 영업: 매일 17:00-24:00 일요일 휴무 위치: 서울 금천구 벚꽃로40길 8 한라목장은 가산디지털 단지 1번 출구에서 도보 4분... 저는 그렇거든요 어릴 땐 생고기 보다 냉동을 많이 먹었던 거 같아요 그래서인지 어릴 적 생각도 나고 추억여행 온기분이라 넘넘 좋더라구요 요런...,2021. 1. 21.
월간파리유하 2021년5월,"커피도 맛있고 자리도 넓고 이젠 사장님이 알아보고 스콘을 서비스로 주심 >.< 길에서 한컷 - 금천구 롯데캐슬 4차에 위치한 네일이시간 - 벌써... 서울로 돌아가던 날 - 인생돼지국밥을 한그릇먹고, 커피한잔. 이렇게 부산 여행 마무으리 - 6월은 더욱더 행복할꺼야 >.<",2021. 6. 21.
장난감도서관 이용해보세요 소하광명하안점 저도 곧 대여하러 레고레고,"산으로 바다로 여행을 가거나 물놀이를 즐겼을 아이들이지만, 지금은 아이들과 함께 현장 체험도 가기 힘든 상황입니다. 친구들은 우주라는 말을... 더 이상 광명 철산 학원가나, 서울 금천구 쪽으로 멀리 학원 다닐 필요 없이, 닥터스터디 학습코칭 광명 개인 가정 방문 과외 선생님을 쉽게...",2021. 3. 30.
금천구청역 맛집 허가네연탄불고기/안양천 라이딩 맞바람 덕분에 찜콩한 시흥동...,어서어서 코로나19 종식되고 단체 모임도 하고 맘 놓고 여행도 가고... 그러고 싶네요. ㅠㅠㅠ 배추김치는 겉절이였고요. 마늘종은 무침 스타일.... 했던 어제 ㅠㅠㅠ 돌아오는 주중에 바람 안부는 날에 다녀와야겠어요!! 허가네연탄불고기 금천점 주소: 서울 금천구 시흥대로63길33 영업시간:10:00-22:30,2021. 5. 9.
"추석 전, 블랙박스 당일 출장장착 이벤트 ♡","안산 수원 시흥 안양 과천 군포 의왕 광명 부천 오산 화성 서울 금천구 아이나비 블랙박스 파인뷰 블랙박스 아이트로닉스 블랙박스 블랙박스... 장거리 여행 앞두고 블랙박스 점검하셨다가 갑자기 안되는 경우도 있으실 거에요~ 지금! 확인해보시고, 혹시나 안 된다면 카플레이로 연락주세요...",2020. 9. 25.
