header,contents,date
"서울의 시간을 그리다, 한옥 서점 카페 / 정겨운 동네책방",게으른 나는 힘들겠지..? 남편분 이장희 작가님 그림이 담긴 다이어리도 판매 여행이 별건가. 이렇게 꿈꾸고 소망하던 곳에 가보는게 여행이지. 찻값도 저렴하니 서울 독립문 근처 오셨다면 한번 발걸음 해보심이 어떨지.. ☕ 서울의시간을그리다 서울 서대문구 독립문로 31-6 http://naver.me/FcjHWLs4,2020. 5. 30.
세계문화유산 태릉과 강릉(태강릉) 서울 산책하기 좋은 길,"Asia Seoul, Korea July, 2020 한국 :: 서울 한국 라이프 & 한국여행 2020. 07 한국여행 세계문화유산 태릉과 강릉(태강릉) 서울 산책하기 좋은 길 비우고... 서대문구에 있는 안산도 그렇고 이곳 강릉도 그렇고 생각보다 이름이 비슷한 곳들이 꽤 있다. 강릉은 태릉보다 규모가 많이 아담해서 금방 보고...",2020. 10. 11.
"연세대 맛집, 신촌 오코노미야끼 : 철판요리가 맛있는 신촌데이트코스 야바이","이전에 여행갔을때 신랑이 극찬했떤 야끼소바 여긴 맛이 어떨지 궁굼했던 메뉴! 좀 느끼하지 않을까 생각했는데 숙주, 양배추에 야끼소바 소스... 가능하고 매우 편리한곳 신촌에서 하이볼과 오코노미야끼는 이곳입니다요!!ㅎㅎ 주소 : 서울 서대문구 연세로7안길 37 지하1층 전화번호 : 070-8875-1024",2020. 2. 2.
"[스누피의 한국여행 85.20] 서울 마포구 홍대입구 및 주변 여행기1 (합정역, 상수역...","이후 일제대 경기도 고양군 연희면 합정리로 되었다가 1943년 서대문구 합정정이 되었다가 1946년에 일제식 동명을 우리 동명으로 바꾸면서 마포구 합정동이 되어 오늘에 까지 이른다. 서울 북서부 한강변 환승거점으로 유명하고 인천, 고양, 파주 등 수도권 서부지역으로 환승하는 버스들이 많이...",2020. 8. 20.
<박영선>이라는 여자,"생일 파티를 즐기고 골프와 여행을 마냥 즐기기 위해서였다. 1) 박영선, 2) 노영민, 3) 박기춘, 4) 양승조, 5) 우윤근, 6) 이강래, 7) 전병헌, 8) 주승용, 9)... ‘서민을 위한 서울 시장’을 기치로 내건 박 후보의 아들은 서울 서대문구 연희동에 위치한 외국인 학교에서 초등 교육을 받았는데, 이 학교의...",2021. 1. 21.
서울특별시 행정구역(1)- 한성군 소속 지역,"새로 편입된 지역을 관할하기 위하여 같은 날 서대문구 은평출장소, 성동구 뚝도출장소, 성북구 숭인출장소가 설치되었다 1950년 3월 15일 : 서울특별시에 속한 리(里)가 모두 동(洞)으로 변경됨 1963년 1월 1일 (서울 대확장) : 경기도 시흥군 동면(안양리 제외)·신동면, 부천군 소사읍 동부...",2020. 8. 31.
연희동맛집 : 이연복셰프 : 목란,두근세근 연희동 중국집 목란 전화번호 : 02)732-1245 주소 : 서울 서대문구 연희로15길 21 월요일 휴무 넓은 주차장. 주차도와주시는 발렛아저씨가 계셔서 수월한편이다. 점심은 11:30~15:00 저녁은 17:00~21:30 오후3시부터 5시까지는 브레이크타임이다. 매달 15일주기로 예약을 받는다는데 6/15-7/15까지의...,2020. 6. 18.
2018년 B.,"만성적 여행수지, 서비스 수지 적자 해소에 크게 기여할 수도 있을 것입니다. 사업성이 있는 해운대 마린시티, 센텀시티, 해운대 비치와부터... 서울 서대문구 대현동 럭키대현아파트 전용면적 59.7㎡는 지난 7일 9억원, 서울 강동구 성내동 현대아파트 전용 59.36㎡도 지난 3일 9억원에...",2021. 9. 5.
엔드그리고 (andgrigo) 와인바 후기,엔드그리고 ( andgrigo ) 서울 서대문구 홍제천로 186 안녕하세요 :) 이제 포스팅 꾸준히 올려야겠어여ㅠㅠㅠㅎㅎ 오랜만에 올리려니 밀린숙제를 하는기부닙니다 ㅋㅋㅋㅋㅋㅋ 오늘은아주오랜전에 다녀온 #엔드그리고 와인바 포스팅할라구해용 저희 커플은 평소에 여행다니는걸 참좋아해요...,2021. 9. 19.
연희동 한정식 잘하는 연희동그집의 건강밥상,여행을 하는 기분을 주는것 같아요. 서대문에는 예쁜 카페와 편집샵 외에도 연희동 한정식 잘하는 집이 있어서 찾아가 보았어요. 코스로 나오는 음식들이 푸짐하면서도 처음 먹어보는 것도 있어 신기했는데 정갈하고 맛있더라구요. 고급스러우면서 식재료가 신선했어요. 서울특별시 서대문구...,2021. 8. 31.
"거리두기 4단계 직격탄, 숙박·여행업계 “할 수 있는 게 없다”","거리두기 4단계 직격탄, 숙박·여행업계 “할 수 있는 게 없다” 입력2021.07.23. 오전 12:03 수정2021.07.23. 오전 12:04 코로나 4차 유행으로 예약... [연합뉴스] 서울 서대문구에서 숙박업소를 운영하는 A씨. 그는 22일 “요즘 매출은 바닥이고 손님도 거의 없다”며 “전에는 이 일대에 식사하거나...",2021. 7. 23.
[공정거래위원회] 대기업집단 계열회사 변동 현황 공개,"자문, 구축 및 관리업 서울 서대문구 성산로 543, 2층(대신동, 국제빌딩) 카카오 상출 프리티비지㈜ 윤나라 소프트웨어 개발 및 공급 경기도 고양시 일산동구 중앙로 1275번길 60-30, 4층(장항동, 라페스타 비동) 카카오 상출 ㈜스튜디오하바나 왕효진 출판업 서울시 서초구 강남대로 53길 8",2021. 8. 3.
연희동 카페 매뉴팩트 커피 MANUFACT COFFEE,방배점에서 아이스로 마시고 너무 맛있어서 깜짝 놀란 커피였고 스페인 여행에서도 제법 챙겨마신 코르타도라서 오랜만에 괜히 더 반가운... 주소 서울 서대문구 연희로11길 29 (연희동 130-2) 전화번호 02-6406-8777 영업시간 평일 09:00 - 18:00 토요일 09:00 - 18:00 일요일 휴무 주차 불가 Copyright ⓒg_ny ALL...,2020. 3. 11.
서대문자연사박물관 :: 서대문 자연사박물관리뉴얼 후 이렇게 달라졌어요.(코로나 전후...,도끼고기와 관벌레를 보고 싶다고 해서 목포까지 여러 번 기차여행을 하고 목포어린이바다과학관(2019) 개복치와 고래상어가 보고 싶다고 해서... [서대문자연사박물관] ·주소: 서울 서대문구 연희로 32길 51 ·평일관람시간: 9시~18시(3~10월) ·주말관람시간: 9시~19시(3~10월) ※11월~2월 1시간씩 단축...,2021. 10. 9.
[서울한양도성]인왕산구간:돈의문터~인왕산 정상~윤동주 시인의 언덕~창의문,14 포항으로 가족 여행 가려고 기차를 예매해뒀는데 갑자기 신랑이 일이 생겨서 포항으로 가는 건 취소하고 서울에 있게 되었다 여행 가려다 취소돼... 도착 서대문구와 종로구의 경계(우) 정상에 서니 북악산이 더 가까워졌다 평창동 방향 남산 방향 지난 주에 청와대 앞을 지나 삼청로로 걸었던 그...,2020. 11. 15.
연남동 빵집 만동제과 줄서서 먹는 서울 빵집,연남동 빵집 만동제과 정보 주소 서울 서대문구 창천동 448 영업시간 11시 ~ 20시30분 소진시 조기마감 휴무. 월요일 연남동 나들이갔을때 그냥 지나칠 수 없었던 연남동 빵집 만동제과 전에 강릉 여행갔을때도 맛있게 먹었어서 연남동 갈때 꼭 들려야지 했던곳이다 멀리서부터 느껴지는 빈티지한...,2020. 8. 17.
홍제동 족삼리 반반족발 친절한 사장님,"홍제동 친구가 추천하는 찐맛집 복을 주는 족발마을, 족삼리 얼마만에 만나는지 6월 제주여행 이후로 정확히 세달만의 만남ㅠㅠ 6시 이후로 2인이상... 족삼리 서울 서대문구 홍제동 115-5 1층 매일 15:00 ~ 01:00 국민지원금 사용 가능 웬일로 시간맞춰 딱 도착해서 다른 친구들 기다리는 동안 먼저...",2021. 9. 23.
"서울여행기 2편 - 딩딤1968,서대문형무소,바캉스커피,잡채호떡,서울부띠크",#서울카페 #서울데이트 #서울맛집 #서울여행 #먹방투어 #카페투어 #서울카페 #종로 놀거리 #딤섬맛집 #바캉스커피 #남대문시장 #1박2일... 마음속에서 울리는 무언가의 요동이 아직도 잊혀지지 않아요 서대문구를 가실 일이 있다면 꼭 가보시기를 ㅠㅠ 서대문 형무소는 코로나 기간동안 인원을...,2021. 4. 13.
"신촌 맛집, 고급 중식당 [티원 연세대점]","맛 요약입니다 배 터질 거 같다 하면서도 거의 핥아먹고 왔네요 ㅋㅋ 고급스러운 중식당 찾으시면 티원 방문해보세요! ▲ 티원 공식 홈페이지 서울 서대문구 신촌공 134 (연세대학교) 서울 서대문구 연세로 50 (연세대학교) 매일 11:00 ~ 22:00 브레이크타임 15:00 ~ 17:00 일요일, 공휴일 휴무 02-365-6564",2020. 2. 3.
뷰카페에서 가을 감성 일상 여행,"때마침 언덕에 불법주차된 차로 인해 입구를 발견하지 못해서 한참을 헤매다 방문한 연희카페 오디너리핏 오디너리핏 ordinary.pit 서울 서대문구 연희동 433-10, 3층 서울 서대문구 연희로11가길 48-23 영업시간 12:00 - 20:00 (월요일 휴무) 주차 불가능 어릴 적 부유했던 동창 집이 생각나는 마당 있는...",2020. 11. 19.
서울 호캉스 추천 / 남산뷰 호텔 <티마크 그랜드 호텔 명동> 패밀리스위트룸 후기,"나름 서울 강북구쪽(종로구, 중구, 서대문구 등) 호텔은 잘 다니는 편인데 그 중에서도 가성비가 너무 좋았어요 특히 #서울남산뷰호텔 로 치면 이만한 가성비가 없는 거 같긴 해요! 명동, 남대문 쪽에서 놀 예정이고 가성비 남산뷰 호텔을 찾는다 하면 #티마크그랜드호텔 을지로, 청계천...",2020. 7. 22.
"[11월 일상] 서울가을여행 일상(하늘공원:억새숲, 망리단길/시험/카페/목도리뜨개질)",서울에서 이런 경치를 볼 수 있다는게 너무 행복하다_ 한강이 한 눈에 들여다 보인다. 꽤 넓은 규모라서 복작거리지 않았다. 혼자와서 구경하다가도... 서대문구까지 가느라 힘들었다. 아침부터 일어나는 것도 힘들고 카페인 충전이 필요했는데 근처에 문을 연 카페가 하나도 없었다 ㅠ 편의점...,2020. 11. 18.
서울 일출명소 응봉산 팔각정 전망대의 경이로운 일출 (주차장 정보),"서울에도 일출 명소가 여러 곳이 있답니다. 성동구 응봉산 팔각정 전망대, 마포구 하늘공원 전망대, 남산타워의 전망대, 서대문구 안산 봉수대... #서울일출명소 #일출명소 #응봉산 #응봉산팔각정 #응봉산일출 #응봉산주차장 #서울가볼만한곳 #서울여행 서울 가볼만한곳 응봉산 팔각정 전망대의 일출...",2020. 12. 23.
●해외여행 대신 명품···청담동 샵 매출... 16팀●해외여행 대신 명품···청담동 샵...,"●해외여행 대신 명품···청담동 샵 매출 폭등 [코로나 1년, 자영업자의 눈물] 주요상권 5곳 업종별 매출 분석·심층인터뷰 ‘경제’보다는... ▲ 19일 서울 서대문구 이화여자대학교 인근 한 상점에 점포정리라는 종이가 붙은채 문이 닫혀 있다. 2021. 1. 19 박윤슬 기자 ****@*****.**.** ··●관광객...",2021. 6. 5.
"[서울/서대문] 알 사람은 다 아는 우동 맛집 '가타쯔무리' :: 웨이팅, 메뉴추천",여행사진 #여행정보 #여행코스 #서로이웃 #이웃 #이웃환영 #서이추 #서이추환영 #소통 #댓글 #일상블로그 #카페 #감성카페 #카페추천 #카페인테리어 #카페사진 #맛집 #맛집추천 #명지대맛집 #서대문구 #서대문맛집 #가타쯔무리 #수타면 #우동 #우동맛집 #일식 #서울3대우동 #서울맛집 #서울여행 #서울,2021. 5. 11.
신촌 연어 무한리필 회식장소 하꾸야,불과 몇 달전에 다녀온 여행지의 추억이 고스란히 소환되는 이 느낌 너무 행복하다. 여러 종류의 사케들과 아기자기한 소품 그리고 중앙홀에 있는... 풀어보면서 신촌이 주는 젊은 감성을 온 몸으로 느껴본다. 신촌 연어 무한리필 월 - 토 17:00 - 01:00 서울 서대문구 창전동 52-23 2층 신촌역 2번 출구 417m,2020. 4. 18.
"코로나신규확진자 343명(2020.11.19,목)",어제 정오 기준으로 서울 서대문구 요양원과 관련해 9명이 추가확진 돼 누적확진자 10명이 발생했습니다. 또 동대문구 에이스희망케어센터는 6명이 추가 확진돼서 누적확진자 71명으로 집계됐습니다. 지난 13일 첫 확진자가 나왔던 송파구에서도 지인여행모임과 관련해 17명이 새로 확진돼...,2020. 11. 19.
"서울 신촌) 신촌에서 제주 고기국수가 먹고 싶다면 신촌밥집 ""맨도롱식당""으로!!!",올해 9월 제주 여행을 다녀오고 나서 제일 생각나는 것이 제주시내에서 먹은 고기국수인 것 같아요. 아이들도 국수를 엄청 좋아해서 국수! 국수!... 맨도롱식당 영업시간 매일 11:00 - 23:00 02-3141-3055 서울 서대문구 연세로5가길 8-3 1F 맨도롱 식당 2번 신촌역1번 출구에서 200m (걸어서 3분),2020. 12. 23.
[머노까머나] 신촌 인도요리 맛집,KITCHEN 서울 서대문구 연세로11길 13 2층 OPEN / 11:00 CLOSE / 22:30 2층에 위치한 머노까머나 저희가 앉은 자리예요 ! 깔끔하게 세팅되어 있어서 좋았어요 ~~ 컵이 신기하게 생겨서 한 컷 찍어봤습니당 히히 Previous image Next image #머노까머나메뉴판 사장님의 세심한 인테리어를 보니 괜히 인도 온...,2021. 9. 13.
신촌 카페 독수리다방 유럽 여행 중인 척-☆,"▶ 서울 서대문구 연세로 36 독수리빌딩 8층 ▶ 월-금 11:00-24:00 / 토 11:00-23:30 / 일, 공휴일 11:00-23:00 ** 방문 전 영업시간 확인 필요 ▶ 인스타그램 @dokdabang 홍이 가면 흥이 따라오는 일상의 홍이예요 ( ღ'ᴗ'ღ ) 코로나 확진자 수가 갑작스레 또 증가하며.. 잠시나마 가능할 것 같았던 해외여행의 꿈은...",2020. 11. 29.
[주간이슈] SDGs/로컬콘텐츠/도시재생 새소식 모음 (8월 3주),"전환 서울 서대문구가 올 하반기에 지속가능발전 계획 및 추진사항을 점검하고 전문가 자문을 거쳐 지속가능 발전 기본계획을 목표형으로... 제로’ 여행 콘텐츠를 제시했어요. 플라스틱 제로 콘텐츠에는 도보로 여행하는 탄소제로 코스 다회용 컵 이용하기, 식수 무료 제공 받기 등 다양한 에코...",2021. 8. 17.
"서울/맛집_이화여대 맛집, 이대맛집 추천_골목식당 백종원 극찬한 집",라멘 먹으니까 일본 갔던 생각이 났다 일본에서 먹었던 라멘과 비교 할 수 있게 함께한 여행기록 먹어 봐서 비교 할 수 있어서 또 우리에게 추억을 더할 수 있어 좋은 시간이였다. ▶ 주소 : 서울 서대문구 이화여대5길 7-3 ▶ 영업시간 : 매일 11시-22시 (B.T 15시 - 17시) ▶ 전화 : 02-363-7877 . . . . . . .,2020. 1. 4.
서울/강원 지역안내,닭갈비/춘천여행/소양댐/춘천닭갈비/닭갈비집/소양댐닭갈비/춘천맛집 2012. 3. 22. 세종익스프레스 이사/포장이사/사무실이사/보관이사/원룸이사/춘천이사/춘천포장이사/춘천사무실이사/춘천보관이사/춘천원룸이사/이삿짐센터/이삿짐센타/이사짐센타/이사짐센터 2012. 3. 22. [서울 중구...,2021. 8. 9.
수요미식회 맛집리스트 - 3편 (서울 한강이북지역),진행방식과 음식점을 선정하는 기준에서 조금씩 차이가 있었지만 타지역으로 여행을 갈때 꼭 체크해볼 소중한 맛집 리스트였습니다.... 죽해수산 서울 서대문구 연세로5길 30 (창천동 62-3) 31회 중국만두 서울 편의방 서울 서대문구 연희로 36 (연희동 353-94) 42회 빵 서울...,2020. 12. 31.
홍제동 스위스그랜드호텔 에이트리움카페,한식 단품식사를 해도 식전빵도 준 게 제일 좋았다.^^ *** 직접 계산하고 먹은 후기입니다. 취향이 저와는 다를 수 있으니 장소 참고만 하세요~ 스위스 그랜드 호텔 에이트리움 02-2287-8270 서울 서대문구 홍은동 201-1 ( 연희로 353 지하 로비층 ) 매일 12:00~22:00 연중무휴,2020. 2. 23.
광복절에 가볼만한 곳을 추천합니다,<서대문형무소역사관 관람정보> (주소) 서울 서대문구 통일로 251 서대문형무소역사관 (이용시간) 09:30~18:00 * 코로나19 확산 방지를 위해 홈페이지 사전 예약 (시간당 150명 이내/ 방문 15일~1일 전까지 인터넷 예약 가능 / 당일 인터넷 예약 불가 / 미 예약시 입장불가) (관람요금) 무료 / 일부...,2020. 8. 15.
랜선여행 한국 스타벅스 1호점 이대R 기념MD,"부산사는 저로써는 너무 방문해보고 싶은데 직장인에, 현재 시국상 바로 서울 여행을 가기 힘들어서 서울친구에게 이야기 했더니 바로 저 대신 방문 이렇게 스타벅스 1호점 이대R 랜선여행이 시작되었습니다. 스타벅스 코리아 1호점 이대R 주소 : 서울 서대문구 이화여대길 34 시간 : 07:00-21:30...",2020. 7. 7.
서울 등산코스 추천 / 안산자락길 따라 무악동 봉수대까지,코로나로 여행계획을 세울 수 없어 근교 등반코스를 둘러보기로 했다. 설악산과 한라산을 연말에 탈 계획으로 가볍게 몸을 풀 수 있는... 서대문구와 은평구를 바라보며 우선 사진 한잔 찍어본다. 저 멀리 북하산자락과 인왕산 산성이 한눈에 들어오는 곳. 서울 도성길이 이렇게 한눈에 펼쳐지는...,2020. 12. 28.
서대문독립공원 독립문 서울 아이와 가볼만한곳,겨울방학 혹은 여름방학 맞이하여 꼭 한번 방문하세요 아이와 함께 주말에 교과서여행 어때요? 추천추천! 이제 그만 안녕! 오늘은 여기까지! ㅋㅋㅋ 다음은 서대문형무소 이동할꺼니까 다음 포스팅 기대해주시면 더더더더욱 감사할 것 같네요오! 서울 서대문구 현저동 941 독립문 네비 찍어용!,2020. 1. 23.
"서울 데이트 코스 추천 (독립문역, 예산 3만원)","서대문 독립 공원 서울특별시 서대문구 현저동에 있는 시립공원이다. 그냥 '독립공원' 이나, '독립문공원'이라고 불리기도 한다. 예전에는... 개인적으로 도가니탕을 먹기보다는 수육 하나 시켜서 쏘주 한 병하면 그날 데이트나 여행의 마무리로는 훌륭하다. 만난지 얼마 안된 커플이라면, 대성집...",2021. 8. 2.
연희동에서 힐링하기 등산하고 맥주 먹고 불멍까지,요즘 하루하루 넘 거지 같아서 힐링 찾으러 또 여행 아닌 여행을 다냐옴 이쯤 되면 내 패턴 확실 ㅋㅋㅋㅋㅋㅋ 인생 좆같다 -> 여행 -> 마음 정리 다시... 안산 선수님 아니조 경기도 안산 아니조 서울 서대문구에 있는 산 ! 안산 ! 전나 힘들고 개더워서 땀 질질 나고 ㅠ 진짜 심장 아파서 사람 죽는 줄...,2021. 8. 30.
신촌피부관리 아이뽀에서 프리미엄 코스 만족 후기,"아이뽀 신촌점 위치는 위의 지도 참고하시길 :) 예약은 02-3442-0111 주소는 서울 서대문구 신촌역로 20 지하 1층이다. 오픈 시간은 매일 오전 10시- 오후... 아이뽀 제품들이야 워낙 다 유명하지만, 나에게 추천해주신 제품은 바로 수딩시카크림 :) 아프리카 여행으로 예민해진 피부를 잠재울 예정이다...",2020. 3. 4.
"[김해근대여행] <홍도야 우지마라>, 김영춘","[김해 근대문화여행, 인물편] 오빠가 왔다! '홍도야 우지마라' 김영춘 2020년 ! 코로나로 힘든 사람들의 심신을 달래준 TV 프로그램이 있었습니다.... 1936년 봄, 서울 서대문구 있었던 우리나라 최초의 연극 전문극장 이었던 <동양극장>에서는 연극 <사랑에 속고 돈에 울고> 라는 작품이 공연되고...",2020. 12. 23.
[서울] 나만 알고싶은 서울 감성 숙소 위시리스트 :: 7곳 가격 & 예약링크,서로이웃 #이웃 #이웃환영 #서이추 #서이추환영 #소통 #댓글 #일상블로그 #카페 #감성카페 #카페추천 #카페인테리어 #카페사진 #감성숙소 #에어비앤비 #에캉스 #호캉스 #호텔 #서울 #서울여행 #종로 #서촌 #경복궁 #남산 #연남동 #이태원 #한남동 #한강진 #서대문구 #연희동 #연희동사진관 #반신욕,2021. 3. 26.
"여름휴가 아이들과 가볼만한 곳 추천 @서대문형무소,서대문 독립공원 (주차,관람료 등)","의왕으로 서울구치소가 이전된 뒤 보안과, 청사, 옥사, 한센병사, 공작사,사형장을 남겨두고 나머지 시설은 모두 철거했다고해요. 그래서 서대문구에서 역사성을보존하기 위해 역사관 개관을 진행해 이렇게 관람할 수 있게 된거죠. 이왕이면 코로나로 해외여행 못가는 이 시점에 아이들과 꼭...",2020. 8. 6.
도심 속 120년 된 근대 건축: 충정각,"아직 못 가본 곳이라, 다음에 목포 여행을 가면 꼭 둘러 볼 생각이다. 세트 메뉴를 시켜 이것 저것 먹었는데, 수다 떠느라 사진은 전식으로 나온... 출처: 매일 경제, 사진:장진혁 주소: 서울 서대문구 충정로2길 8 지하철 5호선 9번 출구에서 도보로 딱 3분이면 도착할 수 있어 접근성도 뛰어나다.",2021. 5. 19.
서울에서 만난 책1_’충실한 마음’ (feat.서울의 시간을 그리다),"2021.02.13 서울 여행의 첫 경유지, 서울의 시간을 그리다 서울특별시 서대문구 독립문로 31-6 새벽에 버스로 출발해서 곧장 향했다! 날씨가 좋았다. 책이 많은 편은 아니고 베스트셀러 도서보다는 책방지기의 취향 가득 담긴 책들, 기회가 되면 또 가고 싶다. 충실한 마음 _델핀 드 비강 제목을 보고 몇...",2021. 7. 17.
"신촌 데이트 하기 좋은 칵테일, 와인바 - 에어플레인모드","일단 에어플레인모드 정보 서울 서대문구 창천동 13-36 2층 서대문구 연세로 4길 36 2층 *** **** **** 영업시간은 평일 낮 12시오픈- 새벽2시, 주말은... 진짜 여행온 기분 나는 곳입니다. 어느날 에어플레인모드 갔을때 외국인들이 너무많아서 순간 제가 외국에 왔나 착각이 들정도 ㅋㅋㅋㅋㅋ 외국인들...",2020. 8. 22.
걷고 또 걷기,"도보여행을 떠나기 한 달 정도 전부터 미리 체력을 키운다. 6. 수분을 충분히 섭취한다. 7. 걷기에 있어 중요한 것은 신발이다. 쿠션과... 296m 서울 서대문구 구룡산 308m 서울 서초구 서초동, 양재동 인왕산 340m 서울 서대문구 삼성산 481m 서울 관악구, 금천구, 경기 안양 불암산 508m 서울...",2021. 10. 1.
밤의 진공 / 이재헌 / 2018.4.7 - 4.28,"28 Placemak 2 서울 서대문구 홍제천로4길 39-26 open : 12 pm - 7 pm (Wed - Sun) 꽃밭 속의 형상 figure in the garden_캔버스에 유채_190×150cm_2015 연희동... 작가가 말하는 '밤의 진공으로 향한 반복된 여행'은 암흑과 같은 세계를 더 자세히 보려 함이요, 밤의 진공 속에서 오늘날 우리가 가진 고독, 허무...",2021. 4. 25.
"부동산경제뉴스-사라지는서울6억이하아파트,K푸드K편의점,현대기아차출고대란...","비정상적으로 서울 비롯 수도권 집값이 너무 오르고 있어요. 자산 1억이 되지 않아도 살 수 있는 집들이 많았었는데 이젠 몇억이 있어도 살 집... 다시 여행주, 항공주를 주목해야할 타이밍인 것 같습니다. 서대문구 북가좌동 DMC한양아파트가 재건축 1차 정밀안전진단을 통과했다는 소식입니다....",2021. 10. 6.
하와이 여행 총정리-하와이 항공편/자가격리 면제/하와이 현재 상황,"하와이행 비행기에 안전하게 탑승, 도착 후 입국 심사를 거쳐 바로 호텔로 이동 및 여행 시작!! **하와이 주정부 기관 지정 국내 코로나19 검사 기관 리스트** - 연세세브란스병원 (신촌): 서울특별시 서대문구 연세로 50-1 - 강북삼성병원: 서울특별시 종로구 새문안로 29 - 인하대학병원 본원...",2021. 6. 18.
[남가좌동] 속이 편안한 웰메이드 중식집 - 락희안,크으 중국 여행에 대한 그리움은 이날 락희안에서 모두 해소했다는 사실 춘광육슬 원래 경장육슬을 모티브로하여 봄에 맞는 재료들을 곁들여... 영업시간 : 매일 11시 반 - 21시 반 브레이크타임 : 평일 15시 - 17시 휴무일 : 매주 월요일 주소 : 서울 서대문구 가재울로4길 53 문의전화 : 02-375-7576,2021. 5. 24.
서울의 하늘,소설가님의 여행의 이유 경주에서 김영하 소설가님을 뵈어서 사진도 찍었는데 소설가님 이렇게 보답드립니다ㅎㅎ 꼭 읽겠다는 엄마의 약속을 받고 책을 샀으니 기분이 좋다 늘 바쁘다 서울은 시간에 쫓길 필요가 없는 엄마와 나는 이 시간이 즐겁지 아 공부 열심히 할껄 하다가도 숨이 턱턱 막히지...,2020. 8. 3.
"[코로나19 발생현황] 신규확진자 343명_지역 293명,해외 50명","지인 간 여행, 친목모임 등을 중심으로 한 새로운 집단발병도 확인됐다. 송파구의 한 지인 여행모임과 관련해 지난 13일 첫 환자가 나온 뒤... 서울 서대문구의 한 요양원과 관련해서도 지난 15일 첫 확진자가 발생한 이후 종사자와 이용자, 지인 등 총 10명이 양성 판정을 받고 치료 중이다....",2020. 11. 19.
