header,contents,date
[연남동 와인바 추천] 책과 함께하는 사색의 공간! 연남동 와인바 <백색소음>,"주소: 서울 서대문구 연희로 38-12 “백색소음은 여러 책들이 있는 와인바지만, 손님들께 딱히 ‘정숙함’을 부탁드리지 않습니다. 술과 음식의... 이날 여행이 고팠던 저희라 주로 여행 얘기를 주구장창 하다 온 것 같네요 ㅎㅎ 이곳저곳에 자연스럽게 자리하고 있는 책과 소품들이 인상적인...",2020. 8. 18.
서대문 호텔 더 그레이 연남동 접근성 좋아서 편하게 이용,2021.10.07 더 그레이 호텔 서울특별시 서대문구 수색로 34-6 / 서울특별시 서대문구 남가좌동 290-140 0507-1379-5202 Check-in: 16:00(평일) 21:00(주말) Check -out... #서대문호텔 #서대문호텔더그레이 #연남동호텔 #홍대호텔 #서대문모텔 #연남동모텔 #더그레이호텔 #홍대모텔 #서울여행 #연남동숙박 #홍대숙박...,2021. 10. 10.
[라이프스탁] 국내주식시장에 미치는 영향들에 대해서,"尹 측 ""신상 몰랐다"" 윤석열 전 검찰총장의 부친이 거주했던 서울 서대문구 연희동 자택을 성남시 대장동 개발 과정에서 수천억 원의 배당금을... (패션/의류) #패션플랫폼 #국동 #한세실업 ✅ 여행 · 투어 관련주 #모두투어 #하나투어 #노랑풍선 ✅ 면세점 관련주 #호텔신라 #신세계 #현대백화점...",2021. 9. 29.
서대문역 맛집 추천 다이닝 후 (DINING HU),서울 서대문구 충정로 43-1 평일 11:00 - 14:00 ( 라스트 오더 13:30) 평일 17:00 - 22:00 (라스트 오더 요리 21:00 음주&사이드 디시 21:30) 토요일 13:00 - 22:00... 코로나로 인해 여행을 못 간지 1년이 되어가는데 마카오를 갈 때마다 찾은 현지 식당 아 로차(A Lorcha)가 갑자기 그리워지더라고요. 조개와 새우랑...,2021. 3. 15.
사자명예훼손재판/버진갤럭틱우주여행티켓판매/MBK파트너스김병주/우버리프트...,(58)이 서울 서대문구 북가좌동에 들어설 서울시립도서관 건립을 위해 300억원의 사재를 쾌척했다. 개인 기부금만으로 서울시립도서관이... 여행·쇼핑에 지갑 여는 미국…우버·리프트 '즐거운 비명' 미국 내 승차공유 서비스인 우버·리프트의 평균 승차 요금이 최고치를 갈아치웠다. 또...,2021. 8. 9.
풍경#연세대학교#신촌캠퍼스#늦가을풍경#수경원#연희궁#광혜원#은방울꽃의여행이야기,♡연세대학교 신촌캠퍼스♡ 서울특별시 서대문구 연세로 50 (신촌동 134번지) #언더우드관(사적 제276호) #스팀스관(사적 제275호) #아펜젤러관(사적 제277호) 진리가 너희를 자유케 하리라 좀 여유롭게 갔어도 해넘이 진행되는 시간이었다. 교문에서부터 이어지는 일직선의 진입로이다. 좌우로 많은...,2020. 12. 15.
"서울시 고소장비 대여 렌탈, 강서구 구로구... 마포구 서대문구 양천구 용산구 은평구...",서울시 고소장비 렌탈 전동사다리 임대 대여 강서구 구로구 금천구 노원구 도봉구 동작구 마포구 서대문구 양천구 용산구 은평구 종로구... 수학여행레크레이션 sipkorea 솔라led 안산폐기물처리 조립식난방 풍무웅신미켈란의아침 경매중개 수원카고크레인 가스보일러물보충 금고보관...,2021. 5. 31.
서울 데이트코스 / 은평한옥마을 야경도 이쁘다,서울 데이트코스 은평한옥마을 야경도 이쁘다 한국의 100대 명산인 북한산을 병풍처럼 두르고 있는 한옥마을이 있답니다 서대문구에 있는... 은평한옥마을 서울이 아닌 다른 곳으로 여행온듯한 느낌이 드는 풍경을 가진 곳입니다 조용하고 한적하며 공기까지 좋은 곳으로 서울 데이트코스로...,2020. 12. 21.
치과/ 서대문구 치과/ 증산역 치과/ 철저한 소독 및 위생 관리하는 서울아이치과에서...,중국여행 자제하기 2. 손을 깨끗하게 씻기 3. 마스크 착용 생활화 등의 예방 수칙을 발표했습니다. 저희 서울아이치과에 방문해주시는 많은 환자분들께서도 사람들이 많이 다녀가는 저희 서울아이치과에 걱정과 불안을 가지고 내원하실 수도 있으실텐데요. 평소에 저희 서울아이치과에서...,2020. 1. 29.
서울 아이와 가볼만한 곳 - 어린이 박물관 & 과학관,박물관 서대문 자연사 박물관 전쟁기념관 (용산 어딘가) 국립중앙박물관 (이촌역) 독도체험관 (서대문구) 생각하는 박물관 서울역사박물관 (시청역 근처) < > < > 국립한글박물관 (이촌역) 경찰박물관 - 어린이 경찰학교 (서대문) 세종충무공이야기 (광화문) 쌀박물관 농업박물관...,2020. 1. 12.
홍대수제빼빼로 MYSD(미쓰디빈티지케이크)에서 빼빼로데이 기념,"인스타그램에서도 유명한 MYSD(미쓰디빈티지케이크)에요:) MYSD(미쓰디빈티지케이크) 서울 서대문구 연희로2길 14 1층 MYSD(미쓰디빈티지케이크)... 만들기 어려울 때, 홍대수제빼빼로 MYSD(미쓰디빈티지케이크)에서 빼빼로를 구경해보세요:) #샐리의여행일기 #홍대수제빼빼로 #MYSD(미쓰디빈티지케이크)",2020. 11. 4.
신촌 세브란스병원 식당 제주도로담 이대 삼겹살 맛집,"*1 [ 신촌 세브란스 병원 식당 : 제주도로담 ] 주소 서울 서대문구 연세로2마길 14 (지번) 서울 서대문구 대현동 104-18 연락처 02-312-9334 영업시간 매일... 좋아서 여행을 가고 싶은 데, 코로나로 인해 가기 어려운 날들이네요 이럴 시기엔 공항으로 가는 대신, 맛으로 떠나는 여행을 즐겨보는 건...",2021. 10. 4.
단양 사인암 나들이,여행 혹은 나들이 하면 역시 맛집이 빠질 수 없지요. 저희 커플은 전골처럼 끓이면서 먹는 순두부를 아주 좋아합니다. 마침 단양 IC와 사인암 근처에... 나들이로 온 거라 서울로 돌아갑니다. 서울 서대문구까지 4시간 반이 넘게 걸리더군요. 교통 체증에 시달리긴 했지만 정말 기분 좋은 나들이였습니다.,2021. 10. 8.
클룩 서울 봄꽃 오픈탑 버스 투어 남산 인왕산 벚꽃 구경,네이버 여행 인플루언서 고미리레 입니다. 올해 2021년 서울 벚꽃 3월 27일 공식 개화 발표를 하며 1922년 서울 벚꽃 관측을 시작한 이후 99년... 운행코스인 경복궁을 지나 사직공원 인왕산로로 이어집니다~ 서울 중심부에 위치한 약 338미터 높이의 산! 종로구와 서대문구에 걸쳐 있어...,2021. 4. 8.
"서울 카페, 인스타 감성적인 핫카페","여행 후 현지에서 먹은 음식에 대한 아이디어와 감성을 전달하는 개념은 베를린의 감성을 포함했습니다. 나무 가구와 호박 등 유럽의 작은... 위치 : 서울 서대문구 연희로 11 번가 51 번 영업 : 평일 12:0020:00, 주말 13:0018:00 (월, 화 휴무) 메뉴 : 아메리카노 (4,000원) 라떼 (500,000원) 바닐라...",2021. 7. 11.
[맛있는 녀석들] 출현한 맛집 총 정리! (2018'~2019'),"한우 오마카세 : 설로인, 서울 강남구 봉은사로 73길 19 13가지 한우 요리! 179회 [당일치기 여행 1탄] 편 (방영일 : 2018.7.27) 러시아... 28) 대림동삼거리먼지막순대국, 서울 영등포구 시흥대로 185길 11 CU 북아현뉴타운점, 서울 서대문구 북아현동 147-12 두툼, 서울 중구...",2020. 10. 14.
"서대문역네일, 네일와이에서 통젤로 여름느낌 뿜뿜♩","네일와이 #서대문역네일 #서대문역네일잘하는곳 서울 서대문구 충정로9길 4, 2층 02-312-6244 매일am11- pm9, 토am11- pm6, 일 휴무 글, 사진 ⓒ 맛, 그리고 여행 by 리즈 여행을 다녀오자마자 다녀왔던 서대문역네일, 네일와이인데요. 드릴케어와 프리미엄 통젤로 젤케어가 들어가는 젤네일맛집이랍니다....",2020. 6. 1.
신촌모텔 코자모텔 신촌역모텔 이대모텔,"*1 [ 신촌모텔 : 코자모텔 ] 주소 서울 서대문구 연세로4길 7 (지번) 서울 서대문구 창천동 18-72 연락처 0507-1419-2323 시설 커플PC, 신축... 사회적 거리두기로 인해 외식하기도 어렵고, 외출하는 거 자체가 예전보다 까다로워졌습니다 여행가기도 조심스러운 요즘, 호캉스를 즐기면서...",2021. 10. 6.
경복궁사진관 종로셀프촬영 가족사진촬영은 쏘나이스,아이에게 예쁜 추억을 담은 가족셀프촬영이 필요하시다면 쏘나이스 스튜디오 꼭 방문해 보세요 : ) ▼카톡으로 예약 및 상담 가능합니다. << >> 문의: ***-****-**** 카톡채널: 쏘나이스 검색 주소: 서울 서대문구 통일로 366 B1 쏘나이스 찾아오시는 길: 지하철 3호선 무악재역 1번출구 50m 앞,2020. 8. 30.
"[신촌맛집] 서울가볼만한곳, 신촌 현대백화점 리틀쿠바에서 주말 데이트","주소: 서울특별시 서대문구 창전동 30-1 현대유플렉스 11층 연락처: 0507-1319-3086 영업시간: 매일 10:30 - 22:00 라스트오더 21시30분 단체석, 주차, 발렛파킹, 포장, 예약, 무선 인터넷, 유아시설(놀이방), 남/녀 화장실 구분, 장애인 편의시설 네이버 플레이스 샤로수길 대표 맛집 <쥬벤쿠바>의...",2020. 5. 31.
서대문구 현저동cctv 씨씨티비 가격세심하게 처리,"서대문구 현저동cctv 씨씨티비 가격 그리스는 아테네의 은광 덕분에 페르시아가 에게해로 진출하는 것을 막을 수 있었으며, 로마의 알렉산더... 여행 다녀와서 칭구랑 쿨쿨자고월요일에 미리 오전반차를 내서 여유롭게 준비하고 나왔어옹!집에서 걸어갈수있어서 더현대서울 가기로했쥬(。≖ˇ∀ˇ...",2021. 8. 2.
Lomo Horizon 로모 호라이즌 - 신촌 유플렉스 맛집 <랑만>,"08 <신촌 현대백화점 유플렉스 푸드앨리>, 서울 서대문구 Lomo Horizon Perfekt 로모 호라이즌 퍼펙트 Kodak Gold 200 < > < > 유플렉스 12층에 있는... 베트남 여행 갔을 때 반쎄오를 못 먹어봐서 늘 궁금했는데 검색하다보니 요기에 반쎄오로 유명한 집이 있다길래 일부러 찾아와 본...",2020. 5. 31.
[신혼일상] 남편이랑 호캉스! 가성비 갑! 수영장 있는 10만원대 스위스그랜드호텔 후기!...,"저는 보통 가성비 좋은 숙소들을 주로 찾아보고~ 급 여행을 떠나는 편이에요~ 서울 서대문구 가성비 호텔! 내돈내후기 10만원 초반! 수영장 있는 호텔! 스위스 그랜드 호텔 구. 그랜드 힐튼 서울 찾다 보니, 그랜드 스위스 호텔? 구. 그랜드 힐튼 호텔 3년 전, 결혼박람회에 참석했던 구. 그랜드 힐튼...",2020. 8. 7.
3월 서울 전시회 추천 SKY COLLAGE(아티스트 넌지) 전시 후기,""" - 아티스트 넌지님 - | 장소 | 카페드아미디 (서울 서대문구 신촌로 29길 26) | 기간 | 2월 21일(일) ~ 3월 6일(토) | 시간 | 월 : 12~18시 화~토 : 12... 삶과 죽음의 경계를 여행하는 영혼들의 이야기를 다양한 장소와 구도로 담아내고 있지요. 이는 제 주변 환경뿐 아니라 온 세계를 감싸는...",2021. 3. 2.
"♡) 신촌 양꼬치 맛집, 신촌양꼬치에서 저녁식사♩","신촌 양꼬치 맛집, 신촌양꼬치 이쁘니랑 저녁 주소 서울 서대문구 연세로9길 22 전화번호 02-322-8199 오후 세시 오픈 오전 두시 클로즈:) 둘째주 넷째주 일요일 휴무이므로 참고 해주세요 조명색이 독특해서 그런가 사진 찍으면 꼭 여행 온것처럼 나오더라구:) 신기했당 양꼬치의 특징 넓은 테이블...",2020. 4. 15.
"신촌/이대 카페 ) 부산 커피 위크, 서울에서 커피로 만나는 부산 _R x BICF",부산 여행을 가도 뚜벅이라 가기 어려워서 못가본 곳들도 이렇게 만나볼 수 있어 너무 좋더라구요! 한 자리에서 다양한 카페들을 만나볼 수 있으니 방문하셔서 나만의 취향을 찾는 것도 좋을 것 같아요~ 2021년 5월 31일 ~ 6월 27일 12:00-20:00 서울 서대문구 대현동 90-24...,2021. 6. 14.
연희동 콘하스 / 주택개조카페 / 서울 핫한 카페 / 서울카페투어 /아인슈페너맛집...,"한복판에서 여행을 온 듯한 시원한 풍경을 느낄 수 있어서 아주 좋았습니다ㅋㅋㅋㅋㅋㅋ 아....날씨... 증말!!!!!!!! 날씨만 좋았다면ㅠ_ㅠ... 그래서 더 가보고 싶은 마음^^) 콘하스 서울 서대문구 연희로27길 99 02-325-0792 매일 10:00 - 23:00 일요일 10:00 - 22:00 주차가능하지만 협소, 단체석있음 네이버...",2021. 6. 7.
간다 여수장거리택시 삼성서울병원 암병원 택시왕복,"여수서울서대문구택시,여수서울마포구택시,여수서울양천구택시,여수서울강서구택시,여수서울구로구택시,여수서울금천구택시... 장거리출장 및 여행 왕복 서비스 9.긴급서류 및 소형 화물 퀵배송 서비스 10.택시미행 서비스 11.수행비서처럼 애용하는 24시간-48시간 대절서비스...",2021. 5. 28.
"서울 5성급 호텔 목록, 서울 호캉스 추천","여름 본식을 앞두고 신혼여행을 준비하고 있다. 결혼식 당일, 첫날 묵을 숙소로 호텔을 알아보는 중 정리한 내용 :) 서울에 여러 5성급 호텔이... 호텔 서울 서대문구 연희로 353 쉐라톤 서울 디큐브시티 호텔 서울 구로구 경인로 662 디큐브시티 노보텔 앰배서더 서울 용산 서울 용산구...",2021. 4. 29.
서대문구운전연수 안전을 위해 도로연수 시작,서울 그 어디라도 제가 원하는 코스대로 스케쥴을 조정해서 강사님이 오신다고 하니까 너무 좋았죠. 저는 집으로 와 달라고 말씀을 드렸었는데... 서대문구운전연수 도로연수를 받는다고 했을 때 저희 엄마가 굉장히 놀라셨었어요 혹시라도 사고가 나면 어쩌냐고 그러셨었거든요. 저도 은근히...,2021. 2. 3.
200507_신촌 맛집 홋카이도 부타동 스미레 北海道豚丼すみれ (내돈내산 후기),"뭔가 내 블로그 프롤로그를 보고 갑자기 맛집블로거가 된 것 같은 느낌에 씁쓸함이 느껴진당...ㅜ 다시 조회수가 잘 나오는 여행기를 올리는... 신촌 맛집_홋카이도부타동스미레 北海道豚丼すみれ 서울 서대문구 연세로4길 61 LUNCH 11:30 ~ 15:00 / DINNER 17:00 ~ 20:30 * 일요일, 월요일 휴무 후기에 웨이팅이...",2020. 5. 18.
"신촌 분짜 잘하는 랑만, 베트남음식 맛집이네","신촌 랑만 주소: 서울 서대문구 연세로 13 유플렉스 11층 전화번호: 02-3145-3081 사실 유플렉스는 신촌을 지나가다가 많이 보긴 했지만 엘리베이터... 얼른 여행 떠나고 싶다는 생각이ㅠㅠ 메뉴는 누들, 분짜, 라이스 등 다양한데 우리는 베트남음식의 대표라고 할 수 있는 분짜와 BBQ Pork&라이스를...",2020. 9. 15.
서울 성곽길 산책 길상사에서 북정마을 심우장까지,요즘은 시간만 나면 한강라이딩이나 서울근교로 걷기여행을 떠나고 있다. 서울에서도 가장 좋아하는 코스는 성북동 길상사에서 성곽길을 따라... 차를 공용주차장에 세워놓고 서울 성곽길을 걷는다. 여기서부터 시작하는 성곽길은 동대문구 / 성북구 / 서대문구 / 종로구에 걸쳐서 이어져 있다....,2020. 10. 10.
"신촌 정육면체, 2020 미쉐린가이드 우육면 맛집","서울 서대문구 연세로5다길 22-8 (지번 : 창천동 62-18 1층) - OPEN 11:00 - 21:00 *Last Order 20:30 TEL 070-4179-3819 얼른 포스팅해야지 해야지 해놓고서 이제서야 올리는 신촌 정육면체 :-) 4월 중순쯤 다녀왔었는데 허헣 그래서 보면 사진이 아직 쌀쌀한 너낌! 무튼, 이날 유플렉스 갈 일이 있어서 근처에 맛집...",2020. 7. 18.
서울 출사지 / 홍제동 개미마을 ( 7번방의선물 촬영지),큰 거북이 뒤에 따라가고 있는 아기거북이만 제대로 찍어봤네요 #서울출사지 #서울벽화마을 #홍제동개미마을 #서대문구가볼만한곳 #서대문구볼거리 #홍제역가볼만한곳 마을안 슈퍼에는 따뜻한 커피 맛있는 라면 끓여드립니다라고 써있어요 진짜로 해주는건지 궁금하긴 하지만 요즘엔 실내로...,2020. 12. 19.
서울 인왕산 등산(범바위~정상)/서울성곽여행,인왕산은 서울 종로구와 서대문구 사이에 걸쳐있는 산으로 높이는 340미터이며 남산보다 조금 높은 산입니다 하지만 돌로 이루어진 산이다보니 올라갈수록 등산난이도가 올라갑니다. 토요일에 비가 한번 내린뒤 미세먼지없이 날씨가 맑아 종로구에 있는 인왕산에 등산해보기로 했습니다. 3호선...,2020. 3. 23.
자가격리 없는 하와이 여행,#하와이#자가격리면제#허니문#신혼여행#커플여행#오하우섬#알로하 하와이 입국시 의무 격리 기간 면제 방법 알려드릴게요. 현재 '방문객 사전... *국내 지정병원 연세세브란스병원 (신촌) (서울특별시 서대문구 연세로 50-1) 강북삼성병원 (가정의학과) (서울특별시 종로구 새문안로 29)...,2021. 9. 2.
VR로 실감나게! 서울에서 독도를 만나요,"특히 여행 가기 힘든 요즘, 과거 여행 사진과 랜선 여행 콘텐츠를 보는 습관이 생겼다. 독도체험관 홈페이지 메인화면 ⓒ독도체험관 여담이지만... ■ 독도체험관 ○ 소개 : 독도의 역사, 자연환경, 정보 등을 보존하여 올바른 정보를 알리는 박물관 ○ 위치 : 서울시 서대문구 미근동 통일로 81...",2020. 12. 9.
서울사랑상품권 구매 가능한 날짜! 각 자치구별 발행일시,"2) 7월 서울사랑상품권 발행 날짜 서울 7월의 서울사랑상품권 발행날짜는 7월 12일부터 7월 14일까지 발행됩니다. 7월 12일 10:00 용산구, 동대문구, 노원구, 서대문구, 강서구 12:00 광진구, 도봉구, 구로구, 동작구, 관악구 13:00 성동구, 마포구 14:00 종로구, 강북구, 강남구 7월13일 10:00 영등포구 7월14일...",2021. 7. 6.
명지대 카페 1Q84 CHURROS / JMT 츄러스,주소 서울 서대문구 가좌로 97 (홍은동 402-1 1층) 영업시간 매일 10:00 - 22:00 금요일 휴무 츄러스는 이렇게 굳이 카페 안을 들어가지 않고도 입구... 코로나로 해외는 꿈도 못꾸는 시국이라 왼쪽 코너에 진열된 인테리어 소품들중 가장 눈에 띄던 아시아나 비행기를 보며 여행하는 상상에도 잠깐...,2020. 10. 7.
서대문구와 은평구 경계의 백련산 초록숲길 방문결과 (은평둘레길 5코스 일부 겹침),"오케이의 기분좋은 여행입니다. 오늘은 집에서 가까운 곳에 있는 서대문구 백련산 초록숲길을 방문한 결과를 기술해 보았습니다. ■ 백련산과... 은평정 ~ 백련공원 가는 길 * 은평정에는 2층으로 된 정자와 함께 서울 북쪽 지역의 멋진 풍광을 볼수 있는 조망이 매우 우수한 장소 였으며, 주변에는...",2021. 2. 24.
성산동변기 서교동변기 엄청 막힘 구해줘!(망원동 서대문구 서대문),망원동변기막힘 서대문구변기막힘 서대문변기막힘 안녕하세요 :> 오늘은 유익한정보와 제가 이번에 강원도 여행갔다온 썰을 들려주려해요.다들... 요즘 친구들은 돈벌어서 서울에서 살고싶다는데 저는 돈 많이벌면 한적한 시골마을에서 살고싶어요. 하지만 저의 엄청난 식탐덕분에...,2021. 1. 7.
서대문형무소 다녀오다 투어라이브 오디오투어,<위치> 도로명 주소 서울 서대문구 통일로 251 서대문형무소역사관 지번 주소 서울 서대문구 현저동 101 서대문형무소역사관 나와 친구는 전철역... https://apps.apple.com/KR/app/id1473242927?mt=8 https://sphh.sscmc.or.kr/ #국내여행 #서울여행 #여행 #대한민국구석구석 #투어라이브 #서대문형무소...,2021. 2. 3.
"[TV속 정보] 4월 16일 (금) 2TV생생정보, MBC생방송오늘저녁, SBS생방송투데이 나온...",3GO - 남도 3GO 여행> ▶ 이화식당 ☎061-544-5688 전남 진도군 진도읍 남동1길 55 ▶ 맛나식당 ☎061-544-6171 주소 : 전남 진도군 진도읍... 02-336-1577 서울 서대문구 연세로5나길 20 < 인생 분식 - 따스한 행복을 채워주는 추억의 즉석 떡볶이> ▶ 신사리즉석떡볶이 ☎ ***-****-****...,2021. 4. 16.
보울룸 신촌점 | 서울 속 하와이 느끼기,보울룸 신촌점 서울 서대문구 연세로 13 현대백화점 유플렉스 11층 http://naver.me/5640QsLP 메뉴는 못찍었으니 여기서 확인 바란다. 신촌 유플렉스 11층에... 창가 자리에 앉아서 해가 지는 모습을 보며 밥을 먹으니 하와이까지는 아니지만 어디 여행이라도 온 기분이었다.. 물론 내가 그날 오전에 근무하고...,2020. 7. 31.
"[이지트립 휠체어 여행] 서대문/충정로 깔끔하고 든든한 퓨전일식 맛집, 미동식당","미동식당의 저녁식사도 궁금해지는 이지트립은 저녁에 다시 방문해 보려 합니다 :) 휠체어 여행자분들도 서대문/충정로 근처의 맛집을 찾으신다면 <미동식당> 방문해 보세요~ *** 미동식당 *** 서울 서대문구 충정로 6길 59 02-313-0958 ""이 정보는 사회적기업 모아스토리 <이지트립>이 조사하고 공유합니다""",2020. 1. 12.
원덬이가 여행 마려워서 쓰는 우리나라 관광명소들(스압주의),원덬이가 여행 마려워서 쓰는 우리나라 관광명소들(스압주의) theqoo.net <수도권> 창덕궁-서울 종로구 율곡로 99 창경궁-서울 종로구 창경궁로... 서대문형무소역사관-서울 서대문구 통일로 251 서대문형무소역사관 이화마을-서울 종로구 이화장길 70-11 올림픽공원-서울 송파구 올림픽로 424...,2021. 8. 7.
여행계획 올해의 바캉스!!!,일단 3가지로 요약 음 호캉스와 카페투어 그리고 부산여행을 갈까 해요. 계획중.. 1. 호텔에서 푹자고 1일 1빙수~ 망고빙수 >_< http://www.... 124000원 부터~~ㅎㅎ (세금별도) http://www.swissgrand.co.kr/Sub_SpecialOffers.asp?tGo=7 위치 : 서울특별시 서대문구 연희로 353 가까워서 참 괜찮아!!! 2. 가까운...,2020. 7. 14.
"2021년 4월 16일 생방송 투데이 남도3GO여행, 첫 눈에 반하다! 개성 만점, 이색 반찬...","3GO - 남도 3GO 여행 이화식당 전남 진도군 진도읍 남동1길 55 061.544.5688 - 꽃게탕, 장어탕 맛나식당 전남 진도군 진도읍 남산로 124-1... 빅데이터 랭킹 맛집 - 수도권 최고의 육개장 TOP 5 조선의 육개장 칼국수 서울 서대문구 연세로5나길 20 (창천동 57-61) 02.336.1577 (2호선)...",2021. 4. 16.
남가좌동파스타는 207PASTA로,남가좌동파스타는 207PASTA로 먹방계의 행성 보라앙마 저번주엔 파주여행을 다녀왔다고 올렸었죠~ ▼ https://blog.naver.com/violetdevil3/221982932058... ▼ 주소: 서울 서대문구 증가로 207 1층 ( 북가좌동 290-15 ) 전화번호: 02-374-3739 영업시간: 매일 11:00-23:50 명절연휴 당일휴무 주차는 가게 뒷편에 주차장이...,2020. 6. 2.
콩글리쉬 Konglish / 김연진 / mixed media / 2020. 08. 01- 08. 22,22 Placemak 2 서울 서대문구 홍제천로4길 39-26 open : 12 pm - 7 pm (Wed - Sun) “콩글리쉬 (Konglish)”는 멀티디시플리너리... 서울의 도시환경에서 자란 작가는 미국의 많은 곳은 여행하면서 경험하게 된 자연이 주는 불편함과 생소함...,2021. 5. 1.
적극 추천하는 이대 맛집 유소바,유소바 서울 서대문구 이화여대2길 4 1층 070-8224-7956 매일 11:30 - 21:30 브레이크타임:15:00~17:00 모두의 주차장 Yes APM 주차장 이용 (심야 이용권 4천원)... 지난번 대만 여행 갔을 때 먹었던 닭날개 볶음밥은 비교도 안되게 고급진 요리 너낌이 낭낭해요. 튀김옷이 정말 얇아서 하나씩 나눠 먹었음에도...,2021. 9. 25.
서대문구 충정로 2가 서대문디오빌오피스텔 코맥스 비디오폰 CAV-43U,하루 빨리 사태가 완화되어 여행도 자유롭게 갈 수 있는 때가 왔으면 합니다ㅠㅠ 아이홈넷은 서대문구 충정로 2가 서대문디오빌오피스텔 에... 및 책임 A/S완료제를 시행하고 있습니다. 서울 인천 경기 전지역 모두 당일 설치 가능합니다. 이외의 지역은 문의해주시면 친절한 상담 도와드리겠습니다,2021. 1. 14.
"포방터 홍탁집, 서울 맛집 (어머니와아들)",그러다보니까 웬만한 맛은 식상해서 부푼 기대를 안고 먹은 경기도 음식은 입에 맞지 않았어요 룸메가 서울여행이나 가자고 해서 맛집을 찾던... 주소 : 서울 서대문구 포방터길 46 / 구주소 : 홍은동 9-160> 영업시간은 9:00 ~ 22:00 로 네이버에 표기돼있지만 거리두기 2.5단계 때문에 21:00 까지 겠쥬?...,2021. 2. 3.
안산자락길 가을 언택트여행 2020,돌고 돌아 고통의 업으로 환생하는 그리움아 네 한 다 하거든 맑은 사랑으로 피어나거라 #안산자락길 #언택트여행 #서울가볼만한곳 #서울둘레길 #서울걷기좋은길 #주말나들이 #가족나들이 #안산자락길북까페 #안산자락길숲속무대 #전기스설체어충전기 #서대문형무소역사관 #서대문구치소,2020. 10. 12.
