header,contents,date
서울 걷기여행 서대문구 안산자락길 걷다 홍제천 인공폭포까지,오늘은 좀 그런대로 시원한 것 같기도 하고 해서 서울 걷기여행 서대문구 안산 자락길 걷고 홍제천 인공폭포 까지 보고 왔답니다. 알고는 있었지만 봄에 한번 가야겠다 하면서도 못 가다가 오늘 드뎌 다녀왔지요. 안산 서대문구 안산을 걷다 왔지요. 아마도 오늘은 약 3시간 이상 걸은 것 같아요....,2020. 6. 17.
[서울 서대문구]스위스 그랜드 호텔 1박 여행 솔직후기 / 부모님과 내돈내산으로 다녀온...,진짜로 20000 #서울호텔 #서울호캉스 #서울근교호텔 #서울근교호캉스 #호캉스추천 #스위스그랜드호텔 #서대문구호텔 #서울5성급호텔 #그랜드힐튼 #홍제동호텔 #스위스그랜드호텔레지던스 #스위스그랜드호텔수영장 #서울뷰호텔 #서울수영장호텔 #호텔추천 #가족여행 #부모님여행 #1박여행 #호캉스...,2021. 6. 30.
서울 토박이도 신기한 ‘서대문구 랜선여행’,서대문구 사이버투어 ‘서대문 명소여행 360˚ VR’ >> 바로가기 ▶ ‘내 손안에 서울’ 앱으로 받아보기 ▶ ‘코로나19 서울생활정보’ 한눈에 보기 ▶ 내게 맞는 ‘코로나19 경제지원정책’ 찾아보기 출처 : 내 손안에 서울 시민기자 신예은,2020. 9. 28.
서울 등산 추천 서대문구 안산과 인왕산에서 바라본 서울 야경과 일출 feat. 왕초보 가능,오늘은 초보도 등산하기 쉬운 서울의 산 중에 오늘 서울 서대문구 안산에서 촬영한 서울 야경과 일출 그리고 예전에 눈 내린 날 인왕산에서... DHK.Photogallery Photogroup Soon-Gan 여행하며 사진 찍고 글 쓰는 여행 사진작가 김대형 창작자에게 힘을 주세요! 인플루언서 팬 하기! 아래 네임텍을...,2021. 9. 25.
서울시문화재 서울시서대문구여행 서울가볼만한곳 사적 제 324호 서대문형무소역사관,서울시문화재 서울시 서대문구여행 서울가볼만한곳 사적 제 324호 서대문형무소역사관 서울시 서대문구의 현저동에 자리하고 있는 서대문형무소역사관은 조국의 독립투쟁과 민주의 현장입니다 사적 제 324호에 지정되어 있는 국가지정 문화재입니다 서대문형무소역사관 지난시기 우리민족사에...,2021. 3. 13.
[국내여행 서울 당일치기] 서대문구 안산자락길 명상산책 코스,"명상여행 가이드 도나입니다 (-: 오늘 소개해 드릴 명상여행지는 가벼운 마음으로 다녀오실 수 있는 #서울근교여행지 서대문구 #안산자락길 입니다. 이미지 출처: 서대문구청 홈페이지 #서대문구안산 은 높이 296미터의 나즈막한 산이며, 총 길이 7km의 순환형 데크길이 놓여 있어 몸이 약간...",2020. 9. 1.
"여행] 여름철 무더위는 시원한 폭포와 숲속 허브가 있는 곳에서!!(21.6, 서울 서대문구...","서울 한복판 폭포도 즐기시길 추천합니다. #아이들체험, #코로나아이볼거리, #코로나아이놀거리, #서울볼거리, #서울가볼만한곳, #서울서대문구가볼만한곳, #서대문구볼거리, #주말나들이, #아빠어디가, #홍제인공폭포, #안산, #서울데이트, #서울여행, #서울가볼만한공원, #서울안산",2021. 6. 16.
서대문 신라스테이 / 서대문구 호텔 / 서대문구 호텔 / 신라스테이 서울 / 서울 여행,"이번 여름, 잠시 아니다 조금 길게 머물렀던 서울,오랜만에 서울 여행이었다. 사실 일반적인 여름이었다면, 여름 서울 여행은 숙박비가 저렴한 곳을 묵거나 저렴했을 건데...상황이 상황인지라 사람들은 생각보다 해외로 못 나가고 여행을 가지 않았고, 안전을 위해서 적당한 가격 대의 숙소를...",2021. 9. 30.
서울여행 / 서대문구 홍제동 예술공간 '홍제유연',^^ 서울에 무료로 이런 작품을 즐길 수 있다는 점이 다른 단점들을 커버한다고 생각해요. 홍제천의 물 흐르는 소리도 간만에 들으니.. 힐링되는 것 같구요~ 다만 주변지역이 오래된 상권이라.. 주변에 즐길만한 꺼리들을 별로 찾지 못했어요. 그 부분이 아쉽기는 해요. 안의 공간을 구경하는데 약...,2020. 10. 10.
[스누피의 한국여행 85.24] 서울 서대문구 홍제동 개미마을 방문기,"지금은 서울시에서 50~60년대 마을모습 보존을 위한 미래유산으로 지정하였다고 한다. 영화 7번방의 선물에서도 배경으로 나왔다고 한다. ⚽ 홍제동의 지명유래 ♥ 홍제동은 홍제원이라고 하여 조선시대에 역원중의 하나로 공무여행자들의 숙소였는데 동대문밖 보제원, 광희문밖 전관원, 이태원...",2020. 9. 19.
공모전〕 초록 희망으로 피어나는 홍제동 개미마을-경상도 토박이의 서대문구 여행,"교통의 발달로 전국이 일일생활권안에 들어있다지만, 경상도 사람이 일일여행으로 서울을 향한다는 것은 쉽지 않죠. 게다가 경복궁, 덕수궁 등 많은 사람이 쉽게 찾는 관광지도 아니고 서대문구의 한 마을을 찾아 떠나다니.. 그러나, 저는 경남 김해에서 서대문구 「개미마을」로 향하는 행복한...",2021. 4. 27.
[서울여행-9][서대문구카페][연희동카페] SWAY COFFEE STATION. 스웨이 커피...,날 좋을 때 초록 커피 정거장 스웨이 커피 스테이션 다시 방문하고 싶네요 :) - SWAY COFFEE STATION - 스웨이 커피 스테이션 - 서울 서대문구 연희로11길 61 (연희동 126-1) - 02-6348-0061 - AM 11:00 - PM 09:00 (연중무휴) - 가게 옆 주차 가능,2020. 2. 27.
"서대문구, ‘서대문 명소여행 360VR’ 운영",360도 VR영상으로 초고화소 제공…스마트폰·PC로 관람 ‘서대문 명소여행 360VR 서비스’로 본 서대문자연사박물관 [서대문구 제공] 서울 서대문구(구청장 문석진)는 스마트폰이나 PC로 간편하게 지역내 명소들을 관람할 수 있는 ‘360VR 콘텐츠’를 확대 구축하고 8일 서비스를 시작했다. 이용...,2021. 10. 8.
"[연희동 맛집] 서울 서대문구 연희동 한정식 잘하는 곳 ""고미정""","서대문구 연희동 한식 맛집 고미정 여러분 안녕하세요, 매일매일 맛집을 여행하는 먹깨비 아리 예요. 저는 양식을 좋아해서 외출을 하면 주로... #서울한식 #서울한정식 #서울저렴한한정식 #서울상견례 #서대문구맛집 #서대문구한식 #서대문구한정식 #연희동맛집 #연희동한식 #연희동밥집...",2020. 10. 29.
"서울 :: 서대문구 손세차 ""그린손세차장"" 빠르고 꼼꼼한 남가좌동 세차장 팰리세이드...","서대문구 빠르고 꼼꼼한 ""그린손세차장"" 안녕하세요 홍양입니다:) 해피 추석이네요~! 여행 전이나 오랜만에 시골길에 오를 땐 다들 세차 하고... ***-****-**** 서울 서대문구에 위치한 그린손세차장은 아침 8시부터 운영하기 때문에 아침일찍 후딱 세차하고 어디 출발하기 참 좋았어요 미리 예약을...",2021. 9. 21.
서울 서대문구 가볼만한 곳 : 홍제유연 추천해요,"https://youtu.be/0opksGpG8Yg <모든 사진의 저작권은 한국관광공사에 있으며 위 포스팅은 한국관광공사로부터 소정의 원고료를 받아 작성된 글입니다. > #한국관광공사, #숨은관광지, #스페셜플레이스, #여행, #가을여행, #겨울여행 #서울여행, #서울데이트, #홍제유연, #서대문구가볼만한곳, #홍제천",2020. 12. 4.
서울 서대문구 깔끔한 호텔 신라스테이 서대문,서대문구 깔끔하고 가성비 좋은 호텔 신라스테이 서대문 결혼하면 막 갑자기 여행떠나고 숙소도 급하게 잡아서 낭만있는 여행을 할 줄 알았지만... 집에서 여행은 계획있게 진행하고 있는 2년차 부부의 삶 ㅋㅋ 주문받은 상품 배송을 핑계로 대전 시골쥐들 서울 상경을 계획. 버는것보다 쓰는게 더...,2020. 4. 16.
콘서트~~/자연인 음식7/경주/서울커피점4/교육방송 KBS오스트리아 서대문구,"12코스-여행사 메일 받음 https://www.youtube.com/watch?v=ZIX1GAaeYFI&t ----------------------------------------- 부부 남미여행 100일... smenu=9725de&bbs_loc=T2005-0731-04-492860,read,,340,996832 19:10김영철의 동네 한 바퀴--서울 서대문구- 99회 http://program.kbs.co.kr...",2020. 12. 4.
서울시문화재 서울시걷기여행 서울시서대문구여행 서대문독립공원 사적 제32호인...,서울시문화재 서울시걷기여행 서울시서대문구여행 서대문독립공원 사적 제32호인 독립문 사적 제33호 영은문주초 독립문영천시장 오늘의 서울시 서대문구 걷기여행은 서대문독립공원안에 자리한 사적 제32호로 지정된 독립문과 사적 제33호인 영은문주초를 함께 살펴보고 서울의 서대문구...,2021. 3. 17.
서대문형무소 / 서울 여행 / 서울 8월 가볼만한곳 / 서대문구 가볼만한곳,"서울 여행 중, 사실 10여년 전에 들렸던 서대문으로 향하고 있다.서대문형무소로 불렸지만 명칭은 서대문형무소역사관으로 가고 있다. 독립문... 완성되면 가볼 요량이다. 서대문형무소역사관 서울특별시 서대문구 통일로 251 서울특별시 서대문구 현저동 101 Tel. (02) 360-8590",2021. 8. 14.
[서울 서대문구] 안산 둘레길 걷기_210519(목),[서울 서대문구] 안산 둘레길 걷기_210519(목) 늦은포스팅입니다. 81년 ~ 88년생들이 모여서 정기적으로 사찰 순례를 하고 있습니다. 소모임명은 산사... 사찰 여행일정은 홍제천 -> 안산둘레길 -> 로하스 입니다. 홍제천 인공폭포에서 출발하여 안산 둘레길을 걸어 연희동 로하스에서 차한잔 하고 모임...,2021. 6. 24.
서울 서대문구 숲속한방랜드 입장권,"한국 전통 찜질 SPA인 불가마에서 피부 속 노폐물을 모두 내보내세요! 3. 찜질방, 오락실, 사격장, 헬스장, 노래방까지 다양한 부대시설이 구비되어있습니다. * 예약하기 https://herewego.link/shop/item.php?it_id=PM_47347 #뜨거운청춘 #여행의희열 #히어위고 #서울 #서대문구 #숲속한방랜드",2021. 5. 1.
〔서울 서대문구〕 서대문구 안산 자락길,서울 서대문구에 위치한 안산. 말의 안장을 닮았다고 하여 안산이라 불린다고. 높이는 296m로 비교적 낮고 넓은 산지형 공원. '안산 순환형 무장애... 사진을 동생에게 보내니 해외 여행 간 것 같다고~ 신경을 많이 쓴 흔적이 곳곳에 방향 표지판도 잘 되어 있다. 정자가 나와 잠시 쉬어가기로...,2021. 4. 20.
"서울 서대문구 영어회화[천연동, 홍제동, 홍은동, 남좌동]원어민과 1:1 맞춤수업","보내세요~ 서울 서대문구 영어회화[천연동, 홍제동, 홍은동, 남좌동] 우리가 어릴 때 부터 필수 과목으로 배우고 있는 '영어' 여러분은 어떻게... 생활, 여행, 취업 면접, 시사토론, 비지니스회화, 프리토킹 등 다양한 커리큘럼 또한 구성되어있으며 수업의 전반적인 부분을 케어하고 코칭해주는...",2021. 8. 22.
서울 서대문구 빌라 하부레일원슬라이딩 화이트 슬라이딩 현관중문,"차가 막혀 아직 도착하지않은분들도 계실테고, 연휴를 활용해 여행중이신분들도 많이 계시겠죠!? 무쪼록 사고없이 안전하고 즐거운 귀성길되시길 바래봅니다 ♡ 오늘 보여드릴 글은 서울 서대문구 빌라 하부레일원슬라이딩 화이트 슬라이딩 현관중문 이예요 :) 너무 깔끔하고 예쁜 화이트...",2020. 1. 24.
서울 나들이) 서대문구 아이랑 나들이 가볼 만한 곳 '독립공원',여행 서울 나들이) 서대문구 아이랑 나들이 가볼 만한 곳 '독립공원'서울 나들이) 서대문구 아이랑 나들이 가곳 '원' 나라사랑. 민족의 얼을 느낄 수 있는곳 '서대문 독립공원' 에 대하여 포스팅 합니다. 독립문역에 내려서 4번출구(2021년 6월 현재 엘레베이터 공사중입니다)로 나오면 바로...,2021. 9. 27.
서울 서대문구 가까운 용한 점집 > 신림해월당 추천,하거나 여행을 가거나 홀로 시간을 많이 보내는 편인데요. 이번에는 여러가지가지로 고민이 많이 돼서 누군가의 조언이 좀 필요한 상황이였거든요. 그러던 끝에 난생 처음 점집이라는 곳에 가보기로 했어요. 서울 용한 점집을 찾던 중 서대문구와 가까운 신림해월당이 눈에 들어왔어요. 사실...,2021. 3. 12.
"서울 등산 코스 추천, 도심속 힐링 산행 - 서대문구 안산 봉수대","1/1일, 새해 첫날 의미있는 걸 하고 싶어서 아침에 떡국을 먹고 서울 서대문구에 위치해 있다는 도심 속 산, 안산 을 올라가보기로 했다. 원래 아침... 그야말로 서울이 한눈에 다 보이는 것이다. 남편과 얘기하길, 신혼여행으로 해외여행을 가서 케이블카 타고 어디 전망대 올라가서 보는 느낌이라고...",2021. 1. 2.
[서울여행] 서대문구 홍제역 유진상가 사진 찍기 좋은 곳 - 홍제천길 홍제유연,서울 서대문구 홍제역 유진상가 근처에 사진 찍기 좋다는 '홍제유연'이라는 곳이 있다길래 찾아가봅니다. 네이버 지도에서 '홍제유연'의 검색결과가 없어서 유진상가에 앞에 주차를 하고 한참 헤맸던 기억이 납니다. '홍제유연'으로 들어가는 길은 아래 지도에서 화살표로 표시한 곳으로 지하철...,2021. 3. 15.
서울 호캉스 서대문구 호텔 - 스위스 그랜드 호텔 (ex. 그랜드 힐튼 서울),"안녕하세요~ 오늘은 서울 호캉스가 가능한 서대문구 호텔 스위스 그랜드 호텔 (ex. 그랜드 힐튼 서울)에 대한 소개를 해드리겠습니다^^ 스위스 그랜드 호텔은 1988년 5월에 개관, 도심 속에 위치한 자연 친화적인 5성급 호텔입니다. 원래 그랜드 힐튼 서울로 힐튼 계열이었는데 2020년 올해부터는 스위스...",2020. 2. 27.
서울3대돈까스 긴자료코 연희직영점 찐 서대문구맛집 맞네!,서대문구맛집 서울3대돈까스 긴자료코 연희직영점 위치 서울 서대문구 연희로12길 8 1층 영업시간매일 11:30 - 22:00 라스트오더 21:30 여러분... 그릇 크기가 예전에 일본에서 먹었던 그릇 느낌이 나서 급 일본 여행 생각이 나더라구요..! 요즘에는 일본에 가지 못하니까 이렇게라도 일본을 느껴보기...,2021. 2. 24.
"[서울 서대문구] 신촌 미쉐린가이드 정육면체 - 우육면 맛집 - 깨부수면, 마파새우면...","정육면체 서울 서대문구 연세로5다길 22-8 1층 정육면체 #신촌미쉐린가이드맛집 #신촌정육면체 남편이 가보고 싶다고 하여 온 가족 출동한 신촌!... 후추 여행 못 다니는 우리 가족 오늘은 홍콩 또는 대만 쪽으로 여행 다녀온 셈 치자고!! 다음에 또 간다면 우육면 홍탕, 백탕만 시키고 보리밥을...",2021. 6. 30.
[서울특별시/서대문구/미근동] 서소문 아파트 / 서울 출사 / 서대문구 출사,"나도 오래된 아파트에 살고 있고, 뭔가 우연히 서소문 아파트 지역을 재개발한다는 이야기를 듣고, 서울 여행 중에 우연히 들리게 되었다. 사실... 서울특별시 서대문구 충정로 6길 59 (미근동, 서소문아파트)생뚱 맞기는 하지만 SK브로드밴드 케이블 안내라니... ㅌㄷㄹ 홍보하는 거 아닙니다.근데...",2021. 8. 27.
[여행] 서대문구 안산,"서대문구에 있는 안산은 높이 295.9 m의 낮은 산이다. 산보로 오르면 30분 정도면 충분히 봉수대가 있는 정상에 오를수 있고, 둘레에는 안산자락길이... 언젠간 밤에 올라 야경도 한번 보고 싶다. 안산에서 바라보는 도시의 불빛은 또 얼마나 멋질까? 참고 링크 및 정보원 서울둘레길 '안산 자락길'",2020. 10. 3.
[서울/서대문구] 단체숙박 및 조리 가능한 서울 5성급 호텔 ! 스위스 그랜드 호텔...,넓은 스위스 그랜드 호텔 레지던스 4베드룸 완추 #서울호텔 #서울단체숙소 #서울파티룸 #서울가족호텔 #서대문구호텔 #단체호텔 #서울단체호텔 #펜션같은호텔 #스위스그랜드호텔 #서대문구호텔 #서울5성급호텔 #국내호텔 #서울호캉스 #침대많은호텔 #국내호캉스 #국내여행 #서울여행 #서울가족여행,2021. 3. 7.
서울 서대문구 안산 초보자 등산코스 (독립문역 -안산자락길-봉수대-연희동),"요즘 날씨도 좋고, 등산의 매력에 푹빠졌는데요 맨날 등산가는 메이트 언니는 #추석여행 때문에 고향으로 내려갔고 저는 서울이 고향이라서 어디를... 가능인거죠 ㅋㅋㅋ 안산 초보자 등산코스로 안산자락길 추천합니다 ㅋㅋ 서울 서대문구 안산 초보자 등산코스 (독립문역 -안산자락길-봉수대-연희동)",2020. 10. 6.
서울 여행 가성비 숙소 서대문구 숙소 신라스테이 서대문역점,우리가 국내여행 갈때마다 잡는 숙소 신라스테이 (제주도 제외) 비지니스호텔이라 가격도 저렴하고 가성비가 좋다 특히나 신라스테이의 그 무드가 맘에 든다 지하철이 바로 코앞이라서 너무좋음 버스 정류장도 근처에 많고 가까움 미리 예약을 하고 간 터라 간단한 체크인을 하고 숙소에 들어갔다...,2021. 3. 30.
[현대해상 본사 운전자 상해보험] - 서울 서대문구 냉천동,서울 서대문구 냉천동에 거주하시는 신○우님 운전자 상해보험 문의 및 가입을 해 주셨습니다.^^ ○ 현대해상 운전자 상해보험 문의 경로 제... 자동차보험 해외여행보험. 장기체류자보험(유학생.주재원) ◎일반보험 ◎영업배상 책임 (헬스장. 음식점. 주차장. 학원배상. 아파트 배상) ◎재난...,2020. 12. 29.
서울 서대문구 가볼만한곳 베스트 10 여행지 추천,서울 서대문구 가볼만한곳 베스트 10 여행지 추천 서울 서대문구 가볼만한곳서울 서대문구 가볼만한곳 베스트10서울 서대문구 관광명소서울 서대문구 관광지서울 서대문구 놀거리서울 서대문구 데이트코스서울 서대문구 볼거리 먹거리서울 서대문구 여행서울 서대문구 여행지서울 서대문구...,2021. 9. 27.
"대학동기모임:)서울서대문구숙소 그랜드힐튼레지던스 스위트룸,곱창이야기 신촌점",ㅎㅎ 이소장도 방금 점심식사 맛있게 하고 돌아왔습니다 코로나가 재 확산되기전에 대학동기들과 1년에 한번씩 모임을 갖고 1박2일로 여행을... 합니다 서울서대문구쪽에 위치해있는 스위스그랜드힐튼호텔 바로옆에 위치하고있는 그랜드힐튼레지던스 다녀왔는데요. 평수가 일반 아파트로...,2020. 10. 10.
201027_여행일기 38) 서울 서대문구/중구,"그냥 집에만 있기에는 답답했고, 1단계로 떨어진 상황이여서 이왕이면 서울로 나가서 오래간만에 박물관과 미술관을 가고 싶었다. 그전부터 가장... 커피와 간식을 먹으면서 힘든 다리를 쉬고, 간단한 서울 투어는 이렇게 끝이아니라,,, 뮤지컬을 보러갔다! 별도의 포스팅을 안하려고 한다. 그냥...",2020. 11. 2.
"서울 서대문구 연희동 홍연시장, 필카와 어울리는 레트로 골목(#우리가#몰랐던#서울)",서대문구 홍연시장 일대 이 친구 동네는 꽤 종종 갔었는데 자연스럽게 세월이 녹아든 그런? 레트로 감성 가득한 곳이었기에 필카 챙겨나온 김에... 홍연시장에서 바라본 언덕 나름 여행을 좀 다니다보니 아 저기에서 사진 찍으면 인생샷 건지겠다..하는 감이 있다. 카메라가 워낙 작아서 두손으로...,2021. 4. 30.
"서울야경명소 서대문구 안산자락길 등산코스에서 일출 바라보기, 서울 여행지 추천","3.1절(삼일절) 가볼만한곳 서대문형무소 / 서울야경명소 서대문구 안산자락길 등산코스에서 일출 바라보기, 서울 여행지 추천 글 / 사진 - 사진작가 김대형 안녕하세요. DHK.Photogallery 김대형입니다. 내일은 우리나라 102주년을 맞이한 3.1절 (삼일절)입니다. 우리나라 한민족이 식민통치에...",2021. 2. 28.
결벽증클린♡서울 서대문구 합동 SK리쳄블 오피스텔 이사청소,맘껏 여행할수 있는 그날이.. 계절이 오듯 자연스럽게 올거라 생각합니다 마음이 편안한 하루 보내십시요~♡ 저희는 휘몰아 치듯 청소 작업하지... 바랍니다~* #결벽증클린 #결벽증클린청소 #하루한집청소 #서대문구합동원룸이사청소 #합동이사청소 #고퀄이사청소 #디테일이사청소...,2021. 2. 4.
인천 입국 / 서울 해외 입국자 자가격리 호텔 입소 / 서대문구 보건소 코로나19 검사,"마지막으로 갔던 스모키마운틴 여행. 나몰래 귀여운 열쇠고리를 사줬다. 사실 여행 당시, 각자 힘든 상황 때문에 기분이 좋지 않고 서로에 대한... 체온계 #서울자가격리 #서울자가격리호텔 #서울자가격리시설 #서대문구보건소 #서대문보건소 #해외입국자시설 #해외입국자코로나...",2020. 5. 31.
[국내]서울 가볍게 다녀오기 좋은 등산 추천/서대문구 안산,서울 서대문구 안산 입니다! 저는 이 동네에 살고 있어서 걸어서 이동했습니다! 산은 어디서 시작하느냐에 따라 다르니깐요 ㅎㅎ 저는 연대... 코로나로 여행 가기 힘든 요즘!! 날씨도 풀렸는데 가벼운 등산 어떠신가요? 등산으로 몸도 풀고 자연 보면서 힐링 하시길 바랍니다!!,2020. 9. 30.
[다크 투어리즘 - 어둠에서 배우다 *서울 서대문구 *] 애국지사들의 피맺힌 절규가...,'다크 투어리즘'은 어둠을 뜻하는 다크(Dark)와 여행을 의미하는 '투어리즘(Tourism)'의 합성어입니다. 가슴 아프지만 잊어서는 안되는 현장을 '여행... ^^ '서대문 형무소 역사관'과 함께 만나보면 좋은 곳 서대문 독립공원 서울 서대문구 통일로 247 독립문역 사실 서대문 형무소 역사관은 '독립문'이...,2020. 11. 5.
[여행] 서울시 서대문구 성시경숲,이렇게 팬 분들이 연예인들을 기념하여 조성한 숲이 서울 곳곳에 있다는 것도 이번에 처음 알았다. 성시경숲 가운데는 '성시경나무'가 있다.... 또한 성시경씨 본인은 서울 내에 자신의 이름을 딴 장소가 생긴 것을 알고 얼마나 기뻤을까 생각해 본다. 참고링크 및 정보원 디시인사이드 성시경 갤러리,2021. 10. 9.
서울 서대문구 신촌 락희돈: 역시 돼지꼬치장인의 맛,(지도를 포함한) 장소 #서대문구맛집 #홍대맛집 #연남동맛집 #락희돈 #돼지고기꼬치 #돼지꼬치 #돼지꼬치달인 무엇에든 꼬치에 끼우면 맛있게 먹는 나의 개인적 취향. 닭꼬치는 자주 먹었으니 오랜만에 돼지꼬치!! 일본에서 30년경력을 가지고 운영하신다고 함. 가게 들어가자마자 여행온 느낌...,2021. 4. 4.
서울 서대문구 남가좌동 피아노 방문 레슨,서대문구 남가좌동 피아노 방문 레슨 서울 서대문구 남가좌동 피아노 방문 레슨 어릴적 피아노 학원에서 배우는 시간은 왠지 지루하기도 하고... 음악 여행 새로운 나를 만나는 시간 피아노는 평생 친구 랍니다^^ 피아노 선율에 힐링 되다 한주의 시작입니다. 매일 매일 반복되는 시간 속에서 나를...,2020. 7. 27.
서대문구 추잡의회 박경희 의장의 싸구려... 분노감이 폭발해 춘천 위로 여행 다녀왔어요.,서울 서대문구의회 제8대 후반기 의장으로 선출된 박경희 의장은 “먼저 나를 믿고 중요한 자리를 허락해 준 선배·동료 의원들에게 감사드린다”며 “전반기 의정활동을 바탕삼아 그 뜻과 기대에 부응하는 결실을 맺을 수 있도록 막중한 책임감을 갖고 다양한 목소리에 귀 기울이며 과감한...,2020. 8. 13.
서울 아기랑 갈만한곳 서대문구 안산 벚꽃길 봄 축제,"서울 벚꽃 명소 서대문구 안산 아기랑 함께 하얀 꽃망울 구경가기 이제 서울시 서대문구 안산은 봄시즌 벚꽃 구경만 가는 곳이 아니라 홍제천을... 안산 벚꽃 나들이 벚꽃 랜선 여행 매년 벚꽃이 피면 전국 명소마다 찾아다니며 벚꽃 축제을 즐겼어요. 하지만, 올해는 사회적 거리두기 및 방역수칙...",2021. 3. 27.
"(서울 서대문구) 오야코동은 사랑♡ 이대 맛집, 파파노다이닝","일본여행에 갔을 때 매 번 오야코동을 꼭 먹을 정도로 정말 좋아한다❤ 오랜만에 이대에 갔는데 내가 알던 이대가 맞나? 할 정도로 가게를 내놓은 곳이 많았다. 코로나로 인해서 상권이 많이 타격을 받은 듯. 파파노다이닝은 신촌기차역 근처에 있다. 파파노다이닝 = 아빠의 식사, 아빠의 만찬...",2021. 8. 8.
