header,contents,date
가재울도서관에서 떠나는 국내 벚꽃여행 반나절이면 다녀올 수 있는 벚꽃여행 코스,"안 가면 손해 저자가 추천하는 봄 베스트 여행지 서대문구 안산자락 벚꽃길, 국립서울 현충원, 아차산 생태공원 워커힐 벚꽃길입니다. 4월 방문하면 좋은 곳 봉은사 신라 원성왕 10년 연화국사가 창건한 1200년 역사의 사찰 봉은사 4월이면 봉은사 마당에 봄 향기가 가득해 4월 초에는 홍매화가...",2021. 3. 31.
"연희동 고고쭈꾸미 서울 연희동 맛집, 연희동 한식으로 유명한 고고 쭈꾸미에서...",그래도 여행 가고 싶은데 이런 날씨를 보니 더 여행 가고 싶네요 자 오늘은 어디를 갈 건지 잇님들은 아시나용~~~! 바로 요기를 갈 거예요 어디냐... 고고 꼬 오늘도 맛나게 즐거운 하루 20000 총총 총 ~~~ 매장 정보 상호:고고쭈꾸미 주소:서울특별시 서대문구 연희로 192 전번:02-717-5428 영업시간:11:00~23:00,2021. 7. 1.
【앙금플라워케이크】 2호 사이즈 흑임자설기 반전케이크/서울동대문구서대문구은평구...,아버님이 그린컬러를 좋아하신다고 하셔서 맞춰 제작해드린 오늘의 케이크 그린컬러만 있으면 너무 심심할까봐 분홍빛 장미와 딸기꽃으로 포인트를 넣어드렸어요 떡도 맛있고 행사도 잘치루셨다는 후기까지 들려주신 고객님 가족여행도 즐겁게 다녀오시길바랍니다 주문문의는 카카오톡에서...,2021. 3. 3.
연남동 리히트케이크 연남동 케이크로 유명한 리히트& 서울두부에서 몸에 좋은 건강하고...,동남아 여행을 못 가서 아쉽 그런 마음을 담아서 할망고 케이크를 선택 자 이제 집으로 고고 꼬 연남동 케이크 리히트 & 서울두부 인스타샷 아... 자 이제 결정하셨다면 바로 어떻게 추울바알알알 고고 꼬 매장 정보 상호:리히트 주소:서울특별시 서대문구 연희로 4길 10 이구삼동 리히트 케이크 전번...,2021. 7. 10.
감동했던 연희동 맛집 모음,"연경 연희점 메뉴 : 북경오리 반마리 40,000원 / 북경오리 한마리 70,000원 주소 : 서울 서대문구 연희로 145 전화 : 02-336-8855 영업 : 평일 15:00 - 17:00... 중국 여행 온것 같기도 하고 설렜어요. 주차 공간도 넉넉하게 마련이 되어 있어서 차를 끌고온 친구들도 쉽게 주차를 할 수 있었어요. 지금은...",2021. 7. 16.
캠퍼스투어003 3학년 코스 지식의 전당을 여행하는 히치하이커를 위한 안내서,"테마여행신문 TTN Korea 캠퍼스투어(Campus Tour)와 함께 어제도, 오늘도, 내일도 멋진 진리여행을! B 이양하 수필가의 신록예찬(新綠禮讚)(1947)... 서울 서대문구 연세대 : SBS 제중원(2010) 02-8. 서울 서대문구 이화여대 : 영화 타짜(2006) 02-9. 서울 노원구 서울과기대 : tvN 치즈인더트랩(2016) 02...",2020. 12. 21.
K-art 가을을 물들이다,"전시를 모두 관람한 후 다시 로비로 돌아오면 수백 년을 여행한 듯한 기분이 들 거예요. 한국화 시대를 걷다 – 안상철 미술관(~11.25. (목)) 경기도... (화)) 서울 서대문구 식물은 예로부터 화가들이 좋아했던 주제예요. 농경사회였던 조선시대만 해도 풀, 과일, 꽃 등 식물을 소재로 한 그림을 그리는...",2021. 9. 8.
북가좌6구역 주택재건축 서대문구 아파트 추진현황,"예전 같으면 다들 여름휴가를 준비하고 여행 일정 등을 잡는 등 분주한데, 올해는 코로나19의 영향으로 조용한 것 같습니다. 코로나19로 인해 올 한해 어려움이 많았지만 이전의 모습을 조금씩 찾아가는 것 같아 위안을 가져봅니다. 오늘은 서울 서대문구에 들어오는 재건축 사업이 있어 같이...",2020. 7. 27.
[온앤오프] 광복절_애국지사들의 고귀한 넋을 기리는 서대문 독립공원,지친 마음을 달래주는 랜선 여행 온N오프 광복절을 맞아 서대문 독립공원을 찾아가보았어요. 2021년 8월 15일 제 76주년 광복절입니다. 여러분은... 서대문 독립공원 ✔ 서울 서대문구 통일로 247 독립문역에 위치한 서대문 독립공원! ✔ 우리나라의 역사를 눈으로 보면서 배울 수 있는 서대문...,2021. 8. 17.
서울 맛집여행 2일차 (쉐이크쉑/ 백종원의 골목식당 어머니와 아들/ 여우골 초밥),"안녕하세요 이웃님들 산뜻한 여행일기에요 제가 며칠 전에 올린 서울 맛집여행 1일차 포스팅 보셨나요? https://blog.naver.com/daejeontop1/222159025105... 위치 서울 서대문구 홍은중앙로 100-1 (홍은동 9-86) 웨이팅 있을거 같아서 30분전에 서둘러 갔는데 기다리는 사람도 많아서 놀람,, 명단...",2020. 12. 11.
"서울여행, 서울정복","#서울여행, #서울트레킹, #서울나들이, #서울구경, #창경궁, #서울타워, #중앙박물관, #소마미술관, #서울숲, #푸른수목원, #서울식물원, #얼리힐링, #워커밸, #소확행 관광 약자를 위한 여행 기획 스타트업... - 상호: (주)모아스토리 대표 강민기(070-8639-4415) - 주소: 서울 서대문구 충정로 53...",2020. 10. 7.
"서대문구 안산,안산자락길,서대문 구청, 트래킹,설화수 아모레,서울 둘레길,아모레퍼시픽",#서대문구 안산 #안산자락길 #서대문여기로 #인왕산끝자락 #산정상 #윤동주시인 #아모레설화수헤라 #설화수카운셀링 #즐거운산행 #서울시 둘레길 #반나절산행으로 좋은 곳 #안산자락길추천 #반나절여행 7월11일 매달 둘째 토요일은 아침 일찍 산행 하는 날 #서대문구 안산 자락길 트래킹 #일찍 아침...,2020. 7. 12.
신촌카페 문베어 | 신촌에서 샤랄라한 예쁜 디저트 카페 찾기,#내돈내산 #신촌카페 #신촌데이트코스 #데이트코스추천 #예쁜카페 #디저트카페 #구움과자맛집 신촌 예쁜 디저트 카페 문베어 서울 서대문구 명물길 66 1층 cafe moonbear 운영시간 오픈 - 클로즈 매일 11:00 - 23:00 연중무휴 문베어의 겉 모습은 다소 시끄럽다. 아무래도 이렇게 메뉴 그림이나 프로모션...,2021. 9. 15.
서울종로구가볼만한곳 서울시명산 인왕산 등산코스 무악재하늘다리 선바위 한양도성...,서울종로구가볼만한곳 서울시명산 인왕산 등산코스 무악재하늘다리 선바위 한양도성 기차바위 운동주문학관 창의문 인왕산은 서울시 종로구의 무악동과 서대문구의 홍제동까지 광범위하게 자리하고 있습니다 서울의명산으로 손꼽히는 인왕산의 등산코스는 무악재하늘다리에서 진입해서...,2021. 9. 28.
[서울특별시 서대문구] 221. 벤치 커피 스튜디오 ( Bench Coffee Studio ),"여행 중, 삶을 고뇌하는 고민은 이루어지지 않는다. 거기에 문화적 사대주의까지 더해져 우리는 머릿속과 마음속에서 스스로 대단한 환상을... 내가 벤치의 디카페인 블렌딩을 마신 느낌은 서울숲의 Mesh Coffee와 비슷했다. Nordic 이라 불리우는 굉장히 물맛이나 허브 계열이 강하게 느껴지는 그런...",2020. 4. 19.
서울 호캉스 호텔 추천/주말 호캉스> 서대문구 홍제역 홍은동 스위스 그랜드 호텔 호캉스...,서울 호캉스 호텔 추천/주말 호캉스> 서대문구 홍제역 홍은동 스위스 그랜드 호텔 호캉스+조식 후기 (구 그랜드힐튼호텔) 주말에 호캉스 다녀왔어요... 지내니 여행온 기분~ 다음날 조식! 지하1층에서 먹어요! 한국인보다 외국인이 더 많아서 해외여행온줄~ 스위스그랜드호텔 조식은 메뉴가 딱...,2020. 11. 3.
서울 이대·신촌┃2020 미쉐린 가이드 우육면 맛집_정육면체 (내돈내산 후기),"퓨전 면요리집이라고 생각하시면 편할 듯,,, 그럼 리뷰 후딱 시작할게요~ 이대·신촌 2020 미쉐린 가이드 맛집_정육면체 서울 서대문구 연세로5다길 22-8 OPEN 11:00 ~ CLOSE 21:00 (Last Order 20:30) 완전 밥 때에 찾아가시면 웨이팅하실 확률이 높습니다! 저랑 친구도 딱 두 자리 남은 것 보곤 호다닥...",2020. 8. 16.
[전시회] 한국에서 가장 비싼 화가_추상미술의 뿌리 김환기의 '우주' 130억원!!,<너랑 나랑 우리 둘이 ‘부암동 미술관 여행’> 경복궁역 도착(8시 49분) – 스타벅스 (3번출구 100m) 커피 & 샌드위치 (아침) – 10시 나와서... 서울 서대문구 연세대에는 윤동주가 연희전문 재학 시절에 살았던 기숙사가 남아 있다. 1922년에 건립된 3층 규모의 석조건물 '핀슨홀'이다. 언더우드관과...,2021. 7. 4.
[2021] 서울여행 2편,그래도 같이간 친구들이 맛있다고 해서 다행ㅎㅎ 내가 사랑해마지않는 서울숲 나 약간 서대문구 마포구 종로구 빌런이라 서울숲 18년인가 그때... 헤헤 (아니 근데 진심 무슨 이번 여행 압구정 너무 많이감...ㅋㅋㅋ 막상 서울살 때는 진짜 손에 꼽을 정도로 안가는 곳인뎈ㅋㅋㅋ) 아는 맛이 무섭다(9)...,2021. 4. 16.
헨리 피터만(Henry Petermann)의 서울풍경 1957-58,"무악재 (毋岳재) 서울 서대문구 현저동과 홍제동 사이에 있는 고개. 예로부터 한양으로 들어오는 교통의 요충지였으며 옛적엔<길마재>라고 하였다. 독립문 조선 말에서 대한제국으로 이어지는 1896년부터 1897년에 걸쳐 완공한 기념문. 양식은 유럽식 개선문의 모습을 하고 있으며, 청일전쟁...",2020. 3. 28.
서울 떡볶이 맛집 서울3대 떡볶이 기찻길 옆 분위기 좋은 서대문 충정로 철길떡볶이,그럼 지금부터 서울3대 떡볶이 맛집 충정로 철길떡볶이 포스팅을 시작할게욧 철길떡볶이 전화번호 02-364-3440 주소 서울 서대문구 충정로 35-6... 다 비까번쩍한 건물들 사이에 낮은 건물이 왠지 다른곳으로 여행온 것 같고 고층의 빌딩들 보다 분위기 있고 좋더라구요. 철길떡볶이 뒷편에서 본...,2021. 9. 9.
서대문구초등미술 [청개구리 여행사],만들어 여행을 떠나요!! 가이드님 피켓들고 손님 절찬 모집중 교육상담 문의 (▼ 아래 번호를 누르면 바로 연결됩니다.) ***-****-**** 사진 설명을 입력하세요. 홍은벽산클래스 영렘브란트 홍은벽산클래스 서울특별시 서대문구 세검정로1길 95 홍은벽산아파트 115동 303호...,2021. 3. 7.
외식하기 좋은 연희동 맛집 ♡,"5.작은스페인 가격 : 리코타 치즈샐러드 12:000원 주소 : 서울 서대문구 연희로25길 37 전화 : 0507-1426-8870 영업시간 : 평일, 주말 11:30 - 21:30 주차가능 마치 스페인에 여행온 것 처럼 이색적인 분위기가 돋보였고 SET도 다양해 갖가지 음식을 한꺼번에 맛볼 수 있는 식당이예요.",2020. 11. 18.
서울 속 유럽 호캉스?! 스위스 그랜드 호텔??,"추석이라고 호캉스라도 가고프신 분, 유럽병 걸리신 분들 아쉬운대로 서울에서 스위스 그랜드 호텔이 있네요. 서대문구에 있고, 인왕산 근처라... #미술가 #화가 #미술 #제네바 #스위스 #스위스그랜드호텔 #호캉스 #유럽병 #메로나 #코시국 #klm #루프트한자 #유럽 #여행 #김창열 #홍제동마을둘레길...",2021. 9. 20.
사진으로 보는 조용기 목사의 생애(초창기 교회부흥)/ 국민일보,사진으로 보는 조용기 목사의 생애(초창기 교회부흥) 순복음신학교를 졸업한 조용기 목사는 1958년 5월 18일 서울 서대문구(현 은평구) 대조동... 조 목사는 해외여행이 자유롭지 못하던 64년 미국 하나님의성회 교단창립 50주년 기념식에 한국대표로 참석해 유창한 영어로 한국교회 상황을...,2021. 9. 16.
서울애견유치원 강아지놀이터 서대문구 반려견 돌봄서비스 1일 3만원,서울애견유치원 강아지놀이터 서대문구 반려견 돌봄서비스 1일 3만원 안녕하세요^^ 클레어스입니다~ 오늘 하루 잘 보내고 계시나요? 클레어스는?... 회사에 출근 하거나 여행 혹은 개인 사정으로 반려견 호텔과 반려견 유치원 이용을 하는 분들이 많이 늘어나고 있는데요^^ 1박 이상 맡겨 두어야...,2020. 3. 4.
[이대 카페] 북카페 파오 공부하기 좋은 곳,"#이대카페 #북카페 북카페파오 카페,디저트 0507-1404-1130 / 서울 서대문구 이화여대길 34 신흥빌딩 3층 2호선 이대역3번 출구에서148m 찾기 어렵지 않은... #전주느리게걷기 여행을 떠나보고 싶은 곳중 한곳인데 아직 #전주 는 안가봤어요. #전주비빔밥 도 먹고 #전주한옥마을 도 가보고 싶었는데 말이죠....",2021. 7. 13.
[서울시내버스여행 ] 7713번,대중교통을 통해 다양한 서울의 맛을 느껴보는 서울 시내버스 여행. 안녕하세요! 스마트에드입니다. 7713번 버스는 서대문구 창천동에서 홍은2동을 이어주는 버스입니다. 2013년 말 노선변경이 되면서 통학수요를 책임지는 버스가 되었어요. 첫차의 시각은 05:00 막차는 23:30입니다. 배차 간격은...,2020. 1. 4.
"미리보는 서울 벚꽃 명소 꽃 구경 나들이~ 남산, 안양천 등등","해당 포스팅은 실시간 포스팅이 아니며, 사전에 개화 상황이나 벚꽃길 운영 방식 등등 꼭 확인하시고 여행해주세요. 서울 벚꽃 명소 1. 서울 남산 2.... 있는 서울의 대표적인 조망 명소이기도 합니다. 서대문 안산 벚꽃길 마지막으로 소개할 서울 벚꽃 명소로는 서대문구 안산 벚꽃길입니다. 안산은...",2021. 3. 30.
[책으로떠나는여행]나의 포근했던 아현동,"다모아 호프 주소: 서울 서대문구 신촌로37안길 8 작가 부모님의 오랜 단골집이라고 해요. 연애 시절부터 오기 시작해, 결혼 후에도 먹고 갔고... 아현동 구석구석 작가의 추억 이야기와 함께하다 보면 어느새 아현동 한 바퀴를 여행한 것 같은 느낌이 들어요. 마지막에는 재개발로 이사 가는 작가...",2021. 5. 21.
감탄했던 연희동 맛집 모음,"이국적인 느낌을 물씬 풍기는 곳이라 해외여행에 대한 갈증을 해소해 주기도 하더라고요. 비싼 가격대가 살짝 아쉬웠지만 맛만큼은 출중했어요. 4. 조은집 가격: 한정식 도시락 12,000원 / 떡갈비정식 18,000원 주소: 서울 서대문구 연희동 133-24 전화: 02-323-8084 영업시간: 매일 11:30~21:30 breaktime...",2021. 1. 6.
"홍제쉐어하우스, 서대문구쉐어하우스 블랑쉐어하우스 5호점 입주자 모집중!",서대문구 홍제역 블랑쉐어하우스 홍제쉐어하우스 블랑쉐어하우스 홍제점 1인실 서울 #서대문구 #홍제동 #3호선 #홍제역 #블랑쉐어하우스... 재무설계 서대문구쉐어하우스 블랑쉐어하우스 홍제점 거실 #여행컨셉하우스(TOUR HOUSE) 기존 프리미엄 서비스 + 1년이상 계약 입주자...,2020. 1. 28.
210815 신촌 정육면체 우육면 깨부수면 미쉐린 가이드 서울 2021,ʕ•ᴥ•ʔ 신촌 정육면체 서울 서대문구 연세로5다길 22-8 ( 서울 서대문구 창천동 62-18 ) 050713313819 매일 11:30 - 21:00 Last Order 20:30 *･ ゜ﾟ･*:.｡.... 해외여행 가고싶어요 징챠 #우육면홍탕 #깨부수면 #우육면 #홍탕 우육면 처음 먹어봤는데 저는 완전 호호호 극호였어요 !! 생각보다 고기가...,2021. 8. 30.
전국 맛집 모음,"혹여나 여행을 가시거나 지방을 가시는 분들은 한번 검색해 보시면 좋지 않을까 생각해 봅니다. 맛있는 식사하세요.. 희락반점 대전 중구... 몽고네 서울 서대문구 연희로 11가길53 / 연희동 192-29 봉골레 파스타, 해산물샐러드, AOC 장안정 서울 동대문구 답십리로 314/ 장안동 334-3...",2021. 10. 3.
개미랑 노는 베짱이 이연복 셰프 목란 위치 사위 박종복 나이 김수찬 힐링 스팟...,이연복 셰프 목란 위치 서울 서대문구 연희로15길 21 목란입니다. 월급 천만원 연봉 미공개. 그런가 하면 개미랑 노는 베짱이에서 이연복이 여행을 통해 보인 찐 웃음이 힐링을 전파했습니다. 사위와 벌인 농구 대결에서 불타는 승부욕을 뽐내는 한편 무서운 놀이기구에서는 겁먹은 모습을 보이기도...,2021. 6. 28.
서울 빵집 순례,서울 성동구 연무장길 20SNS @ode. LA의 유명한 도넛 맛집인 랜디스 도넛은 제주에 이어 서울 연남동에 문을 열었습니다. 제주 여행에서 필수... 싱싱한 채소와 연어를 첨가한 연어 베이글 샌드위치는 뉴욕 베이글에 떨어지는 결정타를 날립니다. 서울 서대문구 연희로 11길 29SNS @everythingbagel_korea,2021. 8. 5.
"연희동 브런치 카페, 이이알티키친 eert kitchen 방문 후기!","해외여행을 떠나지는 못하지만 나름 분위기 충만한 브런치 카페에 다녀왔어요. 연희동에 위치한 eert kitchen 인데, 정말 분위기 맛집이라는... eert kitchen의 주소는 서울 서대문구 연희로11가길 36 1-2층이예요 가게 오픈 시간은 보통 10시 30분 이후부터이며 당일 예약이나 1인 예약도 가능하고 7월의...",2021. 7. 27.
"서대문구, '정월대보름 맞이 아빠와 함께 달 보기' 개최","서울 서대문구(구청장 문석진)는 가족들이 함께 밤하늘 천체를 관측하고 천문 강좌도 들을 수 있는 이색 프로그램 ‘아빠와 함께 달 보기’를... 이번 프로그램은 천문 강좌, 천문 공작 체험, 부럼깨기, 천체망원경으로 밤하늘 관측하기, 달·행성·별자리 스크린 여행, 천문 퀴즈왕 선발 OX 게임...",2020. 1. 16.
비오는 날 신촌 밥집 맨도롱 식당 가서 제주도 고기 국수 먹은 후기 ✌,제주도 여행 욕구가 뿜뿜 솟는 요즈음... 제주도에 실제로 가지는 못하지만 대신 음식을 먹으면서 만족하기로 했어요 그렇게 신촌에 있는... 신촌역에서 내려서 현대백화점에서 도보로 1분거리예요 문의전화 : 02-3141-3055 영업시간 : 매일 11:00 - 23:00 주소 : 서울 서대문구 연세로5가길 8-3 1F...,2021. 6. 3.
김광석 신촌칼국수 이대점 보글보글 맛있는 샤브샤브 추천,#김광석신촌칼국수이대직영점 서울 서대문구 명물길 70 1층 http://naver.me/FfMW56yT 영업시간 토요일 10:00 - 22:00 일요일 10:00 - 22:00 월요일 10:00 - 22:00... #캠핑칼국수 #밀키트칼국수 챙겨서 훌쩍 여행가기도 좋고 집에서 포장해서 보글보글 끓여먹기도 좋겠어요. #캠핑음식 #캠핑요리 간단한 칼국수...,2021. 8. 7.
"기자 ]서울에서 자연을 즐기는 하나의 방법 “탐조”, 재밌고 유익한 서울 및 근교 탐사","안산 주소: 서울 서대문구 봉원동 (연세대학교 뒷산) 또는 안산자락길 이용가능 청둥오리, 꿩, 멧비둘기, 뻐꾸기, 쇠딱다구리, 오색딱다구리, 큰오색딱다구리, 청딱다구리, 직박구리, 되지빠귀, 붉은머리오목눈이, 곤줄박이, 쇠박새, 박새, 참새, 꾀꼬리, 어치, 까치, 큰부리까마귀 등 관찰 가능하다고...",2020. 5. 26.
[인천 강화] 가족들과 강화도 당일치기 여행 ( 강화 루지 / 온수리 성공회성당...,(우리집은 뷰 맛집 ㅋㅋ) 오늘은 아내도 저도 연차 사용하고 강화도 당일치기 여행 go go ㅋ 오후에 비가 온다고 하는데 그러다가 안 온 경우가 많으니까 희망을 가지고 ㅎㅎ 일단 아침 하늘은 좋았습니다.ㅋ 서울 서대문구 홍제동 → 씨사이드리조트 루지 → 온수리 성공회성당 → 해운정...,2021. 7. 19.
명지대 카페 분위기있는 쉘터,"여행가고싶어지는 여행지 마그네틱~ 참고로, 여기는 컵이 진짜 이뻐서 인증샷을 찍게 되는 곳이에요~ 저희는 갈때 콜드브루를 자주 사와서... 서울 서대문구 연희동 715-4 @cafe.shelter 화요일 휴무 월,수~금 09:00~21:00/토 10:00~21:00/일16:00~21:00 *휴무 및 오픈시간 변경은 인스타그램에서 확인 가능",2021. 4. 13.
"[이영욱의 지역분석 부동산여행] 재개발 재건축 이슈, 의료산업 특화 서대문구 홍제동","[이영욱의 지역분석 부동산여행] 재개발 재건축 이슈, 의료산업 특화 서대문구 홍제동 https://youtu.be/-dmcgmSvwFM - 서울 53지구중심 중 홍제지구중심에 속한 홍제동 - 홍제역 일대 재정비촉진지구 지정(재건축, 재개발 이슈) - 강북횡단선 개통 예정 - 재개발 재건축 확인...",2021. 1. 7.
서울여행 점심은 고기가 진리 신촌역 맛집 신촌 돼지갈비 고기랑,"고기 인생 자고로, 고기는 아침과 점심이 진리다 단, 묵직한 배와 냄새만이 쥐쥐ㅎㅎ 고기랑 참숯갈비전문 서울 서대문구 창천동 62-5 1층 신촌역... 지방족 서울여행파든 신촌 근거리 지역 회식파든 정답고 다정한 주인분들의 서비스와 함께 좋은 숯내음 나는 돼지갈비, 신촌고기랑을 추천해본다...",2021. 5. 23.
서울 가볼 만한 곳: 레트로 감성 충만한 돈의문 박물관마을,"아무튼 이 만화 아는 분 여기 꼭 가보시길 :P 진짜 이번에 추억 여행 제대로 하고 왔네요. 서대문 사진관은 학교 앞 분식처럼 진짜 영업을 하고 있는... 엄청 오래되신 유물 같은 분인가 봐요 ㅋㅋㅋ 서울 서대문구 근처에 있는 돈의문 박물관마을. 레트로 감성 충만한, 아이랑 부모님과 연인과, 그...",2021. 9. 29.
"택배노조, 김포 대리점주 '골프·여행' 사진 공개..유족 측 ""사실과 달라""","https://news.v.daum.net/v/20210928145333131 "" "" "" "" "" "" "" 지난 27일 오후 서울 서대문구 대회의실에서 택배노조측이 기자간담회를 열어 CJ대한통운 김포... 지난 27일 택배노조 측이 진행한 간담회에서 진경호 택배노조 위원장은 ""고인은 평일 골프를 쳤고 해외여행, 풀빌라 여행 등 풍요로운 생활을 했다""며...",2021. 9. 28.
"따릉이 타고 연희동 카페, 콘하스(야외 테라스 까지)","""콘하스 연희동 야외 테라스카페 지하1층부터 3층까지 수영장 발장구 가능 ' _서울 서대문구 연희로27길 99 ' 들어가자마자 반겨주는 갱애지!!... 멀리 여행온듯한 기분. 연희동카페에 에서 느껴버림 갑분화장실 연희동 콘하스 카페는 화장실도 너무 특별하다. 사실 문 못찾음.. 거울여세요 화장실...",2021. 5. 29.
"서울여행 타임머신을 타고 도착한 1970년대 풍경, 홍제동 개미마을","서울에서 얼마 남지 않은 '달동네'라고 하면 서대문구 홍제 3동에 있는 개미마을을 연상하게 돼요. 하지만 달동네라고 표현을 하기에는 조금 미안한... 여행길이 언제나 즐거울 수는 없지만 그래도 남은 있는 이들의 행복을 소원하며 돌아서는 발걸음이 개운, 산뜻하지 않은 하루였어요.",2021. 6. 18.
"서울 ㅣ 여름이 오는 길목에서 떠난 걷기 여행, <힐링 트래킹>","안산 자락길 서울 서대문구에 위치한 안산(鞍山)은 산의 모양새가 말의 안장처럼 생겼다고 하여 붙여진 이름입니다. 낙산, 남산의 명성에 가려져... 걷기 여행의 매력을 더 즐기고 싶다면 인왕산 산책길로 넘어가는 것도 추천합니다. 인왕산 한양도성 성곽길 인왕산은 안산의 인근에 위치하면서도...",2020. 6. 23.
[서울시내버스여행 ] 7737번,"대중교통을 통해 다양한 서울의 맛을 느껴보는 서울 시내버스 여행. 안녕하세요! 스마트에드입니다. 연대앞 정류장의 경우 중앙차로... 독립문공원,서대문구의회→독립문파크빌아파트(회차) DMC첨단산업단지 : 1997년 '상암택지개발지구'가 지정되고 1999년 '새서울타운발전구상'이 발표 되면서...",2021. 7. 23.
"코로나 시대 여행, 인천공항에서 서대문구, 입국 후기","버스는 서울 지역을 4개로 나누어 4대가 하루에 4번 운행을 한다. 나는 서대문구라서 1번 버스를 탔다. 버스에는 한 13명 정도 탄 것 같은데, 마포구가 제일 먼저 내리고 그 다음이 서대문구, 그 후에 성북구, 중구로 가는 사람들이 있었다. 마포구는 5-6명이 내렸는데, 서대문구는 나 혼자였다. 1시간 푹...",2020. 7. 9.
접종주기 단축? 안내없이? 날짜변경? 정부가 아닌 sns안내? 신혼여행? 예약변경 방법?,지난 15일 오후 서울 서대문구 북아현문화체육센터에 마련된 코로나19 예방접종센터에서 시민들이 백신 접종을 마친 뒤 이상반응 모니터링을 하고 있다./연합뉴스 다음 달 결혼식과 신혼여행을 앞둔 문모씨는 접종 일정을 앞당기겠다는 정부 발표를 듣고 질병관리청이 운영하는 애플리케이션인...,2021. 9. 29.
":: 서울, 강릉, 경주 맛집 여행(달콤한 거짓말, 센트 그릴, 어린 왕자 스파 펜션, 소돌...","텍사스식 바비큐와 다양한 종류의 생맥주를 즐기면서 여행하면서 쌓인 피로를 풀어보는 것도 좋을 것 같습니다! 주소: 서울 서대문구 연희로 89-3 지하 1층 센트 그릴, 홍대입구역 3번 출구에서 1067m 운영시간: 일요일 17시~ 22시 월요일 휴무 화요일 17시~24시 수, 목요일 17시~ 24시 금, 토요일 17시~ 01시...",2021. 2. 16.
