header,contents,date
"생배추 감자탕 (서울 새절역,응암동 대림시장 감자국거리) 경기시흥여행","02-306-6535 서울 은평구 응암로 172 (응암동) (6호선) 새절역 1번 출구 760m / 응암동 대림시장 감자국거리 내 뼈다귀감자국 (특대) 52,000... 031-497-3827 경기 시흥시 오이도로 159 갯골생태공원 031-488-6900 경기 시흥시 동서로 287 #철판짜글이통닭 #생배추감자탕 #경기시흥여행",2020. 10. 12.
"♥ 북한산 둘레길 10구간 내시묘역길, 11구간 효자길 걷기 여행","10구간 내시묘역길은 거리 3.7km, 1시간 45분 소요되며, 코스는 서울 은평구 방패교육대앞 - 경천군송금물참비 - 북산산성분소 - 효자동공설묘지까지... 이번 걷기 여행을 하면서 내시묘역길에 내시묘(45기)들이 어느날 흔적도 없이 사라졌다는 것이 큰 아쉬움으로 남았고, 효자길을 걸으며 울창한...",2020. 6. 10.
서울한옥 게스트하우스 응정헌 은평한옥마을에서 힐링,한번쯤은 살아보고 싶은 한옥 서울한옥 게스트하우스 응정헌에서 대리 만족 하며 은평한옥마을에서 힐링여행 고즈넉한 분위기 조용한 나만의... 응정헌 서울 은평구 연서로 50길 19 (진관동) ***-****-**** 체크인 : 15:00 ~ 은평한옥마을 입구에서 길따라 쭈욱 한옥을 구경하다 마지막 한옥집이...,2020. 6. 17.
강아지 이동가방 패리스독 백팩 하퍼 앞가방,"날이 많이 풀리면서 요즘 산으로 바다로 여행을 떠나시는 분들이 많으신것 같아요. 매장에서도 기차, 고속버스와 같은 대중교통 이용시에... 패리스독 백팩은 도그원 연신내 오프라인 매장에서 만나보실 수 있답니다 :) 감사합니다^^ 도그원 반려동물용품 전문매장 서울 은평구 연서로29길 24...",2021. 6. 12.
"은평구맛집 동굴과화로구이 , 놀이방있는 가족모임하기 좋은 고깃집",동굴과화로구이 소개할게요 :D 은평구맛집 숯불갈비전문점 동굴과화로구이 서울 은평구 은평로185(녹번동) 2층 02-353-8592 11:30~22:00 (브레이크 타임 : 14:30~17:00) ▼ 네이버 예약하기 https://booking.naver.com/booking/6/bizes/156950 네이버 예약이 가능해서 전화보다 훨씬 간편하게 예약을 할 수 있어요. 게다가...,2020. 3. 17.
[한 국] 서울 여행 | 진관사 나들이,날씨가 따뜻해지고 초록초록한 빛들이 무성할 때 다시 와보고 싶은 진관사. 날씨는 좀 쌀쌀했지만 고즈넉한 사찰을 걷고 오니 평안하니 좋았다. ☺️ #진관사 #서대문구산책 #은평구산책 #은평한옥마을 #은평한옥마을산책길 #산책길 #서울 #서대문 #한옥마을 #여행,2021. 3. 7.
[서울 진관사 템플스테이] - 힐링 여행,요리해 주신 스님이 금손이신건지...대박이였답니다 ㅋㅋ 템플스테이 처음 해보았는데 생각했던 것보다 너무 좋아서 힐링 완전 가득하고 갔어요! 수도권에서 템플스테이를 알아보시고 계신 분들은 진관사 추천드립니다! 주소 : 서울 은평구 진관길 73 진관사 전화번호 : 02-359-8410,2020. 5. 31.
[서울 근교 여행] 은평 한옥마을 - 북한산 아래 고즈넉한 곳,인터넷을 찾아보니 서울 은평구에 한옥마을이 있다네요~ 인스타에서 다른 사람들이 찍은 사진을 봐도 너무 예쁘게 잘나왔길래.. 바로 여기다 싶었죠!ㅎㅎㅎ 집에서 30분정도 거리라서 크게 부담없이 방문하기 좋았어요ㅎㅎ 주말인데도 불구하고 생각보다 사람이 없어서 넘 좋았어요 ㅋㅋㅋ...,2020. 4. 20.
요리하기 귀찮죠? 은평구수제반찬 순수식탁은 어때요,여행 한 번 다녀온 이후로 블로그가 너무 귀찮아져서 방치해놓았다가... 아주아주 오래간만에 올리는 포스팅입니다. 허허허 오랜만에 올리는 글이... 저만그런가요?ㅋㅋㅋㅋ (응) 은평구수제반찬 / 은평구아이반찬 전문 순수식탁 주소 서울특별시 은평구 역촌동 7-32 영업시간 09:00~20:00 예약/문의 카톡...,2020. 7. 21.
"서울에서 영주, 단양 당일치기 여행 코스[이른 아침 ~ 늦은 밤 도착] 영주 부석사...",<추천 여행지는 빨간 색으로 표시를 해둘게요> ▶서울 출발(은평구 연신내) → 중부고속도로 → 평택제천고속도로→ 중앙고속도로→ 영주 부석사(세계문화유산) → 랜드컴포트커피스토어 → 명동감자탕→ 소수서원 → 카페 산 → 집으로 귀가 영주 부석사 Previous image Next image 한국...,2021. 5. 31.
"5월 마지막 일상 _ 브레하,미씽유얼레디,은평구한옥마을","계속~줄곧~가보고싶었던 은평구 한옥마을 북한산의 정기가 느껴지고, 한옥이 아기자기 넘 귀여웠다 새로 지은 한옥이라 그런가, 웅장한 느낌보다는... 멀리 서울을 떠나와 여행온 느낌이 들었다 소나무도 울창하니 예뻤고 사람들이 돗자리 피고 휴식취하는 언덕이 있는데 사람이 한적해서 아무곳에...",2020. 5. 31.
"서울 당일코스 나들이 (정동, 덕수궁길,통인시장, 서촌, 은평 한옥마을, 명동야경)","서울에서 꼭 가고 싶은 곳이 있단다.(서촌과 정동길) 다행히, 서울 여행길에 우려는 없었고 생각 이상으로 서울 나들이가 완벽했다고 한다. 한국... 서촌을 구석구석 둘러보고 삼계탕으로 점심하기 서촌에서 은평구 한옥마을로 출발~ 서촌을 보고오니 만들어진 한옥마을은 볼 것이 없다며 대충...",2021. 1. 29.
은평구중국집 격이다른 분위기와 맛 중화요리 차이몬스터,나쵸와 함께 먹어보기도 하고 어찌보면 내가 남미의 어느 나라에 여행와서 저녁식사를 즐기는 듯한 착각을 일으키는 듯 색다른 깐풍기의 모습에... 새절역맛집 서울 은평구 불광천길 334 응암동 591-18 6호선 새절역 2번출구 5분안쪽 거리 02-305-7843 영업시간 월 ~ 토요일 17:00 ~ 01:00 일요일휴무,2020. 12. 29.
서울 연남동 당일치기(반나절) 여행 코스[점심 부터 저녁까지] 연남동 연하동 / 맥코이...,"<추천 여행지는 빨간 색으로 표시를 해둘게요> ▶서울 출발(은평구 연신내) →연남동 연하동→ 맥코이커피 → 엘리카메라 → 레이어드 연남 → 아오이토리 → 집으로 귀가 연하동 어느 순간부터 밥과 함꼐 먹는 덮밥을 좋아하게 되어, 덮밥집을 찾아갔어요 이미 연남동에서 핫한...",2021. 7. 5.
2021.03 서울여행,"2021.03.5 ~ 2021.03.07 2박3일 서울여행, 알찬일정으로 돌아 오고 싶었으나 이번여행은 숙취와 함께함ㅋㅋ 그래서 서울여행코스라기보단 서울 맛집... 그리고 술은 덜 깼지만 배가 고파서 맞은편에 김밥 포장하러옴, (우리 은평구 처음온거 맞음..) 그치만 누구보다 적응력 빠르게 먹을 거리는 찾아냈음...",2021. 3. 13.
접종주기 단축? 안내없이? 날짜변경? 정부가 아닌 sns안내? 신혼여행? 예약변경 방법?,아무런 안내도 없이 신종 코로나바이러스 감염증(코로나19) 2차 예방접종 날이 일주일 앞당겨져 신혼여행과 겹치게 됐다. 부랴부랴 예약일을 다시... 서울 은평구의 한 의원 관계자는 “정부에서 백신 정책을 바꿀 때마다 접종 업무를 하기 어려울 정도로 문의 전화가 계속 와서 힘들다”며 “당장...,2021. 9. 29.
[은평구 카페 추천] 구산 노트커피 가격도 착하고 인테리어도 이뻐요...,"앞에 09번 마을버스타는 분들을 위해 앉아있을 수 있게 의자들도 채워넣어주신 사장님의 하나하나 배려가 돋보이는 곳 ㅠㅠ ""노트커피"" 위치 : 서울특별시 은평구 구산동 368-40 마을버스 09번타고 임창빌라에서 내리시면 바로 앞에있어요 !!! 평일 9:30-22:00 주말 밑 공휴일 10:00-22:00 #은평구카페...",2020. 3. 5.
"3월 갈만한 국내여행지 추천 (feat. 버릇처럼, 열두달 여행)","그래도 꽃들과 상관없이 3월에 안전하게 떠날 수 있을만한 여행지들을 소개해볼까 해요. 버릇처럼, 열두 달 여행 저자 홍수진 출판 푸른향기 발매... 서울 은평구 은평 한옥마을 주소. 서울 은평구 진관동 127-27 지난번에도 소개해드린 은평 한옥마을이에요. 눈 내리는 날 이곳의 분위기가 어떨지...",2021. 2. 28.
서오릉 맛집/ 은평구 맛집 시골마루장작구이 가족모임 하기 좋은 곳!,"오리훈제 바비큐, 삼겹살 바비큐 등 도심 속에서 바비큐를 즐길 수 있는 서오릉 맛집 서울 가까이 위치한 은평구 맛집으로 추천하는 시골마루장작구이에서 캠핑 온 느낌, 여행 온 느낌 내시면서 맛있는 식사 어떠세요~ 서오릉 맛집 / 은평구 맛집 시골마루장작구이 서오릉점 주소 : 경기도 고양시...",2020. 8. 19.
은평구강아지분양 나를 웃게만드는 아이들,저는 서울사람이기 때문에 한강을 너무 많이 갔어서 고민을 많이 했지만 다른 지역에서 오는 친구들은 한강을 가본적이 없다고해서 한강구경이나... 이제는 산책길도 반려견과 함께 여행도 반려견과 함께 모든 날 모든 순간을 저희 은평구강아지분양 내품안의반려견 품견 친구들과 함께 해보세요...,2021. 8. 14.
은평구 산후조리원 올리비움 호텔식 시설 좋구놔~ 조리원 천국!,서울에 살고 있는 친구가 얼마 전 늦둥이를 가졌다는 말에 축하의 인사와 함께 나이 걱정에 예전과 다르니 산후조리 제대로 해야 할 것 같다고... 몇군데 생각하는 곳이 있는데 그중에 은평구 산후조리원 올리비움이 1순위라며 어떤지 봐달라는 말에 저도 자세히 들여다보았지요~ 덕분에 제가 둘째...,2020. 3. 26.
[엑소시스트 삼천궁] 2020년 쥐띠 & 소띠 신년운세 서울용한점집 은평구사주 일산신점...,하지만 술자리나 먼거리 여행 또 외국 나가시는 분들은몸을 많이 조심을 하셔야 될 것 같아요 쥐띠 소띠 서울용한점집 삼천궁 쥐띠 소띠는 대체으로 안좋은 수가 많이 있습니다. 위에 해당하시는 분들은 위에 말씀 드린 부분만 조심하시면 되지 않을까 싶어요. 또한 사주에 따라 개인의 차이가...,2020. 1. 21.
“신혼여행 피해서 백신 예약했는데…” 깜깜이 예약변경에 시민들 분통,"신혼여행과 겹치게 됐다. 부랴부랴 예약일을 다시 바꿨다. 정부가 기존 4주에서 6주로 늘어났던 mRNA계열 백신(화이자, 모더나)의 접종 주기를 1... 서울 은평구의 한 의원 관계자는 “정부에서 백신 정책을 바꿀 때마다 접종 업무를 하기 어려울 정도로 문의 전화가 계속 와서 힘들다”며 “당장...",2021. 9. 29.
서울 북한산 카라반여행,여기는 서울에 거의 끝쪽이라 그런가 조용하기도 조용하고 너무 좋았음 직원분리 은평구 한옥마을도 있으니깐 걸어서 갈만 하다고 하셔서 갈까 했는데 그냥 다음날 차타구감 ㅎㅎㅎㅎ완전 사람 바글바글 차 바글바글 그래서 그냥 주차도 되고 하는 코앞 카페 가서 커피 마시고 집으로...,2021. 8. 17.
[연신내 세이지] 가까운 일본여행의 심야식당 술집,안에 닭고기와 채소가 들어있다고 보시면 됩니다~ 샹그리아 하이볼 하이볼이 너무 맛있어서 (여자입맛) 이번엔 샹그리아로 주문했습니다. 이것도 여심저격이죠? 모히또 하이볼에 가까운 일본여행 어떠세요? 세이지 서울 은평구 연서로 27길 13-6 ☎ 02) 356-7910 평일 18:00~02:00 휴무 월요일 주차 불가능,2020. 7. 18.
투데이 용인3GO여행 여주반찬가게 (경기 여주) 서울 최고의 순대국 TOP5 (서울 장안동)...,"3GO> 용인 3GO 여행 대장금파크 031-337-3241 경기 용인시 처인구 백암면 용천드라마길 25-10 용인중앙시장 031-336-1110 경기 용인시 처인구... 02-305-0192 서울 은평구 응암동 300-10 대림시장 자58호 (응암동) (6호선) 새절역 1번 출구 842m 잔치국수, 비빔국수, 열무냉국수, 냉콩국수...",2020. 10. 9.
상암동호텔 시크호텔 여름은 여기서 즐기자,상암동호텔 시크호텔은 주변에 맛있는 돈까스집 갈비집도 있는데여 특히나 북한산 은평한옥마을도 있어서 데이트하고 여행하기 좋은... 제휴을 맺어서 더욱 안심하면서 즐기기 좋아요 https://hotelchic.modoo.at/ 호텔시크 서울 은평구 응암로11길 12-2 0507-1326-2044 #상암동호텔 #수색동호텔 #시크호텔,2021. 6. 10.
투데이 함양3GO여행 연잎한상(함양) 철갑상어 응암동반찬가게 회냉면(서울 제기역)...,"3GO - 함양 3GO 여행 거연정 경남 함양군 서하면 봉전리 055-960-5756 함양 용추 계곡 경남 함양군 안의면 용추휴양림길 71 옥연가 (연잎... 믿고 먹는 건강 반찬 한상가득 서울 은평구 응암로22길 29-1 1층 (응암동 239-15) 02-6465-6766 - 매일 11:00~20:00 - 매주 토,일 휴무...",2020. 7. 31.
[혼자 서울여행/한옥 휴식여행] 정갈하고 깔끔한 한옥 게스트하우스: 은화당...,"안녕하세요 전통한옥 알리미,하녹이입니다 자연을 찾아,힐링을 찾아 한옥으로 만들어진 공간을 찾는 분들이 많아지고 있는데요 오늘은 도심 속에서 휴식을 취할 수 있는 공간, 한옥 게스트하우스를 소개해보려 합니다 은화당(恩花堂) 서울 은평구 진관길 11-33 은평한옥마을 은화당은 푸르른 하늘...",2020. 10. 22.
은평구 삼겹살맛집 구산역맛집 그때그제주 흑돼지집,주택에 고깃집이 외관부터이쁘다 ~ 벌써 맛집 포스 신혼여행가서 너무 맛있게 먹어서 서울에서 그맛을 느낄수있을까 하다 찾아낸 곳 제주에도... 우도막걸리 캬~~~ 완전 제주를 느끼고 왔다구요 꼭 한번 가봐도 좋아요 적극 추천~~ #구산역맛집#제주흑돼지#삼겹살#오겹살#그때그제주흑돼지집#은평구맛집,2021. 7. 25.
김미경 은평구청장“광복절 연휴 집에서 머무르기”동참 호소,"서울 은평구(구청장 김미경)는 이번 광복절 연휴 기간이 코로나19 확산 방지의 분수령이라 보고 13일 ‘광복절 연휴 집에서 머무르기’ 온라인... “어른들이 멈추지 않으면 코로나19도 멈출 수 없습니다.” 이번 광복절 연휴에는 부디 이동과 여행을 자제하여 주시고, 집에 머물러 주시기를...",2021. 8. 13.
강원도 홍천으로 떠나는 1박 2일 펜캉스 가족여행,돌미나리집 - 펜션푸름 - 문배마을 - 일품간장게장 매년 여름이 되면 생일 겸 피서를 위해 짧게라도 가족들과 함께 여행을 떠난다. 예년 같았으면... 일품간장게장 주소: 서울 은평구 진흥로 125 전화번호: 02-388-2299 영업시간: 10:00 ~ 22:00 (명절 휴무) 정보: 주차 가능 평소 꽃게를 좋아하는 터라...,2021. 8. 31.
[외형복원]-아반떼MD 리어범퍼(교체)~앞범퍼도색-은평구판금도색+은평구외형복원...,"찾아오시는길 : 서울특별시 은평구 진흥로 87 (101호) 상담문의 : 02-388-4566, ***-****-**** 운영 시간 : AM 9:00 ~ PM 7:30 안녕하세요. 은평구 역촌동 판금도장, 외형복원, 프리미엄 광택, 유리막코팅, 스팀세차 전문 'JC 카케어' 입니다. 햇살좋은 주말 입니다!!!!여행은 못 가더라도 맘만은 여유 부리며...",2021. 3. 6.
"(미제살인, 사건.17)치과의사 모녀 살인사건’","‘치과의사 모녀 살인사건’은 95년 6월12일 서울 은평구 불광동 이도행씨의 아파트에서 당시 치과의사이던 부인 최수희씨와 한살 난 딸이 숨진 채... 사무장 채용에 대한 문제는 이미 다른 사람으로 결정이 난 상태였고, 사건이 일어나기 2주 전 온 가족이 장모와 함께 괌 여행을 다녀올 만큼...",2021. 9. 13.
아들 3형제와 씨름하는 언니가 봄맞이 기분전환으로 은평구 안경점...,엄마랑 아빠가 아이들 봐주신다고 해서 안경 맞추려고 은평구안경점 글라스바바응암점을 찾아갔습니다. 응암역 근처 본서부병원 사거리에 위치한 글라스바바 http://naver.me/xPtaqCSY 02-354-4567 영업시간 오전 10:00 ~ 오후 09:30 제가 이곳을 추천하는 가장 큰 이유중 하나가 바로 주차장입니다. 서울...,2020. 4. 22.
[서울 당일치기 여행] 남산,"[서울 당일치기 여행] 남산 2021년 1월, 남산에 올라갔다 왔습니다. 물론 저는 체력이 꽝이라 숭례문 앞에서 순환버스를 타고 올라갔습니다. 어렸을... 서울 도심과 은평구쪽이 보입니다. 남산타워 앞 전망대에서 바라본 모습입니다. 저멀리 청와대와 경복궁도 보이네요. 서울에 건물이 저렇게 많아도...",2021. 1. 19.
"서울 북한산 카라반 ""서울북한산럭셔리카라반&수영장글램핑""",& & 서울북한산력셔리카라반&수영장글램핑 주소 : 서울 은평구 진광동 326-1 전화번호 : ***-****-**** 입실 : 15:00 퇴실 : 11:00 안녕하세요 ㅎㅎ 휴가는... #북한산카라반 #북한산글램핑 #북한산 #커플여행 #놀러갈곳 #주말 #여름휴가 #서울카라반 #서울글램핑 #우중캠핑 #소고기 #반피 #와인 #숯불 #카라반...,2021. 8. 4.
서울 근교 한옥마을/ 주말에 갈만한곳/ 주말나들이좋은곳/은평구한옥마을/한옥카페...,한옥마을하면 전주한옥마을을 제일먼저 생각나지만 서울에서 적당한 거리에있는 은평구 한옥마을 다녀왔습니다^^ 요즘같이 날씨좋은날 한옥의... 주말에갈만한곳 #주말추천 #주말 #여행 #주말여행 #우리주말에뭐할까 #은평구한옥마을 #은평한옥마을 #은평한옥마을주차 #은평한옥마을빵집 #빵집,2020. 9. 30.
은평한옥마을 채효당에서의 여행!,"여기서 평생 이렇게 살다보면 계속해서 선을 행 할 수 있을 것 같은 느낌이었어요 ㅋㅋㅋㅋ 이번 여름 휴가 가지 않으려다 가까운곳으로 떠난 힐링여행이었는데 너무나 만족스럽고 좋은 곳을 알게되 행복하네요~ 은평 한옥마을, 채효당에서 제대로 힐링하는 시간 가져보세요^^ 주소: 서울 은평구...",2021. 8. 7.
은평구 롯데몰 언더씨킹덤,롯데월드 키즈파크 언더씨킹덤 기다리고 기다리던 서울여행 ㅎ 친구네 집들이도 가고 나의 주된 목적은 이수랑 약속했던 언더씨킹덤가기 ㅎㅎ 물고기 좋아하는 이수 안성맞춤 놀이동산이라 꼭 한번 데려다주고 싶었다 롯데월드 언더씨킹덤이래서 나는 당연히 잠실에 있을 줄 알았는데 은평구에...,2020. 1. 8.
은평구입원실한의원 차사고로 휴식취하고싶다면,그래서 가끔은 서울 근교로 차를 타고 드라이브를 하시는 분들도 많을 거라고 생각합니다. 하지만 이럴 때에는 모두들 한마음 한뜻이죠. 너무나도 답답한 마음을 해소 시키기 위해서 어딘가로 여행을 떠나고 싶어 합니다. 그래서인지 고속도로나 도로에 차의 이동량이 급격하게 증가하게 증가합니다....,2021. 9. 3.
서울 북한산 카라반 여행 다녀왔어요,"오늘은 여자친구와 기념일로 서울 북한산 카라반 글램핑 여행을 다녀온 이야기를 해보려고 해용~ 현재 4단계를 시행하기 전, 6월 말에 방문했어요 서울북한산럭셔리카라반&수영장글램핑 위치 : 서울특별시 은평구 진관동 326-1 전화 : ***-****-**** 영업시간 : 입실-15:00/퇴실-11:00 캠핑을 좋아하지만...",2021. 7. 15.
은평한옥마을 한옥숙박 게스트하우스 【채효당】,게스트하우스 채효당이라는 곳에서 하룻밤 머물게 되었는데 평일이라 그런지 사람도 거의 없고 1박 2일 코스로 여행하기 딱 좋았던 장소였어요. 단지 안에 역사박물관까지 있어 아이들 교육에도 유익했던 장소라 여러분들께 소개해볼게요~ 1.은평한옥마을 주소 : 서울 은평구 진관길 11-30 연락처...,2021. 3. 25.
은평한옥마을 게스트하우스 숙소 응정헌 가장 완벽했던 1박,"은평한옥마을 게스트하우스 응정헌 (조식, 룸, 피크닉세트) 요즘 국내여행 다니는 분들이 많지요!? 개인위생상 프라이빗한 독채숙소를 에약하는... 응정헌 서울 은평구 연서로50길 19 ***-****-**** 체크인 15:00~ / 체크아웃 ~11:00 피크닉세트, 조식, 일러스트그림 모두 포함 취사,흡연, 과도한 음주 금지...",2021. 7. 11.
"송추 오핀베이커리, 넓고 휴식하기 좋은 카페네요","서울 은평구에서 의정부로 가는 길에나오는 송추. 그곳을 지나다 보면 웅장한 크기때문에 눈길가는 빵집이 한군데 있습니다. 바로 송추... 송추가골과 친한지, 가마골 이용 영수증이 있으면 10프로 할인되더군요. 의외로 송추에 가볼 곳들이 많아 지루하지 않은 하루 여행이었습니다 ^^ """"",2021. 5. 14.
【앙금플라워케이크】 2호 사이즈 흑임자설기 반전케이크/서울동대문구서대문구은평구...,아버님이 그린컬러를 좋아하신다고 하셔서 맞춰 제작해드린 오늘의 케이크 그린컬러만 있으면 너무 심심할까봐 분홍빛 장미와 딸기꽃으로 포인트를 넣어드렸어요 떡도 맛있고 행사도 잘치루셨다는 후기까지 들려주신 고객님 가족여행도 즐겁게 다녀오시길바랍니다 주문문의는 카카오톡에서...,2021. 3. 3.
은평구 진관사,여행을 하면 계획하든 계획하지 않았든 그 지역에 사찰을 둘러보고 오는 게 저는 참 좋더라고요. 이 곳 진관사는 둘러 본 느낌이 참 단정한... 입구에 <은평구 한옥마을>이 조성되어 절에 들렀다가 나오시면서 예쁜 한옥마을 둘러보셔도 정말 좋을 거에요^^ 일관되는 이 느낌적인 느낌^^ 서울에서 만날...,2021. 5. 24.
서울 가볼만한 곳 :: 은평 한옥마을 당일치기로 다녀오기 좋은 곳이예요.,"은평한옥마을 옛날부터 한옥마을이 아니라 2012년 은평구 진관동 일대가 재개발 하면서 한옥 스테이, 까페, 음식점, 학교 등등 다양한 문화를 즐길... 속에서 커피 한 잔 해 보는것도 나쁘지 않을 것 같아요. 힐링공간도 많고 한옥마을 전체가 포토존이어서 서울 당일치기 여행으로 강추합니다.",2021. 10. 5.
"은평구 카페, 한옥마을 한눈에 담는 1인1잔",눈이 녹았겠지만- 대자연의 웅장함이 그대로 담긴 북한산과 은평한옥마을에서 느낀 그 감정은 절대 잊을 수 없을 것 같네요 :-) 모두 힘내길 바랍니다. [위치] 서울시 은평구 연서로 534 [영업시간] ※ 월요일 휴무 매일 10:00~21:30 [문의] 02-355-1111 ▲ 소품들 모두 마음에 들어요! 내돈후기 / 내돈내산,2020. 3. 11.
은평구임플란트 안전하고 건강하게,또한 내원하시는 환자분들의 해외여행 이력을 확인도 이러한 위생관리 강화에 포함하고 있습니다. 코로나-19로 다소 어수선한 사회분위기이긴... 은평구임플란트 잘 하는 치과로 알려진 보스톤 탑 치과 위치는 서울 지하철 3호선 연신내역 4번 출구에서 가까운 푸르덴샬투자증권 건물 3층으로 쉽게...,2021. 4. 14.
"[TV속 정보] 9월 17일(금) KBS2TV생생정보 , MBC생방송오늘저녁, SBS생방송투데이...",02-354-7788 서울 은평구 은평로 185 <이PD가 간다- 부여 밤 수확> ▶ 만석이네농장☎ *** **** **** 충남 부여군 남면 남성로 423 <엄마는... 3GO - 부여 3GO 여행 > ▶구드래나루터선착장 *황포돛배 ☎041-835-4689 충남 부여군 부여읍 나루터로 72 ▶고란사 ☎041-835-2062 충남 부여군...,2021. 9. 17.
10월의 서울 다누림관광 새소식을 알려드립니다! 월간 다누림,그리고 서울다누림 여행용 보조기기 대여 또한 정상적으로 운영된답니다. 다누림버스를 타고 떠나는 서울시티투어! 서울다누림투어가 오랜만에 돌아왔습니다. 10월의 코스는 은평구와 서대문구를 넘나드는 일정으로 짜여 있네요! 고즈넉한 가을 정취에 걸맞는 은평한옥마을과 한옥의 건축 구조...,2021. 9. 24.
은평구한의원 찾다 알게된 한방병원에서 후유증 케어 받기,은평구한의원 찾다 알게된 한방병원에서 후유증 케어 받기 안녕하세요 이웃님들! 한~창 휴가철이지만 이 시국에 마음 편히 멀리 여행은 가지 못하니 아쉬운대로 서울 근교 드라이브만 다녀 왔는데요! 서울로 올라오는 길에 작은 접촉사고가 나고 말았어요 다행히 겉으로 외상은 없고 근육통만 있는...,2021. 8. 23.
[서울여행] 은평한옥마을 / 북한산제빵소,"북한산은 여러방향에서 볼 수 있는데, 강북에서 마을버스 타고 올라가도 북한산 둘레길이 있고, 은평구 진관동에서 멋진 북한산 둘레길이 있다.... ㅎㅎ 다음에도 꼭 한번 와봐야지!! #서울여행 #한옥마을 #가족여행 #북한산제빵소 #1인1잔 #베이커리카페 #서울맛집 #서울빵맛집 #서울카페 #은평한옥마을",2020. 8. 4.
