header,contents,date
맛있는 쭈꾸미 땡기는 날♡,me/FaVzLYBm 서울 동대문구 무학로 144 친구들이랑 17000원씩 내고 맛나게 먹은 후기 ♡ #용두동맛집 #쭈꾸미맛집 #맛집 #맛집투어 #맛집스타그램 #맛집여행 #먹방 #맛집추천 #맛있는쭈꾸미 #낮술땡기는곳 #나정순할매쭈꾸미 #쭈꾸미골목 #낮술 #맛있는쭈꾸미볶음,2021. 3. 12.
"신혼여행 그 이후의 근황들 (동대문구 혼인신고, 신혼집 꾸미기, 삽교호, 강릉여행...",제주도 신혼여행을 다녀와서 우리는 바로 혼인신고를 했다! (무려 6달전 ^^..) 시댁근처 동대문구청에서 진행했는데 코로나라 침체된 분위기 속에서... 생신겸 서울 올라간 날 ! 어머님이 좋아하시던 앙금 플라워 떡케이크 주문했다! 청량리 디저트미 라는 곳에서 주문했는데 반나절 정도 지나고 나니...,2021. 3. 10.
얼땅쟈 [서울 중식당],"저는 여행이 너무 가고 싶더라고요 갑작스럽게 여행을 가지 못하게 되니까 더 가고 싶어지는 거 같답니다 그래서 오늘 소개해드릴 곳은 바로바로~!~!~!~!~!~!~!~! 서울 동대문구 경희대로 1길 8-7에 위치한 ""얼땅쟈""입니다! 지하철을 이용하시는 분들은 회기역 1번 출구에서 631m 이동하시면...",2021. 8. 20.
경희대 카페 l 노트북 하기 좋은 이디야,"아마 여기가 캠퍼스 안에 있지만 않았으면 단순한 #경희대카페 가 아닌, 일부러 찾아서 오는 여행명소 인스타카페가 되었을 거 같아요... 더... 집...집에 가야 하는데 경희대카페 이디야 매장정보 주소 서울 동대문구 경희대로 26 (회기동 1-5) 전화번호 02-966-6467 영업시간 오픈시간 모름 / 마감 19:50...",2021. 5. 16.
▩▩▩ 동대문구 소풍데이케어센터 (주야간보호센터) ▩▩▩ 【음악과함께추억여행】,"안녕하세요 소풍데이케어센터입니다 음악수업을 통하여 새로운 노래를 배우고, 같이 불러보았습니다 ☎. 02-2213-0076 전화주시면 친절하게 상담 도와드리겠습니다 서울특별시 동대문구 한천로 137 -소풍데이케어센터-",2020. 4. 3.
경희대네일 수아네일에서 여름 페디했어요,"엄지발톱은 무광으로, 나머지 발가락은 반짝반짝 펄감 있는 걸로 마무리해준답니다. 동남아 여행 가고 싶은, 해변이 생각나는 시원해 보이는 디자인입니다:D 확실히 페디큐어를 받고 나니 맨발도 자신 있어졌어요!!! 경희대네일은 수아에서 받아보세요! 서울 동대문구 회기로149 2층 02-964-1214",2020. 6. 15.
"[서울교육소식통] ‘책, 쉼, 만남’의 독서 축제로 초대합니다!","(금)~선착순 마감 동대문구 한 도서관 한 책 읽기 선정도서 「긴긴밤」 루리 저자 강연회 서대문 도서관 어린이 미술 ○ (줌) 10.13.~12.15.(매주 수) 16:30~17:30 16명 9.23.(목)~선착순 마감 무늬, 정물, 명화등을 활용한 그리기수업 동대문 도서관 친구와 함께하는 세계문화여행 × 10.16.~10.30....",2021. 9. 30.
살펴보고 선택한 장안동 맛집,다음번에 저희 모이할때 여기서 케이크 주문하나 해서 여행가자구 저녁에 한잔하며 먹기에 너무 좋지 않겠냐며 이야기하기도 했었네요~ 4. 엘더키친 주소 : 서울 동대문구 장한로25길 45 전화번호 : ***-****-**** 영업시간 : 평일 11:30 -21:00/ 브레이크타임 15:00 - 17:00 / 일요일 휴무 대표메뉴...,2020. 10. 26.
서울 탕수육 맛집 전농동 신락원 since1965,"저희 가족은 여행을 가면, 전국 어디를 가던지 그 지역의 탕수육 맛집은 찾아서 꼭 가보는 편이에요 ^^ 아이들이 탕수육과 짜장면을 워낙에 좋아해서요~ 아이들 먹는거 보면, 이집이 맛집이다 아니다 딱 알수 있을 정도예요 ^^ 몇년전 지인의 추천으로 알게된 서울 동대문구 전농동의 신락원...",2021. 6. 27.
[서울시내버스여행 ] 2015번,"여행이 가고 싶지만, 그렇게 하지 못하는 서울 사람들을 위한. 서울의 잘 모르는 곳까지 구석구석, 여행하고 싶은 사람들을 위한, 서울에 살지... 동부시장 : 서울시 동대문구 답십리동 495-1에 있는 재래시장이다. 동대문역사문화공원 : 서울특별시 중구에 있는 공원. 2009년 10월에 개장하였다....",2020. 7. 26.
캠퍼스투어012 서울시립대학교 지식의 전당을 여행하는 히치하이커를 위한 안내서,"테마여행신문 TTN Korea 캠퍼스투어(Campus Tour)와 함께 어제도, 오늘도, 내일도 멋진 진리여행을! B 개교 100주년(2018) : 서울시립대는 1918년... 평평한 동대문구 전농동에 입점했기 때문입니다. 지하철역(청량리역, 회기역)에서 다소 멀다는 점이 단점이긴 합니다만, 배봉산 서편에...",2020. 12. 21.
"쏘렌토 인젝터리빌드 작업포함(DPF, 흡기클리닝 까지) 완벽 3종세트 ~","마음으로 여행 계획하시면 좋을듯 합니다 저희도 이번주말 실천해 보려 합니다. 쏘렌토 디젤차량 꼭 필요한 3종세트 작업후, 새롭게 태어날... 서울 동대문구 장안동 456-1 #쏘렌토인젝터수리 #쏘렌토인젝터 #인젝터리빌드 #dpf클리닝 #흡기클리닝 #디젤인젝터클리닝 #쏘렌토인젝터클리닝",2021. 3. 26.
시민이 발로 찾은 서울 골목길 30선,한 권으로 떠나는 서울여행 [서울 골목길 30선] 서울시의 숨겨진 골목을 한 눈에 들여다 볼 수 있는 '시민이 발로 찾은 서울 골목길 명소 30선... 창신동 절벽골목 - 동대문구 창신 1~3동 '시민이 발로 찾은 서울 골목길 명소 30선'(한) '시민이 발로 찾은 서울 골목길 명소 30선'(중) '시민이 발로...,2020. 6. 1.
서울여행 발길 따라다녀본 서울대병원 - 창경궁,"대한민국여행 궁궐 좀 복잡한데? 발길 따라 창경궁 글, 사진 영상 ⓒ 구석구석뚜벅뚜벅 풍류기행 서울대병원을 수년 동안 다니면서 이곳을 방문한... 내가 동대문구에서 어린 시절을 보냈는데, 그때는 창경원이라고 불리었고 그 창경원에는 온갖 동물은 가득한 동물원과 식물원은 물론이거니와...",2021. 5. 23.
가을꽃바구니 예쁜꽃바구니 전농동꽃집 장안동꽃집 답십리꽃집,#가을꽃바구니 #여자친구선물 #예쁜꽃선물 #카라 #율두스장미 가을하늘에 기분이 좋아지는 요즘입니다 코로나만 아니였다면 정말 여행하기 더없이... 장안동꽃집 #동대문구꽃배달 #서울예쁜꽃집 #배봉사거리꽃집 #당일주문 #당일배송 #당일꽃배달 #휘경동꽃집 #회기역꽃집 #장한평꽃집 #답십리꽃집...,2021. 9. 26.
아동미술대회추천 대한민국 학생'어린이 미술대회 공모전,"http://www.waaeo.or.kr/ 응모자격 대한민국 국적의 유치부, 초등부 어린이 및 청소년 ( 해외여행에 참가할 수 있는 어린이 및 청소년 ) 구분... 02633 서울특별시 동대문구 천호대로 395-2 창도빌딩 402호 접수 메일 *****@*****.*** 팩스 01-2243-4953 전화 02-2244-0847~8 더 자세한 사항은 홈페이지를 아래...",2021. 9. 27.
배움의 열정이 가득한 동대문구학교 찾고 있다면,"서울 각지에서 통학이 가능한 편리한 교통편이 진형의 강점이라 할 수 있지요. 청소년 학생 분들이라면 진형에 대해 아셔야 할 점이 있습니다.... 수학여행, 동아리활동, 가을축제, 백일장, 소풍 등 소중한 학창시절의 추억까지 쌓을 수 있는 동대문구학교를 알아보신다면 진형에서 함께 공부해보시면...",2020. 7. 31.
[회기] 진짜 온 듯한 베트남 음식점 '목꾸안',마치 현지에나 있을 법한 화려한 색깔과 앞에 크게 있는 나무 덕분에 정말 여행을 온 기분이 들게 하는 곳. 가야지 가야지하다가 동네 아는 형과... 너무 기분이 좋은 베트남 음식점 '목꾸안'. 주변에서 특별한 식사를 하고 싶다면 방문해보시길. 상호 : 목꾸안 주소 : 서울특별시 동대문구 회기로 135,2021. 8. 24.
"[서울/인천] 먹방여행-청량리 맛집-할머니냉면,광주식당 & 인천맛집-부암갈비,장수손만두","먹방 여행 타이틀은 (맛있는 녀석들 투어!!) 2박 3일 불사지름 출발전 광주에서의 아침밥! 아침 일찍부터 위를 다스리기 위해 종종 가던 나의 맛집 <영명국밥> 닭발 육수를 내서 아주 맛이 깰끔하고, 개운하고, 얼큰하고, 시원하고 아주 느무 좋당 서울 도착후 첫 코스! <할머니 냉면> 서울 동대문구...",2021. 2. 4.
"서울 도봉, 도봉구, 은평, 은평구, 서대문... 동대문, 동대문구, 중랑, 중랑구, 종로...","안녕하세요 블로그 지기 샌디 오빠입니다 (샌디는 하늘나라 여행 중인 저희 아이에요) 보통 집에서 생활하는 반려묘는 수명이 15~20살 정도라고... 특히 서울 도봉, 도봉구, 은평, 은평구, 서대문, 서대문구, 노원, 노원구, 성북, 성북구, 동대문, 동대문구, 중랑, 중랑구, 종로, 종로구, 중구, 강북구에서...",2021. 5. 23.
"서울에 예술 한 스푼 더하다! '서울, 25부작'","도봉구, 동대문구, 마포구, 서대문구, 성동구, 송파구, 양천구, 은평구, 종로구 등)에 작품 12점이 새롭게 선을 보였다. 서울시 전역에 산재해 있는... 광장 여행무대, 팀 ‘공간’ 작 ‘공감산수’, 시각장애 예술인들과 시각 예술인들의 협업으로 완성됐다 ⓒ조수봉 서대문구 홍제천 인공폭포...",2021. 8. 24.
"서울 블루보틀보다 맛있던 커피 동대문구 답십리 전농동 커피나인 ""COFFEE NINE""","아마도 그때는 배낭여행중이라 배고픔에.. 신문물맛에 느낌상 맛있었던 걸까요 아무튼 내입맛! 내 남자친구 입맛! 블루보틀보다 맛있는 커피 커피나인 커피나인 위치 , 주소 답십리점 이태원점 서울에는 이렇게 두 곳이 있답니다 제가 방문한 곳은 앞서 말씀드렸다시피 답십리점! 남자친구가 답십리...",2020. 7. 14.
동대문구 벤츠 서비스센터 굿즈 샵 방문,벤츠 골프용품 벤츠로고가 고급스러운 여행가방과 골프장갑인데요 골프는 안치지만 탐나네요 캐리어는 가벼운여행갈때 좋을것같아요 화이트... 주소:서울 성동구 용답동 238-8 영업시간: 평일 09:00 - 18:00 주말 09:00 - 13:00 02- 2244-5578 #벤츠서비스센터#냉각수교체#동대문구벤츠서비스센터...,2021. 5. 7.
웨딩포토 전자액자 넷기어 뮤럴디지털 캔버스 신기해,"웨딩사진, 여행사진 등도 클라우드에 업로드 하거나 SD를 이용해서 똑같이 감상할 수 있다니 신박했다. 캔버스 자체의 크기가 16:9비율로... ( 서울 동대문구 왕산로 3가길 5) 블루스퀘어 콘서트홀 & 북카페 서울시 용산구 이태원로 294 블루스퀘어(한남동 727-56) 궁 클래식 산후조리원...",2020. 8. 1.
"비즈니스와 교육용 두마리 토끼를 잡은 노트북 겸 테블릿 ""MS 서피스 고 LTE""",저희 집이 위치한 서울 동대문구 국립산림과학원 인근에서 LG U+ 기준으로 측정 해 보면 최대 다운로드 139~140Mbps 까지 나오는 것을... 특히 WIFI 버전과 다르게 사무실이나 집의 PC와 함께 사용하며 인터넷강의시청/여행/출장/외부작업 등의 이동하면서 사용할 수 있는...,2021. 9. 13.
"인천 영흥도펜션 빠쎄꼼뽀제 수영장까지 완벽한 오션뷰, 십리포 일몰","(섬이지만 대교로 다 연결되어 있어 여행지 이동이 편합니다) *영흥도와 선재도는 인천, 대부도는 안산입니다. 이번 여행엔 영흥도 수영장 펜션인... 서울 동대문구 출발해서 영흥도까지 2시간 정도 걸렸습니다. (특히 오이도에서 대부도 넘어가는 대교에서 차가 엄청 막혔어요) 선재도에서 영흥도...",2021. 7. 20.
"[서울풍물시장] (서울시 성동구,동대문구,종로구) 왕십리역-한양대-한양시장-곱창거리...",코스 왕십리역-한양대-한양시장-곱창거리-마장동축산물시장-약령시장-순대국집-이발소-서울풍물시장-동묘시장-완구시장-동대문역 서울의 갬성 시장 구경하며 걷기 코스 1. 왕십리역 세종시에서 아침에 버스타고 출발하는데 무지개가 즐거운 여행 길을 배웅해줌 왕십리역 화장실에 동물 드립...,2021. 2. 5.
[서울시내버스여행 ] 2013번,"대중교통을 통해 다양한 서울의 맛을 느껴보는 서울 시내버스 여행. 안녕하세요! 스마트에드입니다. 지금은 겸재교가 완성되어 겸재로 구간을... 있으며, 서울특별시 강북 지역의 중심 터미널 가운데 하나다. 배봉산 동대문구 전농동에 있는 표고 110m의 산이다. 서울시립대학교가 위치해 있으며...",2020. 7. 19.
전통·감성·추억의 서울여행…'오래가게' 21곳 선정,"특히 시민들이 코로나19로 지친 마음을 짧은 여행으로 달랠 수 있도록 '한방·그린·전통·미식·맞춤·추억·감성' 7가지 힐링 테마로 분류했다. '한방 힐링' 테마로는 동대문구 서울약령시 '효성한의원'에서 한방차를 맛본 후 한의약박물관에서 다양한 전시를 감상하고, 조선 시대 의료인 복장...",2020. 11. 10.
"'재택근무, 경영관리' 경리나라로 해결했습니다!","(주)제니스트래블 / 여행서비스업 서울 동대문구 / 5인 미만 / 경리나라 이전프로그램 : 엑셀/수기 코로나 직격탄으로 힘든 시기를 지나고 있는 여행 업계. 하지만 오히려 지금이 회사를 정리하고 다지기 좋은 시기라 말하는 ㈜제니스트래블의 경영진을 만나고 왔다. 위기를 기회로, 경리나라가...",2021. 7. 30.
동대문구 유니폼세탁 호텔관리의 첫걸음,요즘은 여행을 갈 수 없다 보니 많은 분들이 호캉스를 선택하여 휴가 및 여가를 즐기고 있는 추세입니다. 그에 따라서 서울 곳곳의 멋진 호텔들은... 동대문구는 특히 외국인 손님들에게 인기가 있는 관광명소이기도 합니다. 현재 전 세계적으로 어려운 상황이라고는 해도 끊임없이 많은 사람들이...,2021. 4. 30.
서울전연령렌트카 후기 및 여행,일단 많은곳을 알아보고 후기를 보고 서울 동대문구 답십리동에 위치한 스타렌트카를 이용해 본 후기를 솔직 하게 리뷰를 해볼라고 합니다. 일단 저는 k5신형을 1주일전에 예약을 하였는데 직원들 말씀을 들어보니 k5신형은 미리 예약을 안하시면 예약하기 힘들 수 있으니 미리 예약문의 하시고...,2020. 9. 9.
[청년뉴스] 2021-07-12 청년뉴스,"경북도와 상생 협약 연합뉴스 4 아산시, '국민취업지원' 서비스 본격 운영 충청뉴스 5 동대문구, 서울청년센터 동대문오랑에서 ‘AI·VR... 교육…100% 국비지원 브릿지경제 7 부산 청년지원사업 위닛캠퍼스 참여자 모집 연합뉴스 8 관광공사, MZ세대 겨냥 DMZ 여행상품 공모전 뉴시스",2021. 7. 12.
장안동 케이크 히포케이크 생일파티 준비,나의 여행메이트가 3월에 생일이었는데 지난번 만남에 케이끼에 초부는거 못해서 아쉬운 마음에 준비해보게 되었다. ㅋㅋㅋ 원래 생일은 한... 장안동케이크 히포케이크 정보 *위치: 서울 동대문구 장안동 377-9 *연락처: 0507-1493-2202 *영업시간 화~금 12:00-20:00 토 11:30-17:00 월12:00-19:00 일요일...,2021. 3. 24.
[유네스코 문화유산 조선왕릉-4] 결이 다른 초록 왕릉의 품격 화성 융건릉,"예전에 여행처럼 다녀왔을 때도, 왕릉 수첩을 지참하고 탐방을 다니는 지금도 이곳처럼 조선왕릉의 품격이 느껴지는 곳은 없었다. 소나무와... 정조가 그의 아버지 사도세자의 묘를 서울 동대문구 배봉산에서 현재의 자리로 옮긴 후 이듬해에 조성한 원형의 연못이다. '용의 여의주' 형상을 하고 있는...",2021. 5. 13.
"""제주벚꽃명소"" 올해도 전농로 벚꽃 축제는 패스네요",위에 보이는 지도 가운데 가로가 전농로입니다. 서울 동대문구에도 전농로가 있으니 조심하시구요. 엇그제 먹은 저녁... 요즘은 막걸리가 먹기 편하더라구요. 침전 버전이죠. 즐거운 하루 되시기 바랍니다. #제주도벛꽃명소 #제주전농로벚꽃축제 #제주벚꽃볼만한곳 #제주여행추천 #제주벚꽃거리,2021. 3. 24.
사적 436호 서울 선농단 (안암오거리 모노),그리고 근처 안암오거리에 있는 모노라는 스시집에 방문하였다. 내가 먹은 것은 특초밥이고 흰살생선의 식감이 매우 좋았다. 다음에 가시 방문한다면 광어초밥 위주로 먹을 생각이다. #사적 #436호 #선농단 #서울 #동대문구 #여행 #안암 #맛집 #모노 #주차,2020. 10. 25.
"방구석 서울 여행 1탄! 나만의 아지트, 흥인지문공원","회사는 장충동, 집이 동대문구 쪽이었을 때 틈만 나면 갔다. 날이 좋거나 구름이 예쁠 때도, 노을을 보기 위해서도, 서울 야경을 보고 싶을 때도... #방구석여행 #서울여행 #서울기록 #뚜벅이여행자 #서울가볼만하곳 #나만의아지트 #서울야경명소 #서울야경 #동대문 #동대문아경 #흥인지문공원...",2020. 4. 12.
서울 식용유납품 폐식용유 폐식용유수거... 성동구 중구 동대문구 광진구 용산구 강남구...,마장동 #서울숲 #뚝섬 #왕십리 #한양대학교 #성수동 #도선동 #사근동 #도선동 #중구식용유납품 #중구폐식용유수거 #중구폐유수거 #중구폐식용유 #청구 #충무로 #을지로 #퇴계로 #남산 #장충동 #명동 #남대문시장 #신당동 #중앙시장 #동대문구식용유납품 #동대문구폐식용유수거 #동대문구폐유수거...,2021. 3. 15.
광나루곱창전골 /광진구곱창/아차산냉면/서울회냉면/장안동닭갈비/동대문구닭갈비...,"ㅋㅋㅋㅋㅋ 속초에서먹는 회냉면 같다고 ㅎㅎㅎ 서울에서 회냉면 맛있게 먹어본적이 없는데 맛있다고 ! 처음먹을땐 좋았는데, 갑자기 몸이... 마스크를 써야하는 현실 날도 따뜻한데 , 어디 여행도 못가고 마스크쓰면 숨차고 ㅋㅋㅋㅋ 언제쯤 괜찮아질지 !!! - 주말에 날씨가 너무좋아서 강아지 산책...",2020. 3. 9.
[회기동 나들이] 목꾸안&천장산하늘길&국립산림과학원(feat.홍릉수목원),동생의 꼬득임으로 회기동 나오신 언니님은 세번의 베트남 여행의 좋은 트래블 메이트. 맛이 어떠심? 베트남 가고 싶지?? 여행이 고프신 여사님.... 국립산림과학원&홍릉수목원 서울 동대문구 회기로 57 / 평일 10:30 - 15:30 / 주말 09:00 - 18:00 / 공휴일 및 월요일 휴무 이제 산을 다 내려왔다고 생각했는데....,2021. 5. 29.
수원나들이 : 화성행궁 - 정조의 아버지 사랑이 빚어낸 신도시 건설(랜선여행),"운한각에 봉안되어 있는 어진(임금의 초상화)는 2004년에 다시 그린 것으로, 원래 있던 것은 1908년에 서울로 옮겨졌으나 1954년 부산 피난처에서... 화성행궁은 효성이 지극했던 정조가 아버지 사도세자(장헌세자)의 묘소(현재 융릉)를 옮기면서(동대문구 배봉산에서 화산으로) 수원 신도시를...",2021. 10. 4.
2021-09-4/5 동대문구,"경희대학교서울캠퍼스평화의전당 공연보기 경희대 근처 박물관 , 홍릉숲, 세종대왕 박물관 보기 10분 이동 14:00~15:00 돈카츠 시키카츠에서 점심 또는 청량리 먹자골목에서 순대국 점심 20분이동 15:30~17:00 경동시장에서 주전부리 먹으면서 여행...",2021. 9. 4.
"[경기도 언택트 여행지] 정조가 남긴 조선의 효심, 세계문화유산 화성 융·건릉","여행이나 나들이를 떠나기에는 그리 적합한 시기는 아닙니다. 하지만 우리 도민 여러분들이 힘을 모아 지금의 위기를 이겨내고, 다시 코로나19가... 사도세자의 묘는 현재의 서울 동대문구에 위치한 배봉산 자락에 조성되었는데요, 이후 묘의 이름은 수은묘라 하였으며, 1776년 정조가 왕위에...",2020. 9. 3.
장안동속눈썹 잘하는 그집 로코네로.,자주 붙이고 싶은데 원채 속눈썹이 ㅠㅠ 얇고 붙일때마다 사라져 가는 기분이 들어서 여행가기전쯤- 기분 내고 싶을 때 붙이곤 합니당. 21년의... 로코네로 전화번호 0507-1331-0638 주소 서울 동대문구 장한로28가길 45 4층 운영시간 평일 11:00 - 21:00 토요일 11:00 - 21:00 일요일 휴무 공휴일 11:00 - 19...,2021. 2. 23.
"2020년 7월 31일 생방송 투데이-보고먹고즐기고(함양여행), 우리 동네 반찬 가게(서울...",3GO - 함양 3GO 여행 편 ▶<거연정> 주소 : 경남 함양군 서하면 봉전리 번호 : 055-960-5756 ▶<함양 용추 계곡> 주소 : 경남 함양군 안의면... 빅데이터 랭킹 맛집 - 수도권 최고의 회냉면 TOP 5 편 ▶<함경면옥> 주소 : 서울 동대문구 왕산로 87 번호 : 02-921-7300 * 이외의...,2020. 7. 31.
[여행] 서울시 동대문구 숭인동 동묘(東廟)에 얽힌 사연 동묘엔 여(呂)씨 성을 가진...,#여행종묘 #관운장 #관우신뢰 #관우재물 #동묘공원 #서울동묘 #동관왕묘 #남관왕묘 #멋진제임스 #앨빈토플러 #허경영강연 #허경영팩트 #장국진박사 앨빈 토플러 한국보고서 https://youtu.be/hfJQEN5Nw3I 허경영강연 1261회 '허경영은 무슨 돈으로 18세부터 150만원을 평생 주는가' (2020.12.12) https://youtu.be...,2021. 2. 9.
건강하고 행복한 혼라이프를 위한 1인 가구 프로그램 66!,"경제·자립 동대문구 중장년 구직활동 및 진로설정 ""탄탄대로 프로젝트"" 동작구 중장년층 대상 ""재무설계 교육"" 사회적 관계망 노원구 자기돌봄 및... 가"" 여행 마포구 매봉산, 난지천공원 산책 ""걸어서 마포 속으로"" 양천구 온라인 나들이 프로그램 ""랜선 나들이"" 여가생활 서대문구 운동습관 형성...",2021. 10. 7.
서울 풍경 1954,"서울 명동에서 복구 작업하는 인부들과 건물 옆을 지나는 여인, 1954 선거사무소, 1954 민의원 선거에 입후보한 후보자 김용우의 동대문구... 신혼여행을 갔을 때... 마릴린 먼로는 군대를 위문하기 위해 한국으로 우회했다. 그녀는 4일 동안 총 100,000명 이상의 미군들을 위해서 10여...",2021. 9. 22.
"서울 애견동반 스튜디오 TOP 7 추천, 증멍사진 찰칵!","데이아 서울 동대문구 난계로30길 59 A룸 네번째로 소개해드릴 공간은 전문사진관 느낌 뿜뿜하는 동대문구의 애견동반 스튜디오 '스튜디오... 코로나로 여행을 못가서 아쉬운 분들, 이곳에서 반려동물과 함께 컨셉 사진을 찍어보시는 건 어떨까요?~ 남는 건 역시 사진뿐 이 외에도 깔끔한...",2021. 7. 22.
이젠 동네투어가 대세! 서울 동북권 '오래가게'를 추천해주세요!,"이러한 시대 상황에 발맞춰 서울시에서는 서북권‧서남권에 이어, 동북권* 일대를 대상으로 우리 동네만의 매력을 간직한 오래가게를 발굴, 힐링여행 스토리로 엮어낼 계획이에요. *동북권 성북구, 강북구, 도봉구, 노원구, 중랑구, 광진구, 성동구, 동대문구 등 8개 자치구 서울 동북권...",2020. 7. 21.
놀먹일상/ 서울 데이트코스 맛집 카페 추천 [하남 스타필드 에베레스트/이십사절기...,"없어져서 슬픔 ㅠㅠ 여기는 회기역 막걸리 맛집 #이모네왕파전 이에요 이모네왕파전 02-959-8318 서울 동대문구 회기로28길 12-3 매일 11:00 - 05:00... 오늘은 여기까지 #서울데이트코스추천 #서울맛집추천 #서울카페추천 마무리하구요, 시간 좀 남았으니 이제 부랴부랴 남은 해외여행들 포스팅...",2021. 8. 12.
"[스누피의 한국여행 86.56] 서울 종로구 숭인2동 동묘, 동묘앞역, 서울풍물시장...",⚽ 서울풍물시장 (Seoul Folk Flea Market) ♥ 서울풍물시장은 서울시 동대문구 신설동 천호대로4길 21번지에 위치하고 있다. 신설동이라는 지명은 조선시대에 동부숭신방에 새로 설치한 동네라는 의미로 신설계로 이름을 지었다가 갑오개혁때 신설동으로 바뀌었다고 한다. 우리말로는 새말...,2021. 5. 17.
서울 심야식당 추천 BEST,"정말 여행 온 기분을 느낄 수 있어요. 다찌 좌석도 있고, 그래서 마술도 나쁘지 않습니다. 혼자 오면 부담스럽지 않아서 잘하는 것도 많다.... 운영 시간 : 금요일, 토요일 17:00 05:00 라스트 오더 04:00 / 일요일 휴일 17:00 05:00 라스트 오더 03:00 전화 번호 : 029696212 위치 : 서울 동대문구...",2021. 7. 12.
"[TV속 정보] 5월 26일 (수) 2TV생생정보, MBC생방송오늘저녁, SBS생방송투데이 나온...","02-963-6880 서울 동대문구 홍릉로1길 46 ▶ 고집쎈강정 ☎ 0507-1351-1447 서울 동대문구 고산자로36길 3 경동시장 신관 3층 엘레베이터 옆... 곰미디어 <여행본능, 섬 - 퍼플교로 이어진 두 섬 ‘반월도 & 박지도’> ▶천사대교 전남 신안군 암태면 당사리 ▶퍼플섬 전남 신안군...",2021. 5. 26.
