header,contents,date
20.10.17.토.2박 3일 여수여행 3일째;여수에서 야경을 감상하며 김포공항으로...,야경 서울 금천구 가산동 하늘 위 야경 구로구 개봉동 하늘 위 야경 부천시 오정구 하늘 위 야경 강서구 과해동 하늘위에서 착륙을 합니다~ 김포공항에 안전하게 착륙했어요~ 그동한 수많은 여행을 해봤지만 비행기 이.착륙에 불안증은 없었는데 볼라벤 태풍으로 제주에서 김포로.. 김포에서 공비행...,2020. 10. 26.
"공포의 택시기사···여성승객에 대뜸 ""저기 모텔 가고싶다""",지난달 11일 오후 5시쯤 노모(22ㆍ여)씨는 부산 여행 마지막 날 택시로 부산역으로 이동하던 중 기사의 말을 듣고 깜짝 놀랐다. 노씨는 “택시... 서울 금천구 가산동 부근에서 택시를 탄 박모(28ㆍ여)씨는 13분간 택시 기사의 막말과 성희롱에 시달렸다. 박씨는 “친구 4명과 함께 택시를 탔는데...,2020. 9. 6.
"[서울 근교 나들이] 역사 여행, ""8일간의 화성행차"" 3일차,4일차_수원화성","지난 2편의 블로그에서 창덕궁을 떠나 지하철 1호선과 비슷한 노선으로 노량진에서 점심먹고 시흥행궁에서 첫날을 보낸 1일차와, 금천구... 여기까지 읽어주신 모든 분들 감사합니다.^^ #서울근교나들이 #근교여행 #수원여행 #화성행차 #수원화성 #체험학습 #체험여행 #역사여행 #화성행궁...",2021. 5. 1.
금천구 독산동꽃집 :: 수국꽃다발 :: 여름여름한 느낌 너무나 풍성하고 사랑스러워요,"#오후의플로라 #금천구꽃집 #독산동꽃집 #금천구수국꽃다발 #독산동수국꽃다발 #독산동꽃집추천 여름여름한 수국꽃다발 여름에는 수국을보러 여행... 상담, 문의는 편하게 주세요오 :) #금천구꽃배달 #금천구꽃선물 #독산동꽃선물 #금천구꽃바구니 #독산동꽃바구니 #서울예쁜꽃집...",2020. 8. 14.
추석 차량 타이어 점검 및 휴무 안내 영등포타이어 구로구타이어 구로타이어 금천구타...,"9월 20일 , 9월 21일(추석 당일) 휴무입니다 ! 안전한 귀성길 , 가족여행을 위한 차량점검은 꼭 받아보시길 바랍니다 !! 예약 문의 전화 ☎ 02 - 3667 - 5866 ☎ *** - **** - **** 주소 신 주소 : 서울특별시 동작구 상도로 15 구 주소 : 서울특별시 동작구 대방동 398 - 8 풍요로운 한가위 되세요 !!",2021. 8. 31.
3/10 쌍교숯불갈비 금천점에서 점심으로 떡갈비 냠냠 ♡,레알 떡갈비는 남도지 전에 가족여행으로 갔던 광주에서 먹었던 떡갈비 진짜 인생떡갈비였던게 기억난다! 앞에 주차장도 있고 이렇게 메뉴판이... 다음에는 아빠랑도 같이 가야지 ♡ (이상으로 내돈주고 사먹은 후기 끝! 가족 외식하기 좋음^ㅡ^) TEL: 02-859-1193 주소: 서울 금천구 시흥대로 435 (독산동),2020. 4. 12.
[금천구 시흥동 유아 & 영재 & 성인 취미 & 입시 피아노 세종 아카데미 음악 학원]...,보다가 여행 짐 챙기고 칼국수 먹고 운전 5분 하고 또 저녁 먹을 준비한 건데 하루가 왜 이리 길었던 걸까요 ㅎㅎㅎ 암튼 배불리 먹고 이렇게 하루를 마무리했답니다. 역시 다음날 서울 올라오는 길도 섬에서 섬에서 빠져나와야만 정체가 풀리더라고요 오는 길은 3시간은 걸린 것 같아요. 그리고...,2020. 7. 20.
"[서울 근교 나들이] 역사 여행, ""8일간의 화성행차"" 2일차_화성행궁 도착",◎ 안양 코스 : 금천구 시흥동을 출발 → 안양역 → 사근행궁(의왕시 고천동272-1) - 반나절이지만 꽤 먼 거리를 달려왔습니다. 비도 오는데 말이죠.... #서울근교나들이 #근교여행 #수원여행 #화성행차 #체험학습 #체험여행 #역사여행 #사근행궁 #노송지대 #지지대쉼터 #장안문 #신풍루 #화성행궁,2021. 4. 26.
행복한 가족의 18k가족반지에 담은 행복 Castor Pollux,가족 여행을 가셨나 봅니다 멋집니다~~ 그저 부럽기만 하네요~~ 살다 보니 정말 가족과 함께 하기 쉽지는 않네요 ㅠㅠ 그래도 아이들이 아기... ㅎㅎ 서울 금천구로~ 4인 가족반지 나침반반지 https://blog.naver.com/jewelry4989/221759560816 가족이 함께한 불교반지~ https://blog.naver.com/jewelry4989/221518036250,2020. 10. 21.
알면 쓸모 있는 서울 역사여행 연관 지식,알면 쓸모 있는 서울 역사여행 연관 지식 오늘도 서울투어 관련 공부를 위해 방문해주신 여러분 반갑습니다! ^^ 오늘처럼 지속적으로 노력하면... 배우러 찾아오신다면 앞으로도 알찬 정보들로 여러분을 만족시켜 드리도록 하겠습니다~^^ #금천구부동산 #가산동부동산 #두산위브아파트전세...,2020. 12. 15.
[어디가지_은]금천구맛집/금천중국집... 칭따오/퇴근길행복/70년전통중국집/금천구청맛집,추억의동네 #금천구청 #시흥동 을 다녀왔어요 이동네에서 같이 회사다니던게 엊그제? 같진 않고 벌써 퇴사한지 5년이 다되가네요 ㅋㅋㅋㅋㅋㅋㅋ소름 우리 그렇게 오래됬냐며 동네한바퀴 돌면서 추억여행을 하고왔습니다 새건물들도 많이 생겼지만 추억이 있는 대부분의 맛집들과 카페도 그대로...,2021. 3. 2.
"2021년 1월 8일 생방송 투데이-보고먹고즐기고(울진), 우리동네 반찬가게(경기...",3GO - 울진 3GO 여행 편 ▶<왕피천케이블카> 주소 : 경북 울진군 근남면 엑스포로 25 번호 : 054-782-9330 ▶<울진대게빵> 주소 : 경북 울진군... 서대문 김치찜 / 서울 금천구 / 02-853-0118 / 삼겹살 4. 인생 분식 - 한결같아 고마운 소박한 한 그릇 편 ▶<된장솔잎칼국수> 주소 : 경기...,2021. 1. 11.
"퍼포먼스애드, 4차 워크샵! 단양 여행","광고에 대한 스케쥴 설정은 잘하는데, 워크샵이나 어디 여행에 대한 일정을 잘 해내지 못하는 관계로! 이동하며, 무엇을 먹을지 어디를 갈지를 결정을 하게 되었습니다. 서울 금천구를 벗어나 이제 차를 타고 이동을 하는 과정을 아주 상세하게 담아보도록 하겠습니다. 그리고 이 소식을...",2020. 12. 7.
금천향기_2021년 10월호 소식지,"팔도민요 여행> - 금천구민을 위한 <특콘: 특별한 트롯 콘서트> - 공연장 어린이 뮤지컬 <목 짧은 기린 지피> - 상주단체 정기공연 <토리: 행복을... 의정소식 ○ 금천구의회, 제230회 임시회 마무리 ○ 금천구의회, 추석맞이 사회복지시설 방문 서울이야기 ○ 서울시소식 - 한글 창제 원리와...",2021. 9. 27.
서울 구로구 항동철길 레트로 기차여행을 추억하며 산책한다,"이곳은 기차여행을 추억하며 가을 산책하기 좋습니다. 서울특별시 구로구(九老區)는 남서부에 있는 구(區)입니다. 동쪽은 관악구, 북쪽은 영등포구와 양천구가 있습니다. 서쪽은 경기도 부천시, 남쪽은 금천구와 경기도 광명시가 접해 있습니다. 원래 이곳은 서울의 대표적인 공업도시였습니다....",2020. 10. 7.
가을 비대면 관광지 100선 - 서울,거리두기 여행을 실천하는 관광지 중 단풍과 가을 주제(테마)에 부합하는 곳이라고 한다. 특히 이 중에 서울은 일곱 군데가... net/nature/푸른수목원_/29796 주소: 서울특별시 구로구 연동로 240 이용시간: 매일 05:00 - 22:00 입장료: 무료 호암산성 서울 금천구 Previous image Next...,2020. 10. 24.
금천구폐차장 10 년 넘게 몰아온 차도 딱 하루면 안녕,"#금천구폐차장 #금천구폐차 #폐차장 #폐차 안녕하세요 금천구폐차장입니다. 가을은 감성의 계절이죠. 저는 원래도 자타공인 감성적인 사람이지만, 가을이 오면 추억에 절어 살게되더라고요. 굳이 옛사랑이 아니더라도 어린 시절이나 행복했던 여행의 기억 등등 지금은 다시 돌아갈 수 없는 때가...",2020. 10. 21.
"[TV속 정보]12월 17일 (목) 2TV생생정보, MBC생방송오늘저녁, SBS생방송투데이 나온...",com #오늘저녁캠핑장 #신박한네바퀴여행 ▶ 광교호수공원 가족캠핑장 경기 수원시 영통구 광교호수로 57 https://www.suwonudc.co.kr/ggcamping... (닭오도독뼈) ☎1644-6626 서울 금천구 디지털로 121 에이스가산타워 11층 #생투한우 #생투한우집 #생투고수뎐 #생투숙성한우 ▶밥상한우...,2020. 12. 17.
간다 여수장거리택시 서울 여수에서서울삼성병원 외래검진진료 택시왕복,"여수서울금천구,여수서울영등포구,여수서울동작구,여수서울관악구,여수서울서초구,여수서울강남구,여수서울송파구,여수서울강동구... 장거리출장 및 여행 왕복 서비스 9.긴급서류 및 소형 화물 퀵배송 서비스 10.택시미행 서비스 11.수행비서처럼 애용하는 24시간-48시간 대절서비스...",2021. 4. 30.
스타즈호텔 독산 kkday 1박 숙박시 1박 숙박권 이벤트,"네이버 여행 인플루언서 고미리레 입니다. 오늘 소개 해드릴 호텔은 모두투어 그룹 계열 호텔인 스타즈호텔 독산점 입니다. 현재 2월 28일까지 1... 258개 객실의 스타즈 호텔 서울 금천구 시흥대로 315 금천구청역 1번 출구에서 도보 10분거리 마을버스 이용시 1,6,7,8번 버스 승차 롯데캐슬 1차...",2021. 2. 8.
생생정보통 전복 문어 갈비 전골 백 년 단골의 추천 맛집 생생정보통 더덕 장어...,따라 떠나는 여행 <부여 대추 수확> 해살이 농업회사법인 주식회사 주소 : 충청남도 부여군 규암면 나복리 870-5 <엄마는 슈퍼우먼> ■ 34년 전통 제면소 엄마 상호 : 신명자국수 주소 : 서울 금천구 독산로 40길 27-5 평택쌀상회 (신명자국수) 자세한 이야기 https://sometv.tistory.com/46542,2021. 10. 7.
당일로 가는 속초여행 1,"첫째로, 서울 금천구 기준 속초까지는 안막히면 2시간 반이면 간다. 하지만... 10월에 가는 여행은...오전8시쯤 출발하여 5시간걸려서 밥집에 도착하였다. 속초 청초수 라는 물회 전문점이 있는데 늦은 점심이니 좀 한가하려나 했는데 코로나에도 불구하고 번호표 뽑고 대기..ㅜㅜ 가성비 따지시는 울...",2020. 11. 15.
제주도 4일차 8월 24일,"우린 기기막히게 비 안오는 타이밍만 잘잡아서 야외활동을 했다 처형네 가족은 따로 여행을 갔는데, 기가막히게 비를 몰고 다녔다고 한다 그래서... 양갈비캠프 서울 금천구 벚꽃로40길 29 http://naver.me/5TvD3gIS 식사중 또 비가 한바탕 크게 내려서 걱정했는데.. 또 거짓말처럼 계산을 마치고 차에...",2021. 8. 24.
가을 단풍여행...추천관광지/가을 비대면관광지100선,"살아가며 우리가 만나야 했던 미소와 눈물, 혼자 있던 외로움 하나하나 배낭에 챙겨 넣고 가을에는 함께 가는이 없어도 좋은 여행을 떠나자.... 푸른수목원&항동철길 ▷서울 금천구 호암산성 ▷서울 노원구 수락산 학림사 ▷서울 도봉구 원당샘공원 ▷서울 동작구 고구동산길 ▷서울 성동구...",2020. 10. 26.
안양천 코스모스 황화코스모스에 반하는 광명햇살광장,가을하면 생각이 나는 코스모스 서울근교나들이 장소로 안양천이라면 좋을 듯 하네요~~~ 언제부터인가 알록달록한 코스모스보다 황화코스모스가... (광명 금천구 쪽 모습) 뭔가 어수선해보이지만 다리 넘어 안양천을 끼고 양쪽이 황화코스모스가 만개한 곳이랍니다. 다리아래서 내려다보니 언제...,2021. 9. 30.
서울 둘레길 6코스 - 안양천 걷기(ft. 집콕 브라더스),"동심이란 ㅋㅋㅋ 언젠가 여름에 놀러 왔던듯한 금천구 물놀이장도 지나고, 인공으로 조성한 논밭을 지나는데, 어익후, 깜딱이야~ 넌 좀 밤에 보면 무서울 수 있겠다. 벚나무 쫙쫙~ 뻗은 안양천변을 계속 걸어줍니다. 다음 주에 벚꽃 피면 완전 끝내주겠습니다. 저~ 멀리 <고척 스카이돔>이 눈에...",2021. 3. 27.
"7월 일상, 가산디지털단지 아웃백스테이크하우스 l 가산디지털단지 망우리오징어집 l...",안뇽 설정샷도 남기고 ^_^ 7월 17일 주말에 출근하는데 하늘이 이쁘길래..⭐️ 서울 금천구 디지털로10길 9 현대시티아울렛 7층 매일 11:00 - 22:00... 여행온거 같고 좋았당 #감성실패 헤헤헹 혜워니랑 커플 #범고래 지금 다시보니 원피스랑 운동화랑 안 어울리는 거 같기도 서울 마포구 대흥로...,2021. 9. 14.
시흥 고기집 : 올바른고깃집 정돈 모듬세트(2인) 회식,"주소 : 서울 금천구 시흥대로52길 52 102호(시흥동 888) 전화번호 : 02-6115-8508, 0507-1464-0514 영업시간 : 평일 : 16:00~02:00, 주말 및 공휴일 : 15:00~02:00 기타... 양배추는 특히 위장에 좋은 것이고 일본에 여행을 할때보면 많은 여행객들이 카베진이라 하는데 위장약으로 개발한 것을 사기도 하는데, 평소에...",2021. 3. 5.
[금천구 시흥동 어린이 유아 / 영재 / 예중 예고 입시 피아노 세종 아카데미 음악 학원]...,그중 오늘 특강은 봉산탈춤 황해도 봉산 지방에 전승되어 오던 가면극 금천구 시흥동 세종아카데미음악학원 02.6101.0713 탈춤 가운데 가장 예술성이... 서울의 송파 산대놀이나 경기도 양주의 별산대놀이가 오늘날까지 전해 온다. 탈춤의 내용은 지배층이나 특권층을 풍자적으로 비판하는 내용이...,2020. 8. 14.
애쉬브라운 전체염색 독산동 미용실 에이바헤어,원래라면 머리한지 2달이 조금 넘어가면 뿌리염색을 하러 가는 편인데 한동안 회사 일도 정신없고 여행다니느라 바빴어서 미루고 미루다 이번주... 주소 : 서울 금천구 벚꽃로 30 금천롯데캐슬 골드파크 2차상가 212호 영업시간 매일 오전 10시에 시작해서 오후 9시에 끝난다. 금천롯데캐슬...,2021. 6. 20.
생방송투데이맛집오늘 논산3GO여행 논산딸기찐빵집 웅어횟집 웅어회무침 수원 라온찬...,금천구 독산로65길 27 빅데이터 랭킹 맛집 수도권 최고의 콩나물국밥 탑TOP 5 편 ▶ <산야로콩나물국밥> 주소 서울 관악구 관악로 111 *방송된 순위를 제외한 나머지 순위 맛집은 아래 링크에서 확인하실 수 있습니다. https://some.co.kr/food/home 보고 먹고 즐기고! 3GO 논산 3GO 여행 편...,2021. 3. 5.
서울 테니스 레슨받기 좋은 조이테니스아카데미,잔여백신 구하기가 하늘에 별 따기 전 아직도 맞지 못 했는데요 주변에 맞으셨다는 분들이 한 두 분씩 생기면서 여행 가시려고 준비하시는 분들도 많고요 운동하려고 준비하시는 분들도 많더라고요 오늘은 금천구에 위치한 금천구테니스장~~~~~ 서울 테니스 레슨받기 좋은 조이테니스아카데미를...,2021. 6. 19.
"[서울]가산디지털단지맛집, 산더미물갈비 배터지게 즐기자 !","가산디지털단지맛집, 가산디지털역맛집, 가산동맛집, 가산물갈비백년불고기 주소 서울 금천구 가산디지털1로 128 STX V TOWER 110호 (가산동 371-37 STX V TOWER 110호)영업시간 주말 11:30 - 22:00 브레이크타임없음 / 매일 11:30 - 22:00 브레이크 타임 15:00~16:30 연락처 0507-1414-8981",2020. 8. 30.
[쌍교숯불갈비 금천점] - 맛있는 담양떡갈비를 서울에서도 맛볼 수 있어요!,"하지만 쉽지 않은 전라도 여행. 언제 또 먹을 수 있으려나 싶었는데, 저희 친정집 근처에 쌍교숯불갈비 금천점이 생겼더라구요!!!! 남편은 일하느라... 쌍교숯불갈비 #쌍교숯불갈비금천점 #소갈비 #돼지떡갈비 #들깨수제비 #떡갈비맛집 #금천구떡갈비맛집 #금천구맛집 #서울금천구맛집",2020. 8. 4.
[가산네일/독산네일] 네일더드림 Nail The Dream : 세련된 이달의 아트 디자인 ♪,"이번 주, 계곡 여행을 앞두고 페디를 받으러 금천구에 위치한 네일더드림 Nail The Dream 에 다녀왔다. 네일 더 드림 Nail The Dream ✔️ 평일 11:00 - 21:00 ✔️ (일요일 휴무) ☎️ ***-****-**** 서울 금천구 시흥대로 141길 51 구로디지털단지, 독산역 근처에 위치한 [네일더드림] 코로나로 인해 마지막...",2021. 9. 12.
[소울메이트] 두 번째 커뮤니티 <다시 만난 서울> 6화,서울을 여행할 때마다 새로운 매력을 찾아내는 것이 즐거워 함께 이야기를 나누고 싶어졌다고 합니다. 서울 곳곳에 담긴 우리의 추억과 생각을... 있는 서울의 숨은 장소에 관해 이야기를 해보기로 했답니다. 이번 주 주제는 금천구 주변 지역인 영등포 문래창작촌이었는데요. 당일 문래창작촌을...,2021. 7. 22.
서울가죽공방 이비그 에어팟풀커버케이스만들기 원데이클래스,"이비그 서울 금천구 가산동 151-9 ***-****-**** 오픈시간 11:00~23:00 맞춤 주문제작 및 원데이클래스, 정규교육 진행 이비그 가죽공방 한쪽벽면에는... 핸드폰케이스부터 여행가방까지 진짜 다양한 제품들이 있었어요 그리고 일단 가죽들이 너~~무 좋아보였어요 제가 만져봤던 가죽중에서 감촉이 제일...",2020. 7. 3.
"[TV속 정보]11월 17일 (화) 생생정보, 6시내고향, 생방송투데이, 생방송오늘저녁",서울 금천구 가산디지털1로 131 ▶ 우밀면옥 서울 강남구 언주로 508 <본점> 서울 서초구 법원로2길 15 1층 104호 <교대점> #헌집줄게새집다오 #동몽헌 ▶ 빈도림꿀초 061-383-8130 전남 담양군 용산로 265-91 (대덕면 문학리 48) 생방송투데이 sbs.co.kr #생투경북고령여행...,2020. 11. 17.
"""여행은 꿈도 못 꿔.."" 대구에 사는 청년들이 말한다. 지금 우리들이 코로나를 버티고...",서울의 청년 주택에 당첨되어 주거지를 마련했으나 입주를 미루고 있는 상태다. 인터넷에 올라온 범어네거리 실황을 J씨는 자신의 SNS에 게재했다. 입주일이 언제인가? 2월 27일인 오늘이다. 금천구 쪽에 있는 청년 주택에 어렵게 당첨됐다. 하지만 청년 주택이 쉐어하우스 형태로 공용공간을...,2020. 2. 27.
독산동헤어샵 위앤위헤어 나노힐클리닉 후기 (유주디자이너님),"02-888-4222 서울 금천구 범안로 1212 독산 이편한세상 오피스텔 건물 1층 헤어스파, 두피클리닉, 유아전용의자, 주차, 무선 인터넷, 제로페이... 금천구미용실추천 #독산이편한세상 #독산이편한세상미용실 #독산이편한세상헤어샵 별별 일상을 다 기록하는 블로그 #별별로그 _ [일상 여행 취미 맛집]",2021. 9. 28.
[국내여행] 서울 3박4일 1일차 신사동 가로수길 코엑스 스타필드 별마당 도서관,한국 법인은 서울특별시 금천구 가산동에 있다. 출처 나무위키 폴로는 미국에서도 비싼 브랜드인데 한국에서는 더 고급화시킨다고;; 근데 왜... 책과 함께 여행에 나이가 어딨어?란 제목에 이끌려 사진을 찍었어요 저도 죽을때까지 제가 가고 싶은 나라 장소들을 다 가고 싶네요ㅎㅎ 또...,2020. 1. 13.
소소전파사 <골목의 재발견> Ep.42 서울 벚꽃 드라이브,"지금껏 알지 못했던 골목의 매력을 찾아 떠나는 골목 여행 전문 채널 <골목의 재발견> Ep.42 서울 벚꽃 드라이브 이번엔 온통 벚꽃으로 물든 서울 거리를 차로 이리저리 누비고 왔습니다 도림천역 앞 벚꽃터널부터 구로 거리공원, 금천구 가산동 벚꽃로까지 주변이 모두 핑크빛이라 창밖으로 눈을 뗄...",2021. 9. 7.
곤지암리조트 : 백년만에 스노보딩!,친정집인 서울 금천구에서 50키로 밖에 안걸려. 제2경인고속도로 타고 바로 성남쪽으로 나가니 도착까지 1시간도 안걸렸다. 우와... 진짜 가까웠음. 예전에 하이원 시즌권 끊어 다닐때 영등포에서 버스타고 4시간 걸려 갔던 거 생각나네. 어찌 다녔는지.. 오후 3시쯤 도착해서 주차하고 보드복 입고...,2020. 1. 27.
"장마 끝의 안양천 밤 산책, 안양 가볼만한곳",의왕을 시작으로 석수동을 걸쳐 서울 금천구를 지나고 목동을 지나 염창동의 염창교 밑을 지나 한강으로 흘러들게 됩니다. 내린 비가 땅속에 스며들었고 세상의 모든 초목들이 충분히 먹고 남은 물들이 안양 가볼만한곳의 하천으로 흘러들고 있었습니다. 더 이상 과거의 생활하수 천이 아닙니다....,2020. 8. 19.
얼굴형에맞는안경 블루라이트 차단 까지 안경 선택법,"서울 금천구 오공플러스안경원을 찾은 이유는 바로 다양한 안경테와 국산 브랜드의 안경렌즈를 50% DC로 판매하는 매장이기 때문이죠. 물론 다양한... 최근 여행 또는 나들이, 운전 등 집에서도 편하게 사용하고 있는 블루라이트 차단 얼굴형에맞는안경은 무엇보다 가볍고 편해서 좋은 것 같습니다....",2020. 4. 30.
여기서 일하고 싶을걸? 워라밸 좋은 강소기업 53곳을 소개합니다!,"임직원 가족 생일 지원금과 연간 30만원의 여행경비를 지원한다. 사내 동호회 활동을 위해 분기별 공가를 부여하고, 휴게실에 악기나 운동기구를 구비해 임직원의 취미생활을 지원한다. 중소기업 구인난, 청년 실업 동시해결…‘일‧생활 균형’ 강소기업 발굴 서울시가 청년들이 선호하는...",2021. 9. 23.
서울전연령렌트카 빌려 차박여행가자(건대/마곡/노량진/영등포),전구설치하면 정말 이뻐요 어려운거 하나없고 건전지로 하는거라 정말쉽습니다 차박렌트 여행을 하고싶다면 저희 서울전연령렌트카... 낙성대전연령렌트카 #구로전연령렌트카 #여의도전연령렌트카 #금천구전연령렌트카 #종로전연령렌트카 #과천전연령렌ㅌ트카 #우등렌트카,2021. 6. 12.
"3/1-3/2 감딩여행2,3일차 (담양/죽녹원/선인장글램핑/감이할부지할무니네)",여행둘째날 역시나 비를 몰고다니는우리 :) 요새 차에 두고다니기 시작한 500ml 물 참 편하다!! 근데 사놓고 윤수재혁이승철이가 다 마시는것같아!!... 서울 금천구에 생겼대요!! 꼭가세요 누가 나 떡갈비 싫어한대!!!! 너무마쉿는데...!!!!! 아니이~ 근데 할무니가 나 샐러드 잘먹는다고 계~ 속...,2021. 3. 9.
"두드리고 깎으며 만끽하는 오감만족 목향, 비대면 키트로 즐기세요!","김보경 호박골마을공방 공간지기 인프라 대여부터 판매까지, 서울에서 다 되는 목공 금천구 공간 및 인프라 모두 활짝, ‘목공창작공유센터’ 학생부터 일반인, 예비 창업자까지 누구나 목공 작업 인프라 및 공간 사용 가능 위치 금천구 서부샛길 612, 2층(사무국 4층) 문의 02-3463-9634 ※ 산림청...",2021. 4. 20.
2021년 10월 1주차 서울특별시 축제 정보와 공연 및 행사 일정,2021년10월17일 서울특별시 금천구 KOREA 월드푸드챔피언십 2021년11월05일 ~ 2021년11월07일 서울특별시 도봉구 도봉한글잔치... 2021년10월10일 서울특별시 중구 한양도성문화제 2021년10월01일 ~ 2021년10월10일 최신 축제와 공연 및 행사 정보는 아래의 국내 여행 정보...,2021. 10. 1.
"즉흥여행, 대부도로 떠나다.","정말 준비도 안된상태에서 진짜 급 떠난 여행이라, 뭔가 맘이 두근두근! 출발은 서울 금천구 가산동이었죠~~ 대부도 뉴캐슬펜션까지 도착하는데 걸린시간은 1시간정도!!! 중간에 막히는 도로가 있었는데도 빠르게 도착했습니다~^^배도 고플 시간이라 그런지, 고기밖에 생각이 안나더라구요ㅠㅠ...",2020. 4. 21.
권은비 생일 카페 투어 - 홍대입구 (210924),"파리바게트 금천시흥2동점 서울 금천구 금하로 750 (19:07 ~ 19:18) 이곳은 은비가 아이즈원 데뷔 전에 아르바이트 했었던, 파리바게트 금천시흥2동점 입니다. 언젠가 한번 와보고 싶었는데.. 이 날, 이렇게 오게 되었군요.ㅎㅎ 이 날, 이라서 좋았던것 같습니다. 많은 연예인분들이 아르바이트 경험이...",2021. 9. 25.
현명하게 알아보는 서울투어 지식,"뉴스보다 다양하고 유익한 정보니 놓치면 휘회~ 당신의 선택에 더욱 도움이 될 서울 우정여행 코스 관한 정보 통인시장은 친구와 함께 맛있는... 오늘 저와 서울투어 관련 지식을 습득하면서 풍성한 하루를 보내셨기를 바라며, 다음에는 훨씬 유익하고 알찬 정보로 찾아올게요~ #금천구부동산...",2021. 7. 7.
"추천 국내여행지, 2021년 서울 벚꽃 개화시기, 벚꽃놀이 명소, 가볼만한곳",2021년 추천 벚꽃놀이 명소 안양천 안양천도 산책로와 자전거 도로가 있고 금천구청역 부근 뚝방 위쪽 도로에는 양 옆으로 벚꽃나무가 많아서... 여행추천 #벚꽃 #벚꽃놀이 #벚꽃놀이명소 #벚꽃개화시기 #2021년벚꽃개화시기 #벚꽃놀이명소추천 #서울여행 #서울가볼만한곳 #데이트코스 #데이트명소,2021. 3. 3.
