header,contents,date
부동산 임장과 함께 하는 걷기여행 4탄(Feat. 경기도 광명 및 서울 금천구),"어디든 여행할 수 있는 신축 아파트인데 근처에 이케아, 롯데몰, 코스트코까지 있다니 대단한 입지입니다. 아파트를 나오니 저 멀리 KTX 역사가 보입니다 광명은 서울 금천구와 붙어있을 정도로 서울에 가까운 지역입니다. 광명 소하 1동에서 금천구청까지 차로 운전해보았습니다....",2021. 8. 29.
금천구 우마길 문화의거리로 중국시장여행을 떠나요,티케팅을 하지 않아도 됩니다. 공항을 가지 않아도 됩니다. 지하철을 타고 할 수 있는 중국시장여행~ 서울 금천구 우마길 문화의거리에서 할 수 있네요^^ 즐겁고 행복한 목요일을 위해서!! 오늘도 칼퇴근은 필수~ 사랑하는 가족과 맛있는 저녁식사하세요^^,2021. 4. 22.
[서울 금천구 사찰] 호압사+광명동굴_210711(일),a) 대가연 b) 생어거스틴 3) 광명동굴 : 경기 광명시 가학로85번길 142 4) 카페 : a) 아프리코 경기 광명시 밤일안로14번길 1 0507-1355-0526 5) 복귀 #서울사찰 #전국유명사찰 #금천구사찰 #금천사찰 #금천구산사 #서울산사 #사찰순례 #산사순례 #사찰여행 #산사여행 #광명동굴 #대가연 #아프리코...,2021. 8. 18.
하세요 신도리코 Rizium Cabon 카본 3D프린터 Rize 2XC 서울 금천구 복합기렌탈 전문,자유롭게 여행을 했던 그 시절이 정말 그립습니다~ 오늘은 최근 신제품 출시를 한 신도리코 3D프린터 Rize 2XC 를 소개 해 드리겠습니다.... — 3D프린터 렌탈 전문업체 자이온솔루션(주) 02-597-09820 中 서울 금천구 가산디지털단지 자이온솔루션(주)은 2011년 부터 시작된 프린터...,2021. 5. 15.
서울 가성비 호텔 금천구 숙소 호텔인카페 독산사거리점,"서울 가성비 호텔 금천구 숙소 호텔인카페 독산사거리점 다른 두 여행의 환승역 역할을 톡톡히 한 호텔인카페 독산사거리점은 이전에 잘 이용해본 경험이 곧장 선택으로 이끈 케이스다. 그 동기는 서해안 고속도로를 통해 서울로 진입하는 동선에서 비롯되었는데, 서서울TG를 통과하며 오늘...",2021. 5. 25.
200407 혼자놀기 2탄/ 서울근교 금천구 벚꽃여행 안양천 거리_금천구청역/독산교,"190407 혼자놀기 2탄/ 서울근교 금천구 벚꽃여행 안양천 거리_금천구청역/독산교 요즘 격일 출근으로 쉬는날이 많아서, 쇼파랑 한 몸이되어 뒹굴 거리기 보다는 많이 움직이기로 했어요. 쉬는 것도 넘나 지겹더라구요 ㅠ_ㅠ 아침부터 맡긴 세탁물을 찾아오고~ 봄 맞이 꽃놀이를 가려고 합니다 코로나에...",2020. 4. 14.
"금천구 호텔 : 신규오픈해서 깔끔한 서울 부티크 호텔, ""호텔 트리플 8""","5월 황금연휴 마지막 날, 아쉬운 마음을 붙잡고 서울 부티크 호텔 호텔 트리플 8에 다녀 온 우므 커플 :) 금천구 호텔에서 1박 호캉스를 즐기고 왔답니다. 2019년 12월에 새롭게 신규오픈한 곳이라 사진처럼 깨끗하고 좋은 룸 컨디션으로 즐겁게 묵고 왔는데요. 요즘 해외여행을 가기도 어려운...",2020. 5. 13.
서울 금천구 사무용 복합기 임대(렌탈) 설치,"코로나만 아니면 이곳저곳 여행 가고 싶은 날씨이기도 하지요! 오늘도! 컬러 복합기 임대(렌탈)를 위해 출발을 해볼까요~? 출~발~ 서울 금천구 사무용 복합기 임대(렌탈) 설치 위의 사진 속 제품은 IR ADV DX C3720 , 컬러 사무용 복합기입니다. 보시다시피 깔끔한 외관과 조작이 매우 쉬워요!...",2020. 10. 12.
"서울금천구에 배송된 원목평상침대 제작후기,","안녕하세요 , 수제가구부경 입니다, 오늘은 금천구독산동에 배송된 원목평상침대 제작후기입니다, 오늘소개드리는 원목평상침대는 지난주배송된 부여고객님께서 따님것과함께 동일한규격과 색상을주문주셨고 부여고객님댁에는 배송하였는데 따님은신혼여행중이어서 기다리다가...",2021. 5. 10.
"서울 금천구 엘지 스탠드, 대우 벽걸이 에어컨 분해청소 - 곰팡이 박멸",안녕하세요~ 냥집사클린에어랍니다 ^^ 오늘은 서울시 금천구 시흥동에 위치한 가정집에서 불러주시어 세척을 다녀왔답니다 ^^ 엘지 휘센 위너... 하수구로 긴 여행을 떠났다고~? 잘 가 ^^ 다신 돌아오지 말고 .. ㅎㅎ 이렇게 스탠드 에어컨 세척을 마쳤고 벽걸이 세척을 본격적으로 시작해볼까요? 바로...,2021. 4. 24.
[사주] 해수당아씨 -서울 금천구 사주 잘 보는 곳,엄~ 청~ 젊어 보이는데 보살님은 미인이셨어 그럼 오늘은 사주풀이와 함께 안뇽~ 오늘의 일기 선석일기 . . . #선석 #선석일기 #사주 #관상 #신수 #보살 #아씨 #해수당아씨 #점집 #풀이 #인생풀이 #서울점집 #금천구점집 #시흥동점집 #블로그 #네이버 #추천 #좋아요 #일상 #데일리 #여행 #점괴 #미래 #예지 #신,2020. 9. 20.
서울 동작구 세탁기청소 및 관악구 금천구 가능 전문마스터40명 오늘내일가능 업체,서울 동작구 세탁기청소 및 관악구 금천구 가능 전문마스터 40명 오늘 내일 바로 서비스 가능한 업체 다나눔홈도리 안녕하세요 주식회사 다나눔홈도리 인사 올립니다 날씨가 많이 풀려 이제는 활동하기 쾌적한 날씨가 되었습니다 지금 휴가철이고 코로나 때문에 해외로 여행을 못 가고 국내로...,2021. 8. 18.
구해줘 홈즈 123회 서울&경기 강서구 화곡동 손주근접 아파트/금천구 시흥동...,오늘의 의뢰인 # in 서울&경기 <‘육아 퇴근’이 필요한 할머니의 힐링 하우스 찾기!> 이날 구해줘 홈즈에서는 육아 퇴근 후 힐링을 꿈꾸는 할머니가... 유럽 여행을 떠날 수 있는 이 집의 위치 주소는 금천구 시흥동 '화이트 갤러리 하우스' 입니다. 김포 한강신도시 장기동 금쪽같은 옥탑 화원...,2021. 9. 12.
1시간 7억대 집 이현우 서울 금천구 시흥동 아파트 123회 구해줘홈즈 화이트 갤러리 하우스,com/45146 구해줘 홈즈 123회 in 서울 경기 외 할머니 집 예산 매매가 7억 원대 최대 8억 원까지 [ 복팀 ] 박나래 이현우 시흥동 아파트 화이트 갤러리 하우스 서울 금천구 시흥동 화이트 갤러리 하우스 아파트 매물 우아한 분위기의 유럽풍 인테리어 럭셔리 스타일 갤러리 도어 유럽 여행...,2021. 9. 12.
"서울 구로구, 금천구의 회의실, 파티룸, 스터디룸...독산동, 가산동, 시흥동의 프라이빗...","서울의 구로구와 금천구의 기업들이 현재는 회의와 면접장소로 이곳을 활용중입니다. 독산동, 가산동, 시흥동... 프라이빗 단독공간♡ 업무적... 국내는 잘 방어되고 있지만...세계는 델타이슈로 세계 여행은 아직...긍정적이지 않습니다. 세미나, 워크숍, 강의, 교육 뿐만 아니라... 브라이덜샤워...",2021. 6. 28.
서울 금천구 가산디지털단지에서 복합기렌탈 프린터렌탈 전문 업체 찾고 계신가요?,"이런 날 어딘가 여행을 가면 참 좋을 것 같은데 같이 갈 사람이 없네요~ ㅎㅎ 사무실에서 가장 많이 사용하는 IT 장비는 ? 뭘까요 궁금하신가요... 삼성전자DMFP 정식 대리점 OKI 프린터 ES클럽 정식 대리점 교세라 도큐먼트솔루션 정식 대리점 3D프린터 대리점(큐비콘, 모멘트) 02-597-0980 서울 금천구...",2020. 7. 17.
[독산동 카페/서울 금천구] 금천/구로 정원이 있는 카페 '카페 자작나무',서울 금천구 독산동 금천/구로 정원이 있는 카페 '카페 자작나무' 요즘 시기가 이런지라 어디 여행 가기는 좀 그렇고 집에 있긴 답답하고 인터넷 검색하던 중 금천/구로 정원이 있는 카페 '카페 자작나무'를 찾았어요. 도심에 있는 카페의 분위기가 아닌 뻥 뚤린 테라스가 좋고 금천/구로 애견동반...,2020. 9. 29.
무뼈국물닭발 | 서울닭발맛집 | 시흥닭발맛집 | 금천구 닭발 맛집 | 제주도 닭발,"저는 추후에 제주여행가게되면 부가네얼큰이 제주본점(관덕정)에 갈 예정이랍니다! 다들 오늘 저녁도 맛저 하시길! -연락처 02-895-5000 -위치 및 지도 서울 금천구 독산로50길 101 - 영업시간 pm 17:00 ~ am 02:00 *매주 화요일, 공휴일 휴무 #닭발맛집 #전국닭발맛집추천 #서울닭발 #제주닭발 #제주도닭발...",2021. 2. 15.
에머이 이색데이트 베트남음식 창업비용 가맹비 쌀국수 서울 금천구 마포구,그 이유는 음식을 통해 여행을 떠나는 문화가 생겨나면서 직접 가는 여행이아니라 음식여행을 떠너라 에머이를 많이 찿고 있습니다. 뿐만 아니라... 서울 금천구 마포구 에머이 창업비용 총 창업비용 : 9천 순수익 : 430만원 온라인 / 오프라인에서 큰 인기를 끌고 있는 창업을 원하신다면 아래...,2021. 1. 2.
지바 코코넛캠핑카2 서울 금천구로 출고되었습니다.,"지바코코넛캠핑카2 서울 금천구 고객님께 출고하였습니다. 피크닉테이블과 외부수납함은 왼쪽에 1개, 오른쪽에2개, 외부샤워기, 충전구, 주유구, 자동어닝 4미터가 장착되었습니다. 출입문 입구에는 스텝발판과 후방카메라가 장착되었습니다. 입구 들어오면 오른쪽에는 씽크대랑 인덕션1구...",2020. 7. 15.
#서울점집 #금천구점집 #시흥동점집 #마포구점집 #망원동점집 #성산동점집 #합정점집...,서울 금천구 시흥동 점집 해인당 벼락대신 사전예약필수 ***-****-**** #서울점집 #금천구점집 #시흥동점집 #마포구점집 #망원동점집 #성산동점집... 신병 #무병 #신굿 #신내림 #애동제자 #살풀이 #마음 #이별 #이혼 #재혼 #소송 #관재 #사고 #부적 #굿 #병 #조상 #천도 #귀신 #터 #고사 #업장 #소멸 #가족 #,2021. 10. 1.
서울 금천구 가산동 대형폐기물 아파트단지 쓰레기수거 가전제품버리기 이삿짐폐기...,#금천구 #가산동 #독산동 #독산본동 #시흥동 #시흥본동 #대형폐기물 #아파트쓰레기 #가구수거 #고인유품정리 #이민정리 #아파트폐기물 #학교쓰레기... 목재버리는법 #여행가방버리기 #커텐버리기 #mdf버리기 #각재버리는법 #간이매트리스버리는법 #간이쇼파버리는법 #건조대버리는법 #공기청정기폐기...,2020. 12. 25.
서울 금천구│SL아사무광화이트 슬라이드장 10.5자 시공 후기,"칼바람이 불었던 때가 언제였냐는듯 너무도 맑은 하늘이 기분 좋네요 :) 지난 석가탄신일부터 황금연휴로 여행가신 분들이 많으실텐데... 서울 금천구 현장에 시공 완료된 모습입니다. 집의 전체 리모델링을 진행하시면서 화이트로 컨셉을 잡으셨는데요, 하덱스 아사무광화이트 슬라이드장이...",2020. 5. 4.
[서울 호캉스 / 금천구 독산 호텔] '스타즈호텔 독산점 : 스탠다드 트윈' 이용 후기!...,"슬찡이 커넥팅 룸 되나 전화해봤는데 안된다구 했음 스타즈호텔 독산 서울특별시 금천구 시흥대로 315 02 2020 4036 우리는 11번가에서 예약을 했는데 토요일인데도 불구하고 1주년 기념 특가로 스탠다드 트윈룸이 59,220원이었다! 아무리 제일 기본 방이라고 해도 호텔이고 주말인데 진짜 완전...",2020. 8. 4.
"[맛집여행] 금천구 ""JYS스시"" 가산디지털단지역점 ❣pinkemo❣너랑❣핑크이모❣","맛있다 서울 금천구 가산디지털2로 127-33 1층 02-806-7478 가산디지털단지역5번출구 480m 평일 10:30 ~ 10:00 토,일요일 11:00 ~ 09:00 글°사진ㅣ수여니 생선초밥 생선초밥 & 15,000원 생선초밥 & 15,000원 JYS스시 & 장국 JYS스시 & 우동 JYS스시 & 연어초밥 JYS스시 & 주먹밥 JYS스시 & 연어초밥...",2021. 6. 8.
서울 금천구 독산로 173 1층 소담닭발,육아맘 #육아일기 #육아맘소통 #육아템 #육아는장비빨 #육아소통환영 #오늘의육아 #일상육아 #슬기로운가족 #슬기로운똥이 #신혼부부 #신혼일상 #럽스타그램 #23개월아기 #springgarret #크리에디터 #스프링게럿 #내아기 #내딸 #제주도 #가족여행 #여행일지 #여행 #한국가족 #영상 #똥이 #남편사랑,2021. 9. 18.
"금천구 진료부스(워킹스루)가 있는 ""독산보건분소 임시선별검사소""","연휴 기간 동안 가족, 친지, 친구들과 만나신 분도 계실 테고 혹은 여행을 다녀오신 분도 계실 거니 말입니다. 이러한 점 때문에 연휴 기간... 독산보건분소 임시선별검사소 서울 금천구 독산로87길 27 http://naver.me/5aVTv8zu 위치 : 서울 금천구 독산로87길 27 (서울 금천구 독산동 985-22) 주변...",2021. 9. 28.
서울 금천구 가산디지털단지역 6번 출구 앞에 복합기렌탈 떠오르는 심쿵 나만 모르는...,"가을이 오고 있는 것 같습니다~ 이런 날에는 해외여행을 가던지, 아니면, 국내 여행을 가야 하는데, 코로나19 바이러스 때문에 아무것도 못하고... 자이온솔루션(주)은 서울시 금천구 가산디지털1로 165 가산비지니스센터 804호 에 위치 하고 있습니다. 지하철 1호선 7호선 가산디지털단지역 6번...",2020. 9. 18.
서울 동작구/영등포구/관악구/서초구/구로구/금천구/양천구 중고서점 두비반디,"그곳은 여행하는 사람들에게도 여행지에 포함될 정도로 명소가 되었다고 한다. 내가 사는 동네엔 아이들 참고서를 주로파는 작은 서점만 2,3군데... 중고책/방문매입/무료수거/현금입금 두비반디 010*3051*2670 서울시 동작구/영등포구/관악구/서초구/구로구/양천구/금천구 등 서울 인근 지역 지역은...",2020. 12. 1.
서울 카드대납대출 강서구 양천구 금천구,서울 카드대납대출 강서구 양천구 금천구 항공기 제조 업체에도 비상이 걸린 상황입니다. 대규모의 손실은 말을 할 것도 없겠죠. 항공 여행 수요가 상당한 수준으로 감소를 하게 된 데다 주력 항공기라고 하 수 있는 737에서 계속해서 연쇄적인 추락사고가 있어왔기 때문이라고 할 수 있습니다. 이에...,2020. 4. 30.
서울특별시 금천구에서 경북 구미 시계명장으로 택배 보내온 닥터 바이오 Dr.Bio...,"구미시계수리점 서울특별시 금천구에서 경북 구미 시계명장으로 택배 보내온 닥터 바이오 Dr.Bio 텅스텐 게르마늄 팔찌 파손 부품 교체 수리 입니다. 몇년전부터 일본이나 동남아쪽 여행가면 꼭사오기시작 해서 현재 국내에서도 유행으로 건강 팔찌, 건강 목걸이로 인기있는 게르마늄 제품입니다....",2020. 11. 14.
달콤했던 금천구 시흥 떡케이크 다정한세계,다정한세계 서울 금천구 독산동 1155 상가 172호 매일 10:00 - 19:00 인스타그램 @dajunghan_segye 네이버 및 카카오채널 '다정한세계'로 예약 네이버로... 섬으로 여행가서 같이 드시라고 실온에 보관해두었어요 남은 떡케이크는 앙금부분과 분리해서 떡은 냉동실에 앙금은 냉장고에 보관하면 더 오랫동안...,2021. 8. 11.
서울점집.금천구점집.시흥동점집.신점.영점.쪽집게.사주팔자.해인당벼락대신.운세.금전....,서울 금천구 시흥동 점집 해인당 벼락대신 사전예약필수 ***-****-**** 한공간에 살아도 서로다른 생각으로 살아간다. 내가 생각한 것과 그대가... 신병 #무병 #신굿 #신내림 #애동제자 #살풀이 #마음 #이별 #이혼 #재혼 #소송 #관재 #사고 #부적 #굿 #병 #조상 #천도 #귀신 #터 #고사 #업장 #소멸 #가족 #,2021. 7. 14.
서울 금천구 독산본동 생활폐기물 가구수거업체 무거운쓰레기 버리기 버리는방법...,"목재버리는법 #여행가방버리기 #커텐버리기 #mdf버리기 #각재버리는법 #간이매트리스버리는법 #붙박이장 #간이쇼파버리는법 #건조대버리는법 #옷장... 안마의자수거비용 #금천구 #가산동 #독산동 #독산본동 #시흥동 #시흥본동 24시 문자, 전화 open!! 서울 인천 경기 All ! ***-****-**** 햇살자원 아래 이미지...",2021. 1. 9.
관악산둘레길 금천구간,"11.(목) 13:43 ~ 17:19(총3시간36분, 8.77k) 서울 금천, 관악산 둘레길 금천구 구간 <날씨> 영상 2 ~ 영상 14도, 흐림. 완전 봄날이라 티만 입었다. <코스... 도보 성지, 여행이야기 리본도 보인다. 물레방아 : 힘차게 돈다. 물레방아 정문 : 산에 다니는데 전철 타지 않고 다닐 수 없다. 한 두어 달 자차를...",2021. 3. 11.
서울 금천구 가산동 사무실 바닥왁스코팅은 역시 전문청소업체에게,수료업체 서울. 경기. 인천은 물론 강원.충청까지 고객님을 위해 편리하게 진행해드리는 종합청소업체 깨끗한DAY입니다 이번 장마는 상당히 오래가네요. 임시공휴일까지 여행다녀오시는 분들 많으실텐데 조심히 잘 다녀오시기 바랍니다. 그렇다면 비어있는 사무실을 청소하실 수 있는 기회의 시간이...,2020. 8. 15.
"[맛집여행] 금천구 ""갑초밥"" 가산디지털단지역점 ❣pinkemo❣너랑❣핑크이모❣","맛있다 서울 금천구 가산디지털1로 168 우림라이온스밸리 A동 2층 가산본점 ***-****-**** 대표번호1833-6873 가산디지털단지역6번출구 글°사진ㅣ수여니 초밥 & 특선중독 & 15,000원 갑초밥 & 식전샐러드 갑초밥 & 식전샐러드 갑초밥 & 미소장국 갑초밥 & 식전 갑초밥 & 새우차완무시 갑초밥 & 샐러드...",2021. 4. 18.
올바른찬 서울금천구 반찬가게 통영 3GO여행 해상택시 인생분식 안양관양시장...,3GO 통영 3GO 여행 편 ▶ <디피랑> 주소 : 경남 통영시 남망공원길 29 홈페이지 : http://dpirang.com ▶ <통영해양스포츠센터> **해상택시 주소... 서울 성북구 화랑로 170 우리 동네 반찬 가게 놀라운 가성비! 넘치는 인심의 자매 반찬 편 ▶ <올바른 찬> 주소 : 서울 금천구 금하로1가길 48-3,2021. 4. 30.
금천구네일 애룽샵 이달의아트 제주여행네일 완성,금천구네일 애룽샵 주소: 서울 금천구 독산로40길 51 1층 예약번호 : ***-****-**** 안녕하세요 정쥬입니다 여러분 이번 주도 잘 보내고 계신가요? 저는... 그리고 여행 가니까 뭔가 네일하면서 기분 전환도 하고 싶더라구요 결과는 완전 대만족이에요 애룽샵 다녀온 후기 함께 보시져!! 오픈은 11시부터...,2021. 6. 15.
서울 금천구 금천 탐정이 알려주는 흥신소,"근데 신혼여행에서 돌아와서 함께 사는 순간부터 제 기대와는 전혀 다른 너무 힘들고 괴로운 결혼생활을 하고 있습니다. 남편은 총각 때 생활습관을... 그래서 신혼여행 갔다가 돌아오자마자 그런 일들이 있었으나 어쨌든 그런 이유로는 이혼할 수 없다면서 그렇게 살아왔다는 거죠. 즉, 이 정도가...",2021. 2. 5.
시간여행과 치매예방활동하기[관악구 방문요양/금천구 방문요양/관절염 어르신...,"이 날은 어르신과 함께 80년대 귀성길 전쟁 이야기를 보았는데요, 서울에서 대전까지 15시간씩 걸려 귀성하던 모습을 담을 영상을 보며 옛날에... 영등포구 여의도동/신길동/영등포본동/영드포동/대림동/도림동/문래동/당산동/양평동 및 관악구/금천구/동작구/구로구/서초구 등 전 지역으로도...",2021. 9. 22.
"금천구, 장애인 맞춤 미래형 체험교육 실시","[금천구 제공] 서울 금천구(구청장 유성훈)는 취약계층 교육격차 해소를 위해 장애인시설 이용자와 종사자를 대상으로 오는 28일 ‘찾아가는... 프로그램은 소형 목공장비 유니맷을 이용한 ‘나만의 샤프 만들기’, 가상현실 VR로 떠나는 감성 여행이라는 테마로 ‘가상공간 그림 그리기’...",2021. 4. 28.
금천구미용실 마음에 드는 이자가헤어비스,요즘 휴가시즌인데 멀리 여행도 못가고 집에만 있으니깐 너무 답답하고 우울해서 오랜만에 머리를 하면 기분전환이 될까? 해서 다녀왔어요.... 선생님이 또 손이 빠르셔서 금방 스타일링도 끝났어요! 이가자헤어비스 가산 현대시티아울렛점 서울 금천구 디지털로10길 9 02-2136-9980,2020. 8. 11.
금천구일본어회화과외/개인레슨으로 맞춤식학습진행,"월드인서울 금천구일본어회화과외수업은 현재 일대일로 수업을 진행하는회화수업을 진행하고 있습니다. 일대일로 밀착관리하며 학생들이... 금천구일본어회화과외 수업은 금천구 전지역에 강사님이 방문과외 수업을 통해 일본어회화수업을 진행해보실수 있도록 하고 있습니다. 비즈니스,여행...",2020. 7. 22.
서울 금천구 시흥동 점집 신점 영점 무당 사주 운세 궁합 택일 개명 작명 취업 합격 시험...,금천구 시흥동 점집 해인당 신점 사전예약필수 ***-****-**** #서울점집 #금천구점집 #시흥동점집 #마포구점집 #망원동점집 #성산동점집 #합정점집... 신병 #무병 #신굿 #신내림 #애동제자 #살풀이 #마음 #이별 #이혼 #재혼 #소송 #관재 #사고 #부적 #굿 #병 #조상 #천도 #귀신 #터 #고사 #업장 #소멸 #가족 #,2021. 9. 26.
금천구 중식 라복궁 마라탕 찐하게,"금천구 중식 마라탕 찐하게 먹고 싶다면 라복궁 서울 도심 속의 차이나타운, 마라탕과 꿔바로우의 진수를 만나다 금천구 및 구로구에 유독... 중화권여행이 그리울 땐 바지락볶음도 좋을 것 같다. 깔끔하게 정리되어 운영되는 마라탕 재료코너 위생관리는 물론, 고객에게 자신있게 드러내는 신선한...",2020. 9. 17.
"우리동네반찬가게(서울 금천구 자매반찬), 빅데이터 랭킹맛집(닭갈비TOP5), 인생분식...","3GO - 통영 3GO 여행 편 ▶ <디피랑> 벽화 빛 축제 주소 : 경남 통영시 남망공원길 29 번호 : 1544-3303 홈페이지 : http://dpirang.com... 넘치는 인심의 자매 반찬 편 ▶ <올바른 찬> 주소 : 서울 금천구 금하로1가길 48-3 번호 : 0507-1326-8232 4000원 고추잡채,미역국, 소고기장조림 5....",2021. 5. 3.
금천구 고기 맛집 꼬기 먹으러 가잡!,#금천구고기맛집 #금천구맛집 #시흥사거리맛집 #서서갈비 #백년회관서서갈비 #갈비맛집 #장거리데이트추천 #서울여행 #서울여행코스추천 아침부터 고기가 생각나는 그런날 있죠! 제가 딱 그 상태이였죠! 그래서 다녀온 금천구 고기 맛집~ 제가 고기에대해서는 좀 까다로운데 맛있게 먹고와서...,2020. 2. 1.
"[맛집여행] 금천구 ""이선생짜글이"" 가산디지털단지역점 ❣pinkemo❣너랑❣핑크이모❣",맛있다 서울 금천구 가산디지털1로 181 가산W센터 207호 02-6281-6292 가산디지털단지역 6번 출구 매일 11시 ~ 8시 매주일요일휴무 브레이크타임 3시 ~ 5시 글°사진ㅣ수여니 솥밥주는이선생짜글이 돼지감자짜글이 & 7.500원 돼지감자짜글이 & 라면사리 계란후라이 계란후라이 셀프바...,2021. 4. 4.
금천구 시흥동 _ 신규오픈한 금천구 호텔 트리플8에서 쾌적한 호캉스 보내기,좋은 곳에 위치해 있는 금천구 호텔 트리플8 고척돔과도 가까워서 고척돔에서 야구를 보거나 콘서트를 본 후에도 방문하게 좋은 곳이다. 코로나19로 여행에 목마르다면 가까운 신규오픈 호텔에서 호캉스로 달래보자. 호텔 트리플8 서울 금천구 시흥대로56길 15 / 시흥동 888-11 전화번호 : 02-894-8888,2020. 6. 11.
[생방송 투데이]빅데이터 랭킹 맛집 수도권 최고의 두루치기 TOP5 서울 금천구 우리...,TOP5 서울 금천구 우리 동네 반찬 가게 온 가족 정성 반찬 여주 리린정찬방 논빼미돼지볶음 2843회 링크▽ https://fire8blog.tistory.com/2689 <> ▽ [생방송 투데이]인생 분식 달콤한 행복이 쌓이는 곳 추억의 시장 꽈배기 도너츠 부천 장수당 강릉 3GO 여행 오징어 요리 한 상...,2021. 6. 11.
금천구 독산동 유품정리 남은가구폐기 폐장농수거 연락주세요,안전한 여행 보내고 오시기 바랍니다 ! 저희 비움365에서 오늘은 금천구 독산동 유품정리 관련 작업을 보여드리려고 합니다 ! 자잘한... 저희 비움365에서는 서울 경기 지역의 수도권 폐기물진행 도와드리고 있으니 궁금한 점 있으시면 언제든 상담 요청해 주시기 바랍니다. ▼전화상담클릭...,2021. 10. 8.
서울점집.금천구점집.시흥동점집.관악구점집.봉천동점집.부천점집.신점.영점.신내림....,서울 금천구 점집 해인당 벼락대신 사전예약필수 ***-****-**** #서울점집 #금천구점집 #시흥동점집 #관악구점집 #봉천동점집 #동작구점집 #광명점집... 무병 #신굿 #신내림 #애동제자 #살풀이 #마음 #이별 #이혼 #재혼 #소송 #관재 #사고 #부적 #굿 #병 #조상 #천도 #귀신 #터 #고사 #업장 #소멸 #가족 #,2021. 6. 19.
