header,contents,date
어린이날 아이와 나들이하기 좋은 숲여행지 추천,숲여행지 추천 해드릴게요. 국립수목원 (광릉수목원) 주소 : 경기 포천시 소흘읍 광릉수목원로 415 연락처 : 031-540-2000 운영시간(입장시간 기준)... 사진출처 : 한국관광공사 홈페이지 홍릉숲 (홍릉수목원) 주소 : 서울 동대문구 회기로 57 연락처 : 02-961-2777 운영시간 하절기 : 오전 9시~오후 6시...,2021. 5. 4.
"[장안동 맛집] 프라이빗한 공간에서 식사를 콘반 - 마담국수, 쏨땀","서울 동대문구 한천로26길 48-12 월~토 11:30 - 15:00 (라스트 오더 14:30) 브레이크타임 17:30 - 21:30 (라스트 오더 21:00)/ 일,월 휴무 주차 건물앞에 2~3대 주차... 밖에 웨이팅 자리로 보이는곳에서 이색적인 장소에서 기념사진도 찍고~~ 여행온 기분으로 찐 힐링하고 가네요~~ 다음에 또 재방문의사 있어여!!",2021. 7. 24.
"여름밤 서울야경 좋은곳 (야경좋은곳, 야경데이트장소)","마포구 서울함공원 - 동대문구 청계천, 광진구 뚝섬한강공원 - 양천구 목동, 영등포구 한강유람선 - 강동구 광진교 - 종로구 청계천 모전교, 중구... □함께 읽으면 좋은 글 한강 자전거 여행 코스(서울한강자전거대여, 한강자전거데이트) 특별한 주말 여행 DMZ 인천섬(언택트여행, 인천근교...",2020. 7. 17.
"국토대장정 8일차, 구리에서 서울(흥인지문/ 광장시장/ 보신각/ 마포대교)",그래도 우리나라 제일 가는 도시이고 강원도에서 서울까지 왔다는 것에 살짝 뿌듯하기도 했다. 그런 서울에서 가장 먼저 들어선 동네는 여행에서... 중랑구를 지나 도착한 곳은 동대문구인데 과연 오늘 서울의 몇개의 구를 지나게 될까. 도장깨기하는 기분으로 하나씩 카운트하기로 했다. 꽤나...,2021. 5. 28.
대구 경북 코로나 확진자 수11 동선 영남대학교 청도 영천 청송 성주 영덕 경산 인접...,모임 여행 감염 확산 경상북도는 11. 28(토) 코로나19 국내감염 11명이 신규 발생했다고 밝혔다. 세자매 가족모임 추가 확진자는 1명이며 청도... 28) 경주 +6 서울가족 포항자택 방문관련 확진자는 2명으로 서울 동대문구 확진자(#295)가 포항 자택을 방문하여 확진된 것으로 추정하고 있으며...,2020. 11. 29.
확실했던 장안동 맛집 리스트,"주소 : 서울 동대문구 천호대로77길 22 영업시간 : 변동 마지막에는 평화상사에서 코앞거리인 엄마김밥에 갔는데 예스러운 색이 묻어나는 곳으로 정겹더라고요. 라면은 칼큼한 국물에 탱탱한 면이 시그니처였고, 수제비는 직접 떠주신거라 쫙 감겼어요. 부모님 모시고와 추억여행하기에도 적절한...",2021. 1. 27.
답십리동맛집 꼬꼬누리 치킨 배달 후기,안녕하세요 3세 6세 여행육아맘 하루여행입니다. 신랑이 가장 좋아하는 배달음식 1위인 치킨. 저희집 근처가 대학들이 많아서 치킨집 종류가 정말... <꼬꼬누리> 주소: 서울 동대문구 한천로 165 전화번호: 0507-1347-1696 #동대문구치킨 #동대문구치킨배달 #답십리동맛집 #답십리동치킨 #꼬꼬누리,2021. 4. 19.
천연기념물(식물) 지정 목록,"전국의 모든 천연기념물의 식물을 답사해 보기는 불가 하겠지만 여행삼아 다녀 볼까 한다. 벌써 몇군데 실패한곳이 있었다.(보안구역... 덩굴류는 경상북도 경주시의 오류리 등나무, 서울특별시의 창덕궁 다래나무와 삼청동 등나무 등을 살펴볼 수 있다. 희귀수종은 다른 종과의...",2020. 1. 1.
회기파스타맛집 101호이탈리안레술토랑 2호점,101호이탈리안레술토랑 주소.서울 동대문구 회기동 42-61 1층 101호 open.오전11시 회기분위기맛집 101호이탈리안레술토랑 2호점 회기점... 마지막으로 버섯루꼴라피자도 먹어볼게요~ 회기맛집 루꼴라피자 101호이탈리안레술토랑 회기맛집 101호이탈리안레술토랑 루꼴라피자는 제가 해외여행에서...,2021. 6. 21.
005. Cause I got a day in your life - 110,"- 본 게시글은 <버스로 서울 여행>(이예연, 이혜림 지음)이라는 책을 참고하여 작성했습니다. <세월의 시계> - 해당 게시물은 ""2021년 08월... 경동시장사거리 →) - 동대문구청, 용신동주민센터 - (← 동대문구청, 용두역 ←) - 마장축산물시장 - 도선사거리 - 성동구청 - 무학여고...",2021. 9. 10.
서울가볼만한곳 홍릉숲 걷기좋고 사람적고 입장료도 무료,서울가볼만한곳 홍릉숲 홍릉수목원 걷기좋고 사람적고 입장료도 무료 한국 최초의 수목원/서울여행지추천/홍릉시험림/ 국립산림과학원/서울나들이 이런곳이 있는걸 왜 여태 몰랐을까! ㅇㅅ언니의 추천으로 알게된 곳인데 너무너무 좋았다 동대문구 청량리쪽에 있는데 이쪽은 집이랑 거리가...,2021. 4. 24.
대전특수교육 대전사랑방 대전산림욕장 대전마케팅홍보.,"서울동대문구특수교육 #대전버스정류장 그러나 살도귀 화벽승의 칼이 그보다는 빨랐습니다 상급반에서 대전영업대행전문, 맥도날드애플파이배달... 가족여행숙박 지독합니다. 신곡동특수교육 #대전핼스 잡지 사진 팬 레터 클럽 순례 의식 영화제 이것들은 스타 입니다 숭배의 기본적인...",2021. 7. 2.
[서울 장한평역] 보르조미 부티크 서울 호텔 (Borjomi Boutique Seoul Hotel),본 숙소(보르조미 부티크 서울 호텔)에는 다양한 시설이 있어 서울에서의 여행 시간을 풍요롭게 해줍니다. 본 숙소에서 Wi-Fi (무료/전 객실)... 주소 : 서울 동대문구 천호대로83길 98 위치 : 서울 숙소 객실수 : 42 체크인 시작시간: 17:00 체크아웃 마감시간: 12:00 리셉션 종료 시간: 00:00 숙소...,2020. 7. 30.
쏘랜토R 오토미션수리.변속충격.울컥거림.경고등점등.전후진충격.오일누유....,뉴스에서는 휴가철 항공표가 전자석 매진이 된다고 했는데 해외여행계획이 있으신 분들은 잘 알아보세야 겠네요.. 빨리 코로나로 부터 해방되고... 변속이 완벽하게 잘 이루어 집니다.. 정상출고 합니다. 쏘랜토R 오토미션수리 문의 동양오토미션 ***-****-**** 서울 동대문구 이문동 97-18 동양오토미션,2021. 6. 25.
[회기] 치킨앤칩스 경희대점 - 추억보정 없이 여전히 지상 최강의 파닭,스페인여행 떠나기전에 문어랑 척척이랑도 여기서 송별회를 했었다ㅋㅋ 그렇게 자주 드나들었는데도 다른 메뉴를 먹어본 기억은 없고 오로지... 치킨앤칩스 경희대점 서울 동대문구 회기로 147 070-7501-8879 매일 16:00 - 02:00 세월이 느껴지는 치킨앤칩스의 외관 대학가에서 유명 브랜드도 아닌...,2021. 4. 6.
[생방송 투데이]빅데이터 랭킹 맛집 서울 최고의 순댓국 TOP 5 원공전통순대국 우리...,sbs 생방송 투데이 2674회 ▽ 생방송 투데이 빅데이터 랭킹 맛집 서울 최고의 순댓국 TOP 5 서울 동대문구 원공전통순대국 우리 동네... com/2378 ▽ [생방송 투데이]인생 분식 50년 세월 어머니라는 이름으로 떡볶이 잔치국수 잡채 서울 은평구 할매집 용인 3GO 여행 2674회...,2020. 10. 9.
[회기]경희대 일식집:연어롤이 맛있는 스시선생,스시선생 서울 동대문구 경희대로4길 54 매일 11:30~22:00 Break time 15:00~17:00 천천히 둘러보다 마음에 드는 곳을 발견해서 서로 어!?이러다 일식집이여서 들어간 곳이예요 (초밥 좋아하는 칭구들..ㅎㅎ) 딱 들어가면 다찌 자리가 보이고 일본여행이 생각나는 분위기와 감성이예요 다찌자리 외에도 일반...,2021. 5. 20.
"[#기차여행 5월, #서울역.#용산역.#영등포역.#청량리역 기차역 가깝고 저렴한 주차장...",": #부산기차여행갈때 서울역은 필수코스죠~ ^^ ** 서울역 8, 9번출구 바로앞 건물 ** 서울시 중구 한강대로 416 ⑥ 서울역 4분... ** 서울시 동대문구 청량리동 317 ⑮ #영등포역주차 3분거리, ●J&S빌딩 주차장' - 평일 1일권 : 15,000원 (00:00~24:00) - 주말 1일권 : 10,000원 (00:00~24:00)...",2021. 4. 16.
"코로나19 국내 발생 및 예방접종 현황(3.9., 정례브리핑)","* (구분) 학생 16명(지표포함, +1) - (서울 동대문구 병원3 관련) 3월 6일 이후 접촉자 추적관리 중 4명이 추가 확진되어 누적 확진자는 총... ○ 특히, 개학·봄철을 맞아 가족‧지인과의 여행·모임, 대학가 등 젊은층 중심의 다중이용시설 이용이 증가할 것으로 예상되어...",2021. 3. 9.
[돈무적] 서울 경기 백지도 그리기,(마포구) 서울역 (중구) 왕십리역 (성동구) [트러플 역세권] 디지털미디어시티 (마포구) 동대 입구 (중구) 동대문 역사 문화공원 (동대문구) 청량리... 백지도와 대입해서 보면 좋을 듯하네요 경기도 백지도 경기도 여행 떠나볼까요 화성은 부지가 어마 무시 하네요 서울을 중심으로 가까운 곳은 역시...,2021. 7. 14.
"중국행 PCR 및 혈청항체 검사 관련, 중국대사관 지정 병원현황",삼육서울병원 서울시 동대문구 망우로 82 가능 한전의료재단한일병원 서울특별시 도봉구 우이천로 308 가능 고려대학교의료원안암병원 서울... 739 #코로나19 #코로나 #중국입국 #PCR검사 #혈청항체검사 #코로나PCR지정병원 #중국입국코로나검사지정병원 #항공발권 #여행사 #일본전문...,2021. 6. 8.
[서울 청량리역] 호텔 더 디자이너스 청량리 (Hotel The Designers Cheongnyangni),본격적인 서울 여행 시작을 위한 이상적인 장소입니다. 도시의 재미가 가득한 곳에서 5km 거리에 있는 이 2성급 숙소는 좋은 위치와 도시의 많은... 청량리)는 서울 방문 이유와 상관없이 아주 신나고 즐거운 일상 탈출을 즐길 수 있는 완벽한 장소입니다. 주소 : 서울 동대문구 왕산로 226 위치...,2020. 7. 30.
"“누구나 시작할 수 있는 라이프스타일, 플로깅엔 나이가 없습니다”",10대부터 60대까지…세대 초월한 플로깅 “다회용 컵이 없으면 음료를 안 마셔도 괜찮습니다.” 지난달 12일 서울 동대문구의 한 카페에서 만난... 상으로 유럽 여행을 보내준다고 해서 혹했죠. 주제를 정하려고 환경 문제를 다룬 다큐멘터리를 찾아봤어요. 그런데 예상했던 수준이 아니었어요....,2021. 7. 13.
"청량리역 맛집, 청량리 샤브샤브 먹으러 로운 샤브샤브 청량리점 고고씽","롯데백화점 B2에 위치해있어요 롯데백화점 B2에는 무한리필 애슐리퀸즈, 로운샤브샤브가 있어요 서울특별시 동대문구 전농동 591-53 매일 11am-8:30pm... 즐거웠던 서울여행!! 와플은 완전 맛이쪄! 나리야 와플계사지마... 여기서 먹자! 그리고 와플도 만들어먹고! 망고도 먹고! 푸딩도 먹고! 파인애플도...",2020. 11. 2.
제주도 선녀와 나무꾼에서 엄마랑 좋은 추억 쌓고 온 후기,제주도 여행 2박 3일 중 나름 유명한 곳곳을 다닌 것 같은데 엄마가 제일 집중해서 봤던 곳 같다. 생각보다 입장료가 저렴해서 금방 끝나겠지 했는데 여러 전시관이 계속 나와서 구경도 오래 했던 것 같다. 엄마 어렸을 적 살았던 서울 동대문구 제기동에 위치했던 집의 구조와 비슷하다고 말한 곳...,2021. 4. 30.
알페온 오토미션수리.변속충격.후진안됨.전진안됨.경고등점등.쉐보레오토미션....,코로나백신 2차까지 접종이 이루어지면 해외여행도 할수 있다고 하니 1년넘게 막혀 있다가 열리니 여행 좋아하신분들은 더욱더 맞고 싶어 하는것... 시기에 모두 건강하시고 잘 이겨 내시길 바랍니다.. 쉐보레 오토미션 수리 문의 동양오토미션 ***-****-**** 서울 동대문구 이문동 97-18 동양오토미션,2021. 6. 8.
장안동 와인바 고무래 분위기 좋은 맛집,사장님이 4개 대륙을 여행하면서 겪은 경험을 토대로 요리하신다고 해요. 음식 자체는 캐주얼한 느낌이 강합니다. 깔끔한 접시와 이케아 물컵... :) 일부러 팔로우도 해둠!ㅋㅋㅋㅋ http://www.instagram.com/gomurae_seoul - 주소: 서울 동대문구 장한로26길 37 202호 - 전화: 0507-1437-8770 - 영업: 매일 17:00~22:00...,2021. 5. 19.
자꾸 생각나는 경희대 맛집,"인테리어는 중국느낌으로 고풍스럽고 세련되게 꾸며나 중국에 여행온듯한 기분까지 드는곳이였답니다~! 5.경희대 노천파전 주소 : 서울 동대문구 회기로28길 3 전화번호 : 02-968-2494 영업시간 : 17 : 00 ~ 05 : 00 가격 : 오뎅국수 4,000원 / 굴전 13,000원 (계절메뉴) 정보 : 단체석, 포장, 남/녀 화장실...",2021. 3. 2.
2021년 7월 14일 ~ 7월 31일 코로나발생현황,"5일 여행을 위해 입도, 서울 성북구 확진자 접촉자로 분류 격리중확진 #1403번 워터파크유흥업소 방문이력 #1402번 #1400번(7/12확진)가족 #1401번 #1312번(7/7확진)접촉자 #1400번 #1402번(7/12확진)가족 #1399번 코로나19유증상으로 검사후 확진 #1398번 #1312번(7/7확진)...",2021. 8. 19.
"오늘부터 '추석 특별방역' 2주간 시행…전국 2단계 연장, 민속놀이도 금지","오전 서울 동대문구 경동시장을 찾은 시민들이 장을 보고 있다. 2020.9.27/뉴스1 © News1 김진환 기자국내 신종 코로나바이러스 감염증(코로나19)... 방문, 여행 등의 이동을 자제하고, 불가피한 이동 시에도 방역 관리에 만전을 기해달라""고 당부했다. 정세균 국총리는 지난 28일 서울 종로구...",2020. 9. 28.
[이문동 카페] 외대 스터디 모임하기에 좋구나! 크레이저커피 외대점,주소:서울 동대문구 천장산로 32-2 전화번호:02-959-9525 월~토 8:00~21:00 / 일 : 12:00~21:00 겉에서 봤을땐 일반 프렌차이즈 카페처럼 보였고 테이블이... 스터디 하는 모습이며 노트북 들고 외대 근처 북카페가서 몇시간동안 작업했던 기억들도 새록새록 떠오르며 혼자 머릿속 추억여행에 감회가 새로웠던날!...,2021. 6. 28.
서울벚꽃명소 중랑천벚꽃길과 장안벚꽃안길 둘레길코스,"서울시 동대문구 벚꽃길 북카페 폐쇄 그리고 서울시 동대문구 벚꽃길 북카페... 현재는 운영을 하고 있지 않습니다. 운행했다면 사람들이 많았을건데 아쉽기만 하네요. 군자교, 이화교, 배봉산, 연육교 가는 길 그리고 카페앞의 표지판과 사람들.. 삼삼오오 모여서 어르신들이 이야기를 하고...",2020. 4. 3.
[회기] 회기버거 - 동네이름을 걸만했던 가성비 죽이는 수제버거,오랜만에 내 마음의 고향인 회기로 추억여행을 다녀왔다. 매번 올때마다 가는 곳 말고 새로운 식당을 개척해보고 싶어서 안가본 수제버거집을 한번 찾아가봤다. 회기버거 서울 동대문구 이문로 46 1층 0507-1406-3210 매일 11:00 - 21:00 브레이크 15:00 - 16:00 회기버거는 작년에 오픈한 수제버거집인데...,2021. 4. 5.
"7월 7일 ~ 7월 8일 코로나발생현황 (2021년 7월 7일 17명, 7월 8일 31명)",7일 서울 강남구 확진자 접촉자로 분류 검사후 확진 #1332번 코라나19유증상으로 검사후 확진 #1331번 경기 시흥 거주자로 7/5 여행위해... 입도 #1279번 서울 동대문구 확진자(6/25~6/28까지 제주방문)와 접촉한 도민 #1278번 #1259번(6/28확진)가족 #1277번 6/26~6/30까지 업무차 러시아...,2021. 7. 9.
전농동 치킨 전기구이 옛날통닭 계몽시대,"안녕하세요~ 3세 6세 여행육아맘 하루여행입니다. 요즘 전기구이로 만드는 옛날통닭을 파는곳이 잘 안보이더라고요. 기껏해야 트럭에서 가끔 보는... <계몽시대> 주소: 서울 동대문구 전농로29길 107 계몽시대 전화번호: 02-3394-6394 #전농동 치킨, #전농동 맛집, #옛날통닭, #전기통닭 #계몽시대",2021. 5. 24.
우한 코로나바이러스 감염증 선별진료소 현황,27 동대문구 서울특별시동부병원★ 02-920-9435/9119 28 동대문구 서울성심병원★ 02-966-1616 29 동대문구 경희의료원★ 02-958-8114 30 동작구 동작구보건소★ 02-820-9465 31 동작구 서울특별시 보라매병원★ 02-870-2114 32 마포구 마포구보건소★ 02-3153-9037 33...,2020. 1. 29.
신설동호텔 <동대문 부티크나인>,주소 : 서울 동대문구 왕산로28 전화 : 0507-1349-0720 친구들이랑 오랜만에 만났음 삼겹살 목살 먹었다 냉면이랑 볶음밥도 먹었음 소주 오랜만에... 동대문여행이나 신설동 동대문 근처 비즈니스 호텔 찾는다면 추천하고싶당 키받아서 엘베타러 가는중 복도도 깨끗하고 엄청 조용했다 나는 친구랑...,2021. 5. 13.
화이자 2차 접종 후기 및 증상,"화이자 백신 접종 1차 후기 (증상 포함) 및 포포인츠 명동 숙박 화이자 접종 1차 때와 같은 동대문구 체육관 (영화촬영소 고개)에서 맞게... 2일차 오후부터 통증이 없어 토요일인 오늘은 어디 가볍게라도 서울 여행이라도 다녀오자, 싶어 가벼운 마음으로 다녀왔습니다. 쿠브 (COOV) 앱 코브 앱에서...",2021. 8. 14.
"청량리 롯데백화점 맛집 애슐리퀸즈 가격, 메뉴, 디저트 솔직후기!","이날은 단양에서 서울로 올라왔던 날인데요. 저녁을 먹고 집에가려고 청량리역 맛집을 찾아보다가, 여행의 마무리로 뷔페를 먹기로 했어요 사실... 한끼 두둑히 먹고 저도 집으로 갑니당 오랜만에 먹으니 여전히 맛난 애슐리였어요 ✨주소 : 서울 동대문구 왕산로 214 지하 2층",2021. 6. 3.
설선물로 이거 어때요? '서울사랑상품권' 설날맞이 10% 특별 할인 판매,"※ 300억원 소진시까지 10% 특별 할인 ※ 이후 상시 7% 할인 현재 서울사랑상품권 발행 자치구(총 17개) 마포구, 성동구, 강동구, 영등포구, 관악구, 종로구, 중구, 중랑구, 동대문구, 서대문구, 양천구, 은평구, 강북구, 금천구, 도봉구, 동작구, 성북구 ※ 총 참여 자치구 21개, 나머지 자치구 순차적...",2020. 1. 17.
"11월20일 경제,기업 관련 기사모음","net/v/20210120183129065 설 자금 38조 풀고 선물한도 20만원 한시 상향 설 성수품 수급안정 대책이 발표된 20일 서울 동대문구 청량리청과물 도매시장에 설 성수품인 사과와 배가 진열돼 있다. 뉴시스 정부가 설 명절을 앞두고 가계·기업 지원을 위해 특별자금 대출, 근로...",2021. 1. 20.
노원구 건설기초안전보건교육 이수증 안전교육 받는 교육원,하루라도 빨리 코로나가 없어져서 여름부터는 국내여행이라도 자주자주 떠나고 싶어요 1 당일에 접수가능 2 교육시간은 월화수목금토일 3... at/ 전화문의 : 02-2135-5060 오시는길: 서울시 동대문구 신설동 102-9 문정빌딩 5층 이렇게 기업에서도 상황이 좋지 않다 보니 취업은 물론 안정적으로 회사를...,2021. 8. 31.
[회기맛집] 골목족발 신라호텔 쉐프의 새우족발 요리집,회기 골목족발 서울 동대문구 회기로26길 5 02-964-2027 운영시간: 4pm-1am(일 휴무) 주차불가 안녕하세요 오늘은 회기에 골목족발을 갔다왔어요 ㅎㅎ... 회기맛집 찾으시면 골목족발 추천해요❤️ 서울맛집추천 서울여행 맛집탐방 족발맛집 요리대회금상 회기맛집 골목족발 회기역맛집,2021. 4. 10.
"현대백화점, 2021년 턴어라운드 주인공","30% 현대백화점은 코로나19의 장기화로 인해 여행이 금지되고 사회적 거리두기 등 영업환경이 제한되면서 영업실적이 계속... 동대문아울렛 서울 동대문구 - - - 52,807 - 임차 송도아울렛 인천 연수구 143,986 59,193 183,751 139,043 327,737 소유 가든파이브점 서울 송파구 - - - 102,091...",2021. 1. 28.
이쁜 술집 장안라운지 장안동 술집 장한평역 맛집 추천,"뭔가 여행온 듯한 분위기와 화기애애한 모습 보는 것만으로도 즐거워요~ 장안동술집 장안라운지의 메뉴판입니다. 정말 다양하죠! 장한평역... ***-****-**** 서울 동대문구 한천로2길 107 2층 매일 17:00~03:00(명정당일휴무) 단체석, 주차, 포장, 배달, 예약, 무선 인터넷, 남/녀 화장실 구분, 장애인...",2021. 7. 2.
전동킥보드 견인 서울 전역으로 확대…주차구역도 만든다,"중구, 동대문구, 강북구, 노원구, 양천구, 강서구, 금천구, 서초구 강남구와 용산구는 아직 견인 시행 계획이 없으나, 향후 두 자치구가 참여할 수... 문의 : 교통정책과 02-2133-2233 [출처] 서울시 #brasuca #brazuca #브라주카 #brasuca브라주카 #브라질 #중남미 #중미 #쌈바 #삼바 #카니발 #여행 #관광...",2021. 9. 29.
"[경희대맛집] 홍춘천치즈닭갈비,",홍춘천치즈닭갈비 회기경희대점 (부대장부대찌개) 전화 0507-1402-6884 주소 서울 동대문구 회기로13길 10 2층(회기역1번출구 661m) 영업시간 11:00~23:00 춘천닭갈비 좋아하는 우리는 닭갈비먹으러 춘천으로 여행도 참 많이 갔드랬죠 ㅎㅎ 소양강도 가서 보고 오고 오리배도 타고 춘천에 추억이 많드랬죠...,2021. 4. 7.
결혼을 하다 (1978. 12. 9),신혼여행을 마치고 고향 집에 인사차 들렀더니 이상한 소문이 퍼져 있었다. 신부가 갑자기 애가 생겨 급하게 결혼식을 올리게 됐단다. 허... 우리는 망우동 전셋집에 신혼살림을 차렸다.(서울 동대문구 망우동 432-3) 결혼 한 달 뒤(1979.1) 아내가 다니는 유치원 겨울방학을 틈타 친구들을 초대하여...,2021. 5. 19.
"7월 9일 ~ 7월 12일 코로나발생현황 (2021년 7월 9일 10명, 7월 10일 24명, 7월...","가족여행을 위해 입도, 이후 사무실내 확진자 발생 소식을 듣고 검사후 확진 #1407번 여행을 위해 가족3명과 10일 제주입도, 입도후... 입도 #1279번 서울 동대문구 확진자(6/25~6/28까지 제주방문)와 접촉한 도민 #1278번 #1259번(6/28확진)가족 #1277번 6/26~6/30까지 업무차 러시아...",2021. 7. 13.
청량리호텔 모든것이 완벽한 동대문호텔 호텔더디자이너스 청량리,"서울 동대문구 전농동 호텔더디자이너스 청량리 주소: 서울 동대문구 왕산로 226 (전농동 597-41) 전화번호: 0507-1485-3318 그 길로 쭉 들어와서 좌회전을... ㅎ 시간만 있으면 하루 더 머물고 싶을 정도로 깔끔하고 쾌적하고 시원했던 호텔더디자이너스 청량리 동대문, 북서울 등 서울 여행을...",2021. 7. 1.
서울 동대문 쯔양 간장게장 맛집으로 유명한 <일미간장게장> 솔직 후기,"암튼 동대문구 장안동에 있는 <일미간장게장> 방문!!! 중 자 주문하면 두 마리가 나오는데 75,000 조금 비싼 편.. 공기밥 1,000원 !! 김에 챡 싸 먹으면... #서이추환영 #서이추 #이웃환영 #서울맛집 #서울간장게장맛집 #간장게장맛집 #서울여행 #게장맛집 #맛집블로거 #맛집블로그 #��일상블로그...",2020. 10. 3.
코리빙 하우스 • 맹그로브 신설 방문 투어 리얼후기,mangrove sinseol 서울 동대문구 왕산로 22 이사할 집을 구하던 중 알게 된 맹그로브 코리빙 하우스 지난 6월 14일에 가오픈을 해서 오픈 첫 날에 방문했던 후기를 적어본다. 코리빙 하우스란 개인 공간과 여럿이 쓰는 공간이 분리되어 있는 공유 주거 형태를 의미한다. 쉐어하우스와 비슷하지만 규모...,2021. 6. 29.
경동시장 장어 택배 : 경동민물 (캠핑요리 추천!!),분들 많은데 저처럼 야외에서 장어구이 해보시는 것도 좋을 것 같아요. 초벌을 해주시니 너무 간편해 야외에서도 집에서도 좋겠어요. 저는 이번주 뭘 먹어볼까요..?? 주소 : 서울특별시 동대문구 고산자로 458 경동민물 전화 : 02-959-2525 / 영업 시간 : 06:00~18:30 문자 : ***-****-**** / 카카오톡 : EEL5559,2020. 7. 13.
"[안암 맛집]제기집, 맛깔나게 양념된 닭곱창에 소주 한 잔!","제기집 주소 : 서울 동대문구 제기로6길 23 영업시간 : 매일 14:00 - 02:00 전화번호 : 02-925-3989 고대 앞 한 골목에는 닭곱창을 만날 수 있는데, 골목길... 추천합니다 서울에서 닭곱창을 접할 수 있는 곳이 많이 없으니, 한 번쯤 부담없이 한 잔하며 시도해보기 재미나요! #꿀벌여행 #제기집 #고대맛집...",2021. 5. 12.
생방송투데이 울진여행 오징어횟집 오징어회 더덕한우곱창 오징어통찜 오징어물회...,"3GO-울진 3GO 여행 편 ▶<월송정> 주소 : 경북 울진군 평해읍 월송정로 517 ▶<죽변항> 주소 : 경북 울진군 죽변면 죽변항길 124... 방배천로2길 41 번호 : 02-586-8683 인생 분식 30년 그 자리, 한결같은 마음 사랑방 떡볶이 편 ▶<숑가떡볶기> 주소 : 서울 동대문구 답십리동 66-39 번호 : ***-****-****",2020. 6. 26.
