header,contents,date
"인천과 경기의 랠리는 계속, 1년 뒤가 기대되는 지역은? 리브부동산...",아직도 힘들어하는 소상공인들이 많음을 진작할 수 있었습니다~~ 매주 주말이 되면 이웃님들과 여행을 떠나는 시간이 찾아오지요... 이번주는... 오산과 인천연수구도 불장을 보이면서 2위와 3위를 차지했고 경기지역에서 상위권을 독차지했네요... 포항 북구가 처음으로 TOP 10에 진입한 것이...,2021. 7. 25.
[송도문보트] 인천 송도여행 센트럴파크 수상보트를 타다!,바로 인천송도입니다! 저희가족도 오랜만에 인천송도에 센트럴파크에 갔는데요. 날이 좋아서인지 사람도 조금 있더라구요~ 공원산책만... 그리고 연수구 주민분들은 할인! 부럽습니다 ㅎㅎㅎㅎ 현재 투명카약은 운행이 안된다고 하네요 ㅎㅎ 입구에서 발열체크고 하고 있습니다....,2021. 3. 9.
인천드라이브코스 맛집부터 산책까지,송도 센트럴파크 송도 센트럴파크 인천광역시 연수구 컨벤시아대로 160 와 날씨가 좋으니 이렇게 레저도 할 수 있네요. 대부분 가족단위로 오신듯 했고 넘나리 재미나 보였어요. 저는 이날 체력방전으로 지쳐있어서 타지 못했는데 다음번 송도여행오면 꼭 타고 싶어요. 수상택시에 사람들 다다닥...,2020. 9. 13.
[인천 송도] 이베리코 전문점 '바른 고기'_소고기 같은 돼지고기 !!,"네이버 거리뷰 .영업시간: 평일15:00-24:00 / 주말,공휴일 12:00-23:00 (주말 break time 15:00-17:00) .위치: 인천 연수구 컨벤시아대로 81 1층 .주차: 드림시티... 제주도 흑돼지도 생각나고 다음여행으론 제주도를 가야겠어요 ㅎㅎㅎ 인테리어도 깔끔하고 맛도 깔끔했어요 !! 새로운 느낌의 돼지고기였습니다....",2021. 4. 26.
생생정보통 대통밥 한상 비법 24시 복탕 참게탕 대동맛지도 매운탕 특집 아재여행...,생생정보통 대통밥 한상 비법 24시 복탕 참게탕 대동맛지도 매운탕 특집 아재여행 김포 새우잡이 빛나라 청춘 현장 식당에서 인생 2막을... 주소 : 인천 연수구 인천타워대로 323 센트로드 2층 진한식당 박선영 생생정보통 <전통시장 쿠폰> 자세한 정보 https://sometv.tistory.com/45205,2021. 9. 13.
"[송도,인천]송도 돌핀커피로스터스 커피가 너무 맛있는 곳(디카페인가능,테이크아웃할인)",ㅠㅠ 제가 송도 여행 가기전에 이웃님 블로그에서 보고 카페 갈 곳을 정해 놨었는데요 어쩌다 보니 거기는 가지 못하고 호텔 근처에서 밥먹고 인근... ~~ 돌핀커피로스터스 주소: 인천광역시 연수구 컨벤시아대로 116 운영시간: 10:00 ~ 21:00(라스트오더 20:40) 주차:지하주차장 및 지상 공영주차장 (3시간...,2021. 10. 6.
인천연수동맛집 / 방문할때마다 최고인 러시아음식점 카라반,해외여행 온 기분 팍팍 들게했던 다시 가도 대만족 하고 나왔던 이색음식점 연수역맛집 카라반 카라반 옆에 작은 주차장이 있긴 하지만 언제나... 다시가고 싶은 집이예요 #인천이색음식점 찾으신다면 꼭 한번 방문하셔서 드셔보시길 추천할께요 카라반 전화번호 032-813-8122 주소 인천 연수구 함박로 60-1,2021. 4. 6.
"[송도 오크우드, 인천] 시티뷰,센트럴파크뷰, 버거룸181 수제버거, 맥주♥",여기저기 섞여서 기억은 잘 안 나지만 티비가 있어서 안 심심하고 좋았던 기억ㅎㅎ 나는 매일 반신욕하고 민송이는 매일 호텔에 있는 헬스장에 갔었다 맥쭈 삼겹살 지하에 있는 롯데마트에 가 장을 보고 요리를 해 먹은 사진ㅎㅎ 여행에 고기는 빼먹을 수 없죠! 버거룸 181 인천 연수구 센트럴로 160...,2021. 5. 4.
비오는날의 인천투어 [2021.03.28~03.29],송도 센트럴파크 인천 연수구 컨벤시아대로 160 Previous image Next image 사라진 더위사냥 꽁지 찾아요!! 흐려도 분위기 있다구 Previous image Next image 한옥마을 카페에서 커피한잔의 여유랄까?☕️ 요즘 코로나때문에 여행도 자주 못했는데 드라이브 겸 맛있는것도 먹고 좋은것도 볼 수...,2021. 3. 29.
"인천 송도에서 야무지게 1박2일 보내기 [스시사쿠,송도 오크우드 애프터눈티,일몰...",했는데 유리 반응도 좋아서 그렇게 송도로 떠나게 되었다 스시사쿠 인천 연수구 송도과학로16번길 13-18 119호 일정계획을 세세하게 못짜서... #여행 #1박2일 #당일치기 #송도 #인천송도 #송도여행 #인천송도여행 #인천송도1박2일 #송도맛집 #송도디저트 #송도카페 #송도일몰 #인천송도맛집...,2021. 8. 1.
"제주은희네해장국 인천 송도점_선지해장국 맛집 추천, 아침식사, 송도 센트럴파크","인천광역시 연수구 아트센터대로 87 운영시간 매일 07:00 - 22:00 국민지원금 사용 가능처입니다. 제주 은희네 해장국 송도점이 오픈했다고 해서 장인어른, 장모님과 추석연휴 기간에 방문하였습니다. Previous image Next image 은희네 해장국 사이트에 들어가보니, 최근에 인천송도점 포함 3개점이...",2021. 9. 21.
인천 문학동 한식 밀키트 마시따쿡과 함께 하는 가정간편식 요리와 BIG찬스 오픈...,"최근에는 캠핑족이나 여행, 1인 가구, 맞벌이 부부 등이 증가하면서 한식 밀키트에 관심도가 높아지고 있습니다. 일반적으로 밀키트는 택배를... 032-283-8008 #인천밀키트 #인천미추홀구밀키트 #인천문학동밀키트 #인천연수구밀키트 #인천남동구밀키트 #마시따쿡 #마시따쿡문학점 #마시따쿡인천...",2021. 9. 15.
인천 송도 카페 추천 : 아키라커피 송도점,"송도 카페 추천, 아키라 인천 연수구 청량로 92 독채 OPEN 11:30 ClOSE 23:00 인테리어는 일본 느낌 뿜뿜하죠? 다다미방부터 시작해서 왠지 일본여행 온 기분이랄까요 아키라 메뉴판입니다 아키라 화이트 6.5 아키라 그린 6.9 바닐라라떼 6.0 키세츠노오카 (딸기 크로플) 7.5 햇볕이 좋아서 사진도 잘...",2021. 3. 5.
인천 송도 커넬워크 맛집 :: 마담 샤브 칼국수 막국수,인천 송도 커넬워크 맛집 :: 마담 샤브 칼국수 막국수 / 2020.09.20.일 남자친구랑 송도에 갔다가 커넬워크에 있는 샤브샤브집에서 저녁식사를 하였습니당 :) 송도 커넬워크 [마담 샤브칼국수막국수] 인천광역시 연수구 아트센터대로 107 301동 111-115호 ☎ 0507-1358-3996 <영업시간> 매일 11:00 - 22:00...,2020. 10. 15.
러시아음식 ㅣ 카라반 ㅣ연수본점인천연수동맛집 / 연수역맛집 / 러시아음식점,더운날씨에 카라반에서 맥주와 특색있는 러시아음식 잊지못할 추억 해외여행온듯한 느낌이였어요. 코로나로 인해 여행을 가고싶은데 못가시는 분들 인천 연수구에 방문하셔서 이국적인 러시아음식 가족분들과 드시러가는건 어떨까요? 카라반연수본점 카라반 추천드립니다,2021. 5. 26.
제주 가을여행 ★나태주/오로라/마이진공연★,""" ★카카오 채널 추가 GO GO !! https://pf.kakao.com/_GmhLxb ★실시간 상담 카카오톡 오픈 채팅방 GO GO!! https://open.kakao.com/o/g2ORNVUb (주)행복나라여행사 인천 연수구 컨벤시아대로 116 (송도동 22-21) 푸르지오월드마크 7단지, 119호 TEL. 032 501 6603 E-MAIL. ************@*****.***",2021. 9. 16.
"인천 차박 장소 추천, 송도달빛축제공원에서 강아지들이랑 동반!",콩 푸 웅 ♡ 이렇게 같이 가족 돼서 함께 살게 된 지 1년도 안되었는데 워낙 산책도 같이 한 적이 많고 나 여행때마다 그 당시 남자친구였던 남편이... 푸추는 깨알 창문보며 드라이브~ 잼써따 인천 송도 노지캠핑 차박 @ 송도달빛축제공원 인천 연수구 센트럴로 350 화장실 있음 !,2020. 12. 13.
인천 송도 분위기 좋은 카페 : 스탠다드 스퀘어 / 처음 마셔보는 음료 ~!,연수구 컨벤시아대로 50 에 위치한 카페에요 :-) 번호 : ***-****-**** 주소 인천 연수구 컨벤시아대로 50 지번송도동 20-22 101동... #인천송도여행 오신다면 #스탠다드스퀘어 추천합니당~! 파트너스활동으로 일정 금액의 수수료를 제공받을 수 있습니다.,2021. 2. 7.
국내여행 인천여행 : 반짝이는 인천 송도 야경 그리고 맛있는 송도 백합 칼국수,"주소 인천 연수구 센트럴로 263 (송도동 29-13) 영업시간 매일 오전 10시 30분 ~ 오후 9시 30분 조개의 여왕이라 불리는 백합 국물로 시원하게 즐길 수 있는 백합칼국수! 칼국수보단 수제비를 더 좋아하는 편인데, 진짜 맛있게 싹싹 먹고 온거 있죠 ㅎㅎ 해물 베이스다보니 시원하고 국물맛이 정말...",2020. 3. 18.
인천 청학동 카페 CAFE 약속의 땅 예쁜 용담마을 안에 숨어 있었다!,"인천 청학동 카페 , CAFE 약속의 땅 주소 : 인천 연수구 청학동 454 상가건물 2층에 자리하고 있다. 상가 건물 입구에 안내가 잘 되어 있어서 찾기는 쉽지 않았다. 용담마을 안에 작은 상가 2층에 자리하고 있는 인천 청학동 카페 CAFE 약속의 땅 계단으로 올라가니 바로 보인다. 아기자기하게 잘 꾸며...",2021. 4. 20.
[영원투어] 인천 송도 오렌지듄스골프클럽 / 오렌지듄스GC / 오렌지듄스CC 소개 및...,영원투어는 예약이 마감된 골프장이라도 네트워크를 통해 취소티나 조인 연결을 통해 골프 여행을 설계해 드립니다. 어느 골프장이든 일단... 인천광역시 연수구 인천신항대로 1120 오렌지듄스 골프클럽 ◆ 인천 송도 오렌지듄스골프클럽 / 오렌지듄스GC / 오렌지듄스CC 코스 패널티...,2021. 9. 17.
코로나19를 피하라! 나 홀로 즐기는 인천 나들이 장소,"위치: 인천광역시 미추홀구 미추홀대로 716 (주안동, 메인프라자 7층) 문의: 032-427-6777 운영시간: PM 1:00 ~ 10:00 (월요일 휴관) 나 홀로 쇼핑하기 좋은 곳, 트리플스트리트 출처: 인천투어 인천의 연수구에는 볼거리, 먹거리, 문화콘텐츠가 있는 스트리트형 복합문화공간인 트리플스트리트가...",2020. 2. 20.
[인천 키즈카페추천] 슈퍼윙스키즈카페 송도점,"송도점 인천 연수구 한나루로 71 4층 매일 10:00~20:00 연중무휴 어린이기본입장가 ₩15,000 성인기본입장가 ₩5,000 아동이용 기본2시간 추가10분 ₩1,000... 해외여행은 언제쯤 다시 갈수있을까요?ㅜㅜ 비행기좌석에도 앉아보고^^ 이제 본격적으로 놀아볼까요~ 출동! 봉반장 4층에서부터 3층으로 연결된...",2021. 6. 5.
[송도][오크우드 프리미어 인천] 송도 호캉스 고층뷰 5성급 호텔 리뷰,이제 곧 가을 추석 연휴잖아용ㅎㅎㅎ 여행은 가고싶은데 시국이 이런지라 멀리 가지도 못하고ㅠㅠ 이럴땐 딱 호캉스죠!!! 그래서 얼마전 이모님 덕에 묵을 수 있었던 송도 호텔 후기를 공유할까 합니당 :) 오크우드 프리미어 인천 인천광역시 연수구 컨벤시아대로 165 체크인 15:00체크아웃 11:00...,2021. 9. 7.
"인천에서 가장 핫한 센트럴 파크, 송도 도심의 휴양지","새로나온 문보트는 연수구 주민 이용 시 10,000원 할인 가능합니다. (단, 주민등록증 제시) 참고로 송도 코마린은 드라마 도깨비 촬영지여서 매년... #인천 #인천투어 #인천여행 #인천가볼만한곳 #인천관광지 #인천축제 #송도 #센트럴파크 #수상택시 #수상레저 #코마린 #송도코마린 #해수족욕탕...",2020. 9. 15.
인천 송도 센트럴파크 내돈내산 맛집 [따룽훠궈],"#인천맛집 #인천송도맛집 #송도맛집 #인천훠궈맛집 #훠궈맛집 #따룽훠궈 #송도따룽훠궈 #송도카페 #송도센트럴파트맛집 #인천여행 #송도여행... 너무 먹는데 정신 팔려서 사진을 많이 못찍었지만, 훠궈맛집으로 적극 추천합니다ㅠㅠ 따룽훠궈 인천 연수구 센트럴로 160 103동 C동 2층 1. 인천 1호선을...",2021. 5. 25.
"[TV속 정보] 9월 2일(목) KBS2TV생생정보 , MBC생방송오늘저녁, SBS생방송투데이 나온...",행 (아주 재밌는 여행) -경기도 여주시> ▶ 오감체험농장 (포도 수확 체험) ☎ ***-****-**** 경기 여주시 강천면 가야리 16... 서울 양천구 공항대로 630 < 고수뎐 - 육즙을 위한 7일의 기다림! 일품 우대갈비> ▶전구식당 ☎0507-1330-1230 인천 연수구 컨벤시아대로 50,2021. 9. 4.
*인천애견미용 추천*_ 믿고 맡기는 연수동애견미용_멍쮸,멀리 여행가거나 하시는 분들은 이용하시면 좋을 것 같네요 대형견 위탁목욕도 이곳에서 깨끗하게 드라이까지 하면 좋을 듯@ 내부 모습이에요... http://blog.naver.com/mongjjyu1004 https://www.instagram.com/mongjjyu1004 위치 : 인천광역시 연수구 연수동 507-27 전화번호 : 032-812-9009 주차 : 매장 앞 가능,2020. 3. 10.
송도 센트럴파크 카페 오션97 여름느낌 물씬,인천 연수구 인천타워대로 257 (센트럴파역 2번출구) 송도 센트럴파크 카페 오션97 메뉴! 이렇게 음료수도 튜브에 넣어주니 놀러온 느낌나고~~♪ ◆ 카페 내부 :) 바닥도 바다처럼 모래사장으로 만들어놔서 분위기가 더해짐 ㅋㅋ 방명록에 장식품까지 여행온 느낌 ㅎ 카페는 지금 사진에 보이는게...,2021. 5. 10.
연수구 옥련동 마사지 파빌리온스파 만족스러웠어요,태국여행 갔을때 들렸던 고급스파에 온듯한 분위기를 잘 자아냈더라구요 (급 여행 가고 싶다....태국여행 좋았었는데) 아쉬운데로 오늘은 그 느낌... 장소였습니다 #연수구마사지 #옥련동마사지 #송도마사지 #인천송도마사지 #송도타이마사지 #송도아로마마사지 #연수동마사지 #파빌리온스파...,2021. 8. 17.
"[카페투어] 인천 송도 커피 맛집, 쿠키 맛집, <스탠다드 스퀘어>","9:30) ✔️ 인천 연수구 컨벤시아대로 50 / (지번) 송도동 20-22 101동 101호 ✔️ 주차 가능 (송도푸르지오월드마크 지하주차장) ✔️ 센트럴파크 공원 입구까지 도보로 약 15분 소요 송도에 여행을 오거나, 들를 일이 있을 때, 맛있는 커피 한 잔이 생각난다면 이곳 <스탠다드 스퀘어> 카페를...",2021. 6. 9.
"2TV 생생정보 비법24시 '대통밥 한 상', 대동맛지도 매운탕",아재여행] ■ 새우잡이 (사랑호) -위치: 경기도 김포시 하성면 금포로 1928 ■ 벼꽃농부 -위치: 경기도 김포시 하성면 마곡로 239 ■ 금빛수로 보트하우스 -위치: 경기도 김포시 장기동 2001-1 [빛나라 청춘] ■ 진한식당 -위치: 인천 연수구 인천타워대로 323 센트로드 2층 진한식당 다양한...,2021. 9. 13.
인천 둘레길 8코스 승기천과 문학산 코스정보와 여행포인트,인천 둘레길 8코스 승기천과 문학산 둘레길 코스정보와 여행 포인트 안녕하세요 :) 인천의 뿌리를 찾아가는 길 승기천과 문학산은 인천 둘레길의... [지하철] 인천1호선 동막역 2번 출구 문학산 인천의 옛 냄새가 묻어있는 이름 중에 하나입니다. 남구와 연수구에 걸쳐있는 문학산은 해발 224m...,2021. 5. 12.
<카페나들이> 아키라커피 인천 송도점,"해외여행 간 느낌, 이국적인 분위기의 #아키라커피 에 다녀왔어요 오픈소식 들었을때부터 너무 가고싶었는데, 코로나 터지고, 심해지고, 자유시간... 송도점 인천 연수구 청량로 92 독채 영업시간 / 주차관련 정보는 위 링크 클릭✓해주세요 가보고싶었던곳이라 저에게는 아주 만족스런...",2021. 4. 12.
"송도빵집_ 인생 소금빵을 맛 볼 수 있는 빵집, 샹끄발레르","송도빵집 - 인생 소금빵을 맛 볼 수 있는 빵집, 썅끄발레르 지난 2월에 송도에 여행을 왔다가 집 가는 길에 소금빵을 사가려고 했는데... 샹끄발레르 영업시간_ 매일 09:00 - 21:00 번호_ 032-831-2274 주소_ 인천광역시 연수구 컨벤시아대로130번길 14 방문날짜_ 210919(일)",2021. 9. 28.
연수구교통사고입원실 후유증 치료를 위해 찾는다면,연수구교통사고입원실 후유증 치료를 위해 찾는다면 현대를 살아가고 있는 사람이라고 한다면 일상생활을 하고 있으면서 다양한 부분에서... 이처럼 개인이 소유하고 있는 자동차를 이용하여 이곳저곳으로 이동하고 또 출퇴근은 물론 여행이나 드라이브까지 즐기려고 하는 사람들이 계속해서...,2021. 9. 9.
"인천사찰 송도 흥륜사 , 바쁨 속 평온함을 찾아서","인천사찰 송도 흥륜사 인천힐링여행 인천관광안내소에서 근무하고 있는 인천관광안내사입니다. 오늘은 인천 연수구에 위치한 인천사찰 '흥륜사'에 대해 포스팅을 하려고합니다. 요즘 날씨가 너무 더워지고 , 집에만 있기에는 갑갑한데 , 지금 코로나19로 인하여 인천의 박물관 , 공원 등이...",2020. 7. 13.
인천 뷰 맛집 송도센트럴파크 야경,00 (코로나19 상황에 따라 운영 여부가 변경될 수 있습니다.) 전화:032-832-3031 자차 이용 시에는 센트럴파크 공영 주차장 (연수구 테크노파크 164)을... 서늘한 가을 애인과 함께 가족과 함께 아름다운 야경을 볼 수 있는 송도센트럴파크로 놀러 오세요^^ #인천 #인천투어 #인천여행 #인천가볼만한곳...,2020. 9. 15.
[호캉스/호텔리뷰 :: 쉐라톤 그랜드 인천 호텔 리뷰!],위치: 인천 광역시 연수구 컨벤시아대로 153 입니다 호텔이 전부 모여있더라구요 입구 사진입니다! 정말 획기적이라고 생각한 부분이에요! 야외에 쉐라톤 포차라고 만들어 두었더라구요~ 저녁에 정말 사람들이 많고 다들 맥주 한 잔씩 하는데 정말 강추합니다! 인천 쉐라톤은 그랜드라 그런지 규모가...,2020. 6. 18.
"〔인천/선학동 맛집〕한우리산악회장 이,취임식 및 2/4분기정기모임을 '농원집'에서...",주소: 인천광역시 연수구 학나래로 45번길 4-4(지번:선학동 361-3) ☎032-815-0409 농원에 핀 원추리꽃 오후7시가 되었는데도 밖은 환하다. 야외라 모기가 걱정이 됐는데 사방에 선풍기를 가동하고 반찬을 놓은 통밑에 모기향을 피워 여름인데도 시원하다. 상은 차려지고 회원들이 모였다. 반찬은...,2020. 6. 27.
<인천/송도> 케이슨24 - 송도카페/송도데이트/송도여행/송도드라이브/루프탑카페...,"인천 연수구 컨벤시아대로391번길 20 케이슨24 1층 카페 드 라뻬 (카페) 09:00 - 24:00 연중무휴 2층 키사스 (다이닝 펍) 11:00 - 22:00 연중무휴 월-금, 브레이크 타임 15:00 - 17:00 케이슨 24 홈페이지 케이슨 24는 1층은 카페, 2층은 다이닝펍 레스토랑! 으로 구성 되어있었당 주차 공간은 조금 협소... 그래도...",2020. 2. 25.
인천 둘레길 9코스 청량산 봉재산 코스정보와 여행포인트,"봉재산 ~ 인천환경공단 여행포인트 1,600년 전 해상항로를 개척한 백제의 한나루 터, 일제강점기 경제수탈을 위해 설치된 수인선 철도 그리고... 송도의 금강산 청량산 연수구 한 복판에 우뚝 솟아 있는 청량산은 해발 157m로 산세가 깨끗하고 아름답다고 해서 붙은 이름으로 청량산, 청릉산...",2021. 5. 14.
"[인천맛집] 송도 맛집 카이웨이,홍콩분위기 제대로~",식여행 #좋반댓반 #좋아요반사 #소통해요 #인스타그램 #블로거 #블로그소통 #일상기록 #맛스타그램 #카페스타그램 #셀피#ootd #악세사리 #진주목걸이 #홀리다링 #월미도 #인천중식 #송도중식 #연수구맛집#홍콩#가지덮밥 #selfie #빈티지니트 #실버링 인천 송도에 위치한 #카이웨이...,2021. 3. 27.
"[SNS 서포터즈] 현대와 과거가 함께 숨쉬고있는 ""송도 미추홀공원""을 소개해요~",송도 미추홀공원은 인천 연수구 해송로 59 갯벌문화관에 위치해 있습니다. 미추홀공원은 센트럴파크와 마찬가지로 송도신도시에 아름다운 현대의... 멀리 여행을 가거나 좋은 시간을 보내긴 어렵겠지만 우리 지자체에 있는 아름다운 공간을 방문해 잠시나마 마음에 휴식을 취하고 색다른 공간을...,2021. 6. 2.
연수구보건소 첫 코로나 검사 후기,있는데 인천서울여성병원만 그런건지 다른데도 그런건지 몰겠지만 코로나검사 음성 결과가 필수라고 하더라고요. 그래서 연수구보건소로 코로나... 문진표는 이름 생년월일 사는곳 등 인적사항이랑 해외여행 다녀왔냐 증상있냐등등 일반적인 사항이에요. 문진표 작성안하고 접수대로 가시는 분이...,2021. 7. 3.
인천 칵테일 국가자격증 조주기능사 학원 바앤텐더 홍대 청춘마루 칵테일 출강 모습,세계여행!! 입니다 먼저 kb청춘마루 유튜브에 올라갈 영상촬영부터 했는데요 넘나 떨리는.....어버버버버..ㅋㅋㅋ 이번 수업은 회당 각기 다른... 티칭 인천 연수구 평생교육관 하우스맥주과정 강사 안양 안양여자상업고등학교 조주기능사 출강강사 안양 고등학교 칵테일동아리 칵스 자문...,2020. 10. 15.
[인천] 당일치기여행 “청라국제도시- 이태리공방 - 인천송도 - 트리플스트리트”,"(첫 인천인데, 마치 많이 와 본것처럼 ㅋㅋ) 인천의 차이나 타운과 을왕리 가 아닌 새로운 곳을 여행 하고 싶으면 이 당일코스를 추천 한다!⬇️ #청라국제도시 와 #이태리공방 은 서구에 있지만 #송도센트럴파크 와 #트리플스트리트 는 연수구에 있다.! 사실 슈퍼맨이 돌아왔다를 보면서...",2020. 11. 29.
역사가 문화가 되다 트렌드가 되다 #인천개항기역사길 #소제동철도관사촌,"인천항과 인천역이 다 중구에 있어 예전(舊)에는 인천의 중심이었으나 현대에 오면서 연수구, 부평구, 서구 등 다른 자치구에 비해 개발이 늦어져... 루비살롱 #인천개항박물관 #대전소제동 #소제동철도관사촌 #국내여행 #인천여행 #국내여행 #인천중구여행 #대전여행 #도시재생 #문화 #보존 #생활유산",2021. 2. 21.
어버이날!쉐라톤그랜드인천피스트 ♥,쉐라톤 그랜드 인천 위치: 인천 연수구 컨벤시아대로 153 쉐라톤 그랜드 인천호텔 인천대입구역 4번 출구에서 671m 쉐라톤 그랜드 인천피스트 외부... 쉐라톤 호텔 뷔페 내부 모습을 영상으로도 확인해보세요~ 2021년 5월 1일부터 다음달 30일까지 진행이 되는 팔도 식도락 여행 프로모션! 이번...,2021. 5. 11.
인천 송도카페:) 기노스코,송도 살면서 예전부터 가보고 싶었던 곳이었는데 마침 근처에 있어서 갔다 센트럴파크 근처라서 위치도 좋았다 - address 인천 연수구 송도동 83... 가보시길 ✨ #인천 #인천맛집 #인천카페 #인천송도 #인천센트럴파크 #인천가볼만한곳 #인천여행 #인천송도카페 #기노스코 #인천디저트카페...,2021. 3. 28.
●카라반●연수구러시아음식/연수구특색음식,"그녀의 추억여행이 되겠지? 카라반 인천 연수구 함박로 60-1 아시아음식,러시아음식 내부는 이국적이면서 깔끔했고 우리말고는 모두 외국인이었다~ 한 쪽면에 진열된 러시아 술과 주스~ 보드카...맥주... 러시아유학파 친구는 러시아에 술을 공부하러 갔다왔는지 역시 술술~~설명을 해준다~ 번호가...",2020. 5. 15.
"송도 디저트 카페, 헤이트래블러, 맛있는 크로플이 있는 여행카페, 커넬워크, 인천...","송도 크로플 맛집, 헤이트래블러, 커넬워크 디저트 카페, 인천 데이트코스 추천 인천 연수구 아트센터대로 87 커낼워크 겨울동 402동 144호 / 0507-1385... 게다가 주차요금도 전~혀 없으니 인천 데이트코스 로도 아주 추천해요. 인천 데이트코스 추천 헤이트래블러 는 송도 최초 여행카페 로서 여행에...",2020. 8. 27.
<직장인정규반후기>까늘레/바삭쫄깃 까늘레클래스/인천까눌레수업,오늘은 날씨가 너무너무 좋은 거 있죠~ 이런 날씨에는 따스한 햇살을 받으며 예쁜 풍경을 보며 여행을 해야 하는데 말이죠 하지만 시국이... 찾아오시는 길 인천 연수구 인천타워대로 323 송도센트로드 c동 502호 #송도원데이베이킹 #송도베이킹클래스 #까늘레 #까눌레 #패스트리 #더베이키...,2021. 6. 25.
인천 송도 돌잔치 전문! - 쎄쎄쎄에서 음식과 뷰를 동시에,"드디어 가게 되었습니다 쎄쎄쎄 송도점 0507-1356-3341 인천 연수구 컨벤시아대로165 포스코타워 7층, 33층 매일 10:00 ~ 18:00 코로나 기간동안 영업시간에... 태국 여행을 생각나게 할 정도였습니다 디저트와 커피도 한 잔~ 깔끔하게 디저트까지 다 즐기니까 아주 완벽했습니다 이날도 A~D홀까지 모든 홀이...",2021. 4. 26.
