header,contents,date
[SNS 서포터즈] 인천도시역사관 출입용 QR코드 찍고 방문하세요,꾸며져 인천 도시의 발전 모습을 관람할 수 있는데요. 먼저 1층 근대도시관으로 입장하면 조선의 중요 항구 가운데 하나인 제물포로 시간 여행을... 겪으며 안전하고 슬기로운 나들이 되시길 바랍니다. #연수구 #인천도시역사관 #QR코드 #생활방역 *연수구 SNS 서포터즈 6기 조연희님의 콘텐츠 입니다.,2020. 7. 29.
인천 연수구 청학동 송도 합성 엔진오일 교환 전문점 xpert 입니다^^,즐거운 여행 잘 다녀오시길 바랍니다 ㅎㅎ 삼성 XM3 고객님이 방문주셔서 하도 럭셔리 드라이브 5W40 으로 엔진오일 교환하여 드렸습니다... 강원도 여행 안전운전 하시고 즐거운 한주 되시길 바랍니다^^ 쉐보레 스파크 고객님이 방문주셔서 피닉스 5W40 으로 엔진오일 교환하여 드렸습니다...,2020. 8. 24.
[인천 송도 여행] 송도 카페 추천 | 큰 공간과 분위기가 좋아 만족한 송도 카페 글렌휴,인천송도여행코스추천 #인천카페 #인천카페추천 #인천연수구카페 #인천연수구카페추천 #인천연수구카페추천_글렌휴 #글렌휴주차 #송도베이커리카페 #송도베이커리카페추천 #송도베이커리카페_글렌휴 #송도빵집 #송도빵집추천 #송도루프탑카페 #인천송도루프탑카페 #송도루프탑카페추천...,2020. 8. 11.
[인천여행] 경원재 앰배서더 호텔 디럭스 더블 호캉스 + 삼복반상 후기,"저는 저녁을 연수구쪽에서 먹었는데, 택시비 왕복 2만원이 채 나오지 않아 괜찮았습니다. 또 바로 옆에도 맛있는 곳이 많고 걸어갈 수 있는 곳에도... 사진보다 더 좋은 호텔! 이 맞고여.. 호캉스 준비하는 분들 꼭 요 송도 경원재 가보세요.. 완전 강추합니다. (+송도 여행도 재미있어요)",2021. 8. 24.
"인천 이색데이트 :: 곰표 전시회, 표곰이 보러 가자~!!",있는 인천 이색데이트로 곰표 전시회를 추천해 드리려고 해요! 곰표 전시회 전시 기간 : 2021.07.20 - 10.03 전시 위치/장소 : 인천 연수구 청량로160번길... 실내에서 즐길 수 있는 인천 이색데이트로 추천드려요! #인천이색데이트 #곰표전시회 #곰표전시 #인천시립박물관 #인천시립박물관곰표 #인천여행,2021. 7. 29.
인천요양원/연수구요양원/청학동요양원/한가족요양원/오리,"저는 혼자서 동물원을 몇번 갔을만큼 동물원을 참 좋아하는데요, 모두 다같이 여행조차 못가게 될만큼 고생하는 상황이라 저도 못간지 오래 되서 참 쓸쓸하답니다. 여러분들은 최근에 보고 싶은 동물이 있으신가요? 그 동물은 어디서 주로 어디서 보셨나요? 저는 요즘에는 오리가 많이 생각이 나요....",2020. 11. 19.
"아시아나항공 OZ1588편 무착륙 국제관광비행 2편 - 부산, 대마도, 제주를 거쳐 인천으...","인천광역시와 송도국제도시의 모습이 내려다보입니다. 송도국제도시의 모습. 인천 남동구, 연수구, 문학경기장 모습 몇분 지나서 수원시의... 한국에 오신걸 환영합니다~ 해외여행 마치고 인천공항 돌아오면 보게 되는 문구인데, 코로나 시국에 이런 문구가 얼마나 그리웠는지 많은 생각을 하게...",2021. 2. 26.
서울마포구합정동출발~ 인천 옹진군 카니발리무진점보택시로 이동,"#인천여행 #카니발리무진투어 중구,동구,미추홀구,연수구,남동구, 부평구,계양구,서구,강화군,옹진군 코로나바이러스에 안전한 방역콜밴 출발부터 마무리까지 편안합니다. 이른 아침부터 늦은 밤까지 24시간 예약이용 가능한 #공항콜밴 새벽에 도착하는 비행기로 오실 때도 공항에서 버스...",2021. 9. 6.
"[인천_송도] 송현아 가는 길에 들리기 좋은 송도 신상카페, 컵피(CUPI) - 커피/디저트...","말차포카토 먹으러 갔다가 커피랑 파운드케이크에 더 반하고 온 송도 카페, 컵피(CUPI) 이번 휴일에 지난번처럼 급 여행을 가려다.. 정말루 숙소가... 주소 인천 연수구 송도과학로28번길 8 주차 지하주차장 있으며 무료~ (편리편리) 영업시간 주말 10:00 - 22:00 - Last order 21:30 평일 10:00 - 22:00 - Last order 21...",2021. 10. 11.
"(인천 송도 디저트 맛집) 홍콩와플 까이딴자이와 밀크티의 달콤한 조합, 홍콩다방 송도점","홍콩다방 송도점 주소: 인천광역시 연수구 신송로 153 더마란츠타워 104호 연락처 : 032-832-2853 영업시간 : 매일 12:00~23:00(명절당일휴무) *포장, 배달... 다 먹고 추가주문한 란퐁유엔 토스트 홍콩여행 마지막날 란퐁유엔에서 먹었던 토스트가 생각나서 계속 웅얼거렸더니 남편이 사줌ㅋㅋ 연유버터...",2021. 4. 7.
"인천맛집 송도갈비 본점 소갈비 먹고, 바다쏭에서 커피로 마무리",파란하늘과 너무나 잘 어울렸던 아름다운 정원과 폭포가 있어서 마치 여행을 간듯한 느낌 코시국에 어디 제대로 놀러가지 못하니깐 식사만이라도... 좋은 송도갈비 본점과 바다쏭이었다. ■ SFG 송도갈비 본점 - 주소 : 인천 연수구 능허대로 16 - 전화번호 : 032-831-0000 - 운영시간 : 11:30~22:00,2021. 9. 15.
인천 구월동 혼주메이크업샵 끌레르 잔치/연수구/송도/결혼식/올림머리/가족사진...,구월동리마인드메이크업잘하는샵 #혼주메이크업샵 #연수구 #송도 #구월동 인천 구월동 혼주메이크업샵 끌레르 입니다. 벌써 화요일 이네요 ~ 2020년은 더더욱 시간이 빨리 가는 것 같아요^^ 오늘도 오전에 면접 메이크업 헤어로 일찍 오픈 해서 일하고 나서 블로그 글 쓰러 왔답니다. 그럼 혼주...,2020. 6. 16.
[SNS 서포터즈] 언택트 여행을 할 수 있는 '송도국제캠핑장'을 가보다!,가까운 송도국제도시에도 새롭게 오픈한 '송도국제캠핑장(인천시 연수구 송도동 221-2/ 032)456-2865)'이 있어 이곳을 방문해 보았습니다. 주말 오전... #송도국제도시캠핑장 #송도국제캠핑장 #연수구언택트여행 #연수구캠핑 #연수구SNS서포터즈 *연수구 SNS 서포터즈 6기 백보미님의 콘텐츠 입니다.,2020. 8. 19.
인천카페 남촌회관_야경과 분위기에 취하고 커피맛에 취하는 베이커리 카페,있으셨어요 인천 연수구에 있었던 그 식당 이름이 바로 산너머 남촌이라는 곳이었고 너무 맛있게 식사를 했었던 기억이 납니다. 오늘 방문했던... 계시냐면요~ 인천카페 남촌회관의 분위기가.. 흠… 마치 동남아 여행가면 보는 5성급 호텔 프론트 같은 뭔가 고급스러운 그런 느낌? 화초와 인테리어...,2021. 9. 26.
"경원재 앰배서더 인천 디럭스룸, 조식뷔페 후기",경원재 앰배서더 인천 디럭스룸 1박 후기는 여기서 마칠게용~ 안뇽~ 아기랑 송도여행 / 경워재 디럭스룸 경원재 앰배서더 인천 주소 : 인천 연수구 테크노파크로 200 전화번호 : 032-729-1101 홈페이지 : https://www.ambatel.com/gyeongwonjae/incheon/ko/main.do,2020. 8. 4.
[MHN 여행]주말에 가볼만한 인천 언택트 여행지,언택트 여행지 3곳을 소개한다. 인천 연수구 송도 센트럴파크 송도국제도시의 핵심지구인 국제업부단지 내 첨단업무지구와 주거단지 가운데 위치한 송도 센트럴파크는 도시의 열섬현상을 막고 빗물을 효율적으로 재활용 할 수 있는 최신공법으로 조성되었다. 우리나라 최초로 해수를 끌어와...,2020. 10. 11.
"[인천, 송도] 송현아｜ 분위기 짱 송도 트리플스트리트 카페&라운지 바 : 제이앤제이슨","제이앤제이슨 0507-1320-7053 인천광역시 연수구 송도과학로16번길 33-4 트리플 스트리트 D동 202호 매일 14:00~22:00 오늘의 소개할 곳은 송도의 핫한... 동영상까지 촬영 완료 이걸 넋 놓고 보고 있으면 여행이 가고 싶어진다. 열심히 둘러보니, 술이 짜잔 양은 확실히 적지만 ㅎㅎ.. 맛과 모양은...",2021. 4. 7.
인천 다이어트 여리한다이어트 송도점 by 약손명가 따끈한 후기 가격정보,저도 미리 조금은 관리해두면 가족들과 맛난 음식을 먹거나 여행 때 허리띠를 조금 풀어도 다시 관리모드 들어가기 좋더라구요. 추석 명절... 주소: 인천 연수구 컨벤시아대로 81 드림시티 3층 전화번호: 032-831-4122 시간: 평일 10시~23시 / 토요일 9시~17시 30분 / 공휴일 10시~18시 (일요일 휴무) 다이어트...,2021. 9. 21.
"[송도 주차장] 포스코타워 송도 주차장 (쉐라톤 인천 주차장, 송도 롯데마트 주차장...",[삐와이부부가 편하려고 기록하는 주차정보 94번째] 인천 연수구 - 송도 주차장 : 쉐라톤 인천 주차장/ 포스코타워 송도 주차장 위치 : 인천광역시... #삐와이주차정보 #인천여행 #여행log #송도주차장 #인천쉐라톤주차장 #송도포스코타워주차장 #송도롯데마트주차장,2021. 9. 4.
[더카페쿠키] 아이와 함께 가볼만한 곳 / 인천송도/ 주말나들이/the cafe cookie,아이와 함께 좋은 추억 만드세요:) 쿠키 박스들고 행복하게 집으로 갑니다:) 더카페쿠키 전화번호 : 032-831-7412 주소 : 인천 연수구 신송로 153 지번주소:송도동 21-39지도보기 영업시간 : 평일 10:00 - 22:00 이웃님들의 공감과 댓글은 포스팅 힘의 원천입니다:),2020. 1. 7.
인천 송도숙소 문라이트 스테이에서 1박2일 호캉스?,제주도여행 잡아 놨었는데 결국 또 다 취소 했습니다 ㅠㅠ) 사람이 없는 한적한 곳을 찾기 위해 두리번 거리고 있는 듯 해요~ 8월에 남해에 우리만... 오늘도 무지 더울 듯 하네요 ㅠㅠ 행복한 주말 되세요~^^ 위치 : 인천광역시 연수구 아트센터대로168번길 100 예약은 네이버예약으로도 할 수 있습니다 ^^,2021. 8. 6.
[인천여행] 비오는 센트럴파크역 일대 송도국제도시와 6월6일 일요일 초여름날씨의...,"인천경제자유구역 송도국제도시(松島國際都市)는 인천광역시 연수구 일원의 해상을 간척해 조성되는 경제자유구역이며 약 40조원의 민간 자본 조달로 지어지고 있는 세계 최대 규모의 민간 도시 개발 사업이다(국가주도 신도시보다 하위 개념). 1990년대부터 본격 시작된 상하이, 싱가포르...",2021. 6. 7.
9월 18일 추석연휴 강원도 낚시 여행(2박3일) 1일차,오늘은 추석 연휴 낚시 여행(2박3일) 다녀온 포스팅을 시작하겠습니다. 토요일 퇴근 후 낚시 같이 다니는 스승님과 함께 강원도로 바로 떠났습니다. 인천 연수구-> 강원도 대진 급하게 차에 낚시 장비 실고 출발~~~ 중간에 팜파스 휴게소에 들려 밥을 먹고 다시 출발했습니다. #팜파스휴게소 휴게소...,2021. 9. 25.
"인천 송도 가볼만한곳 센트럴파크 나들이, 보트, 데이트","센트럴파크 인천 연수구 컨벤시아대로 160 공원 공영주차장 있음 송도 센트럴파크 공영주차장은 넓고 쾌적해서 좋아요~ 주차요금은 시간당 1,000원... 꿀잼이에유 >< #인천여행 #송도센트럴파크 #서울근교여행 #인천나들이 #인천데이트 #인천송도 #인천송도공원 #송도공원산책 #문보트 #구르미보트...",2021. 9. 4.
"인천항문외과, 휴가철 어떻게 관리해야 할까?",하며 여행 중 변의를 느끼는 경우 참지 말고 화장실을 가야 합니다. 항문 가려움증을 줄이기 위해서는 통풍이 잘되는 복장을 하고 항문부위를 건조하게 하는 것이 중요합니다. 이상 인천항문외과에서 여름 휴가철 항문관리에 대해 알려 드렸습니다^^ * 오시는 길 인천 연수구 컨벤시아대로 165...,2021. 8. 6.
"6월은 호국 보훈의 달, 인천상륙작전기념관에 방문하다",위해 인천시 연수구에 건립된 인천상륙작전기념관에 방문하였습니다. 인천상륙작전을 더 자세히 설명해드리겠습니다. 인천상륙작전은 1950년 6... #625전쟁 #인천상륙작전 #맥아더장군 #인천상륙작전기념관 #유엔군사령관 #낙동강전선 #인천광역시 #가볼만한곳 #역사적의미 #역사여행 #행정안전부...,2021. 6. 22.
인천 남동구 서구 연수구 송도 페인트처리 페인트폐기 페인트통폐기 형광등수거...,이번 설 연휴도 가족여행 가시는분들도 계시고~온 가족이 모여 오랜만에 이런저런 얘기도 나누고 명절 분위기내며 지내는 분들도 계실텐데요... #인천폐페인트버리기 #안산페인트처리 #광명페인트폐기 #시흥형광등폐기 #화분처리 #대형화분버리기 #화환처리 #폐형광등처리 #부천유품정리...,2020. 1. 22.
"[인천 송도] 라마다 호텔 디럭스 더블, 조식 후기","▷ 라마다 송도 호텔 ▶ 인천 연수구 능허대로267번길 29 ▷ 타입: 디럭스 더블 룸 (902호) ▶ 네이버 예약 오랜만에 인천 출장을 갔다가 숙박을 하게... 와우...ㅎㅎ 맛은 그냥저냥 먹을만 했다. 룸 컨디션과 주차 공간이 넓은 건 정말 좋았으나, 만약 출장이 아닌 여행으로 올 경우 절대 방문안할것 같다.",2021. 8. 27.
인천 송도 가성비 카페 '팔공티' 송도밀레니엄점 방문후기,코코넛커피 스무디 동남아 여행 가면 많이들 사 오는 코코넛커피의 맛과 굉장히 흡사해요 하지만 얼음의 비중이 너무 많은 듯해 금방 밍밍해지는... 인천 송도 가성비 카페 '팔공티' 송도밀레니엄점 위치안내 주소: 인천 연수구 컨벤시아대로 69 1층 127-1호 송도 밀레니엄빌딩 1층 전화: 032-858-8008...,2021. 8. 6.
인천 송도 왁싱 처음해보는 아나덴 슈가링왁싱 인천송도타임스페이스점 오픈샵 다녀온...,"오랜만이죠~ 희야왔어요 오늘은 다른 먹는이야기 여행이야기 그런것 아니구요 정말 살다가 처음으로 해보는 왁싱이야기를 해보려구해요 저만의... 인천송도타임스페이스점 인천 연수구 하모니로 158 (송도동) 송도타임스페이스 C동 301호 032-222-9664, ***-****-**** #인천왁싱 #송도동왁싱...",2021. 9. 6.
셀럽스테이송도 호텔 인근 가볼만한곳 핫한 야경명소 추천해요.,인천 송도 여행이 처음 이시라구요? 그럼 제가 추천 드리는 장소는 꼭 가보셨음 좋겠어요. 인천 송도는 낮과 밤이 모두 이쁜 곳이예요. 특히 밤... 송도 센트럴파크 인천 연수구 컨벤시아대로 160 여유있게 송도호텔 셀럽스테이에서 1박을 하는거라 밤 송도를 구경하러 나가야겠죠?...,2021. 8. 24.
"오랜만에 다녀온 송도 뷔페 쉐라톤 인천 피스트, 주말 디너!","내 입에는 양갈비랑 치킨스튜, 파스타, 아이스크림이 맛있었음! 가성비는 별로지만... 호텔뷔페니 기분 내고 싶을때는 나쁘지 않을거같다 여기까지.. 엄마가 사준 쉐라톤 인천 피스트 후기 끝^.^ 쉐라톤 그랜드 인천 피스트 #호텔뷔페 인천 연수구 컨벤시아대로 153 쉐라톤 그랜드 인천호텔 1층 피스트",2020. 4. 12.
인천 야경 명소 송도 센트럴파크 데이트하기 좋은 곳,"송도 센트럴파크 인천 연수구 컨벤시아대로 160 입장료 없음 / 공영 주차장(시간당 1,000원) 송도 센트럴파크의 랜드마크인 포스코 타워는 밤에 보면... 부산 더베이 못지않는 은은한 분위기 덕에 여행 온 기분까지 느끼게 해준다. 문보트는 타는 것도 물론 좋지만, 멀리서 보는 것만으로도 즐겁다. 여러...",2021. 8. 26.
필리핀 음식점 에이스크랩 인천 송도 맛집 추천,"보라카이 여행 때 기분을 몽글몽글 느낄 수 있어 너무 좋았던 인천 송도 맛집이다. 1. 에이스크랩 송도직영점 주소: 인천광역시 연수구 컨벤시아대로 60 전화: 0507-1481-0073 영업시간: 매일 11:30~22:00 / 주차 가능 메뉴: 칠크세트 38,000원(2인용) 갈크세트 38,000원(2인용) 송도 푸르지오월드마크 2단지...",2021. 5. 4.
"오르골 만들기부터 쿠킹클래스까지… 현지인이 기획한 지역 여행, 지역의 ‘진짜’...","지역의 진짜 이야기가 있는 곳, ‘관광두레’ 현지에서만 할 수 있는 경험 선보여 누구나 한 번쯤 여행을 떠나기 전 ‘현지인 맛집’을 검색해본... 가족과 함께 캠핑장을 찾은 신대범 씨(인천 연수구)는 “아이가 역사에 관심이 많은데, 통일을 염원하면서 함께 오르골을 만들었다”고 말했다. 한참...",2021. 2. 1.
"[인천] 인천상륙작전기념관, 수도국산달동네박물관,송도,김포 :: 인천 여행",옆에 인천상륙작전기념관이 있다. 그래서 식사를 하고 가게 되었다. 인천상륙작전기념관 인천 연수구 청량로 138 (옥련동525-11) 032 -832 -0915 매일 09... 트리플스트리트 #11브레드 #11bread #홀리데이인인천송도 #김포공항 #롯데몰 #롯데시티호텔 #아띠오아나폴리핏제리아 #인천가볼만한곳 #인천여행,2020. 10. 26.
연수구치과 주변 치아와 어우러지는 임플란트!,연수구치과 주변 치아와 어우러지는 임플란트! 맛있는 음식을 찾아 여행을 다니시는 분들이 계시는 것처럼 맛있는 음식을 먹음으로 행복함을... 인천연수구치과인 본원은 10인의 분과별 의료진이 협력 하여 다년간 난케이스를 비롯하여 일반치과진료에 대한 풍부한 경험으로 자연치아의 기능을...,2021. 4. 13.
국내 여행 야경 가볼만한곳 사진 투척~~,"1.경원재 앰배서더 인천 주소 : 인천광역시 연수구 테크노파크로 200 국내 여행 야경 가볼만한곳 경주에서 가장 인기있는 야경명소가 바로 월정교와 안압지랍니다. 안압지가 현재는 동궁과 월지였나? 지명이 그것으로 바뀐 것으로 아는데, 안압지는 입장료가 있고 월정교는 무료랍니다. 안압지는...",2021. 8. 6.
인천 | 송도 수제버거집 '버거룸181 BURGEROOM181',"2층에 위치한, 그 중에서도 볕이 잘 들어오는 자리여서 그런지 뭔가 여행 온 듯한 느낌이 들었고, 전반적인 인테리어도 벽돌 느낌 때문인지... 버거룸181 (BURGEROOM 181) 인천광역시 연수구 센트럴로 160 센트럴파크 푸르지오 주상복합 상가 A동 2층 평일 11:30 - 22:00 (브레이크타임 15:00 - 17:00)...",2021. 3. 20.
인천 송도 _ 소금빵이 맛있는 샹끄발레르,"샹끄발레르 인천 연수구 컨벤시아대로130번길 14 인천송도여행의 시작으로 샹끄발레르를 갔다. 소금빵이 너무 궁금해서 가봤다.. 토요일 오전 11시에 도착했더니 한시간을 기다려야했다... 이날 하늘도 너무 이쁘고 날씨도 좋았다 소금빵 나오는 시간은 12시, 3시였다..! 그래서 기다리는동안...",2021. 8. 18.
인천 맛집 송도 융건릉쭈꾸미 송도 맛집,오늘 인천에 장봉도라는 섬이 있어요 가려면 영종도 삼목항에서 배를 타야 하는데 여행가가전 든든하게 점심먹고 출발하려고 송도에 있는 융건릉쭈꾸미에갔습니다. 위치 & 주소 : 인천광역시 연수구 송도동 15-10 송도더프라우 주상복합3단지에 위치하고 있구요 야기 단지에 주차하시면 되요. 저는...,2020. 6. 30.
"인천여행 _인천송도, 신포국제시장, 자유공원, 차이나타운, 위크앤드카페 _ 밤에...",#신포닭강정 #위크앤드 #인천자유공원카페 #인천여행 #신포닭강정밤 #신포닭강정영업시간 #자유공원 #차이나타운 #인천송도 #인천육회맛집... (방이 정말 넓더라구요!!) 인천 스테이호텔 전화 : 0507-1416-0169 주소 : 인천 연수구 능허대로 181 야놀자 앱에서 예약을 하구 갔구 65000원에 전면뷰! 더블로...,2021. 3. 13.
[인천 송도] 운동 필수에요 송도 원모어피트니스,다 있어서 시원하게 스트레칭 할수있습니다~~ 거울도 있어서 자세보기 편해요! 아쉽게도 지금 코로나 때문에 샤워시설.옷은 사용 못하고 있습니다. 빨리 코로나가 끝나서 여행도 갈수있고 마스크 없이 운동하는 날이 왔으면 좋겠네요! 주소 : 인천 연수구 인천타워대로 323 전화번호 :0507-1446-1478,2021. 8. 17.
인천 송도 호캉스 오크우드 프리미어 인천 2 베드룸 슈페리어 상세 후기,"오크우드 프리미어 인천에서 세상 행복한 시간을 보내고 대부도 여행까지 잘 마쳤답니다. 오크우드 프리미어 인천 인천 연수구 컨벤시아대로 165 032-726-2000 65층 5성급 호텔 처음에는 영종도, 송도 호텔로 '네스트 호텔'을 염두에 두고 있었어요. 최근에 지인이 다녀왔는데 인피니티 풀이 있어...",2020. 6. 29.
[인천여행] 따뜻하면서도 미세먼지없는 늦은 겨울날 송도국제도시 인천대입구역 일대 및...,"인천경제자유구역 송도국제도시(한국 한자: 松島國際都市)는 인천광역시 연수구 일원의 해상을 간척해 조성되는 경제자유구역이며 약 40조원의 민간 자본 조달로 지어지고 있는 세계 최대 규모의 민간 도시 개발 사업이다. 1990년대부터 본격 시작된 상하이, 싱가포르, 두바이 등 도시들의 국제...",2021. 2. 27.
송도 맛집 후라토식당 트리플스트리트점,일본 여행에서 따온 뜻이라고 한다. 사진을 클릭하면 읽어보시기 수월함. 그 중 가장 유명한 규카츠. 오늘은 너를 주문 해 주겠어 우리가 앉았던... 인천이음카드 (인천지역화폐) 가능한 후라토식당 송도 맛집 후라토식당 트리플스트리트점 인천 연수구 송도과학로16번길 33-1 A동 2층 207-2호 인천...,2021. 9. 5.
인천 송도 횟집 킹크랩 맛있게 먹기,바다로횟집은 인천 연수구에 있는데요. 송도 GC와 가까운 위치에 있답니다. 독립적인 공간을 가지고 있는 횟집이어서 일반적인 작은 가게에서 하는... 이유에서든 도용을 허락하지 않습니다. 필요시 정당히 요구해 주시기 바랍니다. * 여행하며 사진 담아 공감하는 신양이의 공감포토에세이입니다.,2021. 6. 20.
[SNS 서포터즈] 인천시립박물관 우현마당에서 추억 속 협궤열차를 만나다.,지금의 열차와 달리 느린 속도로 달리는 수인선 협궤열차는 마치 여행을 떠나는 기분을 만듭니다. 느리게 가도 이상하지 않던 당시는 어쩌면... #연수구 #연수구청 #연수구볼거리 #인천시립박물관 #협궤열차 #수인선 *연수구 SNS 서포터즈 6기 이창해님의 콘텐츠 입니다.,2020. 12. 4.
인천 동춘동 :: 카페 블랙벤자민 / 도심 속 여행온기분! / 연수동 카페 추천,저녁약속 앞두고 #연수동카페 검색하다가 발견한곳 생긴지 얼마안된곳인데 너무 괜찮았다 인천 산다면 진짜 강력추천ㅎㅎ 카페 블랙벤자민 도심속 여행온기분 드는 아늑한 디저트카페 카페 블랙벤자민 주소 : 인천 연수구 청능대로78번길 21 (동춘동 1116-14) 전화 : ***-****-**** 11:00 - 21:00 / 월요일...,2020. 7. 27.
"인천송도맛집 에이스크랩, 세부음식 맛집 송도데이트 하기 좋은 곳 에이스크랩","에이스크랩 인천 연수구 컨벤시아대로 60 2단지 1층 0507-1481-0073 영업시간 평일 11:30-22:00, 브레이크타임 14:30-16:30 주말11:30-22:00 브레이크타임없음... 다시가고싶다 해외여행... 해외여행은 못가지만, 해외음식을 즐기러 왔다. 에이스크랩 #칠리크랩맛집 에이스크랩 너무 기대대지유 내부는 그렇게 큰...",2021. 9. 6.
쉐라톤 그랜드 인천 호텔 이그제큐티브 호캉스(Feat.센트럴파크뷰),"화니찌니가 2박3일 인천으로 여행을 떠났습니다. 첫째날은 쉐라톤 그랜드 인천 호텔에서 숙박을 하였고, 둘째날은 그랜드 하얏트 인천에서... 쉐라톤 그랜드 인천 호텔 인천 연수구 컨벤시아대로 153 032-745-1234 쉐라톤 그랜드 인천 호텔 주소 및 연락처 로비에 사람들이 많았어요;;; 제가 일찍와서...",2021. 9. 21.
"[송도 쉐라톤호텔] 쉐라톤 그랜드 인천 호텔 클럽라운지, 해피아워 주말 메뉴/시간/운영","호텔 - 인천> 쉐라톤 그랜드 인천 호텔 - 위치 : 인천광역시 연수구 컨벤시아대로 153 - 브랜드 : 메리어트 - 등급 : 5성급 - 보유시설 : 피트니스, 스파... 날~ #삐와이호캉스 #인천호캉스 #송도호캉스 #인천여행 #여행log #호텔리뷰 #호텔해피아워 #송도센트럴파크호텔 #쉐라톤그랜드인천호텔...",2021. 10. 11.
인천에서 송도 돈까스로 도쿄를 만나다 후라토식당트리플스트리트점,"여행을 가고싶어도 국내로만 가게되고 국내에서도 차박이나 사람이 많이 없는곳으로 가게되잖아요 외국여행이 그리울때는 음식을 먹으며... 픽하는거죠 인천 연수구 송도과학로16번길 33-1 A동 2층 207-2호 032-310-9383 #송도밥집, #송도돈까스, #송도카레, #송도점심 이 포스팅은 소정의 원고료를...",2021. 8. 29.
