header,contents,date
[인천여행] 현지인 추천받은 연수구 양꼬치 맛집 두만강양꼬치!,"인천여행 글 이제 한 4~5개 정도 포스팅 남은 것 같습니다. 두만강양꼬치도 인천 현지인 추천으로 다녀왔는데요~ 인천 출장을 종종가는 제 남친은... 인천음식 best top 5에서 한 3위 정도 차지하고 있습니다. 송도 경원재에서 출발 했는데요~ 꽤 거리가 멀다 싶었는데, 만원 안나오는 거리에 연수구가...",2021. 9. 8.
인천 연수구 역사여행 - 인천상륙작전기념관 방문기,"인천 역사여행 인천상륙작전기념관 방문기 인천시립박물관과 옥련동 일대를 지날 때면, ‘인천상륙작전기념관’에서의 추억과 기억이... 6·25전쟁과 인천상륙작전에 대해 자세히 알 수 있는 좋은 ‘안보 교육의 장’이라는 생각이 듭니다. 인천상륙작전기념관 032-832-0915 인천 연수구 청량로 138...",2021. 7. 5.
인천연수구네일 선학동 네일가연,ㅠㅠ 시원한 여름 패디 하고 해외여행 가구 싶당. 샵 가면 선반에 가지런히 정리된 매니큐어들을 보면 왜 그렇게 예쁜지 ㅎㅎㅎ 입구 쪽에 있는 이것들이 뭔가~하고 자세히 봤더니 하나하나 이름이 적혀있는 걸로 봐서 단골손님들이 쓰는 개인 도구들이 들어있는 것 같다. 단골이 많은 인천연수구네...,2021. 7. 23.
인천 연수구 수영장은 동남스포피아,많더라고요 인천 연수구 수영장 동남스포피아 알려드릴게요 코로나로 방학 같지 않은 방학을 보내고는 있지만 저도 휴가가 생겨서 아이들과 함께 즐거운 시간을 보내려고 많이 알아봤어요 4일 중 3일은 여행 계획이 있어 첫날 무얼할까 고민하다가 저희 아이들이 제일 좋아하는 수영으로 답정!!!...,2020. 8. 10.
[SNS 서포터즈] 인천 연수구 언택트 여행 산책코스,"코스는 인천 연수구 동네분들이 자주 이용하는 등산 코스라고 합니다. 마침 산행을 즐기는 시민이 있기에 여쭤보니 이 코스는 아시는 분들, 동네 주민들이 이용하는 산행코스라고 합니다. 둘레길처럼 조성된 산행코스를 따라 20분 정도 산행을 즐겨보았습니다. 최근 유행하는 언택트 여행지로 아주...",2020. 10. 21.
착한 소비 '아름다운 가게' 인천 송도점 - 인천시 연수구,"032-817-1113) 영업시간 : 월요일~토요일(오전 10시 30분~오후 6시) 오늘도 새벽부터 가을 장마로 비가 오락가락 하는 가운데 인천 연수구에 있는... 나도 자원봉사를 마치고 사고 싶었던 핑크색 손목시계(3500원), 하율이 폴로 티셔츠(5500원), 여행가서 입을 편안한 치마(3500원)를 구입했다. 4시간의 즐거운...",2021. 8. 28.
인천여행 연수구 송도국제도시,"연수구문화재단 김이슬_인천 연수구이야기_2020 :곳곳 나의 추억이 담긴 공간 좌측에서 우측으로 설명 하나씩 이어볼께요 ^^ 1. 능허대 인천광역시... 나의 발걸음으로, 배로, 수상택시 등의 여러 교통수단으로 다양한 시선을 두고 또 다른 여행길을 다닐 수 있는 곳. 8. 송도 트라이볼(공연장) 독특한...",2020. 6. 25.
소문내고픈 인천 연수구 맛집,이국적인 분위기에 현지식 그대로 느낄수 있어서 여행하는 기분으로 식사를 할수 있었던 곳이었어요. 데이트장소로도 추천할만 합니다 5. 인천 연수구 임파스토 주소 : 인천 연수구 아트센터대로 203 전화번호 : 0507-1318-1223 영업시간 : 월요일 휴무 / 둘째 넷째 일요일 휴무 다양한 메뉴가 마음에...,2021. 4. 18.
인천연수구맛집 교대이층집 삼겹살 킹왕짱,송도여행을 오면서 인천연수구맛집 탐방을 하면서 신랑과 술한잔은 기본이라 생각했는데ㅠ 나의 몸 상태 땜시 결국은 신랑혼술이 되어보림 그리고 구운 쑥떡 와 이거 짱맛임 조청 에다가 담아주시는데 따듯할때 먹어야 해요 그 사이 삼겹살 까지도 먹기좋게 잘라져서 마무리 중 가니쉬들은...,2021. 10. 7.
[동네탐험][인천연수구] 능허대공원,한 20분 둘러 보고 한 시간 정도 그림을 그렸다. 이제 집에 가야지. #인천연수구 #옥련동 #능허대 #능허대공원 #고대백제사신선 #동네탐험 #인천문화재산책 #동네탐험 #야외스케치 #어반스케치 #수채화 #칼디페이퍼 #여핸드로잉 #여행스케치 #펜드로잉 #urbansketch #watercolor #pendrawing #동네산책 #옥련동산책,2021. 9. 9.
인천 연수구 가족사진 뜻깊었던 시간들,그러다가 우연히 인천 연수구 가족사진 스튜디오를 발견하고 이곳에서라면 부모님께도 특별한 선물을 드릴 수 있겠구나 싶어 망설이지도 않고 방문했어요. 이곳에서는 의상 대여까지 가능했는데요. 그래서 따로 옷을 챙겨가지 않아도 스튜디오 안에서 맞춰 입을 수 있었죠 그동안 일하느라고 바빠서...,2021. 5. 11.
인천 연수구 연수동 마사지 파빌리온 아로마마사지 받고왔어요.,코시국에 해외여행은 못가더라도 해외를 방불케하는 인테리어로 마치 해외에 놀러 온듯한 착각을 불어일으키는 인천 연수구 연수동 마사지 파빌리온 스파에 방문했어요. 편안한 공간에서 받는 마사지로 일상에서 쌓인 스트레스 해소와 피로회복에 도움을 주는 마사지는 주기적으로 받으면 확실히...,2021. 7. 29.
[인천 송도 맛집] 연수구 데이트 핫플레이스 고기집 신세계 갈비를 맛보다!,[인천 송도 맛집] 연수구 데이트 핫플레이스 고기집 신세계 갈비를 맛보다! 인천으로 여행을 가서 잊지 못할 인천 송도 맛집을 찾았는데 또 가서 먹기 어렵다는 건 너무 너무 아쉬워요. 혹시라도 인천에 방문해서 식사를 하실 일이 있다면 꼭 방문해보시라고 추천하고 싶어요. 매장명: 당산오돌 송도점...,2021. 10. 7.
[사찰 여행] 인천 연수구 연경산 청학사 방문,그래서 국내 여행을 할 때도 그 지역 근처에 있는 절은 되도록 일정에 넣고 해외여행을 할 때도 기회가 있으면 그 나라의 절이나 사원을 방문하곤 했어요. 이제는 시국이 시국인지라 너무 옛날 일 같지만요. ( ´╹ᗜ╹`*) 아무튼 오늘은 6월 초 방문했던 인천 연수구 청학사라는 사찰에 대해 글을...,2021. 6. 25.
가볍게 등산하고 아름다운 노을 풍경 감상! 인천 연수구 청량산,인천 연수구 청량산 일몰이 멋지다고 하여 가을이 찾아오는 9월의 어느 날 청량산을 찾았습니다. 청량산은 처음인지라 어느 곳에 주차하고 등산을... <인천 청량산> ※ 코로나19 확산세가 안정될 때까지 우리 모두 잠시만 S.T.O.P! ※코로나19가 잠잠해질 때까지 당분간 여행ㆍ관광은 자제해 주세요!...,2021. 9. 15.
계속 끌리는 매콤함이 좋았던 인천 연수구 맛집,핸드 연지입니다 :) 남자친구랑 이번에 세부 여행을 느끼고 싶어서 인천 연수구 맛집에 다녀왔어요. 에이스크랩이라고 세부에 있는 음식점인데요 인천에 오픈을 했다고 하길래 바로 다녀왔어요~ 업체명 : 에이스크랩 주소 : 인천광역시 연수구 컨벤시아대로 60 2단지 161호 주차 : 가능 지하주차장에...,2020. 12. 19.
연수구 가성비호텔 <브라운도트 호텔 인천 송도점> 스탠다드 트윈 베드 후기!!,인천송도점 추천드립니다 :) 인천광역시 연수구 능허대로 277-7 체크인 15시 / 체크아웃 12시 #연수구가성비호텔 #연수구호텔추천 #브라운도트호텔인천송도점 #송도여행호텔 #인천송도여행 #인천송도호텔추천 #인천송도가성비호텔 #옥련동호텔 #옥련동호텔추천 #브라운도트호텔 #알리스위트호텔,2021. 6. 11.
"인천 연수구 송도 현지인 입맛의 커리 파키스탄 인도카레 맛집, 할랄푸드 아라베스크",해외여행을 못간지 1년하고도 6개월이예요 이런 나의 불만을 외국현지 맛집으로 풀고있는 요즘이예요 ㅎㅎ 음식으로나마 외국의 정취를... 주소는 인천광역시 연수구 능허대로 267번길 30 연락처는 032-589-6900 코로나 시국에 맞게 온도측정과 전화인증을 하고 손소독을 해주어요 넓은 매장...,2021. 9. 5.
[SNS서포터즈] 인천 연수구 도심 속 공원 용담공원 가을산책,생활 속거리두기를 철저히 지키면서 지역 간 이동 및 장거리 여행은 조금은 자제를 하면서 내가 살고 있는 동네에서 가벼운 산책 또는 운동을 즐기면서 가을을 느껴보는 것도 아주 좋을 것 같습니다. 그래서 준비했다! 인천광역시 연수구에 위치한 도심 속 공원 용담공원입니다. 소개할게요 가을에...,2020. 10. 29.
인천 연수구 맛집 송쭈집 쭈꾸미 연수에 상륙!,개인의 생각을 반영하였으며 좀 아닌건 아니라고 했고 좋은건 좋다 했으니 보편적으로 참고하시길 사전적으로 말씀드립니다 :) 인천 연수구 맛집을 찾아서 떠나는 여행을 만나다. 송쭈집 연수 직영점을 방문한 후기를 전합니다. 이곳은 연수동의 자존심! 메이져 송쭈집입니다. 본점은 인근에 있고...,2021. 3. 29.
달달 대게 폭식♬ 인천 송도 맛집 연수구 크래버 대게나라,이번 강화도여행의 대미를 장식한 마지막 폭먹 장소를 고민하다 동선 안에 인천 송도 맛집 대게나라 송도점이 있길래 컴백홈 길에 들러 푸짐한... 인천 연수구 더샵 센트럴파크2 내에 자리한 송도 킹크랩 대게 전문 크래버대게나라. 입구에 들어서자마자 주산지에서 직접 공수한 특상급 싱싱한 생물...,2021. 6. 26.
[인천 여행] 인천 연수구 / 송도 센트럴파크,"공원 중 하나인 송도센트럴파크, 공원 여기저기를 다니다보면 사람이 만든 자연도 아름답다는 사실을 알게 된다. - 출처 네이버 지식백과 송도 센트럴파크 호텔에서 내려다본 전망 가장 좋아하는 건물은 단연 더위사냥 타워 2016. 7. @ 인천광역시 연수구 컨벤시아대로 160(송도동 24-5) 송도 센트럴파크",2020. 11. 10.
인천 여행 중 들른 연수구 송도 맛집 남도향 리뷰~!,인천 여행을 계획하며 ~ 여행 끝 무렵 마지막 날 저녁에 들른 연수구 송도에 위치한 남도향! 당일 점심 먹긴 했는데 뭘 먹은 건지 ~ 기억이 안날 정도로 배 두둥 맛나게 포식했던 담양식 숯불갈비. 그날 점심은 뭐였지? 모르겠다 찬찬히 생각해보고 포스팅 해봐야겠다 ㅜ.ㅡ 생각이 안 나니~ 분명 멀...,2020. 5. 6.
느티나무 우드슬랩 @ 인천 연수구 그린위크 아파트,세상을 삐닥하게 보기 좋아하는 작자들은 바이러스 시국에 공항이 붐빈다고 여행자들에게 손가락질을 합니다. 이러니 세상이 이모양이라며... 인천 연수구 그린위크 아파트에 나간 느티나무 우드슬랩 인천에는 꽤 많은 우드슬랩 회사가 있습니다. 영림목재를 비롯하여 여러 슬랩을 만드는 회사들이...,2021. 7. 21.
"[인천] 송도마사지샵, 연수구마사지 '파빌리온스파' - 타이마사지 (해피타임 이벤트)","파빌리온스파 인천 연수구 청량로 117 032-832-4450 매일 00:00 - 24:00 파빌리온스파는 옥련동에 위치해있어요 도로변에 엄청 크게 위치해서 눈에 확... 직원 분이 루프탑 구경해보시라 해서 귀찮지만 올라갔던거였는데..^^ 세상에 ~~~ ♡ 커피, 차, 음료와 라면도 무료로 먹을 수 있고 진짜 여행온...",2021. 9. 13.
인천복층빌라매매 연수구 옥련동 축현초등학교 신축 복층테라스,시기인만큼 여행을 떠나기 부담스러워 하시는 분들이 많으실거라고 생각이 드는데요 집안에 거주하시는 시간이 많다보니 집 안에서 야외 활동을... 보았습니다 인천 연수구 옥련동 축현초등학교 도보 2분 통학거리를 제공해주는 인천 복층테라스 신축빌라는 차량 이용 시 수인분당 송도역까지...,2021. 7. 30.
인천 동네 탐방기! 가을바람 느끼기 좋은 연수구 새싹공원,인천 동네 탐방기! 가을바람 느끼기 좋은 연수구 새싹공원 코로나19로 여행이나 관광이 자제되고 있는 요즈음 지친 몸과 마음을 관리하기 쉽지 않으실 텐데요. 오늘은 푸른 녹지 공간에서 시간을 보내기 좋은 인천 연수구 새싹공원에 대해 소개해드리겠습니다. 옥련초등학교 앞에 위치한 새싹공원은...,2021. 9. 27.
인천 :: 부띠끄 연수구 호텔 498에서 넷플릭스 ♥,"수용가능한 수영장이 있는 방도 있고 가든, 글램핑룸도 있어서 호캉스하기에는 정말 딱이에요 그리고, 실시간예약도 가능해요 :) 방이 나가지 않았다면요 ㅎㅎㅎㅎ 다음엔 여러명이서 수영장이 있는 방에 숙박해보고 싶다 ! #인천호텔추천 #인천분위기있는호텔 #인천호텔498 #호텔498 #인천연수구호텔",2020. 6. 27.
"(전주3GO여행), 우리동네 반찬가게(인천 연수구), 빅데이터 랭킹맛집(순댓국TOP5)...",3GO - 전주 3GO 여행 편 ▶ <한국도로공사 전주수목원> 주소 : 전북 전주시 덕진구 번영로 462-45 번호 : ***-***-**** ▶ <한복남... 우리 동네 반찬 가게 - 따스한 마음으로 나눔을 실천하는 착한 반찬 편 ▶ <엔젤푸드> 주소 : 인천 연수구 청능대로23번길 11 번호 : 070-7556-1279...,2021. 5. 7.
인천 연수구계단청소 부부크린,"좋아서 여행하기 좋은날씨네요 주말에는 맛있는 음식도 많이드시구요, 가족과 함께 즐거운 시간 보내시길 바랄께요 코로나바이러스 항상 조심하시구요 오늘은 인천 연수구 송도동 원룸건물에서 정기적인 계단청소를 요청하셔서 다녀왔습니다 연수구 모든지역 동춘동,선학동,송도동, 연수동,옥련동...",2021. 4. 11.
인천 연수구 요기요양 재가노인복지센터의 찾아가는 방문요양 서비스란?,인천 연수구 요기요양 재가노인복지센터의 찾아가는 방문요양 서비스란? 코로나19로 인해 우리의 일상 생활에 많은 어려움이 따르고 있습니다.... 여행이든 출장이든 친적집이든 며칠만 집을 떠나 있어도 집 현관문을 여는 순간 밀려오는 안도감은 표현할 수 없지요. 특히 몸이 불편하신 어르신들은...,2021. 8. 24.
인천썬팅 인천연수구썬팅 대영상사에서 콜로라도 나노필름으로 시공 하기,인천썬팅 인천연수구썬팅 대영상사입니다. 진짜 가을 날씨가 만끽인 요즘 인데요. 하지만 코로나의 확진세는 전혀 줄어들지 않아서 2천명이... 그래도 어서 빨리 일상생활을 할 수 있도록 변이가 잘 잡히는 백신이 빨리 개발되어 해외여행도 어서 빨리 가고 싶네요. 그런 날을 기다리며 오늘의...,2021. 9. 9.
인천 연수구 송도유원지 소금커피 “세인트커피”,032-464-9064 인천 연수구 청량로 67 대만에 소금커피로 유명한 “85도씨” 아시죠?? 대만여행갔을때 맛있게 먹어서 또 먹고싶었는데 밍샤가 인천에도 소금커피집이 있다고 맛있다며 추천해줬어요 운영시간 매일 11:00 - 22:00 주차는 가게앞에 이중주차로 하면되는데 음 주차장 상태가 좋지는 못해요!...,2021. 5. 30.
인천 연수구 강아지 장례 단독 화장의 중요성,인천 연수구 강아지 장례 화장 어게인은 보호자님의 마음까지 치유받을 수 있도록 진실되고 거짓 없는 투명한 장례만으로 반려동물과의 추억을 추모하며 단독 화장으로 합법적으로 안전한 게 마지막 이별 여행을 할 수 있습니다. 잘못된 반려동물 장례식장 선택으로 그 피해는 고스란히 보호자님의...,2021. 9. 1.
"카라반 (KARAVAN) - 인천 함박마을 나들이, 고려인마을, 연수구 연수동","함박마을 인천 연수구 연수동 위치. 이 마을에 들어서면 마치 다른 나라에 온 듯 키릴문자로 쓰인 간판들이 눈에 띄는데, 거리에서도 러시아어... (여행을 못가니 인천 하나 가는 데에도 의미 부여 ㅋㅋ) 암튼 그렇게 가서 점심 먹을 양으로 찾아들어갔던 러시아 음식점, 카르반. 구글이나 네이버에...",2020. 11. 15.
[아버지와의추억여행] 인천 연수구 횟집 오픈!! 바다로 에서 아들들 생일을 축하해 주시다.,스마트에드 입니다.벌써 아버지와의 추억여행 2탄입니다. 이번에는 저희 두아들의 생일을 직접 챙겨주셨는데요~ 저는 7월12일. 제 동생은 일주일 후 입니다. 이번에는 아버지 동네에 있던 회집이 이전을 했다는 이야기를 듣고 가보고 싶다는 말씀을 하셔서 오픈도 축하하고 저희 생일도 측하를 할겸...,2020. 7. 21.
인천 연수구 동춘동 아파트누수원인점검 화장실방수공사(타일깨지않고...,"하늘은 어찌나 맑은지 초미세먼지수치가 10이하로 떨어져있었던,,, 이런날이 여행하기 딱 좋은날인데, 코로나19로 온세상이 셧다운상태네요.. 지난 12일 다녀온 방수공사 작업내용입니다. 인천 연수구 동춘동 풍림3차아파트 고객님댁 다녀왔구요. 아랫세대 거실화장실 점검구 넘어 누수부위...",2020. 3. 16.
"인천 연수구 사찰, 문학산 둘레길에 있는 고즈넉한 청학사","저는 종교가 없지만 자연을 좋아라 해서 오래된 사찰여행을 자주 하는데요. 지난 주말에는 문학산과 연결된 연경산에 있는 인천 연수구 사찰, 청학사를 다녀왔어요. 날씨도 화창하고 높지 않은 산자락에 있어서인지 트레킹하는 분들도 가끔 만날 수 있었는데요. 저희는 차로 방문했어요. 청학사에...",2021. 5. 13.
인천 연수구 사찰 청학사에서 가을 풍경을 담다,인천 연수구에는 비교적 작은 규모의 호젓한 사찰이 있습니다. 문학터널과 청솔공원 사이에서 청학사 입구를 찾을 수 있었는데요. 문학산 자락의... 전국으로 여행 다니는 걸 좋아해서 절 구경하는 게 이제는 꽤나 익숙해졌나 봅니다. 주변을 둘러보는데 전혀 낯설지가 않더라고요. 이곳 청학사...,2020. 11. 25.
"인천 연수구, 함박마을 외국인 대상 얀센 백신 자율접종","단 여행 목적 등으로 한국을 방문한 단기체류자는 백신 접종대상에서 제외되며 기타 자세한 사항은 연수구보건소 콜센터로 문의하면 된다.... 아니라 연수구 거주 외국인이면 누구나 접종이 가능하니 이번 접종에 적극적으로 참여하길 부탁드린다""고 말했다. (끝) 출처 : 인천연수구청 보도자료",2021. 8. 26.
[인천_연수구] 인천송도 가족여행 데이트,저는 저녁식사 후 이곳에서 산책하며 즐거운 하루를 마무리했답니다. #블챌 #오늘일기 #송도맛집 #송도햄버거 #송도맛집추천 #송도소개팅 #송도야경 #인천연수구송도맛집 #인천연수구야경 #송도산책 #송도가족여행 #인천데이트추천 #인천소개팅산책,2021. 5. 1.
파빌리온스파에서 커플마사지 받고왔어요 !! 인천 송도 마사지 / 연수구 타이마사지,불법 행위는 하지 않는다고 되어있어요~ 제가 받아봤더니 믿음직 합니다 ㅎㅎ 인천 연수구 타이마사지 파빌리온스파는 일반 합성 마사지 오일이... 마사지샵 오니까 넘나 태국 해외여행이 그립네요 ㅜㅜㅜㅜㅜ코로나로 인해 해외는 갈 수 없으니 이렇게라도 태국의 향을 느껴보아요 ㅎㅎㅎ 먼저...,2021. 5. 30.
인천 연수구 송도동 임장기 (송도더샵퍼스트파크),"어제 임장 겸 여행으로 인천 송도에 다녀왔습니다 ^^ 송도는 꼭 가보고 싶은 지역 중에 한 곳이었는데요. 그동안 송도, 송도 말로는 많이... 인천 연수구가 투기과열지구로 지정되면서 지방광역시 시세 날라갈 때 다소 주춤한 모습이었는데요. 이제 지방광역시도 규제지역으로 묶이게 되어...",2021. 1. 28.
"아이와 함께 한옥 스테이, 인천 연수구... 마켓가든, 아이와 인천여행.",ㅋ 시국이 시국이였던만큼 여행 후기도 뭔가 인스타에 사진 한장 달랑 올리고 끝내야했던;;; 이제 더는 늦출수가 없어 하나씩 정리해보려는 오래된 여행 후기..ㅎㅎ *오픈하자마자 다녀왔던거라 현재와는 상황이 다를수 있어요 :) 제가 방문했을 때는 없었는데 다시 확인해보니 한옥 외부에 모래...,2021. 5. 4.
인천 연수구 동춘동 카페 아키라커피 송도점(AKIRA COFFEE),"일본으로 여행을 다녀온듯한 느낌을 받은 아키라커피 송도점 고즈넉한 인테리어와 자꾸만 생각나는 시그니처 커피, 크루아상으로 만들어진... 꼭 한번 다녀와 보시기를 추천해요 ٩(●'▿'●)۶ 아키라커피 송도점(AKIRA COFFEE) 인천 연수구 동춘동 791 평일 11:30-23:00 주말 11:00-23:00 휴무는 인스타 참조",2021. 6. 17.
성인 취미 미술 / 인천 연수구 청학동,보통 색연필화나 여행스케치등으로 근사한 효과를 낼 수 있는 작품들을 많이 하지요. 그런데 우리 른이클래스 수강생님들은 노후 대책으로 그림을... 교육문의 : ***-****-**** #청학동성인미술 #연수구성인미술 #인천성인미술 #송도성인미술 #송도취미미술 #청학동취미미술 #연수동성인미술...,2021. 9. 12.
연수구 백제 사신(百濟 使臣)길 - 인천 청학동 문학산,불기 2564년 5월 30일(윤4월 초파일) 부처님 오신날 인천 여행 : 연수구 문학산 백제 사신(百濟 使臣)길 *** 문학터널 *** *** 백제 우물터 *** ***삼호현(三呼峴) 전통 숲 *** 삼호현 : 세 번 이름을 부르고 이별하던 가슴 아픈 전설을 지닌 곳. 문학동에서 청학동으로 넘어가는 문학산과 연경산...,2020. 5. 30.
인천 연수구 안경원 으뜸50안경 인천연수점에서 멋진 안경을 장만했어요!!,인천 연수구 안경원 으뜸50안경 인천연수점에서 멋진 안경을 장만했어요!! 요즘 긴급 재난 지원금이 풀리면서 식당이나 패션의 수요가 많이... 외부에서는 선글라스처럼 사용하고 있어서 여름철에 여행하면서 착용하기 딱 좋은 안경이 되어 줄 것 같아요~ㅎㅎ 현재 저의 스타일과도 잘 어울려서...,2020. 6. 4.
인천 연수구 함박마을 러시아 우즈백 특별한 아써르티 빵집 다녀왔습니다!,Previous image Next image 치즈 와 식료품 그리고 러시아로 여행 갔다오시면 많이들 사오시는 초콜릿도 팔고 있어요~! 구경하는 재미도 있고 하나씩... #인천 #연수구맛집 #인천빵집 #인천연수구빵집 #연수구빵집 #연수동빵집 #아써르티 #연수아써르티 #함박마을 #연수함박마을 #선학역빵집 #인천러시아빵집...,2021. 5. 24.
[인천 연수구 동춘동 맛집] 판모밀과 만두를 청실홍실에서 포장해서 먹기!,"오늘은 포장해서 맛나게 먹을 수 있는 인천 연수구 동춘동 맛집 청실홍실 후기입니다. 청실홍실은 인천 신포시장에 본점이 있습니다. 본점에서... 여행을 가야하는데, 요새 여행을 못가서 동네 맛집 다니는 것 일상들을 올리고 있네요. 얼른 여행으로 찾아뵐 수 있도록 할게요! 끝까지 읽어주셔서...",2021. 6. 16.
"피톤치드 느끼며 가벼운 운동하기 좋은 곳, 인천 연수구 대암공원","피톤치드 느끼며 가벼운 운동하기 좋은 곳, 인천 연수구 대암공원 인천광역시는 도심 속에서 시민들이 힐링할 수 있는 공간 조성을 포함해 다양한... T.O.P! ※코로나19가 잠잠해질 때까지 당분간 여행ㆍ관광은 자제해 주세요! ※ 본 게시글은 제9기 인천시 블로그 기자단 전재현 님이 작성하였습니다.",2021. 9. 1.
[인천 여행] 인천 연수구 / 일렉트로마트 연수점,일렉트로마트는 이마트에서 운영하는 체험형 가전제품 매장이다. 이 아이 이름이 그루트인가 마블에 나오는 아이라고 알고 있다(본 일은 없음) 귀여운데 마빡에 가격표는 좀 2018. 5. @ 인천 연수구 경원대로 184 (동춘동 926-9) 일렉트로마트 연수점,2020. 11. 15.
인천연수구브런치카페추천 컨벤시아 나이로비커피비스트로,를 들으신다고 하셨는데 관련 내용이 써있는걸 못봐서 찍어오진 못했다 아무튼 여기 원두도 좋은거 쓰고 커피 엄청 맛있다고 들었다 다음에는 꼭 커피 마셔봐야지 나이로비커피비스트로 #송도카페 인천 연수구 센트럴로 123 송도컨벤시아 1층 032-210-1313,2020. 7. 5.
인천 연수구 맛집 : 동춘동 왕십리불막창,"인천 연수구 맛집 동춘동 왕십리불막창 안녕하세요! 호박이네입니다! 호박맘이랑 외식을 하러 가고싶을 때 항상거론되는 음식점이 하나 있지요. 그곳은 바로 인천 연수구 맛집 동춘동 왕십리불막창.이곳은 연탄불에 삼겹살, 막창들을 초벌해주는데,그 맛과 양 대비 가격도 괜찮은 편이라 자주...",2021. 5. 21.
