header,contents,date
복탕 생생정보통 맛집오늘 9월13일 취재 연락처 빛나라청춘 아재여행김포새우잡이,행 (아주 재밌는 여행) <경기도 김포시> 상호 사랑호 ... 새우잡이 주소 경기도 김포시 하성면 금포로 1928 전화 ☎️ O10-3737-3680 상호... 열다> 상호 진한식당 주소 인천 연수구 인천타워대로 323 센트로드 2층 진한식당 전화 ☎️ 0507-1374-1556 박선영 생생정보통 <전통시장 쿠폰>,2021. 9. 13.
비대면 온라인 미술강의. 단체키트 의뢰.인천 연수구,거짓말보태서 거의 자는시간 빼고 무슨일을 하든 늘 머릿속에 수업에 대한 생각이 습관적으로 있어요 여행때도. 티비볼때도. 운동하다가도. 저녁밥을 차리다가도... 이번달도 관공서에서 비대면 온라인 미술강의. 단체키트 의뢰주문이 3건이 들어왔습니다. 비대면 온라인 미술강의. 단체키트...,2021. 2. 27.
인천의 밤을 수놓는 아름다운 야경 명소 - 송도 오션스코프 전망대,"인천은 상반된 매력이 공존하는 도시이다. 개항로 일대는 근대로의 시간 여행을 할 수 있다면, 송도 센트럴 파크 일대는 화려한 스카이라인으로... 인천1호선 환승 ▶ 국제업무지구역 2번 출구, 도보 10분 2. 주 소 : 인천 연수구 인천타워대로 385-1 * 공항철도 블로그 기자 김선주 님이 작성한 글입니다.",2021. 6. 23.
#무지개돈가스 편 #오유미당 인천 연수구 하모니로138번길 11 032-859-6262,"여행본능, 섬 - 5월! 신비의 모래섬‘임자도’ 편 ▶<임자대교> 주소 : 전라남도 신안군 임자면 진리 ▶<임자만났네 협동조합> 주소... #무지개돈가스 편 #오유미당 주소 : 인천 연수구 하모니로138번길 11 번호 : 032-859-6262 #카츄마마 주소 : 경기도 화성시 삼성1로5길 6 번호 : 031...",2021. 5. 19.
인천요양원/연수구요양원/청학동요양원/한가족요양원/투호,코로나19의 확산을 막고자 여행이나 모임을 자제하다보면 모기때문에 괜시리 더 화만 나고 억울하게 느껴질 때가 있는것 같아요. 혼자 집에 있어도 억울할판에 왜 모기 너와 동거란 말인가요 ㅜㅜ 밖에 나가지 못해서 집에 계속 있게 되더라도 몸을 스트레칭하고 조금씩 운동하는 것은 참 중요한것...,2021. 9. 1.
#송도발마사지추천#인천발마사지추천#더풋샵송도센트럴파크점#송도여행추천,#송도발마사지추천 더풋샵 송도센트럴파크점 주소 : 인천 연수구 인천타워대로 257 아트포레푸르지오 상가 4층 위치 : 센트럴파크역 2번... #송도더풋샵 #송도여행 #송도1박2일 #인천여행 #가까운곳1박2일 #여행가자 #송도여행추천 #더풋샵센트럴파크점 #송도발마사지 #송도발마사지추천...,2021. 9. 3.
[인천여행] 송도 센트럴파크에서 여유로운 한때,"이러다가 9월 내내 인천 여행 이야기를 할 것 같아요. 이번에는 송도 센트럴파크 다녀온 이야기 써 보려고 합니다. 저는 이번 여름휴가로 인천 송도... 연수구에서 밥 먹고 밤이 되어 다시 산책을 나왔습니다. 트라이볼이 낮에 봤을땐 그냥 외계인 조형물 같았는데, 밤에 보니 은근 은은한 야경이...",2021. 9. 5.
카보틴맛집:)인천 송도 맛집 센트럴파크 구경하공~ 백합칼국수 냠!,하는 버스가 있어서 대중교통으로도 갈 수 있어 더욱 좋은것 같아요~ 인천 송도 맛집 백합칼국수 송도가면 꼭 먹고 와야 하는 그런 맛집이랍니다. 송도 센트럴시티 산책도 하공~ 맛난것도 먹공 ㅎㅎㅎ 즐거운 송도 1박2일 여행이었네용^^ 백합칼국수 032-831-5670 주소 인천 연수구 아암대로 811 동춘동 913-8,2021. 5. 17.
"이국적이었던 인천 여행, 차이나타운 나들이",내돈내산 내가 좋아서 남기는 인천 여행 기록기 꽤 귀여웠었던 짜장면 박물관의 마스코트 아저씨가 보이면 차이나타운 도착 맞다 중국 음식 거리에 맞게 온통 빨간색으로 칠해진 차이나타운 불과 10년전에는 완전 바글바글 했었는데 이제는 동인천보다는 부평이나 연수구로 많이 놀러가서 그런지...,2021. 7. 12.
"미국 해외입국자 코로나 자가격리, 인천 연수구 구호물품",열어보니 내가 좋아하는 마이쮸 같은 캔디 러시아계 친구라 그런지 러시아 캔디였는데 내 입에 딱 맞았다ㅎㅎ드디어 인천공항 도착! 공항 내려서... 버스 선택(인천행 버스는 9시가 첫차) 집도 아니고 난 에어비앤비로 들어가기 땜에 진짜 가기 싫었다ㅠㅠ 택시는 같은 인천인데도 5-6만원 이길래.. 넘...,2020. 9. 1.
아이와 함께한 인천 대형 키즈카페 송도 아틀란티스,"송도 아틀란티스 인천 연수구 컨센시아대로 230번길 42 운영시간 11:00~19:30 입장요금 네이버 스마트 플레이스 참고 송도 아틀란티스 입장 전... 당일치기 여행이기도 하고, 아이의 식사시간과 낮잠시간때문에 시간에 쫓겨 다녔답니다. 대형 인형뽑기가 있었지만 운영하지 않는 관계로 해보지는...",2021. 7. 6.
소확행(小確幸)을 누리는 인천 송도 센트럴파크(SRT매거진 4월호),"사방이 탁 트이고 드넓은 야외 관광지, 송도국제도시(인천 연수구)의 센트럴파크는 도시와 자연이 어우러진 경관과 함께 대중교통으로 떠나는 당일 여행지로도 손색 없습니다. ■ 수상레포츠와 야경천국, 송도 센트럴파크 센트럴파크는 해외 명소 뺨치는 아름다운 해수공원이자 임해...",2021. 4. 3.
연수구 인천 송도동 소호 오피스 공유 사무실 빌리기 같이가자^^*,연수구 인천 송도동 소호 오피스 공유 사무실 빌리기 같이가자^^* 연수구 인천 송도동 소호 오피스 공유 사무실 빌리기 같이가자^^* 소호사무실... 2 월 말 아일랜드 여행을 마치고 집에 도착했을 때 전염병이 확산되고있었습니다. 얼마 지나지 않아 Prine은 고관절 교체 수술을 받았으며 회복을...,2020. 10. 13.
"[2021 설특집] 설 명절 맞이 랜선여행 | 인천 전통주, 전통체험, 전통시장",출처 : 인천다송예절문화원 ■ 위치 : 인천광역시 연수구 용담로 11 시대아파트 상가동 210호 “초연다구박물관” 다구?? 글쓴이처럼 다구에 대해 잘 모르고 계시는 분들을 위해 간략히 설명 드리자면 차를 끓여 마시는데 필요한 도구를 다구라고 합니다!! 이곳에는 우리나라뿐만아니라 동양과...,2021. 2. 11.
"인천의 특별한 공원 | 송도 센트럴파크, 영종 씨사이드파크, 월미테마파크",다양한 장소에서 새로운 만남을 찾을 수 있는 센트럴파크에서 코로나가 종식되면 만나요~ ■ 위치 : 인천 연수구 컨벤시아대로(송도동 24-5) 160... 음뭐어어어어어어어어어어어어~ #인천 #인천관광공사 #인천여행 #인천랜선투어 #랜선여행 #공원 #파크 #송도 #센트럴파크 #영종도 #씨사이드파크...,2021. 2. 2.
흡족했던 인천 맛집 모음,"도우에 자박하게 토마토소스가 발려 있고 하몽이 곁들여져 있으니까 이탈리아 여행 온 기분도 나고요! 한 조각 들어 올리니 블랙 올리브와 바질이... 한식 동해 막국수, 송쭈집, 맛을 담은 강된장, 선녀풍, 황해 해물칼국수 주소: 인천 연수구 컨벤시아대로 50 영업시간 : 매일 11:30 ~ 22:00 / 라스트 오더...",2020. 9. 18.
"[SNS 서포터즈] 2021년, 새단장 된 인천시립박물관 '기증실'을 소개합니다!",유물 문의에 관련한 문의는 '인천시립박물관 유물관리부(032-440-6742)'로 주시면 된답니다! #인천시립박물관 #박물관유물기증 #연수구볼거리 #연수구여행 #인천광역시립박물관 *연수구 제7기 서포터즈 곽은비님의 콘텐츠 입니다.*,2021. 4. 21.
"[인천송도/호텔추천] 쉐라톤 그랜드 인천 호텔 Sheraton Grand Incheon Hotel, 1층...",주소ㅣ인천광역시 연수구 컨벤시아대로 153 전화번호ㅣ032-835-1000 홈페이지ㅣhttps://www.marriott.co.kr/hotels/travel/selgi-sheraton-grand-incheon-hotel/ 태그ㅣ#제제온여행 #제로국내여행 #JERO #온쓰트래블 #OnTravelbug #여행 #Travel #국내여행 #한국여행 #TripToKorea #제제온한국...,2021. 6. 9.
[인천/경기] 바로 앞이 바다였던 이쁜 펜션에서 친구들과 1박2일 선재도여행,선재도로 1박2일 여행가기 미루고미루가 가게된 급여행 퀸스비치글램핑펜션 주소 : 인천 옹진군 영흥면 선재로306번길 27-116 Previous image Next image... 스시로 연수점 주소 : 인천 연수구 청능대로 210 우리들은 초밥 러버들❤ 여기 스시로점 진짜진짜 존맛탱ㅜㅜㅜ 완전 신선하고 맛있고 ㅠ 내가...,2021. 9. 13.
캠퍼스투어036 인천 지식의 전당을 여행하는 히치하이커를 위한 안내서,"테마여행신문 TTN Korea 캠퍼스투어(Campus Tour)와 함께 어제도, 오늘도, 내일도 멋진 진리여행을! B 인천시 연수구 송도 캠퍼스타운(Songdo Campus Town) : 2009년 개통한 인천1호선 송도 캠퍼스타운(Songdo Campus Town)역은 송도국제도시 연장구간의 첫 번째 역으로 ‘수도권 전철 중...",2020. 12. 22.
"인천에서 찾아보는 Temple 투어 | 보문사, 용궁사, 정수사, 흥륜사","미세먼지가 없는 날엔 인천의 전경들이 더욱 더 잘 보이니까 한번 방문해 보시는 건 어떨까요? ■ 위치 : 인천 연수구 청량로46번길 38... 강화도, 송도 등 정말 다양한 곳에 위치하고 있어서 인천여행하신다면 부담없이 다녀오실 수 있어요!! 저희가 소개해드린 사찰 이외에도 인천에는...",2020. 12. 4.
인천 연수구 송도 합성 엔진오일 교환 전문점 XPERT 입니다^^,안녕하세요 인천 연수구 송도 합성 엔진오일 교환 전문점 XPERT 입니다^^ 새로운 한주가 밝았습니다 ㅎㅎ 시간 정말 금방 가네요 벌써 한주가... 드립니다 여행 잘 다녀오세요^^ 싼타페 TM 고객님이 방문주셔서 연료필터 교환및 하도 럭셔리 드라이브 5W40 엔진오일 교환하여 드렸습니다...,2020. 10. 19.
[인천 여행] 안심관광지 문학산역사관으로 코로나로부터 안심여행해요⛰,한국관광공사 서포터즈이자 여행을 좋아하는 사람으로서 지금 코로나가 심각해져서 4단계로 유지가 되고 있는 걸 보면 집콕만 하며 시간이... 문학산역사관 인천 연수구 연수동 산59-2 문학산은 잔디광장반려동물놀이터라고 무료강아지운동장이 있는 곳이자 고등학교 때까지 제가 살았던 연수동...,2021. 9. 3.
"인천 연수구, 청년 창업자 맞춤형 지원사업 4개 팀 선정",인천=장관섭 기자 | 2020.05.07 15:23 인천 연수구는 7일 구청 소회의실에서 ‘2020년 청년 창업자 맞춤형 지원 사업’에 최종 선정된 4개 팀에... 공닥(주)와 오즈는 앱개발 분야로 공닥(주)는 공장에 필요한 각종 설비공사를 중계하는 플랫폼을 오즈는 사용자 데이터 기반의 DIY 여행패키지...,2020. 6. 9.
[인천 송도] 음식으로만 세계여행 수준인 인천 송도 돌잔치 쎄쎄쎄 다녀왔어요!,"주소 인천 연수구 컨벤시아대로 165 포스코타워 7층,33층(주차 5시간무료) 영업시간 매일 10:00 - 18:00 지하주차장이 매우 넓어서, 사진에 보이는 것... 동남아 음식까지 준비되어 있어서 음식으로만 세계여행하는 느낌이 들 정도에요! 고급식재료를 사용하고, 즉석음식 코너도 있어서 원하는 음식 맛있게...",2021. 7. 16.
#인천인테리어◈Design by #한샘리하우스 바른대리점 <연수구 동춘동...,입구방 ▶ 인천 연수구 동춘동 #연수대우삼환아파트 33평 #입구방 입니다. * 벽지 : [한샘] 필름 (37029-5 ‘산토리니여행’) * 바닥 : [한샘] 강마루 – NEO 리얼 그레이 오크 * 창호 : [한샘] 필름 S200 ‘화이트톤’ * 조명 : [한샘] 스키니 LED 방등 * 도어 : [한샘] ABS도어 + 핸들 + 도어스토퍼...,2020. 6. 2.
"[인천/연수구]""호텔 498"" 로얄 스위트 1박2일 호캉스","8월 25~27은 제주도 여행 예정이었다.. 하지만 코로나와 태풍 바비로 인해..잠정 연기 얼마나 열심히 일정 짰는데....식도락 여행.. 억울한 마음 호캉스로 돌렸다 연수역에서 도보 약 5분거리에 있는 ""호텔 498"" 야놀자에서 '로얄 스위트' 체크인 2시, 체크아웃 2시 숙박 2인 8만원(1인 추가시 1만원)으로...",2020. 8. 27.
인천지하철 여행 센트럴파크역 송도 센트럴파크 야경,"지하철역과 가깝기 때문에, 인천지하철 여행하기에 센트럴파크만한 곳은 없는것 같았네요. 야경도 너무 좋았고요! "" 다음에는 문보트 타보자 아들아~ "" 송도 센트럴파크 위치 송도 센트럴파크 (주차장) 인천광역시 연수구 테크노파크로 164 대중교통 인천지하철 1호선 센트럴파크역 3번출구",2021. 10. 1.
"[인천 연수구] 송도 떡집 ""상시루"" NO 방부제! NO 합성색소! 웰빙떡을 냠냠~","정말 사연이 많은 가구로 신혼여행 갔다 와서 인터넷으로 5단 서랍장 2개를 구매했는데 서랍장 1개가 모서리 파손이 발견되어 바로 교체, 하지만... 상시루 / 위치 우리가 방문한 떡집은 상시루~ 인천광역시 연수구 해돋이로 168-15로 송도 글러벌시티프라자 1층에 있습니다. 대중교통을 이용할 경우...",2020. 6. 30.
◈Design by barun [인천인테리어 – 연수구 송도동...,- 바닥 : [한샘] 강마루 - 스타일그레이 오크 - 아트월&복도 : [한샘] 월플러스 - 배수브라이트 - 조명 : [한샘] T5 조명 (전구색) - 벽지 : [한샘] 실크벽지 37029-2 (산토리니 여행) - 가구 : [한샘] 빌트인 플러스 2단 장식장 - 창호 : [한샘] 필름 S205 (다크그레이) ★Barun concept : 인천 연수구...,2020. 3. 24.
인천 송도 센트럴파크 - 배 타고 여행하기 좋은 인천 송도 가볼만한 곳 & 문보트 이용 안내,"포스팅이에요 ~ 인천 송도 센트럴파크에서 배도 타고 경치 좋은 곳이 있어서 추천해드리려 후기를 남깁니다 - 송도센트럴파크 인천 연수구... 가봤는데 인천여행으로 여기 또 들리면 좋을 듯해요 ! 다음에 다시 또 들러서 인천 송도 센트럴파크에서 바 타려해요 ~ 인천 송도 여행, 인천 송도...",2021. 8. 17.
"인천 가볼만한곳 송도 트리플스트리트 우산 야경, 센트럴파크 야경, 여기가 데이트...","긴 말 필요 없이 사진으로 만나 보시죠~ 인천 송도 가볼만한곳 트리플스트리트 야경 송도 트리플스트리트 인천광역시 연수구... 올리는 여행, 사진 게시물들을 편하게 보실 수 있습니다. DHK.Photogallery 밴드 페이지 https://band.us/@dhkphoto 바라보는 그 순간. DHK.Photogallery Photogroup Soon-Gan 하며...",2021. 9. 11.
인천도심여행 속 인천상륙작전기념관,인천상륙작전기념관 인천 연수구 청량로 138 인천시립박물관을 만나고 싶어서 다녀왔는데 기억에 남아서 포스팅을 적어볼까 해요. 선경이는 어느 지역을 여행하든지 박물관은 빼놓지 않고 다니는 편이에요. 시립박물관을 가기 전에 들린 인천상륙작전기념관은 사실 생각하지도 못한...,2021. 8. 26.
인천 맛집 송도 가볼만한곳 센트럴파크 포함 3곳!,여행에 대한 갈증까지 싹 해소시킬 수 있는 곳이었습니다. 웬만한 유명 쇼핑몰 못지않게 꾸며져 있어 왜 송도 가볼만한곳으로 인기가 좋은지 알겠더군요. 어린아이들을 데리고 다니기에도 괜찮은 곳이다 보니 주말 나들이 장소로도 제격이겠다! 싶었습니다. 03 크래버대게나라 주소 인천 연수구...,2021. 9. 3.
[서해여행] 영흥도 십리포해수욕장(feat.바다로가는펜션),"영흥도여행 십리포해수욕장(feat.바다로가는펜션) 안녕하세요. 천국나그네입니다. 지지난주에 영흥도에 놀러 갔다왔어요. 징허게 인생을 함께하고... 그래서 검색을 해봤더니, 음, 나쁘지 않아보여서 연락처 얻어서 전화를 했고, 약간의 DC를 받고 예약을 완료했네요 ㅎㅎㅎ 저는 인천 연수구에서...",2021. 7. 12.
"[인천송도/제제온맛집] 임파스토 Impasto, 뇨끼러버가 만난 생활의 달인에도 등장한...","연수구 아트센터대로 203 전화번호ㅣ***-****-**** 영업시간ㅣ매일 11:30~15:30, 17:30~21:50 (월요일 휴무, 브레이크 타임 있음) 예약방법ㅣ위에 적힌 번호로 문자 발송(날짜+시간+인원+성함)하면 순차대로 회신 태그ㅣ#제제온맛집 #온쓰푸디 #ON_Foodie #지하철따라맛집여행 #인천1호선...",2021. 6. 1.
"인천의 숨은 가성비 갑(甲) 호텔 BEST3 | 호텔498, 호텔 에버리치, 오라카이...","~ ■ 위치: 인천 연수구 테크노파크로 151 ■ 전화번호: 032-210-7000 ■ 제공 서비스: 일리카페, Level 19(뷔페), Thirsty Monk(웨스턴 스타일 식당), 이마트24 등 5성급 호텔은 부담스럽고 이번 여름휴가는 호캉스를 즐기고 싶을 때 이 세곳으로 떠나보시는 것이 어떨까요?? #인천 #인천여행...",2020. 8. 3.
인천중구 인천동구 미추홀구 미추홀 인천 연수구 연수 남동구 남동 부평구 부평 부천시...,안녕하세요 해피피아노입니다 요즘 날씨가 많이 좋아졌네요 이젠 잠바 벗어버리고나니 너무 편하고 좋네요 여행이라도 다니고 싶지만... 미추홀 인천 연수구 연수 남동구 남동 부평구 부평 부천시 부천 중고피아노 계양구 계양 인천서구 강화군 옹진군 일산서구 고양시 고양 일산동구 일산...,2021. 4. 25.
"지하철로 떠나는 인천 여행! 센트럴파크역, 송도 센트럴파크","인천역, 송월동 동화마을에 이어 지하철로 떠나는 인천 여행, 그 두 번째 역! 바로 센트럴파크역입니다! 오늘은 센트럴파크역의 송도 센트럴파크로... 또 연수구 주민은 모든 수상 레저가 일정 금액 할인이 가능하다고 하니 잘 알아보시고 저렴하게 이용해보세요! 해가 지면 송도 센트럴파크는 또...",2021. 3. 24.
고급스러웠던 인천 스테이크,주소 : 인천 연수구 컨벤시아대로 50 전화번호 : 070-7736-5800 영업시간 : 매일 11:30 - 22:00 기대하며 찾아간 피제리아일피노는 센트럴파크역에서 차로 6분 걸려 도착했어요 외관도 유럽느낌이 물씬 풍겨서인지 여행을 온듯 기분이 설레더라고요. 주차같은 경우 지하에 넓은 주차장이 있어 손쉽게 주차도...,2020. 11. 24.
"[5월2주] 여주시, 안양시, 구리시, 이천시, 인천 연수구, 청양군",인천 연수구 마을 중심 코로나 19 극복에 나서다 코로나19 장기화로 어려움을 겪는 이웃 돕기에 나선 인천광역시 연수구(구청장 고남석)... 청양군 청양 여행자들의 ‘소확행’ 담은 에세이 발간 청양군(군수 김돈곤)이 청양에 와서 행복을 느낀 여행자들의 다양한 경험을 묶은 ‘친환경 힐링 여행...,2020. 5. 28.
확실했던 인천 송도 맛집,마치 남해 미조항에 여행 와있는 기분이었다고나 할까요. ∴ 멸치회는 한눈에 봐도 싱싱한 생물 멸치를 매콤하고 새콤한 양념에 여러 가지... 주소 : 인천 연수구 테크노파크로 111번길 11 영업시간 : 10:00 ~ 22:00 글/사진 : UltraOrange [장 세현] 촬영지 : 송도 바다를 쌈하다 - UltraOrange`s Light Illusion -,2020. 7. 15.
"연수구청소년수련관, 비대면 가족캠프‘우리가족 DIY’성료",관련기사 이미지.(사진=연수구청소년수련관) 연수구청소년수련관(관장 홍현웅)은 지난 6월부터 7월까지 인천 내 청소년 자녀를 둔 17가정을... 재밌는 여행이 됐다”고 소감을 밝혔다. 한편 연수구청소년수련관은 여성가족부 주관 전국 청소년수련시설 종합평가 최우수 등급 기관으로 코로나19...,2021. 7. 29.
인천 송도 쉐라톤 호텔 / 중식당 유에 YUE 디너 후기,"""유에"" 주소: 인천 연수구 컨벤시아대로 153 4층 전화번호:0507-1309-1718 매일 12:00-14:30 점심 매일 18:00-21:30 저녁 시간을 잘 알아두고 가면 좋을듯합니다. 저희는 6시에 예약해놓은상태! 저는 중식요리를 그-닥 좋아하지않는데 남편이 좋아해서 예약해봤어요 ㅎ_ㅎ 엇..우리가 1등이네 ㅋㅋㅋ 분위기는...",2021. 3. 3.
[인천송도/호텔추천] 쉐라톤 그랜드 인천 호텔 Sheraton Grand Incheon Hotel...,주소ㅣ인천광역시 연수구 컨벤시아대로 153 전화번호ㅣ032-835-1000 홈페이지ㅣhttps://www.marriott.co.kr/hotels/travel/selgi-sheraton-grand-incheon-hotel/ 태그ㅣ#제제온여행 #제로국내여행 #JERO #온쓰트래블 #OnTravelbug #여행 #Travel #국내여행 #한국여행 #TripToKorea #제제온한국 #대한민국...,2021. 6. 7.
"[인천-연수구] 노브랜드버거 안 먹어 봤으며,꼭 먹어보길..","""시다맘빠"" 여행 가자 ""시""야 / 아들 ""다""야 / 딸 ""맘"" / 엄마 ""빠"" / 아빠 주둥이( #랭글러사하라 ) / ""맘""차 / 등산용 검둥이( #그랜드카니발 ) / ""빠""차 / 차박용 저희 시다맘빠 이웃님들 순회하다가 알게된.. #노브랜드햄버거.. 가격이 착해서, 더 끌려.. 먹어보겠다?..후.. 폭풍검색으로 #이마트노브랜드...",2021. 2. 6.
대학생 취준생 직장인 주부 시니어 인천 연수구 동춘동 선학동 송도 연수동 옥련동 청학동,"파빅스, 시험, 문법, 회화, 정규과정, 여행, 시사 토론 등 다양한 카리큘럼이 준비되어 있습니다. 저희 EMO잉글리쉬의 큰 장점 중 또 하나는 저와... 시니어분이신데 여행을 위해 영어를 하셔야겠다 등,, 현재 모습에서 더 나은 삶을 위해 'English'에 관심을 가지고 있는 것입니다. 저희 프로그램 안에는...",2021. 7. 25.
인천아이폰수리 사설수리 잘하는곳,예전에 여행갔을 때에 중국에서 산적 있는데 너무 많이 써서 이제 사용할 수 없을 정도에요. 그렇지만 이번에 제대로 고치게 되면서 보조배터리를... 6153 인천 연수구 송도과학로 27번길 55 상가a동 212호 #송도아이폰수리 #인천아이폰수리 #아이폰xs수리 #아이폰12 #인천아이픽스...,2021. 5. 4.
"인천 송도 냉면 맛집, 송도 코다리냉면 다녀왔어요.","인천 송도 냉면 맛집, 송도 코다리냉면 다녀왔어요. 날씨가 좀 따뜻해지기 시작하면 생각나는 냉면, 콩국수, 아이스 아메리카노 중 남해 여행... 상호 : 속초코다리냉면 송도본점 주소 : 인천 연수구 아트센터대로 87 nc백화점 nc큐브 커낼워크 401동 110호 찾아오는 길 : 국제업무지구역 5번 출구...",2021. 4. 18.
"인천 송도 냉면 맛집, 송도 코다리냉면 다녀왔어요.","인천 송도 냉면 맛집, 송도 코다리냉면 다녀왔어요. 날씨가 좀 따뜻해지기 시작하면 생각나는 냉면, 콩국수, 아이스 아메리카노 중 남해 여행... 상호 : 속초코다리냉면 송도본점 주소 : 인천 연수구 아트센터대로 87 nc백화점 nc큐브 커낼워크 401동 110호 찾아오는 길 : 국제업무지구역 5번 출구...",2021. 4. 18.
"연수구맛집 :: 푸줏단 숯불 삼겹살 무조건 여기! (주차, 메뉴)","ㅠㅠ 여행 온 느낌나네 갑쟉2,,,★ 끄앙 20mm 한돈 생삼겹살이라는데 진짜 두툼하더라고요 엄지손가락 한마디정도는 돼보였어요 그리고 고사리... ㅎㅎ #동춘동맛집 #연수구맛집 #인천연수구맛집 #인천동춘동맛집 #연수구고깃집 #동춘동고깃집 #연수구청맛집 #연수구술집 #동춘동술집 #인천삼겹살...",2021. 7. 4.
인천 드라이브코스 환상 야경 송도 케이슨24,- 글 · 사진 별빛 가득 차향 송도 케이슨24 영업시간/ 10시부터 23시까지 휴 무 일 / 연중무휴 문의전화/ 032-832-0024 주소/ 인천 연수구 컨벤시아대로... ~ 글고 보면 멀리 여행 다니는 것도 좋지만 가까운 곳도 나들이 갈 수 있는 곳이 얼마나 많은지요. 어린이가 있는 가정이라면 새우깡 주는 재미와...,2021. 4. 27.
버스타고 1시간 10분! 송도 센트럴파크&서해바다 당일여행(한국일보 2021.03.05),"* 케이슨24 카페 문의 : 032) 832-0024 가격 : 율무크림라떼 핫 6300원, 바나나코코넛케이크 6800원 주소 : 인천광역시 연수구 컨벤시아대로391번길 20 케이슨24 * 인천 연수구 문화관광 032) 832-3031(인천종합관광안내소) & * 한국일보(온라인) 2021.03.05에 게재되었습니다. * 네이버에서 인천 송도여행을...",2021. 3. 7.
송도 포스기 연수구 카드단말기 학원 미용실 카페 카드기 상담 비용견적,"송도여행 당일치기 공원에서의 치맥 배달용 송도카드단말기로 무선 유선 뷰가 좋은 호프집, 레스토랑, 루프탑 조화로운 분위기속에서 여유로운... 포스기카드단말기 더불어 카카오입점신청 인천 연수구 서구 제대로 준비를 도와드릴 수 있도록 현재 무료로 도와드리고 있습니다.",2021. 7. 16.
