header,contents,date
"장성 축령산 편백숲, 걷기 좋은 길 모암 저수지 둘레길",이곳 축령산은 전남 장성군과 전북 고창군의 경계를 이루는 산이며 행정구역으로는 전라남도 장성군에 속한다. 춘원 임종국 선생이 1956년부터... 홀로 여행을 즐기며 받는 에너지원. 다시 모암 저수지 둘레길 데크로드를 따라 축령산 편백숲을 향한다. 걷고 오신 분들 흙먼지 떨구시라고 바람총도...,2021. 4. 26.
[고창여행 _ 학원농장] 노랗게 익어가는 학원농장의 청보리,"익어가는 고창 학원농장의 청보리밭 여물어 가는 보리의 해질녘을 담아 보고 싶어서 오랜만에 오후 외출. 2021년 5월 28일 / 전북 고창군 공음면 고창 학원농장 #청보리, #학원농장, #전북고창, #고창여행, #자화상, #아름다운고창, #고창사진여행, #고창카페스며들다, #Self_Portrait #보리밭 #보리",2021. 5. 29.
고창 선운사 펜션 풍천펜션,오랜만에 고창 선운사에서 맑은 공기를 마시며 힐링하고 오니 몸도 마음도 편안해지더라고요 주소 : 전북 고창군 부안면 연기길 41 저희는 수많은... 힐링하러 가기 위한 여행이었기에 좀 더 자연을 구경하고 싶었거든요 많은 사람들의 발자국으로 만들어진 길을 따라가봤는데요. 주위 풍경을...,2021. 6. 15.
#전북여행:고창갯벌 오토캠핑&글램핑장과 람사르 고창갯벌센터,준비는 힘들지만 이벤트같아요.^^ 설레이는 여행지로 출발! 급 도착한곳은 #고창 갯벌 오토캠핑&글램핑장! 고창군에서 주변공원을 조성하고 글램핑장은 사장님이 꾸미셨대요. 와~~~ 생각보다 크고 깔끔한 글램핑장. 2인기준 15만원 3명추가인데 2명만 받으시네요. 1인추가 2만원 19만원^^* 우리에겐...,2020. 12. 8.
[전북고창여행]고창 아이와 가볼만한곳. 고창 아이와 산책. 고창 힐링카운티 근처....,"다가오는 가을, 가족과 연인과 친구와 고창읍성의 성곽길을 걸으며 진솔한 대화 나누는건 어떨까요~? #고창읍성#모양성#고창군립도서관#고창여행#고창관광#고창관광지#고창가볼만한곳#고창아이와#고창아이와가볼만한곳#고창명소#고창데이트#고창힐링카운티근처#고창산책#고창읍성야경#고창읍성성곽",2021. 8. 27.
♥ 2월에 떠나는 전북 고창2색 골프여행,"2월에 떠나는 희망의 #골프여행 전북 #고창2색골프 #선운산cc #석정힐cc #고창cc #1박2일골프여행 입니다 고창에는 이 세 곳의 골프장이 있는데... us/@stargolfdaegubranch 선운산 CC 개장일 : 2011년 12월 인수 주소 : 전라북도 고창군 아산면 용계리 산 27-1 전장 : 5,872m ( 6,421yds) 규모 : 18홀 par 72 ( 선운...",2021. 1. 20.
자전거여행 준비교실 Step 2 수료 _ 졸업여행 다녀왔습니다 . ( 변산반도 / 고창...,설렁설렁 전북과 전남 일부구간을 천천히 돌아보는 코스를 잡았습니다 . 여행의 형태는 설렁설렁하게 경치 좋은 곳을 다녀보는 credit card 로... 이길은 고창군 심원면 월산리 965 부터 고창 CC 까지 구불구불한 데크로 깔아놓은 길과 아스팔트길 거리는 약 7.5 km 한쪽은 바닷가 개펄을 보면서 한쪽은...,2021. 10. 11.
전북 고창 독채펜션 석정힐링하우스305에서 아이와 함께 즐기는 가족여행,"#고창펜션 #전북고창펜션 #고창독채펜션 #광주근교펜션 #고창여행 #고창숙소 #가족여행 #아이와가볼만한곳 #석정힐링하우스 #고창상하농원... ㅋㅋ 다음날 아침, 그냥 가기 아쉬우니까 비눗방울 한번 더^^ 주소 : 전라북도 고창군 고창읍 석정1로 105 번호 : ***-****-**** 입실 15:00 / 퇴실 11:00 네비에 주소...",2020. 10. 23.
노랗게 보리가 익어가는 오월 [전북 고창],"보리밭과 깔맞춤이라니... 팔이라도 하얀색이라 다행이지 머리만 둥둥 떠다닐뻔 했다는... 2021년 5월 18일 / 고창군 고수면 #전북고창, #아름다운고창, #고창사진여행,고창스냅 #고창여행, #자화상, #스며들다, #고창카페스며들다, #Self_Portrait #보리",2021. 5. 25.
군산의 맛집 진성원 - 전북 군산여행,"상술한 것처럼 중국 요리라는 인식 때문인지 중국 대륙으로 여행을 가는 사람들이 중국본토의 오리지널 짜장면(?)의 맛을 찾는 경우는 상당히... 편이지만 고창군 벗어나면 거의 하는 곳이 없다. 고창 내에서는 위의 짬짜면과 '고창식' 짬짜면이 혼재하는 상황인데, 두 종류 다 취급하는 집도 있다....",2020. 5. 23.
고창 가볼만한곳 선운사 꽃무릇 개화,"이번 여행지는 우리 어머니 추천으로, 고창 여행지로 유명한데다 꽃무릇 개화시기라 가볼만하다는 이야기를 들어 전북여행 하며 돌아보기로 했다.... 고창에서 가볼만한 곳 여행지를 꼽아본다면, 고창군의 홈페이지를 통한 조사 결과는 다음과 같았다. 1. 선운사 2. 운곡람사르습지 3. 석정온천 4....",2021. 9. 26.
고창가볼만한곳 고창읍성 모양성 가을고창여행,"고창당일치기여행 코스 중 선선한 가을 산책하기 딱 좋았던 가을 고창여행 가성비 갑 고창읍성(모양성) 마음의 평화를 가져다 주었던 전북 힐링여행지였어요~ 고창읍성 입장료 - 3,000(성인) 고창사랑상품권 2,000원 페이백 고창군민무료 전북 고창군 고창읍 읍내리 182-6 063-560-8067 주차장 있음 3...",2021. 10. 8.
"[고창 여행] 전북 고창 맛집 , 수요미식회 소개 된 고창 간장게장 # 우정회관",간장게장 비쥬얼에 반해서 남편과 총총 다녀왔답니다 우정회관은 현지인맛집이라고도 하죠 우정회관 영업시간 : 금~일 10:00 - 18:00 재료소진시 조기 종료 전화번호 :***-***-**** 주소 : 전북 고창군 심원면 심원로 196 (지번 : 연화리 729-7 우정회관) 전북 고창맛집 간장게장 우정회관위치는 고창군...,2020. 8. 13.
"전북 여행지 추천) 고창 가볼만한 곳, 고창 ""청보리밭""",고창 청보리밭 전북 고창군 공음면 예전리 469-1 063-564-9897 주차장있음 입장료 없음 남자친구와 첫여행으로 갔던 고창!!! 3주년 기념해서 첫여행지를 다녀왔어용 ㅎㅎ 그 중 너무 기억에 남았던 #고창청보리밭 !!! 오랜만에 갔지만 여전히 푸릇푸릇 이쁘더라구요!!! 고창 청보리밭 산책로 안내도도...,2021. 5. 19.
지나칠 수 없는 꽃거울 [전북 고창],"지나칠 수 없는 꽃거울 [전북 고창] 거울 하나로 혼자 놀기 씁쓸하지만 혼자 놀기의 달인이 되어가는 중. 2021년 5월 29일 / 고창군 아산면 #꽃놀이, #전북고창, #아름다운고창, #고창사진여행, #고창여행, #자화상, #스며들다, #고창카페스며들다, #Self_Portrait #장미 #금계국",2021. 6. 3.
"고창군 · 전북도, ‘고창에서 한 달 여행하기’ 참가자 모집",호남뉴스,2020. 7. 27.
"전북 고창 가볼만한곳, 고창 선운사 동백나무숲(천연기념물 제184호) 여행","방문 : 2020년 09년 22일(화) 주소 : 전북 고창군 아산면 삼인리 산68번지 특징 : 천연기념물 제184호 소유 : 선운사 관리 : 고창군 ""고창 선운사 동백나무 숲""은 1967년 02월 17일 ""천연기념물 제184호""로 지정되었다. [ 방문동기 ] 2020년 09월 22일 보은길(소금길) 일부를 산책하면서 관람하였다. "" "" ""고창...",2020. 10. 1.
[전북 고창] 고창여행 스탬프투어 총정리~~,"전북 고창군 그 전에도 자주간 고창이지만 이번 여행을 하면서 새로 배운것이 문화관광해설사로부터 들은 것은 고창군이 서울특별시보다 크다는 사실인데요. 찾아보니 정말 약간 크더라구요(약 1킬로미터 제곱 정도) 고창 하면 떠오르는 장소는 선운산(선운사), 고창읍성이 대표적이지만 이번...",2020. 10. 14.
길에서 만난 동백 [전북 고창],"길에서 만난 동백 [전북 고창] 동백꽃 필 무렵 고창은 지금. 여러 그루 동백이 보고 싶다규... 선운사에 가야겠다. 새로운 길에서 만난 동백나무 잘 기다리고 있는 내차 고생이 많은... 고물차 2021년 3월 13일 / 고창군 심원면 고창여행, 동백, 고창동백, 인물사진, 고창스냅, 개인프로필, 봄...",2021. 3. 17.
"10월 국내 여행지 추천 :: 가장 좋아하는 계절, 가을에 떠나는 여행","또한, 근처에 있는 고창 청농원에서 핑크뮬리가든 축제가 한창이니 고창 여행 코스로 함께 계획해 봐도 좋겠다. - 이용시간 : 아침 동틀 때 ~ 해 질 녘 *야간조명이 없으니 밤에는 삼가 *상설 식당 매점 09:00 - 19:00 - 입장료 : 무료 - 주소 : 전북 고창군 공음면 학원농장길 154 - 문의 : 063-564...",2021. 10. 1.
[전북 고창 _ 벚꽃] 벚꽃엔딩,"작년부터 만개하면 꼭 와야지 했는데 세찬바람으로 꽃들이 모두 피기도전에 몽땅 다 떨어져버렸다. 그래도 예쁘다. 2021년 4월 3일 / 고창군 대산면 #꽃놀이, #전북고창, #아름다운고창, #고창사진여행, #고창여행, #자화상, #스며들다, #고창카페스며들다, #Self_Portrait #벚꽃",2021. 5. 31.
[고창] 고창 카페 망고빙수 가 맛있는 곳 백일후애,여행서적도 엄청 꽂혀있는걸 보니 사장님이 여행매니아이신가보다... 야외는 너무 더워서 아직은 앉아 있기에 너무나 덥지만 가을같은 선선한... 먹고 싶다면 백일후애에서 시원하게 몸을 녹여보자. 주소 : 전북 고창군 고창읍 태봉로 582 영업시간 : 10:30 ~ 20:30 (수요일 휴무) 연락처 : 0507-1360-4103,2021. 8. 1.
[고창여행]아이들과 가기 좋은 람사르 펜션+상하농원(๑°꒵°๑),"쏘는 여행 언니가 펜션을 알아보고 예약을 했습니다요 ෆ 람사르 펜션 외관 람사르 펜션 전북 고창군 심원면 선운대로 2290-17 우리가 예약한 방은 '가을(복층)' 토요일 오후 6시쯤 도착해서 그때는 깜깜했기 때문에 다음 날 퇴실할 때 사진을 찍었다. 12시쯤인데, 사진으로 봐서는 오후 4시 넘은 듯 ;;...",2020. 11. 25.
고창 청보리밭 학원농장 백배즐기기,고창 청보리밭 보리나라 학원농장 전북 고창군 공음면 학원농장길 154 고창 청보리밭 학원농장 오늘은 ‘어버이날’이였어요 엄마빠와 함께 고창... 추천드려요~ #고창 #고창여행 #고창가볼만한곳 #전북가볼만한곳 #전북여행 #전북드라이브코스 #광주근교데이트 #광주근교드라이브코스 #광주근교...,2021. 5. 9.
전북 고창 가볼만한 곳 핑크뮬리 명소 꽃객프로젝트 / 전주근교,시 간 9:00 ~ 18:00 장 소 전라북도 민간정원 1호 '꽃객프로젝트' 팜정원 일원 - 전라북도 고창군 부안면 복분자로 307 (용산리 409-1) 정원이용료... #전북 #고창 에 여행오시면 한번쯤 꼭 들려보시길 추천합니다! 데이트하러오시는분들 정말 많았어요 워낙 넓어서 서로서로 방해는 크게 되지...,2021. 10. 10.
선운사 #전북 고창여행 #국내여행 #절 #사찰 #데이트하기좋은곳 #산책 #힐링 #상사화,선운사 전북 고창군 아산면 선운사로 250 전북 고창군 아산면 삼인리 500 (지번) 전화 : 063-561-1422 조선후기 에 중건된 사찰 보물 제290호 김제 금산사(金山寺)와 함께 전라북도의 2대 본사 아름다운 산들에 둘러쌓여 웅장함을 더합니다. 상사화 (꽃말-이룰수 없는사랑) 가 사찰 올라가는...,2021. 1. 2.
마스토미 야스사에몽 장로와 전북 고창 오산리/ 국민일보,"마스토미 야스사에몽 장로와 전북 고창 오산리 한국기독역사여행, 조선을 사랑한 일본인, 기독 공동체 터전 세우다 8월 초의 한낮. 전북 고창군 부안면 공립 부안초등학교 교정은 더없이 조용했다. 푸른 하늘이 선명하고 매미 소리만 요란했다. 면 소재지 학교가 전교생 29명이다. 올해 입학생은...",2021. 8. 14.
고창터미널 버스시간표 - 고창을 여행하는 뚜벅이라면 미리 알아둘 것. (2020년 10월...,"고창터미널은 전북 고창군 고창읍에 위치한 터미널로, 고창군에 위치한 터미널에서 가장 큰 규모를 자랑한다. 군내버스와 시외버스, 고속버스가 터미널을 같이 사용하며, 각 방면 별로 타는 곳이 다르니 참고하도록 하자. 고창군내버스 고창터미널에서는 대산, 해리, 무장, 상하, 흥덕, 아산 등 고창...",2020. 10. 23.
고창 상하농원 아이와 즐거운 추억 수영장 물놀이까지,고창 상하농원 전북 고창군 상하면 상하농원길 11-23 매일 09:30 ~ 21:00 고창 여행은 자연과 더불어 고즈넉함과 여유를 느끼기 좋은 것 같아요. 오랜만에 상하농원을 예약해서 파머스 빌리지까지 다녀왔는데요. 저녁 시간 즈음 느긋하게 체크인하고 사람들이 없는 한적한 시간에 산책을 하니 선선한...,2021. 8. 26.
전북 가볼만한 곳 : 고창 청보리밭 (도깨비 촬영지 메밀밭 인생 샷),"고창 나래궁 전북 고창군 고창읍 동리로 41 (짬짜면, 차돌짬뽕) 하는 수 없이 주면 시장쪽을 돌다가 생선구이를 보곤 땡겨서 들어간 식당~ 이 식당... ㅁ; 이렇게 꽉 채운 1박 2일간의 전남 여행 끄읕~!!! 날씨가 엄청 좋진 않았지만 간만에 콧바람 쐬니 넘 조쿠나~~ 코로나야 언능 물럿거라~!!",2021. 6. 1.
[고창] 선운사 - 국내여행,없어졌다고 해서 아쉽더라구요ㅠㅠ 적당히 넓고 사람은 없어서 좋았어요 단풍시즌에는 어떨지 모르겠지만요 ㅎㅎ 선운사 육층석탑 Summer breeze 가지가 너무 신기하게 난 나무 고창 맛집 치면 요기도 뜨던데 선운사랑 연결되어있더라구요 참 좋았던 곳 :) 그럼 뿅!! 전북 고창군 아산면 선운사로 250,2020. 10. 25.
"[전라북도 여행] 전북 부안,고창 여행코스(포토존) 줄포생태공원, 구시포항/국내여행지추천","당일치기 여행코스로 줄포생태공원, 노을이 아름다운 구시포항. 전라북도 부안과 고성에 이어 영상을 만들어봤어요~ 프라하의연인 촬영지... 줄포만갯벌생태공원 : 전북 부안군 줄포면 생태공원로 170 구시포항 : 전북 고창군 상하면 자룡리 인스타그램 : https://www.instagram.com/o_o__s.h...",2020. 10. 30.
고창청보리밭 여행 후 고창펜션 람사르펜션에서 펜캉스 추천!,잘 쉬었다 갑니다. 고창 청보리밭여행 했어요. 바람이 부는 따사로운 날이라 바람에 흩날리는 청보리들의 모습이 정말 시원하고 예뻣어요. 여러분도 느껴보세요. 방문가능시간 체크인 14:00 / 체크아웃 11:00 위치 : 전북 고창군 심원면 선운대로 2290-17 문의 : ***-****-**** / 070-4110-0133,2021. 5. 12.
출렁이던 붉은 꽃의 바다 [고창군 부안면],"붉은 물결 출렁이던 오월의 작약밭 2021년 5월 14일 / 고창군 부안면 #꽃놀이, #전북고창, #아름다운고창, #고창사진여행, #고창여행, #자화상, #스며들다, #고창카페스며들다, #Self_Portrait #작약",2021. 5. 23.
전북에서 안전하게 힐링하기 - 여름에 걷기 좋은 선운사 숲길,요즘 같은 시기에는 시원한 나무 그늘을 따라 산책하며 조용히 사색에 잠길 수 있는 숲길을 찾게 되는데 전북 고창군에 있는 선운사를 소개합니다.... 안전 수칙 지키며 여행하기 사실 며칠 전 코로나 19 확진자의 동선에 선운사 이곳이 있어 걱정이 되었습니다. 그러나 이미 방역을 완료하였고...,2020. 7. 14.
고창 핑크뮬리 전북 가볼만한곳 청농원에 가면 무료!,전북 가볼만한곳 고창 핑크뮬리가 있는 청농원으로 가보실까요? 전북 가볼만한곳 고창 핑크뮬리 청농원 이용 팁! 1. 청농원 주소 : 전북 고창군... 전북 여행 마지막 코스라서 만약 너무 늦었다고 돌려보내시면 올해 고창 핑크뮬리는 못 봤을지도. 얼른 들어가서 사진 찍고 나왔지만 너무 좋았던...,2020. 10. 15.
고창읍성 #전북 고창여행 #국내여행 #성곽 #데이트하기좋은곳 #힐링#산책 #산성,"고창읍성 전북 고창군 고창읍 읍내리 산 9 전화 : 063-560-8067 사적 제145호 군 단위로는 최대의 고인돌 밀집지역. 조선전기에 축조된 성곽. 성곽 내,외부가 넓게 조성되어 있어 아름다운 성곽과 함께 조경시설과 옛 건축물들을 벗삼아 산책하기 정말 좋은 장소입니다. 산과 함께 아름다운 성곽이...",2020. 12. 27.
고창 상하농원 체험교실 고구마 케이크 만들기&파머스카페,고창 상하농원 체험교실 고구마 케이크 만들기 &파머스카페 1월에 겨울여행 가족여행 다녀온 #고창아이와가볼만한곳 #고창상하농원... 아이들 놀거리가 많아서 좋아요~ 상하농원 전북 고창군 상하면 상하농원길 11-23 지번 : 전북 고창군 상하면 자룡리 산1-2 09:30~21:00 연중무휴 1522-3698 https://www....,2021. 7. 16.
"고창 힐링여행 ""선운산 도립공원 & 선운사""",전라북도 선운산 도립공원은 전북 서해안권 국가지질공원이라고 합니다. 선운산 도립공원을 이용 시 준수 사항 읽어보시고 이용해보세요.... 전라북도 여행의 투어패스와 고창군 알뜰하게 여행할 수 있는 정보가 있네요. 처음 알게 된 투어패스네요. 선운산도립공원 긴급신고 및 구조요청...,2021. 6. 27.
"[고창·영광 blog 뉴스] 고창군, 대한민국 테마여행 10선 ‘시간여행 플랫폼’...","고창군청 나철주 문화유산관광과장은 “시간여행 플랫폼은 대한민국 테마여행10선 10개 권역 중 전북지역에서는 처음으로 진행되는 사업이다”며 “7권역(전주, 군산, 고창, 부안)을 비롯한 전라북도 관광 활성화를 위한 새로운 마중물이 될 것이다”고 전했다.",2021. 4. 22.
무장읍성 #전북 고창여행 #국내여행 #데이트하기좋은곳 #힐링 #산책 #동학농민운동...,"무장읍성 전북 고창군 무장면 무장읍성길 45 전북 고창군 무장면 성내리 309 (지번) 대한민국의 사적 제346호. 읍성이란 군이나 현의 주민을 보호하고, 군사적·행정적인 기능. 1894년 일어났던 동학 농민혁명은 이곳 무장읍성에서 맨 처음 봉기. 일반 평지에 위치하고 있어 무리가 되지 않고...",2020. 12. 25.
[고창여행_선운사] 눈오는날의 고창 선운사,"우선 사람이 별로 없으니 참 좋구나. 목련이 필때쯤 다시 와야지... 2021년 2월 18일 / 전북 고창군 고창 선운사 고창여행, 고창, 선운사, 고창선운사, 선운사, 고창사진여행, 사진여행, 버들강아지,도솔촌, 고창카페, 고창카페스며들다, 스며들다",2021. 2. 20.
선운사가 위치한 산으로 더 유명한 단풍맛집 전북 고창 선운산도립공원,전국 이 곳 저곳 다니면서 자연을 감상하고 감사해하며 자신을 되돌아볼 시간을 내는 여행바다 빠진 여빠부부입니다 지난 5월 초 황금같은 귀중한... 느껴지는 전북 고창군의 명산 선운산 추천하며 글 맺을게요 이 산에만 서식한다는 송악이라는 식물 군락지도 꼭 보셔야할 곳입니다 인상적이었던...,2021. 5. 27.
10월 고창 아이와 가볼만한곳 상하농원 할로윈 즐기기,미션 수행 안 하고 사진만 찍으실 분들은 오후 5시 이후를 즐겨보시길~ 입장료 무료 대상자는 고창군민 36개월 미만 유아 소인 - 기초생활수급자... 이외에도 가을에 가기 좋은 전북 고창 여행 코스는 따로 포스팅했지요. 꽃객프로젝트도 좋지만 청농원 핑크뮬리도 예뻐서~ '모두 제 돈 들여 다녀온...,2021. 10. 7.
"공유가 선택한 고창, 강선달마을 농촌공감 힐링여행","#농촌공감여행 #전북농촌여행 #전라북도농촌관광 #농촌체험휴양마을 #여행후기 #공모전 #전북농어촌종합지원센터 #삼락농정... 주소: 전북 고창군 상하면 구시포해변길 165(큰집수산) 직접 방문도 할 수 있지만, 마을과 연계되어 운영 중이라, 마을 예약 통해 이용하면 더 많은 서비스를 받을 수...",2020. 7. 30.
"[전북모험] 은근히 잘 알려지지 않은 전북 벚꽃 명소, 고창 다녀 왔어요!","항상 갔던 고창과는 조금 색달랐던 고창 여행! 함께 떠나보실래요? 고창읍성 : 내 마음대로 지은 별명, '꽃의 성(花城)' 전라북도 고창군 고창읍... - #전라북도#전라북도관광마케팅종합지원센터 팸투어 지원#전북여행#전라북도 부안여행#전라북도 고창여행 #전라북도 가볼만한곳#전라북도...",2021. 4. 12.
[유적지 탐방] 전라북도 고창군 고창읍성,"조선왕조는 전라남도 영광군 법성진성과 고창군의 고창읍성, 정읍군의 입암산성을 잇는 방어선을 만들어 호남 내륙을 왜구의 노략질로부터... (자료 : 답사여행의 길잡이 전북 편 참조) 고창읍성 입구에 한옥 몇 채를 건립해 한옥마을로 정해 관광객의 발걸음을 멈추게 하고 있다. 이곳 근처에는...",2021. 7. 2.
[전북 고창] 아지랑이 솔솔 어느 봄날,"거기다가 빨간 문이라니... 올해도 가면 예쁘려나. 봄날의 산책 봄날 따듯한 햇살아래 날이 흐리니 따듯한 봄 햇살이 그리워진다. 2020년 2020년 5월 12일 / 전북 고창군 고수면 고창, 전북고창, 고창여행, 아름다운고창, 고창스냅 고창사진여행, 자화상, Self_Portrait, 고창카페스며들다, 봄",2021. 2. 15.
자연과 함께하는 고창 건강식 '자연과 오리',고창 여행 중 무장면 일대를 찾으셨다면 주변 볼거리도 천천히 둘러보시고 몸에 좋고 맛있는 오리고기로 건강까지 챙겨보시길 바랍니다. ^^ 자연과오리 주소 : 전북 고창군 무장면 동서대로 844 영업시간 : 오전 11시~오후 9시 *월요일 휴무 전화번호 : 063-561-5295,2021. 3. 11.
"2020년 새해 첫캠핑 및 첫해루질,,,전북 고창군 심원면 만돌리 조개(동죽) 주워담고...","#조개캐기 #조개해루질 #동죽캐기 #서해안조개체험 #고창조개체험 #고창해루질 #서해안해루질 #노지캠핑 #서해안노지캠핑 #고창조개캠핑 2020년 첫 주말을 첫 캠핑이자 첫 해루질로 고창 만돌해변 바닷가로 다녀왔네요~ 이곳은 매년 두세번 오던곳이라 낯설지 않고 주변 편의시설이 있어, 캠핑하기...",2020. 1. 7.
고창 상하농원 아이들과 함께 가면 좋을 전북여행지,"여긴 여러가지 체험은 물론 산책로나 먹거리, 그리고 파머스 빌리지까지 있어 하루 코스로 가도 좋을 전북여행지랍니다. 주소 : 전북 고창군 상하면 상하농원길 11-23 번호 : 1522-3698 영업시간 : 매일 09:30~21:00 연중무휴 도착해서 보면 주차장은 굉장히 넓게 마련되어 있어 아무곳이나 파킹하면 되고요....",2021. 1. 25.
고창여행) 청농원 in 고창 (feat. 핑크뮬리/라벤더 맛집),"이번 추석, 본인 외갓집(전북 고창군) 방문 하면서 가족과 들린 ""청농원"" 여름엔 라벤더, 가을엔 핑크뮬리로 꾸며놓은 정원에, 카페도 같이 운영하고... 수도권에서 전북 고창은 좀 멀고 유명하지도 않지만, 주변 혹시라도 갈 일 있다면 잠깐 들러 힐링여행지로 추천 꾹 :)",2021. 9. 27.
"고즈넉한 아름다움에 힐링 되는 곳, 고창 무장읍성",단순히 산책하기도 좋지만 아이들과 역사 여행으로 떠나오기도 참 좋은 곳이라 생각되는 곳인데요~ 고려시대까지 무송과 장사의 두 고을이었던... 무장읍성으로 떠나보는 걸 어떨지~ 추천해봅니다. 무장읍성 주소 : 전북 고창군 무장면 성내리 149-1 입장료 : 무료 전화번호 : 063-560-8047,2021. 2. 25.
"▶상하농원, 책마을해리, 고창읍성, 고창한옥마을, 보리나라학원농장◀국내가을여행지...","★추천여행코스 : 상하농원 – 책마을해리 – 고창읍성 한옥마을 – 고창읍성,맹종죽림 – 보리나라 학원농장 바람에 찬 기운이 느껴지는 날, 구름... 위치 : 전북 고창군 상하면 상하농원길 11-23 입장료 : 대인 8,000원, 소인 5,000원 운영시간 : 매일 9:30~21:00(연중무휴) *체험 프로그램 안내는 아래...",2020. 10. 19.
고창 가볼만한곳 익어가는 보리밭 학원농장,"-여행을 꿈꾸는 사내- 2. 선운사 주소: 전북 고창군 아산면 선운사로 250 선운사 운영시간: 매일 05:00 - 20:00 주차비: 2,000원 입장료: 성인기준 4,000원 우리나라의 대표적인 사찰 중 하나로 선운산(禪雲山.335m)의 또다른 이름의 도솔산(兜率山) 선운사(禪雲寺)는 대한불교 조계종 제24교구 본사로 봄에는...",2021. 5. 24.
