header,contents,date
고창 장어맛집 여기로 가요~ 장어명가 풍천,장어명가 풍천 #고창장어 #고창장어맛집 전화) ***-***-**** 주소) 전북 고창군 고창읍 중앙로 126 요즘 ~ 캠핑에 재미를 붙이고 나서 평생안가본 고창을... 좋은 드라이브 코스가 될거예요 #고창맛집 #고창장어맛집 #고창장어 #장어명가풍천 #고창드라이브 #고창여행 #고창동호해수욕장 #고창현지인맛집,2020. 10. 29.
전국 물놀이 안전명소 계곡 추천! 안전한 여름휴가 즐기기!,"2015~2019년 물놀이 안전명소 – 계곡 문수사와 단풍나무 숲이 함께 있는, 전북 고창군 문수계곡 출처 : 고창군 공식 홈페이지 처음 소개드릴... 낙동강 구포나루축제를 비롯한 마을축제도 열리기 때문에 여행 전, 부산 북구 공식홈페이지에 꼭 방문해보시기 바랍니다. ▼부산 북구 홈페이지...",2020. 7. 29.
생생정보 선운사-안현돋음볕마을-죽염-청보리밭-갯벌-고창전통시장<노래방>전북 고창,[2TV 생생정보 1046회] 4월 14일 화요일 소행정 이미지출처:KBS2TV 노.래.방 (노래 따라 방방곡곡 떠나는 여행) <고창여행> #선운사 전라북도 고창군 아산면 선운사로 250 선운사 ☎ ***-***-**** #안현돋음볕마을 전북 고창군 부안면 안현길 14 063-560-8511 #죽염 #한국로하스식품...,2020. 4. 14.
고창여행 상하농원 & 학운농장 청보리밭,상하농원 전북 고창군 상하면 상하농원길 11-23 매일 09:30 - 21:00연중무휴 청보리밭에 나와서 상하목장으로 향했어요 5월달부터 새롭게 브런치뷔페와... 나오시는길에는 다양한 상하목장의 제품또한 구매할 수 있어요 어린아이가 가정에게 추천드리는 여행코스예요 한번쯤 가봐도 나쁘지 않을듯 해요,2021. 5. 4.
임실 옥정호 한옥카페 하루에서 잠시 쉬다!,카페는 전북 고창군 해리면에서 옮겨 온 송하정이라는 정자와 녹차밭으로 이루어져 있다고 이렇게 쓰여 있길래 찰칵!!!! 2003년 현재의 장소로 옮겨... 제주도 여행의 여운이 남아 있어서 그랬는지 엄마는 해녀입니다 를 읽었네요 에바 알머슨이라면서 짱 재미있었다고 ㅎㅎㅎㅎ 이야기 해주네요...,2021. 10. 8.
"고창 여행_세련된 유기농 체험 테마공원, 상하농원","상하농원은 농림축산부와 전북 고창군, 매일유업이 공동 투자해 고창군 상하면의 약 10만㎡(약 3만 평)대지에 조성된 농어촌 테마공원이다. 건강한 식재료를 생산하고, 동물과 함께 뛰놀며, 맛있게 먹으며 행복한 세상을 만들자는 의도로 ‘짓다, 놀다, 먹다’라는 컨셉트를 정했다. 고창에 도착해서...",2020. 12. 22.
[군산여행] 물짜장의 빈해원,운영중인 식당이 문화재로 등록된 사례는 일제강점기 건물인 전북 고창군의 조양식당(제325호)과 빈해원이라고 합니다. #빈해원 #빈해원 메뉴는... 이런 식탁 문화에 어려서부터 습관이 된 중국인들이 우리나라에 여행을 오면 아무렇지도 않게 물어보지도 않고 그냥 합석을 한다는...제 생각입니다....,2021. 6. 26.
고창카페 카페베리 뷰맛집,고창카페 카페베리 전북 고창군 심원면 심원로 270-66 일요일 11:00 - 19:00 매일 12:00 - 19:00 수요일 휴무 (공휴일 제외) 주차장이 앞에 있어서 주차 하기... 모든 사진 무단 도용 금지해요 사용하실땐 출처를 꼭 남겨주세요 #고창카페 #고창여행 #고창데이트코스 #고창카페베리 #고창분위기좋은카페,2020. 4. 19.
곰소항 - 전북부안여행,"부안군과 고창군의 경계를 이루고 있는 만으로써, 만의 대부분에 갯벌이 매우 잘 발달되어 있으며, 서해안의 만 가운데 원지형의 보존 상태가... 형성 및 변천 해수면이 현재보다 약 120m 이상 낮았던 약 1만년 전의 지난 빙기 동안에 곰소만은 남쪽의 고창군에서 흘러오는 주진천에 갈곡천이...",2020. 11. 11.
고창청보리밭/초록과노랑이 일렁이는 청보리밭 아름답더라.,올해 17회째 진행 되고 있는 고창 청보리밭 전북 고창군 학농원을 다녀 왔답니다. 넓은 보리밭에서 초록빛 물결이 일렁이는 보리밭을 걸으며... 점프샷도 해보고 그래 지금 마음껏 뛰어보자. 아티스트가 그려 놓은 그림 위에서 즐겨 보기도 하고.. 아빠랑 함께한 청보리밭 여행 흥미롭게 즐겁게 보내다.,2020. 4. 24.
[고창여행] 1. 고창 상하목장,전북 고창군 상하면 상하농원길 11-23 매일 09:30 - 21:00연중무휴 주차장있음 너무너무너무 오랜만에 쓰는 블로그....ㅠㅠ 이제 시간이 많아져서... 은근히 내 전신샷이 맘에들어서 합격!ㅋㅋㅋㅋ 다른여행지에 포토존보다는 사람들이 별로 몰리지도 않고 좋았어여ㅎㅎ 이번 고창여행은...,2021. 5. 13.
[국내여행] 고창 당일치기,"고창 여행정보 식당 맹구네★★★★☆ 장어구이 2인분 기준 69,000원 칼국수 3,000원 전북 고창군 심원면 검당길 52 063-563-8834 고창 구시포 해수욕장★★★★☆ 전북 고창군 상하면 자룡리 고창 상하농원★★★★★ 입장료 성인 기준 1인 8,000원 전북 고창군 상하면 상하농원길 11-23 꽃객프로젝트...",2020. 10. 27.
"오늘저녁 복분자농장,장어구이,청보리면 (전북 고창) 초밥 (제주) 반찬가게 (대전 노은역)...",php 청림정금자할매집 (장어구이) 전북 고창군 아산면 인천강서길 12 (반암리) 063.564.1406 매일 10:00~19:00 (마지막주문 6시) #소금구이 #고추장구이 #복분자구이 #된장구이 #고창 #아산면 보리올레 (청보리면) *코로나로 임시 휴업중* <신박한 네바퀴 여행> 세프의초밥제주...,2020. 12. 24.
코로나 피해서 안심하고 여행할 수 있는 여행지 2탄! (feat. 여름 비대면 안심관광지...,"하동군 하동편백자연휴양림 울창한 편백 숲으로 떠나는 힐링 여행지, 2020년 여름 개장한 신상 휴양림 함양군 선비문화탐방로 화림동계곡이 품은 선비의 삶을 만나는 여행 전북 고창군 운곡람사르습지 세계가 인정한 최고의 생태탐방 여행지, 원시적인 습지 생태계의 보고 무주군 구선총 어사길...",2021. 6. 10.
"당일치기 고창여행! 유채꽃밭, 삼시세끼 고창편 촬영지 등",당일치기 고창여행 코스 2. 고창유채경관지구 전북 고창군 심원면 궁산리 산 3-13 두번째로 방문한 당일치기 고창여행 코스는 고창 심원면 유채경관지구입니다 : ) 삼시세끼 고창편 촬영지에서 나래궁으로 가는 길에 우연히 만난 곳이랍니다. 차를 세워서 위치를 잡아보니 주소가 '전북 고창군 심원면...,2021. 4. 29.
"[The-K 매거진] 무더운 여름, 힐링이 필요하다면? 떠나요~ ‘The-K 휴스테이’로!","그러나 코로나19로 인하여 해외여행이 제한적인 지금, ‘어디로 떠날까’ 하며 이렇다 할 계획을 세우고 있지 못한다면, 여기 히든카드가... 전국 휴스테이 제휴시설(11곳) 더 베네치아 스위트 호텔 강원 춘천시 효자로 136 고창 힐링 카운티 전북 고창군 고창읍 석정2로 207-46 동양 보양온천...",2021. 7. 16.
<고창밥상> 찐 숯불갈비 맛집!! 고창 '하마평숯불갈비',갈비도 간이 너무 세지 않아 입에 잘 맞았고 삼겹살도 신선하니 함께 즐길 수 있어서 더할 나위 없이 좋고요! 오늘 메뉴는 고창 하마평 숯불구이에서 맛있는 식사 어때요~? 하마평 숯불구이 전화번호 : ***-***-**** 주소 : 전북 고창군 고창읍 성산로 4 （읍내리 671-8),2020. 8. 20.
"[일상/여행] 고창 가볼만한곳 도깨비촬영장소 ""학원농장 청보리밭""",(지금은 코로나19로 축제는 취소되었지만 입장은 가능하다) 4~5월에는 유채꽃과 청보리 8월에는 해바라기꽃 10월에는 메밀꽃 시즌에 맞춰서 오는것도 좋은 여행지가 될것같다. 고창 학원농장 청보리밭 주소 : 전북 고창군 공음면 예전리 469-9 입장료 : 무료 주차 : 무료 전화 : 063-564-9897 입구부터...,2021. 5. 13.
"국내여행, 대한민국의 세계 문화유산","많은 여행자들이 야외 역사 박물관으로 생각하는 경주는 거의 천 년 동안 신라 왕국의 수도였으며 고대 한국에서 가장 오래된... 전라북도 고창군과 전라남도 화순군, 인천광역시 강화군 3개 지역에 나뉘어 위치해 있는 고인돌 군(群)입니다. 이 세 지역의 고인돌은 고인돌 문화 형성...",2021. 8. 20.
[고창방문]선운사에 가보고 저녁은 핑크뮬리가 있는 장어파는부부에서,장어 파는 부부로~~ 장어 파는 부부집 정원 핑크뮬리정원에서 화보 촬영ㅋ 넓은 정원이 너무 근사하다! 지금까지 먹어본 장어중 최고의 피지컬ㅋ 장어파는부부 전북 고창군 아산면 인천강서길 417 http://naver.me/5fnjv78W #고창여행 #가족나들이 #선운사방문 #장어파는부부 #최고의장어맛집,2021. 10. 11.
생방송오늘저녁 맛집 김포 한우도끼생갈비 청림정금자할매집 태백꽃등심 설화등심...,(위치) 전북 고창군 고창읍 동리로 87-1 <신박한 네바퀴 여행 방송정보> ▶ 셰프의초밥제주 주소(위치) 제주 제주시 관덕로15길 2 셰프의초밥 영업시간 : 11:30~20:30 마지막주문8시. 매주 월요일휴무. <반찬고수의 족집게 레시피 방송정보> ▶ 효모로찬 (노은점) 주소(위치) 대전 유성구 은구비남로...,2020. 12. 24.
고창펜션 하늘마을펜션 관광지도 가깝고 휴식하기도 딱 좋은 펜션!,"안녕하세요 올리담입니다 오늘 소개할 곳은 바로 고창펜션 하늘마을펜션 이에요 하늘마을펜션 전북 고창군 부안면 검산리 559-3 063-532-2288 24시간... 올리담이 추천하는 추억을 함께하는 곳 고창펜션, 하늘마을페션에서 행복한 여행하세요! #고창펜션 #선운사펜션 #고창독채펜션 #고창단체펜션...",2021. 10. 7.
"코로나19로 지친 심신, 숲에서 치유하세요.",우수하고 여행하기에 좋은 '국유림 명품숲' 5개소를 추가 선정하였습니다. ※ 추가선정 명품숲 1. 강원 춘천시 '굴참나무 숲' 2. 강원 영월군 '태화산 경관 숲' 3. 경북 영양군 '자작나무 숲' 4. 충북 충주시 '소나무 숲' 5. 전북 고창군 '문수산 편백 숲' 춘천 방하리 굴참나무 숲은 굴참나무가 집단으로...,2020. 6. 10.
200804 ~ 200825 고창군 도시재생 군민 아카데미 (8월) 현장 스케치,"고창군도시재생지원센터입니다. 여름 더위가 한풀 꺾이고, 이제 매미 대신 귀뚜라미 우는 소리가 들려오고 있습니다. 센터에서는 지난 8월부터... 20.08.04 1주차_[도시인문학] 도시행복론, 내 도시에서 행복하게 살기 도시재생 아카데미 첫 주차는 전북대학교 김요한 교수님의 [도시행복론, 내...",2020. 9. 2.
[고창여행2] 고창황토펜션 고창힐링카운티 허브온실 고창월파크시티 황톳길체험장,주소 지번:전북 고창군 고창읍 석정리 744-8 도로명:전북 고창군 고창읍 석정2로 207-34 운영시간 24시간 입실 15:00 퇴실 11:00 예약및문의 063.560.7300... 건강면역여행 힐링카운티와는 인사를 하고!!! 건강면역 마지막 코스 ㅎㅎ 편백나무 숲으로 고고!!! 힐링카운티와는 차로 7분정도 거리에 있어요 ㅎㅎ...,2021. 5. 23.
봄에 가볼만한 국내여행 추천장소 '고창 선운사',오늘도 국내여행을 찾으시는 분들이나 작은 대리만족이라도 느끼실 분들을 위해 국내여행 추천장소 포스팅 시작하겠습니다! 전북 고창군의 가볼만한 곳 '고창 선운사' 바로버스와 28인승 전세버스타고 놀러가봐요~ 전북 고창군에 있는 절인 '고창 선운사' 입니다~ 고창 선운사 하면 생각나는게...,2021. 4. 23.
고창 맛집 / 우정회관 - 게딱지만큼은 최강 !!,"ㅋㅋ 간장게장과 새우탕 두 장으로 급 결정된 고창 여행에서 가장 기대했던 곳이기도 하다. 6월 1일부터 주말 3일간만 영업한다고 하니, 방문 전... 전화번호 : ***-***-**** 주소 : 전북 고창군 심원면 심원로 196 / 연화리 729-7 주차 : 가능 영업시간 : 금/토/일 3일간만 영업 (10:00 - 18:00 재료 소진시 조기종료)",2020. 6. 14.
고창 맛집 / 성송반점 - 올해 아주 기억에 남았던 짜장면을 만나다.,"고창 여행의 마지막은 고창에서도 시골에 위치한 성송반점으로 향했다. 이게 어느 곳에 위치한지는 당연히 몰랐지만, 운전을 해 가면서 건물이... 성송우체국 옆 건물 전화번호 : ***-***-**** 주소 : 전북 고창군 성송면 삼송정길 14 / 계당리 556-2 주차 : 근처에 요령껏 영업시간 : 매일 11:00 - 16:00 연중무휴",2020. 6. 7.
전북 고창읍 월곡 귀농귀촌 꿈에그린 단지 (2020.4.26),1박2일 일정으로 고창군 여행 중 둘러본 곳은 고창읍 월곡리에 자리잡은 고창 월곡 꿈에그린 단지라는 곳이다. 귀농ㆍ귀촌인의 정착을 위해 조성한 집단 주거단지로 2013년 조성했다고 한다. 이곳은 고창읍을 지나가나 유채꽃 정원과 이국적인 주택 모습에 이끌려 둘러 보았다. 처음엔 귀농 귀촌...,2020. 5. 2.
"[전라북도 여행] 고창 라벤더 꽃밭에서 꽃구경하고 온 ""청녹원""","안녕하세요 코코다일이에요 :) 전주 근교에 여행 갈 곳이 없나 찾던 중에 고창에 라벤더 꽃밭이 있다는 걸 알고는 안 갈 수가 없었어요 보랏빛 꽃밭에서 자연을 만끽하고 왔던 ""청녹원""을 소개합니다 청녹원 전화 ***-***-**** 주소 전북 고창군 공음면 청천길 41-27 영업시간 매일 09:00 - 17:30 정원 관람...",2021. 6. 12.
"전북 고창 가볼만한곳 ::: 고창군립미술관, 고창판소리박물관, 신재효 고택",수습생들에게 처소를 마련해 주어 대략 50여 가구가 한 울타리 안에서 공동체를 이루며 살았다고 합니다. #고창가볼만한곳 #전북가볼만한곳 #고창여행 #고창군립미술관 #고창미술관 #고창판소리박물관 #판소리박물관 #신재효 #신재효고택 #판소리 #판소리여행 #고창여행지 #고창여행지추천 #베리쎄쎄,2020. 2. 26.
"<이달의 여행지> 호국 보훈의 달, 한국 최초 순수 민간 성금으로 건립된 '일광기념관'","그냥 고창을 여행할 때와는 달리, 잘 알려져 있지 않은 고창의 기록들을 볼 수 있어 생소하면서 새로 알게 된 사실에 재밌었는데요~ 다음엔... 현재를 살아가고 미래를 준비할 수 있는 힘을 얻어 보면 어떨까 합니다. 일광기념관 주소 : 전북 고창군 고창읍 중앙로 264 ☎ : 063-564-0987 입장료 : 무료 < > < >",2020. 6. 22.
"전라도 식도락 여행 (작은항구, 승일식당, 축령산사랑가득국밥, 공음청정한우, 쉘부르...","#전라도 #식도락여행 #국내여행 #작은항구 #승일식당 #축령산사랑가득국밥 #공음청정한우 #쉘부르 #현대옥고창점 #1일1소화제 전라도가 음식이 맛있기로 유명하다해서 이번 여행은 전라도! 첫 번째, 작은항구 전북 고창군 심원면 상전1길 45 작은항구 가격은 1키로에 6마넌 칼국수는 6천원 대부분의...",2021. 4. 18.
고창 학원농장 청보리밭축제,고창 학원농장 청보리밭 전북 고창군 공음면 학원농장길 154 코로나19로 청보리밭축제는 취소 되었어요~~ 오늘 청보리밭 갔다 왔어요~ 비가 계속... 남겨주세요 #광주근교 #광주근교나들이 #광주근교가볼만한곳 #고창가볼만한곳 #고창여행 #고창데이트코스 #고창유채밭 #고창청보리밭 #고창청보리축제...,2020. 4. 19.
고창 밀터 해물칼국수 풍부한 해산물이 가득한 소문난 칼국수 맛집,"***-***-**** 전북 고창군 고창읍 월산리 59-22 매일 11:00-21:00 매월 둘째, 넷째 주 월요일 휴무 석정힐cc근처 맛집 선운산에서 약 35분 소요 고창... ㅋㅋ 고창에 여행을 가시는 분이나 석정힐cc운동 가시는 분들은 여기 밀터해물칼국수 들러 점심으로 해물칼국수, 녹두해물전 꼭 드셔보시길 추천드립니다~^^",2021. 10. 7.
고창 풍천장어 맛집 우리수산 풍천장어 으뜸 보양식,지번/전북 고창군 심원면 월산리 214 영업시간 11:00~21:00 연중무휴 ☎️***-***-**** 고창 풍천장어 우리수산에서는 전국택배 서비스 진행중이었어요... 했어요^^ #전북고창맛집 #고창심원맛집 #고창풍천장어맛집 #우리수산 #고창우리수산풍천장어맛집추천 #풍천장어 #선운사근처맛집 #고창여행맛집...,2021. 10. 3.
"10월 국내 여행지 추천 :: 가장 좋아하는 계절, 가을에 떠나는 여행","또한, 근처에 있는 고창 청농원에서 핑크뮬리가든 축제가 한창이니 고창 여행 코스로 함께 계획해 봐도 좋겠다. - 이용시간 : 아침 동틀 때 ~ 해 질 녘 *야간조명이 없으니 밤에는 삼가 *상설 식당 매점 09:00 - 19:00 - 입장료 : 무료 - 주소 : 전북 고창군 공음면 학원농장길 154 - 문의 : 063-564-9897 3....",2021. 10. 2.
[추가] 코로나가 잠잠해지면 가보고 싶은 곳,이리 저리 흘러다니다가 가까운 곳이면 찾아 들 생각입니다. 첨부파일 가보고 싶은 곳(21.10.07. 현재).pdf 파일 다운로드 전국의 가볼만한 곳이 시도별로 *.pdf 파일로 정리되어 있습니다. 위의 '가 보고 싶은 곳.pdf' 파일을 내려 받으시면 전국 가볼만한 곳이 정리되어 있습니다. 강원도...,2021. 2. 14.
<이달의 여행지> 봄의 향기가 느껴지는 고창읍성과 전통시장,"읍성 바로 앞에도 고창 농특산품 판매장이 따로 있으니 고창 여행의 추억을 양손 가득 담아 가보시는 건 어떨까요~? 고창읍성 주소 : 전북 고창군 고창읍 읍내리 126 문의 : 관광안내소 063)560-8055, 매표소 063)560-8068 요금 : 성인 3천 원, 청소년 2천 원, 어린이 1500원",2020. 5. 21.
고창 서해안바람공원 만돌갯벌체험학습장,"고창 가족 나들이 서해안바람공원 전북 고창군 심원면 애향갯벌로 311 원래 만돌 갯벌체험 왔다가 조카가 잠들어서 서해안 바람공원 산책하고... 단체 여행객분들 사진 많이 찍으시더라구요~ 서해안에서 자라는 벙게,달랑게 조형물도 있네요~~ 귀요미 돌고래 의자도 있어요~ 조카가 안잤으면...",2020. 6. 7.
"전라도 고창 골프장 석정힐CC, 유럽스타일의 코스를 느껴보실래요?","고창 석정힐CC 주소: 전북 고창군 고창읍 석정2로 192 지번: 전북 고창군 고창읍 석정리 814-2 구분: 대중체18홀 잔디: 한국잔디 부대시설... 고창하면 풍천장어와 복분자가 떠오르지요~ 라운드로 지친 피로는 보양식으로 풀어주세요~ 올 가을 국내골프여행은 먹거리,볼거리,즐길거리가 있는...",2021. 9. 27.
"고창,학원관광농장 ( 백일홍,해바라기)",여행지;고창 학원관광농장 여행일자/날씨;2020년8월16일 일요일/맑음 폭염경보 동행; 다음메일 산악회 주소;전북 고창군 공음면 학원농장158-6 문의;063 564 9897 분류; 자연생태 공음면 선동리에 위치한 학원농장은 면적이 30만여 평으로 1994년 관광농원으로 지정되었다. 봄에는 수십만 평의 완만한...,2020. 8. 22.
고창여행 : 고창읍성 부근 맛집 섬진강 장어탕,주소 : 전북 고창군 고창읍 동리로 240 길 가다 만난 대추 하룻밤 잘 자고 다시 길을 나섰다. 둘째 날 일정은 넥스트모텔(고창군 고창읍 월암수월길 112) → 고창읍성 → 고창공용버스터미널 → 학원농장 메밀꽃밭 아침에 보니 또 좋은 고창읍성 고창여행 필수 코스 중 하나이다. 내가 갔을 땐...,2020. 8. 6.
깊어가는 가을을 쫓아 #고창 으로,▶위치 : 전북 고창군 공음면 학원농장길 154 고창 여행코스 자세히 보기 ▶ https://c11.kr/ip2y #가을여행 #국내가을여행지추천 #고창가볼만한곳 #고창여행 #황화코스모스 ★ 모두가 건강한 일상으로 돌아오는 그 날까지 #사회적거리두기 수칙을 준수해주세요!,2020. 10. 21.
고창 카페:) 심원면 팜카페이솔,"주소 : 전북 고창군 심원면 연화리 359-1 문의 : ***-****-**** 영업시간 : 10:00 - 19:00 / 화요일 휴무 (공휴일 제외) 주차 : 카페 맞은편 도로 전용 주차장... 와서 하나만 주문했어요 프레즐에 버터조합은 말모,, 위에 솔트도 있어서 단짠고소 너무 맛있었어요 고창 여행 갈 때 들러보기 좋은 팜카페이솔 :)",2021. 9. 28.
국토종주 자전거여행(3박4일 520km)의 추억 (서울-평택-공주-부여-군산-김제-목포-순천),"자전거여행을 하는 동안 많은 지역을 지나면서 물을 얻어야 했고, 전북 고창군 대산면의 어느 집에서는 보신탕을 얻어먹기도 했습니다. 점심 때가 지나서 배가 고프던 차에 어느 길갓집에 물을 얻으러 들어갔는데 마침 점심을 먹고 있어서 밥좀 달라고 하였더니 선뜻 들어오라고 하였습니다....",2021. 7. 4.
고창 장어집 몸보신은 강나루풍천장어,고창 장어집 몸보신은 강나루풍천장어 고창 장어집 강나루풍천장어 주소 도로명 : 전북 고창군 부안면 연기길 17 지번 : 전북 고창군 부안면 용산리... 가족여행도 14년도가 마지막이였으니 곧있으면 정말 10년 다 되겠네요 걸어다니는걸 워낙 좋아하시는 아빠는 자주 돌아다니셔서 네비도 따로...,2021. 9. 25.
"14th 출정-서해,남해 여행","2020.12.28~2021.01.04일[7박8일] 캠핑카 여행을 시작하고, 처음으로 긴 여행을 떠났다.2020년을 마무리하고...2021년 새해를 맞이했다. 전북 고창: 선운사... 선운사 전북 고창군 아산면 선운사로 250 선운사 아무생각없이 터벅터벅 기이하게 뻗어있는 나무사이 숲길을 산책하며 힐링하긴 그지없이 좋은...",2021. 3. 2.
고창펜션 선운사근처 펜션추천 '하늘마을펜션',"24시간 #고창펜션 #선운사펜션 #고창독채펜션 #고창단체펜션 전북 고창군 부안면에 위치한 고창펜션 하늘마을펜션을 소개해드릴게요. 넓은 잔디밭, 깔끔한 테라스와 벤치가 있어서 여행객의 피로를 풀어주고 힐링과 편안하고 즐거운 여행을 도와줄 독립형 펜션으로 고창단체펜션 고창독채펜션...",2021. 9. 25.
고창여행-구시포해수욕장/고창펜션 순하우스,♡ 배부르게 먹고 구시포 해수욕장을 좀걷다가 상하목장을 가기위해 얼른 출발했다~!!! 포스팅이 넘 길어져서 상하목장은 따로 써야겠당 전북 고창군 상하면 구시포해변길 122-1 http://naver.me/FrLaEUhf #고창여행 #구시포해수욕장 #구시포조개구이 #구시포백합칼국수 #고창펜션 #고창숙소 #고창순하우스,2021. 5. 23.
고창 여행 웰파크시티 힐링카운티 고창 숙소 언니와 힐링여행하고 왔어요,고창 여행 코스로 안성맞춤이고 느긋하게 건강을 생각하고 나를 생각해 보는 힐링여행으로 최고였어요 힐링카운티 전화번호 063-560-7300 홀른온천&파동 욕장 ***-***-**** 그린스토리면역력한식당 ***-***-**** 전북 고창군 고창읍 석정 2로 233-45 힐링카운티 전화번호 : 063) 560-7300 체크인 15:00 체크아웃 11:00,2021. 6. 22.
돋음볕마을 #전북 고창여행 #벽화 #국내여행 #산책 #힐링 #데이트,돋음볕마을 전라북도 고창군 부안면 안현길14 아름다운 벽화로 꾸며진 마을입니다. 벽화를 보면서 걷다보면 어느새 마음도 풍요로워 집니다. 마을... 고창의 유명한 고인돌도 그려져 있네요 국화 그림때문인지 집이 따스해 보이네요 행운이 한가득입니다. 돋음볕마을 전라북도 고창군 부안면 안현길14,2020. 12. 11.
고창 맛집 / 꺼먹고무신 - 장어에 복분자가 있는데 비아그라는 왜 먹어?!,"Overall Score : ★★★★ 좋았던 점 : 훌륭한 맛, 준수한 서비스 아쉬운 점 : ■ 꺼먹고무신 위치 : 선운산 풍천장어거리 초입 전화번호 : ***-***-**** 주소 : 전북 고창군 아산면 선운사로 63-7 / 아산면 삼인리 96-3 주차 : 가능 영업시간 : 매일 11:00 - 19:00 / 매주 월요일 휴무",2020. 7. 4.
미당 서정주 시문학관 #전북 고창여행 #국내여행 #박물관#힐링 #문학,미당 서정주 시문학관 전라북도 고창군 부안면 질마재로 2-8 한 송이의 국화꽃을 피우기 위해 봄부터 소쩍새는 그렇게 울었나 보다. 커다란 자전거... 여러 작품들이 전시되어 있습니다. 근처 사유지 같은데 마치 그림과도 같네요 미당 서정주 시문학관 전라북도 고창군 부안면 질마재로 2-8,2020. 12. 16.
