header,contents,date
전북 진안군 용담면 송풍리 차박 성지 '용담 섬바위'(천년송) - 차박 여행,전북 진안군 용담면 송풍리에 유명한 차박 성지가 있습니다. 몇 해 전 핑클 멤버들이 캠핑했던 곳입니다. 도착하였습니다. 입구엔 양옆으로... 그리하여 햇볕이 따갑습니다. 잠시 쉬고 짐을 정리합니다. 이불도 베개 커버에 넣어 정리합니다. 정말 멋진 여행이었습니다.,2021. 9. 14.
"가을여행,전북 진안군 마이산,탑사","#함께같이 #가족여행 #가을맞이 #전북_진안군_마이산_탑사 #좋쿠나 이른 아침 엄마를 만나고 달려 가 본 곳, https://terms.naver.com/entry.nhn?cid=40942&docId=1286442&categoryId=33081 남부주차장으로 갔슴. 주차후 체온을 체크하고 저런 팔찌를 줌 ㅎㅎㅎ 금당사,괘불탱화 보물1266호 가 있는 곳....",2020. 10. 19.
[진안군여행] 기암괴석의 운일암반일암 숲길/전북천리길 트레킹,숲속에 데크길과 오토캠핑장은 다시 걷고 머무르고 싶은 길입니다.종점 부근인 와룡암 정자는 주변 경치와 더블어 또 다른 아름다움이네요 진안군여행에 운일암반일일암 숲길은 전북천리길에 백미가 아닐까요??? 전라도 정도 천년을 맞아 전라북도 14개 시군에서 405km/44구간중 진안군에는...,2021. 5. 6.
전북 진안군 여행,"곳에서 촬영하면 풍경이 멋지게 나오질 않으니, 세동 보건 진료소를 지나 카페가 나오기 바로 전 길 옆에 있는 작은 주차장에 주차를 하고, 거기서부터 풍경을 감상하시면 멋진 장면을 찍을 수 있습니다. 이상으로 진안군 여행 소개를 마칩니다. 즐거운 여행을 통해 멋진 추억을 만드시길 바랍니다.",2021. 10. 4.
"전북 진안군 여행 : 운장산자연휴양림, 부귀편백숲산림욕장, 진안 카페 - 기배기카페","전라북도 진안군 여행지 추천 운장산자연휴양림, 부귀편백숲산림욕장, 진안 기배기카페 무진장의 무주, 진안, 장수! 지난번 무주산골영화제 탐방에... 운장산자연휴양림, 전북 진안 진안, 운장산자연휴양림 진안, 운장산자연휴양림 전북 진안은 숙소도 마땅하지 않았다. 그래서 검색하다 보니...",2021. 7. 18.
전북 진안군 해물짬뽕 - 산마루,부엉오빠랑 무주여행을하고 집에 돌아가는길에 이리저리 돌아당기다보니 시간은 벌써 점심시간쯔으으음. 뭘먹을지 고민하다가 이때 전북 진안군으로 들어갔어요. 전북 진안군에는 뭐가 유명하고 맛있나 블로그를 보다가 눈에 띄던 가리비 잔뜩올려진 짬뽕 짬뽕을 좋아하는 달비슬이기에 지나칠수...,2021. 1. 29.
전북 진안군 주말 가족여행! 마이산 돌탑과 계곡~,"전북 진안군 주말 가족여행! 마이산 돌탑과 계곡~ _________________________________ #코로나19 가 참으로 오래갑니다. 이래저래 한창 뛰어놀 아이들이 마스크 쓰고, 학교도 제대로 못 가니 그게 좀 안타깝네요. 주발에 오랜만?에 전북 #진안군 #마이산 #가족여행을 다녀왔습니다. 보통 1년에 한 번은 가는데...",2021. 8. 27.
[진안여행]전북 진안군 숨겨진 명소! 충혼탑으로~,"우리에겐 전북진안은 정말 먼 장거리여행이었지만, 경치가 끝내준다고 얘기를 많이 듣고 자연을 보고 힐링하고 싶은 마음에 큰맘 먹고 가보았다! 지금아니면 또 언제가나 바로 고고! 와 이게 댐물이다. 전라북도 진안군에 위치한 용담댐! 크기가 어마어마하다. 순간 바다인줄! 이렇게 큰댐은 처음본다...",2020. 9. 25.
[전북천리길]도보여행.스탬프북. 진안군 기념품수령,전북천리길 천리길 스탬프북 도보여행 인증 진안군 기념품 수령! 흔적 임실군에이어서 이번엔 전북천리길 진안군 스탬프북 인증 기념품의 흔적을 기록해본다. 전북천리길 진안군에는 운일암 반일암 숲길. 용담댐 감동벼룻길. 마이산길. 이렇게 한국유일의고원지대를품은 전북천리길이 있다...,2021. 7. 6.
"[전북천리길] 진안군 용담호 감동벼룻길... 조각공원 등 (진안트레킹, 용담호 주변여행)","전북 진안군에는 #용담호감동벼룻길 이 있습니다. 용담댐 주변 여행과 함께 진원고원길의 일부인 #용담호감동벼룻길 트레킹 코스를 소개합니다. 용담호를 따라 호수와 산을 제대로 즐기실 수 있습니다. 용담댐 주변은 나름의 관광지로서 펜션, 맛집도 있고,, 가족테마공원, 물문화관...",2021. 7. 21.
진안군 도보여행 스탬프 투어 전북천리길과 진안고원길 기념품,"진안군 도보여행 스탬프 투어 전북천리길과 진안고원길 기념품 진안군 전북천리길은 제1길 용담댐 감동벼룻길 12km 제2길 운일암반일암 숲길 10km 제3길 마이산길 12.9km 의 3개의 코스이다. 진안에는 하늘땅 진안고원길이 있다. 진안고원길은 하늘땅 고샅고샅에서 마을과 사람, 진안을 만나는...",2021. 5. 22.
"전북 진안 맛집, 마이산 돼지불고기 진안군 맛집 샘터가든 굿!","샘터가든 주소: 전북 진안군 진안읍 군상리 498 영업시간: 월~금 09:00~20:00 (아침식사 가능) 주차(주차장): 건물 앞 넓은 주차장 있어요. 흑돼지 불고기... 아이들도 잘먹었어요.^^ 진안 마이산 가시거나 장수,무주 여행 가신다면 들러서 식사하시면 좋을 거 같아요. 포스팅하면서 냉이 향 가득한...",2021. 3. 5.
힐링하는 전북진안군 운일암반일암 국민여가캠핑장 강추!,다시또 찾게될곳 아름다웠던 전북진안군의 힐링포인트 운일암 반일암 안녕하세요 수완정석공인중개사 대표 김정석입니다 오늘은 전북진안쪽에... 그중에서 여행도 많은 제재가 있다보니 캠핑족이 많이 늘었습니다 저도 세번쯤 하다보니 캠핑의 매력에 빠지게 되더라구요 조만간 예약하고...,2020. 11. 6.
전북 진안군 진안읍 가막리 '가막리들'(1박 2일 촬영지) - 차박여행,전북 진안군 진안읍 가막리에 '가막리들'이라는 곳이 있습니다. 1박 2일에도 방영되었던 곳입니다. 갑니다. 도착하였습니다. 와~ 감탄사가 절로 나옵니다. 하지만 너무 컴컴합니다. 간신히 차박텐트를 설치합니다. 아침이 되었습니다. 아침 풍경은 또 색다릅니다. 주위를 산책합니다. 어제 도착했을...,2020. 8. 21.
[진안군여행]전북천리길/진안고원길1구간/마이산길 탐방,"[진안군여행]전북천리길 / 진안고원길1구간 / 마이산길 탐방 2021,6월 3째주말에 친구2+4들이 진안군여행 전북천리길 진안군에는 마이산길,운일암반일암길,용담감동벼룻길 3개 코스가 있는데 그 중 진안고원길1구간 마이산길을 걸었네요 평화롭고 조용한 농촌풍경과 마이산 주변에 풍광을...",2021. 6. 21.
"[산 여행] 전북 진안군 마이산, 초등학생 자녀와 함께 봄 산행","가까우니 다음 기회에 꼭! 친구와 다음 주에도 아이들 데리고 산에 가기로 했다. 전주시 남서쪽에 위치한 모악산을 갈 것이다. 코로나 때문에 딱히 아이들과 어디 가기 힘든 요즘, 전혀 가지 않았던 산을 찾게 되었는데 아이들도 좋아하고 나도 즐겁다. 다음 주의 산 여행이 또 내 가슴을 설레게 한다.",2020. 4. 12.
"전북 진안군 여행 : 마이산 도립공원, 탑사&은수사, 마이산 맛집","아무튼 마이산에 들리시는 분들 속금산음식점에서 정갈한 한식 드시고 마이산 둘러보세요!~! 마이산 맛집, 속금산음식점 메뉴판 전북 진안군 여행 지난 포스팅 보러 가기! - 운장산자연휴양림, 부귀편백숲산림욕장, 진안 카페 - 기배기 카페, 진안부귀편백숲산림욕장, 원조 화심순두부",2021. 7. 21.
전북여행.진안군 마이산&용담호.Attractions in Korea.Mai-Mt & Yongdam Lake...,"지난 3월 둘째 주에는 전라북도 진안군을 두차례 방문했습니다. 주중에 용담호를 먼저 다녀온 후, 동호회 출사에 참석차 토요일엔 마이산.... 오늘은 지난 주 촬영되고 편집된 진안군의 명소 두군데를 소개합니다. 아래 두편의 영상은 일출부터 일몰까지 하루를 보내면 마이산의...",2020. 3. 18.
"[여행] 전북 진안군 국민관광지 ""운일암반일암""","[도덕정] 운일암반일암은 전라북도 진안군의 주천면 대불리에 소재한 바위의 이름이지만, 주천면 주양리에서 무릉리를 거쳐 대불리까지 걸쳐 있는 계곡을 지칭하기도 한다. 이 계곡은 운장산[1,126m]과 동북쪽의 명덕봉[845.5m]과 명도봉[863m] 사이에 발달한 계곡으로 길이는 약 5㎞에 이르며...",2021. 3. 16.
전북 진안군 마이산 도립공원 말 귀 닯은 산새 그리고 벚꽃길,"안녕하세요 가본 곳은 많은 데 손이, 육신이, 정신이 게을러서 여행 블로그에 다 옮기지 못하는 게으름장이 여행블로고 여행바다에 빠진 여빠부부입니다 오늘 소개해드리고 싶은 곳은 제가 소싯적에 살았었던 전북 장수군과 아주 가까운 지역인 전북 진안군의 유명한 산 마이사입니다 마이 라는...",2021. 4. 19.
12컷 진안 국가지질공원 구봉산 탐방(전북 진안군),석 달 전 전북 진안의 국가지질공원 탐사에서 놓친 구봉산을 찾았습니다. 구봉산이라는 이름은 전국에 많은데 그 이름이 완전수인 3의 3배라서... 지질탐사하면서 함께 여행한 진안 부귀 메타세콰이어 길입니다. https://blog.naver.com/erric88/222527074833 이번에 탐방한 국가지질공원이란?...,2021. 10. 3.
[전북 진안군] 박수치는 맛이라더니 정말 박수치고 왔어요 ‘샘터가든’,"고기가 굉장히 신선해요, 배터질것같은데 고기가 넘 맛있어서 끝까지 집어먹었네요 ㅎㅎ :-) 전북 진안군 '샘터가든' 메뉴 전북 진안군 '샘터가든' 메뉴 #전북진안 #진안맛집 #전북맛집 #진안여행 #진안관광 #진안고깃집 #진안가볼만한곳 #진안추어탕 #진안삼겹살",2021. 2. 23.
전북진안군 마이산 탑사의 만불탑과 능소화,전북 진안군의 가볼만한곳으로 마이산의 탑사에 있는 만불탑과 벽면을 타고 자라는 놀라운 생명력의 능소화를 소개합니다 마이산탑사의 만불탑은... 싶네요 #진안 #진안마이산 #전북진안마이산 #마이산능소화 #능소화 #마이산탑사 #마이산만불탑 #진안가볼만한곳 #진안여행 얼굴닮은 마이산의...,2020. 7. 30.
"진안군, ‘진안힐링여행 가을이야기’ 큰 호응 #복지TV 전북방송",진안으로 떠나는 힐링여행 (출처=전북 진안군) 전북 진안군은 진안군 관내에 소재한 ㈜포레스트가 주최한‘진안힐링여행 가을이야기’가 지난 10월 2일부터 3일까지 1박2일로 진행됐다고 5일 밝혔다. 이번 행사는 ㈜포레스트가 산림청에서 주관하는 ‘2021 숲관광 전문인력 양성사업’공모에...,2021. 10. 5.
"[여행] 전북 진안군 안천면 ""용담댐조각공원"" / 마음이 편안해지는 곳 / 드라이브...","용담댐은 일제 강점기 때 전력을 생산하기 위한 댐으로 거론되기 시작하여 3차에 걸쳐 사업이 추진되었다. 1차 사업은 일제 강점기인 1940년부터 1945년까지 계획되었으나 해방으로 중단되었고, 1966년부터 2차 사업을 계획되었지만 대청댐의 건설로 전주권의 급수가 가능하다는 이유로 취소되었다....",2021. 6. 12.
전라도여행지추천 / 진안고원 수박축제 / 전북 진안군,진안고원 수박축제 2020 전북 진안군 진안고원에서 20℃이상 일교차가 큰 고랭지 기후의 영향으로 아삭한 식감과 12brix 이상의 당도를... 주최 진안군 주관 진안고원수박축제추진윈원회 이용요금 체험장마다 상이 공연시간 8. 1.(토) 16:00~ #가볼만한축제 #가족여행 #관광지 #나들이...,2020. 7. 31.
전북 진안군 용담면 송풍리 '용담섬바위' 차박성지(캠핑클럽 촬영지) - 차박여행,"JTBC에서 방영된 캠핑클럽에서 전북 진안의 '용담섬바위'라는 곳으로 캠핑을 갑니다. 화면으로 보았을때 너무 좋아보였습니다. 그래서 갑니다. 나도 캠핑하러... 저녁에 도착하였습니다. 비가 엄청 내립니다. 일단 차박텐트를 설치하고, 한 숨돌립니다. 강가에 텐트를 설치하였으나 물이 계속해서...",2020. 8. 25.
[9년 전 오늘] [전북여행/진안군/마이산여행]마이산 탑사/돌탑/금당사/사찰여행/천지탑...,"2011.6.27. 9년 전 오늘 [전북여행/진안군/마이산여행]마이산 탑사, 돌탑,금당사,사찰여행,천지탑,이갑용처사,역사여행 행복한여행이야기",2020. 7. 1.
국내 가을 여행 추천지 전북 진안군 마이산 탑사,"쏘원입니다 지난주 주말에 마지막 가을 여행 갔다왔어요 첫째날은 전주, 둘째날은 진안 마이산에 갔어요 전주 가는길에 특이하게 생긴 산이 있어서... 이른시각에 왔다 가시길 추천드려요 국내여행지로 마이산 왕추천! 전 너무 좋았어요 여러분도 가을에 마이산 탑사 꼭 가보세요! 오늘 후기 여기서 끝!",2020. 11. 16.
[진안군여행]진안고원길14코스/섬진강 발원지 데미샘 탐방/210km완주기념 사진,[진안군여행]진안고원길14코스/진안천 물길/상전면사무소~진안만남쉼터 트레킹/섬진강 발원지 데미샘 탐방/진안고원길 사무실에서 완주기념 사진... 상전면사무소~진안만남쉼터 4시간 트레킹~~ 전북 진안군 상전면사무소앞 출발지에 안내 표시 출발 인증샷 오전8시15분 시작~~ 상전면체련공원을...,2021. 10. 11.
진안 카페 추천 서리태 라테 맛집 * 전북 진안군 카페 공간153,진안 여행 갈 때마다 찾으시는 분들이 많으세요 아마 카페 공간 153의 아기자기한 공간의 느낌과 커피 맛이 맛있어서 다시 재방문 하시는 거 같아요... #인스타그램 환영합니다 #진안카페 #진안커피맛집 #전북카페 #진안카페추천 #서리태라떼맛집 #공간153 #카페공간153 #광주근교데이트...,2021. 5. 12.
전북 진안군 마이산은 아름다운 겨울산이었다..,전북 진안군 마이산은 그렇게 아름다운 겨울산이었다. 언젠가 눈이 많이 내리면 꼭 한번 가보리라 다짐했던 전북진안 마이산을 보고 왔다. 산에... 꼭 들러보고 싶던 마이산 탑사 방문은 못했지만 진안 여행 중 혹독한 마이산 날씨 탓으로 떠넘기고 영상을 담아 보는 것으로 만족해야 했다. 영상의 B....,2020. 2. 26.
"전북 진안군, 진안여행 데미샘계곡펜션으로 엠티왔어요.","안녕하세요. 데미샘계곡펜션지기 마니짱입니다. 겨울이 지나고 새봄이 왔어요. 데미샘계곡펜션의 징검다리 건너 숲속은 산새의 놀이터에요. 산새가 뛰놀던 날, 데미샘계곡펜션에 지인 모임에서 단체엠티를 왔어요. 따뜻한 난로에 장작을 가득가득 넣어가며 바베규장에서 멤버쉽 강화를 위한 즐거운...",2020. 3. 4.
"[전북 진안군] 시간이 담겨있는 여행자카페, 공간 137카페","[전북 진안군] 시간이 담겨있는 여행자 카페, '공간 137카페' 이 카페의 건물은 일제강점기때 지어진 오래된 한옥건물이었다고 해요. 머리를 띠용하게 만드는 문구입니다.. ㅇ_ㅇ.... (동공지진) '세남자의 시골카페만들기, 이천십오년 여름날, 호선.현두.홍군' 예술가와 안예술가의 차이는...",2021. 2. 23.
전라북도로 떠나는 여행 - 마이산이 생각나는 '진안군'편,"'2023 전북 아태 마스터스대회가 열리는 전라북도로 떠나는 여행' 시리즈! 오늘 소개해 드릴 일곱 번째 도시는, 미슐랭 그린가이드에서 만점을 받은 대한민국 최고의 명소이자 한국 관광 100선에도 선정된 마이산이 있는 '진안군'입니다. 진안에는 전국에서 5번째 규모의 용담댐이 있는데요....",2021. 4. 23.
삼척시 △충북 단양군 △전북 진안군 △경북 영주군 △경남 남해군 등 5개 시·군을 선정,"독일마을로 유명한 경남 남해군은 '구텐타그, 여권 없이 떠나는 독일여행'을 콘셉트로 한 관광활성화로 지역경제 발전 기반을 마련했다. 충북 단양군과 전북 진안군은 각각 '다리안 디 캠프 플랫폼 조성', '마이힐링 진안 케렌시아 프로젝트'로 지역 관광자원 재활용에 나섰다. 문체부는 지역 주도로...",2021. 5. 24.
[진안군여행] 유채꽃 만발한 배넘실마을,다들 기분전환하러 유채꽃도보시고~ 시원한 용담댐드라이브도 하고가세요~ #진안군여행 #진안군유채꽃 #전북꽃놀이 #전북꽃 #전북유채꽃 #배넘실마을 #꽃 #용담댐 #진안추천 #진안군맛집 #진안마이산 #진안용담댐 #전주근교여행 #전주꽃놀이 #진안꽃축제,2021. 4. 22.
전북 진안군 마이산 여행길에 만난 빈센트 반 고흐의 테디베어 해바라기 - 창원꽃집...,"작년 7월 전북 진안군 진안읍에 있는 마이산 여행길에 만난 테디베어 해바라기 . 통통하니 넘 예뻤어요 제 얼굴 만 하죠? 어찌나 크고 이쁘던지 한참을 요녀석한테 빠져 일행과 멀어져 그 떼악볕에 뜀박질을 해야했다는 ㅎㅎㅎ 테디베어 해바라기의 꽃말 당신만을 사랑합니다 기다림,숭배 입니다...",2020. 9. 15.
진안여행 진안군 메타세콰이어길 너무 멋있어서 탈이다,사진 잘 찍으면....인생샷도 건질수있는 진안여행 진안군 메타세콰이어길 주소는 전북 진안군 부귀면 세동리 69-15 조용하고 아름다운 드라이브하기좋은곳 꼭~가시기전에 맛있는 커피랑...좋은음악 준비해서 가세요~ 옆좌석에는 내가 가장 사랑하는 사람이 타있으면 더 좋겠지요^^ 너무...,2020. 11. 5.
코로나블루 치유하는 진안군 봄꽃여행,"출처 TOURKOREA 원연장 꽃잔디동산 봄이 점차 깊어가면서 전북 진안군 이 아름다운 꽃밭으로 변해가고 있는 중이다. 4~5월 진안군 여행은 핑크빛, 황금빛 등의 꽃 향연이 펼쳐지는 곳으로 상춘객들의 마음을 설레게 한다. 코로나블루에 지친 심신을 회복하고, 우울한 기분을 떨치기 좋은 청정...",2021. 5. 1.
"[진안군 추천 펜션, 코로나 피해 힐링여행] 진안 부귀면 지상낙원 펜션. 마이산...","후기 진안군 추천 펜션 마이산 인근 추천숙소 써미트CC, OKCC 인근 추천숙소 진안군 추천 숙소 진안군 힐링여행 안녕하세요. 그랜드리무진 의전명인... ★ 인근에 유명한 마이산 그리고 써미트CC 등 골프장 갈 때도 이용하기 편리함 (차로 15분 거리) 이상 내 돈 내고 이용한 전북 진안군 부귀면...",2020. 12. 3.
전북 진안군 구봉산,다음엔 어떤 모습일지 궁금하다. 휘리릭 (절대 힘들어서 그만 찍은 건 아니다) 힘들 때 하산할 때 기쁠 때 여행 갈 때 올라갈 때 ~때는 + 언제 어디서든 무엇을 하든 빈지노가 맞아 빵 빵 멀리서 진짜 토끼인 줄 알았다 소중한 03:10:48 빈지노는 옳다.,2020. 6. 3.
진안 맛집 마이산 맛집 추천 * 전북 진안군 초가정담,해요 여행 갔는데 맛집도 아주 중요해요 ㅋㅋㅋㅋ #마이산맛집 #진안맛집 매일 : 오전 9시 ~ 오후 9시 연중무휴 063 - 432 - 2469 마이산 주차장 있어요... #인스타그램 환영합니다 #진안맛집 #전북맛집 #마이산맛집추천 #마이산맛집 #마이산보리밥추천 #마이산고기추천 #진안맛집추천 #초가정담 #진안꽃축제...,2021. 5. 6.
태조이성계역사탐방 이성계가 꿈을 꾸며 기도를 드렸던 사찰 진안군 마이산 은수사,태조이성계역사탐방 이성계가 꿈을 꾸며 기도를 드렸던 사찰 진안군 마이산 은수사 #태조이성계역사탐방 #전라북도태조이셩계역사탐방 #전북역사탐방 #전북여행 #마이산은수사 #이성계전북테마여행 #일월오봉도 #금척훈장 #몽금척 #은수사 마이산 은수사는 한국불교 태고종 사찰로 마이산에...,2021. 9. 21.
국내여행추천 진안여행 마이산탑사 용담호 전북특별한관광지,"국가지정문화재로 진안군수가 관리중입니다, 진안 마이산에서도 유명한곳이 바로 탑사 80여개의 자연톨탑이 쌓여져 장관을 이루고 있는곳으로... 진안 #진안여행 #진안마이산 #진안용담호 #코로나여행 #전북여행 해당 포스팅은 캠페인을 홍보하면서 전라북도로부터 지원을 받아서 작성했습니다",2021. 7. 9.
[전북 진안여행] 큰바위펜션 전라북도 여행지원금받기,큰바위 펜션 주소: 전북 진안군 백운면 백장로 407 큰바위펜션 전화번호 : 063-433-4978 데미샘 계곡이 바로근처에 있음. 바베큐가능. 장은 읍내에서 보는걸 추천. #전라북도여행 #전북여행 #진안여행 장을보고 우리가 예약한 펜션으로 향했어요ㅎ #전라북도 #큰바위펜션 은 제가 미리 인터넷으로 알아보고...,2021. 9. 14.
[전북 진안군] 진안읍-연꽃두부,"연꽃두부 11:00-20:00 연잎밥정식 13,000 연꽃 두부 전골 20,000 가족끼리 진안으로 여행을 갔을 때 어디서 점심을 먹을까 하고 찾아보다가 발견한... 가보는 것도 나쁘지 않을 것같다! 다음 포스팅을 기다리며 하은한 하루^!^ #전북맛집 #진안맛집 #진안 #연꽃두부 #두부요리 #두부정식 #연잎밥 #삼색두부",2020. 2. 9.
여름 국내여행지추천 전북1박2일 여행 진안 가볼만한곳,마이산패밀리펜션 전북 진안군 진안읍 외사양길 78 1박2일 진안여행을 계획하고 숙소를 어디에 잡을까 고민을 했는데 마이산 아래쪽 홍삼스파와 함께 작고 큰 숙소들이 모여 있어 이곳에서 깔끔한 시설의 마이산 패밀리 펜션을 예약해보았습니다. 저렴한 가격에 깔끔한 시설을 자랑하는 숙소로...,2021. 7. 2.
"진안 반려견 동반여행... 국제캠핑장, 용담댐 조각공원, 전북 진안 가볼만한곳","따스한 분위기가 가득한 공간의 카페 진안, 반려견 동반 여행코스로 추천해드려요~ 위치 : 전북 진안군 부귀면 원세동길 2 운영시간 : 11:00~20:00 대표가격 : 아메리카노 5,000원 / 돈가스 8,000원 (식사 시 음료할인) 운일암반일암 숲길(진안고원길 9구간) 진안 눈치보지마시개길 많은 댕댕이들이 편한...",2021. 6. 16.
전라북도 진안군 최초의 로스팅카페 인 공간153 입니다.,카페 공간153 주소 / 전북 진안군 읍 당산길 26-2 전화 / 070-8869-5536 #전북진안카페 #진안한옥카페 #카페공간153 #진안계곡 #전북카페추천 #진안군카페 #전주근교카페 #마이산카페 #진안맛집 #진안여행 #공간153 #진안유채꽃 #KT올레커피청년 #로스팅카페 #진안최초로스팅카페...,2021. 7. 3.
[위클리 진안] 7월 셋째주 진안군 주간소식!,"▼ 경제총조사 홈페이지 바로가기 ▼ 동향면 대량리 제동유적 4차 발굴조사 실시, 제동로 2기와 대규모 폐기장 조사 완료 전북 진안군 동향면... 여름 특별 아카데미는 8일간의 미술여행(초등 대상), 톨(Tole) 페인팅, 드럼, 전자기타, 신디사이저(건반), Slow푸드(막걸리체험) 강좌가 개설되며...",2021. 7. 16.
전북여행1-마이산 탑사의 석탑,"마이산 탑사의 천지탑 - 전북 여행 1 전라북도로 여행을 했습니다. 진안군에 있는 마이산 탑사 탐방 .. 거대한 암벽과 원뿔형 모양의 천지탑, 돌탑들.. 신비한 풍경이 너무도 기이하고 인상적이었어요. 몇 년 전에 여행하며 찍은 사진인데 그간 방치했다가 이제야 정리해 올리네요. 사진의 시간...",2021. 4. 25.
"진안군 당일치기 1 / 샘터가든, 죽도 가막리들, 고원시장 빵돌이네 / 1박2일 촬영지...","2020년 5월 30일 토요일 전라북도 진안군 당일치기 여행 첫번째 이야기 금요일에 회식하고 늦게 들어온 남편은 술주정을 부리다 새벽 1시쯤 소파에서... 주소는 '오지캠핑, 전북 진안군 진안읍 가막리 73-3'로 1박2일 촬영지인 죽도 가막리들에 도착했다. 농업용수로 사용하기 위해 폭파시켜 만들어진...",2020. 5. 31.
"(안심여행)대한민국 안심여행 캠페인 방역 우수 관광지/전북, 전남, 제주 소재 관광지 목록",한국관광공사에서 진행하는 '대한민국 안심여행 캠페인'은 방역체계를 구축하고 수칙을 준수하는 전국의 178개 방역 우수관광지와 함께한다.... 마이산도립공원(전북 진안군) 출처: 진안군청 <전남> - 가우도(전남 강진군) 출처: 강진군청 - 힐링파크 쑥섬쑥섬-애도(전남 고흥군)...,2021. 6. 26.
