header,contents,date
"담양제과, 전남 담양군 대나무 디저트맛집 카페 추천!","담양제과, 전남 담양군 대나무 디저트맛집 카페 추천! 작년에는 국내여행을 종종 다녔어요. 국내에도 좋은 곳들이 참 많이 있다는 생각을 하게 됐는데 대나무로 유명한 담양도 좋은 곳이더라고요! 역시 전라도라 맛있는 것도 많고 돌아다녔던 맛집 진짜 다 넘 만족쓰....ㅎㅎㅎ 대나무를 이용해...",2021. 4. 21.
전남 담양군 돼지 갈비 맛집 [ 승일식당 ],안녕하세요 ㅎㅎ 이번에 포스팅 할 곳은 가족 여행으로 다녀온 전라남도 담양군에 위치한 돼지 갈비 맛집 [ 승일식당 ] 입니다. 영업 매일 09:30... 생각에는 한번 초벌로 구워 놓고 주문이 들어오면 완벽히 조리하는 방식인듯 합니다. ㅎㅎ 여기까지 전남 담양군 돼지갈비 맛집 [ 승일식당 ]입니다.,2021. 9. 3.
"[전남 담양군/메타세콰이어길, 메타프로방스] 여행의 끝, 낭만의 가로수 길로","확실히 이번 여행이 도움이 된 것 같죠?ㅎㅎ . . . . . . . . . . . . 그럼 전남 담양군 포스팅, 이만 마치겠습니다! '메타세콰이어길 & 메타프로방스' 란 무엇일까? 네이버 지식백과 & 메타프로방스 홈페이지 -담양 메타세콰이어길 -분류 : 인문(문화/예술/역사) > 체험관광지 > 이색거리 -위치 : 전라남도...",2021. 6. 13.
명옥헌 - 전남 담양군 고서면여행,"명옥헌 전라남도 담양군 고서면에 있는 조선후기 오이정이 조성한 정원. 전라남도 기념물 제44호. 고서(古西) 네거리를 지나 창평 쪽으로 가다보면 길 오른쪽에 ‘鳴玉軒庭苑入口’라고 쓰인 비석이 서 있고, 그 옆의 샛길로 접어들어 언덕을 하나 넘으면 네모진 연못이 하나 있는데 이것이 바로...",2020. 11. 4.
전남 담양군의 숨은 볼거리. 창평 슬로시티 고씨 집성촌,"""전라남도 담양군 가볼 만한 곳"" ""슬로시티 창평면 고씨 가옥"" ▶고재욱 가옥 전남 담양군 창평면은 담양의 역사와 슬로푸드가 공존하는... 임신영블로그엔 상업사진 및 여행 사진들이 많이 포스팅 되여 있으니 클릭하고 들어오십시오. https://blog.naver.com/photo4782",2021. 2. 14.
[메타세쿼이아길/관방제림] 광주 사는 친구와 담양여행 [전남/담양군],"담양군청 311번 버스를 타고 도착함 담양. 주말, 공휴일엔 담양군청에서, 주중엔 담양읍사무소에서 자전거를 무료로 빌려준다고 하여 담양군청에서... 담양여행 리뷰를 보다보면 관방제림에서 자전거를 빌려서 20분걸로 메타세쿼이어 길에 오고, 초입에서 10분간 사진찍으며 놀고, 다시 20분 걸려서...",2021. 8. 27.
전남 담양군 대전면 대치리 '한재골 주차장' - 차박 여행,전남 담양군 대전면 대치리에 위치한 '한재골 주차장'으로 갑니다. 저녁에 차박하러 갑니다. 도착하였습니다. 이번엔 면 타프를 자동차 2대의 지붕에 커다란 큐방으로 고정시켜 봅니다. 잘 버텨줍니다. 새로 산 12V 에디슨 전구도 밝혀봅니다. SKY Life 안테나도 설치합니다. 분위기 괜찮습니다. 밖의...,2021. 9. 11.
"""전남 담양군"" 광주/전남 ""키즈풀빌라펜션 ""오떼떼 가족과의 여행리뷰 104호","광주/전남에서 입소문이 났다던 담양 키즈풀빌라펜션 오떼떼를 가족과 104호 스파룸에 방문해 휴식을 취하고 왔습니다.^^ 딸이 너무도 심심해 하여 와이프와 예약하기 힘든 오떼떼를 예약해 즐거운 여행을 했네요. 담양 오떼떼 ""키즈풀빌라펜션"" 오떼떼에 도착하여 짐을 풀고 딸과 놀아주다가 나와서...",2021. 5. 25.
전남 담양군 여행_ 담양의 겨울풍경들,담양여행은 정자문화만 둘러봐도 너무나 멋진 여행이 되지요. 사계절 각양각색의 풍경이 너무나 아름다운 곳들입니다. 다음은 눈오던날의 가사문학권 여러 정자들의 흔적들입니다. 명옥헌 원림 소쇄원 식영정 부용당 송강정 일명 “메타세콰이어 랜드”,2021. 1. 3.
죽녹원 / 담양군 가볼만한곳 / 담양군 여행 / 전남,"거의 담양 여행의 필수 코스인 곳! 두구 두구 두 번째 방문이었다. 주차는 죽녹원 주차장이 아니라 담양 종합 체육관 주차장을 이용하였다. 더 편하다는 꿀팁을 보고 갔는데 넓~고 좋았다. 천 년 담 양 죽녹원 정문 정문 매표소 성인 일반은 3,000원이다. 죽녹원 안에서 밖으로 바라봄 쓰레기통도...",2021. 4. 29.
[新국토기행] <35> 전남 담양군 - 서울신문,[新국토기행] <35> 전남 담양군 입력 : 2015-07-01(수) 17:54 깨어나는 담양의 신비…발길잡는 남도의 손맛 전남 담양군은 예부터 대나무가 많이 나서 ‘죽향’으로 불린다. 한때 죽제품과 죽물시장이 전국 상인을 불러들일 만큼 번창했으나 지금은 플라스틱 제품과 수입품에 밀리면서 쇠락을 거듭하고...,2020. 5. 14.
"[전남 담양군] 1박 2일 스파 펜션, 담양 퀸즈캐슬 솔직후기","하고픈 말이 태산인데 다 까먹고 핸드폰 바꾸고 ㅋㅋ 그래서 육아휴직기간인 횬식이가 돌아왔습니당 담양 퀸즈캐슬 로고 전남 담양군, 퀸즈캐슬... 그치만 이모, 엄마와 함께하는 첫 여자들 여행으로써 다들 만족이었고 다른 곳으로 또 여행하자는 말이 나왔으니 대체적으로 만족이었습니다. 위생...",2020. 2. 13.
쌍교숯불갈비(담양본점) - 전남 담양군 봉산면 양지리 돼지숯불갈비 맛집 추천,쌍교숯불갈비(담양본점) - 전남 담양군 봉산면 양지리 돼지숯불갈비 맛집 추천 워낙 유명한 맛집이다보니 주차장도 어마무시합니다. 주차걱정은... #전라남도맛집 #담양맛집 #담양식갈비 #담양숯불갈비 #담양숯불돼지갈비 #쌍교숯불갈비 #담양본점 #담양봉산면맛집추천 #담양맛집추천 #담양여행...,2021. 8. 5.
‘한국기행’ 전남 담양군엔 추억이 피어나는 돌담길이 있다,"전남 담양군 좁은 돌담길에서 피어오르는 추억과 따뜻한 이야기는 1일 밤 9시 30분 방송되는 EBS 1TV 시사ㆍ교양 프로그램 ‘한국기행’에서 만나볼 수 있다. ‘한국기행’은 대한민국의 숨은 비경을 찾아 떠나는 공간 여행이다. 역사와 풍습, 건축, 문화의 향기를 느끼고 전하는 아름다운 시간...",2021. 2. 1.
[전남 담양군/죽녹원] 대나무 향기를 따라 여행을 떠나다!,"수학여행 등 연간 관광객 100만명이 찾는 대한민국 최고의 관광명소로 자리잡고 있습니다. -이이남아트센터? ""죽녹원 속 미술관, 미술관 속 죽녹원""을 테마로 담양군과 전문 민간 기업이 협력하여 완성한 디지털 영상 미술관입니다. 이이남아트센터에는 담양의 대나무를 아름다운 영상으로 표현한...",2021. 6. 13.
담양후산리은행나무(潭陽后山里銀杏─) - 전남 담양군 고서면여행,담양후산리은행나무(潭陽后山里銀杏─) 전라남도 담양군 고서면 산덕리에 있는 은행나무. 전라남도 기념물 제45호. 이 은행나무는 나이가 약 600년으로 추정되는 노거목이다. 이 나무는 일명 인조대왕(仁祖大王)의 계마행(繫馬杏) 이라고도 한다. 고전천(高傳川)의 기록에 따르면 인조대왕이 잠저...,2020. 11. 4.
"운영/ 담양군, 하반기 민방위 사이버 교육 재개/ 곡성군-전남과학대, 지역 동반 성장...","관련기사 담양군 창평면, 이웃 돕기 사랑의 밑반찬 나눔 실시전남교육청, 9월1일자 교육공무원 인사 발령전남도, 힐링․여유․감성․별미 등 소개 ‘남도 가을여행’ 발행담양군, 대전면에 한재골 수목정원 조성담양군, 제3회 한국문화가치대상 문화분야 정책평가 ‘최우수상’...",2021. 9. 12.
[ 전남 담양군 - 여행지 / 자연관광 ] 용마루길,"[ 전남 담양군 - 여행지 / 자연관광 ] 용마루길 ■ 답사 기준일 : 2020. 11. 27. (금) ■ 인근 관광지 추천 : 옐로우지브라 담양곤충박물관, 죽녹원, 한국대나무박물관, 관방제림, 메타세콰이어 가로수 길, 메타프로방스 등 00:02 00:53 1) 기본정보 - 주 소 : 전남 담양군 용면...",2020. 12. 15.
[국내여행영상] 전남 담양군 담양읍 죽녹원,#윤의일 #윤의일기자 #필란트로피윤의일 #이상기후 #동남아여행 #중국여행 #유튜브 #맛집투어 #나홀로여행 #코로나증상 #대권적합도 #남북회담 #소상공인 #제주여행 #추석 #명절 #귀성객 #코로나추석 #9월명절 #연휴 #송편 #명절제사 #여행사주식 #항공주식 #국민의힘 #민주당 #더불당 #더불어민주당...,2021. 9. 13.
"전남 담양군 '한재골 주차장' 가는 길 - 비 온 후 무지개, 차박 여행",전남 무안에 조금 나루 해수욕장이 있습니다. 차박을 하러 갑니다. 마침 석양이 지고 있습니다. 대강 사이드 유리창에 모기장을 설치하고 상황을 지켜봅니다. 석양이 너무 아름답습니다. 그러나 잠시 후 비가 너무 세차게 내려 포기하고 돌아섭니다. 며칠 후 소나기가 내립니다. 담양에 위치한...,2021. 8. 25.
전남 담양군 / 담양을 왔으면 이곳! 갈비라고 하여 다똑같은 갈비가 아니다!...,전남 담양군 / 담양을 왔으면 이곳! 갈비라고 하여 다똑같은 갈비가 아니다! 담양갈비창고 담양 식후경 전남 담양하면 볼꺼 많고 먹을꺼 많은 곳!... ㅋㅋㅋ 아기의자도 구비되어 있으니 가족들과 여행을 와서 먹어도 편하게 먹을 수 있는 것! 친구들이나 소규모로 왔을 경우 룸이 있어 룸에서...,2020. 5. 28.
[전남 담양군] 푸르른 죽녹원이 인상깊었던 나의 담양여행,"담양의 푸르른 대나무 숲을 보고 싶어 전라남도 여행을 계획하게 되었다 ! 광주역에서 네이버지도 앱을 보고 담양으로 가는 버스 찾기 광주 311번... 너무 좋았는데 혼자 뚜벅이 여행을 하다보니까 대나무 숲을 배경으로 한 내 사진은 없다 내 사진이 없어서 더 멋있었던 걸까, 내려오면서 이거 타시는...",2020. 11. 18.
(전남 담양군) 고서창평국밥,"담양군 창평면과 고서면을 중심으로 자리하고 있는 국밥집들도 빼놓을 수 없는 담양의 먹거리입니다. 오늘은 제가 애정하는 담양 국밥에 대해... 일대의 먹거리와 그 주변의 가사문화권, 무등산권을 돌아보는 것도 즐겁고, 매력적일 겁니다. 즐거운 여행 되시길 바랍니다. 읽어주셔서 고맙습니다~",2021. 3. 15.
관방제림 / 담양군 가볼만한곳 / 담양군 여행 / 전남,관방제림~죽녹원~국수거리 멀지 않은 곳에 있어 뚜벅이 여행으로도 담양이 참 좋을 것 같았다. * 담양 여행 추천 코스 국수거리 - 죽녹원 - 담양제과(카페) - 관방제림 메타세콰이아길&메타프로방스까지도 걸어서 30분 정도 걸리니 걸어가도 상관은 없을 것 같았다. 여행지가 넓게 흩어져 있는 것이...,2021. 5. 1.
[전남 담양군] 당일치기 담양 여행,작년인가 재작년인가 코로나 자체가 없던 때에 갔다. 비가 오는 날에 가서 날이 많이 흐렸다. 먼저 간 곳은 아마 메타프로방스 모형 보자마자 마카롱 먹고 싶었다. 마치 땅에서부터 이어져 가면을 들고 있는 모습 같아 신기해 다각도로 봤다. 외국 길거리 느낌이 난다. 문득 요새도 공중전화를...,2020. 12. 21.
[新국토기행] <87> ‘한국의 죽향’ 전남 담양군 - 서울신문,"[新국토기행] 대나무숲 걷노라면 竹我一體 입력 : 2016-10-12(수) 17:38 (87) ‘한국의 죽향’ 전남 담양군 전남 담양군은 ‘한국의 죽향(竹鄕), 대나무... 담양군 제공 ●3대 자연유산 삼인산·추월산·담양호 최근에는 체험위주의 관광에서 스토리를 찾아가는 여행이 트렌드다. 담양군도 이에 맞게...",2020. 8. 22.
[전남 담양군] 시원한 계곡 물놀이와 맛있는 백숙 맛집 상록수산장,금요일임에도 불구하고 꽤 많은 사람들이 방문했더라구요 적당히 북적스러워서 평일에 오길 잘했단 생각이 들었어욤 !! 시원한 계곡물과 맛있는 백숙집을 찾는다면 #전남여행 #용흥사계곡 #담양백숙맛집 #상록수산장 꼭- 방문해보세욤 #내돈내먹 후기 끝,2021. 7. 25.
고서 창평국밥 - 전남담양군 고서면여행,"창평시장의 명물 국밥· 돼지고기 국물에 내장과 순대 등이 듬뿍 들어간 국밥은 예부터 서민들의 대표적인 음식이었다. 창평시장의 창평국밥은 광주사람이면 개운하고 깔끔한 그 맛을 잊을 수 없어 일부러 한번씩은 꼭 찾는 창평의 대표적인 명물이다. 광주서 15분 거리, 점심시간을 이용해...",2020. 11. 4.
[전남 담양군/소쇄원] 조선의 선비가 거닐던 풍경속으로..,"※담양군민, 65세 이상 경로, 국가(참전)유공자, 장애우, 미취학 아동 &#x27;무료관람&#x27; 가능! 구분 개인 단체 어른 2,000원 1,600원 청소년, 군경 1... 어이~ 정가야~ 정가 : (난 분명 카메라맨 이었는데...) 아무래도 이번여행의 컨셉은 황선비와 노비들 인듯ㅋㅋㅋ 방금까지 우리가 있던 정자의 전경...",2021. 6. 7.
"전남 담양군 창평면 ""카페 하녹'","담양군 창평면 ""카페 하녹' 전남 담양군 창평면 ""카페 하녹' 전남 담양군 창평면 ""카페 하녹' 전남 담양군 창평면 ""카페 하녹' 전남 담양군 창평면 ""카페 하녹' 전남 담양군 창평면 ""카페 하녹' #광주근교#전남여행 #담양#창평#창평가볼만한카페#사진찍기좋은카페#한옥카페#예쁜카페#마당있는카페#카페하녹",2021. 7. 10.
[ 전남 담양군 - 여행지 / 역사관광 ] 한국가사문학관,"[ 전남 담양군 - 여행지 / 역사관광 ] 한국가사문학관 ■ 답사 기준일 : 2020. 01. 30. (목) ■ 인근 관광지 추천 : 광주호호수생태원, 식영정, 취가정, 환벽당, 소쇄원 등 00:00 00:40 1) 기본정보 - 주 소 : 전남 담양군 가사문학면 지곡리 319 - 지 도 : https://map.kakao.com/?urlX=501065&urlY=469844...",2020. 2. 3.
"기차마을로즈홀에서/담양군, ‘창평면 도시재생 뉴딜공모사업’ 최종 선정[전남조은뉴...","먼 옛날 여행의 길잡이가 되었던 밤하늘의 별자리를 콘셉트로 평생학습을 통해 내 삶의 미래를 찾는 꿈과 희망의 메시지를 전달한다. 포스트... com 기사입력: 2021/10/02 [21:44] 최종편집: ⓒ 전남조은뉴스 담양군, ‘창평면 도시재생 뉴딜공모사업’ 최종 선정:네티즌 독자와 함께 만들어...",2021. 10. 3.
전남 담양군 대전면 대치리 '한재골 수목 정원 주차장' - 차박 여행,차박 여행을 하려 합니다. 전북 임실에 '옥정호'가 있습니다. 그 주변을 돌아다닙니다. 모두 '캠핑카 야영' 금지입니다. 스텔스 차박을 할 건데도 뭔가 찜찜합니다. 그리하여 전남 담양군 대치리 대전면에 있는 '한재골'로 향합니다. 주차장에 도착하였습니다. 달이 뜨고 있습니다. 달이 구름 속에 숨어...,2021. 8. 6.
전남 담양군 여행, ,2021. 9. 26.
전남 담양군 감성카페 신상카페 담양 소예르(soller),나올때가 되니 해가 뉘엿뉘엿 그래도 역시 사람은 많다 더 추워지면 야외에는 절대 못앉을듯 다녀오실 분들은 지금 가세요 !! 분위기 좋은 감성카페 소예르 제주감성 양양감성 외쿡감성 다 있다 커피맛은 ? 잘모르겠다 ㅋㅋ #전남여행 #담양카페 #담양핫플레이스 #데이트코스 #드라이브코스 #담양소예르,2020. 10. 27.
메타프로방스 / 담양군 가볼만한곳 / 담양군 여행 / 전남,"담양 메타세쿼이아길 바로 옆에 있는 곳! 메타 프로방스다. 주차는 메타세쿼이아를 방문했다면 세운 곳에 그대로 세워 두고 방문해도 되고, 내비게이션에 메타세콰이아랜드 주차장이라고 찍고 오면 된다. 주차는 무료고 공간은 많았다. (사람 많을 때는 부족할 수도 있겠지만 넉넉해 보였다.)...",2021. 5. 5.
광주근교 데이트 분위기 좋은 담양맛집 * 전남 담양군 담양앞집,"담양으로 여행 오시는 가족단위 손님들에게도 룸으로 예약하시는 걸 강추해드려요 Previous image Next image 담양 하면 떡갈비잖아요 그렇지만 등산 전 먹기엔 투 머치 한 느낌이 들어 ㅋㅋㅋㅋ 맛있는 떡갈비를 포기하고 한우탕반면, 담양육반 밥류로 주문했어요 메뉴가 정말 다양해서 고르는데 조금...",2021. 9. 30.
힐링여행에 좋은 전라남도 담양군 창평면,"힐링여행에 좋은 전라남도 담양군 창평면 전남 담양군은 국가지정 문화재인 고택이 많이 남아있으며, 죽녹원과 메타세콰이어 가로수길, 관방제림 같은 절경을 가진 도시다. 창평면(昌平面)은 담양군 남부에 있는 면으로서 주요농산물은 쌀·보리·참깨·고추·마늘 등이며, 이의 집산을 위한...",2021. 9. 8.
(전남 담양군) 뚝방국수,현지인들에게 알려진 국수 맛집 관방천변에 형성된 국수의 거리는 담양 사람들은 물론 인근 지역 사람들을 넘어 여행이나 맛집에 관심 있는 사람들이라면 누구나 한 번쯤 들어 본 명소가 되었습니다. 그렇다면 왜 관방천변에 국숫집들이 이렇게 들어서게 되었을까요? 이유는 간단합니다. 과거...,2021. 6. 17.
[전남 담양군 맛집] 저렴한 가격에 먹을 수 있는 떡갈비 정식 '달빛 뜨락',"이번에 여름 휴가도 못가고 급하게 남자친구와 당일치기로 잡은 담양여행이였어요! 담양이 떡갈비와 죽통밥이 되게 유명한 지역이라서 한번 꼭 먹고 싶었는데, 죽녹원 근처는 너무 비싸더라구요.... 그래서 조금 괜찮은 곳 없을까 하는 생각에 포스팅을 보다가 가본 곳이랍니다! 요세... 핸드폰...",2021. 8. 24.
대학생 여행 블로그☆ '황선비님과 함께 떠난' 전남 담양군 여행기,"(healing) 여행을 떠나보려 한다. 코로나에 지치고, 학업에 지치고, 바뀌어버린 일상에 지친 요즘, 조금은 복잡하고 힘들지만 이 기록 하나하나가 미래의 나에게 의미 있는 메시지가 되기를 바란다. 오늘의 주인공 우리의 '황선비' 님 이번 여행의 주인공 우리의 황선비님!! 옷 입는건 동생들이 해도...",2021. 5. 31.
승일식당_전남 담양군,#담양맛집 #광주근교여행 #광주여행 #담양여행 #광주드라이브 #담양드라이브 2021.01.24 일요일 점심 즈음.. 여자친구를 픽업하여 광주에서 담양 승일식당으로 출발했다. 한 번씩 찾는 식당이다. 엄청 맛있다기보다는 한 번씩 생각나는 맛이기에 들리고는 한다. 줄 서 있는 승일식당. 앞을 보면...,2021. 1. 25.
[ 전남 담양군 - 카페 / 카페 ] B612카페,⑬ 장애인문화관광센터 링크 : 홈페이지 : http://www.dctc.or.kr 네이버카페 - http://cafe.naver.com/happyywing 다음카페 - http://cafe.daum.net/happyywing 장애인문화관광센터 www.dctc.or.kr ⑭ 해시태그(메타데이터) #전남 #담양군 #카페 #장애인여행 #장애인관광 #휠체어여행 #휠체어관광 #휠체어...,2020. 2. 3.
"2021년 8월 7일~8일 전남 목포, 담양군 (목포, 성식당, 떡갈비, 코롬방제과점...",전라도 여행을 떠날 때는 늘 쉬었다 가는 섬진강 휴게소. 주말이지만 전라도 쪽은 그렇게 차가 많지 않았다. 식당 앞에는 주차장이 없기 때문에 인근에 주차를 해야 한다. 목포역 뒤에 있는 공영주차장에 차를 세우고 좀 걸어갔다. 한 10분 정도 걸어야 한다. 좀 더 가까운 곳에 주차하려면 목포항...,2021. 8. 10.
전남 담양군 금성산성 동자암 비구니 보리 스님과 양경모 신부님 만나,"'전남 담양군 금성산성 동자암 비구니 보리 스님과 양경모 신부님 만나' 뉴스를 알아봅니다. [EBS 한국기행] 그 여름의 산사 “수행자이기 때문에!... 한편 EBS 한국기행은 대한민국의 숨은 비경을 찾아 떠나는 공간 여행이자 역사와 풍습, 건축, 향기를 느끼고 전달하는 아름다운 시간 여행이다....",2021. 8. 18.
메타세쿼이아랜드 / 담양군 가볼만한곳 / 담양군 여행 / 전남,"가을 단풍 질 때 와도 정말 멋있을 것 같다. 담양 여행 계획 예정이라면 꼭! 이곳, 담양 메타세쿼이아길을 한 번 걸어보기를 추천한다. 해피 ♥ 주차공간 ○ 화장실 남/여 구분 ○ 재방문의사 ○ 한 줄 평 메타세쿼이아길에서 봄~여름의 푸르름을 느껴보세요",2021. 5. 4.
[전남 담양군/창평 슬로시티] 환경친화적 삶이 녹은 마을 속으로...,담양을 여행하다 조금 지칠 때면 와서 잠시 쉬어가는 것도 나쁘지 않은 거 같습니다. 뒤뜰 안쪽으로 들어와 보니 우물과 물레방아가 있네요?... 네이버 지식백과 분류 : 인문(문화/예술/역사) > 역사관광지 > 민속마을 위치 : 전라남도 담양군 창평면 돌담길 9-22 문화재지정 : 아시아 최초의 슬로시티...,2021. 6. 12.
배롱나무꽃의 여름 in 담양 명옥헌원림 .. [전남담양여행],"연못과 주위를 둘러싼 배롱나무꽃, 연꽃의 개화가 한폭의 그림으로 추억하게 합니다. 전남 담양군 고서면 후산길 103 마을 입구에 주차장과 화장실, 그리고 카페도 있습니다. #담양가볼만한곳 #담양여행지추천 #전남가볼만한곳 #사진찍기좋은곳 #여름꽃여행 #드라이브 #네모연못 #연꽃개화 #연잎반영",2021. 8. 23.
"[전남 담양] 담양 속 아름다운 유럽 마을, 메타프로방스","<담양 메타프로방스> 전화 : 061-383-1710 주소 : 전남 담양군 깊은실길 2-17 ※ 운영시간 없음, 주차료 무료 가을에는 가고 싶은 여행지를 떠올리는 것만으로도 기쁨이 두 배가 된다. 특히, 유럽풍의 분위기를 느낄 수 있는 메타프로방스 같은 독특한 여행지는 상상만으로도 이미 여행지에 가 있는...",2021. 10. 6.
담양 여행코스 대숲향 진한 죽녹원 전남여행지로 딱~,"진한 대숲향 맡으며 힐링 제대로 했거든요, 언제 가도 한결같은 담양 여행코스로 죽녹원 올려볼게요~ 주소: 전남 담양군 담양읍 죽눅원로 119 영업시간: 09:00~ 19:00 입장료: 3000원 문의처: 061 380 2680 보통 죽녹원을 찾으면 담양 종합체육관주차장에 차를 두고 정문으로 들어가는데요, 이번엔...",2021. 8. 26.
"담양 곤충박물관 장수풍뎅이, 파충류 체험 / 전남 아이와 가볼만한곳 /담양 여행","주소 - 전남 담양군 담양읍 담양88로 428 담양곤충박물관 매일 10:00 - 18:00연중무휴,입장마감(17:30까지) 요금정보 성인 6,000원 어린이 15,000원 회원 할인... 담양 여행은 어떠셨어요? 하루를 다쓰고도 부족한거 같아 다음엔 1박을 하면 좋을거 같다고 생각한 담양 아이들과 즐기고 체험하기 정말 유익하고...",2021. 7. 9.
"[전남 담양군/용마루길] dragon-road, 용마루길을 거닐다!",(나름 선글라스 잘 어울리는데?) 황선비와 아이 둘이 뽑은 이번여행 최고의 사진 (잘 찍히지 않았나요? ㅎㅎ) 용마루길 안내판 와~ 용마루길이... 이번 여행으로 느꼈던 건데 담양은 정말 어딜가나 나무가 참 많네요 황선비님은 뭘 보고계신 걸까요? (황선비 : [따봉] ) (한가 : 근데 이제는...,2021. 6. 13.
전남 5월추천관광지① 담양 금성산성 오토캠핑장 언택트여행,"■ 담양 먹거리 소개 * 한상근 대통밥집 문의 : 061) 382-1999 메뉴 : 한상근정식 28,000원, 대통밥정식 18,000원(1인 기준) 주소 : 전남 담양군 월산면 담장로 113 담양의 대통밥정식은 여행객에게는 실패 없는 음식으로 유명한데요. 대나무통에 밥을 지을 때의 물기가 고스란히 담겨 나오는 대통밥은...",2021. 5. 4.
전남 여행 가볼만한곳 : 담양 명옥헌 원림 배롱나무 백일홍,여름 전남 여행 필수코스?중 하나이기도 합니다 전남 담양이 전국에서 손꼽히는 관광도시이다 보니 그간 여러차례 담양 여행 갔음에도 타이밍... ㅠ 담양 명옥헌 원림 주차장 주소 : 전남 담양군 고서면 산덕리 435-2 명옥헌 바로 앞까지 동네 좁은 도로 뚫려있어 차 다닐수있는 여건은 되지만 1....,2021. 8. 12.
[풍성한남도] 자연과 어울리기 좋은 전남 언택트 여행 명소 BEST4,"그런 시원한 기분을 느끼고 싶을 때, 전남 어느 곳을 가면 좋을지! 전남 언택트 여행 명소 BEST4를 소개합니다! *언택트 여행이란? 사람간의... 전라남도 산림자원연구소 바로가기☞ http://jnforest.jeonnam.go.kr/#none 담양 메타프로방스 위치 전남 담양군 담양읍 깊은실길 2-17 메타세쿼이아길...",2020. 5. 18.
