header,contents,date
남도여행_나주~광주,전라남도에서 나주와 광주지역을 여행하였습니다! 나주에서의 점심_송현불고기 현지식사(나주) 1시에 출발을 한 졍구들은 배가고팠습니다. 그래서 나주의 맛집 송현불고기로 바로 향했습니다! 송현불고기는 전남 나주시 건재로 193에 위치해 있는 나주 맛집으로써 백종원3대천왕에 출연한 유명한...,2021. 7. 27.
[지역N문화] 이색 등대를 찾아 떠나는 여행! 4곳을 소개합니다!,이색등대를 찾아 떠나는 여행! 4곳을 소개합니다! 등대란 항로표지 중에 시각표지에 해당하며 그 중에서도 광파표지/대형에 속하는 건축물을... 통영 연필등대 보러 가실래요???^^ 나주 영산포등대 전남 나주시 영산동 659-11 나주 영산포등대는 모양보다는 한국의 내륙 하천가에 있는 유일한...,2021. 8. 25.
전남 #장성군 기행,"[전남 장성(長城)군 기행] - 2021.09.05. 수정. 1. 개요 □ 지지 * 호남에서 학문이 높은 지역으로 유명. * 문불여장성(文不如長城) : 흥선대원군이... ○ 황룡강(黃龍江) : 장성군 북하면 입암산에서 발원하여 나주시, 광주시로 흐르는 하천. □ #장성호 관광지★ : 장성8경 * 면적 1,237km2의...",2021. 9. 12.
"전남 나주보쌈, 배멧원","전남 나주보쌈 배멧원 위치:전남 나주시 배멧3길 5-18(전남 나주시 빛가람동 348-19) 매일 10:00 - 22:00 BREAK TIME (14시30분,16시30분)/ 일요일 휴무... 맛스타그램 #여행스타그램광주맛집 #광주밥집 #광주카페 #광주핫플 #광주데이트 #광주데이트코스추천 #먹스타그램 #맛스타그램 #여행스타그램 #광주야미...",2020. 3. 5.
전남 나주 맛집 영일복집 몸보신하자용~!!,"전남 나주 맛집 영일복집 주소 - 전남 나주시 영산3길 22-1 전화번호 - 061-334-3596 영업시간 - 11:00~20:00(2시~5시 브레이크타임/첫째, 셋째 일요일 휴무) 회사분들과 다녀온 나주 영일복집! 여기 복어전골이 되게 맛있다구 하시더라구요~ 영일복집 식당이 은근 커요! 이렇게 주차장도 있다는 점...",2020. 3. 20.
"[오천, 금강, 영산강 라이딩 ⑤] - 전남 나주, 영산포, 죽산보, 우습제, 느러지전망대...","영산포 양곡교를 건너 우회전한 직후 나주시 공산면 동촌리의 멋진 길 [오천, 금강, 영산강 라이딩 ⑤] - 2020. 10. 20. (화). ▷ 주행경로, 주행거리... 4박 5일의 무사하고 즐거운 여행... 축하하고 수고했다는 덕담을 서로 나눕니다 목포터미널에서 13:00 출발 프리미엄버스 탑승... 서울 센트럴시티...",2020. 10. 25.
전남 수국/ 나주 느러지 전망대 / 환상적인 퍼플 수국길,"코로나인데 제주도로 여행갈수도 없고.....흑흑.... 그리하여 인스타에 전남,전북 수국길 좀 알려주십사 글을 올렸더니 세분께서 정보를 주셨답니다.... 나주시에서 관리하면 좀더 오래볼 수 있겠지만요... 하. 이렇게 아름다울 수가 있습니까? 전남에도 이렇게 예쁜 수국길이 있었을줄이야... 제주도...",2020. 6. 28.
근사했던 나주 맛집,숭늉을 한 입 들이키니 마치 어머니가 직접 차려준 집밥을 먹는거 같은 착각마저 들었습니다. 나주 맛집은 손수 요리한 제철음식을 맛볼 수 있어 감동적이었습니다. 토속적인 한국의 맛이 그리울 땐 어김없이 이 곳을 찾으려구요! #나주맛집 #메주애꽃 주소: 전남 나주시 금성길 52 번호: 061-333-9253,2020. 5. 3.
"대구석의 밥상 전라도로 떠나는 한 그릇 말복 보양식 기행, 여름보양식추천","나주곰탕하얀집 가격 : 곰탕 9,000원 주소 : 전남 나주시 금성관길 6-1 전화번호 : 061-333-4292 여수 장어탕 여수는 공항과 고속철도가 연결되어 있어서 많은 여행객의 꾸준한 사랑을 받는 남도 여행지입니다. 여수 하면 유명한 여러 가지 요리 중에서도 장어를 이용해 만든 요리들이 참 많습니다. 장어...",2020. 8. 10.
"[나주 맛집] 나주 아구찜은 진미아구찜, 도심속 레트로여행",나주곰탕도 유명하고 영산포 홍어도 유명하지만 맛있는 것도 먹고 신나는 데이트로 할 수 있는 나주정미소 앞 나주맛집 나주 진미아구찜으로 맛여행 가보시는 건 어떨까요? 나주 진미아구찜 061-333-8935 전남 나주시 금성길 65-2(성북동) 매주 수요일 휴무 영업시간 11:30 ~ 21:00,2021. 8. 15.
"눙눙이, 나주 소품샵 일층뭉구점 신규 입점(10/10), 쿠션인형, 스티커, 엽서, 뱃지 등",쿠션인형 #눙눙이 #티롱이 #링링이 #코롱이 #일층뭉구점 #나주여행 #나주 #나주소품샵 #전남여행 #전라도여행 #전남소품샵 #전라남도여행 #전라남도 #전남나주 #나주카페 #나주데이트 #나주데이트코스 #나주핫플 #나주핫플레이스 #나주혁신도시 #나주소품샵일층뭉구점 #나주시 #나주일층뭉구점...,2020. 10. 13.
"[SNS서포터즈]자연으로 떠나는 가족나들이, 산림자원연구소의 봄","나주산림자원연구소는 전남 나주시 산포면 산제리에 위치해 있고, 부지면적이 약 48ha로 전체적으로 둘러 보는데만도 꽤나 시간이 걸리는 곳이랍니다. 이용시간은 하절기(3월~10월)와 동절기(11월~2월)로 분류해 하절기에는 오전9시~오후6시까지, 동절기에는 오전9시~5시까지 이용 가능하답니다....",2020. 4. 9.
"[프롤로그]맛의 고장, '전라남도'를 여행했어요!","특히 전남을 여행하고 싶었다 학부생 때 방학을 이용하여 광주광역시 / 담양군 / 구례군 / 순천시 / 여수시 를 여행하였고, 졸업 후 나주시를 여행했다 아직 부족하다, 진정한 남도를 알기 위해 나는 여행을 떠났다 이번 여행을 군 입대를 앞둔 나의 중학교 학원 친구이자, 고등학교 동창인 '마스터...",2021. 7. 12.
나주 가볼만한곳 한옥 카페 3917마중-테마여행10선,나주 가볼만한곳 한옥 카페 3917마중 테마여행10선 얼마나 오랜만에 간 걸까... 이곳이 생소하니 말이다... 아마도 가장 나중에 간 해가 2015년인 거... 역시 담에 오면 모두 다 함께 먹어줄게^^ 나주 가볼만한곳 카페 3917마중 : 전남 나주시 향교길 42-16 061-331-3917 주차장 있음... 조금 떨어진 곳에 한옥...,2021. 2. 25.
기차를 타고 떠나는 역사 추리게임 - [나주행]- 십일삼.com,기차를 타고 떠나는 여행은 더 설레고 특별함이 있죠. 여기 시간여행을 떠나게 해주는 기차가 있습니다. 1929년 기차에 올라탔던 그들처럼 이... 극락강역(광주 광산구 목련로 310-23) 나주역(전남 나주시 나주역길 56) -온라인참여는 휴대폰인 경우 '네이버 앱'을 컴퓨터인 경우는 '크롬 브라우저'를...,2020. 10. 17.
나주곰탕거리 하얀집 입맛에 딱,"| 나주곰탕 하얀집 전남 나주시 중앙동 48-17 8시~ 21시 1,3째주 월요일 휴무 금성관 옆쪽 무료주차장 이용해서 편히 식사하고, 나주를 바로 떠나긴 싫어서 산책할만한 코스를 찾아 나주여행을 이어갔네요:) 지난 5월 말에 다녀온 판다의 2020 전남여행기는 다음 편에서 #나주곰탕거리 #나주곰탕하얀집...",2020. 6. 30.
전남애견동반 나주 마중3917 한옥카페,우리 밥풀이사진 찍어가시더라구요 너무귀엽다고 인형인줄알았다면서 ㅎ호호호 - 너무정신 없어서 사진을 많이 찍지 못했는데 그래도 이렇게 전남애견동반 가능한 나주 카페 다녀왔다는 의미로 좋았어요 나중에 좀 더 쌀쌀해지면 방문하기 좋을 것 같아요 전남 나주시 향교길42-16 교동 16 061.331.3917,2020. 8. 3.
전남수영장펜션 :: 나주 중흥골드스파 여름 아이와 가볼만한 곳!,오시는 길 전남 나주시 다도면 나주호로 558-314 (중흥골드스파&리조트) 전남리조트 나주 중흥골드스파는 아이와 함께 가볼만한 숙소 겸... 이렇게 1박2일 나주 여행을 마쳤습니다. 돌아보니 정말 즐거웠던 여행인것 같네요:) 아이는 언제 또 가냐고 벌써부터 ㅎㅎㅎ 여름 아이와 나주로 여행을 떠나...,2020. 7. 9.
[월간테마여행] 한옥 좋아하세요?,"숙박체험과 다양한 문화체험도 진행된다고 하니, 가족들과 함께 공주로 여행을 떠나보세요. ● 주소: 전남 나주시 다도면 풍산리 193 공주 한옥마을 공주 한옥마을은 한옥에서 숙박을 할 수 있는 한옥 체험마을이예요. 족욕체험, 다도체험 등 다양한 체험 프로그램이 준비되어 있고, 마을...",2021. 1. 13.
영산나루 아름다운 정원을 품다(나주 여행 7편),"영산나루 전남 나주시 주면 2길 28 매일 11:00 ~ 22:00 매주 월요일 휴무 단체석, 주차, 포장, 예약, 무선인터넷, 남녀 구분 화장실 복합문화공간으로... 이곳 나루재 펜션은 동실과 남실, 가야산 실로 이루어져 있는데 영산포를 여행하는 방문객이라면 푸르른 정원을 마당 삼아 이용해 보시는 것도...",2021. 7. 14.
광주근교나들이 나주여행,위치:전남 나주시 금성길13 ☎061-330-8107 남파고택 구경하고 7월22일 오픈한 전자랜드에 왔어요. 전자제품은 오픈 할인이 가장 싸다는것도 처음 알았 어요. ㅋㅋ [전자랜드나주점] ▶찾아가는길: 전남 나주시 영산로 5411 사람들 무지 많고 싸고 좋은 제품들 도 많아요. 전자제품 필요하신분들은...,2021. 7. 24.
2021국제농업박람회 10월 21일 ~ 10월 31일이 기다려집니다.,[2021국제농업박람회]는 대한민국 유일한 농업종합 박람회로 2021년 10월 21일부터 10월 31일까지 11일간 전남 나주시 산포면에 위치한 전남... 관심과 참여로 성공적인 박람회가 되었으면 합니다. #2021국제농업박람회 #국제농업박람회 #농업박람회 #전남여행 #나주여행 #전남가볼만한곳 #티켓예매,2021. 10. 10.
전남 나주맛집/목포낙지전문점 :낙지볶음♡,갑자기 낙지볶음이 먹고싶어져..ㅜ 애기아빠와 나주에 유명한 목포낙지전문점에 맛점하러 갔어요 ~!!♡ 목포낙지전문점 전남나주시 혁신도시... 목포까지 갈필요 없었어용 저번에 가족여행때 목포식당서 소고기탕탕이 먹는데 실망했던 기억이..ㅠㅠ 광주에서 멀기도 멀었지만 오랜만에 제대로...,2020. 1. 4.
5월 여행지 Pick! 나주의 푸름으로 떠나자!,"금성산 생태숲 전남 나주시 노안면 금안리 370-1 금성산 생태숲은 나주시 금성산 일대의 넓은 삼림에 탐방길과 전시, 그리고 교육관이 갖춘 생태숲... 5월의 나주는 참 가볼 곳이 많지만, 이 곳으로 떠나는 여행! 역사와 전통 그리고 체험이 함께하니 가족들과 떠니기 참 좋은 곳으로 꼭 가보시길...",2020. 5. 17.
지칠때 가볼만한곳 나주 태평사 산책(여행 5편),"나주 태평사 전남 나주시 노안면 금성산 길 387-83 주차 가능 이용료 없음 대웅전은 정면 3칸, 측면 1칸이며 석가모니불 및 보살 입상 2구를 봉안하고... 관광객이 있을 만큼 핫스팟인 곳이랍니다. 여기까지 전남 나주 여행으로 태평사와 서 씨 묘를 가볼만한곳으로 추천드리며 포스팅을 마칩니다.",2021. 7. 7.
나주 맛집 피자 & 파스타 레스토랑 재난지원금 사용방문 '2046 팬스테이크' 분위기 강추!,근데 이런 날씨에 집에만 있는 것은 저한테 너무 못할 짓이라는 생각이 들어서 친구들과 급약속을 잡았어요 여행은 그렇다 치더라도 근사한데서... 매장주소: 전남 나주시 빛가람동 336-3 5층 매장전화: 061) 332-2046 나주 파스타 & 피자 & 스테이크 전문점이에요 북촌 한옥마을에서 유명한 맛집이라는데...,2020. 5. 13.
"[SNS 서포터즈] 나주여행, 온가족이 즐거운 금성산생태숲","요즘 전남의 핫한 관광명소가 된 것 같아요. 아이부터 어르신들까지 3세대가 모두 함께 즐길 수 있는 시설이 갖추어져 있다는 게 가장 큰 이유 같아요. 어떤 즐길거리가 있는지 하나씩 소개해 드릴게요. 문의 및 안내 금성산 생태숲 061-336-8439 나주시 산림공원과 061-339-7215 먼저, 금성산 생태숲으로...",2021. 3. 8.
산림자원연구소,산림 자원 연구소 전남 나주시 산포면 다도로 7 안녕하세요:) 정말 오랜만에 데이트 블러그 올릴려고 왔어요!! 요즘 코로나 때문에 놀러가고 싶은... 무료 #일상 #일상블로그 #일상이야기 #일상생활 #일상생각 #커플 #커플룩 #커플티 #커플사진 #장거리 #장거리커플 #부산 #부산여행 #부산가볼만한곳...,2021. 10. 5.
"멘델스존과 슈만, 바이올린 김동현 협연/ 나주시, 안성현 탄생 100주년 온라인 기념음악회",같은날 현대 무용의 선구자인 이사도라 덩컨의 일대기를 다룬 '던컨'과 생의 마지막을 앞둔 건축가와 그의 친구의 유럽 여행을 그리는... 11:05:50 전남 나주시는 제26회 나주시민의 날인 30일 '안성현 선생 탄생 100주년 기념 음악회'를 시 유튜브를 통해 방영할 예정이라고 29일 밝혔다....,2020. 10. 29.
"전남 나주 여행_나주에 남은 일제강점기 아픈 근대사의 흔적, 일본인지주가옥 & 동척...","이렇게 나주엔 일제강점기의 근대건축도, 운동의 역사도 어려 있어요. 나주 여행 가실 분들은 한번쯤 돌아보시면 좋을 거 같습니다. *나주시 금계동 19번지. 나주 금성관 앞에 있어요. ↓영산강을 노래한 노래를 찾아보니 안치환이 부른 노래가 있어 같이 올려 봅니다.",2020. 8. 12.
"나주 가볼만한곳, 금성관/정수루/금학헌/나주곰탕/황포돛배","나주 여행은 이때가 처음이었습니다. 나주... 광주의 위성도시 정도로 알고 있지만, 전라도의 전(全)이 전주, 라(羅)가 이곳 나주를 말할 정도로... 정수루 위치 : 전남 나주시 금계동 13-18 전화번호 : 061-330-8114 목사내아 금학헌 '거문고 소리를 들으며 학처럼 고고하게' 조선시대 나주목사가...",2021. 1. 30.
"[롤리트롤리 여행 정보] 강 앞에서 즐기는 힐링 카페여행, 전라남도 광주 근교 [구례/나주]","당신의 즐거운 여행 동반자 롤리트롤리입니다☻ 연인과 함께 / 가족과 함께 / 친구와 함께 드라이브하기 좋은 5월 입니다:) 잔잔함이 가득한... 영상강 리버뷰 나주 카페, 비클래시 이용시간 : 매일 10:00 - 22:00 / 라스트오더 21:00 전남 나주시 노안면 건재로 524-11 품장장어구이 사진출처...",2021. 5. 3.
"전라도 역사기행/전라도 관광 100선에 포함된 역사여행(남도여행, 가볼만한 곳)","- 주소: 전남 나주시 과원동 출처: 남도여행길잡이 ▶ 목포 근대역사거리/갓바위 최근 모 국회의원 때문에 더욱 유명해진 목포 근대거리는 일본식 가옥과 관사 등이 즐비한 역사의 거리이다. 근대역사관과 동양척식주식회사, 일본영사관, 일본식 가옥과 상가주택, 동아부인상회, 병원...",2020. 11. 27.
김장준비! 나주 이화당!,"스트래스 받고 쉬고 싶을때 한번쯤 들려보아도 후회없을 것이라고~입소문이~ 나주 그리고 영산강 여행시 편안한 한두밤 쉬고 십은곳이라고... ♧♧이화당 전남 나주시 금천면 촌곡길 66 (촌곡리 16-12) ***-****-**** 기준 8인 270,000 (최대 20인) 입실 15:00 · 퇴실 12:00 와이파이, 파티, 바베큐 스몰웨딩...",2020. 11. 9.
금성관 나주 객사 외국인도 다 가본곳?(여행 3편),오늘은 전남 나주 여행 가볼만한곳으로 금성관을 소개해드리겠습니다. 건립시기는 이유인 목사가 1487년 4월 12~1489년 재임 당시 망화루와 함께... 전남 나주시 금성관길 관람시간 1~4월 09:00 ~ 18:00 5~6월 09:00 ~ 19:00 7~9월 09:00 ~ 20:00 10~11월 09:00 ~ 19:00 12월 09:00 ~ 18:00 주차장 없음. 주변 주차 가능...,2021. 7. 5.
나주 빛가람 전망대 와 호수 공원 그리고 유아숲 체험원과 모노레일♥ (전남 여행),"공원 내 안전 수칙 애완동물 출입 자제 쓰레기 투기 금지 불법 주차 금지 공원 시설 훼손 금지 나주시 공원 내 안전 수칙은 지켜 줘야겠죠:) 올바른... 공원 내의 서식하는 동물을 학대하거나 허가 등을 받지 아니하고 포획하는 행위 - 100,000원 나주시 산림공원과 공원 내 「텐트, 해먹」 설치...",2020. 4. 27.
전남 워터파크 나주 가볼만한곳 중흥골드스파 리조트.,큰 기대안하고 그냥 물놀이나 한번 할 생각에 왔는데 아주 즐겁게 잘 즐겼다. 나중에 조카들도 데리고 또 방문하여 놀이기구들도 이용하며 즐겨보고 싶다. 전남 나주 가볼만한곳 중흥 골드스파 리조트 괜찮네~ㅎㅎㅎ & 예약문의: 061-339-5500 전남 나주시 다도면 나주호로 588-184 중흥 골드스파 & 리조트,2020. 6. 3.
나주 최초의 천주교회 노안 성당에서...,나주 천주교회 노안성당 주소: 전남 나주시 노안면 이슬촌길 108 노안성당은 나주 지역 최초의 천주교회이며 이 지역 대표적 근대 성당 건축물이다.... 그럼에도 성당이 주는 경건하고 차분한 느낌이 좋아 유서 깊은 성당이 있는 곳을 자주 여행한다. 나주 천주교회 노안성당 나주 천주교회 노안성당...,2020. 10. 10.
"[나주 글램핑 / 캠핑장] 별밤캠핑장＆글램핑, 새로 생긴 글램핑 + 캠핑 + 차박 다 가능한...",입구에 핑크뮬리 예쁘게 있음 ㅎㅎ ■나주 별밤 글램핑＆캠핑 전남 나주시 다시면 송촌리 산2-14 ***-****-**** 글램핑 + 캠핑할 수 있는 데크 + 차박... 나주 #나주여행 #광주근교 #광주근교캠핑 #광주근교여행 #전남글램핑 #전남캠핑장 #전남차박 #전남글램핑장 #전남캠핑 #캠핑장 #캠핑 #먹스타그램,2021. 10. 6.
"나주와 즐겁게, 나주힐링코스 당일치기 여행 추천!","오늘은 그 역사속으로 같이 여행 가보실래요? 뚜벅이도 좋고, 차 있어도 좋은 2020 나주 힐링코스 알아보기 ! 1. 태광갈비 전남 나주시 북망문길 36-15 볶음돼지갈비가 유명한 현지인 추천 맛집! 터미널, 나주역과 접근성도 좋고 넓고 쾌적해서 전남도민들의 사랑을 듬뿍 받는 맛집이라고 해요!...",2020. 11. 25.
나주 벚꽃길 한수제 생생후기,나주 한수제 전남 나주시 경현동 언니와 서은이와 벚꽃길로 유명한 한수제 왔어요^^ 코로나로 금성산생태숲 임시휴장 하네요~ 마스크를 쓰고 돌아... 남겨주세요 #나주벚꽃길 #나주여행 #나주한수제 #나주저수지 #나주데이트코스 #나주가볼만한곳 #나주벚꽃 #나주벚꽃터널 #나주나들이...,2020. 3. 31.
충북 괴산·전남 나주 ‘투자선도지구’ 지정,"또한, 지역의 유기농산물 생산자와 소비자를 직접 연결하는 공방견학, 소비자 체험, 하루여행 프로그램을 운영하고, 괴산 산막이 옛길... 사업으로, 나주시와 민간 출자회사가 공동으로 나주시 송월동 일원, 779,948㎡ 부지에 2,138억원을 투자하여 에너지 관련 연구 및 업무시설을 유치하고 산업...",2021. 9. 1.
나주 학생 독립운동 기념관 방학때 아이와 가볼만한곳(여행 10편),나주학생독립운동 기념관 전남 나주시 죽림 길 26 관람료 무료 관람시간 하절기(3~10월) 평일 09:00 ~ 18:00 동절기(11월~2월) 평일 09:00 ~ 17:00 매주... 독립을 위해 희생하신 선열들께도 감사한 마음을 전해드리며 나주 학생 독립운동 기념관 포스팅을 마칩니다. 나주 여행 방학 때 아이와 가볼만 곧,2021. 8. 1.
"나주맛집, 지금 당장 필요한 건 뭐? <불수성 풍천장어>",<불수성 풍천장어> 전남 나주시 봉황면 봉황로 711 061- 334 - 4496 매일 11:30 - 21:00 오후 3시~ 5시 준비시간 매주 화요일 휴무 식당 내부는 이렇습니다. 요즘 테이블식으로 바뀌는 추세인지 이곳 역시 테이블로 자리가 마련되어 있구요. 쪼~오기 한쪽에 방 두 곳은 어린 자녀와 함께하는 가족들이 편하게...,2020. 3. 2.
광주전남장거리택시 광주➡️나주 운행,오늘은 광주에서 전남 나주시에 위치한 나주혁신산업단지에 다녀왔습니다. 나주혁신산업단지는 나주시내를 지나 영산포를 지나 위치하고... 면회픽업 ♡휴가철 펜션 계곡여행.스키장픽업 ♡사업 비지니스 출장 기사대리수행 ♡전국 공항.여객선터미널 섬가능 ♡반려견.반려모 동반가능 ♡병원....,2021. 3. 24.
2020 공예주간 프로그램 [충청/전라/경상 지역],"빗자루 여행: 나만의 반려 빗자루를 찾아서 (DPA) 전시 개요 일상의 물건들이 두루 그러하듯, 빗자루에는 자연이 담겨 있고 생활이 묻어나며... 기간 9월 18일–27일 09:00-22:00 *월 휴무 체험별 일정 상이 장소 전남 나주시 호수로 77 빛가람전망대 1층 기획전시실 전시, 체험 경상 실을 잇다...",2020. 9. 14.
나주산림자연연구소 인근 커피맛집 카페바로,카페바로 전남 나주시 산포면 산포로 434 전남 나주시 산포면 매성리 580-5 ***-****-**** 나주 카페 바로는 위생등급 우수업체~ 손소독제도 입구에 바로... 카페바로 #나주산림자연연구소카페 #나주산림자연연구소커피맛집 #나주카페바로 #나주커피맛집 #나주여행 #나주가볼만한곳 #나주맛집,2020. 3. 24.
나주 여행 가볼만한곳 BEST4,"나주 여행 가볼만한곳 BEST4 1. 나주 영상테마파크 2. 국립나주박물관 3. 나주 금성산 생태숲 4. 나주 빛가람전망대 나주 영상테마파크 위치 : 전남 나주시 공산면 덕음로 450 이용시간 : 월요일 휴무, 4월-10월(09시~18시) 11월-3월(09시~17시) 입장료 : 성인 2천원, 청소년·군인 1천5백원, 경로·어린이 1천원...",2021. 4. 28.
전남 MICE 시설 _ 나주문화예술회관 [최고의 시설 최고의 시스템],"전남 MICE 소개 전남 MICE, MICE 시설, 전라남도 MICE, 전남 관광, 나주문화예술회관, MICE 시설 MICE 산업이란? Meeting(회의), Incentives Travel(포상여행)... [나주문화예술회관] 전라남도 나주시 송월동에 위치한 나주문화예술회관은 나주시의 대표적인 문화·예술 공간으로, 1998년 4월 15일...",2021. 9. 25.
막걸리 발효기행 시즌1을 마무리하며,전남 나주시 남도탁주에서 만든 정고집옛날생동동주로 넘어가 보겠습니다. 구입할때부터 마셔보고 싶었던 막걸리 입니다. 정말 쌀알이 동동... 아산의 떼루아가 생각나는 술이죠 떼루아란 만들어가는 진행형같아요 예전 아산여행의 기억이 함께 묻어나네요.이 술은 복합적인 고급청주의 향에 더...,2020. 10. 4.
[한국관광공사_가봄] 배의 계절에 더 아름다운 나주,나주의 여행지를 소개해드리려고 합니다! 첫 번째로 소개해드릴 여행지는 드들강 솔밭 유원지입니다. 광주에서도 가깝고 나주시 중심에서도 멀지... ‘가봄’ 활동을 통해 소정의 원고료를 받아 작성하였습니다. #한국관광공사 #한국관광공사광주전남지사 #광주전남여행리포터 #가봄 #나주여행,2021. 9. 27.
[전남/나주] 카페 향교길20,"<향교길20, 전남 나주시 서내동 84-5> 나주 여행 중 찾게 된 한옥카페 개인적으로 한옥으로 인테리어를 한 카페를 좋아해서 시간을 내서 들르게 되었습니다! 출입명부를 작성하고 들어오게 되면 우드톤의 테이블과 식물들이 자연스럽게 배치되어 있어요. 내부는 2층으로 올라가는 계단도 있고 날이...",2021. 5. 24.
"[오천, 금강, 영산강 라이딩 ④] - 전남 담양읍, 메타세쿼이아가로수길...",이번 여행에 대해 여러가지를 조언해 주신... 징검다리 님이 특히 추천한 식당입니다 백반 아침식사... 아주 맛있고 푸짐하게 잘 먹었습니다 호텔... 일단 나주 시내로 가서 고치기로 합니다 나주대교 서편에 있는 전망대와 카페 나주시로 들어갑니다 금성관 구경 나주 <산즐러> 도착... 저와 함께...,2020. 10. 25.
"나주맛집,꽃무지야생화촌,나주고기맛집,전남애견동반식당",역시 냉동삼겹이 아니라서 씹었을 때 육질의 촉감이 좋았어요. 바짝 익혔는데도 여전히 만족스러운 두께감을 유지하고 있더라구요.! 변한맛 없이 ~ 그대로 !!! 주소 )전남 나주시 태신길 20-14 Tel ) 061-336-8745 영업시간)12:00 - 22:00 * 매주 화요일은 정기 휴일,2020. 3. 16.
나주영상테마파크 찐 핫플레이스!(여행 9편),나주 영상테마파크 전남 나주시 공산면 덕음로 450 주몽세트장 이용 시간 매일 09:00 ~ 18:00 하절기(4~10월) 매일 09:00 ~ 17:00 동절기(11~3월) 매주 월요일... 목책 성문아 잘있거라. 나중에 또 오마. 여기까지 영상테마파크를 나주 여행 핫플레이스로 추천하며 포스팅을 마칩니다.,2021. 7. 15.
