header,contents,date
담양 가볼만한곳 용마루길 산책로,담양 가볼만한곳 용마루길 전남 담양군 용면 용연리 산305 담양 용마루길 산책로 후기예요~ 사람이 어찌나 많던지 주차장이 넓은데 빼곡해서... 추천드려요^^ #광주근교 #광주근교데이트코스 #광주근교나들이 #광주근교산책 #광주근교산책로 #담양여행 #담양나들이 #담양가볼만한곳 #담양용마루길...,2020. 9. 7.
"[전라도 담양 여행] 담양 무조건 가야 하는 아름다운 죽녹원 ""완전 정복""","[전라도 담양 여행] 담양 무조건 가야 하는 아름다운 죽녹원 ""완전 정복"" 날씨를 너무 잘 고른 이번 여름휴가는 기억에 많이 남을 것 같습니다.... 주소: 전남 담양군 담양읍 죽녹원로 119 전화번호: 061-380-2680 운영시간: 09:00 ~ 18:00 (11월 ~ 2월) 09:00 ~ 19:00 (3월 ~ 10월) 입장료: 개인(일반)_3,000원 개인...",2021. 7. 12.
"담양여행 / 담양 가볼만한 곳 :: 메타프로방스, 사랑의자물쇠♥",주소 전남 담양군 담양읍 깊은실길 2-17 전화 061-383-1710 담양 메타프로방스 홈페이지입니다 ↓↓↓ 담양 와서 한번도 못가본 메타프로방스 그냥 밥집이랑 기념품샵들만 있는 곳이더라구요..? 딱히 구경하거나 볼거리가 있는 곳은 아니였어요 저는 마그네틱 하나 샀어요 ㅎㅎ 사랑의자물쇠가...,2020. 6. 20.
"[국내여행/담양] 대나무 숲 휴양림""죽녹원""","전남 담양 대나무 숲 국내 힐링 여행지 ""죽녹원"" 아침 일찍 원조 대나무 국수에서 든든하게 배도 채웠겠다 힐링 하자며 여행 계획 일정 중에 있던 담양에 위치한 죽녹원에 갔어요! 담양 맛집 원조 대나무 국수 후기는 아래 링크로 들어가시면 돼요! """" "" "" 주소 : 전남 담양군 담양읍 죽녹원로 119 전화...",2021. 7. 19.
식객 허영만의 백반기행 전남 담양 누른 돼지 머리 고기와 6천 원 백반이 담양으로 바로...,"전남 담양군 중앙로 18 지금 고민하고 있네요. ""내일이라도 담양 부부식당에 누른 돼지머리 고기 와 백반 먹으러 갈까?"" 코로나 때문에 괜찮을까?? 아~~ 갈등이네요. 아래 링크해 놓은 글들은 식객 허영만의 백반기행을 애청하면서 제가 가보고 싶은 지역의 식당들을 포스팅해 놓은 글이에요. 여행이...",2020. 3. 6.
"[TV속 정보] 6월 7일(월) KBS2TV생생정보 , MBC생방송오늘저녁, SBS생방송투데이 나온...","행 (아주 재밌는 여행) - 강원도 춘천 & 홍천> ■ 자연 밥상 ☎ ***-****-**** 들깨, 태양초고추, 오골계알, 토종닭유정란 판매... 누리보듬 ☎***-****-**** 전남 담양군 창평면 해곡내동길 11 <옆집 부자의 비밀 노트> ▶ 잘생긴 정육점 ☎ 02-521-2992 서울 서초구 효령로 140 <대박의...",2021. 6. 11.
산성여행 에서 찾는 역사 이야기,산성여행 에서 찾는 역사 이야기 안녕하세요! 다다른인생에 다맞춘 보험 코로나19시대에 다맞춘 여행~ 삼성생명 보험컨설턴트 송현경FC... ADD 전남 담양군 금성면 대성리 일대 TRANSPORTATION 담양군 금성면 금성산성1길 75에 있는 금성산성 주차장에 주차후 산행 자연과 함께하는 담양의 휴식 코스...,2021. 7. 28.
담양 분위기 좋은 한옥 카페 담월_아이와함께!,멋진 여행지 같아요!! 특히 아이랑 함께하기 좋은 곳들도 많고요 자연을 바로 가까이에서 느끼기에도 좋아서 저는 광주 내려갈 때마다 담양을... 저희 아빠랑 남편 뒷모습인데 보기만 해도 좋네요 * 운영시간 _11:00-18:00 * 주소 _ 전남 담양군 월산면 도개안길 67-1 #담월카페메뉴 #담양담월메뉴 일단...,2021. 10. 11.
담양 풀빌라 펜션 메종드프로방스 104호 후기,"✔️업체명: 메종드프로방스 ✔️구분: 펜션 ✔️주소: 전남 담양군 담양읍 메타프로방스2길 14 ✔️이용 객실: 104호 ✔️연락처: 061-383-9903... 국물이, 국물이 끝내줘요- 담양에서 편하게 쉬고 좋은 추억 만들 수 있었던 담양 펜션 메종드프로방스였어요:) 담양 여행 중 휴식을 위한 풀빌라 펜션...",2021. 7. 1.
4박5일 여름휴가 여행 ft 아무곳 발길닿는데로.D-1일차,그럼저희여행 이야기를 들어보실까요? D-day1 전주비비밥.전주한옥마을.담양 메타세콰이어길.광양금목서불고기.여수케이블카... 입장료진짜아까울정도로 잘해놧어요 너무더워서3층을못올라가본게 후회되드라구요 실컷구경후 담양으로갔어요 - 주소 : 전남 담양군 담양읍 학동리 633...,2021. 8. 13.
천년담양,담양 관방제림 - 전남 담양군 담양읍 객사7길 37 천연기념물 제 366호로 300년이 넘은 여러 종류의 나무들이 그늘을 드리우고 있습니다 산책하기 정말 좋은 곳 모두 코로나 19 예방수칙을 지키며 안전여행하세요 :) 본 게시물은 한국관광공사 광주전남지사 '가봄'활동을 통해 소정의 원고료를 받아...,2021. 9. 24.
"전남 담양 맛집, 오마이밥","오마이밥 : 전라남도 담양군 담양읍 죽향대로 1302-1 ⏱ : 월화 11:00 ~ 14:00, 수목금토일11:00 ~ 19:00 (수목금 break time 15:00 ~ 17:00) ☎️ : *** - **** - ****... 담양저녁 #광주근교데이트 #숯불불고기덮밥 #명란덮밥 #치즈롤카츠 #담양덮밥 #담양 #담양주말 #담양한상 #전남담양맛집 #광주근교드라이브",2021. 10. 7.
"전남 담양 수제맥주 양조장 담주브로이, 대나무맥주 밤블리 종류별로 마셔봤어요 ◡̈",전남 담양 대나무 수제맥주 밤블리 Bambly 양조장 #담주브로이 방문&맥주 구입 담양에 도착하자마자 아점으로 담양애꽃에서 맛있는 떡갈비... 2011년 담양군과 투자협약을 체결 2013년에 담양으로 확장이전 했다고 합니당 ! 무튼 역사는 꽤나 오래된 맥주양조장이었어요 ✔️ 그리고 자세히 보니...,2021. 7. 7.
칭찬하는 담양 국수거리 맛집,가성비 좋고 맛 좋았던 담양 국수거리 맛집 온 가족이 칭찬했던 곳을 소개해드려볼께요 전남 담양군 담양읍 객사3길 24 매일 11:00 ~ 20:30 ***-***-****... 하나인데요 여행에 있어 한번쯤 꼭 가볼만한 곳이 된 거리랍니다 가게 앞엔 요렇게 맛있게 삶아진 계란이 있어요 비가 언제 왔냐는 듯 날씨는 화창...,2020. 8. 10.
[전남-담양] 카페 '호시담' 담양에서의 좋은 시간♥,"담양 카페 '호시담' 좋을 호(好), 때 시(時) 담양 카페 '호시담' 전남 담양군 용면 추령로 375-25 / 지번 쌍태리 산128-9 ***-****-**** 오픈한지 이제 막... 산에서 보이는 하늘도 너무나 예뻤어용~~~ 서울가는 길까지도 너무 로맨틱했던 담양 여행 후기를 마칩니다..ㅎㅎ 서울에서 가까웠다면 더 자주 가봤을...",2020. 4. 22.
"담양메타프로방스카페/담양크로플/담양크로플 포장주문 ""마음커피숍"" 후기(feat.이쁜...","오늘 담양여행을 하면서 처음으로 담양메타프로방스를 방문하여, 담양크로플 포장주문을 한 후기를 들려주고자 해요! 바로 ""마음커피숍""이에요! 위치 및 영업시간 <주소> 전남 담양군 담양읍 메타프로방스2길 10 <영업시간> 월~일 10:30 ~ 20:00 <전화번호> 061-383-0143 외관 및 인테리어 ""마음커피숍""은...",2021. 1. 7.
담양여행 메타세쿼이아 가로수길 메타세쿼이아랜드 산책 어린이 프로방스 입장료 무료...,담양 여행하면 한번씩 들리는 코스인 담양 메타세쿼이아 가로수길이 있는 메타세쿼이아랜드를 방문하는데요 메타세쿼이아 가로수길의... 가로수길 전남 담양군 담양읍 학동리 633 이용시간 하절기(5~8월) 09:00~19:00 동절기(9~4월) 09:00~18:00 전화번호 061-380-3149 메타세쿼이아랜드는 산림청과...,2021. 6. 28.
SRT 선정 BEST 여행지 '같이 가줄래',이 거대한 인공 호수는 전남평야에 용수를 공급하고 수해를 방지하는 역할을 한다. 아름다운 산을 병풍처럼 두르고 있어 여행자들이... 전남 담양군 용면 용연리 산 305 메타세쿼이아 가로수길 메타세쿼이아 가로수길은 담양에서 둘째가라면 서러워할 만큼 많은 사랑을 받고 있는...,2021. 4. 22.
"[전남 담양 죽녹원 맛집] 대통밥과 떡갈비 한상 ""대사랑""","그래도 여행왔는데 건물도 좋고 깨끗한곳에서 먹자고해서 대사랑으로 왔다. 조금 협소한 주차장도 있다. 방송에도 소개되고 모범음식점으로도... 그럼 나의 분홍빛 이야기 이만 총총.. 든든한한정식한상♡ << 위치 및 번호,영업시간 >> 전남 담양군 담양읍 객사4길 38-17 061-383-0093 매일 11:00 - 20:00",2020. 2. 12.
담양카페 / 담양한옥카페 :: 명지원,주소 전남 담양군 고서면 덕촌길 37 영업시간 매일 11:00 - 21:00 전화 061-383-2577 담양여행의 마무리는 한옥카페 명지원에서~ 따라라라라♪ 동영상도 한번 찍어봤어요 잔디밭이 펼쳐지는 곳 여기 너무 아름다워요 잔디밭이 넓어서 애기들 데리고 많이 오더라구요 여기도 테이블이 되네요 너무...,2020. 6. 24.
"[TV속 정보] 5월 12일 (수) 2TV생생정보, MBC생방송오늘저녁, SBS생방송투데이 나온...","0507-1433-9286 전남 담양군 대전면 대치5길 131 <노래 따라 방방곡곡 -충청남도 부여> ▶ 웃골농원 (고사리 & 머위 수확)☎ 041-834-2891 충남... 곰미디어 <여행본능, 섬 - 벼랑 끝 봄 바다를 걷다, 비렁길 ‘금오도’ > ▶돌산 신기항 ☎061-666-8092 전남 여수시 돌산읍 신기길 90...",2021. 5. 13.
"담양 카페, 밀밀(mill mill)","담양 카페, 밀밀(mill mill) 담양 카페,밀밀(mill mill) 주소 : 전남 담양군 금성면 담순로 208 영업시간 : 매일 10:00 - 20:00 LAST ORDER 19:30 너무 더웠던... 메타세쿼이아 나무 길로 되어있어요. 눈도 호강하고 입도 호강한 카페 밀밀(mill mill) 담양에 드라이브나 여행간다면 꼭 들렀다 가보세요~! 안녕~!!",2021. 10. 11.
전라남도 담양 여행 | 국내 여행지 추천 | 2020.07.29~07.30(1박2일)| 모녀의 여행...,보이는 여행의 마법이란ㅎㅎㅎ Previous image Next image 길 중간 즈음에 어린이 프로방스라고 적힌 작은 터널 공간이 있는데 넘어가면 정말 동심의 세계가 펼쳐져요ㅎㅎ 장난을 좋아하는 제 모습을 카메라로 담아두신 울 엄마ㅎㅎㅎ 메타 프로방스 전남 담양군 담양읍 메타프로방스1길 17...,2021. 6. 9.
<담양여행> 오월의 담양 여행 둘째날 (담양1박2일/담양글램핑/퀸즈캐슬/소쇄원...,"소쇄원 전남 담양군 가사문학면 소쇄원길 17 09:.00 ~ 17:00 입장료(성인) 2,000원 #담양가볼만한곳 #담양사진찍기좋은곳 #담양소쇄원 #담양퀸즈캐슬 #담양여행지 초록초록 이런 계절에 잘 어울리는 소쇄원 작은 계곡을 사이에 두고 아담하게 꾸며진 정원이다 많은 사람들이 사진을 찍고 있었다....",2021. 6. 12.
담양여행 3 고서회관 구례의 쌍산재,헤위이 ㅇ 드뎌 담양여행 셋째 날 기록을 고서회관 금요일 11:30 - 15:00 라스트오더 토요일 11:00 - 15:00 라스트오더 일요일 11:00 - 15:00 라스트오더 월요일 휴무 화요일 11:30 - 15:00 라스트오더 수요일 11:30 - 15:00 라스트오더 목요일 11:30 - 15:00 라스트오더 전남 담양군 고서면 원등1길 16-7 고서회관...,2021. 8. 6.
전라도 담양 여행하면서 창평국밥 막창전골 안 먹고오면 말짱 도루묵,6월에 다녀왔던 전라도 담양을 지금에서야 올리는 나 자신 반성하고 또 반성해야 해 (아마도) 하지만 전남 담양군 창평면에 위치한 이곳은 안 올릴... 입소문 자자한 맛집에는 역시 이유가 있구나~ 담양 여행의 첫 단추를 성공적으로 끼워 준 담양 창평국밥의 막창전골 ! 3명 모두에게 인정받은 재방문...,2021. 8. 5.
생방송투데이 오천만의메뉴 서울 도봉 포두부삼합(갓두부삼합) 경기 가평 잣두부전골...,"(생방송투데이 오늘방송맛집) SBS ‘생방송투데이’ 방송 캡처 SBS ‘생방송투데이’ 2769회에서 ‘여행본능, 섬’ 한려수도 절경을 한눈에... 슬로우 푸드 쌀엿 편 ▶고재구전통쌀엿 주소 : 전남 담양군 창평면 경동길 11-10 #생방송투데이 #도봉포두부삼합맛집 #도봉산갓두부삼합맛집...",2021. 2. 10.
"담양 죽녹원, 대나무숲, 시가문화촌, 담양여행, 담양가볼만한곳","* 장소 : 전남 담양군 담양읍 향교리 * 일시 : 2021년 8월 6일(금) * 날씨 : 맑음 죽녹원은 2003년 5월에 조성하여 약 31만㎡의 공간에 울창한 대나무숲과... 죽녹원은 전망대, 쉼터, 정자, 다양한 조형물을 비롯 영화·CF촬영지와 다양한 생태문화관광 시설을 갖추고 있으며 가족, 연인, 친구, 수학여행 등...",2021. 8. 8.
국내 가을 여행지 코로나에 안전한 5곳 추천,"오늘 소개하는 여행 코스는 이런 코로나 정국에 안전하게 다녀올 수 있는 국내 가을 여행지 5곳입니다. 가을 단풍이 아주 멋들어진 날 답답했던... 1970년대 초반, 전국 가로수 조성 사업 때 담양군이 3~4년생 메타세콰이아 묘목을 심은 것이 지금의 이국적이고 울창한 가로수 터널을 만들었습니다....",2021. 10. 3.
[2020년 11월 23일~29일] 주간 주요일정 _순천시/광양시/고흥군/담양군/보성군/구례군,분청문화박물관 담양군 일 정 시 간 행 사 명 장 소 주 관 참석 대상 참석 여부 일 요일 23 월 08:30 간부회의 영상회의실 자치행정과... 10:00 전남도청 ◦율포해수풀장 철거공사 도 계약심사 ∙인 원 : 2명 전라남도 (해양수산과) 10:30 보성군의회 협 의 실 ◦11월중 의원 월례회의...,2020. 11. 23.
담양펜션 위치좋게 풀빌라 즐긴 메종드프로방스,"가까운 여행지를 생각하다가 오랜만에 부부동반으로 친구 딸과 함께 담양 풀빌라를 예약해서 하루 종일 신나게 물놀이도 하고, 안전하게 놀다... 위치 : 전남 담양군 담양읍 메타프로방스2길 14 입실 15:00 / 퇴실 11:00 연락처 : 061-383-9903 식당, 카페 등 상점가를 지나면 이렇게 펜션들이 모여있는 거리가...",2021. 7. 7.
담양 죽녹원 맛집 가성비 갑은 담양죽녹원국수!!,"워낙 어디 여행가는걸 별로 안좋아하는 동거인 양반덕분에;;;;; 가까운 코앞 담양 죽녹원 맛집가서 입이라도 즐겁자~ 토요일 아침 늦잠을 늘어지게... 다음번엔 내가 막걸리담당, 동거인이 운전담당????ㅋㅋㅋㅋㅋㅋ 전남 담양군 담양읍 향교길 7-6 / 담양읍 향교리 293 ℡ 061-381-9596 ㏂ 09:30 ~ ㏘ 20:30",2021. 2. 23.
[죽녹원카페] 저렴한가격과 짐승용량의 음료 ! 여기는 청자다방죽녹원점,"청자다방죽녹원점 봄 여름 가을에는 담양여행을 한번쯤은 가야죠 ! 특히 죽녹원은 관광객들이 언제나 많은데, 매년마다 죽녹원 근처에 상점들이 많이 생겼더라구요 청자다방죽녹원점 위치 : 전남 담양군 담양읍 죽녹원로 133 전남 담양군 담양읍 천변6길 2 영업시간 : 매일 10시 ~ 22시 도립대 앞...",2020. 6. 6.
전남 담양펜션/카라반/캠핑장 ~공기좋고! 기분전환되는 가족소풍캠핑장/반려동물가능,"힐링하기 좋은 담양캠핑장 소개해드릴게요^^ 담양 가족소풍캠핑장 ■주소■ 전남 담양군 용면 용소길 6 지번) 용연리 742-4 가족소풍 캠핑장 올... 멀리 여행 온거같지만 가까운 광주근교 ^^ 담양에 이런데가 있다니 ..! 카라반/펜션/캠핑장 답게 개수대와 샤워장, 화장실(남녀구분)이 따로 있어 편리해요...",2020. 4. 9.
"담양 여행 : 진미국수 , 죽녹원, 호시담 카페","담양 진미국수 매일.10:30 ~ 7:00 수요일휴무 061.382.0984 전남 담양군 담양읍 객사3길 26 오빠랑 담양으로 처음으로 당일치기로 놀러왔어요! 여기는 국수거리로 정말 국수집들이 줄지어 있고, 다 평상테이블로 되어있더라구용ㅎㅎ 신기방기!! 많은국수집이 있었는데 진미국수는 삼대천왕에도...",2021. 8. 6.
신안 증도 모실길 도보여행① -상정봉 한반도 해송숲을 바라보다.,"'마이 힐링 로드' 말그대로 힐링 도보여행 등산이나 여타 운동은 지레 겁부터 먹을만큼 좋아하지 않는데 그나마 걷는 건 할 수 있다며 따라다닌... 우리나라의 슬로시티로는 전북 전주(한옥마을), 전남 완도군(청산도)·신안군(증도)·담양군(창평면), 경남 하동군(악양면)·김해시(봉하마을...",2020. 6. 4.
담양 가사문학면에 자리잡은 선비정신과 원림문화 소쇄원,되겠습니다 전남 담양군 가사문학면(구.남면) 지곡리 123 ☎ 061-381-0115 문화재 명승 제 40호 자가용이 활개쳐 버스운행표가 그리 도움이 되진... 모습 여행. 관광객들에게 접근성이 편하게 정돈되어 있어 쉽게 찾을수 있어요 담양군에서 운영하는 시티투어 버스 주차장에서 무등산 자락을 바라보는 뷰...,2021. 10. 9.
오늘저녁 30cm 탑 산더미 감자탕 슬기로운 외식생활 남양주 맛집 퇴계원 왕감자탕...,주소 : 전남 담양군 창평면 삼천리 141 돌담길 102 장아찌 36가지 약초 장아치 <신박한 네바퀴 여행 방송정보> 상호 : 고사포캠핑11번가 주소 : 전라북도 부안군 변산면 운산리 441-11 <슬기로운 외식생활> 상호 : 퇴계원왕감자탕 대표메뉴 : 감자탕 뼈해장국 어린이돈가스 주소...,2021. 10. 11.
전라남도 담양 여행 | 국내 여행지 추천 | 2020.07.29~07.30(1박2일)| 모녀의 여행...,"담양 여행을 리뷰 해보고 싶어졌어요! 안산 종합 버스 터미널 ➡️ 담양 공용버스터미널 여행의 시작은 터미널에서 고속버스 터미널... 국수거리 전남 담양군 담양읍 객사리 터미널에서 국수거리까지 택시를 타고 이동했어요. 5분 정도 걸렸던 것 같고, 택시비 4,000원 가량 나왔던 것...",2021. 6. 8.
[담양] 2박 3일 나홀로 여행 기록 두번째,#담양 국수거리 지나가긩 날씨가 너무좋았다..★ 비온다길레 무서웟지만 흐흐흐 첵오 죽녹원 가는길에 잠깐 들린곳 혼자 여행 기념 사진 찍어주깅 진짜 혼자 갔는데 뻘줌하지않게 잘 도와주셨다 ㅎㅎ 포즈도 다 정해주셔서 인생샷 건짐 사진관 소소 전남 담양군 담양읍 향교길 15 #죽녹원 안녕...,2021. 5. 9.
[전남담양맛집]담양 수플레는 여기! 딸기수플레가 맛있는 담양카페 코튼드수플레...,"코튼드수플레 전남 담양군 고서면 가사문학로 327 (지번: 동운리 583-10) 12:00~20:00 매주 월요일 휴무 딸기수플레 13,000원 티라미수수플레 13,000원 초코홀리데이 15,000원 아메리카노 3,800원 NAVER 7월 13일(토) ~ 14일(일) 1박2일 담양여행 둘째날 <⬆️ 담양펜션 명아원 후기참조> #담양펜션 #명아원...",2020. 7. 14.
담양 추월산 카페 아리에뜰 뷰카페,담양 추월산카페 아리에뜰 전남 담양군 용면 추월산로 997 매일 10:00 - 20:00 하절기 10:00~21:00(7월~8월) 내돈내먹 솔직후기! 추월산 뷰카페 아리에뜰... 산책로도 추천드려용^^ #담양카페 #광주근교카페 #담양추월산카페 #담양데이트코스 #담양여행 #담양뷰카페 #담양분위기좋은카페 #광주근교드라이브,2020. 9. 7.
[담양 소쇄원]1500년대(조선시대)에 만들어졌다는 민간 정원 산책,[광주담양목포여행]1500년대(조선시대)에 만들어졌다는 민간 정원 소쇄원 산책 2021.06.04~06.07 담양에서는 숙박할 예정 없이 관광만 할... kr/ 소쇄원은 전남 담양군 남면 지곡리 123번지에 소재하고 있는 우리나라의 대표적인 민간 원림이다. 한국 민간원림의 원형을 간직하고 있어 명승 40호로...,2021. 9. 25.
"[제주 사회]새콤달콤 깊은 맛, ‘아라주는 딸기’ 맛보세요~","전국적으로 현재 노지딸기의 명맥을 이어오는 곳은 제주시 아라동과 전남 담양군 두 곳뿐이다. 아라동주민센터와 영평하동마을회(회장 양광수), 부녀회(회장 현순실), 아라동연합청년회(회장 오승철) 등 여러 자생단체에서는 출하 시기에 맞춰 딸기 소비촉진을 위해 각종 홍보를 펼치고 있다....",2021. 5. 6.
"[담양 여행]맛집, 카페 데이트 코스 추천(진우네국수, 아키올로지, 죽녹원)",많이 덥더라도 대나무 숲은 시원하니 담양 여행 가볼만한 곳으로 강력 추천해요! 전남 담양군 담양읍 죽녹원로 119 전남 담양군 담양읍 향교리 산37-6 #죽녹원 #담양가볼만한곳 #담양대나무 개인 사정상 담양을 반나절밖에 구경하지 못했지만 알차게 ! 재밌게 ! 여행한 듯 해요 제가 다녀온 여행...,2021. 7. 15.
딱이었던 담양 여행코스,남기기 아쉬운 모습들은 사진으로도 여러 장 남겨주었답니다 1박 2일 동안 짧게 즐겼던 담양 여행코스였지만 기억에 남는 추억들을 많이 만들 수 있어 행복했어요 위치: 전남 담양군 금성면 금성산성길 202 호텔. 061-380-5000 및 스파. 061-380-5111 매일 08:00 - 17:00 소정의 원고료를 지급받고 작성하였습니다.,2020. 11. 6.
"올여름 휴가 ‘농촌교육농장’으로 - 수확 ‧ 체험, 만들기 ‧ 놀이 등 다채로운 체험...","net 담양 다화림식물원&치유정원 전남 담양군 대전면 추성1로 419-150 반려식물 다육이를 키워요! ***-****-**** dawhalim.com 순천... kr 함양 호미랑농촌교육농장 경남 함양군 지곡면 개평길 61 볍씨의 여행, 쌀의 무한변신 ***-****-**** http://blog.naver.com/djje785 제주 초록꿈...",2021. 7. 11.
담양 메테오라펜션 여행 솔직_후기,"펜션: 메테오라펜션 주소: 전남 담양군 담양읍 메타프로방스1길 70 예약 ROOM: 산토리아 연락처: ***-****-**** 입실: 15:00 / 퇴실: 11:00 홈페이지: http... 정리: 숙박비 30만원(성수기특+ -0-), 불판&숯불은 사용 안 했으므로 0원 총 30만원 3대 가족여행은 올해 처음 한 것 같습니다. 즐거운 시간과 추억을...",2021. 8. 9.
전남 담양 맛집<박물관앞집>,안그러면 까 먹거든요ㅋㅋ 박물관앞집 전남 담양군 담양읍 죽향문화로 22 담양에서 찾은 맛집!! 마라물갈비 존맛탱!!! #담양맛집 #전남담양맛집 #광주물갈비 #담양온천 #담양떡갈비 #담양대통밥 #가족여행 #담양가볼만한곳 #겨울방학가볼만한곳 #다이어트,2020. 1. 10.
"담양,광주 숙박,호캉스 '소아르 호텔' 추천 ! ! !","[크리스마스때는 집에만있었더니 전혀 크리스마스 같은느낌이 안들더라구요ㅠㅠ] 저희는 이번에 누나가 출산해서 조카 와 함께하는 첫 여행이였... 담양하면 대체로 죽녹원 , 메타프로방스 이 두곳이 가장 유명하죠 전화번호 : 061-383-5010 위치 : 전남 담양군 담양읍 메타프로방스 3길 2 [지번...",2021. 1. 2.
"담양 소쇄원 맛집 ""수려재""에서 분위기 있는 담양 한정식 먹고 경치 좋은 광주호...","#담양맛집 #담양여행 #전남담양 #담양소쇄원 #담양한정식 #소쇄원 #소쇄원맛집 #광주근교 #전남맛집 #깔끔한한정식 #담양드라이브 #담양데이트장소... 한옥식 인테리어가 멋스러운 담양 떡갈비 전문점 담양 ""수려재"" 담양 수려재 주소 : 전남 담양군 가사문학면 가사문학로 753-8 (개선제 근처) 전화번호...",2021. 7. 19.
[2020년 9월 21일~27일] 주간 주요행사_순천시/광양시/고흥군/담양군/보성군/구례군,16:00 전남도청 ◎우주항공산업 추진 간담회 6명 미래산업과 9. 25. (금) 14:30 대서면 서호마을 ◉공무원 천사랑 나눔성금 「제27호 천사랑의 집」기증식 50명 주민복지과 담양군 일 정 시 간 행 사 명 장 소 주 관 참석 대상 참석 여부 일 요일 21 월 08:30 간부회의 영상회의실 자치행정과...,2020. 9. 21.
1박 2일 담양 여행 코스 총정리! 가볼만한곳 메타프로방스와 SOOOP 카페,"전라남도 담양 여행 1박 2일 코스 @ 메타프로방스 @ 메타세쿼이어 @ 국수 거리 @ 관방제림길 @ 죽녹원 @ 담화 @ 한상근 대통밥집 @ 명옥헌원림... 주소 : 전남 담양군 담양읍 메타프로방스1길 55-5 영업시간 : 여름 매일 10:30 - 21:00 / 겨울 매일 10:30 - 20:00 시그니처 메뉴 : 모카크림라떼 \6,500 수제청차 \6,500...",2021. 8. 9.
언택트 여행지로 농촌 체험 마을이 뜬다 -☆,언택트 여행지로 농촌 체험 마을이 뜬다! 코로나19로 인해 언택트 여행지가 대세! 생활 속 거리두기를 지키면서 즐거운 여름 휴가를 가족과 함께... 주소 : 전남 담양군 대덕면 무월길42 군위 삼국유사 화본마을 폐교를 활용하여 농촌체험마을을 운영 중인 마을! 일연스님이 인각사에서 '삼국유사'를...,2020. 8. 13.
