header,contents,date
나주 가볼만한곳 - 삼국시대 백제의 고분을 볼 수 있는 나주 반남고분군,"소재지 : 전남 나주시 반남면 대안리 103 등 시대 : 삼국시대 종류/분류 : 고분군 크기 : 121,397㎡ 그리고 반남고분군 바로 옆에 국립 나주 박물관이 위치해 있기 때문에 묶어서 함께 다녀오시면 좋을 것 같습니다. 지금까지 나주에서 역사 여행 가기 좋은 반남고분군에 대해 소개해드렸습니다!...",2021. 5. 20.
전라남도 산림자원연구소와 국립나주숲체원 다녀왔어요,산림자원연구소 전남 나주시 산포면 다도로 7 http://naver.me/FGoepppt 동기분들과 약속장소로 정하였기는 했으나 너무 촉박하게 출발을 한탓에 두루두루 둘러보지 못하고 후배기수들의 워크샵 장소로 이동했습니다 들꽃다물농장의 급한 농사들 어느정도 마무리되는 시기에 둘이서 편하게 여행 겸...,2021. 5. 22.
나주곰탕하얀집 (나주맛집),이번에 소개해드릴 맛집은 전라남도 나주시 중앙동에 위치한 곰탕집입니다 나주곰탕하얀집 전남 나주시 중앙동 48-17 AM8시부터 ~PM8시까지... 맛을 유지해주는 나주곰탕맛집이였습니다 이웃님들 전남 나주여행시 나주곰탕하얀집에서 곰탕 한그릇하세요! 저의 맛집 포스팅을 읽어주셔서 감사합니다,2021. 2. 3.
"나주 케이크, Jungle elephant",나주 케이크 Jungle elephant 위치:전남 나주시 남평읍 강변2길 7 EMJ TOWER 1층(전남 나주시 남평읍 동사리 360-4) 매일 10:00 - 23:00 초이스메뉴... 맛스타그램 #여행스타그램 #광주맛집 #광주밥집 #광주카페 #광주핫플 #광주데이트 #광주데이트코스추천 #먹스타그램 #맛스타그램...,2021. 5. 16.
나주 중흥골드스파 펜션/나비의꿈/조용하고 자연과함께하는 곳,나주 중흥골드스파 펜션 나비의꿈 전남 나주시 남평읍 우산리 2127 퇴근하고 저녁 9시반에 도착을 했다 조명들이 있어서 그런지 이쁘게 보였고 가는... #나주여행 #전남여행 #전남나주여행 #나주펜션 #중흥골드스파펜션 #전남펜션 #나주중흥골스파 #광주근교여행 #전라도여행 #나주가볼만한곳,2021. 6. 23.
"국립나주박물관, 전라도여행, 한국여행, 우리나라여행, 대한민국여행...",국립나주박물관은 전남 나주시 반남면 고분로 747 에 위치한다. 국립나주박물관은 2013년 11월에 문을 열었다. 나주박물관이 자리 잡은 반남 고분군은 5세기 무렵 형성된 마한 문화를 엿볼 수 있다. 박물관을 중심으로 수백기의 고분들이 영산강 유역 곳곳에 분포하고 있다. 이 고분들이 묻혀 있는...,2021. 5. 31.
"나주혁신도시 맛집, 김형제 고기의 철학, 나주 고기맛집입니다.",예전에 광주여행을 갔을 때 친구가 나주에 잠깐 들릴 일이 있어서 따라갔다가 우연히 가게 된 곳! 고기가 맛있기로 유명한 김형제 고기철학을 다녀왔었지요 이곳이 왜 유명하냐? 고기에 철학을 담았다고 해요 고기 자체가 철학인데 또 한스푼 정도 더 담았나봐요? 위치 전남 나주시 상야4길 16-10...,2021. 8. 4.
충북 괴산·전남 나주 ‘투자선도지구’ 지정,"또한, 지역의 유기농산물 생산자와 소비자를 직접 연결하는 공방견학, 소비자 체험, 하루여행 프로그램을 운영하고, 괴산 산막이 옛길... 사업으로, 나주시와 민간 출자회사가 공동으로 나주시 송월동 일원, 779,948㎡ 부지에 2,138억원을 투자하여 에너지 관련 연구 및 업무시설을 유치하고 산업...",2021. 9. 1.
나주카페 은행나무 수목원카페 GGT POT,"손탱입니다:) 광주 근교로 여행을 다니는 중~.~ 헤헤 이번에는 화순으로 가기 전, 나주에 있는 GGT POT 카페에 들렀다 가기로 했어요! 나주에서... 나주 은행나무 수목원에 있는 곳인데 별 기대 없이 갔다가 풍경으로 힐링하고 온 곳이랍니다 나주 GGT POT 전남 나주시 남평읍 동촌로 236-42 제가 갔을...",2021. 7. 10.
[SNS 서포터즈] 삼국시대 드라마와 영화 촬영지로 유명한 '나주 영상테마파크',"드라마 주몽의 촬영 세트가 전남 나주 영산강변에 위치하고 있다는 것을 모르는 분이 많은데 삼국시대를 배경으로 한 드라마와 영화 촬영을 위한... 있는 여행이 되시기 바랍니다. ※ 이 글은 SNS 서포터즈의 취재를 바탕으로 제작된 주관적인 글로, 나주시의 공식 입장과는 다소 다를 수 있습니다....",2021. 7. 7.
나주 행운분식 사라다빵 빵지순례 필수코스,나주 행운분식 전남 나주시 나주로 142-3 open 08:00 close 19:00 매주 일요일 휴무 Tel. 0507-1326-9751 사라다빵으로 입소문난 나주 행운분식! 금성관... 엄청 특별한 맛은 아니지만 속재료가 알차서 맛있게 잘 먹었어요 역쉬 아는 맛이 제일 무서움 @.@ 나주 여행 빵지순례 코스 행운분식 추천합니다!,2021. 7. 31.
"❤1박2일 촬영지❤로 유명해진 #전라남도산림자원연구소 메타세콰이어길 산책, 힐링 숲...","전라남도산림자원연구소 전화번호 : 061-336-6300 주소 : 전남 나주시 산포면 다도로 7(산제리 23-7) 입장료는 무료입니다. 나중에 유료화로 계획 중인... 광주, 전라남도 여행 오시게 되면, 꼭 ~ 들러보세요~ ^^ 맑은 공기 마시고 가세요❤ 치유의 숲에서 힐링 산책 추천드려요~ #광주여행 #나주여행...",2021. 6. 14.
나주 펜션 숲아래잠 화순cc근처 독채 조용한 힐링,멀리 여행가면 관광지 다녀야되고 뭐 구경해야하고.. 호캉스는 답답한 빌딩안에서 또 예쁘게 꾸미고 사진도 찍어야할거같아서 그런거 다 떠나서... 나주펜션 숲아래잠 061-337-7855 전남 나주시 남평읍 인암2길 9-14 http://page.yapen.co.kr/33066 본채 - 기준 4인 (최대 10인) 달빛실 - 기준 2인 (최대 5인) 시골에...,2021. 7. 14.
[빵지순례] 나주 편 2.행운분식,목적이니 기다리는것이 아쉬워 사라다빵두개랑 매진임박 도너스 하나 구매 럭키아닌 럭키 같은 느낌 한줄평 : 나주가면 사라다빵 드셔보세요 위치 나주시 나주로 142-3 주차 : 공영주차장 #전남여행 #코로나적은 #나주여행 #나주맛집 #나주빵집 #행운분식 #나주사라다빵 #빵순이 #빵지순례,2021. 5. 2.
"나주혁신도시카페, 저녁엔 분위기 좋은 와인바 :: [ 스테이케이션 ]",나주 스테이케이션 OPEN 10:30 CLOSE 24:00 일요일 10:30 - 20:00 월요일 휴무 전남 나주시 빛가람동 159-5 1층 070-4799-5693 갓길주차 가능 세번째 방문인 빛가람동 카페 '스테이케이션' 리뷰 시-작 첫번째. 남편이랑 와인마시러 방문 두번째. 친구랑 세번째. 언니랑 외부모습 건물이 화려하게 생겨서 처음...,2021. 6. 10.
[국내호텔 특가] 혜택받아 예약하는 국내 호캉스 호텔 추천!,"웨스틴 조선 서울 ~6/27 170,151원~ (vat 별도) https://bit.ly/3jitOIH 중흥 골드스파&리조트 전남 나주시 다도면 나주호로 558-314 휴식과 레저를 함께 즐길... 그랜드 조선 제주 내에는 전 객실 발코니를 보유한 디럭스 객실부터 아이들을 위한 키즈룸, 우리만의 프라이빗 여행을 즐길 수 있는 힐 스위트...",2021. 6. 23.
[전라남도 산림자원연구소]-나주 가볼만한곳 나주 메타세콰이어길,받아서 광주 근교 드라이브하러 전라남도 산림자원연구소로 콧바람 쐬러 총총 다녀왔어요 전라남도 산림자원연구소 전남 나주시 산포면 다도로... 산림자원연구소 #전남산림자원연구소 #나주메타세콰이아길 #나주메타세쿼이아길 #나주핫플 #나주가볼만한곳 #광주근교가볼만한곳 #나주여행...,2021. 5. 24.
"나주 공방 오구오구 5959, 아크릴모빌 자개모빌 만들기 체험과 마리모 어항 테라리움...","나주 오구오구 공방 전남 나주시 금남길 45, 민트색 매장 ( 나주시 금계동 38-1 ) 매일 12:00 ~ 19:00 매주 월요일, 공휴일 휴무 ***-****-**** 주변 골목... 보라카이에 여행갔을 때 사왔던 자개모빌이 이미 있기 때문에 항상 갖고 싶은데 너무나 비싸서 구경만 했던 ( 내가 본 아크릴 모빌들 전부 6만원 이상.. )...",2021. 8. 18.
4월 여행 명소. 가볼만한 곳. 추천베스트. 갈만한 곳. 진달래 벚꽃 튤립축제,4월 여행 명소. 가볼만한 곳. 추천베스트. 갈만한 곳. 진달래 벚꽃 튤립축제 4월 가볼만한 곳. 베스트명소 제주 한림공원 튤립. 녹산로 가시리... 득량면 삼정리 나주 4월 초 전남 나주시 금천면 나주박물관. 영산강변 만석보 4월 말 전북 정읍시 이평면 하송리 부안 4월 하순 전북 부안군 보안면...,2021. 4. 1.
호남 곡창지대 수탈을 위해 일제가 만든 신도시 나주 영산포(榮山浦) 인문여행,"찾아 전남 내륙지역으로 들어와 눈독을 들인 곳이었다. 일제는 임오군란을 빌미로 체결한 조일수호조규속약(1882)을 통해 일본 상인의 활동 범위를... 출처: '나주시 옛 영산포 시가지 가로공간의 변화와 건축물 특성'(김홍기, 동명대 건축학과) 논문. 이제 준비해 온 자료를 다시 확인하며 신발끈을...",2021. 4. 16.
[무포장가게 네트워크] 우리동네에도 있다 포장없이 파는 가게 ⑨: 전라편 (늘미곡...,"바다와 산이 어우러지고 평야와 맛난 음식이 많아 자주 여행을 가는 곳이기도 합니다. 봄에 찾아간 전라지역의 매장은 늘미곡, 이공... 아직 나주시 자체가 인근 광주, 목포, 순천 지역 같이 제로웨이스트에 대한 사회적 분위기가 조성되지 않아 안타깝다고 얘기해주셨는데 나주의...",2021. 6. 25.
나주에서 사진 남기기 좋은 곳들:),그렇게 돌아온 남편과 커피 한 잔을 한 후 나주 여행을 본격적으로 다니기 시작했다. 엔커피 전남 나주시 학생운동길 11 남평역 전남 나주시 남평읍 동촌로 313 나주남평역 이곳은 (구) 남평역으로 1956년에 지어진 역사이다. 몇 장의 사진을 통해 가보고 싶다는 생각으로 남편과 왔는데 사진만 통해...,2020. 12. 15.
[SNS 서포터즈] 옛 영산포역의 흔적을 느낄 수 있는 '영산포 철도공원',"영산포와 전남서부 사람들의 애환이 서려 있는 영산포역은 물산이 이동하던 거점 역할을 하던 곳으로 역사적으로도 의미 있는 곳으로 지금은... 제작된 주관적인 글로, 나주시의 공식 입장과는 다소 다를 수 있습니다. 위 이미지를 클릭하면 나주시 박인웅 서포터즈 글을 더 보실 수 있습니다.",2021. 6. 8.
나주 핫플 ‘유딜라이트’ 베이커리 카페 추천,유딜라이트 전남 나주시 남평읍 강변1길 36 매일 10:30-22:00 0507-1358-3432 전남 나주시 남평에 있는 조명맛집으로 유명한 대형카페 유딜라이트를... 추천해요:D #나주카페 #광주근교대형카페 #광주카페 #나주베이커리 #남평카페 #나주여행 #광주근교데이트 #나주커피 #나주핫플 #나주빵집 #나주데이트...,2021. 5. 7.
[SNS 서포터즈] 전라남도 문화재자료 제88호 지정된 유서 깊은 사찰 나주 '심향사',미륵전 내부에는 고려시대 전기에 조성 봉안된 전라남도 유형문화재 제309호로 지정된 석조여래좌상이 있으며 전남지방의 고려시대 전기 불상을... 사찰로 나주 시내권에 인접하고 있는 접근성이 좋은 여행지로 500년 된 모과나무도 볼거리이니 잠시 들러서 문화재 탐방과 풍경을 즐겨보는 시간을...,2021. 6. 1.
나주 호텔 혁신도시 웨스턴 호캉스 다녀옴~,"여행 다녀오고 피곤함을 어떻게 풀까 했는데~ㅋㅋ #나주호텔 #나주혁신도시호텔 #나주웨스턴호텔 에서 #호캉스 즐겼어요^^ 월풀 욕조가 있어서... 웨스턴호텔 전남 나주시 베멧3길 5-18 (빛가람동 348-19) 061-332-3133 4층이 호텔 로비에요~ 엘리베이터 타고 가면서, 무료 조식도 체크하고...",2021. 7. 7.
나주 순교자 기념 성당 `20051,스무번째여행 나주순교자기념성당 - 곡성옥터 나주 순교자들의 신앙을 기리는 곳 '나주 순교자 기념 성당' 한국의 성지와 사적지 나주 순교자... (현 전남 나주시 노안면 양천리) 주민들이 이 한약방을 왕래하면서 계량 마을에 천주교가 알려지게 되었다. 당시 계량 마을에서 한약방을...,2021. 4. 13.
[나주 카페]스테이케이션,[나주 카페/ 스테이케이션] l 주소 l 전남 나주시 빛가람동 159-5 1층 ㅣ 운영시간 ㅣ 일요일 10:30 - 20:00 매일 10:30-21:00 비가 추적추적 내리는날 나주 여행 후 좋은 카페를 찾다가 스테이테이션을 찾았어요 스테이케이션 외부 건물에 간판은 없었지만 특이한 건물구조로 쉽게 찾을수있었답니다 [외부...,2021. 5. 16.
#광주근교#가볼만한카페#승촌보#크로와상 식빵이 맛있는#비클래시카페,"어디론가 여행을 떠나고픈 날~~ 코로나로 긴 여행은 언감생심ᆢ 광주근교 가까운 곳을 선택했다. 얼마전 마음 속에 저ㆍ장ㆍ해 둔 곳, 나주... 비ㆍ클ㆍ래ㆍ시 주소 : 전남 나주시노안면 학산리 544-5 들어가는 문 옆에 주문 전 자리 확보라는 안내가 있었다. 매장이 혼잡하니 먼저 자리를 잡고...",2021. 5. 2.
일제강점기 학생독립운동의 진원지인 (구)나주역사와 나주학생독립운동기념관,"나주 가볼만한 곳, 여행 계획을 세우고 계신다면 나주학생독립기념관과 구나주역사를 돌아보며 의미있는 시간을 가져보시는건 어떠신가요? :) *번호 061-334-5393 *주소 전남 나주시 죽림길 26 나주학생독립운동기념관 *영업시간 평일 09:00 - 18:00 평일 09:00 - 17:00동절기(11월~2월) 월요일...",2021. 5. 22.
[빛가람동미용실] 집근처 메이듀 다녀왔어요!,다들 여행계획 있으신가요? 저는 이번에 친구웨딩촬영을 하는데 친구들끼리 사진이나 찍자고해서 촬영장 가기 일주일 전에 집근처 미용실에 다녀왔어요! 제가 방문한곳은 빛가람동미용실 메이듀라는 곳인데요. 전남 나주시 그린로 155 110호에 위치한 곳으로 매일 오전10시부터 오후7시30분까지...,2021. 6. 1.
"여행후기_mr.j 111 나주 느러지전망대, 함평 억새밸리존, 한옥전원마을",#전남목포 #영*횟집 #전남나주 #느러지전망대 #전남함평 #억새밸리존 #전남함평 #한옥전원마을 ('20.10.11) 추자항을 11시경에 출항한 쾌속선이 해남... 느려지고 나주시동강면 느러지를 통과하는 모습은 영락없는 한반도 모습을 하고 있다 바다로 가기 전 호흡을 가다듬고 가는 이 곳은 여유롭고...,2021. 10. 8.
[나주]광주근교 나주 숙소 호텔뷰,"#전남여행 #전라남도나주 #나주혁신도시 #광주근교숙소 #나주숙소 #빛가람호수공원숙소 #나주호텔 #나주모텔 #나주숙박 #광주근교호텔... (야놀자로 디럭스 6만원) 전라남도 나주시 중야2길 20 호텔뷰 2~5층 (빛가람동 336-1) 지하주차장 있음. 지하주차장 주차 후 2층 프론트로 가시면 돼요, 저희는...",2021. 4. 15.
"전라북도 정읍시 시내 : 수성동 번화가, 길거리 풍경","전남 나주시 보다 살짝 적은 수준인데요. 구) 나주의 번화가였던 금성관 주변 중앙동에 비하면 좀 더 번화하지만, 혁신도시 버프를 받은... 이건 정읍에 여행 오시는 분들에게 제가 드리는 약간의 꿀 팁인데요!? 쇼핑이랄 것도 없지만 쇼핑의 목적이 아니라 음식, 술 한 잔을 원한다면 아래의 장소로...",2021. 7. 21.
"나주의 맛집 베이커리 카페""비스터""",카스테라도 부들부들~~~ 전체적으로 빵이 달지않아 취저였답니다!!! 나주 여행계획 있으신분들 꼭 들러서 맛보시길 추천드려요!! 다음엔 다른빵과 커피도 맛볼거예요~~ 아!!! 케이크도 판매하고 있었답니다~^^ http://instagram.com/cafe_b.ster 전남 나주시 정보화길 50 상가 1층,2021. 5. 24.
"[나주 가볼만한곳] 광주근교 드라이브하기 좋은 나주 산림자원연구소, 나주 한수제",나주 산림자원연구소 주소 : 전남 나주시 산포면 산제리 23-7 전화번호 : 061-336-6300 입장시간 : <3월~10월> am 09:00 ~ pm 06:00 / <11월~2월> am 09:00 ~ pm 05:00... 된다면 나도 영산강 벚꽃길을 자전거 타고 달리고 싶다는 생각을 했다. 이상으로 나주 가볼만한곳 / 나주 여행 / 광주근교 드라이브 포스팅을 마친다.,2021. 4. 2.
나주혁신도시 한식맛집 배멧원 보리굴비 정식 추천,"나주혁신도시 배멧원 전남 나주시 배멧3길 5-18 open 10:00 close 22:00 break time 14:30-16:30 일요일 휴무 Tel. 0507-1368-0403 나주혁신도시 한식 맛집 배멧원... 친절,, #배멧원 #나주혁신도시맛집 #나주맛집 #나주보리굴비 #나주여행 #빛가람동맛집 해시태그 이벤트도 진행중이니 참고하세요 :D 빛가람...",2021. 5. 20.
광주디자인다올 먹방여행 ㅡ나주 가내수공업2021.5.29,피자 빨간 국수 샐러드 불쭈꾸미 전남 나주시 중야2길 10 061-332-9777,2021. 5. 29.
광주 북구 용봉동 어디까지 가봤니?,"이곳은 용봉동에서 시작해서 남쪽으로는 나주시 노안면과 전해 있으며 영산강 대촌동과 경계를 이루고 있습니다. 용봉동행정복지센터 광산군에... 전남대 학생회관 뒤편으로 이어지는 언덕 자락은 용주, 반룡 마을을 안고 있어 반룡의 주형 명당이라고 합니다. 동의 서쪽경계인 어린이 대공원...",2021. 6. 30.
나주 맛집 : 동신대 맛집 [한의식당] 찌개 맛집 feat. 김치찌개,"그만큼 나주에 볼거리, 맛집, 예쁜 곳이 많으니 전남 여행 하시는 분들 관심있으시면 꼬옥 참고해보시길 바랄게요 :-) 한의식당 전남 나주시 정렬사길 35 한의식당 되게 옛스러운 느낌의 식당이에요 ! 나주 한의식당은 동신대학교 한의대 바로 앞 쪽에 있어요 그래서 한의식당인가 ,, 이런 레트로 of...",2021. 4. 26.
나주 혁신도시 빛가람동 이차돌 : 고기와 곁들이기 좋은 메뉴들 그리고 매콤 쫄면,그래도 오랜만에 그렇게 돌아다니니 이동하는 동안에는 여행 느낌이 살짝 들기도 하더군요. 그래도 겁나서 일보고 밥먹고 숙소가고 일보고 밥먹고... 빛가람동 이차돌 LEECHADOL 주 소 : 전남 나주시 배멧3길 5-4 지 번 : 전남 나주시 빛가람동 348-9 전화번호 : 061-333-7799 영업시간 : 오전 11시 3분 ~ 오후 11...,2021. 5. 2.
"비프부르기뇽 #홍성 추어어죽,추어튀김 / 해양경찰,포항여행,막걸리","KBS2TV 생생정보 20200102 (974) #해양경찰 #쿠스쿠스 #자알룩 #분보후에 #분팃느엉 #비프부르기뇽 #추어어죽 #추어튀김 #포항여행... 장현오, 장봉수) ♡ 전남 나주시 다도면 신동리 426-6 @마라케쉬 레스토랑 (서울) @팜티진쌀국수 (서울) @빠리가옥 (서울) @광천원조어죽 (홍성)",2020. 1. 2.
[채용정보]농림식품기술기획평가원 2021년 정규직(공무직)/체험형 청년인턴 채용,해외여행에 결격사유가 없는 자 - 신체검사 결과 신체 또는 정신의 이상으로 장기요양이 필요한 자 제외 - 다른 공공기관에서 부정한 방법으로... 고졸 전남 나주시 2명 [체험형 청년인턴] 일반경쟁 - R&D 기획·관리 업무 지원 * 만 15세 이상 34세 이하(1986.7.1.이후 2006.7.2. 이전 출생자) - 취업자...,2021. 5. 18.
"남도맛기행 미션투어, 최대 28만원까지 여행경비 지원하는 특급 챌린지","전남 맛집 <자료출처: 남도관광 테마기행) 손맛 좋기로 유명한 전라남도에서는 남도맛기행 미션투어가 한창입니다. 광주광역시, 목포시, 나주시, 담양군 등 남도맛기행권역 네 지역에서 펼쳐지는 이번 행사는 신청을 통해 미션클리어까지 이어지면 여행경비, 바비큐그릴 혜택까지 있으니까 좋은...",2021. 9. 20.
육영수,"육영수가 재학하던 당시 배화고등여학교에서는 일본으로 수학여행을 갔는데, 육영수는 무척 가고 싶어했지만 아버지의 반대로 가지 못했다고... 또한 1971년 전남 나주시의 한센인촌, 1972년 전북 익산시의 한센인촌을 방문하는 등 한센인들의 인권을 위하여 많은 노력을 하였고, 이후 1974년 소록도...",2021. 7. 27.
1박2일 국내골프패키지 화순권 화순CC & 해피니스CC,안녕하세요~ 세계여행투어앤골프입니다^^ 오늘 소개해 드릴 1박2일 국내골프 여행지는 #국내골프여행 #국내골프투어 #국내골프패키지... 해피니스CC 전남 나주시에 위치한 해피니스CC는 약 45만평 27홀 골프장입니다 회원제18홀+대중제9홀로 구성되어 있습니다 나지막한 산야로 둘러싸인...,2021. 8. 29.
전남나주 드라마 도깨비촬영지 사극세트장 나주영상테마파크,여행기록 전남나주 드라마 도깨비촬영지 사극세트장 나주영상테마파크 다녀왔어요 나주영상테마파크 안녕하세요 최근에 다녀왔던 나주 드라마촬영지 소개해보려구요 나주영상테마파크 전라남도 나주시 공산면 덕음로 450 주몽세트장 성인 2.000원 / 청소년 1.500원 / 어린이 1.000원 나주시민은...,2021. 4. 18.
"나주 혁신도시피부관리, 나주 마사지, 블랑에스테틱",나주마사지 블랑에스테틱 위치:전남 나주시 우정로 106 토담스타타워 B동 2층 205호(전남 나주시 빛가람동 203-1) 월-토 10:00- 21:00 초이스메뉴... 맛스타그램 #여행스타그램 #광주맛집 #광주밥집 #광주카페 #광주핫플 #광주데이트 #광주데이트코스추천 #먹스타그램 #맛스타그램 #여행스타그램...,2021. 3. 24.
[사학연금지] 2021년 5월호 발간 안내,이국적인 여행 <경남 거제>로 떠나볼까요? 스물아홉 봄날에 안녕을 건네는 가수가 있죠! <가수 아이유>라는 최고의 장르 꽃 피는 봄날... kr 2) [우편] 전남 나주시 문화로245 사학연금 홍보실 ★ 선생님의 뜻깊은 사연 및 사진 등으로 소개해주세요 ★ 자세한 사항은 사학연금지 뒷면...,2021. 5. 4.
2020년 11월1일 남평 은행나무길,우남식당 전남 나주시 남평읍 남평2로 50-12 남평 은행나무길 단풍구경후 식사를 하기위해 생활의 달인에 소개된 나주 탕수육 짬뽕 우남식당 다녀왔어요 #남평은행나무길#나주근교가볼만한곳#은행나무길#남평은행나무수목원#단풍명소#가을여행추천#나주생활의탈인#우남식당#우남식당탕수육,2020. 11. 3.
아로마테라피스트 남도여행기 전라남도 산림자원연구소 메타쉐콰이어가로수길,"주소 : 전남 나주시 산포면 산제리 산 23-7 워낙 식물에 관심이 많다보니 여행 코스를 정할때도 꼭 식물원이 들어가 있습니다. 어제는 유채꽃을 봤지만 사실 진짜 목적은 홍어도, 유채꽃도 아닌 ""전남 나주 산림자원연구소"" 였답니다.! 역시 평일 아침이다보니 한적했어요1 도착한 시간이 대략 8시...",2021. 3. 27.
20번 환자는 15번 친척ㆍ22번은 16번 오빠… 가족 간 감염 ‘비상’,22 번째 환자 (46 세 남성)는 태국 여행 후 감염된 것으로 추정되는 16 번째 환자 (42 세 여성) 오빠 설 연휴 인 지난달 25 일 전남 나주시의 친가에서 16 시간 환자와 함께 식사했다. 자기 절연 시행 한 검사에서 6 일 양성으로 확인되어 조선대 병원에 격리되었다. 딸의 18 세 환자 (21 세...,2021. 7. 12.
맛있다고 포스팅했는데 어느날 다시 가보니 없어진 맛집 ! 중소벤처기업부가...,"맛집전문 블로그가 아니어서 계획적으로 찾아 다니지는 않지만 , 그래도 여행을 하며 맛집이라는 식당을 이욧한다. 제 블로그 이름이... 짱퉁어탕) △주몽가든맛집(전남 나주시, 30년, 한방삼계탕) △보름베이커리(전북 익산시, 24년, 제과ㆍ제빵) △교동다원(전북 전주시, 21년, 황차ㆍ발효차 등...",2021. 5. 7.
[전남/나주] 글램핑/펜션 :: 나주 글램핑어스 리뷰(feat. 순천 수내닭꼬치) #전남글램핑...,전라남도 나주시 경현길 65 예약처_인스타그램 (@glampingus_cafeglam) 안녕하세요. 츄아블로그 입니다. 오늘은 작년에 다녀온 글램핑 포스팅을 해보려구요. 일단 ※방 내부 사진 없음※ 입니다 ㅎㅎ 포스팅 계획에 없었던 거라 내부 사진을 안찍어 뒀거든요 ㅜ 제가 다녀왔던 나주글램핑어스는 전남...,2021. 4. 1.
나주 빛가람호텔을 소개합니다,"동반자 빛가람호텔이 남다른 고품격서비스로 기대이상의 가치를 선사합니다. 앞으로 각종 프로모션과 이벤트, 빛가람호텔 주변 #나주여행 과 정보등 다양한 이야기까지 즐거운 tmi로 여러분을 찾아뵐께요 많은 관심 부탁드립니다♥ 나주역 도보로 4분거리 전남 나주시 빛가람로 36 061-338-9000",2021. 6. 16.
