header,contents,date
여름 비대면 안심관광지 25선,"만나는 여행 19-전북-고창군-고창운곡람사르습지-세계가 인정한 최고의 생태탐방 여행지,-원시적인 습지 생태계의 보고 20-전북-무주군-구천동... 21-전북-진안군-운일암반일암 숲길-진안 최고의 비경을 만나는 계곡 트레킹, 계곡 물놀이도 가능하며 일부 구간은 생태탐방 데크가 조성되어 있음...",2021. 6. 10.
출사지 정보 (가을),"#출사지정보 #출사지 #사진 #꽃 #여행 #가을 출사지 정보 (가을) ※ 본 정보는 서울, 경기 위주의 제 개인 출사지 정보이며, 지극히 제... 전북 진안군 반월제 코스모스밭 - 호수로 마이산반영 촬영가능 7. 충남 부여 백마강 코스모스밭 - 구드레선착장~박제대교 8. 인천 영종도...",2020. 10. 27.
용봉의 라이딩일기 #2. 전라북도 북부투어 with 인디언챌린저,포스네요 진안군 메타세콰이어길 요기가 어딘지 몰라 대아저수지만 갈까하다 전북이 주무대인 슬리머즈분들에게 도움을 청했는데 밴장님이 직접 마중도 나와주시고 점심도 사주시고 커피도 사주시고 코스안내도 해주시고 대두산까지 배웅도 해주시고 정말 느무느무 감사합니다 ^^* 여기는 정말...,2020. 9. 7.
코로나 시대 ''캠핑 명소 베스트5,이효리도 반한 전북 진안군 섬바위 전북 진안군 섬바위 금강변의 보름밤. [양영훈 여행작가] 한 종합편성채널 예능프로그램에서 이효리와 핑클 멤버들이 캠핑카를 타고 맨 처음 찾아간 곳이다. 첩첩한 산자락과 굽이치는 강줄기에 둘러싸여 자연미가 빼어나다. 금강 상류의 물길 한가운데 소나무...,2020. 6. 27.
진안 마이산 샘터가든 맛있네요,전북진안 맛집 샘터가든은 흑돼지 오리주물럭 돼지불고기 이 추천메뉴라 하네요 진안여행을 하면서 한번들르시면 후회는 하지 않을것 같습니다... 와야하는 전북 진안군 진안읍 맛집 인것 같아요 농사지은 고추가루로 김치를 담아서인지 보는것만으로도 맛깔스럽던지 김치에 밥한공기는 순식간에...,2020. 4. 6.
찜통더위를 피해 천연 에어컨 속으로 [진안 풍혈냉천],무더위를 식혀 줄 여행지를 물색하다 찜 해두었던 풍혈냉천을 무더위가 절정인 오늘 찾아 나섰습니다. 풍혈냉천(風穴冷泉)이란? 전라북도 진안군... 마이산에서 약 10km 거리에 떨어져 있고 임실 사선대와도 멀지 않으니 전북 여행 계획이 있으시다면 경유지로 설정해 보심을 추천드립니다....,2020. 8. 19.
비대면 5성급 가을 관광지 중 최고 지역,"가을 단풍여행을 즐기는 여행 수요가 늘어나는 가운데, 한국관광공사가 전국관광기관협의회와 함께 관광객 밀집을 최소화하고, 거리두기... 부귀 메타세쿼이아길 - 전북 진안군 ★★★★★ 진안에 위치한 부귀 메타세쿼이아길은 1.5km 구간으로, 전주에서 가깝고 마이산이 근접해 있어 사계절...",2020. 10. 23.
"[조용준의 여행만리] 울긋불긋 산벚꽃, 연둣빛 신록 아래 자발적 고립",완주군 소양면과 진안군 부귀면을 잇는 20㎞ 거리의 고갯길이다. 그 옛날 무주ㆍ장수ㆍ진안 사람들이 전주를 가기 위해 꼭 넘어야 했던... 좌회전한 뒤 자산삼거리에서 오른쪽으로 방향을 잡아 10분쯤 가면 장전마을이다. 2021.04.24 | 원문링크 바로가기 #국내여행 #전북여행 #전북 #진안,2021. 4. 28.
"한국관광공사, 여름 비대면 안심관광지 25선...휴가철 여행지로 추천","한국관광공사 '대한민국 구석구석' 누리집 내에 안전여행 페이지에서 '생활 속 거리두기'에 따른 여행경로별 안전여행 가이드를 설명하고 있다... 전북 진안군 운일암반일암 숲길, 진안 최고의 비경을 만나는 계곡 트레킹, 계곡 물놀이도 가능하며 일부 구간은 생태탐방 데크가 조성되어 있음 22....",2021. 6. 8.
"100대명산, 마이산 등산 코스(마이산 국립공원, 남부주차장~ 나봉암 비룡대~금당사...","일시 : 2020년 2월 4일(화) 주소 : 전북 진안군 마령면 마이산로 130 특징 : #100대명산 #마이산(블랙야크,산림청) 동행 : 3인(남2, 여1) 준비 : 빵, 생수... 또 세계 최고의 여행 안내서인 프랑스 미슐랭그린 가이드에서 별3개의 만점을 받아 대한민국 최고의 명소로 각광받고 있다. 안내문 중에서...",2020. 2. 5.
2021년 5월 4주차 사진전시 일정 (5/19~5/25),"/ 고병선, 이익재, 이재훈 [ 127 ] 국보 제62호 미륵전 벽화 사진전 / 금산사 성보박물관 앞마당(전북 김제시 금산면 모악15길 1)... / 전경배 [ 102 ] 제주에서 떠나는 유네스코 세계 여행 / 제주세계자연유산센터(제주도 제주시 조천읍 선교로 569-36) / 2021.05.12....",2021. 5. 6.
10월에 떠나면 좋은 가을 여행지,"10월에 떠나면 좋은 가을 여행지 아침,저녁으로 옷깃을 여미게 하는 차갑고 쌀쌀한 바람으로인해 가을이 성큼 다가온것을 느끼는 요즘 어느새... ▲진안메타쇄콰이어 길 (전북 진안군 부귀면 세동리 69-3) 진안메타쇄콰이어길은 진안과 전주를 이어주는 아름다운 길이다. 전라북도 진안 모래재...",2020. 9. 29.
2021년 5월 5주차 사진전시 일정 (5/26~6/1),(코로나19로 인해 취소 또는 연기된 전시가 포함되어 있을 수 있습니다) [ No ] 전시제목 / 장소 / 전시(시작일) ~ 전시(종료일) / 작가 [ 169 ] 독도사진전 / 임실문화원(전북 임실군 임실읍 봉황로 131) / 2021.06.01. ~ 2021.07.31. / 안동립 [ 168 ] 서울공원의 사계...,2021. 5. 13.
차박지 캠핑추천장소 알려드려요!,혼자 여행을 떠나는것을 좋아하는 사람들에게 더더욱 인기 있답니다. 차박은 많은 돈을 들여 차를 고칠필요없이 최소한의 준비로 떠나는... 강릉안반데기마을 주소 : 강원 강릉시 왕산면 안반덕길 428 2.무주 금강 주소 : 전북 무주군 부남면 3.진안 용담호 주소 : 전북 진안군 용담면 월계리 4....,2020. 4. 27.
"[전라북도여행] 진안 가볼만한 곳, 용담호 카페 기배기,용담호 드라이브코스...",시급합니다ㅎㅎ 전북에는 숨겨진 캠핑 명소가 너무 많아요♡ 아무데나 의자놓고 테이블놓고 앉아 풍경감상을 하면서 낮잠자고 싶다는 생각을 매번 하게 된답니다ㅎㅎ 멀리갈 필요도 없어서 더 좋아요♡ 정천 망향의광장 전망대 위치 : 전라북도 진안군 정천면 모정리 970-40 주차 : 주차가능(무료)...,2021. 4. 29.
진안 마이산 - (경치 사진 없음),"이렇게 여행하는 시간, 금전 지출도 자세히 써 놓아서 누가 그때 인터넷 할줄 알았을까... 높이 : 680m 위치 : 전북 진안군 진안읍 특징, 볼거리 마이산(馬耳山)은 두 암봉이 나란히 솟은 형상이 말의 귀와 흡사하다고 해서 붙여진 이름으로서 동쪽 봉우리가 숫마이봉, 서쪽 봉우리가 암마이봉이다....",2020. 8. 2.
2021.06.02 마을기업간담회,담당관들이 참석한 가운데 코로나로 인한 어려움을 토로하며 그 가운데서 고군분투하는 기업들이 서로 격려하고 결의의 다지는 시간이었습니다. 원연장마을도 지역과 함께 상생하는 건강한 마을기업으로 나아가겠습니다. #원연장꽃잔디마을#전북마을기업#진안군마을공동체#진안고원촌스런마을여행#,2021. 6. 29.
대전비디오테이프변환 /비디오테이프변환 .결혼.재롱잔치. 신혼여행 .집안행사변환,신혼여행 집안 행사 비디오테이프 영상파일로 변경하는것입니다 . 계속 저희가 강조 하는것있습니다 . 변환 해서 hd나 uhd로 되냐고 하시는데... 산시/익산시/정읍시/남원시/김제시/완주군/진안군/무주군/장수군/임실군/순창군/고창군/부안군/서산/논산/계룡/당진/금산군/부여군 /서천군/청양군...,2021. 8. 13.
[한국관광공사] 여름 비대면 안심관광지 25선,"만나는 여행 19 전북 고창군 고창운곡람사르습지 세계가 인정한 최고의 생태탐방 여행지, 원시적인 습지 생태계의 보고 20 전북 무주군 구천동... 21 전북 진안군 운일암반일암 숲길 진안 최고의 비경을 만나는 계곡 트레킹, 계곡 물놀이도 가능하며 일부 구간은 생태탐방 데크가 조성되어...",2021. 6. 9.
[원연장마을소식]05.10 '테마가 있는 자연마을'조성사업 컨설팅,http://naver.me/xmrylp2y 진안군 원연장마을 ‘테마가 있는 자연마을’ 선정 - 전북도민일보 진안군은 ‘21년 전라북도 테마가 있는 자연마을... #원연장꽃잔디마을#테마가있는자연마을#진안고원촌스런마을여행#진안농촌관광#원연장마을공동체#마을공동체일번지#,2021. 5. 30.
전국 캠핑장 리스트 (기타 시도),"특별한 여행지 문화관광농원 캠핑장 문화관광농원 캠핑장은 앞으로는 탁 트인 거제 바다가 보이며, 뒤로는 시원한 산들이 병풍처럼... 경남 고성군 동해면 조선특구로 1526010-2744-7713 [경상남도 고성군] 당항포 오토캠핑장 캠핑과 함께 다양한 테마 여행까지 즐길 수 당항포 오토캠핑장....",2021. 1. 7.
"전라북도의 중심,전주시의 버스터미널을 소개합니다!!!(feat.알면 편리하게 이용할 수...","#전라북도#전북여행#전주여행#전주터미널#전주고속터미널#전주시외터미널#덕진정류장#완산동정류장#한옥마을정류장#서부신시가지정류장... 인후동(안골)발 행선지 진안군(진안,안천,송풍,정천,주천),장수군(장수,장계,천천,계북,계남),무주군(무주,안성,적상,설천,구천동),금산,서상,안의...",2020. 7. 12.
무려 119대1 올여름 성수기 가장 인기 높은 휴양림 객실 수준,66:1 (진안군)운장산자연휴양림 야영 250 154 38 116 1.62:1 #자연휴양림 #산림청 #숲속의집 #국립자연휴양림 #추첨결과 #성수기휴양시설 #언택트여행지 #변산자연휴양림 #변산자연휴양림위도항 #가리왕산자연휴양림 #정선 #강원도 #변산반도 #부안 #전북 #가리왕산 #유명산자연휴양림...,2020. 6. 24.
[정보공유] 전국 차박캠핑 노지 중심 가볼만한 곳 추천(ver 6_21.9.28),"JJ캠핑 (강원도 인제) @ 신남선창작 옆 낚시 노지 (강원도 정선) 동강전망자연휴양림오토캠핑장(유/예) 단풍, 동강뷰_유.여행플러스 (강원도 정선)... 남이섬 인근_유.여행플러스 (경기도 가평) 막힘(?) 화악터널 쌈지공원 별보기(화사) 스텔스차박_유.캠핑모드 (경기도 가평) 화야캠핑장(유/예)...",2020. 12. 29.
100대 명산 진안 마이산,"일 전북 진안 마이산 2020년 61번째 11.0Km 산행 우리 사진여행으로 즐겨보시게요...요 2020년 누적 1,002.2Km -----♧♧♧----- 아침에 집을 나서는데... 7m) 봉우리를 점령할 수가 있거덩요 진안군 연장리 꽃잔듸 마을이 보여요 실컷 여름의 색을 구경했으니 나봉암 정자에 오르렵니다 어케 요로코름 맛이...",2020. 5. 17.
진안 가볼만한 곳 모래재 메타세쿼이아 길,"전북 진안군은 올해 이곳에 1억여 원을 들여 차도 옆에 보행로를 신설하고, 차량 접근 경보장치 등을 설치하는 등 진안의 대표 지역 명소로 만들 예정이라고 하네요. 그러니 앞으로는 더 유명한 진안 모래재 메타세쿼이아길이 될 듯합니다. 시원스럽게 곧게 뻗은 메타세쿼이아길. 어디선가 본 적...",2020. 6. 30.
진안 마이산 맛집 로컬음식 현지인 추천 샘터가든 찾았다!,전라북도 진안군은 여행지로 떠나기 정말 좋았던 이유는 힐링이되고 시골을 좋아 하는 거로써 조용한 분위기에서 드라이브만 해도 기분이 많이... 마이산 맛집 로컬음식 현지인 추천 샘터가든 인거같아요! 전북 진안군 진안읍 중앙로 99 샘터가든 본 포스팅은 소정의 원고료를 지급받아 작성된 글입니다.,2020. 11. 25.
혔다. '숲으로 행,"앞서 도는 지난 4월 중 ‘정원으로 떠나는 소풍여행’을 주제로 전문가 및 종사자들이 참여하는 ‘문화정원’과 일반인 및 대학생이 참여하는.... 하하호호, 우리도 가을 소풍 갑니다~~ 전북 진안군 마령면 초등학력인정 문해 교실의 문해 학습자 18명이 27일 마이산으로 가을소풍을 떠났다....",2021. 5. 13.
‘2021 경남관광박람회’ 세코에서 개최 5.20.(목)~22.(토) 3일간,"안전하고 가까운 여행지로의 관광체험 경남관광홍보, 우수축제, 바이어온라인 상담 등 91개사(325부스) 참여 단계별 체계적인 방역관리시스템으로... 장수군 ▲전북 진안군 등 타 시도의 8개 지자체와 ▲산청한방약초축제 ▲ 진주유등축제 ▲울산옹기축제도 참여한다. □ 관광인 미니 잡페어...",2021. 5. 18.
불타는 청춘 여행지,"방송을 보면서 숙소 찾기 상세주소 제외 순번 방송회차 방송일 정보 여행지 위치 1 파일럿 2015.01.02 2015.02.18 파일럿... 01 김광규 진안 전북 진안군 주천면 무릉리 19 2016.03.08 2016.03.15 2016.03.22 이형철,이다도시 해남 전남 해남군 송지면...",2021. 4. 28.
마이산 바라보며 홍삼물에 '푹~'…몸과 마음이 따뜻해진다,"진안군 홍삼스파 전북 진안군 진안읍 홍삼스파 옥상에 있는 노천탕에서 관광객들이 온천욕을 즐기고 있는 모습. 뒤편에 말의 귀처럼 솟은 두... 특히 프랑스인 전문 여행가이드인 레아모로씨가 한국어, 영어, 프랑스어로 관광 안내에 나서는 점도 눈여겨볼 만 하다. 풍경버스는 매주 수요일부터...",2020. 12. 7.
"아이폰 11 프로 카메라(7과 사진 비교) 기능 사용기와 좋은점, 불편한 점",또한 금년에 예정되어 있는 해외여행을 위한 카메라에 대한 요구를 반영한 선택이기도 하다. 이전 여행에서는 여행 전 사진강좌를 하나 듣고... <마이산 정상을 마이산 비룡대 (전북 진안군 진안읍 연장리 산 180)에서 광각촬영> <마이산 정상을 마이산 비룡대 (전북 진안군 진안읍 연장리 산 180)...,2020. 2. 3.
"압도적인 진안 마이산 탑사, 마이산이 한눈에 보이는 사양제","진안 마이산 탑사, 사양제, 진안 메타세콰이어 순서로 전북 진안여행을 했답니다. 전북 진안군 마령면 마이산남로 367 (동촌리 8) 입장료 성인3000원 / 청소년2000원 / 어린이1000원 T. 063-433-0012 저희는 진안 마이산 탑사를 아침일찍 둘러봤어요. 대웅전에 계시던 관리자 분이 젊은 사람들이 일찍 왔다며...",2021. 6. 28.
2019 지구촌장 국내 등산&트레킹 결산일지,"연석산 전북 진안군 완주군 11월 20일 35 수도산 경북 김천시, 경남 거창군 11월 29일 36 장군봉 전북 진안군 12월 8일 2019 트레킹 결산일지 순서 길 이름 지역 일자 1 간절곶소망길 울산시 1월 20일 2 김삿갓문학길 강원 영월군 6월 2일 3 화암사숲길 강원 고성군 6월 15일 4 쑥섬(애도)...",2020. 1. 6.
4월 24일 금요일 [뉴스],"23일 전북 진안군 성수면의 한 다리에서 경찰 관계자들이 시체를 수습하고 있다. 6. 김재원, 이번엔 지자체 동의 받아와라 ""지방비 3조원... '여행 보이콧' 넘긴 韓·日, 코로나에 '넉다운' - 한국, 일본 3월 외국인 여행객 전년比 95%·93% 급감..국내여행 활성화로 돌파구 모색 12. 김종인 ""총선 참패?...",2020. 4. 24.
한국의 아름다운 길 100선. 무주 구천동 국도 37호선 드라이브 코스로 추천,무주 여행지에서 만난 환상 드라이브 코스. 무주 구천동 입구 경승지인 라제통문에서 신풍령 빼재까지의 국도 37호선입니다. 한국의 아름다운... 모래재 전북 완주군 소양면 ~ 진안군 (구 국도 26호선) 052 굽이 굽이 옛정 (대관령 옛길) 강원도 강릉시 성산면 ~ 평창군 도암면 (지방도 456호선)...,2021. 8. 21.
955회 로또 당첨번호 당첨금액 지역은 어디일까?,드림여행 경기 연천군 우리로또복권 경기 용인시 용인로또복권방 경기 의정부시 일등복권방 경기 평택시 대진로또 경기 화성시 서해로또방... 다사랑복권 전북 진안군 하오하오복권랜드 경북 경산시 레인보우 경남 거창군 노다지복권거창점 경남 양산시 드림로또 경남 양산시...,2021. 3. 21.
/재첩국 사이소~~/,"꽃구경도, 여행도 못하고 서울에서 지내면서 주말을 맞으니 남도의 꽃과 맛이 그리워진다 필자가 다녀본 벚꽃의 경치는 진해 통제부사령부, 경주... 섬진강은 전북 진안군 데미(봉의리)샘 에서 발원하여 전남 광양시 광양만으로 흘러가는 남한에서 4번째로 긴 강이다 노령산맥과 소백산맥 사이를...",2021. 1. 19.
"토탈레코드- 기차마을, 관광지 안내방송,관광객안내방송,관광객안내멘트...","그럼 즐거운 여행되시기 바랍니다. 고맙습니다. *((섬진강)) 왼쪽으로 보이는 강이 우리나라 5대강 중에 하나인 섬진강입니다. 섬진강은 전북 진안군에 있는 팔공산의 ‘데미샘’이라는 곳에서 발원하여 전북, 전남, 경남을 걸쳐 212km를 지나 남해바다로 흘러가고 있습니다. 그 중 우리 곡성은...",2020. 7. 20.
[여행] 가을여행-자연휴양림 10선,"[여행팁] ▶단풍감상 명소=장재 저수지 주변 ▶추천 산행코스=산책로 1.95km(1시간), 등산로 1코스 2.26km(왕복2시간) ▶주소 &연락처=충청북도 보은군 장안면 장재리 산5-1(043-543-6282) ▲ 용현휴양림 숲속의 집 6. 또 다른 내장산 '운장산자연휴양림'(전북 진안군) 구봉산에서 운장산으로 뻗은 긴...",2020. 3. 27.
진안 맛집 탁월한 선택~,"당일치기로 다녀온 진안 여행. 진안 마이산 휴게소(장수 방향)에 들러 저 멀리 마이산을 조망하고, 마이산 등갈비 골목에 있는 진안 맛집... 주소 : 전북 진안군 마령면 마이산남로 213 영업시간 : 오전 9시~오후 9시 연중무휴. 단체석, 포장, 예약. 주차 가능 등갈비로 방송 출연도 한 적이 있다더니...",2020. 7. 5.
진안 마이산 맛집 샘터가든!!^^,"이름 지명도 생소한 전북 진안군 으로 힐링여행을 다녀 왔네요 진안가볼만한곳이 마이산 탑사 운장산 휴양림 선각산 백운동계곡 운일암 반일암 진안 구봉산 용담호, 진안 홍삼스파 등이 있네요 전북 진안은 전북에서 완주군 다음으로 면적이 2번째로 크더군요 가는길에 들른 진안...",2020. 1. 29.
"[전북 날씨] 흐리고 한때 비, 아침기온 0도, 낮 최고 기온 10도...초미세먼지 나쁨","미세먼지 보통, 초미세먼지 나쁨, 강수확률 70% [아시아뉴스통신=길호경 기자] 기상청은 오늘(13일) 전북지역은 흐리고 한때 비가 오는 날씨로... 장수군·진안군 7도 이다. #아시아뉴스통신 #아시아뉴스통신윤의일기자 #윤의일기자 #필란트로피임영주 #오늘의날씨 #날씨 #미세먼지 #영하 #지역별...",2020. 12. 13.
사계절 체류형 산림․힐링․관광도시로 재도약시키겠습니다!,"풍경이 수려한 완진무장을 하나의 관광권역이자, ‘완진무장 80일간의 여행’이란 브랜드로 육성해 사계절 체류하는 산림․힐링․관광 도시로... 완주군의 경우 북부 6개면을 연결하는 명품순례길(되재~백석~수청~화암사~소농교회~고산향교~고산성당~천호성지)을, 진안군은 고원길·치유숲길...",2020. 4. 9.
진안카페 공간153 [주말의커피 스페셜 메뉴 안내],카페공간153 #수동출커피전문점 #KT올레커피청년 #진안고원커피 #로스터리카페 #진안최초로스팅카페 #핸드드립커피 #전북여행 #카페여행 #일상여행 #여름여행추천카페 #블렌딩원두 #시그니쳐히말라야만년설 #가을여행 #전북가을여행 주소 / 전북 진안군 읍 당산길 26-2 전화 / 070-8869-5536,2020. 9. 27.
[마이산]마이산 탑사(가을산행),지난 주말 메밀묵 & 찹쌀떡 마이산 탑사에 다녀왔어요 마이산 탑사 마이산 탑사 전북 진안군 마령면 마이산남로 367 ***-***-**** 구미에서 전북 진안... 즐기는 여행.. #진안여행 #마이산탑사 #마이산돌탑 #마이산남부주차장 #마이산은수사 #가을여행추천 #가족여행추천 #가족나들이추천 #전북진안마이산,2020. 10. 13.
진안 가볼만한곳 모래재 메타세쿼이아길,있어 함께 담아봤는데 꽃이 활짝 폈을때 메타세쿼이아랑 어우러진 모습도 예뻤겠다는 생각을 해봅니다. 찬란한 햇살을 머금고 있는 풍경을 담으러 볕이 좋은날 한번 더 방문해야할듯해요. 진안 모래재 메타세쿼이아길 정보 주소 전북 진안군 부귀면 세동리 69-3 네비검색지 부귀메타세쿼이어길주차장,2020. 5. 18.
"전북도, ‘반려견과 함께 하는 우선 안심 걷기 길’ 협약 체결","9구간(진안군) ▲섬진강 예향천리마실길(순창군) 등이다. 협약에 따라 전북도는 ‘반려견과 함께 하는 우선 안심 걷기 길’ 활성화 사업을 통해... 또한 관련 업계(에어비앤비, ㈜펫츠고트래블)는 ‘걷기길’ 연계 여행 편의시설 DB발굴 및 체류형 관광코스 상품화를 통해 전북에 관광객을...",2021. 3. 17.
운일암반일암 :: 무지개펜션 【평상/텐트/캠핑】,낮과 다른 색다른 분위기가 연출되는 무지개펜션에서의 밤은 절대 잊혀지지 않을 만큼 좋은 기억으로 남을 거 같에요. 1박 2일 동안 날씨도 좋고 깨끗한 계곡이 있는 운일암반일암 무지개펜션 마음이 여유로워지는 여행이였습니다 전북 진안군 주천면 동상주천로 1666 무지개펜션 ***-****-****,2020. 8. 3.
"캠핑카! 움직이는 집, 머무는 곳이 여행지죠~♬♪","전북 진안군 주천면 대불리와 주앙리 사이에 있는 운일암과 반일암은 깎아지른 절벽 때문에 하늘,돌,나무,구름 밖에 보이지 않아 운일암이라 하고... 캠핑카 여행은 한 마디로 움직이는 집이라 맘에 드는 곳이면 그 곳이 여행지 숙박 장소가 된다는 점이다. 여행 첫날, 오후 3시, 광양으로 향했다...",2020. 8. 4.
배창랑님은 2012년 10월에 국내 1000m 산과 봉우리 512개를 올랐다 '나는 언제 다...,"4m 강원 홍천군 내면[연결산행] 61)구봉산 1,002m 전북 진안군 주천면 62)국망봉 1,168.1m 경기 포천군 이동면. 가평 북면 [한북정맥,100산... 3m 강원 강릉시 강동면,옥계면,왕산면[여행정보] 145)만복대 1,443.4m 전남 구례군 사동면 [월간산98.11 지리산,백두대간] 146)만선봉 1,232m...",2020. 11. 17.
캠핑클럽 1회 촬영지 진안 캠핑 성지 용담섬바위,공원 화장실 엄청 깨깟하니깐 여기 이용하시면 좋을거에요. 캠핑장에서 좀 걸어야하긴하는데 산책삼아 걸어나와서 공원도 한바퀴 구경하믄 되죠뭐. ㅋㅋㅋㅋㅋㅋㅋㅋㅋㅋㅋ 캠핑클럽 1회촬영지 진안 용담섬바위 위치 전북 진안군 안천면 안용로 832-27,2020. 7. 19.
"진안 가볼 만한 곳, 진안 모래재 메타세쿼이아 숲길 ~","진안 여행, 싱그러운 신록 풍경 속 사진 찍기 명소, 모래재 메타세쿼이아 숲길 2020년 5월 1일 오월은 싱그러운 신록이 가득한 푸르름이 가득한... 진안 메타세쿼이아 숲길은 사계절 아름다운 길로 전북 진안군 부귀면에 있는 메타세쿼이아 가로수 길입니다. 초록이 가득한 싱그러운 신록이 하늘을 덮어...",2020. 5. 7.
사진작가와 함께하는 ‘풍경 낚시’,사진작가들과 함께 출발할 오늘의 촬영지는 ‘전북 진안’. 코로나 이후 처음 떠나는 타지 여행이다. 오길 잘했다. 모든 일상을 이미지로... ▲ 지난 8일 한국사진작가협회 제천지부 등 제천에서 활동하는 사진작가들이 전북 진안군 일대에 합동 촬영회를 나갔다. ⓒ 임지윤 이 기사는...,2020. 11. 14.
CNN 선정 '한국의 가장 아름다운 사찰',한 관광객이 자전거를 타고 꽃 터널을 지나고 있다 전북 진안군에 소재하는 마이산탑사가 CNN의 ‘2020년 한국의 가장 아름다운 사찰 33곳’에 선정됐다. 최근 CNN의 여행섹션에서 역사적 의미가 깃든 한국의 900개 사찰 가운데 여행객이 가볼만한 아름다운 사찰을 소개하는 기사가 보도됐다....,2020. 2. 14.
"섬진강(蟾津江, Seomjin-gang(river))",섬진강 경상남도/전라남도 > 하동군/광양시 > 하동읍/다압면 기간:2021.02.27 ~ 2021.03.27 (28박 29일) 컨셉:사진에 담는 출사여행 경로:부산 동래구 사직동▶만덕터널▶남해고속도로▶하동 나들목▶섬진강(경남/전남 경계선) TIP 전라북도 진안군에서 발원하여 전북 및 전남 동부를 흐르다 하류 부근에서...,2021. 3. 3.
