header,contents,date
[나주카페] 엔틱한 분위기가 좋았던 미스박 카페 찐 후기!!,추억여행해 보시는 것도 좋을 거 같아요 이렇게 나주에 오면 미스 박이 생각 나주 라는 재밌는 문구에서 사진도 찍을 수 있어요~! 여기가 나주카페... 기다리면서 이렇게 놀러 다닐 수 있는 날이 오길 기대해봅니다 미스박 주소 - 전남 나주시 경현길 135-11 시간 - 11:00~21:00 월요일 휴무 번호 - 061.333.7294,2021. 1. 4.
대전비디오테이프변환 /정직한 변환 확실한 개당가격으로 변환 소중한추억으로 여행...,경북/경남/제주/창원/금산/천안/서울/경기/전북/전남/세종/강원/부산/울산/공주/청주/나주/전주/영주/구미/수원/영등포/상주/예천 /안동/안동시... 순천시/나주시/광양/담양군/곡성군/구례군/고흥군/보성군/화순군/장흥군/강진군/해남군 /영암군/무안군/함평군/영광군/ 동대구 /대구 /서산/당진...,2021. 9. 25.
2021년 4차 농식품산업 해외진출지원 융자 사업 지원대상자 모집 공고,투자‧국외여행 등에 우려가 있는 국가로 진출하는 경우에는 원칙적으로 지원 대상에서 제외 - 우선지원 요건 ㆍ 해외 개발 농산물을 국내로... 접수처 : 전남 나주시 그린로 20 한국농어촌공사 해외사업처 융자사업담당자 ㅇ 신청 서류 : 신청서 등 기타사항 ※ 자세한 사항은 한국농어촌공사...,2021. 8. 23.
"빛가람동카페, 아루나",빛가람동카페 아루나 위치:전남 나주시 문화로 234 성도스카이 106호(전남 나주시 빛가람동 348-12) 초이스메뉴: 비포선라이즈(7.0) 루이보스아몬드(7.0)... 맛스타그램 #여행스타그램 #광주맛집 #광주밥집 #광주카페 #광주핫플 #광주데이트 #광주데이트코스추천 #먹스타그램 #맛스타그램 #여행스타그램...,2020. 8. 21.
나주카페: 3917 마중 복합문화공간 / 나주카페 추천 / 나주 가볼만한곳,주차장: 전남 나주시 교동 19-2번지 (주차장 있어요!) 3917 마중은 이쪽 말고 반대편쪽에도 주차장이 있어요!! 주차장은 두군데 입니다! 주문하러... 저의 여행이야기 들고 찾아올게요! ▶ 다른 사진이 궁금하시다면 인스타에 공유할게요! 놀러오세요:-) #나주 #나주가볼만한곳 #나주카페...,2020. 10. 26.
"나주성북동보쌈, 메주애꽃",나주성북동보쌈 메주애꽃 위치:전남 나주시 금성길 52(전남 나주시 성북동 219-15) 매일 11:00 - 22:00 초이스메뉴:두부보쌈 大(40.0) 돌솥밥(3.0) 나주 가면... 맛스타그램 #여행스타그램 #광주맛집 #광주밥집 #광주카페 #광주핫플 #광주데이트 #광주데이트코스추천 #먹스타그램 #맛스타그램 #여행스타그램...,2020. 8. 22.
광주 근교 나주 카페 찐행복을 느낄 수 있었던곳,마중 *주소: 전남 나주시 향교길 42-16 *영업시간: 오전11:00~22:00 *주차장: 있음 사실 입구 들어가기전까지만해도 시큰둥 (ㅇㅅaㅇ) 메뉴 시키기전까진... 라고 생각할 수 있는데 정말루 야자수에 저 하와이 무늬때문에 휴양지 느낌 가득하더라구요 나주 카페 마중에서 잠깐 비행기타고 여행을 다녀온...,2020. 10. 5.
2021년 4차 농식품산업 해외진출지원 융자 사업 지원대상자 모집 공고,투자‧국외여행 등에 우려가 있는 국가로 진출하는 경우에는 원칙적으로 지원 대상에서 제외 - 우선지원 요건 ㆍ 해외 개발 농산물을 국내로... 접수처 : 전남 나주시 그린로 20 한국농어촌공사 해외사업처 융자사업담당자 ㅇ 신청 서류 : 신청서 등기타사항※ 자세한 사항은 한국농어촌공사...,2021. 8. 20.
[맛집] 나주 곰탕 하얀집,"가족여행을 가기 전 나주를 지나가게 되어서 나주 곰탕 하얀집을 방문하게 되었다. 근방 공영주차장에 차를 주차하고 보았더니....!!!!! 사람... 하얀집 전남 나주시 금성관길 6-1 ☎ 061-333-4292 매일 08:00 - 21:00첫째, 셋째 월요일 휴무 라고한다. 드디어 우리차례 회전율이 빨랐다. 열체크를 하고...",2020. 8. 5.
국내산 홍어 나주 빛가람 홍어 친정엄마를 위한 선물,주소 : 전남 나주시 남교1길 5-3. 1층 (이창동 110-54) 전화번호: 0507-1365-2161 영업시간 : 매일 00:00~24:00 기대되서 오픈을 해봅니다 히히 홍어 언박싱의... 업체로부터 제품만을 제공받아 체험후 작성한 후기입니다- #국내산홍어 #홍어맛집 #홍어회 #홍어포장 #나주홍어 #나주홍어맛집 #나주여행 #빛가람홍어,2020. 12. 23.
(전남 여수 온라인 정책토론회)SW AI 자격제도 개선을 위한 정책토론회(여수 남도기획),"전라남도교육청, 나주시 ◦ 주 관 : (재)전남정보문화산업진흥원 ◦ 행사 규모 : 현장 약 20명 내외 / 온라인 참여 100여명 - (현 장) 패널... 조달등록 주요사업분야 행사대행업 전시·축제·체육·기공식·이벤트 국제회의기획업 MICE·학술대회·컨퍼런스 대행 PCO 국내여행업 워크샵 연수 대행...",2020. 12. 11.
2020년 2차 농식품산업 해외진출지원 융자 사업 지원대상자 모집 공고,"투자ㆍ국외여행 등에 우려가 있는 국가로 진출하는 경우에는 원칙적으로 지원 대상에서 제외이다. 우선지원 요건은 밀, 옥수수, 콩 등 식량... 신청 방법은 전남 나주시 그린로 20 한국농어촌공사 해외사업처 융자사업담당자앞으로 우편 및 방문 접수하고 제출 서류는 사업계획서, 현지사업자...",2020. 7. 6.
"나주맛집, 나주혁신도시맛집 나주 33년 전통 아구전문맛집 [진미아구찜]","진미아구전문 위치 전남 나주시 금성 길 65-2 (성북동) 영업시간 운영시간 : 11:30~21:00 (l.o 20:30) 매월 2,4째주 월요일 휴무 매장 옆 공영주차장 포장... 드셔보세용~ #나주맛집 #나주아구찜 #나주혁신도시맛집 #광주근교맛집 #나주혁신도시아구찜 #나주버스터미널맛집 #나주여행맛집 #나주여행...",2020. 9. 14.
바이커's 커피로드 : page 9~15,"5 나주 [영산나루] 전남 나주시 주면2길 28, 영업중 첫인상 : 정문에선 별로 안 크네? 아담한 집 한채 인가.. 뒤 뜰 돌아가는 순간, 와... 크다! 외관은... 전국일주 중이라 하니 직접 여행코스 짜주실 정도로 친절하며, 목포에서 둘러볼 곳도 알려주셨다. 지나고서 적는 이야기지만 목포 대교는 진짜...",2020. 5. 14.
"나주카페) 나주 와플 맛집 '와플칸' , 피자와플에 한 번 더 반해버린 곳","* 연락처 : 061-331-4282 * 주소 : 전남 나주시 정렬 사길 7 1,2층 * 영업시간 : 매일 10:00 ~ 21:00 누가 봐도 와플 카페라는 게 느껴지는 외관. 유리에 시럽이... #나주와플 #나주와플칸 #나주와플맛집 #나주가볼만한곳 #나주예쁜카페 #나주데이트 #나주여행 #와플맛집 #나주피자와플 #와플칸피자와플...",2020. 11. 18.
"'20년 걷기정리(50일, 652.75㎞)",25 빛가람치유의숲 전남 나주시 9.08 259.22 https://blog.naver.com/upt10004/221929865965 19 20.05.02 보현산별빛누리길 경북... 24 1박2일 여행 12.74 596.31 https://blog.naver.com/upt10004/222127919959 45 20.11.08 이청준&한승원 문학길 전남 장흥군 22.55 618.86...,2020. 12. 31.
나주_ 노안집_나주 곰탕,"이 주변에 곰탕집이 진짜 엄청나게 많다 그래서 후기보고 고르고 골라서 간 노안집 후기 :) 주소는 전남 나주시 금성관길 1-3 영업 시간은 7:00 -21:00 일단 들어가면 사람이 진쫘 많아요 와,,, 곰탕 먹으러 사람이 이만큼 오는구나 싶을 정도? 여행을 시작하기 앞서 아침 식사하러 갔다 역시 곰탕은...",2020. 8. 23.
"(나주,곰탕 맛집) 나주곰탕 노안집","위치 전남 나주시 금성관길 1-3 영업시간 매일 07:00 - 21:00 월요일 휴무 둘째주, 넷째주 안녕하세요 :-) 오늘은 되게 오랜만에 카페가 아닌 맛집... 전라도 여행 계획중이시라면 나주에 들러서 곰탕한그릇 어떠세요?? 배따뜻하게 채우고 아이스아메리카노로 입가심하며 블로그 포스팅하는 이순간에 넘...",2020. 5. 9.
#수중국정통아로마에서 지대로 몸 풀고 왔어요~ #나주마사지,마사지는 평소에는 잘 받지 못하고 꼭 해외로 여행 가면 1일 1마사지를 하곤 하는데... 해외에서 받던 마사지와는 비교도 안되더라고요~ 조근조근... 신랑이 또 나주로 출장 간다면 한 번 더 따라와서 같이 받고 싶네요~ 수중국정통아로마 전남 나주시 그린로 361 그랜드타워4층 0507-1483-0134,2020. 9. 3.
"나주 가볼만한곳, 광주 근교 나들이는 남평 드들강 어때?","나주 남평 드들강 솔밭유원지 이용 주의사항 주소 : 전남 나주시 남평읍 남석리 주차 가능 : 주차장은 넓지만 주말에는 일찍 방문하시는 게 좋아요. 차로 3분만 가면 아파트 단지가 있어서 큰 마트, 치킨집, 중국집을 만날 수 있어요. 근처 관광지 : 산림자원연구소, 나주 남평역(사진찍기 좋은 간이역)...",2020. 5. 29.
화사한 봄의 정취를 느끼며 라운딩 즐겨보세요. 유명한 2색골프 조합/ 전남골프추천,"요즘 날씨가 하루가 다르게 따뜻해지고 있죠~ 더 더워지기전에 남쪽에 위치한 최고의 컨디션을 자랑하는 해피니스cc+화순cc 2색골프 여행... # 해피니스cc 해피니스cc 는 전라남도 나주시에 위치한 골프장으로 휴먼코스, 해피코스, 힐링코스, 하트코스 총 4가지 코스로 이루어진 회원제 18홀 / 대중제...",2021. 4. 11.
나주카페) 뷰와 조명맛집 유딜라이트(U:DELIGHT),"* 연락처 : 0507-1358-3432 * 주소 : 나주시 남평읍 강변1길 36 U:DELIGHT * 영업시간 : 매일 10:30 ~ 22:00 나주에 또 가고싶었던 또 다른 카페, 유딜라이트에... 여기까지 #나주 #나주맛집 #나주카페 #나주유딜라이트 #유딜라이트 #나주가볼만한곳 #전남여행 #목포카페 #광주카페 #광주근교카페 #나주데이트...",2020. 9. 25.
나주) 더브리즈 솔직후기 나주음식점/나주맛집/영산강근처맛집/영산강맛집/나주여행...,"위치는 전남 나주시 선창길 11 1층 1층은 베트남음식점, 2층은 카페로 운영한다고해요! 저희는 식사하면서 너무 실망스러워 식사만 하고 서둘러 귀가했답니다(˘̩̩̩ε˘̩ƪ) 생각보다 꽤 건물이 크더라구요 ◡̈ 코로나만 아니였어도 사람이 몰려 여기로 많이들 찾아 오시나봐요~ 영산강이 바로...",2020. 3. 29.
광주근교나들이 영산강 유채꽃 점심은 나주품장. 장어의 효능,"다음에 또 몸보신하고 싶을 때, 나주품장장어로 GO GO 061-334-1300 전남 나주시 노안면 건재로 524-11 브레이크 타임 평일 15:00~17:00 유용한 정보였으면 댓글, 서로 이웃 추가 #광주근교나들이 #유채꽃 #영산강유채꽃 #영산강 #나주유채꽃 #장어효능 #장어맛집 #나주맛집 #나주품장 #품장장어 #나주품장장어...",2020. 4. 27.
나주 무인텔 숲무인텔 알차고 고급스러운곳 여기,무인텔 숲 무인텔 영상으로 한번 보시구요 위치랑 예약정보는 아래에서 참고 하세요 ㅎㅎ 나주 혁신도시에서 3분거리인 나주 숲무인텔 위치는 지도로 보시고 전남 나주시 금천면 금영로 744 061-338-8500 예약 필수 시설 알차고 좋은 나주 무인텔 나주 숲무인텔 나주 혁신도시 나주 여행엔 참고 하세요 ㅎㄹ,2020. 8. 26.
"나주치킨맛집, 오늘도 닭",나주치킨맛집 오늘도 닭 위치:전남 나주시 남평읍 강변2길 21 108호(전남 나주시 남평읍 동사리 359-1) 매일 12:30 - 01:00 초이스메뉴: 후라이드 치킨(16.0)... 나주여행 #서이추 #서이추환영 #서이추추천 #일상 #일상이야기 #일상기록 #일상블로그 #먹스타그램 #맛스타그램 #여행스타그램광주맛집 #광주밥집...,2020. 6. 30.
"(광주근교 맛집) 나주혁신도시 까페, 솔레이유 SOLEIL (나주마한농원)","주소 : 전남 나주시 도민길7 전화번호 : 0507-1382-0722 영업시간 : 매일 11:00 - 22:00 (21:30) 주차장 : 까페 앞 도로 노란선 말고, 하얀선에 주차가능... 가격도 알맞아서 좋은 까페예요. 주말에 광주근교로 여행오시거나, 나주에 사시는분들이 오시면 좋을까페입니다. 감사합니다.",2020. 3. 19.
"나주혁신도시카페, 비스터",나주혁신도시카페 비스터 위치:전남 나주시 정보화길 50 상가 1층(전남 나주시 빛가람동 235-3) 매일 09:00 - 22:00 초이스메뉴: 뜨아(4.5) 아아(4.5)... 맛스타그램 #여행스타그램광주맛집 #광주밥집 #광주카페 #광주핫플 #광주데이트 #광주데이트코스추천 #먹스타그램 #맛스타그램 #여행스타그램 #광주야미...,2020. 6. 14.
[나주] 산림자원연구소,2020.01.19 윤뜰에서 가볍게 브런치를 먹고 이제 산책하러 산림자원연구소로 이동했어요~ 주소 : 전남 나주시 산포면 산제리 산23-7 전화번호 : 061... ¸♡ 좋아요와 댓글은 힘이 됩니다 ❤️ <빠른 여행정보> #나주 #나주여행 #나주산림자원연구소 #나주가볼만한곳 #산림자원연구소...,2020. 6. 23.
2021년 4월 1주차 사진전시 일정 (3/31~4/6),"/ (제주야생화 주최) [ 138 ] 2021 광주전남 생태·환경보도 사진전 / 나주동신대학교한방병원 1층 로비(전남 나주시 교육길 14)... / [ 91 ] Bye 코로나, Hi 추억여행 / 공무원연금공단 본부 GEPS-라운지(제주도 서귀포시 서호중앙로 63 공무원연금공단) / 2021.03.22....",2021. 3. 18.
"빛가람동카페, 스테이케이션",빛가람동카페 스테이케이션 위치:전남 나주시 빛가람동 159-5 1층 매일 10:30 - 00:00/ 월요일 휴무 일요일 10:30 - 20:00 초이스메뉴:아메리카노(4.5)... 맛스타그램 #여행스타그램 #광주맛집 #광주밥집 #광주카페 #광주핫플 #광주데이트 #광주데이트코스추천 #먹스타그램 #맛스타그램 #여행스타그램...,2020. 10. 10.
6. 뷰 좋은 나주 카페/에비뉴449(Avenue 449),나주에 카페 새로생겼다길래 출동했습니다 ㅋㅋㅋ 에비뉴 449 주소/ 전남 나주시 남평읍 지석로 449 주차/ 주차장 엄청 넓어요 드들강유원지... ㅎㅎ #나주카페 #드들강카페 #광주근교카페 #광주카페 #카페추천 #광주맛집 #나주맛집 #나주돈까스 #광주돈까스 #일상블로그 #나주여행 #서이추환영...,2020. 8. 20.
[나주 카페/나주 혁신도시 카페] 러스틱,카페 러스틱 주소 전라남도 나주시 도민길 23-20 러스틱 시간 평일 09:30-22:00 Last Order 21:30 / 토요일 11:00-20:00 / 일요일 휴무 전화 070.8845.0426 나주... 나주드라이브카페로 추천해용 #전남카페 #나주카페 #나주드라이브 #전남여행 #나주 #빛가람동카페 #나주혁신도시카페 #나주맛집 #전남맛집...,2020. 7. 19.
영등포구(을) 국회의원선거 후보 김민석 - [코로나 19 긴급 생활지원을 요청하는...,"수입도, 월급도, 급식도 차단되어 한계상황을 맞고 있는 중소기업, 영세소상공인, 자영업자, 프리랜서, 강사, 교육·돌봄·여행 종사자, 비정규... 위원장/전남나주시화순군) ·이상호(전 민주당 전국청년위원장/부산사하구을) ·진성준(전 서울시 정무부시장/서울강서구을) ·허대만(전 행정안전부장관...",2020. 3. 5.
"나주 아구찜,나주 혁신도시 맛집, 진미아구찜",나주아구찜 진미아구찜 위치:전남 나주시 금성길 65-2(전남 나주시 성북동 70-1) 매일 11:30 - 21:00 매월 둘째/넷째주 월요일 휴무 초이스메뉴... 맛스타그램 #여행스타그램광주맛집 #광주밥집 #광주카페 #광주핫플 #광주데이트 #광주데이트코스추천 #먹스타그램 #맛스타그램 #여행스타그램...,2020. 7. 6.
"전남여성가족재단, “전남지역 직장과 마을 내 성평등 워라밸 소모임·공동체...",전남개발공사 학습 소모임‘TOW: Team Of WLB(무안군)’은 워라밸에 대한 직원들의 인식 개선과 건강하고 생동감 넘치는 직장문화를 만들기 위한 공동연구 및 학습활동과‘워라밸 교과서 만들기’를 통해 직장 내 워라밸 바른 언어문화의 확산을 위해 노력하였다. 나주시 한전 직원들의 소모임...,2020. 12. 8.
2021년 4월 2주차 사진전시 일정 (4/7~4/13),/ [ 127 ] 2021 아미의 작가들: 작품 속 시공간으로 여행 떠나볼까 / 아미미술관(충남 당진시 순성면 남부로 753-4) / 2021.04.01.... / (제주야생화 주최) [ 114 ] 2021 광주전남 생태·환경보도 사진전 / 나주동신대학교한방병원 1층 로비(전남 나주시 교육길 14) / 2021....,2021. 3. 24.
나주곰탕 본진을 가다,나주에 가시면 곰탕거리 가셔서 곰탕 한사발하세요 가격은 곰탕 9천원 수육 2만원 음료 서비스입니다 #나주곰탕#나주맛집#나주시맛집#곰탕맛집#나주여행#나주곰탕사매기#수육#곰탕본진#곰탕본가#나주혁신도시맛집#한국전력맛집#한국전력#전남맛집#전남여행#전라남도맛집#행복#맛집여행#나주혁신도시,2020. 6. 8.
인생국밥리스트 중 손꼽히는 나주곰탕하얀집 수육곰탕,"주소 : 전남 나주시 금성관길 6-1 영업시간 : 매일 08:00 - 20:00 첫째,셋째 월요일 휴무 전화번호 : 061- 333 - 4292 공영주차장 주차가능(무료) , TV출연 다수... 전라남도 여행 겸 겸사겸사 다시 찾아왔어요 이미 메뉴는 머릿속에 정해두고와서 메뉴판도 따로 보지않고 수육곰탕으로 주문했어요 곰탕 9,000원...",2021. 7. 6.
"조류독감, 조류인플루엔자 AI 대유행 우려, 영주시 차단방역 총력전!","음성과 전남 나주에서 의심되는 개체가 발견이 되면서 방역당국은 비상이 걸렸다고 해요. 폐사율이 급격히 치솟아 의심신고가 들어왔다는 음성군 메추리 농장은 이미 국내에서 퍼지고 있는 H5N8형 AI 항원이 검출됐었다고 하는데, 고병원성 여부를 검사 중이며, 나주시의 오리농장도 H5형 항원이...",2020. 12. 9.
"[나주 신상카페]넉넉 Knock Knock, 광주 근교 나주혁신도시 애견동반가능카페","전남 나주시 그린로 317-7 매일 11:00-23:00 전화번호 ***-****-**** 안녕하세요 잇님들 :-) 예~전에 다녀온 나주혁신도시 카페인데요,,ㅎㅎ 귀차니즘이... 의외라서 깜짝 입구뿐만이 아니라 옆면전체가 통유리인데 뷰가 공원뷰라서 진짜 여행온듯 끝내주더라구요 푸릇푸릇 제가 좋아하는 초록뷰 독특한...",2020. 9. 18.
2021년 4월 4주차 사진전시 일정 (4/21~4/27),/ [ 82 ] 2021 아미의 작가들: 작품 속 시공간으로 여행 떠나볼까 / 아미미술관(충남 당진시 순성면 남부로 753-4) / 2021.04.01. ~ 2021.... / (제주야생화 주최) [ 59 ] 2021 광주전남 생태·환경보도 사진전 / 나주동신대학교한방병원 1층 로비(전남 나주시 교육길 14)...,2021. 4. 7.
"나주 조명맛집 예쁜 카페, 유딜라이트",안녕하세요~ 도어민족 입니다^^ 오늘 포스팅은~~ 나주 남평에 있는 대형 카페 '유딜라이트(U:DELIGHT)'를 소개해드릴게요^^ 주소: 전남 나주시 남평읍... 파인애플 때문인지 휴양지 온 것 같은 느낌이에요 ㅎㅎㅎ 어디 멀리 해외여행도 못가는데 ㅠㅠ 이걸로라도 기분 냈어요 ㅎㅎㅎ 오렌지슬라이스와 그...,2020. 8. 1.
전남수영장펜션 나주 가볼만한곳 나주 중흥 골드스파&리조트,"시댁이 전라도여서 나주로 여행을 가곤 합니다. 나주하면 유명한 나주곰탕거리, 홍어,나주영상테마파크 그리고 중흥 골드스파&리조트 포우맘은... 그래도 날씨는 춥다^^ & 나주 중흥골드스파&리조트 주소:전라남도 나주시 다도면 나주호로 588-184 전화 061-1688-5200 #전남수영장펜션 #전남펜션...",2020. 6. 2.
[일상솔직후기] 나주 곰탕 맛집 하얀집(★★★★★),"진도로 떠난 장인어른 환갑여행을 다녀오던길에 장인어른의 고향인 나주를 들리게 되었고 처조부모님 산소에도 들러 앞으로 잘살게 해달라고... 주소: 전남 나주시 금성관길 6-1 (지번주소:나주시 중앙동 48-17) 전화번호: 061-333-4292 영업시간: 매일 08:00~21:00 첫째, 셋째 월요일 휴무 주차: 가능...",2020. 7. 21.
"나주와플맛집, 와플칸","나주와플맛집 와플칸 위치: 전남 나주시 정렬사길 7 1,2층(전남 나주시 대호동 744-3) 매일 10:00 - 21:00 초이스메뉴: 아이스아메리카노(2.5) 아메리카노... 맛스타그램 #여행스타그램광주맛집 #광주밥집 #광주카페 #광주핫플 #광주데이트 #광주데이트코스추천 #먹스타그램 #맛스타그램 #여행스타그램...",2020. 7. 6.
대전비디오테이프변환 /소중한추억 한번 여행시작,비디오테이프를 소중한추억을 변환을하섰서 한번 과거로 여행 해보세요 . usb나 네이버 클라우드로 하시면 영구적으로 볼수가 있습니다 . 전에는... 순천시/나주시/광양/담양군/곡성군/구례군/고흥군/보성군/화순군/장흥군/강진군/해남군 /영암군/무안군/함평군/영광군/ 동대구 /대구 /서산/당진...,2021. 9. 16.
나주맛집) 대통령도 다녀간 60년전통 나주곰탕 원조 '남평할매집',☑️위치: 전남 나주시 금성관길 1-1 ☑️영업시간: 매일 08:00 - 21:00 ☑️전화번호: 061)334-4682 나주 남평할매집 외부모습! 60년전통의 오래된 맛집입니다 ㅎㅎ 티비에도 많이 방영되구 이미 유명한 곳! 나주 남평할매집 내부모습! 넓어요 테이블수도 많구 좌식 입식 테이블 다 있으니 편하신곳으로...,2020. 5. 7.
200721(엔커피),엔커피(전남 나주시 학생운동길 11) 여행을 가야겠다 마음 먹고 갈 때는 시간 하나하나 예상해서 가지만 이번에는 아니기에 카페 하나만 들렸다. 핸드드립 카페인데 작고 아늑한 가게였다. 특히 바처럼 돼있는 카운터가 마음에 든다. 구석구석 찍고 싶었는데 다른 손님들이 와서 조용히 커피 쪼록하고...,2020. 7. 21.
여행 1. 은퇴부부의 1차 여행(계획 짜기),"진도군 나주시 목포시 무안군 순천시 신안군 영암군 화순군 전라남도 북부지역 – 광주광역시 곡성군 구례군 담양군 함평군 영광군 장성군 *참고 – 전남 자연휴양림 목록 (국립)낙안민속–순천, 방장산–장성, 진도, 천관산–장흥 (공립)광양백운산, 흑석산–해남...",2021. 9. 15.
[나주곰탕하얀집] 전라도 먹방투어 start!,"나주곰탕하얀집 전남 나주시 금성관길 6-1 월요일 첫째주, 셋째주 휴무 / 평일 08:00-21:00 주차 - 맞은편 공영주차장 포장가능 tv다수출연 어쩌다... 여튼 고기도 부드럽고 국물도 기가 막히고 너무 맛있었어요 참고로 저희는 전라도 여행을 마칠때 머가 제일 맛있었어? 라고 서로에게 물어봤을때...",2020. 1. 13.
과자로 시작한 40년 나눔과 봉사..나주 오종순씨,""" 전남 나주시가 올해 처음으로 제정한 '숨은 의인'에 선정된 오종순(67)씨가 지역사회와 이웃에 나눔과 봉사활동을 시작한 것은 40여 년 전인 1978년... ""중학교 2학년으로 기억하는데 돈이 없어 속리산 수학여행을 못 가고 학교에 나와 화장실 청소를 했다""는 오씨는 ""이것이 중·고교에 수학 여행비를...",2020. 12. 12.
"나주혁신도시 대방엘리움1차 아파트 소개, 빛가람동 대형평수아파트(42형)...",☆대방엘리움1차 아파트☆ 주소: 전남 나주시 빛가람동 378(중야1길37) 세대수:414세대(총6개동) 준공년월:2018년5월 주차대수:717대(세대당:1.73대)... 한동안 지상에 주차장 없는 아파트가 인기였다면 지금은 가족과 함께 여행하는 일들이 많아지다 보니 캐라반을 보유하시는 분들이 많아서...,2021. 5. 24.
나주맛집/하얀집/고창청보리밭/고창맛집/금단양만,"하얀집 061-333-4292 전남 나주시 금성관길 6-1 매일 08:00 - 21:00첫째, 셋째 월요일 휴무 나주는 유명한게 뭐죠???? 나주하면 바로바로 나주 곰탕이쥬... 두껍고 순삭했지뭐에요 하루일정에 거의 먹는게 반이지만^^알찬휴가였어요 고생한오빠덕분에❤️하핫 #나주여행 #고창여행 가시면 꼭 들러보세용",2020. 8. 6.
[나주] 나주 가볼만한곳 산림자원연구소 치유의 숲으로,위치 : 전남 나주시 산포면 산제리 산23-7 2.영업시간 : - 3월~10월 09:00 - 18:00 (입장시간 17시까지) - 11월~2월 09:00 - 17:00 (입장시간 16시까지) 3. 연락처... 산림자원연구소 #나주산림자원연구소 #전남가볼만한곳 #메타세콰이어길 #나주메타세콰이어길 #나주나들이 #나주데이트 #나주여행,2020. 7. 2.
