header,contents,date
부부여행 차박여행! 전북 고창군 동호 해수욕장,"차박여행! 시작~~ 7월 끝을 잡고 있던 마지막 주 전북 고창군 해리면 동호해수욕장 해수욕장 진입도로 길목마다 발열 검역소 설치 드라이브 스루 방식으로 발열검사 후 명부 작성은 필수 주차장에 차를 세우고 차에서 내려 보고 깜~짝 명사십리 동호해수욕장의 규모며 깔끔하게 조성된 모습에 ""와~~~우!...",2020. 8. 9.
[지역N문화 테마여행] 전북 고창군 여행코스 :: 천의 얼굴 고창,"전북 고창군 여행코스 천의 얼굴 고창 천의 얼굴 고창 전북 고창군 *출처 : 고창문화관광 지역N문화 테마여행! 우리나라 고인돌 최대 밀집지역으로 잘 알려진 고창으로 떠나봅니다. 고창의 역사는 청동기 시대인 2천 년 전부터 시작되는데요. 삼국시대, 조선, 근대 유물까지 모두 보유한...",2020. 10. 27.
"[전북 고창군|여행2일차-10] 상하농원, 추천 많이 하는 여행지~ 저도 가봤어요 : )",여행지가 된 상하농원에 도착했습니다. 주차장은 넓긴 한데 방문객이 많아서 살짝 부족해 보였습니다. 주차 후 상하농원 입구로 가는 길에 고창군... 그냥 그저 그런 저수지인 줄만 알았더니 아니었습니다~ 전북 설화 강선달 이야기는 전라북도 공식 블로그에도 소개하고 있네요! 저수지 옆을...,2021. 3. 25.
전북 고창군 선운사 꽃무릇 (2021.9.19),"전북 고창군 선운사의 꽃무릇 ▶ 위 치 : 전북 고창군 아산면 삼인리 500 ▶개 요 : 대웅보전은 보물 제290호로 지정되어 있으며 선운사 주변은... ※ 9월중순 꽃무릇 여행지 [행복한여행 블로그] 전남영광군 불갑사 꽃무릇( 2021.9.19.), 전남 함평군 용천사 꽃무릇 (2021.9.19)참조 ▶입장료 : 아래사진...",2021. 10. 1.
[고창군여행]전북천리길/볼거리가 즐거운 운곡습지생태길2코스 탐방,[고창군여행] 전북천리길 / 볼거리가 즐거운 운곡습지생태길2코스 탐방 5월22일(토) 주말에 고창군 전북천리길해설사님과 친구내와 함께 날씨는 화창하고 찔레꽃 향기에 흠뻑 젖어 신록 계절 5월에 운곡습지생태길2코스/전북천리길 즐거운 탐방하였네요. 전라도 정도 천년 기념으로 전라북도...,2021. 5. 24.
주말여행 전북 고창군 상하농원 으로 고고씽~,#전북 #고창군 #전북고창군 #상하농원 #젓소 #염소 #토끼 #주말데이트 #동물체험 #유기농카페 #사진맛집 #우유주기체험 #꿀잼 안녕하세요 여러분 네이버 인플루언서 로운 이에요~! 오늘은 저에 일상 여행을 소소하게 남겨볼까 합니다~^^ 항상 주 5일 열심히 일하고 주말이 되면 한번씩 여자친구와 함께...,2021. 3. 15.
선운사 꽃무릇/고창군/전북/국내여행/사진/연휴기간중/꽃나들이/방역수칙...,"지금은 감나무에 감이 주렁주렁 익어가고 대웅전 들어가 기도드리고 공양미도 올려보는 신랑~~ 선운사/불갑사/용천사의 꽃무릇이 울나라 최대군락지라 하니 낼은 영광군 ""불갑사""에 가보련다. #9월19일#선운사#꽃무릇#고창군#전북#여행#사진#국내여행#전라도",2021. 9. 26.
{{ 고창 구시포해수욕장 }} 전북 고창군 노을이 아름다운 드라이브 코스 장소 추천,마음으로 여행을 오는것도 좋은것 같다. 구시포를 오면 꼭 가는 코스가 있다. 아름다운 고창 명사십리 해변도로를 달려 동호해수욕장을 들렸다고 집으로 돌아간다. 다음 코스로 출발~~~ 오늘 하루 와이프가 행복해하니 나도 행복하다. ■ 구시포해수욕장 위치 : 고창군 구시포해수욕장 주소 : 전북...,2021. 10. 3.
고창군 도보여행 스탬프 투어 전북천리길 기념품,고창군 도보여행 스탬프 투어 전북천리길 기념품 고창군 전북천리길은 제1길 운곡습지생태길 1코스 제2길 운곡습지생태길 2코스 제3길 고창읍성길로 3개의 코스입니다. 운곡습지생태길은 1코스와 2코스가 중복되는 곳이 있습니다. 1코스 시작점인 운곡습지탐방안내소에서 출발하여...,2021. 5. 13.
"고창군 전북트래블마트 참가.. ""힐링·치유관광지 고창 적극 홍보""","이번 전북트래블마트에는 전북도를 비롯한 도내 14개 시·군과 관광 관련업계, 한국관광공사가 참여하였고, 글로벌청년 스마트관광 교류회와 인플루언서 SNS 활동 등 다양한 프로그램을 진행했다고 합니다. 고창군은 국내외 여행업계, 마이스업계, 관광벤처, 인플루언서 등 100여명의 참가자들에게...",2020. 11. 20.
"여행모먼트003. 전북 고창군 동호해수욕장 : 캠핑 ! >""<","앞으로의 여행, 캠핑을 위해 남자친구가 직접 만든 나무박스 흐흐흐흐흐흐흐흐 (깨알 목수남친 자랑ㅋㅋㅋㅋㅋ) 멋있다.....♥ 이거 외 않되? (1)... 소중히 기록해야지 ㅎ0ㅎ! 다음에 다시 가고 싶은 동호 해수욕장. 끝! 뿅! ▽주소▽ *고창 동호해수욕장 주차장 > 전북 고창군 해리면 명사십리로 910",2020. 9. 1.
전북 고창군 해리면 동호리 동호해수욕장 - 차박여행,"전북 고창군 해리면 동호리에 동호해수욕장이 있습니다. 갑작스럽게 차박여행을 하러 갑니다. 도착하였습니다. 비가 엄청 내립니다. 급하게 타프를 설치합니다. 등도 밝힙니다. 비에 젖은 관계로 몸을 녹이기 위하여, 주전자에 물을 끓여봅니다. 캠핑카도 있습니다. 흐르는 물의 방향을 바꾸고자...",2020. 9. 15.
[전라북도/고창군] 학원관광농원고창청보리밭 / 고창 청보리밭 / 전북여행 / 고창 여행...,"생각해봅니다. 한반도 첫 수도, 고창 참, 대한민국은 어디를 가도 수도, 수도 타령이네. 양산인지 우산인지 쓰고 걸어가는 중년의 두 남녀를 보며...날씨 참 좋은 고창 보리밭에서 사진, 추억 끝! 학원관광농원고창청보리밭 전라북도 고창군 공음면 예전리 469-1",2021. 6. 19.
"전북고창군 고창읍성, 3월 봄날을 걸었어요","여행을 다니면서 잘 몰랐던 것을 이렇게 알게 되고 우리 것을 돌아보는 일 참 좋습니다. 드디어 매표소에 도착했어요. 고창 읍성 관람료를 내고... 자리에 고창군 소나무를 심었다고 해요 (전북일보, 2021. 02.04) .과거를 청산하고 새 역사를 시작하는 지점에 고창의 소나무가 심겨진 것이지요. 그래서...",2021. 3. 15.
"[전북 고창군|여행2일차-11] 구시포해수욕장과 구시포항, 멋진 일몰을 만끽하다! (일몰...","구시포항, 구시포 해수욕장 주소 전북 고창군 상하면 자룡리 구시포해수욕장의 이름이 낯설지 않은 건, 바로 내가 좋아하는 유해진 배우가 나오는 삼시세끼 고창 편을 보았기 때문입니다. 혹시 기억나시나요? 차승원 배우가 구시포해수욕장에서 동죽을 양동이 한가득 캤던 장면 말입니다. 와~ 저렇게...",2021. 3. 29.
무장읍성 - 전북고창군 무장면 여행,"무장읍성 전라북도 고창군 무장면에 있는 조선전기 에 축조된 성곽.읍성. 사적.내용사적 제346호. 지정면적 182,596㎡. 고려시대까지 무송(茂松)과 장사(長沙)의 두 고을이었던 것을 효과적인 왜구의 방비를 위하여 1417년(태종 17) 합하여 두 고을 첫자를 떼어 무장이라 하고 성과 관아를 새로...",2020. 11. 4.
"5월 국내여행지 추천 전북 고창군, 청보리밭 풍천장어 복분자","5월 국내여행지 추천 전북 고창군, 청보리밭 풍천장어 복분자 어느덧 5월이 다가왔다. 웬만한 봄꽃들이 3~4월 절정을 이루다가 사라진, 봄이 완전 완연하게 찾아와 여름이 성큼 다가온다는 느낌이 드는 5월. 가정의 달이라고 하여 행사도 많고 근로자의 날, 어린이날, 석가탄신일 등 쉬는 날도 많은...",2021. 5. 1.
10th 전북 고창군 해리면 동호리 동호해수욕장|고창 차박명소|고창 일몰 명소|고창 평일...,오늘 소개할 차박장소는 전북 고창군 해리면 동호리 동호 해수욕장 입니다. 집에서 저녁6시 40분 출발해야 약2시간 걸려 늦은 저녁에 도착... 시설 #아이캠퍼스카이캠프#전북고창동호해수욕장차박명소#차박좋아하는아이들#전북고창일몰명소#아이들과함께떠나는차박캠핑여행#렉스턴W차박...,2020. 10. 15.
"[전북고창군] 고창 상하농원 : 자연과 함께 즐기는 곳, 아이의 체험거리가 많은 곳-1일차...","#전북고창군 #고창갈만한곳 #고창상하농원 #상하농원 #매일유업 #아이와함께갈만한곳 상하농원은 2009년에 프로젝트 착수하여, 2016년에 개관을 했고 2020년에 전체 완공을 앞두고 있습니다. 식당과 체험관, 공방은 이미 개관을 했고, 41객실의 호텔도 오픈했습니다. 현재 수영장과 스파를 건축중에...",2020. 4. 26.
전북 고창군 학원농장 청보리밭,연초록 봄의 흔들림 전북 고창군 학원농장 청보리밭 끝이 보이지 않는 광활한 구릉에 연초록 바람이 춤을 춘다. 보리밭 사이를 거니는 사람도... _글 일멋 / 사진 여행촌(테마여행 전문)2012 ◆찾아가는 길 ① 서해안고속도로 고창 IC- 무장면 방면 (고창 시가지 반대 방향) ② 호남고속도로 정읍 I.C...,2021. 2. 7.
생생정보 호야농장-성내장어셀프-라벤더가든-맹종죽 숲-트리클라이밍<전북 고창군>,[2TV 생생정보 1347회] 방송일 2021.07.01(목) 소행정 박광현의 아.재.여.행 (아주 재밌는 여행) <전라북도 고창> 미네랄이 풍부한 황토 서해안의 해풍 당도가 높고 향이 진한 '고창 복분자' #호야농장 고창군 아산면 녹두로 908-8 ☎ o10-9000-9926 https://smartstore.naver.com/hoya_farmer...,2021. 7. 1.
고창cc 코스 공략법 비치코스 블루코스/전북 고창군,고창cc는 풍천장어로 유명한 고장이며 살기좋은 고창군 바닷가 갯벌을 간척해 만든 27홀의 골프클럽으로 비치코스 블루코스 스카이코스로... 블루코스 6번홀. 블루코스 7번홀. 블루코스 8번홀. 블루코스 9번홀. #골프라운드 #골프 #골프장 #골프여행 #골프웨어 #골프코스 #골프라운딩 #골프클럽,2020. 5. 27.
"고창군, '대한민국 국제 관광박람회' 참가해 홍보관 운영.. 큰 호응 #복지TV 전북방송","큰 호응 (출처=전북 고창군) 전북 고창군이 지난 9월 9일부터 12일 나흘간 일산 킨텍스 제2전시장에서 ‘제6회 대한민국 국제 관광박람회’에... 특히, 고창군 홍보 동영상 상영, 관광 책자, 지도, 기념품을 배포하고, 문화관광해설사와 함께하는 고창군 역사문화 여행 상담을 진행하여...",2021. 9. 13.
"전북 웰니스 관광.고창군, ‘체험·힐링’체류형 관광도시로 뜬다","전북 웰니스 관광 고창군, ‘체험·힐링’체류형 관광도시로 뜬다 고창군이 변화하는 관광환경을 선도하는 다각적인 관광정책과 함께 관광객이... 상하농원은 개장 첫 해(2016년) 방문객은 약 1만 명이었으나 지난해 방문객은 20만명 이상을 기록, 코로나19 여파로 해외여행이 감소한 데 따른...",2021. 2. 27.
#여행정보❣ 전북 고창군 가을벗꽃,"#여행정보❣ 전북 고창군 ""학원농장""에 핀""가을벗꽃"" #좋은글 #국내가볼만한곳 #맛집 #먹방 #소확행 #백신 #항체 #힐링 #좋은생각 #고창#벗꽃#여행#정보#힐링",2020. 10. 16.
[전북 고창군][여행3일차-2] 선운사에서 가을 정취 느껴보세요./고창 가볼 만한 곳...,"있는 여행지라 여전히 사람들은 많습니다. 주차장으로 가는 길에, 이날 가장 색이 아름다웠던 단풍나무를 만났습니다. 사진으로도 느껴지듯이 맑고 붉은색을 띠고 있었어요. 색이 너무 예뻐서 사진을 찍으려 기다리는 사람들도 많더군요. 이곳에 비치된 고창군 관광안내도를 마지막으로 선운사...",2021. 4. 9.
전북 고창군 비디오폰 9대+로비폰1+CCTV 대 시공,전라북도 고창군에 신축 오피스텔에 비디오폰 9대+로비폰 1대+cctv 1대 시공 하였습니다. 입선작업이 끝난뒤에 투입되어 선들의 경로를 확인후... 소방폐쇄장치 #광주코콤 #광주코멕스 #광주게이트맨 #광주삼성도어락 #전남로비폰 #전남비디오폰 #광주홈넷트워크 #고창비디오폰 #고창여행,2020. 4. 9.
고창 신재효고택 - 전북 고창군 고창읍여행,"선생을 기리기 위해 이 고택 뒤에는 동리국악당을 개관, 고창군에서 운영하고 있으며 고택을 한바퀴 돌아보는 동안 국악당에서 틀어놓은 판소리가... 자(字)는 백원(百源), 호(號)는 동리(桐里)·호장(戶長)이고 본관은 평산(平山)이며 조선 전라도 고창현(지금의 대한민국 전라북도 고창군) 출생이다....",2020. 11. 4.
광주근교 산책 데이트 하기 좋은 - 전북 고창군 고창읍성,많은 소통을 하기 위해서 노력해볼게요~ 그럼 고창읍성 포스팅은 여기까지!! #고창읍성 #고창 #고창맛집 #광주맛집 #광주 #고창가볼만한곳 #고창카페 #전남 #전북 #전라남도 #전라북도 #상무지구 #금호지구 #풍암지구 #일상 #소통 #사랑 #공감 #상무지구맛집 #상무지구카페 #산책 #힐링 #휴가 #행복 #여행,2021. 3. 18.
전북 고창군 노인전동스쿠터 나드리 110 납품 후기...,전북 고창으로 납품 다녀왔습니다. 제품에 대해 몇 마디 묻지 않으시고 쿨하게 믿고 주문해 주셔서 아침 일찍 출발을 했습니다. 아직 단풍이 완전히 들진 않았지만 가을 느낌을 물신 느끼면서 납품가는 길이 아니라 여행 가는 기분으로 다녀왔습니다. 미당 서정주 문학관이랑 생가가 있는...,2020. 11. 6.
[전북 고창군 상하면 명진장어참숯구이]구워주는 장어집,올린 스마트해진 석 씨와 함께 1박 2일 고창 여행 (21.08.07~21.08.08) 첫 스타트는 장어집 부시기!! 이리저리 찾아보다가 우리 영양사 선생님께서 강추해 주신 곳으로 선택!! 여기는 딱히 메뉴판이 없고 그냥 이렇게 적혀있다. (계산할 때 즈음 찍음) 명진장어참숯구이 메뉴판 21.08.07 기준 우리는 여성...,2021. 8. 10.
"[고창·영광 blog 뉴스] 고창군·전북대학교 평생교육원 연계, 평생학습 아카데미...","운영 고창군이 전북대 평생교육원과 연계한 평생학습 아카데미 수강생을 모집한다고 밝혔다. 수강 프로그램은 총 12개 과정(건설기계운전(굴삭기, 지게차), 정원만들기와 그린인테리어, 꽃차 소믈리에, 드론 자격취득, 심리상담(1급), 목공(소목)교실, 커피바리스타, 붓길따라 마음여행, 라인...",2021. 3. 19.
"전라북도로 떠나는 여행 - 산, 들, 강, 바다가 있는 '고창군'편","'2023 전북 아태 마스터스대회가 열리는 전라북도로 떠나는 여행' 10번째 도시 '고창군'을 소개합니다~! 2023 아태 마스터스대회의 정식종목인 ""골프"", ""배드민턴"",""탁구"" 경기가 열릴 예정인 고창군은 산과 들과 강 그리고 바다까지, 천혜의 자연환경을 갖춘 관광명소입니다. 의와 예의 고장, 고창...",2021. 5. 20.
"전북 고창군 구시포 해수욕장 ::: 전북 갯벌체험, 물놀이, 여름방학 체험하기 좋은 곳",「바다여행 사이트」에서 혼잡도 검색했는데 양호 물때는 「바다타임」에서 오후 2시경에 만조라고 나와서 부랴부랴 준비하고 나옴 입구에서... 편의점에서 컵라면과 핫바로 때움 근처 식당도 많아요. 휴가철이고 아이들도 방학이라 여행 많이 갈 텐데 마스크 잘 쓰고 건강하게 여름 나자고요~,2021. 7. 24.
"고창군 여행, 마애석불상이 있는 멋진 암자, ""도솔암""","""도솔암"" 전북 고창군 아산면 삼인리 도솔산(兜率山)에 있는 대한불교 조계종 제24교구 본사 선운사의 산내암자이다. 도솔암의 정확한 창건사실은 알... 여행중독입니다!! 이번에 다녀 온 곳은 고창 선운사 부속암자 선운산 자락에 있는 ""도솔암""입니다!! 녹음 짙은 숲길따라 30분 정도 걷다보면 나오는...",2021. 8. 12.
"[전북고창군] 고창 상하농원 : 자연과 함께 즐기는 곳, 아이의 체험거리가 많은 곳-2일차...","#고창상하농원 #청정호텔 #힐링타운 #전북아이들숙박 #전라도아이체험 #전북아이체험 한국 고유의 창호틀이 더 저의 마음을 평화롭게 합니다. 밖을 나가볼까요? 2층에 이런 객실이 20개 있습니다. 3층에 21객실 더 있으니, 총 41객실의 호텔이죠. 1층에 요가&명상존이 있어요. #요가명상존 1층에는 여러...",2020. 5. 1.
[전북 고창군|여행2일차-9] 무장읍성에서 조용한 산책,"입장료 무료, 주차장 없음 #고창가볼만한곳 #언택트여행지 #무장읍성 #고창읍성 겨울이 다가오면 바삐 움직여야 합니다. 해가 일찍 지다 보니 입장... ※ 출처 : 고창군 문화관광 http://www.gochang.go.kr/donghak/index.gochang?menuCd=DOM_000001103004007000 무장읍성의 입구입니다. 왼쪽 입구로 들어가서 오른쪽을...",2021. 3. 21.
영광읍 자전거 여행 (고창군 대산면 몽불사),이 다리 까지가 행정구역상 영광읍 계송리에 속하고 다리 건너편은 전북 고창군 대산면이 됩니다. 다리 끝에 보이시죠?? “다시 만날 영광을!!” ㅋㅋ 이 다리를 지나고 나서부터는 좀 힘든 언덕길이 나옵니다. 대산면 해룡리에 사는 아무개가 변호사에 합격했나 봅니다. 축하 현수막이 걸려...,2021. 5. 10.
[국내여행] 전라북도 고창군 아름다운 삼태마을 숲,"아름다운 숲 삼태마을 강진여행 》 고창여행 하고 대전오기전 들린 전라북도 고창군 삼태마을 숲 삼태마을 전북 고창군 성송면 하고리 http://naver.me/5baPmFx0 마을의 재앙을 막아주는 마을 숲 삼태마을 숲은 마을 옆 하천제방을 따라 왕버들 외에 느티나무, 느릅나무, 소나무 등 거목 12종 99그루가 숲을...",2020. 5. 15.
[주말 가볼만한곳] 문화유산 숨결 느끼는 낭만여행... 고창군,"주민공정여행사 팜팜 김수남 대표, 문화유산 스토리 공모전 수상 전북 고창군의 다양한 문화유산을 접목한 여행프로그램이 최근 문화유산 스토리 공모전에서 대상을 타며 화제를 모으고 있다. 23일 고창군에 따르면 고창군 주민공정여행사 팜팜의 김수남 대표가 ‘2020문화유산...",2020. 9. 24.
전북 고창군 건강식당추천~ 한식뷔페 고창선운사맛집 베리팜가든,고창 베리팜 전국 곳곳을 돌아다니는 것에 그다지 취미가 없었던 나에게는 고작 동네방네이거나 모임을 통해서 여행다니는 것 이외에 특별하게... 전북 고창군 선운사맛집 베리판가든 한식뷔페의 특징과 장점에 대해서 쌀밥과 오색보리밥~ 왜 남다른 것인지 그 이야기가 나와 있었는데 고창쌀의...,2020. 7. 24.
[전북 고창군 상하면 네모의꿈 펜션]조용한 논밭 뷰 맛집,"석 씨와의 고창 여행기 21.08.07(토)~21.08.08(일) (1박2일간) 여행지는 고창으로 결정! 숙소를 고심히 찾아보다가 으로 결정! 11번가에서 최저가 결제 158,790원 남사장님께서 친절하게 맞아주신다! 우리가 선택한 B201블루스카이 논밭 뷰 싱그러워서 좋았다. 불판 이용 시 추가 5,000원 (현장 결제) 안락한...",2021. 8. 14.
"[전북 고창군|여행2일차-12끝] 힐링카운티에서 1박2일 - 홀론 온천, 패밀리 룸 내부...","고창의 가족단위 추천 숙박시설, 힐링카운티 이번 여행의 첫 번째 목표는 증도의 엘도라도리조트에서 1박을 하는 것이었고, 그다음의 목표는... 어쩌다 고창의 여행지를 찾다가 고창의 매력에 흠뻑 빠진 겁니다! 고창은 한 번도 가보지 못한 여행지였는데 볼게 많았고, 규모가 있는 힐링카운티라는...",2021. 4. 1.
"[전북 고창군|여행3일차-1] 클라이밍 장소, 고창 선운사 가는 길에 만난 할매바위...",여행하다 이런 장소를 발견하게 되면 기분이 좋아요. 전혀 예상치 못했는데 선운사를 가려다 이런 곳도 알게 되었네요. 뜻하지 않게 방문했던 고창 아산면의 할매바위였습니다. 이제 다시 원래 가던 길로 가야겠죠? 선운사로 갑니다.,2021. 4. 5.
전북여행 2021 고창 핑크뮬리 축제,"전북여행 소개해 드릴께요^^ 주소: 전북 고창군 부안면 복분자로 307 운영시간: 오전 9시~ 오후 6시 입장료: 5,000원 (대인/소인/단체/경로) 공통사항이며 음료이용권과 음료,디저트이용권 패키지로 구매도 가능해요 36개월 미만은 무료입장이라 저희 아기는 무료입장으로 들어가게 되었어요^^ 입구에서...",2021. 9. 17.
고창 여행 전북 당일치기 읍성 데이트하기 좋은 곳,"고창 여행 전북 당일치기를 하던 고창 읍성 데이트하던 일단 모든 분들은 입구에서 어른 3000원 청소년 2,000원 어린이 1000원의 입장료를 지불해야... 비석의 건립 연대가 조선 중기부터 근대까지 다양한 비석이 모여 있는 곳으로 고창 이곳저곳에 흩어져 있던 것들로 고창현, 고창군과 인연을 맺었던...",2021. 10. 9.
[전북 고창군 공음면]21.08.08일 학원농장 근황,"그런데 청보리밭이 안 보인다. ??? 그런데, 이게 더 이쁘네.. 무슨 꽃일까? 그윽한 꽃들이 주욱 펼쳐져 있다. 이뻐.. 이뻐 ㅎㅎ 같이 여행했던 석씨 사진 찍어주기. 무슨 꽃일까요? 꽃밭? 앞에 놓인 푸르디푸른 도로. 석 씨가 찍어준 나. 바라보기 (feat.설정샷)",2021. 8. 16.
전북 고창 당일치기 여행 : 핑크뮬리 축제중인 꽃객프로젝트,^^ 선운사 꽃무릇이 궁금하시면 클릭 ▼ 고창 꽃객프로젝트 핑크뮬리 축제 전라북도 고창군 부안면 복분자로 307 축제기간) 9/16 ~ 11/7 매일 09:00 ~ 18:00... 전북 고창 사진찍기 좋은 곳 꽃객프로젝트에 가득한 백일홍 전북 고창 당일치기 가을여행 전북 고창 사진찍기 좋은 곳 주변이 산으로 둘러싸여...,2021. 10. 4.
선운사 꽃무릇 .. [전북 고창여행],[전북 고창여행] 선운사 꽃무릇 고창 도솔산 선운사 兜率山 禪雲寺 .. 꽃무릇 피었습니다 ^^ 혹여나 하는 기대감에 선운사를 들렀습니다. 다음 주가... 다음 주 또 오는건 절대 아닐겁니다 ~~ #꽃무릇 #선운사꽃무릇 #선운산생태공원 #9월에피는꽃 전라북도 고창군 아산면 도솔산에 있는 백제시대...,2021. 9. 14.
고창 핑크뮬리 축제 꽃객프로젝트 전북 여행 드라이브,"고창 핑크뮬리 축제 꽃객프로젝트 전북 여행 드라이브 전북 고창군 부안면 복문자로 307 / 매일 09:00~18:00 / 입장료 5,000원 지난 9월 15일 선운사 꽃무릇 구경 나서는 길에 고창 핑크뮬리 축제가 열리는 꽃객프로젝트 정원도 함께 보고 왔어요. 축제 전날 어느 정도 피었나 궁금해서 찾아봤는데요....",2021. 9. 25.
전북 고창 가볼만한곳 상하농원 목장 체험 여행,"고창 가볼만한곳 찾아 여행 다녀오실 분들은 도깨비 촬영지인 보리나라 학원농장의 청보리밭도 같이 다녀오시면 좋아요. 지금은 저 초록 초록한... 위치, 주차 주소: 전북 고창군 상하면 자룡리 산1-2 당근 먹이 파는 곳과 송아지 우유주기 체험을 할 수 있는 곳은 위 지도에서 상하농원...",2021. 5. 21.
"고창군⇔코레일(용산역), 지역관광 활성화 업무협약",‘힐링 생태관광 성지’ ‘세계문화유산도시’ 전북 고창군이 지역 관광 활성화를 위해 코레일(용산역)과 손을 맞잡았습니다. 20일 고창군에... 협약식은 생태체험·세계문화유산 투어를 선도하며 힐링체험 1번지로서 자리매김하고 있는 고창군이 코레일과 함께 철도여행 상품을 개발해...,2021. 4. 21.
[전북/고창] 선운산 등산코스(feat. 산림청/블랙야크 100대 명산),국내여행 전북 고창군 #전북 #고창 #선운산 #도솔산 #수리봉 #선운사 #도립공원 ※ 선운산 등산코스(약 2시간 소요) 선운산 도립공원 주차장 -> 선운사 -> 수리봉(정상) -> 포갠바위 -> 선운사 -> 주차장 명절날 친척집을 가지 못하고 성묘를 간 아빠를 뒤로한 채 엄마가 등산을 가고 싶으시단다. 그래서...,2021. 9. 21.
고창 가볼만한곳 선운사 꽃무릇 전북 가을나들이 여행코스..,"고창 선운사 꽃무릇 전북 가을나들이 여행코스, 9월 꽃무릇이 피기 시작하면 땅위 붉은 물감을 쏟아 놓은 듯 정관을 이룹니다. 9월을 물들이는... 전북 고창군 아산면 선운사로 250 // 063-561-1422 계곡 산책로를 걷다 선운사 경내로 들어왔어요. 전북 고창 선운사는 577년 백제 위덕왕 24년에 검단선사가...",2020. 9. 28.
