header,contents,date
충남카페추천 꽃이 있는 대천 리리스블루 & 레트로한 장항 두빛나래,"얼마 전에 충남여행을 다녀왔는데, #충남카페추천 중에서 꽃이 있는 #대천카페 #리리스블루 그리고 레트로한 #장항카페 #두빛나래 두 곳이 너무... 리리스블루카페 영업시간 : 10시 ~ 20시(연중무휴) / 연락처 ***-****-**** / 주소 : 충남 보령시 해수욕장3길 11-10(한화리조트내 1층) 한화리조트 1층 프론트...",2020. 10. 19.
충남 가볼만한곳 1박2일 보령여행 무창포 신비의 바닷길 시간,"처음으로 하는 1박2일 충남여행의 시간 중에 무창포 신비의 바닷길을 보고야 말았습니다. 충남 가볼만한곳, 충남 여행 하면 당연히 보령... 무창포해수욕장은 충남 보령시 웅천읍 관당리에 있는 해수욕장으로 길이 1.5km로 웅천해수욕장이라고도 불립니다. 무창포 남쪽 해안에 남북으로 길게 펼쳐진...",2020. 10. 24.
"1박 2일 충남 보령여행 2탄(죽도, 대천 해수욕장, 짚트랙)",https://blog.naver.com/qbdtkadl1 충남 보령여행 1탄에 이어서 2탄을 적어보도록 하겠다! 죽도 죽도는 충청남도 보령시 남포면(藍浦面) 월전리(月田里)에 딸린 섬으로 대천해수욕장으로 가는길에 있기에 한번 들려보았다! 죽도에 오면 상화원이라는 곳을 들려야하는데 다 보려면 1시간 정도가 걸린다기에...,2021. 8. 18.
"충남보령여행, 보령펜션추천, 무창포해수욕장 펜션, 바다노을펜션","충남 보령 여행 숙박 후기 ""바다노을펜션 "" 여기어때 앱이용 주말성수기 기준 (2인기준 최대4인) 170,000원 인원추가 비용 2만원 바베큐 숯불 이용 2만원 위치: 충청남도 보령시 웅천읍 열린바다로 371-23 무창포해수욕장 도보 5분! 보령으로 떠난 가족여행 펜션주인분들이 너무 좋았어서 여행이 더 만족...",2021. 8. 10.
무창포해수욕장 무창포 물때,무창포해수욕장 서해 갯벌체험이 가능한 무창포해수욕장 무창포 물때 @콩이와꽃순이 무창포해수욕장 충남 보령시 웅천읍 열린바다1길 10... ㅋㅋㅋㅋㅋ 여행만 가면 저랑은 절대 손 안잡는 둥이 ㅋㅋ 이모만 따라 다녀요. 이모 손만 잡고(*´ー｀*)/ 제법 큰 게도 있어요. 돌들도 예쁘고...,2021. 10. 8.
보령 캠핑장 [스칸디캠프팜] 2박3일 다녀왔습니다:),스칸디캠프팜 충남 보령시 청소면 송덕신송길 229-42 날씨가 선선해지니 캠핑이 생각납니다:) 더위는 갔으니 추위가 오기전에 캠핑을 나가봐야겠지요!?^^ 보령으로 캠핑을 떠났어요~ 아이들 온라인클래스를 마치고 금요일 오후에 출발해서 2박3일로 다녀왔는데요:) 보령 좋더라구요~ (보령여행...,2021. 9. 6.
대천해수욕장 충남보령 대천가볼만한곳 대천여행 서해안바다,"충남 보령시 신흑동 2276 폭씬폭씬한 모래와 잔잔한 바다의 파도소리 탁 트여져 있어서 가만히 바라보고만 있어도 힐링 ~ 아련한 표정으로 거닐어 보기 ㅎㅎ 머리한번 쓸어주고 ~ 아련,,아련,, 햇빛이 강한바람에 눈을 뜨고는 못찍겠더라구요 ㅜㅜ 사진을 찍고 맛있는 조개구이를 먹으러 갔어요 ㅎㅎ...",2021. 5. 4.
충남 보령 죽도여행 죽도 주차 이렇게 하세요! 꿀팁 방출!,"죽도(竹島)는 대한민국 충청남도 보령시 남포면 월전리에 속한 섬으로 섬 전체에 대나무가 울창하여 죽도라 불린다. 위키백과 죽도, 이름처럼 정말... #죽도 #충남 #보령 #남포면 #월전리 #방파제 #서해 #가볼만한곳 #명소 #주차 #꿀팁 #상화원 #죽도슈퍼 #주말 #가족여행 #낚시 #바다낚시 #날씨대박...",2021. 9. 24.
보령 여행 어부횟집 입맛 돋우는 자연산 회정식이 좋아라,"보령 맛집으로 어부의 차별화된 맛으로 현지인은 물론이고 보령을 여행 온 사람들도 찾는 곳이다. 제철 식재료와 해산물을 직접 낚시로 잡아... One Point Tip 보령 어부횟집 찾아가는 길 주소: 충남 보령시 지장골길 48 예약전화: 041-933-8495 영업시간: 오전 10시에서 오후 10시까지 휴무일: 2,4주 월요일...",2021. 8. 28.
[보령우유창고]아이와함께 카페& 목장체험하기♬,(2021/09/22) D+2110♥D+922 주소: 충남 보령시 충북면 하만리216 도로명: 충남 보령시 충북면 홍보로574 매일 11:00 - 19:00(연중무휴) #충남 #충남보령 #보령가볼만한곳 #충남가볼만한곳 #충남여행 #보령 #아이와함께 #보령카페 #보령우유 #우유창고 #보령우유창고 #목장체험 #스템프투어 #건초주기 #정원카페...,2021. 10. 8.
1박 2일 보령 여행 둘째날! 장항선에서 가장 오래된 청소역! 청소역 맛집 풍정돌솥밥!,청소역 : 충남 보령시 청소면 청소큰길 176 풍정 돌솥밥 : 충남 보령시 청소면 청소큰길 186 ( 진죽리 337-5 ) 031-934-0909 밥을 먹은 후 해미읍성과 개심사를 갈까 아니면 수덕사를 가나 예당호 출렁다리를 가나 고심을 했습니다. 저는 울애가 안 가본 예당호 출렁다리를 권했는데 출렁다리보다는 옛...,2021. 7. 12.
충남보령가볼만한곳 보령여행 베스트5 / 성주사지 오천성오천항 갈매못순교성지...,#충남보령가볼만한곳 #서해안가볼만한곳 #보령여행 #보령겨울여행 충남보령 충남 대천으로 떠나는 겨울여행입니다 눈이 가득한 겨울의 보령은 매우 아름답습니다 눈이 내리는 날 즐거운 보령여행 겨울에도 너무 좋은것 같습니다 성주사지 041-930-4072 주소 충남 보령시 성주면 성주리 73 성주사는...,2021. 2. 4.
"[울릉도 늦은 신혼여행] 2일차 _ 천부해중전망대, 삼선암, 선녀탕 스노쿨링, 천금수산","울릉도 2일차 일정 시작, 울릉도 처럼 날씨가 9할인 여행지에서는 아침에 일어나면 가장 먼저 해야하는 일, 쉼호흡 한번하고 커텐걷고 하늘 날씨... * * 자매도시 * * 경기도 : 안양시, 성남시, 구리시 경북 : 포항시 경주시 충남 : 보령시 강원도 : 삼척시, 동해시 전남 : 신안군 부산광역시 : 수영구...",2021. 9. 3.
"D.Margarita, 빈티지와 엔틱이 공존하는 보령시 대천 해안도로 중심에 있는 통나무집...","자리도 넉넉해서, 단체로 여행와서 카페 오기 딱 좋은곳!! 2층에도 셀프바 물이 놓여있네요:) 작은 소품의 인테리어에 또 한번 감동..ㅠ 붉은... 주소 : 충남 보령시 해안로 475 / 남곡동 772-9 전화 : 041-931-5531 영업시간 : 평일 11:00 - 22:00 / 주말 및 공휴일 10:00 - 22:00 / 일요일 10:00 - 18:00 연중무휴...",2020. 4. 20.
대천 조개구이 가족들과 다녀온 곳 !,대천 불타는 조개구이 : 충남 보령시 해수욕장 8길 79 안녕하세요 쌔미입니다. 저는 요즘 삼합의 매력에 푹빠져있는데요.. 지난주에도 오고... 밥먹고 바다에서 한참을 놀다가 왔답니다. 맛있겜거고 즐거웠던 추억의 대천 당일치기 여행 행복했던 날이였어요 ~♥ 다음번에 또 먹으러와야지!!,2021. 8. 27.
[퍼스널컬러 나다움] 보령시 청소년지원센터 꿈드림 퍼스널컬러 특강 !,"2020년 12월 , 보령시 청소년지원센터 꿈드림에서 학교밖 청소년들을 대상으로 하는 퍼스널컬러 특강을 다녀왔답니다 :-) 코로나로 인해 졸업여행을... :) 충남 보령시 청소년센터 꿈드림 학생들과 함께 한 즐거운 시간이었습니다 ! 좋은 시간 마련해주신 담당자 선생님께도 감사드립니다...",2021. 1. 11.
"봄따라 맛따라 별미여행::부안 백합, 무창포 주꾸미, 남해 죽방멸치쌈밥, 울진 대게","무창포해수욕장은 매년 3월 주꾸미·도다리축제가 열리는 보령의 대표적인 봄맞이 미식 여행지입니다. 이맘때면 해변에 늘어선 음식점 어디서든... 오천항 위치 : 충남 보령시 오천면 봄봄봄봄, 멸치 왔어요~! 남해 죽방멸치쌈밥과 멸치회 한려수도의 비경을 품은 남해는 태생적으로 섬이나...",2021. 3. 15.
충남 보령가볼만한곳 무궁화수목원 산책코스 편백나무 숲 추천 여행,제가 봤을 땐 보령에 와서 여기만 와서 맑고 신선한 공기를 마셔도 힐링 여행을 할 수 있을 거 같습니다^^ 보령 산책하기 좋은 무궁화수목원 위치 : 충남 보령시 성주면 성주산로 318-57 주차장 : 무료 입장료 : 무료 운영시간 : 하절기 09:00 ~ 18:00 동절기 09:00 ~ 17:00 휴무일 : 매주 월요일 지정 공휴일(1월...,2021. 4. 21.
"충남 보령 여행 / 보령 가볼만한 곳 / 영화 ""결백"" 촬영지 / 블루레이크","카페 블루레이크 충남 보령시 청라면 죽성로 154 매일 10시부터 19시까지, 공휴일은 정상영업 0507-1309-5616 아침부터 바깥 나드리를 해서 그런지 굉장히 피곤했지만, 결백이란 영화를 아주 재미있게 봐서 그런지 기대가 아주 컸습니다. 특히 허준호 배우님이 눈에 띕니다. 결백에 나오는 주인공들...",2021. 5. 8.
"대천여행 :: 커피인터뷰 ☕️coffee interview (대천카페, 보령카페)",보령 대천 커피 인터뷰 :: Coffee Interview :: 매일 11:00 - 22:00 042-823-3712 충남 보령시 대천항1길 67-23 대전 근교로 훌쩍 떠나고 싶었던 날 선택한 대천. 학부 때 엠티 등으로 몇번 간 걸 제외하곤 정말 오랜만의 대천여행 이었다. 대천에 도착하고 내리쬐는 태양을 피해 주차를 한 뒤 조개구이...,2021. 4. 11.
[충남보령여행 가볼만한곳] 무창포해수욕장과 죽도보물섬관광지 죽도매운탕맛집 강선장,[충남보령여행 가볼만한곳] 신비의 바닷길 무창포해수욕장과 죽도보물섬관광지 죽도매운탕맛집 강선장 안녕하세요! 쌈박한비기너 #쌈비 인사해요... #금강산도식후경 밥먹으러 이동~~ 보령시 해수욕장 진출입 곳곳마다 발열체크하는 스티커를 손에 붙혀줍니다. 아주 시스템이 잘 되어 있더라구요....,2021. 8. 21.
"<충남 대천, 밥집> 24시 청주해장국",#대천 여행 중 방문하게 된 < > #청주해장국 리뷰입니다. 내돈내산 100% ㅎㅎ 청주해장국 욕장점 주소 : 충남 보령시 머드로 46 배고파서 #아점 먹으러 나와 걷다가 홀린듯 들어가게 된 #식당 입니다. 늦잠을 실컷 자고 일어나 11시쯤 너무 배가고파서 근처에 식당을 찾아보자해서 거닐다 홀린듯...,2021. 9. 21.
경기도에서 당일치기 여행 충남 보령 죽도 상화원과 대천해수욕장 최고예요,찾아봤더니 충남 보령시에 있는 죽도 상화원이라는 곳을 알게 됐네요 죽도라 함은 섬이라는 말인데 지도를 보니 섬이 맞네요 사람들에게 알려지기... 더워지면 다시 한번 오고 싶다는 생각이 드는 해수욕장입니다 죽도 상화원을 들러 대천 해수욕장까지 당일치기로 부담 없이 즐긴 여행이었습니다.,2021. 5. 22.
[서해여행]보령 조용한섬 삽시도에서 힐링여행,"그 중에서도 조용한 섬 삽시도에 힐링여행 오신분들이 계셨어요. 삽시도는 충남 보령시 대천항에서 배를 타고 가야하는 서해안 섬이랍니다. 코로나로 배를 타시는 모든 분들이 마스크를 쓰고 여행을 하시는 모습을 볼 수 있었습니다. 배에는 방,의자,야외로 나누어져 있어 편하게 거리 두기를 하실...",2020. 7. 6.
황군김양일상)) 충남 보령여행~ 대천해수욕장에 다녀왔어요~^^,"위해서~ 충남 보령시 대천해수욕장으로 여행 다녀왔어요~^^ ᆞ ᆞ 주소: 충남 서천군 비인면 서해안고속도로 168 ( 성산리 22-4 ) 연락처: 041-952-9700 영업시간: 無 휴게소 메뉴: 소고기국밥, 등심돈까스, 냄비우동, 핫도그, 떡볶이, 호두과자, 오징어, 등등 ᆞ ᆞ 휴게소는 작지만 주차장은 작지...",2020. 8. 15.
일상:여행/데이트::충남보령 대천 여행 및 데이트 당일/숙박 코스!!,"주말에 다녀온 충남보령 데이트 코스 및 여행코스를 공유해보려고한당!! 뭐 별거 없지만ㅋㅋㅋㅋ 커플이 다녀와도 좋고~ 커플이 아니라면,,ㅠㅠ... 위치: 충청남도 보령시 해수욕장 10길 80 (충남보령시 신흑동 대천해수욕장 2210-1) 운영시간: 성수기- 09:00~19:30 비성수기- 09:00~18:00 요금:1인(초등...",2020. 4. 28.
충남 보령 맛집 해물찜 윤가네 가을 여행이 맛있다,나중에 여쭤보니 간장게장도 일품이었다고 하네요. 내용은 길지 않습니다. 다만 맛있었을 뿐~ ㅋㅋ 이래서 충남보령여행이 즐겁고 맛있었답니다. 서울에 이런집이 있었으면 좋겠다고 진심 생각했던 시간이었습니다. 충남 보령시 대해로 28 (궁촌동) 041. 935. 1919,2020. 11. 11.
대천 한화리조트 한화리조트 대천파로스 부대시설 조식뷔페 도시락,대천 한화리조트 대천 한화리조트 한화리조트 대천파로스 조식뷔페 도시락 @콩이와꽃순이 한화리조트 대천파로스 충남 보령시 해수욕장3길 11-10... 동남아 여행 온 듯한 기분이 들더라구요. 오히려 오래전 지어져서 테라스며 건물 느낌이 레트로 스러워서 전 더 좋았어요. ٩( ᐛ )و 후앙 ㅋㅋ 파타야...,2021. 10. 5.
"[보령시] 대천해수욕장, 서해안 겨울 바다","얼마전 다녀온, 충남 보령시 대천해수욕장을 소개해 드리려고 해요. 부산바다와는 또다른 서해안 바다를 느낄 수 있는 곳인데요. 대천해수욕장 근처... #대천해수욕장 #보령머드박물관 #겨울바다여행 #서해안해수욕장 #서해안겨울바다 #겨울바다 #일몰명소 #바다보석",2021. 1. 18.
(내맘대로 자유여행) 충남 보령여행 2일차 기록,(내맘대로 자유여행) 충남 보령 여행기록 2일차 대천해수욕장 산책 짚라인 & 2인승카트타기 (카페)우유창고 - 현재 거리두기로 카페내부에는 앉을 수 없음 (10월3일 기준) 10월3일 토요일 날씨 : 흐림 대천해수욕장 충남 보령시 신흑동 대학생때 이후로 대천해수욕장에 오랜만에 왔다. 천천히...,2020. 10. 12.
블루레이크 보령 카페 가볼만한 곳,블루레이크 충남 보령시 청라면 죽성로 154 안녕하세요? 보령 캠핑 다녀온지가 언젠데... 드.디.어 보령 여행 마지막 소개 포스팅입니다 :) 보령 카페 <블루레이크> 영화 <결백> 촬영지 이기도 하고 카페 앞으로 보이는 저수지의 포토존이 인기있는 곳이랍니다^^ 보령 캠핑장에서 블루레이크로 가는 길...,2021. 9. 20.
충남 보령 명복식당/막창전골이 끝내줍니다,명복식당 충남 보령시 청라면 냉풍욕장길 37 041-932-8166 전골은 예약필수(30분걸림) 보령 여행중 방문한 명복식당.식당입구에서 귀여운 강아지가 반갑게 맞이해준다.시골집느낌에 아담한 식당. 맛집 티비 방송도 여러번 했네요.. 내부는 약간 외곽쪽에 있는데 시골집 느낌에 맛집 정겨웠어요. 주차장...,2021. 8. 13.
<4> 할아버지 수소차로 가보는 신박나는 한국 섬 여행,원산도(元山島) 지난주 경기ㆍ인천 섬들을 다녀온 뒤 이번 주는 다음 여행 준비를 하느라 모든 시간을 보냈다. 전국에서 섬이 가장 많은... 윤찬이는 2층을 좋아해 수없이 오르내렸다. 할아버지는 피곤해서 일찍이 잠자리에 들었다. ♨ 충남 보령시 오천면 원산도4길 263-3. 해마루 펜션(041-936-3322),2021. 8. 23.
여행작가 에세이⑤ 아이들과 떠나는 충남 보령여행 - 여름이니까 더 좋아!,자연스레 충남 보령으로 향했다. 깨끗한 자연 속에서 여름을 즐기기에 더 없이 좋을 것 같다. 오랜만의 여행에 들뜬 아이들은 자동차 안에서도... info 주소 : 충남 보령시 천북면 학성리 산 45 하늘과 바다 사이를 가르는 스카이바이크 어느새 대천해수욕장에 도착했다. 아이들에게도 익숙한...,2020. 6. 17.
보령시 웅천읍에 가면 형제 종합 카센터가 있다,"▲형제종합카센타 대기중인 차량들의 모습과 전경 조명구사장님과 조정구1급 산업정비 기사님이 운영하는 형제 종합 카센타는 충남 보령시... 여행중에 무창포 해수욕장과 ""모세의기적""도 구경하시고 읍내에 들어오셔서 오석석재단지와 오석박물관도 구경하시고 다시 여행길에 오르실때...",2020. 9. 12.
대천해수욕장펜션 모던한 고품격 휴식 공간,분위기 좋은 곳에서 좋은 사람과 맛있는 음식까지 먹으니 심리적으로 육체적으로도 만족감 최상 정말 손에 꼽을만한 여행이었어요. 하루 밤이라... 친절한 사장님과 깨끗하고 분위기 좋은 방까지 정말 완벽했습니다 :-) 충남 보령시 해수욕장9길 2-27 #대천해수욕장펜션,2021. 10. 1.
"가족 나들이하기 좋은 곳, 보령 석탄박물관","<보령 석탄 박물관> 찾아가는 길 : 충남 보령시 성주면 성주산로 508 문의 전화 : 041-934-1902 관람시간 : 매일 09:00 - 18:00, 매주 월요일 휴무 관람료 : 어른 2,000원 / 청소년, 군인 1,500원 / 어린이 1,000원 / 노인 무료 단체 어른 1,500원 / 청소년 1,000원 / 어린이 500원 홈페이지 http://www.1stcoal.go.kr/ - 홍보요원...",2021. 9. 8.
"보령 비체팰리스 바다전망 객실, 조식, 사우나","비체팰리스 위치 : 충남 보령시 웅천읍 열린바다1길 78 (무창포해수욕장) 체크인 3시, 체크아웃 11시 비체팰리스 13층 바다전망 객실과 전망 ( 동영상) 비체팰리스 36평 객실은 방 두 개 (침대방1, 온돌방1), 거실, 욕실2, 주방의 구조로 되어 있고 널찍해서 가족여행에 적합했다. 욕실에는 일체형...",2021. 9. 23.
"""물은 무서워도 모래사장은 좋아요❤"" 대전 근교 충남 보령시 대형견 가능 [대천해수욕장]",""" 이대로는 너무 아쉬우니까 엄마랑 모래사장 뛰어보기 마지막으로 둘이 같이 달리기 시야가 너무 넓어서 휴지랑 종이가 정신 못 차리고 달려준 덕분에 엄마는 없는 힘까지 쥐어짜서 달림 이렇게 한 번씩 오직 휴지랑 종이만을 위해서 여행을 다녀오면, 근처 맛집은 물론 카페도 한번 들리지...",2021. 2. 9.
대천해수욕장 맛집 여행리스트,"대천에는 휴게소가 잘 되어있어서 놀러오기에 좋은 여행지입니다. 지역자체의 좋은 환경도 중요하지만 오가는 길에 휴게소도 중요한... 남포집 주소 충남보령시 성주면 성주중앙길 69-4 전화번호 041-934-9057 메뉴 : 매운칼국수 7,000원 /안매운칼국수 7,000원 막걸리 , 도토리묵, 손두부, 칼국수를...",2020. 11. 27.
[충남/대천] 여름휴가: 2278리조트펜션,"먼저 첫날 머문 곳은 ""2278리조트펜션"" 대천 2278 리조트펜션 위치: 충남 보령시 머드광장로 14 영업시간:09:00~22:00 주차는 전용주차공간이용... 그래도 우리가 먹었던 과일은 쵝오였네용 한번 더 이용할거같진않은.... 그래도 이날여행은 좋았네용 #대천가볼만한곳 #충남여행 #여름휴가 #대천펜션",2021. 8. 27.
[충남여행] 보령 가볼만한곳 동백꽃필무렵 드라마 촬영지 '충청수영성',저도 저 장면 따라 찾으러 왔답니다 ㅋㅋ 보령충청수영성 충남 보령시 오천면 소성리 661-1 충청수영성의 주소지 근처 종합안내도도 볼 수 있어요... 충남여행 보령 가볼만한 곳으로 추천합니다❤️ 입장료 : 없음 주차비 : 없음 관광시간 : 24시간 연중무휴 여러분의 팔로우를 기다리겠습니다⭐️,2021. 1. 18.
충남 보령으로 엄마 생일 기념 가족 여행 다녀온 날 / 무창포해수욕장,장원식당 충남 보령시 해수욕장5길 32 다음 날 아침겸 점심은 #해물뚝배기 를 먹었다. 양이 진짜 많고 너무 맛있어서 라면사리까지 먹었다 ㅠㅠ 또 먹고싶다 ... 밥 먹고 잠시 바다도 봐주고 사진도 찍었다. 온 가족들이 바다 보는건 진짜 오랜만이라서 너무 들떴었다 :) 짧았던 여행이라 아쉬웠지만...,2020. 5. 5.
"[여행추천템/필수품] 이제 슬슬 여행을 준비할 시간, 헬렌스타인과 여행을 떠나요️","날씨는 점점 더워지고 아이들 학기는 끝나가고 이미 마음은 여행지에 있는 것 같지 않으신가요? 캠핑장, 펜션, 풀빌라… 여기저기로 여행을... 그 느낌 충남 보령시 계곡에서도 느껴보고 싶으시다면 헬렌스타인 호텔콜렉션 페이스타월 추천드립니다. 탄탄한 30수, 면 100% 소재로 수건의...",2021. 6. 3.
가족과 함께한 보령시 무창포 해수욕장 1박 2일 코스 겨울나들이!!!,충남 보령시 웅천읍 관당리에 위치한 무창포해수욕장은 길이가 1.5km이며 인근 북쪽 8km 지점에는 대천해수욕장이 위치해 있다. 길게 펼처진... 1박2일의 무창포해수욕장의 꿀잼 여행은 우리 가족에게는 좋은 기회엿으며 한동안 소원했던 가족간의 서운함도 여행을 통하여 하지 못했던 대화를...,2021. 2. 19.
"보령시맛집 장벌바지락칼국수 바지락비빔밥,탕 맛나요!","보령여행 가시면 아무래도 서해 이다 보니 바지락, 조개구이 많이 드시죵?? 우연히 알게된 보령시맛집인데용 위치는 대천해수욕장에서 차로 15분 정도 소요된답니당>< 장벌바지락칼국수 충남 보령시 해안로 405 041-935-7693 영업시간 10:30 - 20:00 매월 2째주 월요일 휴무 해안도로 바로 옆에 치하고...",2020. 8. 17.
"바다와 자연, 예술이 어우러진 감성 충만한 섬 여행/한국관광공사 추천 11월...",11월 추천 여행지 옹진 신시모도 보령 죽도 상화원 남해 노도 신안 기점·소악도 여수 장도 제주 추자도 바다와 자연이 어우러진 감성이 충만한 섬... - 죽도 상화원 주소: 충남 보령시 남포면 남포방조제로 408-52 ★ 김만중의 꿈이 깃든 절해고도 노도(경남 남해) 남해는 조선시대 대표적인...,2020. 10. 30.
무창포 어심횟집 조개구이 & 해수욕장 당일치기 여행,익스플로언서 루피입니다^^ㅋ 오늘은 지난주 불금에 여친과 다녀온 무창포 당일치기 여행을 올려봅니다. 2021. 5. 14 (불금) 대전에서 느지막히 11시쯤... 충남 보령시 웅천읍 관당리 818-3 신주소에 어색하신 분들은 구주소 찍고 가세욧 ㅋㅋ Aㅏ~ 참고로 주차장은 별도로 없었는데.. 그냥 가게 앞에...,2021. 5. 19.
"보령 무창포 여행 무창포 봄 도다리쑥국 대신 쑥갓국, 무창포숙소",보령 봄 여행 ③ 대천항은 겨울천국 충남 보령시 신흑동 1250 손님도 우리밖에 없어 너무 좋았던 횟집의 봄 전령사 도다리 요리는 환상적 이었다. 폭설이 멈추고 대천항으로 향했다. 무창포에서 20여분 거리라는데 눈길로 조심조심 40여분 걸린듯 하다. 도착하여 보니 대천항은 겨울 왕국 이었다....,2021. 3. 7.
[충남가을여행/은행나무마을] 인생샷 건지러 가을에가면 좋을 가을은행명소 보령 청라...,"★오전 일찍가는게 사진찍기 좋아요 보령 청라 은행나무 마을 (신경섭가옥, 정촌유기농원) 충청남도 보령시 청라면 장밭길 62(장현리 688) 01... □ 주소 : 충청남도 보령시 청라면 장밭길 62(장현리 688) □ 입장료 : 무료 □ 주차 : 신경섭 가옥 앞 주차장 이용 (사용불가경우 마을 안쪽에) 최대한 많은...",2020. 11. 9.
해저터널 뚫리는 원산도에 케이블카 건설..보령시 사업자 공모,"주변 섬 3.5∼4.5km 연결..12월까지 사업 신청서 접수 원산도 안면도 연결 도로 충남 보령시가 국내 최장 해저터널이 건설되는 원산도에 해양관광... 차량을 이용해 원산도에 도착한 관광객들이 케이블카를 타고 다른 섬으로 이동, 현지에서 개인 이동수단(모빌리티)을 대여해 섬 여행을 즐길 수...",2020. 10. 19.
"충남 보령 1박2일 여행 / 대천해수욕장, 카페 우유창고, 먹보네 조개구이, 머드린호텔...","천안이랑 대전에서 1시간30분정도 걸린데용 코로나 터지기전이라 다행스러우면서도 씁쓸 대천해수욕장 충남 보령시 신흑동 아,, 서해바다... 남친이랑 생각해보면 충남에서 음식은 보령이 젤 맛있는거 아니야..? 이러다가 옴 대천해수욕장이 있는 보령여행 끝〰️ (급 마무리..)",2020. 11. 25.
홍성언니-보령시 용두해수욕장 가다ㆍ,바다 #남매둥이맘 #일상 #데일리 #가족 #사랑 #삶 #데이트 #맘스타그램 #육아스타그램 #니가좋으면나도좋아 #셀카 #딸램 #아들램 #육아템 #엄마 #워킹맘육아 #홍성 #보령 #해수욕장 #먹방 #여행 #홍성인플루언서 #그라폴리오김경희작가 #김경희 #홍성파워블로거 #충남소식 #홍성소식 #충남여행 #사진,2021. 8. 16.
