header,contents,date
[10년 전 오늘] [충남/조치원/연기군 맛집] 산장가든 : 충남 연기군 참나무 숯불 통돼지갈비,10년 전 오늘 [충남/조치원/연기군 맛집] 산장가든 : 충남 연기군 참나무 숯불 통돼지갈비 충남 연기군 국도변의 참나무 숯불 통돼지갈비로 유명한 산장가든 고복저수지 부근입니다 남도 여행을 마치고 올라오는 길에 여행중 하도 해물만 먹으러 다녔더니 몸에서 비늘이 돋는것...,2021. 9. 28.
충남 세종 가볼만한 곳 미리가 본 국립세종수목원 4계절 온실,"충남 연기군과 공주시 일부 지역, 충북 청원군 일부를 흡수하여 2012년 7월 출범했는데요. 지금은 고인이 된 노무현 전 대통령이 자꾸만 비대해지는... 이름도 궁금한 식물과 나무들이 무성하게 자라고 귀한 바나나도 주렁주렁 달려서 동남아 여행지에 온 기분이 납니다. 온실 내부에는 인공...",2020. 9. 25.
[장흥유원지] 양주시립장욱진미술관,가족 - 민복진 장욱진미술관 조각 공원의 작품들 여행자 - 김건주 가슴에 터억 하니 다가온 작품 그래. 여행이란 이렇게 멀리 내다볼 수 있는 시야를... 찾아보니 충남 연기군 태생이시고 양주와는 어떤 인연도 없는 거 같은데 왜 양주에 장욱진미술관이 세워졌을까 궁금함이 남았다. 장욱진은 1918년...,2021. 9. 22.
한 사람의 일생을 돌아보는 대전 여행 역사탐방 송준길의 묘,"코로나19 상황에서 여러 사람과 함께 하는 것보다 나 홀로 여행을 떠나보는 것도 이 가을에 의미가 있을듯합니다. 홀로 떠나는 여행은 조금 심심할... 원래 묘는 충남 연기군에 있었는데, 공주 등 여러 곳으로 옮겼다가 숙종 26년 1700년에 현재 서구 원정동에 있습니다. 동춘당은 대덕구만 상상하다가...",2020. 10. 14.
안전하게 여행하자! 언택트 관광- 세종시 편,"안전하게 여행할 수 있는 언택트 여행지 100선 중 세종시를 알아볼까요? 비암사 세종시 전의면 비암사길 137 비암사는 2,000여 년 전 삼한시대의... 이런 재미를 느낄 수 있는 곳이 충남 연기군에 자리한 교과서박물관이에요~ ○주소 : 세종특별자치시 연동면 청연로 492-14 ○문의 : 044-861-3141~5...",2020. 9. 17.
연기군전의면맛집 67632275070,연기군전의면맛집 세종시 전의면 역사 유적 가볼만한 곳 문목사계룡도령(鷄龍道令 春月)이 며칠 동안 세종시 전의면의 역사 문화 유적(歷史 文化 遺跡)을 소개하고 있는데 올해는 세종 여행 전의면의 타우(打寓) 이상(李翔)을 배향(配享)한 사당(祠堂 廟 묘)인 문목사(文穆祠)와 조금 떨어진 곳...,2020. 11. 20.
"여행을 떠나요, 우리나라지도, 전국지도 by 에이든과 함께 :)","예전에 충남 연기군에 있을 때 갔는데 아기곰들이 너무 귀여웠다. ㅎㅎ 가족들끼리 가면 아가들이 너무 좋아할만한 곳. 나는 베어트리파크가 생긴지 얼마안되서 가서 많은 동물은 보지 못했지만 그래도 곰돌이들을 봤다는 것 만으로도 너-무 신났었다. ㅎㅎ 독립기념관, 아우내순대거리는 세트 여행...",2021. 3. 27.
"여행을 떠나요, 우리나라지도, 전국지도 by 에이든과 함께 :)","예전에 충남 연기군에 있을 때 갔는데 아기곰들이 너무 귀여웠다. ㅎㅎ 가족들끼리 가면 아가들이 너무 좋아할만한 곳. 나는 베어트리파크가 생긴지 얼마안되서 가서 많은 동물은 보지 못했지만 그래도 곰돌이들을 봤다는 것 만으로도 너-무 신났었다. ㅎㅎ 독립기념관, 아우내순대거리는 세트 여행...",2021. 3. 27.
국내 겨울 여행지 공주 명탄서원과 충절사,"겨울의 끝자락 가벼운 산책길에서 조용한 힐링여행 안녕하세요. 공주 서포터즈 이창헌입니다. 오늘 소개해 드릴 관광지는 충절사와 명탄서원... 성종 때 충남 연기군 명탄에 세웠던 충절사라는 사당인데, 명탄서원이라고도 불렸습니다. 선조 18년에 서원 이름을 하사받았으며 임진왜란 때 불타...",2021. 2. 15.
충남 홍성 가볼만한곳 홍성 장날(1.6) 전통시장 구경,우리 유년시절에는 특히 충남 연기군 시골이었기 때문에 싱싱한 생선을 구경도 못하고 기껏 해서 소태처럼 쓰디쓴 소금에 절여진 자반고등어나... 6) 전통시장 구경 #충남홍성가볼만한곳 #홍성가볼만한곳 #홍성여행코스 #홍성장날 #홍성전통시장 #장구경 #홍성장 #5일장 #장터풍경 #충남여행...,2020. 1. 31.
"12월의 이달의 역사인물 이명성, 이명덕 형제의 ‘명탄서원’","가만히 생각해 보니, 공주시를 종종 여행하면서 이명성과 이명덕 두 형제분의 이야기를 간접적으로 접했던 경우가 많았는데요. 최근에는 공주시내 곳곳에 디지털 사이니지나 현수막을 통해서 두 위인의 존재를 많이 부각하고 있습니다. 원래는 충남 연기군 명탄에 세워져 처음 명탄서원이라...",2021. 1. 14.
옛정취찾는 보만정 검단서원과 쪽빛 천연염색 비단길농장,"가을엔 여행을 떠나야 합니다. 모든 사물이 아름답게 보이고, 옛정취를 찾아서 역사여행을 하는 것도 즐거운 일입니다. 조금은 고리타분하다고... 묘소는 처음에는 충남 연기군에 있다가 공주로 옮겨졌다가 현재는 대전 서구에 있습니다. 대전 세종 충남 부분에 두루 송준길의 발자취를 많이...",2020. 10. 12.
정말이지 세종시 가볼만한곳이 있을까?,"충남 연기군과 공주시, 청원군 일부 지역까지 편입 된 것으로 안다. 10년도 안된 신생 도시인데 연기군으로만 놓고 보면 역사는 오래되었다.... 관광, 여행으로 가볼만한곳이 세종시에 무엇이 있는지는 인터넷이 발달하고 소셜네트워크 덕분에 알게 되었다. 독락정과 나성 오며가며 세종시 가볼만한곳...",2020. 5. 24.
봄 비오는 날 여행 서울 고덕천~하남 미사호수공원 우중 산책,"봄 비오는 날 여행, 서울 고덕천~하남 미사호수공원 우중 산책 여행 날짜: 2021. 3. 1 사진. 영상. 글: 호미숙 안녕하세요. 호미숙 여행작가입니다. 3월... 지금은 고향 이름도 충남 연기군 금남면에서 세종시로 바뀌었고 그토록 넓고 큰 건물로 느껴지던 학교도 사라졌습니다 고덕 초등학교 신학기 2021년...",2021. 3. 3.
모산 낚시터 안전하게 이용해보기!,논산 #어의곡낚시터 충남 연기군 #순찬 낚시터 경북 성주군 #염치 낚시터 부산 사상구 #가곡낚시터 강원 강릉 #토도수산 경북 고령군 #쌍둥이2 낚시터 경남 남해군 #낚시여행낚시터 경남 함양군 #태극호좌대 경기 동두천 #송악 낚시터 충북 음성군 #안국지낚시터 충북 영동군 #삼인동 충남 천안...,2021. 10. 6.
세종시 토박이가 소개하는 세종시 가볼만한 곳,"# 세종특별자치시의 관문, 오송역 세종시로의 여행은 보통 경부/호남고속철도 오송역에서부터 시작됩니다. 세종시에서 약 10km 넘게 떨어진... 행복도시는 과거 충남 연기군과 공주시 장기면,의당면,반포면 일부와 충북 청원군 부용면 일대에 건설하는 신도시로 과거 모습 모형도를 보면 알 수...",2020. 6. 28.
방구석 미술관2 - 조원재,남편 우영은 일본 외무성 외교관이 됨 - 1927년 일본 외무성의 포상으로 남편과 함께 1년 9개월동안 세계 여행을 함. 법학 공부를 위해 남편... 고향인 충남 연기군에 정착하여 작품 활동 전쟁이 끝나자 서울대 대우교수로 있으며 작품 활동 1960년 교수직을 내려놓고 전업작가 1963년(47세) 자연...,2020. 12. 28.
[추가] 코로나가 잠잠해지면 가보고 싶은 곳,이리 저리 흘러다니다가 가까운 곳이면 찾아 들 생각입니다. 첨부파일 가보고 싶은 곳(21.10.07. 현재).pdf 파일 다운로드 전국의 가볼만한 곳이 시도별로 *.pdf 파일로 정리되어 있습니다. 위의 '가 보고 싶은 곳.pdf' 파일을 내려 받으시면 전국 가볼만한 곳이 정리되어 있습니다. 강원도...,2021. 2. 14.
한국관광공사 추천 - 국내여행지 100선(계절별),충주 #충북선 (충남 연기군/충북 제천시) 2월 - 온천여행 92. 창녕 #부곡온천 (경남 창녕군) 93. 예산 #덕산온천 과 #덕숭산 (충남 예산군) 94. 속초 #척산온천 (강원 속초시) 95. 완주 #화심온천 (전북 완주군) - 겨울 산사 96. 가평 #현등산 (경기 가평군) 97. 부안 #개암사 (전북 부안군) 98. 화순...,2020. 11. 26.
세종 문화재 여행 연동 송용리 마애여래입상,"세종특별자치시 문화재자료 제4호를 찾아 세종 문화재 여행 연동 송용리 마애여래입상 충남 연기군에서 세종특별자치시로 지명이 바뀌면서 지역이 좀 더 넓어졌는데도 사람들은 세종시를 신도시로만 생각하는 경향이 많습니다. 세종시 연동면은 효자 효녀도 많이 났고, 열녀도 많이...",2021. 7. 21.
시간여행TV의 주식투자전략 19-개헌관련주,"오늘은 시간여행TV의 주식투자전략 챕터 22. 테마주 중 개헌관련주를 공부해 보았다. 챕터 22. 실전투자를 위한 훈련-테마주(개헌관련주)... -세종시에 2곳의 사업장이 있으며, 충남 연기군에 토지와 공장 보유 2)오스템 : -주요 사업 분야는 자동차 부품제조업. -신규 사업으로 안마의자...",2020. 7. 20.
4월 여행 명소. 가볼만한 곳. 추천베스트. 갈만한 곳. 진달래 벚꽃 튤립축제. 부산알림이...,4월 여행 명소. 가볼만한 곳. 추천베스트. 갈만한 곳. 진달래 벚꽃 튤립축제 4월 가볼만한 곳. 베스트명소 제주 한림공원 튤립. 녹산로 가시리... 화개리 오십천변 영천 4월 중순 경북 영천시 평천리 임고수변공원 금산 홍도 4.28 충남 금산군 남일면 신정2리 홍도마을 고복저수지 4.22 충남 연기군...,2021. 3. 27.
조천연꽃공원 연꽃명소 금계국 만개,"충남 동북부에 위치한 특별자치시 세종시로 떠나본 날 2010년 세종시 설치 관한 특별법에 따라 충남 연기군 전역, 공주시 일부와 충북 청원 일부를 흡수 2012년 광역자치단체로 출범한 세종시 세종시 가볼만한 곳 조천 연꽃공원 조치원 연꽃공원 두 발로 떠나는 여행 '연꽃'하면 가장 핫한 장소로...",2021. 6. 5.
미리 찾아가는 익산미래유산 2. 왕궁면,"같은 해 9월, 충남 연기군 송성국민학교에서도 미감아 한 명 때문에 등교를 거부하는 사태가 또 일어났어요. 연이은 등교거부 사태로 마침내 왕궁남초등학교 온수분교로 승인이 되고 선생님들이 발령받아 오시며 아이들의 교육문제가 해결되었습니다.” ▶왕궁남초등학교에 아직도 남아있는...",2020. 6. 19.
충남 전의 세종나무시장 다녀왔어요,"하늘의 '여행같이가요' ■ 충남 전의 세종 나무시장 전의 세종나무시장 매년 3월말, 4월초는 벗꽃의 계절답게 어딜가든 쉽게 꽃 구경이 가능합니다.... (사람들로 북적한곳 실내공간은 가지마세요) 오후엔 어머니의 부름으로 천안에서 충남 전의 나무시장에 다녀왔는데요 예전엔 연기군 소속이었는데...",2020. 3. 29.
로드 자전거여행 [랜도너스 서울400K] 무박2일 라이딩 체험기,충남 연기군 서면 쌍류리 72-1. 근처에서 곧 만날 업힐 전에 잠깐 휴식을 취했다. 슬슬 기온이 떨어져서 몸이 으슬으슬 해졌다. 아무래도 소화가... 타이어를 바꾸려고 코어밸브를 뺐는데 물이 콰르르르~ 이 물을 담고 달렸다니..ㅠㅠ #로드자전거 #자전거여행 #랜도너스 #랜도너스 서울400K...,2020. 5. 29.
충북선따라 오송~청주,"여행 오송에서 청주까지의 19.43km, 이번코스에선 경부선이 오송역에 KTX, SRT가 일 이십 분 간격으로 운행을 해서 충북선 출발점으로 용이하다. 전반부에 12km나 강변을 거슬러게 될 미호천( 39.07km)은 충북 음성군 삼성면 마이산(472m)에 있는 망이산성에서 발원하여 진천군·청주시 및 충남 연기군을...",2021. 7. 5.
방구석 미술관 2,"여성 여행 중 김우영은 법학 공부로 베를린에, 혜석은 파리에 남아 그림 공부 아내의 생활을 부탁한 최린과 애정행각으로 부부간 신뢰가 깨짐... 폭음으로 충남 연기군 고향으로 오게 됨, 그곳에서 작품 활동 전쟁 후 서울로 올라와 생계를 위해 애씀, 서울대 미술대학 대우교수로 재직 1960년...",2021. 9. 3.
박수근미술관 아카이브 특별전,바라본 충남 연기군 남면 방축리 귀농당년 귀농전년 농촌으로 온 사람들 원골에 별이 빛나는 밤 원골마을 별빛 수선화밭에서 아기 강아지 찾기... #강원관광 #강원도여행 #강원도구석구석여행 #강원도가족여행 #강원도비대면여행지 #박수근미술관 #박수근파빌리온 #박수근현대미술관...,2021. 5. 7.
공주 가볼만한곳 충현서원과 공암마을 겨울 풍경을 담다!,겨울 풍경이 조용하고 편안한 힐링 여행지 마법에 걸렸나~~ 세상이 온통 흰색으로 빛나! 동장군이 기세등등하여 겨울 추위가 연일 계속되었는데... 그리고 충남 공주시 반포면 학봉리에서 발원하여 연기군 금남면에서 금강으로 흘러드는 용수천도 보입니다. 온통 눈이 쌓여 있어서 그런가 겨울다운...,2021. 1. 29.
"국립현대미술관에 기증된 1,488점의 ‘이건희 컬렉션’ 베일을 벗다","이중섭, 흰소, 1953~54, 30.7x41.6cm / 이중섭(1916~1956)은 자신의 정체성을 종종 ‘소’에 빗대어 표현하곤 했다. 소는 일제강점기부터 조선인을 상징하는 동물이었는데, 특히 흰색은 조선인의 색으로 인식되었기 때문에, ‘흰소’가 가지는 상징성은 매우 크다고 할 수 있다. 이중섭은 일제강점기...",2021. 5. 17.
국립공주박물관,"충남지역 문화재 258,661여 점의 문화재를 수집 보관하고 있답니다. 국보 18점, 보물 4점 등 학술적 가치가 높은 중요문화재가 많으니 공주여행을... 연기군 조치원에서 발견되었는데 충청도 연기 지방을 중심으로 발전한 독특한 신앙 형태를 알 수 있는 귀중한 유물이라고 합니다. 공주...",2021. 5. 6.
형제사랑 기나긴 모정의 세월,부추를 몽땅 따주시고 쌈짓돈도 풀어 놓으셨다 내고향군산 전의이씨 30세손 / #군산율북리 #여행사진작가 #이종예 #전의이씨종가집 지난 3월27일... 시조할아버지 조선명당으로 알려진 산소 (全義李氏) 시조 이도(李棹)의 묘는 충남 연기군 전의면 유천리에 있다. 천안에서 1번 국도를 따라 남쪽으로...,2021. 4. 10.
제13회 충남•세종 향토사 대회 '충남•세종의 강과 바다',"충남역사문화연구원 태안향토문화연구소 공동 주관 행사 제13회 충남•세종 향토사 대회 '충남•세종의 강과 바다' 10월 19일 오후 1시 30분, 오랜 기간 연기되었던 충남·세종향토사연구연합회(회장 이해준)와 국립해양문화재연구소(소장 김연수)가 공동 주최하고, 충청남도역사문화연구원(원장...",2020. 10. 21.
5월 여행 명소. 가볼만한 곳. 추천베스트. 갈만한 곳. 튤립 철쭉산행. 첫사랑 꽃잎,"소백산 충남 도청 영산홍. 연기군. 천안 단국대 강원 태백 태백산. 정선 두위봉. 홍천 비발디파크. 춘천 영산홍 오봉산, 컨트리클럽 경기 군포시. 성남 청계산. 남양주 서리산 축령산. 화성 삼성전자. 부천 고강본동. 안성 영산홍. 가평 연인산 서울 관악산. 강동 천호공원 5월여행 가볼만한 곳...",2021. 4. 25.
4월 여행 명소. 가볼만한 곳. 추천베스트. 갈만한 곳. 진달래 벚꽃 튤립축제,4월 여행 명소. 가볼만한 곳. 추천베스트. 갈만한 곳. 진달래 벚꽃 튤립축제 4월 가볼만한 곳. 베스트명소 제주 한림공원 튤립. 녹산로 가시리... 화개리 오십천변 영천 4월 중순 경북 영천시 평천리 임고수변공원 금산 홍도 4.28 충남 금산군 남일면 신정2리 홍도마을 고복저수지 4.22 충남 연기군...,2021. 4. 1.
행정중심복합도시,대의명제아래 충남연기군.충북부강면일원에 설치하였으며 국책사업지로는 특별구역인 행정중심복합도시와 주변지역인 금남면.장군면.부강면.... 또한 주변도시인 대전.청주.공주ktx역에 BRT노선을 연결하여 여행객들이 주변도시를 통해들어오고 주변도시를 여행하기 편리하도록 정시성을...,2021. 5. 29.
진천 농다리(鎭川 籠橋) 210228,"여행일자 : 2021. 02. 28 6. 이동수단 : 개인(자차) . 망포-진천농다리 주차장 79Km 1:30분 3500원, 무료도로 89Km 1:55분 7. 소개 충북 진천군 문백면 구곡리... 미호천(美湖川)은 충북 음성군 삼성면 마이산(472 망이산, 매산)에 있는 망이산성에서 발원하여 충북 진천군, 청주시 및 충남 연기군을 거쳐...",2021. 3. 1.
"어렸을 때 기억, 마가린 간장밥 잊지 못해","여행작가 호미숙입니다. 블로그씨, 정말 오랜만에 답변을 해보네요. 오늘은 2020년 9월 1일 20여 년 살던 집에서 새로운 집으로 이사하는 날입니다.... 제가 어렸을 때 충남 연기군 현재의 세종시 깡촌에서 7남매 중 막내로 위로 큰언니와 작은 언니와 나이차는 16살 13살 그 아래 오빠 4명들과 3년. 2년...",2020. 9. 1.
대한민국 대표여행지 1000 - 그래도 책이 잘 나가는데는 이유가 있다.,"대한민국 대표 여행지 1000은 책 제목 그대로 우리나라 (남한 지역만 해당) 곳곳의 가볼만한 곳을 추려서 간략하게 소개해주는 책인데, 많은 곳을... 모르겠으나, 충남지도에는 2020년에 나오는 개정판에도 연기군이 존재하며, 계룡시가 대전과 한데 묶여 있다는 점에서 경악을 금치 않을 수 없다....",2020. 8. 7.
"서울 전동킥보드 대여, 반포한강공원에서 연습(바이클로반포점)라이클",호미숙 여행작가입니다. 호미가 아주 특별한 체험? 배우기를 했어요. 바로 전동킥보드입니다. 사실 자전거는 오래 탔지만 킥보드는 이번이... 그런데 재미있는 건 서로 인사 나누다가 호미가 누군지 소개하려고 인플루언서 홈의 @호미숙 보여드렸는데 여기에 제 프로필의 충남 연기군 글자를...,2020. 5. 31.
[전시] 서울전시추천_이건희 컬렉션 특별전 : 한국미술명작_국립현대미술관(MMCA)...,"그림 ☑︎ 충남 연기군에서 태어나 학생 시설 여러 미술 대회에서 입상 ☑︎ 일본 제국미술학교에서 유학하였고, 해방 이후 김환기, 유영국, 이규상 등과 '산사실파'동인을 결성하여 활동함 ☑︎ 1945-1960년까지는 서울대에서 교수 생활을 했으며 이후에는 전업 작가 생활을 함 (1챕터에 그의...",2021. 8. 23.
"인왕산 1코스(광화문, 경희궁~인왕산 자락길, 수성동)-2","-2: 월암공원~홍난파가옥~딜쿠샤~인왕산자락길~수성동계곡~통인시장 월암공원 국립기상박물관을 에워 싼 한양도성이 깔끔하게 복원된 것은 그리 오래된 일이 아니다. 복원도 복원이지만, 어느새 이 주변도 ‘상전벽해(桑田碧海)’라는 말이 전혀 과장이 아닐 정도로 변모했다. 서대문에서...",2021. 8. 22.
포스트 코로나시대의 한가위를 보내며...,그러나 다른 한편에서는 수백만 인파가 여행을 떠날 채비를 하고 있다고 한다. 민족 대이동 대신에 여행 대이동이 벌어질 태세니 우려스럽기 짝이... 금년 설날 가족성묘 사진 [410여년 선영을 새롭게 조성하다] 본래 우리 선영(先瑩)은 엿 충남 연기군 남면 방축리 일원(현 세종특별자치시 방축동)에...,2020. 10. 5.
김형국의 미학산책/ 탄생 100주년 맞은 장욱진 화백(2017년 4월),그 아버지가 전염병으로 갑자기 타계하자 지금은 세종시 한 귀퉁이가 된 옛적 충남 연기군 동면 내판들의 천석(千石)지기 종가를 떠나 일가는... 최근 일본여행에서 들었던 일화도 그렇게 인재가 자랄 수 있겠구나 싶어 기대감으로 나 혼자 기쁜 마음으로 ‘소설을 썼다’. 일본 규슈의 깊은...,2020. 10. 29.
7월 여행. 가볼만한 곳. 계곡. 해수욕장 캠핑장. 추천 베스트. 전국 축제일정,7월 여행. 가볼만한 곳. 계곡. 해수욕장 캠핑장. 추천 베스트. 전국 축제일정 7월에 가볼 만한 야간여행 명소. 관광공사 * 달빛 아래 누리는 고궁의... 충남 연기군 서면 용암리 208-5 대덕숲 유원지. 충북 청원군 미원면 대덕리 266-1 용연 청소년야영장. 충남 천안시 동남구 목천동 교촌리 산19-1...,2020. 6. 29.
석불 조성의 배경( 석굴암의 상세도포함),(진홍섭 교수님의 글을 많이 참고하여 정리 했습니다. 감사합니다.) 대체로 절을 짓고 불상을 조성하는 데는 깊은 인연이 따르게 마련이다. 국가의 安泰를 기원하는 일에서 부터 개인의 복을 빌기 위한 일에 이르기 까지 여러 가지가 있다. 석불의 경우도 예외는 아니다. 이러한 造佛의 배경은 당시의...,2021. 6. 8.
강원도 양양 남애3리해수욕장 동해안 여름 7월 여행지 추천,특히 충남 연기군 현재의 세종시 산골 출신인 호미에게는 바다는 꿈의 풍경이었습니다. 처음 바다 가본 지가 언제인지 까마득합니다. 그동안 여행을 시작한 뒤로 바닷가를 찾는 일이 잦았지만 갈 때마다 미혹된다고 할까요? 서해바다는 서해바다 나름대로의 특징을 갖고 있어 특히 저녁놀 질 때...,2020. 7. 29.
독서노트(꿈 너머 꿈),"충남 연기군의 한 임대아파트에 칠십대 노인이 한 분 살고 계셨다. 노인은 아내를 잃은 뒤 동네 아파트 공사장 막노동으로 생계를 유지하며 힘겹게... 태울 줄 알아야 한다.”<한창기/ 뿌리 깊은 나무 사장> 한 걸음이 모든 여행의 시작이고, 한 단어가 모든 기도의 시작이다,<틱낫한> 대명매(2021. 3.14)",2021. 3. 16.
"금강 종주! 군산->대청댐->세종시 라이딩~(9.11), 안락했던 그러나 첫 200km",혼자 여행은 더욱 청승 맞게 이럽니다. 이제 대망의 금강라이딩을 시작합니다. 금강하구둑 인증센터 정말 아쉽게도 종주수첩을 안 가져왔습니다... 위험합니다!!!(충남 연기군 금남면 부용리 571) 현재로서는 공사가 되려면 시일이 걸릴 것이고 당분간은 저 자전거 길은 건너 가실수 없습니다. 물론...,2020. 9. 13.
"[미술계 소식] 국립현대미술관, 이건희컬렉션 1,488점 세부 공개 - 세기의 기증...","이중섭, <흰소>, 1953~54, 30.7x41.6cm 장욱진(1917~1990)은 충청남도 연기군의 부유한 집안 출신으로 중고등학교 시기는 서울에서 보냈다. 명문 경성제2고보에 입학했으나 자퇴하고 양정고보에 편입했는데, 양정고보 재학 중 1937년 조선일보에서 주최한 제2회 ‘전조선학생미술전람회’에 <공기놀이...",2021. 7. 21.
빵빵!여기는 특별한 도시 세종시-알고 떠나는 우리 도시 땀방,"특별한 세종시를 여행할 코스도 보여주고 있습니다. 지금의 세종시는 충남 연기군, 공주시,충북 청원군의 일부를 합해 만든 도시에요. 산과 강이 어우러진 평범한 농촌을 행정도시로 만든거죠. 세종시는 똑똑한 도시락 해요. 이유는 책에 설명이 되어있습니다~ 밀마루 전망대에서 내려다본 정부...",2020. 5. 13.
탁트인 고복저수지·곰이 있는 수목원 (베어트리파크),"탁트인 고복저수지·곰이 있는 수목원 (베어트리파크) <주말여행>연기 가볼만한 곳-여름날, 무심히 바라보다 본격적인 휴가철이다. 어린이들이... ▶베어트리파크 충남 연기군 전동면 송성리에 위치한 베어트리파크(원장 이선용)는 서울에서 1시간 20분 거리로 경부고속도로와 연결된 1번...",2020. 10. 9.
慎協 시집 단순한 강물,"10 쪽수 : 153 ISBN : 89-7734-153-1 사양 : 46판 정가 : 6000원 저자소개 慎協 충남 연기군 전동면 출생 대전고, 서울 문리대 국문과 졸 고려대 대학원... 달나라 여행 月国の旅行 辨明 弁明 연 凧 나의집 私の家 落葉으로 돌아와서 落葉として帰ってきて 물 1 水 1 물 2 水 2 물 3 水 3 물 5 水 5 물 6 水 6 물 11...",2020. 6. 17.
8월 여행. 가볼만한 곳. 여름휴가지. 계곡 바다 섬 캠핑장 휴양림,8월 여행. 가볼만한 곳. 여름휴가지. 계곡 바다 섬 캠핑장 휴양림 강원도 여름 휴가지 : 매봉산 풍력발전단지. 구와우마을 해바라기축제.... 충남 연기군 서면 용암리 208-5 대덕숲 유원지. 충북 청원군 미원면 대덕리 266-1 용연 청소년야영장. 충남 천안시 동남구 목천동 교촌리 산19-1...,2020. 7. 27.
