header,contents,date
[카페추천/충주여행] 충주의 핫플 카페앤드,"어느여행지를 가나 카페 하나쯤은 방문하게 되잖아요 역시나 어떤 카페를 가볼지 고민하다가 생긴지 얼마되지 않은 것 같은 분위기있는 카페를 찾았죠! 충주의 골목길에 위치한 ""카페앤드 &"" 입니다 :) 주소 : 충북 충주시 동수2길 46 1층 영업시간 : 오전 10시 ~ 밤 10시 ※ 월요일 휴무 주차가능여부...",2021. 8. 27.
짧지만 힐링되는 단양 1박2일여행 필수코스,"단양 1박2일 여행코스를 짜시는 분들이라면 충주를 꼭 들러보시길 바랄께요!! 되게 좋아요. 충주댐 그린가든 043-851-6531 충북 충주시 동량면 1342-9 평일 09:30 - 21:00연중무휴 쏘가리회 130,000원 송어회 25,000원 향어, 붕어회 22,000원 쏘가리탕 50,000원 메기탕 30,000원 충주댐 그린가든은 #충주송어회맛집...",2020. 4. 24.
아빠본색 김지현 홍성덕 마지막회 ⭕️충주호 휴게소 위치 주소 일민 신곡 쇼가요중심...,충주호 악어봉 휴게소에서 본 게으른 악어카페 충북 충주시 살미면 월악로 927 충주호 휴게소 ⭕️ #김지현 나이 키 대한민국의 가수이자... 충주여행을 끝으로 하차 하는데 여행중 휴게소에서 본 풍경이 예술이네요 위치는 게으른악어 카페 이고 맨위에 누르면 주소 나와요 코로나19때문에...,2020. 7. 26.
충주여행 최응성 고택 힐링되는 충주고택 여기네,"충주여행으로 딱~ 최응성 고택 관련해서 자세한 경비나 참여방법 등이 궁금하시다면 아래를 보고 확인하시면 될 거 같습니다 저도 이거 보고 갔는데요, 일정도 여러가지로 선택할 수 있으니 참고하시면 좋을거 같아요 전화번호 ***-****-**** 주소 충북 충주시 살미면 중원대로 2220",2021. 8. 26.
격하게 먹어본 충주 맛집 소개,"좋았어요 여행온 가족단위 방문하기 좋았습니다. 4. 충주 뱃살공주 주소 - 충북 충주시 연수동산로6길 8 진성빌딩 전화 - 0507-1414-0323 시간 - 11:30~03:00 돼지 오겹살 15,000원 / 갈매기살 13,000원 이번 여행의 하이라이트는 충주 맛집 뱃살공주도 한몫했습니다. 야식겸 술한잔 때리기위해 찾아간 곳인데...",2020. 12. 3.
국내 여행지 추천 충주 중앙탑사적공원,둥근 달이 떠있었고 중앙탑 바로 앞에도 둥근달이 떠있어 밤에 사진을 찍으면 더 멋스럽다. 국내 여행지 추천인 중앙탑사적공원은 충주여행코스로 한번쯤 들리면 좋다. 찾아가는 방법은 네비에 충북 충주시 중앙탑면 탑정안길 6 찍고 가면된다. 바로앞 무료주차장 이용 가능하고 입장료는 무료이다.,2021. 2. 21.
월악산 악어떼 충주호 촬영장소 한국기행 찬바람이 불면 나 홀로 떠나볼까 충북 충주,나 홀로 떠나볼까 12월 9일 (수) 밤 9시 30분 배우 정은표의 충주를 여행하는 법 정보 : 활옥동굴 주소 : 충북 충주시 목벌안길 26 (지번) 목벌동 319 전화 : 043-848-0503 정보 : 종댕이길 주소 : 충주시 종민동 마즈막재 주차장 전화 문의 : 043-850-5823 충주시청 산림녹지과 아는 동네라 생각했지만...,2020. 12. 8.
#충주탑평리칠층석탑 / 중앙탑 / 충주박물관,"충주 탑평리 칠층석탑 / 중앙탑 충북 충주시 중앙탑면 탑평리 11 1962년 12월 20일 국보 제6호로 지정되었다. 화강석으로 만들었으며, 높이 14.5m로... ♡ #충주탑평리칠층석탑 #충주중앙탑 #중앙탑 #국보6호 #충주여행 #충북역사여행 #아이들과함께하는역사여행충주 #중앙탑사적공원 #충주가볼만한곳...",2021. 9. 12.
캠핑카 & 차박 / 충북 충주 수주팔봉,"* 언택트 : 접촉하다는 의미의 콘택트(contact)에 언(un)의 의미를 합친 합성어 / 비대면 여행 트렌드 ""차박"" 캠핑 자동차에서 즐기는 캠핑으로 따로... 493m로 충북 충주시 살미면 향산리에 위치하고 있으며 야트막하지만 날카로운 바위로 이루어져 있어 그 위세가 당당하다. 수주팔봉 일대는 옥천계...",2020. 8. 19.
충북 단양 추천 여행지,"ㅤㅤ “좋은 날씨와 바람만 있으면 어디든 갈 수 있어… (아련)” ㅤㅤ 충청북도 여행지의 꽃, 단양! ㅤㅤ 단양은 공기가 좋고 맑은 곳이라 시원한... 월악산은 충북 충주시, 제천시, 단양군과 경북 문경시에 걸쳐 있으므로 방문하실 주소는 자세한 위치 선정 후, 검색 부탁드립니다. [보발재]...",2020. 9. 1.
충주여행 best 4 /1박2일추천코스,Local tour '아이엠그라운드지기'에요 ∞⌒⌒ 2021.중부내륙 힐링여행 교육의 일환으로 다녀온 당일치기 충주여행을 포스팅해보려 합니다. 드라마... 충주 자유시장/무학시장 043-848-2292 충북 충주시 봉방동 4-58 충주 전통시장은 5일장이에요. 5/10/15/20/25/30 일에 장에가면 정말 사람도 많고 다양한 살것도...,2021. 9. 6.
카약체험 활옥동굴 충북 제천 충주 가볼만한곳,#제천여행 #제천활옥동굴 #충주활옥동굴 - 이 포스팅은 직접 비용을 지불하고 작성한 솔직하고 개인적인 포스팅입니다 - 안녕하세요 잇님들... 하고 카약체험도 하고 너무 좋은 추억을 만든곳이랍니다!̆̈ 충주 활옥동굴 주소 : 충북 충주시 목벌안길 26 영업시간 : 09:30~18:30 전화번호 : 043-848-0503,2020. 9. 9.
복숭아 농장,지치고 힘들다면 지금 당장 충청북도 충주시로 여행을 떠나 보시기 바랍니다. 가족여행 전문가! 해외배낭여행 전문가! 여행유튜버! 활동 중인... 바로 충주시입니다. 충주시 복숭아는 전국적으로 유명하다고 합니다.이번 이야기는 충주 복숭아 농장입니다. 충북농업기술원의 최첨단 농업기술을...,2021. 7. 6.
원코스 충청도005 충주 대한민국을 여행하는 히치하이커를 위한 안내서,"통일신라 5소경(五小京) 중 중원경(中原京)이라 불렸던 충북 충주시(忠州市)는 ‘중앙탑(충주 탑평리 칠층석탑)’이란 별칭에서 보듯... 테마여행신문 TTN Korea 원코스 충청도(1 Course Chungcheong-do)와 함께 어제도, 오늘도, 내일도 멋진 여행을! B 경북 문경(聞慶) 문경새재도립공원(명승...",2020. 1. 8.
충주 수안보맛집 본가할매숨두부자연산 버섯찌개,본가할매숨두부 주소 : 충북 충주시 수안보면 물탕2길 8 (구주소 : 충북 충주시 수안보면 온천리 217-2) 영업시간 : 매일 07:30 - 22:30 전화번호 : 043-846-4764 할매숨두부는 지난번 수안보여행중 다녀온 곳인데요. 본가할매숨두부는 건물앞에 주차공간이 넉넉해서 주차걱정없이 이용할수 있어요~ . 저는...,2021. 10. 11.
"[충주여행] 추워서 긴팔 옷 준비해 가야하는 여행지, 카약을 타고 동굴 내부를 볼 수 있는...","출처 : 대한민국 구석구석 충북 충주시 목벌안길 26 (우)27485 (지번) 목벌동 319-8 #활옥동굴 - 문의처 · 활옥동굴 : 043-848-0503 · 활옥동굴 카페 : 043-854-0504 · 관람시간 : 하절기(4월~10월) 09:30 ~ 18:30(마지막입장 17시) 동절기(11월~3월) 09:00 ~ 18:00 (마지막입장 17시) · 관람요금 : 대인 7,000원...",2021. 8. 2.
"[켄싱턴호텔 앤 리조트] 경상, 전라, 제주 6개 지점 혜택+특가!",켄싱턴호텔 앤 리조트 켄싱턴리조트 충주 Previous image Next image 충북 충주시에 자리한 켄싱턴리조트 충주는 2020년 객실 전체를 리모델링하여 쾌적한 공간에서 휴식할 수 있어요. 일반 객실과 함께 애견동반객실을 보유하고 있어 사랑하는 반려동물과 함께 국내여행을 즐길 수 있는데요....,2021. 6. 3.
2021.9.26(日)~10.2(土)(土.영주소백산 여행),일상업무틈나면 수면 오후에 농협에서 동전교환등후 집 주변에서 1만보걷기 추가후 저녁식사후 검색식등공부하다. 전화: .......&&&&&....... 2021.10.2.토 10:01 영주쪽 10:01 영주 쪽 10:04 천등산휴게소 충북 충주시 평택제천고속도로 106(충주시 산척면 영덕리) 89km 11:24 경북영주시풍기읍,2021. 9. 27.
수주팔봉 - 친구들과 함께한 충북충주여행,물맛이 달아 ‘감천(甘川)’ ‘달래강’이라 불리기도 한 달천은 지금도 충주 시민의 식수원으로 귀한 대접을 받는다. 속리산 천왕봉 인근에서 발원해 충북 내륙의 산과 들을 적시며 수려한 계곡을 만든 달천은 충주에 이르러 그 품을 넓히고 충북의 2대 평야 중 하나인 달천평야를 만든다. 충주의...,2020. 11. 13.
"KBS 숨터 아름다운 산성, 충북 단양 온달산성 10월 8일 1104회 촬영지 장소 위치...","저에게 군사를 주신다면 가서 반드시 우리땅을 되찾겠습니다” 하고 아뢰고 “계립령(지금의 충주시 지릅재 일대)과 죽령 서쪽의 땅을 되찾지... 출저 : [네이버 지식백과] 온달산성 (답사여행의 길잡이 12 - 충북, 초판 1998., 6쇄 2003., 한국문화유산답사회, 김효형, 신미원, 김성철, 유홍준, 최세정...",2021. 10. 8.
충주 민들레 :: 한식도 좋고 분위기도 예쁜 곳,남편과 함께 떠난 가을 충주 여행 첫날 마지막 코스는 바로 충주 지역 내에서도 유명세가 자자하다는 민들레 한식집이었다. 사실 여긴 아주... + 주소 : 충북 충주시 동량면 지동로 1055 영업시간 : 오전 11시~밤11시 연중무휴로 운영 사실 이날 새벽 6시부터 차를 몰고 일정을 시작한 터라 저녁 8시가...,2020. 11. 17.
만족스러운 충주 맛집 리스트,친구들이랑 단톡방에서 충주 맛집 추천 리스트를 서로 공유하면서 이야기를 나눴는데요 그 중 매콤한맛이 땡기던날 방문 했다가 만족스러워서 소개해볼까 합니다 주소:충북 충주시 금제7길 14 전화번호:043-843-4408 운영시간:매일 11:00~22:00 충주시청 근처에서 도보로 1~2분 거리에 있어서 찾기도 쉽고...,2020. 9. 25.
"충주 무료 오토캠핑장 수주팔봉 유원지, 달천",충북 충주시 살미면 향산리에 위치한 수주팔봉은 야트막하지만 날카로운 바위로 이루어져 위세가 당당하다. 수주팔봉 일대는 풍화에 강한 암맥이 뚫고 들어간 곳이다. 수안보면에서 서쪽으로 흐르는 오가천이 달천과 합류하는 과정에서 심하게 곡류하면서 북동-남서 방향으로 길게 늘어진...,2020. 7. 28.
충주 최고의 차박 야영지 충북 충주에 위치한 수주팔봉일대입니다. ~ 영화 빈센조의...,~ 오늘은 충주 여행입니다. ~ 대한민국에 좋은 차박 캠핑 야영지가 있겠지만 이만큼 좋은곳 그만큼 많이 알려져 많은 캠핑족이 찾는 그곳을 다녀 왔습니다. 수주팔봉 충주시 대소원면에 위치한 팔봉!!. 수주팔봉 출렁다리에서 본 야영지는 음 ~ 정말 좋습니다. ~ 21년 5월 22일 토요일 오전!! 차가...,2021. 5. 23.
충북 - 충주 / 애견펜션 간다구? 난 애견수영장있는 리조트로 여행간다. 무게제한없이...,이런 일들로 상처받은 댕댕이들 이제 한곳에서 퀄리티있게 댕캉스 충주 켄싱턴리조트 충주점 위치 : 충북 충주시 앙성면 산전장수1길 103... 모두들 강아지와 함께 여행와서 그런지 강아지도 견주도 모두 즐거워 보였는데요. 드디어 저희도 체크인을 하기위한 모든 과정을 끝냈습니다! 1층에는 수...,2021. 5. 22.
차크닉 하기 좋은 차박 캠핑장!,안녕하세요 디파츠입니다 ^^ 코로나 19로 집콕과 거리두기가 일상화되어 사람들과의 접촉을 피하는 일명 '언택트 여행'이 떠오르고 있는데요.... 주소 : 충북 충주시 대소원면 문주리 #3 동해 추암 오토캠핑장 푸르른 바다풍경과 함께 해돋이 명소로 유명한 동해 추암해변에 위치해있는...,2021. 4. 15.
인기가 많은 로얄포레cc 라운딩가능한 국내골프여행』국내골프패키지 with Durigolf,"국내골프여행·1박2일골프 임페리얼레이크CC + 로얄포레CC + 켄싱턴리조트 호반의 도시 충주에서 이틀동안 다른 골프장에서 라운딩하며 피톤치드 그윽한 켄싱턴리조트에서 편안한 휴식!!! ■국내골프-임페리얼레이크CC■ '편안하고 아름다운 골프장' 18홀 / 72파 / 연장 6,313m 충북 충주시...",2021. 9. 18.
"아이와 함께 가보면 좋은 충주 가볼만한곳, 고구려천문과학관","안녕하세요 충주의 관광지, 축제, 맛집, 카페 등 충주의 모든 여행 정보가 있는 충주여행입니다^^ 아이들의 상상력은 어른들 보다 더 많은... 아이와 함께 가보면 좋은 충주 가볼만한곳, 고구려천문과학관 주소 충북 충주시 중앙탑면 묘곡내동길 100 고구려천문과학관 영업 매일 15:00 - 23:00...",2020. 8. 27.
"한적하고 풍요로웠던 충북 충주 여행기 오대호아트팩토리, 탄금대공원 그리고 라바랜드","사방팔방 사과나무로 울창한 과수원, 이 길을 따라 충주 여행을 떠났다. 전원 경치를 바라보며 어느새 도착한 충주는 여유 가득해 보였다. 오대호 아트팩토리 충북 충주시 앙성면 가곡로 1434 거대한 로봇과 함께 충주에 도착해서 처음으로 방문 한 곳 오대호 아트팩토리! 입구에서부터 심상치 않은...",2020. 6. 7.
"충주 맛집, 추운 날 따끈한 샤브샤브 먹기 좋은 채선당",저번 주에 충주 여행을 다녀오면서 충주 신연수동에 맛집이 많다고 해서 가봤어요 사실 맛집보다는 술집이 많은 거리였지만 갑자기 추워진 날 따끈한 국물이 당겨서 샤브샤브를 먹기 위해 채선당을 다녀왔습니다 후기 남깁니다. 위치: 충북 충주시 갱고개로 157 영업시간: 매일 11:00 ~ 22:00...,2020. 11. 17.
<충주> 초록초록 힐링 1박2일 여름청주여행( ⁎ᵕᴗᵕ⁎ )(1/2) [갈마가든-게으른악어...,활옥동굴 충북 충주시 목벌안길 26 이때쯤 온도가 거의 34도엿나..? 그늘에 있다가 사진찍으면서 너무 더워져서 시원한곳으로 가고싶었다 그래서 동굴로 피신하자!!ㅋㅋ 하고 출발할때 찾아봤던 #활옥동굴 로 고고했움 근데 여기 생각보다 너무너무 좋았다!!! 충주여행간다면 (특히 여름에) 꼭...,2021. 7. 27.
충주여행 지금 이시국 안성맞춤 최응성 충주고택으로 가요,충주여행 지금 이시국 안성맞춤 최응성 충주고택으로 가요 최응성 고택 주소 : 충북 충주시 살미면 중원대로 2220 전화 : ***-****-**** 안녕하세요. 엣지블 살구언니입니다. 오늘 제가 소개하는 정보는 지금 이 시국 안전하게 즐기기 좋은 충주가볼만한곳을 추천해드리고자 합니다. 바로 농촌체험...,2021. 8. 17.
"3월 갈만한 국내여행지 추천 (feat. 버릇처럼, 열두달 여행)","그래도 꽃들과 상관없이 3월에 안전하게 떠날 수 있을만한 여행지들을 소개해볼까 해요. 버릇처럼, 열두 달 여행 저자 홍수진 출판 푸른향기 발매... 충북 충주시 소태면 덕은로 596 / 번호. 043-855-9909 마지막은 바로 지난주에 다녀온 충주의 서유숙펜션으로 마무리 지을게요. 가는 길에 만난 충주의...",2021. 2. 28.
여름엔 시원한 냉면이 최고! 충주 평양냉면 맛집 삼정면옥,"안녕하세요 충주의 관광지, 축제, 맛집, 카페 등 충주의 모든 여행 정보가 있는 충주여행입니다^^ 여름철 시원한 음식 하면 냉면이 가장 먼저... 충주 냉면 맛집 삼정면옥 주소 충북 충주시 관아3길 21 영업 매일 11:30 - 22:00(Last order 21:00) 문의 043-847-4882 충주시 성서동에 위치한 삼정면옥은 30년째...",2020. 6. 24.
충주여행 :: 신양자강 :: 찾았다 인생 짬뽕! 가격도 양도 대만족,주소 : 충북 충주시 약막2길 5 영업시간 : 매일 11:00~19:30 평일 브레이크타임 15:00~17:00 월요일 휴무 전화번호 : 043-848-6336 주차 : 가게 앞 가능... 아 이번 여행 삼일중에 제일 맛있게 먹은 음식 = 신양자강 짬뽕 해물짬뽕 진짜 잊지못해ㅠㅠ 서울 체인점 부탁해여 사장님 #충주신양자강 #충주짬뽕...,2021. 8. 30.
충주 가을 여행지 웰니스 골목스테이,"충주 가을 여행지 깊은산속옹달샘 충북 충주시 노은면 우성1길 201-61 안녕하세요 빵쁨입니다! 오늘은 깊은산속옹달샘 x 아이엠그라운드 콜라보로 진행한 웰니스골목스테이를 다녀온 후기를 올려볼까 합니다! 자연속에서 쉼을 즐기고, 추억의감성을 깨우는 체험프로그램으로 심적으로 저...",2021. 10. 9.
충북도 퇴직공무원에 '순금 5돈' 등 13억 전별금 논란,"여행지는 이탈리아, 프랑스, 스페인 등 유럽을 포함해 유명 관광지를 도는 일정이 다수였다. 순금을 주는 곳도 있었다. 괴산, 단양, 영동, 옥천은... 금품제공이 없는 기관은 제천시와 진천군, 충주시 뿐이었다. 충북도 본청도 퇴직자에게 50만 원 상당의 국내·외 연수를 제공하고 순금 2돈...",2020. 10. 20.
[충주&단양] 중부내륙 힐링여행과 함께 하는 미션투어 테마여행,중부내륙 힐링여행 대 상 : 대한민국 국민 누구나 여행지 : 제천.단양.영월. 충주 중 2곳 이상 경유여행 미 션 : 1박이상. 현지식사. 유료관광지.... 충주 자연이 주는 여유 충청북도 충주시 중앙탑면에 위치한 천연염색 체험장 문의 : ***-****-**** 주소 : 충북 충주시 중앙탑면 감노로 2295 자연이 주는...,2021. 8. 9.
도시의 재구성편,도시이야기 오늘은 충북 충주시에 대해서 이야기해줄게 충청북도에 위치한 충주시는 인구 약 21만명의 도시로 최근 인구수는 소폭감소하는 추이이며 장기적으로는 충북에서 청주의 급격한 발전에 비하여 상대적으로 발전의 속도가 더딘 지역이야 여행 및 관광을 가기도 참 좋은 지역임에도...,2020. 8. 21.
#충주 탄금대_우륵이 가야금을 탄! 아이들과 산책하기 참 좋은!,충주 탄금대 충북 충주시 칠금동 주차료/ 입장료 : 무료 '탄금대'라는 명칭은 악성 우륵선생이 가야금을 연주한데서 유래하였다. 주차를 하고 나무가... 너희들과 함께 걸어 좋은길! #충주탄금대 #탄금대 #충주가볼만한곳 #충주여행 #아름다운충주 #충주아이들과산책하기좋은곳 #국내여행,2021. 9. 12.
장소 차박 수주팔봉 캠핑장 한국기행 찬바람이불면 물길따라굽이굽이 충북 충주 12월8일,"상호 : 마니따농장 주소 : 충북 충주시 하용두 2길 46 전화 : ***-****-**** 그렇게 비내섬 어부가 되었습니다 갈대를 많이 베어갔다고 해서... 손수 만들었다는 숟갈과 탁자에 여행 가방으로 만든 스피커까지- 물길처럼 자유롭게~ 흐르다 보면 새로운 풍경, 새로운 나를 만나게 됩니다. 자세한...",2020. 12. 8.
[여행정보] 충주 능이버섯요리전문점 샤브락 - 예쁜 조경에 월남쌈까지 주는...,"나를 위한 힐링여행, 트립앤미 입니다. 여러분은 외부에서 식사를 하실 때 가장 먼저 어떤 점을 고려하시나요? 메뉴와 평점? 식당을 선택할 때... 샤브락 043-853-4949 충북 충주시 안림로 167 매일 11:00 - 22:30 단독 주차장 있음, 단독룸 있음, 온돌 좌식 형태 착한샤브샤브 16,000원 (소고기 90g)...",2021. 8. 30.
"[충북 충주] 소태면 복탄리 ""서유숙펜션"" 방문기 (해인숙5동 방문후기, 감성...","주소: 충북 충주시 소태면 덕은로 596 입실 15:00 / 퇴실 11:00 전화: 043-855-9909 요금: 220,000원~ (2인 기준) 3월 어느날 충주에 위치한 한옥스테이 갬성이 뿜뿜한 서유숙펜션 방문기. 쓸이와 두번째 여행 ㅎㅎㅎ 일단 용산역에서 만나서 점심 먹고 고고고고!!!!! 이마트 참치김밥, 다코야끼 그리고 짬뽕까지...",2021. 4. 27.
충주라멘맛집 혼다라멘 곱창라멘 후기입니다.,맛집추천 #충북맛집 #충주 #충주맛집추천 #충주용산동라멘 #혼다라멘 #충주혼다라멘 #충주용산동혼다라멘 #충주곱창라멘 #곱창라멘 #충주여행... 충주 혼다라멘 주소 충북 충주시 금봉4길 13-3 혼다라멘 평일 오전11시부터 오후10시 브레이크타임 오후3시부터 오후5시,2020. 11. 21.
오늘은 충주시에서 시행하고있는 아실수도 혹은 모르실수도있는 몇가지 정보를...,마음 따뜻한 사회적 소상공업인 으로 언제든지 연락주시면 최선을 다해 일해드리겠습니다 *** -**** - **** #충주시 #지원사업 # 여행 #연수동 #시행사업 #20년대학수학능력시험 #충주시청 #그린에코산업 #클린에너지 #충주스카이차 #충북스카이차 #스카이차작업비용 #여행경비40%지원,2020. 11. 6.
충주 펜션 추천 '하늘과태양' 충북 펜션 추천,"오랜만에 가족들과 한적한곳에 여행다녀왔어요 _ 충주는 처음 와봤는데, 공기좋고 괜찮은 동네더라구요 저희가 1박했던 펜션 '하늘과태양'도... 또 방문할게요 충주펜션 '하늘과태양' 추천합니다 주소 : 충북 충주시 수안보면 미륵점말2길 20-15 (미륵리 248-26) 시간 : 24시간 전화번호 : ***-****-****",2020. 5. 11.
설레였던 충주 맛집,집에 돌아갈 때 차 안에서 뜯었는데 중독성 최고라고 해요ㅋㅋ 그리고 충주 맛집 때문에라도 앞으로 종종 더 오겠다고 했어요. 택배 사업도 하셨음 좋겠다며 혹시라도 그런 경우가 생기면 꼭 귀뜸 해달라고 했어요. 연락처 043-843-4408 영업시간 매일 11:00 ~ 22:00 연중무휴 위치 충북 충주시 금제7길 14,2020. 8. 15.
충주 관광지 고구려비전시관 외3 달달문화재야행 축제,"받으면서 여행 가즈아 외치면서 스타트를 시작했답니다. Previous image Next image 저희는 은하수반,,,,ㅋㅋㅋㅋ 은하수로 해서 은하수 버스를 타고 투어를 시작 하기로 했어요 처음으로 방문할곳은 충주박물관 입니다. 1.충주박물관 충북 충주시 중앙탑면 중앙탑길 112-28 043-850-3924 처음에는 충주...",2021. 10. 2.
충주 가볼만한곳 당일치기 리스트,"1.깊은산속옹달샘 깊은산속옹달샘은 충북 충주시 노은면에 위치한 명상 치유센터예요. 지금까지의 여행이 관광과 맛집에 집중했다면 이곳은 건강과, 행복, 웰빙에 비중을 두고 있는데요, 지난 2017년 한국관광공사에서 웰니스 관광지로 지정받으며 우리나라를 대표하는 힐링 여행지로 주목받고...",2021. 2. 24.
"충주호 벚꽃(충주) - 충북 충주 여행, 바람에 날린 벚꽃이 강물에 떨어져 유유히 떠가며...","바람에 날린 벚꽃이 강물에 떨어져 유유히 떠가며 한폭의 동양화를 그려내다 충주호 벚꽃 (충 주) 충주호는 충청북도 충주시, 제천시, 단양군에 걸쳐 있는 인공호수이며 면적 67.5㎢, 높이 97.5m, 길이 464m로 우리나라 호수 가운데 가장 크고 깨끗한 호수이다. 또 1985년 충주시 종민동과 동량면...",2021. 4. 1.
생생정보 26년 전통 오계메구이(경기 양평) 돌판 해물 갈비(충북 청주),me/GKm2wtmF #오계매구이 #호박도나기찜 #호박오리구이 <청춘시대> 26세 열정이 만든 돌판 해물 갈비 청춘식당 충북 충주시... 튀김) 부산 동구 성북로 46-1 ***-***-**** 부산 치유의 숲 부산 기장군 철마면 철마천로 101 ***-***-**** #부산여행 #요트 #웹툰이바구길 #떡튀김 #숲,2020. 9. 4.
"충주탄금호캠핑장 고캠프, 이래서 글램핑 하는구나!",별님이에요-★ 지난 충주여행에서는 글램핑을 하고 왔어요. 충주탄금호 조정경기장 바로 옆에 있는 충주탄금호캠핑장에서요~~ 난생 처음하는 글램핑에 여기저기 알아봤었는데 충주로 가길 정말 잘한 듯 합니다. 충주탄금호캠핑장 충북 충주시 중앙탑면 탑평리 117 031-932-8188 라온빌리지라는...,2021. 1. 18.
피서철 계곡 캠핑장 둘러보기,"힐링여행 가평 오토캠 40,000원 ~ 백운오양골캠핑장오양골캠핑장에 오신 것을 환영합니다. 99,000원 ~ 동물카라반펜션특색이 있는 펜션 59... 소나무숲아래충북 충주시 수안보면 미륵리사지길 29(미륵리 206-2)35,000원 ~ 오시유충남 천안시 동남구 광덕면 해수길 178-38(광덕리 720-12)150...",2021. 6. 3.
"충주&제천&단양 가족여행 1일차(악어봉, 이정동묵밥, 송계계곡)","충주, 제천, 단양으로 여행을 다녀왔습니다. 최대한 음식은 야외나 숙소에서 먹고 사람 없는 곳으로만 다녔으니 충주, 제천, 단양 여행이... 이정동묵밥 충북 충주시 쇠저울1길 13-2 평일 10:00 - 21:00 월요일 10:00 - 15:00 능이짬뽕묵밥 9.0 냉채묵밥 8.0 임자탕 8.0 거리두기 4단계로 6시 이후에는 2인 이상...",2021. 8. 17.
