header,contents,date
펫키지 일산 호텔 위치 정보 소노캄 카트 레이싱 어디? 태연 윤은혜 김희철 홍석천...,"펫키지 태안 카트 레이싱 위치 정보 충남 태안군 안면읍 백사장1길 59 안면카트체험장으로 추정됩니다. 반면에 펫키즈 태안 팀 홍현희, 강기영, 홍석은 야심차게 준비한 여행 코스로 바로 반려견 동반 탑승이 가능한 카트 레이싱 장을 방문했으며 반려견용 헬멧부터 반려견과 탑승 가능하도록 설계된...",2021. 9. 16.
"태안 만리포 맛집, 착한가격에 넉넉한 인심 가득한 시골밥상","넉넉한 인심으로 착한 가격에 푸짐한 한 상을 차려주는 곳으로 태안 여행객에게 즐거운 기억을 남겨줄 태안 만리포 맛집, 시골밥상을 소개합니다. 시골밥상 충남 태안군 소원면 대소산길 368 매일 8:30 - 16:00 / 일요일 12:30 오픈 ※ 재료 소진시 조기 마감 될 수 있음 시골밥상은 만리포해수욕장에서...",2021. 7. 14.
태안 캠핑장 :: 신두리정원캠핑장 아기랑 성공적인1박 2일,태안 신두리정원캠핑장 충남 태안군 원북면 신두리 1210-58 ***-****-**** 텐트 칠 수 있는 시간은 1시인데 장보고 이것저것 하느라 2시에 도착! 이미... ㅋㅋㅋㅋ 체크아웃하고 바로 옆에 있는 신두리사구센터에 가보았어요 여행 갔으면 그지역 박물관이나 센터같은데 들르면 아이한테 참 좋지요...,2021. 9. 1.
안면도 가족여행과 해루질 펜션 - 2021년 4월25일 일요일,"충남 태안군 안면읍 황도리 마을은 갯벌의 대부분을 유어장과 바지락 양식장 및 모시조개(가무락) 양식장으로 태안군으로부터 허가받아 황도 어촌계에서 관리 및 운영하고 있는 사유재산입니다. 외부인의 주, 야간 갯벌 출입을 단속하고 있으니 주의하시기 바랍니다. 안면도 가족여행과 해루질...",2021. 5. 7.
조개캐기 갯벌체험은 우리 아이들에게 놀이동산보다 몇배나 좋은 경험을...,"태안 진산리 어촌계 충남 태안군 남면 진산2길 187-33 하루 전, 몽산포 해수욕장에서 2시간 동안 조개를 캐보려고 노력했는데, 맛조개 두마리, 동죽 두마리 밖에 못잡았어요. 아이들이 자신의 노력에 비해 수확물이 없다보니 실망한 눈치였습니다. 그래서 검색을 해봤어요. 그러다가 많은 분들이...",2021. 10. 5.
충남태안여행 서해 바다 아이와 가볼만한곳 파도리 해수욕장,파도리 해수욕장 태안여행 서해바다 아이와가볼만한곳 #태안여행추천 #태안여행 #서해바다 #서해해수욕장 #파도리해수욕장 충남 태안군 소원면 모항파도로 490-85 매일 10:00 - 19:00 불금즐기며 급 ! 여행계획세워 다음날 바로 출발한 태안여행 역시 여행은 급떠나야 재미있죠 : ) 주말에 비온다고...,2020. 7. 28.
충남 태안 _ 이원식당 (박속밀국낙지탕),"올해 첫 포스팅은 1박 2일 충남 태안 여행이야기로~~~~~~~ 2020, 올 첫 여행은 충남 태안으로 가볍게~~~~~~ ㅎ 숙소는 안면도와 다리로 이어진 ""황도""로 잡고 내려가는 길에 점심을 먹기위해 찾은곳은 태안군 북쪽 이원면에 있는 ""이원식당"" ""박속밀국낙지탕""을 먹기위해~~~~ ㅎ ""이원식당...",2020. 1. 6.
충남 태안의 예쁜 사막 신두리 해안사구,태안의 여행지 신두리 해안사구를 소개해드릴 황상큼입니다. 신두리 해안사구 충남 태안군 원북면 신두해변길 201-54 신두리 사구센터 네비에 신두리 사구센터를 검색해서 가면 신두리 해안사구가 보입니다 주차는 신두리 사구센터 주차장이나 신두리 해안사구 주차장에 하면 됩니다. 이 날은...,2021. 8. 7.
"[충남여행 : 당진 태안] 당진 태안 여행 코스 추천, 당진 태안 핫플 여행","이번 여행 숙소 아주 만족❣️ 신두리해안사구 충남 태안군 원북면 신두해변길 201-54 #신두리해안사구 는 우리나라 최대 규모의 해안사구 지역으로 조류와 연안류에 실려 온 모래가 파랑에 밀려 사빈으로 올라온 뒤, 바람에 날려 그 배후에 운반퇴적되어 형성된 해안지형이다...",2020. 8. 29.
5월 국내여행지 추천 연휴 때 가볼만한곳 안면도 여행코스,"[주소] 충남 태안군 안면읍 안면대로 31711-8 [영업시간] 평일 09:00 ~ 18:00 주말 08:00 ~ 20:00 (토) 09:00 ~ 18:00 (일) [휴뮤] 첫째, 둘째 화요일 전화 문자 예약시 10%할인 까지 ! 가성비도 최고에다가 할인까지 더 해서 먹어 볼 수 있는 5월 국내여행지 추천 안면도 연휴 때 가볼만한곳 여행코스로 무조건 가성비...",2021. 5. 12.
안면도여행 #3 안면도카페 :: 안면도 가볼만한 곳. 사진찍기 좋은 예쁜 디저트 카페...,안면도카페 SEIO macaron 시오마카롱 주소 : 충남 태안군 안면읍 중장리 1477-77 2층 안면도 여행에서 힐링의 장소였던 시오카페 요것도 #안면도맛집 검색하면 파워랭커로 나오는 카페인데 예쁘게 잘 꾸며져 있어서 그런 것 같다 겉보기엔 그냥 그럴듯해 보이지만 실내 내부인테리어가 너무 예뻤던곳 바다...,2021. 4. 2.
태안 안면도 여행 서해 일출 명소 대야도,"서해 일출 명소 태안 안면도 여행 대야도 일출 여행일 : 2021년 3월 1일 / 글, 사진 : 순수시대 주세환 새벽 4시 알람 소리에 맞춰 눈을 비비면... 충남 태안군 안면도 대야도는 아름다운 일출을 만날 수 있는 곳으로 썰물 때가 되면 앞에 있는 토끼섬까지 갯벌이 드러나는데 걸어서 이동하면서 돌게와...",2021. 3. 3.
충남 태안 신두리 해안사구 국내최대의 모래언덕 신두리해수욕장,충남가볼만한곳 신두리해안사구 태안해변길 안내 신두리 해안사구는 충남 태안군에 있는데 모래언덕으로 되어진 사막과 같은 분위기의... 국내최대의 모래언덕 제주도 오름을 걷는 듯한 느낌 충남여행 태안 신두리해변사구 좋아요. 괜찮아요. 가족과함께 충남여행을 하게되면 한번쯤 걸어보는것도...,2021. 8. 8.
"충남 태안 간장게장 맛집 :: 화해당 후기 , 수요미식회 나온 내돈내먹",주소 : 충남 태안군 근흥면 근흥로 901-8 운영시간 : 매일 10:00 - 20:00 마지막 주문 19:00 / 화요일 휴무 주차 : 주차장 크게 되어있음 돈스파이크 유튜브에서 돈스파이크가 여기 간장게장이 진짜 맛잇다고 한 영상을 보고 태안을 가게 된다면 꼭 가야지 생각 했다가 드디어 태안여행을 가게 되면서 화해당...,2021. 9. 5.
6월은 꽃과 나무와 함께,"6월의 싱그러움이 살아 있는 충남의 수목원. 꽃과 나무가 만발하는 충남의 수목원으로 여행 한번 어떠신가요? 자연의 보고 태안 천리포 수목원... ▶소재 : 충남 태안군 소원면 천리포1길 187 울창한 숲과 함께 당진 삼선산 수목원 상쾌한 기운을 뿜어내는 숲, 그 속에서 뿜어져 나온 피톤치드는...",2021. 6. 3.
"[토지투자] ""태안군기본계획""으로 태안 바로 알기","새만금 땅에 두 번째 땅 등기를 위해, 열심히 지역을 찾아보던 중 ""충남 태안군""이 아주 매력적으로 느껴져 임장 활동을 다녀왔습니다.... 대부분의 분들이 한 번은 여행으로 다녀왔을 법한 태안은 갖가지의 축제들도 많습니다. 세계 튤립축제, 황토축제, 연꽃축제, 허브축제, 대하축제, 빛 축제...",2020. 12. 29.
"충남 안면도 태안 카페추천 시그니처커피 ""텅커피"" 애견동반카페","""오늘의 쭈이기록"" 태안여행이 끝나고 집으로 오는길에 엄청 맛있는 시그니처커피가 있다고해서, 남편을 꼬셔 가족들끼리 헤어지기전 카페한번 갔다가 헤어지기로 했어용 카페 텅 ✔️위치: 충남 태안군 태안읍 중앙로 305 1층 CAFE TUNG ✔️ 운영시간 : 매일 10:00 ~ 18:00 월요일 휴무 ✔️주차장...",2021. 7. 27.
[충남/태안]어서와 핑크뮬리와 팜파스(억새풀)는 처음이지? 가을가을한 하늘과 자연의...,"이곳은 바로바로 청산수목원인데요 근교에서도 안가던 수목원 이렇게 충남태안에야 와서 이렇게 왔네요 ���� 청산수목원 충남 태안군 남면... 사고 ㅋㅋㅋㅋㅋㅋㅋ 애정이 싹트는 태안당일치기 여행이였네요 연인, 친구, 예비부부, 가족 모두모두 예쁜사진도 찍으시고 리프레쉬 하기 좋은...",2020. 10. 7.
충남 태안 가볼만한곳 : 천리포 수목원,ㅠ 충청도는 여행지로서 대한민국 최하급으로 그중 태안은 괜찮은 곳에 속합니다 주차장 주소 : 충남 태안군 소원면 천리포1길 161 주차장 주소 찍고 가면 바로 나오고 주차비 무료 입니다 주차장이 큰편이 아니라 주말의 경우 주차문제 발생할수도 있을듯 보였습니다 태안 천리포 수목원 입구...,2020. 8. 29.
태안카페 밀리앤코@아이와함께하기좋은 베이커리카페♬,[태안카페] 밀리앤코 아이와함께하기좋은 베이커리카페♬ (2021/06/20) 주소: 충남 태안군 태안읍 송암리 742-13 도로명: 충남 태안군 태안읍 용샘길 147... 태안여행중 꼭 들려보시길♬ 꼭꼭 강추하고 싶은 밀리앤코 입니다! 아이와함께하면 더더욱요~ 넓은 실외카페를 아이와 맘껏 누빌수 있는 밀리앤코...,2021. 7. 27.
[태안여행 / 태안캠핑] 태안 청솔 야영장 2박 3일 캠핑 (Feat. 캠핑끝 꽃놀이가자) - 3일차,주소 : 충남 태안군 남면 마검포길 200 봄이 가기 전에 태안 꽃을 또 보고 가야지! 해서 꽃을 보러 출동 했다. 주차장이 휑~해서 혹시 문 안연건 아닐까 괜한 걱정을 했다. 그냥 코로나 때문에 적은 것 뿐이였음ㅋㅋㅋㅋ 들어가자 보이는 꽃들에 기분이 좋아졌다. 원래 꽃에 관심이 없었는데 요즘 들어...,2021. 5. 10.
안심했던 꽃지해수욕장 맛집 리스트,"지난주엔 짱친들과 여행 중 현지인도 줄서 먹는다던 꽃지해수욕장 맛집을 다녀왔어요. 게국지는 양이 푸짐한 것은 물론 대단한 감칠맛도 지녀 만족했기에 공유해봐요. 1. 강복순의 안면꽃게 간장게장 25,000원 / 게국지 45,000원 주소 : 충남 태안군 안면읍 방포로 29-4 강복순의안면꽃게 연락처 : 041...",2021. 5. 20.
태안 안면도 가볼만한곳 일몰명소 드르니항,드르니항 충남 태안군 남면 신온리 주차 가능 작년부터 안면도 일몰명소 핫플레이스로 인별사진들을 볼때마다 기회가 되면 가봐야지~ 했던 딸래미랑 여행을 떠나면서 아름다운 석양을 만나 볼 수 있겠구나 했는데 일몰시간때를 놓치면서 안면도펜션 정원에서 일몰을 감상하게 되었어. 안면도...,2021. 9. 25.
[태안 학암포오토캠핑장] 충남태안 캠핑여행/휴가장소 추천/자동차 야영장/캠핑장 추천,태안 학암포오토캠핑장 충남 태안군 원북면 옥파로 1152-37 학암포오토캠핑장 (주차가능) 예약안내 https://reservation.knps.or.kr/information/campInfo.... 빠질 수 없죠 ෆ 지금 생각해도 웃음이 지어지는 첫 캠핑장 ෆ 추천드려요 ෆ #태안 #태안여행 #충남 #충남여행 #캠핑 #캠핑장 #캠핑추천,2020. 9. 22.
안면도 추억여행과 해루질 체험 - 2021년 5월13일 목요일,"충남 태안군 안면읍 황도리 마을은 갯벌의 대부분을 유어장과 바지락 양식장 및 모시조개(가무락) 양식장으로 태안군으로부터 허가받아 황도 어촌계에서 관리 및 운영하고 있는 사유재산입니다. 외부인의 주, 야간 갯벌 출입을 단속하고 있으니 주의하시기 바랍니다. 안면도 추억여행과 해루질체험...",2021. 5. 14.
"무더운 여름, 언택트여행, 충남의 여름명소!","- 소재 : 충남 태안군 원북면 황촌리 초보 강태공들의 천국, 전국구 낚시터 예산 예당저수지 예당저수지의 여름은 늘 특별합니다. 그곳을 살아가는... 공주 #미르섬 #태안 #구례포해변 #예산 #예당저수지 #아산 #신정호수 #충남가볼만한곳 #충남여행지 [출처] 충남의 여름명소|작성자 충청남도",2021. 7. 15.
충남 태안 여행 - 안면도 휴플레이스 키즈펜션,전국에서 가운데는 어디인가요 ㅎㅎ 이번에는 안면도로 떠나봤어요 ~ #충남여행 #안면도여행 #안면도펜션 친구가 폭풍검색해가지구 ~ 7월 초중순인 이때 준성수기 시작직전 ? 예약을 딱 했지유 광주에서는 2시간 정도 걸린거 같아요 주소 : 충남 태안군 남면 곰섬로 487 #충남키즈펜션 아이들이 신나게...,2020. 8. 1.
안면카트체험장 : 태안여행 안면도 슈퍼맨이 돌아왔다 촬영지,4월 첫째주에 태안을 다녀왔어요 태안여행 중에 첫번째로 소개할 곳은 아이들이 너무 즐겁게 체험했던 안면 카트 체험장입니다. 장소 및 할인정보 안면카트체험장 기본 정보 전화 041-675-1003 주소 충남 태안군 안면읍 백사장1길 59 지번 창기리 1262-269 영업시간 평일 09:00 - 19:00연중무휴 주말 09:00 - 19...,2021. 4. 19.
풀빌라 태안 펜션 갯벌체험 가족 숙소,여행을 즐길 수 있겠다. 아름다운 태안의 자연을 더욱 가까이서 느끼고 싶다면 태안 숙소 선정이 고민이 될 텐데 태안 펜션 자작나무는 신두리 해수욕장이 가까울 뿐 아니라 부대시설까지 빠짐없이 갖춰 태안 풀빌라 펜션이나 갯벌체험 펜션을 찾는다면 이곳이 정답이겠다. ⊙ 주소 : 충남 태안군...,2021. 7. 19.
"태안 수제버거 맛집, 파도리 인생버거 ""태안 여행 올때마다 꼭 들려서 먹는...","안녕하세요~ 오늘은 토요일 주말입니다~ 저는 어제 급 주말여행을 계획해서 지금 태안으로 강아지와 함께 여행 중이랍니다^^* 어제 갑작스레... 태안 수제버거 맛집 파도리 인생버거 위치,휴일,가격정보 ★ 주소 ★ 충남 태안군 소원면 파도길 63-6 < 지번 : 소원면 파도리 687 > ★ 영업시간 ★ 주말...",2021. 7. 31.
[태안여행]신두리 사구센터~학암포 카라반 후기,"얼마전 다녀왔던 1박2일 태안여행 ^^ 신두리 사구센터~ 학암포 카라반~카페 몰로 까지 보여드릴게요. 신두리 해안사구 사구센터: 매일 09:00 - 18:00... 카페 몰로 충남 태안군 소원면 모항항길 94 카페몰로 평일 11:00 - 19:00 주말 11:00 - 20:00 체크아웃을 하고, 오션뷰 카페를 찾아서 카페몰로로...",2021. 3. 18.
태안 안면도 여행 가볼만한곳 세계튤립축제 공원 코리아플라워파크,"전, #태안안면도 여행을 다녀왔어요. 간 김에 #태안튤립축제 도 보고 왔는데 넓은 부지에 다양한 튤립꽃들이 피어있어서 눈이 아주 황홀해지는 시간이었답니다 :D #태안세계튤립축제 가 열리는 #태안세계튤립공원 은 바로 #코리아플라워파크 충남 태안군 안면읍 꽃지해안로 400에 위치하고 바로...",2021. 5. 3.
국내 1박2일 가을 여행지 추천 프라이빗 해변 힐링하기 좋은 해루질펜션,"짐이 되지 않을까 생각했는데 재료들을 안가져왔으면 완전 후회 엄청 했을거예요 !ㅠㅠㅠ 이렇게 프라이빗 해변도 있는 국내 1박2일 가을 여행지 로 알맞는 펜션, 그리고 해루질까지 가능한 펜션은 바로 충남 태안군 이원면에 위치한 #파인비치펜션 입니다. 파인비치펜션은 2018년 우수숙박업소 로...",2021. 9. 24.
입에맞던 안면도 맛집 모음,"우연히 방문한 안면도 맛집이지만 여행의 꽃이 되어주던 곳이라 모르면 후회할뻔했어요. (2) 르스튜디오블루 가격 : 아메리카노 3,500원 / 자몽에이드 6,000원 주소 : 충남 태안군 안면읍 꽃지해안로 204 전화번호 : 변동 영업시간 : 변동 식후에는 꽃지해수욕장에서 차로 4분 걸리는...",2021. 4. 26.
"태안 소소펜션, page 7에서의 1박 2일 + 바베큐 솔직한 후기","소소펜션, page 7 @조용한 휴식을 위한 노키즈 독채 펜션 충남 태안군 남면 안면대로 1296-36 입실 15:00 - 퇴실 11:00 바베큐 가능, 수영장 있음 http... 작정하고 챙겨온 홀츠클로츠 커피 드리퍼) 코로나가 없던 재작년 여름에도 함께 제주도 여행 다녀왔던 그멤버 리멤버. 남동생과 신랑은 중요한 시험과...",2021. 9. 11.
4월 국내여행 놀러가기 좋은곳 갯벌체험 과 함께 바다도 볼 수 있는곳,"후회없는 갯벌체험여행이 되실거랍니다 태안 무지개펜션 충청남도 태안군 이원면 내리 580-29 태안 무지개펜션 저희가 예약했던 4월 국내여행 놀러가기 좋은곳 갯벌체험이 가능했던 펜션은 충남 태안군 이원면에 위치한 #무지개펜션 입니다. 무지개펜션은 신축펜션이 아니였지만, 그래도 넓은 객실과...",2021. 4. 6.
태안 가볼만한곳 만대항 포구 여행과 가성비 만점 만대수산시장 횟집,만대항 충남 태안군 이원면 내리 만대항은 충남 태안의 가장 북쪽에 있는 아담한 포구입니다. 오래전부터 단골로 찾고 있는 자드락 펜션을 가다... 여행자의 속을 확 풀어주는 이 음식은 지금까지 여행하면서 많은 곳의 매운탕을 먹어봤지만 자신하건대 최고의 맛입니다. 아담한 크기의 포구도...,2021. 1. 16.
"【수도권여행】 충남서산수골프앤리조트, 태안빛축제에 다녀오다.","성실한 탑 이부장은 가족들과, 1박 2일 서산쪽으로 여행을 다녀왔답니다. 너와 함께 라면 조아조아~~ 자, 그럼 떠나볼까요. < 충남 서산수골프앤... <태안빛축 제 : 태안군 남면 마검포길200> 충남서산수리조트에서 차로 1시간10분정도 소요되는 태안빛축제,네이쳐월드에 도착하였어요. 입장료는...",2021. 2. 14.
d+1252 : 아이와 태안여행 갯벌체험하러 서해로~,태안여행 2일차 아침은 햇반이랑 비비고 곰탕 끓였다가 으익 맛이 없다.. 누누는 공룡에 관심이 없지만 #안면도쥬라기박물관 은 유명한곳이니 가보기로 함.. 안면도쥬라기박물관 충남 태안군 남면 곰섬로 37-20 https://m.place.naver.com/attraction/20136626 성인 1만원 어린이 6천원 날씨가 너무 더워서...,2021. 6. 19.
[태안 가볼만한곳] 일몰명소 만리포해수욕장 외 3곳 소개합니다,태안여행지로 추천드려요:) 3. 만리포해수욕장 충남 태안군 소원면 모항리 천리포 수목원과 가까이 있어서 관람 후 들렀던 곳이예요 도착했을 때 마침 일몰타임♡ 태안의 일몰명소로도 유명하더라구요~~ 그냥 누가 봐도 와~~아~~ 소리질럿!!! 멋지다!! 환호성이 나오는 뷰였어요~~ 구름도 멋있구...,2021. 8. 13.
서해 태안 여행 : 안면도 꽃지 해수욕장 갯벌 물때,태안 여행 하면서 볼거리 뭐 있나.. 하고 슬쩍 다녀왔습니다 안면도 꽃지 해수욕장 여행날짜 : 2021년 2월 23일 방문소요시간 : 30분 겁나 넓은... 주소 : 충남 태안군 안면읍 승언리 339-586 C 가 엄청 큰 주차장이고 B 가 해안도로변 주차장으로 둘다 해변에서 매우 가까워 어떤곳에 주차하셔도 큰...,2021. 3. 4.
태안여행:: 내돈내산 안면도 게국지 꽃게탕 맛집 꽃지꽃게집,3줄 요약 각자 사느라 바쁜 친구와 떠난 태안 배낚시 여행 난생처음 낚아올린 우럭의 손맛과 직접 만든 매운탕 그리고 매운탕의 맛은 잊지못해. #안면도맛집 #태안맛집 #서해맛집 #충남맛집 #태안군맛집 #안면도꽃게탕 #안면도게국지 #안면도간장게장 #안면도새우장 #안면도양념게장 #태안꽃게탕...,2021. 8. 1.
안면도 여행코스에 꼭 있어야 할 카트체험장 찐재미네,주소 : 충남 태안군 안면읍 백사장1길 59 전화번호 : 041-675-1003 영업시간 : 매일 9시~19시 연중무휴 주차할 공간은 넉넉하다 :) 인스타 포토존 :) 안면도 여행에 추억으로 남을만한 포토존이었다. 안면도 카트체험을 하면서 사용할 수 있는 예쁜 헬멧! 취향껏 아무거나 선택해서 쓰면 된다. 예쁜 헬멧들을...,2021. 9. 29.
[서해 여행] 충남 태안 숙소 - 라벨르 풀빌라 숙박 후기,태안 라벨르 풀빌라 겨울철 어디로 여행을 떠나볼까 하며 고심 끝에 충남 태안으로 여행을 결정했습니다. 이제 지역을 결정했으니 숙소를... - 라벨르 풀빌라 펜션 - 주소 : 충남 태안군 남면 곰섬로 223-29 연락처 : ***-****-**** 입실 15:00 · 퇴실 11:00 홈페이지 : http://www.labellepool.kr,2020. 1. 3.
언제 먹어도 맛있는 안면도 횟집,"마린횟집 대표메뉴 : 활어회 - 80,000~150,000원 /세트메뉴 - 80,000~120,000원 / 대하 - 70,000~110,000원 주소 : 충남 태안군 안면읍 방포항길 115 전화번호 : 041-673-8878 영업시간 : 평일 09:00 - 22:00 주말 09:00 - 24:00 오랜만에 바다를 보니까 역시나 힐링되는 기분이었다. 내가 좋아하는 여행 스팟이기도 한...",2021. 8. 17.
입맛 살아난 꽃지해수욕장 맛집 게국지,"먹방여행을 갔다가 알게된 곳인데 단골집 같은 편한 분위기에 스페셜한 플레이팅이 인상적인 곳인데 미식가들의 성지같은 곳이었어요 5.신태루 짬뽕6,000 짜장5,000 주소: 충남 태안군 태안읍 시장5길 43 신태루 번호: 041-673-8901 시간:매일 10:00-19:30 / 화요일 휴무 태안중학교 맞은편에 있는...",2021. 6. 21.
태안 안면도 카페 반려견 동반 카페 트레블브레이크 커피,주소 충남 태안군 안면읍 등마루1길 125 운영시간 월 - 금요일 10:00 - 20:00 토 - 일요일 10:00 - 20:30 연락처 050-2266-1000 주차 가능하다. 메인 도로에서... 아쉬운 맘으로 서울로 복귀한다ㅠ 돌아가기 싫어라. #태안카페 #안면도카페 #반려견동반카페 #대형견카페 #트레블브레이크 #애견동반여행 #애견동반카페,2021. 9. 22.
충남 태안 당진 1박2일 애견동반 여행 다녀온 후기,애견동반 여행 후기 한 걸로 치면 어딜 많이 다니거나 하지는 않았지만 펜션에서 코코도 저도 너무 재미있게 놀다온 하루여서 만족 스럽고 다음날 당진에 아미 미술관도 다녀왔습니다 라온애견펜션 충남 태안군 남면 진산1길 229-76 애견동반 펜션으로 울타리가 쳐져 있고 15kg까지 가능해요...,2020. 2. 24.
일곱가지 무지개색으로 빛나는 충남,"무지개의 7가지 색처럼 충남에서 찾아보는 아름다운 곳으로 랜선여행을 가보실까요? ""빨강색"" 공주 미르섬 금강 옆에 놓여 있는 섬이라서 공주... < 만리포해수욕장 > 위치 : 충청남도 태안군 소원면 모항리 ""남색"" 홍성 홍예공원 홍예공원은 내포신도시 중심부에 충남도서관과 함께 같이 있습니다....",2021. 3. 4.
충남/태안 신축 독채풀빌라::봄날,"풀빌라 봄날 spring day 입실 15:00 - 퇴실 11:00 충남 태안군 남면 진산1길 277-123 인원 : 기준 2인 ~ 최대4인 개별 바베큐 가능 남자친구와의 1000일... 오픈한지 채 1달도 안된 숙소였다 꺄 원래 주말은 55만원인데 49만원에 예약했당 럭키 덕분에 부산에서 태안까지 장거리 여행을 떠났,,ㅎㅎ 일이 있어...",2021. 8. 10.
태안 펜션 청포대해수욕장 갯벌체험 짱인 숙소,"여행으로 다녀오기에 최적화된 숙소랍니다. 그래서 저도 조만간 조카들 데리고 다시 함 다녀오려고 한답니다. 이 멋진 오션뷰 스파 감성 숙소와 바닷가에 대해 자세히 설명할게요. - 글. 사진/ 별빛 가득 차향 태안 더클래식펜션 입실시간 /15시, 퇴실 11시 문의전화/ ***-****-**** 주 소/ 충남 태안군...",2021. 7. 14.
"태안 파도리 해수욕장 해피준, 해식동굴 인생샷",원래도 카페 가는 걸 좋아하지만 요즘처럼 더운 날씨에 여행을 다닐 때면 뜨거운 햇빛을 피해 쉬어가는 시간도 꼭 필요한 것 같아요. 태안 파도리 해수욕장에 있는 해피준은 개인적으로 태안에서 가장 좋아하는 카페라 잇님들에게도 소개해 보고 싶어요. 태안 해피준 주소 : 충남 태안군 소원면...,2021. 8. 7.
[충남여행] 태안 가볼만한곳 한국의무이네 '신두리해안사구',"충남 태안군에 위치한 '신두리해안사구'입니다!! 신두리해안사구센터 네비에 '신두리해안사구센터'로 검색해서 오시면 되요 그럼 관리소까지 안내해줄거예요~ 오시다보면 신두리해안사구 전용 주차장도 있고, 주변 도로에 주차해주셔도 됩니다!!ㅎㅎ 신두리해안사구 국내 최대의...",2021. 1. 11.
골든베이cc 충남의 명품 골프장!7월 8월 골프여행,"(요금변동) 주소 충남 태안군 근흥면 정죽리 386-1 골든베이골프&리조트 개장일 2010년 8월 코스규모 회원제 27홀 / 파108 / 9,865m 잔디 페어웨이... 골든베이투스칸빌리지(골프장내위치) 궁금하신 사항 있으시면 강실장을 찾아주시고, 미리 연락주시면 느긋하고 여유로운 골프여행을 준비하 실...",2020. 6. 24.
