header,contents,date
"[논산여행 떠나You] '사색의 길'을 걷다, 논산 백일헌 종택",무엇보다 백일헌 종택의 사색의 길을 걸으면서 얻을 수 있었던 것은 한 걸음씩 내디딜 때마다 자신의 내면을 들여다볼 수 있었다는 것입니다. 논산을 방문할 분들은 명재고택이나 상상마당과 연계해서 백일헌 종택을 찾아보시기 바랍니다. 백일헌 종택: 충남 논산시 상월면 주곡길 45,2020. 12. 25.
"논산시 가볼만한 곳, 은진면의 소소한 풍경 속으로",오늘은 여러분께 논산시 은진면의 #천주교공소 #석림사 #은진현관아터 소개를 하려고 합니다. 여행 명소는 아니지만 우리 주변의 소소한 풍경... 은진면 추천 코스: 은진향교 - 석림사(입구 주차) - 은진현관아터 - 천주교은진공소 은진현관아터(은진초등학교): 충남 논산시 은진면 매죽헌로 25번길 1,2020. 7. 7.
"[논산여행 떠나You] 예학의 고장 논산의 서원, 강경 죽림서원","논산 죽림서원은 충남 논산시 강경읍 황산리에 위치한 곳으로 충청남도 문화재자료 제75호로 지정된 곳이라고 합니다. 특히 율곡 이이와 우계 성혼, 사계 김장생, 정암 조광조, 퇴계 이황, 우암 송시열 등의 선현들에게 제사를 지내고 후학을 교육하기 위해 세운 서원이라고 하는데요. 특히 율곡...",2020. 11. 4.
"논산으로 떠나는 고택여행, 눈 오는 날 찾은 임수택 가옥",논산시내에서 떨어진 곳에 있는 임수택 가옥은 충남 논산시 연산면 오산리 117-3에 위치해 있는 고택으로 가옥이 이곳에 세워진 것은 1703년으로 거슬러 올라가는데 윤원거의 손자인 윤임교의 처에 의해 건립되어 유지되다가 한국전쟁 발발 직전인 1946년 임수택의 소유가 된 곳이라고 합니다. 눈이...,2021. 1. 15.
[논산여행 떠나You] 다양한 이야기와 볼거리가 있는 논산 언택트여행지 개태사,"이렇듯 개태사에는 다양한 이야기와 볼거리들이 가득했는데요. 코로나 시대, 가족과 함께 찾을 수 있는 언택트 여행지를 찾고 계신다면, 논산 개태사에 한번 들러보시는 것은 어떨까요? 논산 개태사 041-734-8730 충남 논산시 연산면 천호리 111 주차장 있음",2020. 10. 13.
"[논산여행 떠나You] 성 대건 신부의 자취를 찾아서, 논산 강경성지성당","성지순례를 위해 강경을 찾는 분들은 강경성지성당과 성김대건신부기념관, 그리고 성김대건신부 유숙성지도 빼놓지 않고 찾아보시기 바랍니다. * 강경성지성당 & 성김대건신부기념관 -주소: 충남 논산시 강경읍 옥녀봉로 27번길 13-3 -문의전화: 041-745-1298",2020. 3. 27.
명재고택 #충남 논산여행 #국내여행 #데이트하기좋은곳 #산책 #힐링#항아리 #조선후기...,명재고택 충남 논산시 노성면 노성산성길 50 충남 논산시 노성면 교촌리 306 (지번) 전화 : 041-735-1215 이용 : 10:00~16:00 중요민속자료 제190호 조선 숙종 때의 학자인 윤증이 건축하였다고 하나 후대에 개수 등이 있었던 듯 현존건물은 19세기 중엽의 건축양식을 보이고 있습니다. 옛 건축물과...,2020. 12. 28.
[논산여행 떠나You] 비 오는 날 산책 코스로 추천하는 논산 종학당,늘 패키지여행처럼 시간에 쫓기다가 종학당 정수루에서 참다운 여유를 맛보았습니다. 다음에는 책이라도 한 권 가지고 와서 읽으면 좋겠다는... 종학당에서 들은 빗소리와 창문 안으로 빌려온 풍경들로 다시 종학당을 찾게 될 것 같습니다. 종학당 가는 길: 충남 논산시 노성면 병사리,2020. 7. 21.
"[국내여행] 논산 가볼만한곳 명재고택과 종학당으로,",여행일시 : 2020.09.03. 태풍 마이삭은 떠났지만 그 후유증은 전국적으로 깊게 남겨진듯 하다. 비가 그치고 바람도 잦아들었지만 산행하기는... 명재고택 사색의길 명재고택(윤증선생고택) 명재고택은 충남 논산시 노성면 교촌리에 위치하는 파평 윤씨의 한 종가이다. 명재 윤증선생(1629~1714)은...,2020. 9. 4.
[논산여행 떠나You] 초겨울에 찾은 논산 노성 애향공원,"노성산을 등산을 마치고 애향공원에서 잠시 휴식을 취하고 아래쪽으로 내려와서 주변에 있는 명재고택이, 노성향교 그리고 궐리사 등을 돌아보면서 논산시 노성면의 향기에 취해보아도 참 좋습니다. 논산 애향공원 주소 : 충남 논산시 노성면 교촌리",2020. 12. 8.
논산여행1 선샤인스튜디오01 | 미스터션샤인 대탈출3 국내유일 개화기 영상촬영장...,"선샤인스튜디오 충남 논산시 연무읍 봉황로 90 1811-7057 월요일 10:00 - 18:00 (입장마감 17:30) 매주 수요일 휴무 주차장있음. 재성이네는 현장예매를 했는데 네이버예약을 통해 예약을 하면 할인된 가격이네요. 다음엔 네이버예약으로 예매하고 가야겠어요. 단, 네이버 예약의 경우 당일 사용은...",2021. 6. 9.
[논산여행 떠나You] 강경 죽림서원과 팔괘정 그리고 임리정,현재 임리정은 강경유림의 소유로 되어 있다. 임리정기비는 임리정 앞마당 비각 안에 보호되어 있습니다. ▷ 죽림서원 - 주소 : 충청남도 논산시 강경읍 금백로 20-8 - 전화 : 041-730-3226 ▷ 팔괘정 - 충남 논산시 강경읍 황산리 86번지 ▷임리정 - 주소 : 충남 논산시 강경읍 금백로 20-8,2020. 11. 25.
[논산여행 떠나You] 논산 관촉사에서 만나는 꽃무릇의 매혹적인 모습,"코로나 탓에 온라인 강의가 이어지면서 대학에서 사진학을 전공하는 아들과 사진 여행을 다닐 기회가 생겼습니다. 사회적으로 침체된 분위기지만... *논산 관촉사 -찾아가는 길 : 충남 논산시 관촉로 1번 길 25 -문의전화 : 041-736-5700 -입장료 : 어른 2000원, 청소년 군경 1500원, 어린이 1000원 -홈페이지...",2020. 10. 2.
"논산 여름여행, 명재고택에서 종학당까지. #2",충남 논산 명재고택 충남 논산시 노성면 노성산성길 50(교촌리 306) 하절기 10:00-17:00 │ 동절기 10:00-16:00 충청남도 중요민속문화재 제190호 명재고택은 대문도 담장도 없다. 노성산 아래 고택이 있고 커다란 느티나무가 감싸안은 장독대가 있다. 대문도 담장도 없다고 시도 때도 없이 방문객이...,2020. 9. 1.
"[논산 여행] 논산 당일치기. 미스터션샤인 촬영지 - 선샤인랜드(선샤인스튜디오), 논산...",떠나기 좋은 날씨 션샤인랜드 충남 논산시 연무읍 봉황로 102 수요일 휴무수요일이 공휴일인 경우 개관 (다른날 휴무) 매일 09:00 - 17:00점심시간 12:00~13:00 / 11~2월 매일 09:00 - 18:00점심시간 12:00~13:00 / 3~10월 041-746-8480 주차장 큼 당일치기로 떠난 여행 진짜 션샤인랜드 하나 보러 3시간인가...,2021. 9. 29.
견훤왕릉 #충남 논산여행 #국내여행 #후백제 #산책 #힐링 #데이트 #묘,"견훤왕릉 충남 논산시 연무읍 금곡리 산 18-3 충청남도기념물 제26호 지름 17.8m, 둘레 70m, 높이 4.5m 다른 왕릉에 비해 규모가 약간 작게 느껴지고 주변 시설은 없지만 조용하고 아담함을 느끼며 둘러보기 좋습니다. 묘 자리는 기가막힌것 같습니다. 올라가는 길인데 계단이 높지 않고...",2020. 12. 21.
"[논산여행 떠나You] 산책하기 좋은 곳, 논산 시민공원",길어지는 코로나 19로 면역력이 그 어느때보다 강조되고 있습니다. 마스크 착용하고 거리두기를 하며 논산시민공원으로 산책 어떠세요? ▷ 논산시민공원 - 찾아가는 길: 충남 논산시 관촉동 333-1 - 주차정보 : 논산 문화원 입구 공영주차장,2020. 12. 22.
논산가볼만한곳 선샤인랜드 미스터선샤인촬영지,선샤인랜드 체험여행 041-746-8480 주소 충남 논산시 연무읍 봉황로102 지번주소 논산시 연무읍 황화정리 859-44 매일 09:00-17:00 점심시간 12:00-13:00 매주 수요일 휴무 미스터 선샤인 촬영지 선샤인 스튜디오 주차장은 제1주차장 제2주차장 등 주차공간은 정말 넘칩니다. 물론 무료주차이구요. 관람료는...,2021. 7. 20.
"[논산여행 떠나You] 코로나19 시대, 논산의 언택트 여행지 논산 시민공원","일명 '코로나 시대'를 살아가고 있는 요즈음, 나와 모두의 건강을 위해 코로나19 여파 속에서도 최대한 안전하게 여행을 할 수 있는 비대면(언택트)... 다소 조심스러울 때, 이렇게 가까운 곳에서 공원 산책을 즐기며 마음의 여유를 가져 보시는 것은 어떨까요? 논산 시민공원 충남 논산시 관촉동 333-1",2020. 9. 2.
충남 논산 개태사 대전근교 드라이브 기분전환하기,개태사 태조왕건의 삼국통일을 기념하여 지은 사찰 위치 : 충남 논산시 연산면 계백로 2614-11 논산 천호산 밑에 위치 있음 특징 : 평지에 위치해 있는... #개태사 #논산8경 #천호산 #논산절 #대전근교드라이브 #대전근교데이트 #힐링여행 #힐링데이트 #고려시대 #고려시대문화재 #태조왕건 #개태사철확...,2021. 4. 20.
[논산여행 떠나You] 대웅전 중창불사가 한창인 개태사를 찾아서,충남 논산시 연산면 천호리에 위치한 개태사는 고려의 태조 왕건이 창건한 호국종찰입니다. 왕건은 후백제를 토벌한 기념으로 황산에 개태사를 세웠다고 하는데요. 그 후 오랫동안 폐사지로 남아 있다가 수차례의 불사를 통해 지금의 모습을 갖추게 되었습니다. 불사는 지금도 진행되고 있는데요....,2020. 11. 3.
논산 여행 _406-1번 버스의 종점 쌍계사,"오랜만에 쌍계사를 찾아 너무나 익숙하지만 한편으로는 반가운 풍경에 매료되었습니다. 다가오는 추석 연휴에는 사람 많은 곳을 피해 쌍계사에서 한가롭게 거닐어 보는 것도 좋을 듯합니다. 쌍계사 가는 길: 충남 논산시 중산길 192 연중무휴, 무료입장",2020. 9. 6.
"[논산여행 떠나You] 국화향으로 깊어가는 가을, 논산시민공원 국화전시장","분들이 시간에 맞추어 화단에 물도 주고, 청소도 하고, 시민들의 안전에도 힘을 씁니다. 코로나로 어려운 시기지만 언제나 그랬듯이 힘차게 극복할 수 있다는 엄지척 릴레이를 펼쳐 봅니다. 논산 시민공원 국화 전시장 찾아가는 길 : 충남 논산시 관촉동 333-1 주차 정보 : 논산문화원 입구 주차장 여유",2020. 10. 28.
[논산여행] 여운이 오래 남았던 선샤인랜드,"지난 10월의 어느 날, 당일치기로 갔던 여행기 기록해봅니다. 발열체크와 큐알코드 체크인을 한 후에 티켓을 끊고 들어가니 딱, 이문구가... 충남 논산시 연무읍 봉황로 102에 위치해 있어요! 함께 긴 글 읽어 주셔서 감사해요! 더 많은 사진과 글씨는 아래주소로 와주세요:)감사합니다! https://www....",2020. 10. 15.
"논산시 가볼 만한 곳, 연산면을 한 바퀴 돌아볼까요?","논산시공식블로그(https://blog.naver.com/nscity)인데요. 논산의 가장 빠른 소식과 함께 논산의 여행지, 이벤트, 축제 등의 정보를 얻을 수 있기... 어떤가요? 여러분도 연산을 찾으면 제가 소개해 드린 코스를 한 번쯤 거닐어 보시기 바랍니다. 연산시장: 충남 논산시 연산면 연산 4길 10-7",2020. 3. 30.
돈암 서원 - 논산 여행 ( 1 ),"충남 논산으로 여행을 떠난다 .. 아침 일찍 출발한 여행사 버스는 .. 세시간 정도를 달려서 .. 논산의 돈암서원의 입구 주차장에 도착하다 ..... '돈암'은 서원이 창건되었던 충청남도 논산시 연산면 하임리 숲말 산기슭에 있는 바위 이름으로, 현재 서원의 자리에서 서북쪽으로 약 1.5㎞ 떨어진 곳에...",2021. 7. 12.
"[논산여행 떠나You] 논산 드라이브 코스, 국내 최장 탑정호 출렁다리","▷ 탑정호 수문공원 - 찾아가는 길 : 충남 논산시 탑정로 773 (종연리 산 58) - 주차장 : 공원 주차장 평일 여유, 주말 붐빔 ▷ 탑정호 수변생태공원 - 찾아가는 길 : 충청남도 논산시 부적면 부적로 721-10 (충곡리 287-8) - 주차장 : 공원 주차장 평일 여유, 주말 붐빔 ▷ 탑정호 출렁다리 - 찾아가는 길...",2020. 12. 17.
"[논산여행 떠나You] 파평 윤씨의 대표적인 문중 서원, 논산 노강서원",충남 논산시 광석면 오강리에 위치한 노강서원은 조선시대 후기에 건립되었습니다. 윤황 선생의 학문과 덕행을 추모하는 노강서원은 승용차가 아니면 닿기 어려운 곳이라 찾는 이의 발길이 뜸한 곳이지만 기품이 있는 곳입니다. 그럼 노강서원으로 한 걸음 들어가 볼까요? 노강서원은 대원군의 서원...,2020. 9. 22.
또가고픈 논산 맛집 리스트,"1.태능초가집갈비 주소: 충남 논산시 중앙로398번길 7-7 전화번호: 0507-1366-2111 영업시간: 매일 11:00 - 22:00 명절 연휴 휴무 대표메뉴: 25년돼지갈비 14,000원 오겹살 14,000원 이곳은 논산금호고속버스터미널에서 차로 5분도 채 걸리지 않는 곳에 위치해있었기 때문에 찾아오는 길이 매우 쉬운...",2021. 7. 27.
"[논산여행 떠나You] 근대문화골목에서 역사공부를, 옥녀봉에서 가을산책을","여유로운 자연 속에서 힐링의 시간이 될 거예요. 강경 옥녀봉 찾아가는 길 : 충남 논산시 강경읍 북옥리 주차 정보 : 옥녀봉 공원 공영주차장, 근대문화 골목 입구 노상 주차 강경둔치 찾아가는 길 : 충남 논산시 강경읍 황산리 198 주차 정보 : 공영 주차장",2020. 11. 3.
[논산여행 떠나You] 논산 비대면여행으로 추천하는 영사암과 신풍리마애불,논산의 잘 알려지지 않은 문화재인 논산 부적면에 있는 영사암과 논산신풍리마애불을 한꺼번에 돌아보면서 논산을 좀 더 알 수 있는 기회가 되었습니다. 논산 영사암 충남 논산시 부적면 신풍길 75-42 논산 신풍리마애불 충남 논산시 부적면 신풍리 20-7,2020. 10. 23.
"[논산여행 떠나You] 농맹아와 항일운동 역사속으로의 여행, 한적한 논산 조정서원","많아질 때, 역사 속 시간여행은 유명 명소를 찾는 부분에서의 공허함을 조금 채워줄 수도 있을 듯합니다. 다시 한번 말씀드리지만 단촐하기 때문에 탑정호 코스로 묶음여행을 하시는 걸 추천합니다. 찾아가는길. 충남 논산시 가야곡면 등길 129 버스이용시 논산역 419번버스 조정리 하차. 도보이용",2020. 9. 8.
[여행 정보] 동양 최장 출렁다리 - 논산시 탑정호,"탑정호 출렁다리(논산시 홈페이지) 논산시 탑정호에 동양 최장 출렁다리가 곧 개통된다는 소식입니다. 길이는 600m이고 높이 50m에 주탑이 2개 세워졌습니다. 탑정호는 충남에서 두 번째로 넓은 호수이고 대둔산의 물줄기를 담아서 맑기로 유명하고, 탑정호 주변 드라이브 코스도 아주 좋답니다....",2021. 6. 18.
극찬했던 대천 맛집,"그렇게 요리의 맛부터 양과 완성도까지 모든게 압도적이었던 대천 맛집이라, 다음번 여행때도 꼭 들려 볼 려고 친구이랑 약속을 해두었답니다!... 황산옥 주소 : 충남 논산시 강경읍 금백로34 영업시간 : 09:30 ~ 21:30 전화번호 : 041-745-4836 아구찜 35,000원 / 홍어회 20,000원 강경역에서 100m 거리의...",2021. 5. 17.
충청남도 > 논산시 > 설렘 가득 논산여행 | 테마기행 길 |,Home > 대한민국 (South Korea) > 충남 (South Chungcheong) > 논산시 설렘 가득 논산여행 | 테마기행 길 | 4월 5일 대전MBC,2021. 3. 6.
[논산여행 떠나You] 이색 볼거리가 있는 선샤인랜드 야외전시광장,"햇살이 좋은 가을 선샤인랜드의 야외 모습은 평온하기만 한데요, 조용히 쉬어갈 수 있는 쉼터가 많아 가볍게 산책하며 머물기 좋았습니다. 가을 나들이로 방문하셨다면 야외시설을 이용할 때도 거리두기와 마스크 착용은 필수라는 점 잊지 마시길 바랍니다. 충남 논산시 연무읍 봉황로 102 041-746-8480",2020. 11. 6.
[논산여행 떠나You] 사회적 거리두기 여행으로 찾은 논산 갈매울공소,이유야 어떠하든 공소가 우리나라 천주교 역사에서 중요한 위치를 차지하고 있는 것만은 틀림없기에 갈매울공소를 찾아 차분한 마음으로 주변을 둘러보며 천주교의 역사를 살펴보는 것도 의미있는 여행이지 않을까 생각해봅니다. 천주교대전교구 연무본당 갈매울공소 충남 논산시 가야곡면...,2020. 7. 31.
강경 미내다리 #충남 논산여행 #국내여행 #갈대밭 #억새밭 #산책 #데이트 #힐링,"강경 미내다리 충남 논산시 채운면 삼거리 541 강경천에 있는 석교 충청남도 유형문화재 11호 전국 교역의 중요한 거점이 되었다는 강경포구가 있던 곳으로, 이 강을 ‘미내(渼奈)’라고 부른 것에서 유래하여 ‘미내다리’라고 부른다 아치형 다리가 주위 풍경과 조화를 이룹니다. 다리위에...",2020. 12. 18.
[논산여행 떠나You] 한적한 시골에서 만난 논산 충곡서원,충남 논산시 부적면 충곡리 수락산 아래 1692년 (숙종18)에 창건이 된 충곡서원이 있습니다. 초창기에는 육신서원이라 불리고 그 후에 8일은 제향한... 한바퀴 쭉 둘러 보다 보면 과거로 시간여행 온 듯한 느낌과 곳곳에 피어 있는 꽃들을 보실 수 있습니다. 충곡서원은 논산 솔바람길 코스 중에 한...,2020. 6. 23.
[논산여행 떠나You] 고즈넉한 한옥의 아름다움이 있는 논산 명재고택,"이 에 머무르는 것만으로도 마음이 참 편했던 명재고택인데요. 이번 주말, 복잡한 도심을 떠나 한적한 국내 여행지를 찾고 계신다면, 논산 명재고택에 한번 들러 보시는 것은 어떨까요? <논산 명재고택> 041-735-1215 충남 논산시 노성면 노성산성길 50 http://www.myeongjae.com/",2020. 7. 28.
"[논산여행 떠나You] 대둔산 단풍 속으로, 대둔산 수락폭포 가는 길",불과 한 시간 정도의 산책로여서 등산을 하시는 분들에겐 시시하겠지만 가볍게 자연을 만나고 싶은 분들에게는 좋은 코스입니다. 대둔산 수락폭포 산책로에서 막바지 가을 단풍을 만나 보세요. 대둔산 수락계곡 찾아가는 길 : 충남 논산시 벌곡면 수락리 116 문의 전화 : 041-732-3568 주차장 : 여유,2020. 11. 12.
[논산여행 떠나You] 캠핑과 함께 문화예술을 즐길 수 있는 KT&G 상상마당 논산,요즘 여행의 대세가 거리를 두고 나만의 공간에서 여행을 즐기는 캠핑이라고 하는데요. 이번 여름 휴가는 캠핑과 함께 다양한 예술과 문화를 덤으로 즐길 수 있는 KT&G 상상마당 논산에서 머물러 보시는 것은 어떨까요? <KT&G 상상마당 논산> 041-734-6984 충남 논산시 상월면 한천길 15-20 https://www....,2020. 7. 28.
꽃창살이 아름다운 논산 제5경 쌍계사 여행,충남 논산시 양촌면 중산리 불명산에 위치한 ‘쌍계사’는 입구부터 2차선 아스팔트 길이 조용히 달려 도착을 했습니다. 쌍계사 초입에 들어서 첫 번째 주차장에 차를 주차하고 카메라를 들고 내리자 바로 옆에 있는 차주가 나에게 먼저 말을 했습니다. “쌍계사에 취재하러 오셨습니까?” “예!...,2021. 5. 25.
[논산여행 떠나You] 논산 선샤인랜드에서 만나는 1950 낭만스튜디오,"이번 주말, 드라마 속 거리를 거닐으며 따뜻한 추억과 낭만을 남길 수 있는 이색 여행을 계획하고 있다면, 논산 선샤인랜드를 한 번 찾아보시는 것은 어떨까요? <논산 선샤인랜드> 전화번호: 041-746-8480 주소: 충남 논산시 연무읍 봉황로 102 운영시간: 매일 09:00 - 18:00 (수요일 휴무) 홈페이지: http...",2020. 7. 2.
[논산여행 떠나You] 논산 금곡서원에서 만나는 김수남의 애국심,"논산을 여행하다보면 많은 서원을 만날 수 있습니다. 논산에는 돈암서원을 비롯해서 노강서원, 충곡서원, 죽림서원, 휴정서원, 조정서원 등 많은... 있는 선현들을 매년 음력 3월 3일과 9월 9일에 제사를 지내고 있습니다. 논산금곡서원 전화 : 041-730-3226 주소 : 충남 논산시 연무읍 왕릉로 170-35",2020. 7. 21.
쌍계사로 떠나는 겨울 산사 여행,"겨울 눈을 기다리다가 경내에 내린 찬서리라도 보자고 찾은 쌍계사의 이른 아침 풍경은 겨울 산사의 묘미를 만끽하게 했습니다. 겨울 여행을 계획하고 계신 분이라면 논산의 관촉사, 쌍계사, 개태사를 잇는 천년 사찰 답사는 어떤가요? 쌍계사 찾아가는 길: 충남 논산시 중산길 192 연중무휴, 무료입장",2020. 1. 5.
논산 딸기축제 #충남 논산여행 #국내여행 #봄축제 #데이트 #힐링 #산책 #아이들이...,"논산 딸기축제 (논산대교 일원) 충남 논산시 대교동 319 논산딸기는 현재 전국의 생산면적에 15%를 차지하고 있으며 2100농가에서 1600억 원의 매출을 올리는 등 논산시 농업분야 GDP에서 20%이상을 점유하고 있는 논산의 대표 특산품. 볼거리 , 먹을거리 , 놀이공간 등이 풍부하게 마련되어...",2020. 12. 28.
[논산여행 떠나You] 와야리 벽화마을에서 만난 벽화 그리는 학생들,골목여행의 장점은 바로 이렇게 계절의 변화에 따라 피는 담장너머의 꽃구경을 할수 있다는거겠죠? 아이들이 보이지 않아도 아이들의 웃음소리가... 살고 있는 곳이니 마스크를 반드시 착용하고 조용하게 마을을 돌아보는 것을 추천합니다. 와야리벽화마을 충남 논산시 은진면 와야길 49 주차가능,2020. 7. 4.
"[논산여행 떠나You] 여행의 시작은 시장에서, 논산 화지중앙시장","여행길에 먹을 간식을 사도 좋고, 맛있는 저녁거리를 구입해도 좋습니다. 되돌아가는 길 논산의 특산물들을 만날 수 있는 이색 여행지, 전통시장을 먼저 둘러보며 시작해보면 어떨까 합니다. || 이용안내 주소 : 공영주차장(3) 충남 논산시 중앙로 486 사이트 : http://sijangnonsan.mf24.net/specialmarket/?mid=86",2020. 7. 6.
[논산여행 떠나You] 연산 대추골 역전마을 소경 & 송불암,"조용한 송불암과 연산역 골목은 평범하지만, 소소한 일상이 소중하게 여겨지는 때라 특별하게 느껴졌던 발걸음이었습니다. 연산역 (041-735-0804) 충남 논산시 연산면 선비로 275번길 31-2 송불암 041-733-6518 논산시 연산면 황룡재로 92-18",2020. 10. 15.
탑정호 붉은 노을은 계백 장군의 충혼이런가…풍경·역사 따라 가는 충남 논산 여행,"충남 논산시 가야곡면과 부적면을 잇는 탑정호 출렁다리의 말굽쇠 모양 교각에 아침 해가 걸려 있다. 폭 2.2m, 다리 구간 570m 규모 현수보도교로... 논산천 유역 평야 관개용으로 축조됐지만 최근 색다른 풍경을 선사하며 비대면 여행지로 각광받고 있다. 탑정호에서 신상 볼거리는 호수를...",2020. 12. 17.
"충남 논산 여행, 봄 나들이로 명재 선생 흔적을 찾아서",살포시 쌓인 솟을삼문 그리고 담장에도 하얀 눈이 쌓여 있는 멋들어진 풍경으로 큰 선물을 받도 추억여행은 다음 장소로 떠나게 됩니다. <논산 노강서원 이용정보> - 주소 : 충남 논산시 오강길 56-5 두 번째 방문지는 명재 선생의 영정을 모신 사당인 유봉 영당입니다. 유봉 영당은 노강서원에서 5km...,2020. 3. 8.
연산역과 연산대추꽃피는 마을의 벽화,연산역과 연산대추꽃피는 마을의 벽화 겨울이지만 좀 따스한 날의 논산여행은 즐거움을 주기에 충분했습니다. 집에서 자동차로 1시간 10분쯤 걸려... 안내판을 들고 앉아있는 조형물 속의 아이들의 모습 또한 천진스럽습니다. 연산역 주소 : 충남 논산시 연산면 선비로 275번길 31-2 전화 : 1544-7788,2021. 2. 13.
탑정호 수변생태공원 #충남 논산여행 #국내여행 #산책 #힐링 #저수지 #철새 #데이트 #공원,"탑정호 수변생태공원 충남 논산시 부적면 충곡리 287-8 충청남도에서 두 번째로 큰 저수지로서 어족자원이 풍부. 깨끗한 수질과 겨울철에도 잘 얼지 않고, 주변의 논산평야 등 대규모 농경지가 위치해 풍부한 먹이로 철새들의 서식에 적당하여 겨울철새들의 월동지로 이용. 2010년부터 주변에...",2020. 12. 21.
"[논산여행 떠나You] 불교 건축과 예술의 극치, 논산 쌍계사",사찰을 방문하시는 분들이 모두 편히 다녀올 수 있도록 사찰 입구 쪽에 만들어진 전용 주차장을 이용하셔서 조금 걸어올라 오시면 좋을 것 같습니다. 주소 : 충남 논산시 양촌면 중산길 192 주차정보 : 전용 주차장 이용가능 (무료),2020. 10. 30.
