header,contents,date
상화원(尙和園) - 충남 보령 죽도,"<<여행정보>> 1. 관람기간 - 4월~11월 금/토/일요일과 법정 공휴일 2. 관람시간 - 9시~18시 (동절기 ~17시) 3. 입장료 - 일반 6천 원, 할인 4천 원 4. 주소 - 충남 보령시 남포면 남포방조제로 408-52 5. 전화 - 070-7456-2200, 041-933-4750 6. 관람 안내도 (출처: 상화원 홈페이지) #상화원#충남#보령#죽도",2021. 1. 2.
충남 보령 카페 우유창고,상호 / 우유창고 지번 / 충남 보령시 천북면 하만리 216 도로명 / 충남 보령시 천북면 홍보로 574 영업시간 / 매일 11:00 - 19:00 #보령여행 #대천여행 #보령카페 #대천카페 #보령우유창고 #우유창고젖소 #보령카페추천 원래 우리의 보령 여행 계획은 명복 식당 → 상화원 → 우유 창고였는데 상화원이...,2021. 2. 24.
[충남 대천⑦] 대천해수욕장뷰 카페모카브레드,"충남 대천 1박 2일 여행 2일차 ① (2021/2/15 토) 카페모카브레드 주소 충남 보령시 해수욕장4길 84 신흑동 1917 영업시간 일~금요일 08:00 - 22:00 토요일 08:00 - 00:00 전화번호 041-931-1356 대천해수욕장 근처 카페 카페모카브레드 카페모카브레드 메뉴 아이스아메리카노 5,000원...",2021. 4. 1.
2021.10.11 전북 부안 뚜벅이 여행,"가령 염소가 부안 뚜벅이 여행 중, 언제 올지 모르는 농어촌 버스를 단 5~10분만 기다리고 바로 탈 수 있었다거나, 우연히 들어간 식당에서... 충남 보령시에 있는 대천해수욕장, 충남 태안군의 만리포해수욕장과 더불어 서해안의 3대 해수욕장으로 손꼽힌다고 합니다. 밀물과 썰물이 오고 간...",2021. 10. 11.
풍경있는 여행 - 충남 보령 대천해수욕장 ‘보령 머드박물관’을 둘러보고 2020년...,"보령 대천해수욕장 머드박물관 충남 보령시 대해로 897-15 ( 신흑동 2022 ) 보령 대천해수욕장 머드박물관 041-931-4021이용 머드광장에 울려 퍼지는 젊은이들의 환호성이 들려오는 것 같고 스트레스는 다 날려 보낼 수 있을 것 같고 1층에는 머드 샤워장, 머드마사지실, 머드제품 판매장, 보령 관광...",2020. 2. 2.
충청남도 보령여행 (보령7경 : 보령 충청수영성 -> 오천항의 경관과 조선시대 수군의...,충남 보령시 오천면 소성리에 있는 오천항은 작은 항구지만 천수만 일대의 주요 어항 중 한 곳으로 아름다운 풍경과 함께 방파제 등 별도의 피항시설이 필요 없을 만큼 자연적 조건이 좋고 수심이 깊으며 원산도와 안면도 등 섬들이 자연적으로 방파제 역할을 하고 있습니다. 오천항에서 주로...,2021. 9. 26.
충남 보령 가볼만한 곳 개화예술공원 내 바둑이네 동물원 (구) 바둑아 놀자,"애들이 정말 좋아하던 곳인데- 언젠가 충남 보령으로 자리를 옮기셔서 쉽게 갈 수 없는 곳이 되어버렸다. 얼마전 다녀온 보령 1박2일 여행... 바둑이네동물원 충남 보령시 성주면 성주산로 673-24 개화예술공원 http://naver.me/GqHoUD6z 기니피그,토끼,다람쥐,돼지..... 꽃사슴,캥거루,양, 전갈...",2021. 4. 3.
[Bogus 여행일기 다섯번째 이야기] 충청남도 보령 당일치기 여행!!,Bogus의 여행일기 다섯번째 충청남도 보령 당일치기 여행 시작합니다! 차에 먼지가 많죠ㅜㅜㅎㅎㅎ 저번주에 날이 너무 너무 좋아서 참지 못하고... 청소역 충남 보령시 청소면 청소큰길 176 우리나라에서 가장 오래된 간이역이래요! 폐역인줄 알았는데 기차가 운행을 하더라구요ㅎㅎ 당일치기로 온...,2021. 9. 13.
"이번 여름, 원산도 오봉산해수욕장 참 좋아요!!",이곳은 자연의 숨결을 그대로 품고 있고 사람들이 많이 오는 곳이 아니어서 가족단위나 연인들이 호젓한 여행을 하기에 참 좋습니다. 해변에... 이번 여름 이곳에서 바다의 향기를 만나보면서 아름다운 원산도 오봉산해변을 느껴보면 어떨까요? 오봉산해수욕장 충남 보령시 오천면 원산도리,2021. 7. 8.
[충남 보령] 바다부터 숙소까지 너무 예뻤던 대천여행 / 대천테마펜션 이글스파크펜션,안녕하세요 ~ 저 대천 여행 다녀왔어요 ꈍ◡ꈍ 최근 바다 여행은 동해로만 갔었는데 오랜만에 서해 바다를 가고싶더라구요 ! 서울 근교 서해... 이글스파크펜션 주소: 충남 보령시 고잠2길 4-35 전화번호: ***-****-**** Soo daily 버스에서 내려서 펜션 단지 쪽으로 총총 들어가다보면 제가 예약한...,2020. 4. 13.
5월 남해보리암여행 1박2일 프롤로그 #페이지,"5월 남해보리암여행 1박2일 프롤로그! 거제여행2박3일을 끝내고, 5월남해 보리암여행을 하기 위해,남해로 이동을 하였다. 이번 남해여행을 주선해... 단군성전 (충남 보령시 청라면 양지편길 70-32) 충북 창원단군성전 (충북 청주시 흥덕구 강내면 저산리) 국조단군성전 (대구 수성구 두산동) 경북...",2020. 5. 24.
"확실하게 즐긴 대천맛집여행 [대천키조개삼합, 갱스커피, 청해호]",대천키조개삼합 주소 : 충남 보령시 해수욕장8길 51 영업시간 : 매일 00:00 - 24:00 연중무휴 전화번호 : 041-932-9239 마지막 대천맛집여행 추천은 대천키조개삼합이라는 곳인데요. 주변에 흔하게 널린 보통 조개구이집이 아니라 엄청나게 많은 해산물들을 한 번에 즐길 수 있는 특별한...,2021. 9. 27.
충남 보령 맛집 원조명가 : 보리굴비 정식 솔직 후기,여기 지역 여행하다가 밥이 땡긴다! 든든하게 맛있게 먹고 싶다! 하는 분들은 원조명가 가보는 걸 권유 드리는 바입니다. 충남 보령시 문화원길 42 (지번. 대천동 618-258) Tel. 041.931.0042 14:30 ~ 16:30 break time #충남보령맛집 #보령보리굴비 #원조명가 #보령원조명가 #서이추 #서이추환영 #서로이웃...,2021. 2. 13.
"국군대천콘도 (충남 보령, 2021 여름)",쫌 멋졌음 ㅋ 보령시 성주산 자연휴양림. 성인 4명 입장료 + 주차료 = 6천원. 우리 네비는 엉뚱한 곳으로 안내해줘서 헤맸다. <성주 어린이집> 으로... 물때 맞춰서 여행계획 세운다면 너무 좋을 듯. 예전에 조개잡이에 심취했을 때... 그때 왜... 이런 곳을 몰랐을까... 바보. 혹시나 사격훈련이 있고...,2021. 8. 6.
"카페모카브레드, 바다가 보이는 카페, 대천해수욕장 , 대천",#카페모카브레드 #바다가보이는카페 #대천해수욕장 #기차여행 #SRT #나홀로바다 대천에 왔어요 이렇게 혼자 기차 타고는 처음 와요 둑흔둑흔 o_o... 이틀동안 정말 많이 걷고 걸었네요 다음에는 조금 길게 와야지이 +_+ 카페모카브레드 충남 보령시 해수욕장4길 84 https://m.place.naver.com/restaurant/1274928531,2021. 6. 3.
안면도 여행코스 짠다면 베이그릴121 꼭 넣으세요,열심히했어요 가족과함께 연인과함께 가기에 너무 좋았던 베이그릴121 ~ 이번 안면도여행코스로 너무너무 만족스러운 곳이였어요 ~ 안면도 가실 계획있으신분들은 꼭 베이그릴121 들러보세요 대 만족하실꺼에요 ~ 베이그릴121 위치 & 연락처 TEL : ***-****-**** 주소 : 충남 보령시 오천면 원산도7길 121,2021. 9. 22.
끝내주던 대천 해수욕장 맛집 리스트,1.대천키조개삼합 주소 : 충남 보령시 해수욕장8길 51 영업시간 : 매일 00:00 - 24:00 연중무휴 전화번호 : 041-932-9239 메뉴가격 : 키조개 해물 삼합구이... 좋은 재료들을 아끼지 않고 넣어 주는 푸짐한 곳이었어요. 오랜만에 깊고 건강한 맛을 느끼며 든든하게 여행을 마무리할 수 있었던 곳이랍니다.,2021. 6. 10.
[보령 맛집] 충남 보령 1박 2일 여행 중 들린 오양 손칼국수,그리고 칼국수 집 위 달보드레 카페도 운영되고 있는데요 할인쿠폰 받아서 이용하실 수 있어요~ 그럼 충남 보령 오양 손칼국수 정보 남겨드리며 보령 여행기 1번째 포스팅을 마무리해볼게요! 주소 : 충청남도 보령시 오천면 소성리 691-52 오양 손칼국수 전화번호 : 041-932-4110 영업시간 : 매일 10:30...,2021. 9. 15.
충남 보령 펜션추천 오후의 스케치북 빨간방 찐후기,"어제의 충남보령 여행 일정에 이어 오늘은 충남 보령 무창포쪽에 묵었던 오후의 스케치북 소개드릴께요. 사진이 많은관계로 1탄 2탄으로 나눠서... ㅋㅋㅋ 오후의 스케치북 주소:충남 보령시 웅천읍 간드리1길 5 입실 15시, 퇴실 11시 전화번호:***-****-**** 충남 보령 첫번째 1박할 숙소로 오후의...",2021. 4. 21.
<2021. 02. --- 충남 보령 대천해변 차박여행...>,"이번 여행의 목적지는 충남 '보령'이다........ 여행 모드는 '차박모드'로........ 섬으로 백패킹 여행을 가고 싶지만, 계속된 한파와 풍랑주의보... 소황사구란,,, 충남 보령시 웅천읍 독산리 해안부터 소황리 해안까지 약 2.5km 해안에 형성된사구이며, 이 해안사구는 바람에 의해 형성되는...",2021. 2. 22.
보령 펜션 추천 너울펜션 태안해수욕장 여행에 딱!!,충남 보령시 신흑동 2220-7 지난 주말 친정부모님 모시고 태안해수욕장으로 놀러갔어요~ 스무살때쯤 부모님이랑 동생이랑 가족여행으로 가보고 20여년만에 태안해수욕장 다시 찾았습니다. 그 동안 보령머드축제로 엄청나게 유명해진 태안해수욕장. 규모가 장난이 아니더라구요. 먼저 태안항...,2020. 2. 6.
"무창포 맛집 :) 바다보면서 먹는, 무창포조개구이회센터 비체팰리스맛집 ★",안녕하세요 - 안찡이 입니다 - 오늘 소개해드릴 장소는 - 비체팰리스여행에서 먹었던 식당 2곳중에 마지막 한곳인 조개구이를 먹었던 #무창포조개구이회센터 를 소개해드리려고 합니다 ㅎㅎ 041-936-7911 충남 보령시 웅천읍 열린바다1길 35 장소는 - 무창포 #비체팰리스맛집 으로 비체팰리스에서 나와서...,2021. 6. 21.
"국내 기차여행 비대면으로 즐기는 방법 :: 분천역, 김유정역, 청소역, 구서도역, 경강역",청소역 CHEONGSO STATION 주소 : 충남 보령시 청소면 진죽리 343-1 세 번째 국내 기차여행은 장항선 노선에서 가장 오래된 청소역이다. 이곳은 1929년 12월 1일 영업을 시작으로 거진 100년의 역사를 지니고 있는 곳이며 2006년 등록문화재 305호로 지정되면서 근대 간이역사의 건축 스타일을 잘 보여주고...,2021. 2. 21.
언택트로 돌아보는 친숙한 공간 대천천,"쉼과 여유를 즐길 수 있는 공간, 삶의 이야기가 묻어나는 대천천에서 힐링하며 여행의 쉼표를 찍어보세요. 끝없이 이어지는 길은 언택트로 돌아보는 장점이 있어요. 사계절 누구나 찾는 명소 보령 대천천, 충남 보령시 대천천은 사계절 누구나 찾는 명소라는 생각입니다.",2021. 2. 8.
충남 보령 맛집 해물창고 추천 메뉴 대천 키조개 삼합에 빠지다,"가까운 곳이라서 놀러가기에 좋은 곳이고 파레브호텔 맞은편에 있으니 찾기도 쉬워요^^ 바다도 보고 맛있는 조개구이도 또 먹고. 아이들과 즐거운 여행을 위해 방문해보려고 합니다. 해물창고 ★주소: .충남 보령시 해수욕장8길71 ★전화: 041-933-1481 ""소정의 원고료를 받아 작성된 포스팅입니다""",2021. 3. 21.
"황홀했던 충청도여행 추천 동선 :: 김가네사골수제비, 꽃지해수욕장...","충청도여행 첫째 날 들렸던 곳은 머드광장에서 3분 거리의 김가네사골수제비였어요. 여기는 굉장히 오래 전부터 한 자리에서 운영되고 있는 곳으로 현지인들의 추천이 많아 찾게 됐답니다. 주소 : 충남 보령시 석서1길 57 영업시간 : 매일 09:00 ~ 16:00 둘째, 넷째 화요일 휴무 전화번호 : 041-934-4706...",2021. 9. 28.
맛집 > 충남 보령 천북 굴단지 깐돌네 굴집,"첨엔 천북 굴단지라고 해서 땅굴이 있는 곳인줄 ㅋㅋㅋ 충남 보령시에 있는 굴이 많이 나오는 곳이에요. 남당리에 새조개, 천북면에 굴~ 외워둡시다... 충남에 여행가시면 천북 굴단지 꼭 가보세요~^^ 해산물 좋아하는 저에게는 완전 천국이었어요^^ #충남보령맛집 #보령맛집 #천북굴단지 #굴요리맛집...",2021. 2. 27.
서해안 가볼만한곳 대전근교바다 대천해수욕장 일몰 드라이브 당일치기 여행,"대전근교바다여행 일몰이예쁜 서해바다 대천해수욕장 충남 보령시 신흑동 몇일전 무료하게 집에서 뒹굴거리다가, 친구와 카톡한통으로 급으로 떠나게된 대천해수욕장. 서해안가볼만한곳으로 유명한 대천해수욕장은 대전에서 한시간반거리에 위치한 대전근교바다로 오후 1-2시 급 당일치기여행(?)...",2021. 8. 29.
[대천해수욕장 숙소/ 오션뷰 호텔 우연플로라]_2021.07.14 짱이 추천,바다수영하기로 하고 해수욕장 바로 앞에 있는 숙소를 예약했다ㅎㅎ <전화번호> 041-933-0007 <상세주소> 충남 보령시 해수욕장8길 48 <홈페이지> 출처... 완충돼서 여행할 때 편안 절대 금연!! 지켜주세유 약간 흐리지만 이렇게 오션뷰ㅜㅜ 앞이 해수욕장이다보니까 사람들이 노는 것도 보이고 해지는...,2021. 7. 15.
[충남 대천③] 해수욕장 근처 코랄커피,충남 대천 1박 2일 여행 1일차 ③ (2021/2/14 일) 코랄커피 주소 충남 보령시 해수욕장4길 82 신흑동 1916 코랄커피 영업시간 월요일 11:00 - 22:00식사메뉴 11:00~17:30 화요일 11:00 - 22:00주방휴일 (음식X) 수요일 11:00 - 22:00주방휴일 (음식X) 목요일 11:00 - 22:00식사메뉴 11:00~17:30...,2021. 4. 1.
충남 보령 맛집 보령곱창전골 전문점 명복식당,상호 / 명복식당 지번 / 충청남도 보령시 청라면 의평리 243-1 도로명 / 충남 보령시 청라면 냉풍욕장길 37 전화 / 041-932-8166 휴무 / 월요일 ★ 30 전 예약 필수 #세종근교맛집 #보령맛집 #보령명복식당 #보령곱창전골 #보령여행 #보령맛집추천 #보령술안주 #보령갑오징어 #충남보령맛집...,2021. 2. 22.
"가족여행 추천지, 머드박물관","2022년 7월 ~ 8월 충남 보령에서 열리는 ""2022 보령해양머드박람회"" 축소판이 2021년 7월쯤에 여러분을 찾아갑니다. 흥분되지 않으세요? 2022년이 되어야... - 홍보요원 이창헌 - #머드박물관 #머드 #보령박물관 #머드화장품 #머드축제 #보령가볼만한곳 #가족여행 #보령 #보령시 #보령시청",2021. 5. 7.
충남 : 대천 맛집 : 대천해수욕장 조개구이 맛집 ' 섬과섬사이조개구이',"섬과섬사이조개구이 충남 보령시 해수욕장4길 124(신흑동 1864) 영업시간 : 00:00 - 24:00 대천해수욕장을 따라 조개구이 가게가 쫙 있는데 유일하게... 대천,보령여행오면 꼭 가봐야할 맛집 !!!!!!! 술이란 호로록호로록 하면서 맛있게 먹었습니댜♡ 위치도 좋고, 날씨도 좋고, 맛도 좋고 !",2020. 9. 11.
"충청도 1박2일 골프여행 제대로 즐기기 - 대천키조개삼합, 청해호, 안면도 리솜리조트",날씨도 좋은 9월 가을이라 친구와 함께 정말 오랜만에 충청도 1박2일 골프여행을 다녀왔어요. 일이 바빠서 여름휴가도 제대로 못갔기 때문에 모든 것들을 제대로 즐기기 위해서 정말 잘 알아보고 다녀왔답니다. 대천키조개삼합 충남 보령시 해수욕장8길 51 매일 00:00 - 24:00 연중무휴 041-932-9239 첫째...,2021. 9. 29.
"[보령여행] 대천찐맛집 가족모두 만족했던 매콤한 피자돈까스가 맛있는 ""피자파티""",[REVIEW] 피자파티 - 영업시간 : 11:00 - 20:00 / 화요일 휴무 / 주차x 위치 : 충남 보령시 대흥로 44 진 미용실 2층 잇-하 오늘도 끝나지 않은 #보령여행 이야기 ㅋㅋㅋ 울 엄마는 보령 언제까지 올리냐며 ㅋ 이번 포스팅은 진짜 대박추천 기억해 보령은 피자파티야 보령=피자파티 #보령찐맛집 #보령주민맛집...,2021. 9. 24.
[충남 보령] 대천 캠핑장 보령 캠핑장 나혼자산다 촬영지 대천 용두캠핑장,"충남 보령 대천용두캠핑장 충남 보령시 웅천읍 열린바다로 100-50 예약 문의 후 사이트를 선택하면, 사장님께 문자가 온다. Previous image Next image 5번... 껍데기 캠핑이나 여행시 우리 부부의 빠지지않는 시그니쳐 메뉴 집에도 항상 킵되있음 ㅋㅋㅋ 메뉴 중 젤 맛났다 조개구이 육고기가 질릴 때쯤...",2021. 4. 6.
"폐철도부지에 탄소 저감 생태숲, 놀러 오세요!",위치는 충남 보령시 대천동 321-2번지 일원입니다. 환경부 자연환경보전사업에 선정되어 장항선 폐선부지 2500㎡에 탄소 저감 생태숲 을... 충남의 생태가 잘 보존된 곳을 찾아 생태여행을 다니던 터라 더욱 반가와요! 아직은 초기 단계이지만 세월이 지날수록 더욱 울창해지겠지요? 정말이지 보령의...,2020. 10. 19.
"충남 보령카페 대천카페 / 카페 애즈유라이크(feat. 숲속뷰, 바다뷰)","과거 대천이란 지명과, 대천해수욕장때문에 흔히들 대천이라 부르지만 현재는 보령시로 통합 후 과거의 지명이 되었고 충남 보령시 대천동이란... 하시며 여행의 마무리를 짓는 코스를 과감히 추천드림니당 다음에 날 좋을 때, 탁 트인 바다보러 또 오고 싶은 대천 해안도로에 위치한 포토존이...",2021. 3. 29.
[국내여행][픽! 보령] 성주산 자연휴양림에 가을 여는 꽃무릇 활짝 (연합뉴스),[국내여행][픽! 보령] 성주산 자연휴양림에 가을 여는 꽃무릇 활짝 (연합뉴스)(보령=연합뉴스) 17일 충남 보령시 성주산 자연휴양림을 찾은 어린이들이 진홍색 꽃망울을 터뜨린 꽃무릇 군락지 사잇길을 걷고 있다. 2011년 성주산 자연휴양림 입구 소나무 숲에 조성된 꽃무릇 군락지는 5천500...,2021. 9. 17.
"[충남/보령] 대천해수욕장 대천 놀거리 3종! 스카이바이크, 짚라인, 카트",#대천 #보령 #여행 #보령여행 #대천여행 #보령놀거리 #대천놀거리 #대천해수욕장 #스카이바이크 #짚라인 #카트 1. 스카이바이크 충남 보령시 해수욕장10길 79 041-931-1180 매일 10:00 - 12:00오전 탑승시간 매일 14:00 - 17:00오후 탑승시간 네이버 지도 로드뷰 첨부 ※ 3종을 다 즐기려면 주차 자리는 파란색...,2020. 8. 4.
"낚시 인구 1,000만 시대! 국내 섬 바다낚시 숨은 명소 Best7!","비진도 여행은 어떨까요? 출처=통영시 블로그 통영 여객선 터미널에서 비진도로 들어오는 길엔 해금강과 십자동굴도 구경할 수 있어, 어린이 체험학습장으로도 훌륭합니다. 비진도는 통영 여객선 터미널에서 1일 2회 운행 중이며, 약 40분 소요됩니다. 장고도 충남 보령시 풍부한 수산자원을 간직한...",2020. 7. 30.
해저터널 뚫리는 원산도에 케이블카 건설..보령시 사업자 공모,"재판매 및 DB 금지] (보령=연합뉴스) 양영석 기자 = 충남 보령시가 국내 최장 해저터널이 건설되는 원산도에 해양관광 케이블카를 건설한다.... 차량을 이용해 원산도에 도착한 관광객들이 케이블카를 타고 다른 섬으로 이동, 현지에서 개인 이동수단(모빌리티)을 대여해 섬 여행을 즐길 수...",2020. 10. 19.
"[TV속 정보] 9월 2일(목) KBS2TV생생정보 , MBC생방송오늘저녁, SBS생방송투데이 나온...",MBC 생방송오늘저녁 제작사: MBC C&I <새참 줍쇼> ▶ 미남호박 ☎0507-1370-8315 충남 보령시 고리굴길 136 <옆집 부자의 비밀 노트... 행 (아주 재밌는 여행) -경기도 여주시> ▶ 오감체험농장 (포도 수확 체험) ☎ ***-****-**** 경기 여주시 강천면 가야리 16 ▶여주자전거여행...,2021. 9. 4.
햇살 가득한 봄 사진 명소(보령시 청소면),햇살 가득한 봄! 사진명소에서 인생샷 찍으세요~! #봄나들이 #사진 #명소 #사진명소 #인생샷 #청소역 #장항선 #간이역 #충청남도 #충남 #보령시 #보령 #청소면 #보령여행 #여행,2021. 4. 21.
2박 3일 울릉도 여행 3일차 오징어회/통구미 거북바위/관음도/천부해중전망대/저동커피...,"서수깡이에요:-) 2박 3일 울릉도여행 3일차! 원래는 하루 더 있다가 나가는 건데 비가 오고 파도가 쎄서 하루 앞당겨서 나가게 되었어요ㅠㅠ... 경주시 충남 : 보령시 강원도 : 삼척시, 동해시 전남 : 신안군 부산광역시 : 수영구 주민등록증상 해당 주소지시면 앞에 티켓팅할때 보여주시고 무료입장...",2021. 9. 26.
"군산 선유도,근대문화유산거리,서천 장항스카이워크(2021년 휴가)",시간여행 꼬마열찰 11;23... 11;26... 군산 내항역사문화공간... 군산항 뜬다리(부작교) 11;26... 일제 강점기에 만들어졌다 간조와 만조의 수의 변화와 무관하게 대형선박 접안을 위해 조성된 시설이다. 진포해양공원... 전라북도 군산시 내향2길 32(장미동 1-4) 고려말 1380년 금강하구의 진포에...,2021. 9. 5.
"【보령】1000만 반려동물 시대...보령시, '반려동물 동반여행 콘텐츠' 개발한다","[sbn뉴스=보령] 나영찬 기자 = 충남 보령시가 '반려동물 동반여행 관광콘텐츠' 개발을 위한 용역보고회를 가졌다고 3일 밝혔다. 이번 용역은 반려동물 1000만 시대와 반려동물을 가족 혹은 자신과 동일시하는 펫팸족(Pet+Family), 펫미족(Pet=me)의 증가로 2027년에는 펫코노미 시장이 6조원 규모로 확대될...",2020. 7. 3.
대천항 수산시장 제철 대하(흰다리새우) 꽃게 청주수산 15호 먹은 여행 후기 그리고...,가을철 꽃게철/가을 대하 가을철 #꽃게제철 그리고 #대하철 성어기인 9월이 도래되면서 일찌감치 충남 보령시 #대천항수산시장 #대천항청주수산 을 청주에서 출발하여 세종시 등을 통과하는 등 약 2시간 30분의 대천항 드라이브 여행은 시작이 된다 대천항 수산시장에서 활어회 저렴하게...,2021. 9. 9.
보령 가볼만한곳/동백꽃필무렵 촬영지 : 보령 충청수영성,보령충청수영성 충남 보령시 오천면 소성리 661-1 10월에 다녀온 보령 여행 마지막 포스팅! 대천해수욕장에서 조개구이도 먹고 보령 핫플 갱스커피도 다녀오고 근처에 어디 가볼만한곳 없나 해서 찾아본 보령충청수영성 사실 별로 큰 기대 없이 방문했던 보령 충청수영성인데 도착해서 둘러보고 너무...,2020. 12. 3.
안면도 카페 원산도 바다뷰 바이더오,뷰가 이쁜 카페 충남 보령시 #안면도 #원산도 #바이더오 힐링하기 좋은곳으로 바다가 한눈에 들어와 여행의 피로를 풀어주기 참 좋은곳 같아요^^ #커피맛집 카페안에서 풍기는 고소한 카스테라 향기~ 자꾸 절 유혹하네요 ㅎㅎ 1층 자리도 좋지만 바다가 보고파 2층에 자리를 잡았어요. 10시...,2021. 4. 15.
전국 자연휴양림 지역별로 한눈에 알아보기,곳이라 여행하면서 많이 들 선택하는 휴양림입니다 지역 휴양림 명 소재지 설립 주체 강원도 가리왕산 자연휴양림 강원도 정선군 정선읍 국립... 자연휴양림 충남 보령시 청라면 국립 충청남도 용현 자연휴양림 충남 서산시 운산면 국립 충청남도 희리산 해송 자연휴양림 충남 서천군 종천면 국립...,2021. 8. 30.
>> 보령시 오천항 수산물판매센터 6호점,주소 : 충청남도 보령시 오천면 오천해얀로782-7 오천항 수산물판매센터 6호 전화번호 : 041- 934 -5277 영업시간 : 오전 9 : 00 ~ 21 : 00 보령시 오천항... 충남 보령은 초행 이였음에도 항구의 이미지는 여행자에게 가족들과 편안한 휴식을 누리기에 충분한 지역 이엿다고... 바다도 서해지만 맑고 푸른...,2021. 8. 17.
대천항 수산시장 맛집 가서 사온 싱싱한 제철회~,여행 가면 그 지역의 유명한 먹거리나 특산물을 꼭 먹어봐야하는 신랑을 데리고 살고 있어서 바닷가 근처가면 꼭 먹는 회. 사실 난 회맛을 잘... 기억하셨으면 좋겠다 ㅋㅋ 신요나수산 주소 : 충남 보령시 신흑동 2240-6 45호 연락처 : 0507-1427-1240 영업시간 : 평일 09:00 - 20:00 주말 08:30 - 21:00 노멀한 금자씨 &,2021. 6. 23.
[충남 보령] 머드린 조개구이 (무한리필),"마이 홈 그라운드 ,,, ♡ 대천해수욕장 오면 꼭 가야하는 place는 No.1 조개구이 머드린 조개구이 충남 보령시 해수욕장8길 28 전화번호 931-8100... 대천 = 해수욕장 = 조개구이 = 머드린 조개구이 이 공식만 암기하면 성공적인 대천 여행 완료 (੭ु｡╹▿╹｡)੭ु⁾⁾ 오늘 포스팅은 여~기~까...",2021. 3. 14.
