header,contents,date
"대천 카페, 커피인터뷰 그림같은 스팟","그림같은 대천여행 사진을 남기고 싶으시다면 무조건 추천드리는 곳이랍니다. 날씨 좋은날 그림같은 사진 남겨보세요 ♥ 대천 카페, 커피인터뷰 충남 보령시 대천할1길 67-23 /지번, 충남 보령시 신흑동 948-31 스테이인터뷰 강릉점/영동점 후기",2020. 10. 11.
"[TV속 정보] 5월 28일 (금) 2TV생생정보, MBC생방송오늘저녁, SBS생방송투데이 나온...",행 (아주 재밌는 여행) : 충청남도 보령> ▶ 땅두릅 ☎ 041-934-4435 충남 보령시 미산면 뜨메기골길 32 (그리고 캠핑장) ▶ 스카이바이크 ☎ 041-931-1180 충남 보령시 해수욕장 10길 79 ▶ 오천항키조개음식 ☎ 041-933-2933 충남 보령시 오천면 오천해안로 782-5...,2021. 5. 28.
보령 가볼만한곳 개화예술공원,충남 보령으로 여행을 떠나보겠습니다... 충남 보령에 있는 개화예술공원을 둘러볼께요.. 들어가는 입구부터 조각작품들이 눈에 보이더라구요... 미술관 이름이 모산미술관 오렌지색 지붕이 이쁜 미술관으로 들어가 봅니다..^^ 이곳 보령 개화예술공원은 충남 보령시 성주면 개화리에 있는...,2020. 7. 14.
최초의 기독교 선교지 보령 고대도를 아시나요? #페이지,"장고도를 떠나면서 2019년 5월 2일 다녀옴 14:15분 장고도에서 고대도행 장고도-고대도 승선권 #고대도 충남 보령시 오천면 삽시도리 차량탑승이 가능하기에, 배에 승용차 를 싣고 섬여행에 나선 것이다. 고대도는 해안선 길이 4.3km, 삽시도북쪽 4.5km에 위치하며, 대천항과 오천항에서 각각 16km...",2020. 5. 7.
[보령맛집-김밥] 엄마애김밥,아참 그리고 새로운 음식에 절대 도전 안하는 우래기 김도 안먹는 녀석인데 뭔일인지 제발로 와서 제손으로 집어먹더라구요? 그렇게 우래기의 첫 김밥이 되었습니다^^❤️ 앞으로 이동네 김밥은 이 집으로 정착합니다 ㅎㅎㅎㅎ엄마애김밥 ***-****-**** 충남 보령시 작은오랏3길 82,2020. 8. 21.
"[보령개화예술공원] 10월, 아이와 가볼만 한 곳",참새가 방앗간을 그냥 못지나가듯 송송남매가 사고 싶은 것들이 한가득! 결국 기념으로 꽃장식 볼펜 2자루 선물로 득템!! 보령에서 가볼만한 곳 개화예술공원이었습니다! #충청남도#보령시#충남여행#보령#개화예술공원 #모산미술관#허브랜드#리리스카페#가족여행 #아이와가볼만한곳#여행#1박2일,2021. 10. 6.
보령 대천 여행 맛집 장벌바지락칼국수,HOT PLACE PICTURE 위치 정보 address 확인하세요 주소 : 충남 보령시 해안로 405 영업시간 : 10:00~20:00 연락처 : 041-935-7693 주차장 : 식당 앞에 전용 주차장 있어요(약 4대~5대) 가격 정보 HOT PLACE PICTURE 당일치기 #아이와가볼만한곳 #아이와여행 #아이와함께 #육아맘소통 #육아맘일상 #초등맘...,2021. 8. 13.
대천해수욕장 데이나이스호텔 커플여행 후기,대천해수욕장 데이나이스호텔 커플여행 후기 안녕하세요. 여행블로거 고미리레 입니다. 요즘은 국내여행을 다니며 여러 여행지를 소개하고... 이맛에 오션뷰 호텔 가지~^^ 대천 데이나이스 호텔 Daynicehote 호텔 예약 최저가 보러가기 ◀ 클릭 위치 : 충남 보령시 해수욕장8길 60 투숙객 무료주차...,2020. 6. 15.
풍족했던 대천해수욕장 맛집 리스트,얼마 전 부모님 생신을 맞아 떠난 당일치기 여행에서 미리 알아봐둔 대천해수욕장 맛집에 방문했어용 ㅎㅎ 대천에서 가장 큰 규모를 자랑한다는... 엔제리너스 대천점 주소 : 충남 보령시 해수욕장4길 28 황해횟집키스나이트 번호 : 041-935-0540 영업시간 : 매일 09:00 - 00:00 식사 후에는 바로 옆건물인...,2020. 11. 5.
충남 보령 맛집 / 대천항 수산시장 회센터,"검색했더니 충남 보령시는 광어 1kg 20,000원 하더라구요!! 식당에서는 1kg 35,000원 물론 밑반찬이 나오지만 ! 저희는 밑반찬보다 회가 중요해서 ㅋㅋ... 대천항수산시장맛집 #광어회 #광어회맛집 #매운탕맛집 #매운탕 #충청도맛집 #당일치기여행 #충남여행 #보령여행 #맛집데이트 #데이트 #충청데이트",2020. 4. 28.
가족경영협약 교육,이번 여행은 가족경영협약 교육을 진행하기 위해서 충남 보령시에 위치한 비체팰리스로 너무 먼 곳이라서 어제부터 와서 지인들 만나고 수다 실컷 떨고 충청남도연합회 회원 12팀을 만났다. 먼저 자기소개 시 대부분의 남편님들 모르고 왔다./얼떨결에 왔다/ 속아서 왔다./ 그냥 앉아만 있다...,2021. 7. 3.
깔끔했던 대천 한화리조트 맛집,완벽한 봄날씨를 맞이해 지난 주말엔 친구들과 충남 보령으로 1박 2일 여행을 다녀왔어요. 저녁엔 요즘 핫플레이스의 중심으로 손꼽히는 대천... 주소 : 충남 보령시 해수욕장8길 51 전화번호 : 041-932-9239 영업시간 : 매일 00:00 - 24:00 연중무휴 특히 얼마전 사장님귀는당나귀귀에서 촬영을 다녀가 더...,2021. 3. 29.
10월9일~11일 2박3일 낚시모임 #충남태안영목항 #안면도 #소도바위섬펜션...,소도바위섬펜션 (안면도 영목항 앞 소도섬 속의 펜션) 위치 충남 보령시 오천면 소도길 11-6. 6인실이라서 1박->15만원 2박->30만원 (살짝봤는데... 그럼이만 #2박3일여행 #2박3일낚시여행 #낚시모임 #낚시회원 #안면도낚시 #충남태안 #영목항 #충남태안영목항 #소도바위섬펜션 #안면도펜션 #태안펜션...,2020. 10. 12.
[여객선 시승]영목항~대천항,"(보통 시내버스여행시에 태안에 오후2시쯤 들어오므로 고의로 버스를 안타는것을빼면 충분히 2019년까지만하여도 영목항에서 막배타는것을... 대천항(충남 보령시 신흑동) 중간경유지 효자도,원산도 영목항에 대천으로 가는 막배가 들어오는데 자세히보면 현수막같은게 걸려있는데 저 현수막은...",2020. 11. 27.
충남 보령 이광명 고택,희망찾기 사회적협동조합 생활문화 및 여가 사업팀에서는 충남 보령 이광명 고택으로 인문학 한옥 여행을 왔습니다. 장마비도 비켜간 주말의... 보령으로 온 인문학 한옥 여행은 보령시 한면택 비서관님을 만나 보령시의 홍보와 비전을 나누는 유익한 시간을 보냈습니다. 보령을 사랑하고 겸손 하고...,2021. 7. 11.
2020.08.03 휴가 1일,2020 .08.03~04 1박 2일 여행 충남 보령시 천북면 펜션&호텔뷰 vip506 호실. 친정엄마랑 우리가족 5인 이라 큰방? 으로. 보시는바와 흡사. 싱크로율99퍼. 사진은 기술적으로 넓게 찍어올려지니 ㅋㅋ 다른데도 다 마찬가지~ 중부지방 호우경보문자 계속오는데 우리가는곳은 비 거의 안와서 다행....,2020. 8. 5.
"대천청운콘도::대천펜션, 대천커플여행",위치 : 충남 보령시 고잠2길 68 3층 4층(대천 S마트 바로 옆에 있고 주차장도 넓다) 건물에 2층은 암웨이였고 3층과 4층이 방으로 되어있었다! 방은... 친절하고 예쁘고 깔끔해서 맘에 드는 곳이였다 급하게 간 대천여행이지만 모든게 맘에 드는 여행이다 늦게 가서 오히려 안전하고 조용하게 보낼...,2021. 8. 6.
[충남/보령] 보령카페 핫플 여행지!! 인스타각 갱스커피 갱스토리,#충남여행 #보령여행 #보령카페 #대천카페 #보령핫플 #갱스커피 #갱스토리 #사진찍기좋은카페 #이쁜카페 #인스타각 #카페 #여행 #코스 충남 보령시 청라면 청성로 143 041.931.9331 매일 10:00 - 20:00 ※ 주차장 넓음 인스타 사진을 찍기에 좋다는 소문을 듣고 갱스 커피를 갔다. 티맵으로 검색했을 때...,2020. 7. 28.
지역관광추진조직 12곳을 선정하여 1곳당 최대 2.5억 지원 예정,- 경기 고양시 - 경남 남해군 - 경남 통영시 - 경북 경주시 - 전남 광양시 - 전남 강진군 - 전북 고창군 - 충남 보령시 - 충남 홍성군 - 충북 단양군... 지역관광추진조직 선정 결과 경기 고양 - (사)고양시관광컨벤션협의회 - (필수사업) 코로나 시대 안전 여행 자원 발굴 및 스마트 관광 기술 활용한 관광...,2021. 4. 5.
대천어항과 방파제에서 만난 일몰,이럴 때 일수록 가끔 트인 공간을 여행하면서 즐거운 시간을 가져도 좋습니다. 요즘 겨울바다가 보기 좋습니다. 날씨가 차갑지만 방파제에서... 바다나 산으로 떨어지는 모습은 장엄합니다. 여름보다는 겨울에 만나는 일몰이 더 아름답습니다. 대천항 전화 : 041-932-2023 주소 : 충남 보령시 신흑동 1250,2020. 12. 23.
"바닷길이 열리는 신비의 바다, 무창포",충남 보령시 웅천읍 열린바다1길 10에 위치한 무창포해수욕장은 지역의 이름 그대로 웅천해수욕장이라고도 불린다. 무창포라는 명칭은... 모래사장에 남긴 아이들 이름 #보령여행 #무창포 #신비의바닷길 #주꾸미도다리 #축제 #낙조 #보령8경 #인간극장 #박은순할머니 #외산중,2021. 6. 5.
"임팩트 있었던 대천여행코스(대천 스카이바이크, 대천키조개삼합, 보령갱스커피)",기분 좋은 짜릿함을 즐긴 후에 우리는 배를 채우러 다음 대천여행코스에 방문했어요. 바로 대천키조개삼합이라는 곳이었는데 해수욕장 인근에 있어서 금방 찾아갈 수 있었어요. 2. 대천키조개삼합 주소: 충남 보령시 해수욕장8길 51 전화번호: 041-932-9239 영업시간: 매일 00:00 - 24:00 메뉴가격: 키조개...,2021. 4. 16.
"대천여행, 대천 공주대학교 수련원 학생6인실 방문기",대천 공주대학교 수련원 주소 : 충남 보령시 해수욕장10길 80 전화번호 : 041-932-8111 주차가능 (무료) 체크인 14:00 / 체크아웃 11:00 이곳은 충남권 MT의 메카 대천해수욕장입니다. 그중에서도 가장 끄트머리에 위치한 사진속 장소. 바로 대천 공주대학교 수련원이에요. 공주대 재학생은 물론이요 교직원...,2021. 9. 15.
[충남] 보령 대천해수욕장맛집 _ 해물상회,"차로만이동을했고, 수시로 손소독제와 마스크는 밥먹을때를 제외하곤 일체 벗지않았어요) 번호 _ 041-931-9060 주소 _ 충남 보령시 해수욕장6길 118... 꼭 방문해보세요! #해물상회 #대천해수욕장맛집 #대천맛집 #전국맛집 #데이트코스 #맛집추천 #맛집찾기 #국내여행 #국내여행맛집 #국내맛집",2020. 8. 19.
매력있던 대천 조개구이,주소 : 충남 보령시 해수욕장8길 51 영업시간 : 매일 00:00 - 24:00 연중무휴 전화번호 : 041-932-9239 앞에 주차장도 있어서 편하게 대놓고 들어갔는데... 그렇고 친구들도 모두 100%대만족한 곳이었어요. 다음에는 해물 삼합 구이를 먹어볼 생각이고 근처에 여행 오시는 분들은 가보셔도 아주 좋을 거 같아요.,2021. 4. 12.
(보령 외연도 봉화산279m )가고싶은섬 보물섬 축복의섬 외연도 봉화산^^~,하며 산행이든 여행이든 아쉬움은 늘 남더라 봉화산 표시따라 봉화산으로 숲길따라 걷는다 동백꽃 핀 너덜길을 홀로 걷는데 은근 걱정이다... 제136호 충남 보령시 오천면 외연도리 산 293 충남 서해안에 위치한 외연도에 있는 상록수림 3만여 평의 면적에 동백나무 후박나무 팽나무 및 각종...,2021. 7. 6.
마음까지 힐링되는 휴심채캠프 보령여행 떠나요~,휴심채캠프 보령여행 꼭 한번 다녀가시길 추천해용!^^ 주소 : 충남 보령시 통나무마을1길 48-21 휴심채 캠프 전화번호 : 0507-1487-6364 #보령 #보령맛집 #셀프바베큐장 #보령카페 #보령여행 #대천여행 #대천해수욕장 #천안근교 #천안바베큐 #보령핫플 소정의 포인트를 지급받아 주관적으로 작성했습니다.,2021. 6. 29.
"[충남펜션] 깨끗한 보령숙소추천 ""겨울연가펜션""","겨울연가펜션 주소 충남 보령시 머드로 150 (신흑동 2228-12) 전화번호 041-932-6868 1박2일로 보령여행을 계획하다가 숙소 알아보는게 너무 힘들어 친구한테 보령숙소추천을 받아 ""겨울연가펜션"" 이라는 곳을 다녀왔어요! 겨울연가펜션은 대천바다와 1분거리에 위치하여 많은 분들이 찾아오기도 하며...",2020. 8. 4.
[충남] 보령 무창포해수욕장 비체팰리스,결국 모래사장이 코앞인 비체팰리스 리조트로 무창포 비체 팰리스 충남 보령시 웅천읍 열린바다1길 78 041-939-5757 진짜 로비에서 나오면 바로... 많이 아쉬웠다 리모델링 하면 비싸질것도 같고.. #충남보령 #무창포해수욕장 #비체팰리스 #바다앞리조트 #주말여행 #엄마랑아이랑,2020. 6. 16.
이열치열 국내여행~ 해물샤브샤브와 대천키조개삼합 추천후기!,이번 휴가는 국내여행으로 다녀왔어요! 그렇게 방문한 대천해수욕장 안에 있는 대천키조개삼합에 방문하게 되었는데요~ 주소 : 충남 보령시 해수욕장8길 51 전화번호 : 041-932-9239 영업시간 : 매일 00:00 - 24:00 연중무휴 주차여부 : 주차가능 어둑어둑해진 날씨에도 오픈되어 있는 대천키조개삼합은...,2021. 8. 12.
충남 보령_저절로 행복해지는 공간 <리리스 카페>,꽃향기가 가득한 플라워카페 리리스 카페 <리리스 카페> 충남 보령시 성주면 개화리 177-2 개화예술공원 내 매일 09:30 - 18:00 연중무휴 개화예술공원... 보령 여행에서 제일 기억에 남는곳이 리리스카페였다.ㅋㅋ 그만큼 너무 예쁘고 아기자기한 곳이었다. #리리스카페 #대천카페 #보령카페 #플라워카페...,2020. 8. 20.
"보령 여행 : 대천해수욕장 , 대천 여행",이번 1박2일 여행은 보령에 있는 대천해수욕장에 다녀왔어요. 저는 서울에서 출발했기 때문에 센트럴시티(호남선)에서 버스를 탔어요. 사실... 대천 2278 리조트 충남 보령시 머드광장로 14 2인이 묵기에는 깔끔했고 다만 날씨가 습한 탓인지 바닥이 조금 꺼끌했어요. Previous image Next...,2021. 7. 16.
"설경이 아름다운 국립자연휴양림, 랜선으로 즐겨봐요!","하지만 코로나19로 여행이 쉽지 않아 아쉬운 분들이 많으시죠? 아쉬운 마음을 조금이라도 달래드리고자 아름다운 설경 사진을 가져왔어요... 설경 <국립오서산자연휴양림> - 충남 보령시 청라면 오서산길 531 ☎ 041-936-5465 - 주변관광지 : 대천해수욕장, 냉풍욕장, 석탄박물관 코로나19로...",2021. 1. 11.
대천여행 - 대천항 수산시장 / 커피인터뷰 / 한화리조트 대천파로스 / 먹보네조개구이...,비가 많이 왔던 1박 2일 대천여행 [2021. 07. 03 ~ 2021. 07. 04] 할라큉입니다ಇ 남편이랑 동생들이랑 대천으로 놀러 다녀왔는데 별거 없지만 기록용... 수산시장 충남 보령시 대천항로 334 08:00 - 21:00 연중무휴 보령중앙시장에서 살짝 실망했는데 대천항 수산시장은 굉장회 활성화 되어있어요. 사람도...,2021. 7. 8.
대천여행 대천우유창고 대천해수욕장... 너울펜션 스파펜션 아기랑 대천나들이 가족여행,대천을 가면서 첫번째 여행지 우유창고를 방문했어요 사진찍는 곳이 많은 이곳은 많은 사람들이 찾는 포토존의 명소 충남 보령시 천북면 홍보로 574 이 곳은 우유를 생산하는 곳이며 소도 만날 수 있어요 우유 아스크림이 제일 핫한 카페 입니다 그리고 아이들 체험학습도 할수 있어요 주차장에서...,2021. 5. 25.
노는 언니 55회 김자인 조해리 김은혜 나이 인스타 키 남편 자녀 국대엄마 육아해방여행...,이번 여행을 통해 육아 동기를 결성하는데요. 촬영장소 죽도 상화원 충남 보령시 남포면 월전리 844-15 남포방조제로 408-52 보령 머드축제 대천해수욕장 머드 페스티벌 김은혜와 김자인은 농구와 클라이밍 등 운동선수 엄마다운 태교 비법을 전수한 반면 조해리는 좀비 영화를 비롯한 공포...,2021. 8. 17.
보령 가볼만한곳 대천해수욕장 짚트랙코리아 짚라인 후기 (feat.카트),"여행은 커녕 식당, 카페를 이용하기에도 힘든 시기이죠 ㅠㅠ 이럴 때 꺼내보는 사진첩... 자그마치 반년전에 다녀온 대천해수욕장 ㅎㅎㅎ 보령 대천해수욕장의 명물로 떠오르고 있는 짚트랙코리아를 소개합니다. 짚트랙코리아 충남 보령시 해수욕장10길 80 041-934-3003 이 날은 대전에 사는 이모네...",2021. 1. 7.
[사건후] '화해'위해 떠난 여행이었는데...혼인 18일 만에 '비극'으로 끝나,"충남 보령시의 한 바닷가로 여행(2박 3일)을 간 부부는 대화하며 그동안의 오해를 풀고 화해했다. 그렇게 관계를 회복한 채로 집으로 돌아오던 도중, 아내 B 씨가 “이대로 집에 돌아가기 싫다”는 말을 하자 A 씨는 충남 공주시 공주보 인근으로 차를 몰았고 두 사람은 이곳에서 술을 마시며...",2021. 3. 8.
[대천. 보령] 반려동물 동반 가능한 음식집 - 고깃집. 칼국수. 조개구이. 조개찜.,야외 자리도 있어서 반려동물 동반이 가능한 음식점들이 많아요 ㅎㅎ 청산에 조개구이 충남 보령시 해수욕장8길 21 평일은 10시부터 10까지 주말은... 걱정 없이 여행을 다녀왔어요> < . #매력쟁이코코 #대천애견동반 #대천반려동물동반 #보령애견동반 #보령반려동물동반 #반려동물동반여행,2021. 10. 8.
(보령여행) 충남보령 돌솥쌈밥맛집?! : 보령 시골돌솥쌈밥,"대천해수욕장 근처는 거의 해산물 위주여서, 대천해수욕장에서 약간 벗어나 보령시내(?)쪽에서 식사를 하기로 했습니다. 점심때쯤에 갔는데... 충남엔 '미더유~'란 사업(?)을 하고 있더라구요. '미더유'는 내 식당에서 50km이내의 인근지역에서 재배, 생산된 농수산물을 구입하여 고객에게 먹거리로...",2020. 7. 9.
충남 보령맛집:: 삼겹살과 쭈꾸미의 매운조합! 열정쭈꾸미 보령 가족점,참고하셔서 방문시에 더 푸짐한 식사하시길 바래요^^ #충남보령맛집 #충남맛집 #보령시내맛집 #동대동맛집 #보령동대동맛집 #보령삼겹살맛집 #보령쭈꾸미맛집 #보령쭈꾸미삼겹살 #보령쭈삼볶음 #보령쭈꾸미삼겹살맛있는곳 #보령식당 #보령외식 #대천해수욕장 #대천여행 #보령여행 #쉬즈블로그...,2020. 6. 26.
보령여행 제2경 죽도 상화원(尙和園) 한국식 전통정원은 조화를 숭상하고(崇尙)...,"보령 죽도 섬 상화원 석양 정원 대 연못 충남 보령시 여행 명소 제2경 죽도 섬의 바다정원 상화원의 추천 장소 석양노을, 대 연못, 한옥마을 코스 상화원 분재정원 상화원은 마지막 코스 구간에 분재 정원이 있습니다. 대나무 터널도 있고요 상화원 분재정원의 정경 대나무숲을 통과하면..잘 정리...",2020. 8. 6.
"태풍 BAVI가 지나고 방문한 ""대천해수욕장"" 코로나 방역과 안전","대천해수욕장 충남 보령시 머드로 123 해수욕장 입구에 다다라서 코로나 방역과 입출입을 통제하는 곳이 생겼더라구요 코로나가 현재 2.5단계 격상으로 이전처럼 경제활동과 문화, 여행에 어려움을 겪고 있는데 잠시나마 야외에서 자연을 만끽할 생각으로 방문했어요 체온측정과 마스크여부를...",2020. 8. 28.
올 여름 휴가엔 '섬' 어떠세요? - '2020 휴가철 찾아가고 싶은 33섬' 선정,"올해는 코로나19 장기화로 인해 지친 일상을 섬 지역의 언택트 힐링 여행*으로 치유함과 동시에, 경영난을 겪고 있는 지역 소상공인과... 충남 보령시 장고도 그 중에서 충남 보령시 장고도는 썰물 때 물이 빠지면 명장섬까지 신비의 바닷길이 열려 2km의 백사장이 펼쳐집니다. 전남 신안군 기점...",2020. 6. 29.
겨울 먹거리를 찾아서 대천항수산시장으로 놀러와~보령!,보령 여행하면서 재미있는 시장 구경도 할 겸 다녀온 대천항 수산시장에는 어떤 먹거리들이 있을지 궁금하시죠? 대천항수산시장에 마련된 넓은... 제철 맞이해 맛있는 먹거리를 대천항수산시장에서 찾아~보령! 대천항수산시장 주소 : 충남 보령시 대천항로 334 문의 : 041-931-1230 1월 홍보요원 기은주,2020. 1. 17.
"원산도커피, 원산도카페 분위기 포토존 이쁜곳 바다뷰카페",원산도카페 분위기 포토존 이쁜곳 바다뷰카페 원산도커피 정보 포스팅을 시작하고자 합니다 아름다운 원산도 여행 계획중이거나 또는... 주소 : 충남 보령시 오천면 원산도5길 102 전화번호 : ***-****-**** 해시태그 #충남카페 #보령카페 #보령맛집 #대천카페 #대천맛집 #원산도카페#안면도카페...,2021. 10. 9.
"보령 여행 추천 명소 (1) :: 충청수영성, 시원하게 트인 경치에 힐링",""" 충청수영성 "" 충남 보령시 오천면 소성리 661-1 보령 여행 추천 명소, 충청 수영성 조개구이로 시작한 대천 여행, 조개구이 먹고 보령 곳곳 여행하기 1. 충청 수영성 동백꽃 필 무렵의 촬영지이기도 한 이곳, 충청 수영성. 무지개 모양인 서문. 화창한 날씨와 어우러져 시원하고도 정갈한 분위기가...",2021. 7. 23.
[여행정보] 랜선으로 떠나는 가을 섬 여행,"랜선으로 떠나는 가을 섬 여행 2021년 찾아가고 싶은 섬 2021.09.07 행정안전부 어디로든 불쑥 불쑥 떠나고 싶어지는 요즘입니다. 위도, 병풍도... 절경 [충남 보령시 삽시도] - 방문하기 좋은 시기 : 9월~11월 • 삽시도 둘레길은 오붓한 오솔길이 조성되어 있으며, 기암괴석 갯바위와 백사장 등...",2021. 9. 8.
「2021년 찾아가고 싶은 33섬」 여름 휴가철 여행지 참고하세요!,"- 충남 보령시 고대도는 조선 최초의 선교사인 칼 귀츨라프를 기념하는 고대도 교회가 있으며, 경남 통영시한산도는 매년 8월 한산대첩을 승리로 이끈 이충무공의 구국정신을 기리기 위한 한산대첩축제를 개최하고있다. ④ ‘쉬기 좋은 섬’은 인적이 드문 섬에서 힐링여행으로 치유하는...",2021. 6. 25.
보령 2박 3일 여행(2021.07.25 ~ 27),국제적 관광명소인 충남 보령시 대천해수욕장입니다. 오늘은 바다에 발만 담구어 보았습니다. 이렇게 멋지고 넓은 이 곳이 유명한데에는 다... 사람들이 모여살면서 동네를 이룬 마을) 걷다보면 추억의 문방구들이 많이 보이네요. 2박 3일 동안 즐거운 보령(전주와 군산 포함)여행이었습니다.,2021. 7. 28.
원산도디저트카페 에그타르트맛집을 찾으신다면 원산도커피를 방문해서 힐링하세요,이국적인 분위기는 물론 안면도 여행의 필수 코스로 유명한 파노라마 오션뷰 카페를 즐기고 싶으시다면 원산도 커피를 방문해 보세요! 방문을... 커피와 디저트를 한 번에 즐기면서 힐링하세요 주소 : 충남 보령시 오천면 원산도 5길 102 전화번호 : ***-****-**** 소정의 포인트를 지급받음.,2021. 10. 10.
"[대천여행] 보령 대천해수욕장 맛집 통큰해물뚝배기, 바운스조개구이무한리필","나의 첫 대천여행 ! 스타뚜! 보령 통큰해물뚝배기 041-935-8280 충남 보령시 머드로 137 대천해수욕장에 여름휴가로 친구들이랑 왔다가 대천 해수욕장 근처로 맛집을 찾다가 보령 현지맛집이자 후기도 괜찮기래 바로 보령 통큰해물뚝배기에 방문!!! 우선 메뉴는 해물탕, 알탕, 꽃게탕, 아구찜 등 해물과...",2021. 8. 18.
보령 아이와갈만한곳 [보령석탄박물관],보령석탄박물관 ▪️ 충남 보령시 성주면 성주산로 508 ▪️ 041-934-1902 ▪️ 매일 09:00 - 18:00 3~10월 / 입장은 30분 전까지 가능 매일 09:00 - 17:00 11... 늦게 가서 못하고 와서 아쉽지만 좀 더 일찍 가서 체험까지 하면 좋을거 같네요 #보령여행 #보령 #보령갈만한곳 #보령석탄박물관...,2021. 10. 9.
대천 해수욕장: 바다전망 감성호텔/펜션 “스테이 인터뷰 대천점”,홈키파 ㅋㅋㅋㅋㅋㅋㅋㅋㅋㅋㅋㅋ 홈키파 필수입니다 왜냐하면 입실하자마자 거미를 발견했그등요^^ 대천 여행 바다가 훤히 보이는 침대... 아아 두명. 뜨아 두명 취향 뚜렷한 내친구덜 즐거웠어 봄엔 더 좋은데 가자앙 *충남 보령시 대천항1길 67-22 (신흑동 948-31) *입실 15:00 -토ㅣ실 11:00 ****-****-****,2021. 2. 16.
[충남/보령/대천해수욕장 맛집... 대천해수욕장점'대천 여행 에서 만난 현지인 로컬 맛집,안녕하세요 잇님들 오랜만에 휴가를 쓰고 대천 여행 을 왔어요 대천해수욕장 치킨 오랜만에 느끼는 바닷 공기... 그리고 휴가의 맛 대천하면... 생활맥주 대천해수욕장점 현지인들이 조개 안먹고 가는 술집 대천 해수욕장 치킨 대천치맥 수제맥주 충남 보령시 해수욕장4길 134 매일 17:00~02:00 ☎041...,2020. 8. 2.
