header,contents,date
"20210604 생방송 투데이 (2838) 충주 3GO 여행, 따뜻한 인심은 덤! 27년 내공이 깃든 맛...","3GO - 충주 3GO 여행 활옥동굴 충북 충주시 목벌안길 26 / 043.848.0503 중앙탑메밀마당 (메밀치킨, 메밀막국수) 충북 충주시 중앙탑면 중앙탑길 103/ 0507.1400.0283 충주호관광선 충북 충주시 동량면 지등로 882 / 041.851.6481 오대호아트팩토리 충북 충주시 앙성명 가곡로...",2021. 6. 4.
켄싱턴리조트 충주 : 애견동반여행 : 신나개 재밌개,깜짝놀랬네요 충북 충주시 앙성면 산전장수1길 103 켄싱턴리조트 충주 . 엘리도 차를 오래 안타서 그런지 멀미도 안했답니다 . 반려견과 함께 여행하기 부담없는 거리라서 일단 맘에 드는 켄싱턴리조트 충주 . 도착은 12시쯤 했는데 체크인이 오후 3시라서 시간떼우기로 먼저 들러본 “중앙탑...,2021. 4. 21.
와이즈발레단과 함께하는‘신나는 예술여행’,예술여행 '발레야놀자' 공연 일정 순번 순회처 지역 일정 시간 주대상자 1. 중앙탑중학교 충북 충주시 2021년 5월 10일(월) 13:30 청소년 2. 벌교여자중학교 전남 보성군 2021년 5월 12일(수) 13:20 청소년 3. 고성중학교 전남 진도군 2021년 5월 13일(목) 13:20 청소년 4. 완도군외중학교 전남 완도군...,2021. 7. 21.
충주맛집 :: 분위기 좋은 한옥 식당 겸 카페 민들레 (내돈내산 솔직후기),충주 민들레 주소) 충북 충주시 동량면 지동로 1055 영업시간) 11:00 ~ 23:00 연중무휴 운영 주차 가능 민들레 앞에는 이렇게 넓은 주차장이 있어요. 뚜벅이 분들이 방문하기에는 어려운 곳에 위치하고 있어요. 충주부릉이여행객분들에게 추천합니다. 오후 4~5시 사이에 좀 애매한 시간에 방문했는데도...,2021. 10. 10.
"[충북 가볼만한곳] 단양온달동굴, 충주활옥동굴, 청주미원청석굴, 정북토성 주말나들이...","충주 이색동굴 활옥동굴 활옥동굴은 충북 충주시 충주 호변에 위치하고 있으며 100여년 동안 활옥, 백옥, 활석 등을 채광하던 광산이었다고 합니다. 이곳을 2019년 힐링과 체험의 동굴로 재탄생시키면서 충주 관광명소로 급부상중인 곳입니다. 기본정보 □ 매일 09:30 - 18:30 (마지막 입장 17:00)...",2020. 8. 14.
청풍호반케이블카를 타고 올라가 비봉산 전망대에서 바라본 청풍호,"오늘은 충북 제천시, 충주시, 단양군에 결쳐 있는 인공호수 청풍호! 충주댐을 막아 형성된 호수랍니다. 소양호 다음으로 담수량이 많다고... 예쁜 사진 많이 찍으세요~^^ 충북 제천을 여행하시는 분들께 청풍호반케이블카 타보실 것을 권해드립니다. 풍광이 정말 좋습니다. 연인 혹은...",2020. 7. 20.
"충주맛집, 촉촉하고 바삭한 교현동 구돈가스!",눈과 입이 즐거운 충주시 여행을 책임지는 충주여행입니다. '겉바속촉'이라는 단어를 아시나요? 겉바속촉은 겉은 바삭하고 속은 촉촉하다의... 주소 충북 충주시 염밭로 88-1 전화 043-910-7350 영업 매일 11:00~21:00 (Breaktime 14:00~17:00) / 일요일 휴무 충주맛집 교현동 구돈가스는 일본식 돈가스와 카레가...,2020. 3. 17.
충주 가볼만한곳 중앙탑공원 탄금호 무지개다리 야경 명소,중앙탑사적공원 주소 : 충북 충주시 중앙탑면 탑정안길 6. 주차장 무료. 입장료 없음 제일 먼저 만난 곳은 색색의 고운 천들이 널려 있는 중앙탑... 충주여행도 다시 한번 계획해 봐야겠어요. #충주가볼만한곳 #충주여행 #충주야경 #충주무지개다리 #충주중앙탑공원 #야경명소 #중앙탑사적공원,2021. 10. 8.
충주 주덕 화곡저수지 / 가볍고 조용하게 산책하기 좋은 곳,"충주 여행 주덕에서 간단하게 산책할 곳을 찾다가 가게 된 주덕 화곡저수지! 차가 많이 다니지 않는곳이라, 길가에 붙여서 주차를 해도 될 것 같다. 거의 길 끝쪽이고, 너 넘아가면 막다른 길이라 거의 차들이 없다고 보면 된다. 화곡 저수지 충북 충주시 주덕읍 화곡리에 있는 저수지다. 이곳에 처음...",2021. 9. 22.
갈마가든_월악산_충주드라이브,ㅎㅎㅎ 충북 충주시 살미면 용천리 245-1 이제 배 채웠으니 가볼만한 곳... 으로 가야하는데 계곡... 이야기를 하는 누군가. 그래 뭐! 기분 내키는 대로 달리면 되는 것이지. 그리하여 월악산 이정표를 따라 달린다. 멋진 경치와 함께 달리다가 잠시 정차할 곳을 찾으니 한적한 길. 장마비에 씻기고...,2020. 8. 1.
충주 핫플레이스 중앙탑공원 - 충주라서 달달해,"기존에는 사적공원으로 인식되었던 이곳이 관광명소, 여행 코스로 바뀌고 있는데, 그중 하나가 여기에 있는 큰 달입니다. ‘충주라서 달달해’라는... 표시하던 중앙탑 이제 앞으로 관광의 중심으로 자리매김할 충주를 기대해 봅니다. 충주 중앙탑공원 충북 충주시 중앙탑면 탑평리 11 글/사진. 그린티",2020. 7. 3.
"청풍배스포인트, 충북배스, 루어낚시, 앵글러, 앵글러, 충주배스, 충주배스포인트, 충북...",릴라의 블로그였습니다~~~ #충주배스 #충주호배스 #충주댐 #청풍배스 #청풍배스포인트 #청풍가물치 #충주가물치 #앵글러 #루어낚시 #배스앵글러 #배스낚시 #민물낚시 #충북배스 #충북권 #동출 #워킹낚시 #일상 #네이버블로그 #블로그 #취미 #낚시인 #여행 #충주시 #단양배스 #오름수위 #충주호수위...,2021. 9. 7.
부용지맥51.78km- 오랜만에 홀로 걸어본,중간지점인 31km 지점 충북 충주시 노은면 신효리 846-1 이곳에 차량을 주차하고 카카오택시를 부르니 10분도 안되어 택시가 도착을 하고 택시비 26... 어둠속에서 의 여행이 끝나가려나 보다. 산속을 벗어나 굴다리를 통과 하고... 과수원 이 있는 야트막한야산 하나 넘어서 다시 만나는 지방도로.....,2021. 6. 2.
수주팔봉,언제 : 2021년 9월 4 일 누가 : 사니조아 부부 어디를 : 수주팔봉 시점 : 충북 충주시 살미면 토계리 417-8 수주팔봉주차장 종점 : 충북 충주시 살미면... ▼코로나 2 차 접종 후 몇일이 지나지 않아 조심스러워 여행겸 작은 산을 산행하기로 예정하고 1 박 2일의 첫 코스를 충주 수주팔봉으로 시작한다...,2021. 9. 9.
스피또1000 53회 출고율 및 1등 잔여량,나래복권 043)853-3659 충북 충주시 충원대로952 #스피또 #스피또1000 #스피또2000 #스피또500 #나래복권 #1등배출점 #스포츠토토 #스피또1등 #스피또잔여량 #충주복권방 #복권명당 #남한강명소 #충주명소 #충주가볼만한곳 #충주여행 #충주댐 #라이더 #자전거여행 #스피또53회 #승무패 #승부식...,2020. 11. 19.
"[충주여행]엉금엉금 기어서 가자 악어봉! /악어봉 가는길 , 그리고 게으른 악어",충주하면 요즘은 이미 인기 여행지가 되어버린 '악어봉' 악어봉 충북 충주시 살미면 신당리 예전부터 가고 싶었던 악어봉을 작년 코로나가 기승을 부리다 잠깐 잠잠해진 어느날 다녀왔다 원래 몇년 전부터 악어봉은 이미 유명하다면 유명한 인기 여행지였는데 다만 이렇게 입산금지 산이라는게 선뜻...,2021. 8. 1.
데이트하기 좋은 충주맛집 연수동 레스토랑 k1534!,날씨가 점점 따뜻해지고 있는데요 봄은 여행하기엔 좋지만 나른해지고 입맛이 없어지기 쉽습니다. 그래서 오늘은 분위기도 좋고 입맛도 돋울 수 있는 충주맛집인 연수동 k1534을 소개해드리겠습니다! 데이트하기 좋은 충주맛집 연수동 레스토랑 k1534! 주소 충북 충주시 연수동산로6길 7 1층...,2020. 3. 19.
국내여행 | 충주 글램핑 '클럽멤피스 글램핑앤리조트' 충주호뷰 최고!,패러글라이딩을 타기 위해 단양 여행을 가면서 그냥 돌아오기 아쉬워 2박 3일로 충주까지 들렀었다. 단양-충주 여행 코스 : 2박 3일... 지금 다시 봐도 정말 뷰 하나는 최고~~~ (수영장은 여름 기간 3개월 동안 개장한다고 한다.) 클럽멤피스 글램핑앤리조트 충북 충주시 살미면 월악로 1229 010...,2021. 3. 2.
행복한 딸기 체험 충주체험관광,"탄금호에 자리한 '충주체험관광센터'를 찾으면 다양한 체험 프로그램들을 착한 가격에 부담없이 즐기며 힐링 여행을 할 수있어 더욱... 충북 충주시 봉방동 646-3에 자리한 행복한 딸기 농장은 충주 딸기 농장 중에서도 맛이 좋기로 알려진 농장이라 합니다. 행복한 딸기 농장은 연간 1,500여명이 찾아...",2020. 5. 27.
"[TV속 정보] 4월 9일 (금) 2TV생생정보, MBC생방송오늘저녁, SBS생방송투데이 나온 곳...",043-850-7346 충북 충주시 노은면 우성1길 191 ▶강동토종씨앗도서관 서울 강동구 고덕로 314 <택시맛객 - 산야초 닭백숙 한 상 차림... 3GO - 부산 3GO 여행 편> ▶ 해동용궁사 주소 : 부산광역시 기장군 기장읍 용궁길 86 번호 : 051-722-7744 ▶ 해운대블루라인파크 미포정거장...,2021. 4. 13.
권태기의 연인과 부부들을 위한 충북 호수 여행,아내의 동의 아래 ‘충북의 호수 여행’을 테마로 정했다. ‘진짜’ 바다만 빼고 여행의 모든 것을 즐길 수 있기 때문이다. 충주호 충주시 살미면 신당리 악어봉에서 바라본 악어섬. 악어 몇 마리가 충주호 호반에 엎드려 있는 듯하다. 여행에도 강약조절이 필요하다. 여행이 만족스러우려면 여행...,2020. 6. 6.
"충주 카페 :: 저수지 옆 햇살 예쁜곳, 타임",이번에는 남편과 1박2일 여행을 즐기면서 다녀와본 충주 카페타임 이야기를 정리해보려 한다. 여긴 이웃님인 제이콥님 블로그에서 접했던 곳인데... + 주소 : 충북 충주시 대소원면 성종두담길 232 영업시간 : 매일 오전 11시~밤10시 매주 월요일 휴무 가게 외관은 이런 느낌이다. 컨테이너 건물로...,2020. 11. 20.
충주 카페 / 우림정원에서 작약꽃밭을 만나다,"충주 여행중에 들린 카페 우림정원을 소개할께요 부부가 직접 일군 정원으로 규모가 생각보다 크고 아름다워서 놀랐던 곳이랍니다 입장료 5000원을 내면 우림정원을 구경할수 있고 한바퀴 돌고 나와서 커피나 음료 그리고 과일을 무료로 내어주는 정원 카페랍니다 충주 카페, 우림정원 충북 충주시...",2020. 6. 6.
[충주여행]활옥 동굴카페,폐광산을 카페로 재탄생시킨 충주활옥동굴카페 이곳은 강화의 조양방직 카페처럼 작업장을 카페로 꾸민 곳에요 동굴 관람 후 내려간 체온을 올려주기 위해 들렀죠 주소 : 충북 충주시 목벌안길 26 전화 : 043-848-0503 주차 가능 운영시간 AM 9:30 ~ PM 6:30 (마지막 입장 PM 5:00) 월요일 휴무 (월요일이...,2021. 7. 13.
"짬뽕 전골,눈꽃 깐쇼새우 (경기 시흥) 연탄불고기 (서울 송파) 30년 손맛 만두 (충북 충주)",(9호선) 석촌고분역 1번 출구 284m <이PD가 간다> 경상도 가을 여행 상구달구나곶감 와송나라 경북 상주시 선상서로 2470-19 01O.6400.8488 신경순 대표 <엄마는 슈퍼우먼> 30년 손맛! 행복을 빚는 만두 엄마 명동김치만두 충북 충주시 충인6길 2 (충의동) 043.848.5652 06:00~20:00 #만두,2020. 11. 6.
[충주 1박2일] 애견동반 가능한 코스로 충주여행하기,"이번 여행은 조금 특별하게 애견동반 코스로 다녀왔습니다. 이유는 바로 귀여운 '먼지'와 함께 하기 위해서였어요. 갓플레이스 충북 충주시 직동길 81 매일 11:00 - 21:00 매주 월요일 휴무, 마지막 주문시간 8시 다양한 메뉴들이 있는 레스토랑 #갓플레이스 주차장이 따로 없어 사진 처럼 가게 앞이나...",2021. 3. 23.
"충주 우림정원, 가을에 가기 좋은 힐링 명소",그래서 이번 포스팅은 살랑이는 가을 바람을 만끽하며 즐길 수 있는 여행지 #충주우림정원 을 소개해드리겠습니다! 충북 민간정원 제6호 충주 우림정원 푸릇푸릇한 나무 숲 사이로 향긋한 산들바람이 불어오는 이곳~! 충주 우림정원은 충주시 엄정면 작은 산 중턱에 위치한 민간정원입니다....,2021. 9. 1.
왕의 온천 악어섬 수주팔봉,"걸쭉하고 톡 쏘는 달콤한 막걸리는 고소한 나물과 어우러져 찰지게 목을 타고 술술 넘어간다. 생막걸리는 유통기간이 일주일 남짓이라 수안보를 벗어나면 구하기 어렵다. (영화식당, 충북 충주시 수안보면 물탕1길 11, 산채 정식 1인분 1만6000원) [충주 = 권오균 여행+ 기자] [출처 : 매일경제]",2021. 2. 22.
클굿플] 충주시 노은면 연하리 가신리 대덕리에 스타렉스캠핑카 들르다.,"4 충주시 #노은면 #연하리 #가신리 #대덕리 에 #스타렉스캠핑카 들르다. 노은면 [ 老隱面 , Noeun-myeon ] 관할 법정지명 : 연하리, 법동리, 안락리... 원통산 높이: 657m 위치: 충북 음성 감곡면, 충주 노은면(등산코스: 골프장입구-둔터고개-승대산-질마재-원통산-치성터-북녘능선-헬기장-톱실-오갑국교)...",2020. 4. 6.
충청북도농업기술원 잇다팜 햇살블루 사과따기 농촌체험 가족여행,"재미있게 잘 들었고요, 넉넉한 인상처럼 이곳에서 농촌체험, 요리체험 등을 하면서 시골의 넉넉함을 느껴보시기 바랍니다. 깊어가는 가을! 만추의 가을을 느낀 하루였습니다. 충청북도농업기술원(충북농업기술원) 잇다팜 인증한 충주시 햇살블루 사과따기 체험과 농촌체험 가족여행으로 추천합니다",2020. 11. 12.
여행추천!!! 충주 활옥동굴+고추냉이 (feat.6시내고향),출처:네이버 #활옥동굴 충북 충주시 목벌안길 26 ☎ 043-848-0503 매일 09:00 - 18:00 마지막입장 17:00 월요일 휴무 (월요일 공휴일의 경우 월요일 정상... 과거 운동선수셨다던 대표님과~즐거운 고추냉이잎 촬영이었습니다!!!ㅋㅋ 방송직전!!!!챨칵! 나중에 여행으로 놀러가고 싶은 곳으로 체크♥,2021. 4. 20.
❤️충주 반품샵 '두원리퍼브' 쇼핑 후기,"두원리퍼브 충북 충주시 봉방동 33-1(지번) 충북 충주시 탄금대로 58(도로명) 전화번호 : 043-521-4992 영업일 : 매주 목/금/토/일(월요일~수요일은 휴무)... 급하게 여행용 등으로 캐리어가 필요할 경우 찾아볼만 하다 여기는 디지털 제품을 판매하는 매대다 각종 케이블, 키보드, 보조배터리, 충전기...",2021. 10. 3.
서울근교 충청도가볼만한곳 당일여행 충주 활옥동굴,충청도당일여행 활옥동굴 동굴안에 카누를 탈수있는곳이있어서 아이들이 너무좋아해요! 더운여름에 시원한 동굴이라 긴팔옷 필수로 챙겨가셔야하는곳~~ ㅋㅋㅋ하루라도 에어컨없이는 살수없는 여름철날씨에 등골서늘한 동굴이라 좋아요^^ 충청도가볼만한곳 충주 활옥동굴 043-848-0503 충북 충주시...,2021. 8. 13.
(충주 용산동) 중간중간 감자가 별미인 푸짐하고 맛있는 산더미 치킨 맛집 [111닭],영업시간 매일 : 11:30 ~ 23:59 위치 충북 충주시 용산동 335 영진보람아파트 상가 111닭 실내는 6~7 테이블 정도가 있었고 신상 가게라 그런지 깔끔하게... 충주영진보람아파트치킨 #충주여행 #커플여행 #우정여행 #가족여행 #직장인점심 #직장인저녁 #충주회식 #충주호프 #충주맥주집 #충주소주집,2021. 9. 30.
[차박 명소 추천] 언택트 여행으로 즐기기 좋은 차박명소!,차박은 말 그대로 차 안에 머무르며 숙박을 하는 방식의 여행이며 요즘 언택트 여행의 대표주자로 떠오르죠? 저도 차박을 즐겨 하는 만큼... 목계솔밭 [충북 충주시] 충청북도 충주시 중앙탑면 장천리 412-2 원래도 캠핑 명소로 유명한 충북 충주시의 목계 솔밭! 노지 캠핑장이지만 푸드트럭부터...,2021. 6. 16.
체험하기 좋은곳-슬로우파머,좋은곳 충북 충주시 수안보면 탑골 1길 178번지에 자리한 슬로우파머와 수안보온천 길거리 족욕코스 왕 추천합니다 뜨끈한 온천수에 발을 담그고 자연 풍광 공짜로 보며 사랑하는 회원들과 혹은 가족 단위 여행일짜 잡아 보셔요 지난 가을 단풍구경과 체험했던 일과를 병간호하면서 회상 해봅니다,2020. 2. 20.
충주시 소식,"오늘은 충주시 소식에 대해 알아볼께요~ '첫 번째 소식' 중앙탑 사적공원, 충주호체험관광지, 충주세계무술공원 3곳 선정 충주시, 장애물 없는... 한편 4개 SNS 매체별 특성을 토대로 세대별 선호도가 높은 콘텐츠를 제작해 충북도는 코로나19 속에서도 여행 욕구를 채우기에 충분하다는 메세지를...",2021. 3. 2.
충주 체험 여행 천연염색 자연이주는여유,이와 같은 식으로 염색을 했답니다 나중에 코로나가 잡히고 여행하게 되면 아이들과 같이 체험해 볼만한 충주 체험 여행입니다. 체험이 있는 농가민박 천연염색장 <자연이주는여유> 충북 충주시 중앙탑면 감노로 2295 ☎ ***-****-**** 네이버지도에도 나오지 않으니 직접 주소로 찾아가야 할것 같네요,2021. 1. 15.
"플라톤의 국가론, ""정의란 무엇인가?""","총 인구가 21만명(지금의 충북 충주시 규모)에 불과한 작은 도시국가(polis) 아테네에서도 지금 이 시대와 똑 같이 ""정의(justice)의 문제""가 핫한... 플라톤은 40세에 이탈리아 남쪽 섬나라 시칠리아를 여행한 적이 있었다. 그때 알게된 시칠리아 시라쿠사(Siracusa)의 참주 디오니시오스 1세...",2021. 6. 25.
"충주 아이들과 함께 가볼만한곳, 충주 박물관 특별전 ""충주의 옛길과 쇠부리""","◇ 장소 : 충주 박물관 제1전시관 기획전시실 ◇ 관람시간 : 오전 9:00 ~ 오후 18:00 ◇ 휴관일 : 매주 월요일, 1월 1일, 설날, 추석 ◇ 관람료 : 무료 ◇ 명칭 : 충주 박물관 ◇ 주소 : 충북 충주시 중앙탑면 중앙탑길 112-28 ◇ 주차장 : 소형 200대, 대형 40대, 장애인 편의시설 보유 ◇ 안내 및 문의실 : 043...",2020. 1. 24.
화려하게 빛나는 남한강 수변 야간 산책 명소! 단양 상상의 거리,"충북에서도 충주시와 단양군이 야간관광 100선에 선정되었는데요. 일찍이 체류형 관광을 추진하며 야간관광자원을 운영하고 있는 단양군의 야간 산책 명소를 소개합니다. 충북 단양으로 여행을 떠나게 되면 고수동굴, 도담삼봉, 사인암 등 전통적인 단양팔경과 만천하 스카이워크, 수양개빛터널 등...",2020. 6. 8.
제천여행,제천에서 1박2일 힐링 여행~ 충주댐으로 조성된 인공호수 충북 충주시.제천시.단양군에 걸쳐있으며 충주에서는 충주호로 제천에서는 청풍호로 ~~ 의림지 용추계곡. 청풍호반케이블카. 약선음식거리.민화 벽화마을.정방사 제천맛집 <강호돈>에서 근고기와 한라산으로 맛난저녁~ #제천가볼만한곳...,2021. 5. 28.
충주 가볼만한곳 - 수주팔봉,"이번 후기는 충북 충주시에서 수려한 자연경관이 으뜸이었던 충주수주팔봉을 소개 드릴게요, 명칭은 여덟 개의 산봉우리가 연결된 모습에서... 같은데, 여행을 와서 땀 흘리는 체력운동을 하고 싶지 않았을 뿐~ 주변의 경치가 좋아서 미리 계획을 했다면 끝까지 올라보셔도 좋을 것 같아요 바로 아래...",2020. 5. 19.
충주 글램핑장 클럽멤피스에서 캠핑으로 숙박 호로록,다음 여행을 위해서 하루하루 열심히 보내야겠습니다 오늘 말씀드릴 것은 친구들과 머물렀던 충주 글램핑장에 대한 이야기입니다 클럽멤피스 글램핑앤리조트 주소 충북 충주시 살미면 월악로 1229 입실 - 퇴실 15:00 - 11:00 전화번호 0507-1309-6857 뷰가 도라방스였던 충주 글램핑장 클럽멤피스...,2021. 9. 30.
[충주식당/호암동]서가네 곱창,[충주식당/호암동] 서가네 곱창 오랜만에 기차여행 기차 타고 충주 다녀왔어요 저녁 먹고 온 충주 호암동 '서가네 곱창' 서가네 곱창 주소 : 충북 충주시 형설로 54-10 /지번 -호암동 181-1 전화번호 : 043-852-9599 저희는 점심도 저녁도 아닌 오후 5시가 안되어서 가서 들어갈 땐 사람이 없었는데 나올...,2020. 3. 28.
충주 가볼만한곳 활옥동굴 투명 카약 체험도 했어요~,동굴 여행 가면 항상 만나는 와인 저장고네요 충주가볼만한곳에도 다양한 와인이 숙성 보관되어 판매도 하고 있었어요 광산체험장에는... 주소 : 충북 충주시 목벌안길 26 전화 : 043-848-0503 휴관일 : 월요일 관람시간 : 동절기(11월~3월) 09:00~18:00 [마지막 입장 17:00]/ 하절기 (4월~10월) 09:30~18:30[마지막...,2020. 9. 25.
"[부티베베 여행] 충주 가볼만한 곳 활옥동굴, 수주팔봉 출렁다리",충주 활옥동굴 주소: 충북 충주시 목벌안길 26 이용시간: 9:30-18:30 (마지막 입장 17:00) (월요일 휴무) 전화: 043-848-0503 #충주 수주팔봉 #충주 출렁다리 충주에 파견 나가있는 친구 한 명이 오전 근무를 마쳤다고 연락이 와서 픽업 후 수주팔봉 출렁다리에 왔다. 오전에는 살짝 비가 내렸는데 금세...,2021. 7. 17.
"[경인매일 신문 1면톱기사] 잇단 홍수피해, 인재인가, 천재지변인가... 기상청 오보...",7명 부상에 591세대 919명 이재민 발생 1면톱-수도권 홍수피해와 달리 폭염으로 인해 코로나19로 해외여행이 사실상 금지되자 8월초 휴가철... 한편 본격적으로 비가 쏟아진 1일 토요일 오후부터 3일까지 경기 안성시 일죽 자동관측기(AWS)와 충북 충주시 엄정 AWS엔 400mm라는 어마어마한 강수량이...,2020. 8. 5.
충주 자연 호텔 / 유황온천하고 둘레길 걷기,충주 자연 호텔 유황온천하고 둘레길 걷기 충주 여행중 묵은 숙소는 충주 자연 호텔이랍니다 이 호텔은 유황온천을 할수있는 호텔로 이 지역에선 꽤 유명하다고 하네요 원래 이름은 문강유황온천호텔이였나봐요 프론트 명함엔 이리 적혀있네요 충주 자연 호텔 충북 충주시 살미면 팔봉로1061...,2020. 7. 24.
"충주 현지인 맛집 :: 중앙탑 막국수, 여기가 찐b","이번에는 날씨가 더 추워져버리기 전에 지난 충주 여행 때 다녀왔던 현지인 맛집, 중앙탑 막국수 후기를 올려볼까 한다. 충주에 거주하는 이웃님들... + 주소 : 충북 충주시 중원대로 3018 영업시간 : 매일 오전 10시 30분~밤8시 * 화요일 휴무 가게 외관은 이렇게 생겼음. 약 1시 즈음? 방문했었는데 여름철...",2020. 10. 22.
"코로나19로 지친 심신, 숲에서 치유하세요.",국유림 명품숲 5개소 추가 지역 산림관광 명소로 육성 산림청에서 숲의 경관과 생태적 가치가 우수하고 여행하기에 좋은 '국유림 명품숲' 5개소를 추가 선정하였습니다. ※ 추가선정 명품숲 1. 강원 춘천시 '굴참나무 숲' 2. 강원 영월군 '태화산 경관 숲' 3. 경북 영양군 '자작나무 숲' 4. 충북 충주시...,2020. 6. 10.
"충주 여행 ,활옥동굴,충주중앙탑",중앙탑 비가 내리려고 하늘이 흐렸지만 바람도 시원하고 해볕따갑지가 않아서 여행하기 좋은 날씨인것 같다. 충주 활옥동굴 충북 충주시 목벌안길 26 여름에 동굴은 그야말고 환상이다. 시원한 얼음 물 한잔 마시는 것보다 더 더 더 시원해서 좋았다. 너무 시원해서 아이들과 다음에 또 오자고...,2021. 7. 7.
충청탑뉴스 충주시 (3월 15일),"문화누리카드는 공연과 영화, 전시장 관람 등은 물론 체육 분야와 도서 및 음반구입, 관광여행을 위한 숙박, 시외버스, 철도에…충주지역... 충주시는 10일 충북연합 맘모아가 지정 기탁한 1000만 원의 후원금이 기탁 단체의 뜻에 따라 사용될 수 있도록, 사회복지공동모금회...",2020. 3. 15.
충주 핫플 :) 게으른 악어 여기가 뷰맛집,"애견동반 가능한 수안보 카페 게으른악어 043 724 9009 충북 충주시 살미면 월악로 927 신당리533 단체석, 주차, 포장, 예약, 무선 인터넷, 반려동물 동반, 남/녀 화장실 구분, 장애인 편의시설 #충북가볼만한곳 괴산 용성골펜션에서 점심먹고 시원한 계곡물에서 휴식을 취한 뒤 요즘 충주에서 제일 핫...",2020. 7. 23.
"충주 카페 게으른악어, 충주호 뷰맛집이네~","여행은,, 가는 곳마다 좋았다구 한다.. ㅋㅋㅋㅋ ❤️ 오토바이 아죠씨들도 왕창 오셔서 막 사진찍구가시던대 ㅋㅋㅋ 전 오픈시간에 맞춰가서 그런지 사람이 별로 없고 좋았는데 다시 집에갈때 보니까 차도 많고,, 장난 없더라구요!! 무튼, 날 좋으날 뷰맛집 한번 다녀오세요 ㅋㅋㅋ 주소 충북 충주시...",2020. 6. 14.
