header,contents,date
태안 펜션 가족 모두 서해안 보며 힐링,"얼마 전 가족과 함께 다녀온 서해바다 여행에서는 태안 펜션 두곳에 묵으며 즐거운 시간을 보냈습니다. 두 번째 날 묵었던 태안 가족펜션은 객실... 수 있었던 시간이 아니었나 합니다. 주소 : 충남 태안군 원북면 신두해변길 95 입실 : 15:00, 퇴실 11:00 번호 : 공일공-7490-8272 글/사진 : UltraOrange 장 세현",2021. 7. 26.
태안펜션 단체여행 솜니움트리 깔끔함의 세심함이 좋았던 숙소...,낚시여행도 오자고 하였어요~손맛이 좋았다면서요~ㅎㅎ 그렇게 영목항 드라이브만 즐겨주고는~하룻밤 휴식을 취해줄 태안단체펜션 솜니움트리에 도착을 했습니다~ㅎ 충남 태안군 안면읍 대야로 315-19 태안펜션 솜니움트리는 바다와 마주한곳 그리 멀지 않은 곳에 위치해 있었는데요 대부분 펜션...,2020. 3. 6.
"태안 가볼만한곳 청산수목원 팜파스, 핑크뮬리 시기에요!","충남 태안군 남면 연꽃길 70 ☎0507-1324-0656 이용요금 일반 9천원, 청소년(초,중,고) 7천원, 유아 5천원 하절기 (6~10월)매일 08:00 - 19:00 봄 (4~5월) 매일 09:00 - 18:00 동절기 (11~3월) 매일 09:00 - 17:00 * 입장마감은 일몰 1시간 전까지입니다. 봄에는 홍가시나무, 꽃창포, 여름에는 연꽃, 가을에는 팜파스와...",2021. 9. 25.
"152만명 찾은 태안군 해수욕장,해수욕장서 코로나 확진자""0""","코로나19 방역 긍정 평가..충남 태안군, 2020년 해수욕장 운영결과 보고회 열려 ""코로나19라는 전대미문의 감염병 때문에 총체적으로 힘든... 비록 수치는 전년도 대비 감소했지만 코로나19 사태로 인한 국내여행의 전반적인 위축에도 나름대로 선전했다는 평가를 받고 있다. 44일간 28개...",2020. 10. 13.
안면도 가볼만한곳! 안면도 먹빵 다녀옴,찾아보니까 안면도 가볼만한곳으로들 많이 추천하고 있어서 이렇게 리뷰를 남겨봄 안면도먹빵 충남 태안군 안면읍 안면대로 2489 매일 10:00 - 20:00... 아마 기억을 하실지도 모르겠다 ㅋㅋㅋㅋㅋㅋㅋㅋㅋㅋ 커피도 진하게 잘 뽑으시고 먹빵도 생각보다 꽤 맛있어서 3일동안 출첵함 우리가 여행마다...,2021. 8. 14.
태안 트레킹 명소! 모래와 바람의 나라 태안해변길 1코스 바라길,있어 여행 가기 조심스러운 요즘. 코로나19 사회적 거리 두기를 지키며 더위에 지친 일상을 해소할 수 있는 태안의 트레킹 코스를... 태안해변길 1코스 바라길 학암포 - 신두리ㅣ거리 : 12Kmㅣ시간 : 3시간 40분 우리나라 최고의 사구지대 신두리해수욕장 충남 태안군 원북면 신두리 고운 모래로 된...,2021. 7. 20.
"태안 몽산포 맛집, 새콤달콤 맛있는 메밀막국수가 일품인 초가",초가 충남 태안군 남면 안면대로 605-8 ※ 주차장 있음 ※ 초가는 깨끗한 백사장과 솔밭이 끝없이 펼쳐진 것으로 유명한 몽산포해수욕장 인근에 위치해 있습니다. 흙과 나무로 지어진 건물은 전통의 향취를 품고 있으며 식당 앞쪽에는 아담한 등나무 쉼터가 있어 나무 아래 앉아 쉴 수 있는 공간도...,2021. 8. 30.
"[태안 여행]청포대해수욕장,바다 앞 팜비치펜션/샌드위치조식~/친구들과 여행","팜비치펜션/샌드위치조식~/친구들과 여행 2020.11.20(금)~11.21(토) 서로들 바빠서 숙소를 찾아보지 못하다가, 목적지가 태안으로 변경되어 알아보던중~친구들과 함께 찾다가 예약하게 된 태안 팜비치 펜션이예요. 입실시간:오후 3시~오후10시 퇴실:익일 오전 11시까지 주소:충남 태안군 남면 청포대길 57-34...",2020. 12. 9.
서해 가볼만한곳 낚시펜션 오투오션 에서 1박2일여행,"낚시여행 을 해보시고 싶으신 분들은 서해 가볼만한곳 태안 낚시펜션 으로 떠나셔야겠는걸요 ? 태안 오투오션펜션 충남 태안군 이원면 원이로 2502-47 예약: 오투오션 홈페이지 실시간예약 전화문의: 041-674-1222 무료갯벌체험, 테라스낚시, 바다뷰, 오션뷰 서해 가볼만한곳 낚시펜션, 장비까지 유료대여...",2020. 4. 20.
자꾸 생각나는 만리포 맛집,얼마 전 가족들과 당일치기 여행을 떠났다가 괜찮은 만리포 맛집을 발견했어요. 맛깔나는 스끼다시부터 신선한 해물요리까지 다양하게 맛볼 수... 무엇보다 근처의 골프장에서 픽업도 가능하다고 하니 다음 번에 이용해보려고요. 주소: 충남 태안군 소원면 서해로6 호남횟집 번호: 041-673-6789,2021. 4. 23.
태안 가볼만한곳 여행코스 해수욕장 부터 맛집까지 알맞게 추천,"만리포해수요강은 충남 태안군 소원면에 위치하고 있습니다. 가까운곳에 천리포수목원이 있어 많은 관광객분들이 찾고 계신다죠 ? 넓은 백사장에서 갯벌생테체험도 가능하고, 각종 편의시설이 잘 갖춰어진 명소 ! 태안 가볼만한곳 여행코스 만리포해수욕장을 가시면 상징인 ""만리포사랑 노래비...",2021. 1. 20.
태안 안면도 수산시장 대하 & 꽃게 구매후기!,일단 대하 보러 가실 분들은 제가 올렸던 포스팅들을 참고해 보시고 골라서 가보시면 좋을 거 같네요 ㅎㅎ 이로써 태안 여행 이야기도 끝났어요~~ 긴 글 읽어주셔서 감사합니다! 주소. 충남 태안군 안면읍 승언리 1249 전화. 041-673-0136,2021. 10. 9.
시원과 같이하는 국토순례 태안 신두리 해수욕장 - 충남태안여행,"신두리 해수욕장은 태안군의 원북면에 위치 하고 있다. 태안읍에서 603번 국도를 따라 학암포로 가는 중간에서 왼편으로 들어가면 되며, 도로를 따라 3km정도 들어가다보면 해변가위로 소나무 숲이 우거져 있고 그 사이로 해수욕장입구로 난 길이 보인다. 5Km에 이르는 넓은 백사장은 보는 이 들의...",2020. 11. 18.
태안 가볼만한곳 여름 국내 여행지 추천 만리포해수욕장 천리포수목원 외,있는 여행지로 요즘 왜 핫플인지 알 수 있는 시간이 되었습니다. 태안 가볼만한곳 1. 천리포수목원 2. 만대회수산 3. 만리포해수욕장 4. 청포대해수욕장 5. 해바라기올레정원 6. 파도리해수욕장 1. 천리포수목원 주소 : 충남 태안군 소원면 천리포1길 187 운영시간 :매일 09:00 - 18:00 하절기(4월-10월)...,2021. 7. 9.
태안 여행 :: 청산수목원 팜파스축체(+포토존위치),"태안이 가깝다면 그냥 패스했을 텐데 태안 여행으로 멀리까지 왔기 때문에 다시 힘내서 찍은 것,,,, 이 날씨에 더워 죽는 줄 하하 팜파스 처음 보는데 예쁘긴 예뻐서 좋았다! 날씨가 더워서 고생했지만 태안 여행 계획에 청산수목원은 필수로 추천!! 041-675-0656 충남 태안군 남면 연꽃길 70 매일 08:00~19:00",2020. 9. 29.
[2021.07] 태안 나리 하우스 펜션 후기,"한 달 전부터 생신 겸 여름휴가로 여행이라도 다녀와야 하는 거 아니냐고 부지런한 며느리는 남편을 쪼아댔지만 별 신경 안 쓰던 김서방 결국... 위치 충남 태안군 남면 신온리 5-5 태안 마검포 해수욕장 바로 앞에 있다. 바다 보러 가기에는 정말 최적의 장소였다. 빨간 별은 숙소 위치, 하늘...",2021. 8. 26.
"태안 애견펜션, 가격도 착한 독채형 개스타펜션 대만족",최근 오픈을 해서 깔끔하고 정돈된 외관과 실내를 가지고 있어서 반려동물과 함께 여행계획을 세우고 있다면 추천을 드리고 싶은 곳이에요. 주소: 충남 태안군 안면읍 삼봉길 96-5 연락처: ***-****-**** 운영시간 : 오후3시 입실 오전11시 퇴실 친구들도 반려동물을 키우기 시작하면서 집을 비우는 것이...,2021. 5. 28.
맛집으로의 여행-튀김만두 맛집(진미각) 충남 태안,이번 맛집으로의 여행은- 충남 태안군에 위치한 튀김만두 맛집 진미각입니다. 여행을 갔다가 집으로 올라오는 길에는 가끔씩 그 지역의 짬뽕이 먹고 싶어 중식 식당에 들르게 되는데 미리 봐둔 진미각에서 한 끼 하고자 들렸답니다. 저는 오로지 짬뽕 생각에 차를 대고 QR 체크인하고 입장하니 '십...,2021. 5. 6.
두근거리는 안면도 게국지 맛집 리스트,"꽃지원조꽃게집 주소 : 충남 태안군 안면읍 꽃지1길 185 번호 : 041-673-9989 운영시간 : 08:00 - 21:00 / 주말 08:00 - 22:00 대표메뉴 : 게국지세트 70,000원, 간장게장 28,000원 이날 방문한 식당은 꽃지협재주차장 바로 옆이라 헤매지 않고 도착했어요. 전면이 번쩍거리는 통유리로 지어져있어 약 오십미터...",2021. 7. 13.
태안 럭셔리펜션 한옥스테이 에서 아이와겨울여행 하기 좋아요,"이 곳은 바로 앞에 바다가 한눈에 다 보이고, 또 썰물시간때에는 펜션 바로 앞 갯벌로 걸어나가 간단한 무료 갯벌체험을 즐겨볼수 있는 태안 럭셔리펜션, 태안 별궁펜션 태안 럭셔리펜션 한옥스테이에서 당일치기가 아닌 1박2일여행 으로 아이와겨울여행 하기 좋은 장소는 바로 충남 태안군 이원면에...",2020. 12. 1.
여름휴가 태안 무지개펜션으로 다녀왔어요 (펜션 안에서 낚시할수있어요),지난주 친정 식구들과 함께 여름휴가를 다녀왔어요 충남 태안은 코로나2단계로 직계가족끼리는 여행이 가능했답니다. 01. 펜션소개 태안 무지개 주소 : 충남 태안군 이원면 원이로 2502-33 부모님과 아이들과 함께하는 여행이였기에 다리가 아프신 아빠와 에너지가 넘치는 아이들 모두를...,2021. 8. 5.
크리스마스 여행 가볼만한곳 겨울 가족여행 으로 안면도 추천,"남녀노소 누구나 방문하기 좋고, 안면도 랜드마크로 세계명화 미술관 까지 관람 가능하고, 다양한 트릭아트가 마련되어져 있어 사진찍기 아주 좋은곳 으로 추천드리는 특별한 크리스마스 여행 이 되실거랍니다. 안면도 아기자기랜드 충남 태안군 안면읍 안면대로 3171-6 운영시간: 매일 10:00 ~ 18:00...",2020. 12. 2.
충남 태안 남면 모던186 키즈 펜션 ~ 청포대해수욕장 근처 아이와 함께 갈만한 펜션,충남 태안 남면 모던 186 키즈펜션 충남 태안군 남면 청포대길 22 ***-****-**** 입실 15:00 · 퇴실 11:00 네이버 플레이스 안녕하세요~ 삼촌네에어컨... ㅎㅎ 저희는 급하게 온거여서 다행이 객실이 하나 비여서 조금 작은 평수로 잡게 되었는데 급조 여행인데도 불구하고 너무 만족하고 갔습니다. ㅎㅎ...,2021. 6. 26.
랜선으로 떠나보는 본격 대리만족 여행! 여기가 어디지?2편,"위치 : 충남 태안군 원북면 신두해변길 201-54 전화번호 : 041-672-0499 마음까지 시원해지는 풍경, 쭉쭉 뻗은 메타세쿼이아를 만날 수 있는 이곳은?... 이용자분들께 드리는 당부의 말씀! 현재 상황이 안정될 때까지 여행 자제를 부탁드리며 사회적 거리두기 캠페인에 함께 동참해주세요 : )",2020. 4. 14.
충청도 태안군 골프장 골든베이cc(ft.골프텔),충남 태안에 위치한 골든베이cc 는 총 27홀 골프코스로 구성되어 있으며 리조트와 함께 서해안의 명품 골프장입니다 한화에서 운영을 하며 KLPGA 한화금융클래식을 개최하는 골프장으로 모든분들이 한번 다녀오고 싶어 하는 골프장입니다 충청도 태안군 골프장 골든베이cc(ft.골프텔)...,2021. 10. 4.
3월 국내여행 / 충남 펜션 / 태안 자드락펜션 예약,국내여행 충남 펜션 저희 대가족이 함께 떠날 태안 자드락펜션 을 재 예약 과 함께 재방문을 하게 되었답니다. 작년 자드락에서 친구들이랑... 자드락펜션은 충남 태안군 이원면 에 위치하고 있어요 산속으로 들어가야 있다는점 :) 그리고 이 주변에는 다른펜션이 없고 딱 하나의 펜션 자드락펜션이...,2020. 2. 23.
서해 바다 추천! 태안 대표 해수욕장 BEST 6,두 개의 거대한 바위 너머로 붉게 물드는 낙조는 태안을 상징하는 아름다운 풍광 중 으뜸으로 꼽혀 서해 바다 여행지로 추천합니다. 서해 3대 낙조 몽산포해수욕장 충남 태안군 남면 신장리 태안해안국립공원에 속하며 넓은 백사장이 아름다워 태안 8경으로 선정된 몽산포해수욕장입니다. 깨끗한...,2021. 7. 6.
[태안 가볼만한곳] 빵이 진짜 맛있는 '몽산포제빵소' :: 여행코스추천,안녕하세요 오늘은 지난 태안 여행때 다녀왔던 베이커리! 빵집! 한군데 소개해드립니다 ㅎㅎ 안면도까지 가서 무슨 빵이냐구요? 모르시는말씀... 팜카밀레 몽산포제빵소 충남 태안군 남면 우운길 56-19 이곳은 팜카밀레 허브농원 바로 옆에 위치해 있어요! 허브농원은 입장료가 있지만 제빵소는...,2021. 9. 30.
[태안 여행]샌드힐 카페/그때그펜션&바베큐/파도리해수욕장 해식동굴with써니네 커플,태안여행 둘쨋날 시작 아침으로 진짬뽕(+버섯+파) & 전날 만들어놨던 김치버섯볶음 증말 요리는 다 기뱅이가 했네 대단하다 내남자팅구 그래두 태안 왔는데 관광지 하나도 안 들리면 너무 아쉬울거같아서 급 찾아온 파도리해수욕장 충남 태안군 소원면 모항파도로 490-85 진짜 유써니랑 오니까 커플...,2021. 10. 3.
안면도 카페 노을이 예술인 태안 바보카페,먹고 여행지를 서해로 결정한 만큼!! 뷰가 예술이라는 안면도 카페 바보카페에서 여행의 마무리를 지어보기로 했죠. 석양을 보고싶어서 일부러 해가... 충남 태안군 안면읍 해안관광로 247-3 (승언리 1992-7) 바보카페 이름이 너무 재미있었던 바보카페는 길가에 위치해있어서 찾기 어렵지 않고요 건물...,2021. 6. 23.
"[태안군 안면읍] 신선놀음 힐링 되는 카페 ""트레블브레이크커피""",지난주에 여행갔다가 우연히 들른 카페 포스팅을 이제야 한다 그동안 본가도 다녀오고 홈파티도 하고 나름 바빴네?ㅋㅋ 어디 좋은카페 없나 *스타를 뒤적뒤적 거리다가 오~ 여기 인테리어 특이한데? 가보자!!! 트레블브레이크커피 충남 태안군 안면도 네비양이 안내하는곳으로 도로를 벗어나고...,2020. 3. 27.
안면도 그때그펜션과 딴뚝식당,"이녀석은 그냥 우리들 곁에 눌러 앉을 예정인지 종식될 기미가 안보인다 덕분(?)에 여행 가본지 오래인터라 평일날 우리끼리만 조용히 있을수... 주소 : 충남 태안군 안면읍 안면대로 2608-193(안면읍 정당리 957-17) ◇ 식당 : 딴뚝식당 - 주력메뉴 : 게국지, 간장게장, 양념게장, 새우장 - 주소 : 충남...",2021. 7. 15.
"[충남 태안] 감성과 트렌디를 모두 겸비한 카페 ""Cafe opinio""[카페오피뉴]","서나님 하고 충청남도 태안으로 여행을 가게 됐습니다. 또 멀리까지 갔는데 아무 카페나 가면 안 되겠죠??? 그래서 준비했습니다. ""Cafe opinio"" 카페 오피뉴 전화번호 0507-1393-8440 카페 오피뉴 지번주소 충남 태안군 태안읍 정주내3길 10-3 1층 카페 오피뉴 도로명주소 충남 태안군 태안읍 동문리 898-6...",2021. 6. 30.
태안 가볼만한곳 볼거리 놀거리 만리포 해수욕장 천리포수목원,만리포 해수욕장 충남 태안군 소원면 만리포2길 138 / 041-670-2114 / 해수욕장 운영 : 2021.07.03~08.29 / 주차장 : 무료 서울에서 2시간 정도 달려 도착한... 서해안 3대 해수욕장의 한곳인 만리포 해수욕장은 태안 가볼만한곳으로 여행코스에서도 빠지지 않는 곳입니다. 바다에 발 담그며 모래사장도...,2021. 6. 11.
국내 여름여행지 추천 갈만한곳 따라와~,"해서 나름 여행플래너인 테리아가 국내 여름여행지 추천 갈만한곳 중에 몇 군데를 뽑아서 소개해볼까 하네요. 학암포해수욕장 주소 : 충청남도 태안군 원북면 옥파로 1163-27 충남 태안군에 볼거리 즐길거리가 많은 곳인데, 그 중에서 사람들에게 덜 알려진 언택트한 곳으로 소개를 하면...",2021. 8. 16.
서해안 추석 연휴 해루질 - 2021년 9월19일 일요일,충남 태안군 안면읍 황도리 마을은 갯벌의 대부분을 유어장과 바지락 양식장 및 모시조개(가무락) 양식장으로 태안군으로부터 허가받아 황도... 가족 모두 즐거운 추석 연휴 보내시구요 ~ 행복한 서해안 안면도 가족여행이 되시길 바라겠습니다. 서해안 추석 연휴 해루질 태인이에요 ~ 오후에 망둥이...,2021. 9. 20.
태안 / 안면도 아기자기랜드 안에 있는 마카롱카페 꼬끄시니! (반려동물 동반 가능 카페),그래도 또 열심히 더위를 이겨내봐야겠죵ㅠ.ㅠ흑 너무 덥다보니 여행사진들을 자꾸 다시 보게되는거 같아요ㅠ.ㅠ 그러다가 포스팅되지못하고 썩고있는 사진들이 발견(?)되서 글을 써봅니당! (이 게으른 블로거같으니라구..) 마카롱카페 꼬끄시니 주소 : 충남 태안군 안면읍 승언리 88-1 운영시간...,2021. 7. 28.
안면도펜션 풀빌라 솜니움트리 독채여서 안심된었던 숙소,안면도여행을 다녀왔었는데요 다녀온지 엊그제 같은데 벌써 한 계절이 지나가고 있습니다~ㅎ 친구커플과 같던 여행지는 안면도 대야도에 위치한... 있었습니다~ㅎ 충남 태안군 안면읍 대야로 315-19 부지가 넓은 만큼 정원도 공원처럼 멋지게 꾸며져 있었는데요~전문가의 손길이 느껴지는것 같았구요...,2021. 8. 24.
5월 태안가볼만한곳 안면도 튤립꽃축제 포함 7곳,다양한 포토존이 있어 사진찍기도 좋아 비싼 입장료가 아깝지 않을정도로 대 만족한 #태안튤립꽃축제 튤립축제가 끝나도 다른 꽃들이 심어질 예정으로 여름ㄹ 가을 수국까지 다양한 꽃을 만날 수 있으니 태안 안면도 여행 시 꼭 방문해보세요. 2. 태안신두리해안사구 충남 태안군 원북면...,2021. 5. 2.
태안 갯벌체험 여행 1박 2일 일정 계획,"기준 충남 전지역 3단계 (~10.03.) - 충청남도 사회적 거리두가 3단계에 따른 인원제한 등의 자세한 내용은 충남도청 홈페이지 참고 * 참고 : 충남도청 홈페이지 - 코로나 19 사회적 거리두기 <> © analogicus, 출처 Pixabay 여행 중 방문 예정지 1. 숙소 : 충남 태안군 남면 위치 2. 방문 예정 및...",2021. 9. 30.
"안면도 여행 갈만한곳 꽃지해수욕장,서산 간월도 간월암까지",안면도 꽃지해수욕장 충남 태안군 안면읍 승언리 당일치기였기에 한 번의 나들이는 살짝 욕심을 내어 가보고 싶었던 여행지 몇 곳 둘러보고 왔는데요. 그중 조수간만의 차로 썰물일 때 안면도 꽃지해수욕장 갯벌체험하는 분들도 있고 평일 서해바다 보러 오는 분들을 볼 수 있었어요....,2021. 4. 29.
태안 가볼만한곳 만리포 해수욕장 외 4,"이곳에서는 펜션도 함께 운영하고 있다고 하니 태안 여행을 계획하고 있다면 참고해 보시길 ^^,, 05. 천리포수목원 주소 : 충남 태안군 소원면 천리포1길 187 영업시간 : 매일 09:00-17:00 전화번호 : 041-672-9982 마지막 태안 가볼만한곳 명소는 천리포수목원이다. 하루 종일 맑은 날씨 덕에 수목원에...",2020. 12. 14.
태안 여행코스 - 안면암 환상적인 일출을 만나다,"태안 여행을 떠나다! 바다 위 둥둥 떠 있는 탑과 일출의 감동 충남 태안군 안면읍 여수해길 198-160 안면암 안녕하세요. 꿈공장입니다. 지난 주말에는 무박2일로 태안 출사를 다녀왔습니다. 태안 안면도 운여해변에서 은하수를 찍고, 안면암 일출과 인천의 바다, 그리고 수섬의 삘기를 보는...",2020. 5. 28.
"국내 여행지 추천 태안 튤립 축제 세계튤립 공원, 안면도 봄꽃축제",이번에는 태안 튤립 축제로 만족을 하며 한창 이쁠 때 봐서 꽃충전을 제대로 한 국내 여행지 추천 코스예요. 2. 꽃지해수욕장 할미할아비바위 충남 태안군 안면읍 승언리 꽃지 해안 공원 주차장 바로 옆으로 꽃지해수욕장이 있는데요. 물론 태안튤립공원에서도 해변이 내려 보이죠. 꽃지가 이렇게...,2021. 4. 23.
태안 여행,"사랑둥홍민이랑 첫 여행 2021.09.26 ~ 2021.09.27 출발하기 전에 인스타 필터로 사진 찍기 국룰❛˓◞˂̵ 아니 홍민 언제까지 귀여울래; 내 눈에 애기... 뒤에 홍민이 아몰랑,,히히,,♥ 암튼 김사랑 귀 깐 거는 홍민이가 깠다고 했다,, 둘 다 귀여워 귀여우어우엉 태안 청산수목원 충남 태안군 남면 연꽃길 70...",2021. 10. 7.
태안 바다뷰펜션 오션뷰 까지 너무 완벽했던 충남여행 더담은펜션,예약해 충남여행 을 댕겨 왔답니다 ^^ 이 친구들도 역시나 수도권에서 왔는데 충남 태안 까지 여행 왔으면 그래도 갯벌체험 은 시켜주고 싶었지만... +3+ 그리고 각 객실마다 개별바베큐장 까지 있어서 그런지 큰 고민없이 바로 예약을 했답니다 ^^ 태안 더담은펜션 충남 태안군 이원면 관리 1040-10 입실...,2020. 5. 21.
[안면도 칼국수] 전통딴뚝칼국수 개운하고 깔끔한 칼국수,"전통딴뚝칼국수 칼국수,만두 충남 태안군 안면읍 안면대로 3018 전통딴뚝칼국수 / 매일 08:30 - 20:00 0507-1424-1221 지난 봄 #안면도여행 다녀왔을때 맛있게 먹었던 #전통딴뚝칼국수 리뷰입니다. 한참 지났는데도 깔끔하고 개운했던 해물 육수의 맛이 생각나네요 ^^ 평일 점심이 조금 지난 시간이라...",2021. 7. 20.
<우리나라/여행정보/전국>전국 핑크뮬리 스팟 리스트 및 지도,#핑크뮬리 #전국핑크뮬리 #핑크뮬리명소 #핑크뮬리스팟 #언택트여행 #야외여행지 #전국여행 #우리나라가볼만한곳 #전국가볼만한곳 전국... 청산수목원 충남 태안군 남면 연꽃길 70 대전 금강로하스공원 대전 대덕구 석봉동 충주 하방마을 울주군 삼남면 암리하방길 153 고창 핑크뮬리축제장...,2020. 10. 20.
꼬똥 견생 첫 여름휴가! 서해안 태안 꾸지나무골해수욕장 캠핑과 전주 한옥마을로...,꽃님이는 견생 첫 여름휴가 여행을 위해서 열심히 공부를 합니다. 부산에서 6시간을 달려서 도착한 충남 태안군 #꾸지나무골해수욕장 입니다. #노르디스크 레이사6 텐트 설치 완료 ㅎㅎㅎ 텐트 안에서 딸 셋은 편안하게 쉬고 있어요. 뿌듯합니다. 아들은 못왔어 맘이 쓰이지만.... ㅠㅠ 다음에...,2021. 8. 24.
태안가족펜션 추천 완벽한 오션뷰가 최고,태안가족펜션 한옥 별궁 태안 한옥펜션 별궁 충남 태안군 이원면 원이로 2492 회사 동료들이 여행 왔을 때 찜한 태안가족펜션 추천 여행으로 딱 좋은 장소였어요. 창문을 열면 오션뷰가 멋더러 지게 펼쳐지니 가슴이 뻥 뚫리는 느낌을 받아요. 오션뷰가 최고 친환경 한옥으로 지어졌다 해서 회사...,2021. 5. 25.
안면도 해루질 태안여행 예원 해루질 장비 렌탈샵,릴-하 안면도 여행가서 해루질하기 딱 좋은 시즌 이런 황금 시즌에는 야간 해루질이 필수지 ㅎㅎ 이번에는 장비까지 빌려서 완전 무장으로 다녀온 태안여행 안면도 해루질 여행 해루질 장비 렌탈샵 포스팅 예원 해루질 전문점 태안 해루질 장비 렌탈 ***-****-**** 충남 태안군 남면 천수만로 340-30...,2021. 10. 7.
[충남 태안 1박2일 여행#2] 태안 1박2일 여행 놀거리 백호레져 체험장 ATV 체험 후기...,ㅠㅠ 직진코스 풀악셀로 달려보고 싶은 욕구가 예랑이는 저번 여행 왔을 때 탔던 안면도 카트도 타러가자했지만 시간이 너무 애매해서 다음으로 미뤘답니당 청포대 해수욕장에서 차로 5분? 정도 걸렸구용 뭐 할지 고민이시라면 추천드려요 충남 태안군 남면 마검포길 104-108 (신온리 323-6) ***-***-****,2020. 5. 8.
급이 다른 안면도 횟집,그림같은 백사장항 뷰도 즐기고 퀄리티 높은 해산물도 즐기고 일석이조의 여행이 되어서 좋은 추억이 되었어요. 다녀왔던 곳은 대한횟집... 도로명주소 : 충남 태안군 안면읍 백사장1길 119 전화번호 : 041-673-8831 ---------------------------------본 포스팅은 소정의 원고료를 받아 작성되었습니다.,2021. 5. 4.
천리포수목원의 봄(2) - 충남 태안여행,천리포수목원(Chollipo Arboretum Foundation) 천리포수목원(Chollipo Arboretum Foundation)은 충청남도 태안군 소원면 천리포1길 187 (의항리 114번지)에 있는 우리나라 최고의 수목원이다. 미국에서 귀화한 민병갈 박사(Dr Carl Ferris Miller)가 오랜 한국생활 중에 1960년 초부터 구입하기 시작한 천리포...,2020. 3. 4.
