header,contents,date
[논산 여행]선샤인 스튜디오,"운영시간 : 매일 10:00 - 18:00 / 수요일 휴무 주소 : 충남 논산시 연무읍 봉황로 90 전화번호 : 1811-7057 드라마 '미스터션샤인'과 '대탈출' 촬영지인 논산의 대표 여행지 ""선샤인 스튜디오"" 저는 '미스터션샤인'은 보지 않았지만 '대탈출'을 보고 가봐야지 하다가 이제야 다녀왔어요. 주차를 하고...",2021. 5. 24.
대전 수영장 근교 물놀이 찾는다면 벌곡랜드,"친한 지인이 휴가를 받아 함께 논산으로 여행을 다녀왔어요. 첫째 날은 대둔산 펜션에서 푹 쉬었고, 둘째 날은 대전 수영장에서 대전 물놀이를... 때마다 만족스러워서 내년에는 또 어떤 모습일지 기대가 되네요. 벌곡랜드 ☎ 070 - 7799 - 0809 충남 논산시 벌곡면 황룡재로 494 ( 충남 논산시 한삼천리 308-4 )",2020. 8. 16.
"[논산여행] 로봇뮤지엄, 아이들과 가볼만한 곳, 슈퍼전대로봇시리즈",논산 로봇 뮤지엄 이색 카페 ※ 주소 : 충남 논산시 관촉로 58번길 38-76 ※ 전화 : 041-733-7749 ※ 입장료 : 무료이나 음료주문 ※ 입장시간 : 매일 10:00 ~ 22:00 ※ 편의 : 주차장 남/여 화장실 구분 개관한지 얼마 되지 않은 로봇 뮤지엄 입구에 커다란 로봇들이 입구를 지키고 있습니다. 로봇뮤지엄이라고...,2021. 5. 16.
랜선여행/ 설레는 겨울왕국 대둔산,"대둔산(大芚山) 전북 완주군 운주면과 충남 논산시 벌곡면 및 금산군 진산면에 걸쳐 있는 산. ▶️ 위 치 : 전북 완주군 운주면 산북리 611 ~ 34... #랜선여행 으로 대둔산의 설경을 보니, 언젠가 꼭 설경보러 가보고싶어지네요. 출처 [축제여행] BAND :: 랜선으로 보는 설레는 겨울왕국 #대둔산...",2021. 1. 15.
"여름여행지, 논산여행, 논산8경, 논산제5경, 논산사찰, 쌍계사, 불명산 쌍계사",쌍계사는 가을보다 봄과 여름에 찾아야 제대로 감상 수 있습니다. 논산을 여행할 계획이 있으신 분들은 개태사 - 관촉사 - 쌍계사를 코스로 천년고찰의 멋스러움을 만끽해 보시기 바랍니다. 쌍계사 가는 길 : 충남 논산시 양촌면 중산리 192 홈페이지: http://www.ssangyesa.com/ 입장료: 무료,2021. 5. 26.
"[논산여행 떠나You] 상상을 위한 공간, 상월면 KT&G 상상마당 논산",논산시 소셜미디어 서포터즈 조현화입니다. 논산시에는 미래를 향해 꿈을 꾸며 나아가는 상상마당이 상월면 한천리 구 한천초등학교에 자리... 있는 충남 논산의 (구)한천 초등학교를 리모델링한 교외형 복합문화체험공간입니다. 입구에 보면 오른쪽에 캠핑장이 마련되어 있어 자연 속에서의...,2020. 10. 22.
논산 배스포인트 논산천 배스낚시 조행기,충남 논산시의 외곽을 흐르고 있는 논산천. 소문으로는 다양한 어종이 많고 붕어는 씨알도 좋다고한다. 배스는 과연 잘 나올지 궁금한 그런 멋진 포인트. 논산천. 논산천의 첫번째 배스포인트는 주차하기 너무 좋은 논산대교 포인트. 운동하시는 분들도 많고 강아지와 산택하시는 분도 많은 그런...,2020. 3. 17.
[논산여행] 탑정호수변생태공원-소풍길,논산에 탑정호수변생태공원안에 소풍길에 다녀왔습니다 #논산가볼만한곳 #탑정호수변생태공원 탑정호수변생태공원_ 소풍길 탑정호소풍길주소 : 충남 논산시 부적면 충곡리 287-8 제가 다녀온곳은 탑정호 수변생태공원중 소풍길이에요 #탑정호소풍길 일단 논산탑정호수변공원 소풍길옆에 주차장이...,2021. 3. 11.
[국내여행] '랜선으로 맛보는 새콤달콤' 24∼28일 온택트 논산딸기축제 (연합뉴스),"[국내여행] '랜선으로 맛보는 새콤달콤' 24∼28일 온택트 논산딸기축제 (연합뉴스)(논산=연합뉴스) 조성민 기자 = 충남 논산시는 오는 24일부터 28일까지 닷새간 유튜브채널(논산딸기향TV)을 통해 '온택트 논산딸기축제'를 개최한다. 날짜별로 논산딸기, 색에 반하다(24일)·달콤한 향에 취하다...",2021. 2. 23.
[논산] 벌곡랜드 야외 물놀이장 대전근교 물놀이 아이와 갈만한 곳 추천장소,"오늘은 오랜만에 논산 가는 날, 지난 해 여름 보령 여행 중 들렀던 《논산 챌린지팜》 이후 일년 만에 다시 찾아가는 논산입니다. [논산 챌린지팜 방문기] 논산 벌곡랜드 충남 논산시 벌곡면 한삼천리 308-4 벌곡랜드 ⏰ 운영시간 매일 09:00 - 19:00 ☎️ 070-7799-0809 벌곡랜드 둘러보기 대전근교 야외...",2021. 8. 1.
논산 가볼만한곳-관촉사,국내 여행을 코로나 끝나기 전에 마무리 하려구요~ 그래서 우선은 근교 위주로 평일에 다녀볼까 합니다~ 오랫만에 꺼낸 카메라가 먹통이라 노트7로 찍었으니 화질이 이상해도 감안하고 보시면 감사하겠습니다~ 관촉사 주소:충남 논산시 관촉로1번길 25 전화:041-736-5700 운영시간:08:00~20:00 연중무휴...,2021. 7. 6.
[일상]아이들과가볼만한곳 논산아이들과가볼만한곳 주말논산가볼만한곳 백제군사박물관,가볼말한곳 #백제군사박물관추천 #논산여행 #논산흔들다리 #논산탑정호흔들다리 #논산탑정호흔들다리근처가볼만한곳 #논산갈만한곳 #논산볼만한곳 #충남명소 #충청남도흔들다리 #충남여행 #논산명소 박물관명: 백제군사박물관 주소: 충남 논산시 부적면 충곡로 311-54 백제군사박물관 영업시간...,2021. 9. 3.
Kbs 2tv 생생정보 궁중전골 코다리 메밀 막국수 논산갈비 소 양념갈비 물짜장 탕수육...,주소 : 충남 논산시 대학로 106 대전 서구 비법 24시 밥상을 털어라 <물짜장 & 짜장 & 탕수육> 경방루 전북 남원시 광한북로 29 노.래.방 (노래 따라 방방곡곡 떠나는 여행) <경기도 포천> 산정호수 주소 : 경기 포천시 영북면 산정호수로411번길 89 프로레저(산정호수 ATV) 주소 : 포천시 영북면...,2020. 10. 9.
바람이 솔~솔~ 논산 탑정호 노을 출사,"논산에 탑정호가 있어 사계절 언제나 찾아도 좋으니 얼마나 다행스러운지 모른답니다. [논산 탑정호] 충남 논산시 부적면 신풍리 206 입장료, 주차료 없음 #오현숙의소소한일상이야기 #논산이야기 네이버에서 검색하고 논산과여행의 팬이 되어주세요!",2021. 8. 24.
충남한바퀴 시내버스여행기 1일차(2021.06.24),"그런데 뭔가 명분(?)을 만들어보고 싶어서, 구 충남도청(대전)과 신 충남도청(내포신도시)를 서로 이어주도록 루트를 부분수정해서... 대전 21번 도산2리 > 벌곡 / 09:28 > 09:42 경로상 어쩔 수 없이, 대전 시내버스를 다시 타게 됩니다 ㅋㅋㅋ 그것도 논산시구간만 말이죠. 이번 여행 컨셉(충청남도...",2021. 6. 27.
[국내여행] 한적하고 여유있는 논산 종학당,종학당 충남 논산시 노성면 병사리 http://naver.me/GV8acRcs 입구부터 남다른 종학당 가을하늘이 힐링을 줄 준비를 해주네요~ 주머니에 손넣고 멋진데... 더 여행하고파 추억많이쌓자~ 저의 여행블로그가 나중되서 아이들에게 추억사진이 되길 바라며 열심히 하고 있네요~^^ 이 녀석은 뭐하니?ㅋㅋ...,2020. 11. 8.
문화재 여행을 떠나요! 유네스코 세계유산 논산 돈암서원,"논산시 소셜미디어 서포터즈 조강숙입니다. 비가 오던 어느 날, 궂은 날씨지만 돈암서원에 다녀왔습니다. 우리나라 전통 건축물이라 그런지 비... (충남문화재자료 제366호. 돈암서원 홈페이지 참조). 돈암서원의 백미는 뭐니 뭐니 해도 강당인 응도당(凝道堂)입니다. 도가 응집된다라는 뜻의...",2021. 6. 28.
논산 전원주택지 탑정빌리지 분양정보(탑정호 주변 전원주택지),탑정빌리지는 충남 논산시 부적면 신교리 147-3 일원에 위치해 있었고 계획관리지역이였는데요 총 면적은 8277평 공유면적 1482평 건폐율 / 용적률 40... 이용해 논산시내를 거치지 않고 저수지 방향으로 달리다 보니 탑정빌리지까지 가는 길이 꼭 날좋은날 여행가는 느낌이 들정도로 도로 포장이 잘...,2021. 9. 10.
대전근대문화 유산을 찾아서 ~네 번째(대전역 주변 문화재),"김재현(1923~1950)기관사는 충남 논산시 출생으로 대전전투에 기관사로 참전하여 순직을 하였습니다. 황남호(1928~2006) 보조기관사는 전북 정읍군 출생이며, 현재영(1928~2010) 보조기관사는 충북 옥천군 출생입니다. [구 철도청 대전지역사무소 보급창고 3호] ‘구 철도청 대전지역사무소 보급창고...",2020. 5. 30.
"논산시 [관촉사] ""논산 8경중 제 1경"" 천년의 미소, 천년의 향기 불기 2565년(2021년)...","논산시 시니어 블로그 홍보단 임정옥 입니다 불기 2565년(2021년) 5월 19일 ""부처님 오신날"" 행사에 참석하기 위해 이른 아침부터 관촉사를 향하는 제... 석문 (충남 유형문화제 79호) 관촉사 경내에 들어가려면 통과해야 하는 문으로 크기는 바깥너비 194cm, 안너비 137cm, 바깥높이 196cm이며 석문 자체의...",2021. 5. 24.
논산 여행 _ '선샤인랜드' 미스터선샤인 촬영지 의상대여 하고 놀기!,"급으로 연차내고, 오빠랑 논산 당일여행! 논산을 가게된건 둘다 너무 재미있게봤던 드라마 미스터선샤인 촬영지 - 선샤인랜드 에 가기 위해서... 포스터만 봐도 넘나리 설레쟈나 >_< 선샤인랜드 충남 논산시 연무읍 봉황로 102 운영시간 09.00-18.00 / 수요일휴무 네이버에는 저녁 5시 까지 운영으로...",2021. 2. 13.
"충남 금산,논산 가볼만한곳 ; 생태관광 금산천내습지, 적벽강, 대둔산, 탑정호",이번 여행에는 수락폭포까지 다녀왔습니다. 수락계곡을 가기 위해서는 대둔산 수락주차장에서 부터 시작을 합니다. 입장료 3000원이 있지만 요즘은 코로나19로 인해 주차료가 무료입니다. 올라가는 코스는 편안한 살방 코스... 대둔산 수락주차장 충남 논산시 벌곡면 수락계곡길 248 입구에서 부터...,2020. 10. 27.
"응답하라 1900, 뉴트로의 성지 선샤인 스튜디오, 탑정호 카페 (논산여행 즐기기)",사진 찍기도 좋고 색다른 체험을 할 수 있는 곳 논산 ‘선샤인 랜드’로 떠나봅시다~~ 논산 선샤인 랜드 충청남도 논산시 연무읍 봉황로 90... #한국관광공사 #한국관광공사_대전충남지사 #대충가봄 #가봄 #충남여행 #논산여행 #선샤인스튜디오 #미스터선샤인촬영지 #탑정호수변공원 #탑정호카페...,2020. 12. 2.
전북 완주 여행 / 완주 가볼만한 곳 / 대둔산 안심사 /금강계단,"대둔산 안심사 전북 완주군 운주면 완창리 대둔산은 전북 완주군과 충남 논산시, 그리고 금산군 경계면으로 되어 있습니다. 안심사는 전북 완주군 운주면 방면에서 골짜기로 쭈욱 들어가야 합니다. 대둔산 일주문 일주문이 굉창히 커서 보자마자 그리고 뒤편에 보이는 대둔산 보고 와 그리고...",2021. 5. 7.
2021년 7월 글램핑,2021.7.24~25 : 충남 논산시 #탑정호글램핑 #올림픽 여름휴가를 남쪽으로 떠나고 싶은 우리 남편의 말에 또 열심히 검색한 아내. 한 번에 쭉 가기엔... 여행내내 그 꽃과 함께 했드랬지. (집에 돌아와서는 시들시들해져서.. 지금은 없.) 2021.7.27~28 : 경남 사천시 #비토섬글램핑 #비토섬신우리조트 2박3일...,2021. 9. 9.
7월 아름다운 연꽃을 찾아 상월면 주곡리,^^ #여행 #충남여행 #충남가볼만한곳 #논산여행 #논산시여행 #논산여행지추천 #논산추천여행지 #논산시추천여행지 #논산가볼만한곳 #논산시가볼만한곳 #논산문화재 #논산역사문화여행 #논산문화재탐방 #논산가족나들이하기좋은곳 #논산시가족나들이하기좋은곳 #논산볼거리 #논산시볼거리...,2021. 7. 13.
개태사,여행날짜 : 2020-08-12 위치 : 충남 논산시 연산면 천호리 111 태조 왕건이 후백제를 정벌한 기념으로 창건되었다고 합니다. 신종루 아래에 있는 계단을 통해 올라갑니다. 개태사 오층석탑이 보이네요. 공사를 하고 있는지라 어수선하네요. 대웅전에는 태조 왕건이 후백제를 멸하고 마침내 삼국통일의...,2020. 8. 26.
SBS 생방송 투데이 3월5일 논산 3GO 여행 딸기와 딸기찐빵,"SBS 생방송 투데이 3월5일 논산 3GO 여행 딸기와 딸기찐빵 논산은 딸기 생산지로 유명함 거대한 크기의 킹스베리 딸기 종류중 설향 유영농원 ☎ ***-****-**** 충청남도 논산시 노성면 병사리 423-4 딸기찐빵, 호떡, 식혜 논산딸기찐빵 ☎ 041-733-7740 충남 논산시 중앙로492번길 9-19",2021. 3. 6.
[여행/논산] 뷰맛집! 논산 탑정호 출렁다리,"출렁다리보러 다시 갔었는데 아직 건널 수는 없었고, 3월 즈음부터 예정이라고 보았어요 :) 21.01.30 방문 탑정호 출렁다리 충남 논산시 부적면 안천리 925 막 해가 떨어지고 있을 때에 갔었는데 불이 딱 들어오더라구요! 아직 건너지 못하는건 좀 아쉬웠지만 그것은 다음에 다시 와보기로 했어요ㅎㅎ...",2021. 2. 17.
생방송투데이맛집오늘 논산3GO여행 논산딸기찐빵집 웅어횟집 웅어회무침 수원 라온찬...,3GO 논산 3GO 여행 편 ▶ <선샤인스튜디오> 주소 충남 논산시 연무읍 봉황로 90 홈페이지 : https://sunshinestudio.co.kr/ ▶ <유영농원> 주소 충청남도 논산시 노성면 병사리 423-4 ▶ <논산딸기찐빵> 주소 충남 논산시 중앙로492번길 9-19 ▶ <만나식당> *웅어회집-웅어회 무침 주소 충남...,2021. 3. 5.
"논산 쌍계사, 사찰여행, 사찰기행, 충청도여행, 한국여행, 우리나라여행...","쌍계사는 충남 논산시 양촌면 중산길 192에 위치한 사찰이다. 쌍계사는 역사가 오래되었을 뿐만 아니라 예술성까지 갖춘 이름난 절이다. 고려때에 세워진 것으로 추정되었지만 정확한 시기는 알 수 없다. 조선 후기에 기록된 쌍계사 중건기에 따르면 쌍계사는 ‘백암사’라고도 불렸으며, 고려...",2021. 3. 22.
논산 강경 가볼만한곳 옥녀봉 탑정호 수변생태공원 논산맛집 2곳,여행을 갔다 왔어요! 별로 기대를 안 하고 갔는데 볼거리도 많고 가볼 곳이 많더라고요~ 그래서 제가 갔던 곳 중 좋았던 5곳을 소개해보려 합니다! 논산 강경 가볼만한곳 5곳 1. 옥녀봉 2. 강경 해물칼국수 3. 탑정호 수변생태공원 4. 셋집매 농가맛집 5. 선샤인 스튜디오 1. 옥녀봉 공원 충남 논산시...,2021. 8. 6.
충청남도 논산시 ‘탑정호 수변생태공원’을 둘러보고 2020년 7월 7일,오고 #논산여행 랜드마크가 될 탑정호 출렁다리 탑정호 수변 출렁다리가 완공되면 다시 찾고 싶은 곳 탑정호 출렁다리는 호수 위를 가로질러 탑정호의 수려한 경관을 감상할 수 있는 곳 논산을 대표하는 관광 자원인 탑정호 #탑정호 충청남도 논산시 부적면 부적로 665 탑정호는 충남에서 두...,2020. 7. 8.
ktx 공주역 고속철도 호남선 위치정보 열차시간표,"공주와는 17km, 논산시에서 22km, 부여군에서 25km 떨어진 곳이에요. 조금 애매하다는 생각 들었어요. 공주역 충남 공주시 이인면 새빛로 100 1544-7788... 기차여행이 어려웠던 지역의 사람들에겐 공주역이 생김으로 인해 이용이 용이해졌을 거란 생각. 그것도 ktx, srt여서 더욱 괜찮아졌을 거란 생각이...",2021. 9. 17.
2TV 저녁 생생정보 1389회 대통밥 매운탕 복탕 참게탕 맛집 한식뷔페 어디 새우...,"9월 13일 월요일 2TV 저녁 생생정보에서는 ‘생생정보통’, ‘비법 24시 밥상을 털어라’, ‘대동 맛 지도’, ‘아재여행’, ‘빛나라 청춘’로... 주소는 충남 논산시 강경읍 금백로 34. 죽림서원 북쪽, 대전지검 논산지청 북서쪽에 위치해 있다. 금강이 보이는 금강 둔치 바로 옆이다. 우여는...",2021. 9. 13.
논산 여행 눈 내린 노성 궐리사 풍경,#여행 #충남여행 #충청유교 #논산시여행 #논산시여행지추천 #논산여행지추천 #논산가볼만한곳 #노성면여행 #노성면가볼만한곳 #노성면여행지추천 #인문학여행 #논산문화탐방 #논산시노성면 #논산시노성면가볼만한곳 #기호유학 #노성산성 #노성향교 #논산명재고택 #명재윤증고택 #명재윤증선생고택...,2021. 2. 7.
논산 온빛자연휴양림 유럽분위기 물씬 뷰맛집,"아쉽게도 연락처는 찾지 못했어요. *온빛자연휴양림의 봄 *온빛자연휴양림의 겨울 [온빛자연휴양림] 충남 논산시 벌곡면 황룡재로 480 입장료, 주차료 없음 #오현숙의소소한일상이야기 #논산이야기 네이버에서 검색하고 논산과여행의 팬이 되어주세요!",2021. 8. 25.
"충청도 계곡 베스트 15 [여름휴가, 계곡캠핑, 충청도 계곡을 8분에 몰아보기, 차박...","수락계곡 Surak Valley 충남 논산시 벌곡면 수락리 117-23 117-23, Suseong-ri, Bulgok-myeon, Nonsan-si, Chungnam 논산시 문화 관광... 여름여행 #계곡여행 #계곡 #자연휴양림 #충청계곡 #장전계곡 #흥정계곡 #이끼계곡 #충남계곡 #충청여행 #충남계곡",2021. 8. 13.
[공유] [논산여행] 논산 화지중앙시장에서 즐기는 전통시장 먹거리 투어!,부모님이 좋아하는 과일과 야채를 추가로 구입하여 양손 무겁게 집으로 돌아갑니다. 가격도 저렴하고 신선한 과일이 넘치는 논산 화지 중앙 시장에서의 어린 시절 추억의 분식과 다양한 음식을 꼭 만나보세요. 2020 년 이후의 정월 준비물은 여기에서 해결하세요! 충남 논산시 화지돈,2021. 6. 6.
[강경 성지 순례] 김대건 신부 첫 사목지가 있는 강경 뚜벅이 여행,"논산 강경 가볼 만한 곳, 비대면 여행지 강경 성지 순례 코스 한적하고 여유롭게 뚜벅이 여행하기 좋은 곳, 강경 근대 문화거리 2020년 12월 25일... 성 김대건 신부 첫 사목 성지 <위치 : 충남 논산시 강경읍 홍교리 101-1, 102-1> 강경은 수상교통의 중심지로 해상무역은 물론 금강 뱃길을 통해 다양한...",2020. 12. 29.
[논산비대면여행] 논산숨은비경 온빛자연휴양림 눈내리던날에~,"비대면여행지로 좋은 온빛자연휴양림의 모습 소개해드릴께요. 온빛자연휴양림과 함께 주위 가볼만한곳으로 대둔산 수락계곡도 산책하기에도 등산하기에도 좋은곳으로 함께 추천드립니다. [온빛자연휴양림] 충남 논산시 벌곡면 한삼천리 309 입장료 없음, 주차장 넓음 *온빛자연휴양림의 봄 풍경...",2021. 1. 2.
2월 가볼만한 곳. 여행 명소. 추천베스트. 갈만한 곳. 주요축제. 부산알림이,여행 명소. 추천베스트. 갈만한 곳. 주요축제 매화축제. 매화 출사지 통도사 홍매화 2월15일 현재 40% 개화 김해 건설공고 와룡매 / 코로 인하여... 28 충남 논산시 서울랜드 겨울 빛축제 2021 2020.11.27~ 03.01 경기 과천시 국립민속박물관 정월대보름 한마당 2021.02.01~ 03.03 오색별빛정원전 2021...,2021. 2. 17.
[영상] 비대면으로 떠나는 논산여행 <연산 개태사>,"후삼국 통일 역사를 간직하고 평화의 시대를 활짝 연 사찰 개태사 충남 논산시 연산면 천호리에 있는 하늘의 가호에 보답한 사찰 개태사를 카메라에 담았습니다. 고려태조 왕건은 후삼국을 통일한 것이 부처님 은덕이라 하여 산은 천호산, 절은 개태사라고 이름 지었다고 합니다. (2021. 5. 4. 2분...",2021. 5. 4.
논산 가볼 만한 곳-미스터 선샤인 촬영지 1,이런저런 일들로 고민이 많아지다 보니 이런 부분도 고민이 되어 글을 적어 보았네요. 설 연휴 마지막 날이네요. 귀경하시는 분들 운전 조심하시고 연휴 잘 마무리하세요. 오늘은 지방에 있는 관계로 답방은 복귀 후하겠습니다. 너그러이 이해해 주세요. 2020년11월24일 충남 논산시 카지의 사진여행,2021. 2. 14.
[국내 여행] 내돈내산 리얼 후기 논산 풀빌라 피크닉 테마파크에서 수영과 스파를 모두...,글/사진 hongbohongbo 2020.02.19~20 논산 여행 #논산풀빌라 가는 길에 우연히 들렀던 #메밀전문점 #춘산메밀꽃 에서 맛있는 #메밀막국수 먹고 예약해놓은 숙소 피크닉 테마파크 논산 으로 달려갔어요. 주소 : 충남 논산시 연산면 천호4길 33-4 지번 : 천호리 5 전화번호 : 041-733-0503 오잉? 엄청 큰 공룡이...,2021. 2. 27.
[논산여행 떠나You] 귀여운 포토존이 가득한 논산 연산역!,논산시 소셜미디어 서포터즈 윤은정입니다. 논산 연산역 철도문화체험관을 다녀왔어요! 큰 역사는 아니지만 자그마한 역사가 참으로 정감 있는... 일제강점기에 전국 각지에 철도망을 부설할 당시 주요 역마다 기관차 급수시설을 설치하였는데 충남에는 서대전과 강경역에 급수탑이 있었는데...,2020. 6. 12.
논산피부관리 트로이필 신세계! 에스엠아르케지엥 논산점,결혼식 무사히 잘 마치고 신혼여행도 행복하게 잘 다녀오고 정신 없는 요즘이에요 ㅋㅋㅋㅋㅋㅋㅋㅋㅋ 얼른 결혼 후기 폿팅 쪄 오겠슴당 *ㅅ* 일... 에스엠아르케지엥 논산점 만세 또 갈게요 원장님 ~ ㅋㅋㅋㅋㅋㅋㅋㅋㅋㅋㅋ ㅋㅋㅋㅋㅋㅋㅋ 에스엠아르케지엥 논산점 충남 논산시 시민로 291 2층...,2021. 7. 9.
"SBS 생방송 투데이 3월5일 논산 3GO 여행 웅어회, 웅어회 무침","SBS 생방송 투데이 3월5일 논산 3GO 여행 웅어회, 웅어회 무침 임금님 수라상에 올라가 웅어 전어와 비숫하지만 뼈가 더부드러움 전어 맛 평가 웅엉회 무침 만나식당 ☎ 041-745-7002 충남 논산시 강경읍 황산리 138-2 방문 후기는 아래 블러그에서 보세요",2021. 3. 6.
"【논산 여행】 기호(畿湖) 문화의 중심지, 돈암서원을 가다","소재지 : 충남 논산시 연산면 임3길 26-14 입장료 : 무료 관리사무소 : ☎ 041) 733-9978 프로그램 담당자 : ☎ 041) 732-6482 홍살문 및 하마비 돈암서원은 사계(沙溪) 김장생(金長生, 1548~1631)이 타계한지 3년 후인 1634년(인조 12) 충청도 연산현(連山縣)의 임리(林里)에 창건되었다.[249 번지] 창건 시...",2021. 6. 2.
[공유] [논산여행] 백설 속에 만난 백의정승 명재 윤증 선생의 고택,아름다운 풍경을 사진으로 남기려고 모여 드는 사람 중에 특별한 사진을 남기고 싶어인지 몰라도 들어가서는 안되는 곳 들어가는 등 위험한 행동을 서슴지 않는데 이로시묜 없습니다. 모두가 소중히하고 아쿄야 우리의 후손에 물려 줄 수 없을까요 충남 논산시 노 성 명 노 손산와의 거리 50,2021. 7. 15.
"논산여행, 계곡추천, 논산8경, 논산 제3경, 대둔산, 수락계곡, 수락폭포, 승전탑, 구름다리,","해발 878m의 대둔산은 충남 논산시와 금산군, 그리고 전북 완주군의 어름에 우뚝 솟아 있는데요. 케이블카를 타고 오를 수 있는 곳이 완주군이고, 원효대사가 창건한 태고사가 있는 곳이 금산군, 수락계곡은 논산시가 소재지랍니다. 대둔산 수락계곡은 산 좋고 물 맑은 수락마을(논산시 벌곡면...",2021. 5. 9.
[강경여행] '스승의 날' 발원지 논산 강경고등학교,'스승의 날' 발원지 논산 강경고등학교 충남 논산시 강경읍 남교리48 논산시 논산경찰서 인근에 있는 강경고등학교는 1936년에 개교한 ‘스승의 날’의 발원지다. 대한적십자사는 1958년부터 학교 발전에 공을 세운 교직원이나 병으로 퇴직한 교직원을 위로하는 행사를 적십자사의 날인 5월...,2021. 5. 17.
논산 여행 봄눈 내린 노성 명재고택,"^^ #여행, #충남여행, #500년보호수, #500년느티나무, #겨울명소, #노성산 #고택음악회, #기호유학, #노서서재, #노성면가볼만한곳, #노성면여행지추천, #노성산설경, #노성산성, #논산가볼만한곳, #논산고택음악회, #논산명재고택, #논산시노성면, #논산시노성면가볼만한곳, #논산시여행, #논산시여행지추천...",2021. 2. 18.
논산 토속촌 훈련소 입대 전 점심 #내돈내산,"토속촌 충남 논산시 논산대로351번길 8 / 충남 논산시 취암동 131-5 매일 11:00 - 22:00 041-735-9051 엄청 큰 공터 뒤에 위치한 토속촌. 그냥 거기에... 오늘도,, #논산맛집 #논산훈련소점심 #논산토속촌 #논산고깃집 #논산오리고기 #논산삼겹살 #논산목살 #논산여행 #논산훈련소 #토속촌 총평 맛...",2021. 6. 2.
