header,contents,date
충주 중앙탑막국수 막국수와 치킨?,반려견 마음이와 충주 여행을 갔을 때 들렀던 막국수 집이에요. 다녀온 지 한참 지났지만 언니는 가끔 중앙탑막국수가 먹고 싶다는 이야기를 하는데요. 조만간 드라이브 삼아 한번 다녀와야 하나 봅니다. 주소 : 충북 충주시 중앙탑면 중앙탑길 109 영업시간 : 매일 10:00-21:00 전화번호 : 043-846-5508 메뉴...,2021. 9. 5.
충북 충주가볼만한곳 아이와함께 가볼만한곳 활옥동굴구경 후 활옥동굴카페~^^,주소 : 충북 충주시 목벌안길 26 전화 : 043-854-0504 영업시간 : 매일 09:30 ~ 18:00 (월요일 휴무) 활옥동굴카페는...충북충주가볼만한곳으로 유명한... 만족합니당~~~ㅎ 충북충주가볼만한곳으로 유명한 활옥동굴에서 카약체험도 하고 활옥동굴카페에서 잠깐의 요기와 휴식을 취하고 돌아온 충주여행...,2021. 6. 30.
[충북] 충주정육점/충주밀키트 구매는 '잘자란 돼지소',"충주여행 #충주 캠핑고기 #충주이베리코 충주정육점, 충주밀키트 구매는 #잘자란돼지소 충북 충주시 갱고개로 219 1층 잘자란 돼지소 매일 09:00 - 22:30 연중무휴 주차, 포장, 배달, 예약 가능 안녕하세요~! 대한민국 최상급 한우 1++ 를 전문으로 하는 프리미엄 충주정육점 잘자란돼지소 를 소개드리려...",2021. 8. 2.
"충북 충주 가볼만한곳, <깊은산속옹달샘> 힐링여행 BEST 5","저에겐 충주시 유튜브 '홍보맨'으로 익숙한 곳이라, 사과가 유명하다는 정도만 알고 있었어요. 그러다 이번 팸투어를 통해 진정한 충주 여행의 매력을 알게 되었습니다. [충북 충주 가볼만한곳 BEST 5] 01. 깊은산속옹달샘 - 음식 저장고 투어 02. 깊은산속옹달샘 - 싱잉볼 & 선무도 03. 중앙탑 사적...",2021. 2. 13.
"[충청북도] 충주 2일차, 비내섬","비내섬 주소 : 충북 충주시 앙성면 조천리 412 비내쉼터 주소 : 충청북도 충주시 앙성면 남한강변길 146 비내마을 주소 : 충청북도 충주시 앙성면... 총 여행경비 1일차 토론토 호텔 2박 110,000원 낙지냉면 + 콜라 20,000원 편의점 5,000원 2일차 짬뽕 9,000원 편의점 3,000원 스타벅스 5,600원 전 일정 교통...",2021. 10. 4.
충주 가볼만한곳 '수주팔봉 출렁다리'...드라마 빈센조 촬영지,충주에 여행 가실 분들은 충주호 인근이니 들러보세요. 기억에 남는 추억이 될 겁니다. ㅎㅎ 충북 충주시 살미면 토계리 국내/당일치기/충주/가볼만한곳/여행/핫플/뷰포인트/사진찍기좋은곳/명소/데이트/추천/ヴィンチェンツォ/위치...,2021. 8. 20.
"[TV 조선 아내의 맛] 함소원 & 진화 부부, 마마의 충주 여행",무지개길 충북 충주시 중앙탑면 탑평리 11 사진 : SNS작가단 양배츄 충주 탄금호 무지개 길 ◆ 주차 및 입장료 : 무료 ◆ 기타 : 화장실 및 와이파이 무료 ◆ 이용시간 : 00:00 ~ 24:00 ◆ 문의처 : 043-842-0533 아내의 맛 충주여행 04. 비내섬 충북 충주시 앙성면 조천리 412 사진 : SNS작가단 양배츄 비내섬...,2020. 6. 25.
"제천여행② 의림지, 의림지 파크랜드, 우림정원, 충주라이트월드 :)","빡센 일정 우림정원 ○ 주소: 충북 충주시 엄정면 삼실길 42(율능리) ○ 영업시간: 매일 09:00~19:00 ○ 입장료: 5,000원 #충주우림정원 #우림정원... 포토존도 진짜 많아욧 #의림지 #의림지파크랜드 #우림정원 #충주라이트월드 #제천여행 #충주여행 #제천당일치기 #충주당일치기 #국내여행",2020. 9. 10.
"충북/충주여행 월악산 악어봉 ""자연의 만든 풍경""","충북/충주여행 월악산 악어봉 ""자연의 만든 풍경"" 충주시 살미면 월악산 악어봉이 충북여행의 포인트입니다. 악어봉을 가기 위해서는 보통 대미산을 거쳐서 악어봉으로 산행이 이루어지지만 오늘은 짧고 굵게 게으른 악어에서 악어봉으로 코스를 잡았습니다. 악어봉산행코스 : 내사마을(충주시...",2021. 1. 7.
"충주시 맛집, 새싹 메밀 막국수 맛집, ""중앙탑 메밀마당""","""중앙탑 메밀마당"" 전화번호 : 043-855-0283 주소 : 충북 충주시 중앙탑면 중앙탑길 103 영업시간 : 매일 10:40 - 21:00 안녕하세요!! 여행중독입니다!! 가족여행으로 충주 활옥동굴과 수안보 온천 가족탕을 계획을 했는데 금강산도 식후경 맛집을 검색하던 중 충주에는 새싹 막국수 맛집이 많이 있다고 해서...",2021. 6. 12.
[충북 충주] 충주여행 : 생활의달인 은둔식달 쫄면달인 분식 맛집 성서동 오뚜기분식...,오늘은 충주여행중 다녀왔던 생활의달인 은둔식달에 소개된 쫄면달인이 있는 분식 맛집 충주 성서동 오뚜기분식을 소개 하려해요. 충주에... 중앙 어울림시장 내에 위치한 충주 맛집 오뚜기 분식 적극추천 합니다 오뚜기분식 충북 충주시 예성로 168 043-844-3461 매일 am10:30 - pm 20:00 매주 일요일 휴무,2021. 3. 4.
충주 가볼만한곳 활옥동굴 외 여행코스까지,"충주 가볼만한곳 활옥동굴 외 여행코스까지 글&사진 : 초록바다 최양훈 한동안 외출을 자제하면서 렌선여행기만 작성하다가 정말 오랜만에... 30년 전통 칡냉면집 갈마가든 주소: 충북 충주시 살미면 용천리 245-1 영업시간: 매일 10:00~21:00 메뉴: 칡냉면 7,000원 / 왕만두 6,000원 / 해물만두전골(2인)...",2021. 2. 22.
"충주1박2일여행 : ) 낮과밤이다른공간 낮과밤, 낮에도 밤에도 예쁜정원이 함께하는...",2021.09.05-09.06 충주1박2일 여행 써니 & 유리 오랜만에 무궁화호 기차 타고 충주가기 ♪ 충주1박2일여행 • 충주역도착 ⓒ DaisyYul 충주역에... 충주지현동맛집 충북 충주시 지현천변1길 55-2 낮과밤복사 충북 충주시 지현동 388 낮과밤 매일 10:30 - 01:00 last order 12:00펼쳐보기 금요일 10:30 - 02:00...,2021. 9. 21.
충주 여행으로 추천하고 싶은 중앙탑에서 자전거타기,#충주여행 #충주 #충주명소 #충주여행하기 #충북여행 #중앙탑 #충주중앙탑 #충북여행추천 #충주여행추천 #충주놀러가기 #충주자전거 #자전거... 그래서 충주시에서 준비한 자전거입니다 ㅎㅎ 자전거 타고 돌수 있어서좋습니다 총 시간은 2시간입니다 하는법 알려드릴게요 ㅎㅎ 처음에...,2020. 11. 15.
"가을 여행지 추천, 가을 여행가기 딱 좋은 명소 BEST5","코로나 때문에 여행 한번 편히 가지 못하는 요즘, 알록달록 변해가는 풍경들을 바라보며 가을 여행을 떠나는 생각을 한번 쯤 해보셨을 텐데요... 스카이어드벤처 충북 충주시 앙성면 단암길 19 1588-8715 3. 단양 - '만천하스카이워크&이끼터널,수양개빛터널' 앞서 소개 드린 충주과 함께 액티비티로...",2021. 9. 27.
충북가볼만한곳 키즈카페 야외 놀이동산 라바랜드,옥천여행 #영동여행 #단양여행 #청주카페 #제천카페 #충주카페 #괴산카페 #증평카페 #진천카페 #음성카페 #보은카페 #옥천카페 #영동카페 #단양카페 #충북가볼만한곳 #서이추 주소: 충북 충주시 남한강로 30 영업: 매일 10:00 - 18:00동절기(12월 ~ 2월) 영업: 매일 10:00 - 19:00하절기(3월 ~ 11월)...,2021. 7. 23.
"충주시, 03.03 최신뉴스","이번 부부관계 증진 프로그램은 노인부부 충북사회복지공동모금회의 지원을 받아 3월부터 12월까지 진행되며, 부부교육, 소통 상담, 집단 프로그램, 요리 교실, 동반 취미활동, 일일 신혼여행 등 다양한 세부 프로그램으로 구성돼 있는데요. 충주시는 이번 사업을 통해 부부간의 정서적 지지 및...",2021. 3. 3.
"충주시 맛집, 탕수육과 소마면으로 유명한 맛집, ""상촌식당""","""상촌식당"" 전화번호 : 043-848-3492 주소 : 충북 충주시 수안보면 중산신촌길 99 영업시간 : 매일 11:30 - 15:00 월요일 휴무 안녕하세요!! 여행중독입니다!! 충주 여행 중 마지막 맛집으로 들린 곳 ""소마면""과 ""산더미탕수육""으로 유명한 맛집 ""상촌식당""에 다녀왔습니다!! 이곳 상촌식당 갈때 정말 의심이...",2021. 6. 13.
충주여행 가볼만한곳 세계술박물관 리쿼리움(Liquorium),"충주여행 가볼만한곳 세계술문화박물관 리쿼리움 2층 카페 뮤지엄에서 내려다 본 풍경은 너무 멋지고 아름다워요. 조정경기 연습을 하는지... 세계술문화박물관 리쿼리움 주소 : 충북 충주시 웅앙탑면 탑정안길 12 (지번 탑평리 51-1) 이용시간 : 매일 10시 ~ 18시 휴무 : 매주 월요일, 신정 휴관...",2020. 11. 19.
<충청북도/여행정보/충주>충주 수안보 가족탕 온천 객실을 운영하는 호텔,수안보 수호텔 등급 : 없음 출처 : 수호텔 홈페이지 호텔명 수호텔 수안보 주소 충청북도 충주시 수안보면 장터2길 12 홈페이지 바로가기 할인예약사이트 없음 수안보 패밀리스파텔 등급 : 없음 출처 : 수안보 패밀리스파텔 홈페이지 호텔명 수안보 패밀리스파텔 주소 충북 충주시 수안보면...,2020. 10. 4.
충주호 캠핑월드 수영장 글램핑펜션 후기,충북 충주시 동량면 호반로 696-1 충주는 이번에 처음 와봤는데 서울에서 2~3시간정도 걸렸어요. 오토캠핑장과 글램핑 두 가지 타입의 숙박이 가능한데 우리는 캠핑 무지렁이니까 당연히 글램핑 숙소를 선택했어요. 사진처럼 전체가 호수에 둘러싸인 곳이라 어떤 타입의 숙소를 선택해도 호수 전망을...,2021. 8. 20.
#충북카페 #충청도카페 #게으른악어,"좋고, 여행의 즐거움을 더해주는 기분좋은 카페였습니다 :) 예약가능여부 : X 043-724-9009 카페 공간이 넓은데 비해 관리를 해주시는 직원분이... caiman/ 찾아가시는 길 충북 충주시 살미면 월악로 927 자차 이동 추천드려요 :) #충청도카페 #충청북도카페 #월악산카페 #충청도애견동반카페...",2021. 5. 25.
"충주시 맛집, 수안보 꿩요리 맛집, ""대장군""","충주시 수안보 꿩요리 맛집 ""대장군"" 전화번호 : 043-846-1757 주소 : 충북 충주시 수안보면 미륵송계로 105 영업시간 : 매일 11:00 - 20:30 브레이크 타임 16시~17시 안녕하세요!! 여행중독입니다!! 충주 여행을 다녀 왔습니다!! 충주에는 꿩요리 전문점이 많이 있으며 충주향토 음식으로 유명하여 왔으니...",2021. 6. 12.
"[충주가볼만한곳] 세계무술공원, 놀이터가 가득해서 아이가 좋아해~","충주여행 / 충주가볼만한곳 충주세계무술공원 - 주소 : 충북 충주시 남한강로 24 - 문의 : 043-850-6740 - 이용요금 : 무료 - tip : 주차장 무료 - 다녀온 날 : 2021.08.07 자주 찾게 되는 충청북도 충주시~!! 충주에 가볼만한곳, 예쁜 곳, 즐길곳 등 다양한 매력들이 가득한데요. 오늘은 아이와 함께 가볼만한곳...",2021. 8. 21.
충주여행이 추천하는 충주댐 카페 빌라쥬에즈!,충주여행이 추천하는 충주댐 카페 빌라쥬에즈! 주소 충북 충주시 동량면 지등로 325 전화 043-846-5999 남한강 앞에 위치하고 있는 충주 빌라쥬에즈! 주택을 개조한 이 카페는 빈티지한 느낌이 강한 곳인데요 커다란 마당과 함께 내부도 굉장히 넓습니다. 내부 인테리어는 사장님께서 직접...,2020. 3. 2.
[충북/충주자유시장] 충주순대만두골목 중원순대 솔직후기,[충북/충주자유시장] 충주순대만두골목 중원순대 솔직후기 충주 당일치기로 여행 아닌 나들이?를 다녀왔는데요 맛집은 무조건 가줘야죠... 중원순대 ☎ 043-847-5375 매일 07:00 - 21:30 충청북도 충주시 충의동 101 헬로우미니의 블로그 포스팅은 저의 경험담을 직접 기록합니다! 입맛은 개개인마다...,2021. 7. 24.
충주 여행 1박 2일간의 행복했던 추억(ft. 게으른 악어),"친구가 구미에 거주하고 있기 때문에 서울에 있는 저와 딱 중간 지점인 충주로 여행지를 선택하게 되었는데요, 살면서 처음인 커플여행인 만큼 한달동안 잘 준비해서 차질 없이 너무 행복한 여행이 되었습니다. 날씨가 .. 뜰이야기펜션 043-842-5561 충북 충주시 중앙탑면 수룡봉황길 524-1 깨끗...",2020. 5. 6.
[충북 충주] 아이들 호기심 자극하며 놀기 좋은 오대호아트팩토리,"오대호아트팩토리 충북 충주시 앙성면 가곡로 1434 매일 10:00 - 17:30 (매표,입장시간) / 18:00(관람시간) 월요일 휴무 (공휴일 월요일 개관) 주차장... 조금 선선한날, 가보자 가보자 #오대호아트팩토리 #충주 #충주여행 #충주가볼만한곳 #아이랑충주 #아이랑갈만한곳 #예스키즈존 #아이랑체험",2021. 6. 2.
제천 여행 청풍호반 케이블카 충주호가 한눈에 보이는 파노라마뷰!,"ㅋㅋㅋ 산 좋고 물 맑은 청정도시 #충북제천 제천에는 유명한 여행지들이 참 많지만 그중 가장 유명한 스폿을 딱 한곳만 고르라면 역시 충북 충주시, 제천시, 단양군을 아우르는 청풍호(충주호)와 이 주변 경관을 한눈에 조망할 수 있는 #비봉산 정상이 아닐까 싶어요. 워낙 풍경 예쁘다고 소문난...",2020. 11. 20.
충주 월악산 캠핑장 철수 후 추천코스 : 수안보온천 추천 목욕탕 3 + 갈마가든 or...,→ 수안보 낙천탕 충북 충주시 수안보면 온천천변길 39-4 043-846-2905 별도의 가족탕도 있어서 우리가족 끼리만 목욕가능한 룸 형식의 욕실도 있어요. 대중탕을 이용하기 꺼리시거나 어린 아이들이나 노약자 분들과 여행 중 온천욕을 원하신다면 이용하시는 것도 추천드려요. (하지만 큰 탕은...,2021. 7. 17.
"8월 국내 여행지 추천 충북 베스트5, 충주 활옥동굴포함",여름이면 더 좋은 충주 활옥동굴 충북 충주시 목벌안길 26 043-848-0503 이용시간 9시 30분~ 18시 30분(17시 입장마감) 21년 7월 20일~8월 21일 9~19시까지 연장 개장 입장료 대인 7천원/ 초중고 6천원 / 소인 5천원 동굴보트 입장료 + 3천원 충주 활옥동굴 여름 국내여행지 강력 추천! 올해 3월에 다녀온...,2021. 7. 25.
[생활에 이런 팁이] 안전하게 여유롭게 집 안에서! 눈으로 떠나는 방구석 랜선 여행!,"눈으로 떠나는 방구석 랜선 여행! 코로나로 인해 해외여행은 물론, 휴가다운 휴가를 즐기지 못하고 있는데요. 집에 머무는 시간이... cotid=9d1a5779-c0be-4476-843c-151b805653ea&big_category=A02&mid_category=A0203&big_area=35 ▼ ▼ ▼ [충북 충주시] 폐교의 유쾌한 변신, 아트팩토리...",2021. 1. 20.
국내여행 정보> 한국관광공사 1330 카카오톡 서비스 여행상담 받은 후기,"네이버 여행 인플루언서 핑크예리입니다. 우리가 #국내여행 을 준비할 때 숙소, 교통, 관광지, 가볼만한곳 등등 많은 것을 알아보게 되는데요.... 비내섬(충북 충주시), 양산팔경 금강둘레길(충북 영동군), 마곡사 백범 김구명상길(충남 공주시) 부소산(충남 부여군), 대명유수지&달성습지(대구...",2021. 9. 24.
[충북 제천 충주 가족여행] 충주자연생태체험관 - 충주 브레드코코 - 충주댐 - 제천...,"충청북도에서 충주 사과, 충주댐, 이렇게 충주 이름 붙은 아이콘들이 떠올려지는 충주시를 국내여행 가족여행으로 들렸다가 충주시 바로 옆에 이어지는 제천시 소재, 월악산국립공원 內 나라에서 운영하는 글램핑장, 닷돈재야영장에서 1박 일정, 다녀왔습니다. 작지만 강한 자연생태체험관 충주...",2020. 7. 25.
충북글램핑 충주 수주팔봉 뷰 팔봉글램핑,바로 앞에 위치해있어서 아이들과 자연을 만끽하기에도 좋고 감동적인 뷰를 즐길 수 있는 팔봉글램핑이었습니다 팔봉글램핑 043-855-8085 충북 충주시 대소원면 팔봉향산길 19 #충청도여행 #충주여행 #충청도글램핑 #충북글램핑 #충주글램핑 #충주가볼만한곳 #팔봉글램핑 #수주팔봉 #글램핑추천,2021. 5. 31.
충주 활옥동굴! 충주여행의 핫플레이스를 아직도 못가보셨나요?,"오늘은 그 #충주여행 중에서 사람들이 많이 모르지만, 꼭 다녀와보시길 추천드리는 #충주활옥동굴 을 소개해 볼게요. 충주 활옥동굴은 충주시를 기점으로 보면 동쪽 계명산 자연휴양림 근처에 위치해 있고, 주소는 충북 충주시 목벌안길 26 번지입니다. 충주호를 끼고 있어서 활옥동굴을 찾아가는...",2020. 9. 8.
자연의 청량함과 고즈넉한 한옥! 충북 충주 카페.,♡ 충북 충주 카페 추천 산과 물이 어우러진 멋진 전망을 볼 수 있고 드라이브 코스로도 인기를 끌고 있는 충주호를 시작으로 가족여행으로도... • 위치 : 충북 충주시 소태면 덕은로 596 * 전화 번호 : ***-****-**** * 영업 시간 : 매일 11:00-19:00 일요일 10:30-19:00 * 화요일 휴무 * 메뉴...,2021. 6. 28.
충주가볼만한곳 BEST9: 국내 가을로 다녀온 충주 1박 2일 여행 코스 완벽정리,역사와 자연이 함께 한다고 소개되어 있는 이 곳은 가족여행객들이 많이 찾는 핫플 중 한 곳이에요. 실제로 주말에 갔는데 사람들이 정말 많이 붐비더라고요! 연락처 043-848-0503 주소 : 충북 충주시 목벌안길 26 영업시간 : 매일 09:30 ~ 18:30 (마지막 입장 ~ 17:00까지) 월요일 휴무 (미리 홈페이지...,2021. 10. 9.
"충주 백숙 맛집 모음, 무더위를 이겨낼 ""스테미너 충전""은 여기서 하세요!","충주의 맛집, 여행지를 소개하는 충주여행 블로그입니다. :) 요즘같은 더위를 이겨내려면 기력 보충이 매우 중요하죠 또 내일이 바로 중복이기도... 입짧은 햇님도 반한 ""숲속장수촌"" 충북 충주시 금제로 28 숲속장수촌은 예사롭지 않은 사진에서 알 수 있듯, 조금은 생소한 ""닭해물탕"" 맛집입니다....",2021. 7. 20.
오늘은 어린이날! 천진난만한 웃음이 쏟아지는 어린이 놀이터 :: 목포어린이바다과학관...,"취향저격 여행지를 소개합니다. 목포어린이바다과학관 사진제공 한국관광공사 이범수 목포어린이바다과학관은 지상 3층 규모로 ‘바다’를... 위치 : 충북 충주시 양성면 가곡로 1434 운영시간 : 10:00~18:00, 매주 월요일 휴관 관람요금 : 일반, 어린이 5,000원 ※거리두기 상황에 따라 운영여부 및...",2021. 5. 5.
[충북 충주] 충주 여행 아이와 함께 가볼만한곳 추천 : 비오는날 활옥동굴 투명카약 데이트,"한결이와 겨리마미 둘이 다녀왔어요 가는길에 충주 시내를 지나고나니 한적한 길이 나오더라구요. 따라가는데 와.... 저 멀리 산이 보이고 안개가 좌라락 껴있는데 그게 너무 멋진거예요. 사진에 표현이 잘 안되지만 진짜 최고예요. 이래서 부모님들이 여행다니면 그렇게 경치, 꽃 사진을 찍는구나...",2021. 3. 27.
제대로 찾은 수안보 맛집 탑5,"수안보 명가식당해장국 해장국 8,000원 백반정식 8,000원 주소: 충북 충주시 수안보면 장터3길 20 번호: 043-852-7080 혼밥하기에 좋은 곳으로 자전거 여행을 하는 분들이 많이 찾는 백반집이에요. 저렴한 가격에 집에서 엄마가 만들어주신 것 같은 밥맛을 느낄 수 있어 정감이 가는 곳이랍니다. [본...",2020. 12. 11.
[충북제천가볼만한곳] 당일치기여행 충주 가볼만한 곳 드라마 사랑의 불시착 촬영지...,"#비내섬 #충주비내섬 충북 충주시 앙성면 조천리 412 주차장 있음(무료) 드라마 다수 촬영함(대표작_사랑의 불시착) 화장실, 카페 비내섬 가는 길에... 충주 비내섬은 가을 여행지로 소개될 만큼 갈대들이 예쁘게 어우러져 있는 곳이랍니다! 요니도 갈대들과 인생샷도전!! 갤럭시 20 이에요~(대박!!!!)...",2020. 6. 2.
답사여행의 길잡이 12 - 충북,"이용법 충북 답사여행의 길잡이 제1부 진천·음성과 충주·월악산, 제천·단양 코스 1. 진천·음성 연곡리 석비 보탑사 김유신 탄생지와 길상사... 삼대묘소 충주시 중원(충주) 탑평리 칠층석탑 억정사 대지국사비 중원(충주) 고구려비 정토사 법경대사 자등탑비 청룡사 보각국사 정혜원륭탑 청룡사...",2020. 5. 29.
충북여행 충주 미륵대원지,"충주시 수안보면 미륵리 월악산 국립공원 안에 위치한 미륵대원지는 고려 초기의 석굴 사원터로 이 사원은 주실이 북향하는 특이한 배치이며, 주실에는 독립된 미륵불입상이 중앙에서 북향하여 멀리 월악산을 바라보고 있다. 보물 제95호 미륵리 오층석탑으로 높이 6미터 단층기단 위에 5층의...",2020. 10. 21.
충주 명소! 충주여행의 시작! 충주세계무술공원!!,분주하고 답답한 일상 속에서 휴식 같은 시간을 보낼 수 있는 충주세계무술공원으로 2월의 시간을 맡겨 보자구요^^* 충주 여행의 시작 충주세계무술공원 주소 : 충북 충주시 남한강로 24(지번 : 금릉동 601) 이용시간 : 00:00 ~ 24:00 입장료 및 주차비 : 무료 편의사항 : 와이파이 무료 문의처 : 043-850-6740...,2020. 2. 20.
[충주시의 23산],"인등산 충북 충주시 산척면 영덕리에 위치하며 높이는 666M로 더덕내음 그득한 철도산행의 적지로 철도청에서 매년 추진 시행되는 관광열차로 여행하면 주위의 삼탄유원지도 볼 수 있는곳이다. A코스 : 산행거리 7.1km, 약 3시간 소요, 대모천마을(80분/2.7㎞) → 주능선안부(40분/1.3...",2020. 5. 19.
[충북 가볼만한곳] 충주 산책로 등산로힐링 코스 <비내섬 비내길>,충북여행 기획팀 [충북 가볼만한곳] 충주 산책로 등산로힐링 코스 <비내섬 비내길> 충주의 아름다운 길 비내섬 비내길 #충북여행... 주소: 충북 충주시 앙성면 조천리 412 아름다운 사진정보 @happi__young님 아름다운 사진정보 @joohokim_people님 #비내섬 클릭시 이동합니다 ㅡ 인스타그램 ㅡ...,2021. 6. 29.
[ 충북 충주 ] 충주라이트월드 : 반짝반짝 불빛축제,제가 불빛축제를 너무나 좋아해서~~ 통통이가 올해 2월 충주 여행 때 데리고 간 곳이랍니다. 밤에 오다 보니 잘 보이지도 않고 안내판도 보이질... 위치 정보 ★ 상 호 충주라이트월드 ★ 전 화 1522-1258 ★ 주 소 충북 충주시 남한강로 24 (충주시 금릉동 601) ★ 영업시간 17:00 ~22:00 / 주말 · 공휴일...,2021. 5. 10.
〔충주/목행동 맛집〕강촌해장국에서 아침식사로 먹은 해장국과 내장탕,"여행준비를 하고 7시에 맞추어 식당에 도착을 했다. 주소: 충북 충주시 목행산단5로 97(지번: 목행동408-1) 주차장은 널직했다. 영업시간은 오전7시~오후2시 이고 휴무일은 매주 월요일이다. 우리가 첫손님이었다. 좌석은 전부 좌식이었다. 식사메뉴로는 해장국(7,000원)과 내장탕(10,000원) 두종류가...",2021. 7. 20.
충주 카페 @게으른악어 (충주호 뷰를 한눈에),드라이브할 겸 서울 근교 여행을 떠났다! 충주 시내에서 식사를 하고 이천으로 넘어가려고 했는데 충주호에 뷰가 좋은 카페가 있다고 해서 방문해 봄 게으른악어 충북 충주시 살미면 월악로 927 꼬불꼬불한 도로를 달리다보면 도착하는 게으른악어 주차장이 아주 넓어서 주차 걱정은 없지만 그늘막이...,2021. 7. 25.
"충주 가볼만한곳, 하얀짬뽕이 맛있는 수안보 상촌식당 (소마면&탕수육)","수안보 온천을 떠나 논밭이 있는 시골길을 따라 식당하나 없을 것 같은 길을 들어가면 하얀짬뽕, 소마면이 유명하고 맛있는 상촌식당 충북 충주시... 소마면은 특히 해장에 좋다고 하여 수안보 온천여행을 와서 술을 마신 다음날 찾아오는 손님들이 많대요. - 2TV 생생정보 1078회 안녕하세요...",2021. 7. 26.
365일 휘영청 둥근 보름달이 뜬다! 달달한 밤 산책 명소 TOP2,365일 항상 둥근 보름달을 보러 가는 국내 여행지 두 곳을 골랐다. 전북 남원 광한루원과 충북 충주 중앙탑공원이다. 왼쪽 사진: 남원시 제공... 박동일 충주시 관광과 주무관 홍지연 여행+ 기자 #국내여행 #추석 #보름달 #추석보름달 #한가위 #야간산책 #야경명소 #남원여행 #광한루 #광한루원...,2021. 9. 21.
"강아지와 충주 여행 - 게으른악어 카페, 종댕이길, 무학시장","충주 무학시장 · 충주 무학시장 위치 충북 충주시 봉방동 4-58 여행에서 빠질 수 없는 재래시장투어 심바 데리고 어디 저녁 먹으러 가기가 마땅치 않아 먹을거리 사서 리조트에서 먹기로했어요 검색해보니 충주 무학시장 안에 만두,순대 골목이 있다길래 순대덕후 박부부는 아묻따 무학시장으로 궈궈...",2021. 1. 15.
