header,contents,date
"[등산여행_전라북도, 충청도] 전북 완주군(충남 논산시) 대둔산 국립공원 마천대...","[등산여행_전라북도, 충청도] 전북 완주군(충남 논산시) 대둔산 국립공원 마천대(878m) 제 1 코스 ""케이블카"" BAC 블랙야크 100대 명산 2021.07.30 85 번째 산행 등산여행_전라북도, 충청도 대둔산국립공원 - 케이블카 - 대둔산 구름다리 - 삼선교 - 마천대 - 램블러 대둔산 완주 뱃지 1 대둔산 마천대(878m)...",2021. 8. 6.
충남 논산시 벌곡면 수락리 잘 지은 전원주택 매매,오늘은 충남 논산시 벌곡면 수락리에 위치한 집을 소개할게요. 수락리야 예부터 공기좋고 물 좋고 수려하기로 유명하죠. 게다가 마을 자체가 약간... 혹여 전원주택 산다고 친척이나 지인들 방문시 갈 곳이 많아 여행오는 기분이 들 것 같아요. 현재 올바른 전원주택 짓기 강사로 활동중이신 분이...,2020. 10. 9.
『연산순대마을』 - 충남 논산시 연산면의 명물음식 피순대,『연산순대마을』 - 충남 논산시 연산면의 명물음식 피순대 안녕하세요. 기록하는 흰둥이(기둥이) 입니다. 논산에서 수로권 붕어낚시를 마치고... 이 일대에 정말 많은 순대를 파는 가게가 있는데 낚시 겸 여행을 다니며 들를때마다 거의 모든 집을 가서 먹어봤었습니다. 희안하게도 조금씩은...,2021. 4. 9.
논산 중고 피아노 매입 팔기 충남 논산시 시민로,"팔기 충남 논산시 시민로 화려한 봄날은 하루하루 지나가기만 하는데, 여전히 추운 날 속에서 머뭇거리는 모습들을 엿볼 수 있습니다. 여러 가지 코로나가 그렇게 다 바꾸어 놓은 거 같은 요즘 일상이 되어버린 거 같습니다. 라이프스타일, 의료 교육, 국제관계까지 바꾸나 봅니다. 자유로운 해외여행...",2020. 3. 31.
[충남 논산시_조선옥] 논산 어머니의 정성이 느껴지는 돼지갈비 맛집!,오늘은 논산여행을 하면서 들렸던 식당을 소개해드릴려고 합니다! 위치는 연무중앙초등학교 인근인데... 주소를 찍고 가시는 것을 추천드리고 가게 앞에 가로주차공간이 있으니 참고하세요~^^ - 매장명 : 조선옥 - 영업시간 : 10:00~22:00 * 휴무일 : 매주 수요일 - 매장주소 : 충남 논산시 연무읍 연무로...,2020. 8. 8.
[충남 여행 ] 충남 논산시 연산면 천년의 백제 역사 숨결이 살아 숨쉬는 황산성 힐링...,코로나로 국민모두가 힘든 시간을 보내고 있지만 생활속 거리 두기 걱정 없이 산책하듯이 등산하기 좋은 여행지로는 논산시 연산면 표정리에 출발하는 황산성 둘레길을 강력히 추천 합니다. 무엇 보다도 아이들과 함께 하기에도 매우 좋은 코스로 여러분께 소개합니다.,2020. 5. 17.
"가을여행, 논산시 가볼만 한 곳, 강경여행, 근대문화유산, 사진촬영지, 산책코스",▲ 강경 상징 조형물(위치: 충남 논산시 강경읍 계백로 159 논산경찰서 앞) 강경은 전국 최고의 젓갈 산지로 유명한 곳입니다. 가을에 열리는 젓갈축제와 김장에 사용할 젓갈을 구입하기 위해 강경을 찾는 사람들의 발길이 끊이지 않습니다. 그러한 이유로 강경 근대문화 코스의 첫 발걸음은 새우를...,2021. 9. 23.
충남 논산시 벌곡면 대둔산 “수락계곡”,"20210811 수요일 밤 내가 살고있는 충남 #계룡시는 나들이, 여행가기 좋은 곳 어디든 그리 멀지 않은 곳은 이른 점심식사 후 다녀와도 집에 와서 식사할 수 있는 거리 그래서 계획 없어도 그냥 훌쩍 나들이를 나선다. 오늘도 점심식사 후 30분 거리에 있는 #대둔산 #수락계곡으로!!! 다음주에...",2021. 8. 11.
#3. 후지X100V 사진이야기(충남 논산시 연산),나는 약간 무계획 여행하는 것을 좋아한다 논산시 연산에 한적한 카페를 찾아가는 중 철길을 지나 가다보면 임시 휴업.. 망할 코로나.. 하지만 주변 자연경관이 좋기에 한바퀴 돌기로 했다 푸릉푸릉한 농촌뷰 시골이라 그런지 사진찍고 있는 데 허허허 하면서 지나가는 할아버지 정이 넘쳤다. 농촌용...,2020. 9. 23.
"논산 여행 코스! 계백의 충절을 기리는 충효의 고장, 논산시 부적면 한 바퀴!",'부적면사무소 - 덕평리 석조여래입상 - 봉계공윤유선생영당 - 논산 탑정리석탑 - 논산 탑정호출렁다리 - 충곡서원 - 탑정호수변생태공원 - 휴정서원 - 신풍리마애불 - 계백장군유적지 - 백제군사박물관'의 코스만 봐도 산책이 아니라 여행에 어울릴 듯합니다. ▲논산시 부적면사무소(위치: 충남...,2021. 8. 31.
"낮과 밤의 다른 매력을 찾아서, 충남 논산시 탑정호","탑정호출렁다리 충남 논산시가 탐정호출렁다리의 개장을 앞두고 있다. 화려한 미디어파사드 조명이 수놓은 출렁다리, 산책길과 광장에... 충청남도 논산시 가야곡면 탑정로 773-30 (한국농어촌공사 논산 금산지사 탑정 관리소) * 여행팁 : 호수 주변으로 여러 주차장이 마련되어 있다. 탑정호...",2021. 6. 4.
(32차) 논산 에버그린캠핑장과 논산시 여행 이야기(2021.10.2~3),2021년 10월 2일 토요일 충남 논산에 위치한 #에버그린오토캠핑장 이 우리집 전주에서 한시간 이내 거리에 위치해 있어 천천히 출발하기로 하고... 반대편 카페에서 아이스아메리카노 시원하게 한잔 하고 되돌아 와 논산시에서 운영하는 셔틀버스 타고 제2주차장으로 컴백 우리님께서 몇 번 본지도...,2021. 10. 7.
8th 충남 논산시 양촌면 모천리 논산 양촌 무료캠핑장(당일치기)대전 근교 무료캠핑장...,옆에 아이들이 보고 있습니다. #가족과함께하는여행#아이캠퍼스카이루프탑텐트#렉스턴W루프탑텐트#충남논산무료캠핑장#충남논산양촌면무료캠핑장#양촌축우회전용구장#대전근교무료캠핑장#아이들과함께떠나는차박캠핑여행,2020. 10. 8.
[논산시 여행]코이비꼬(koivikko),"충남 논산시 강산길 90 매일 11:00~22:00 영업시간을 참고하세요. 도착하면, 자작나무 숲 앞에 주차장이 크게 있습니다. 코이비꼬 주차장 그리고 이곳은 자작나무 숲 입니다. 왼쪽은 가을, 오른쪽은 초여름(장마) 보시는 바와같이 흰색 줄기를 가진 자작나무가 엄청 많이 심어져있습니다. 제가...",2021. 7. 18.
충남 논산시 태국 현지 음식점 :: 태국 정통 음식점 알로이키친 다녀옴,"먹고싶었다 생각없이 ㅎ 다 매운 메뉴를 시켰었다,,,, 메뉴판에 분명 고추그림 하나짜리여서 우습게 봤는데 이제보니 메뉴판에 고추 두개 세개는 없다 그냥 다 한개인 것이다. 분위기도 좋고 양도 많고 맛있고 이시국에 해외여행도 못가는데 태국 정취 느끼고 싶고 태국음식 먹고 싶다면 방문하세오!",2021. 2. 26.
[충남 논산시_선샤인랜드] 미스터션샤인 촬영지를 살펴볼 수 있는 곳,"- 장소명 : 션샤인랜드 - 주소 : 남 논산시 연무읍 봉황로 102 - 전화번호 : 041-746-8480 -운영 시간 : 매일 09:00~18:00 11월~2월: 17:00까지 (점심시간 12:00~13:00, 수요일 휴무) #국내여행 #논산여행 #미스터션샤인 #션샤인랜드 #촬영장세트 #글로리호텔 이곳도 내부시설은 코로나 여파로 인해서 3월부터...",2020. 8. 8.
[충남 논산 여행] 논산시 강경읍 옥녀봉, ,2021. 9. 11.
[충남여행] 논산시 탑정호 수변생태공원 수변데크(탑정호 출렁다리),"충남 논산여행 탑정호 수변생태공원 & 출렁다리 어렸을적부터 북적임에 익숙하다보니 그래도 그 익숙함이 그대로 남아있어서인지 조용하고 한적한... 여기는 충청남도 논산시 논산 8경 ""탑정호"" 그리고 수변생태공원 ""탑정호수변생태공원""이라 부르며 나름 깔끔한 화장실과 주차장을 갖춘 충남의...",2020. 10. 2.
"가을 여행, 시골여행, 논산여행, 논산시, 양촌면, 바랑산, 양촌공소, 햇빛촌 바랑산...",▲ 논산시 양촌면사무소 (위치: 충남 논산시 양촌면 매죽헌로 1665번길 28) 논산시 양촌면사무소에 차를 세우고 여행에 필요한 정보를 얻었습니다. 양촌면의 지도를 보면 대부분이 산지로 이루어졌는데요. 지형에서 양촌면의 유래를 짐작할 수 있을 듯합니다. 예로부터 우리의 조상들은 풍수지리에...,2021. 9. 13.
추웠던 겨울아 굿바이 충청남도 '논산시로 떠나는 힐링 여행’: 선샤인랜드...,"호수를 보며 걷는 힐링 여행과 더불어 특별한 체험을 하고 싶으분들께들게 추천합니다! 위치:충남 논산시 부적면 충곡리 287-8 입장료: 무료 날씨가 풀리며 괜히 밖에 나가고 싶은 요즘, 그런데 나가기는 부담되는 요즘, 살랑거리는 바람과 함께 떠나는 야외 투어 어떨까요? 지금까지 '논산시로...",2021. 2. 28.
"퇴근길 여행, 논산시 광석면 노강서원은 보수 공사 중!",오늘은 논산시 광석면의 노강서원을 찾았습니다. 수고로웠던 하루를 다독이기 위해 떠나는 퇴근길의 여행! 해가 길어져서 어디든 잠깐 다녀올 수... 애써 노강서원을 찾게 될 방문객을 위해 사진을 찍고 글을 남기는 일이 보람이 되었으면 하는 바람입니다. 노강서원 위치 : 충남 논산시 광석면 오강리,2021. 4. 28.
논산시 여행 비밀의 정원 광석면 벚나무숲,^^ #여행 #충남여행 #충남가볼만한곳 #논산여행 #논산시여행 #논산가볼만한곳 #논산시가볼만한곳 #논산가족나들이추천 #논산시가족나들이추천 #논산여행지추천 #논산시여행지추천 #논산볼거리 #논산시볼거리 #논산문화유산 #논산시문화유산 #논산문화유적 #논산시문화유적 #논산역사유적...,2021. 4. 10.
[충남 논산 여행] 논산시 강경읍 강경역사관, ,2021. 9. 11.
"논산여행, 논산시 가볼 만한 곳, 상월면, 주곡리, 백일헌 종택, 충헌사, 상상마당",▲ KT&G 상상마당(위치: 충남 논산시 상월면 한천길 15-20) 예술가들의 창작 활동을 지원하는 KT&G 상상마당은 아이들을 동반한 가족 여행지로 추천하고 싶은 곳입니다. 생텍쥐페리의 동화 <어린왕자>에 나오는 보아 뱀이 집어삼킨 코끼리를 형상화한 건물이 인상적입니다. 상상마당 안으로 들어서니...,2021. 8. 8.
[논산여행 떠나You] 배롱나무꽃 예쁘게 핀 논산시 촬영명소들,여름 여행지로 논산을 선택한 분들과 풍경 사진을 좋아하는 분이라면 논산의 배롱나무꽃 촬영지를 찾아 멋진 추억과 사진을 담아 가시기 바랍니다. 보명사: 충남 논산시 등화5길 95 견훤왕릉: 충남 논산시 연무읍 금곡리 산 18-3 명재고택: 충남 논산시 노성면 노성산길 50 돈암서원: 충남 논산시...,2020. 7. 29.
[논산여행 떠나You] 소소한 풍경과 함께하는 논산시 은진면,논산시 소셜미디어 서포터즈 장수현입니다. 오늘은 여러분께 논산시 은진면의 #천주교공소 #석림사 #은진현관아터 소개를 하려고 합니다. 여행... 은진면 추천 코스: 은진향교 - 석림사(입구 주차) - 은진현관아터 - 천주교은진공소 은진현관아터(은진초등학교): 충남 논산시 은진면 매죽헌로 25번길 1,2020. 7. 15.
"볼거리 많은 산책코스, 논산시 은진면 여행","바로 은진면이 대전과 전주, 부여와 금산으로 가는 교통의 중심이기 때문인데요. 그만큼 은진면은 편리한 교통과 볼거리가 많은 곳입니다. 작지만 내실 있는 은진면을 잊지 마시고 언제든 산책 삼아 가벼운 마음으로 걸어보시기 바랍니다. 은진초등학교 : 충남 논산시 은진면 매죽헌로25번길 1",2021. 1. 27.
논산시 여행 환상적인 탑정호 출렁다리 야경,^^ #여행 #충남여행 #충남가볼만한곳 #논산여행 #논산시여행 #논산가볼만한곳 #논산시가볼만한곳 #논산여행지추천 #논산시여행지추천 #논산추천여행지 #논산시추천여행지 #논산가족나들이하기좋은곳 #논산시가족나들이하기좋은곳 #논산볼거리 #논산시볼거리 #논산입대장병이많이찾는곳...,2021. 2. 21.
"가을여행, 논산여행, 가야곡면 볼거리, 논산시 가야곡면 가볼만 한 곳, 성삼문묘, 반야사...",▲ 천주교 대전교구 연무본당 갈매울공소 (위치: 충남 논산시 가야곡면 가야목곡1길 15-4) 가야곡면의 서원을 둘러봤으니 이제 색다른 장소로 이동합니다. 바로 갈매울공소인데요. 마치 타임머신을 타고 과거로 시간 여행을 간 느낌이 드는 장소입니다. 천주교의 박해의 시기에 지역의 신자들이 모여...,2021. 9. 16.
"[논산여행 떠나You] 휴식과도 같은 곳, 논산시 은진면 석림사","은진현 관아터, 은진면 비석군, 천주교은진공소를 비롯해 주변에 가볼 만한 곳이 여럿 있으니 분명한 목적의 여행 계힉을 세우고 나선다면 논산시 은진면을 제대로 알게되는 정말 멋진 나들이가 될 것입니다. 석림사 041-741-0414 충남 논산시 은진면 교촌리 189-1 탐방 시 근처 주차할 곳 많음",2020. 8. 26.
[논산여행 떠나You] 시인들의 친필을 볼 수 있는 논산시 가야곡면 어린왕자문학관,"아기자기하게 볼 것 이 많은 전시공간이라 매우 흥미 있었는데, 어린왕자 전시는 별도의 포스팅으로 전하겠습니다. *논산시 가야곡면 어린왕자문학관 -주소 : 충남 논산시 가야곡면 원앙로111번길 42 -관람시간 : 오전 10시 ~ 오후 5시 -문의 : ***-****-****, ***-****-**** -무료 관람 / 앞마당에 무료 주차",2020. 9. 29.
"논산여행, 논산산책, 논산시 광석면, 노강서원, 지와바리, 갈산리 곰솔, 항월리","▲ 논산시 광석면사무소 (위치: 충남 논산시 광석면 사계로 441) 논산시 광석면사무소를 기점으로 오강리, 중리, 갈산리, 왕전리, 항월리를 순차적으로 둘러보았습니다. 그동안 논산시의 은진면, 채운면, 성동면을 산책할 때는 무작정 발길이 닿는 곳이나 지나친 곳을 다시 방문하기 위해 발품을 파는...",2021. 7. 14.
"[논산여행 떠나You] 논산시 연무읍 가볼만한 곳, 견훤왕릉과 서재필 박사 본가지",충남 논산시 연무읍 금곡리에 위치한 견훤왕릉으로 가는 길은 두 가지 방법이 있습니다. 견훤왕릉공원에 주차하고 돌계단을 걸어서 가는 방법과 왕릉로 108번길 사거리에서 자동차를 이용해 견훤왕릉 바로 앞까지 가는 방법입니다. 저는 견훤왕릉 공원 - 돌계단 - 견훤왕릉 - 백련사 코스를 추천하고...,2020. 4. 3.
"[논산여행 떠나You] 익성군 신도비와 무석을 찾아서, 논산시 은진면 탐방",익성군 신도비와 무석을 보러 간 것이 계기가 되어 우리나라 묘에 설치하는 석물에 대해 공부도 하게 되었습니다. 여러분도 조상의 묘를 찾을 때 석물의 의미를 아이들에게 알려주면 좋을 듯합니다. 익성군 신도비와 무석 : 충남 논산시 은진면 용산리 산93-3,2020. 10. 30.
충남 논산 여행 현지인 추천 맛집 관촉사 입구 돌체,"논산 관촉사 현지인 추천 보리굴비 정식 맛집 돌체 충남 논산시 관촉로3번길 13 위에서 안급 했듯이 논산에 거주하는 ""여행을 꿈꾸는 사내"" 님이 추천하여 준 식당이 돌체다. 점심시간 전후하여 관촉사 방문할 계획이라 하였더니 의심 없이 추천하여 준 식당이 돌체다. 돌체 식당은 관촉사 입구에...",2021. 9. 13.
국내 당일치기 여행 : 충남 논산 탑정호 수변생태공원,충남 논산시 부적면 부적로 721-10 충남 공원 탑정호 생태공원과 주차장이 동일한 지번 사용중으로 주소 찍고 가시면 주차장 무난히 도착 하십니다 연지 국내 당일치기 여행 삼아 논산 탑정호 수변생태공원 방문시 가장 먼저 반겨주는것은 연지로 8월 20일에 갔더니 연잎 수북히 올라오고...,2021. 9. 2.
"옥녀봉, 논산 가볼만한곳, 논산여행코스, 충남 가볼만한곳, 5월가볼만한곳",위치 : 충남 논산시 부적면 부적로 721-10 옥녀봉 여행 마무리의 정석은 역시 '일몰'이 아닐까요? 논산에서 일몰 풍경이 가장 아름다운 곳은 젓갈로 유명한 강경에 있습니다. 강경읍은 논산과 부여 사이에 있어 다른 곳에 비해 이동하는 데 시간이 제법 걸립니다. 아름다운 노을을 놓치고 싶지...,2021. 5. 26.
[충남 논산] (탑정호 출렁다리) 국내 최장... 경치좋은 논산 탑정호 출렁다리(논산 여행),"요금&주소&전화 요금 : 무료(추후 유료예정) 운영 : 매일 09:00 - 18:00(수요일 휴무) 주소 : 충남 논산시 부적면 안천리 925 전화 : 041-746-6645~6649 PHOTO VIEW 다리입구 전경 화장실 안전시설 다리 중간지점 스카이가든 다리 끝 주차장 LOCATION #논산탑정호출렁다리, #논산여행, #논산가볼만한곳...",2021. 8. 29.
"안심여행 캠페인 방역 우수 관광지 중 강원, 경기, 충북, 충남 소재 여행지",대한민국 안심여행 캠페인 방역 우수 관광지 178선은 전국 17개 광역지자체에서 추천한 방역 우수관광지이다. 이번에 소개할 여행지 목록은... 돈암서원(충남 논산시) - 합덕제(충남 당진시) - 대천해수욕장(충남 보령시) - 백제문화단지(충남 부여군) - 해미읍성(충남 서산시) 출처: 한국관광공사...,2021. 6. 22.
"충남 당일치기 논산 여행 봄나들이 코스 관촉사, 시민공원, 탑정호출렁다리~","논산 봄나들이 논산 시민공원 주차장, 남/여 화장실 구분 주소: 충남 논산시 관촉동 339-1 논산 여행으로 찾아보기에 좋은 논산 시민공원인데요 공원 내 벽천폭포 뒤 쪽으로 새롭게 조성된 꽃 밭은 풍차와 더불어 최근에 많은 인기를 끌고 있답니다. 작은 물고기들이 노니는 연못에는 분수도 놓여...",2021. 4. 15.
"논산 산책코스 추천! 새로운 변화가 기대되는 곳, 논산시 광석면","▲ 논산시 광석면사무소 (위치: 충남 논산시 광석면 사계로 441) 논산시 광석면사무소를 기점으로 오강리, 중리, 갈산리, 왕전리, 항월리를 순차적으로 둘러보았습니다. 그동안 논산시의 은진면, 채운면, 성동면을 산책할 때는 무작정 발길이 닿는 곳이나 지나친 곳을 다시 방문하기 위해 발품을 파는...",2021. 7. 21.
추석 연휴 여기어때? 충남 논산 가볼만한곳 동양 최대 출렁다리 탑정호 출렁다리,탑정호 찾아가기 충남 논산시 가야곡면 탑정로 900 서울에서 논산 탑정호까지는 차로 3시간 남짓 걸리는 거리로 지루하지도 않고 가깝지도 않은 여행하기 딱 좋을 만한 곳입니다. 하지만 워낙 넓은 탑정호이고 며칠전에 문을 연 출렁다리라서 찾는 이들이 많아 주차장을 잘 골라야 합니다. 주차장은...,2021. 9. 20.
충남 가볼만한곳 논산 선샤인랜드(선샤인스튜디오) 미스터 션샤인 촬영지,"선샤인스튜디오 충남 논산시 연무읍 봉황로 90 충남 논산 가볼만한곳 미스터 션샤인 촬영지 선샤인스튜디오 매표소입니다. 예전에 찾아갔던 곳이... 여행도 계절, 날씨 등의 조건도 갖춰져야 좋은 여행이 되기에.. 전시관 같은 카페니 둘러보셔도 좋습니다. 2층으로 올라가니 제법 그럴싸한...",2021. 9. 17.
"충남 논산 여행! 고즈넉한 아름다움을 느낄 수 있는 곳, 충곡서원","오늘의 비대면 여행지인 '충곡서원'으로 함께 떠나 보겠습니다. 충고서원은 충남 논산시 부적면 충곡리에 위치해 있습니다. 차를 주차할 수 있는 공간이 주위에 위치해 있으며, 위의 사진은 주차장에 세워져 있는 비석입니다. 현재는 코로나로 인해 내부 개방이 불가능한 상태여서, 바깥쪽으로...",2021. 8. 23.
충남 논산 강경 여행 BEST 12,"엊그제 기차여행으로 다녀온 충남 논산 강경은 감성 가득 시간여행이었습니다. 이젠 찬 이슬이 맺혀있고, 찬 이슬이 맺힌 단풍이 더 곱게 물드는... 구 한일은행 강경지점 충남 논산시 강경읍 계백로167번길 50 100년 전에 강경에 이런 은행이 있다는 것만으로도 당시 강경의 번성함을 짐작할 수...",2020. 11. 3.
"충남여행 논산 가볼 만한 곳, 반야사 ♪","실제로 가보니 감탄사 연발하게 만드는 자연풍경 크 진짜 말해뭐하냐고오 ㅋㅋㅋ 반야사 충남 논산시 가야곡면 삼전길 104 스님들의 기도 시간... 내가 좋아하는 가을, 너희들과 함께라서 엄만 너무 행복했어❤️ #충남여행 #반야사 #아름다운대한민국 #인스타핫플 #조용한곳 #논산가볼만한곳...",2021. 10. 9.
31. 논산시,"7. 충남 논산시 반나절 여행 혼자 훌쩍 떠난 가을 나들이. 차로 40분쯤 거리에 있는 관촉사를 찾았다. 그 유명한 은진미륵도 보고 싶고, 가을날 조용한 산사를 찾아가고 싶었다. 계단을 오르니 가장 먼저 보이는 대웅전. 특이한 모습이라 눈에 띈다. 주변의 오래된 사찰의 느낌과는 달리 화려한 외관과...",2020. 11. 8.
매력적인 충남 여행 가볼만한 곳 어디까지 가봤니,"논산시, 보령시, 부여군, 서천군, 예산군, 청양군, 태안군, 홍성군 가봐야 할 여행지가 많아서 해외여행 다니느라 못 다닌 국내여행지 가볼 만한 곳 안전운전하며 두루두루 다녀야겠어요~~ 미처 가보지 못한 충남 논산시, 예산군 가볼 만한 곳 충남 맛집 찾아서 알찬 여행해보고 싶어요 매력적인 충남...",2020. 7. 8.
충남 논산과 서천 그리고 전북 익산을 아우르는 주말 당일여행코스. 맛집과 체험이...,오래된 기억이긴한데 여행코스로 이제야 정리를 한다. . 필자가 진행했던 여행코스 중에 당연 마음에 드는 코스로 상용화도 가능하리라... 전화번호 : 041-746-8480 주소 : 충남 논산시 연무읍 봉황로 102 영업시간 : 매일 09:00 - 17:00 점심시간 12:00~13:00 http://www.nonsan.go.kr/sunshine/ *수요일 휴무(2018. 12....,2021. 2. 12.
[충남논산여행!] 논산 가볼만한곳 반야사 여긴 꼭 가야하는 논산 필수 코스! 주차(0)...,워낙에 논산시가 위쪽에 있는 곳이다 보니 전날 전주에 미리와서 숙소를 잡았어요. (그 숙소는 ㅜㅜ 에어컨 소리가 너무 시끄럽고 생각보다는 별로 였던곳... 다음날 잤던 숙소가 더 좋았어요) 논산에 있는 숙소는 괜히 비쌀 것 같고 별로 일 것 같아서... 전주로 잡았었네요. 아침에 7시에 일어나 준비!...,2021. 10. 7.
논산시 가볼 만한 곳_탑정호수변생태공원,날씨가 더워질수록 꽃들도 시들어갈 테니 서둘러 탑정호를 찾는 것도 논산 여행의 팁이라 할 수 있습니다. 탑정호수변생태공원은 가까운 거리에... 활동보다는 탑정호수변생태공원을 찾아 즐겁고 건강한 시간을 보내시기 바랍니다. 탑정호수변생태공원 찾아가는 길: 충남 논산시 부적면 충곡리 287-8,2020. 5. 31.
"논산 역사 탐방! 조선으로 떠나는 가을 힐링 여행, 논산 모선재!","코로나19때문에 안정적인 여행이 힘들어지고 있기 때문에 유명 관광지보다는 서민들의 흔적이 남아있고, 지역 역사가 오랫동안 기록되어 있는... 충남 논산시 연산면 고정리에 위치하고 있는 이곳은 조선 왕조를 포함한 600년 이상의 역사와 전통을 지닌 마을로, 기호학파를 대표하는 사람 중에서...",2021. 10. 8.
"충남 논산 여행 코스! 가볍게 산책하기 좋은 곳, 논산 8경 관촉사!","논산시 소셜미디어 서포터즈 송종연입니다. 어느덧 무더운 여름이 지나고 가을이 성큼 눈앞으로 다가왔습니다. 오늘은 나 홀로 떠나는 여행길로 논산 8경 중 한 곳인 관촉사를 소개해드리겠습니다. 이른 아침부터 도착한 관촉사입니다. 사진에 보이는 곳은 관촉사 천왕문으로, 문을 지나며 경건한...",2021. 9. 8.
"추억의 골목스케치, 충남 골목 여행지 베스트 8",주소 : 충남 논산시 은진면 와야길 49 근대로의 시간여행 논산 강경근대문화거리 < 골목길 포인트 > - 역사가 담긴 강경근대역사관 - 맛깔난 강경젓갈시장 ▶ 주소 : 충남 논산시 강경읍 계백로 167번길 50 살아있는 민속 박물관 아산 외암민속마을 < 골목길 포인트 > - 아름다운 돌담길 - 주민들이...,2021. 2. 13.
