header,contents,date
일석이조인 안면도 맛집 모음,"얼마 전 친구들과 떠난 태안여행 중 TV에서 방영된 안면도 맛집을 발견했어요. 현지에서도 소문난 곳답게 게장이 신선함 그 자체였고 반찬의 퀄리티까지 뛰어나 소개해봅니다. 1. 꽃게집 시골밥상 메뉴 : 간장게장 30,000원 주소 : 충남 태안군 안면읍 안면대로 3022 번호 : 041-673-8423 시간 : 매일 08...",2021. 10. 3.
시원한 바다여행! 태안 해수욕장에서 즐길수있는 액티비티!,시원한 바다여행! 태안 해수욕장에서 즐길수있는 액티비티 #태안 #액티비티 최근 폭염이 보름 이상 이어지면서 가장 높은 기온으로 역대급 폭염을... 시원한 파도의 만남 만리포서핑 충남 태안군 소원면 모항리 삼면이 바다로 둘러싸인 태안에서 즐길 수 있는 액티비티가 많이 있습니다. 그중 서해...,2021. 8. 3.
충남맛집 안면도 풍년회센타 꽃지해수욕장 자연산 횟감 횟집 부모님과 함께,충남 맛집 : 안면도 횟집 풍년회센타 주소 충남 태안군 안면읍 방포항길 24 지번 > 승언리 1331-34 전화&예약문의 041-674-4254 영업시간 평일 : 09:00~22:00... 해안근처에 기본상차림 구성도 아주 푸짐하기로 유명한 안면도 맛집이라 손님도 많고 여행객도 많았는데 ㅠㅠ 아무래도 시기가 시기인 만큼 일요일...,2020. 4. 28.
태안여행 둘째날 | 바다보다카페,태안여행기 다음편 이어보겠습니다 시설과 청결 상태 모두 만족스러웠던 개판펜션에서 푹 자고 일어나 모닝 수영을 즐겼습니다 하늘이 너무 예쁘고 바다도 한번 더 보고 싶어 바다가 보이는 카페에 방문하기로 했어요 열심히 검색해서 찾은 핫플 바다보다카페 바다보다카페 충남 태안군...,2021. 7. 31.
"태안튤립여행지 모음zip, 태안 가볼만한곳, 태안여행 :: 천리포수목원, 팜카밀레...","매년 달리아, 백합, 수국, 튤립 등 다양한 꽃을 주제로 꽃박람회를 진행하고 있어 빠질 수 없는 태안여행코스입니다. 위치 : 충남 태안군 남면 마검포길 200 운영시간 : 매일 09:00 ~ 22:00 (태안빛축제 19:00 ~ 22:00) 입장료 : 성인 9,000원 / 청소년 7,000원 안면도 자연휴양림 안면도자연휴양림에는...",2021. 4. 23.
"[안면도 여행] 리솜 아일랜드, 딴똑통나무식당, 대성식관, 트레블브레이크, 꽃지해수욕장","[안면도 여행] 기대가 1도 없었던 이번 여름 휴가 안면도 여행.... 동해나 부산이나 제주도는 사람이 많을 것 같아.. 코로나가 무서워 사람이 적은... 2인 세트 - 75,000원(게국지+ 간장게장+양념게장+새우장) #딴뚝통나무식당 주소 충남 태안군 안면읍 조운막터길 23-22 전화번호 : 041-673-1645 영업시간...",2021. 8. 28.
<태안 가볼만한곳><안면도 놀거리> 안면도 여행에 빠지면 섭섭한 백사장항 카트장...,"안면도 여행 핫플레이스인 안면카트체험장에서의 추억, (스피드, 스릴, 짜릿함에 힐링까지..) 잇님들도 꼭 만들어 보세요~~ : 안면카트체험장 도로명 주소 : 충남 태안군 안면읍 백사장1길 59 지번 주소 : 충남 태안군 안면읍 창기리 1262-269 전화 : 041-675-1003 영업시간 : 오전 9시 ~ 오후 7시 주차...",2021. 8. 31.
"훠궈와 양꼬치, 중국 본토요리가 맛있는 충남 태안 맛집",아는 분이 중국 여행 갔다가 마트를 들렸는데 거기에 한 코너에 목이버섯 코너가 따로 있을 정도로 목이버섯의 인기가 중국에선 엄청 나다고... 마음이 들더라구요 :)) #충남태안맛집 #태안양꼬치 #태안훠궈 #태안샤브샤브 #태안군맛집 태양부양꼬치 태안점 충남 태안군 태안읍 동백로 265 041-672-9933,2020. 3. 18.
부모님과 함께 가기 좋은 충남의 가족여행 명소,"가정의 달을 맞아, 부모님과 함께 가기 좋은 충남 여행지 - 봄 향기 물씬 풍기는 여행지부터 이색 체험까지! - 1년 중에서 가장 행복한 달을 꼽자면... 가족여행, 커플여행으로도 손색이 없는 모두의 축제로 평가받고 있습니다. 축제가 열리는 곳은 태안군 안면읍에 위치한 코리아플라워파크이며, 4월...",2020. 5. 7.
"2월 6(토) 충남 태안 솔향기길 외 임도,시골길,해안길 67km [XC] 라이딩 공지","충남 태안 자전거여행입니다. 1. 일시,장소 : 2월 6일 토요일 충남 태안군 원북면 사무소 아침 7시 40분, 예상기온 영상4도~영상9도 2.인원: 코로나로인하여 법정인원(1~3명) 3. 난이도 : 임도,마을길,시골길 위주고, 태안솔향기길(약 10여km)구간에 벨바,끌바가 있을 수 있습니다. 4. 코스 : 원북면...",2021. 1. 31.
"[충남 태안군 남면] 카밀레 팜과 붙어있는 빵카페 ""몽산포제빵소""",2층에서 내려다보는 정원뷰도 예쁘더라구요 전체적으로 이국적인 느낌이라 여행온 기분내기 좋았어요 커피가 나왔다는 진동벨을 들고 다시 1층으로 살구쨈 향이 은은히 나는 페이스츄리 나비파이 맛있더라구요 커피는 구냥 쏘쏘 포스팅하다보니 다른빵을 못먹어본게 참 아쉬워요 방문하시는분들은...,2020. 10. 8.
강아지랑 백사장항 맛집,"주소 : 충남 태안군 안면읍 백사장1길 49 전화 : 041-672-0405 영업 : 평일 07:00 ~ 21:00 / 주말 07:00 ~ 21:00 도로명부터 백사장1길!! 백사장항 근처에 위치해... 백사장항 맛집에 단연 1순위가 아닐까,, 항상 여행을 가면 그곳을 대표하는 메뉴를 꼭 먹어보려 하는데 저렴하게 세트 메뉴로 접하니 좋았어요. 가격...",2021. 10. 8.
[충남 태안 여행 2탄] 태안 분위기맛집 안면도 카페 '멜로우 데이즈',"오늘은 태안 여행 때 다녀온 카페를 소개할게요! 분위기맛집, 사진맛집, 인테리어, 감성카페 태안 안면도 카페 멜로우 데이즈(Mellow Days) 태안 카페 멜로우 데이즈(Mellow Days) 주소 : 충남 태안군 고남면 고남리 617 멜로우데이즈 시간 : 매일 오전 10시 ~ 오후 8시 (수요일 정기휴무) 토요일 오전 12시...",2021. 7. 27.
태안 가족여행 코스 추천! 안면도 쥬라기 박물관! 충남 아이와 가볼 만한 곳!,"여유로운 이번 태안 여행에서 일상의 신체적 리듬을 잃지 않게 도와준 안면도 쥬라기 박물관을 지금부터 만나보시죠! *네이버 제공 업체 정보 - 전화 041-674-5660 - 주소 충남 태안군 남면 곰섬로 37-20 - 영업시간 매일 09:30 - 17:30 월요일 휴무 (설날, 추석 당일 휴관) - 요금 10,000원 성인 8,000원 청소년 6...",2021. 8. 11.
안면도 가볼만한곳 꽃지해수욕장 커플 여행코스,아일랜드 리솜 충남 태안군 안면읍 꽃지해안로 204 이번 여행의 목적지였던 아일랜드 리솜! 안면도가볼만한곳으로 유명한 꽃지해수욕장 이번에 리뉴얼하여 시설도 깔끔하고 무엇보다 바다 바로 앞에 위치하여 객실에서도 석양을 볼 수 있어요 아일랜드 리솜의 하이라이트는 바로 선셋을 감상하면서...,2021. 4. 6.
충남 안면도 여행 시인의섬 펜션을 선택한 특별한 이유,"시인의섬 충남 태안군 안면읍 대야로 261-10 입실 15시, 퇴실 11시 041-673-7273 앞 마당에 펼쳐진 잔디정원은 사장님이 손수 가꾸시고 다듬으신 흔적이... 국물과 함께 정원에서 한참을 바베큐타임을 즐기며 여행의 마지막을 멋지게 보낼수 있었습니다. #안면도여행 #충남여행 #안면도펜션 #시인의섬펜션",2021. 6. 6.
[충남 태안] 가의도 배시간표,충남 태안군을 여행하면서 안흥↔가의도 간 배시간표를 아래와 같이 입수하여 게시하니 여행하시는 분들은 참고하시기 바랍니다 안흥유람선(복합터미널) 네비주소 : 충청남도 태안군 근흥면 신진부두길 10 임시 매표소 복합터미널 20m전방 부두에 위치하고 있다 가의도 까지 약 25분 정도 걸린다...,2021. 4. 11.
태안 가볼만한곳 국내 봄 여행지 충남 청산수목원 만리포해수욕장,"5.태안 천리포해수욕장 충남 태안군 소원면 천리포 1길 187 (041-672-9982) 입장료 9,000원 태안여행으로 추천하고픈 천리포수목원 국내 봄 여행지 추천 장소로 지금부터 가을까지 피고 지는 다양한 꽃들이 반겨주는 곳이랍니다. 지금은 다른 꽃들이 존재할 텐데요. 당시 2월 말 풍경은 매화, 복수초...",2021. 3. 16.
태안 키즈펜션 국내 가족여행 으로 떠나기 좋은 오투오션 추천,오투오션펜션 충남 태안군 이원면 원이로 2502-47 입실 14:00 퇴실 11:00 전화번호: 041-674-1222 국내 가족여행 태안 키즈펜션 으로 다녀온 오투오션펜션은 충남 태안군 이원면에 위치하고 있어요 많고 많은 키즈펜션 중 왜 오투오션을 선택했느냐 ! 바로 펜션 앞에 바다가 있기 때문에!! 그리고 갯벌체험도...,2021. 9. 6.
태안여행 안면도 밧개해수욕장 일몰,주소:충남 태안군 안면읍 승언리 주차장:밧개해수욕장 내 주차장 입장료 없이 누구나 이용가능 파란하늘 을 맘껏 볼수 있는 요즘 하늘 구경하기... 좋은날 ' 충남여행을 다녀왔던 날은 무지개도 보고 멋진 일몰도 보는 뜻밖에 선물을 받은 날이었어요 핑쿠핑쿠 하늘 시시각각 하늘색이 변하는...,2021. 7. 26.
(3)2021년 새해여행 충청남도 태안군 안면도 꽃지해수욕장,ㅋㅋㅋ 장소는 충남 태안군 안면도 꽃지해수욕장입니다!!! 지금으로부터 14년전... 태안 기름 유출 사고 기억하신가요? 삼성-허베이스피릿호 원유 유출 사건으로인해 한반도 전체 서해안지역 큰 피해를 봤죠... 유출사고 터진 지역이 바로 충남 태안군 만리포 북서쪽 10km 지점에서 사고가 발생한...,2021. 1. 3.
태안 가볼만한곳 국내 당일치기 태안 여행 코스,"태안 가볼만한곳 국내 당일치기 태안 여행 코스 여행일 : 2021년 7월 1일 / 글, 사진 : 순수시대 주세환 얼마 전 지인들과 국내 당일치기 여행으로... 천리포수목원 주소 : 충남 태안군 소원면 천리포1길 187 운영시간 :매일 09:00 - 18:00 하절기(4월-10월), 입장마감 17:00, 연장 운영 4.10일-8.15일(09:00-19:00...",2021. 7. 23.
"[충남/안면도] 골드독 펜션, 강아지 펜션, 애견 펜션, 안면도 여행",충남 태안군 안면읍 붓드기길 4 강아지를 두 마리를 키우고 있는 와중에 여름휴가를 강아지들과 같이 즐기고 싶어서 찾은 골드독펜션 !! 애견 동반 펜션 말고 강아지만을 위한 펜션을 찾아왔다. 약 두 시간가량을 달려 도착한 충남.. 안면도 처음 와봐.. 안녕.. 실외에 수영장 두 개와 인공잔디가 넓게...,2021. 7. 24.
충남 태안 수영장 펜션 물놀이 와 함께 음포해수욕장 까지 완벽했던 여행,그늘막도 설치되어져 있고 쉼터도 따로 있어 테이블공간도 여러개가 있어 앉아서 쉬면서 간식거리들도 먹어가며 아이들 노는것도 구경할 수 있어 정말 힐링같은 태안여행을 즐길수 있었답니다 :) 태안 더담은펜션 충청남도 태안군 이원면 음포길 135 결국 우리가 굳 초이스한 충남 태안 수영장 펜션...,2021. 7. 21.
태안 여행 신두리 해안사구 국내 최대의 모래사막,태안 여행 신두리 해안사구 국내 최대의 모래언덕 충남 태안군 원북면 신두해변길 201-122 파란 하늘 아래 하얀 모래언덕이 드넓게 펼쳐진 이곳은 태안 신두리 해안사구 입니다. 국내 최대 규모의 모래언덕으로 국내에서는 흔히 볼 수 없는 풍경을 보여주는 곳이라 관심받는 곳인데요. 파란 하늘이...,2021. 8. 25.
개강 전 호다닥 1박2일 안면도 여행_1탄 /충남여행/태안여행/천안근교바다...,"지금부터 2021/08/20-2021/08/21 친구들과 안면도 1박2일 여행을 다녀온 이야기를 해볼게요 길면 2탄으로 넘어 갈 수도,,, ㅋㅋㅋㅋㅋ 넘넘 재밌었기 때문!... 1차로 놀라고 2차로는 생각 보다 많이 마트가 작아서 놀랐더 어찌 저찌 나와서 #태안로컬푸드직매장 충남 태안군 남면 안면대로 1641 여기에 가서...",2021. 8. 24.
경이로운 태안 맛집 리스트,"며칠 전, 친구들과 안면도로 여행 갔다가 현지인이 소개해준 태안 맛집에 다녀왔어요. 싱싱한 해산물은 물론이고, 직접 만든 수제 반찬까지 완벽했던 곳이라 소개해드리려고 해요. 1. 조개산꽃게집 게국지세트 4인 (대) 120,000원 주소: 충남 태안군 안면읍 안면대로 3061 번호: 041-675-0860 영업시간...",2021. 10. 5.
국내여행정보 충남 연꽃 향연에 스팟,#국내여행정보 #충남 연꽃 스팟 이응노의집 -충남 홍성군 홍북읍 이응노로 61-7 -한 여름에 눈 내린듯 백련이 퐁퐁! 미술관 관람하구 보구 가 청산수목원 -충남 태안군 남면 연꽃길 70 -넓고 예쁜 수목원! 카페에서 파는 연잎아이스크림도 필쑤 정안천생태공원 -충남...,2021. 6. 23.
친구들과 파도리 여행 - 충남태안여행,만리포해수욕장(태안군 소원면 모항리 1325-2 / 신주소 : 소원면 만리포2길 1) 종점: 파도리해수욕장(태안군 소원면 파도리 595-1 / 신주소 : 모항파도로 490-85) ․ 관할 : 소근분소 041-673-1065 솔모랫길 주요지점 안내 만리포 해변서해안 지역에서 손꼽히는 해수욕장 중 하나인 만리포는 아름답고 질이...,2020. 10. 20.
태안 안면도 여행 : 가볼만한곳 (1박2일),"태안 안면도 여행에 필수 코스 아닐까, (아님말고) 우리 갔을 때 핑크 뮬리가 아직 초록빛이었는데 좀 더 지나면 핑크색으로 이쁘게 물든대요! 가을 산책하기 딱! ⭐⭐⭐⭐ 신두리해변 041-670-2114 충남 태안군 원북면 신두리 바다 피크닉을 생각하며 왔지만 생각과는 너무 다르네? 차에 간단한...",2021. 8. 30.
태안가볼만한곳 태안여행 캠핑장추천... 청포비치캠핑장 / 충남드라이브코스,"#태안가볼만한곳 #태안캠핑장추천 #태안여행코스 #서해갯벌체험 #태안갯벌체험 #태안드라이브코스 #충남드라이브코스 청포대해수욕장 충남 태안군 남면 원청리 충청남도 태안군 남면 양잠리·원청리에 있는 해수욕장입니다 백사장 면적은 50ha, 길이는 1.5km, 폭은 250m, 경사는 4도, 안정수면거리는...",2021. 7. 24.
태안 가볼만한곳 볼거리 먹거리 포함 여행 코스,태안 가볼만한곳 볼거리 먹거리 포함 정리 얼마 전 태안 꽃지해수욕장을 시작으로 태안 여행 코스를 한 바퀴 돌았습니다. 보통 여름 시즌 같으면... 태안 만대회수산 충남 태안군 소원면 서홰로 8 천리포 수목원을 둘러본 뒤 태안 먹거리를 즐기러 찾아간 곳은 만리포해수욕장 바로 앞 대로변에...,2021. 7. 22.
충남 태안군 신두리 사구 모래언덕,우리나라에서 사구로 유명한 충남 태안에 있는 신두리 사구를 찾았습니다. 사막은 호주 여행을 갔을 때 한 번 보고 접할 기회가 없었기에 사막은 아니지만 사막과 같은 모습을 볼 수 있는 사구의 모래언덕을 제일 먼저 찾아갔습니다. 생각보다는 범위가 좁았고 경계선에서 망원렌즈를 사용하지...,2020. 1. 10.
태안 안면도 꽃지해수욕장 & 서산 간월도 간월암 서해안여행,태안 꽃지해수욕장 충남 태안군 안면읍 승언리 안면도 꽃지해수욕장은 태안 여행길에서는 필수 코스인 듯이 찾게 되는데요. 개인적으로도 이곳에서 본 일몰은 지금도 생각이 날 정도로 인상적이었어요. 일몰시간대가 아니라서 마알간 모습으로 할미 할아비바위를 봤는데요. 바닷물이 빠진...,2021. 5. 22.
충남태안코로나19확진환자 발생(feat 펜싱국가대표선수),19일 충남 #태안군재난안전대책본부에 따르면 펜싱 국가대표인 A씨(36)가 전날 오후 지역 선별진료소 검사에서 #코로나19 확진 판정을 받았습니다. A선수 스스로 자가격리 권고를 준수했어야 했는데 권고를 어기고 여행을 한 점은 아쉽게 느껴진다. 펜싱국가대표 중 울산 C(25)씨와 남양주 D...,2020. 3. 19.
안흥항 나래교와 마도방파제 - 시원과 같이하는 국토순례 충남태안 안흥여행,"코로나19도 어찌할 수 없는 우리들의 여행에 대한 이야기, 할 말 많은 태안군 신진도를 소개하려고 합니다. 태안터미널에서 시내버스로 30분... 가을 햇빛이 기분을 즐겁게 하여 생활의 에너지를 충전시켜 주는 곳, 태안 ‘안흥항’입니다. 충남 화이팅!! 태안 화이팅! 충청남도 도민 리포터의 글",2020. 10. 23.
"국내 당일치기 여행, 수려한 연꽃세상 태안 청산수목원",당일치기 여행으로 지친 삶에 건강한 휴식을 가져보는 건 어떨까요? 푸른 잎들이 무성한 여름의 정취를 물씬 느끼며 수려하게 피어나는 연꽃을 만날 수 있는 태안 청산수목원을 소개합니다. 수려한 연꽃세상 청산수목원 충남 태안군 남면 연꽃길 70 태안군 남면에 위치한 청산수목원은...,2021. 7. 28.
태안 신두리 5초펜션_아이와 바다 갯벌 체험 여행간 오션뷰 가족펜션,"서해가 아이와 여행하기 좋은 점이 바다가 깊지 않고, 조개 같은 해산물을 잡을 수 있다는 점인데 이런 체험을 처음 해보는 딸아이는 정말 시간... 부모님도 이곳에 오면 너무 좋아하실 것 같다. 가족들과 오기에 딱 좋을만한 펜션이다. * 신두리 5초 펜션 충남 태안군 원북면 신두해변길 97",2021. 7. 19.
태안 수영장펜션 가족 여행 끝판왕,수영장이 끝내주는 태안 한옥펜션 별궁 별궁펜션 충남 태안군 이원면 원이로 2492 태안 수영장펜션 가족 여행으로 끝내주는 바다전망 힐링 장소예요. 올여름 시원한 휴가를 책임져줄 장소지요. 예약 문의 전화 041-675-7273 하늘에 구름이 몽실몽실 떠 있는 풍경이 너무 예쁜 곳. 오션뷰 전망에...,2021. 6. 20.
"[충남 태안] 7월, 수국꽃 시절 '팜 카밀레'#1","#2020 #태안 #7월 #팜카밀레 제주로, 공주로 수국 여행을 다녀왔지만 수국 수국은 언제나 좋은 거. 작년 여름 내년엔 꼭 가봐야지 다짐했던 태안 팜... 5 ㄴ캐논 by 그분 041-675-3636 충남 태안군 남면 우운길 56-19 매일 09:00 - 18:00 동절기 매일 09:00 - 18:30 하절기 초록 초록한 풍경 속에 파란빛 수국은...",2020. 10. 15.
충남 태안 : 안면암,나는 부모님에게서 여행 유전자를 물려받아서 여행을 정말 좋아한다. 새로운 곳 찾아다니는 것을 좋아하는데~ 드디어! 드디어 지난달에는... 올 때는 신발 신겨서 걷게 함 - 주소 : 충남 태안군 안면읍 정당리 178-7 안면암 1시 야외 점심식사(~2시) 2시~3시 애견동반 해수욕장 나들이 3시~4시 펜션복귀 및...,2020. 9. 1.
서울 근교 당일치기 여행 : 파도리 해수욕장 / 해식동굴 인생샷,"서울 근교로 시간이 얼마 걸리지 않아, 당일치기 급 여행으로도 오기 좋은 태안의 '파도리 해수욕장' 입니다 :) 파도리 해수욕장 전화번호... 주소 : 충남 태안군 소원면 파도길 63-12 전화번호 : 0507-1335-5154 영업시간 : 평일 11:00 ~ 19:00 (일몰까지) 주말 10:00 19:00 출처 : https://www....",2021. 8. 19.
[국내여행/태안여행] 안면도 가볼만한 곳 청산수목원 (feat. 팜파스 축제),청산수목원 청산수목원 충남 태안군 남면 연꽃길 70 입장 시간 : 08:00 - 19:00 하절기 (6~10월) 09:00 - 18:00 봄 (4~5월) 09:00 - 17:00 동절기 (11~3월) ( 일몰 1시간 전 마감 ) 인스타에서 큰 팜파스가 풍성하게 펼쳐져 있던 청산수목원 사진을 보고 다음에 안면도에 가게되면 꼭 가봐야지 하고 저장해두었던...,2021. 9. 17.
태안 안면도 가볼만한곳 1박2일 여행,09:00~18:00 충남 태안군 안면읍 안면대로 3195-6 안면도 가볼만한곳 첫번째! 자연휴양림입니다. 겨울에 가려다가 못 갔던 곳이라서 이번에는 꼬옥 가고 싶었는데요. 여기가 생각보다 산책하기 너무 좋은 곳이라서 아이들과 함께 태안 여행 오시는 분들에게도 추천하고 싶어요. 지금 제가 사진으로...,2021. 5. 25.
[충남 태안] 기암괴석 전시장 백화산(白華山)!!,이 산을 알게된 계기는 산행블로그에서 지금은 여행블로 열차를 바꿔타신 강산(現 혼소풍) 님의 오래 전 포스팅을 보고 미리 부터 찜해뒀던 사실상 숨겨놓은 산이기도 하다. 2020년 제33차 산행 백화산(충남 태안군) 백화산(흰白 빛날華 뫼山) 충청남도 태안군 태안읍에 있는 산높이는 284m이다....,2020. 4. 20.
"【충남여행,태안여행】 바로 앞이 바다라서 더 좋은 테라스+독채 펜션...",#천리포은하수펜션#여름휴가#국내여행#바다앞펜션#갯벌체험#모래놀이#천리포해수욕장#캠핑장소#여름물놀이#국내가볼만한곳#여름휴가로가볼만한곳#태안해변캠핑#해루질가능한펜션 안녕하세요 블로거 전대리입니다 오늘은 여름휴가를 맞아서 충남 태안 천리포은하수펜션에 다녀왔어요 그네와...,2021. 7. 29.
충남 가볼만한곳 청산수목원 팜파스 그리고 핑크뮬리,"2020 태안 팜파스글라스 &핑크뮬리 얼마전 다녀온 충남 여행 팜파스글라스와 핑크뮬리 등 가을향기 가득 느낄수 있는 청산수목원 을 다녀왔어요 . 태안 청산수목원 팜파스 &핑크뮬리 주소:충남 태안군 남면 연꽃길 70 입장료:성인7,000원 청소년(초,중,고)6,000원 주차:무료 입장시간:매일 08:00 - 19:00 태안...",2020. 10. 14.
최고의 가을 여행지 추천 : 충남 태안 신두리 해안사구 서해랑길,"가을 여행지 추천 으로 소개해 드리겠습니다 태안 신두리 해안사구 방문날짜 : 2020년 8월 25일 관람 소요시간 : 1시간 ~ 2시간 신두리 사구센터... 주소 : 충남 태안군 원북면 신두리 357-28 B,C 주차장이 마주보고 있어 아무데나 주차하시면 되시구요 태안 신두리 사구센터 주차장 바로 옆에 있는...",2020. 9. 7.
"충남가볼만한곳♥태안여행♥태안꽃지해수욕장,안면도꽃지해수욕장♥운여해변...",서해여행지로 딱 좋습니다 이렇게 우리는 서해 꽃지해수욕장의 일몰을 포기하고 운여해변을 향해 달렸습니다 운여해변 .운여해수욕장 - 주소 :: 충남 태안군 고남면 장삼포로 535-57 - 주차장 있음 네비를 치고 갔는데 . 헉 논길 사이로 안내를 해줘갖고 .. 적지 않게 당황한 우리 가족 차가 바닥이...,2021. 9. 1.
▶충남 가볼만한곳 태안 파도리 동굴 위치 바다물때 시간 LG U+ 유플러스 광고 촬영지,충남여행지 태안 가볼만한곳 파도리 동굴 가는길 위치 바다물때 LG U+ 엘지유플러스 광고 촬영지 동굴 태안여행 후기 충남여행지 에서 무척이나... 아...그거 참 속상해요~~ ㅎㅎㅎㅎㅎㅎㅎㅎㅎ 태안군 에서 이렇게 친절하시게도 간판을 설치 해 놓으셨는데.. 이곳은 밀물시에 물이 차는 곳입니더....,2020. 10. 5.
충남 태안 가볼만한곳 핵심 코스 BEST 5,지난주는 바다 구경과 함께 스케일이 큰 수목원을 구경할 수 있는 충남 태안 여행을 다녀왔는데요. 산책하기도 좋고 푸짐한 음식도 먹으면서 진정한 가을을 만끽할 수 있었답니다. 1. 청산수목원 주소 : 충남 태안군 남면 연꽃길 70 번호 : 0507-1324-0656 관람시간 : 08:00 ~ 19:00 (입장마감 1시간 전)...,2021. 9. 10.
"충남 태안, 안면도 펜션 바다가 쓴 시, 데이드림 숙박 후기","충남 태안, 안면도 펜션 바다가 쓴 시, 데이드림 숙박 후기 -주소 : 충남 태안군 고남면 옷점길 147-54 -예약 : 카카오톡 친구 추가 / 네이버 예약 가능 -전 객실 오션뷰이고 개별 테라스 바베큐 가능한 #안면도펜션 -일부 객실 반려견 동반 가능 #태안펜션 내가 여행 블로그를 운영한지 그럭저럭 시간이...",2020. 12. 8.
신나는 태안 여행 - 안면도 당일치기 여행 코스 5,"★ 안면도 쥬라기 박물관 이용안내 매일 09:00 ~ 17:30 ※ 월요일, 추석·설날 당일 휴관 성인 청소년 어린이 경로 군인, 경찰, 소방, 국가유공자 10,000원 8,000원 6,000원 2,000원 5,000원 자연의 힐링 여행지 안면도 수목원 충남 태안군 안면읍 안면대로 3195-6 안면도자연휴양림 숲속의 고요함과 신비로움을...",2021. 6. 23.
원산도 여행 섬의 매력에 빠져 먹거리에 빠져,국물이 지근 지근 거리지 않고 딱 떨어지는 깔끔함이 있어서 좋았어요. 밥 한 그릇과 함께 하기 좋은 맛이더라고요. 안면도 찾아가시는 분들 원산도 여행 길에도 올라 보시고 회도 튀김도 맛난 자연산 오대감튀김 으로 찾아 가보세요~ 자연산 오대감튀김 충남 태안군 안면읍창기리 1269-24 041-673-2117,2021. 4. 15.
